src/acc/libsmm_acc/parameters/parameters_Mi250.json
[
{"m": 3, "n": 3, "k": 3, "tile_m": 1, "tile_n": 1, "threads": 64, "grouping": 20, "minblocks": 8, "algorithm": "medium", "perf": 48.6087, "source": "autotuned"},
{"m": 3, "n": 3, "k": 4, "tile_m": 1, "tile_n": 1, "threads": 64, "grouping": 13, "minblocks": 4, "algorithm": "medium", "perf": 84.8962, "source": "autotuned"},
{"m": 3, "n": 3, "k": 5, "tile_m": 1, "tile_n": 1, "threads": 64, "grouping": 20, "minblocks": 5, "algorithm": "medium", "perf": 73.5997, "source": "autotuned"},
{"m": 3, "n": 3, "k": 6, "tile_m": 1, "tile_n": 1, "threads": 64, "grouping": 20, "minblocks": 21, "algorithm": "medium", "perf": 107.41, "source": "autotuned"},
{"m": 3, "n": 3, "k": 7, "tile_m": 1, "tile_n": 1, "threads": 64, "grouping": 16, "minblocks": 5, "algorithm": "medium", "perf": 128.314, "source": "autotuned"},
{"m": 3, "n": 3, "k": 8, "tile_m": 1, "tile_n": 1, "threads": 64, "grouping": 20, "minblocks": 14, "algorithm": "medium", "perf": 116.311, "source": "autotuned"},
{"m": 3, "n": 3, "k": 9, "tile_m": 1, "tile_n": 1, "threads": 64, "grouping": 18, "minblocks": 2, "algorithm": "medium", "perf": 141.009, "source": "autotuned"},
{"m": 3, "n": 3, "k": 10, "tile_m": 1, "tile_n": 1, "threads": 64, "grouping": 16, "minblocks": 3, "algorithm": "medium", "perf": 160.153, "source": "autotuned"},
{"m": 3, "n": 3, "k": 11, "tile_m": 1, "tile_n": 1, "threads": 64, "grouping": 18, "minblocks": 22, "algorithm": "medium", "perf": 165.478, "source": "autotuned"},
{"m": 3, "n": 3, "k": 12, "tile_m": 1, "tile_n": 1, "threads": 64, "grouping": 20, "minblocks": 22, "algorithm": "medium", "perf": 158.175, "source": "autotuned"},
{"m": 3, "n": 3, "k": 16, "tile_m": 1, "tile_n": 1, "threads": 64, "grouping": 20, "minblocks": 15, "algorithm": "small", "perf": 170.362, "source": "autotuned"},
{"m": 3, "n": 3, "k": 23, "tile_m": 1, "tile_n": 1, "threads": 64, "grouping": 20, "minblocks": 12, "algorithm": "medium", "perf": 200.418, "source": "autotuned"},
{"m": 3, "n": 4, "k": 3, "tile_m": 2, "tile_n": 1, "threads": 64, "grouping": 20, "minblocks": 12, "algorithm": "medium", "perf": 60.2617, "source": "autotuned"},
{"m": 3, "n": 4, "k": 4, "tile_m": 1, "tile_n": 1, "threads": 64, "grouping": 14, "minblocks": 5, "algorithm": "medium", "perf": 84.0512, "source": "autotuned"},
{"m": 3, "n": 5, "k": 3, "tile_m": 1, "tile_n": 1, "threads": 64, "grouping": 14, "minblocks": 7, "algorithm": "medium", "perf": 82.3408, "source": "autotuned"},
{"m": 3, "n": 5, "k": 5, "tile_m": 1, "tile_n": 1, "threads": 64, "grouping": 13, "minblocks": 12, "algorithm": "medium", "perf": 122.632, "source": "autotuned"},
{"m": 3, "n": 6, "k": 3, "tile_m": 1, "tile_n": 1, "threads": 64, "grouping": 7, "minblocks": 26, "algorithm": "medium", "perf": 149.966, "source": "autotuned"},
{"m": 3, "n": 6, "k": 6, "tile_m": 1, "tile_n": 1, "threads": 64, "grouping": 7, "minblocks": 7, "algorithm": "small", "perf": 202.623, "source": "autotuned"},
{"m": 3, "n": 7, "k": 3, "tile_m": 1, "tile_n": 1, "threads": 64, "grouping": 13, "minblocks": 12, "algorithm": "small", "perf": 104.887, "source": "autotuned"},
{"m": 3, "n": 7, "k": 7, "tile_m": 1, "tile_n": 1, "threads": 64, "grouping": 9, "minblocks": 8, "algorithm": "small", "perf": 265.285, "source": "autotuned"},
{"m": 3, "n": 8, "k": 3, "tile_m": 1, "tile_n": 1, "threads": 64, "grouping": 13, "minblocks": 20, "algorithm": "medium", "perf": 142.651, "source": "autotuned"},
{"m": 3, "n": 8, "k": 8, "tile_m": 1, "tile_n": 1, "threads": 64, "grouping": 20, "minblocks": 6, "algorithm": "medium", "perf": 279.469, "source": "autotuned"},
{"m": 3, "n": 9, "k": 3, "tile_m": 1, "tile_n": 1, "threads": 64, "grouping": 13, "minblocks": 22, "algorithm": "medium", "perf": 157.818, "source": "autotuned"},
{"m": 3, "n": 9, "k": 9, "tile_m": 1, "tile_n": 1, "threads": 64, "grouping": 13, "minblocks": 6, "algorithm": "medium", "perf": 389.226, "source": "autotuned"},
{"m": 3, "n": 10, "k": 3, "tile_m": 1, "tile_n": 1, "threads": 64, "grouping": 16, "minblocks": 1, "algorithm": "medium", "perf": 153.817, "source": "autotuned"},
{"m": 3, "n": 10, "k": 10, "tile_m": 1, "tile_n": 1, "threads": 64, "grouping": 16, "minblocks": 8, "algorithm": "medium", "perf": 450.936, "source": "autotuned"},
{"m": 3, "n": 11, "k": 3, "tile_m": 1, "tile_n": 1, "threads": 64, "grouping": 16, "minblocks": 18, "algorithm": "medium", "perf": 172.335, "source": "autotuned"},
{"m": 3, "n": 11, "k": 11, "tile_m": 1, "tile_n": 1, "threads": 64, "grouping": 20, "minblocks": 7, "algorithm": "medium", "perf": 487.302, "source": "autotuned"},
{"m": 3, "n": 12, "k": 3, "tile_m": 1, "tile_n": 1, "threads": 64, "grouping": 9, "minblocks": 18, "algorithm": "medium", "perf": 272.932, "source": "autotuned"},
{"m": 3, "n": 12, "k": 12, "tile_m": 1, "tile_n": 1, "threads": 64, "grouping": 9, "minblocks": 7, "algorithm": "medium", "perf": 646.875, "source": "autotuned"},
{"m": 3, "n": 16, "k": 3, "tile_m": 1, "tile_n": 1, "threads": 64, "grouping": 8, "minblocks": 17, "algorithm": "medium", "perf": 366.395, "source": "autotuned"},
{"m": 3, "n": 16, "k": 16, "tile_m": 1, "tile_n": 1, "threads": 128, "grouping": 13, "minblocks": 5, "algorithm": "medium", "perf": 826.618, "source": "autotuned"},
{"m": 3, "n": 23, "k": 3, "tile_m": 1, "tile_n": 2, "threads": 128, "grouping": 18, "minblocks": 1, "algorithm": "medium", "perf": 346.986, "source": "autotuned"},
{"m": 3, "n": 23, "k": 23, "tile_m": 1, "tile_n": 2, "threads": 192, "grouping": 29, "minblocks": 2, "algorithm": "medium", "perf": 807.591, "source": "autotuned"},
{"m": 4, "n": 3, "k": 3, "tile_m": 2, "tile_n": 1, "threads": 64, "grouping": 20, "minblocks": 5, "algorithm": "medium", "perf": 59.588, "source": "autotuned"},
{"m": 4, "n": 3, "k": 4, "tile_m": 1, "tile_n": 1, "threads": 64, "grouping": 13, "minblocks": 5, "algorithm": "medium", "perf": 91.0536, "source": "autotuned"},
{"m": 4, "n": 4, "k": 3, "tile_m": 1, "tile_n": 1, "threads": 64, "grouping": 8, "minblocks": 15, "algorithm": "medium", "perf": 111.908, "source": "autotuned"},
{"m": 4, "n": 4, "k": 4, "tile_m": 1, "tile_n": 1, "threads": 64, "grouping": 20, "minblocks": 20, "algorithm": "medium", "perf": 123.061, "source": "autotuned"},
{"m": 4, "n": 4, "k": 5, "tile_m": 1, "tile_n": 1, "threads": 64, "grouping": 14, "minblocks": 16, "algorithm": "medium", "perf": 151.283, "source": "autotuned"},
{"m": 4, "n": 4, "k": 6, "tile_m": 1, "tile_n": 1, "threads": 64, "grouping": 20, "minblocks": 13, "algorithm": "medium", "perf": 158.124, "source": "autotuned"},
{"m": 4, "n": 4, "k": 7, "tile_m": 1, "tile_n": 1, "threads": 64, "grouping": 14, "minblocks": 16, "algorithm": "medium", "perf": 183.758, "source": "autotuned"},
{"m": 4, "n": 4, "k": 8, "tile_m": 1, "tile_n": 1, "threads": 64, "grouping": 20, "minblocks": 7, "algorithm": "medium", "perf": 226.413, "source": "autotuned"},
{"m": 4, "n": 4, "k": 9, "tile_m": 1, "tile_n": 1, "threads": 64, "grouping": 3, "minblocks": 1, "algorithm": "small", "perf": 289.266, "source": "autotuned"},
{"m": 4, "n": 4, "k": 10, "tile_m": 1, "tile_n": 1, "threads": 64, "grouping": 11, "minblocks": 2, "algorithm": "small", "perf": 234.219, "source": "autotuned"},
{"m": 4, "n": 4, "k": 11, "tile_m": 1, "tile_n": 1, "threads": 64, "grouping": 18, "minblocks": 9, "algorithm": "medium", "perf": 234.747, "source": "autotuned"},
{"m": 4, "n": 4, "k": 12, "tile_m": 1, "tile_n": 1, "threads": 64, "grouping": 16, "minblocks": 14, "algorithm": "medium", "perf": 282.632, "source": "autotuned"},
{"m": 4, "n": 4, "k": 16, "tile_m": 1, "tile_n": 1, "threads": 64, "grouping": 13, "minblocks": 11, "algorithm": "small", "perf": 299.18, "source": "autotuned"},
{"m": 4, "n": 4, "k": 23, "tile_m": 1, "tile_n": 1, "threads": 128, "grouping": 20, "minblocks": 10, "algorithm": "medium", "perf": 377.083, "source": "autotuned"},
{"m": 4, "n": 5, "k": 4, "tile_m": 1, "tile_n": 1, "threads": 64, "grouping": 6, "minblocks": 4, "algorithm": "small", "perf": 203.089, "source": "autotuned"},
{"m": 4, "n": 5, "k": 5, "tile_m": 1, "tile_n": 1, "threads": 64, "grouping": 9, "minblocks": 25, "algorithm": "medium", "perf": 202.459, "source": "autotuned"},
{"m": 4, "n": 6, "k": 4, "tile_m": 1, "tile_n": 1, "threads": 64, "grouping": 14, "minblocks": 8, "algorithm": "medium", "perf": 169.162, "source": "autotuned"},
{"m": 4, "n": 6, "k": 6, "tile_m": 1, "tile_n": 1, "threads": 64, "grouping": 18, "minblocks": 7, "algorithm": "medium", "perf": 217.578, "source": "autotuned"},
{"m": 4, "n": 7, "k": 4, "tile_m": 1, "tile_n": 1, "threads": 64, "grouping": 20, "minblocks": 26, "algorithm": "medium", "perf": 174.636, "source": "autotuned"},
{"m": 4, "n": 7, "k": 7, "tile_m": 1, "tile_n": 1, "threads": 64, "grouping": 14, "minblocks": 6, "algorithm": "medium", "perf": 262.665, "source": "autotuned"},
{"m": 4, "n": 8, "k": 4, "tile_m": 1, "tile_n": 1, "threads": 64, "grouping": 14, "minblocks": 4, "algorithm": "medium", "perf": 222.977, "source": "autotuned"},
{"m": 4, "n": 8, "k": 8, "tile_m": 1, "tile_n": 1, "threads": 64, "grouping": 9, "minblocks": 18, "algorithm": "medium", "perf": 447.137, "source": "autotuned"},
{"m": 4, "n": 9, "k": 4, "tile_m": 1, "tile_n": 1, "threads": 64, "grouping": 14, "minblocks": 21, "algorithm": "medium", "perf": 249.88, "source": "autotuned"},
{"m": 4, "n": 9, "k": 9, "tile_m": 1, "tile_n": 1, "threads": 64, "grouping": 18, "minblocks": 6, "algorithm": "medium", "perf": 449.647, "source": "autotuned"},
{"m": 4, "n": 10, "k": 4, "tile_m": 1, "tile_n": 1, "threads": 64, "grouping": 14, "minblocks": 8, "algorithm": "medium", "perf": 270.477, "source": "autotuned"},
{"m": 4, "n": 10, "k": 10, "tile_m": 1, "tile_n": 1, "threads": 64, "grouping": 18, "minblocks": 3, "algorithm": "medium", "perf": 575.986, "source": "autotuned"},
{"m": 4, "n": 11, "k": 4, "tile_m": 1, "tile_n": 1, "threads": 64, "grouping": 20, "minblocks": 25, "algorithm": "medium", "perf": 266.977, "source": "autotuned"},
{"m": 4, "n": 11, "k": 11, "tile_m": 1, "tile_n": 1, "threads": 64, "grouping": 11, "minblocks": 1, "algorithm": "medium", "perf": 741.426, "source": "autotuned"},
{"m": 4, "n": 12, "k": 4, "tile_m": 1, "tile_n": 1, "threads": 64, "grouping": 6, "minblocks": 25, "algorithm": "medium", "perf": 476.482, "source": "autotuned"},
{"m": 4, "n": 12, "k": 12, "tile_m": 1, "tile_n": 1, "threads": 64, "grouping": 12, "minblocks": 11, "algorithm": "medium", "perf": 825.924, "source": "autotuned"},
{"m": 4, "n": 16, "k": 4, "tile_m": 1, "tile_n": 1, "threads": 64, "grouping": 13, "minblocks": 1, "algorithm": "medium", "perf": 505.524, "source": "autotuned"},
{"m": 4, "n": 16, "k": 16, "tile_m": 1, "tile_n": 1, "threads": 64, "grouping": 18, "minblocks": 4, "algorithm": "medium", "perf": 1067.92, "source": "autotuned"},
{"m": 4, "n": 23, "k": 4, "tile_m": 1, "tile_n": 2, "threads": 128, "grouping": 16, "minblocks": 9, "algorithm": "medium", "perf": 563.703, "source": "autotuned"},
{"m": 4, "n": 23, "k": 23, "tile_m": 2, "tile_n": 1, "threads": 192, "grouping": 29, "minblocks": 6, "algorithm": "medium", "perf": 1029.0, "source": "autotuned"},
{"m": 5, "n": 3, "k": 3, "tile_m": 1, "tile_n": 1, "threads": 64, "grouping": 14, "minblocks": 14, "algorithm": "medium", "perf": 78.5437, "source": "autotuned"},
{"m": 5, "n": 3, "k": 5, "tile_m": 1, "tile_n": 1, "threads": 64, "grouping": 12, "minblocks": 8, "algorithm": "small", "perf": 140.412, "source": "autotuned"},
{"m": 5, "n": 4, "k": 4, "tile_m": 1, "tile_n": 1, "threads": 64, "grouping": 20, "minblocks": 8, "algorithm": "medium", "perf": 119.486, "source": "autotuned"},
{"m": 5, "n": 4, "k": 5, "tile_m": 1, "tile_n": 1, "threads": 64, "grouping": 9, "minblocks": 16, "algorithm": "medium", "perf": 211.411, "source": "autotuned"},
{"m": 5, "n": 5, "k": 3, "tile_m": 1, "tile_n": 1, "threads": 64, "grouping": 20, "minblocks": 7, "algorithm": "medium", "perf": 149.112, "source": "autotuned"},
{"m": 5, "n": 5, "k": 4, "tile_m": 1, "tile_n": 1, "threads": 64, "grouping": 12, "minblocks": 11, "algorithm": "small", "perf": 197.036, "source": "autotuned"},
{"m": 5, "n": 5, "k": 5, "tile_m": 1, "tile_n": 1, "threads": 64, "grouping": 20, "minblocks": 5, "algorithm": "medium", "perf": 222.291, "source": "autotuned"},
{"m": 5, "n": 5, "k": 6, "tile_m": 1, "tile_n": 1, "threads": 64, "grouping": 20, "minblocks": 5, "algorithm": "medium", "perf": 267.939, "source": "autotuned"},
{"m": 5, "n": 5, "k": 7, "tile_m": 1, "tile_n": 1, "threads": 64, "grouping": 12, "minblocks": 12, "algorithm": "medium", "perf": 302.075, "source": "autotuned"},
{"m": 5, "n": 5, "k": 8, "tile_m": 1, "tile_n": 1, "threads": 64, "grouping": 9, "minblocks": 22, "algorithm": "medium", "perf": 423.773, "source": "autotuned"},
{"m": 5, "n": 5, "k": 9, "tile_m": 1, "tile_n": 1, "threads": 64, "grouping": 20, "minblocks": 5, "algorithm": "medium", "perf": 299.693, "source": "autotuned"},
{"m": 5, "n": 5, "k": 10, "tile_m": 1, "tile_n": 1, "threads": 64, "grouping": 16, "minblocks": 2, "algorithm": "medium", "perf": 434.313, "source": "autotuned"},
{"m": 5, "n": 5, "k": 11, "tile_m": 1, "tile_n": 1, "threads": 64, "grouping": 6, "minblocks": 26, "algorithm": "medium", "perf": 503.922, "source": "autotuned"},
{"m": 5, "n": 5, "k": 12, "tile_m": 1, "tile_n": 1, "threads": 64, "grouping": 12, "minblocks": 14, "algorithm": "medium", "perf": 511.274, "source": "autotuned"},
{"m": 5, "n": 5, "k": 16, "tile_m": 1, "tile_n": 1, "threads": 64, "grouping": 13, "minblocks": 6, "algorithm": "medium", "perf": 518.448, "source": "autotuned"},
{"m": 5, "n": 5, "k": 23, "tile_m": 1, "tile_n": 1, "threads": 64, "grouping": 20, "minblocks": 14, "algorithm": "medium", "perf": 573.268, "source": "autotuned"},
{"m": 5, "n": 6, "k": 5, "tile_m": 1, "tile_n": 1, "threads": 64, "grouping": 12, "minblocks": 8, "algorithm": "medium", "perf": 300.709, "source": "autotuned"},
{"m": 5, "n": 6, "k": 6, "tile_m": 1, "tile_n": 1, "threads": 64, "grouping": 5, "minblocks": 8, "algorithm": "small", "perf": 386.735, "source": "autotuned"},
{"m": 5, "n": 7, "k": 5, "tile_m": 1, "tile_n": 1, "threads": 64, "grouping": 18, "minblocks": 5, "algorithm": "medium", "perf": 281.674, "source": "autotuned"},
{"m": 5, "n": 7, "k": 7, "tile_m": 1, "tile_n": 1, "threads": 64, "grouping": 14, "minblocks": 7, "algorithm": "medium", "perf": 328.184, "source": "autotuned"},
{"m": 5, "n": 8, "k": 5, "tile_m": 1, "tile_n": 1, "threads": 64, "grouping": 20, "minblocks": 5, "algorithm": "medium", "perf": 296.814, "source": "autotuned"},
{"m": 5, "n": 8, "k": 8, "tile_m": 1, "tile_n": 1, "threads": 64, "grouping": 20, "minblocks": 7, "algorithm": "medium", "perf": 483.122, "source": "autotuned"},
{"m": 5, "n": 9, "k": 5, "tile_m": 1, "tile_n": 1, "threads": 64, "grouping": 9, "minblocks": 23, "algorithm": "medium", "perf": 384.674, "source": "autotuned"},
{"m": 5, "n": 9, "k": 9, "tile_m": 1, "tile_n": 1, "threads": 64, "grouping": 12, "minblocks": 1, "algorithm": "medium", "perf": 706.199, "source": "autotuned"},
{"m": 5, "n": 10, "k": 5, "tile_m": 1, "tile_n": 1, "threads": 64, "grouping": 12, "minblocks": 8, "algorithm": "medium", "perf": 414.447, "source": "autotuned"},
{"m": 5, "n": 10, "k": 10, "tile_m": 1, "tile_n": 1, "threads": 64, "grouping": 13, "minblocks": 12, "algorithm": "medium", "perf": 745.609, "source": "autotuned"},
{"m": 5, "n": 11, "k": 5, "tile_m": 1, "tile_n": 1, "threads": 64, "grouping": 6, "minblocks": 8, "algorithm": "medium", "perf": 601.937, "source": "autotuned"},
{"m": 5, "n": 11, "k": 11, "tile_m": 1, "tile_n": 1, "threads": 64, "grouping": 9, "minblocks": 11, "algorithm": "medium", "perf": 945.236, "source": "autotuned"},
{"m": 5, "n": 12, "k": 5, "tile_m": 1, "tile_n": 1, "threads": 64, "grouping": 13, "minblocks": 24, "algorithm": "medium", "perf": 472.861, "source": "autotuned"},
{"m": 5, "n": 12, "k": 12, "tile_m": 1, "tile_n": 1, "threads": 64, "grouping": 10, "minblocks": 22, "algorithm": "medium", "perf": 1016.93, "source": "autotuned"},
{"m": 5, "n": 16, "k": 5, "tile_m": 2, "tile_n": 1, "threads": 128, "grouping": 12, "minblocks": 3, "algorithm": "medium", "perf": 694.503, "source": "autotuned"},
{"m": 5, "n": 16, "k": 16, "tile_m": 1, "tile_n": 2, "threads": 128, "grouping": 20, "minblocks": 16, "algorithm": "medium", "perf": 1120.43, "source": "autotuned"},
{"m": 5, "n": 23, "k": 5, "tile_m": 1, "tile_n": 2, "threads": 128, "grouping": 14, "minblocks": 2, "algorithm": "medium", "perf": 925.576, "source": "autotuned"},
{"m": 5, "n": 23, "k": 23, "tile_m": 1, "tile_n": 1, "threads": 128, "grouping": 31, "minblocks": 3, "algorithm": "medium", "perf": 1227.76, "source": "autotuned"},
{"m": 6, "n": 3, "k": 3, "tile_m": 1, "tile_n": 1, "threads": 64, "grouping": 16, "minblocks": 7, "algorithm": "medium", "perf": 94.2544, "source": "autotuned"},
{"m": 6, "n": 3, "k": 6, "tile_m": 1, "tile_n": 1, "threads": 64, "grouping": 20, "minblocks": 8, "algorithm": "medium", "perf": 156.363, "source": "autotuned"},
{"m": 6, "n": 4, "k": 4, "tile_m": 1, "tile_n": 1, "threads": 64, "grouping": 14, "minblocks": 8, "algorithm": "medium", "perf": 165.788, "source": "autotuned"},
{"m": 6, "n": 4, "k": 6, "tile_m": 1, "tile_n": 1, "threads": 64, "grouping": 9, "minblocks": 12, "algorithm": "small", "perf": 230.366, "source": "autotuned"},
{"m": 6, "n": 5, "k": 5, "tile_m": 1, "tile_n": 1, "threads": 64, "grouping": 13, "minblocks": 5, "algorithm": "medium", "perf": 242.931, "source": "autotuned"},
{"m": 6, "n": 5, "k": 6, "tile_m": 1, "tile_n": 1, "threads": 64, "grouping": 16, "minblocks": 5, "algorithm": "medium", "perf": 269.907, "source": "autotuned"},
{"m": 6, "n": 6, "k": 3, "tile_m": 1, "tile_n": 1, "threads": 64, "grouping": 9, "minblocks": 2, "algorithm": "medium", "perf": 285.082, "source": "autotuned"},
{"m": 6, "n": 6, "k": 4, "tile_m": 1, "tile_n": 1, "threads": 64, "grouping": 18, "minblocks": 2, "algorithm": "medium", "perf": 274.249, "source": "autotuned"},
{"m": 6, "n": 6, "k": 5, "tile_m": 1, "tile_n": 1, "threads": 64, "grouping": 9, "minblocks": 27, "algorithm": "medium", "perf": 442.052, "source": "autotuned"},
{"m": 6, "n": 6, "k": 6, "tile_m": 1, "tile_n": 1, "threads": 64, "grouping": 14, "minblocks": 3, "algorithm": "medium", "perf": 369.733, "source": "autotuned"},
{"m": 6, "n": 6, "k": 7, "tile_m": 1, "tile_n": 1, "threads": 64, "grouping": 12, "minblocks": 13, "algorithm": "medium", "perf": 470.905, "source": "autotuned"},
{"m": 6, "n": 6, "k": 8, "tile_m": 1, "tile_n": 1, "threads": 64, "grouping": 12, "minblocks": 11, "algorithm": "medium", "perf": 575.643, "source": "autotuned"},
{"m": 6, "n": 6, "k": 9, "tile_m": 1, "tile_n": 1, "threads": 64, "grouping": 16, "minblocks": 22, "algorithm": "medium", "perf": 524.301, "source": "autotuned"},
{"m": 6, "n": 6, "k": 10, "tile_m": 1, "tile_n": 1, "threads": 64, "grouping": 20, "minblocks": 5, "algorithm": "medium", "perf": 541.641, "source": "autotuned"},
{"m": 6, "n": 6, "k": 11, "tile_m": 1, "tile_n": 1, "threads": 64, "grouping": 18, "minblocks": 24, "algorithm": "medium", "perf": 538.35, "source": "autotuned"},
{"m": 6, "n": 6, "k": 12, "tile_m": 1, "tile_n": 1, "threads": 64, "grouping": 20, "minblocks": 2, "algorithm": "medium", "perf": 566.47, "source": "autotuned"},
{"m": 6, "n": 6, "k": 16, "tile_m": 1, "tile_n": 1, "threads": 64, "grouping": 13, "minblocks": 14, "algorithm": "medium", "perf": 727.804, "source": "autotuned"},
{"m": 6, "n": 6, "k": 23, "tile_m": 1, "tile_n": 1, "threads": 64, "grouping": 14, "minblocks": 8, "algorithm": "medium", "perf": 799.476, "source": "autotuned"},
{"m": 6, "n": 7, "k": 6, "tile_m": 1, "tile_n": 1, "threads": 64, "grouping": 20, "minblocks": 8, "algorithm": "medium", "perf": 342.394, "source": "autotuned"},
{"m": 6, "n": 7, "k": 7, "tile_m": 1, "tile_n": 1, "threads": 64, "grouping": 13, "minblocks": 23, "algorithm": "medium", "perf": 393.183, "source": "autotuned"},
{"m": 6, "n": 8, "k": 6, "tile_m": 1, "tile_n": 1, "threads": 64, "grouping": 8, "minblocks": 5, "algorithm": "medium", "perf": 493.64, "source": "autotuned"},
{"m": 6, "n": 8, "k": 8, "tile_m": 1, "tile_n": 1, "threads": 64, "grouping": 12, "minblocks": 9, "algorithm": "medium", "perf": 699.393, "source": "autotuned"},
{"m": 6, "n": 9, "k": 6, "tile_m": 1, "tile_n": 1, "threads": 64, "grouping": 8, "minblocks": 23, "algorithm": "medium", "perf": 556.646, "source": "autotuned"},
{"m": 6, "n": 9, "k": 9, "tile_m": 1, "tile_n": 1, "threads": 64, "grouping": 10, "minblocks": 23, "algorithm": "medium", "perf": 864.42, "source": "autotuned"},
{"m": 6, "n": 10, "k": 6, "tile_m": 1, "tile_n": 1, "threads": 64, "grouping": 20, "minblocks": 1, "algorithm": "medium", "perf": 471.286, "source": "autotuned"},
{"m": 6, "n": 10, "k": 10, "tile_m": 1, "tile_n": 1, "threads": 64, "grouping": 12, "minblocks": 22, "algorithm": "medium", "perf": 943.323, "source": "autotuned"},
{"m": 6, "n": 11, "k": 6, "tile_m": 2, "tile_n": 1, "threads": 128, "grouping": 10, "minblocks": 7, "algorithm": "medium", "perf": 674.902, "source": "autotuned"},
{"m": 6, "n": 11, "k": 11, "tile_m": 2, "tile_n": 1, "threads": 128, "grouping": 20, "minblocks": 11, "algorithm": "medium", "perf": 758.811, "source": "autotuned"},
{"m": 6, "n": 12, "k": 6, "tile_m": 1, "tile_n": 2, "threads": 64, "grouping": 6, "minblocks": 3, "algorithm": "medium", "perf": 729.121, "source": "autotuned"},
{"m": 6, "n": 12, "k": 12, "tile_m": 2, "tile_n": 1, "threads": 128, "grouping": 20, "minblocks": 5, "algorithm": "medium", "perf": 915.954, "source": "autotuned"},
{"m": 6, "n": 16, "k": 6, "tile_m": 2, "tile_n": 1, "threads": 128, "grouping": 12, "minblocks": 4, "algorithm": "medium", "perf": 899.944, "source": "autotuned"},
{"m": 6, "n": 16, "k": 16, "tile_m": 2, "tile_n": 1, "threads": 128, "grouping": 20, "minblocks": 16, "algorithm": "medium", "perf": 1304.86, "source": "autotuned"},
{"m": 6, "n": 23, "k": 6, "tile_m": 3, "tile_n": 1, "threads": 128, "grouping": 13, "minblocks": 16, "algorithm": "medium", "perf": 925.427, "source": "autotuned"},
{"m": 6, "n": 23, "k": 23, "tile_m": 1, "tile_n": 3, "threads": 192, "grouping": 25, "minblocks": 4, "algorithm": "medium", "perf": 1349.15, "source": "autotuned"},
{"m": 7, "n": 3, "k": 3, "tile_m": 2, "tile_n": 1, "threads": 64, "grouping": 13, "minblocks": 8, "algorithm": "medium", "perf": 119.395, "source": "autotuned"},
{"m": 7, "n": 3, "k": 7, "tile_m": 1, "tile_n": 1, "threads": 64, "grouping": 14, "minblocks": 17, "algorithm": "medium", "perf": 209.607, "source": "autotuned"},
{"m": 7, "n": 4, "k": 4, "tile_m": 1, "tile_n": 1, "threads": 64, "grouping": 13, "minblocks": 5, "algorithm": "medium", "perf": 211.854, "source": "autotuned"},
{"m": 7, "n": 4, "k": 7, "tile_m": 1, "tile_n": 1, "threads": 64, "grouping": 8, "minblocks": 1, "algorithm": "medium", "perf": 320.618, "source": "autotuned"},
{"m": 7, "n": 5, "k": 5, "tile_m": 1, "tile_n": 1, "threads": 64, "grouping": 9, "minblocks": 16, "algorithm": "medium", "perf": 337.009, "source": "autotuned"},
{"m": 7, "n": 5, "k": 7, "tile_m": 1, "tile_n": 1, "threads": 64, "grouping": 12, "minblocks": 24, "algorithm": "medium", "perf": 410.337, "source": "autotuned"},
{"m": 7, "n": 6, "k": 6, "tile_m": 1, "tile_n": 1, "threads": 64, "grouping": 9, "minblocks": 20, "algorithm": "medium", "perf": 469.564, "source": "autotuned"},
{"m": 7, "n": 6, "k": 7, "tile_m": 1, "tile_n": 1, "threads": 64, "grouping": 16, "minblocks": 8, "algorithm": "medium", "perf": 367.395, "source": "autotuned"},
{"m": 7, "n": 7, "k": 3, "tile_m": 1, "tile_n": 1, "threads": 64, "grouping": 9, "minblocks": 26, "algorithm": "medium", "perf": 328.442, "source": "autotuned"},
{"m": 7, "n": 7, "k": 4, "tile_m": 1, "tile_n": 1, "threads": 64, "grouping": 20, "minblocks": 1, "algorithm": "medium", "perf": 355.5, "source": "autotuned"},
{"m": 7, "n": 7, "k": 5, "tile_m": 1, "tile_n": 1, "threads": 64, "grouping": 9, "minblocks": 1, "algorithm": "medium", "perf": 478.243, "source": "autotuned"},
{"m": 7, "n": 7, "k": 6, "tile_m": 1, "tile_n": 1, "threads": 64, "grouping": 8, "minblocks": 1, "algorithm": "medium", "perf": 538.794, "source": "autotuned"},
{"m": 7, "n": 7, "k": 7, "tile_m": 1, "tile_n": 1, "threads": 64, "grouping": 11, "minblocks": 1, "algorithm": "medium", "perf": 632.94, "source": "autotuned"},
{"m": 7, "n": 7, "k": 8, "tile_m": 1, "tile_n": 1, "threads": 64, "grouping": 12, "minblocks": 15, "algorithm": "medium", "perf": 759.257, "source": "autotuned"},
{"m": 7, "n": 7, "k": 9, "tile_m": 1, "tile_n": 1, "threads": 64, "grouping": 16, "minblocks": 12, "algorithm": "medium", "perf": 761.05, "source": "autotuned"},
{"m": 7, "n": 7, "k": 10, "tile_m": 1, "tile_n": 1, "threads": 64, "grouping": 12, "minblocks": 16, "algorithm": "medium", "perf": 778.019, "source": "autotuned"},
{"m": 7, "n": 7, "k": 11, "tile_m": 1, "tile_n": 1, "threads": 64, "grouping": 20, "minblocks": 7, "algorithm": "medium", "perf": 706.199, "source": "autotuned"},
{"m": 7, "n": 7, "k": 12, "tile_m": 1, "tile_n": 1, "threads": 64, "grouping": 16, "minblocks": 27, "algorithm": "medium", "perf": 793.057, "source": "autotuned"},
{"m": 7, "n": 7, "k": 16, "tile_m": 1, "tile_n": 1, "threads": 64, "grouping": 10, "minblocks": 6, "algorithm": "medium", "perf": 1008.46, "source": "autotuned"},
{"m": 7, "n": 7, "k": 23, "tile_m": 1, "tile_n": 1, "threads": 128, "grouping": 20, "minblocks": 1, "algorithm": "medium", "perf": 969.576, "source": "autotuned"},
{"m": 7, "n": 8, "k": 7, "tile_m": 1, "tile_n": 1, "threads": 64, "grouping": 9, "minblocks": 19, "algorithm": "medium", "perf": 568.161, "source": "autotuned"},
{"m": 7, "n": 8, "k": 8, "tile_m": 1, "tile_n": 1, "threads": 64, "grouping": 10, "minblocks": 1, "algorithm": "medium", "perf": 902.969, "source": "autotuned"},
{"m": 7, "n": 9, "k": 7, "tile_m": 1, "tile_n": 1, "threads": 64, "grouping": 16, "minblocks": 23, "algorithm": "medium", "perf": 517.355, "source": "autotuned"},
{"m": 7, "n": 9, "k": 9, "tile_m": 1, "tile_n": 1, "threads": 64, "grouping": 18, "minblocks": 2, "algorithm": "medium", "perf": 793.253, "source": "autotuned"},
{"m": 7, "n": 10, "k": 7, "tile_m": 1, "tile_n": 2, "threads": 128, "grouping": 13, "minblocks": 14, "algorithm": "medium", "perf": 718.91, "source": "autotuned"},
{"m": 7, "n": 10, "k": 10, "tile_m": 1, "tile_n": 2, "threads": 64, "grouping": 10, "minblocks": 23, "algorithm": "medium", "perf": 900.092, "source": "autotuned"},
{"m": 7, "n": 11, "k": 7, "tile_m": 2, "tile_n": 1, "threads": 128, "grouping": 10, "minblocks": 7, "algorithm": "medium", "perf": 848.213, "source": "autotuned"},
{"m": 7, "n": 11, "k": 11, "tile_m": 1, "tile_n": 2, "threads": 128, "grouping": 13, "minblocks": 5, "algorithm": "medium", "perf": 963.974, "source": "autotuned"},
{"m": 7, "n": 12, "k": 7, "tile_m": 2, "tile_n": 1, "threads": 128, "grouping": 12, "minblocks": 10, "algorithm": "medium", "perf": 901.596, "source": "autotuned"},
{"m": 7, "n": 12, "k": 12, "tile_m": 1, "tile_n": 2, "threads": 128, "grouping": 14, "minblocks": 10, "algorithm": "medium", "perf": 1120.87, "source": "autotuned"},
{"m": 7, "n": 16, "k": 7, "tile_m": 2, "tile_n": 1, "threads": 128, "grouping": 12, "minblocks": 1, "algorithm": "medium", "perf": 1149.36, "source": "autotuned"},
{"m": 7, "n": 16, "k": 16, "tile_m": 2, "tile_n": 1, "threads": 128, "grouping": 16, "minblocks": 10, "algorithm": "medium", "perf": 1466.3, "source": "autotuned"},
{"m": 7, "n": 23, "k": 7, "tile_m": 1, "tile_n": 3, "threads": 192, "grouping": 16, "minblocks": 6, "algorithm": "medium", "perf": 1193.54, "source": "autotuned"},
{"m": 7, "n": 23, "k": 23, "tile_m": 1, "tile_n": 3, "threads": 192, "grouping": 30, "minblocks": 5, "algorithm": "medium", "perf": 1522.25, "source": "autotuned"},
{"m": 8, "n": 3, "k": 3, "tile_m": 1, "tile_n": 1, "threads": 64, "grouping": 13, "minblocks": 4, "algorithm": "medium", "perf": 132.835, "source": "autotuned"},
{"m": 8, "n": 3, "k": 8, "tile_m": 1, "tile_n": 1, "threads": 64, "grouping": 18, "minblocks": 8, "algorithm": "medium", "perf": 330.918, "source": "autotuned"},
{"m": 8, "n": 4, "k": 4, "tile_m": 1, "tile_n": 1, "threads": 64, "grouping": 12, "minblocks": 22, "algorithm": "medium", "perf": 245.039, "source": "autotuned"},
{"m": 8, "n": 4, "k": 8, "tile_m": 1, "tile_n": 1, "threads": 64, "grouping": 9, "minblocks": 23, "algorithm": "medium", "perf": 516.246, "source": "autotuned"},
{"m": 8, "n": 5, "k": 5, "tile_m": 1, "tile_n": 1, "threads": 64, "grouping": 14, "minblocks": 5, "algorithm": "medium", "perf": 297.418, "source": "autotuned"},
{"m": 8, "n": 5, "k": 8, "tile_m": 1, "tile_n": 1, "threads": 64, "grouping": 18, "minblocks": 10, "algorithm": "medium", "perf": 516.822, "source": "autotuned"},
{"m": 8, "n": 6, "k": 6, "tile_m": 1, "tile_n": 1, "threads": 64, "grouping": 6, "minblocks": 1, "algorithm": "medium", "perf": 559.016, "source": "autotuned"},
{"m": 8, "n": 6, "k": 8, "tile_m": 1, "tile_n": 1, "threads": 64, "grouping": 16, "minblocks": 15, "algorithm": "medium", "perf": 598.724, "source": "autotuned"},
{"m": 8, "n": 7, "k": 7, "tile_m": 1, "tile_n": 1, "threads": 64, "grouping": 12, "minblocks": 1, "algorithm": "medium", "perf": 561.082, "source": "autotuned"},
{"m": 8, "n": 7, "k": 8, "tile_m": 1, "tile_n": 1, "threads": 64, "grouping": 16, "minblocks": 12, "algorithm": "medium", "perf": 763.392, "source": "autotuned"},
{"m": 8, "n": 8, "k": 3, "tile_m": 1, "tile_n": 1, "threads": 64, "grouping": 18, "minblocks": 19, "algorithm": "medium", "perf": 393.813, "source": "autotuned"},
{"m": 8, "n": 8, "k": 4, "tile_m": 1, "tile_n": 1, "threads": 64, "grouping": 18, "minblocks": 8, "algorithm": "medium", "perf": 537.112, "source": "autotuned"},
{"m": 8, "n": 8, "k": 5, "tile_m": 1, "tile_n": 1, "threads": 64, "grouping": 12, "minblocks": 3, "algorithm": "medium", "perf": 644.83, "source": "autotuned"},
{"m": 8, "n": 8, "k": 6, "tile_m": 1, "tile_n": 1, "threads": 64, "grouping": 9, "minblocks": 1, "algorithm": "medium", "perf": 623.792, "source": "autotuned"},
{"m": 8, "n": 8, "k": 7, "tile_m": 1, "tile_n": 1, "threads": 64, "grouping": 8, "minblocks": 2, "algorithm": "medium", "perf": 747.128, "source": "autotuned"},
{"m": 8, "n": 8, "k": 8, "tile_m": 1, "tile_n": 1, "threads": 64, "grouping": 18, "minblocks": 8, "algorithm": "medium", "perf": 839.605, "source": "autotuned"},
{"m": 8, "n": 8, "k": 16, "tile_m": 1, "tile_n": 1, "threads": 128, "grouping": 20, "minblocks": 10, "algorithm": "medium", "perf": 1183.61, "source": "autotuned"},
{"m": 8, "n": 8, "k": 23, "tile_m": 1, "tile_n": 1, "threads": 64, "grouping": 20, "minblocks": 7, "algorithm": "medium", "perf": 1200.78, "source": "autotuned"},
{"m": 8, "n": 16, "k": 8, "tile_m": 1, "tile_n": 2, "threads": 64, "grouping": 9, "minblocks": 27, "algorithm": "medium", "perf": 1425.14, "source": "autotuned"},
{"m": 8, "n": 16, "k": 16, "tile_m": 2, "tile_n": 1, "threads": 128, "grouping": 17, "minblocks": 16, "algorithm": "medium", "perf": 1671.22, "source": "autotuned"},
{"m": 8, "n": 23, "k": 8, "tile_m": 2, "tile_n": 2, "threads": 192, "grouping": 20, "minblocks": 10, "algorithm": "medium", "perf": 1412.43, "source": "autotuned"},
{"m": 8, "n": 23, "k": 23, "tile_m": 1, "tile_n": 3, "threads": 192, "grouping": 31, "minblocks": 8, "algorithm": "medium", "perf": 1682.11, "source": "autotuned"},
{"m": 9, "n": 3, "k": 3, "tile_m": 1, "tile_n": 1, "threads": 64, "grouping": 20, "minblocks": 8, "algorithm": "medium", "perf": 129.559, "source": "autotuned"},
{"m": 9, "n": 3, "k": 9, "tile_m": 1, "tile_n": 1, "threads": 64, "grouping": 12, "minblocks": 12, "algorithm": "medium", "perf": 427.699, "source": "autotuned"},
{"m": 9, "n": 4, "k": 4, "tile_m": 1, "tile_n": 1, "threads": 64, "grouping": 9, "minblocks": 2, "algorithm": "medium", "perf": 283.085, "source": "autotuned"},
{"m": 9, "n": 4, "k": 9, "tile_m": 1, "tile_n": 1, "threads": 128, "grouping": 11, "minblocks": 4, "algorithm": "small", "perf": 442.617, "source": "autotuned"},
{"m": 9, "n": 5, "k": 5, "tile_m": 1, "tile_n": 1, "threads": 64, "grouping": 9, "minblocks": 6, "algorithm": "medium", "perf": 391.489, "source": "autotuned"},
{"m": 9, "n": 5, "k": 9, "tile_m": 1, "tile_n": 1, "threads": 64, "grouping": 18, "minblocks": 13, "algorithm": "medium", "perf": 590.993, "source": "autotuned"},
{"m": 9, "n": 6, "k": 6, "tile_m": 1, "tile_n": 1, "threads": 64, "grouping": 9, "minblocks": 8, "algorithm": "small", "perf": 558.289, "source": "autotuned"},
{"m": 9, "n": 6, "k": 9, "tile_m": 1, "tile_n": 1, "threads": 64, "grouping": 16, "minblocks": 16, "algorithm": "medium", "perf": 748.385, "source": "autotuned"},
{"m": 9, "n": 7, "k": 7, "tile_m": 1, "tile_n": 1, "threads": 64, "grouping": 6, "minblocks": 8, "algorithm": "medium", "perf": 855.688, "source": "autotuned"},
{"m": 9, "n": 7, "k": 9, "tile_m": 1, "tile_n": 1, "threads": 64, "grouping": 12, "minblocks": 15, "algorithm": "medium", "perf": 960.205, "source": "autotuned"},
{"m": 9, "n": 9, "k": 3, "tile_m": 1, "tile_n": 2, "threads": 128, "grouping": 18, "minblocks": 9, "algorithm": "medium", "perf": 472.711, "source": "autotuned"},
{"m": 9, "n": 9, "k": 4, "tile_m": 1, "tile_n": 1, "threads": 128, "grouping": 18, "minblocks": 9, "algorithm": "medium", "perf": 526.767, "source": "autotuned"},
{"m": 9, "n": 9, "k": 5, "tile_m": 2, "tile_n": 1, "threads": 128, "grouping": 20, "minblocks": 6, "algorithm": "medium", "perf": 643.738, "source": "autotuned"},
{"m": 9, "n": 9, "k": 6, "tile_m": 1, "tile_n": 2, "threads": 128, "grouping": 13, "minblocks": 12, "algorithm": "medium", "perf": 832.733, "source": "autotuned"},
{"m": 9, "n": 9, "k": 7, "tile_m": 2, "tile_n": 1, "threads": 128, "grouping": 14, "minblocks": 4, "algorithm": "medium", "perf": 917.151, "source": "autotuned"},
{"m": 9, "n": 9, "k": 9, "tile_m": 2, "tile_n": 1, "threads": 128, "grouping": 10, "minblocks": 13, "algorithm": "small", "perf": 953.237, "source": "autotuned"},
{"m": 9, "n": 9, "k": 16, "tile_m": 1, "tile_n": 2, "threads": 128, "grouping": 19, "minblocks": 16, "algorithm": "medium", "perf": 1169.1, "source": "autotuned"},
{"m": 9, "n": 9, "k": 23, "tile_m": 2, "tile_n": 1, "threads": 128, "grouping": 19, "minblocks": 3, "algorithm": "medium", "perf": 1250.03, "source": "autotuned"},
{"m": 9, "n": 16, "k": 9, "tile_m": 3, "tile_n": 1, "threads": 64, "grouping": 10, "minblocks": 25, "algorithm": "medium", "perf": 1259.32, "source": "autotuned"},
{"m": 9, "n": 16, "k": 16, "tile_m": 2, "tile_n": 2, "threads": 192, "grouping": 19, "minblocks": 7, "algorithm": "medium", "perf": 1604.95, "source": "autotuned"},
{"m": 9, "n": 23, "k": 9, "tile_m": 2, "tile_n": 2, "threads": 256, "grouping": 19, "minblocks": 1, "algorithm": "medium", "perf": 1484.93, "source": "autotuned"},
{"m": 9, "n": 23, "k": 23, "tile_m": 2, "tile_n": 2, "threads": 320, "grouping": 30, "minblocks": 6, "algorithm": "medium", "perf": 1808.53, "source": "autotuned"},
{"m": 10, "n": 3, "k": 3, "tile_m": 1, "tile_n": 1, "threads": 64, "grouping": 13, "minblocks": 8, "algorithm": "medium", "perf": 172.47, "source": "autotuned"},
{"m": 10, "n": 3, "k": 10, "tile_m": 1, "tile_n": 1, "threads": 64, "grouping": 18, "minblocks": 2, "algorithm": "medium", "perf": 423.394, "source": "autotuned"},
{"m": 10, "n": 4, "k": 4, "tile_m": 1, "tile_n": 1, "threads": 64, "grouping": 18, "minblocks": 7, "algorithm": "medium", "perf": 253.505, "source": "autotuned"},
{"m": 10, "n": 4, "k": 10, "tile_m": 1, "tile_n": 1, "threads": 64, "grouping": 9, "minblocks": 12, "algorithm": "medium", "perf": 687.576, "source": "autotuned"},
{"m": 10, "n": 5, "k": 5, "tile_m": 1, "tile_n": 1, "threads": 64, "grouping": 8, "minblocks": 13, "algorithm": "medium", "perf": 453.449, "source": "autotuned"},
{"m": 10, "n": 5, "k": 10, "tile_m": 1, "tile_n": 1, "threads": 64, "grouping": 12, "minblocks": 13, "algorithm": "medium", "perf": 836.378, "source": "autotuned"},
{"m": 10, "n": 6, "k": 6, "tile_m": 1, "tile_n": 1, "threads": 64, "grouping": 9, "minblocks": 12, "algorithm": "medium", "perf": 649.71, "source": "autotuned"},
{"m": 10, "n": 6, "k": 10, "tile_m": 1, "tile_n": 1, "threads": 64, "grouping": 10, "minblocks": 18, "algorithm": "medium", "perf": 1008.29, "source": "autotuned"},
{"m": 10, "n": 7, "k": 7, "tile_m": 2, "tile_n": 1, "threads": 128, "grouping": 20, "minblocks": 9, "algorithm": "medium", "perf": 663.084, "source": "autotuned"},
{"m": 10, "n": 7, "k": 10, "tile_m": 2, "tile_n": 1, "threads": 128, "grouping": 13, "minblocks": 3, "algorithm": "medium", "perf": 860.717, "source": "autotuned"},
{"m": 10, "n": 10, "k": 3, "tile_m": 2, "tile_n": 1, "threads": 128, "grouping": 20, "minblocks": 14, "algorithm": "medium", "perf": 514.267, "source": "autotuned"},
{"m": 10, "n": 10, "k": 4, "tile_m": 1, "tile_n": 2, "threads": 128, "grouping": 12, "minblocks": 9, "algorithm": "small", "perf": 689.868, "source": "autotuned"},
{"m": 10, "n": 10, "k": 5, "tile_m": 2, "tile_n": 1, "threads": 128, "grouping": 10, "minblocks": 5, "algorithm": "medium", "perf": 957.051, "source": "autotuned"},
{"m": 10, "n": 10, "k": 6, "tile_m": 1, "tile_n": 2, "threads": 128, "grouping": 18, "minblocks": 14, "algorithm": "medium", "perf": 853.143, "source": "autotuned"},
{"m": 10, "n": 10, "k": 7, "tile_m": 2, "tile_n": 1, "threads": 128, "grouping": 13, "minblocks": 12, "algorithm": "small", "perf": 863.212, "source": "autotuned"},
{"m": 10, "n": 10, "k": 10, "tile_m": 1, "tile_n": 2, "threads": 128, "grouping": 20, "minblocks": 2, "algorithm": "medium", "perf": 1115.59, "source": "autotuned"},
{"m": 10, "n": 10, "k": 16, "tile_m": 2, "tile_n": 1, "threads": 128, "grouping": 12, "minblocks": 5, "algorithm": "medium", "perf": 1434.5, "source": "autotuned"},
{"m": 10, "n": 10, "k": 23, "tile_m": 1, "tile_n": 2, "threads": 128, "grouping": 24, "minblocks": 2, "algorithm": "medium", "perf": 1432.58, "source": "autotuned"},
{"m": 10, "n": 16, "k": 10, "tile_m": 2, "tile_n": 2, "threads": 192, "grouping": 19, "minblocks": 3, "algorithm": "medium", "perf": 1513.98, "source": "autotuned"},
{"m": 10, "n": 16, "k": 16, "tile_m": 2, "tile_n": 2, "threads": 128, "grouping": 18, "minblocks": 14, "algorithm": "medium", "perf": 1714.34, "source": "autotuned"},
{"m": 10, "n": 23, "k": 10, "tile_m": 2, "tile_n": 2, "threads": 256, "grouping": 23, "minblocks": 2, "algorithm": "medium", "perf": 1622.51, "source": "autotuned"},
{"m": 10, "n": 23, "k": 23, "tile_m": 2, "tile_n": 2, "threads": 320, "grouping": 30, "minblocks": 3, "algorithm": "medium", "perf": 1944.26, "source": "autotuned"},
{"m": 11, "n": 3, "k": 3, "tile_m": 1, "tile_n": 1, "threads": 64, "grouping": 18, "minblocks": 8, "algorithm": "medium", "perf": 176.216, "source": "autotuned"},
{"m": 11, "n": 3, "k": 11, "tile_m": 1, "tile_n": 1, "threads": 64, "grouping": 18, "minblocks": 9, "algorithm": "medium", "perf": 496.753, "source": "autotuned"},
{"m": 11, "n": 4, "k": 4, "tile_m": 1, "tile_n": 1, "threads": 64, "grouping": 9, "minblocks": 5, "algorithm": "medium", "perf": 329.247, "source": "autotuned"},
{"m": 11, "n": 4, "k": 11, "tile_m": 1, "tile_n": 1, "threads": 64, "grouping": 12, "minblocks": 1, "algorithm": "medium", "perf": 694.62, "source": "autotuned"},
{"m": 11, "n": 5, "k": 5, "tile_m": 1, "tile_n": 1, "threads": 64, "grouping": 18, "minblocks": 4, "algorithm": "medium", "perf": 412.56, "source": "autotuned"},
{"m": 11, "n": 5, "k": 11, "tile_m": 1, "tile_n": 1, "threads": 64, "grouping": 20, "minblocks": 12, "algorithm": "medium", "perf": 777.126, "source": "autotuned"},
{"m": 11, "n": 6, "k": 6, "tile_m": 1, "tile_n": 2, "threads": 128, "grouping": 13, "minblocks": 5, "algorithm": "medium", "perf": 623.818, "source": "autotuned"},
{"m": 11, "n": 6, "k": 11, "tile_m": 1, "tile_n": 2, "threads": 128, "grouping": 20, "minblocks": 1, "algorithm": "medium", "perf": 800.38, "source": "autotuned"},
{"m": 11, "n": 7, "k": 7, "tile_m": 2, "tile_n": 1, "threads": 64, "grouping": 10, "minblocks": 13, "algorithm": "medium", "perf": 838.182, "source": "autotuned"},
{"m": 11, "n": 7, "k": 11, "tile_m": 2, "tile_n": 1, "threads": 128, "grouping": 12, "minblocks": 15, "algorithm": "medium", "perf": 988.882, "source": "autotuned"},
{"m": 11, "n": 11, "k": 3, "tile_m": 1, "tile_n": 1, "threads": 128, "grouping": 12, "minblocks": 1, "algorithm": "medium", "perf": 724.31, "source": "autotuned"},
{"m": 11, "n": 11, "k": 4, "tile_m": 1, "tile_n": 1, "threads": 128, "grouping": 16, "minblocks": 4, "algorithm": "medium", "perf": 835.893, "source": "autotuned"},
{"m": 11, "n": 11, "k": 5, "tile_m": 1, "tile_n": 1, "threads": 128, "grouping": 12, "minblocks": 15, "algorithm": "medium", "perf": 1030.54, "source": "autotuned"},
{"m": 11, "n": 11, "k": 6, "tile_m": 1, "tile_n": 1, "threads": 128, "grouping": 10, "minblocks": 10, "algorithm": "medium", "perf": 1067.98, "source": "autotuned"},
{"m": 11, "n": 11, "k": 7, "tile_m": 1, "tile_n": 1, "threads": 128, "grouping": 18, "minblocks": 16, "algorithm": "medium", "perf": 1052.5, "source": "autotuned"},
{"m": 11, "n": 11, "k": 11, "tile_m": 1, "tile_n": 1, "threads": 128, "grouping": 12, "minblocks": 3, "algorithm": "medium", "perf": 1357.04, "source": "autotuned"},
{"m": 11, "n": 11, "k": 16, "tile_m": 1, "tile_n": 1, "threads": 128, "grouping": 18, "minblocks": 14, "algorithm": "medium", "perf": 1482.09, "source": "autotuned"},
{"m": 11, "n": 11, "k": 23, "tile_m": 1, "tile_n": 1, "threads": 128, "grouping": 18, "minblocks": 3, "algorithm": "medium", "perf": 1558.5, "source": "autotuned"},
{"m": 11, "n": 16, "k": 11, "tile_m": 2, "tile_n": 2, "threads": 192, "grouping": 17, "minblocks": 3, "algorithm": "medium", "perf": 1618.33, "source": "autotuned"},
{"m": 11, "n": 16, "k": 16, "tile_m": 3, "tile_n": 1, "threads": 192, "grouping": 20, "minblocks": 8, "algorithm": "medium", "perf": 1814.42, "source": "autotuned"},
{"m": 11, "n": 23, "k": 11, "tile_m": 2, "tile_n": 3, "threads": 256, "grouping": 22, "minblocks": 5, "algorithm": "medium", "perf": 1773.17, "source": "autotuned"},
{"m": 11, "n": 23, "k": 23, "tile_m": 3, "tile_n": 2, "threads": 320, "grouping": 31, "minblocks": 2, "algorithm": "medium", "perf": 1969.81, "source": "autotuned"},
{"m": 12, "n": 3, "k": 3, "tile_m": 1, "tile_n": 1, "threads": 64, "grouping": 16, "minblocks": 3, "algorithm": "medium", "perf": 192.663, "source": "autotuned"},
{"m": 12, "n": 3, "k": 12, "tile_m": 1, "tile_n": 1, "threads": 64, "grouping": 12, "minblocks": 11, "algorithm": "medium", "perf": 641.726, "source": "autotuned"},
{"m": 12, "n": 4, "k": 4, "tile_m": 1, "tile_n": 1, "threads": 64, "grouping": 16, "minblocks": 7, "algorithm": "medium", "perf": 309.312, "source": "autotuned"},
{"m": 12, "n": 4, "k": 12, "tile_m": 1, "tile_n": 1, "threads": 64, "grouping": 16, "minblocks": 17, "algorithm": "medium", "perf": 743.23, "source": "autotuned"},
{"m": 12, "n": 5, "k": 5, "tile_m": 1, "tile_n": 1, "threads": 64, "grouping": 8, "minblocks": 1, "algorithm": "medium", "perf": 542.139, "source": "autotuned"},
{"m": 12, "n": 5, "k": 12, "tile_m": 1, "tile_n": 1, "threads": 64, "grouping": 10, "minblocks": 11, "algorithm": "medium", "perf": 1027.16, "source": "autotuned"},
{"m": 12, "n": 6, "k": 6, "tile_m": 1, "tile_n": 2, "threads": 128, "grouping": 18, "minblocks": 13, "algorithm": "medium", "perf": 643.773, "source": "autotuned"},
{"m": 12, "n": 6, "k": 12, "tile_m": 1, "tile_n": 2, "threads": 128, "grouping": 20, "minblocks": 10, "algorithm": "medium", "perf": 906.348, "source": "autotuned"},
{"m": 12, "n": 7, "k": 7, "tile_m": 2, "tile_n": 1, "threads": 128, "grouping": 20, "minblocks": 16, "algorithm": "medium", "perf": 809.689, "source": "autotuned"},
{"m": 12, "n": 7, "k": 12, "tile_m": 2, "tile_n": 1, "threads": 128, "grouping": 13, "minblocks": 3, "algorithm": "medium", "perf": 1090.56, "source": "autotuned"},
{"m": 12, "n": 12, "k": 3, "tile_m": 1, "tile_n": 3, "threads": 128, "grouping": 10, "minblocks": 2, "algorithm": "medium", "perf": 798.931, "source": "autotuned"},
{"m": 12, "n": 12, "k": 4, "tile_m": 1, "tile_n": 3, "threads": 192, "grouping": 18, "minblocks": 9, "algorithm": "medium", "perf": 917.343, "source": "autotuned"},
{"m": 12, "n": 12, "k": 5, "tile_m": 1, "tile_n": 3, "threads": 192, "grouping": 16, "minblocks": 5, "algorithm": "medium", "perf": 1084.48, "source": "autotuned"},
{"m": 12, "n": 12, "k": 6, "tile_m": 3, "tile_n": 1, "threads": 128, "grouping": 10, "minblocks": 12, "algorithm": "medium", "perf": 1147.44, "source": "autotuned"},
{"m": 12, "n": 12, "k": 7, "tile_m": 3, "tile_n": 1, "threads": 192, "grouping": 18, "minblocks": 8, "algorithm": "medium", "perf": 1182.77, "source": "autotuned"},
{"m": 12, "n": 12, "k": 12, "tile_m": 1, "tile_n": 3, "threads": 192, "grouping": 19, "minblocks": 10, "algorithm": "medium", "perf": 1484.64, "source": "autotuned"},
{"m": 12, "n": 12, "k": 16, "tile_m": 2, "tile_n": 2, "threads": 192, "grouping": 20, "minblocks": 10, "algorithm": "medium", "perf": 1631.09, "source": "autotuned"},
{"m": 12, "n": 12, "k": 23, "tile_m": 1, "tile_n": 3, "threads": 192, "grouping": 25, "minblocks": 5, "algorithm": "medium", "perf": 1629.36, "source": "autotuned"},
{"m": 12, "n": 16, "k": 12, "tile_m": 3, "tile_n": 1, "threads": 192, "grouping": 20, "minblocks": 5, "algorithm": "medium", "perf": 1804.78, "source": "autotuned"},
{"m": 12, "n": 16, "k": 16, "tile_m": 2, "tile_n": 2, "threads": 256, "grouping": 26, "minblocks": 3, "algorithm": "medium", "perf": 2003.56, "source": "autotuned"},
{"m": 12, "n": 23, "k": 12, "tile_m": 2, "tile_n": 3, "threads": 256, "grouping": 21, "minblocks": 7, "algorithm": "medium", "perf": 1787.6, "source": "autotuned"},
{"m": 12, "n": 23, "k": 23, "tile_m": 2, "tile_n": 3, "threads": 320, "grouping": 30, "minblocks": 1, "algorithm": "medium", "perf": 2065.04, "source": "autotuned"},
{"m": 13, "n": 13, "k": 13, "tile_m": 2, "tile_n": 2, "threads": 192, "grouping": 15, "minblocks": 9, "algorithm": "medium", "perf": 1671.24, "source": "autotuned"},
{"m": 13, "n": 13, "k": 23, "tile_m": 2, "tile_n": 2, "threads": 192, "grouping": 26, "minblocks": 6, "algorithm": "medium", "perf": 1771.39, "source": "autotuned"},
{"m": 13, "n": 23, "k": 13, "tile_m": 2, "tile_n": 3, "threads": 320, "grouping": 30, "minblocks": 5, "algorithm": "medium", "perf": 1923.26, "source": "autotuned"},
{"m": 13, "n": 23, "k": 23, "tile_m": 2, "tile_n": 3, "threads": 320, "grouping": 30, "minblocks": 2, "algorithm": "medium", "perf": 2135.27, "source": "autotuned"},
{"m": 14, "n": 14, "k": 14, "tile_m": 2, "tile_n": 2, "threads": 256, "grouping": 20, "minblocks": 4, "algorithm": "medium", "perf": 1768.02, "source": "autotuned"},
{"m": 14, "n": 14, "k": 23, "tile_m": 2, "tile_n": 2, "threads": 256, "grouping": 31, "minblocks": 7, "algorithm": "medium", "perf": 1873.71, "source": "autotuned"},
{"m": 14, "n": 14, "k": 29, "tile_m": 2, "tile_n": 2, "threads": 256, "grouping": 30, "minblocks": 6, "algorithm": "medium", "perf": 1930.65, "source": "autotuned"},
{"m": 14, "n": 14, "k": 32, "tile_m": 2, "tile_n": 2, "threads": 320, "grouping": 31, "minblocks": 3, "algorithm": "medium", "perf": 2050.32, "source": "autotuned"},
{"m": 14, "n": 23, "k": 14, "tile_m": 3, "tile_n": 2, "threads": 384, "grouping": 30, "minblocks": 4, "algorithm": "medium", "perf": 2028.22, "source": "autotuned"},
{"m": 14, "n": 23, "k": 23, "tile_m": 2, "tile_n": 3, "threads": 384, "grouping": 30, "minblocks": 3, "algorithm": "medium", "perf": 2191.81, "source": "autotuned"},
{"m": 14, "n": 29, "k": 14, "tile_m": 2, "tile_n": 2, "threads": 448, "grouping": 19, "minblocks": 1, "algorithm": "medium", "perf": 2174.29, "source": "autotuned"},
{"m": 14, "n": 29, "k": 29, "tile_m": 2, "tile_n": 2, "threads": 448, "grouping": 8, "minblocks": 1, "algorithm": "medium", "perf": 2415.93, "source": "autotuned"},
{"m": 14, "n": 29, "k": 32, "tile_m": 2, "tile_n": 2, "threads": 448, "grouping": 4, "minblocks": 3, "algorithm": "medium", "perf": 2627.22, "source": "autotuned"},
{"m": 14, "n": 32, "k": 14, "tile_m": 2, "tile_n": 2, "threads": 256, "grouping": 29, "minblocks": 1, "algorithm": "medium", "perf": 2394.63, "source": "autotuned"},
{"m": 14, "n": 32, "k": 29, "tile_m": 2, "tile_n": 2, "threads": 512, "grouping": 6, "minblocks": 1, "algorithm": "medium", "perf": 2657.66, "source": "autotuned"},
{"m": 14, "n": 32, "k": 32, "tile_m": 2, "tile_n": 2, "threads": 448, "grouping": 6, "minblocks": 2, "algorithm": "medium", "perf": 2734.11, "source": "autotuned"},
{"m": 15, "n": 15, "k": 15, "tile_m": 2, "tile_n": 2, "threads": 256, "grouping": 22, "minblocks": 1, "algorithm": "medium", "perf": 1891.35, "source": "autotuned"},
{"m": 15, "n": 15, "k": 23, "tile_m": 2, "tile_n": 2, "threads": 256, "grouping": 30, "minblocks": 5, "algorithm": "medium", "perf": 2019.48, "source": "autotuned"},
{"m": 15, "n": 23, "k": 15, "tile_m": 3, "tile_n": 2, "threads": 384, "grouping": 30, "minblocks": 4, "algorithm": "medium", "perf": 2140.57, "source": "autotuned"},
{"m": 15, "n": 23, "k": 23, "tile_m": 3, "tile_n": 2, "threads": 384, "grouping": 30, "minblocks": 1, "algorithm": "medium", "perf": 2301.82, "source": "autotuned"},
{"m": 16, "n": 3, "k": 3, "tile_m": 1, "tile_n": 1, "threads": 64, "grouping": 9, "minblocks": 6, "algorithm": "small", "perf": 271.01, "source": "autotuned"},
{"m": 16, "n": 3, "k": 16, "tile_m": 1, "tile_n": 1, "threads": 64, "grouping": 14, "minblocks": 16, "algorithm": "medium", "perf": 831.372, "source": "autotuned"},
{"m": 16, "n": 4, "k": 4, "tile_m": 1, "tile_n": 1, "threads": 64, "grouping": 16, "minblocks": 8, "algorithm": "medium", "perf": 554.061, "source": "autotuned"},
{"m": 16, "n": 4, "k": 16, "tile_m": 1, "tile_n": 1, "threads": 64, "grouping": 19, "minblocks": 1, "algorithm": "medium", "perf": 1081.08, "source": "autotuned"},
{"m": 16, "n": 5, "k": 5, "tile_m": 2, "tile_n": 1, "threads": 128, "grouping": 16, "minblocks": 2, "algorithm": "medium", "perf": 644.356, "source": "autotuned"},
{"m": 16, "n": 5, "k": 16, "tile_m": 2, "tile_n": 1, "threads": 128, "grouping": 19, "minblocks": 9, "algorithm": "medium", "perf": 1136.45, "source": "autotuned"},
{"m": 16, "n": 6, "k": 6, "tile_m": 2, "tile_n": 1, "threads": 128, "grouping": 18, "minblocks": 1, "algorithm": "medium", "perf": 749.443, "source": "autotuned"},
{"m": 16, "n": 6, "k": 16, "tile_m": 1, "tile_n": 2, "threads": 128, "grouping": 19, "minblocks": 3, "algorithm": "medium", "perf": 1346.31, "source": "autotuned"},
{"m": 16, "n": 7, "k": 7, "tile_m": 2, "tile_n": 1, "threads": 64, "grouping": 12, "minblocks": 3, "algorithm": "medium", "perf": 1107.69, "source": "autotuned"},
{"m": 16, "n": 7, "k": 16, "tile_m": 2, "tile_n": 1, "threads": 128, "grouping": 19, "minblocks": 10, "algorithm": "medium", "perf": 1474.34, "source": "autotuned"},
{"m": 16, "n": 8, "k": 8, "tile_m": 1, "tile_n": 2, "threads": 128, "grouping": 18, "minblocks": 11, "algorithm": "medium", "perf": 1406.39, "source": "autotuned"},
{"m": 16, "n": 8, "k": 16, "tile_m": 2, "tile_n": 1, "threads": 128, "grouping": 26, "minblocks": 11, "algorithm": "medium", "perf": 1698.93, "source": "autotuned"},
{"m": 16, "n": 9, "k": 9, "tile_m": 1, "tile_n": 3, "threads": 192, "grouping": 18, "minblocks": 6, "algorithm": "medium", "perf": 1310.24, "source": "autotuned"},
{"m": 16, "n": 9, "k": 16, "tile_m": 1, "tile_n": 3, "threads": 192, "grouping": 19, "minblocks": 1, "algorithm": "medium", "perf": 1602.73, "source": "autotuned"},
{"m": 16, "n": 10, "k": 10, "tile_m": 2, "tile_n": 2, "threads": 192, "grouping": 20, "minblocks": 6, "algorithm": "medium", "perf": 1460.69, "source": "autotuned"},
{"m": 16, "n": 10, "k": 16, "tile_m": 2, "tile_n": 2, "threads": 192, "grouping": 19, "minblocks": 8, "algorithm": "medium", "perf": 1717.21, "source": "autotuned"},
{"m": 16, "n": 11, "k": 11, "tile_m": 2, "tile_n": 2, "threads": 192, "grouping": 19, "minblocks": 4, "algorithm": "medium", "perf": 1622.85, "source": "autotuned"},
{"m": 16, "n": 11, "k": 16, "tile_m": 1, "tile_n": 3, "threads": 192, "grouping": 19, "minblocks": 9, "algorithm": "medium", "perf": 1807.14, "source": "autotuned"},
{"m": 16, "n": 12, "k": 12, "tile_m": 2, "tile_n": 2, "threads": 192, "grouping": 18, "minblocks": 8, "algorithm": "medium", "perf": 1846.72, "source": "autotuned"},
{"m": 16, "n": 12, "k": 16, "tile_m": 2, "tile_n": 2, "threads": 192, "grouping": 20, "minblocks": 5, "algorithm": "medium", "perf": 1984.15, "source": "autotuned"},
{"m": 16, "n": 16, "k": 3, "tile_m": 2, "tile_n": 2, "threads": 128, "grouping": 11, "minblocks": 13, "algorithm": "medium", "perf": 1177.38, "source": "autotuned"},
{"m": 16, "n": 16, "k": 4, "tile_m": 2, "tile_n": 2, "threads": 128, "grouping": 10, "minblocks": 4, "algorithm": "medium", "perf": 1558.89, "source": "autotuned"},
{"m": 16, "n": 16, "k": 5, "tile_m": 2, "tile_n": 2, "threads": 256, "grouping": 20, "minblocks": 8, "algorithm": "medium", "perf": 1415.67, "source": "autotuned"},
{"m": 16, "n": 16, "k": 6, "tile_m": 2, "tile_n": 2, "threads": 256, "grouping": 20, "minblocks": 1, "algorithm": "medium", "perf": 1847.01, "source": "autotuned"},
{"m": 16, "n": 16, "k": 7, "tile_m": 2, "tile_n": 2, "threads": 256, "grouping": 20, "minblocks": 6, "algorithm": "medium", "perf": 1712.64, "source": "autotuned"},
{"m": 16, "n": 16, "k": 8, "tile_m": 2, "tile_n": 2, "threads": 256, "grouping": 19, "minblocks": 5, "algorithm": "medium", "perf": 2026.67, "source": "autotuned"},
{"m": 16, "n": 16, "k": 9, "tile_m": 2, "tile_n": 2, "threads": 256, "grouping": 19, "minblocks": 4, "algorithm": "medium", "perf": 1843.78, "source": "autotuned"},
{"m": 16, "n": 16, "k": 10, "tile_m": 2, "tile_n": 2, "threads": 256, "grouping": 19, "minblocks": 5, "algorithm": "medium", "perf": 2161.01, "source": "autotuned"},
{"m": 16, "n": 16, "k": 11, "tile_m": 2, "tile_n": 2, "threads": 256, "grouping": 22, "minblocks": 6, "algorithm": "medium", "perf": 1990.73, "source": "autotuned"},
{"m": 16, "n": 16, "k": 12, "tile_m": 2, "tile_n": 2, "threads": 256, "grouping": 20, "minblocks": 2, "algorithm": "medium", "perf": 2230.82, "source": "autotuned"},
{"m": 16, "n": 16, "k": 16, "tile_m": 2, "tile_n": 2, "threads": 256, "grouping": 27, "minblocks": 4, "algorithm": "medium", "perf": 2299.66, "source": "autotuned"},
{"m": 16, "n": 16, "k": 23, "tile_m": 2, "tile_n": 2, "threads": 320, "grouping": 30, "minblocks": 5, "algorithm": "medium", "perf": 2240.89, "source": "autotuned"},
{"m": 16, "n": 23, "k": 16, "tile_m": 2, "tile_n": 3, "threads": 384, "grouping": 32, "minblocks": 3, "algorithm": "medium", "perf": 2338.78, "source": "autotuned"},
{"m": 16, "n": 23, "k": 23, "tile_m": 1, "tile_n": 3, "threads": 192, "grouping": 30, "minblocks": 5, "algorithm": "medium", "perf": 2403.01, "source": "autotuned"},
{"m": 17, "n": 17, "k": 17, "tile_m": 3, "tile_n": 2, "threads": 320, "grouping": 30, "minblocks": 5, "algorithm": "medium", "perf": 2037.81, "source": "autotuned"},
{"m": 17, "n": 17, "k": 23, "tile_m": 2, "tile_n": 3, "threads": 192, "grouping": 25, "minblocks": 5, "algorithm": "medium", "perf": 2136.81, "source": "autotuned"},
{"m": 17, "n": 23, "k": 17, "tile_m": 2, "tile_n": 4, "threads": 256, "grouping": 29, "minblocks": 3, "algorithm": "medium", "perf": 2226.25, "source": "autotuned"},
{"m": 17, "n": 23, "k": 23, "tile_m": 2, "tile_n": 4, "threads": 256, "grouping": 30, "minblocks": 1, "algorithm": "medium", "perf": 2312.55, "source": "autotuned"},
{"m": 18, "n": 18, "k": 18, "tile_m": 2, "tile_n": 3, "threads": 384, "grouping": 30, "minblocks": 4, "algorithm": "medium", "perf": 2226.65, "source": "autotuned"},
{"m": 18, "n": 18, "k": 23, "tile_m": 2, "tile_n": 3, "threads": 384, "grouping": 31, "minblocks": 1, "algorithm": "medium", "perf": 2262.32, "source": "autotuned"},
{"m": 18, "n": 23, "k": 18, "tile_m": 2, "tile_n": 4, "threads": 256, "grouping": 30, "minblocks": 1, "algorithm": "medium", "perf": 2325.84, "source": "autotuned"},
{"m": 18, "n": 23, "k": 23, "tile_m": 6, "tile_n": 2, "threads": 256, "grouping": 25, "minblocks": 3, "algorithm": "medium", "perf": 2424.69, "source": "autotuned"},
{"m": 19, "n": 19, "k": 19, "tile_m": 2, "tile_n": 4, "threads": 384, "grouping": 30, "minblocks": 3, "algorithm": "medium", "perf": 2263.16, "source": "autotuned"},
{"m": 19, "n": 19, "k": 23, "tile_m": 2, "tile_n": 4, "threads": 192, "grouping": 29, "minblocks": 2, "algorithm": "medium", "perf": 2327.58, "source": "autotuned"},
{"m": 19, "n": 23, "k": 19, "tile_m": 2, "tile_n": 4, "threads": 256, "grouping": 30, "minblocks": 2, "algorithm": "medium", "perf": 2406.26, "source": "autotuned"},
{"m": 19, "n": 23, "k": 23, "tile_m": 2, "tile_n": 2, "threads": 256, "grouping": 30, "minblocks": 7, "algorithm": "medium", "perf": 2470.3, "source": "autotuned"},
{"m": 20, "n": 20, "k": 20, "tile_m": 2, "tile_n": 2, "threads": 320, "grouping": 30, "minblocks": 1, "algorithm": "medium", "perf": 2398.36, "source": "autotuned"},
{"m": 20, "n": 20, "k": 23, "tile_m": 2, "tile_n": 2, "threads": 512, "grouping": 19, "minblocks": 2, "algorithm": "medium", "perf": 2424.99, "source": "autotuned"},
{"m": 20, "n": 23, "k": 20, "tile_m": 2, "tile_n": 2, "threads": 256, "grouping": 30, "minblocks": 6, "algorithm": "medium", "perf": 2544.57, "source": "autotuned"},
{"m": 20, "n": 23, "k": 23, "tile_m": 2, "tile_n": 2, "threads": 576, "grouping": 25, "minblocks": 2, "algorithm": "medium", "perf": 2581.28, "source": "autotuned"},
{"m": 22, "n": 22, "k": 22, "tile_m": 2, "tile_n": 2, "threads": 512, "grouping": 19, "minblocks": 4, "algorithm": "medium", "perf": 2627.8, "source": "autotuned"},
{"m": 23, "n": 3, "k": 3, "tile_m": 1, "tile_n": 2, "threads": 64, "grouping": 6, "minblocks": 1, "algorithm": "medium", "perf": 416.91, "source": "autotuned"},
{"m": 23, "n": 3, "k": 23, "tile_m": 1, "tile_n": 2, "threads": 192, "grouping": 30, "minblocks": 4, "algorithm": "medium", "perf": 803.507, "source": "autotuned"},
{"m": 23, "n": 4, "k": 4, "tile_m": 1, "tile_n": 2, "threads": 128, "grouping": 20, "minblocks": 15, "algorithm": "medium", "perf": 504.685, "source": "autotuned"},
{"m": 23, "n": 4, "k": 23, "tile_m": 1, "tile_n": 2, "threads": 192, "grouping": 29, "minblocks": 1, "algorithm": "medium", "perf": 1032.52, "source": "autotuned"},
{"m": 23, "n": 5, "k": 5, "tile_m": 3, "tile_n": 1, "threads": 128, "grouping": 10, "minblocks": 4, "algorithm": "small", "perf": 768.368, "source": "autotuned"},
{"m": 23, "n": 5, "k": 23, "tile_m": 2, "tile_n": 1, "threads": 128, "grouping": 31, "minblocks": 3, "algorithm": "medium", "perf": 1208.14, "source": "autotuned"},
{"m": 23, "n": 6, "k": 6, "tile_m": 3, "tile_n": 1, "threads": 128, "grouping": 11, "minblocks": 16, "algorithm": "medium", "perf": 1008.43, "source": "autotuned"},
{"m": 23, "n": 6, "k": 23, "tile_m": 1, "tile_n": 3, "threads": 192, "grouping": 29, "minblocks": 4, "algorithm": "medium", "perf": 1354.9, "source": "autotuned"},
{"m": 23, "n": 7, "k": 7, "tile_m": 3, "tile_n": 1, "threads": 192, "grouping": 20, "minblocks": 4, "algorithm": "medium", "perf": 1156.79, "source": "autotuned"},
{"m": 23, "n": 7, "k": 23, "tile_m": 3, "tile_n": 1, "threads": 192, "grouping": 30, "minblocks": 6, "algorithm": "medium", "perf": 1518.1, "source": "autotuned"},
{"m": 23, "n": 8, "k": 8, "tile_m": 3, "tile_n": 1, "threads": 192, "grouping": 18, "minblocks": 1, "algorithm": "medium", "perf": 1409.05, "source": "autotuned"},
{"m": 23, "n": 8, "k": 23, "tile_m": 3, "tile_n": 1, "threads": 192, "grouping": 30, "minblocks": 4, "algorithm": "medium", "perf": 1673.24, "source": "autotuned"},
{"m": 23, "n": 9, "k": 9, "tile_m": 2, "tile_n": 2, "threads": 256, "grouping": 20, "minblocks": 8, "algorithm": "medium", "perf": 1467.38, "source": "autotuned"},
{"m": 23, "n": 9, "k": 23, "tile_m": 2, "tile_n": 2, "threads": 320, "grouping": 30, "minblocks": 2, "algorithm": "medium", "perf": 1770.44, "source": "autotuned"},
{"m": 23, "n": 10, "k": 10, "tile_m": 2, "tile_n": 2, "threads": 256, "grouping": 20, "minblocks": 7, "algorithm": "medium", "perf": 1674.46, "source": "autotuned"},
{"m": 23, "n": 10, "k": 23, "tile_m": 2, "tile_n": 2, "threads": 320, "grouping": 30, "minblocks": 4, "algorithm": "medium", "perf": 1923.06, "source": "autotuned"},
{"m": 23, "n": 11, "k": 11, "tile_m": 3, "tile_n": 2, "threads": 256, "grouping": 22, "minblocks": 2, "algorithm": "medium", "perf": 1759.15, "source": "autotuned"},
{"m": 23, "n": 11, "k": 23, "tile_m": 3, "tile_n": 2, "threads": 256, "grouping": 30, "minblocks": 1, "algorithm": "medium", "perf": 1963.18, "source": "autotuned"},
{"m": 23, "n": 12, "k": 12, "tile_m": 2, "tile_n": 3, "threads": 192, "grouping": 25, "minblocks": 10, "algorithm": "medium", "perf": 1778.02, "source": "autotuned"},
{"m": 23, "n": 12, "k": 23, "tile_m": 3, "tile_n": 2, "threads": 320, "grouping": 30, "minblocks": 3, "algorithm": "medium", "perf": 2084.23, "source": "autotuned"},
{"m": 23, "n": 13, "k": 13, "tile_m": 3, "tile_n": 2, "threads": 320, "grouping": 30, "minblocks": 5, "algorithm": "medium", "perf": 1928.04, "source": "autotuned"},
{"m": 23, "n": 13, "k": 23, "tile_m": 3, "tile_n": 2, "threads": 320, "grouping": 30, "minblocks": 2, "algorithm": "medium", "perf": 2135.28, "source": "autotuned"},
{"m": 23, "n": 14, "k": 14, "tile_m": 3, "tile_n": 2, "threads": 384, "grouping": 30, "minblocks": 3, "algorithm": "medium", "perf": 2031.27, "source": "autotuned"},
{"m": 23, "n": 14, "k": 23, "tile_m": 3, "tile_n": 2, "threads": 384, "grouping": 30, "minblocks": 3, "algorithm": "medium", "perf": 2192.88, "source": "autotuned"},
{"m": 23, "n": 15, "k": 15, "tile_m": 2, "tile_n": 3, "threads": 384, "grouping": 30, "minblocks": 1, "algorithm": "medium", "perf": 2165.94, "source": "autotuned"},
{"m": 23, "n": 15, "k": 23, "tile_m": 3, "tile_n": 1, "threads": 384, "grouping": 30, "minblocks": 3, "algorithm": "medium", "perf": 2304.05, "source": "autotuned"},
{"m": 23, "n": 16, "k": 16, "tile_m": 3, "tile_n": 2, "threads": 384, "grouping": 30, "minblocks": 4, "algorithm": "medium", "perf": 2334.13, "source": "autotuned"},
{"m": 23, "n": 16, "k": 23, "tile_m": 3, "tile_n": 1, "threads": 384, "grouping": 30, "minblocks": 5, "algorithm": "medium", "perf": 2403.02, "source": "autotuned"},
{"m": 23, "n": 17, "k": 17, "tile_m": 2, "tile_n": 4, "threads": 256, "grouping": 26, "minblocks": 4, "algorithm": "medium", "perf": 2218.82, "source": "autotuned"},
{"m": 23, "n": 17, "k": 23, "tile_m": 2, "tile_n": 2, "threads": 256, "grouping": 21, "minblocks": 8, "algorithm": "medium", "perf": 2332.53, "source": "autotuned"},
{"m": 23, "n": 18, "k": 18, "tile_m": 2, "tile_n": 4, "threads": 256, "grouping": 30, "minblocks": 4, "algorithm": "medium", "perf": 2330.69, "source": "autotuned"},
{"m": 23, "n": 18, "k": 23, "tile_m": 2, "tile_n": 2, "threads": 256, "grouping": 30, "minblocks": 3, "algorithm": "medium", "perf": 2432.94, "source": "autotuned"},
{"m": 23, "n": 19, "k": 19, "tile_m": 2, "tile_n": 2, "threads": 256, "grouping": 31, "minblocks": 8, "algorithm": "medium", "perf": 2403.93, "source": "autotuned"},
{"m": 23, "n": 19, "k": 23, "tile_m": 2, "tile_n": 2, "threads": 256, "grouping": 30, "minblocks": 1, "algorithm": "medium", "perf": 2478.42, "source": "autotuned"},
{"m": 23, "n": 20, "k": 20, "tile_m": 2, "tile_n": 2, "threads": 256, "grouping": 30, "minblocks": 3, "algorithm": "medium", "perf": 2534.06, "source": "autotuned"},
{"m": 23, "n": 20, "k": 23, "tile_m": 2, "tile_n": 2, "threads": 256, "grouping": 30, "minblocks": 5, "algorithm": "medium", "perf": 2559.43, "source": "autotuned"},
{"m": 23, "n": 23, "k": 3, "tile_m": 3, "tile_n": 1, "threads": 192, "grouping": 16, "minblocks": 3, "algorithm": "medium", "perf": 1254.94, "source": "autotuned"},
{"m": 23, "n": 23, "k": 4, "tile_m": 3, "tile_n": 1, "threads": 192, "grouping": 15, "minblocks": 6, "algorithm": "medium", "perf": 1523.87, "source": "autotuned"},
{"m": 23, "n": 23, "k": 5, "tile_m": 2, "tile_n": 5, "threads": 192, "grouping": 17, "minblocks": 10, "algorithm": "medium", "perf": 1697.4, "source": "autotuned"},
{"m": 23, "n": 23, "k": 6, "tile_m": 3, "tile_n": 2, "threads": 192, "grouping": 17, "minblocks": 1, "algorithm": "medium", "perf": 1810.83, "source": "autotuned"},
{"m": 23, "n": 23, "k": 7, "tile_m": 3, "tile_n": 2, "threads": 192, "grouping": 16, "minblocks": 2, "algorithm": "medium", "perf": 1935.98, "source": "autotuned"},
{"m": 23, "n": 23, "k": 8, "tile_m": 3, "tile_n": 3, "threads": 192, "grouping": 22, "minblocks": 2, "algorithm": "medium", "perf": 2075.16, "source": "autotuned"},
{"m": 23, "n": 23, "k": 9, "tile_m": 3, "tile_n": 2, "threads": 320, "grouping": 32, "minblocks": 3, "algorithm": "medium", "perf": 2137.24, "source": "autotuned"},
{"m": 23, "n": 23, "k": 10, "tile_m": 3, "tile_n": 2, "threads": 384, "grouping": 31, "minblocks": 1, "algorithm": "medium", "perf": 2221.82, "source": "autotuned"},
{"m": 23, "n": 23, "k": 11, "tile_m": 3, "tile_n": 2, "threads": 320, "grouping": 31, "minblocks": 3, "algorithm": "medium", "perf": 2291.66, "source": "autotuned"},
{"m": 23, "n": 23, "k": 12, "tile_m": 3, "tile_n": 2, "threads": 320, "grouping": 32, "minblocks": 5, "algorithm": "medium", "perf": 2340.29, "source": "autotuned"},
{"m": 23, "n": 23, "k": 13, "tile_m": 3, "tile_n": 2, "threads": 384, "grouping": 30, "minblocks": 3, "algorithm": "medium", "perf": 2403.89, "source": "autotuned"},
{"m": 23, "n": 23, "k": 14, "tile_m": 3, "tile_n": 2, "threads": 320, "grouping": 30, "minblocks": 2, "algorithm": "medium", "perf": 2403.99, "source": "autotuned"},
{"m": 23, "n": 23, "k": 15, "tile_m": 3, "tile_n": 2, "threads": 320, "grouping": 30, "minblocks": 3, "algorithm": "medium", "perf": 2457.42, "source": "autotuned"},
{"m": 23, "n": 23, "k": 16, "tile_m": 3, "tile_n": 2, "threads": 320, "grouping": 30, "minblocks": 2, "algorithm": "medium", "perf": 2523.59, "source": "autotuned"},
{"m": 23, "n": 23, "k": 17, "tile_m": 3, "tile_n": 2, "threads": 192, "grouping": 30, "minblocks": 4, "algorithm": "medium", "perf": 2516.3, "source": "autotuned"},
{"m": 23, "n": 23, "k": 18, "tile_m": 3, "tile_n": 2, "threads": 192, "grouping": 29, "minblocks": 1, "algorithm": "medium", "perf": 2508.77, "source": "autotuned"},
{"m": 23, "n": 23, "k": 19, "tile_m": 3, "tile_n": 2, "threads": 192, "grouping": 30, "minblocks": 1, "algorithm": "medium", "perf": 2543.19, "source": "autotuned"},
{"m": 23, "n": 23, "k": 20, "tile_m": 3, "tile_n": 2, "threads": 320, "grouping": 30, "minblocks": 3, "algorithm": "medium", "perf": 2558.41, "source": "autotuned"},
{"m": 23, "n": 23, "k": 23, "tile_m": 3, "tile_n": 2, "threads": 192, "grouping": 30, "minblocks": 3, "algorithm": "medium", "perf": 2633.42, "source": "autotuned"},
{"m": 24, "n": 24, "k": 24, "tile_m": 2, "tile_n": 3, "threads": 384, "grouping": 30, "minblocks": 5, "algorithm": "medium", "perf": 3079.79, "source": "autotuned"},
{"m": 24, "n": 24, "k": 32, "tile_m": 2, "tile_n": 3, "threads": 320, "grouping": 30, "minblocks": 2, "algorithm": "medium", "perf": 3179.83, "source": "autotuned"},
{"m": 24, "n": 32, "k": 24, "tile_m": 2, "tile_n": 4, "threads": 384, "grouping": 30, "minblocks": 2, "algorithm": "medium", "perf": 3430.27, "source": "autotuned"},
{"m": 24, "n": 32, "k": 32, "tile_m": 3, "tile_n": 2, "w": 4, "v": 16, "threads": 128, "grouping": 16, "minblocks": 4, "algorithm": "largeDB2", "perf": 3544.87, "source": "autotuned"},
{"m": 29, "n": 14, "k": 14, "tile_m": 2, "tile_n": 4, "threads": 256, "grouping": 26, "minblocks": 1, "algorithm": "medium", "perf": 2113.67, "source": "autotuned"},
{"m": 29, "n": 14, "k": 29, "tile_m": 4, "tile_n": 2, "w": 10, "v": 8, "threads": 64, "grouping": 16, "minblocks": 2, "algorithm": "largeDB2", "perf": 2313.13, "source": "autotuned"},
{"m": 29, "n": 14, "k": 32, "tile_m": 1, "tile_n": 4, "threads": 256, "grouping": 4, "minblocks": 1, "algorithm": "medium", "perf": 2426.9, "source": "autotuned"},
{"m": 29, "n": 29, "k": 14, "tile_m": 3, "tile_n": 3, "threads": 256, "grouping": 32, "minblocks": 8, "algorithm": "medium", "perf": 2762.54, "source": "autotuned"},
{"m": 29, "n": 29, "k": 29, "tile_m": 3, "tile_n": 3, "w": 8, "v": 16, "threads": 128, "grouping": 16, "minblocks": 4, "algorithm": "largeDB1", "perf": 3268.86, "source": "autotuned"},
{"m": 29, "n": 29, "k": 32, "tile_m": 3, "tile_n": 3, "w": 12, "v": 22, "threads": 128, "grouping": 16, "minblocks": 4, "algorithm": "largeDB1", "perf": 3430.8, "source": "autotuned"},
{"m": 29, "n": 32, "k": 14, "tile_m": 2, "tile_n": 4, "threads": 320, "grouping": 32, "minblocks": 2, "algorithm": "medium", "perf": 3099.21, "source": "autotuned"},
{"m": 29, "n": 32, "k": 29, "tile_m": 3, "tile_n": 3, "w": 4, "v": 20, "threads": 128, "grouping": 16, "minblocks": 2, "algorithm": "largeDB2", "perf": 3632.97, "source": "autotuned"},
{"m": 29, "n": 32, "k": 32, "tile_m": 3, "tile_n": 3, "w": 12, "v": 20, "threads": 128, "grouping": 16, "minblocks": 2, "algorithm": "largeDB1", "perf": 3755.41, "source": "autotuned"},
{"m": 32, "n": 14, "k": 14, "tile_m": 2, "tile_n": 2, "threads": 256, "grouping": 29, "minblocks": 5, "algorithm": "medium", "perf": 2364.55, "source": "autotuned"},
{"m": 32, "n": 14, "k": 29, "tile_m": 2, "tile_n": 2, "threads": 448, "grouping": 5, "minblocks": 2, "algorithm": "medium", "perf": 2643.28, "source": "autotuned"},
{"m": 32, "n": 14, "k": 32, "tile_m": 2, "tile_n": 2, "threads": 576, "grouping": 26, "minblocks": 1, "algorithm": "medium", "perf": 2768.43, "source": "autotuned"},
{"m": 32, "n": 24, "k": 24, "tile_m": 2, "tile_n": 4, "w": 8, "v": 12, "threads": 128, "grouping": 16, "minblocks": 1, "algorithm": "largeDB2", "perf": 3394.48, "source": "autotuned"},
{"m": 32, "n": 24, "k": 32, "tile_m": 2, "tile_n": 4, "w": 8, "v": 20, "threads": 128, "grouping": 16, "minblocks": 1, "algorithm": "largeDB2", "perf": 3594.98, "source": "autotuned"},
{"m": 32, "n": 29, "k": 14, "tile_m": 2, "tile_n": 4, "threads": 320, "grouping": 32, "minblocks": 2, "algorithm": "medium", "perf": 3173.65, "source": "autotuned"},
{"m": 32, "n": 29, "k": 29, "tile_m": 2, "tile_n": 4, "threads": 512, "grouping": 26, "minblocks": 4, "algorithm": "medium", "perf": 3673.46, "source": "autotuned"},
{"m": 32, "n": 29, "k": 32, "tile_m": 2, "tile_n": 4, "threads": 512, "grouping": 26, "minblocks": 3, "algorithm": "medium", "perf": 3801.04, "source": "autotuned"},
{"m": 32, "n": 32, "k": 14, "tile_m": 2, "tile_n": 4, "threads": 256, "grouping": 29, "minblocks": 1, "algorithm": "medium", "perf": 3570.23, "source": "autotuned"},
{"m": 32, "n": 32, "k": 24, "tile_m": 3, "tile_n": 3, "w": 4, "v": 16, "threads": 128, "grouping": 16, "minblocks": 1, "algorithm": "largeDB1", "perf": 3907.32, "source": "autotuned"},
{"m": 32, "n": 32, "k": 29, "tile_m": 3, "tile_n": 3, "w": 4, "v": 20, "threads": 128, "grouping": 16, "minblocks": 8, "algorithm": "largeDB2", "perf": 4075.72, "source": "autotuned"},
{"m": 32, "n": 32, "k": 32, "tile_m": 3, "tile_n": 3, "w": 4, "v": 16, "threads": 128, "grouping": 16, "minblocks": 2, "algorithm": "largeDB2", "perf": 4179.99, "source": "autotuned"},
{"m": 72, "n": 72, "k": 72, "tile_m": 5, "tile_n": 6, "w": 8, "v": 28, "threads": 192, "grouping": 16, "minblocks": 1, "algorithm": "largeDB2", "perf": 8144.64, "source": "autotuned"}
]