src/acc/libsmm_acc/parameters/parameters_A100.json
[
{"m": 4, "n": 4, "k": 4, "tile_m": 1, "tile_n": 1, "threads": 32, "grouping": 5, "minblocks": 9, "algorithm": "medium", "perf": 300.325, "source": "autotuned"},
{"m": 4, "n": 4, "k": 5, "tile_m": 1, "tile_n": 1, "threads": 32, "grouping": 8, "minblocks": 1, "algorithm": "medium", "perf": 364.6, "source": "autotuned"},
{"m": 4, "n": 4, "k": 6, "tile_m": 1, "tile_n": 1, "threads": 32, "grouping": 10, "minblocks": 13, "algorithm": "medium", "perf": 424.969, "source": "autotuned"},
{"m": 4, "n": 4, "k": 7, "tile_m": 1, "tile_n": 1, "threads": 32, "grouping": 5, "minblocks": 14, "algorithm": "medium", "perf": 459.363, "source": "autotuned"},
{"m": 4, "n": 4, "k": 8, "threads": 32, "grouping": 7, "minblocks": 3, "algorithm": "tiny", "perf": 491.293, "source": "autotuned"},
{"m": 4, "n": 4, "k": 9, "tile_m": 1, "tile_n": 1, "threads": 64, "grouping": 4, "minblocks": 24, "algorithm": "medium", "perf": 472.099, "source": "autotuned"},
{"m": 4, "n": 4, "k": 10, "tile_m": 1, "tile_n": 1, "threads": 64, "grouping": 4, "minblocks": 24, "algorithm": "medium", "perf": 508.633, "source": "autotuned"},
{"m": 4, "n": 4, "k": 13, "tile_m": 1, "tile_n": 1, "threads": 64, "grouping": 5, "minblocks": 7, "algorithm": "medium", "perf": 590.199, "source": "autotuned"},
{"m": 4, "n": 4, "k": 15, "tile_m": 1, "tile_n": 1, "threads": 64, "grouping": 3, "minblocks": 27, "algorithm": "medium", "perf": 651.289, "source": "autotuned"},
{"m": 4, "n": 4, "k": 22, "tile_m": 1, "tile_n": 1, "threads": 32, "grouping": 3, "minblocks": 11, "algorithm": "small", "perf": 782.765, "source": "autotuned"},
{"m": 4, "n": 4, "k": 23, "tile_m": 1, "tile_n": 1, "threads": 32, "grouping": 3, "minblocks": 6, "algorithm": "small", "perf": 800.883, "source": "autotuned"},
{"m": 4, "n": 4, "k": 25, "tile_m": 1, "tile_n": 1, "threads": 128, "grouping": 3, "minblocks": 13, "algorithm": "medium", "perf": 741.149, "source": "autotuned"},
{"m": 4, "n": 4, "k": 26, "tile_m": 1, "tile_n": 1, "threads": 64, "grouping": 2, "minblocks": 27, "algorithm": "small", "perf": 760.471, "source": "autotuned"},
{"m": 4, "n": 4, "k": 28, "tile_m": 1, "tile_n": 1, "threads": 128, "grouping": 3, "minblocks": 13, "algorithm": "medium", "perf": 792.7, "source": "autotuned"},
{"m": 4, "n": 4, "k": 32, "tile_m": 1, "tile_n": 1, "threads": 32, "grouping": 2, "minblocks": 13, "algorithm": "small", "perf": 912.399, "source": "autotuned"},
{"m": 4, "n": 4, "k": 45, "tile_m": 1, "tile_n": 1, "threads": 32, "grouping": 2, "minblocks": 15, "algorithm": "medium", "perf": 865.655, "source": "autotuned"},
{"m": 4, "n": 5, "k": 4, "tile_m": 1, "tile_n": 1, "threads": 32, "grouping": 7, "minblocks": 2, "algorithm": "medium", "perf": 361.894, "source": "autotuned"},
{"m": 4, "n": 5, "k": 5, "tile_m": 1, "tile_n": 1, "threads": 32, "grouping": 8, "minblocks": 13, "algorithm": "medium", "perf": 446.058, "source": "autotuned"},
{"m": 4, "n": 5, "k": 6, "tile_m": 2, "tile_n": 1, "threads": 32, "grouping": 5, "minblocks": 11, "algorithm": "medium", "perf": 509.297, "source": "autotuned"},
{"m": 4, "n": 5, "k": 7, "tile_m": 2, "tile_n": 1, "threads": 64, "grouping": 13, "minblocks": 5, "algorithm": "medium", "perf": 478.497, "source": "autotuned"},
{"m": 4, "n": 5, "k": 8, "tile_m": 2, "tile_n": 1, "threads": 64, "grouping": 13, "minblocks": 10, "algorithm": "medium", "perf": 526.48, "source": "autotuned"},
{"m": 4, "n": 5, "k": 9, "tile_m": 2, "tile_n": 1, "threads": 64, "grouping": 13, "minblocks": 15, "algorithm": "medium", "perf": 570.112, "source": "autotuned"},
{"m": 4, "n": 5, "k": 13, "tile_m": 2, "tile_n": 1, "threads": 96, "grouping": 13, "minblocks": 13, "algorithm": "medium", "perf": 650.203, "source": "autotuned"},
{"m": 4, "n": 5, "k": 22, "tile_m": 2, "tile_n": 1, "threads": 128, "grouping": 13, "minblocks": 12, "algorithm": "medium", "perf": 826.438, "source": "autotuned"},
{"m": 4, "n": 5, "k": 23, "tile_m": 2, "tile_n": 1, "threads": 128, "grouping": 13, "minblocks": 12, "algorithm": "medium", "perf": 838.545, "source": "autotuned"},
{"m": 4, "n": 5, "k": 25, "tile_m": 2, "tile_n": 1, "threads": 128, "grouping": 13, "minblocks": 12, "algorithm": "medium", "perf": 872.203, "source": "autotuned"},
{"m": 4, "n": 5, "k": 26, "tile_m": 2, "tile_n": 1, "threads": 32, "grouping": 4, "minblocks": 27, "algorithm": "medium", "perf": 816.155, "source": "autotuned"},
{"m": 4, "n": 5, "k": 28, "tile_m": 2, "tile_n": 1, "threads": 32, "grouping": 4, "minblocks": 26, "algorithm": "medium", "perf": 850.155, "source": "autotuned"},
{"m": 4, "n": 5, "k": 32, "tile_m": 2, "tile_n": 1, "threads": 32, "grouping": 4, "minblocks": 25, "algorithm": "medium", "perf": 890.208, "source": "autotuned"},
{"m": 4, "n": 5, "k": 45, "tile_m": 1, "tile_n": 1, "threads": 256, "grouping": 19, "minblocks": 8, "algorithm": "medium", "perf": 889.877, "source": "autotuned"},
{"m": 4, "n": 6, "k": 4, "tile_m": 1, "tile_n": 1, "threads": 32, "grouping": 7, "minblocks": 1, "algorithm": "medium", "perf": 439.326, "source": "autotuned"},
{"m": 4, "n": 6, "k": 5, "tile_m": 1, "tile_n": 1, "threads": 32, "grouping": 8, "minblocks": 1, "algorithm": "medium", "perf": 527.905, "source": "autotuned"},
{"m": 4, "n": 6, "k": 6, "tile_m": 2, "tile_n": 1, "threads": 64, "grouping": 13, "minblocks": 18, "algorithm": "medium", "perf": 506.703, "source": "autotuned"},
{"m": 4, "n": 6, "k": 7, "tile_m": 2, "tile_n": 1, "threads": 64, "grouping": 13, "minblocks": 2, "algorithm": "medium", "perf": 571.502, "source": "autotuned"},
{"m": 4, "n": 6, "k": 8, "tile_m": 2, "tile_n": 1, "threads": 64, "grouping": 13, "minblocks": 15, "algorithm": "medium", "perf": 636.414, "source": "autotuned"},
{"m": 4, "n": 6, "k": 9, "tile_m": 2, "tile_n": 1, "threads": 64, "grouping": 13, "minblocks": 5, "algorithm": "medium", "perf": 676.398, "source": "autotuned"},
{"m": 4, "n": 7, "k": 4, "tile_m": 1, "tile_n": 1, "threads": 32, "grouping": 6, "minblocks": 16, "algorithm": "medium", "perf": 508.667, "source": "autotuned"},
{"m": 4, "n": 7, "k": 5, "tile_m": 2, "tile_n": 1, "threads": 64, "grouping": 13, "minblocks": 6, "algorithm": "medium", "perf": 509.812, "source": "autotuned"},
{"m": 4, "n": 7, "k": 6, "tile_m": 2, "tile_n": 1, "threads": 64, "grouping": 13, "minblocks": 4, "algorithm": "medium", "perf": 586.156, "source": "autotuned"},
{"m": 4, "n": 7, "k": 7, "tile_m": 2, "tile_n": 1, "threads": 64, "grouping": 13, "minblocks": 1, "algorithm": "medium", "perf": 654.23, "source": "autotuned"},
{"m": 4, "n": 7, "k": 8, "tile_m": 2, "tile_n": 1, "threads": 64, "grouping": 13, "minblocks": 9, "algorithm": "medium", "perf": 728.016, "source": "autotuned"},
{"m": 4, "n": 7, "k": 13, "tile_m": 2, "tile_n": 1, "threads": 96, "grouping": 8, "minblocks": 19, "algorithm": "medium", "perf": 891.408, "source": "autotuned"},
{"m": 4, "n": 7, "k": 25, "tile_m": 2, "tile_n": 1, "threads": 32, "grouping": 8, "minblocks": 9, "algorithm": "medium", "perf": 1047.86, "source": "autotuned"},
{"m": 4, "n": 7, "k": 26, "tile_m": 2, "tile_n": 1, "threads": 32, "grouping": 8, "minblocks": 22, "algorithm": "medium", "perf": 1071.66, "source": "autotuned"},
{"m": 4, "n": 7, "k": 28, "tile_m": 2, "tile_n": 1, "threads": 32, "grouping": 8, "minblocks": 21, "algorithm": "medium", "perf": 1068.65, "source": "autotuned"},
{"m": 4, "n": 7, "k": 32, "tile_m": 2, "tile_n": 1, "threads": 32, "grouping": 4, "minblocks": 22, "algorithm": "medium", "perf": 1130.79, "source": "autotuned"},
{"m": 4, "n": 7, "k": 45, "tile_m": 2, "tile_n": 1, "w": 16, "v": 4, "threads": 32, "grouping": 16, "minblocks": 8, "algorithm": "largeDB2", "perf": 1111.24, "source": "autotuned"},
{"m": 4, "n": 8, "k": 4, "tile_m": 1, "tile_n": 1, "threads": 32, "grouping": 5, "minblocks": 25, "algorithm": "medium", "perf": 474.476, "source": "autotuned"},
{"m": 4, "n": 8, "k": 5, "tile_m": 2, "tile_n": 1, "threads": 64, "grouping": 13, "minblocks": 2, "algorithm": "medium", "perf": 581.404, "source": "autotuned"},
{"m": 4, "n": 8, "k": 6, "tile_m": 2, "tile_n": 1, "threads": 64, "grouping": 13, "minblocks": 6, "algorithm": "medium", "perf": 673.786, "source": "autotuned"},
{"m": 4, "n": 8, "k": 7, "tile_m": 2, "tile_n": 1, "threads": 64, "grouping": 13, "minblocks": 1, "algorithm": "medium", "perf": 755.138, "source": "autotuned"},
{"m": 4, "n": 8, "k": 8, "tile_m": 2, "tile_n": 1, "threads": 64, "grouping": 5, "minblocks": 32, "algorithm": "small", "perf": 748.772, "source": "autotuned"},
{"m": 4, "n": 8, "k": 9, "tile_m": 2, "tile_n": 1, "threads": 96, "grouping": 13, "minblocks": 16, "algorithm": "medium", "perf": 804.825, "source": "autotuned"},
{"m": 4, "n": 9, "k": 4, "tile_m": 2, "tile_n": 1, "threads": 64, "grouping": 13, "minblocks": 6, "algorithm": "medium", "perf": 532.491, "source": "autotuned"},
{"m": 4, "n": 9, "k": 5, "tile_m": 2, "tile_n": 1, "threads": 64, "grouping": 13, "minblocks": 22, "algorithm": "medium", "perf": 625.195, "source": "autotuned"},
{"m": 4, "n": 9, "k": 6, "tile_m": 2, "tile_n": 1, "threads": 64, "grouping": 13, "minblocks": 19, "algorithm": "medium", "perf": 711.405, "source": "autotuned"},
{"m": 4, "n": 9, "k": 7, "tile_m": 2, "tile_n": 1, "threads": 64, "grouping": 13, "minblocks": 19, "algorithm": "medium", "perf": 787.746, "source": "autotuned"},
{"m": 4, "n": 9, "k": 8, "tile_m": 2, "tile_n": 1, "threads": 32, "grouping": 5, "minblocks": 7, "algorithm": "small", "perf": 790.043, "source": "autotuned"},
{"m": 4, "n": 9, "k": 9, "tile_m": 2, "tile_n": 1, "threads": 96, "grouping": 13, "minblocks": 14, "algorithm": "medium", "perf": 834.86, "source": "autotuned"},
{"m": 4, "n": 9, "k": 13, "tile_m": 2, "tile_n": 1, "threads": 64, "grouping": 8, "minblocks": 21, "algorithm": "medium", "perf": 1008.94, "source": "autotuned"},
{"m": 4, "n": 9, "k": 22, "tile_m": 2, "tile_n": 1, "threads": 96, "grouping": 8, "minblocks": 17, "algorithm": "medium", "perf": 1156.9, "source": "autotuned"},
{"m": 4, "n": 9, "k": 23, "tile_m": 2, "tile_n": 1, "threads": 96, "grouping": 8, "minblocks": 18, "algorithm": "medium", "perf": 1176.5, "source": "autotuned"},
{"m": 4, "n": 9, "k": 25, "tile_m": 2, "tile_n": 1, "threads": 32, "grouping": 8, "minblocks": 23, "algorithm": "medium", "perf": 1157.4, "source": "autotuned"},
{"m": 4, "n": 9, "k": 26, "tile_m": 2, "tile_n": 1, "threads": 32, "grouping": 8, "minblocks": 23, "algorithm": "medium", "perf": 1181.27, "source": "autotuned"},
{"m": 4, "n": 9, "k": 28, "tile_m": 2, "tile_n": 1, "threads": 32, "grouping": 8, "minblocks": 21, "algorithm": "medium", "perf": 1208.05, "source": "autotuned"},
{"m": 4, "n": 9, "k": 32, "tile_m": 2, "tile_n": 1, "threads": 32, "grouping": 8, "minblocks": 17, "algorithm": "medium", "perf": 1272.48, "source": "autotuned"},
{"m": 4, "n": 9, "k": 45, "tile_m": 2, "tile_n": 1, "w": 16, "v": 6, "threads": 32, "grouping": 16, "minblocks": 1, "algorithm": "largeDB2", "perf": 1235.14, "source": "autotuned"},
{"m": 4, "n": 10, "k": 4, "tile_m": 2, "tile_n": 1, "threads": 64, "grouping": 13, "minblocks": 18, "algorithm": "medium", "perf": 594.698, "source": "autotuned"},
{"m": 4, "n": 10, "k": 10, "tile_m": 2, "tile_n": 1, "threads": 64, "grouping": 8, "minblocks": 22, "algorithm": "medium", "perf": 952.386, "source": "autotuned"},
{"m": 4, "n": 10, "k": 15, "tile_m": 2, "tile_n": 1, "threads": 64, "grouping": 8, "minblocks": 21, "algorithm": "medium", "perf": 1150.67, "source": "autotuned"},
{"m": 4, "n": 13, "k": 4, "tile_m": 2, "tile_n": 1, "threads": 64, "grouping": 13, "minblocks": 8, "algorithm": "medium", "perf": 751.68, "source": "autotuned"},
{"m": 4, "n": 13, "k": 5, "tile_m": 2, "tile_n": 1, "threads": 32, "grouping": 8, "minblocks": 2, "algorithm": "medium", "perf": 801.072, "source": "autotuned"},
{"m": 4, "n": 13, "k": 7, "tile_m": 2, "tile_n": 1, "threads": 32, "grouping": 8, "minblocks": 10, "algorithm": "medium", "perf": 1026.18, "source": "autotuned"},
{"m": 4, "n": 13, "k": 9, "tile_m": 2, "tile_n": 1, "threads": 64, "grouping": 8, "minblocks": 22, "algorithm": "medium", "perf": 1118.73, "source": "autotuned"},
{"m": 4, "n": 13, "k": 13, "tile_m": 2, "tile_n": 1, "threads": 64, "grouping": 8, "minblocks": 25, "algorithm": "medium", "perf": 1344.06, "source": "autotuned"},
{"m": 4, "n": 13, "k": 22, "tile_m": 2, "tile_n": 1, "threads": 96, "grouping": 8, "minblocks": 17, "algorithm": "medium", "perf": 1521.75, "source": "autotuned"},
{"m": 4, "n": 13, "k": 23, "tile_m": 2, "tile_n": 1, "threads": 96, "grouping": 8, "minblocks": 17, "algorithm": "medium", "perf": 1460.42, "source": "autotuned"},
{"m": 4, "n": 13, "k": 25, "tile_m": 2, "tile_n": 1, "threads": 32, "grouping": 8, "minblocks": 17, "algorithm": "medium", "perf": 1462.96, "source": "autotuned"},
{"m": 4, "n": 13, "k": 26, "tile_m": 2, "tile_n": 1, "threads": 32, "grouping": 8, "minblocks": 17, "algorithm": "medium", "perf": 1491.64, "source": "autotuned"},
{"m": 4, "n": 13, "k": 28, "tile_m": 2, "tile_n": 1, "threads": 128, "grouping": 13, "minblocks": 12, "algorithm": "medium", "perf": 1480.14, "source": "autotuned"},
{"m": 4, "n": 13, "k": 32, "tile_m": 2, "tile_n": 1, "threads": 32, "grouping": 10, "minblocks": 1, "algorithm": "medium", "perf": 1456.45, "source": "autotuned"},
{"m": 4, "n": 13, "k": 45, "tile_m": 2, "tile_n": 1, "threads": 32, "grouping": 5, "minblocks": 10, "algorithm": "medium", "perf": 1423.11, "source": "autotuned"},
{"m": 4, "n": 15, "k": 4, "tile_m": 2, "tile_n": 1, "threads": 64, "grouping": 13, "minblocks": 10, "algorithm": "medium", "perf": 863.101, "source": "autotuned"},
{"m": 4, "n": 15, "k": 10, "tile_m": 2, "tile_n": 1, "threads": 64, "grouping": 8, "minblocks": 24, "algorithm": "medium", "perf": 1284.65, "source": "autotuned"},
{"m": 4, "n": 15, "k": 15, "tile_m": 2, "tile_n": 1, "threads": 64, "grouping": 8, "minblocks": 22, "algorithm": "medium", "perf": 1523.91, "source": "autotuned"},
{"m": 4, "n": 22, "k": 4, "tile_m": 2, "tile_n": 2, "threads": 32, "grouping": 8, "minblocks": 26, "algorithm": "medium", "perf": 1008.17, "source": "autotuned"},
{"m": 4, "n": 22, "k": 5, "tile_m": 2, "tile_n": 2, "threads": 32, "grouping": 8, "minblocks": 5, "algorithm": "medium", "perf": 1132.71, "source": "autotuned"},
{"m": 4, "n": 22, "k": 9, "tile_m": 2, "tile_n": 2, "threads": 64, "grouping": 13, "minblocks": 15, "algorithm": "medium", "perf": 1428.33, "source": "autotuned"},
{"m": 4, "n": 22, "k": 13, "tile_m": 2, "tile_n": 2, "threads": 32, "grouping": 8, "minblocks": 17, "algorithm": "medium", "perf": 1625.51, "source": "autotuned"},
{"m": 4, "n": 22, "k": 22, "tile_m": 2, "tile_n": 2, "threads": 96, "grouping": 13, "minblocks": 11, "algorithm": "medium", "perf": 1585.65, "source": "autotuned"},
{"m": 4, "n": 22, "k": 23, "tile_m": 1, "tile_n": 3, "threads": 128, "grouping": 15, "minblocks": 10, "algorithm": "medium", "perf": 1568.67, "source": "autotuned"},
{"m": 4, "n": 22, "k": 26, "tile_m": 1, "tile_n": 3, "threads": 128, "grouping": 15, "minblocks": 10, "algorithm": "medium", "perf": 1528.26, "source": "autotuned"},
{"m": 4, "n": 23, "k": 4, "tile_m": 1, "tile_n": 3, "threads": 96, "grouping": 15, "minblocks": 15, "algorithm": "medium", "perf": 1051.58, "source": "autotuned"},
{"m": 4, "n": 23, "k": 5, "tile_m": 1, "tile_n": 3, "threads": 32, "grouping": 10, "minblocks": 20, "algorithm": "medium", "perf": 1141.9, "source": "autotuned"},
{"m": 4, "n": 23, "k": 13, "tile_m": 1, "tile_n": 3, "threads": 64, "grouping": 10, "minblocks": 19, "algorithm": "medium", "perf": 1618.47, "source": "autotuned"},
{"m": 4, "n": 23, "k": 22, "tile_m": 2, "tile_n": 2, "threads": 96, "grouping": 13, "minblocks": 12, "algorithm": "medium", "perf": 1595.04, "source": "autotuned"},
{"m": 4, "n": 23, "k": 23, "tile_m": 2, "tile_n": 2, "threads": 96, "grouping": 13, "minblocks": 11, "algorithm": "medium", "perf": 1590.04, "source": "autotuned"},
{"m": 4, "n": 23, "k": 26, "tile_m": 1, "tile_n": 3, "threads": 32, "grouping": 10, "minblocks": 11, "algorithm": "medium", "perf": 1570.87, "source": "autotuned"},
{"m": 4, "n": 25, "k": 4, "tile_m": 2, "tile_n": 2, "threads": 32, "grouping": 9, "minblocks": 6, "algorithm": "medium", "perf": 1030.91, "source": "autotuned"},
{"m": 4, "n": 25, "k": 5, "tile_m": 2, "tile_n": 2, "threads": 32, "grouping": 9, "minblocks": 9, "algorithm": "medium", "perf": 1191.3, "source": "autotuned"},
{"m": 4, "n": 25, "k": 7, "tile_m": 2, "tile_n": 2, "threads": 64, "grouping": 8, "minblocks": 21, "algorithm": "medium", "perf": 1398.46, "source": "autotuned"},
{"m": 4, "n": 25, "k": 9, "tile_m": 2, "tile_n": 2, "threads": 64, "grouping": 8, "minblocks": 22, "algorithm": "medium", "perf": 1517.59, "source": "autotuned"},
{"m": 4, "n": 25, "k": 13, "tile_m": 2, "tile_n": 2, "threads": 64, "grouping": 8, "minblocks": 19, "algorithm": "medium", "perf": 1632.76, "source": "autotuned"},
{"m": 4, "n": 25, "k": 25, "tile_m": 2, "tile_n": 2, "threads": 32, "grouping": 13, "minblocks": 8, "algorithm": "medium", "perf": 1569.27, "source": "autotuned"},
{"m": 4, "n": 25, "k": 26, "tile_m": 2, "tile_n": 2, "threads": 32, "grouping": 13, "minblocks": 2, "algorithm": "medium", "perf": 1548.1, "source": "autotuned"},
{"m": 4, "n": 25, "k": 28, "tile_m": 2, "tile_n": 2, "threads": 32, "grouping": 13, "minblocks": 3, "algorithm": "medium", "perf": 1542.33, "source": "autotuned"},
{"m": 4, "n": 25, "k": 32, "tile_m": 2, "tile_n": 2, "threads": 32, "grouping": 13, "minblocks": 1, "algorithm": "medium", "perf": 1531.09, "source": "autotuned"},
{"m": 4, "n": 25, "k": 45, "tile_m": 2, "tile_n": 2, "w": 16, "v": 24, "threads": 32, "grouping": 16, "minblocks": 1, "algorithm": "largeDB2", "perf": 1406.69, "source": "autotuned"},
{"m": 4, "n": 26, "k": 4, "tile_m": 2, "tile_n": 2, "threads": 32, "grouping": 9, "minblocks": 4, "algorithm": "medium", "perf": 1111.46, "source": "autotuned"},
{"m": 4, "n": 26, "k": 5, "tile_m": 2, "tile_n": 2, "threads": 32, "grouping": 9, "minblocks": 9, "algorithm": "medium", "perf": 1219.13, "source": "autotuned"},
{"m": 4, "n": 26, "k": 7, "tile_m": 2, "tile_n": 2, "threads": 64, "grouping": 8, "minblocks": 22, "algorithm": "medium", "perf": 1482.26, "source": "autotuned"},
{"m": 4, "n": 26, "k": 9, "tile_m": 2, "tile_n": 2, "threads": 64, "grouping": 8, "minblocks": 19, "algorithm": "medium", "perf": 1639.52, "source": "autotuned"},
{"m": 4, "n": 26, "k": 13, "tile_m": 2, "tile_n": 2, "threads": 64, "grouping": 8, "minblocks": 19, "algorithm": "medium", "perf": 1736.84, "source": "autotuned"},
{"m": 4, "n": 26, "k": 22, "tile_m": 2, "tile_n": 2, "threads": 96, "grouping": 13, "minblocks": 11, "algorithm": "medium", "perf": 1618.15, "source": "autotuned"},
{"m": 4, "n": 26, "k": 23, "tile_m": 2, "tile_n": 2, "threads": 32, "grouping": 13, "minblocks": 5, "algorithm": "medium", "perf": 1597.72, "source": "autotuned"},
{"m": 4, "n": 26, "k": 25, "tile_m": 2, "tile_n": 2, "threads": 32, "grouping": 13, "minblocks": 3, "algorithm": "medium", "perf": 1570.54, "source": "autotuned"},
{"m": 4, "n": 26, "k": 26, "tile_m": 2, "tile_n": 2, "threads": 32, "grouping": 13, "minblocks": 1, "algorithm": "medium", "perf": 1572.58, "source": "autotuned"},
{"m": 4, "n": 26, "k": 28, "tile_m": 2, "tile_n": 2, "threads": 32, "grouping": 13, "minblocks": 8, "algorithm": "medium", "perf": 1562.72, "source": "autotuned"},
{"m": 4, "n": 26, "k": 32, "tile_m": 2, "tile_n": 2, "threads": 32, "grouping": 4, "minblocks": 4, "algorithm": "medium", "perf": 1537.43, "source": "autotuned"},
{"m": 4, "n": 26, "k": 45, "tile_m": 2, "tile_n": 1, "threads": 64, "grouping": 4, "minblocks": 2, "algorithm": "medium", "perf": 1415.76, "source": "autotuned"},
{"m": 4, "n": 28, "k": 4, "tile_m": 2, "tile_n": 2, "threads": 32, "grouping": 8, "minblocks": 10, "algorithm": "medium", "perf": 1192.8, "source": "autotuned"},
{"m": 4, "n": 28, "k": 5, "tile_m": 2, "tile_n": 2, "threads": 32, "grouping": 8, "minblocks": 25, "algorithm": "medium", "perf": 1323.44, "source": "autotuned"},
{"m": 4, "n": 28, "k": 7, "tile_m": 2, "tile_n": 2, "threads": 32, "grouping": 8, "minblocks": 21, "algorithm": "medium", "perf": 1544.6, "source": "autotuned"},
{"m": 4, "n": 28, "k": 9, "tile_m": 2, "tile_n": 2, "threads": 64, "grouping": 8, "minblocks": 20, "algorithm": "medium", "perf": 1750.55, "source": "autotuned"},
{"m": 4, "n": 28, "k": 13, "tile_m": 2, "tile_n": 2, "threads": 64, "grouping": 8, "minblocks": 19, "algorithm": "medium", "perf": 1857.72, "source": "autotuned"},
{"m": 4, "n": 28, "k": 25, "tile_m": 2, "tile_n": 2, "threads": 32, "grouping": 13, "minblocks": 7, "algorithm": "medium", "perf": 1570.0, "source": "autotuned"},
{"m": 4, "n": 28, "k": 26, "tile_m": 2, "tile_n": 2, "threads": 32, "grouping": 13, "minblocks": 1, "algorithm": "medium", "perf": 1576.25, "source": "autotuned"},
{"m": 4, "n": 28, "k": 28, "tile_m": 2, "tile_n": 2, "threads": 32, "grouping": 13, "minblocks": 2, "algorithm": "medium", "perf": 1581.14, "source": "autotuned"},
{"m": 4, "n": 28, "k": 32, "tile_m": 2, "tile_n": 2, "threads": 32, "grouping": 4, "minblocks": 4, "algorithm": "medium", "perf": 1527.75, "source": "autotuned"},
{"m": 4, "n": 28, "k": 45, "tile_m": 2, "tile_n": 2, "w": 16, "v": 28, "threads": 32, "grouping": 16, "minblocks": 1, "algorithm": "largeDB2", "perf": 1415.11, "source": "autotuned"},
{"m": 4, "n": 32, "k": 4, "tile_m": 2, "tile_n": 2, "threads": 32, "grouping": 5, "minblocks": 3, "algorithm": "small", "perf": 1352.54, "source": "autotuned"},
{"m": 4, "n": 32, "k": 5, "tile_m": 2, "tile_n": 2, "threads": 32, "grouping": 8, "minblocks": 25, "algorithm": "medium", "perf": 1473.33, "source": "autotuned"},
{"m": 4, "n": 32, "k": 7, "tile_m": 2, "tile_n": 2, "threads": 32, "grouping": 8, "minblocks": 23, "algorithm": "medium", "perf": 1717.52, "source": "autotuned"},
{"m": 4, "n": 32, "k": 9, "tile_m": 2, "tile_n": 2, "threads": 64, "grouping": 8, "minblocks": 20, "algorithm": "medium", "perf": 1818.75, "source": "autotuned"},
{"m": 4, "n": 32, "k": 13, "tile_m": 2, "tile_n": 2, "threads": 64, "grouping": 9, "minblocks": 17, "algorithm": "medium", "perf": 1896.43, "source": "autotuned"},
{"m": 4, "n": 32, "k": 25, "tile_m": 2, "tile_n": 2, "threads": 32, "grouping": 13, "minblocks": 1, "algorithm": "medium", "perf": 1579.44, "source": "autotuned"},
{"m": 4, "n": 32, "k": 26, "tile_m": 2, "tile_n": 2, "threads": 32, "grouping": 13, "minblocks": 6, "algorithm": "medium", "perf": 1568.33, "source": "autotuned"},
{"m": 4, "n": 32, "k": 28, "tile_m": 2, "tile_n": 2, "threads": 32, "grouping": 16, "minblocks": 5, "algorithm": "medium", "perf": 1548.87, "source": "autotuned"},
{"m": 4, "n": 32, "k": 32, "tile_m": 2, "tile_n": 2, "threads": 32, "grouping": 3, "minblocks": 1, "algorithm": "medium", "perf": 1512.28, "source": "autotuned"},
{"m": 4, "n": 32, "k": 45, "tile_m": 1, "tile_n": 2, "w": 16, "v": 32, "threads": 64, "grouping": 16, "minblocks": 2, "algorithm": "largeDB2", "perf": 1421.5, "source": "autotuned"},
{"m": 4, "n": 45, "k": 4, "tile_m": 2, "tile_n": 3, "threads": 32, "grouping": 10, "minblocks": 4, "algorithm": "medium", "perf": 1568.11, "source": "autotuned"},
{"m": 4, "n": 45, "k": 5, "tile_m": 2, "tile_n": 3, "threads": 32, "grouping": 10, "minblocks": 24, "algorithm": "medium", "perf": 1709.06, "source": "autotuned"},
{"m": 4, "n": 45, "k": 7, "tile_m": 2, "tile_n": 3, "threads": 32, "grouping": 8, "minblocks": 22, "algorithm": "medium", "perf": 2025.63, "source": "autotuned"},
{"m": 4, "n": 45, "k": 9, "tile_m": 2, "tile_n": 3, "threads": 64, "grouping": 10, "minblocks": 15, "algorithm": "medium", "perf": 1895.65, "source": "autotuned"},
{"m": 4, "n": 45, "k": 13, "tile_m": 2, "tile_n": 3, "threads": 64, "grouping": 13, "minblocks": 11, "algorithm": "medium", "perf": 1677.7, "source": "autotuned"},
{"m": 4, "n": 45, "k": 25, "tile_m": 2, "tile_n": 1, "w": 10, "v": 24, "threads": 96, "grouping": 16, "minblocks": 12, "algorithm": "largeDB2", "perf": 1485.94, "source": "autotuned"},
{"m": 4, "n": 45, "k": 26, "tile_m": 2, "tile_n": 3, "threads": 32, "grouping": 4, "minblocks": 3, "algorithm": "medium", "perf": 1487.75, "source": "autotuned"},
{"m": 4, "n": 45, "k": 28, "tile_m": 2, "tile_n": 3, "threads": 32, "grouping": 3, "minblocks": 3, "algorithm": "medium", "perf": 1467.85, "source": "autotuned"},
{"m": 4, "n": 45, "k": 32, "tile_m": 2, "tile_n": 3, "threads": 32, "grouping": 4, "minblocks": 3, "algorithm": "medium", "perf": 1459.92, "source": "autotuned"},
{"m": 4, "n": 45, "k": 45, "tile_m": 2, "tile_n": 1, "threads": 96, "grouping": 3, "minblocks": 3, "algorithm": "medium", "perf": 1388.69, "source": "autotuned"},
{"m": 5, "n": 4, "k": 4, "tile_m": 1, "tile_n": 1, "threads": 32, "grouping": 8, "minblocks": 16, "algorithm": "medium", "perf": 357.91, "source": "autotuned"},
{"m": 5, "n": 4, "k": 5, "tile_m": 1, "tile_n": 1, "threads": 32, "grouping": 10, "minblocks": 2, "algorithm": "medium", "perf": 416.131, "source": "autotuned"},
{"m": 5, "n": 4, "k": 6, "tile_m": 1, "tile_n": 1, "threads": 32, "grouping": 10, "minblocks": 5, "algorithm": "medium", "perf": 467.212, "source": "autotuned"},
{"m": 5, "n": 4, "k": 7, "tile_m": 1, "tile_n": 1, "threads": 64, "grouping": 15, "minblocks": 2, "algorithm": "medium", "perf": 428.961, "source": "autotuned"},
{"m": 5, "n": 4, "k": 8, "tile_m": 1, "tile_n": 1, "threads": 64, "grouping": 5, "minblocks": 26, "algorithm": "medium", "perf": 473.449, "source": "autotuned"},
{"m": 5, "n": 4, "k": 9, "tile_m": 1, "tile_n": 1, "threads": 64, "grouping": 4, "minblocks": 10, "algorithm": "medium", "perf": 507.511, "source": "autotuned"},
{"m": 5, "n": 4, "k": 13, "tile_m": 1, "tile_n": 1, "threads": 96, "grouping": 15, "minblocks": 20, "algorithm": "medium", "perf": 578.816, "source": "autotuned"},
{"m": 5, "n": 4, "k": 22, "tile_m": 1, "tile_n": 1, "threads": 128, "grouping": 3, "minblocks": 16, "algorithm": "medium", "perf": 709.246, "source": "autotuned"},
{"m": 5, "n": 4, "k": 23, "tile_m": 1, "tile_n": 1, "threads": 128, "grouping": 3, "minblocks": 16, "algorithm": "medium", "perf": 717.646, "source": "autotuned"},
{"m": 5, "n": 4, "k": 25, "tile_m": 1, "tile_n": 1, "threads": 128, "grouping": 3, "minblocks": 14, "algorithm": "medium", "perf": 751.437, "source": "autotuned"},
{"m": 5, "n": 4, "k": 26, "tile_m": 1, "tile_n": 1, "threads": 160, "grouping": 19, "minblocks": 10, "algorithm": "medium", "perf": 725.134, "source": "autotuned"},
{"m": 5, "n": 4, "k": 28, "tile_m": 1, "tile_n": 1, "threads": 160, "grouping": 6, "minblocks": 9, "algorithm": "medium", "perf": 752.188, "source": "autotuned"},
{"m": 5, "n": 4, "k": 32, "tile_m": 1, "tile_n": 1, "threads": 64, "grouping": 8, "minblocks": 21, "algorithm": "medium", "perf": 767.917, "source": "autotuned"},
{"m": 5, "n": 4, "k": 45, "tile_m": 1, "tile_n": 1, "threads": 256, "grouping": 19, "minblocks": 7, "algorithm": "medium", "perf": 781.494, "source": "autotuned"},
{"m": 5, "n": 5, "k": 4, "tile_m": 1, "tile_n": 1, "threads": 32, "grouping": 10, "minblocks": 2, "algorithm": "medium", "perf": 439.536, "source": "autotuned"},
{"m": 5, "n": 5, "k": 5, "tile_m": 1, "tile_n": 1, "threads": 32, "grouping": 13, "minblocks": 10, "algorithm": "medium", "perf": 511.449, "source": "autotuned"},
{"m": 5, "n": 5, "k": 6, "tile_m": 1, "tile_n": 1, "threads": 32, "grouping": 13, "minblocks": 1, "algorithm": "medium", "perf": 588.781, "source": "autotuned"},
{"m": 5, "n": 5, "k": 7, "tile_m": 1, "tile_n": 1, "threads": 64, "grouping": 15, "minblocks": 21, "algorithm": "medium", "perf": 533.52, "source": "autotuned"},
{"m": 5, "n": 5, "k": 8, "tile_m": 1, "tile_n": 1, "threads": 64, "grouping": 15, "minblocks": 21, "algorithm": "medium", "perf": 585.53, "source": "autotuned"},
{"m": 5, "n": 5, "k": 9, "tile_m": 1, "tile_n": 1, "threads": 64, "grouping": 5, "minblocks": 6, "algorithm": "medium", "perf": 630.032, "source": "autotuned"},
{"m": 5, "n": 5, "k": 12, "tile_m": 1, "tile_n": 1, "threads": 64, "grouping": 5, "minblocks": 8, "algorithm": "medium", "perf": 728.21, "source": "autotuned"},
{"m": 5, "n": 5, "k": 13, "tile_m": 1, "tile_n": 1, "threads": 32, "grouping": 3, "minblocks": 2, "algorithm": "small", "perf": 739.575, "source": "autotuned"},
{"m": 5, "n": 5, "k": 16, "tile_m": 1, "tile_n": 1, "threads": 32, "grouping": 3, "minblocks": 6, "algorithm": "small", "perf": 840.827, "source": "autotuned"},
{"m": 5, "n": 5, "k": 22, "tile_m": 1, "tile_n": 1, "threads": 128, "grouping": 3, "minblocks": 15, "algorithm": "medium", "perf": 879.635, "source": "autotuned"},
{"m": 5, "n": 5, "k": 23, "tile_m": 1, "tile_n": 1, "threads": 128, "grouping": 3, "minblocks": 13, "algorithm": "medium", "perf": 881.92, "source": "autotuned"},
{"m": 5, "n": 5, "k": 24, "tile_m": 1, "tile_n": 1, "threads": 128, "grouping": 3, "minblocks": 13, "algorithm": "medium", "perf": 908.274, "source": "autotuned"},
{"m": 5, "n": 5, "k": 25, "tile_m": 1, "tile_n": 1, "threads": 128, "grouping": 3, "minblocks": 13, "algorithm": "medium", "perf": 919.405, "source": "autotuned"},
{"m": 5, "n": 5, "k": 26, "tile_m": 1, "tile_n": 1, "threads": 32, "grouping": 2, "minblocks": 25, "algorithm": "medium", "perf": 893.653, "source": "autotuned"},
{"m": 5, "n": 5, "k": 28, "tile_m": 1, "tile_n": 1, "threads": 32, "grouping": 3, "minblocks": 20, "algorithm": "medium", "perf": 925.351, "source": "autotuned"},
{"m": 5, "n": 5, "k": 32, "tile_m": 1, "tile_n": 1, "threads": 32, "grouping": 2, "minblocks": 10, "algorithm": "medium", "perf": 969.295, "source": "autotuned"},
{"m": 5, "n": 5, "k": 45, "tile_m": 1, "tile_n": 1, "threads": 32, "grouping": 2, "minblocks": 4, "algorithm": "medium", "perf": 981.826, "source": "autotuned"},
{"m": 5, "n": 6, "k": 4, "tile_m": 1, "tile_n": 1, "threads": 32, "grouping": 8, "minblocks": 9, "algorithm": "medium", "perf": 525.771, "source": "autotuned"},
{"m": 5, "n": 6, "k": 5, "tile_m": 1, "tile_n": 1, "threads": 32, "grouping": 8, "minblocks": 5, "algorithm": "medium", "perf": 619.72, "source": "autotuned"},
{"m": 5, "n": 6, "k": 6, "tile_m": 1, "tile_n": 1, "threads": 64, "grouping": 15, "minblocks": 11, "algorithm": "medium", "perf": 582.078, "source": "autotuned"},
{"m": 5, "n": 6, "k": 7, "tile_m": 1, "tile_n": 1, "threads": 64, "grouping": 15, "minblocks": 1, "algorithm": "medium", "perf": 635.975, "source": "autotuned"},
{"m": 5, "n": 6, "k": 8, "tile_m": 1, "tile_n": 1, "threads": 64, "grouping": 15, "minblocks": 26, "algorithm": "medium", "perf": 708.025, "source": "autotuned"},
{"m": 5, "n": 6, "k": 9, "tile_m": 1, "tile_n": 1, "threads": 64, "grouping": 15, "minblocks": 25, "algorithm": "medium", "perf": 749.51, "source": "autotuned"},
{"m": 5, "n": 7, "k": 4, "tile_m": 3, "tile_n": 1, "threads": 32, "grouping": 10, "minblocks": 1, "algorithm": "medium", "perf": 520.717, "source": "autotuned"},
{"m": 5, "n": 7, "k": 5, "tile_m": 4, "tile_n": 1, "threads": 64, "grouping": 13, "minblocks": 4, "algorithm": "medium", "perf": 556.451, "source": "autotuned"},
{"m": 5, "n": 7, "k": 6, "tile_m": 3, "tile_n": 1, "threads": 64, "grouping": 13, "minblocks": 8, "algorithm": "medium", "perf": 634.932, "source": "autotuned"},
{"m": 5, "n": 7, "k": 7, "tile_m": 4, "tile_n": 1, "threads": 64, "grouping": 13, "minblocks": 15, "algorithm": "medium", "perf": 690.09, "source": "autotuned"},
{"m": 5, "n": 7, "k": 8, "tile_m": 3, "tile_n": 1, "threads": 64, "grouping": 13, "minblocks": 16, "algorithm": "medium", "perf": 743.476, "source": "autotuned"},
{"m": 5, "n": 7, "k": 9, "tile_m": 4, "tile_n": 1, "threads": 64, "grouping": 13, "minblocks": 20, "algorithm": "medium", "perf": 808.476, "source": "autotuned"},
{"m": 5, "n": 7, "k": 13, "tile_m": 4, "tile_n": 1, "threads": 96, "grouping": 10, "minblocks": 15, "algorithm": "medium", "perf": 899.359, "source": "autotuned"},
{"m": 5, "n": 7, "k": 25, "tile_m": 3, "tile_n": 1, "threads": 32, "grouping": 3, "minblocks": 25, "algorithm": "medium", "perf": 1066.66, "source": "autotuned"},
{"m": 5, "n": 7, "k": 26, "tile_m": 3, "tile_n": 1, "threads": 32, "grouping": 3, "minblocks": 25, "algorithm": "medium", "perf": 1053.57, "source": "autotuned"},
{"m": 5, "n": 7, "k": 28, "tile_m": 3, "tile_n": 1, "threads": 32, "grouping": 3, "minblocks": 22, "algorithm": "medium", "perf": 1053.34, "source": "autotuned"},
{"m": 5, "n": 7, "k": 32, "tile_m": 3, "tile_n": 1, "threads": 32, "grouping": 3, "minblocks": 21, "algorithm": "medium", "perf": 1116.29, "source": "autotuned"},
{"m": 5, "n": 7, "k": 45, "tile_m": 3, "tile_n": 1, "w": 18, "v": 6, "threads": 32, "grouping": 16, "minblocks": 4, "algorithm": "largeDB2", "perf": 1104.61, "source": "autotuned"},
{"m": 5, "n": 8, "k": 4, "tile_m": 4, "tile_n": 1, "threads": 64, "grouping": 13, "minblocks": 1, "algorithm": "medium", "perf": 541.084, "source": "autotuned"},
{"m": 5, "n": 8, "k": 5, "tile_m": 3, "tile_n": 1, "threads": 64, "grouping": 13, "minblocks": 1, "algorithm": "medium", "perf": 635.444, "source": "autotuned"},
{"m": 5, "n": 8, "k": 6, "tile_m": 3, "tile_n": 1, "threads": 64, "grouping": 13, "minblocks": 1, "algorithm": "medium", "perf": 721.113, "source": "autotuned"},
{"m": 5, "n": 8, "k": 7, "tile_m": 4, "tile_n": 1, "threads": 64, "grouping": 13, "minblocks": 15, "algorithm": "medium", "perf": 782.765, "source": "autotuned"},
{"m": 5, "n": 8, "k": 8, "tile_m": 3, "tile_n": 1, "threads": 64, "grouping": 8, "minblocks": 22, "algorithm": "medium", "perf": 760.471, "source": "autotuned"},
{"m": 5, "n": 8, "k": 9, "tile_m": 4, "tile_n": 1, "threads": 96, "grouping": 13, "minblocks": 11, "algorithm": "medium", "perf": 846.503, "source": "autotuned"},
{"m": 5, "n": 9, "k": 4, "tile_m": 3, "tile_n": 1, "threads": 64, "grouping": 13, "minblocks": 17, "algorithm": "medium", "perf": 601.0, "source": "autotuned"},
{"m": 5, "n": 9, "k": 5, "tile_m": 3, "tile_n": 1, "threads": 64, "grouping": 13, "minblocks": 24, "algorithm": "medium", "perf": 708.497, "source": "autotuned"},
{"m": 5, "n": 9, "k": 6, "tile_m": 3, "tile_n": 1, "threads": 64, "grouping": 13, "minblocks": 8, "algorithm": "medium", "perf": 793.96, "source": "autotuned"},
{"m": 5, "n": 9, "k": 7, "tile_m": 3, "tile_n": 1, "threads": 64, "grouping": 13, "minblocks": 23, "algorithm": "medium", "perf": 874.775, "source": "autotuned"},
{"m": 5, "n": 9, "k": 8, "tile_m": 3, "tile_n": 1, "threads": 96, "grouping": 13, "minblocks": 16, "algorithm": "medium", "perf": 871.571, "source": "autotuned"},
{"m": 5, "n": 9, "k": 9, "tile_m": 3, "tile_n": 1, "threads": 96, "grouping": 13, "minblocks": 15, "algorithm": "medium", "perf": 935.483, "source": "autotuned"},
{"m": 5, "n": 9, "k": 13, "tile_m": 3, "tile_n": 1, "threads": 128, "grouping": 13, "minblocks": 14, "algorithm": "medium", "perf": 1060.85, "source": "autotuned"},
{"m": 5, "n": 9, "k": 16, "tile_m": 3, "tile_n": 1, "threads": 160, "grouping": 19, "minblocks": 9, "algorithm": "medium", "perf": 1142.15, "source": "autotuned"},
{"m": 5, "n": 9, "k": 22, "tile_m": 3, "tile_n": 1, "threads": 32, "grouping": 3, "minblocks": 25, "algorithm": "medium", "perf": 1221.6, "source": "autotuned"},
{"m": 5, "n": 9, "k": 23, "tile_m": 3, "tile_n": 1, "threads": 32, "grouping": 3, "minblocks": 25, "algorithm": "medium", "perf": 1232.53, "source": "autotuned"},
{"m": 5, "n": 9, "k": 25, "tile_m": 3, "tile_n": 1, "threads": 32, "grouping": 4, "minblocks": 22, "algorithm": "medium", "perf": 1235.91, "source": "autotuned"},
{"m": 5, "n": 9, "k": 26, "tile_m": 3, "tile_n": 1, "threads": 32, "grouping": 4, "minblocks": 22, "algorithm": "medium", "perf": 1239.79, "source": "autotuned"},
{"m": 5, "n": 9, "k": 28, "tile_m": 3, "tile_n": 1, "threads": 32, "grouping": 8, "minblocks": 18, "algorithm": "medium", "perf": 1261.52, "source": "autotuned"},
{"m": 5, "n": 9, "k": 32, "tile_m": 3, "tile_n": 1, "threads": 32, "grouping": 8, "minblocks": 17, "algorithm": "medium", "perf": 1328.83, "source": "autotuned"},
{"m": 5, "n": 9, "k": 45, "tile_m": 3, "tile_n": 1, "w": 16, "v": 6, "threads": 32, "grouping": 16, "minblocks": 4, "algorithm": "largeDB2", "perf": 1332.65, "source": "autotuned"},
{"m": 5, "n": 12, "k": 5, "tile_m": 3, "tile_n": 1, "threads": 64, "grouping": 13, "minblocks": 21, "algorithm": "medium", "perf": 926.494, "source": "autotuned"},
{"m": 5, "n": 12, "k": 12, "tile_m": 3, "tile_n": 1, "threads": 64, "grouping": 4, "minblocks": 21, "algorithm": "medium", "perf": 1328.54, "source": "autotuned"},
{"m": 5, "n": 12, "k": 13, "tile_m": 3, "tile_n": 1, "threads": 160, "grouping": 19, "minblocks": 9, "algorithm": "medium", "perf": 1313.54, "source": "autotuned"},
{"m": 5, "n": 12, "k": 26, "tile_m": 3, "tile_n": 1, "threads": 32, "grouping": 8, "minblocks": 18, "algorithm": "medium", "perf": 1541.98, "source": "autotuned"},
{"m": 5, "n": 12, "k": 32, "tile_m": 3, "tile_n": 1, "threads": 32, "grouping": 10, "minblocks": 13, "algorithm": "medium", "perf": 1552.21, "source": "autotuned"},
{"m": 5, "n": 13, "k": 4, "tile_m": 3, "tile_n": 1, "threads": 64, "grouping": 13, "minblocks": 10, "algorithm": "medium", "perf": 842.596, "source": "autotuned"},
{"m": 5, "n": 13, "k": 5, "tile_m": 3, "tile_n": 1, "threads": 32, "grouping": 8, "minblocks": 13, "algorithm": "medium", "perf": 919.186, "source": "autotuned"},
{"m": 5, "n": 13, "k": 7, "tile_m": 3, "tile_n": 1, "threads": 96, "grouping": 13, "minblocks": 14, "algorithm": "medium", "perf": 1126.18, "source": "autotuned"},
{"m": 5, "n": 13, "k": 9, "tile_m": 3, "tile_n": 1, "threads": 64, "grouping": 8, "minblocks": 22, "algorithm": "medium", "perf": 1242.8, "source": "autotuned"},
{"m": 5, "n": 13, "k": 12, "tile_m": 3, "tile_n": 1, "threads": 64, "grouping": 10, "minblocks": 23, "algorithm": "medium", "perf": 1393.29, "source": "autotuned"},
{"m": 5, "n": 13, "k": 13, "tile_m": 3, "tile_n": 1, "threads": 96, "grouping": 13, "minblocks": 11, "algorithm": "medium", "perf": 1364.59, "source": "autotuned"},
{"m": 5, "n": 13, "k": 16, "tile_m": 3, "tile_n": 1, "threads": 32, "grouping": 8, "minblocks": 17, "algorithm": "medium", "perf": 1494.72, "source": "autotuned"},
{"m": 5, "n": 13, "k": 22, "tile_m": 3, "tile_n": 1, "threads": 32, "grouping": 8, "minblocks": 17, "algorithm": "medium", "perf": 1589.39, "source": "autotuned"},
{"m": 5, "n": 13, "k": 23, "tile_m": 3, "tile_n": 1, "threads": 32, "grouping": 8, "minblocks": 18, "algorithm": "medium", "perf": 1584.18, "source": "autotuned"},
{"m": 5, "n": 13, "k": 24, "tile_m": 3, "tile_n": 1, "threads": 32, "grouping": 8, "minblocks": 17, "algorithm": "medium", "perf": 1605.44, "source": "autotuned"},
{"m": 5, "n": 13, "k": 25, "tile_m": 3, "tile_n": 1, "threads": 32, "grouping": 8, "minblocks": 17, "algorithm": "medium", "perf": 1594.53, "source": "autotuned"},
{"m": 5, "n": 13, "k": 26, "tile_m": 3, "tile_n": 1, "threads": 32, "grouping": 8, "minblocks": 17, "algorithm": "medium", "perf": 1587.14, "source": "autotuned"},
{"m": 5, "n": 13, "k": 28, "tile_m": 3, "tile_n": 1, "threads": 32, "grouping": 10, "minblocks": 2, "algorithm": "medium", "perf": 1551.62, "source": "autotuned"},
{"m": 5, "n": 13, "k": 32, "tile_m": 3, "tile_n": 1, "threads": 32, "grouping": 10, "minblocks": 10, "algorithm": "medium", "perf": 1625.51, "source": "autotuned"},
{"m": 5, "n": 13, "k": 45, "tile_m": 3, "tile_n": 1, "threads": 32, "grouping": 13, "minblocks": 9, "algorithm": "medium", "perf": 1604.12, "source": "autotuned"},
{"m": 5, "n": 16, "k": 5, "tile_m": 3, "tile_n": 1, "threads": 32, "grouping": 8, "minblocks": 9, "algorithm": "medium", "perf": 1126.81, "source": "autotuned"},
{"m": 5, "n": 16, "k": 9, "tile_m": 3, "tile_n": 1, "threads": 64, "grouping": 10, "minblocks": 22, "algorithm": "medium", "perf": 1449.32, "source": "autotuned"},
{"m": 5, "n": 16, "k": 13, "tile_m": 3, "tile_n": 1, "threads": 32, "grouping": 8, "minblocks": 19, "algorithm": "medium", "perf": 1598.86, "source": "autotuned"},
{"m": 5, "n": 16, "k": 16, "tile_m": 3, "tile_n": 1, "threads": 32, "grouping": 8, "minblocks": 20, "algorithm": "medium", "perf": 1756.65, "source": "autotuned"},
{"m": 5, "n": 16, "k": 23, "tile_m": 3, "tile_n": 1, "threads": 128, "grouping": 15, "minblocks": 10, "algorithm": "medium", "perf": 1760.75, "source": "autotuned"},
{"m": 5, "n": 16, "k": 32, "tile_m": 3, "tile_n": 1, "threads": 32, "grouping": 10, "minblocks": 10, "algorithm": "medium", "perf": 1749.18, "source": "autotuned"},
{"m": 5, "n": 22, "k": 4, "tile_m": 3, "tile_n": 2, "threads": 96, "grouping": 13, "minblocks": 12, "algorithm": "medium", "perf": 1174.15, "source": "autotuned"},
{"m": 5, "n": 22, "k": 5, "tile_m": 5, "tile_n": 1, "threads": 32, "grouping": 10, "minblocks": 27, "algorithm": "medium", "perf": 1252.46, "source": "autotuned"},
{"m": 5, "n": 22, "k": 9, "tile_m": 5, "tile_n": 1, "threads": 64, "grouping": 13, "minblocks": 20, "algorithm": "medium", "perf": 1553.83, "source": "autotuned"},
{"m": 5, "n": 22, "k": 13, "tile_m": 3, "tile_n": 2, "threads": 32, "grouping": 7, "minblocks": 21, "algorithm": "medium", "perf": 1753.0, "source": "autotuned"},
{"m": 5, "n": 22, "k": 22, "tile_m": 5, "tile_n": 1, "threads": 128, "grouping": 15, "minblocks": 10, "algorithm": "medium", "perf": 1767.49, "source": "autotuned"},
{"m": 5, "n": 22, "k": 23, "tile_m": 5, "tile_n": 1, "threads": 128, "grouping": 15, "minblocks": 10, "algorithm": "medium", "perf": 1777.24, "source": "autotuned"},
{"m": 5, "n": 22, "k": 26, "tile_m": 5, "tile_n": 1, "w": 10, "v": 16, "threads": 32, "grouping": 16, "minblocks": 2, "algorithm": "largeDB2", "perf": 1711.06, "source": "autotuned"},
{"m": 5, "n": 23, "k": 4, "tile_m": 3, "tile_n": 2, "threads": 96, "grouping": 13, "minblocks": 11, "algorithm": "medium", "perf": 1172.95, "source": "autotuned"},
{"m": 5, "n": 23, "k": 5, "tile_m": 5, "tile_n": 1, "threads": 32, "grouping": 10, "minblocks": 26, "algorithm": "medium", "perf": 1288.27, "source": "autotuned"},
{"m": 5, "n": 23, "k": 9, "tile_m": 3, "tile_n": 2, "threads": 64, "grouping": 8, "minblocks": 19, "algorithm": "medium", "perf": 1638.17, "source": "autotuned"},
{"m": 5, "n": 23, "k": 13, "tile_m": 3, "tile_n": 2, "threads": 32, "grouping": 8, "minblocks": 19, "algorithm": "medium", "perf": 1738.92, "source": "autotuned"},
{"m": 5, "n": 23, "k": 16, "tile_m": 5, "tile_n": 1, "threads": 96, "grouping": 13, "minblocks": 11, "algorithm": "medium", "perf": 1855.42, "source": "autotuned"},
{"m": 5, "n": 23, "k": 22, "tile_m": 5, "tile_n": 1, "threads": 128, "grouping": 15, "minblocks": 10, "algorithm": "medium", "perf": 1787.28, "source": "autotuned"},
{"m": 5, "n": 23, "k": 23, "tile_m": 5, "tile_n": 1, "w": 8, "v": 16, "threads": 32, "grouping": 16, "minblocks": 1, "algorithm": "largeDB2", "perf": 1722.54, "source": "autotuned"},
{"m": 5, "n": 23, "k": 26, "tile_m": 5, "tile_n": 1, "threads": 32, "grouping": 13, "minblocks": 1, "algorithm": "medium", "perf": 1806.12, "source": "autotuned"},
{"m": 5, "n": 24, "k": 5, "tile_m": 5, "tile_n": 1, "threads": 32, "grouping": 10, "minblocks": 4, "algorithm": "medium", "perf": 1344.51, "source": "autotuned"},
{"m": 5, "n": 24, "k": 13, "tile_m": 3, "tile_n": 2, "threads": 32, "grouping": 7, "minblocks": 21, "algorithm": "medium", "perf": 1866.61, "source": "autotuned"},
{"m": 5, "n": 24, "k": 24, "tile_m": 5, "tile_n": 1, "threads": 32, "grouping": 13, "minblocks": 6, "algorithm": "medium", "perf": 1875.59, "source": "autotuned"},
{"m": 5, "n": 24, "k": 26, "tile_m": 3, "tile_n": 2, "threads": 32, "grouping": 13, "minblocks": 8, "algorithm": "medium", "perf": 1848.92, "source": "autotuned"},
{"m": 5, "n": 24, "k": 32, "tile_m": 5, "tile_n": 1, "threads": 32, "grouping": 13, "minblocks": 6, "algorithm": "medium", "perf": 1800.56, "source": "autotuned"},
{"m": 5, "n": 25, "k": 4, "tile_m": 3, "tile_n": 2, "threads": 32, "grouping": 9, "minblocks": 26, "algorithm": "medium", "perf": 1206.01, "source": "autotuned"},
{"m": 5, "n": 25, "k": 5, "tile_m": 5, "tile_n": 1, "threads": 32, "grouping": 10, "minblocks": 25, "algorithm": "medium", "perf": 1390.56, "source": "autotuned"},
{"m": 5, "n": 25, "k": 7, "tile_m": 5, "tile_n": 1, "threads": 64, "grouping": 8, "minblocks": 23, "algorithm": "medium", "perf": 1615.75, "source": "autotuned"},
{"m": 5, "n": 25, "k": 9, "tile_m": 3, "tile_n": 2, "threads": 64, "grouping": 8, "minblocks": 20, "algorithm": "medium", "perf": 1742.52, "source": "autotuned"},
{"m": 5, "n": 25, "k": 13, "tile_m": 3, "tile_n": 2, "threads": 32, "grouping": 8, "minblocks": 18, "algorithm": "medium", "perf": 1823.49, "source": "autotuned"},
{"m": 5, "n": 25, "k": 25, "tile_m": 5, "tile_n": 1, "threads": 32, "grouping": 13, "minblocks": 7, "algorithm": "medium", "perf": 1834.49, "source": "autotuned"},
{"m": 5, "n": 25, "k": 26, "tile_m": 5, "tile_n": 1, "threads": 32, "grouping": 13, "minblocks": 1, "algorithm": "medium", "perf": 1814.18, "source": "autotuned"},
{"m": 5, "n": 25, "k": 28, "tile_m": 5, "tile_n": 1, "threads": 32, "grouping": 13, "minblocks": 6, "algorithm": "medium", "perf": 1803.45, "source": "autotuned"},
{"m": 5, "n": 25, "k": 32, "tile_m": 3, "tile_n": 2, "threads": 32, "grouping": 13, "minblocks": 8, "algorithm": "medium", "perf": 1794.82, "source": "autotuned"},
{"m": 5, "n": 25, "k": 45, "tile_m": 5, "tile_n": 1, "threads": 32, "grouping": 3, "minblocks": 5, "algorithm": "medium", "perf": 1653.63, "source": "autotuned"},
{"m": 5, "n": 26, "k": 4, "tile_m": 3, "tile_n": 2, "threads": 32, "grouping": 8, "minblocks": 1, "algorithm": "medium", "perf": 1309.13, "source": "autotuned"},
{"m": 5, "n": 26, "k": 5, "tile_m": 5, "tile_n": 1, "threads": 32, "grouping": 10, "minblocks": 21, "algorithm": "medium", "perf": 1408.97, "source": "autotuned"},
{"m": 5, "n": 26, "k": 7, "tile_m": 5, "tile_n": 1, "threads": 64, "grouping": 8, "minblocks": 22, "algorithm": "medium", "perf": 1658.31, "source": "autotuned"},
{"m": 5, "n": 26, "k": 9, "tile_m": 5, "tile_n": 1, "threads": 64, "grouping": 10, "minblocks": 19, "algorithm": "medium", "perf": 1784.09, "source": "autotuned"},
{"m": 5, "n": 26, "k": 12, "tile_m": 3, "tile_n": 2, "threads": 64, "grouping": 13, "minblocks": 11, "algorithm": "medium", "perf": 1970.31, "source": "autotuned"},
{"m": 5, "n": 26, "k": 13, "tile_m": 5, "tile_n": 1, "threads": 32, "grouping": 8, "minblocks": 17, "algorithm": "medium", "perf": 1858.31, "source": "autotuned"},
{"m": 5, "n": 26, "k": 22, "tile_m": 5, "tile_n": 1, "threads": 128, "grouping": 15, "minblocks": 10, "algorithm": "medium", "perf": 1806.12, "source": "autotuned"},
{"m": 5, "n": 26, "k": 23, "tile_m": 5, "tile_n": 1, "threads": 32, "grouping": 13, "minblocks": 3, "algorithm": "medium", "perf": 1869.33, "source": "autotuned"},
{"m": 5, "n": 26, "k": 24, "tile_m": 5, "tile_n": 1, "threads": 32, "grouping": 13, "minblocks": 10, "algorithm": "medium", "perf": 1866.61, "source": "autotuned"},
{"m": 5, "n": 26, "k": 25, "tile_m": 5, "tile_n": 1, "threads": 32, "grouping": 13, "minblocks": 1, "algorithm": "medium", "perf": 1836.04, "source": "autotuned"},
{"m": 5, "n": 26, "k": 26, "tile_m": 3, "tile_n": 2, "threads": 32, "grouping": 13, "minblocks": 6, "algorithm": "medium", "perf": 1832.22, "source": "autotuned"},
{"m": 5, "n": 26, "k": 28, "tile_m": 5, "tile_n": 1, "threads": 32, "grouping": 13, "minblocks": 1, "algorithm": "medium", "perf": 1806.12, "source": "autotuned"},
{"m": 5, "n": 26, "k": 32, "tile_m": 5, "tile_n": 1, "threads": 32, "grouping": 15, "minblocks": 2, "algorithm": "medium", "perf": 1797.8, "source": "autotuned"},
{"m": 5, "n": 26, "k": 45, "tile_m": 3, "tile_n": 2, "threads": 32, "grouping": 2, "minblocks": 2, "algorithm": "medium", "perf": 1662.45, "source": "autotuned"},
{"m": 5, "n": 28, "k": 4, "tile_m": 3, "tile_n": 2, "threads": 32, "grouping": 8, "minblocks": 11, "algorithm": "medium", "perf": 1410.7, "source": "autotuned"},
{"m": 5, "n": 28, "k": 5, "tile_m": 5, "tile_n": 1, "threads": 32, "grouping": 10, "minblocks": 26, "algorithm": "medium", "perf": 1530.83, "source": "autotuned"},
{"m": 5, "n": 28, "k": 7, "tile_m": 5, "tile_n": 1, "threads": 64, "grouping": 8, "minblocks": 23, "algorithm": "medium", "perf": 1663.42, "source": "autotuned"},
{"m": 5, "n": 28, "k": 9, "tile_m": 5, "tile_n": 1, "threads": 64, "grouping": 10, "minblocks": 19, "algorithm": "medium", "perf": 1916.14, "source": "autotuned"},
{"m": 5, "n": 28, "k": 13, "tile_m": 5, "tile_n": 1, "threads": 96, "grouping": 13, "minblocks": 11, "algorithm": "medium", "perf": 1950.61, "source": "autotuned"},
{"m": 5, "n": 28, "k": 25, "tile_m": 5, "tile_n": 1, "threads": 32, "grouping": 13, "minblocks": 6, "algorithm": "medium", "perf": 1843.97, "source": "autotuned"},
{"m": 5, "n": 28, "k": 26, "tile_m": 5, "tile_n": 1, "threads": 32, "grouping": 13, "minblocks": 5, "algorithm": "medium", "perf": 1825.44, "source": "autotuned"},
{"m": 5, "n": 28, "k": 28, "tile_m": 5, "tile_n": 1, "threads": 32, "grouping": 14, "minblocks": 6, "algorithm": "medium", "perf": 1802.03, "source": "autotuned"},
{"m": 5, "n": 28, "k": 32, "tile_m": 3, "tile_n": 2, "threads": 32, "grouping": 4, "minblocks": 2, "algorithm": "medium", "perf": 1795.43, "source": "autotuned"},
{"m": 5, "n": 28, "k": 45, "tile_m": 3, "tile_n": 2, "threads": 32, "grouping": 2, "minblocks": 3, "algorithm": "medium", "perf": 1664.25, "source": "autotuned"},
{"m": 5, "n": 32, "k": 4, "tile_m": 3, "tile_n": 2, "threads": 32, "grouping": 8, "minblocks": 9, "algorithm": "medium", "perf": 1557.86, "source": "autotuned"},
{"m": 5, "n": 32, "k": 5, "tile_m": 5, "tile_n": 1, "threads": 32, "grouping": 10, "minblocks": 25, "algorithm": "medium", "perf": 1697.36, "source": "autotuned"},
{"m": 5, "n": 32, "k": 7, "tile_m": 5, "tile_n": 1, "threads": 64, "grouping": 13, "minblocks": 20, "algorithm": "medium", "perf": 1887.84, "source": "autotuned"},
{"m": 5, "n": 32, "k": 9, "tile_m": 5, "tile_n": 1, "threads": 64, "grouping": 10, "minblocks": 19, "algorithm": "medium", "perf": 2034.53, "source": "autotuned"},
{"m": 5, "n": 32, "k": 12, "tile_m": 3, "tile_n": 2, "threads": 64, "grouping": 9, "minblocks": 17, "algorithm": "medium", "perf": 2130.84, "source": "autotuned"},
{"m": 5, "n": 32, "k": 13, "tile_m": 5, "tile_n": 1, "threads": 96, "grouping": 13, "minblocks": 12, "algorithm": "medium", "perf": 2042.52, "source": "autotuned"},
{"m": 5, "n": 32, "k": 16, "tile_m": 5, "tile_n": 1, "threads": 96, "grouping": 13, "minblocks": 12, "algorithm": "medium", "perf": 2025.95, "source": "autotuned"},
{"m": 5, "n": 32, "k": 24, "tile_m": 3, "tile_n": 2, "threads": 32, "grouping": 13, "minblocks": 7, "algorithm": "medium", "perf": 1895.33, "source": "autotuned"},
{"m": 5, "n": 32, "k": 25, "tile_m": 5, "tile_n": 1, "threads": 32, "grouping": 13, "minblocks": 2, "algorithm": "medium", "perf": 1838.81, "source": "autotuned"},
{"m": 5, "n": 32, "k": 26, "tile_m": 3, "tile_n": 2, "threads": 32, "grouping": 4, "minblocks": 8, "algorithm": "medium", "perf": 1840.2, "source": "autotuned"},
{"m": 5, "n": 32, "k": 28, "tile_m": 5, "tile_n": 1, "threads": 32, "grouping": 19, "minblocks": 6, "algorithm": "medium", "perf": 1810.91, "source": "autotuned"},
{"m": 5, "n": 32, "k": 32, "tile_m": 5, "tile_n": 1, "threads": 32, "grouping": 19, "minblocks": 6, "algorithm": "medium", "perf": 1784.94, "source": "autotuned"},
{"m": 5, "n": 32, "k": 45, "tile_m": 5, "tile_n": 1, "w": 16, "v": 10, "threads": 64, "grouping": 16, "minblocks": 12, "algorithm": "largeDB2", "perf": 1696.51, "source": "autotuned"},
{"m": 5, "n": 45, "k": 4, "tile_m": 3, "tile_n": 3, "threads": 32, "grouping": 10, "minblocks": 21, "algorithm": "medium", "perf": 1741.62, "source": "autotuned"},
{"m": 5, "n": 45, "k": 5, "tile_m": 3, "tile_n": 3, "threads": 32, "grouping": 10, "minblocks": 25, "algorithm": "medium", "perf": 1934.2, "source": "autotuned"},
{"m": 5, "n": 45, "k": 7, "tile_m": 3, "tile_n": 3, "threads": 64, "grouping": 10, "minblocks": 16, "algorithm": "medium", "perf": 2114.35, "source": "autotuned"},
{"m": 5, "n": 45, "k": 9, "tile_m": 3, "tile_n": 3, "threads": 64, "grouping": 10, "minblocks": 15, "algorithm": "medium", "perf": 2121.82, "source": "autotuned"},
{"m": 5, "n": 45, "k": 13, "tile_m": 3, "tile_n": 3, "threads": 32, "grouping": 13, "minblocks": 1, "algorithm": "medium", "perf": 1966.34, "source": "autotuned"},
{"m": 5, "n": 45, "k": 25, "tile_m": 3, "tile_n": 3, "threads": 32, "grouping": 19, "minblocks": 5, "algorithm": "medium", "perf": 1758.36, "source": "autotuned"},
{"m": 5, "n": 45, "k": 26, "tile_m": 5, "tile_n": 2, "threads": 32, "grouping": 4, "minblocks": 1, "algorithm": "medium", "perf": 1752.74, "source": "autotuned"},
{"m": 5, "n": 45, "k": 28, "tile_m": 5, "tile_n": 2, "threads": 32, "grouping": 4, "minblocks": 5, "algorithm": "medium", "perf": 1753.14, "source": "autotuned"},
{"m": 5, "n": 45, "k": 32, "tile_m": 5, "tile_n": 2, "threads": 32, "grouping": 4, "minblocks": 1, "algorithm": "medium", "perf": 1749.25, "source": "autotuned"},
{"m": 5, "n": 45, "k": 45, "tile_m": 3, "tile_n": 3, "w": 12, "v": 26, "threads": 32, "grouping": 16, "minblocks": 1, "algorithm": "largeDB2", "perf": 1668.74, "source": "autotuned"},
{"m": 6, "n": 4, "k": 4, "tile_m": 1, "tile_n": 1, "threads": 32, "grouping": 8, "minblocks": 3, "algorithm": "medium", "perf": 437.356, "source": "autotuned"},
{"m": 6, "n": 4, "k": 5, "tile_m": 1, "tile_n": 1, "threads": 32, "grouping": 8, "minblocks": 13, "algorithm": "medium", "perf": 526.48, "source": "autotuned"},
{"m": 6, "n": 4, "k": 6, "tile_m": 1, "tile_n": 1, "threads": 64, "grouping": 4, "minblocks": 14, "algorithm": "medium", "perf": 493.777, "source": "autotuned"},
{"m": 6, "n": 4, "k": 7, "tile_m": 1, "tile_n": 1, "threads": 64, "grouping": 13, "minblocks": 11, "algorithm": "medium", "perf": 554.381, "source": "autotuned"},
{"m": 6, "n": 4, "k": 8, "tile_m": 1, "tile_n": 1, "threads": 64, "grouping": 5, "minblocks": 16, "algorithm": "medium", "perf": 613.399, "source": "autotuned"},
{"m": 6, "n": 4, "k": 9, "tile_m": 1, "tile_n": 1, "threads": 64, "grouping": 4, "minblocks": 2, "algorithm": "medium", "perf": 645.755, "source": "autotuned"},
{"m": 6, "n": 5, "k": 4, "tile_m": 1, "tile_n": 1, "threads": 32, "grouping": 8, "minblocks": 16, "algorithm": "medium", "perf": 541.836, "source": "autotuned"},
{"m": 6, "n": 5, "k": 5, "tile_m": 1, "tile_n": 1, "threads": 32, "grouping": 8, "minblocks": 3, "algorithm": "medium", "perf": 648.64, "source": "autotuned"},
{"m": 6, "n": 5, "k": 6, "tile_m": 1, "tile_n": 1, "threads": 64, "grouping": 15, "minblocks": 4, "algorithm": "medium", "perf": 622.19, "source": "autotuned"},
{"m": 6, "n": 5, "k": 7, "tile_m": 1, "tile_n": 1, "threads": 64, "grouping": 4, "minblocks": 21, "algorithm": "medium", "perf": 689.161, "source": "autotuned"},
{"m": 6, "n": 5, "k": 8, "tile_m": 1, "tile_n": 1, "threads": 64, "grouping": 4, "minblocks": 6, "algorithm": "medium", "perf": 758.992, "source": "autotuned"},
{"m": 6, "n": 5, "k": 9, "tile_m": 1, "tile_n": 1, "threads": 64, "grouping": 4, "minblocks": 7, "algorithm": "medium", "perf": 803.823, "source": "autotuned"},
{"m": 6, "n": 6, "k": 4, "tile_m": 4, "tile_n": 1, "threads": 32, "grouping": 8, "minblocks": 7, "algorithm": "medium", "perf": 539.166, "source": "autotuned"},
{"m": 6, "n": 6, "k": 5, "tile_m": 1, "tile_n": 2, "threads": 32, "grouping": 13, "minblocks": 11, "algorithm": "medium", "perf": 642.792, "source": "autotuned"},
{"m": 6, "n": 6, "k": 6, "tile_m": 1, "tile_n": 2, "threads": 64, "grouping": 13, "minblocks": 21, "algorithm": "medium", "perf": 671.676, "source": "autotuned"},
{"m": 6, "n": 6, "k": 7, "tile_m": 1, "tile_n": 2, "threads": 64, "grouping": 13, "minblocks": 21, "algorithm": "medium", "perf": 746.607, "source": "autotuned"},
{"m": 6, "n": 6, "k": 8, "tile_m": 1, "tile_n": 2, "threads": 64, "grouping": 13, "minblocks": 22, "algorithm": "medium", "perf": 818.438, "source": "autotuned"},
{"m": 6, "n": 7, "k": 4, "tile_m": 1, "tile_n": 2, "threads": 32, "grouping": 12, "minblocks": 20, "algorithm": "medium", "perf": 635.002, "source": "autotuned"},
{"m": 6, "n": 7, "k": 5, "tile_m": 1, "tile_n": 2, "threads": 64, "grouping": 13, "minblocks": 22, "algorithm": "medium", "perf": 681.881, "source": "autotuned"},
{"m": 6, "n": 7, "k": 6, "tile_m": 1, "tile_n": 2, "threads": 64, "grouping": 13, "minblocks": 24, "algorithm": "medium", "perf": 770.45, "source": "autotuned"},
{"m": 6, "n": 7, "k": 7, "tile_m": 1, "tile_n": 2, "threads": 64, "grouping": 13, "minblocks": 23, "algorithm": "medium", "perf": 846.482, "source": "autotuned"},
{"m": 6, "n": 7, "k": 8, "tile_m": 1, "tile_n": 2, "threads": 64, "grouping": 13, "minblocks": 23, "algorithm": "medium", "perf": 920.904, "source": "autotuned"},
{"m": 6, "n": 7, "k": 9, "tile_m": 1, "tile_n": 2, "threads": 64, "grouping": 13, "minblocks": 15, "algorithm": "medium", "perf": 979.734, "source": "autotuned"},
{"m": 6, "n": 8, "k": 4, "tile_m": 1, "tile_n": 2, "threads": 64, "grouping": 13, "minblocks": 19, "algorithm": "medium", "perf": 666.875, "source": "autotuned"},
{"m": 6, "n": 8, "k": 5, "tile_m": 1, "tile_n": 2, "threads": 64, "grouping": 13, "minblocks": 6, "algorithm": "medium", "perf": 781.807, "source": "autotuned"},
{"m": 6, "n": 8, "k": 6, "tile_m": 1, "tile_n": 2, "threads": 64, "grouping": 13, "minblocks": 22, "algorithm": "medium", "perf": 898.192, "source": "autotuned"},
{"m": 6, "n": 8, "k": 7, "tile_m": 1, "tile_n": 2, "threads": 64, "grouping": 13, "minblocks": 24, "algorithm": "medium", "perf": 978.895, "source": "autotuned"},
{"m": 6, "n": 8, "k": 8, "tile_m": 1, "tile_n": 2, "threads": 64, "grouping": 8, "minblocks": 21, "algorithm": "medium", "perf": 962.707, "source": "autotuned"},
{"m": 6, "n": 8, "k": 9, "tile_m": 1, "tile_n": 2, "threads": 96, "grouping": 13, "minblocks": 16, "algorithm": "medium", "perf": 1035.94, "source": "autotuned"},
{"m": 6, "n": 9, "k": 4, "tile_m": 1, "tile_n": 2, "threads": 64, "grouping": 13, "minblocks": 24, "algorithm": "medium", "perf": 740.135, "source": "autotuned"},
{"m": 6, "n": 9, "k": 5, "tile_m": 1, "tile_n": 2, "threads": 64, "grouping": 13, "minblocks": 23, "algorithm": "medium", "perf": 870.507, "source": "autotuned"},
{"m": 6, "n": 9, "k": 6, "tile_m": 1, "tile_n": 2, "threads": 64, "grouping": 13, "minblocks": 23, "algorithm": "medium", "perf": 967.011, "source": "autotuned"},
{"m": 6, "n": 9, "k": 7, "tile_m": 1, "tile_n": 2, "threads": 64, "grouping": 13, "minblocks": 22, "algorithm": "medium", "perf": 1080.15, "source": "autotuned"},
{"m": 6, "n": 9, "k": 8, "tile_m": 1, "tile_n": 2, "threads": 96, "grouping": 15, "minblocks": 16, "algorithm": "medium", "perf": 1080.34, "source": "autotuned"},
{"m": 6, "n": 9, "k": 9, "tile_m": 1, "tile_n": 2, "threads": 96, "grouping": 13, "minblocks": 20, "algorithm": "medium", "perf": 1137.14, "source": "autotuned"},
{"m": 7, "n": 4, "k": 4, "tile_m": 1, "tile_n": 1, "threads": 32, "grouping": 8, "minblocks": 2, "algorithm": "medium", "perf": 495.059, "source": "autotuned"},
{"m": 7, "n": 4, "k": 5, "tile_m": 1, "tile_n": 1, "threads": 64, "grouping": 15, "minblocks": 21, "algorithm": "medium", "perf": 476.157, "source": "autotuned"},
{"m": 7, "n": 4, "k": 6, "tile_m": 1, "tile_n": 1, "threads": 64, "grouping": 15, "minblocks": 21, "algorithm": "medium", "perf": 539.003, "source": "autotuned"},
{"m": 7, "n": 4, "k": 7, "tile_m": 1, "tile_n": 1, "threads": 64, "grouping": 15, "minblocks": 21, "algorithm": "medium", "perf": 597.516, "source": "autotuned"},
{"m": 7, "n": 4, "k": 8, "tile_m": 1, "tile_n": 1, "threads": 64, "grouping": 15, "minblocks": 21, "algorithm": "medium", "perf": 646.175, "source": "autotuned"},
{"m": 7, "n": 4, "k": 9, "tile_m": 1, "tile_n": 1, "threads": 64, "grouping": 15, "minblocks": 21, "algorithm": "medium", "perf": 698.003, "source": "autotuned"},
{"m": 7, "n": 4, "k": 13, "tile_m": 1, "tile_n": 1, "threads": 96, "grouping": 15, "minblocks": 20, "algorithm": "medium", "perf": 794.396, "source": "autotuned"},
{"m": 7, "n": 4, "k": 25, "tile_m": 1, "tile_n": 1, "threads": 64, "grouping": 8, "minblocks": 24, "algorithm": "medium", "perf": 937.006, "source": "autotuned"},
{"m": 7, "n": 4, "k": 26, "tile_m": 1, "tile_n": 1, "threads": 64, "grouping": 8, "minblocks": 24, "algorithm": "medium", "perf": 936.733, "source": "autotuned"},
{"m": 7, "n": 4, "k": 28, "tile_m": 1, "tile_n": 1, "threads": 128, "grouping": 10, "minblocks": 14, "algorithm": "medium", "perf": 967.407, "source": "autotuned"},
{"m": 7, "n": 4, "k": 32, "tile_m": 1, "tile_n": 1, "threads": 64, "grouping": 8, "minblocks": 22, "algorithm": "medium", "perf": 976.176, "source": "autotuned"},
{"m": 7, "n": 4, "k": 45, "tile_m": 1, "tile_n": 1, "w": 16, "v": 4, "threads": 32, "grouping": 16, "minblocks": 2, "algorithm": "largeDB2", "perf": 981.955, "source": "autotuned"},
{"m": 7, "n": 5, "k": 4, "tile_m": 4, "tile_n": 1, "threads": 32, "grouping": 8, "minblocks": 4, "algorithm": "medium", "perf": 515.89, "source": "autotuned"},
{"m": 7, "n": 5, "k": 5, "tile_m": 2, "tile_n": 1, "threads": 64, "grouping": 13, "minblocks": 23, "algorithm": "medium", "perf": 559.658, "source": "autotuned"},
{"m": 7, "n": 5, "k": 6, "tile_m": 4, "tile_n": 1, "threads": 64, "grouping": 13, "minblocks": 16, "algorithm": "medium", "perf": 627.729, "source": "autotuned"},
{"m": 7, "n": 5, "k": 7, "tile_m": 4, "tile_n": 1, "threads": 64, "grouping": 13, "minblocks": 15, "algorithm": "medium", "perf": 690.09, "source": "autotuned"},
{"m": 7, "n": 5, "k": 9, "tile_m": 4, "tile_n": 1, "threads": 64, "grouping": 13, "minblocks": 18, "algorithm": "medium", "perf": 803.402, "source": "autotuned"},
{"m": 7, "n": 5, "k": 13, "tile_m": 4, "tile_n": 1, "threads": 96, "grouping": 13, "minblocks": 12, "algorithm": "medium", "perf": 901.47, "source": "autotuned"},
{"m": 7, "n": 5, "k": 25, "tile_m": 2, "tile_n": 1, "threads": 64, "grouping": 8, "minblocks": 19, "algorithm": "medium", "perf": 1032.16, "source": "autotuned"},
{"m": 7, "n": 5, "k": 26, "tile_m": 4, "tile_n": 1, "threads": 32, "grouping": 3, "minblocks": 21, "algorithm": "medium", "perf": 1032.97, "source": "autotuned"},
{"m": 7, "n": 5, "k": 28, "tile_m": 4, "tile_n": 1, "threads": 32, "grouping": 4, "minblocks": 21, "algorithm": "medium", "perf": 1015.51, "source": "autotuned"},
{"m": 7, "n": 5, "k": 32, "tile_m": 4, "tile_n": 1, "threads": 32, "grouping": 2, "minblocks": 21, "algorithm": "medium", "perf": 1078.77, "source": "autotuned"},
{"m": 7, "n": 5, "k": 45, "tile_m": 2, "tile_n": 1, "w": 18, "v": 4, "threads": 32, "grouping": 16, "minblocks": 1, "algorithm": "largeDB2", "perf": 1063.7, "source": "autotuned"},
{"m": 7, "n": 6, "k": 5, "tile_m": 2, "tile_n": 1, "threads": 64, "grouping": 13, "minblocks": 23, "algorithm": "medium", "perf": 671.245, "source": "autotuned"},
{"m": 7, "n": 6, "k": 6, "tile_m": 4, "tile_n": 1, "threads": 64, "grouping": 13, "minblocks": 15, "algorithm": "medium", "perf": 748.054, "source": "autotuned"},
{"m": 7, "n": 6, "k": 7, "tile_m": 4, "tile_n": 1, "threads": 64, "grouping": 13, "minblocks": 19, "algorithm": "medium", "perf": 830.098, "source": "autotuned"},
{"m": 7, "n": 6, "k": 8, "tile_m": 4, "tile_n": 1, "threads": 64, "grouping": 13, "minblocks": 19, "algorithm": "medium", "perf": 901.674, "source": "autotuned"},
{"m": 7, "n": 6, "k": 9, "tile_m": 4, "tile_n": 1, "threads": 64, "grouping": 13, "minblocks": 15, "algorithm": "medium", "perf": 960.429, "source": "autotuned"},
{"m": 7, "n": 7, "k": 4, "tile_m": 4, "tile_n": 1, "threads": 32, "grouping": 8, "minblocks": 9, "algorithm": "medium", "perf": 712.169, "source": "autotuned"},
{"m": 7, "n": 7, "k": 6, "tile_m": 4, "tile_n": 1, "threads": 64, "grouping": 13, "minblocks": 20, "algorithm": "medium", "perf": 863.525, "source": "autotuned"},
{"m": 7, "n": 7, "k": 7, "tile_m": 4, "tile_n": 1, "threads": 64, "grouping": 13, "minblocks": 19, "algorithm": "medium", "perf": 936.883, "source": "autotuned"},
{"m": 7, "n": 7, "k": 8, "tile_m": 4, "tile_n": 1, "threads": 64, "grouping": 8, "minblocks": 24, "algorithm": "medium", "perf": 1029.45, "source": "autotuned"},
{"m": 7, "n": 7, "k": 9, "tile_m": 4, "tile_n": 1, "threads": 64, "grouping": 13, "minblocks": 20, "algorithm": "medium", "perf": 1102.84, "source": "autotuned"},
{"m": 7, "n": 7, "k": 13, "tile_m": 4, "tile_n": 1, "threads": 32, "grouping": 8, "minblocks": 7, "algorithm": "small", "perf": 1265.34, "source": "autotuned"},
{"m": 7, "n": 7, "k": 25, "tile_m": 4, "tile_n": 1, "threads": 32, "grouping": 3, "minblocks": 21, "algorithm": "medium", "perf": 1445.03, "source": "autotuned"},
{"m": 7, "n": 7, "k": 26, "tile_m": 4, "tile_n": 1, "threads": 32, "grouping": 3, "minblocks": 21, "algorithm": "medium", "perf": 1468.95, "source": "autotuned"},
{"m": 7, "n": 7, "k": 28, "tile_m": 4, "tile_n": 1, "threads": 32, "grouping": 3, "minblocks": 18, "algorithm": "medium", "perf": 1434.93, "source": "autotuned"},
{"m": 7, "n": 7, "k": 32, "tile_m": 4, "tile_n": 1, "threads": 32, "grouping": 3, "minblocks": 18, "algorithm": "medium", "perf": 1504.86, "source": "autotuned"},
{"m": 7, "n": 7, "k": 45, "tile_m": 4, "tile_n": 1, "threads": 32, "grouping": 3, "minblocks": 3, "algorithm": "medium", "perf": 1580.91, "source": "autotuned"},
{"m": 7, "n": 8, "k": 4, "tile_m": 4, "tile_n": 1, "threads": 64, "grouping": 13, "minblocks": 1, "algorithm": "medium", "perf": 753.66, "source": "autotuned"},
{"m": 7, "n": 8, "k": 5, "tile_m": 4, "tile_n": 1, "threads": 64, "grouping": 13, "minblocks": 6, "algorithm": "medium", "perf": 873.289, "source": "autotuned"},
{"m": 7, "n": 8, "k": 6, "tile_m": 4, "tile_n": 1, "threads": 64, "grouping": 8, "minblocks": 23, "algorithm": "medium", "perf": 991.381, "source": "autotuned"},
{"m": 7, "n": 8, "k": 7, "tile_m": 4, "tile_n": 1, "threads": 64, "grouping": 13, "minblocks": 15, "algorithm": "medium", "perf": 1088.45, "source": "autotuned"},
{"m": 7, "n": 8, "k": 8, "tile_m": 2, "tile_n": 1, "threads": 64, "grouping": 8, "minblocks": 25, "algorithm": "medium", "perf": 1050.33, "source": "autotuned"},
{"m": 7, "n": 8, "k": 9, "tile_m": 4, "tile_n": 1, "threads": 96, "grouping": 13, "minblocks": 13, "algorithm": "medium", "perf": 1170.64, "source": "autotuned"},
{"m": 7, "n": 9, "k": 4, "tile_m": 4, "tile_n": 1, "threads": 64, "grouping": 13, "minblocks": 4, "algorithm": "medium", "perf": 802.486, "source": "autotuned"},
{"m": 7, "n": 9, "k": 5, "tile_m": 4, "tile_n": 1, "threads": 64, "grouping": 13, "minblocks": 20, "algorithm": "medium", "perf": 934.37, "source": "autotuned"},
{"m": 7, "n": 9, "k": 6, "tile_m": 4, "tile_n": 1, "threads": 64, "grouping": 13, "minblocks": 15, "algorithm": "medium", "perf": 1034.31, "source": "autotuned"},
{"m": 7, "n": 9, "k": 7, "tile_m": 4, "tile_n": 1, "threads": 64, "grouping": 13, "minblocks": 24, "algorithm": "medium", "perf": 1138.63, "source": "autotuned"},
{"m": 7, "n": 9, "k": 8, "tile_m": 4, "tile_n": 1, "threads": 96, "grouping": 13, "minblocks": 13, "algorithm": "medium", "perf": 1152.8, "source": "autotuned"},
{"m": 7, "n": 9, "k": 9, "tile_m": 4, "tile_n": 1, "threads": 96, "grouping": 13, "minblocks": 15, "algorithm": "medium", "perf": 1230.08, "source": "autotuned"},
{"m": 7, "n": 9, "k": 13, "tile_m": 4, "tile_n": 1, "threads": 128, "grouping": 13, "minblocks": 11, "algorithm": "medium", "perf": 1386.38, "source": "autotuned"},
{"m": 7, "n": 9, "k": 25, "tile_m": 4, "tile_n": 1, "threads": 32, "grouping": 8, "minblocks": 17, "algorithm": "medium", "perf": 1485.51, "source": "autotuned"},
{"m": 7, "n": 9, "k": 26, "tile_m": 4, "tile_n": 1, "threads": 32, "grouping": 8, "minblocks": 18, "algorithm": "medium", "perf": 1512.34, "source": "autotuned"},
{"m": 7, "n": 9, "k": 28, "tile_m": 4, "tile_n": 1, "threads": 32, "grouping": 8, "minblocks": 17, "algorithm": "medium", "perf": 1531.73, "source": "autotuned"},
{"m": 7, "n": 9, "k": 32, "tile_m": 4, "tile_n": 1, "threads": 32, "grouping": 10, "minblocks": 13, "algorithm": "medium", "perf": 1568.95, "source": "autotuned"},
{"m": 7, "n": 9, "k": 45, "tile_m": 4, "tile_n": 1, "w": 16, "v": 8, "threads": 32, "grouping": 16, "minblocks": 4, "algorithm": "largeDB2", "perf": 1611.3, "source": "autotuned"},
{"m": 7, "n": 13, "k": 4, "tile_m": 4, "tile_n": 1, "threads": 64, "grouping": 13, "minblocks": 24, "algorithm": "medium", "perf": 1118.12, "source": "autotuned"},
{"m": 7, "n": 13, "k": 5, "tile_m": 4, "tile_n": 1, "threads": 96, "grouping": 13, "minblocks": 12, "algorithm": "medium", "perf": 1192.63, "source": "autotuned"},
{"m": 7, "n": 13, "k": 7, "tile_m": 4, "tile_n": 1, "threads": 96, "grouping": 13, "minblocks": 14, "algorithm": "medium", "perf": 1472.13, "source": "autotuned"},
{"m": 7, "n": 13, "k": 9, "tile_m": 4, "tile_n": 1, "threads": 64, "grouping": 10, "minblocks": 19, "algorithm": "medium", "perf": 1620.36, "source": "autotuned"},
{"m": 7, "n": 13, "k": 13, "tile_m": 4, "tile_n": 1, "threads": 96, "grouping": 10, "minblocks": 14, "algorithm": "medium", "perf": 1795.16, "source": "autotuned"},
{"m": 7, "n": 13, "k": 25, "tile_m": 4, "tile_n": 1, "threads": 32, "grouping": 10, "minblocks": 14, "algorithm": "medium", "perf": 1881.37, "source": "autotuned"},
{"m": 7, "n": 13, "k": 26, "tile_m": 4, "tile_n": 1, "threads": 32, "grouping": 10, "minblocks": 14, "algorithm": "medium", "perf": 1906.2, "source": "autotuned"},
{"m": 7, "n": 13, "k": 28, "tile_m": 4, "tile_n": 1, "w": 10, "v": 8, "threads": 32, "grouping": 16, "minblocks": 1, "algorithm": "largeDB2", "perf": 1896.43, "source": "autotuned"},
{"m": 7, "n": 13, "k": 32, "tile_m": 4, "tile_n": 1, "w": 12, "v": 8, "threads": 32, "grouping": 16, "minblocks": 1, "algorithm": "largeDB2", "perf": 1957.6, "source": "autotuned"},
{"m": 7, "n": 13, "k": 45, "tile_m": 4, "tile_n": 1, "threads": 32, "grouping": 13, "minblocks": 8, "algorithm": "medium", "perf": 1949.37, "source": "autotuned"},
{"m": 7, "n": 25, "k": 4, "tile_m": 4, "tile_n": 2, "threads": 32, "grouping": 8, "minblocks": 26, "algorithm": "medium", "perf": 1596.53, "source": "autotuned"},
{"m": 7, "n": 25, "k": 5, "tile_m": 7, "tile_n": 1, "threads": 64, "grouping": 8, "minblocks": 19, "algorithm": "medium", "perf": 1748.55, "source": "autotuned"},
{"m": 7, "n": 25, "k": 7, "tile_m": 4, "tile_n": 2, "threads": 64, "grouping": 8, "minblocks": 19, "algorithm": "medium", "perf": 2047.77, "source": "autotuned"},
{"m": 7, "n": 25, "k": 9, "tile_m": 4, "tile_n": 2, "threads": 64, "grouping": 10, "minblocks": 15, "algorithm": "medium", "perf": 2223.48, "source": "autotuned"},
{"m": 7, "n": 25, "k": 13, "tile_m": 4, "tile_n": 2, "threads": 32, "grouping": 8, "minblocks": 17, "algorithm": "medium", "perf": 2294.06, "source": "autotuned"},
{"m": 7, "n": 25, "k": 25, "tile_m": 4, "tile_n": 2, "threads": 32, "grouping": 13, "minblocks": 2, "algorithm": "medium", "perf": 2292.09, "source": "autotuned"},
{"m": 7, "n": 25, "k": 26, "tile_m": 4, "tile_n": 2, "threads": 32, "grouping": 13, "minblocks": 7, "algorithm": "medium", "perf": 2294.06, "source": "autotuned"},
{"m": 7, "n": 25, "k": 28, "tile_m": 4, "tile_n": 2, "threads": 32, "grouping": 3, "minblocks": 2, "algorithm": "medium", "perf": 2252.54, "source": "autotuned"},
{"m": 7, "n": 25, "k": 32, "tile_m": 4, "tile_n": 2, "threads": 32, "grouping": 3, "minblocks": 6, "algorithm": "medium", "perf": 2263.64, "source": "autotuned"},
{"m": 7, "n": 25, "k": 45, "tile_m": 4, "tile_n": 2, "threads": 32, "grouping": 3, "minblocks": 1, "algorithm": "medium", "perf": 2098.05, "source": "autotuned"},
{"m": 7, "n": 26, "k": 4, "tile_m": 4, "tile_n": 2, "threads": 32, "grouping": 8, "minblocks": 26, "algorithm": "medium", "perf": 1727.1, "source": "autotuned"},
{"m": 7, "n": 26, "k": 5, "tile_m": 7, "tile_n": 1, "threads": 64, "grouping": 10, "minblocks": 19, "algorithm": "medium", "perf": 1728.05, "source": "autotuned"},
{"m": 7, "n": 26, "k": 7, "tile_m": 7, "tile_n": 1, "threads": 64, "grouping": 10, "minblocks": 19, "algorithm": "medium", "perf": 2071.82, "source": "autotuned"},
{"m": 7, "n": 26, "k": 9, "tile_m": 4, "tile_n": 2, "threads": 64, "grouping": 10, "minblocks": 15, "algorithm": "medium", "perf": 2373.67, "source": "autotuned"},
{"m": 7, "n": 26, "k": 13, "tile_m": 4, "tile_n": 2, "threads": 32, "grouping": 8, "minblocks": 17, "algorithm": "medium", "perf": 2311.27, "source": "autotuned"},
{"m": 7, "n": 26, "k": 25, "tile_m": 7, "tile_n": 1, "threads": 32, "grouping": 13, "minblocks": 9, "algorithm": "medium", "perf": 2306.46, "source": "autotuned"},
{"m": 7, "n": 26, "k": 26, "tile_m": 4, "tile_n": 2, "threads": 32, "grouping": 13, "minblocks": 7, "algorithm": "medium", "perf": 2287.44, "source": "autotuned"},
{"m": 7, "n": 26, "k": 28, "tile_m": 4, "tile_n": 2, "threads": 32, "grouping": 4, "minblocks": 1, "algorithm": "medium", "perf": 2254.24, "source": "autotuned"},
{"m": 7, "n": 26, "k": 32, "tile_m": 4, "tile_n": 2, "threads": 32, "grouping": 4, "minblocks": 2, "algorithm": "medium", "perf": 2294.83, "source": "autotuned"},
{"m": 7, "n": 26, "k": 45, "tile_m": 4, "tile_n": 2, "w": 16, "v": 18, "threads": 32, "grouping": 16, "minblocks": 12, "algorithm": "largeDB2", "perf": 2139.42, "source": "autotuned"},
{"m": 7, "n": 28, "k": 4, "tile_m": 4, "tile_n": 2, "threads": 32, "grouping": 8, "minblocks": 26, "algorithm": "medium", "perf": 1838.07, "source": "autotuned"},
{"m": 7, "n": 28, "k": 5, "tile_m": 7, "tile_n": 1, "threads": 64, "grouping": 10, "minblocks": 19, "algorithm": "medium", "perf": 1828.93, "source": "autotuned"},
{"m": 7, "n": 28, "k": 7, "tile_m": 7, "tile_n": 1, "threads": 64, "grouping": 10, "minblocks": 19, "algorithm": "medium", "perf": 2109.27, "source": "autotuned"},
{"m": 7, "n": 28, "k": 9, "tile_m": 4, "tile_n": 2, "threads": 64, "grouping": 10, "minblocks": 15, "algorithm": "medium", "perf": 2506.46, "source": "autotuned"},
{"m": 7, "n": 28, "k": 13, "tile_m": 7, "tile_n": 1, "threads": 96, "grouping": 13, "minblocks": 11, "algorithm": "medium", "perf": 2413.63, "source": "autotuned"},
{"m": 7, "n": 28, "k": 25, "tile_m": 7, "tile_n": 1, "threads": 32, "grouping": 13, "minblocks": 9, "algorithm": "medium", "perf": 2320.8, "source": "autotuned"},
{"m": 7, "n": 28, "k": 26, "tile_m": 4, "tile_n": 2, "threads": 32, "grouping": 13, "minblocks": 5, "algorithm": "medium", "perf": 2286.6, "source": "autotuned"},
{"m": 7, "n": 28, "k": 28, "tile_m": 4, "tile_n": 2, "threads": 32, "grouping": 4, "minblocks": 2, "algorithm": "medium", "perf": 2287.38, "source": "autotuned"},
{"m": 7, "n": 28, "k": 32, "tile_m": 4, "tile_n": 2, "threads": 32, "grouping": 19, "minblocks": 4, "algorithm": "medium", "perf": 2288.65, "source": "autotuned"},
{"m": 7, "n": 28, "k": 45, "tile_m": 2, "tile_n": 4, "w": 18, "v": 24, "threads": 32, "grouping": 16, "minblocks": 12, "algorithm": "largeDB2", "perf": 2148.4, "source": "autotuned"},
{"m": 7, "n": 32, "k": 4, "tile_m": 4, "tile_n": 2, "threads": 32, "grouping": 8, "minblocks": 21, "algorithm": "medium", "perf": 2000.62, "source": "autotuned"},
{"m": 7, "n": 32, "k": 5, "tile_m": 7, "tile_n": 1, "threads": 64, "grouping": 10, "minblocks": 19, "algorithm": "medium", "perf": 2116.05, "source": "autotuned"},
{"m": 7, "n": 32, "k": 7, "tile_m": 7, "tile_n": 1, "threads": 64, "grouping": 10, "minblocks": 20, "algorithm": "medium", "perf": 2399.35, "source": "autotuned"},
{"m": 7, "n": 32, "k": 9, "tile_m": 4, "tile_n": 2, "threads": 64, "grouping": 10, "minblocks": 15, "algorithm": "medium", "perf": 2720.27, "source": "autotuned"},
{"m": 7, "n": 32, "k": 13, "tile_m": 7, "tile_n": 1, "threads": 96, "grouping": 13, "minblocks": 12, "algorithm": "medium", "perf": 2511.13, "source": "autotuned"},
{"m": 7, "n": 32, "k": 25, "tile_m": 4, "tile_n": 2, "threads": 32, "grouping": 3, "minblocks": 7, "algorithm": "medium", "perf": 2365.6, "source": "autotuned"},
{"m": 7, "n": 32, "k": 26, "tile_m": 4, "tile_n": 2, "threads": 32, "grouping": 4, "minblocks": 3, "algorithm": "medium", "perf": 2354.18, "source": "autotuned"},
{"m": 7, "n": 32, "k": 28, "tile_m": 4, "tile_n": 2, "threads": 32, "grouping": 3, "minblocks": 7, "algorithm": "medium", "perf": 2324.84, "source": "autotuned"},
{"m": 7, "n": 32, "k": 32, "tile_m": 4, "tile_n": 2, "w": 12, "v": 28, "threads": 32, "grouping": 16, "minblocks": 8, "algorithm": "largeDB2", "perf": 2286.43, "source": "autotuned"},
{"m": 7, "n": 32, "k": 45, "tile_m": 7, "tile_n": 1, "threads": 32, "grouping": 2, "minblocks": 1, "algorithm": "medium", "perf": 2183.13, "source": "autotuned"},
{"m": 7, "n": 45, "k": 4, "tile_m": 4, "tile_n": 3, "threads": 32, "grouping": 10, "minblocks": 21, "algorithm": "medium", "perf": 2316.9, "source": "autotuned"},
{"m": 7, "n": 45, "k": 5, "tile_m": 4, "tile_n": 3, "threads": 64, "grouping": 10, "minblocks": 15, "algorithm": "medium", "perf": 2444.25, "source": "autotuned"},
{"m": 7, "n": 45, "k": 7, "tile_m": 4, "tile_n": 3, "threads": 64, "grouping": 10, "minblocks": 15, "algorithm": "medium", "perf": 2651.07, "source": "autotuned"},
{"m": 7, "n": 45, "k": 9, "tile_m": 4, "tile_n": 3, "threads": 64, "grouping": 13, "minblocks": 12, "algorithm": "medium", "perf": 2625.82, "source": "autotuned"},
{"m": 7, "n": 45, "k": 13, "tile_m": 4, "tile_n": 3, "threads": 32, "grouping": 13, "minblocks": 8, "algorithm": "medium", "perf": 2509.98, "source": "autotuned"},
{"m": 7, "n": 45, "k": 25, "tile_m": 7, "tile_n": 2, "threads": 32, "grouping": 3, "minblocks": 1, "algorithm": "medium", "perf": 2300.66, "source": "autotuned"},
{"m": 7, "n": 45, "k": 26, "tile_m": 4, "tile_n": 3, "w": 10, "v": 36, "threads": 32, "grouping": 16, "minblocks": 12, "algorithm": "largeDB2", "perf": 2299.56, "source": "autotuned"},
{"m": 7, "n": 45, "k": 28, "tile_m": 4, "tile_n": 3, "threads": 32, "grouping": 3, "minblocks": 1, "algorithm": "medium", "perf": 2297.59, "source": "autotuned"},
{"m": 7, "n": 45, "k": 32, "tile_m": 4, "tile_n": 3, "threads": 32, "grouping": 2, "minblocks": 4, "algorithm": "medium", "perf": 2294.41, "source": "autotuned"},
{"m": 7, "n": 45, "k": 45, "tile_m": 2, "tile_n": 3, "threads": 64, "grouping": 3, "minblocks": 1, "algorithm": "medium", "perf": 2200.86, "source": "autotuned"},
{"m": 8, "n": 4, "k": 4, "tile_m": 1, "tile_n": 1, "threads": 32, "grouping": 5, "minblocks": 15, "algorithm": "small", "perf": 474.476, "source": "autotuned"},
{"m": 8, "n": 4, "k": 5, "tile_m": 1, "tile_n": 1, "threads": 64, "grouping": 14, "minblocks": 4, "algorithm": "medium", "perf": 577.103, "source": "autotuned"},
{"m": 8, "n": 4, "k": 6, "tile_m": 1, "tile_n": 1, "threads": 64, "grouping": 15, "minblocks": 2, "algorithm": "medium", "perf": 662.346, "source": "autotuned"},
{"m": 8, "n": 4, "k": 7, "tile_m": 1, "tile_n": 1, "threads": 64, "grouping": 15, "minblocks": 6, "algorithm": "medium", "perf": 734.962, "source": "autotuned"},
{"m": 8, "n": 4, "k": 8, "tile_m": 1, "tile_n": 1, "threads": 32, "grouping": 5, "minblocks": 4, "algorithm": "small", "perf": 735.862, "source": "autotuned"},
{"m": 8, "n": 5, "k": 5, "tile_m": 1, "tile_n": 2, "threads": 64, "grouping": 13, "minblocks": 3, "algorithm": "medium", "perf": 651.464, "source": "autotuned"},
{"m": 8, "n": 5, "k": 6, "tile_m": 1, "tile_n": 2, "threads": 64, "grouping": 13, "minblocks": 24, "algorithm": "medium", "perf": 745.931, "source": "autotuned"},
{"m": 8, "n": 5, "k": 7, "tile_m": 1, "tile_n": 2, "threads": 64, "grouping": 13, "minblocks": 19, "algorithm": "medium", "perf": 805.691, "source": "autotuned"},
{"m": 8, "n": 6, "k": 4, "tile_m": 1, "tile_n": 2, "threads": 64, "grouping": 13, "minblocks": 20, "algorithm": "medium", "perf": 668.017, "source": "autotuned"},
{"m": 8, "n": 6, "k": 5, "tile_m": 1, "tile_n": 2, "threads": 64, "grouping": 13, "minblocks": 22, "algorithm": "medium", "perf": 781.807, "source": "autotuned"},
{"m": 8, "n": 6, "k": 7, "tile_m": 1, "tile_n": 2, "threads": 64, "grouping": 13, "minblocks": 23, "algorithm": "medium", "perf": 978.895, "source": "autotuned"},
{"m": 8, "n": 6, "k": 8, "tile_m": 1, "tile_n": 2, "threads": 64, "grouping": 8, "minblocks": 21, "algorithm": "medium", "perf": 960.3, "source": "autotuned"},
{"m": 8, "n": 6, "k": 9, "tile_m": 1, "tile_n": 2, "threads": 96, "grouping": 13, "minblocks": 15, "algorithm": "medium", "perf": 1041.65, "source": "autotuned"},
{"m": 8, "n": 7, "k": 5, "tile_m": 1, "tile_n": 2, "threads": 64, "grouping": 13, "minblocks": 23, "algorithm": "medium", "perf": 904.038, "source": "autotuned"},
{"m": 8, "n": 7, "k": 6, "tile_m": 1, "tile_n": 2, "threads": 64, "grouping": 13, "minblocks": 23, "algorithm": "medium", "perf": 1033.57, "source": "autotuned"},
{"m": 8, "n": 7, "k": 8, "tile_m": 1, "tile_n": 2, "threads": 64, "grouping": 8, "minblocks": 25, "algorithm": "medium", "perf": 1099.18, "source": "autotuned"},
{"m": 8, "n": 7, "k": 9, "tile_m": 1, "tile_n": 2, "threads": 96, "grouping": 19, "minblocks": 10, "algorithm": "medium", "perf": 1200.37, "source": "autotuned"},
{"m": 8, "n": 8, "k": 4, "tile_m": 4, "tile_n": 1, "threads": 64, "grouping": 8, "minblocks": 24, "algorithm": "medium", "perf": 905.943, "source": "autotuned"},
{"m": 8, "n": 8, "k": 8, "tile_m": 1, "tile_n": 2, "threads": 64, "grouping": 10, "minblocks": 3, "algorithm": "small", "perf": 1324.55, "source": "autotuned"},
{"m": 8, "n": 8, "k": 9, "tile_m": 1, "tile_n": 2, "threads": 32, "grouping": 8, "minblocks": 3, "algorithm": "small", "perf": 1400.44, "source": "autotuned"},
{"m": 8, "n": 9, "k": 4, "tile_m": 1, "tile_n": 3, "threads": 64, "grouping": 13, "minblocks": 24, "algorithm": "medium", "perf": 919.527, "source": "autotuned"},
{"m": 8, "n": 9, "k": 6, "tile_m": 4, "tile_n": 1, "threads": 64, "grouping": 13, "minblocks": 20, "algorithm": "medium", "perf": 1192.8, "source": "autotuned"},
{"m": 8, "n": 9, "k": 8, "tile_m": 4, "tile_n": 1, "threads": 96, "grouping": 13, "minblocks": 14, "algorithm": "medium", "perf": 1312.91, "source": "autotuned"},
{"m": 8, "n": 9, "k": 9, "tile_m": 4, "tile_n": 1, "threads": 96, "grouping": 13, "minblocks": 15, "algorithm": "medium", "perf": 1389.42, "source": "autotuned"},
{"m": 9, "n": 4, "k": 4, "tile_m": 1, "tile_n": 4, "threads": 64, "grouping": 8, "minblocks": 23, "algorithm": "medium", "perf": 484.507, "source": "autotuned"},
{"m": 9, "n": 4, "k": 5, "tile_m": 1, "tile_n": 4, "threads": 64, "grouping": 8, "minblocks": 23, "algorithm": "medium", "perf": 559.433, "source": "autotuned"},
{"m": 9, "n": 4, "k": 6, "tile_m": 1, "tile_n": 4, "threads": 64, "grouping": 13, "minblocks": 15, "algorithm": "medium", "perf": 633.01, "source": "autotuned"},
{"m": 9, "n": 4, "k": 7, "tile_m": 1, "tile_n": 4, "threads": 64, "grouping": 13, "minblocks": 15, "algorithm": "medium", "perf": 698.003, "source": "autotuned"},
{"m": 9, "n": 4, "k": 9, "tile_m": 1, "tile_n": 4, "threads": 96, "grouping": 13, "minblocks": 13, "algorithm": "medium", "perf": 727.543, "source": "autotuned"},
{"m": 9, "n": 4, "k": 13, "tile_m": 1, "tile_n": 4, "threads": 64, "grouping": 5, "minblocks": 26, "algorithm": "medium", "perf": 847.147, "source": "autotuned"},
{"m": 9, "n": 4, "k": 22, "tile_m": 1, "tile_n": 4, "threads": 32, "grouping": 3, "minblocks": 25, "algorithm": "medium", "perf": 937.793, "source": "autotuned"},
{"m": 9, "n": 4, "k": 23, "tile_m": 1, "tile_n": 4, "threads": 96, "grouping": 10, "minblocks": 14, "algorithm": "medium", "perf": 973.048, "source": "autotuned"},
{"m": 9, "n": 4, "k": 25, "tile_m": 1, "tile_n": 2, "threads": 128, "grouping": 10, "minblocks": 14, "algorithm": "medium", "perf": 975.305, "source": "autotuned"},
{"m": 9, "n": 4, "k": 26, "tile_m": 2, "tile_n": 1, "threads": 128, "grouping": 10, "minblocks": 14, "algorithm": "medium", "perf": 960.527, "source": "autotuned"},
{"m": 9, "n": 4, "k": 28, "tile_m": 2, "tile_n": 1, "threads": 128, "grouping": 10, "minblocks": 14, "algorithm": "medium", "perf": 984.683, "source": "autotuned"},
{"m": 9, "n": 4, "k": 32, "tile_m": 1, "tile_n": 4, "threads": 32, "grouping": 3, "minblocks": 17, "algorithm": "medium", "perf": 1008.72, "source": "autotuned"},
{"m": 9, "n": 5, "k": 4, "tile_m": 1, "tile_n": 1, "threads": 64, "grouping": 5, "minblocks": 12, "algorithm": "medium", "perf": 570.112, "source": "autotuned"},
{"m": 9, "n": 5, "k": 5, "tile_m": 1, "tile_n": 1, "threads": 64, "grouping": 6, "minblocks": 25, "algorithm": "medium", "perf": 662.397, "source": "autotuned"},
{"m": 9, "n": 5, "k": 6, "tile_m": 1, "tile_n": 1, "threads": 64, "grouping": 5, "minblocks": 2, "algorithm": "medium", "perf": 735.315, "source": "autotuned"},
{"m": 9, "n": 5, "k": 8, "tile_m": 1, "tile_n": 1, "threads": 96, "grouping": 6, "minblocks": 14, "algorithm": "medium", "perf": 819.314, "source": "autotuned"},
{"m": 9, "n": 5, "k": 9, "tile_m": 1, "tile_n": 1, "threads": 96, "grouping": 6, "minblocks": 14, "algorithm": "medium", "perf": 867.137, "source": "autotuned"},
{"m": 9, "n": 5, "k": 13, "tile_m": 1, "tile_n": 1, "threads": 128, "grouping": 6, "minblocks": 13, "algorithm": "medium", "perf": 972.218, "source": "autotuned"},
{"m": 9, "n": 5, "k": 16, "tile_m": 2, "tile_n": 1, "threads": 96, "grouping": 10, "minblocks": 19, "algorithm": "medium", "perf": 1048.27, "source": "autotuned"},
{"m": 9, "n": 5, "k": 22, "tile_m": 2, "tile_n": 1, "threads": 128, "grouping": 10, "minblocks": 13, "algorithm": "medium", "perf": 1111.87, "source": "autotuned"},
{"m": 9, "n": 5, "k": 23, "tile_m": 2, "tile_n": 1, "threads": 128, "grouping": 10, "minblocks": 16, "algorithm": "medium", "perf": 1122.1, "source": "autotuned"},
{"m": 9, "n": 5, "k": 25, "tile_m": 1, "tile_n": 2, "threads": 128, "grouping": 10, "minblocks": 13, "algorithm": "medium", "perf": 1137.76, "source": "autotuned"},
{"m": 9, "n": 5, "k": 26, "tile_m": 1, "tile_n": 2, "threads": 256, "grouping": 19, "minblocks": 8, "algorithm": "medium", "perf": 1115.06, "source": "autotuned"},
{"m": 9, "n": 5, "k": 32, "tile_m": 2, "tile_n": 1, "threads": 32, "grouping": 10, "minblocks": 11, "algorithm": "medium", "perf": 1128.88, "source": "autotuned"},
{"m": 9, "n": 5, "k": 45, "tile_m": 1, "tile_n": 2, "w": 16, "v": 4, "threads": 32, "grouping": 16, "minblocks": 12, "algorithm": "largeDB2", "perf": 1137.14, "source": "autotuned"},
{"m": 9, "n": 6, "k": 4, "tile_m": 1, "tile_n": 2, "threads": 64, "grouping": 15, "minblocks": 21, "algorithm": "medium", "perf": 676.398, "source": "autotuned"},
{"m": 9, "n": 6, "k": 5, "tile_m": 1, "tile_n": 2, "threads": 64, "grouping": 15, "minblocks": 23, "algorithm": "medium", "perf": 787.518, "source": "autotuned"},
{"m": 9, "n": 6, "k": 6, "tile_m": 1, "tile_n": 2, "threads": 64, "grouping": 15, "minblocks": 25, "algorithm": "medium", "perf": 874.705, "source": "autotuned"},
{"m": 9, "n": 6, "k": 7, "tile_m": 1, "tile_n": 2, "threads": 64, "grouping": 15, "minblocks": 26, "algorithm": "medium", "perf": 955.721, "source": "autotuned"},
{"m": 9, "n": 6, "k": 8, "tile_m": 1, "tile_n": 2, "threads": 96, "grouping": 15, "minblocks": 19, "algorithm": "medium", "perf": 979.581, "source": "autotuned"},
{"m": 9, "n": 7, "k": 4, "tile_m": 6, "tile_n": 1, "threads": 64, "grouping": 13, "minblocks": 11, "algorithm": "medium", "perf": 761.332, "source": "autotuned"},
{"m": 9, "n": 7, "k": 5, "tile_m": 6, "tile_n": 1, "threads": 64, "grouping": 13, "minblocks": 17, "algorithm": "medium", "perf": 880.794, "source": "autotuned"},
{"m": 9, "n": 7, "k": 7, "tile_m": 6, "tile_n": 1, "threads": 64, "grouping": 8, "minblocks": 20, "algorithm": "medium", "perf": 1072.21, "source": "autotuned"},
{"m": 9, "n": 7, "k": 9, "tile_m": 6, "tile_n": 1, "threads": 96, "grouping": 13, "minblocks": 12, "algorithm": "medium", "perf": 1143.5, "source": "autotuned"},
{"m": 9, "n": 7, "k": 13, "tile_m": 6, "tile_n": 1, "threads": 128, "grouping": 19, "minblocks": 8, "algorithm": "medium", "perf": 1250.9, "source": "autotuned"},
{"m": 9, "n": 7, "k": 25, "tile_m": 5, "tile_n": 1, "threads": 32, "grouping": 8, "minblocks": 18, "algorithm": "medium", "perf": 1330.65, "source": "autotuned"},
{"m": 9, "n": 7, "k": 28, "tile_m": 1, "tile_n": 1, "threads": 256, "grouping": 4, "minblocks": 7, "algorithm": "medium", "perf": 1383.5, "source": "autotuned"},
{"m": 9, "n": 7, "k": 32, "tile_m": 5, "tile_n": 1, "threads": 32, "grouping": 10, "minblocks": 15, "algorithm": "medium", "perf": 1421.5, "source": "autotuned"},
{"m": 9, "n": 8, "k": 4, "tile_m": 6, "tile_n": 1, "threads": 64, "grouping": 8, "minblocks": 20, "algorithm": "medium", "perf": 873.862, "source": "autotuned"},
{"m": 9, "n": 8, "k": 5, "tile_m": 6, "tile_n": 1, "threads": 64, "grouping": 8, "minblocks": 20, "algorithm": "medium", "perf": 999.007, "source": "autotuned"},
{"m": 9, "n": 8, "k": 6, "tile_m": 6, "tile_n": 1, "threads": 64, "grouping": 8, "minblocks": 20, "algorithm": "medium", "perf": 1108.85, "source": "autotuned"},
{"m": 9, "n": 8, "k": 8, "tile_m": 6, "tile_n": 1, "threads": 96, "grouping": 13, "minblocks": 12, "algorithm": "medium", "perf": 1231.66, "source": "autotuned"},
{"m": 9, "n": 9, "k": 4, "tile_m": 5, "tile_n": 1, "threads": 64, "grouping": 13, "minblocks": 19, "algorithm": "medium", "perf": 934.151, "source": "autotuned"},
{"m": 9, "n": 9, "k": 5, "tile_m": 5, "tile_n": 1, "threads": 64, "grouping": 13, "minblocks": 20, "algorithm": "medium", "perf": 1085.16, "source": "autotuned"},
{"m": 9, "n": 9, "k": 6, "tile_m": 5, "tile_n": 1, "threads": 64, "grouping": 10, "minblocks": 23, "algorithm": "medium", "perf": 1186.89, "source": "autotuned"},
{"m": 9, "n": 9, "k": 7, "tile_m": 5, "tile_n": 1, "threads": 64, "grouping": 13, "minblocks": 20, "algorithm": "medium", "perf": 1312.91, "source": "autotuned"},
{"m": 9, "n": 9, "k": 8, "tile_m": 5, "tile_n": 1, "threads": 32, "grouping": 10, "minblocks": 2, "algorithm": "small", "perf": 1350.42, "source": "autotuned"},
{"m": 9, "n": 9, "k": 9, "tile_m": 5, "tile_n": 1, "threads": 32, "grouping": 10, "minblocks": 1, "algorithm": "small", "perf": 1424.27, "source": "autotuned"},
{"m": 9, "n": 9, "k": 10, "tile_m": 5, "tile_n": 1, "threads": 32, "grouping": 10, "minblocks": 1, "algorithm": "small", "perf": 1507.17, "source": "autotuned"},
{"m": 9, "n": 9, "k": 12, "tile_m": 5, "tile_n": 1, "threads": 128, "grouping": 13, "minblocks": 12, "algorithm": "medium", "perf": 1531.99, "source": "autotuned"},
{"m": 9, "n": 9, "k": 13, "tile_m": 5, "tile_n": 1, "threads": 128, "grouping": 13, "minblocks": 11, "algorithm": "medium", "perf": 1567.45, "source": "autotuned"},
{"m": 9, "n": 9, "k": 16, "tile_m": 5, "tile_n": 1, "threads": 32, "grouping": 4, "minblocks": 26, "algorithm": "medium", "perf": 1688.03, "source": "autotuned"},
{"m": 9, "n": 9, "k": 17, "tile_m": 5, "tile_n": 1, "threads": 160, "grouping": 19, "minblocks": 8, "algorithm": "medium", "perf": 1684.36, "source": "autotuned"},
{"m": 9, "n": 9, "k": 22, "tile_m": 5, "tile_n": 1, "threads": 32, "grouping": 3, "minblocks": 18, "algorithm": "medium", "perf": 1733.04, "source": "autotuned"},
{"m": 9, "n": 9, "k": 23, "tile_m": 5, "tile_n": 1, "threads": 32, "grouping": 4, "minblocks": 17, "algorithm": "medium", "perf": 1747.11, "source": "autotuned"},
{"m": 9, "n": 9, "k": 25, "tile_m": 5, "tile_n": 1, "threads": 32, "grouping": 3, "minblocks": 17, "algorithm": "medium", "perf": 1774.8, "source": "autotuned"},
{"m": 9, "n": 9, "k": 26, "tile_m": 5, "tile_n": 1, "threads": 32, "grouping": 3, "minblocks": 17, "algorithm": "medium", "perf": 1750.88, "source": "autotuned"},
{"m": 9, "n": 9, "k": 28, "tile_m": 5, "tile_n": 1, "threads": 32, "grouping": 10, "minblocks": 1, "algorithm": "medium", "perf": 1754.88, "source": "autotuned"},
{"m": 9, "n": 9, "k": 45, "tile_m": 5, "tile_n": 1, "threads": 32, "grouping": 13, "minblocks": 1, "algorithm": "medium", "perf": 1837.77, "source": "autotuned"},
{"m": 9, "n": 10, "k": 10, "tile_m": 5, "tile_n": 1, "threads": 128, "grouping": 13, "minblocks": 11, "algorithm": "medium", "perf": 1523.91, "source": "autotuned"},
{"m": 9, "n": 10, "k": 32, "tile_m": 5, "tile_n": 1, "threads": 32, "grouping": 10, "minblocks": 13, "algorithm": "medium", "perf": 1856.25, "source": "autotuned"},
{"m": 9, "n": 12, "k": 9, "tile_m": 5, "tile_n": 1, "threads": 128, "grouping": 13, "minblocks": 11, "algorithm": "medium", "perf": 1711.8, "source": "autotuned"},
{"m": 9, "n": 12, "k": 10, "tile_m": 5, "tile_n": 1, "threads": 128, "grouping": 13, "minblocks": 11, "algorithm": "medium", "perf": 1802.75, "source": "autotuned"},
{"m": 9, "n": 12, "k": 32, "tile_m": 5, "tile_n": 1, "w": 12, "v": 6, "threads": 32, "grouping": 16, "minblocks": 1, "algorithm": "largeDB2", "perf": 2104.55, "source": "autotuned"},
{"m": 9, "n": 13, "k": 4, "tile_m": 5, "tile_n": 1, "threads": 64, "grouping": 13, "minblocks": 19, "algorithm": "medium", "perf": 1316.16, "source": "autotuned"},
{"m": 9, "n": 13, "k": 5, "tile_m": 5, "tile_n": 1, "threads": 96, "grouping": 15, "minblocks": 11, "algorithm": "medium", "perf": 1396.46, "source": "autotuned"},
{"m": 9, "n": 13, "k": 9, "tile_m": 5, "tile_n": 1, "threads": 128, "grouping": 13, "minblocks": 12, "algorithm": "medium", "perf": 1828.7, "source": "autotuned"},
{"m": 9, "n": 13, "k": 13, "tile_m": 5, "tile_n": 1, "threads": 32, "grouping": 8, "minblocks": 18, "algorithm": "medium", "perf": 1940.66, "source": "autotuned"},
{"m": 9, "n": 13, "k": 16, "tile_m": 5, "tile_n": 1, "threads": 32, "grouping": 8, "minblocks": 21, "algorithm": "medium", "perf": 2053.27, "source": "autotuned"},
{"m": 9, "n": 13, "k": 22, "tile_m": 5, "tile_n": 1, "threads": 32, "grouping": 10, "minblocks": 13, "algorithm": "medium", "perf": 2063.14, "source": "autotuned"},
{"m": 9, "n": 13, "k": 23, "tile_m": 5, "tile_n": 1, "w": 8, "v": 10, "threads": 32, "grouping": 16, "minblocks": 4, "algorithm": "largeDB2", "perf": 2089.94, "source": "autotuned"},
{"m": 9, "n": 13, "k": 26, "tile_m": 5, "tile_n": 1, "w": 10, "v": 12, "threads": 32, "grouping": 16, "minblocks": 2, "algorithm": "largeDB2", "perf": 2113.16, "source": "autotuned"},
{"m": 9, "n": 16, "k": 5, "tile_m": 5, "tile_n": 1, "threads": 96, "grouping": 13, "minblocks": 13, "algorithm": "medium", "perf": 1715.78, "source": "autotuned"},
{"m": 9, "n": 16, "k": 9, "tile_m": 5, "tile_n": 1, "threads": 160, "grouping": 19, "minblocks": 8, "algorithm": "medium", "perf": 2095.48, "source": "autotuned"},
{"m": 9, "n": 16, "k": 13, "tile_m": 5, "tile_n": 1, "threads": 32, "grouping": 8, "minblocks": 22, "algorithm": "medium", "perf": 2294.83, "source": "autotuned"},
{"m": 9, "n": 16, "k": 16, "tile_m": 5, "tile_n": 1, "threads": 32, "grouping": 8, "minblocks": 19, "algorithm": "medium", "perf": 2466.52, "source": "autotuned"},
{"m": 9, "n": 16, "k": 17, "tile_m": 5, "tile_n": 1, "threads": 32, "grouping": 8, "minblocks": 17, "algorithm": "medium", "perf": 2452.69, "source": "autotuned"},
{"m": 9, "n": 16, "k": 22, "tile_m": 5, "tile_n": 1, "threads": 32, "grouping": 10, "minblocks": 13, "algorithm": "medium", "perf": 2357.88, "source": "autotuned"},
{"m": 9, "n": 16, "k": 23, "tile_m": 5, "tile_n": 1, "w": 8, "v": 16, "threads": 32, "grouping": 16, "minblocks": 12, "algorithm": "largeDB2", "perf": 2389.21, "source": "autotuned"},
{"m": 9, "n": 17, "k": 9, "tile_m": 2, "tile_n": 3, "threads": 160, "grouping": 19, "minblocks": 8, "algorithm": "medium", "perf": 1927.37, "source": "autotuned"},
{"m": 9, "n": 17, "k": 16, "tile_m": 3, "tile_n": 2, "threads": 32, "grouping": 8, "minblocks": 18, "algorithm": "medium", "perf": 2102.31, "source": "autotuned"},
{"m": 9, "n": 17, "k": 17, "tile_m": 2, "tile_n": 3, "threads": 32, "grouping": 8, "minblocks": 17, "algorithm": "medium", "perf": 2071.51, "source": "autotuned"},
{"m": 9, "n": 17, "k": 22, "tile_m": 2, "tile_n": 3, "threads": 32, "grouping": 10, "minblocks": 13, "algorithm": "medium", "perf": 2090.47, "source": "autotuned"},
{"m": 9, "n": 17, "k": 23, "tile_m": 2, "tile_n": 3, "w": 8, "v": 16, "threads": 32, "grouping": 16, "minblocks": 1, "algorithm": "largeDB2", "perf": 2142.92, "source": "autotuned"},
{"m": 9, "n": 22, "k": 4, "tile_m": 5, "tile_n": 2, "threads": 96, "grouping": 13, "minblocks": 12, "algorithm": "medium", "perf": 1785.41, "source": "autotuned"},
{"m": 9, "n": 22, "k": 9, "tile_m": 5, "tile_n": 2, "threads": 32, "grouping": 10, "minblocks": 7, "algorithm": "medium", "perf": 2228.2, "source": "autotuned"},
{"m": 9, "n": 22, "k": 13, "tile_m": 5, "tile_n": 2, "threads": 32, "grouping": 8, "minblocks": 18, "algorithm": "medium", "perf": 2384.08, "source": "autotuned"},
{"m": 9, "n": 22, "k": 16, "tile_m": 5, "tile_n": 2, "threads": 32, "grouping": 10, "minblocks": 13, "algorithm": "medium", "perf": 2357.88, "source": "autotuned"},
{"m": 9, "n": 22, "k": 17, "tile_m": 5, "tile_n": 2, "threads": 32, "grouping": 10, "minblocks": 13, "algorithm": "medium", "perf": 2373.39, "source": "autotuned"},
{"m": 9, "n": 22, "k": 22, "tile_m": 5, "tile_n": 2, "w": 8, "v": 22, "threads": 32, "grouping": 16, "minblocks": 4, "algorithm": "largeDB2", "perf": 2446.12, "source": "autotuned"},
{"m": 9, "n": 22, "k": 23, "tile_m": 5, "tile_n": 2, "w": 8, "v": 22, "threads": 32, "grouping": 16, "minblocks": 1, "algorithm": "largeDB2", "perf": 2468.62, "source": "autotuned"},
{"m": 9, "n": 22, "k": 26, "tile_m": 9, "tile_n": 1, "w": 10, "v": 22, "threads": 32, "grouping": 16, "minblocks": 8, "algorithm": "largeDB2", "perf": 2475.77, "source": "autotuned"},
{"m": 9, "n": 23, "k": 4, "tile_m": 5, "tile_n": 2, "threads": 96, "grouping": 13, "minblocks": 11, "algorithm": "medium", "perf": 1822.75, "source": "autotuned"},
{"m": 9, "n": 23, "k": 5, "tile_m": 5, "tile_n": 2, "threads": 128, "grouping": 19, "minblocks": 8, "algorithm": "medium", "perf": 1903.17, "source": "autotuned"},
{"m": 9, "n": 23, "k": 9, "tile_m": 5, "tile_n": 2, "threads": 32, "grouping": 8, "minblocks": 22, "algorithm": "medium", "perf": 2329.48, "source": "autotuned"},
{"m": 9, "n": 23, "k": 13, "tile_m": 5, "tile_n": 2, "threads": 32, "grouping": 8, "minblocks": 17, "algorithm": "medium", "perf": 2492.45, "source": "autotuned"},
{"m": 9, "n": 23, "k": 16, "tile_m": 5, "tile_n": 2, "threads": 32, "grouping": 10, "minblocks": 13, "algorithm": "medium", "perf": 2465.06, "source": "autotuned"},
{"m": 9, "n": 23, "k": 17, "tile_m": 5, "tile_n": 2, "threads": 32, "grouping": 10, "minblocks": 13, "algorithm": "medium", "perf": 2444.51, "source": "autotuned"},
{"m": 9, "n": 23, "k": 22, "tile_m": 9, "tile_n": 1, "w": 8, "v": 18, "threads": 32, "grouping": 16, "minblocks": 4, "algorithm": "largeDB2", "perf": 2482.97, "source": "autotuned"},
{"m": 9, "n": 23, "k": 23, "tile_m": 9, "tile_n": 1, "w": 8, "v": 22, "threads": 32, "grouping": 16, "minblocks": 8, "algorithm": "largeDB2", "perf": 2494.32, "source": "autotuned"},
{"m": 9, "n": 23, "k": 26, "tile_m": 9, "tile_n": 1, "threads": 32, "grouping": 13, "minblocks": 9, "algorithm": "medium", "perf": 2588.31, "source": "autotuned"},
{"m": 9, "n": 26, "k": 4, "tile_m": 9, "tile_n": 1, "threads": 128, "grouping": 19, "minblocks": 9, "algorithm": "medium", "perf": 1883.01, "source": "autotuned"},
{"m": 9, "n": 26, "k": 5, "tile_m": 5, "tile_n": 2, "threads": 64, "grouping": 10, "minblocks": 15, "algorithm": "medium", "perf": 2031.88, "source": "autotuned"},
{"m": 9, "n": 26, "k": 9, "tile_m": 5, "tile_n": 2, "threads": 32, "grouping": 7, "minblocks": 21, "algorithm": "medium", "perf": 2456.46, "source": "autotuned"},
{"m": 9, "n": 26, "k": 13, "tile_m": 5, "tile_n": 2, "threads": 32, "grouping": 8, "minblocks": 17, "algorithm": "medium", "perf": 2623.23, "source": "autotuned"},
{"m": 9, "n": 26, "k": 22, "tile_m": 5, "tile_n": 2, "w": 8, "v": 26, "threads": 32, "grouping": 16, "minblocks": 1, "algorithm": "largeDB2", "perf": 2652.61, "source": "autotuned"},
{"m": 9, "n": 26, "k": 23, "tile_m": 5, "tile_n": 2, "threads": 32, "grouping": 13, "minblocks": 1, "algorithm": "medium", "perf": 2699.04, "source": "autotuned"},
{"m": 9, "n": 26, "k": 26, "tile_m": 5, "tile_n": 2, "threads": 32, "grouping": 4, "minblocks": 1, "algorithm": "medium", "perf": 2641.45, "source": "autotuned"},
{"m": 10, "n": 10, "k": 10, "tile_m": 1, "tile_n": 4, "threads": 128, "grouping": 13, "minblocks": 11, "algorithm": "medium", "perf": 1761.11, "source": "autotuned"},
{"m": 10, "n": 10, "k": 32, "tile_m": 1, "tile_n": 4, "threads": 32, "grouping": 19, "minblocks": 11, "algorithm": "medium", "perf": 2420.11, "source": "autotuned"},
{"m": 10, "n": 12, "k": 10, "tile_m": 1, "tile_n": 4, "threads": 128, "grouping": 13, "minblocks": 11, "algorithm": "medium", "perf": 2072.47, "source": "autotuned"},
{"m": 10, "n": 15, "k": 10, "tile_m": 5, "tile_n": 1, "threads": 160, "grouping": 19, "minblocks": 8, "algorithm": "medium", "perf": 2315.54, "source": "autotuned"},
{"m": 10, "n": 15, "k": 15, "tile_m": 5, "tile_n": 1, "threads": 32, "grouping": 8, "minblocks": 17, "algorithm": "medium", "perf": 2408.71, "source": "autotuned"},
{"m": 11, "n": 11, "k": 11, "tile_m": 2, "tile_n": 3, "threads": 128, "grouping": 19, "minblocks": 8, "algorithm": "medium", "perf": 2024.11, "source": "autotuned"},
{"m": 12, "n": 12, "k": 12, "tile_m": 2, "tile_n": 3, "threads": 32, "grouping": 4, "minblocks": 25, "algorithm": "medium", "perf": 2393.15, "source": "autotuned"},
{"m": 13, "n": 4, "k": 4, "tile_m": 1, "tile_n": 4, "threads": 64, "grouping": 13, "minblocks": 20, "algorithm": "medium", "perf": 685.627, "source": "autotuned"},
{"m": 13, "n": 4, "k": 5, "tile_m": 1, "tile_n": 4, "threads": 96, "grouping": 13, "minblocks": 11, "algorithm": "medium", "perf": 719.782, "source": "autotuned"},
{"m": 13, "n": 4, "k": 9, "tile_m": 1, "tile_n": 4, "threads": 64, "grouping": 8, "minblocks": 19, "algorithm": "medium", "perf": 982.865, "source": "autotuned"},
{"m": 13, "n": 4, "k": 13, "tile_m": 1, "tile_n": 4, "threads": 64, "grouping": 8, "minblocks": 19, "algorithm": "medium", "perf": 1159.66, "source": "autotuned"},
{"m": 13, "n": 4, "k": 22, "tile_m": 1, "tile_n": 4, "threads": 96, "grouping": 8, "minblocks": 18, "algorithm": "medium", "perf": 1263.65, "source": "autotuned"},
{"m": 13, "n": 4, "k": 23, "tile_m": 1, "tile_n": 4, "threads": 96, "grouping": 13, "minblocks": 11, "algorithm": "medium", "perf": 1217.81, "source": "autotuned"},
{"m": 13, "n": 4, "k": 26, "tile_m": 1, "tile_n": 4, "threads": 32, "grouping": 8, "minblocks": 17, "algorithm": "medium", "perf": 1234.96, "source": "autotuned"},
{"m": 13, "n": 5, "k": 4, "tile_m": 1, "tile_n": 5, "threads": 64, "grouping": 13, "minblocks": 19, "algorithm": "medium", "perf": 761.957, "source": "autotuned"},
{"m": 13, "n": 5, "k": 5, "tile_m": 1, "tile_n": 5, "threads": 32, "grouping": 8, "minblocks": 20, "algorithm": "medium", "perf": 811.046, "source": "autotuned"},
{"m": 13, "n": 5, "k": 9, "tile_m": 1, "tile_n": 5, "threads": 64, "grouping": 8, "minblocks": 19, "algorithm": "medium", "perf": 1066.74, "source": "autotuned"},
{"m": 13, "n": 5, "k": 13, "tile_m": 2, "tile_n": 2, "threads": 96, "grouping": 8, "minblocks": 20, "algorithm": "medium", "perf": 1166.57, "source": "autotuned"},
{"m": 13, "n": 5, "k": 16, "tile_m": 1, "tile_n": 5, "threads": 32, "grouping": 3, "minblocks": 25, "algorithm": "medium", "perf": 1274.91, "source": "autotuned"},
{"m": 13, "n": 5, "k": 22, "tile_m": 1, "tile_n": 5, "threads": 32, "grouping": 8, "minblocks": 18, "algorithm": "medium", "perf": 1319.6, "source": "autotuned"},
{"m": 13, "n": 5, "k": 23, "tile_m": 1, "tile_n": 5, "threads": 32, "grouping": 8, "minblocks": 17, "algorithm": "medium", "perf": 1302.67, "source": "autotuned"},
{"m": 13, "n": 5, "k": 26, "tile_m": 1, "tile_n": 5, "threads": 32, "grouping": 8, "minblocks": 17, "algorithm": "medium", "perf": 1330.23, "source": "autotuned"},
{"m": 13, "n": 9, "k": 4, "tile_m": 7, "tile_n": 1, "threads": 64, "grouping": 13, "minblocks": 19, "algorithm": "medium", "perf": 1207.52, "source": "autotuned"},
{"m": 13, "n": 9, "k": 5, "tile_m": 7, "tile_n": 1, "threads": 96, "grouping": 13, "minblocks": 13, "algorithm": "medium", "perf": 1280.09, "source": "autotuned"},
{"m": 13, "n": 9, "k": 9, "tile_m": 7, "tile_n": 1, "threads": 128, "grouping": 19, "minblocks": 10, "algorithm": "medium", "perf": 1623.69, "source": "autotuned"},
{"m": 13, "n": 9, "k": 13, "tile_m": 7, "tile_n": 1, "threads": 32, "grouping": 10, "minblocks": 18, "algorithm": "medium", "perf": 1728.95, "source": "autotuned"},
{"m": 13, "n": 9, "k": 16, "tile_m": 7, "tile_n": 1, "threads": 32, "grouping": 8, "minblocks": 17, "algorithm": "medium", "perf": 1800.56, "source": "autotuned"},
{"m": 13, "n": 9, "k": 22, "tile_m": 7, "tile_n": 1, "threads": 32, "grouping": 10, "minblocks": 13, "algorithm": "medium", "perf": 1828.7, "source": "autotuned"},
{"m": 13, "n": 9, "k": 23, "tile_m": 7, "tile_n": 1, "threads": 32, "grouping": 10, "minblocks": 13, "algorithm": "medium", "perf": 1799.36, "source": "autotuned"},
{"m": 13, "n": 9, "k": 26, "tile_m": 7, "tile_n": 1, "threads": 32, "grouping": 10, "minblocks": 13, "algorithm": "medium", "perf": 1864.55, "source": "autotuned"},
{"m": 13, "n": 13, "k": 4, "tile_m": 7, "tile_n": 1, "threads": 64, "grouping": 13, "minblocks": 19, "algorithm": "medium", "perf": 1668.28, "source": "autotuned"},
{"m": 13, "n": 13, "k": 5, "tile_m": 8, "tile_n": 1, "threads": 96, "grouping": 13, "minblocks": 12, "algorithm": "medium", "perf": 1769.39, "source": "autotuned"},
{"m": 13, "n": 13, "k": 9, "tile_m": 8, "tile_n": 1, "threads": 128, "grouping": 19, "minblocks": 8, "algorithm": "medium", "perf": 2264.1, "source": "autotuned"},
{"m": 13, "n": 13, "k": 13, "tile_m": 7, "tile_n": 1, "threads": 32, "grouping": 10, "minblocks": 17, "algorithm": "medium", "perf": 2435.38, "source": "autotuned"},
{"m": 13, "n": 13, "k": 16, "tile_m": 7, "tile_n": 1, "threads": 32, "grouping": 10, "minblocks": 18, "algorithm": "medium", "perf": 2580.96, "source": "autotuned"},
{"m": 13, "n": 13, "k": 17, "tile_m": 7, "tile_n": 1, "threads": 32, "grouping": 10, "minblocks": 13, "algorithm": "medium", "perf": 2584.44, "source": "autotuned"},
{"m": 13, "n": 13, "k": 22, "tile_m": 7, "tile_n": 1, "threads": 32, "grouping": 13, "minblocks": 2, "algorithm": "medium", "perf": 2857.96, "source": "autotuned"},
{"m": 13, "n": 13, "k": 23, "tile_m": 7, "tile_n": 1, "threads": 32, "grouping": 13, "minblocks": 13, "algorithm": "medium", "perf": 2804.0, "source": "autotuned"},
{"m": 13, "n": 13, "k": 26, "tile_m": 7, "tile_n": 1, "threads": 32, "grouping": 13, "minblocks": 8, "algorithm": "medium", "perf": 2841.84, "source": "autotuned"},
{"m": 13, "n": 16, "k": 5, "tile_m": 7, "tile_n": 1, "threads": 96, "grouping": 13, "minblocks": 13, "algorithm": "medium", "perf": 2191.7, "source": "autotuned"},
{"m": 13, "n": 16, "k": 9, "tile_m": 7, "tile_n": 1, "threads": 160, "grouping": 19, "minblocks": 8, "algorithm": "medium", "perf": 2581.69, "source": "autotuned"},
{"m": 13, "n": 16, "k": 13, "tile_m": 7, "tile_n": 1, "threads": 32, "grouping": 8, "minblocks": 19, "algorithm": "medium", "perf": 2726.66, "source": "autotuned"},
{"m": 13, "n": 16, "k": 16, "tile_m": 7, "tile_n": 1, "threads": 32, "grouping": 8, "minblocks": 17, "algorithm": "medium", "perf": 2863.28, "source": "autotuned"},
{"m": 13, "n": 16, "k": 23, "tile_m": 7, "tile_n": 1, "w": 8, "v": 16, "threads": 32, "grouping": 16, "minblocks": 8, "algorithm": "largeDB2", "perf": 2875.9, "source": "autotuned"},
{"m": 13, "n": 17, "k": 13, "tile_m": 4, "tile_n": 3, "threads": 32, "grouping": 8, "minblocks": 17, "algorithm": "medium", "perf": 2427.28, "source": "autotuned"},
{"m": 13, "n": 17, "k": 17, "tile_m": 3, "tile_n": 3, "threads": 32, "grouping": 10, "minblocks": 13, "algorithm": "medium", "perf": 2498.79, "source": "autotuned"},
{"m": 13, "n": 17, "k": 23, "tile_m": 3, "tile_n": 3, "w": 8, "v": 16, "threads": 32, "grouping": 16, "minblocks": 1, "algorithm": "largeDB2", "perf": 2604.81, "source": "autotuned"},
{"m": 13, "n": 22, "k": 4, "tile_m": 4, "tile_n": 3, "threads": 96, "grouping": 19, "minblocks": 9, "algorithm": "medium", "perf": 2235.07, "source": "autotuned"},
{"m": 13, "n": 22, "k": 5, "tile_m": 4, "tile_n": 3, "threads": 128, "grouping": 19, "minblocks": 8, "algorithm": "medium", "perf": 2400.08, "source": "autotuned"},
{"m": 13, "n": 22, "k": 9, "tile_m": 4, "tile_n": 3, "threads": 32, "grouping": 8, "minblocks": 20, "algorithm": "medium", "perf": 2750.86, "source": "autotuned"},
{"m": 13, "n": 22, "k": 13, "tile_m": 4, "tile_n": 3, "threads": 32, "grouping": 10, "minblocks": 14, "algorithm": "medium", "perf": 2905.6, "source": "autotuned"},
{"m": 13, "n": 22, "k": 22, "tile_m": 4, "tile_n": 3, "w": 8, "v": 22, "threads": 32, "grouping": 16, "minblocks": 12, "algorithm": "largeDB2", "perf": 2980.1, "source": "autotuned"},
{"m": 13, "n": 22, "k": 23, "tile_m": 4, "tile_n": 3, "w": 8, "v": 22, "threads": 32, "grouping": 16, "minblocks": 12, "algorithm": "largeDB2", "perf": 2994.56, "source": "autotuned"},
{"m": 13, "n": 22, "k": 26, "tile_m": 4, "tile_n": 3, "w": 10, "v": 22, "threads": 32, "grouping": 16, "minblocks": 2, "algorithm": "largeDB2", "perf": 3031.93, "source": "autotuned"},
{"m": 13, "n": 23, "k": 4, "tile_m": 4, "tile_n": 3, "threads": 96, "grouping": 19, "minblocks": 9, "algorithm": "medium", "perf": 2307.82, "source": "autotuned"},
{"m": 13, "n": 23, "k": 5, "tile_m": 4, "tile_n": 3, "threads": 128, "grouping": 19, "minblocks": 8, "algorithm": "medium", "perf": 2475.94, "source": "autotuned"},
{"m": 13, "n": 23, "k": 9, "tile_m": 4, "tile_n": 3, "threads": 32, "grouping": 8, "minblocks": 18, "algorithm": "medium", "perf": 2875.9, "source": "autotuned"},
{"m": 13, "n": 23, "k": 13, "tile_m": 4, "tile_n": 3, "threads": 32, "grouping": 10, "minblocks": 13, "algorithm": "medium", "perf": 2963.58, "source": "autotuned"},
{"m": 13, "n": 23, "k": 16, "tile_m": 4, "tile_n": 3, "threads": 32, "grouping": 10, "minblocks": 13, "algorithm": "medium", "perf": 2990.93, "source": "autotuned"},
{"m": 13, "n": 23, "k": 17, "tile_m": 4, "tile_n": 3, "w": 6, "v": 22, "threads": 32, "grouping": 16, "minblocks": 1, "algorithm": "largeDB2", "perf": 2997.99, "source": "autotuned"},
{"m": 13, "n": 23, "k": 22, "tile_m": 4, "tile_n": 3, "w": 10, "v": 22, "threads": 64, "grouping": 16, "minblocks": 12, "algorithm": "largeDB2", "perf": 3053.86, "source": "autotuned"},
{"m": 13, "n": 23, "k": 23, "tile_m": 4, "tile_n": 3, "w": 8, "v": 10, "threads": 32, "grouping": 16, "minblocks": 1, "algorithm": "largeDB2", "perf": 3027.79, "source": "autotuned"},
{"m": 13, "n": 23, "k": 26, "tile_m": 4, "tile_n": 3, "threads": 32, "grouping": 4, "minblocks": 7, "algorithm": "medium", "perf": 3142.41, "source": "autotuned"},
{"m": 13, "n": 26, "k": 4, "tile_m": 7, "tile_n": 2, "threads": 128, "grouping": 19, "minblocks": 8, "algorithm": "medium", "perf": 2407.4, "source": "autotuned"},
{"m": 13, "n": 26, "k": 5, "tile_m": 7, "tile_n": 2, "threads": 32, "grouping": 8, "minblocks": 19, "algorithm": "medium", "perf": 2481.9, "source": "autotuned"},
{"m": 13, "n": 26, "k": 9, "tile_m": 7, "tile_n": 2, "threads": 32, "grouping": 8, "minblocks": 17, "algorithm": "medium", "perf": 2925.91, "source": "autotuned"},
{"m": 13, "n": 26, "k": 13, "tile_m": 7, "tile_n": 2, "threads": 32, "grouping": 10, "minblocks": 13, "algorithm": "medium", "perf": 2964.51, "source": "autotuned"},
{"m": 13, "n": 26, "k": 22, "tile_m": 7, "tile_n": 2, "w": 8, "v": 26, "threads": 32, "grouping": 16, "minblocks": 4, "algorithm": "largeDB2", "perf": 3141.18, "source": "autotuned"},
{"m": 13, "n": 26, "k": 23, "tile_m": 7, "tile_n": 2, "threads": 32, "grouping": 3, "minblocks": 7, "algorithm": "medium", "perf": 3240.18, "source": "autotuned"},
{"m": 13, "n": 26, "k": 26, "tile_m": 7, "tile_n": 2, "threads": 32, "grouping": 4, "minblocks": 5, "algorithm": "medium", "perf": 3257.44, "source": "autotuned"},
{"m": 14, "n": 14, "k": 14, "tile_m": 7, "tile_n": 1, "threads": 32, "grouping": 10, "minblocks": 17, "algorithm": "medium", "perf": 2789.49, "source": "autotuned"},
{"m": 15, "n": 15, "k": 15, "tile_m": 2, "tile_n": 4, "threads": 32, "grouping": 10, "minblocks": 17, "algorithm": "medium", "perf": 3102.99, "source": "autotuned"},
{"m": 16, "n": 5, "k": 5, "tile_m": 1, "tile_n": 3, "threads": 96, "grouping": 15, "minblocks": 16, "algorithm": "medium", "perf": 1085.77, "source": "autotuned"},
{"m": 16, "n": 5, "k": 9, "tile_m": 1, "tile_n": 3, "threads": 64, "grouping": 8, "minblocks": 21, "algorithm": "medium", "perf": 1401.54, "source": "autotuned"},
{"m": 16, "n": 5, "k": 13, "tile_m": 1, "tile_n": 3, "threads": 32, "grouping": 4, "minblocks": 21, "algorithm": "medium", "perf": 1512.1, "source": "autotuned"},
{"m": 16, "n": 5, "k": 16, "tile_m": 1, "tile_n": 3, "threads": 96, "grouping": 13, "minblocks": 13, "algorithm": "medium", "perf": 1667.19, "source": "autotuned"},
{"m": 16, "n": 5, "k": 23, "tile_m": 1, "tile_n": 3, "threads": 128, "grouping": 15, "minblocks": 10, "algorithm": "medium", "perf": 1700.04, "source": "autotuned"},
{"m": 16, "n": 9, "k": 5, "tile_m": 2, "tile_n": 3, "threads": 96, "grouping": 13, "minblocks": 11, "algorithm": "medium", "perf": 1723.51, "source": "autotuned"},
{"m": 16, "n": 9, "k": 9, "tile_m": 2, "tile_n": 3, "threads": 32, "grouping": 8, "minblocks": 27, "algorithm": "medium", "perf": 2059.97, "source": "autotuned"},
{"m": 16, "n": 9, "k": 13, "tile_m": 2, "tile_n": 3, "threads": 32, "grouping": 8, "minblocks": 22, "algorithm": "medium", "perf": 2265.22, "source": "autotuned"},
{"m": 16, "n": 9, "k": 16, "tile_m": 2, "tile_n": 3, "threads": 32, "grouping": 8, "minblocks": 17, "algorithm": "medium", "perf": 2384.85, "source": "autotuned"},
{"m": 16, "n": 9, "k": 17, "tile_m": 2, "tile_n": 3, "threads": 32, "grouping": 8, "minblocks": 17, "algorithm": "medium", "perf": 2391.37, "source": "autotuned"},
{"m": 16, "n": 9, "k": 22, "tile_m": 1, "tile_n": 5, "w": 8, "v": 8, "threads": 32, "grouping": 16, "minblocks": 12, "algorithm": "largeDB2", "perf": 2339.31, "source": "autotuned"},
{"m": 16, "n": 9, "k": 23, "tile_m": 1, "tile_n": 5, "w": 8, "v": 8, "threads": 32, "grouping": 16, "minblocks": 12, "algorithm": "largeDB2", "perf": 2353.01, "source": "autotuned"},
{"m": 16, "n": 13, "k": 5, "tile_m": 2, "tile_n": 4, "threads": 96, "grouping": 13, "minblocks": 11, "algorithm": "medium", "perf": 2229.27, "source": "autotuned"},
{"m": 16, "n": 13, "k": 9, "tile_m": 2, "tile_n": 4, "threads": 32, "grouping": 8, "minblocks": 26, "algorithm": "medium", "perf": 2639.92, "source": "autotuned"},
{"m": 16, "n": 13, "k": 13, "tile_m": 2, "tile_n": 4, "threads": 32, "grouping": 8, "minblocks": 18, "algorithm": "medium", "perf": 2771.36, "source": "autotuned"},
{"m": 16, "n": 13, "k": 16, "tile_m": 2, "tile_n": 4, "threads": 32, "grouping": 10, "minblocks": 13, "algorithm": "medium", "perf": 2761.92, "source": "autotuned"},
{"m": 16, "n": 13, "k": 23, "tile_m": 2, "tile_n": 4, "w": 8, "v": 10, "threads": 32, "grouping": 16, "minblocks": 8, "algorithm": "largeDB2", "perf": 2857.58, "source": "autotuned"},
{"m": 16, "n": 16, "k": 5, "tile_m": 2, "tile_n": 4, "threads": 96, "grouping": 13, "minblocks": 12, "algorithm": "medium", "perf": 2707.61, "source": "autotuned"},
{"m": 16, "n": 16, "k": 9, "tile_m": 2, "tile_n": 4, "threads": 32, "grouping": 10, "minblocks": 24, "algorithm": "medium", "perf": 3273.75, "source": "autotuned"},
{"m": 16, "n": 16, "k": 13, "tile_m": 2, "tile_n": 4, "threads": 32, "grouping": 10, "minblocks": 1, "algorithm": "medium", "perf": 3429.64, "source": "autotuned"},
{"m": 16, "n": 16, "k": 16, "tile_m": 2, "tile_n": 4, "threads": 32, "grouping": 13, "minblocks": 14, "algorithm": "medium", "perf": 4001.25, "source": "autotuned"},
{"m": 16, "n": 16, "k": 17, "tile_m": 2, "tile_n": 4, "threads": 32, "grouping": 13, "minblocks": 8, "algorithm": "medium", "perf": 3924.3, "source": "autotuned"},
{"m": 16, "n": 16, "k": 22, "tile_m": 2, "tile_n": 4, "threads": 32, "grouping": 13, "minblocks": 4, "algorithm": "medium", "perf": 3693.46, "source": "autotuned"},
{"m": 16, "n": 16, "k": 23, "tile_m": 4, "tile_n": 2, "threads": 32, "grouping": 19, "minblocks": 1, "algorithm": "medium", "perf": 3517.02, "source": "autotuned"},
{"m": 16, "n": 17, "k": 9, "tile_m": 2, "tile_n": 5, "threads": 32, "grouping": 8, "minblocks": 18, "algorithm": "medium", "perf": 2943.23, "source": "autotuned"},
{"m": 16, "n": 17, "k": 16, "tile_m": 2, "tile_n": 5, "threads": 32, "grouping": 10, "minblocks": 10, "algorithm": "medium", "perf": 3139.44, "source": "autotuned"},
{"m": 16, "n": 17, "k": 17, "tile_m": 2, "tile_n": 5, "threads": 32, "grouping": 10, "minblocks": 13, "algorithm": "medium", "perf": 3097.4, "source": "autotuned"},
{"m": 16, "n": 17, "k": 22, "tile_m": 2, "tile_n": 5, "w": 8, "v": 16, "threads": 32, "grouping": 16, "minblocks": 8, "algorithm": "largeDB2", "perf": 3152.67, "source": "autotuned"},
{"m": 16, "n": 17, "k": 23, "tile_m": 2, "tile_n": 5, "w": 8, "v": 14, "threads": 64, "grouping": 16, "minblocks": 12, "algorithm": "largeDB2", "perf": 3171.26, "source": "autotuned"},
{"m": 16, "n": 22, "k": 9, "tile_m": 2, "tile_n": 6, "threads": 32, "grouping": 8, "minblocks": 18, "algorithm": "medium", "perf": 3301.03, "source": "autotuned"},
{"m": 16, "n": 22, "k": 16, "tile_m": 2, "tile_n": 6, "w": 6, "v": 12, "threads": 32, "grouping": 16, "minblocks": 1, "algorithm": "largeDB2", "perf": 3497.78, "source": "autotuned"},
{"m": 16, "n": 22, "k": 17, "tile_m": 2, "tile_n": 6, "w": 6, "v": 22, "threads": 32, "grouping": 16, "minblocks": 2, "algorithm": "largeDB2", "perf": 3551.74, "source": "autotuned"},
{"m": 16, "n": 22, "k": 22, "tile_m": 2, "tile_n": 6, "w": 8, "v": 14, "threads": 32, "grouping": 16, "minblocks": 4, "algorithm": "largeDB2", "perf": 3542.57, "source": "autotuned"},
{"m": 16, "n": 22, "k": 23, "tile_m": 2, "tile_n": 6, "w": 8, "v": 22, "threads": 32, "grouping": 16, "minblocks": 2, "algorithm": "largeDB2", "perf": 3514.99, "source": "autotuned"},
{"m": 16, "n": 23, "k": 5, "tile_m": 2, "tile_n": 6, "threads": 128, "grouping": 19, "minblocks": 8, "algorithm": "medium", "perf": 3166.13, "source": "autotuned"},
{"m": 16, "n": 23, "k": 9, "tile_m": 2, "tile_n": 6, "threads": 32, "grouping": 8, "minblocks": 17, "algorithm": "medium", "perf": 3451.08, "source": "autotuned"},
{"m": 16, "n": 23, "k": 13, "tile_m": 2, "tile_n": 6, "threads": 32, "grouping": 10, "minblocks": 15, "algorithm": "medium", "perf": 3505.0, "source": "autotuned"},
{"m": 16, "n": 23, "k": 16, "tile_m": 2, "tile_n": 6, "w": 6, "v": 18, "threads": 32, "grouping": 16, "minblocks": 8, "algorithm": "largeDB2", "perf": 3608.97, "source": "autotuned"},
{"m": 16, "n": 23, "k": 17, "tile_m": 2, "tile_n": 6, "w": 6, "v": 12, "threads": 32, "grouping": 16, "minblocks": 1, "algorithm": "largeDB2", "perf": 3599.28, "source": "autotuned"},
{"m": 16, "n": 23, "k": 22, "tile_m": 2, "tile_n": 6, "w": 8, "v": 14, "threads": 32, "grouping": 16, "minblocks": 1, "algorithm": "largeDB2", "perf": 3564.49, "source": "autotuned"},
{"m": 16, "n": 23, "k": 23, "tile_m": 2, "tile_n": 6, "w": 8, "v": 14, "threads": 32, "grouping": 16, "minblocks": 1, "algorithm": "largeDB2", "perf": 3575.44, "source": "autotuned"},
{"m": 17, "n": 9, "k": 9, "tile_m": 3, "tile_n": 2, "threads": 160, "grouping": 19, "minblocks": 8, "algorithm": "medium", "perf": 2082.81, "source": "autotuned"},
{"m": 17, "n": 9, "k": 16, "tile_m": 3, "tile_n": 2, "threads": 32, "grouping": 8, "minblocks": 17, "algorithm": "medium", "perf": 2333.05, "source": "autotuned"},
{"m": 17, "n": 9, "k": 17, "tile_m": 3, "tile_n": 2, "threads": 32, "grouping": 8, "minblocks": 17, "algorithm": "medium", "perf": 2274.31, "source": "autotuned"},
{"m": 17, "n": 9, "k": 22, "tile_m": 3, "tile_n": 2, "w": 8, "v": 6, "threads": 32, "grouping": 16, "minblocks": 1, "algorithm": "largeDB2", "perf": 2287.4, "source": "autotuned"},
{"m": 17, "n": 9, "k": 23, "tile_m": 3, "tile_n": 2, "w": 8, "v": 8, "threads": 32, "grouping": 16, "minblocks": 4, "algorithm": "largeDB2", "perf": 2340.49, "source": "autotuned"},
{"m": 17, "n": 13, "k": 13, "tile_m": 3, "tile_n": 3, "threads": 32, "grouping": 8, "minblocks": 17, "algorithm": "medium", "perf": 2661.02, "source": "autotuned"},
{"m": 17, "n": 13, "k": 17, "tile_m": 3, "tile_n": 3, "threads": 32, "grouping": 10, "minblocks": 13, "algorithm": "medium", "perf": 2689.53, "source": "autotuned"},
{"m": 17, "n": 13, "k": 23, "tile_m": 3, "tile_n": 3, "w": 8, "v": 12, "threads": 32, "grouping": 16, "minblocks": 4, "algorithm": "largeDB2", "perf": 2804.0, "source": "autotuned"},
{"m": 17, "n": 16, "k": 9, "tile_m": 9, "tile_n": 1, "threads": 160, "grouping": 22, "minblocks": 7, "algorithm": "medium", "perf": 2898.63, "source": "autotuned"},
{"m": 17, "n": 16, "k": 16, "tile_m": 10, "tile_n": 1, "threads": 32, "grouping": 10, "minblocks": 14, "algorithm": "medium", "perf": 3091.87, "source": "autotuned"},
{"m": 17, "n": 16, "k": 17, "tile_m": 9, "tile_n": 1, "w": 6, "v": 14, "threads": 32, "grouping": 16, "minblocks": 1, "algorithm": "largeDB2", "perf": 3075.43, "source": "autotuned"},
{"m": 17, "n": 16, "k": 22, "tile_m": 9, "tile_n": 1, "w": 8, "v": 16, "threads": 64, "grouping": 16, "minblocks": 12, "algorithm": "largeDB2", "perf": 3170.48, "source": "autotuned"},
{"m": 17, "n": 16, "k": 23, "tile_m": 9, "tile_n": 1, "w": 8, "v": 16, "threads": 64, "grouping": 16, "minblocks": 12, "algorithm": "largeDB2", "perf": 3188.5, "source": "autotuned"},
{"m": 17, "n": 17, "k": 9, "tile_m": 3, "tile_n": 4, "threads": 32, "grouping": 10, "minblocks": 19, "algorithm": "medium", "perf": 3011.36, "source": "autotuned"},
{"m": 17, "n": 17, "k": 13, "tile_m": 3, "tile_n": 4, "threads": 32, "grouping": 10, "minblocks": 14, "algorithm": "medium", "perf": 3145.79, "source": "autotuned"},
{"m": 17, "n": 17, "k": 16, "tile_m": 3, "tile_n": 4, "threads": 32, "grouping": 13, "minblocks": 2, "algorithm": "medium", "perf": 3583.76, "source": "autotuned"},
{"m": 17, "n": 17, "k": 17, "tile_m": 3, "tile_n": 4, "threads": 32, "grouping": 19, "minblocks": 1, "algorithm": "medium", "perf": 3544.14, "source": "autotuned"},
{"m": 17, "n": 17, "k": 22, "tile_m": 3, "tile_n": 4, "threads": 32, "grouping": 4, "minblocks": 1, "algorithm": "medium", "perf": 3507.35, "source": "autotuned"},
{"m": 17, "n": 17, "k": 23, "tile_m": 3, "tile_n": 4, "threads": 32, "grouping": 19, "minblocks": 9, "algorithm": "medium", "perf": 3406.29, "source": "autotuned"},
{"m": 17, "n": 22, "k": 9, "tile_m": 3, "tile_n": 5, "threads": 32, "grouping": 8, "minblocks": 18, "algorithm": "medium", "perf": 3094.72, "source": "autotuned"},
{"m": 17, "n": 22, "k": 16, "tile_m": 3, "tile_n": 5, "w": 6, "v": 22, "threads": 32, "grouping": 16, "minblocks": 12, "algorithm": "largeDB2", "perf": 3225.15, "source": "autotuned"},
{"m": 17, "n": 22, "k": 17, "tile_m": 5, "tile_n": 3, "w": 6, "v": 22, "threads": 32, "grouping": 16, "minblocks": 4, "algorithm": "largeDB2", "perf": 3258.19, "source": "autotuned"},
{"m": 17, "n": 22, "k": 22, "tile_m": 3, "tile_n": 5, "w": 8, "v": 22, "threads": 32, "grouping": 16, "minblocks": 8, "algorithm": "largeDB2", "perf": 3384.28, "source": "autotuned"},
{"m": 17, "n": 22, "k": 23, "tile_m": 3, "tile_n": 5, "w": 8, "v": 20, "threads": 32, "grouping": 16, "minblocks": 4, "algorithm": "largeDB2", "perf": 3389.45, "source": "autotuned"},
{"m": 17, "n": 23, "k": 9, "tile_m": 3, "tile_n": 5, "threads": 32, "grouping": 8, "minblocks": 20, "algorithm": "medium", "perf": 3267.42, "source": "autotuned"},
{"m": 17, "n": 23, "k": 13, "tile_m": 3, "tile_n": 5, "threads": 32, "grouping": 10, "minblocks": 14, "algorithm": "medium", "perf": 3264.93, "source": "autotuned"},
{"m": 17, "n": 23, "k": 16, "tile_m": 3, "tile_n": 5, "w": 6, "v": 20, "threads": 32, "grouping": 16, "minblocks": 1, "algorithm": "largeDB2", "perf": 3314.59, "source": "autotuned"},
{"m": 17, "n": 23, "k": 17, "tile_m": 3, "tile_n": 5, "w": 6, "v": 22, "threads": 32, "grouping": 16, "minblocks": 4, "algorithm": "largeDB2", "perf": 3387.78, "source": "autotuned"},
{"m": 17, "n": 23, "k": 22, "tile_m": 3, "tile_n": 5, "w": 8, "v": 22, "threads": 32, "grouping": 16, "minblocks": 8, "algorithm": "largeDB2", "perf": 3462.19, "source": "autotuned"},
{"m": 17, "n": 23, "k": 23, "tile_m": 3, "tile_n": 5, "w": 8, "v": 22, "threads": 32, "grouping": 16, "minblocks": 1, "algorithm": "largeDB2", "perf": 3442.27, "source": "autotuned"},
{"m": 18, "n": 18, "k": 18, "tile_m": 3, "tile_n": 4, "threads": 32, "grouping": 13, "minblocks": 8, "algorithm": "medium", "perf": 3851.56, "source": "autotuned"},
{"m": 19, "n": 19, "k": 19, "tile_m": 5, "tile_n": 3, "threads": 32, "grouping": 4, "minblocks": 1, "algorithm": "medium", "perf": 3634.08, "source": "autotuned"},
{"m": 20, "n": 11, "k": 11, "tile_m": 2, "tile_n": 4, "threads": 32, "grouping": 8, "minblocks": 21, "algorithm": "medium", "perf": 2608.57, "source": "autotuned"},
{"m": 20, "n": 11, "k": 12, "tile_m": 2, "tile_n": 4, "threads": 32, "grouping": 8, "minblocks": 17, "algorithm": "medium", "perf": 2558.94, "source": "autotuned"},
{"m": 20, "n": 11, "k": 20, "tile_m": 2, "tile_n": 4, "w": 8, "v": 8, "threads": 32, "grouping": 16, "minblocks": 12, "algorithm": "largeDB2", "perf": 2714.66, "source": "autotuned"},
{"m": 20, "n": 11, "k": 25, "tile_m": 2, "tile_n": 4, "w": 10, "v": 8, "threads": 32, "grouping": 16, "minblocks": 1, "algorithm": "largeDB2", "perf": 2714.66, "source": "autotuned"},
{"m": 20, "n": 11, "k": 32, "tile_m": 2, "tile_n": 4, "w": 12, "v": 8, "threads": 32, "grouping": 16, "minblocks": 1, "algorithm": "largeDB2", "perf": 2762.37, "source": "autotuned"},
{"m": 20, "n": 12, "k": 11, "tile_m": 2, "tile_n": 4, "threads": 32, "grouping": 8, "minblocks": 17, "algorithm": "medium", "perf": 2705.76, "source": "autotuned"},
{"m": 20, "n": 12, "k": 12, "tile_m": 2, "tile_n": 4, "threads": 32, "grouping": 8, "minblocks": 20, "algorithm": "medium", "perf": 2791.57, "source": "autotuned"},
{"m": 20, "n": 12, "k": 20, "tile_m": 2, "tile_n": 4, "w": 8, "v": 8, "threads": 32, "grouping": 16, "minblocks": 12, "algorithm": "largeDB2", "perf": 2922.99, "source": "autotuned"},
{"m": 20, "n": 12, "k": 25, "tile_m": 2, "tile_n": 4, "w": 10, "v": 8, "threads": 32, "grouping": 16, "minblocks": 8, "algorithm": "largeDB2", "perf": 2900.39, "source": "autotuned"},
{"m": 20, "n": 12, "k": 32, "tile_m": 2, "tile_n": 4, "w": 12, "v": 8, "threads": 32, "grouping": 16, "minblocks": 1, "algorithm": "largeDB2", "perf": 2927.74, "source": "autotuned"},
{"m": 20, "n": 20, "k": 11, "tile_m": 2, "tile_n": 7, "threads": 32, "grouping": 13, "minblocks": 9, "algorithm": "medium", "perf": 3588.08, "source": "autotuned"},
{"m": 20, "n": 20, "k": 20, "tile_m": 2, "tile_n": 7, "threads": 32, "grouping": 19, "minblocks": 1, "algorithm": "medium", "perf": 4033.52, "source": "autotuned"},
{"m": 20, "n": 20, "k": 25, "tile_m": 3, "tile_n": 5, "threads": 32, "grouping": 19, "minblocks": 7, "algorithm": "medium", "perf": 3827.73, "source": "autotuned"},
{"m": 20, "n": 20, "k": 32, "tile_m": 2, "tile_n": 7, "threads": 32, "grouping": 2, "minblocks": 5, "algorithm": "medium", "perf": 3835.06, "source": "autotuned"},
{"m": 20, "n": 25, "k": 11, "tile_m": 10, "tile_n": 2, "w": 4, "v": 24, "threads": 32, "grouping": 16, "minblocks": 8, "algorithm": "largeDB2", "perf": 3285.26, "source": "autotuned"},
{"m": 20, "n": 25, "k": 12, "tile_m": 10, "tile_n": 2, "w": 4, "v": 14, "threads": 32, "grouping": 16, "minblocks": 8, "algorithm": "largeDB2", "perf": 3369.32, "source": "autotuned"},
{"m": 20, "n": 25, "k": 20, "tile_m": 10, "tile_n": 2, "w": 8, "v": 24, "threads": 32, "grouping": 16, "minblocks": 4, "algorithm": "largeDB2", "perf": 3634.86, "source": "autotuned"},
{"m": 20, "n": 25, "k": 25, "tile_m": 2, "tile_n": 9, "w": 10, "v": 22, "threads": 32, "grouping": 16, "minblocks": 2, "algorithm": "largeDB2", "perf": 3793.66, "source": "autotuned"},
{"m": 20, "n": 25, "k": 32, "tile_m": 2, "tile_n": 9, "w": 12, "v": 22, "threads": 32, "grouping": 16, "minblocks": 12, "algorithm": "largeDB2", "perf": 3808.3, "source": "autotuned"},
{"m": 20, "n": 32, "k": 12, "tile_m": 10, "tile_n": 2, "w": 4, "v": 32, "threads": 32, "grouping": 16, "minblocks": 12, "algorithm": "largeDB2", "perf": 4236.62, "source": "autotuned"},
{"m": 20, "n": 32, "k": 20, "tile_m": 5, "tile_n": 4, "w": 8, "v": 18, "threads": 32, "grouping": 16, "minblocks": 4, "algorithm": "largeDB2", "perf": 4317.9, "source": "autotuned"},
{"m": 20, "n": 32, "k": 25, "tile_m": 5, "tile_n": 4, "w": 10, "v": 22, "threads": 32, "grouping": 16, "minblocks": 12, "algorithm": "largeDB2", "perf": 4238.61, "source": "autotuned"},
{"m": 20, "n": 32, "k": 32, "tile_m": 5, "tile_n": 4, "w": 8, "v": 24, "threads": 32, "grouping": 16, "minblocks": 2, "algorithm": "largeDB2", "perf": 4268.0, "source": "autotuned"},
{"m": 21, "n": 21, "k": 21, "tile_m": 6, "tile_n": 3, "w": 8, "v": 20, "threads": 32, "grouping": 16, "minblocks": 1, "algorithm": "largeDB2", "perf": 3516.15, "source": "autotuned"},
{"m": 22, "n": 4, "k": 4, "tile_m": 1, "tile_n": 4, "threads": 32, "grouping": 8, "minblocks": 1, "algorithm": "medium", "perf": 955.633, "source": "autotuned"},
{"m": 22, "n": 4, "k": 5, "tile_m": 1, "tile_n": 4, "threads": 32, "grouping": 8, "minblocks": 8, "algorithm": "medium", "perf": 1063.87, "source": "autotuned"},
{"m": 22, "n": 4, "k": 9, "tile_m": 1, "tile_n": 4, "threads": 64, "grouping": 8, "minblocks": 24, "algorithm": "medium", "perf": 1321.59, "source": "autotuned"},
{"m": 22, "n": 4, "k": 13, "tile_m": 1, "tile_n": 4, "threads": 64, "grouping": 13, "minblocks": 16, "algorithm": "medium", "perf": 1471.65, "source": "autotuned"},
{"m": 22, "n": 4, "k": 22, "tile_m": 1, "tile_n": 4, "threads": 128, "grouping": 15, "minblocks": 10, "algorithm": "medium", "perf": 1506.69, "source": "autotuned"},
{"m": 22, "n": 4, "k": 23, "tile_m": 1, "tile_n": 4, "threads": 96, "grouping": 13, "minblocks": 11, "algorithm": "medium", "perf": 1518.47, "source": "autotuned"},
{"m": 22, "n": 4, "k": 26, "tile_m": 1, "tile_n": 4, "threads": 128, "grouping": 15, "minblocks": 10, "algorithm": "medium", "perf": 1490.05, "source": "autotuned"},
{"m": 22, "n": 5, "k": 4, "tile_m": 1, "tile_n": 5, "threads": 32, "grouping": 8, "minblocks": 8, "algorithm": "medium", "perf": 1094.09, "source": "autotuned"},
{"m": 22, "n": 5, "k": 5, "tile_m": 1, "tile_n": 5, "threads": 32, "grouping": 10, "minblocks": 4, "algorithm": "medium", "perf": 1228.06, "source": "autotuned"},
{"m": 22, "n": 5, "k": 9, "tile_m": 1, "tile_n": 5, "threads": 64, "grouping": 10, "minblocks": 19, "algorithm": "medium", "perf": 1528.26, "source": "autotuned"},
{"m": 22, "n": 5, "k": 13, "tile_m": 1, "tile_n": 5, "threads": 96, "grouping": 10, "minblocks": 16, "algorithm": "medium", "perf": 1671.08, "source": "autotuned"},
{"m": 22, "n": 5, "k": 22, "tile_m": 1, "tile_n": 5, "threads": 128, "grouping": 15, "minblocks": 10, "algorithm": "medium", "perf": 1696.16, "source": "autotuned"},
{"m": 22, "n": 5, "k": 23, "tile_m": 3, "tile_n": 2, "threads": 128, "grouping": 15, "minblocks": 10, "algorithm": "medium", "perf": 1664.99, "source": "autotuned"},
{"m": 22, "n": 5, "k": 26, "tile_m": 3, "tile_n": 2, "w": 10, "v": 4, "threads": 32, "grouping": 16, "minblocks": 4, "algorithm": "largeDB2", "perf": 1663.31, "source": "autotuned"},
{"m": 22, "n": 9, "k": 4, "tile_m": 3, "tile_n": 3, "threads": 96, "grouping": 13, "minblocks": 11, "algorithm": "medium", "perf": 1703.51, "source": "autotuned"},
{"m": 22, "n": 9, "k": 5, "tile_m": 3, "tile_n": 3, "threads": 64, "grouping": 10, "minblocks": 17, "algorithm": "medium", "perf": 1776.87, "source": "autotuned"},
{"m": 22, "n": 9, "k": 9, "tile_m": 3, "tile_n": 3, "threads": 32, "grouping": 8, "minblocks": 21, "algorithm": "medium", "perf": 2228.2, "source": "autotuned"},
{"m": 22, "n": 9, "k": 13, "tile_m": 3, "tile_n": 3, "threads": 32, "grouping": 8, "minblocks": 18, "algorithm": "medium", "perf": 2438.26, "source": "autotuned"},
{"m": 22, "n": 9, "k": 16, "tile_m": 3, "tile_n": 3, "threads": 32, "grouping": 10, "minblocks": 13, "algorithm": "medium", "perf": 2395.91, "source": "autotuned"},
{"m": 22, "n": 9, "k": 17, "tile_m": 3, "tile_n": 3, "threads": 32, "grouping": 10, "minblocks": 14, "algorithm": "medium", "perf": 2373.39, "source": "autotuned"},
{"m": 22, "n": 9, "k": 22, "tile_m": 3, "tile_n": 3, "w": 8, "v": 6, "threads": 32, "grouping": 16, "minblocks": 12, "algorithm": "largeDB2", "perf": 2460.86, "source": "autotuned"},
{"m": 22, "n": 9, "k": 23, "tile_m": 3, "tile_n": 3, "w": 8, "v": 6, "threads": 32, "grouping": 16, "minblocks": 2, "algorithm": "largeDB2", "perf": 2468.62, "source": "autotuned"},
{"m": 22, "n": 9, "k": 26, "tile_m": 3, "tile_n": 3, "w": 10, "v": 6, "threads": 32, "grouping": 16, "minblocks": 1, "algorithm": "largeDB2", "perf": 2475.77, "source": "autotuned"},
{"m": 22, "n": 9, "k": 32, "tile_m": 3, "tile_n": 3, "w": 12, "v": 6, "threads": 32, "grouping": 16, "minblocks": 12, "algorithm": "largeDB2", "perf": 2445.21, "source": "autotuned"},
{"m": 22, "n": 13, "k": 4, "tile_m": 3, "tile_n": 4, "threads": 96, "grouping": 19, "minblocks": 9, "algorithm": "medium", "perf": 2322.15, "source": "autotuned"},
{"m": 22, "n": 13, "k": 5, "tile_m": 3, "tile_n": 4, "threads": 128, "grouping": 19, "minblocks": 8, "algorithm": "medium", "perf": 2483.41, "source": "autotuned"},
{"m": 22, "n": 13, "k": 9, "tile_m": 3, "tile_n": 4, "threads": 32, "grouping": 8, "minblocks": 18, "algorithm": "medium", "perf": 2798.7, "source": "autotuned"},
{"m": 22, "n": 13, "k": 13, "tile_m": 3, "tile_n": 4, "threads": 32, "grouping": 10, "minblocks": 13, "algorithm": "medium", "perf": 2930.01, "source": "autotuned"},
{"m": 22, "n": 13, "k": 22, "tile_m": 3, "tile_n": 4, "w": 8, "v": 8, "threads": 32, "grouping": 16, "minblocks": 12, "algorithm": "largeDB2", "perf": 2995.23, "source": "autotuned"},
{"m": 22, "n": 13, "k": 23, "tile_m": 3, "tile_n": 4, "w": 8, "v": 12, "threads": 32, "grouping": 16, "minblocks": 2, "algorithm": "largeDB2", "perf": 3038.82, "source": "autotuned"},
{"m": 22, "n": 13, "k": 26, "tile_m": 3, "tile_n": 4, "w": 10, "v": 12, "threads": 32, "grouping": 16, "minblocks": 12, "algorithm": "largeDB2", "perf": 3031.93, "source": "autotuned"},
{"m": 22, "n": 16, "k": 9, "tile_m": 3, "tile_n": 4, "threads": 32, "grouping": 8, "minblocks": 17, "algorithm": "medium", "perf": 3376.05, "source": "autotuned"},
{"m": 22, "n": 16, "k": 16, "tile_m": 3, "tile_n": 4, "threads": 32, "grouping": 5, "minblocks": 13, "algorithm": "medium", "perf": 3497.78, "source": "autotuned"},
{"m": 22, "n": 16, "k": 17, "tile_m": 3, "tile_n": 4, "w": 6, "v": 14, "threads": 32, "grouping": 16, "minblocks": 4, "algorithm": "largeDB2", "perf": 3485.56, "source": "autotuned"},
{"m": 22, "n": 16, "k": 22, "tile_m": 3, "tile_n": 4, "w": 8, "v": 16, "threads": 32, "grouping": 16, "minblocks": 4, "algorithm": "largeDB2", "perf": 3559.94, "source": "autotuned"},
{"m": 22, "n": 16, "k": 23, "tile_m": 11, "tile_n": 1, "w": 8, "v": 16, "threads": 64, "grouping": 16, "minblocks": 12, "algorithm": "largeDB2", "perf": 3514.99, "source": "autotuned"},
{"m": 22, "n": 17, "k": 9, "tile_m": 3, "tile_n": 5, "threads": 32, "grouping": 8, "minblocks": 18, "algorithm": "medium", "perf": 3094.72, "source": "autotuned"},
{"m": 22, "n": 17, "k": 16, "tile_m": 3, "tile_n": 5, "w": 6, "v": 16, "threads": 32, "grouping": 16, "minblocks": 1, "algorithm": "largeDB2", "perf": 3225.15, "source": "autotuned"},
{"m": 22, "n": 17, "k": 17, "tile_m": 3, "tile_n": 5, "w": 6, "v": 14, "threads": 32, "grouping": 16, "minblocks": 8, "algorithm": "largeDB2", "perf": 3222.97, "source": "autotuned"},
{"m": 22, "n": 17, "k": 22, "tile_m": 3, "tile_n": 5, "w": 8, "v": 10, "threads": 32, "grouping": 16, "minblocks": 2, "algorithm": "largeDB2", "perf": 3369.5, "source": "autotuned"},
{"m": 22, "n": 17, "k": 23, "tile_m": 3, "tile_n": 5, "w": 8, "v": 12, "threads": 32, "grouping": 16, "minblocks": 2, "algorithm": "largeDB2", "perf": 3361.21, "source": "autotuned"},
{"m": 22, "n": 22, "k": 4, "tile_m": 3, "tile_n": 3, "threads": 96, "grouping": 19, "minblocks": 12, "algorithm": "medium", "perf": 2976.34, "source": "autotuned"},
{"m": 22, "n": 22, "k": 5, "tile_m": 3, "tile_n": 3, "threads": 128, "grouping": 19, "minblocks": 9, "algorithm": "medium", "perf": 3178.51, "source": "autotuned"},
{"m": 22, "n": 22, "k": 9, "tile_m": 3, "tile_n": 3, "threads": 64, "grouping": 11, "minblocks": 14, "algorithm": "medium", "perf": 3321.16, "source": "autotuned"},
{"m": 22, "n": 22, "k": 13, "tile_m": 3, "tile_n": 3, "threads": 64, "grouping": 6, "minblocks": 13, "algorithm": "medium", "perf": 3664.96, "source": "autotuned"},
{"m": 22, "n": 22, "k": 16, "tile_m": 3, "tile_n": 3, "threads": 64, "grouping": 4, "minblocks": 11, "algorithm": "medium", "perf": 3802.23, "source": "autotuned"},
{"m": 22, "n": 22, "k": 17, "tile_m": 3, "tile_n": 6, "w": 6, "v": 22, "threads": 32, "grouping": 16, "minblocks": 4, "algorithm": "largeDB2", "perf": 3782.43, "source": "autotuned"},
{"m": 22, "n": 22, "k": 22, "tile_m": 3, "tile_n": 6, "w": 8, "v": 20, "threads": 32, "grouping": 16, "minblocks": 1, "algorithm": "largeDB2", "perf": 3782.43, "source": "autotuned"},
{"m": 22, "n": 22, "k": 23, "tile_m": 3, "tile_n": 6, "w": 8, "v": 22, "threads": 32, "grouping": 16, "minblocks": 4, "algorithm": "largeDB2", "perf": 3838.06, "source": "autotuned"},
{"m": 22, "n": 22, "k": 26, "tile_m": 3, "tile_n": 3, "threads": 64, "grouping": 6, "minblocks": 2, "algorithm": "medium", "perf": 4041.5, "source": "autotuned"},
{"m": 22, "n": 22, "k": 32, "tile_m": 3, "tile_n": 3, "threads": 64, "grouping": 4, "minblocks": 5, "algorithm": "medium", "perf": 4102.98, "source": "autotuned"},
{"m": 22, "n": 23, "k": 4, "tile_m": 3, "tile_n": 3, "threads": 96, "grouping": 19, "minblocks": 12, "algorithm": "medium", "perf": 3111.63, "source": "autotuned"},
{"m": 22, "n": 23, "k": 5, "tile_m": 3, "tile_n": 3, "threads": 128, "grouping": 19, "minblocks": 10, "algorithm": "medium", "perf": 3261.33, "source": "autotuned"},
{"m": 22, "n": 23, "k": 9, "tile_m": 3, "tile_n": 3, "threads": 224, "grouping": 17, "minblocks": 5, "algorithm": "medium", "perf": 3444.12, "source": "autotuned"},
{"m": 22, "n": 23, "k": 13, "tile_m": 3, "tile_n": 6, "w": 6, "v": 22, "threads": 32, "grouping": 16, "minblocks": 4, "algorithm": "largeDB2", "perf": 3628.71, "source": "autotuned"},
{"m": 22, "n": 23, "k": 16, "tile_m": 3, "tile_n": 6, "w": 6, "v": 22, "threads": 32, "grouping": 16, "minblocks": 8, "algorithm": "largeDB2", "perf": 3815.26, "source": "autotuned"},
{"m": 22, "n": 23, "k": 17, "tile_m": 3, "tile_n": 6, "w": 6, "v": 12, "threads": 32, "grouping": 16, "minblocks": 1, "algorithm": "largeDB2", "perf": 3787.27, "source": "autotuned"},
{"m": 22, "n": 23, "k": 22, "tile_m": 3, "tile_n": 6, "w": 10, "v": 22, "threads": 32, "grouping": 16, "minblocks": 1, "algorithm": "largeDB2", "perf": 3880.86, "source": "autotuned"},
{"m": 22, "n": 23, "k": 23, "tile_m": 6, "tile_n": 3, "w": 8, "v": 22, "threads": 32, "grouping": 16, "minblocks": 1, "algorithm": "largeDB2", "perf": 3897.87, "source": "autotuned"},
{"m": 22, "n": 23, "k": 26, "tile_m": 3, "tile_n": 6, "w": 10, "v": 22, "threads": 32, "grouping": 16, "minblocks": 1, "algorithm": "largeDB2", "perf": 3916.7, "source": "autotuned"},
{"m": 22, "n": 26, "k": 4, "tile_m": 3, "tile_n": 4, "threads": 128, "grouping": 19, "minblocks": 8, "algorithm": "medium", "perf": 3109.67, "source": "autotuned"},
{"m": 22, "n": 26, "k": 5, "tile_m": 11, "tile_n": 1, "threads": 160, "grouping": 19, "minblocks": 8, "algorithm": "medium", "perf": 3030.61, "source": "autotuned"},
{"m": 22, "n": 26, "k": 9, "tile_m": 3, "tile_n": 4, "threads": 64, "grouping": 13, "minblocks": 11, "algorithm": "medium", "perf": 3306.68, "source": "autotuned"},
{"m": 22, "n": 26, "k": 13, "tile_m": 11, "tile_n": 2, "w": 6, "v": 12, "threads": 32, "grouping": 16, "minblocks": 1, "algorithm": "largeDB2", "perf": 3435.19, "source": "autotuned"},
{"m": 22, "n": 26, "k": 22, "tile_m": 3, "tile_n": 7, "w": 8, "v": 24, "threads": 32, "grouping": 16, "minblocks": 1, "algorithm": "largeDB2", "perf": 3986.89, "source": "autotuned"},
{"m": 22, "n": 26, "k": 23, "tile_m": 3, "tile_n": 7, "w": 8, "v": 26, "threads": 32, "grouping": 16, "minblocks": 2, "algorithm": "largeDB2", "perf": 3992.75, "source": "autotuned"},
{"m": 22, "n": 26, "k": 26, "tile_m": 3, "tile_n": 7, "w": 10, "v": 26, "threads": 32, "grouping": 16, "minblocks": 4, "algorithm": "largeDB2", "perf": 4019.27, "source": "autotuned"},
{"m": 22, "n": 32, "k": 9, "tile_m": 11, "tile_n": 2, "w": 4, "v": 16, "threads": 32, "grouping": 16, "minblocks": 12, "algorithm": "largeDB2", "perf": 3961.24, "source": "autotuned"},
{"m": 22, "n": 32, "k": 22, "tile_m": 3, "tile_n": 8, "w": 8, "v": 30, "threads": 32, "grouping": 16, "minblocks": 2, "algorithm": "largeDB2", "perf": 4361.72, "source": "autotuned"},
{"m": 22, "n": 32, "k": 32, "tile_m": 11, "tile_n": 2, "w": 8, "v": 26, "threads": 32, "grouping": 16, "minblocks": 1, "algorithm": "largeDB2", "perf": 4392.22, "source": "autotuned"},
{"m": 23, "n": 4, "k": 4, "tile_m": 1, "tile_n": 4, "threads": 32, "grouping": 8, "minblocks": 11, "algorithm": "medium", "perf": 996.374, "source": "autotuned"},
{"m": 23, "n": 4, "k": 5, "tile_m": 1, "tile_n": 4, "threads": 32, "grouping": 10, "minblocks": 4, "algorithm": "medium", "perf": 1090.58, "source": "autotuned"},
{"m": 23, "n": 4, "k": 9, "tile_m": 1, "tile_n": 4, "threads": 64, "grouping": 13, "minblocks": 18, "algorithm": "medium", "perf": 1391.56, "source": "autotuned"},
{"m": 23, "n": 4, "k": 13, "tile_m": 1, "tile_n": 4, "threads": 64, "grouping": 8, "minblocks": 20, "algorithm": "medium", "perf": 1544.9, "source": "autotuned"},
{"m": 23, "n": 4, "k": 22, "tile_m": 1, "tile_n": 4, "threads": 128, "grouping": 15, "minblocks": 10, "algorithm": "medium", "perf": 1543.16, "source": "autotuned"},
{"m": 23, "n": 4, "k": 23, "tile_m": 1, "tile_n": 4, "threads": 96, "grouping": 13, "minblocks": 11, "algorithm": "medium", "perf": 1552.72, "source": "autotuned"},
{"m": 23, "n": 4, "k": 26, "tile_m": 1, "tile_n": 4, "threads": 128, "grouping": 15, "minblocks": 10, "algorithm": "medium", "perf": 1483.6, "source": "autotuned"},
{"m": 23, "n": 5, "k": 4, "tile_m": 1, "tile_n": 5, "threads": 32, "grouping": 8, "minblocks": 6, "algorithm": "medium", "perf": 1138.55, "source": "autotuned"},
{"m": 23, "n": 5, "k": 5, "tile_m": 1, "tile_n": 5, "threads": 32, "grouping": 10, "minblocks": 6, "algorithm": "medium", "perf": 1262.41, "source": "autotuned"},
{"m": 23, "n": 5, "k": 9, "tile_m": 1, "tile_n": 5, "threads": 64, "grouping": 10, "minblocks": 19, "algorithm": "medium", "perf": 1584.68, "source": "autotuned"},
{"m": 23, "n": 5, "k": 13, "tile_m": 1, "tile_n": 5, "threads": 32, "grouping": 8, "minblocks": 21, "algorithm": "medium", "perf": 1661.63, "source": "autotuned"},
{"m": 23, "n": 5, "k": 16, "tile_m": 1, "tile_n": 5, "threads": 96, "grouping": 13, "minblocks": 12, "algorithm": "medium", "perf": 1806.85, "source": "autotuned"},
{"m": 23, "n": 5, "k": 22, "tile_m": 1, "tile_n": 5, "threads": 128, "grouping": 15, "minblocks": 10, "algorithm": "medium", "perf": 1738.18, "source": "autotuned"},
{"m": 23, "n": 5, "k": 23, "tile_m": 2, "tile_n": 3, "w": 8, "v": 4, "threads": 32, "grouping": 16, "minblocks": 1, "algorithm": "largeDB2", "perf": 1678.82, "source": "autotuned"},
{"m": 23, "n": 5, "k": 26, "tile_m": 2, "tile_n": 3, "w": 10, "v": 4, "threads": 32, "grouping": 16, "minblocks": 1, "algorithm": "largeDB2", "perf": 1669.05, "source": "autotuned"},
{"m": 23, "n": 9, "k": 4, "tile_m": 3, "tile_n": 3, "threads": 96, "grouping": 13, "minblocks": 11, "algorithm": "medium", "perf": 1780.95, "source": "autotuned"},
{"m": 23, "n": 9, "k": 5, "tile_m": 3, "tile_n": 3, "threads": 64, "grouping": 10, "minblocks": 17, "algorithm": "medium", "perf": 1857.64, "source": "autotuned"},
{"m": 23, "n": 9, "k": 9, "tile_m": 3, "tile_n": 3, "threads": 32, "grouping": 8, "minblocks": 21, "algorithm": "medium", "perf": 2283.8, "source": "autotuned"},
{"m": 23, "n": 9, "k": 13, "tile_m": 3, "tile_n": 3, "threads": 32, "grouping": 8, "minblocks": 18, "algorithm": "medium", "perf": 2492.45, "source": "autotuned"},
{"m": 23, "n": 9, "k": 16, "tile_m": 3, "tile_n": 3, "threads": 32, "grouping": 10, "minblocks": 13, "algorithm": "medium", "perf": 2426.54, "source": "autotuned"},
{"m": 23, "n": 9, "k": 17, "tile_m": 3, "tile_n": 3, "w": 6, "v": 8, "threads": 32, "grouping": 16, "minblocks": 1, "algorithm": "largeDB2", "perf": 2444.51, "source": "autotuned"},
{"m": 23, "n": 9, "k": 22, "tile_m": 3, "tile_n": 3, "w": 8, "v": 8, "threads": 32, "grouping": 16, "minblocks": 8, "algorithm": "largeDB2", "perf": 2497.49, "source": "autotuned"},
{"m": 23, "n": 9, "k": 23, "tile_m": 3, "tile_n": 3, "w": 8, "v": 6, "threads": 32, "grouping": 16, "minblocks": 4, "algorithm": "largeDB2", "perf": 2480.46, "source": "autotuned"},
{"m": 23, "n": 9, "k": 26, "tile_m": 3, "tile_n": 3, "w": 10, "v": 8, "threads": 32, "grouping": 16, "minblocks": 12, "algorithm": "largeDB2", "perf": 2511.05, "source": "autotuned"},
{"m": 23, "n": 13, "k": 4, "tile_m": 3, "tile_n": 4, "threads": 96, "grouping": 19, "minblocks": 9, "algorithm": "medium", "perf": 2396.58, "source": "autotuned"},
{"m": 23, "n": 13, "k": 5, "tile_m": 3, "tile_n": 4, "threads": 128, "grouping": 19, "minblocks": 8, "algorithm": "medium", "perf": 2543.31, "source": "autotuned"},
{"m": 23, "n": 13, "k": 9, "tile_m": 3, "tile_n": 4, "threads": 32, "grouping": 8, "minblocks": 17, "algorithm": "medium", "perf": 2900.69, "source": "autotuned"},
{"m": 23, "n": 13, "k": 13, "tile_m": 3, "tile_n": 4, "threads": 32, "grouping": 10, "minblocks": 13, "algorithm": "medium", "perf": 3012.56, "source": "autotuned"},
{"m": 23, "n": 13, "k": 16, "tile_m": 3, "tile_n": 4, "w": 6, "v": 12, "threads": 32, "grouping": 16, "minblocks": 1, "algorithm": "largeDB2", "perf": 3011.01, "source": "autotuned"},
{"m": 23, "n": 13, "k": 17, "tile_m": 3, "tile_n": 4, "w": 6, "v": 12, "threads": 32, "grouping": 16, "minblocks": 2, "algorithm": "largeDB2", "perf": 3036.18, "source": "autotuned"},
{"m": 23, "n": 13, "k": 22, "tile_m": 3, "tile_n": 4, "w": 8, "v": 6, "threads": 32, "grouping": 16, "minblocks": 4, "algorithm": "largeDB2", "perf": 3069.06, "source": "autotuned"},
{"m": 23, "n": 13, "k": 23, "tile_m": 3, "tile_n": 4, "w": 8, "v": 12, "threads": 32, "grouping": 16, "minblocks": 1, "algorithm": "largeDB2", "perf": 3071.05, "source": "autotuned"},
{"m": 23, "n": 13, "k": 26, "tile_m": 3, "tile_n": 4, "w": 10, "v": 10, "threads": 32, "grouping": 16, "minblocks": 1, "algorithm": "largeDB2", "perf": 3063.19, "source": "autotuned"},
{"m": 23, "n": 16, "k": 5, "tile_m": 3, "tile_n": 4, "threads": 128, "grouping": 19, "minblocks": 8, "algorithm": "medium", "perf": 3109.08, "source": "autotuned"},
{"m": 23, "n": 16, "k": 9, "tile_m": 3, "tile_n": 4, "threads": 32, "grouping": 8, "minblocks": 17, "algorithm": "medium", "perf": 3413.15, "source": "autotuned"},
{"m": 23, "n": 16, "k": 13, "tile_m": 3, "tile_n": 4, "threads": 32, "grouping": 10, "minblocks": 13, "algorithm": "medium", "perf": 3560.64, "source": "autotuned"},
{"m": 23, "n": 16, "k": 16, "tile_m": 3, "tile_n": 4, "w": 6, "v": 16, "threads": 32, "grouping": 16, "minblocks": 2, "algorithm": "largeDB2", "perf": 3562.4, "source": "autotuned"},
{"m": 23, "n": 16, "k": 17, "tile_m": 3, "tile_n": 4, "w": 6, "v": 8, "threads": 32, "grouping": 16, "minblocks": 4, "algorithm": "largeDB2", "perf": 3534.24, "source": "autotuned"},
{"m": 23, "n": 16, "k": 22, "tile_m": 3, "tile_n": 4, "w": 8, "v": 16, "threads": 32, "grouping": 16, "minblocks": 2, "algorithm": "largeDB2", "perf": 3581.31, "source": "autotuned"},
{"m": 23, "n": 16, "k": 23, "tile_m": 3, "tile_n": 4, "w": 8, "v": 16, "threads": 32, "grouping": 16, "minblocks": 1, "algorithm": "largeDB2", "perf": 3559.41, "source": "autotuned"},
{"m": 23, "n": 17, "k": 9, "tile_m": 3, "tile_n": 5, "threads": 32, "grouping": 8, "minblocks": 18, "algorithm": "medium", "perf": 3267.42, "source": "autotuned"},
{"m": 23, "n": 17, "k": 13, "tile_m": 3, "tile_n": 5, "threads": 32, "grouping": 10, "minblocks": 13, "algorithm": "medium", "perf": 3242.72, "source": "autotuned"},
{"m": 23, "n": 17, "k": 16, "tile_m": 3, "tile_n": 5, "w": 6, "v": 16, "threads": 32, "grouping": 16, "minblocks": 4, "algorithm": "largeDB2", "perf": 3352.48, "source": "autotuned"},
{"m": 23, "n": 17, "k": 17, "tile_m": 3, "tile_n": 5, "w": 6, "v": 14, "threads": 32, "grouping": 16, "minblocks": 12, "algorithm": "largeDB2", "perf": 3351.35, "source": "autotuned"},
{"m": 23, "n": 17, "k": 22, "tile_m": 3, "tile_n": 5, "w": 8, "v": 16, "threads": 32, "grouping": 16, "minblocks": 8, "algorithm": "largeDB2", "perf": 3462.19, "source": "autotuned"},
{"m": 23, "n": 17, "k": 23, "tile_m": 3, "tile_n": 5, "w": 8, "v": 14, "threads": 32, "grouping": 16, "minblocks": 1, "algorithm": "largeDB2", "perf": 3428.28, "source": "autotuned"},
{"m": 23, "n": 22, "k": 4, "tile_m": 3, "tile_n": 3, "threads": 96, "grouping": 19, "minblocks": 10, "algorithm": "medium", "perf": 3137.34, "source": "autotuned"},
{"m": 23, "n": 22, "k": 5, "tile_m": 3, "tile_n": 3, "threads": 128, "grouping": 19, "minblocks": 10, "algorithm": "medium", "perf": 3261.33, "source": "autotuned"},
{"m": 23, "n": 22, "k": 9, "tile_m": 3, "tile_n": 3, "threads": 224, "grouping": 17, "minblocks": 5, "algorithm": "medium", "perf": 3472.12, "source": "autotuned"},
{"m": 23, "n": 22, "k": 13, "tile_m": 3, "tile_n": 6, "w": 6, "v": 22, "threads": 32, "grouping": 16, "minblocks": 8, "algorithm": "largeDB2", "perf": 3650.18, "source": "autotuned"},
{"m": 23, "n": 22, "k": 16, "tile_m": 3, "tile_n": 6, "w": 6, "v": 22, "threads": 32, "grouping": 16, "minblocks": 2, "algorithm": "largeDB2", "perf": 3873.66, "source": "autotuned"},
{"m": 23, "n": 22, "k": 17, "tile_m": 3, "tile_n": 6, "w": 6, "v": 22, "threads": 32, "grouping": 16, "minblocks": 1, "algorithm": "largeDB2", "perf": 3841.38, "source": "autotuned"},
{"m": 23, "n": 22, "k": 22, "tile_m": 3, "tile_n": 6, "w": 8, "v": 22, "threads": 32, "grouping": 16, "minblocks": 2, "algorithm": "largeDB2", "perf": 3895.34, "source": "autotuned"},
{"m": 23, "n": 22, "k": 23, "tile_m": 3, "tile_n": 6, "w": 8, "v": 22, "threads": 32, "grouping": 16, "minblocks": 8, "algorithm": "largeDB2", "perf": 3911.84, "source": "autotuned"},
{"m": 23, "n": 22, "k": 26, "tile_m": 3, "tile_n": 6, "w": 10, "v": 22, "threads": 32, "grouping": 16, "minblocks": 4, "algorithm": "largeDB2", "perf": 3916.7, "source": "autotuned"},
{"m": 23, "n": 23, "k": 4, "tile_m": 3, "tile_n": 3, "threads": 96, "grouping": 19, "minblocks": 12, "algorithm": "medium", "perf": 3274.54, "source": "autotuned"},
{"m": 23, "n": 23, "k": 5, "tile_m": 3, "tile_n": 3, "threads": 128, "grouping": 19, "minblocks": 9, "algorithm": "medium", "perf": 3409.57, "source": "autotuned"},
{"m": 23, "n": 23, "k": 9, "tile_m": 3, "tile_n": 3, "threads": 224, "grouping": 17, "minblocks": 5, "algorithm": "medium", "perf": 3600.67, "source": "autotuned"},
{"m": 23, "n": 23, "k": 13, "tile_m": 3, "tile_n": 3, "threads": 64, "grouping": 13, "minblocks": 11, "algorithm": "medium", "perf": 3908.61, "source": "autotuned"},
{"m": 23, "n": 23, "k": 16, "tile_m": 3, "tile_n": 3, "threads": 64, "grouping": 19, "minblocks": 8, "algorithm": "medium", "perf": 3968.74, "source": "autotuned"},
{"m": 23, "n": 23, "k": 17, "tile_m": 3, "tile_n": 6, "w": 6, "v": 22, "threads": 32, "grouping": 16, "minblocks": 1, "algorithm": "largeDB2", "perf": 3940.92, "source": "autotuned"},
{"m": 23, "n": 23, "k": 22, "tile_m": 6, "tile_n": 3, "w": 8, "v": 22, "threads": 32, "grouping": 16, "minblocks": 12, "algorithm": "largeDB2", "perf": 4012.51, "source": "autotuned"},
{"m": 23, "n": 23, "k": 23, "tile_m": 3, "tile_n": 3, "threads": 64, "grouping": 5, "minblocks": 7, "algorithm": "medium", "perf": 4305.71, "source": "autotuned"},
{"m": 23, "n": 23, "k": 26, "tile_m": 3, "tile_n": 3, "threads": 64, "grouping": 6, "minblocks": 3, "algorithm": "medium", "perf": 4228.99, "source": "autotuned"},
{"m": 23, "n": 26, "k": 4, "tile_m": 3, "tile_n": 4, "threads": 128, "grouping": 19, "minblocks": 8, "algorithm": "medium", "perf": 3195.44, "source": "autotuned"},
{"m": 23, "n": 26, "k": 5, "tile_m": 3, "tile_n": 4, "threads": 192, "grouping": 25, "minblocks": 6, "algorithm": "medium", "perf": 3195.44, "source": "autotuned"},
{"m": 23, "n": 26, "k": 9, "tile_m": 3, "tile_n": 4, "threads": 64, "grouping": 11, "minblocks": 13, "algorithm": "medium", "perf": 3456.99, "source": "autotuned"},
{"m": 23, "n": 26, "k": 13, "tile_m": 4, "tile_n": 6, "w": 6, "v": 26, "threads": 32, "grouping": 16, "minblocks": 8, "algorithm": "largeDB2", "perf": 3556.29, "source": "autotuned"},
{"m": 23, "n": 26, "k": 22, "tile_m": 3, "tile_n": 7, "w": 8, "v": 26, "threads": 32, "grouping": 16, "minblocks": 1, "algorithm": "largeDB2", "perf": 4098.87, "source": "autotuned"},
{"m": 23, "n": 26, "k": 23, "tile_m": 3, "tile_n": 7, "w": 8, "v": 26, "threads": 32, "grouping": 16, "minblocks": 2, "algorithm": "largeDB2", "perf": 4081.77, "source": "autotuned"},
{"m": 23, "n": 26, "k": 26, "tile_m": 3, "tile_n": 7, "w": 10, "v": 26, "threads": 32, "grouping": 16, "minblocks": 4, "algorithm": "largeDB2", "perf": 4095.73, "source": "autotuned"},
{"m": 24, "n": 5, "k": 5, "tile_m": 1, "tile_n": 5, "threads": 32, "grouping": 10, "minblocks": 4, "algorithm": "medium", "perf": 1320.84, "source": "autotuned"},
{"m": 24, "n": 5, "k": 13, "tile_m": 1, "tile_n": 5, "threads": 32, "grouping": 8, "minblocks": 17, "algorithm": "medium", "perf": 1741.62, "source": "autotuned"},
{"m": 24, "n": 5, "k": 24, "tile_m": 1, "tile_n": 5, "threads": 128, "grouping": 19, "minblocks": 8, "algorithm": "medium", "perf": 1748.12, "source": "autotuned"},
{"m": 24, "n": 5, "k": 26, "tile_m": 2, "tile_n": 3, "w": 10, "v": 4, "threads": 32, "grouping": 16, "minblocks": 8, "algorithm": "largeDB2", "perf": 1741.62, "source": "autotuned"},
{"m": 24, "n": 5, "k": 32, "tile_m": 2, "tile_n": 3, "w": 12, "v": 4, "threads": 32, "grouping": 16, "minblocks": 2, "algorithm": "largeDB2", "perf": 1731.31, "source": "autotuned"},
{"m": 24, "n": 13, "k": 5, "tile_m": 3, "tile_n": 4, "threads": 128, "grouping": 19, "minblocks": 8, "algorithm": "medium", "perf": 2653.89, "source": "autotuned"},
{"m": 24, "n": 13, "k": 13, "tile_m": 3, "tile_n": 4, "threads": 32, "grouping": 10, "minblocks": 14, "algorithm": "medium", "perf": 3092.43, "source": "autotuned"},
{"m": 24, "n": 13, "k": 24, "tile_m": 3, "tile_n": 4, "w": 8, "v": 12, "threads": 32, "grouping": 16, "minblocks": 1, "algorithm": "largeDB2", "perf": 3177.46, "source": "autotuned"},
{"m": 24, "n": 13, "k": 26, "tile_m": 3, "tile_n": 4, "w": 10, "v": 8, "threads": 32, "grouping": 16, "minblocks": 12, "algorithm": "largeDB2", "perf": 3169.74, "source": "autotuned"},
{"m": 24, "n": 13, "k": 32, "tile_m": 3, "tile_n": 4, "w": 12, "v": 12, "threads": 32, "grouping": 16, "minblocks": 2, "algorithm": "largeDB2", "perf": 3206.48, "source": "autotuned"},
{"m": 24, "n": 24, "k": 5, "tile_m": 3, "tile_n": 3, "threads": 128, "grouping": 19, "minblocks": 10, "algorithm": "medium", "perf": 3790.66, "source": "autotuned"},
{"m": 24, "n": 24, "k": 13, "tile_m": 3, "tile_n": 3, "threads": 64, "grouping": 13, "minblocks": 12, "algorithm": "medium", "perf": 4204.91, "source": "autotuned"},
{"m": 24, "n": 24, "k": 24, "tile_m": 3, "tile_n": 3, "threads": 64, "grouping": 3, "minblocks": 1, "algorithm": "medium", "perf": 4564.81, "source": "autotuned"},
{"m": 24, "n": 24, "k": 26, "tile_m": 3, "tile_n": 3, "threads": 64, "grouping": 4, "minblocks": 2, "algorithm": "medium", "perf": 4430.41, "source": "autotuned"},
{"m": 24, "n": 24, "k": 32, "tile_m": 3, "tile_n": 3, "threads": 64, "grouping": 4, "minblocks": 1, "algorithm": "medium", "perf": 4455.0, "source": "autotuned"},
{"m": 24, "n": 26, "k": 5, "tile_m": 3, "tile_n": 4, "threads": 160, "grouping": 17, "minblocks": 5, "algorithm": "medium", "perf": 3251.02, "source": "autotuned"},
{"m": 24, "n": 26, "k": 13, "tile_m": 3, "tile_n": 4, "threads": 64, "grouping": 13, "minblocks": 11, "algorithm": "medium", "perf": 3675.06, "source": "autotuned"},
{"m": 24, "n": 26, "k": 24, "tile_m": 3, "tile_n": 7, "w": 8, "v": 18, "threads": 32, "grouping": 16, "minblocks": 4, "algorithm": "largeDB2", "perf": 4281.83, "source": "autotuned"},
{"m": 24, "n": 26, "k": 26, "tile_m": 3, "tile_n": 7, "w": 10, "v": 18, "threads": 32, "grouping": 16, "minblocks": 2, "algorithm": "largeDB2", "perf": 4202.97, "source": "autotuned"},
{"m": 24, "n": 26, "k": 32, "tile_m": 3, "tile_n": 4, "w": 12, "v": 22, "threads": 64, "grouping": 16, "minblocks": 1, "algorithm": "largeDB2", "perf": 4246.22, "source": "autotuned"},
{"m": 24, "n": 32, "k": 5, "tile_m": 3, "tile_n": 4, "threads": 192, "grouping": 25, "minblocks": 6, "algorithm": "medium", "perf": 3872.18, "source": "autotuned"},
{"m": 24, "n": 32, "k": 13, "tile_m": 6, "tile_n": 4, "w": 6, "v": 16, "threads": 32, "grouping": 16, "minblocks": 12, "algorithm": "largeDB2", "perf": 4395.74, "source": "autotuned"},
{"m": 24, "n": 32, "k": 24, "tile_m": 3, "tile_n": 8, "w": 8, "v": 32, "threads": 32, "grouping": 16, "minblocks": 4, "algorithm": "largeDB2", "perf": 4646.61, "source": "autotuned"},
{"m": 24, "n": 32, "k": 26, "tile_m": 3, "tile_n": 8, "w": 8, "v": 28, "threads": 32, "grouping": 16, "minblocks": 2, "algorithm": "largeDB2", "perf": 4534.1, "source": "autotuned"},
{"m": 24, "n": 32, "k": 32, "tile_m": 3, "tile_n": 4, "w": 8, "v": 12, "threads": 64, "grouping": 16, "minblocks": 12, "algorithm": "largeDB2", "perf": 4618.68, "source": "autotuned"},
{"m": 25, "n": 4, "k": 4, "tile_m": 1, "tile_n": 4, "threads": 32, "grouping": 9, "minblocks": 10, "algorithm": "medium", "perf": 1012.07, "source": "autotuned"},
{"m": 25, "n": 4, "k": 5, "tile_m": 1, "tile_n": 4, "threads": 32, "grouping": 10, "minblocks": 11, "algorithm": "medium", "perf": 1166.41, "source": "autotuned"},
{"m": 25, "n": 4, "k": 7, "tile_m": 1, "tile_n": 4, "threads": 64, "grouping": 8, "minblocks": 21, "algorithm": "medium", "perf": 1347.79, "source": "autotuned"},
{"m": 25, "n": 4, "k": 9, "tile_m": 1, "tile_n": 4, "threads": 64, "grouping": 8, "minblocks": 23, "algorithm": "medium", "perf": 1462.96, "source": "autotuned"},
{"m": 25, "n": 4, "k": 13, "tile_m": 1, "tile_n": 4, "threads": 64, "grouping": 8, "minblocks": 19, "algorithm": "medium", "perf": 1604.12, "source": "autotuned"},
{"m": 25, "n": 4, "k": 25, "tile_m": 1, "tile_n": 4, "threads": 128, "grouping": 15, "minblocks": 10, "algorithm": "medium", "perf": 1491.4, "source": "autotuned"},
{"m": 25, "n": 4, "k": 26, "tile_m": 1, "tile_n": 4, "threads": 128, "grouping": 17, "minblocks": 9, "algorithm": "medium", "perf": 1477.73, "source": "autotuned"},
{"m": 25, "n": 4, "k": 28, "tile_m": 1, "tile_n": 4, "threads": 128, "grouping": 17, "minblocks": 9, "algorithm": "medium", "perf": 1471.05, "source": "autotuned"},
{"m": 25, "n": 4, "k": 32, "tile_m": 1, "tile_n": 4, "threads": 32, "grouping": 4, "minblocks": 1, "algorithm": "medium", "perf": 1422.25, "source": "autotuned"},
{"m": 25, "n": 4, "k": 45, "tile_m": 1, "tile_n": 4, "w": 22, "v": 4, "threads": 32, "grouping": 16, "minblocks": 12, "algorithm": "largeDB2", "perf": 1379.11, "source": "autotuned"},
{"m": 25, "n": 5, "k": 4, "tile_m": 1, "tile_n": 5, "threads": 32, "grouping": 8, "minblocks": 1, "algorithm": "medium", "perf": 1184.08, "source": "autotuned"},
{"m": 25, "n": 5, "k": 5, "tile_m": 1, "tile_n": 5, "threads": 32, "grouping": 10, "minblocks": 5, "algorithm": "medium", "perf": 1361.49, "source": "autotuned"},
{"m": 25, "n": 5, "k": 7, "tile_m": 1, "tile_n": 5, "threads": 64, "grouping": 10, "minblocks": 19, "algorithm": "medium", "perf": 1562.99, "source": "autotuned"},
{"m": 25, "n": 5, "k": 9, "tile_m": 1, "tile_n": 5, "threads": 64, "grouping": 10, "minblocks": 19, "algorithm": "medium", "perf": 1689.26, "source": "autotuned"},
{"m": 25, "n": 5, "k": 13, "tile_m": 1, "tile_n": 5, "threads": 96, "grouping": 13, "minblocks": 12, "algorithm": "medium", "perf": 1751.62, "source": "autotuned"},
{"m": 25, "n": 5, "k": 25, "tile_m": 1, "tile_n": 5, "threads": 128, "grouping": 19, "minblocks": 9, "algorithm": "medium", "perf": 1706.32, "source": "autotuned"},
{"m": 25, "n": 5, "k": 26, "tile_m": 3, "tile_n": 2, "w": 10, "v": 4, "threads": 32, "grouping": 16, "minblocks": 2, "algorithm": "largeDB2", "perf": 1656.43, "source": "autotuned"},
{"m": 25, "n": 5, "k": 28, "tile_m": 3, "tile_n": 2, "w": 12, "v": 4, "threads": 32, "grouping": 16, "minblocks": 1, "algorithm": "largeDB2", "perf": 1649.38, "source": "autotuned"},
{"m": 25, "n": 5, "k": 32, "tile_m": 3, "tile_n": 2, "w": 12, "v": 4, "threads": 32, "grouping": 16, "minblocks": 4, "algorithm": "largeDB2", "perf": 1659.81, "source": "autotuned"},
{"m": 25, "n": 5, "k": 45, "tile_m": 3, "tile_n": 2, "w": 16, "v": 4, "threads": 32, "grouping": 16, "minblocks": 12, "algorithm": "largeDB2", "perf": 1598.51, "source": "autotuned"},
{"m": 25, "n": 7, "k": 4, "tile_m": 1, "tile_n": 7, "threads": 32, "grouping": 10, "minblocks": 26, "algorithm": "medium", "perf": 1543.53, "source": "autotuned"},
{"m": 25, "n": 7, "k": 5, "tile_m": 1, "tile_n": 7, "threads": 64, "grouping": 10, "minblocks": 19, "algorithm": "medium", "perf": 1694.39, "source": "autotuned"},
{"m": 25, "n": 7, "k": 7, "tile_m": 1, "tile_n": 7, "threads": 64, "grouping": 10, "minblocks": 19, "algorithm": "medium", "perf": 1953.74, "source": "autotuned"},
{"m": 25, "n": 7, "k": 9, "tile_m": 1, "tile_n": 7, "threads": 64, "grouping": 13, "minblocks": 15, "algorithm": "medium", "perf": 2063.71, "source": "autotuned"},
{"m": 25, "n": 7, "k": 13, "tile_m": 1, "tile_n": 7, "threads": 32, "grouping": 8, "minblocks": 17, "algorithm": "medium", "perf": 2181.47, "source": "autotuned"},
{"m": 25, "n": 7, "k": 25, "tile_m": 3, "tile_n": 3, "w": 10, "v": 6, "threads": 32, "grouping": 16, "minblocks": 4, "algorithm": "largeDB2", "perf": 2051.42, "source": "autotuned"},
{"m": 25, "n": 7, "k": 26, "tile_m": 3, "tile_n": 3, "w": 10, "v": 6, "threads": 32, "grouping": 16, "minblocks": 8, "algorithm": "largeDB2", "perf": 2051.42, "source": "autotuned"},
{"m": 25, "n": 7, "k": 28, "tile_m": 3, "tile_n": 3, "w": 10, "v": 6, "threads": 32, "grouping": 16, "minblocks": 1, "algorithm": "largeDB2", "perf": 2079.27, "source": "autotuned"},
{"m": 25, "n": 7, "k": 32, "tile_m": 3, "tile_n": 3, "w": 12, "v": 6, "threads": 32, "grouping": 16, "minblocks": 12, "algorithm": "largeDB2", "perf": 2092.29, "source": "autotuned"},
{"m": 25, "n": 7, "k": 45, "tile_m": 3, "tile_n": 3, "w": 16, "v": 6, "threads": 32, "grouping": 16, "minblocks": 12, "algorithm": "largeDB2", "perf": 2062.88, "source": "autotuned"},
{"m": 25, "n": 9, "k": 4, "tile_m": 1, "tile_n": 9, "threads": 128, "grouping": 19, "minblocks": 8, "algorithm": "medium", "perf": 1709.06, "source": "autotuned"},
{"m": 25, "n": 9, "k": 5, "tile_m": 1, "tile_n": 9, "threads": 64, "grouping": 10, "minblocks": 15, "algorithm": "medium", "perf": 1953.74, "source": "autotuned"},
{"m": 25, "n": 9, "k": 7, "tile_m": 1, "tile_n": 9, "threads": 64, "grouping": 13, "minblocks": 16, "algorithm": "medium", "perf": 2252.54, "source": "autotuned"},
{"m": 25, "n": 9, "k": 9, "tile_m": 1, "tile_n": 9, "threads": 96, "grouping": 13, "minblocks": 11, "algorithm": "medium", "perf": 2274.29, "source": "autotuned"},
{"m": 25, "n": 9, "k": 13, "tile_m": 1, "tile_n": 9, "threads": 32, "grouping": 8, "minblocks": 18, "algorithm": "medium", "perf": 2438.26, "source": "autotuned"},
{"m": 25, "n": 9, "k": 25, "tile_m": 3, "tile_n": 3, "w": 10, "v": 8, "threads": 32, "grouping": 16, "minblocks": 8, "algorithm": "largeDB2", "perf": 2500.04, "source": "autotuned"},
{"m": 25, "n": 9, "k": 26, "tile_m": 3, "tile_n": 3, "w": 10, "v": 8, "threads": 32, "grouping": 16, "minblocks": 1, "algorithm": "largeDB2", "perf": 2528.15, "source": "autotuned"},
{"m": 25, "n": 9, "k": 28, "tile_m": 3, "tile_n": 3, "w": 10, "v": 8, "threads": 32, "grouping": 16, "minblocks": 1, "algorithm": "largeDB2", "perf": 2524.83, "source": "autotuned"},
{"m": 25, "n": 9, "k": 32, "tile_m": 3, "tile_n": 3, "w": 12, "v": 6, "threads": 32, "grouping": 16, "minblocks": 1, "algorithm": "largeDB2", "perf": 2528.88, "source": "autotuned"},
{"m": 25, "n": 9, "k": 45, "tile_m": 3, "tile_n": 3, "w": 16, "v": 4, "threads": 32, "grouping": 16, "minblocks": 12, "algorithm": "largeDB2", "perf": 2428.43, "source": "autotuned"},
{"m": 25, "n": 11, "k": 11, "tile_m": 1, "tile_n": 11, "threads": 32, "grouping": 8, "minblocks": 17, "algorithm": "medium", "perf": 2608.57, "source": "autotuned"},
{"m": 25, "n": 11, "k": 12, "tile_m": 1, "tile_n": 11, "threads": 32, "grouping": 8, "minblocks": 18, "algorithm": "medium", "perf": 2667.86, "source": "autotuned"},
{"m": 25, "n": 11, "k": 20, "tile_m": 5, "tile_n": 2, "w": 8, "v": 8, "threads": 32, "grouping": 16, "minblocks": 1, "algorithm": "largeDB2", "perf": 2743.54, "source": "autotuned"},
{"m": 25, "n": 11, "k": 25, "tile_m": 5, "tile_n": 2, "w": 10, "v": 10, "threads": 32, "grouping": 16, "minblocks": 12, "algorithm": "largeDB2", "perf": 2803.19, "source": "autotuned"},
{"m": 25, "n": 11, "k": 32, "tile_m": 5, "tile_n": 2, "w": 12, "v": 10, "threads": 32, "grouping": 16, "minblocks": 8, "algorithm": "largeDB2", "perf": 2845.72, "source": "autotuned"},
{"m": 25, "n": 12, "k": 11, "tile_m": 5, "tile_n": 2, "threads": 32, "grouping": 8, "minblocks": 17, "algorithm": "medium", "perf": 2813.38, "source": "autotuned"},
{"m": 25, "n": 12, "k": 12, "tile_m": 5, "tile_n": 2, "threads": 32, "grouping": 10, "minblocks": 14, "algorithm": "medium", "perf": 2813.38, "source": "autotuned"},
{"m": 25, "n": 12, "k": 20, "tile_m": 5, "tile_n": 2, "w": 8, "v": 6, "threads": 32, "grouping": 16, "minblocks": 1, "algorithm": "largeDB2", "perf": 2977.12, "source": "autotuned"},
{"m": 25, "n": 13, "k": 4, "tile_m": 7, "tile_n": 2, "threads": 128, "grouping": 19, "minblocks": 8, "algorithm": "medium", "perf": 2138.83, "source": "autotuned"},
{"m": 25, "n": 13, "k": 5, "tile_m": 7, "tile_n": 2, "threads": 128, "grouping": 19, "minblocks": 8, "algorithm": "medium", "perf": 2386.44, "source": "autotuned"},
{"m": 25, "n": 13, "k": 7, "tile_m": 7, "tile_n": 2, "threads": 32, "grouping": 10, "minblocks": 17, "algorithm": "medium", "perf": 2486.57, "source": "autotuned"},
{"m": 25, "n": 13, "k": 9, "tile_m": 7, "tile_n": 2, "threads": 32, "grouping": 10, "minblocks": 17, "algorithm": "medium", "perf": 2593.9, "source": "autotuned"},
{"m": 25, "n": 13, "k": 13, "tile_m": 7, "tile_n": 2, "threads": 32, "grouping": 10, "minblocks": 13, "algorithm": "medium", "perf": 2732.53, "source": "autotuned"},
{"m": 25, "n": 13, "k": 14, "tile_m": 7, "tile_n": 2, "threads": 32, "grouping": 10, "minblocks": 14, "algorithm": "medium", "perf": 2807.21, "source": "autotuned"},
{"m": 25, "n": 13, "k": 25, "tile_m": 7, "tile_n": 2, "w": 10, "v": 12, "threads": 32, "grouping": 16, "minblocks": 12, "algorithm": "largeDB2", "perf": 2953.32, "source": "autotuned"},
{"m": 25, "n": 13, "k": 26, "tile_m": 7, "tile_n": 2, "w": 10, "v": 12, "threads": 32, "grouping": 16, "minblocks": 12, "algorithm": "largeDB2", "perf": 2967.92, "source": "autotuned"},
{"m": 25, "n": 13, "k": 28, "tile_m": 7, "tile_n": 2, "w": 10, "v": 8, "threads": 32, "grouping": 16, "minblocks": 12, "algorithm": "largeDB2", "perf": 2973.49, "source": "autotuned"},
{"m": 25, "n": 13, "k": 32, "tile_m": 7, "tile_n": 2, "w": 12, "v": 12, "threads": 32, "grouping": 16, "minblocks": 2, "algorithm": "largeDB2", "perf": 3000.94, "source": "autotuned"},
{"m": 25, "n": 13, "k": 45, "tile_m": 7, "tile_n": 2, "threads": 32, "grouping": 2, "minblocks": 3, "algorithm": "medium", "perf": 2994.59, "source": "autotuned"},
{"m": 25, "n": 14, "k": 13, "tile_m": 7, "tile_n": 2, "threads": 32, "grouping": 10, "minblocks": 13, "algorithm": "medium", "perf": 2883.08, "source": "autotuned"},
{"m": 25, "n": 14, "k": 14, "tile_m": 7, "tile_n": 2, "threads": 32, "grouping": 10, "minblocks": 13, "algorithm": "medium", "perf": 2926.87, "source": "autotuned"},
{"m": 25, "n": 14, "k": 26, "tile_m": 7, "tile_n": 2, "w": 10, "v": 14, "threads": 32, "grouping": 16, "minblocks": 1, "algorithm": "largeDB2", "perf": 3184.3, "source": "autotuned"},
{"m": 25, "n": 14, "k": 32, "tile_m": 7, "tile_n": 2, "w": 12, "v": 14, "threads": 32, "grouping": 16, "minblocks": 1, "algorithm": "largeDB2", "perf": 3192.49, "source": "autotuned"},
{"m": 25, "n": 20, "k": 11, "tile_m": 3, "tile_n": 3, "threads": 288, "grouping": 19, "minblocks": 4, "algorithm": "medium", "perf": 3264.47, "source": "autotuned"},
{"m": 25, "n": 20, "k": 12, "tile_m": 5, "tile_n": 4, "w": 4, "v": 20, "threads": 32, "grouping": 16, "minblocks": 8, "algorithm": "largeDB2", "perf": 3349.26, "source": "autotuned"},
{"m": 25, "n": 20, "k": 20, "tile_m": 5, "tile_n": 4, "w": 8, "v": 12, "threads": 32, "grouping": 16, "minblocks": 1, "algorithm": "largeDB2", "perf": 3620.82, "source": "autotuned"},
{"m": 25, "n": 20, "k": 25, "tile_m": 5, "tile_n": 4, "w": 10, "v": 18, "threads": 32, "grouping": 16, "minblocks": 2, "algorithm": "largeDB2", "perf": 3663.25, "source": "autotuned"},
{"m": 25, "n": 20, "k": 32, "tile_m": 5, "tile_n": 4, "w": 12, "v": 16, "threads": 32, "grouping": 16, "minblocks": 12, "algorithm": "largeDB2", "perf": 3714.03, "source": "autotuned"},
{"m": 25, "n": 25, "k": 4, "tile_m": 3, "tile_n": 4, "threads": 128, "grouping": 19, "minblocks": 9, "algorithm": "medium", "perf": 3052.71, "source": "autotuned"},
{"m": 25, "n": 25, "k": 5, "tile_m": 3, "tile_n": 4, "threads": 128, "grouping": 19, "minblocks": 9, "algorithm": "medium", "perf": 3339.72, "source": "autotuned"},
{"m": 25, "n": 25, "k": 7, "tile_m": 3, "tile_n": 4, "threads": 192, "grouping": 25, "minblocks": 6, "algorithm": "medium", "perf": 3390.78, "source": "autotuned"},
{"m": 25, "n": 25, "k": 9, "tile_m": 3, "tile_n": 4, "threads": 256, "grouping": 19, "minblocks": 4, "algorithm": "medium", "perf": 3338.66, "source": "autotuned"},
{"m": 25, "n": 25, "k": 11, "tile_m": 3, "tile_n": 4, "threads": 64, "grouping": 13, "minblocks": 11, "algorithm": "medium", "perf": 3503.98, "source": "autotuned"},
{"m": 25, "n": 25, "k": 12, "tile_m": 3, "tile_n": 4, "threads": 64, "grouping": 7, "minblocks": 12, "algorithm": "medium", "perf": 3625.49, "source": "autotuned"},
{"m": 25, "n": 25, "k": 13, "tile_m": 3, "tile_n": 4, "threads": 64, "grouping": 6, "minblocks": 9, "algorithm": "medium", "perf": 3560.55, "source": "autotuned"},
{"m": 25, "n": 25, "k": 14, "tile_m": 3, "tile_n": 4, "threads": 64, "grouping": 6, "minblocks": 10, "algorithm": "medium", "perf": 3663.25, "source": "autotuned"},
{"m": 25, "n": 25, "k": 20, "tile_m": 5, "tile_n": 5, "w": 8, "v": 24, "threads": 32, "grouping": 16, "minblocks": 8, "algorithm": "largeDB2", "perf": 3843.41, "source": "autotuned"},
{"m": 25, "n": 25, "k": 25, "tile_m": 3, "tile_n": 4, "threads": 64, "grouping": 7, "minblocks": 2, "algorithm": "medium", "perf": 4174.65, "source": "autotuned"},
{"m": 25, "n": 25, "k": 26, "tile_m": 3, "tile_n": 4, "threads": 64, "grouping": 7, "minblocks": 2, "algorithm": "medium", "perf": 4107.58, "source": "autotuned"},
{"m": 25, "n": 25, "k": 28, "tile_m": 3, "tile_n": 4, "threads": 64, "grouping": 6, "minblocks": 1, "algorithm": "medium", "perf": 4165.32, "source": "autotuned"},
{"m": 25, "n": 25, "k": 32, "tile_m": 3, "tile_n": 4, "threads": 64, "grouping": 4, "minblocks": 2, "algorithm": "medium", "perf": 4243.41, "source": "autotuned"},
{"m": 25, "n": 25, "k": 45, "tile_m": 3, "tile_n": 4, "w": 16, "v": 22, "threads": 64, "grouping": 16, "minblocks": 1, "algorithm": "largeDB2", "perf": 4153.61, "source": "autotuned"},
{"m": 25, "n": 26, "k": 4, "tile_m": 3, "tile_n": 4, "threads": 128, "grouping": 19, "minblocks": 9, "algorithm": "medium", "perf": 3156.33, "source": "autotuned"},
{"m": 25, "n": 26, "k": 5, "tile_m": 3, "tile_n": 4, "threads": 160, "grouping": 15, "minblocks": 6, "algorithm": "medium", "perf": 3174.82, "source": "autotuned"},
{"m": 25, "n": 26, "k": 7, "tile_m": 3, "tile_n": 4, "threads": 192, "grouping": 25, "minblocks": 6, "algorithm": "medium", "perf": 3555.8, "source": "autotuned"},
{"m": 25, "n": 26, "k": 9, "tile_m": 3, "tile_n": 4, "threads": 256, "grouping": 19, "minblocks": 4, "algorithm": "medium", "perf": 3494.32, "source": "autotuned"},
{"m": 25, "n": 26, "k": 13, "tile_m": 5, "tile_n": 5, "w": 6, "v": 24, "threads": 32, "grouping": 16, "minblocks": 2, "algorithm": "largeDB2", "perf": 3651.77, "source": "autotuned"},
{"m": 25, "n": 26, "k": 14, "tile_m": 5, "tile_n": 5, "w": 6, "v": 24, "threads": 32, "grouping": 16, "minblocks": 1, "algorithm": "largeDB2", "perf": 3710.4, "source": "autotuned"},
{"m": 25, "n": 26, "k": 25, "tile_m": 3, "tile_n": 4, "w": 10, "v": 10, "threads": 64, "grouping": 16, "minblocks": 4, "algorithm": "largeDB2", "perf": 3917.52, "source": "autotuned"},
{"m": 25, "n": 26, "k": 26, "tile_m": 3, "tile_n": 4, "w": 10, "v": 24, "threads": 64, "grouping": 16, "minblocks": 4, "algorithm": "largeDB2", "perf": 4012.33, "source": "autotuned"},
{"m": 25, "n": 26, "k": 28, "tile_m": 3, "tile_n": 4, "w": 10, "v": 24, "threads": 64, "grouping": 16, "minblocks": 4, "algorithm": "largeDB2", "perf": 4073.47, "source": "autotuned"},
{"m": 25, "n": 26, "k": 32, "tile_m": 3, "tile_n": 4, "w": 12, "v": 24, "threads": 64, "grouping": 16, "minblocks": 1, "algorithm": "largeDB2", "perf": 4150.23, "source": "autotuned"},
{"m": 25, "n": 26, "k": 45, "tile_m": 3, "tile_n": 4, "w": 16, "v": 26, "threads": 64, "grouping": 16, "minblocks": 1, "algorithm": "largeDB2", "perf": 4246.2, "source": "autotuned"},
{"m": 25, "n": 28, "k": 4, "tile_m": 3, "tile_n": 4, "threads": 128, "grouping": 19, "minblocks": 8, "algorithm": "medium", "perf": 3366.44, "source": "autotuned"},
{"m": 25, "n": 28, "k": 5, "tile_m": 3, "tile_n": 4, "threads": 192, "grouping": 25, "minblocks": 6, "algorithm": "medium", "perf": 3419.04, "source": "autotuned"},
{"m": 25, "n": 28, "k": 7, "tile_m": 3, "tile_n": 4, "threads": 224, "grouping": 30, "minblocks": 5, "algorithm": "medium", "perf": 3534.76, "source": "autotuned"},
{"m": 25, "n": 28, "k": 9, "tile_m": 3, "tile_n": 4, "threads": 256, "grouping": 19, "minblocks": 4, "algorithm": "medium", "perf": 3739.3, "source": "autotuned"},
{"m": 25, "n": 28, "k": 13, "tile_m": 5, "tile_n": 5, "w": 6, "v": 14, "threads": 32, "grouping": 16, "minblocks": 2, "algorithm": "largeDB2", "perf": 3844.11, "source": "autotuned"},
{"m": 25, "n": 28, "k": 25, "tile_m": 3, "tile_n": 4, "w": 10, "v": 12, "threads": 64, "grouping": 16, "minblocks": 2, "algorithm": "largeDB2", "perf": 4113.13, "source": "autotuned"},
{"m": 25, "n": 28, "k": 28, "tile_m": 3, "tile_n": 4, "w": 10, "v": 22, "threads": 64, "grouping": 16, "minblocks": 4, "algorithm": "largeDB2", "perf": 4274.59, "source": "autotuned"},
{"m": 25, "n": 28, "k": 32, "tile_m": 3, "tile_n": 4, "w": 12, "v": 28, "threads": 64, "grouping": 16, "minblocks": 2, "algorithm": "largeDB2", "perf": 4349.18, "source": "autotuned"},
{"m": 25, "n": 28, "k": 45, "tile_m": 3, "tile_n": 4, "w": 16, "v": 16, "threads": 64, "grouping": 16, "minblocks": 2, "algorithm": "largeDB2", "perf": 4415.62, "source": "autotuned"},
{"m": 25, "n": 32, "k": 4, "tile_m": 7, "tile_n": 2, "threads": 160, "grouping": 15, "minblocks": 6, "algorithm": "medium", "perf": 3261.89, "source": "autotuned"},
{"m": 25, "n": 32, "k": 5, "tile_m": 7, "tile_n": 2, "threads": 192, "grouping": 25, "minblocks": 6, "algorithm": "medium", "perf": 3606.9, "source": "autotuned"},
{"m": 25, "n": 32, "k": 7, "tile_m": 7, "tile_n": 2, "threads": 256, "grouping": 19, "minblocks": 4, "algorithm": "medium", "perf": 3572.54, "source": "autotuned"},
{"m": 25, "n": 32, "k": 9, "tile_m": 7, "tile_n": 4, "w": 4, "v": 16, "threads": 32, "grouping": 16, "minblocks": 4, "algorithm": "largeDB2", "perf": 3836.43, "source": "autotuned"},
{"m": 25, "n": 32, "k": 11, "tile_m": 7, "tile_n": 4, "w": 4, "v": 32, "threads": 32, "grouping": 16, "minblocks": 8, "algorithm": "largeDB2", "perf": 3892.73, "source": "autotuned"},
{"m": 25, "n": 32, "k": 12, "tile_m": 7, "tile_n": 4, "w": 4, "v": 32, "threads": 32, "grouping": 16, "minblocks": 8, "algorithm": "largeDB2", "perf": 4206.92, "source": "autotuned"},
{"m": 25, "n": 32, "k": 13, "tile_m": 7, "tile_n": 4, "w": 6, "v": 24, "threads": 32, "grouping": 16, "minblocks": 2, "algorithm": "largeDB2", "perf": 4167.97, "source": "autotuned"},
{"m": 25, "n": 32, "k": 14, "tile_m": 7, "tile_n": 4, "w": 6, "v": 24, "threads": 32, "grouping": 16, "minblocks": 2, "algorithm": "largeDB2", "perf": 4252.34, "source": "autotuned"},
{"m": 25, "n": 32, "k": 20, "tile_m": 7, "tile_n": 4, "w": 6, "v": 24, "threads": 32, "grouping": 16, "minblocks": 1, "algorithm": "largeDB2", "perf": 4349.18, "source": "autotuned"},
{"m": 25, "n": 32, "k": 25, "tile_m": 7, "tile_n": 2, "w": 10, "v": 16, "threads": 64, "grouping": 16, "minblocks": 1, "algorithm": "largeDB2", "perf": 4392.47, "source": "autotuned"},
{"m": 25, "n": 32, "k": 26, "tile_m": 7, "tile_n": 2, "w": 10, "v": 32, "threads": 64, "grouping": 16, "minblocks": 1, "algorithm": "largeDB2", "perf": 4473.87, "source": "autotuned"},
{"m": 25, "n": 32, "k": 28, "tile_m": 7, "tile_n": 2, "w": 10, "v": 32, "threads": 64, "grouping": 16, "minblocks": 2, "algorithm": "largeDB2", "perf": 4527.28, "source": "autotuned"},
{"m": 25, "n": 32, "k": 32, "tile_m": 7, "tile_n": 2, "w": 12, "v": 32, "threads": 64, "grouping": 16, "minblocks": 4, "algorithm": "largeDB2", "perf": 4625.72, "source": "autotuned"},
{"m": 25, "n": 32, "k": 45, "tile_m": 7, "tile_n": 2, "w": 16, "v": 24, "threads": 64, "grouping": 16, "minblocks": 4, "algorithm": "largeDB2", "perf": 4643.82, "source": "autotuned"},
{"m": 25, "n": 45, "k": 4, "tile_m": 7, "tile_n": 2, "threads": 224, "grouping": 30, "minblocks": 5, "algorithm": "medium", "perf": 3322.89, "source": "autotuned"},
{"m": 25, "n": 45, "k": 5, "tile_m": 7, "tile_n": 2, "threads": 256, "grouping": 19, "minblocks": 4, "algorithm": "medium", "perf": 3493.43, "source": "autotuned"},
{"m": 25, "n": 45, "k": 7, "tile_m": 5, "tile_n": 2, "threads": 320, "grouping": 19, "minblocks": 4, "algorithm": "medium", "perf": 3550.54, "source": "autotuned"},
{"m": 25, "n": 45, "k": 9, "tile_m": 7, "tile_n": 2, "threads": 96, "grouping": 19, "minblocks": 7, "algorithm": "medium", "perf": 3651.98, "source": "autotuned"},
{"m": 25, "n": 45, "k": 13, "tile_m": 7, "tile_n": 3, "w": 6, "v": 44, "threads": 64, "grouping": 16, "minblocks": 1, "algorithm": "largeDB2", "perf": 4233.09, "source": "autotuned"},
{"m": 25, "n": 45, "k": 25, "tile_m": 5, "tile_n": 4, "w": 10, "v": 32, "threads": 64, "grouping": 16, "minblocks": 2, "algorithm": "largeDB2", "perf": 4929.99, "source": "autotuned"},
{"m": 25, "n": 45, "k": 26, "tile_m": 5, "tile_n": 4, "w": 10, "v": 24, "threads": 64, "grouping": 16, "minblocks": 4, "algorithm": "largeDB2", "perf": 4960.3, "source": "autotuned"},
{"m": 25, "n": 45, "k": 28, "tile_m": 5, "tile_n": 4, "w": 10, "v": 28, "threads": 64, "grouping": 16, "minblocks": 1, "algorithm": "largeDB2", "perf": 5032.45, "source": "autotuned"},
{"m": 25, "n": 45, "k": 32, "tile_m": 5, "tile_n": 4, "w": 12, "v": 24, "threads": 64, "grouping": 16, "minblocks": 1, "algorithm": "largeDB2", "perf": 5099.78, "source": "autotuned"},
{"m": 25, "n": 45, "k": 45, "tile_m": 5, "tile_n": 4, "w": 12, "v": 42, "threads": 64, "grouping": 16, "minblocks": 1, "algorithm": "largeDB2", "perf": 5138.07, "source": "autotuned"},
{"m": 26, "n": 4, "k": 4, "tile_m": 1, "tile_n": 4, "threads": 32, "grouping": 9, "minblocks": 7, "algorithm": "medium", "perf": 1057.24, "source": "autotuned"},
{"m": 26, "n": 4, "k": 5, "tile_m": 1, "tile_n": 4, "threads": 32, "grouping": 10, "minblocks": 4, "algorithm": "medium", "perf": 1164.54, "source": "autotuned"},
{"m": 26, "n": 4, "k": 9, "tile_m": 1, "tile_n": 4, "threads": 64, "grouping": 8, "minblocks": 21, "algorithm": "medium", "perf": 1521.48, "source": "autotuned"},
{"m": 26, "n": 4, "k": 13, "tile_m": 1, "tile_n": 4, "threads": 64, "grouping": 8, "minblocks": 19, "algorithm": "medium", "perf": 1618.59, "source": "autotuned"},
{"m": 26, "n": 4, "k": 22, "tile_m": 1, "tile_n": 4, "threads": 96, "grouping": 13, "minblocks": 12, "algorithm": "medium", "perf": 1603.64, "source": "autotuned"},
{"m": 26, "n": 4, "k": 23, "tile_m": 1, "tile_n": 4, "threads": 96, "grouping": 13, "minblocks": 11, "algorithm": "medium", "perf": 1538.55, "source": "autotuned"},
{"m": 26, "n": 4, "k": 26, "tile_m": 1, "tile_n": 4, "threads": 128, "grouping": 17, "minblocks": 9, "algorithm": "medium", "perf": 1489.45, "source": "autotuned"},
{"m": 26, "n": 5, "k": 4, "tile_m": 1, "tile_n": 5, "threads": 32, "grouping": 8, "minblocks": 1, "algorithm": "medium", "perf": 1250.39, "source": "autotuned"},
{"m": 26, "n": 5, "k": 5, "tile_m": 1, "tile_n": 5, "threads": 32, "grouping": 10, "minblocks": 5, "algorithm": "medium", "perf": 1393.71, "source": "autotuned"},
{"m": 26, "n": 5, "k": 9, "tile_m": 1, "tile_n": 5, "threads": 64, "grouping": 10, "minblocks": 19, "algorithm": "medium", "perf": 1758.36, "source": "autotuned"},
{"m": 26, "n": 5, "k": 13, "tile_m": 1, "tile_n": 5, "threads": 32, "grouping": 8, "minblocks": 17, "algorithm": "medium", "perf": 1812.76, "source": "autotuned"},
{"m": 26, "n": 5, "k": 22, "tile_m": 1, "tile_n": 5, "threads": 128, "grouping": 15, "minblocks": 10, "algorithm": "medium", "perf": 1779.16, "source": "autotuned"},
{"m": 26, "n": 5, "k": 23, "tile_m": 1, "tile_n": 5, "threads": 128, "grouping": 15, "minblocks": 10, "algorithm": "medium", "perf": 1747.04, "source": "autotuned"},
{"m": 26, "n": 5, "k": 26, "tile_m": 3, "tile_n": 2, "w": 10, "v": 4, "threads": 32, "grouping": 16, "minblocks": 2, "algorithm": "largeDB2", "perf": 1677.11, "source": "autotuned"},
{"m": 26, "n": 9, "k": 4, "tile_m": 1, "tile_n": 9, "threads": 128, "grouping": 19, "minblocks": 8, "algorithm": "medium", "perf": 1769.16, "source": "autotuned"},
{"m": 26, "n": 9, "k": 5, "tile_m": 1, "tile_n": 9, "threads": 64, "grouping": 13, "minblocks": 15, "algorithm": "medium", "perf": 1935.13, "source": "autotuned"},
{"m": 26, "n": 9, "k": 9, "tile_m": 1, "tile_n": 9, "threads": 96, "grouping": 13, "minblocks": 12, "algorithm": "medium", "perf": 2368.1, "source": "autotuned"},
{"m": 26, "n": 9, "k": 13, "tile_m": 1, "tile_n": 9, "threads": 32, "grouping": 8, "minblocks": 17, "algorithm": "medium", "perf": 2519.0, "source": "autotuned"},
{"m": 26, "n": 9, "k": 22, "tile_m": 3, "tile_n": 3, "w": 8, "v": 6, "threads": 32, "grouping": 16, "minblocks": 1, "algorithm": "largeDB2", "perf": 2540.93, "source": "autotuned"},
{"m": 26, "n": 9, "k": 23, "tile_m": 3, "tile_n": 3, "w": 8, "v": 6, "threads": 32, "grouping": 16, "minblocks": 1, "algorithm": "largeDB2", "perf": 2536.28, "source": "autotuned"},
{"m": 26, "n": 9, "k": 26, "tile_m": 3, "tile_n": 3, "w": 10, "v": 8, "threads": 32, "grouping": 16, "minblocks": 2, "algorithm": "largeDB2", "perf": 2570.06, "source": "autotuned"},
{"m": 26, "n": 13, "k": 4, "tile_m": 7, "tile_n": 2, "threads": 128, "grouping": 19, "minblocks": 8, "algorithm": "medium", "perf": 2237.46, "source": "autotuned"},
{"m": 26, "n": 13, "k": 5, "tile_m": 5, "tile_n": 3, "threads": 32, "grouping": 8, "minblocks": 19, "algorithm": "medium", "perf": 2340.53, "source": "autotuned"},
{"m": 26, "n": 13, "k": 9, "tile_m": 5, "tile_n": 3, "threads": 32, "grouping": 8, "minblocks": 20, "algorithm": "medium", "perf": 2796.83, "source": "autotuned"},
{"m": 26, "n": 13, "k": 13, "tile_m": 5, "tile_n": 3, "threads": 32, "grouping": 10, "minblocks": 14, "algorithm": "medium", "perf": 2841.84, "source": "autotuned"},
{"m": 26, "n": 13, "k": 22, "tile_m": 5, "tile_n": 3, "w": 8, "v": 12, "threads": 32, "grouping": 16, "minblocks": 2, "algorithm": "largeDB2", "perf": 3031.93, "source": "autotuned"},
{"m": 26, "n": 13, "k": 23, "tile_m": 5, "tile_n": 3, "w": 8, "v": 12, "threads": 32, "grouping": 16, "minblocks": 2, "algorithm": "largeDB2", "perf": 3037.67, "source": "autotuned"},
{"m": 26, "n": 13, "k": 26, "tile_m": 5, "tile_n": 3, "w": 10, "v": 12, "threads": 32, "grouping": 16, "minblocks": 4, "algorithm": "largeDB2", "perf": 3052.34, "source": "autotuned"},
{"m": 26, "n": 22, "k": 4, "tile_m": 3, "tile_n": 4, "threads": 128, "grouping": 19, "minblocks": 9, "algorithm": "medium", "perf": 2860.89, "source": "autotuned"},
{"m": 26, "n": 22, "k": 5, "tile_m": 1, "tile_n": 11, "threads": 160, "grouping": 19, "minblocks": 8, "algorithm": "medium", "perf": 2955.47, "source": "autotuned"},
{"m": 26, "n": 22, "k": 9, "tile_m": 7, "tile_n": 3, "w": 4, "v": 22, "threads": 32, "grouping": 16, "minblocks": 4, "algorithm": "largeDB2", "perf": 3376.05, "source": "autotuned"},
{"m": 26, "n": 22, "k": 13, "tile_m": 7, "tile_n": 3, "w": 6, "v": 22, "threads": 32, "grouping": 16, "minblocks": 1, "algorithm": "largeDB2", "perf": 3670.23, "source": "autotuned"},
{"m": 26, "n": 22, "k": 22, "tile_m": 7, "tile_n": 3, "w": 8, "v": 22, "threads": 32, "grouping": 16, "minblocks": 8, "algorithm": "largeDB2", "perf": 3973.46, "source": "autotuned"},
{"m": 26, "n": 22, "k": 23, "tile_m": 7, "tile_n": 3, "w": 8, "v": 20, "threads": 32, "grouping": 16, "minblocks": 2, "algorithm": "largeDB2", "perf": 3929.17, "source": "autotuned"},
{"m": 26, "n": 22, "k": 26, "tile_m": 7, "tile_n": 3, "w": 10, "v": 22, "threads": 32, "grouping": 16, "minblocks": 12, "algorithm": "largeDB2", "perf": 3996.23, "source": "autotuned"},
{"m": 26, "n": 23, "k": 4, "tile_m": 1, "tile_n": 12, "threads": 128, "grouping": 19, "minblocks": 9, "algorithm": "medium", "perf": 2943.83, "source": "autotuned"},
{"m": 26, "n": 23, "k": 5, "tile_m": 1, "tile_n": 8, "threads": 160, "grouping": 25, "minblocks": 8, "algorithm": "medium", "perf": 3039.57, "source": "autotuned"},
{"m": 26, "n": 23, "k": 9, "tile_m": 7, "tile_n": 3, "w": 4, "v": 22, "threads": 32, "grouping": 16, "minblocks": 1, "algorithm": "largeDB2", "perf": 3456.99, "source": "autotuned"},
{"m": 26, "n": 23, "k": 13, "tile_m": 7, "tile_n": 3, "w": 6, "v": 22, "threads": 32, "grouping": 16, "minblocks": 8, "algorithm": "largeDB2", "perf": 3738.67, "source": "autotuned"},
{"m": 26, "n": 23, "k": 22, "tile_m": 7, "tile_n": 3, "w": 8, "v": 22, "threads": 32, "grouping": 16, "minblocks": 8, "algorithm": "largeDB2", "perf": 4098.87, "source": "autotuned"},
{"m": 26, "n": 23, "k": 23, "tile_m": 7, "tile_n": 3, "w": 8, "v": 22, "threads": 32, "grouping": 16, "minblocks": 2, "algorithm": "largeDB2", "perf": 4056.1, "source": "autotuned"},
{"m": 26, "n": 23, "k": 26, "tile_m": 7, "tile_n": 3, "w": 10, "v": 10, "threads": 32, "grouping": 16, "minblocks": 12, "algorithm": "largeDB2", "perf": 4005.72, "source": "autotuned"},
{"m": 26, "n": 26, "k": 4, "tile_m": 3, "tile_n": 4, "threads": 128, "grouping": 19, "minblocks": 8, "algorithm": "medium", "perf": 3282.58, "source": "autotuned"},
{"m": 26, "n": 26, "k": 5, "tile_m": 3, "tile_n": 4, "threads": 160, "grouping": 15, "minblocks": 6, "algorithm": "medium", "perf": 3267.77, "source": "autotuned"},
{"m": 26, "n": 26, "k": 9, "tile_m": 3, "tile_n": 4, "threads": 256, "grouping": 19, "minblocks": 4, "algorithm": "medium", "perf": 3611.1, "source": "autotuned"},
{"m": 26, "n": 26, "k": 13, "tile_m": 3, "tile_n": 4, "threads": 64, "grouping": 19, "minblocks": 8, "algorithm": "medium", "perf": 3833.17, "source": "autotuned"},
{"m": 26, "n": 26, "k": 22, "tile_m": 3, "tile_n": 4, "threads": 64, "grouping": 6, "minblocks": 1, "algorithm": "medium", "perf": 4358.39, "source": "autotuned"},
{"m": 26, "n": 26, "k": 23, "tile_m": 3, "tile_n": 4, "threads": 64, "grouping": 6, "minblocks": 6, "algorithm": "medium", "perf": 4365.51, "source": "autotuned"},
{"m": 26, "n": 26, "k": 26, "tile_m": 3, "tile_n": 4, "threads": 64, "grouping": 6, "minblocks": 1, "algorithm": "medium", "perf": 4395.37, "source": "autotuned"},
{"m": 27, "n": 27, "k": 27, "tile_m": 3, "tile_n": 4, "threads": 64, "grouping": 6, "minblocks": 3, "algorithm": "medium", "perf": 4614.64, "source": "autotuned"},
{"m": 28, "n": 4, "k": 5, "tile_m": 1, "tile_n": 4, "threads": 32, "grouping": 5, "minblocks": 14, "algorithm": "medium", "perf": 1181.35, "source": "autotuned"},
{"m": 28, "n": 4, "k": 13, "tile_m": 1, "tile_n": 4, "threads": 64, "grouping": 4, "minblocks": 19, "algorithm": "medium", "perf": 1662.62, "source": "autotuned"},
{"m": 28, "n": 4, "k": 28, "tile_m": 1, "tile_n": 4, "w": 12, "v": 4, "threads": 32, "grouping": 16, "minblocks": 2, "algorithm": "largeDB2", "perf": 1463.14, "source": "autotuned"},
{"m": 28, "n": 5, "k": 25, "tile_m": 3, "tile_n": 2, "w": 10, "v": 4, "threads": 32, "grouping": 16, "minblocks": 8, "algorithm": "largeDB2", "perf": 1736.65, "source": "autotuned"},
{"m": 28, "n": 28, "k": 28, "tile_m": 2, "tile_n": 7, "threads": 96, "grouping": 4, "minblocks": 5, "algorithm": "medium", "perf": 4889.89, "source": "autotuned"},
{"m": 29, "n": 14, "k": 14, "tile_m": 3, "tile_n": 5, "w": 6, "v": 14, "threads": 32, "grouping": 16, "minblocks": 2, "algorithm": "largeDB2", "perf": 3290.38, "source": "autotuned"},
{"m": 29, "n": 14, "k": 16, "tile_m": 3, "tile_n": 5, "w": 6, "v": 14, "threads": 32, "grouping": 16, "minblocks": 1, "algorithm": "largeDB2", "perf": 3384.39, "source": "autotuned"},
{"m": 29, "n": 14, "k": 29, "tile_m": 3, "tile_n": 5, "w": 10, "v": 14, "threads": 32, "grouping": 16, "minblocks": 1, "algorithm": "largeDB2", "perf": 3376.63, "source": "autotuned"},
{"m": 29, "n": 14, "k": 32, "tile_m": 3, "tile_n": 5, "w": 12, "v": 14, "threads": 32, "grouping": 16, "minblocks": 12, "algorithm": "largeDB2", "perf": 3393.82, "source": "autotuned"},
{"m": 29, "n": 16, "k": 14, "tile_m": 3, "tile_n": 6, "w": 6, "v": 16, "threads": 32, "grouping": 16, "minblocks": 1, "algorithm": "largeDB2", "perf": 3501.09, "source": "autotuned"},
{"m": 29, "n": 16, "k": 16, "tile_m": 3, "tile_n": 6, "w": 6, "v": 16, "threads": 32, "grouping": 16, "minblocks": 12, "algorithm": "largeDB2", "perf": 3570.35, "source": "autotuned"},
{"m": 29, "n": 29, "k": 14, "tile_m": 3, "tile_n": 5, "threads": 64, "grouping": 5, "minblocks": 9, "algorithm": "medium", "perf": 4434.37, "source": "autotuned"},
{"m": 29, "n": 29, "k": 16, "tile_m": 3, "tile_n": 5, "threads": 64, "grouping": 5, "minblocks": 7, "algorithm": "medium", "perf": 4458.99, "source": "autotuned"},
{"m": 29, "n": 29, "k": 29, "tile_m": 5, "tile_n": 3, "threads": 64, "grouping": 4, "minblocks": 1, "algorithm": "medium", "perf": 4939.92, "source": "autotuned"},
{"m": 29, "n": 29, "k": 32, "tile_m": 5, "tile_n": 3, "threads": 64, "grouping": 4, "minblocks": 3, "algorithm": "medium", "perf": 5017.47, "source": "autotuned"},
{"m": 29, "n": 32, "k": 14, "tile_m": 3, "tile_n": 4, "threads": 96, "grouping": 5, "minblocks": 8, "algorithm": "medium", "perf": 4201.31, "source": "autotuned"},
{"m": 29, "n": 32, "k": 29, "tile_m": 3, "tile_n": 6, "w": 10, "v": 16, "threads": 64, "grouping": 16, "minblocks": 1, "algorithm": "largeDB2", "perf": 4816.39, "source": "autotuned"},
{"m": 29, "n": 32, "k": 32, "tile_m": 3, "tile_n": 6, "w": 12, "v": 18, "threads": 64, "grouping": 16, "minblocks": 1, "algorithm": "largeDB2", "perf": 4946.48, "source": "autotuned"},
{"m": 30, "n": 30, "k": 30, "tile_m": 5, "tile_n": 3, "threads": 64, "grouping": 4, "minblocks": 2, "algorithm": "medium", "perf": 5146.42, "source": "autotuned"},
{"m": 31, "n": 31, "k": 31, "tile_m": 2, "tile_n": 8, "threads": 64, "grouping": 4, "minblocks": 4, "algorithm": "medium", "perf": 5145.08, "source": "autotuned"},
{"m": 32, "n": 4, "k": 13, "tile_m": 1, "tile_n": 4, "threads": 64, "grouping": 5, "minblocks": 17, "algorithm": "medium", "perf": 1725.66, "source": "autotuned"},
{"m": 32, "n": 4, "k": 25, "tile_m": 2, "tile_n": 2, "threads": 128, "grouping": 4, "minblocks": 8, "algorithm": "medium", "perf": 1500.47, "source": "autotuned"},
{"m": 32, "n": 4, "k": 26, "tile_m": 2, "tile_n": 2, "w": 10, "v": 4, "threads": 32, "grouping": 16, "minblocks": 1, "algorithm": "largeDB2", "perf": 1522.43, "source": "autotuned"},
{"m": 32, "n": 4, "k": 28, "tile_m": 2, "tile_n": 2, "w": 10, "v": 4, "threads": 32, "grouping": 16, "minblocks": 2, "algorithm": "largeDB2", "perf": 1520.84, "source": "autotuned"},
{"m": 32, "n": 4, "k": 32, "tile_m": 1, "tile_n": 4, "w": 12, "v": 4, "threads": 32, "grouping": 16, "minblocks": 1, "algorithm": "largeDB2", "perf": 1488.84, "source": "autotuned"},
{"m": 32, "n": 5, "k": 4, "tile_m": 1, "tile_n": 5, "threads": 32, "grouping": 5, "minblocks": 21, "algorithm": "medium", "perf": 1333.75, "source": "autotuned"},
{"m": 32, "n": 5, "k": 5, "tile_m": 1, "tile_n": 5, "threads": 32, "grouping": 5, "minblocks": 7, "algorithm": "medium", "perf": 1543.69, "source": "autotuned"},
{"m": 32, "n": 5, "k": 7, "tile_m": 1, "tile_n": 5, "threads": 64, "grouping": 5, "minblocks": 18, "algorithm": "medium", "perf": 1816.61, "source": "autotuned"},
{"m": 32, "n": 5, "k": 16, "tile_m": 1, "tile_n": 5, "threads": 96, "grouping": 5, "minblocks": 10, "algorithm": "medium", "perf": 1871.93, "source": "autotuned"},
{"m": 32, "n": 5, "k": 26, "tile_m": 2, "tile_n": 3, "w": 10, "v": 4, "threads": 32, "grouping": 16, "minblocks": 1, "algorithm": "largeDB2", "perf": 1806.12, "source": "autotuned"},
{"m": 32, "n": 5, "k": 45, "tile_m": 1, "tile_n": 5, "w": 16, "v": 4, "threads": 64, "grouping": 16, "minblocks": 12, "algorithm": "largeDB2", "perf": 1688.03, "source": "autotuned"},
{"m": 32, "n": 7, "k": 4, "tile_m": 1, "tile_n": 7, "threads": 32, "grouping": 5, "minblocks": 24, "algorithm": "medium", "perf": 1717.52, "source": "autotuned"},
{"m": 32, "n": 7, "k": 7, "tile_m": 2, "tile_n": 4, "threads": 64, "grouping": 5, "minblocks": 15, "algorithm": "medium", "perf": 2272.23, "source": "autotuned"},
{"m": 32, "n": 7, "k": 9, "tile_m": 2, "tile_n": 4, "threads": 64, "grouping": 5, "minblocks": 15, "algorithm": "medium", "perf": 2439.47, "source": "autotuned"},
{"m": 32, "n": 7, "k": 13, "tile_m": 2, "tile_n": 4, "w": 6, "v": 4, "threads": 64, "grouping": 16, "minblocks": 12, "algorithm": "largeDB2", "perf": 2319.2, "source": "autotuned"},
{"m": 32, "n": 7, "k": 26, "tile_m": 1, "tile_n": 7, "w": 10, "v": 4, "threads": 64, "grouping": 16, "minblocks": 12, "algorithm": "largeDB2", "perf": 2304.52, "source": "autotuned"},
{"m": 32, "n": 7, "k": 32, "tile_m": 2, "tile_n": 4, "w": 12, "v": 6, "threads": 32, "grouping": 16, "minblocks": 8, "algorithm": "largeDB2", "perf": 2270.98, "source": "autotuned"},
{"m": 32, "n": 7, "k": 45, "tile_m": 1, "tile_n": 7, "w": 16, "v": 4, "threads": 32, "grouping": 16, "minblocks": 12, "algorithm": "largeDB2", "perf": 2173.09, "source": "autotuned"},
{"m": 32, "n": 9, "k": 7, "tile_m": 2, "tile_n": 5, "threads": 64, "grouping": 5, "minblocks": 15, "algorithm": "medium", "perf": 2681.69, "source": "autotuned"},
{"m": 32, "n": 9, "k": 12, "tile_m": 2, "tile_n": 5, "threads": 32, "grouping": 5, "minblocks": 13, "algorithm": "medium", "perf": 2634.97, "source": "autotuned"},
{"m": 32, "n": 9, "k": 13, "tile_m": 2, "tile_n": 5, "w": 6, "v": 4, "threads": 64, "grouping": 16, "minblocks": 12, "algorithm": "largeDB2", "perf": 2700.84, "source": "autotuned"},
{"m": 32, "n": 9, "k": 25, "tile_m": 1, "tile_n": 9, "w": 12, "v": 6, "threads": 64, "grouping": 16, "minblocks": 12, "algorithm": "largeDB2", "perf": 2744.76, "source": "autotuned"},
{"m": 32, "n": 9, "k": 26, "tile_m": 1, "tile_n": 9, "w": 10, "v": 6, "threads": 64, "grouping": 16, "minblocks": 12, "algorithm": "largeDB2", "perf": 2743.04, "source": "autotuned"},
{"m": 32, "n": 9, "k": 32, "tile_m": 1, "tile_n": 9, "w": 12, "v": 6, "threads": 64, "grouping": 16, "minblocks": 12, "algorithm": "largeDB2", "perf": 2726.4, "source": "autotuned"},
{"m": 32, "n": 9, "k": 45, "tile_m": 2, "tile_n": 5, "w": 16, "v": 4, "threads": 32, "grouping": 16, "minblocks": 1, "algorithm": "largeDB2", "perf": 2596.97, "source": "autotuned"},
{"m": 32, "n": 10, "k": 9, "tile_m": 2, "tile_n": 5, "threads": 32, "grouping": 4, "minblocks": 20, "algorithm": "medium", "perf": 2927.74, "source": "autotuned"},
{"m": 32, "n": 10, "k": 10, "tile_m": 2, "tile_n": 5, "threads": 32, "grouping": 4, "minblocks": 17, "algorithm": "medium", "perf": 2942.1, "source": "autotuned"},
{"m": 32, "n": 10, "k": 32, "tile_m": 2, "tile_n": 5, "w": 12, "v": 10, "threads": 32, "grouping": 16, "minblocks": 2, "algorithm": "largeDB2", "perf": 2927.74, "source": "autotuned"},
{"m": 32, "n": 11, "k": 11, "tile_m": 2, "tile_n": 3, "w": 4, "v": 10, "threads": 64, "grouping": 16, "minblocks": 8, "algorithm": "largeDB2", "perf": 2976.34, "source": "autotuned"},
{"m": 32, "n": 11, "k": 12, "tile_m": 2, "tile_n": 3, "w": 4, "v": 10, "threads": 64, "grouping": 16, "minblocks": 2, "algorithm": "largeDB2", "perf": 3070.73, "source": "autotuned"},
{"m": 32, "n": 11, "k": 20, "tile_m": 2, "tile_n": 6, "w": 8, "v": 8, "threads": 32, "grouping": 16, "minblocks": 2, "algorithm": "largeDB2", "perf": 3158.88, "source": "autotuned"},
{"m": 32, "n": 11, "k": 32, "tile_m": 2, "tile_n": 6, "w": 12, "v": 10, "threads": 32, "grouping": 16, "minblocks": 1, "algorithm": "largeDB2", "perf": 3052.98, "source": "autotuned"},
{"m": 32, "n": 12, "k": 11, "tile_m": 2, "tile_n": 3, "w": 4, "v": 12, "threads": 64, "grouping": 16, "minblocks": 1, "algorithm": "largeDB2", "perf": 3194.55, "source": "autotuned"},
{"m": 32, "n": 12, "k": 20, "tile_m": 2, "tile_n": 6, "w": 8, "v": 8, "threads": 32, "grouping": 16, "minblocks": 4, "algorithm": "largeDB2", "perf": 3397.29, "source": "autotuned"},
{"m": 32, "n": 12, "k": 26, "tile_m": 2, "tile_n": 6, "w": 10, "v": 10, "threads": 32, "grouping": 16, "minblocks": 8, "algorithm": "largeDB2", "perf": 3308.45, "source": "autotuned"},
{"m": 32, "n": 12, "k": 32, "tile_m": 2, "tile_n": 6, "w": 8, "v": 12, "threads": 32, "grouping": 16, "minblocks": 4, "algorithm": "largeDB2", "perf": 3255.25, "source": "autotuned"},
{"m": 32, "n": 13, "k": 7, "tile_m": 2, "tile_n": 7, "threads": 32, "grouping": 4, "minblocks": 18, "algorithm": "medium", "perf": 3059.78, "source": "autotuned"},
{"m": 32, "n": 13, "k": 9, "tile_m": 2, "tile_n": 7, "threads": 32, "grouping": 4, "minblocks": 17, "algorithm": "medium", "perf": 3251.02, "source": "autotuned"},
{"m": 32, "n": 13, "k": 13, "tile_m": 2, "tile_n": 4, "w": 6, "v": 12, "threads": 96, "grouping": 16, "minblocks": 12, "algorithm": "largeDB2", "perf": 3189.68, "source": "autotuned"},
{"m": 32, "n": 13, "k": 16, "tile_m": 2, "tile_n": 4, "w": 6, "v": 10, "threads": 64, "grouping": 16, "minblocks": 12, "algorithm": "largeDB2", "perf": 3268.04, "source": "autotuned"},
{"m": 32, "n": 13, "k": 28, "tile_m": 2, "tile_n": 7, "w": 10, "v": 10, "threads": 32, "grouping": 16, "minblocks": 12, "algorithm": "largeDB2", "perf": 3424.27, "source": "autotuned"},
{"m": 32, "n": 14, "k": 13, "tile_m": 2, "tile_n": 7, "threads": 32, "grouping": 5, "minblocks": 13, "algorithm": "medium", "perf": 3371.42, "source": "autotuned"},
{"m": 32, "n": 16, "k": 5, "tile_m": 2, "tile_n": 4, "threads": 192, "grouping": 29, "minblocks": 6, "algorithm": "medium", "perf": 3048.57, "source": "autotuned"},
{"m": 32, "n": 16, "k": 12, "tile_m": 2, "tile_n": 4, "w": 4, "v": 8, "threads": 64, "grouping": 16, "minblocks": 8, "algorithm": "largeDB2", "perf": 4001.25, "source": "autotuned"},
{"m": 32, "n": 16, "k": 13, "tile_m": 2, "tile_n": 4, "w": 6, "v": 16, "threads": 96, "grouping": 16, "minblocks": 12, "algorithm": "largeDB2", "perf": 3806.07, "source": "autotuned"},
{"m": 32, "n": 20, "k": 11, "tile_m": 2, "tile_n": 4, "w": 4, "v": 6, "threads": 96, "grouping": 16, "minblocks": 12, "algorithm": "largeDB2", "perf": 3772.61, "source": "autotuned"},
{"m": 32, "n": 20, "k": 20, "tile_m": 2, "tile_n": 5, "w": 8, "v": 18, "threads": 64, "grouping": 16, "minblocks": 12, "algorithm": "largeDB2", "perf": 4241.61, "source": "autotuned"},
{"m": 32, "n": 22, "k": 9, "tile_m": 2, "tile_n": 4, "w": 4, "v": 14, "threads": 96, "grouping": 16, "minblocks": 12, "algorithm": "largeDB2", "perf": 3784.62, "source": "autotuned"},
{"m": 32, "n": 24, "k": 5, "tile_m": 1, "tile_n": 12, "threads": 192, "grouping": 26, "minblocks": 6, "algorithm": "medium", "perf": 3637.5, "source": "autotuned"},
{"m": 32, "n": 24, "k": 13, "tile_m": 2, "tile_n": 4, "w": 6, "v": 14, "threads": 96, "grouping": 16, "minblocks": 12, "algorithm": "largeDB2", "perf": 4479.87, "source": "autotuned"},
{"m": 32, "n": 24, "k": 24, "tile_m": 4, "tile_n": 6, "w": 8, "v": 24, "threads": 32, "grouping": 16, "minblocks": 1, "algorithm": "largeDB2", "perf": 4646.61, "source": "autotuned"},
{"m": 32, "n": 24, "k": 26, "tile_m": 4, "tile_n": 6, "w": 8, "v": 20, "threads": 32, "grouping": 16, "minblocks": 2, "algorithm": "largeDB2", "perf": 4556.17, "source": "autotuned"},
{"m": 32, "n": 24, "k": 32, "tile_m": 2, "tile_n": 4, "w": 8, "v": 16, "threads": 96, "grouping": 16, "minblocks": 12, "algorithm": "largeDB2", "perf": 4684.39, "source": "autotuned"},
{"m": 32, "n": 25, "k": 5, "tile_m": 2, "tile_n": 7, "threads": 192, "grouping": 32, "minblocks": 5, "algorithm": "medium", "perf": 3319.62, "source": "autotuned"},
{"m": 32, "n": 25, "k": 7, "tile_m": 2, "tile_n": 4, "threads": 256, "grouping": 32, "minblocks": 5, "algorithm": "medium", "perf": 3572.54, "source": "autotuned"},
{"m": 32, "n": 25, "k": 11, "tile_m": 2, "tile_n": 7, "threads": 64, "grouping": 4, "minblocks": 9, "algorithm": "medium", "perf": 3768.3, "source": "autotuned"},
{"m": 32, "n": 25, "k": 13, "tile_m": 6, "tile_n": 5, "w": 6, "v": 12, "threads": 32, "grouping": 16, "minblocks": 8, "algorithm": "largeDB2", "perf": 3901.22, "source": "autotuned"},
{"m": 32, "n": 25, "k": 26, "tile_m": 2, "tile_n": 7, "w": 10, "v": 16, "threads": 64, "grouping": 16, "minblocks": 1, "algorithm": "largeDB2", "perf": 4578.9, "source": "autotuned"},
{"m": 32, "n": 25, "k": 32, "tile_m": 2, "tile_n": 7, "w": 12, "v": 8, "threads": 64, "grouping": 16, "minblocks": 1, "algorithm": "largeDB2", "perf": 4688.96, "source": "autotuned"},
{"m": 32, "n": 25, "k": 45, "tile_m": 2, "tile_n": 7, "w": 16, "v": 20, "threads": 64, "grouping": 16, "minblocks": 4, "algorithm": "largeDB2", "perf": 4669.51, "source": "autotuned"},
{"m": 32, "n": 26, "k": 5, "tile_m": 2, "tile_n": 4, "threads": 192, "grouping": 32, "minblocks": 5, "algorithm": "medium", "perf": 3452.41, "source": "autotuned"},
{"m": 32, "n": 26, "k": 7, "tile_m": 2, "tile_n": 4, "threads": 256, "grouping": 32, "minblocks": 5, "algorithm": "medium", "perf": 3715.45, "source": "autotuned"},
{"m": 32, "n": 26, "k": 9, "tile_m": 1, "tile_n": 7, "threads": 320, "grouping": 26, "minblocks": 4, "algorithm": "medium", "perf": 3715.45, "source": "autotuned"},
{"m": 32, "n": 26, "k": 12, "tile_m": 2, "tile_n": 7, "threads": 64, "grouping": 4, "minblocks": 9, "algorithm": "medium", "perf": 4070.84, "source": "autotuned"},
{"m": 32, "n": 26, "k": 24, "tile_m": 2, "tile_n": 7, "w": 8, "v": 18, "threads": 64, "grouping": 16, "minblocks": 2, "algorithm": "largeDB2", "perf": 4669.79, "source": "autotuned"},
{"m": 32, "n": 26, "k": 28, "tile_m": 2, "tile_n": 7, "w": 10, "v": 24, "threads": 64, "grouping": 16, "minblocks": 4, "algorithm": "largeDB2", "perf": 4739.01, "source": "autotuned"},
{"m": 32, "n": 26, "k": 32, "tile_m": 2, "tile_n": 7, "w": 12, "v": 8, "threads": 64, "grouping": 16, "minblocks": 4, "algorithm": "largeDB2", "perf": 4801.5, "source": "autotuned"},
{"m": 32, "n": 26, "k": 45, "tile_m": 2, "tile_n": 7, "w": 16, "v": 16, "threads": 64, "grouping": 16, "minblocks": 4, "algorithm": "largeDB2", "perf": 4790.04, "source": "autotuned"},
{"m": 32, "n": 28, "k": 4, "tile_m": 2, "tile_n": 4, "threads": 160, "grouping": 32, "minblocks": 6, "algorithm": "medium", "perf": 3537.95, "source": "autotuned"},
{"m": 32, "n": 28, "k": 13, "tile_m": 2, "tile_n": 5, "threads": 96, "grouping": 5, "minblocks": 7, "algorithm": "medium", "perf": 4091.17, "source": "autotuned"},
{"m": 32, "n": 28, "k": 25, "tile_m": 2, "tile_n": 7, "w": 10, "v": 14, "threads": 64, "grouping": 16, "minblocks": 4, "algorithm": "largeDB2", "perf": 4818.02, "source": "autotuned"},
{"m": 32, "n": 28, "k": 26, "tile_m": 2, "tile_n": 7, "w": 10, "v": 24, "threads": 64, "grouping": 16, "minblocks": 1, "algorithm": "largeDB2", "perf": 4898.39, "source": "autotuned"},
{"m": 32, "n": 28, "k": 28, "tile_m": 2, "tile_n": 7, "w": 12, "v": 14, "threads": 64, "grouping": 16, "minblocks": 2, "algorithm": "largeDB2", "perf": 4953.13, "source": "autotuned"},
{"m": 32, "n": 28, "k": 32, "tile_m": 2, "tile_n": 7, "w": 12, "v": 16, "threads": 64, "grouping": 16, "minblocks": 4, "algorithm": "largeDB2", "perf": 4979.33, "source": "autotuned"},
{"m": 32, "n": 28, "k": 45, "tile_m": 2, "tile_n": 7, "w": 18, "v": 28, "threads": 64, "grouping": 16, "minblocks": 1, "algorithm": "largeDB2", "perf": 4968.7, "source": "autotuned"},
{"m": 32, "n": 29, "k": 29, "tile_m": 2, "tile_n": 8, "w": 10, "v": 26, "threads": 64, "grouping": 16, "minblocks": 4, "algorithm": "largeDB2", "perf": 4977.89, "source": "autotuned"},
{"m": 32, "n": 32, "k": 4, "tile_m": 2, "tile_n": 4, "threads": 160, "grouping": 32, "minblocks": 7, "algorithm": "medium", "perf": 3960.0, "source": "autotuned"},
{"m": 32, "n": 32, "k": 7, "tile_m": 2, "tile_n": 4, "threads": 256, "grouping": 32, "minblocks": 5, "algorithm": "medium", "perf": 4451.72, "source": "autotuned"},
{"m": 32, "n": 32, "k": 10, "tile_m": 2, "tile_n": 8, "threads": 64, "grouping": 5, "minblocks": 2, "algorithm": "medium", "perf": 4825.63, "source": "autotuned"},
{"m": 32, "n": 32, "k": 11, "tile_m": 2, "tile_n": 8, "threads": 64, "grouping": 5, "minblocks": 6, "algorithm": "medium", "perf": 4823.42, "source": "autotuned"},
{"m": 32, "n": 32, "k": 16, "tile_m": 2, "tile_n": 8, "threads": 64, "grouping": 4, "minblocks": 5, "algorithm": "medium", "perf": 5546.86, "source": "autotuned"},
{"m": 32, "n": 32, "k": 22, "tile_m": 2, "tile_n": 8, "threads": 64, "grouping": 4, "minblocks": 1, "algorithm": "medium", "perf": 5487.43, "source": "autotuned"},
{"m": 32, "n": 32, "k": 24, "tile_m": 2, "tile_n": 8, "threads": 64, "grouping": 4, "minblocks": 2, "algorithm": "medium", "perf": 5500.53, "source": "autotuned"},
{"m": 32, "n": 32, "k": 25, "tile_m": 2, "tile_n": 8, "threads": 64, "grouping": 4, "minblocks": 3, "algorithm": "medium", "perf": 5456.25, "source": "autotuned"},
{"m": 32, "n": 32, "k": 26, "tile_m": 2, "tile_n": 8, "threads": 64, "grouping": 4, "minblocks": 3, "algorithm": "medium", "perf": 5487.43, "source": "autotuned"},
{"m": 32, "n": 32, "k": 29, "tile_m": 2, "tile_n": 8, "threads": 64, "grouping": 4, "minblocks": 3, "algorithm": "medium", "perf": 5471.26, "source": "autotuned"},
{"m": 32, "n": 32, "k": 32, "tile_m": 2, "tile_n": 4, "threads": 128, "grouping": 5, "minblocks": 1, "algorithm": "medium", "perf": 5526.91, "source": "autotuned"},
{"m": 32, "n": 32, "k": 45, "tile_m": 2, "tile_n": 4, "threads": 128, "grouping": 4, "minblocks": 1, "algorithm": "medium", "perf": 5477.0, "source": "autotuned"},
{"m": 32, "n": 45, "k": 5, "tile_m": 2, "tile_n": 6, "threads": 256, "grouping": 24, "minblocks": 4, "algorithm": "medium", "perf": 4167.97, "source": "autotuned"},
{"m": 32, "n": 45, "k": 7, "tile_m": 2, "tile_n": 6, "threads": 320, "grouping": 32, "minblocks": 3, "algorithm": "medium", "perf": 4480.07, "source": "autotuned"},
{"m": 32, "n": 45, "k": 9, "tile_m": 2, "tile_n": 3, "threads": 416, "grouping": 32, "minblocks": 3, "algorithm": "medium", "perf": 4294.63, "source": "autotuned"},
{"m": 32, "n": 45, "k": 28, "tile_m": 4, "tile_n": 6, "w": 10, "v": 18, "threads": 64, "grouping": 16, "minblocks": 4, "algorithm": "largeDB2", "perf": 5737.76, "source": "autotuned"},
{"m": 45, "n": 45, "k": 45, "tile_m": 6, "tile_n": 6, "w": 8, "v": 44, "threads": 64, "grouping": 16, "minblocks": 4, "algorithm": "largeDB2", "perf": 6255.96, "source": "autotuned"},
{"m": 55, "n": 55, "k": 32, "tile_m": 5, "tile_n": 5, "w": 8, "v": 20, "threads": 128, "grouping": 16, "minblocks": 2, "algorithm": "largeDB2", "perf": 6699.51, "source": "autotuned"},
{"m": 64, "n": 64, "k": 64, "tile_m": 4, "tile_n": 8, "w": 8, "v": 30, "threads": 128, "grouping": 16, "minblocks": 2, "algorithm": "largeDB2", "perf": 7713.74, "source": "autotuned"},
{"m": 72, "n": 72, "k": 72, "tile_m": 11, "tile_n": 4, "w": 4, "v": 26, "threads": 128, "grouping": 16, "minblocks": 2, "algorithm": "largeDB2", "perf": 6870.06, "source": "autotuned"}
]