src/acc/libsmm_acc/parameters/parameters_Mi100.json
[
{"m": 3, "n": 3, "k": 3, "tile_m": 1, "tile_n": 1, "threads": 64, "grouping": 6, "minblocks": 2, "algorithm": "medium", "perf": 78.5689, "source": "autotuned"},
{"m": 3, "n": 3, "k": 4, "tile_m": 1, "tile_n": 1, "threads": 64, "grouping": 9, "minblocks": 12, "algorithm": "medium", "perf": 107.279, "source": "autotuned"},
{"m": 3, "n": 3, "k": 5, "tile_m": 1, "tile_n": 1, "threads": 64, "grouping": 16, "minblocks": 17, "algorithm": "medium", "perf": 100.095, "source": "autotuned"},
{"m": 3, "n": 3, "k": 6, "tile_m": 1, "tile_n": 1, "threads": 64, "grouping": 9, "minblocks": 25, "algorithm": "medium", "perf": 129.566, "source": "autotuned"},
{"m": 3, "n": 3, "k": 7, "tile_m": 1, "tile_n": 1, "threads": 64, "grouping": 9, "minblocks": 3, "algorithm": "medium", "perf": 143.375, "source": "autotuned"},
{"m": 3, "n": 3, "k": 8, "tile_m": 1, "tile_n": 1, "threads": 64, "grouping": 9, "minblocks": 21, "algorithm": "medium", "perf": 171.506, "source": "autotuned"},
{"m": 3, "n": 3, "k": 9, "tile_m": 1, "tile_n": 1, "threads": 64, "grouping": 12, "minblocks": 17, "algorithm": "medium", "perf": 151.772, "source": "autotuned"},
{"m": 3, "n": 3, "k": 10, "tile_m": 1, "tile_n": 1, "threads": 64, "grouping": 12, "minblocks": 13, "algorithm": "medium", "perf": 189.693, "source": "autotuned"},
{"m": 3, "n": 3, "k": 11, "tile_m": 1, "tile_n": 1, "threads": 64, "grouping": 12, "minblocks": 14, "algorithm": "medium", "perf": 190.111, "source": "autotuned"},
{"m": 3, "n": 3, "k": 12, "tile_m": 1, "tile_n": 1, "threads": 64, "grouping": 7, "minblocks": 9, "algorithm": "small", "perf": 203.871, "source": "autotuned"},
{"m": 3, "n": 3, "k": 16, "tile_m": 1, "tile_n": 1, "threads": 64, "grouping": 10, "minblocks": 9, "algorithm": "small", "perf": 220.995, "source": "autotuned"},
{"m": 3, "n": 3, "k": 23, "tile_m": 1, "tile_n": 1, "threads": 64, "grouping": 9, "minblocks": 13, "algorithm": "medium", "perf": 232.418, "source": "autotuned"},
{"m": 3, "n": 4, "k": 3, "tile_m": 1, "tile_n": 1, "threads": 64, "grouping": 8, "minblocks": 4, "algorithm": "medium", "perf": 84.0854, "source": "autotuned"},
{"m": 3, "n": 4, "k": 4, "tile_m": 1, "tile_n": 1, "threads": 64, "grouping": 7, "minblocks": 13, "algorithm": "medium", "perf": 126.304, "source": "autotuned"},
{"m": 3, "n": 5, "k": 3, "tile_m": 1, "tile_n": 1, "threads": 64, "grouping": 11, "minblocks": 5, "algorithm": "medium", "perf": 111.924, "source": "autotuned"},
{"m": 3, "n": 5, "k": 5, "tile_m": 1, "tile_n": 1, "threads": 64, "grouping": 9, "minblocks": 6, "algorithm": "medium", "perf": 158.699, "source": "autotuned"},
{"m": 3, "n": 6, "k": 3, "tile_m": 1, "tile_n": 1, "threads": 64, "grouping": 7, "minblocks": 15, "algorithm": "medium", "perf": 150.192, "source": "autotuned"},
{"m": 3, "n": 6, "k": 6, "tile_m": 1, "tile_n": 1, "threads": 64, "grouping": 7, "minblocks": 18, "algorithm": "medium", "perf": 268.451, "source": "autotuned"},
{"m": 3, "n": 7, "k": 3, "tile_m": 1, "tile_n": 1, "threads": 64, "grouping": 11, "minblocks": 7, "algorithm": "small", "perf": 145.6, "source": "autotuned"},
{"m": 3, "n": 7, "k": 7, "tile_m": 1, "tile_n": 1, "threads": 64, "grouping": 9, "minblocks": 18, "algorithm": "medium", "perf": 325.535, "source": "autotuned"},
{"m": 3, "n": 8, "k": 3, "tile_m": 1, "tile_n": 1, "threads": 64, "grouping": 7, "minblocks": 26, "algorithm": "medium", "perf": 200.804, "source": "autotuned"},
{"m": 3, "n": 8, "k": 8, "tile_m": 1, "tile_n": 1, "threads": 64, "grouping": 7, "minblocks": 14, "algorithm": "medium", "perf": 449.789, "source": "autotuned"},
{"m": 3, "n": 9, "k": 3, "tile_m": 1, "tile_n": 1, "threads": 64, "grouping": 7, "minblocks": 23, "algorithm": "medium", "perf": 222.621, "source": "autotuned"},
{"m": 3, "n": 9, "k": 9, "tile_m": 1, "tile_n": 1, "threads": 64, "grouping": 6, "minblocks": 23, "algorithm": "medium", "perf": 451.863, "source": "autotuned"},
{"m": 3, "n": 10, "k": 3, "tile_m": 1, "tile_n": 1, "threads": 64, "grouping": 7, "minblocks": 16, "algorithm": "small", "perf": 238.256, "source": "autotuned"},
{"m": 3, "n": 10, "k": 10, "tile_m": 1, "tile_n": 1, "threads": 64, "grouping": 9, "minblocks": 19, "algorithm": "medium", "perf": 575.889, "source": "autotuned"},
{"m": 3, "n": 11, "k": 3, "tile_m": 2, "tile_n": 1, "threads": 64, "grouping": 14, "minblocks": 11, "algorithm": "medium", "perf": 207.878, "source": "autotuned"},
{"m": 3, "n": 11, "k": 11, "tile_m": 1, "tile_n": 1, "threads": 64, "grouping": 9, "minblocks": 8, "algorithm": "medium", "perf": 644.357, "source": "autotuned"},
{"m": 3, "n": 12, "k": 3, "tile_m": 1, "tile_n": 1, "threads": 64, "grouping": 5, "minblocks": 24, "algorithm": "medium", "perf": 280.101, "source": "autotuned"},
{"m": 3, "n": 12, "k": 12, "tile_m": 1, "tile_n": 1, "threads": 64, "grouping": 9, "minblocks": 14, "algorithm": "medium", "perf": 712.171, "source": "autotuned"},
{"m": 3, "n": 16, "k": 3, "tile_m": 1, "tile_n": 1, "threads": 64, "grouping": 7, "minblocks": 5, "algorithm": "small", "perf": 369.512, "source": "autotuned"},
{"m": 3, "n": 16, "k": 16, "tile_m": 1, "tile_n": 1, "threads": 64, "grouping": 19, "minblocks": 18, "algorithm": "medium", "perf": 731.657, "source": "autotuned"},
{"m": 3, "n": 23, "k": 3, "tile_m": 2, "tile_n": 1, "threads": 128, "grouping": 9, "minblocks": 11, "algorithm": "medium", "perf": 465.75, "source": "autotuned"},
{"m": 3, "n": 23, "k": 23, "tile_m": 1, "tile_n": 1, "threads": 128, "grouping": 3, "minblocks": 4, "algorithm": "medium", "perf": 662.442, "source": "autotuned"},
{"m": 4, "n": 3, "k": 3, "tile_m": 1, "tile_n": 1, "threads": 64, "grouping": 7, "minblocks": 2, "algorithm": "medium", "perf": 100.224, "source": "autotuned"},
{"m": 4, "n": 3, "k": 4, "tile_m": 1, "tile_n": 1, "threads": 64, "grouping": 7, "minblocks": 24, "algorithm": "medium", "perf": 130.564, "source": "autotuned"},
{"m": 4, "n": 4, "k": 3, "tile_m": 1, "tile_n": 1, "threads": 64, "grouping": 10, "minblocks": 7, "algorithm": "small", "perf": 132.652, "source": "autotuned"},
{"m": 4, "n": 4, "k": 4, "tile_m": 1, "tile_n": 1, "threads": 64, "grouping": 17, "minblocks": 13, "algorithm": "medium", "perf": 69.425, "source": "autotuned"},
{"m": 4, "n": 4, "k": 5, "tile_m": 1, "tile_n": 1, "threads": 64, "grouping": 9, "minblocks": 12, "algorithm": "medium", "perf": 179.709, "source": "autotuned"},
{"m": 4, "n": 4, "k": 6, "tile_m": 1, "tile_n": 1, "threads": 64, "grouping": 9, "minblocks": 10, "algorithm": "small", "perf": 211.43, "source": "autotuned"},
{"m": 4, "n": 4, "k": 7, "tile_m": 1, "tile_n": 1, "threads": 64, "grouping": 9, "minblocks": 2, "algorithm": "medium", "perf": 285.949, "source": "autotuned"},
{"m": 4, "n": 4, "k": 8, "tile_m": 1, "tile_n": 1, "threads": 64, "grouping": 9, "minblocks": 13, "algorithm": "small", "perf": 294.24, "source": "autotuned"},
{"m": 4, "n": 4, "k": 9, "tile_m": 1, "tile_n": 1, "threads": 64, "grouping": 13, "minblocks": 8, "algorithm": "medium", "perf": 294.459, "source": "autotuned"},
{"m": 4, "n": 4, "k": 10, "tile_m": 1, "tile_n": 1, "threads": 64, "grouping": 10, "minblocks": 2, "algorithm": "medium", "perf": 332.859, "source": "autotuned"},
{"m": 4, "n": 4, "k": 11, "tile_m": 1, "tile_n": 1, "threads": 64, "grouping": 10, "minblocks": 13, "algorithm": "medium", "perf": 326.923, "source": "autotuned"},
{"m": 4, "n": 4, "k": 12, "tile_m": 1, "tile_n": 1, "threads": 64, "grouping": 7, "minblocks": 7, "algorithm": "small", "perf": 365.723, "source": "autotuned"},
{"m": 4, "n": 4, "k": 16, "tile_m": 1, "tile_n": 1, "threads": 64, "grouping": 4, "minblocks": 8, "algorithm": "medium", "perf": 421.675, "source": "autotuned"},
{"m": 4, "n": 4, "k": 23, "tile_m": 1, "tile_n": 1, "threads": 64, "grouping": 5, "minblocks": 17, "algorithm": "medium", "perf": 437.68, "source": "autotuned"},
{"m": 4, "n": 5, "k": 4, "tile_m": 1, "tile_n": 1, "threads": 64, "grouping": 7, "minblocks": 25, "algorithm": "medium", "perf": 215.779, "source": "autotuned"},
{"m": 4, "n": 5, "k": 5, "tile_m": 1, "tile_n": 1, "threads": 64, "grouping": 2, "minblocks": 2, "algorithm": "small", "perf": 163.825, "source": "autotuned"},
{"m": 4, "n": 6, "k": 4, "tile_m": 1, "tile_n": 1, "threads": 64, "grouping": 7, "minblocks": 13, "algorithm": "small", "perf": 248.436, "source": "autotuned"},
{"m": 4, "n": 6, "k": 6, "tile_m": 1, "tile_n": 1, "threads": 64, "grouping": 7, "minblocks": 27, "algorithm": "medium", "perf": 351.031, "source": "autotuned"},
{"m": 4, "n": 7, "k": 4, "tile_m": 1, "tile_n": 1, "threads": 64, "grouping": 6, "minblocks": 17, "algorithm": "medium", "perf": 283.86, "source": "autotuned"},
{"m": 4, "n": 7, "k": 7, "tile_m": 1, "tile_n": 1, "threads": 64, "grouping": 3, "minblocks": 13, "algorithm": "medium", "perf": 376.295, "source": "autotuned"},
{"m": 4, "n": 8, "k": 4, "tile_m": 1, "tile_n": 1, "threads": 64, "grouping": 5, "minblocks": 26, "algorithm": "medium", "perf": 329.527, "source": "autotuned"},
{"m": 4, "n": 8, "k": 8, "tile_m": 1, "tile_n": 1, "threads": 64, "grouping": 9, "minblocks": 24, "algorithm": "medium", "perf": 604.468, "source": "autotuned"},
{"m": 4, "n": 9, "k": 4, "tile_m": 1, "tile_n": 1, "threads": 64, "grouping": 7, "minblocks": 5, "algorithm": "small", "perf": 367.756, "source": "autotuned"},
{"m": 4, "n": 9, "k": 9, "tile_m": 1, "tile_n": 1, "threads": 64, "grouping": 5, "minblocks": 22, "algorithm": "medium", "perf": 641.619, "source": "autotuned"},
{"m": 4, "n": 10, "k": 4, "tile_m": 1, "tile_n": 1, "threads": 64, "grouping": 7, "minblocks": 21, "algorithm": "medium", "perf": 422.754, "source": "autotuned"},
{"m": 4, "n": 10, "k": 10, "tile_m": 1, "tile_n": 1, "threads": 64, "grouping": 7, "minblocks": 14, "algorithm": "medium", "perf": 757.028, "source": "autotuned"},
{"m": 4, "n": 11, "k": 4, "tile_m": 1, "tile_n": 1, "threads": 64, "grouping": 7, "minblocks": 11, "algorithm": "medium", "perf": 457.62, "source": "autotuned"},
{"m": 4, "n": 11, "k": 11, "tile_m": 1, "tile_n": 1, "threads": 64, "grouping": 10, "minblocks": 5, "algorithm": "medium", "perf": 827.607, "source": "autotuned"},
{"m": 4, "n": 12, "k": 4, "tile_m": 1, "tile_n": 1, "threads": 64, "grouping": 5, "minblocks": 4, "algorithm": "medium", "perf": 468.703, "source": "autotuned"},
{"m": 4, "n": 12, "k": 12, "tile_m": 1, "tile_n": 1, "threads": 64, "grouping": 9, "minblocks": 15, "algorithm": "medium", "perf": 907.032, "source": "autotuned"},
{"m": 4, "n": 16, "k": 4, "tile_m": 1, "tile_n": 1, "threads": 64, "grouping": 10, "minblocks": 14, "algorithm": "medium", "perf": 701.789, "source": "autotuned"},
{"m": 4, "n": 16, "k": 16, "tile_m": 1, "tile_n": 1, "threads": 64, "grouping": 23, "minblocks": 6, "algorithm": "medium", "perf": 905.478, "source": "autotuned"},
{"m": 4, "n": 23, "k": 4, "tile_m": 2, "tile_n": 1, "threads": 64, "grouping": 8, "minblocks": 7, "algorithm": "medium", "perf": 727.631, "source": "autotuned"},
{"m": 4, "n": 23, "k": 23, "tile_m": 1, "tile_n": 1, "threads": 256, "grouping": 27, "minblocks": 6, "algorithm": "medium", "perf": 839.61, "source": "autotuned"},
{"m": 5, "n": 3, "k": 3, "tile_m": 1, "tile_n": 1, "threads": 64, "grouping": 7, "minblocks": 5, "algorithm": "medium", "perf": 125.923, "source": "autotuned"},
{"m": 5, "n": 3, "k": 5, "tile_m": 1, "tile_n": 1, "threads": 64, "grouping": 9, "minblocks": 10, "algorithm": "medium", "perf": 172.039, "source": "autotuned"},
{"m": 5, "n": 4, "k": 4, "tile_m": 1, "tile_n": 1, "threads": 64, "grouping": 7, "minblocks": 12, "algorithm": "medium", "perf": 216.547, "source": "autotuned"},
{"m": 5, "n": 4, "k": 5, "tile_m": 1, "tile_n": 1, "threads": 64, "grouping": 15, "minblocks": 17, "algorithm": "medium", "perf": 196.433, "source": "autotuned"},
{"m": 5, "n": 5, "k": 3, "tile_m": 1, "tile_n": 1, "threads": 64, "grouping": 5, "minblocks": 22, "algorithm": "medium", "perf": 218.203, "source": "autotuned"},
{"m": 5, "n": 5, "k": 4, "tile_m": 1, "tile_n": 1, "threads": 64, "grouping": 7, "minblocks": 12, "algorithm": "medium", "perf": 296.794, "source": "autotuned"},
{"m": 5, "n": 5, "k": 5, "tile_m": 1, "tile_n": 1, "threads": 64, "grouping": 7, "minblocks": 5, "algorithm": "small", "perf": 330.311, "source": "autotuned"},
{"m": 5, "n": 5, "k": 6, "tile_m": 1, "tile_n": 1, "threads": 64, "grouping": 5, "minblocks": 11, "algorithm": "small", "perf": 372.481, "source": "autotuned"},
{"m": 5, "n": 5, "k": 7, "tile_m": 1, "tile_n": 1, "threads": 64, "grouping": 9, "minblocks": 17, "algorithm": "medium", "perf": 436.714, "source": "autotuned"},
{"m": 5, "n": 5, "k": 8, "tile_m": 1, "tile_n": 1, "threads": 64, "grouping": 7, "minblocks": 26, "algorithm": "medium", "perf": 475.7, "source": "autotuned"},
{"m": 5, "n": 5, "k": 9, "tile_m": 1, "tile_n": 1, "threads": 64, "grouping": 12, "minblocks": 15, "algorithm": "medium", "perf": 457.207, "source": "autotuned"},
{"m": 5, "n": 5, "k": 10, "tile_m": 1, "tile_n": 1, "threads": 64, "grouping": 5, "minblocks": 10, "algorithm": "small", "perf": 499.856, "source": "autotuned"},
{"m": 5, "n": 5, "k": 11, "tile_m": 1, "tile_n": 1, "threads": 64, "grouping": 9, "minblocks": 19, "algorithm": "medium", "perf": 552.752, "source": "autotuned"},
{"m": 5, "n": 5, "k": 12, "tile_m": 1, "tile_n": 1, "threads": 64, "grouping": 9, "minblocks": 21, "algorithm": "medium", "perf": 572.939, "source": "autotuned"},
{"m": 5, "n": 5, "k": 16, "tile_m": 1, "tile_n": 1, "threads": 64, "grouping": 9, "minblocks": 24, "algorithm": "medium", "perf": 592.354, "source": "autotuned"},
{"m": 5, "n": 5, "k": 23, "tile_m": 1, "tile_n": 1, "threads": 64, "grouping": 12, "minblocks": 22, "algorithm": "medium", "perf": 627.143, "source": "autotuned"},
{"m": 5, "n": 6, "k": 5, "tile_m": 1, "tile_n": 1, "threads": 64, "grouping": 6, "minblocks": 4, "algorithm": "small", "perf": 362.348, "source": "autotuned"},
{"m": 5, "n": 6, "k": 6, "tile_m": 1, "tile_n": 1, "threads": 64, "grouping": 6, "minblocks": 27, "algorithm": "medium", "perf": 422.653, "source": "autotuned"},
{"m": 5, "n": 7, "k": 5, "tile_m": 1, "tile_n": 1, "threads": 64, "grouping": 5, "minblocks": 4, "algorithm": "medium", "perf": 408.442, "source": "autotuned"},
{"m": 5, "n": 7, "k": 7, "tile_m": 1, "tile_n": 1, "threads": 64, "grouping": 8, "minblocks": 23, "algorithm": "medium", "perf": 515.846, "source": "autotuned"},
{"m": 5, "n": 8, "k": 5, "tile_m": 1, "tile_n": 1, "threads": 64, "grouping": 9, "minblocks": 21, "algorithm": "medium", "perf": 474.608, "source": "autotuned"},
{"m": 5, "n": 8, "k": 8, "tile_m": 1, "tile_n": 1, "threads": 64, "grouping": 10, "minblocks": 5, "algorithm": "medium", "perf": 715.408, "source": "autotuned"},
{"m": 5, "n": 9, "k": 5, "tile_m": 1, "tile_n": 1, "threads": 64, "grouping": 9, "minblocks": 14, "algorithm": "medium", "perf": 456.87, "source": "autotuned"},
{"m": 5, "n": 9, "k": 9, "tile_m": 1, "tile_n": 1, "threads": 64, "grouping": 12, "minblocks": 1, "algorithm": "medium", "perf": 715.561, "source": "autotuned"},
{"m": 5, "n": 10, "k": 5, "tile_m": 1, "tile_n": 1, "threads": 64, "grouping": 7, "minblocks": 21, "algorithm": "medium", "perf": 596.847, "source": "autotuned"},
{"m": 5, "n": 10, "k": 10, "tile_m": 1, "tile_n": 1, "threads": 64, "grouping": 9, "minblocks": 8, "algorithm": "medium", "perf": 918.729, "source": "autotuned"},
{"m": 5, "n": 11, "k": 5, "tile_m": 1, "tile_n": 1, "threads": 64, "grouping": 7, "minblocks": 3, "algorithm": "medium", "perf": 601.355, "source": "autotuned"},
{"m": 5, "n": 11, "k": 11, "tile_m": 1, "tile_n": 1, "threads": 64, "grouping": 12, "minblocks": 18, "algorithm": "medium", "perf": 957.58, "source": "autotuned"},
{"m": 5, "n": 12, "k": 5, "tile_m": 1, "tile_n": 1, "threads": 64, "grouping": 8, "minblocks": 19, "algorithm": "medium", "perf": 672.342, "source": "autotuned"},
{"m": 5, "n": 12, "k": 12, "tile_m": 1, "tile_n": 1, "threads": 64, "grouping": 11, "minblocks": 6, "algorithm": "medium", "perf": 1028.9, "source": "autotuned"},
{"m": 5, "n": 16, "k": 5, "tile_m": 1, "tile_n": 2, "threads": 64, "grouping": 6, "minblocks": 3, "algorithm": "medium", "perf": 727.285, "source": "autotuned"},
{"m": 5, "n": 16, "k": 16, "tile_m": 1, "tile_n": 1, "threads": 128, "grouping": 17, "minblocks": 1, "algorithm": "medium", "perf": 1017.09, "source": "autotuned"},
{"m": 5, "n": 23, "k": 5, "tile_m": 1, "tile_n": 2, "threads": 64, "grouping": 12, "minblocks": 8, "algorithm": "medium", "perf": 906.135, "source": "autotuned"},
{"m": 5, "n": 23, "k": 23, "tile_m": 1, "tile_n": 1, "threads": 128, "grouping": 28, "minblocks": 2, "algorithm": "medium", "perf": 994.204, "source": "autotuned"},
{"m": 6, "n": 3, "k": 3, "tile_m": 1, "tile_n": 1, "threads": 64, "grouping": 7, "minblocks": 13, "algorithm": "small", "perf": 145.219, "source": "autotuned"},
{"m": 6, "n": 3, "k": 6, "tile_m": 1, "tile_n": 1, "threads": 64, "grouping": 9, "minblocks": 7, "algorithm": "medium", "perf": 259.751, "source": "autotuned"},
{"m": 6, "n": 4, "k": 4, "tile_m": 1, "tile_n": 1, "threads": 64, "grouping": 6, "minblocks": 5, "algorithm": "small", "perf": 251.261, "source": "autotuned"},
{"m": 6, "n": 4, "k": 6, "tile_m": 1, "tile_n": 1, "threads": 64, "grouping": 6, "minblocks": 26, "algorithm": "medium", "perf": 348.219, "source": "autotuned"},
{"m": 6, "n": 5, "k": 5, "tile_m": 1, "tile_n": 1, "threads": 64, "grouping": 5, "minblocks": 20, "algorithm": "medium", "perf": 365.753, "source": "autotuned"},
{"m": 6, "n": 5, "k": 6, "tile_m": 1, "tile_n": 1, "threads": 64, "grouping": 10, "minblocks": 14, "algorithm": "medium", "perf": 404.292, "source": "autotuned"},
{"m": 6, "n": 6, "k": 3, "tile_m": 1, "tile_n": 1, "threads": 64, "grouping": 6, "minblocks": 22, "algorithm": "medium", "perf": 312.826, "source": "autotuned"},
{"m": 6, "n": 6, "k": 4, "tile_m": 1, "tile_n": 1, "threads": 64, "grouping": 6, "minblocks": 25, "algorithm": "medium", "perf": 416.048, "source": "autotuned"},
{"m": 6, "n": 6, "k": 5, "tile_m": 1, "tile_n": 1, "threads": 64, "grouping": 6, "minblocks": 12, "algorithm": "medium", "perf": 489.515, "source": "autotuned"},
{"m": 6, "n": 6, "k": 6, "tile_m": 1, "tile_n": 1, "threads": 64, "grouping": 12, "minblocks": 25, "algorithm": "medium", "perf": 520.425, "source": "autotuned"},
{"m": 6, "n": 6, "k": 7, "tile_m": 1, "tile_n": 1, "threads": 64, "grouping": 5, "minblocks": 5, "algorithm": "small", "perf": 560.301, "source": "autotuned"},
{"m": 6, "n": 6, "k": 8, "tile_m": 1, "tile_n": 1, "threads": 64, "grouping": 9, "minblocks": 25, "algorithm": "medium", "perf": 677.861, "source": "autotuned"},
{"m": 6, "n": 6, "k": 9, "tile_m": 1, "tile_n": 1, "threads": 64, "grouping": 7, "minblocks": 23, "algorithm": "medium", "perf": 706.792, "source": "autotuned"},
{"m": 6, "n": 6, "k": 10, "tile_m": 1, "tile_n": 1, "threads": 64, "grouping": 9, "minblocks": 16, "algorithm": "medium", "perf": 751.616, "source": "autotuned"},
{"m": 6, "n": 6, "k": 11, "tile_m": 1, "tile_n": 1, "threads": 64, "grouping": 7, "minblocks": 4, "algorithm": "medium", "perf": 692.799, "source": "autotuned"},
{"m": 6, "n": 6, "k": 12, "tile_m": 1, "tile_n": 1, "threads": 64, "grouping": 7, "minblocks": 17, "algorithm": "medium", "perf": 692.802, "source": "autotuned"},
{"m": 6, "n": 6, "k": 16, "tile_m": 1, "tile_n": 1, "threads": 64, "grouping": 4, "minblocks": 23, "algorithm": "medium", "perf": 801.841, "source": "autotuned"},
{"m": 6, "n": 6, "k": 23, "tile_m": 1, "tile_n": 1, "threads": 64, "grouping": 6, "minblocks": 16, "algorithm": "medium", "perf": 789.321, "source": "autotuned"},
{"m": 6, "n": 7, "k": 6, "tile_m": 1, "tile_n": 1, "threads": 64, "grouping": 7, "minblocks": 10, "algorithm": "medium", "perf": 580.172, "source": "autotuned"},
{"m": 6, "n": 7, "k": 7, "tile_m": 1, "tile_n": 1, "threads": 64, "grouping": 7, "minblocks": 15, "algorithm": "medium", "perf": 643.16, "source": "autotuned"},
{"m": 6, "n": 8, "k": 6, "tile_m": 1, "tile_n": 1, "threads": 64, "grouping": 6, "minblocks": 9, "algorithm": "small", "perf": 627.876, "source": "autotuned"},
{"m": 6, "n": 8, "k": 8, "tile_m": 1, "tile_n": 1, "threads": 64, "grouping": 8, "minblocks": 16, "algorithm": "medium", "perf": 863.494, "source": "autotuned"},
{"m": 6, "n": 9, "k": 6, "tile_m": 1, "tile_n": 1, "threads": 64, "grouping": 6, "minblocks": 8, "algorithm": "medium", "perf": 686.311, "source": "autotuned"},
{"m": 6, "n": 9, "k": 9, "tile_m": 1, "tile_n": 1, "threads": 64, "grouping": 11, "minblocks": 8, "algorithm": "medium", "perf": 900.947, "source": "autotuned"},
{"m": 6, "n": 10, "k": 6, "tile_m": 1, "tile_n": 1, "threads": 64, "grouping": 9, "minblocks": 26, "algorithm": "medium", "perf": 776.398, "source": "autotuned"},
{"m": 6, "n": 10, "k": 10, "tile_m": 1, "tile_n": 1, "threads": 64, "grouping": 11, "minblocks": 4, "algorithm": "medium", "perf": 1017.7, "source": "autotuned"},
{"m": 6, "n": 11, "k": 6, "tile_m": 2, "tile_n": 1, "threads": 64, "grouping": 9, "minblocks": 27, "algorithm": "medium", "perf": 724.477, "source": "autotuned"},
{"m": 6, "n": 11, "k": 11, "tile_m": 2, "tile_n": 1, "threads": 128, "grouping": 10, "minblocks": 13, "algorithm": "medium", "perf": 938.489, "source": "autotuned"},
{"m": 6, "n": 12, "k": 6, "tile_m": 2, "tile_n": 1, "threads": 64, "grouping": 9, "minblocks": 11, "algorithm": "medium", "perf": 761.713, "source": "autotuned"},
{"m": 6, "n": 12, "k": 12, "tile_m": 2, "tile_n": 1, "threads": 128, "grouping": 17, "minblocks": 9, "algorithm": "medium", "perf": 974.612, "source": "autotuned"},
{"m": 6, "n": 16, "k": 6, "tile_m": 2, "tile_n": 1, "threads": 64, "grouping": 12, "minblocks": 19, "algorithm": "medium", "perf": 943.453, "source": "autotuned"},
{"m": 6, "n": 16, "k": 16, "tile_m": 1, "tile_n": 1, "threads": 128, "grouping": 19, "minblocks": 4, "algorithm": "medium", "perf": 1176.82, "source": "autotuned"},
{"m": 6, "n": 23, "k": 6, "tile_m": 1, "tile_n": 3, "threads": 64, "grouping": 8, "minblocks": 26, "algorithm": "medium", "perf": 1052.43, "source": "autotuned"},
{"m": 6, "n": 23, "k": 23, "tile_m": 1, "tile_n": 1, "threads": 192, "grouping": 27, "minblocks": 7, "algorithm": "medium", "perf": 1111.44, "source": "autotuned"},
{"m": 7, "n": 3, "k": 3, "tile_m": 2, "tile_n": 1, "threads": 64, "grouping": 11, "minblocks": 12, "algorithm": "medium", "perf": 152.123, "source": "autotuned"},
{"m": 7, "n": 3, "k": 7, "tile_m": 1, "tile_n": 1, "threads": 64, "grouping": 9, "minblocks": 17, "algorithm": "medium", "perf": 315.151, "source": "autotuned"},
{"m": 7, "n": 4, "k": 4, "tile_m": 1, "tile_n": 1, "threads": 64, "grouping": 9, "minblocks": 22, "algorithm": "medium", "perf": 282.41, "source": "autotuned"},
{"m": 7, "n": 4, "k": 7, "tile_m": 1, "tile_n": 1, "threads": 64, "grouping": 7, "minblocks": 13, "algorithm": "small", "perf": 377.56, "source": "autotuned"},
{"m": 7, "n": 5, "k": 5, "tile_m": 1, "tile_n": 1, "threads": 64, "grouping": 5, "minblocks": 1, "algorithm": "medium", "perf": 420.179, "source": "autotuned"},
{"m": 7, "n": 5, "k": 7, "tile_m": 1, "tile_n": 1, "threads": 64, "grouping": 6, "minblocks": 11, "algorithm": "medium", "perf": 544.38, "source": "autotuned"},
{"m": 7, "n": 6, "k": 6, "tile_m": 1, "tile_n": 1, "threads": 64, "grouping": 9, "minblocks": 23, "algorithm": "medium", "perf": 564.013, "source": "autotuned"},
{"m": 7, "n": 6, "k": 7, "tile_m": 1, "tile_n": 1, "threads": 64, "grouping": 9, "minblocks": 26, "algorithm": "medium", "perf": 573.971, "source": "autotuned"},
{"m": 7, "n": 7, "k": 3, "tile_m": 1, "tile_n": 1, "threads": 64, "grouping": 9, "minblocks": 15, "algorithm": "small", "perf": 406.999, "source": "autotuned"},
{"m": 7, "n": 7, "k": 4, "tile_m": 1, "tile_n": 1, "threads": 64, "grouping": 6, "minblocks": 13, "algorithm": "small", "perf": 511.252, "source": "autotuned"},
{"m": 7, "n": 7, "k": 5, "tile_m": 1, "tile_n": 1, "threads": 64, "grouping": 9, "minblocks": 21, "algorithm": "medium", "perf": 656.8, "source": "autotuned"},
{"m": 7, "n": 7, "k": 6, "tile_m": 1, "tile_n": 1, "threads": 64, "grouping": 9, "minblocks": 20, "algorithm": "medium", "perf": 751.558, "source": "autotuned"},
{"m": 7, "n": 7, "k": 7, "tile_m": 1, "tile_n": 1, "threads": 64, "grouping": 10, "minblocks": 24, "algorithm": "medium", "perf": 783.998, "source": "autotuned"},
{"m": 7, "n": 7, "k": 8, "tile_m": 1, "tile_n": 1, "threads": 64, "grouping": 9, "minblocks": 1, "algorithm": "medium", "perf": 886.637, "source": "autotuned"},
{"m": 7, "n": 7, "k": 9, "tile_m": 1, "tile_n": 1, "threads": 64, "grouping": 9, "minblocks": 17, "algorithm": "medium", "perf": 919.377, "source": "autotuned"},
{"m": 7, "n": 7, "k": 10, "tile_m": 1, "tile_n": 1, "threads": 64, "grouping": 12, "minblocks": 19, "algorithm": "medium", "perf": 831.615, "source": "autotuned"},
{"m": 7, "n": 7, "k": 11, "tile_m": 1, "tile_n": 1, "threads": 64, "grouping": 9, "minblocks": 20, "algorithm": "medium", "perf": 919.946, "source": "autotuned"},
{"m": 7, "n": 7, "k": 12, "tile_m": 1, "tile_n": 1, "threads": 64, "grouping": 9, "minblocks": 17, "algorithm": "medium", "perf": 969.153, "source": "autotuned"},
{"m": 7, "n": 7, "k": 16, "tile_m": 1, "tile_n": 1, "threads": 64, "grouping": 9, "minblocks": 22, "algorithm": "medium", "perf": 1000.31, "source": "autotuned"},
{"m": 7, "n": 7, "k": 23, "tile_m": 1, "tile_n": 1, "threads": 64, "grouping": 17, "minblocks": 5, "algorithm": "medium", "perf": 910.49, "source": "autotuned"},
{"m": 7, "n": 8, "k": 7, "tile_m": 1, "tile_n": 1, "threads": 64, "grouping": 7, "minblocks": 27, "algorithm": "medium", "perf": 819.953, "source": "autotuned"},
{"m": 7, "n": 8, "k": 8, "tile_m": 1, "tile_n": 1, "threads": 64, "grouping": 9, "minblocks": 13, "algorithm": "medium", "perf": 990.167, "source": "autotuned"},
{"m": 7, "n": 9, "k": 7, "tile_m": 1, "tile_n": 1, "threads": 64, "grouping": 10, "minblocks": 25, "algorithm": "medium", "perf": 847.471, "source": "autotuned"},
{"m": 7, "n": 9, "k": 9, "tile_m": 1, "tile_n": 1, "threads": 64, "grouping": 10, "minblocks": 11, "algorithm": "medium", "perf": 1033.8, "source": "autotuned"},
{"m": 7, "n": 10, "k": 7, "tile_m": 2, "tile_n": 1, "threads": 64, "grouping": 7, "minblocks": 1, "algorithm": "medium", "perf": 832.461, "source": "autotuned"},
{"m": 7, "n": 10, "k": 10, "tile_m": 2, "tile_n": 1, "threads": 64, "grouping": 9, "minblocks": 13, "algorithm": "medium", "perf": 937.67, "source": "autotuned"},
{"m": 7, "n": 11, "k": 7, "tile_m": 2, "tile_n": 1, "threads": 64, "grouping": 7, "minblocks": 27, "algorithm": "medium", "perf": 906.165, "source": "autotuned"},
{"m": 7, "n": 11, "k": 11, "tile_m": 2, "tile_n": 1, "threads": 64, "grouping": 7, "minblocks": 8, "algorithm": "medium", "perf": 1040.96, "source": "autotuned"},
{"m": 7, "n": 12, "k": 7, "tile_m": 2, "tile_n": 1, "threads": 64, "grouping": 7, "minblocks": 7, "algorithm": "medium", "perf": 970.295, "source": "autotuned"},
{"m": 7, "n": 12, "k": 12, "tile_m": 1, "tile_n": 2, "threads": 128, "grouping": 15, "minblocks": 1, "algorithm": "medium", "perf": 1116.73, "source": "autotuned"},
{"m": 7, "n": 16, "k": 7, "tile_m": 2, "tile_n": 1, "threads": 64, "grouping": 7, "minblocks": 15, "algorithm": "medium", "perf": 1165.88, "source": "autotuned"},
{"m": 7, "n": 16, "k": 16, "tile_m": 1, "tile_n": 1, "threads": 128, "grouping": 27, "minblocks": 6, "algorithm": "medium", "perf": 1277.36, "source": "autotuned"},
{"m": 7, "n": 23, "k": 7, "tile_m": 1, "tile_n": 3, "threads": 192, "grouping": 14, "minblocks": 8, "algorithm": "medium", "perf": 1216.97, "source": "autotuned"},
{"m": 7, "n": 23, "k": 23, "tile_m": 1, "tile_n": 1, "threads": 256, "grouping": 27, "minblocks": 3, "algorithm": "medium", "perf": 1240.93, "source": "autotuned"},
{"m": 8, "n": 3, "k": 3, "tile_m": 1, "tile_n": 1, "threads": 64, "grouping": 12, "minblocks": 15, "algorithm": "small", "perf": 159.262, "source": "autotuned"},
{"m": 8, "n": 3, "k": 8, "tile_m": 1, "tile_n": 1, "threads": 64, "grouping": 12, "minblocks": 18, "algorithm": "medium", "perf": 387.939, "source": "autotuned"},
{"m": 8, "n": 4, "k": 4, "tile_m": 1, "tile_n": 1, "threads": 64, "grouping": 9, "minblocks": 24, "algorithm": "medium", "perf": 295.644, "source": "autotuned"},
{"m": 8, "n": 4, "k": 8, "tile_m": 1, "tile_n": 1, "threads": 64, "grouping": 10, "minblocks": 7, "algorithm": "medium", "perf": 581.174, "source": "autotuned"},
{"m": 8, "n": 5, "k": 5, "tile_m": 1, "tile_n": 1, "threads": 64, "grouping": 12, "minblocks": 24, "algorithm": "medium", "perf": 405.688, "source": "autotuned"},
{"m": 8, "n": 5, "k": 8, "tile_m": 1, "tile_n": 1, "threads": 64, "grouping": 8, "minblocks": 19, "algorithm": "medium", "perf": 731.98, "source": "autotuned"},
{"m": 8, "n": 6, "k": 6, "tile_m": 1, "tile_n": 1, "threads": 64, "grouping": 6, "minblocks": 7, "algorithm": "medium", "perf": 659.632, "source": "autotuned"},
{"m": 8, "n": 6, "k": 8, "tile_m": 1, "tile_n": 1, "threads": 64, "grouping": 9, "minblocks": 19, "algorithm": "medium", "perf": 863.496, "source": "autotuned"},
{"m": 8, "n": 7, "k": 7, "tile_m": 1, "tile_n": 1, "threads": 64, "grouping": 6, "minblocks": 11, "algorithm": "medium", "perf": 812.825, "source": "autotuned"},
{"m": 8, "n": 7, "k": 8, "tile_m": 1, "tile_n": 1, "threads": 64, "grouping": 7, "minblocks": 15, "algorithm": "medium", "perf": 973.042, "source": "autotuned"},
{"m": 8, "n": 8, "k": 3, "tile_m": 1, "tile_n": 1, "threads": 64, "grouping": 10, "minblocks": 5, "algorithm": "medium", "perf": 568.097, "source": "autotuned"},
{"m": 8, "n": 8, "k": 4, "tile_m": 1, "tile_n": 1, "threads": 64, "grouping": 10, "minblocks": 24, "algorithm": "medium", "perf": 725.612, "source": "autotuned"},
{"m": 8, "n": 8, "k": 5, "tile_m": 1, "tile_n": 1, "threads": 64, "grouping": 13, "minblocks": 21, "algorithm": "medium", "perf": 790.621, "source": "autotuned"},
{"m": 8, "n": 8, "k": 6, "tile_m": 1, "tile_n": 1, "threads": 64, "grouping": 9, "minblocks": 15, "algorithm": "medium", "perf": 963.313, "source": "autotuned"},
{"m": 8, "n": 8, "k": 7, "tile_m": 1, "tile_n": 1, "threads": 64, "grouping": 10, "minblocks": 21, "algorithm": "medium", "perf": 1033.73, "source": "autotuned"},
{"m": 8, "n": 8, "k": 8, "tile_m": 1, "tile_n": 1, "threads": 64, "grouping": 8, "minblocks": 1, "algorithm": "medium", "perf": 1099.94, "source": "autotuned"},
{"m": 8, "n": 8, "k": 16, "tile_m": 1, "tile_n": 1, "threads": 64, "grouping": 15, "minblocks": 9, "algorithm": "medium", "perf": 1142.36, "source": "autotuned"},
{"m": 8, "n": 8, "k": 23, "tile_m": 1, "tile_n": 1, "threads": 128, "grouping": 15, "minblocks": 4, "algorithm": "medium", "perf": 1049.41, "source": "autotuned"},
{"m": 8, "n": 16, "k": 8, "tile_m": 1, "tile_n": 1, "threads": 128, "grouping": 14, "minblocks": 1, "algorithm": "medium", "perf": 1374.93, "source": "autotuned"},
{"m": 8, "n": 16, "k": 16, "tile_m": 1, "tile_n": 1, "threads": 128, "grouping": 28, "minblocks": 4, "algorithm": "medium", "perf": 1388.91, "source": "autotuned"},
{"m": 8, "n": 23, "k": 8, "tile_m": 1, "tile_n": 3, "threads": 192, "grouping": 19, "minblocks": 5, "algorithm": "medium", "perf": 1436.55, "source": "autotuned"},
{"m": 8, "n": 23, "k": 23, "tile_m": 2, "tile_n": 1, "threads": 192, "grouping": 3, "minblocks": 9, "algorithm": "medium", "perf": 1370.75, "source": "autotuned"},
{"m": 9, "n": 3, "k": 3, "tile_m": 1, "tile_n": 1, "threads": 64, "grouping": 7, "minblocks": 14, "algorithm": "small", "perf": 215.434, "source": "autotuned"},
{"m": 9, "n": 3, "k": 9, "tile_m": 1, "tile_n": 1, "threads": 64, "grouping": 5, "minblocks": 8, "algorithm": "medium", "perf": 493.605, "source": "autotuned"},
{"m": 9, "n": 4, "k": 4, "tile_m": 1, "tile_n": 1, "threads": 64, "grouping": 10, "minblocks": 1, "algorithm": "small", "perf": 328.852, "source": "autotuned"},
{"m": 9, "n": 4, "k": 9, "tile_m": 1, "tile_n": 1, "threads": 64, "grouping": 5, "minblocks": 25, "algorithm": "medium", "perf": 643.801, "source": "autotuned"},
{"m": 9, "n": 5, "k": 5, "tile_m": 1, "tile_n": 1, "threads": 64, "grouping": 8, "minblocks": 2, "algorithm": "medium", "perf": 529.804, "source": "autotuned"},
{"m": 9, "n": 5, "k": 9, "tile_m": 1, "tile_n": 1, "threads": 64, "grouping": 5, "minblocks": 9, "algorithm": "medium", "perf": 742.897, "source": "autotuned"},
{"m": 9, "n": 6, "k": 6, "tile_m": 1, "tile_n": 1, "threads": 64, "grouping": 8, "minblocks": 22, "algorithm": "medium", "perf": 684.404, "source": "autotuned"},
{"m": 9, "n": 6, "k": 9, "tile_m": 1, "tile_n": 1, "threads": 64, "grouping": 11, "minblocks": 3, "algorithm": "medium", "perf": 894.321, "source": "autotuned"},
{"m": 9, "n": 7, "k": 7, "tile_m": 1, "tile_n": 1, "threads": 64, "grouping": 7, "minblocks": 19, "algorithm": "medium", "perf": 872.306, "source": "autotuned"},
{"m": 9, "n": 7, "k": 9, "tile_m": 1, "tile_n": 1, "threads": 64, "grouping": 9, "minblocks": 27, "algorithm": "medium", "perf": 1061.49, "source": "autotuned"},
{"m": 9, "n": 9, "k": 3, "tile_m": 2, "tile_n": 1, "threads": 64, "grouping": 9, "minblocks": 24, "algorithm": "medium", "perf": 560.057, "source": "autotuned"},
{"m": 9, "n": 9, "k": 4, "tile_m": 2, "tile_n": 1, "threads": 64, "grouping": 8, "minblocks": 9, "algorithm": "medium", "perf": 727.028, "source": "autotuned"},
{"m": 9, "n": 9, "k": 5, "tile_m": 2, "tile_n": 1, "threads": 64, "grouping": 11, "minblocks": 5, "algorithm": "medium", "perf": 780.091, "source": "autotuned"},
{"m": 9, "n": 9, "k": 6, "tile_m": 1, "tile_n": 2, "threads": 64, "grouping": 9, "minblocks": 13, "algorithm": "medium", "perf": 907.002, "source": "autotuned"},
{"m": 9, "n": 9, "k": 7, "tile_m": 1, "tile_n": 2, "threads": 64, "grouping": 8, "minblocks": 14, "algorithm": "medium", "perf": 959.107, "source": "autotuned"},
{"m": 9, "n": 9, "k": 9, "tile_m": 2, "tile_n": 1, "threads": 64, "grouping": 17, "minblocks": 2, "algorithm": "medium", "perf": 479.296, "source": "autotuned"},
{"m": 9, "n": 9, "k": 16, "tile_m": 1, "tile_n": 2, "threads": 192, "grouping": 17, "minblocks": 5, "algorithm": "medium", "perf": 1169.07, "source": "autotuned"},
{"m": 9, "n": 9, "k": 23, "tile_m": 1, "tile_n": 1, "threads": 256, "grouping": 23, "minblocks": 5, "algorithm": "medium", "perf": 1097.3, "source": "autotuned"},
{"m": 9, "n": 16, "k": 9, "tile_m": 1, "tile_n": 3, "threads": 192, "grouping": 15, "minblocks": 1, "algorithm": "medium", "perf": 1338.03, "source": "autotuned"},
{"m": 9, "n": 16, "k": 16, "tile_m": 3, "tile_n": 1, "threads": 256, "grouping": 23, "minblocks": 7, "algorithm": "medium", "perf": 1401.05, "source": "autotuned"},
{"m": 9, "n": 23, "k": 9, "tile_m": 1, "tile_n": 2, "threads": 256, "grouping": 27, "minblocks": 2, "algorithm": "medium", "perf": 1472.7, "source": "autotuned"},
{"m": 9, "n": 23, "k": 23, "tile_m": 1, "tile_n": 2, "w": 6, "v": 12, "threads": 128, "grouping": 16, "minblocks": 12, "algorithm": "largeDB2", "perf": 1473.69, "source": "autotuned"},
{"m": 10, "n": 3, "k": 3, "tile_m": 1, "tile_n": 1, "threads": 64, "grouping": 5, "minblocks": 26, "algorithm": "medium", "perf": 233.094, "source": "autotuned"},
{"m": 10, "n": 3, "k": 10, "tile_m": 1, "tile_n": 1, "threads": 64, "grouping": 11, "minblocks": 26, "algorithm": "medium", "perf": 557.492, "source": "autotuned"},
{"m": 10, "n": 4, "k": 4, "tile_m": 1, "tile_n": 1, "threads": 64, "grouping": 7, "minblocks": 2, "algorithm": "medium", "perf": 421.968, "source": "autotuned"},
{"m": 10, "n": 4, "k": 10, "tile_m": 1, "tile_n": 1, "threads": 64, "grouping": 7, "minblocks": 2, "algorithm": "medium", "perf": 749.252, "source": "autotuned"},
{"m": 10, "n": 5, "k": 5, "tile_m": 1, "tile_n": 1, "threads": 64, "grouping": 6, "minblocks": 9, "algorithm": "small", "perf": 560.463, "source": "autotuned"},
{"m": 10, "n": 5, "k": 10, "tile_m": 1, "tile_n": 1, "threads": 64, "grouping": 9, "minblocks": 23, "algorithm": "medium", "perf": 923.14, "source": "autotuned"},
{"m": 10, "n": 6, "k": 6, "tile_m": 1, "tile_n": 1, "threads": 64, "grouping": 7, "minblocks": 2, "algorithm": "medium", "perf": 787.636, "source": "autotuned"},
{"m": 10, "n": 6, "k": 10, "tile_m": 1, "tile_n": 1, "threads": 64, "grouping": 9, "minblocks": 14, "algorithm": "medium", "perf": 1063.7, "source": "autotuned"},
{"m": 10, "n": 7, "k": 7, "tile_m": 1, "tile_n": 2, "threads": 64, "grouping": 7, "minblocks": 27, "algorithm": "medium", "perf": 842.767, "source": "autotuned"},
{"m": 10, "n": 7, "k": 10, "tile_m": 2, "tile_n": 1, "threads": 64, "grouping": 9, "minblocks": 26, "algorithm": "medium", "perf": 941.764, "source": "autotuned"},
{"m": 10, "n": 10, "k": 3, "tile_m": 2, "tile_n": 1, "threads": 64, "grouping": 11, "minblocks": 21, "algorithm": "medium", "perf": 675.109, "source": "autotuned"},
{"m": 10, "n": 10, "k": 4, "tile_m": 2, "tile_n": 1, "threads": 64, "grouping": 7, "minblocks": 19, "algorithm": "medium", "perf": 836.688, "source": "autotuned"},
{"m": 10, "n": 10, "k": 5, "tile_m": 2, "tile_n": 1, "threads": 64, "grouping": 8, "minblocks": 23, "algorithm": "medium", "perf": 987.67, "source": "autotuned"},
{"m": 10, "n": 10, "k": 6, "tile_m": 1, "tile_n": 2, "threads": 64, "grouping": 8, "minblocks": 11, "algorithm": "medium", "perf": 1115.08, "source": "autotuned"},
{"m": 10, "n": 10, "k": 7, "tile_m": 2, "tile_n": 1, "threads": 128, "grouping": 12, "minblocks": 11, "algorithm": "medium", "perf": 1129.39, "source": "autotuned"},
{"m": 10, "n": 10, "k": 10, "tile_m": 1, "tile_n": 2, "threads": 64, "grouping": 9, "minblocks": 8, "algorithm": "medium", "perf": 1233.05, "source": "autotuned"},
{"m": 10, "n": 10, "k": 16, "tile_m": 1, "tile_n": 1, "threads": 128, "grouping": 17, "minblocks": 11, "algorithm": "medium", "perf": 1287.76, "source": "autotuned"},
{"m": 10, "n": 10, "k": 23, "tile_m": 1, "tile_n": 1, "threads": 256, "grouping": 27, "minblocks": 5, "algorithm": "medium", "perf": 1224.44, "source": "autotuned"},
{"m": 10, "n": 16, "k": 10, "tile_m": 2, "tile_n": 2, "threads": 192, "grouping": 17, "minblocks": 7, "algorithm": "medium", "perf": 1490.82, "source": "autotuned"},
{"m": 10, "n": 16, "k": 16, "tile_m": 1, "tile_n": 3, "threads": 256, "grouping": 27, "minblocks": 6, "algorithm": "medium", "perf": 1486.68, "source": "autotuned"},
{"m": 10, "n": 23, "k": 10, "tile_m": 1, "tile_n": 2, "threads": 256, "grouping": 28, "minblocks": 1, "algorithm": "medium", "perf": 1551.4, "source": "autotuned"},
{"m": 10, "n": 23, "k": 23, "tile_m": 1, "tile_n": 2, "threads": 256, "grouping": 4, "minblocks": 3, "algorithm": "medium", "perf": 1591.47, "source": "autotuned"},
{"m": 11, "n": 3, "k": 3, "tile_m": 1, "tile_n": 1, "threads": 64, "grouping": 4, "minblocks": 4, "algorithm": "medium", "perf": 221.534, "source": "autotuned"},
{"m": 11, "n": 3, "k": 11, "tile_m": 1, "tile_n": 1, "threads": 64, "grouping": 10, "minblocks": 1, "algorithm": "medium", "perf": 595.556, "source": "autotuned"},
{"m": 11, "n": 4, "k": 4, "tile_m": 1, "tile_n": 1, "threads": 64, "grouping": 9, "minblocks": 27, "algorithm": "medium", "perf": 443.417, "source": "autotuned"},
{"m": 11, "n": 4, "k": 11, "tile_m": 1, "tile_n": 1, "threads": 64, "grouping": 14, "minblocks": 12, "algorithm": "medium", "perf": 762.441, "source": "autotuned"},
{"m": 11, "n": 5, "k": 5, "tile_m": 1, "tile_n": 1, "threads": 64, "grouping": 7, "minblocks": 13, "algorithm": "small", "perf": 594.138, "source": "autotuned"},
{"m": 11, "n": 5, "k": 11, "tile_m": 1, "tile_n": 1, "threads": 64, "grouping": 10, "minblocks": 12, "algorithm": "medium", "perf": 990.084, "source": "autotuned"},
{"m": 11, "n": 6, "k": 6, "tile_m": 1, "tile_n": 2, "threads": 64, "grouping": 9, "minblocks": 11, "algorithm": "medium", "perf": 720.225, "source": "autotuned"},
{"m": 11, "n": 6, "k": 11, "tile_m": 1, "tile_n": 2, "threads": 64, "grouping": 9, "minblocks": 23, "algorithm": "medium", "perf": 926.173, "source": "autotuned"},
{"m": 11, "n": 7, "k": 7, "tile_m": 2, "tile_n": 1, "threads": 64, "grouping": 9, "minblocks": 25, "algorithm": "medium", "perf": 881.997, "source": "autotuned"},
{"m": 11, "n": 7, "k": 11, "tile_m": 1, "tile_n": 2, "threads": 64, "grouping": 8, "minblocks": 12, "algorithm": "medium", "perf": 1005.66, "source": "autotuned"},
{"m": 11, "n": 11, "k": 3, "tile_m": 1, "tile_n": 1, "threads": 128, "grouping": 10, "minblocks": 15, "algorithm": "medium", "perf": 745.298, "source": "autotuned"},
{"m": 11, "n": 11, "k": 4, "tile_m": 1, "tile_n": 1, "threads": 128, "grouping": 15, "minblocks": 5, "algorithm": "medium", "perf": 931.779, "source": "autotuned"},
{"m": 11, "n": 11, "k": 5, "tile_m": 1, "tile_n": 1, "threads": 128, "grouping": 12, "minblocks": 10, "algorithm": "medium", "perf": 1078.77, "source": "autotuned"},
{"m": 11, "n": 11, "k": 6, "tile_m": 1, "tile_n": 1, "threads": 128, "grouping": 15, "minblocks": 3, "algorithm": "medium", "perf": 1178.24, "source": "autotuned"},
{"m": 11, "n": 11, "k": 7, "tile_m": 1, "tile_n": 1, "threads": 128, "grouping": 11, "minblocks": 13, "algorithm": "medium", "perf": 1219.72, "source": "autotuned"},
{"m": 11, "n": 11, "k": 11, "tile_m": 1, "tile_n": 1, "threads": 128, "grouping": 17, "minblocks": 10, "algorithm": "medium", "perf": 1410.56, "source": "autotuned"},
{"m": 11, "n": 11, "k": 16, "tile_m": 1, "tile_n": 1, "threads": 192, "grouping": 23, "minblocks": 4, "algorithm": "medium", "perf": 1391.57, "source": "autotuned"},
{"m": 11, "n": 11, "k": 23, "tile_m": 1, "tile_n": 1, "threads": 128, "grouping": 28, "minblocks": 4, "algorithm": "medium", "perf": 1313.93, "source": "autotuned"},
{"m": 11, "n": 16, "k": 11, "tile_m": 3, "tile_n": 1, "threads": 192, "grouping": 19, "minblocks": 6, "algorithm": "medium", "perf": 1507.09, "source": "autotuned"},
{"m": 11, "n": 16, "k": 16, "tile_m": 2, "tile_n": 1, "threads": 256, "grouping": 27, "minblocks": 7, "algorithm": "medium", "perf": 1546.67, "source": "autotuned"},
{"m": 11, "n": 23, "k": 11, "tile_m": 1, "tile_n": 1, "threads": 256, "grouping": 27, "minblocks": 3, "algorithm": "medium", "perf": 1618.53, "source": "autotuned"},
{"m": 11, "n": 23, "k": 23, "tile_m": 3, "tile_n": 1, "threads": 128, "grouping": 3, "minblocks": 4, "algorithm": "medium", "perf": 1644.3, "source": "autotuned"},
{"m": 12, "n": 3, "k": 3, "tile_m": 7, "tile_n": 1, "threads": 64, "grouping": 21, "minblocks": 10, "algorithm": "medium", "perf": 704.989, "source": "autotuned"},
{"m": 12, "n": 3, "k": 12, "tile_m": 1, "tile_n": 1, "threads": 64, "grouping": 14, "minblocks": 20, "algorithm": "medium", "perf": 643.778, "source": "autotuned"},
{"m": 12, "n": 4, "k": 4, "tile_m": 1, "tile_n": 1, "threads": 64, "grouping": 6, "minblocks": 7, "algorithm": "medium", "perf": 486.135, "source": "autotuned"},
{"m": 12, "n": 4, "k": 12, "tile_m": 1, "tile_n": 1, "threads": 64, "grouping": 10, "minblocks": 6, "algorithm": "medium", "perf": 908.392, "source": "autotuned"},
{"m": 12, "n": 5, "k": 5, "tile_m": 1, "tile_n": 1, "threads": 64, "grouping": 7, "minblocks": 25, "algorithm": "medium", "perf": 691.423, "source": "autotuned"},
{"m": 12, "n": 5, "k": 12, "tile_m": 1, "tile_n": 1, "threads": 64, "grouping": 13, "minblocks": 1, "algorithm": "medium", "perf": 1022.02, "source": "autotuned"},
{"m": 12, "n": 6, "k": 6, "tile_m": 2, "tile_n": 1, "threads": 64, "grouping": 8, "minblocks": 4, "algorithm": "medium", "perf": 766.077, "source": "autotuned"},
{"m": 12, "n": 6, "k": 12, "tile_m": 2, "tile_n": 1, "threads": 64, "grouping": 5, "minblocks": 5, "algorithm": "medium", "perf": 985.725, "source": "autotuned"},
{"m": 12, "n": 7, "k": 7, "tile_m": 2, "tile_n": 1, "threads": 64, "grouping": 8, "minblocks": 14, "algorithm": "medium", "perf": 956.029, "source": "autotuned"},
{"m": 12, "n": 7, "k": 12, "tile_m": 1, "tile_n": 2, "threads": 128, "grouping": 17, "minblocks": 1, "algorithm": "medium", "perf": 1110.58, "source": "autotuned"},
{"m": 12, "n": 12, "k": 3, "tile_m": 3, "tile_n": 1, "threads": 192, "grouping": 14, "minblocks": 5, "algorithm": "medium", "perf": 797.35, "source": "autotuned"},
{"m": 12, "n": 12, "k": 4, "tile_m": 1, "tile_n": 3, "threads": 64, "grouping": 8, "minblocks": 11, "algorithm": "medium", "perf": 1027.58, "source": "autotuned"},
{"m": 12, "n": 12, "k": 5, "tile_m": 3, "tile_n": 1, "threads": 192, "grouping": 17, "minblocks": 3, "algorithm": "medium", "perf": 1082.57, "source": "autotuned"},
{"m": 12, "n": 12, "k": 6, "tile_m": 1, "tile_n": 3, "threads": 192, "grouping": 17, "minblocks": 3, "algorithm": "medium", "perf": 1205.76, "source": "autotuned"},
{"m": 12, "n": 12, "k": 7, "tile_m": 1, "tile_n": 3, "threads": 128, "grouping": 10, "minblocks": 3, "algorithm": "medium", "perf": 1261.71, "source": "autotuned"},
{"m": 12, "n": 12, "k": 12, "tile_m": 1, "tile_n": 3, "threads": 192, "grouping": 17, "minblocks": 6, "algorithm": "medium", "perf": 1471.99, "source": "autotuned"},
{"m": 12, "n": 12, "k": 16, "tile_m": 3, "tile_n": 1, "threads": 192, "grouping": 24, "minblocks": 6, "algorithm": "medium", "perf": 1466.11, "source": "autotuned"},
{"m": 12, "n": 12, "k": 23, "tile_m": 1, "tile_n": 1, "threads": 192, "grouping": 17, "minblocks": 6, "algorithm": "medium", "perf": 1371.86, "source": "autotuned"},
{"m": 12, "n": 16, "k": 12, "tile_m": 3, "tile_n": 1, "threads": 192, "grouping": 24, "minblocks": 5, "algorithm": "medium", "perf": 1631.08, "source": "autotuned"},
{"m": 12, "n": 16, "k": 16, "tile_m": 1, "tile_n": 2, "threads": 192, "grouping": 27, "minblocks": 5, "algorithm": "medium", "perf": 1644.39, "source": "autotuned"},
{"m": 12, "n": 23, "k": 12, "tile_m": 1, "tile_n": 3, "threads": 320, "grouping": 27, "minblocks": 2, "algorithm": "medium", "perf": 1691.75, "source": "autotuned"},
{"m": 12, "n": 23, "k": 23, "tile_m": 2, "tile_n": 1, "threads": 320, "grouping": 27, "minblocks": 4, "algorithm": "medium", "perf": 1688.82, "source": "autotuned"},
{"m": 13, "n": 13, "k": 13, "tile_m": 1, "tile_n": 1, "threads": 192, "grouping": 24, "minblocks": 3, "algorithm": "medium", "perf": 1139.41, "source": "autotuned"},
{"m": 13, "n": 13, "k": 23, "tile_m": 1, "tile_n": 1, "threads": 192, "grouping": 27, "minblocks": 8, "algorithm": "medium", "perf": 1485.0, "source": "autotuned"},
{"m": 13, "n": 23, "k": 13, "tile_m": 2, "tile_n": 1, "threads": 320, "grouping": 27, "minblocks": 6, "algorithm": "medium", "perf": 1695.45, "source": "autotuned"},
{"m": 13, "n": 23, "k": 23, "tile_m": 1, "tile_n": 1, "threads": 320, "grouping": 5, "minblocks": 2, "algorithm": "medium", "perf": 1780.63, "source": "autotuned"},
{"m": 14, "n": 14, "k": 14, "tile_m": 1, "tile_n": 2, "threads": 256, "grouping": 28, "minblocks": 1, "algorithm": "medium", "perf": 1584.33, "source": "autotuned"},
{"m": 14, "n": 14, "k": 23, "tile_m": 2, "tile_n": 1, "threads": 384, "grouping": 27, "minblocks": 3, "algorithm": "medium", "perf": 1570.32, "source": "autotuned"},
{"m": 14, "n": 14, "k": 32, "tile_m": 2, "tile_n": 1, "threads": 128, "grouping": 4, "minblocks": 5, "algorithm": "medium", "perf": 1630.31, "source": "autotuned"},
{"m": 14, "n": 23, "k": 14, "tile_m": 1, "tile_n": 3, "threads": 384, "grouping": 27, "minblocks": 5, "algorithm": "medium", "perf": 1804.97, "source": "autotuned"},
{"m": 14, "n": 23, "k": 23, "tile_m": 1, "tile_n": 2, "threads": 192, "grouping": 3, "minblocks": 6, "algorithm": "medium", "perf": 1892.29, "source": "autotuned"},
{"m": 14, "n": 29, "k": 32, "tile_m": 2, "tile_n": 1, "threads": 256, "grouping": 4, "minblocks": 2, "algorithm": "medium", "perf": 2134, "source": "autotuned"},
{"m": 14, "n": 32, "k": 14, "tile_m": 1, "tile_n": 2, "threads": 448, "grouping": 7, "minblocks": 2, "algorithm": "medium", "perf": 1966.76, "source": "autotuned"},
{"m": 14, "n": 32, "k": 29, "tile_m": 2, "tile_n": 2, "w": 4, "v": 32, "threads": 128, "grouping": 16, "minblocks": 4, "algorithm": "largeDB1", "perf": 2095.2, "source": "autotuned"},
{"m": 14, "n": 32, "k": 32, "tile_m": 2, "tile_n": 1, "threads": 256, "grouping": 4, "minblocks": 2, "algorithm": "medium", "perf": 2215.32, "source": "autotuned"},
{"m": 15, "n": 15, "k": 15, "tile_m": 2, "tile_n": 1, "threads": 256, "grouping": 27, "minblocks": 1, "algorithm": "medium", "perf": 1633.57, "source": "autotuned"},
{"m": 15, "n": 15, "k": 23, "tile_m": 2, "tile_n": 1, "w": 6, "v": 8, "threads": 128, "grouping": 16, "minblocks": 12, "algorithm": "largeDB2", "perf": 1665.4, "source": "autotuned"},
{"m": 15, "n": 23, "k": 15, "tile_m": 1, "tile_n": 2, "threads": 192, "grouping": 4, "minblocks": 5, "algorithm": "medium", "perf": 1837.85, "source": "autotuned"},
{"m": 15, "n": 23, "k": 23, "tile_m": 1, "tile_n": 3, "w": 4, "v": 16, "threads": 128, "grouping": 16, "minblocks": 8, "algorithm": "largeDB2", "perf": 1892.88, "source": "autotuned"},
{"m": 16, "n": 3, "k": 3, "tile_m": 1, "tile_n": 1, "threads": 64, "grouping": 10, "minblocks": 12, "algorithm": "medium", "perf": 353.838, "source": "autotuned"},
{"m": 16, "n": 3, "k": 16, "tile_m": 1, "tile_n": 1, "threads": 64, "grouping": 19, "minblocks": 4, "algorithm": "medium", "perf": 725.825, "source": "autotuned"},
{"m": 16, "n": 4, "k": 4, "tile_m": 1, "tile_n": 1, "threads": 64, "grouping": 12, "minblocks": 12, "algorithm": "medium", "perf": 666.586, "source": "autotuned"},
{"m": 16, "n": 4, "k": 16, "tile_m": 1, "tile_n": 1, "threads": 64, "grouping": 19, "minblocks": 21, "algorithm": "medium", "perf": 903.482, "source": "autotuned"},
{"m": 16, "n": 5, "k": 5, "tile_m": 1, "tile_n": 2, "threads": 64, "grouping": 7, "minblocks": 4, "algorithm": "medium", "perf": 776.943, "source": "autotuned"},
{"m": 16, "n": 5, "k": 16, "tile_m": 2, "tile_n": 1, "threads": 128, "grouping": 19, "minblocks": 1, "algorithm": "medium", "perf": 1020.69, "source": "autotuned"},
{"m": 16, "n": 6, "k": 6, "tile_m": 2, "tile_n": 1, "threads": 64, "grouping": 9, "minblocks": 26, "algorithm": "medium", "perf": 1014.66, "source": "autotuned"},
{"m": 16, "n": 6, "k": 16, "tile_m": 1, "tile_n": 1, "threads": 128, "grouping": 23, "minblocks": 10, "algorithm": "medium", "perf": 1160.16, "source": "autotuned"},
{"m": 16, "n": 7, "k": 7, "tile_m": 1, "tile_n": 2, "threads": 64, "grouping": 9, "minblocks": 20, "algorithm": "medium", "perf": 1171.68, "source": "autotuned"},
{"m": 16, "n": 7, "k": 16, "tile_m": 1, "tile_n": 1, "threads": 128, "grouping": 28, "minblocks": 3, "algorithm": "medium", "perf": 1260.89, "source": "autotuned"},
{"m": 16, "n": 8, "k": 8, "tile_m": 1, "tile_n": 2, "threads": 64, "grouping": 12, "minblocks": 4, "algorithm": "medium", "perf": 1382.66, "source": "autotuned"},
{"m": 16, "n": 8, "k": 16, "tile_m": 1, "tile_n": 1, "threads": 128, "grouping": 27, "minblocks": 5, "algorithm": "medium", "perf": 1393.63, "source": "autotuned"},
{"m": 16, "n": 9, "k": 9, "tile_m": 1, "tile_n": 3, "threads": 192, "grouping": 17, "minblocks": 3, "algorithm": "medium", "perf": 1319.87, "source": "autotuned"},
{"m": 16, "n": 9, "k": 16, "tile_m": 3, "tile_n": 1, "threads": 192, "grouping": 23, "minblocks": 3, "algorithm": "medium", "perf": 1395.11, "source": "autotuned"},
{"m": 16, "n": 10, "k": 10, "tile_m": 3, "tile_n": 1, "threads": 192, "grouping": 15, "minblocks": 4, "algorithm": "medium", "perf": 1480.96, "source": "autotuned"},
{"m": 16, "n": 10, "k": 16, "tile_m": 3, "tile_n": 1, "threads": 192, "grouping": 24, "minblocks": 4, "algorithm": "medium", "perf": 1492.09, "source": "autotuned"},
{"m": 16, "n": 11, "k": 11, "tile_m": 2, "tile_n": 2, "threads": 192, "grouping": 17, "minblocks": 6, "algorithm": "medium", "perf": 1491.61, "source": "autotuned"},
{"m": 16, "n": 11, "k": 16, "tile_m": 2, "tile_n": 1, "threads": 256, "grouping": 27, "minblocks": 4, "algorithm": "medium", "perf": 1531.95, "source": "autotuned"},
{"m": 16, "n": 12, "k": 12, "tile_m": 1, "tile_n": 3, "threads": 192, "grouping": 23, "minblocks": 5, "algorithm": "medium", "perf": 1610.57, "source": "autotuned"},
{"m": 16, "n": 12, "k": 16, "tile_m": 2, "tile_n": 1, "threads": 256, "grouping": 27, "minblocks": 7, "algorithm": "medium", "perf": 1644.39, "source": "autotuned"},
{"m": 16, "n": 16, "k": 3, "tile_m": 2, "tile_n": 1, "threads": 128, "grouping": 14, "minblocks": 1, "algorithm": "medium", "perf": 1177.38, "source": "autotuned"},
{"m": 16, "n": 16, "k": 4, "tile_m": 2, "tile_n": 2, "threads": 128, "grouping": 13, "minblocks": 8, "algorithm": "medium", "perf": 1443.55, "source": "autotuned"},
{"m": 16, "n": 16, "k": 5, "tile_m": 2, "tile_n": 2, "threads": 128, "grouping": 12, "minblocks": 9, "algorithm": "medium", "perf": 1567.84, "source": "autotuned"},
{"m": 16, "n": 16, "k": 6, "tile_m": 1, "tile_n": 2, "threads": 128, "grouping": 16, "minblocks": 11, "algorithm": "medium", "perf": 1680.36, "source": "autotuned"},
{"m": 16, "n": 16, "k": 7, "tile_m": 2, "tile_n": 2, "threads": 256, "grouping": 18, "minblocks": 8, "algorithm": "medium", "perf": 1740.35, "source": "autotuned"},
{"m": 16, "n": 16, "k": 8, "tile_m": 1, "tile_n": 2, "threads": 256, "grouping": 19, "minblocks": 6, "algorithm": "medium", "perf": 1826.42, "source": "autotuned"},
{"m": 16, "n": 16, "k": 9, "tile_m": 2, "tile_n": 1, "threads": 256, "grouping": 23, "minblocks": 8, "algorithm": "medium", "perf": 1786.6, "source": "autotuned"},
{"m": 16, "n": 16, "k": 10, "tile_m": 2, "tile_n": 1, "threads": 256, "grouping": 27, "minblocks": 3, "algorithm": "medium", "perf": 1859.02, "source": "autotuned"},
{"m": 16, "n": 16, "k": 11, "tile_m": 1, "tile_n": 2, "threads": 256, "grouping": 27, "minblocks": 8, "algorithm": "medium", "perf": 1799.92, "source": "autotuned"},
{"m": 16, "n": 16, "k": 12, "tile_m": 2, "tile_n": 1, "threads": 256, "grouping": 27, "minblocks": 5, "algorithm": "medium", "perf": 1865.23, "source": "autotuned"},
{"m": 16, "n": 16, "k": 16, "tile_m": 2, "tile_n": 2, "threads": 256, "grouping": 23, "minblocks": 3, "algorithm": "medium", "perf": 1650.28, "source": "autotuned"},
{"m": 16, "n": 16, "k": 23, "tile_m": 1, "tile_n": 2, "threads": 256, "grouping": 4, "minblocks": 5, "algorithm": "medium", "perf": 1808.55, "source": "autotuned"},
{"m": 16, "n": 23, "k": 16, "tile_m": 2, "tile_n": 1, "threads": 192, "grouping": 6, "minblocks": 5, "algorithm": "medium", "perf": 1992.05, "source": "autotuned"},
{"m": 16, "n": 23, "k": 23, "tile_m": 1, "tile_n": 2, "threads": 256, "grouping": 28, "minblocks": 7, "algorithm": "medium", "perf": 1992.93, "source": "autotuned"},
{"m": 17, "n": 17, "k": 17, "tile_m": 3, "tile_n": 1, "threads": 320, "grouping": 14, "minblocks": 3, "algorithm": "medium", "perf": 1146.99, "source": "autotuned"},
{"m": 17, "n": 17, "k": 23, "tile_m": 3, "tile_n": 1, "threads": 128, "grouping": 4, "minblocks": 4, "algorithm": "medium", "perf": 1793.01, "source": "autotuned"},
{"m": 17, "n": 23, "k": 17, "tile_m": 2, "tile_n": 2, "threads": 128, "grouping": 5, "minblocks": 1, "algorithm": "medium", "perf": 1930.99, "source": "autotuned"},
{"m": 17, "n": 23, "k": 23, "tile_m": 3, "tile_n": 1, "threads": 256, "grouping": 3, "minblocks": 7, "algorithm": "medium", "perf": 2010.24, "source": "autotuned"},
{"m": 18, "n": 18, "k": 18, "tile_m": 3, "tile_n": 1, "threads": 256, "grouping": 27, "minblocks": 4, "algorithm": "medium", "perf": 1880.87, "source": "autotuned"},
{"m": 18, "n": 18, "k": 23, "tile_m": 3, "tile_n": 1, "threads": 256, "grouping": 5, "minblocks": 3, "algorithm": "medium", "perf": 1918.75, "source": "autotuned"},
{"m": 18, "n": 23, "k": 18, "tile_m": 2, "tile_n": 2, "threads": 256, "grouping": 7, "minblocks": 6, "algorithm": "medium", "perf": 2029.31, "source": "autotuned"},
{"m": 18, "n": 23, "k": 23, "tile_m": 2, "tile_n": 2, "threads": 192, "grouping": 5, "minblocks": 3, "algorithm": "medium", "perf": 2098.78, "source": "autotuned"},
{"m": 19, "n": 19, "k": 19, "tile_m": 1, "tile_n": 2, "threads": 192, "grouping": 27, "minblocks": 8, "algorithm": "medium", "perf": 1945.5, "source": "autotuned"},
{"m": 19, "n": 19, "k": 23, "tile_m": 1, "tile_n": 2, "threads": 192, "grouping": 23, "minblocks": 7, "algorithm": "medium", "perf": 1948.91, "source": "autotuned"},
{"m": 19, "n": 23, "k": 19, "tile_m": 2, "tile_n": 2, "threads": 256, "grouping": 5, "minblocks": 3, "algorithm": "medium", "perf": 2088.58, "source": "autotuned"},
{"m": 19, "n": 23, "k": 23, "tile_m": 2, "tile_n": 2, "threads": 192, "grouping": 29, "minblocks": 5, "algorithm": "medium", "perf": 2103.37, "source": "autotuned"},
{"m": 20, "n": 20, "k": 20, "tile_m": 2, "tile_n": 2, "threads": 256, "grouping": 27, "minblocks": 8, "algorithm": "medium", "perf": 2075.88, "source": "autotuned"},
{"m": 20, "n": 20, "k": 23, "tile_m": 2, "tile_n": 2, "threads": 512, "grouping": 23, "minblocks": 3, "algorithm": "medium", "perf": 2098.72, "source": "autotuned"},
{"m": 20, "n": 23, "k": 20, "tile_m": 2, "tile_n": 2, "threads": 256, "grouping": 4, "minblocks": 4, "algorithm": "medium", "perf": 2245.52, "source": "autotuned"},
{"m": 20, "n": 23, "k": 23, "tile_m": 2, "tile_n": 2, "threads": 256, "grouping": 27, "minblocks": 6, "algorithm": "medium", "perf": 2194.19, "source": "autotuned"},
{"m": 22, "n": 22, "k": 22, "tile_m": 2, "tile_n": 2, "threads": 128, "grouping": 3, "minblocks": 1, "algorithm": "medium", "perf": 2085.32, "source": "autotuned"},
{"m": 23, "n": 3, "k": 3, "tile_m": 1, "tile_n": 2, "threads": 64, "grouping": 10, "minblocks": 16, "algorithm": "medium", "perf": 399.032, "source": "autotuned"},
{"m": 23, "n": 3, "k": 23, "tile_m": 1, "tile_n": 1, "threads": 128, "grouping": 27, "minblocks": 2, "algorithm": "medium", "perf": 656.377, "source": "autotuned"},
{"m": 23, "n": 4, "k": 4, "tile_m": 1, "tile_n": 2, "threads": 64, "grouping": 7, "minblocks": 26, "algorithm": "medium", "perf": 712.481, "source": "autotuned"},
{"m": 23, "n": 4, "k": 23, "tile_m": 1, "tile_n": 1, "threads": 192, "grouping": 27, "minblocks": 1, "algorithm": "medium", "perf": 841.282, "source": "autotuned"},
{"m": 23, "n": 5, "k": 5, "tile_m": 2, "tile_n": 1, "threads": 128, "grouping": 14, "minblocks": 8, "algorithm": "medium", "perf": 943.656, "source": "autotuned"},
{"m": 23, "n": 5, "k": 23, "tile_m": 1, "tile_n": 1, "threads": 128, "grouping": 27, "minblocks": 4, "algorithm": "medium", "perf": 999.371, "source": "autotuned"},
{"m": 23, "n": 6, "k": 6, "tile_m": 1, "tile_n": 3, "threads": 192, "grouping": 17, "minblocks": 4, "algorithm": "medium", "perf": 1067.35, "source": "autotuned"},
{"m": 23, "n": 6, "k": 23, "tile_m": 1, "tile_n": 1, "threads": 192, "grouping": 3, "minblocks": 9, "algorithm": "medium", "perf": 1103.71, "source": "autotuned"},
{"m": 23, "n": 7, "k": 7, "tile_m": 3, "tile_n": 1, "threads": 192, "grouping": 17, "minblocks": 7, "algorithm": "medium", "perf": 1246.95, "source": "autotuned"},
{"m": 23, "n": 7, "k": 23, "tile_m": 1, "tile_n": 1, "threads": 192, "grouping": 27, "minblocks": 3, "algorithm": "medium", "perf": 1221.83, "source": "autotuned"},
{"m": 23, "n": 8, "k": 8, "tile_m": 3, "tile_n": 1, "threads": 192, "grouping": 16, "minblocks": 6, "algorithm": "medium", "perf": 1420.96, "source": "autotuned"},
{"m": 23, "n": 8, "k": 23, "tile_m": 1, "tile_n": 2, "threads": 256, "grouping": 4, "minblocks": 4, "algorithm": "medium", "perf": 1377.44, "source": "autotuned"},
{"m": 23, "n": 9, "k": 9, "tile_m": 2, "tile_n": 2, "threads": 256, "grouping": 20, "minblocks": 6, "algorithm": "medium", "perf": 1406.48, "source": "autotuned"},
{"m": 23, "n": 9, "k": 23, "tile_m": 2, "tile_n": 1, "threads": 320, "grouping": 27, "minblocks": 4, "algorithm": "medium", "perf": 1446.1, "source": "autotuned"},
{"m": 23, "n": 10, "k": 10, "tile_m": 2, "tile_n": 2, "threads": 256, "grouping": 23, "minblocks": 3, "algorithm": "medium", "perf": 1532.79, "source": "autotuned"},
{"m": 23, "n": 10, "k": 23, "tile_m": 1, "tile_n": 2, "threads": 256, "grouping": 5, "minblocks": 2, "algorithm": "medium", "perf": 1542.76, "source": "autotuned"},
{"m": 23, "n": 11, "k": 11, "tile_m": 3, "tile_n": 1, "threads": 256, "grouping": 27, "minblocks": 1, "algorithm": "medium", "perf": 1571.7, "source": "autotuned"},
{"m": 23, "n": 11, "k": 23, "tile_m": 3, "tile_n": 1, "threads": 256, "grouping": 4, "minblocks": 5, "algorithm": "medium", "perf": 1653.64, "source": "autotuned"},
{"m": 23, "n": 12, "k": 12, "tile_m": 3, "tile_n": 1, "threads": 320, "grouping": 27, "minblocks": 2, "algorithm": "medium", "perf": 1674.66, "source": "autotuned"},
{"m": 23, "n": 12, "k": 23, "tile_m": 2, "tile_n": 2, "threads": 192, "grouping": 27, "minblocks": 4, "algorithm": "medium", "perf": 1685.09, "source": "autotuned"},
{"m": 23, "n": 13, "k": 13, "tile_m": 3, "tile_n": 1, "threads": 256, "grouping": 27, "minblocks": 2, "algorithm": "medium", "perf": 1702.87, "source": "autotuned"},
{"m": 23, "n": 13, "k": 23, "tile_m": 3, "tile_n": 1, "threads": 192, "grouping": 3, "minblocks": 2, "algorithm": "medium", "perf": 1782.93, "source": "autotuned"},
{"m": 23, "n": 14, "k": 14, "tile_m": 3, "tile_n": 1, "threads": 384, "grouping": 27, "minblocks": 3, "algorithm": "medium", "perf": 1813.44, "source": "autotuned"},
{"m": 23, "n": 14, "k": 23, "tile_m": 3, "tile_n": 1, "w": 8, "v": 14, "threads": 128, "grouping": 16, "minblocks": 12, "algorithm": "largeDB2", "perf": 1855.17, "source": "autotuned"},
{"m": 23, "n": 15, "k": 15, "tile_m": 1, "tile_n": 2, "threads": 256, "grouping": 27, "minblocks": 3, "algorithm": "medium", "perf": 1847.69, "source": "autotuned"},
{"m": 23, "n": 15, "k": 23, "tile_m": 1, "tile_n": 3, "threads": 192, "grouping": 3, "minblocks": 1, "algorithm": "medium", "perf": 1932.88, "source": "autotuned"},
{"m": 23, "n": 16, "k": 16, "tile_m": 3, "tile_n": 1, "threads": 256, "grouping": 5, "minblocks": 4, "algorithm": "medium", "perf": 2042.72, "source": "autotuned"},
{"m": 23, "n": 16, "k": 23, "tile_m": 3, "tile_n": 1, "threads": 128, "grouping": 3, "minblocks": 1, "algorithm": "medium", "perf": 2029.55, "source": "autotuned"},
{"m": 23, "n": 17, "k": 17, "tile_m": 2, "tile_n": 2, "threads": 256, "grouping": 4, "minblocks": 7, "algorithm": "medium", "perf": 1988.76, "source": "autotuned"},
{"m": 23, "n": 17, "k": 23, "tile_m": 1, "tile_n": 4, "threads": 128, "grouping": 27, "minblocks": 2, "algorithm": "medium", "perf": 1978.55, "source": "autotuned"},
{"m": 23, "n": 18, "k": 18, "tile_m": 2, "tile_n": 2, "threads": 256, "grouping": 3, "minblocks": 8, "algorithm": "medium", "perf": 2027.47, "source": "autotuned"},
{"m": 23, "n": 18, "k": 23, "tile_m": 2, "tile_n": 2, "threads": 192, "grouping": 5, "minblocks": 2, "algorithm": "medium", "perf": 2063.18, "source": "autotuned"},
{"m": 23, "n": 19, "k": 19, "tile_m": 3, "tile_n": 1, "threads": 256, "grouping": 4, "minblocks": 8, "algorithm": "medium", "perf": 2100.91, "source": "autotuned"},
{"m": 23, "n": 19, "k": 23, "tile_m": 2, "tile_n": 2, "threads": 256, "grouping": 7, "minblocks": 3, "algorithm": "medium", "perf": 2101.92, "source": "autotuned"},
{"m": 23, "n": 20, "k": 20, "tile_m": 1, "tile_n": 4, "threads": 256, "grouping": 5, "minblocks": 5, "algorithm": "medium", "perf": 2184.23, "source": "autotuned"},
{"m": 23, "n": 20, "k": 23, "tile_m": 2, "tile_n": 2, "threads": 256, "grouping": 23, "minblocks": 6, "algorithm": "medium", "perf": 2173.16, "source": "autotuned"},
{"m": 23, "n": 23, "k": 3, "tile_m": 3, "tile_n": 1, "threads": 192, "grouping": 16, "minblocks": 9, "algorithm": "medium", "perf": 1419.22, "source": "autotuned"},
{"m": 23, "n": 23, "k": 4, "tile_m": 1, "tile_n": 3, "threads": 192, "grouping": 17, "minblocks": 8, "algorithm": "medium", "perf": 1605.96, "source": "autotuned"},
{"m": 23, "n": 23, "k": 5, "tile_m": 1, "tile_n": 3, "threads": 192, "grouping": 15, "minblocks": 1, "algorithm": "medium", "perf": 1752.18, "source": "autotuned"},
{"m": 23, "n": 23, "k": 6, "tile_m": 3, "tile_n": 1, "threads": 192, "grouping": 17, "minblocks": 2, "algorithm": "medium", "perf": 1845.93, "source": "autotuned"},
{"m": 23, "n": 23, "k": 7, "tile_m": 3, "tile_n": 1, "threads": 320, "grouping": 27, "minblocks": 6, "algorithm": "medium", "perf": 1944.44, "source": "autotuned"},
{"m": 23, "n": 23, "k": 8, "tile_m": 3, "tile_n": 1, "threads": 320, "grouping": 27, "minblocks": 2, "algorithm": "medium", "perf": 2046.73, "source": "autotuned"},
{"m": 23, "n": 23, "k": 9, "tile_m": 3, "tile_n": 1, "threads": 256, "grouping": 24, "minblocks": 6, "algorithm": "medium", "perf": 2042.53, "source": "autotuned"},
{"m": 23, "n": 23, "k": 10, "tile_m": 3, "tile_n": 1, "threads": 320, "grouping": 27, "minblocks": 1, "algorithm": "medium", "perf": 2109.63, "source": "autotuned"},
{"m": 23, "n": 23, "k": 11, "tile_m": 3, "tile_n": 1, "threads": 192, "grouping": 27, "minblocks": 5, "algorithm": "medium", "perf": 2112.83, "source": "autotuned"},
{"m": 23, "n": 23, "k": 12, "tile_m": 3, "tile_n": 1, "threads": 192, "grouping": 6, "minblocks": 5, "algorithm": "medium", "perf": 2177.15, "source": "autotuned"},
{"m": 23, "n": 23, "k": 13, "tile_m": 3, "tile_n": 1, "threads": 192, "grouping": 27, "minblocks": 3, "algorithm": "medium", "perf": 2147.5, "source": "autotuned"},
{"m": 23, "n": 23, "k": 14, "tile_m": 3, "tile_n": 1, "threads": 192, "grouping": 4, "minblocks": 1, "algorithm": "medium", "perf": 2272.49, "source": "autotuned"},
{"m": 23, "n": 23, "k": 15, "tile_m": 1, "tile_n": 3, "threads": 192, "grouping": 6, "minblocks": 5, "algorithm": "medium", "perf": 2208.95, "source": "autotuned"},
{"m": 23, "n": 23, "k": 16, "tile_m": 3, "tile_n": 1, "threads": 192, "grouping": 6, "minblocks": 1, "algorithm": "medium", "perf": 2280.07, "source": "autotuned"},
{"m": 23, "n": 23, "k": 17, "tile_m": 3, "tile_n": 1, "threads": 192, "grouping": 4, "minblocks": 7, "algorithm": "medium", "perf": 2256.47, "source": "autotuned"},
{"m": 23, "n": 23, "k": 18, "tile_m": 3, "tile_n": 1, "threads": 512, "grouping": 9, "minblocks": 1, "algorithm": "medium", "perf": 2255.32, "source": "autotuned"},
{"m": 23, "n": 23, "k": 19, "tile_m": 3, "tile_n": 1, "threads": 256, "grouping": 6, "minblocks": 3, "algorithm": "medium", "perf": 2293.72, "source": "autotuned"},
{"m": 23, "n": 23, "k": 20, "tile_m": 3, "tile_n": 1, "threads": 256, "grouping": 3, "minblocks": 5, "algorithm": "medium", "perf": 2277.62, "source": "autotuned"},
{"m": 23, "n": 23, "k": 23, "tile_m": 3, "tile_n": 1, "threads": 192, "grouping": 6, "minblocks": 4, "algorithm": "medium", "perf": 2364.81, "source": "autotuned"},
{"m": 24, "n": 24, "k": 24, "tile_m": 1, "tile_n": 4, "threads": 192, "grouping": 7, "minblocks": 5, "algorithm": "medium", "perf": 2206.75, "source": "autotuned"},
{"m": 24, "n": 24, "k": 32, "tile_m": 5, "tile_n": 1, "w": 4, "v": 24, "threads": 128, "grouping": 16, "minblocks": 8, "algorithm": "largeDB1", "perf": 2601.14, "source": "autotuned"},
{"m": 24, "n": 32, "k": 24, "tile_m": 3, "tile_n": 1, "threads": 256, "grouping": 4, "minblocks": 3, "algorithm": "medium", "perf": 2911.99, "source": "autotuned"},
{"m": 24, "n": 32, "k": 32, "tile_m": 2, "tile_n": 2, "w": 8, "v": 32, "threads": 192, "grouping": 16, "minblocks": 8, "algorithm": "largeDB2", "perf": 2922.57, "source": "autotuned"},
{"m": 29, "n": 14, "k": 32, "tile_m": 1, "tile_n": 4, "w": 4, "v": 14, "threads": 128, "grouping": 16, "minblocks": 8, "algorithm": "largeDB1", "perf": 2023.79, "source": "autotuned"},
{"m": 29, "n": 29, "k": 29, "tile_m": 4, "tile_n": 5, "w": 12, "v": 22, "threads": 64, "grouping": 16, "minblocks": 4, "algorithm": "largeDB2", "perf": 1645.23, "source": "autotuned"},
{"m": 29, "n": 29, "k": 32, "tile_m": 4, "tile_n": 5, "w": 8, "v": 20, "threads": 64, "grouping": 16, "minblocks": 4, "algorithm": "largeDB1", "perf": 1645.23, "source": "autotuned"},
{"m": 29, "n": 32, "k": 14, "tile_m": 1, "tile_n": 8, "threads": 256, "grouping": 29, "minblocks": 3, "algorithm": "medium", "perf": 2654.97, "source": "autotuned"},
{"m": 29, "n": 32, "k": 29, "tile_m": 1, "tile_n": 4, "w": 8, "v": 26, "threads": 256, "grouping": 16, "minblocks": 4, "algorithm": "largeDB2", "perf": 2651.39, "source": "autotuned"},
{"m": 29, "n": 32, "k": 32, "tile_m": 1, "tile_n": 4, "threads": 256, "grouping": 5, "minblocks": 1, "algorithm": "medium", "perf": 2928.56, "source": "autotuned"},
{"m": 32, "n": 24, "k": 24, "tile_m": 1, "tile_n": 3, "threads": 256, "grouping": 4, "minblocks": 4, "algorithm": "medium", "perf": 2938.29, "source": "autotuned"},
{"m": 32, "n": 24, "k": 32, "tile_m": 2, "tile_n": 2, "threads": 512, "grouping": 4, "minblocks": 3, "algorithm": "medium", "perf": 3074.24, "source": "autotuned"},
{"m": 32, "n": 32, "k": 14, "tile_m": 2, "tile_n": 2, "threads": 512, "grouping": 24, "minblocks": 3, "algorithm": "medium", "perf": 2921.67, "source": "autotuned"},
{"m": 32, "n": 32, "k": 24, "tile_m": 2, "tile_n": 2, "threads": 768, "grouping": 24, "minblocks": 1, "algorithm": "medium", "perf": 3163.92, "source": "autotuned"},
{"m": 32, "n": 32, "k": 29, "tile_m": 2, "tile_n": 2, "threads": 512, "grouping": 24, "minblocks": 1, "algorithm": "medium", "perf": 3227.09, "source": "autotuned"},
{"m": 32, "n": 32, "k": 32, "tile_m": 2, "tile_n": 2, "threads": 448, "grouping": 24, "minblocks": 1, "algorithm": "medium", "perf": 3209.37, "source": "autotuned"},
{"m": 72, "n": 72, "k": 72, "tile_m": 4, "tile_n": 8, "w": 8, "v": 48, "threads": 192, "grouping": 16, "minblocks": 2, "algorithm": "largeDB2", "perf": 4434.41, "source": "autotuned"},
{"m": 80, "n": 80, "k": 80, "tile_m": 2, "tile_n": 4, "w": 8, "v": 18, "threads": 832, "grouping": 16, "minblocks": 1, "algorithm": "largeDB2", "perf": 4440.8, "source": "autotuned"}
]