src/acc/libsmm_acc/parameters/parameters_H100.json
[
{"m": 4, "n": 4, "k": 4, "tile_m": 1, "tile_n": 1, "threads": 32, "grouping": 7, "minblocks": 13, "algorithm": "medium", "perf": 374.319, "source": "autotuned"},
{"m": 4, "n": 4, "k": 5, "tile_m": 1, "tile_n": 1, "threads": 32, "grouping": 8, "minblocks": 21, "algorithm": "medium", "perf": 450.325, "source": "autotuned"},
{"m": 4, "n": 4, "k": 6, "tile_m": 1, "tile_n": 1, "threads": 32, "grouping": 8, "minblocks": 3, "algorithm": "medium", "perf": 551.093, "source": "autotuned"},
{"m": 4, "n": 4, "k": 7, "tile_m": 1, "tile_n": 1, "threads": 32, "grouping": 7, "minblocks": 1, "algorithm": "medium", "perf": 607.815, "source": "autotuned"},
{"m": 4, "n": 4, "k": 8, "threads": 32, "grouping": 6, "minblocks": 1, "algorithm": "tiny", "perf": 662.818, "source": "autotuned"},
{"m": 4, "n": 4, "k": 9, "tile_m": 1, "tile_n": 1, "threads": 64, "grouping": 9, "minblocks": 10, "algorithm": "medium", "perf": 669.072, "source": "autotuned"},
{"m": 4, "n": 4, "k": 10, "threads": 64, "grouping": 7, "minblocks": 1, "algorithm": "tiny", "perf": 720.571, "source": "autotuned"},
{"m": 4, "n": 4, "k": 13, "tile_m": 1, "tile_n": 1, "threads": 64, "grouping": 4, "minblocks": 27, "algorithm": "medium", "perf": 873.794, "source": "autotuned"},
{"m": 4, "n": 4, "k": 15, "threads": 32, "grouping": 4, "minblocks": 1, "algorithm": "tiny", "perf": 978.746, "source": "autotuned"},
{"m": 4, "n": 4, "k": 16, "threads": 32, "grouping": 4, "minblocks": 1, "algorithm": "tiny", "perf": 1018.3, "source": "autotuned"},
{"m": 4, "n": 4, "k": 22, "tile_m": 1, "tile_n": 1, "threads": 32, "grouping": 2, "minblocks": 1, "algorithm": "small", "perf": 1210.71, "source": "autotuned"},
{"m": 4, "n": 4, "k": 23, "tile_m": 1, "tile_n": 1, "threads": 32, "grouping": 2, "minblocks": 13, "algorithm": "small", "perf": 1261.58, "source": "autotuned"},
{"m": 4, "n": 4, "k": 25, "tile_m": 1, "tile_n": 1, "threads": 96, "grouping": 8, "minblocks": 18, "algorithm": "small", "perf": 1143.85, "source": "autotuned"},
{"m": 4, "n": 4, "k": 26, "tile_m": 1, "tile_n": 1, "threads": 64, "grouping": 2, "minblocks": 1, "algorithm": "small", "perf": 1169.45, "source": "autotuned"},
{"m": 4, "n": 4, "k": 28, "tile_m": 1, "tile_n": 1, "threads": 32, "grouping": 2, "minblocks": 1, "algorithm": "small", "perf": 1239.73, "source": "autotuned"},
{"m": 4, "n": 4, "k": 32, "tile_m": 1, "tile_n": 1, "threads": 32, "grouping": 2, "minblocks": 6, "algorithm": "small", "perf": 1452.59, "source": "autotuned"},
{"m": 4, "n": 4, "k": 45, "tile_m": 1, "tile_n": 1, "threads": 32, "grouping": 2, "minblocks": 12, "algorithm": "medium", "perf": 1414.16, "source": "autotuned"},
{"m": 4, "n": 5, "k": 4, "tile_m": 1, "tile_n": 1, "threads": 32, "grouping": 8, "minblocks": 14, "algorithm": "medium", "perf": 460.134, "source": "autotuned"},
{"m": 4, "n": 5, "k": 5, "tile_m": 1, "tile_n": 1, "threads": 32, "grouping": 8, "minblocks": 13, "algorithm": "medium", "perf": 564.995, "source": "autotuned"},
{"m": 4, "n": 5, "k": 6, "tile_m": 2, "tile_n": 1, "threads": 32, "grouping": 8, "minblocks": 8, "algorithm": "medium", "perf": 665.169, "source": "autotuned"},
{"m": 4, "n": 5, "k": 7, "tile_m": 1, "tile_n": 1, "threads": 64, "grouping": 9, "minblocks": 11, "algorithm": "medium", "perf": 685.809, "source": "autotuned"},
{"m": 4, "n": 5, "k": 8, "tile_m": 1, "tile_n": 1, "threads": 64, "grouping": 9, "minblocks": 22, "algorithm": "medium", "perf": 758.531, "source": "autotuned"},
{"m": 4, "n": 5, "k": 9, "tile_m": 1, "tile_n": 1, "threads": 64, "grouping": 9, "minblocks": 8, "algorithm": "medium", "perf": 821.685, "source": "autotuned"},
{"m": 4, "n": 5, "k": 10, "tile_m": 1, "tile_n": 1, "threads": 64, "grouping": 9, "minblocks": 27, "algorithm": "medium", "perf": 885.359, "source": "autotuned"},
{"m": 4, "n": 5, "k": 13, "tile_m": 2, "tile_n": 1, "threads": 96, "grouping": 8, "minblocks": 15, "algorithm": "medium", "perf": 1013.14, "source": "autotuned"},
{"m": 4, "n": 5, "k": 15, "tile_m": 2, "tile_n": 1, "threads": 96, "grouping": 8, "minblocks": 14, "algorithm": "medium", "perf": 1132.32, "source": "autotuned"},
{"m": 4, "n": 5, "k": 16, "tile_m": 2, "tile_n": 1, "threads": 96, "grouping": 8, "minblocks": 15, "algorithm": "medium", "perf": 1196.81, "source": "autotuned"},
{"m": 4, "n": 5, "k": 22, "tile_m": 2, "tile_n": 1, "threads": 128, "grouping": 8, "minblocks": 16, "algorithm": "medium", "perf": 1317.35, "source": "autotuned"},
{"m": 4, "n": 5, "k": 23, "tile_m": 2, "tile_n": 1, "threads": 128, "grouping": 8, "minblocks": 14, "algorithm": "medium", "perf": 1345.3, "source": "autotuned"},
{"m": 4, "n": 5, "k": 25, "tile_m": 2, "tile_n": 1, "threads": 128, "grouping": 8, "minblocks": 16, "algorithm": "medium", "perf": 1386.4, "source": "autotuned"},
{"m": 4, "n": 5, "k": 26, "tile_m": 1, "tile_n": 1, "threads": 160, "grouping": 11, "minblocks": 12, "algorithm": "medium", "perf": 1280.93, "source": "autotuned"},
{"m": 4, "n": 5, "k": 28, "tile_m": 2, "tile_n": 1, "threads": 160, "grouping": 16, "minblocks": 8, "algorithm": "medium", "perf": 1349.23, "source": "autotuned"},
{"m": 4, "n": 5, "k": 32, "tile_m": 2, "tile_n": 1, "threads": 32, "grouping": 8, "minblocks": 12, "algorithm": "medium", "perf": 1432.38, "source": "autotuned"},
{"m": 4, "n": 5, "k": 45, "tile_m": 2, "tile_n": 1, "threads": 32, "grouping": 8, "minblocks": 19, "algorithm": "medium", "perf": 1565.29, "source": "autotuned"},
{"m": 4, "n": 6, "k": 4, "tile_m": 1, "tile_n": 1, "threads": 32, "grouping": 7, "minblocks": 16, "algorithm": "medium", "perf": 549.322, "source": "autotuned"},
{"m": 4, "n": 6, "k": 5, "tile_m": 2, "tile_n": 1, "threads": 32, "grouping": 8, "minblocks": 14, "algorithm": "medium", "perf": 673.458, "source": "autotuned"},
{"m": 4, "n": 6, "k": 6, "tile_m": 1, "tile_n": 1, "threads": 64, "grouping": 9, "minblocks": 7, "algorithm": "medium", "perf": 729.041, "source": "autotuned"},
{"m": 4, "n": 6, "k": 7, "tile_m": 1, "tile_n": 1, "threads": 64, "grouping": 8, "minblocks": 27, "algorithm": "medium", "perf": 813.281, "source": "autotuned"},
{"m": 4, "n": 6, "k": 8, "tile_m": 1, "tile_n": 1, "threads": 64, "grouping": 9, "minblocks": 23, "algorithm": "medium", "perf": 910.635, "source": "autotuned"},
{"m": 4, "n": 6, "k": 9, "tile_m": 1, "tile_n": 1, "threads": 64, "grouping": 9, "minblocks": 18, "algorithm": "medium", "perf": 973.739, "source": "autotuned"},
{"m": 4, "n": 6, "k": 10, "tile_m": 1, "tile_n": 1, "threads": 64, "grouping": 9, "minblocks": 25, "algorithm": "medium", "perf": 1053.32, "source": "autotuned"},
{"m": 4, "n": 6, "k": 13, "tile_m": 2, "tile_n": 1, "threads": 96, "grouping": 8, "minblocks": 16, "algorithm": "medium", "perf": 1195.43, "source": "autotuned"},
{"m": 4, "n": 6, "k": 15, "tile_m": 2, "tile_n": 1, "threads": 96, "grouping": 8, "minblocks": 16, "algorithm": "medium", "perf": 1340.32, "source": "autotuned"},
{"m": 4, "n": 6, "k": 22, "tile_m": 2, "tile_n": 1, "threads": 32, "grouping": 5, "minblocks": 27, "algorithm": "medium", "perf": 1411.88, "source": "autotuned"},
{"m": 4, "n": 6, "k": 26, "tile_m": 2, "tile_n": 1, "threads": 32, "grouping": 5, "minblocks": 27, "algorithm": "medium", "perf": 1534.4, "source": "autotuned"},
{"m": 4, "n": 6, "k": 32, "tile_m": 2, "tile_n": 1, "threads": 32, "grouping": 8, "minblocks": 15, "algorithm": "medium", "perf": 1654.58, "source": "autotuned"},
{"m": 4, "n": 6, "k": 45, "tile_m": 2, "tile_n": 1, "w": 16, "v": 6, "threads": 32, "grouping": 16, "minblocks": 4, "algorithm": "largeDB2", "perf": 1936.72, "source": "autotuned"},
{"m": 4, "n": 7, "k": 4, "tile_m": 1, "tile_n": 1, "threads": 32, "grouping": 7, "minblocks": 20, "algorithm": "medium", "perf": 645.517, "source": "autotuned"},
{"m": 4, "n": 7, "k": 5, "tile_m": 1, "tile_n": 1, "threads": 64, "grouping": 8, "minblocks": 8, "algorithm": "medium", "perf": 752.878, "source": "autotuned"},
{"m": 4, "n": 7, "k": 6, "tile_m": 1, "tile_n": 1, "threads": 64, "grouping": 8, "minblocks": 8, "algorithm": "medium", "perf": 851.831, "source": "autotuned"},
{"m": 4, "n": 7, "k": 7, "tile_m": 1, "tile_n": 1, "threads": 64, "grouping": 8, "minblocks": 8, "algorithm": "medium", "perf": 966.272, "source": "autotuned"},
{"m": 4, "n": 7, "k": 8, "tile_m": 1, "tile_n": 1, "threads": 64, "grouping": 9, "minblocks": 27, "algorithm": "medium", "perf": 1051.7, "source": "autotuned"},
{"m": 4, "n": 7, "k": 9, "tile_m": 1, "tile_n": 1, "threads": 64, "grouping": 8, "minblocks": 8, "algorithm": "medium", "perf": 1151.26, "source": "autotuned"},
{"m": 4, "n": 7, "k": 10, "tile_m": 2, "tile_n": 1, "threads": 96, "grouping": 8, "minblocks": 16, "algorithm": "medium", "perf": 1164.05, "source": "autotuned"},
{"m": 4, "n": 7, "k": 13, "tile_m": 2, "tile_n": 1, "threads": 96, "grouping": 8, "minblocks": 20, "algorithm": "medium", "perf": 1369.76, "source": "autotuned"},
{"m": 4, "n": 7, "k": 15, "tile_m": 2, "tile_n": 1, "threads": 128, "grouping": 8, "minblocks": 15, "algorithm": "medium", "perf": 1397.07, "source": "autotuned"},
{"m": 4, "n": 7, "k": 22, "tile_m": 2, "tile_n": 1, "threads": 32, "grouping": 5, "minblocks": 27, "algorithm": "medium", "perf": 1650.44, "source": "autotuned"},
{"m": 4, "n": 7, "k": 25, "tile_m": 2, "tile_n": 1, "threads": 32, "grouping": 5, "minblocks": 27, "algorithm": "medium", "perf": 1671.4, "source": "autotuned"},
{"m": 4, "n": 7, "k": 26, "tile_m": 2, "tile_n": 1, "threads": 32, "grouping": 5, "minblocks": 26, "algorithm": "medium", "perf": 1726.14, "source": "autotuned"},
{"m": 4, "n": 7, "k": 28, "tile_m": 2, "tile_n": 1, "threads": 32, "grouping": 8, "minblocks": 16, "algorithm": "medium", "perf": 1744.58, "source": "autotuned"},
{"m": 4, "n": 7, "k": 32, "tile_m": 2, "tile_n": 1, "threads": 32, "grouping": 8, "minblocks": 10, "algorithm": "medium", "perf": 1877.78, "source": "autotuned"},
{"m": 4, "n": 7, "k": 45, "tile_m": 2, "tile_n": 1, "w": 16, "v": 4, "threads": 32, "grouping": 16, "minblocks": 1, "algorithm": "largeDB2", "perf": 2127.85, "source": "autotuned"},
{"m": 4, "n": 8, "k": 4, "tile_m": 1, "tile_n": 1, "threads": 32, "grouping": 6, "minblocks": 16, "algorithm": "medium", "perf": 591.198, "source": "autotuned"},
{"m": 4, "n": 8, "k": 5, "tile_m": 1, "tile_n": 1, "threads": 64, "grouping": 9, "minblocks": 2, "algorithm": "medium", "perf": 835.546, "source": "autotuned"},
{"m": 4, "n": 8, "k": 6, "tile_m": 1, "tile_n": 1, "threads": 64, "grouping": 9, "minblocks": 1, "algorithm": "medium", "perf": 971.585, "source": "autotuned"},
{"m": 4, "n": 8, "k": 7, "tile_m": 1, "tile_n": 1, "threads": 64, "grouping": 6, "minblocks": 16, "algorithm": "medium", "perf": 1100.84, "source": "autotuned"},
{"m": 4, "n": 8, "k": 8, "tile_m": 1, "tile_n": 1, "threads": 64, "grouping": 6, "minblocks": 8, "algorithm": "small", "perf": 1029.21, "source": "autotuned"},
{"m": 4, "n": 8, "k": 9, "tile_m": 2, "tile_n": 1, "threads": 96, "grouping": 8, "minblocks": 14, "algorithm": "medium", "perf": 1234.34, "source": "autotuned"},
{"m": 4, "n": 8, "k": 10, "tile_m": 2, "tile_n": 1, "threads": 96, "grouping": 8, "minblocks": 16, "algorithm": "medium", "perf": 1330.48, "source": "autotuned"},
{"m": 4, "n": 8, "k": 13, "tile_m": 2, "tile_n": 1, "threads": 128, "grouping": 8, "minblocks": 14, "algorithm": "medium", "perf": 1461.13, "source": "autotuned"},
{"m": 4, "n": 8, "k": 15, "tile_m": 2, "tile_n": 1, "threads": 128, "grouping": 8, "minblocks": 14, "algorithm": "medium", "perf": 1593.96, "source": "autotuned"},
{"m": 4, "n": 8, "k": 22, "tile_m": 1, "tile_n": 1, "threads": 96, "grouping": 6, "minblocks": 18, "algorithm": "medium", "perf": 1830.82, "source": "autotuned"},
{"m": 4, "n": 8, "k": 26, "tile_m": 2, "tile_n": 1, "threads": 32, "grouping": 8, "minblocks": 5, "algorithm": "medium", "perf": 1921.19, "source": "autotuned"},
{"m": 4, "n": 8, "k": 32, "tile_m": 2, "tile_n": 1, "w": 12, "v": 8, "threads": 32, "grouping": 16, "minblocks": 2, "algorithm": "largeDB2", "perf": 2194.19, "source": "autotuned"},
{"m": 4, "n": 8, "k": 45, "tile_m": 2, "tile_n": 1, "threads": 32, "grouping": 8, "minblocks": 13, "algorithm": "medium", "perf": 2284.62, "source": "autotuned"},
{"m": 4, "n": 9, "k": 4, "tile_m": 2, "tile_n": 1, "threads": 64, "grouping": 9, "minblocks": 7, "algorithm": "medium", "perf": 744.777, "source": "autotuned"},
{"m": 4, "n": 9, "k": 5, "tile_m": 2, "tile_n": 1, "threads": 64, "grouping": 9, "minblocks": 7, "algorithm": "medium", "perf": 876.774, "source": "autotuned"},
{"m": 4, "n": 9, "k": 6, "tile_m": 2, "tile_n": 1, "threads": 64, "grouping": 9, "minblocks": 1, "algorithm": "medium", "perf": 1032.0, "source": "autotuned"},
{"m": 4, "n": 9, "k": 7, "tile_m": 2, "tile_n": 1, "threads": 64, "grouping": 9, "minblocks": 12, "algorithm": "medium", "perf": 1158.38, "source": "autotuned"},
{"m": 4, "n": 9, "k": 8, "tile_m": 2, "tile_n": 1, "threads": 96, "grouping": 12, "minblocks": 7, "algorithm": "medium", "perf": 1189.54, "source": "autotuned"},
{"m": 4, "n": 9, "k": 9, "tile_m": 2, "tile_n": 1, "threads": 96, "grouping": 8, "minblocks": 18, "algorithm": "medium", "perf": 1289.21, "source": "autotuned"},
{"m": 4, "n": 9, "k": 10, "tile_m": 2, "tile_n": 1, "threads": 96, "grouping": 8, "minblocks": 14, "algorithm": "medium", "perf": 1407.5, "source": "autotuned"},
{"m": 4, "n": 9, "k": 13, "tile_m": 2, "tile_n": 1, "threads": 128, "grouping": 8, "minblocks": 14, "algorithm": "medium", "perf": 1529.7, "source": "autotuned"},
{"m": 4, "n": 9, "k": 15, "tile_m": 2, "tile_n": 1, "threads": 32, "grouping": 5, "minblocks": 27, "algorithm": "medium", "perf": 1596.49, "source": "autotuned"},
{"m": 4, "n": 9, "k": 16, "tile_m": 2, "tile_n": 1, "threads": 32, "grouping": 5, "minblocks": 25, "algorithm": "medium", "perf": 1645.56, "source": "autotuned"},
{"m": 4, "n": 9, "k": 22, "tile_m": 2, "tile_n": 1, "threads": 96, "grouping": 8, "minblocks": 14, "algorithm": "medium", "perf": 1853.64, "source": "autotuned"},
{"m": 4, "n": 9, "k": 23, "tile_m": 2, "tile_n": 1, "threads": 96, "grouping": 8, "minblocks": 15, "algorithm": "medium", "perf": 1910.78, "source": "autotuned"},
{"m": 4, "n": 9, "k": 25, "tile_m": 2, "tile_n": 1, "threads": 32, "grouping": 8, "minblocks": 17, "algorithm": "medium", "perf": 1934.81, "source": "autotuned"},
{"m": 4, "n": 9, "k": 26, "tile_m": 2, "tile_n": 1, "threads": 32, "grouping": 8, "minblocks": 17, "algorithm": "medium", "perf": 1963.83, "source": "autotuned"},
{"m": 4, "n": 9, "k": 28, "tile_m": 2, "tile_n": 1, "w": 12, "v": 6, "threads": 32, "grouping": 16, "minblocks": 2, "algorithm": "largeDB2", "perf": 2064.46, "source": "autotuned"},
{"m": 4, "n": 9, "k": 32, "tile_m": 2, "tile_n": 1, "threads": 32, "grouping": 8, "minblocks": 14, "algorithm": "medium", "perf": 2211.4, "source": "autotuned"},
{"m": 4, "n": 9, "k": 45, "tile_m": 2, "tile_n": 1, "threads": 32, "grouping": 8, "minblocks": 9, "algorithm": "medium", "perf": 2282.4, "source": "autotuned"},
{"m": 4, "n": 10, "k": 4, "tile_m": 2, "tile_n": 1, "threads": 64, "grouping": 8, "minblocks": 5, "algorithm": "medium", "perf": 829.44, "source": "autotuned"},
{"m": 4, "n": 10, "k": 5, "tile_m": 2, "tile_n": 1, "threads": 64, "grouping": 9, "minblocks": 4, "algorithm": "medium", "perf": 992.151, "source": "autotuned"},
{"m": 4, "n": 10, "k": 6, "tile_m": 2, "tile_n": 1, "threads": 64, "grouping": 9, "minblocks": 2, "algorithm": "medium", "perf": 1159.14, "source": "autotuned"},
{"m": 4, "n": 10, "k": 7, "tile_m": 2, "tile_n": 1, "threads": 96, "grouping": 8, "minblocks": 14, "algorithm": "medium", "perf": 1208.58, "source": "autotuned"},
{"m": 4, "n": 10, "k": 8, "tile_m": 2, "tile_n": 1, "threads": 96, "grouping": 8, "minblocks": 21, "algorithm": "medium", "perf": 1326.38, "source": "autotuned"},
{"m": 4, "n": 10, "k": 9, "tile_m": 2, "tile_n": 1, "threads": 96, "grouping": 8, "minblocks": 14, "algorithm": "medium", "perf": 1425.19, "source": "autotuned"},
{"m": 4, "n": 10, "k": 10, "tile_m": 2, "tile_n": 1, "threads": 128, "grouping": 8, "minblocks": 16, "algorithm": "medium", "perf": 1423.61, "source": "autotuned"},
{"m": 4, "n": 10, "k": 13, "tile_m": 2, "tile_n": 1, "threads": 32, "grouping": 5, "minblocks": 27, "algorithm": "medium", "perf": 1603.58, "source": "autotuned"},
{"m": 4, "n": 10, "k": 15, "tile_m": 2, "tile_n": 1, "threads": 32, "grouping": 5, "minblocks": 26, "algorithm": "medium", "perf": 1756.73, "source": "autotuned"},
{"m": 4, "n": 10, "k": 22, "tile_m": 2, "tile_n": 1, "threads": 96, "grouping": 8, "minblocks": 16, "algorithm": "medium", "perf": 2062.22, "source": "autotuned"},
{"m": 4, "n": 10, "k": 26, "tile_m": 2, "tile_n": 1, "w": 10, "v": 10, "threads": 32, "grouping": 16, "minblocks": 2, "algorithm": "largeDB2", "perf": 2206.03, "source": "autotuned"},
{"m": 4, "n": 10, "k": 32, "tile_m": 2, "tile_n": 1, "w": 12, "v": 10, "threads": 32, "grouping": 16, "minblocks": 1, "algorithm": "largeDB2", "perf": 2448.7, "source": "autotuned"},
{"m": 4, "n": 10, "k": 45, "tile_m": 2, "tile_n": 1, "w": 22, "v": 10, "threads": 32, "grouping": 16, "minblocks": 4, "algorithm": "largeDB2", "perf": 2448.08, "source": "autotuned"},
{"m": 4, "n": 13, "k": 4, "tile_m": 2, "tile_n": 1, "threads": 64, "grouping": 8, "minblocks": 8, "algorithm": "medium", "perf": 1070.38, "source": "autotuned"},
{"m": 4, "n": 13, "k": 5, "tile_m": 2, "tile_n": 1, "threads": 96, "grouping": 8, "minblocks": 15, "algorithm": "medium", "perf": 1175.73, "source": "autotuned"},
{"m": 4, "n": 13, "k": 6, "tile_m": 2, "tile_n": 1, "threads": 96, "grouping": 8, "minblocks": 14, "algorithm": "medium", "perf": 1378.07, "source": "autotuned"},
{"m": 4, "n": 13, "k": 7, "tile_m": 2, "tile_n": 1, "threads": 96, "grouping": 8, "minblocks": 16, "algorithm": "medium", "perf": 1536.92, "source": "autotuned"},
{"m": 4, "n": 13, "k": 8, "tile_m": 2, "tile_n": 1, "threads": 128, "grouping": 8, "minblocks": 14, "algorithm": "medium", "perf": 1546.38, "source": "autotuned"},
{"m": 4, "n": 13, "k": 9, "tile_m": 2, "tile_n": 1, "threads": 128, "grouping": 8, "minblocks": 13, "algorithm": "medium", "perf": 1675.4, "source": "autotuned"},
{"m": 4, "n": 13, "k": 10, "tile_m": 2, "tile_n": 1, "threads": 32, "grouping": 5, "minblocks": 24, "algorithm": "medium", "perf": 1682.24, "source": "autotuned"},
{"m": 4, "n": 13, "k": 13, "tile_m": 2, "tile_n": 1, "threads": 64, "grouping": 9, "minblocks": 20, "algorithm": "medium", "perf": 2008.88, "source": "autotuned"},
{"m": 4, "n": 13, "k": 15, "tile_m": 2, "tile_n": 1, "threads": 64, "grouping": 9, "minblocks": 16, "algorithm": "medium", "perf": 2094.97, "source": "autotuned"},
{"m": 4, "n": 13, "k": 16, "tile_m": 2, "tile_n": 1, "threads": 32, "grouping": 5, "minblocks": 26, "algorithm": "medium", "perf": 2184.41, "source": "autotuned"},
{"m": 4, "n": 13, "k": 22, "tile_m": 2, "tile_n": 1, "threads": 96, "grouping": 8, "minblocks": 16, "algorithm": "medium", "perf": 2589.63, "source": "autotuned"},
{"m": 4, "n": 13, "k": 23, "tile_m": 2, "tile_n": 1, "threads": 32, "grouping": 8, "minblocks": 16, "algorithm": "medium", "perf": 2538.99, "source": "autotuned"},
{"m": 4, "n": 13, "k": 25, "tile_m": 2, "tile_n": 1, "threads": 32, "grouping": 8, "minblocks": 18, "algorithm": "medium", "perf": 2587.59, "source": "autotuned"},
{"m": 4, "n": 13, "k": 26, "tile_m": 2, "tile_n": 1, "threads": 32, "grouping": 8, "minblocks": 17, "algorithm": "medium", "perf": 2650.08, "source": "autotuned"},
{"m": 4, "n": 13, "k": 28, "tile_m": 2, "tile_n": 1, "threads": 32, "grouping": 8, "minblocks": 16, "algorithm": "medium", "perf": 2729.36, "source": "autotuned"},
{"m": 4, "n": 13, "k": 32, "tile_m": 2, "tile_n": 1, "threads": 32, "grouping": 8, "minblocks": 9, "algorithm": "medium", "perf": 2848.12, "source": "autotuned"},
{"m": 4, "n": 13, "k": 45, "tile_m": 2, "tile_n": 1, "threads": 32, "grouping": 8, "minblocks": 9, "algorithm": "medium", "perf": 3044.66, "source": "autotuned"},
{"m": 4, "n": 15, "k": 4, "tile_m": 2, "tile_n": 1, "threads": 64, "grouping": 9, "minblocks": 2, "algorithm": "medium", "perf": 1230.67, "source": "autotuned"},
{"m": 4, "n": 15, "k": 5, "tile_m": 2, "tile_n": 1, "threads": 96, "grouping": 8, "minblocks": 16, "algorithm": "medium", "perf": 1345.56, "source": "autotuned"},
{"m": 4, "n": 15, "k": 6, "tile_m": 2, "tile_n": 1, "threads": 96, "grouping": 8, "minblocks": 16, "algorithm": "medium", "perf": 1572.75, "source": "autotuned"},
{"m": 4, "n": 15, "k": 7, "tile_m": 2, "tile_n": 1, "threads": 32, "grouping": 6, "minblocks": 24, "algorithm": "medium", "perf": 1639.15, "source": "autotuned"},
{"m": 4, "n": 15, "k": 8, "tile_m": 2, "tile_n": 1, "threads": 128, "grouping": 8, "minblocks": 15, "algorithm": "medium", "perf": 1776.81, "source": "autotuned"},
{"m": 4, "n": 15, "k": 9, "tile_m": 2, "tile_n": 1, "threads": 64, "grouping": 9, "minblocks": 1, "algorithm": "medium", "perf": 1793.29, "source": "autotuned"},
{"m": 4, "n": 15, "k": 10, "tile_m": 2, "tile_n": 1, "threads": 64, "grouping": 8, "minblocks": 19, "algorithm": "medium", "perf": 1937.34, "source": "autotuned"},
{"m": 4, "n": 15, "k": 13, "tile_m": 2, "tile_n": 1, "threads": 64, "grouping": 9, "minblocks": 19, "algorithm": "medium", "perf": 2200.58, "source": "autotuned"},
{"m": 4, "n": 15, "k": 15, "tile_m": 2, "tile_n": 1, "threads": 64, "grouping": 9, "minblocks": 20, "algorithm": "medium", "perf": 2423.12, "source": "autotuned"},
{"m": 4, "n": 15, "k": 16, "tile_m": 2, "tile_n": 1, "threads": 96, "grouping": 8, "minblocks": 15, "algorithm": "medium", "perf": 2458.43, "source": "autotuned"},
{"m": 4, "n": 15, "k": 22, "tile_m": 2, "tile_n": 1, "threads": 32, "grouping": 8, "minblocks": 16, "algorithm": "medium", "perf": 2751.5, "source": "autotuned"},
{"m": 4, "n": 15, "k": 25, "tile_m": 2, "tile_n": 1, "threads": 32, "grouping": 8, "minblocks": 14, "algorithm": "medium", "perf": 2883.44, "source": "autotuned"},
{"m": 4, "n": 15, "k": 26, "tile_m": 2, "tile_n": 1, "threads": 32, "grouping": 8, "minblocks": 2, "algorithm": "medium", "perf": 2891.13, "source": "autotuned"},
{"m": 4, "n": 15, "k": 45, "tile_m": 2, "tile_n": 1, "threads": 32, "grouping": 8, "minblocks": 8, "algorithm": "medium", "perf": 3282.7, "source": "autotuned"},
{"m": 4, "n": 16, "k": 4, "tile_m": 2, "tile_n": 1, "threads": 32, "grouping": 5, "minblocks": 1, "algorithm": "medium", "perf": 1102.31, "source": "autotuned"},
{"m": 4, "n": 16, "k": 5, "tile_m": 2, "tile_n": 1, "threads": 96, "grouping": 8, "minblocks": 16, "algorithm": "medium", "perf": 1466.62, "source": "autotuned"},
{"m": 4, "n": 16, "k": 9, "tile_m": 2, "tile_n": 1, "threads": 64, "grouping": 9, "minblocks": 2, "algorithm": "medium", "perf": 1953.78, "source": "autotuned"},
{"m": 4, "n": 16, "k": 13, "tile_m": 2, "tile_n": 1, "threads": 64, "grouping": 9, "minblocks": 20, "algorithm": "medium", "perf": 2398.44, "source": "autotuned"},
{"m": 4, "n": 16, "k": 15, "tile_m": 2, "tile_n": 1, "threads": 64, "grouping": 9, "minblocks": 20, "algorithm": "medium", "perf": 2588.95, "source": "autotuned"},
{"m": 4, "n": 16, "k": 16, "tile_m": 2, "tile_n": 1, "threads": 96, "grouping": 8, "minblocks": 15, "algorithm": "medium", "perf": 2665.19, "source": "autotuned"},
{"m": 4, "n": 16, "k": 22, "tile_m": 2, "tile_n": 1, "w": 8, "v": 16, "threads": 32, "grouping": 16, "minblocks": 12, "algorithm": "largeDB2", "perf": 3063.49, "source": "autotuned"},
{"m": 4, "n": 16, "k": 25, "tile_m": 2, "tile_n": 1, "w": 12, "v": 16, "threads": 32, "grouping": 16, "minblocks": 2, "algorithm": "largeDB2", "perf": 3021.44, "source": "autotuned"},
{"m": 4, "n": 16, "k": 26, "tile_m": 2, "tile_n": 1, "w": 10, "v": 16, "threads": 32, "grouping": 16, "minblocks": 12, "algorithm": "largeDB2", "perf": 3130.48, "source": "autotuned"},
{"m": 4, "n": 16, "k": 45, "tile_m": 2, "tile_n": 1, "threads": 32, "grouping": 8, "minblocks": 1, "algorithm": "medium", "perf": 3473.06, "source": "autotuned"},
{"m": 4, "n": 22, "k": 4, "tile_m": 1, "tile_n": 3, "threads": 96, "grouping": 8, "minblocks": 14, "algorithm": "medium", "perf": 1504.19, "source": "autotuned"},
{"m": 4, "n": 22, "k": 5, "tile_m": 1, "tile_n": 3, "threads": 32, "grouping": 7, "minblocks": 17, "algorithm": "medium", "perf": 1694.47, "source": "autotuned"},
{"m": 4, "n": 22, "k": 6, "tile_m": 1, "tile_n": 3, "threads": 32, "grouping": 7, "minblocks": 10, "algorithm": "medium", "perf": 1905.24, "source": "autotuned"},
{"m": 4, "n": 22, "k": 7, "tile_m": 2, "tile_n": 2, "threads": 32, "grouping": 8, "minblocks": 15, "algorithm": "medium", "perf": 2149.26, "source": "autotuned"},
{"m": 4, "n": 22, "k": 8, "tile_m": 2, "tile_n": 1, "threads": 64, "grouping": 9, "minblocks": 19, "algorithm": "medium", "perf": 2214.12, "source": "autotuned"},
{"m": 4, "n": 22, "k": 9, "tile_m": 2, "tile_n": 1, "threads": 64, "grouping": 9, "minblocks": 19, "algorithm": "medium", "perf": 2203.54, "source": "autotuned"},
{"m": 4, "n": 22, "k": 10, "tile_m": 2, "tile_n": 2, "threads": 32, "grouping": 5, "minblocks": 26, "algorithm": "medium", "perf": 2349.64, "source": "autotuned"},
{"m": 4, "n": 22, "k": 13, "tile_m": 2, "tile_n": 2, "threads": 96, "grouping": 8, "minblocks": 16, "algorithm": "medium", "perf": 2692.61, "source": "autotuned"},
{"m": 4, "n": 22, "k": 15, "tile_m": 2, "tile_n": 2, "threads": 32, "grouping": 8, "minblocks": 15, "algorithm": "medium", "perf": 2858.04, "source": "autotuned"},
{"m": 4, "n": 22, "k": 16, "tile_m": 2, "tile_n": 2, "threads": 32, "grouping": 8, "minblocks": 14, "algorithm": "medium", "perf": 3039.53, "source": "autotuned"},
{"m": 4, "n": 22, "k": 22, "tile_m": 2, "tile_n": 2, "threads": 32, "grouping": 8, "minblocks": 8, "algorithm": "medium", "perf": 3188.7, "source": "autotuned"},
{"m": 4, "n": 22, "k": 23, "tile_m": 2, "tile_n": 2, "threads": 32, "grouping": 8, "minblocks": 11, "algorithm": "medium", "perf": 3230.8, "source": "autotuned"},
{"m": 4, "n": 22, "k": 25, "tile_m": 2, "tile_n": 2, "threads": 32, "grouping": 8, "minblocks": 3, "algorithm": "medium", "perf": 3221.15, "source": "autotuned"},
{"m": 4, "n": 22, "k": 26, "tile_m": 1, "tile_n": 3, "threads": 32, "grouping": 8, "minblocks": 9, "algorithm": "medium", "perf": 3009.88, "source": "autotuned"},
{"m": 4, "n": 22, "k": 32, "tile_m": 2, "tile_n": 2, "threads": 32, "grouping": 12, "minblocks": 6, "algorithm": "medium", "perf": 3510.13, "source": "autotuned"},
{"m": 4, "n": 22, "k": 45, "tile_m": 2, "tile_n": 2, "threads": 32, "grouping": 12, "minblocks": 2, "algorithm": "medium", "perf": 3543.15, "source": "autotuned"},
{"m": 4, "n": 23, "k": 4, "tile_m": 2, "tile_n": 1, "threads": 96, "grouping": 8, "minblocks": 17, "algorithm": "medium", "perf": 1567.86, "source": "autotuned"},
{"m": 4, "n": 23, "k": 5, "tile_m": 1, "tile_n": 3, "threads": 32, "grouping": 6, "minblocks": 9, "algorithm": "medium", "perf": 1737.36, "source": "autotuned"},
{"m": 4, "n": 23, "k": 13, "tile_m": 2, "tile_n": 1, "threads": 64, "grouping": 8, "minblocks": 21, "algorithm": "medium", "perf": 2696.97, "source": "autotuned"},
{"m": 4, "n": 23, "k": 22, "tile_m": 2, "tile_n": 2, "threads": 32, "grouping": 8, "minblocks": 8, "algorithm": "medium", "perf": 3083.2, "source": "autotuned"},
{"m": 4, "n": 23, "k": 23, "tile_m": 2, "tile_n": 2, "threads": 32, "grouping": 8, "minblocks": 3, "algorithm": "medium", "perf": 3081.02, "source": "autotuned"},
{"m": 4, "n": 23, "k": 26, "tile_m": 2, "tile_n": 2, "threads": 32, "grouping": 8, "minblocks": 10, "algorithm": "medium", "perf": 3348.37, "source": "autotuned"},
{"m": 4, "n": 25, "k": 4, "tile_m": 2, "tile_n": 3, "threads": 32, "grouping": 5, "minblocks": 25, "algorithm": "medium", "perf": 1508.44, "source": "autotuned"},
{"m": 4, "n": 25, "k": 5, "tile_m": 2, "tile_n": 2, "threads": 32, "grouping": 8, "minblocks": 15, "algorithm": "medium", "perf": 1781.44, "source": "autotuned"},
{"m": 4, "n": 25, "k": 7, "tile_m": 2, "tile_n": 2, "threads": 32, "grouping": 8, "minblocks": 14, "algorithm": "medium", "perf": 2197.88, "source": "autotuned"},
{"m": 4, "n": 25, "k": 9, "tile_m": 2, "tile_n": 1, "threads": 64, "grouping": 9, "minblocks": 19, "algorithm": "medium", "perf": 2360.08, "source": "autotuned"},
{"m": 4, "n": 25, "k": 13, "tile_m": 2, "tile_n": 2, "threads": 32, "grouping": 8, "minblocks": 19, "algorithm": "medium", "perf": 2740.9, "source": "autotuned"},
{"m": 4, "n": 25, "k": 15, "tile_m": 2, "tile_n": 2, "threads": 32, "grouping": 8, "minblocks": 17, "algorithm": "medium", "perf": 2933.47, "source": "autotuned"},
{"m": 4, "n": 25, "k": 16, "tile_m": 2, "tile_n": 2, "threads": 32, "grouping": 8, "minblocks": 9, "algorithm": "medium", "perf": 3040.3, "source": "autotuned"},
{"m": 4, "n": 25, "k": 22, "tile_m": 2, "tile_n": 2, "threads": 32, "grouping": 8, "minblocks": 6, "algorithm": "medium", "perf": 3165.55, "source": "autotuned"},
{"m": 4, "n": 25, "k": 25, "tile_m": 2, "tile_n": 2, "threads": 32, "grouping": 12, "minblocks": 6, "algorithm": "medium", "perf": 3291.37, "source": "autotuned"},
{"m": 4, "n": 25, "k": 26, "tile_m": 2, "tile_n": 2, "threads": 32, "grouping": 12, "minblocks": 8, "algorithm": "medium", "perf": 3300.52, "source": "autotuned"},
{"m": 4, "n": 25, "k": 28, "tile_m": 2, "tile_n": 2, "threads": 32, "grouping": 12, "minblocks": 8, "algorithm": "medium", "perf": 3354.34, "source": "autotuned"},
{"m": 4, "n": 25, "k": 32, "tile_m": 2, "tile_n": 2, "threads": 32, "grouping": 12, "minblocks": 5, "algorithm": "medium", "perf": 3460.54, "source": "autotuned"},
{"m": 4, "n": 25, "k": 45, "tile_m": 2, "tile_n": 2, "threads": 32, "grouping": 16, "minblocks": 4, "algorithm": "medium", "perf": 3438.81, "source": "autotuned"},
{"m": 4, "n": 26, "k": 4, "tile_m": 2, "tile_n": 2, "threads": 32, "grouping": 5, "minblocks": 6, "algorithm": "medium", "perf": 1589.7, "source": "autotuned"},
{"m": 4, "n": 26, "k": 5, "tile_m": 2, "tile_n": 2, "threads": 32, "grouping": 8, "minblocks": 22, "algorithm": "medium", "perf": 1861.6, "source": "autotuned"},
{"m": 4, "n": 26, "k": 6, "tile_m": 2, "tile_n": 2, "threads": 32, "grouping": 8, "minblocks": 5, "algorithm": "medium", "perf": 2167.34, "source": "autotuned"},
{"m": 4, "n": 26, "k": 7, "tile_m": 2, "tile_n": 2, "threads": 32, "grouping": 8, "minblocks": 21, "algorithm": "medium", "perf": 2375.26, "source": "autotuned"},
{"m": 4, "n": 26, "k": 8, "tile_m": 2, "tile_n": 2, "threads": 64, "grouping": 9, "minblocks": 15, "algorithm": "medium", "perf": 2378.79, "source": "autotuned"},
{"m": 4, "n": 26, "k": 9, "tile_m": 2, "tile_n": 2, "threads": 64, "grouping": 9, "minblocks": 13, "algorithm": "medium", "perf": 2557.1, "source": "autotuned"},
{"m": 4, "n": 26, "k": 10, "tile_m": 2, "tile_n": 2, "threads": 96, "grouping": 8, "minblocks": 16, "algorithm": "medium", "perf": 2649.38, "source": "autotuned"},
{"m": 4, "n": 26, "k": 13, "tile_m": 2, "tile_n": 2, "threads": 32, "grouping": 8, "minblocks": 17, "algorithm": "medium", "perf": 2945.74, "source": "autotuned"},
{"m": 4, "n": 26, "k": 15, "tile_m": 2, "tile_n": 2, "threads": 32, "grouping": 8, "minblocks": 11, "algorithm": "medium", "perf": 3133.51, "source": "autotuned"},
{"m": 4, "n": 26, "k": 16, "tile_m": 2, "tile_n": 2, "threads": 32, "grouping": 8, "minblocks": 15, "algorithm": "medium", "perf": 3366.55, "source": "autotuned"},
{"m": 4, "n": 26, "k": 22, "tile_m": 2, "tile_n": 2, "threads": 32, "grouping": 8, "minblocks": 10, "algorithm": "medium", "perf": 3463.55, "source": "autotuned"},
{"m": 4, "n": 26, "k": 23, "tile_m": 2, "tile_n": 2, "threads": 32, "grouping": 8, "minblocks": 10, "algorithm": "medium", "perf": 3772.86, "source": "autotuned"},
{"m": 4, "n": 26, "k": 25, "tile_m": 2, "tile_n": 2, "threads": 32, "grouping": 12, "minblocks": 2, "algorithm": "medium", "perf": 3502.78, "source": "autotuned"},
{"m": 4, "n": 26, "k": 26, "tile_m": 2, "tile_n": 2, "threads": 32, "grouping": 12, "minblocks": 6, "algorithm": "medium", "perf": 3515.07, "source": "autotuned"},
{"m": 4, "n": 26, "k": 28, "tile_m": 2, "tile_n": 2, "threads": 32, "grouping": 12, "minblocks": 5, "algorithm": "medium", "perf": 3619.65, "source": "autotuned"},
{"m": 4, "n": 26, "k": 32, "tile_m": 2, "tile_n": 2, "threads": 32, "grouping": 12, "minblocks": 2, "algorithm": "medium", "perf": 3694.83, "source": "autotuned"},
{"m": 4, "n": 26, "k": 45, "tile_m": 2, "tile_n": 2, "threads": 32, "grouping": 16, "minblocks": 2, "algorithm": "medium", "perf": 3591.91, "source": "autotuned"},
{"m": 4, "n": 28, "k": 4, "tile_m": 2, "tile_n": 1, "threads": 64, "grouping": 8, "minblocks": 19, "algorithm": "medium", "perf": 1683.8, "source": "autotuned"},
{"m": 4, "n": 28, "k": 5, "tile_m": 2, "tile_n": 2, "threads": 32, "grouping": 8, "minblocks": 5, "algorithm": "medium", "perf": 2010.42, "source": "autotuned"},
{"m": 4, "n": 28, "k": 7, "tile_m": 2, "tile_n": 2, "threads": 32, "grouping": 8, "minblocks": 14, "algorithm": "medium", "perf": 2466.7, "source": "autotuned"},
{"m": 4, "n": 28, "k": 9, "tile_m": 2, "tile_n": 2, "threads": 64, "grouping": 9, "minblocks": 18, "algorithm": "medium", "perf": 2730.71, "source": "autotuned"},
{"m": 4, "n": 28, "k": 13, "tile_m": 2, "tile_n": 2, "threads": 32, "grouping": 8, "minblocks": 4, "algorithm": "medium", "perf": 3119.58, "source": "autotuned"},
{"m": 4, "n": 28, "k": 25, "tile_m": 2, "tile_n": 2, "threads": 32, "grouping": 12, "minblocks": 3, "algorithm": "medium", "perf": 3629.25, "source": "autotuned"},
{"m": 4, "n": 28, "k": 26, "tile_m": 2, "tile_n": 2, "threads": 32, "grouping": 12, "minblocks": 3, "algorithm": "medium", "perf": 3679.08, "source": "autotuned"},
{"m": 4, "n": 28, "k": 28, "tile_m": 2, "tile_n": 2, "threads": 32, "grouping": 12, "minblocks": 1, "algorithm": "medium", "perf": 3721.21, "source": "autotuned"},
{"m": 4, "n": 28, "k": 32, "tile_m": 2, "tile_n": 2, "threads": 32, "grouping": 12, "minblocks": 6, "algorithm": "medium", "perf": 3884.2, "source": "autotuned"},
{"m": 4, "n": 28, "k": 45, "tile_m": 2, "tile_n": 2, "threads": 32, "grouping": 16, "minblocks": 5, "algorithm": "medium", "perf": 3705.22, "source": "autotuned"},
{"m": 4, "n": 32, "k": 4, "tile_m": 2, "tile_n": 2, "threads": 32, "grouping": 5, "minblocks": 5, "algorithm": "small", "perf": 1956.68, "source": "autotuned"},
{"m": 4, "n": 32, "k": 5, "tile_m": 2, "tile_n": 2, "threads": 32, "grouping": 8, "minblocks": 15, "algorithm": "medium", "perf": 2255.48, "source": "autotuned"},
{"m": 4, "n": 32, "k": 6, "tile_m": 2, "tile_n": 2, "threads": 32, "grouping": 8, "minblocks": 7, "algorithm": "medium", "perf": 2560.8, "source": "autotuned"},
{"m": 4, "n": 32, "k": 7, "tile_m": 2, "tile_n": 2, "threads": 32, "grouping": 8, "minblocks": 5, "algorithm": "medium", "perf": 2776.84, "source": "autotuned"},
{"m": 4, "n": 32, "k": 8, "tile_m": 2, "tile_n": 2, "threads": 32, "grouping": 5, "minblocks": 26, "algorithm": "medium", "perf": 2816.0, "source": "autotuned"},
{"m": 4, "n": 32, "k": 9, "tile_m": 2, "tile_n": 2, "threads": 64, "grouping": 9, "minblocks": 17, "algorithm": "medium", "perf": 2912.94, "source": "autotuned"},
{"m": 4, "n": 32, "k": 10, "tile_m": 2, "tile_n": 2, "threads": 32, "grouping": 8, "minblocks": 13, "algorithm": "medium", "perf": 3059.09, "source": "autotuned"},
{"m": 4, "n": 32, "k": 13, "tile_m": 2, "tile_n": 2, "threads": 32, "grouping": 8, "minblocks": 11, "algorithm": "medium", "perf": 3465.69, "source": "autotuned"},
{"m": 4, "n": 32, "k": 22, "tile_m": 2, "tile_n": 2, "threads": 32, "grouping": 12, "minblocks": 3, "algorithm": "medium", "perf": 3850.83, "source": "autotuned"},
{"m": 4, "n": 32, "k": 25, "tile_m": 2, "tile_n": 2, "threads": 32, "grouping": 12, "minblocks": 3, "algorithm": "medium", "perf": 3889.43, "source": "autotuned"},
{"m": 4, "n": 32, "k": 26, "tile_m": 2, "tile_n": 2, "threads": 32, "grouping": 12, "minblocks": 6, "algorithm": "medium", "perf": 3941.25, "source": "autotuned"},
{"m": 4, "n": 32, "k": 28, "tile_m": 2, "tile_n": 2, "threads": 32, "grouping": 12, "minblocks": 3, "algorithm": "medium", "perf": 3980.52, "source": "autotuned"},
{"m": 4, "n": 32, "k": 32, "tile_m": 2, "tile_n": 2, "threads": 32, "grouping": 12, "minblocks": 7, "algorithm": "medium", "perf": 4094.55, "source": "autotuned"},
{"m": 4, "n": 32, "k": 45, "tile_m": 2, "tile_n": 1, "threads": 64, "grouping": 16, "minblocks": 2, "algorithm": "medium", "perf": 3790.66, "source": "autotuned"},
{"m": 4, "n": 45, "k": 4, "tile_m": 2, "tile_n": 3, "threads": 32, "grouping": 8, "minblocks": 5, "algorithm": "medium", "perf": 2427.89, "source": "autotuned"},
{"m": 4, "n": 45, "k": 5, "tile_m": 2, "tile_n": 3, "threads": 32, "grouping": 8, "minblocks": 7, "algorithm": "medium", "perf": 2694.21, "source": "autotuned"},
{"m": 4, "n": 45, "k": 6, "tile_m": 2, "tile_n": 3, "threads": 32, "grouping": 8, "minblocks": 19, "algorithm": "medium", "perf": 3129.76, "source": "autotuned"},
{"m": 4, "n": 45, "k": 7, "tile_m": 2, "tile_n": 3, "threads": 32, "grouping": 8, "minblocks": 21, "algorithm": "medium", "perf": 3431.2, "source": "autotuned"},
{"m": 4, "n": 45, "k": 8, "tile_m": 2, "tile_n": 3, "threads": 32, "grouping": 8, "minblocks": 13, "algorithm": "medium", "perf": 3177.17, "source": "autotuned"},
{"m": 4, "n": 45, "k": 9, "tile_m": 2, "tile_n": 3, "threads": 32, "grouping": 8, "minblocks": 15, "algorithm": "medium", "perf": 3346.18, "source": "autotuned"},
{"m": 4, "n": 45, "k": 10, "tile_m": 2, "tile_n": 3, "threads": 32, "grouping": 8, "minblocks": 13, "algorithm": "medium", "perf": 3483.84, "source": "autotuned"},
{"m": 4, "n": 45, "k": 13, "tile_m": 2, "tile_n": 3, "threads": 32, "grouping": 11, "minblocks": 6, "algorithm": "medium", "perf": 3836.01, "source": "autotuned"},
{"m": 4, "n": 45, "k": 15, "tile_m": 2, "tile_n": 3, "threads": 32, "grouping": 11, "minblocks": 3, "algorithm": "medium", "perf": 3866.63, "source": "autotuned"},
{"m": 4, "n": 45, "k": 16, "tile_m": 2, "tile_n": 3, "threads": 32, "grouping": 11, "minblocks": 10, "algorithm": "medium", "perf": 3960.0, "source": "autotuned"},
{"m": 4, "n": 45, "k": 22, "tile_m": 2, "tile_n": 3, "threads": 32, "grouping": 11, "minblocks": 4, "algorithm": "medium", "perf": 4103.49, "source": "autotuned"},
{"m": 4, "n": 45, "k": 25, "tile_m": 2, "tile_n": 3, "threads": 32, "grouping": 11, "minblocks": 4, "algorithm": "medium", "perf": 4055.32, "source": "autotuned"},
{"m": 4, "n": 45, "k": 26, "tile_m": 2, "tile_n": 3, "threads": 32, "grouping": 16, "minblocks": 4, "algorithm": "medium", "perf": 3849.89, "source": "autotuned"},
{"m": 4, "n": 45, "k": 28, "tile_m": 2, "tile_n": 3, "threads": 32, "grouping": 16, "minblocks": 3, "algorithm": "medium", "perf": 3838.76, "source": "autotuned"},
{"m": 4, "n": 45, "k": 32, "tile_m": 2, "tile_n": 3, "threads": 32, "grouping": 16, "minblocks": 2, "algorithm": "medium", "perf": 3898.38, "source": "autotuned"},
{"m": 4, "n": 45, "k": 45, "tile_m": 1, "tile_n": 6, "w": 16, "v": 42, "threads": 32, "grouping": 16, "minblocks": 1, "algorithm": "largeDB2", "perf": 3792.73, "source": "autotuned"},
{"m": 5, "n": 4, "k": 4, "tile_m": 1, "tile_n": 1, "threads": 32, "grouping": 8, "minblocks": 21, "algorithm": "medium", "perf": 456.734, "source": "autotuned"},
{"m": 5, "n": 4, "k": 5, "tile_m": 1, "tile_n": 1, "threads": 32, "grouping": 9, "minblocks": 15, "algorithm": "medium", "perf": 547.936, "source": "autotuned"},
{"m": 5, "n": 4, "k": 6, "tile_m": 1, "tile_n": 1, "threads": 32, "grouping": 9, "minblocks": 27, "algorithm": "medium", "perf": 627.773, "source": "autotuned"},
{"m": 5, "n": 4, "k": 7, "tile_m": 1, "tile_n": 1, "threads": 64, "grouping": 11, "minblocks": 9, "algorithm": "medium", "perf": 648.722, "source": "autotuned"},
{"m": 5, "n": 4, "k": 8, "tile_m": 1, "tile_n": 1, "threads": 64, "grouping": 9, "minblocks": 14, "algorithm": "medium", "perf": 712.755, "source": "autotuned"},
{"m": 5, "n": 4, "k": 9, "tile_m": 1, "tile_n": 1, "threads": 64, "grouping": 9, "minblocks": 12, "algorithm": "medium", "perf": 770.569, "source": "autotuned"},
{"m": 5, "n": 4, "k": 10, "tile_m": 1, "tile_n": 1, "threads": 64, "grouping": 4, "minblocks": 6, "algorithm": "medium", "perf": 820.199, "source": "autotuned"},
{"m": 5, "n": 4, "k": 13, "tile_m": 1, "tile_n": 1, "threads": 96, "grouping": 8, "minblocks": 7, "algorithm": "medium", "perf": 889.483, "source": "autotuned"},
{"m": 5, "n": 4, "k": 15, "tile_m": 1, "tile_n": 1, "threads": 96, "grouping": 9, "minblocks": 18, "algorithm": "medium", "perf": 987.785, "source": "autotuned"},
{"m": 5, "n": 4, "k": 16, "tile_m": 1, "tile_n": 1, "threads": 96, "grouping": 9, "minblocks": 21, "algorithm": "medium", "perf": 1025.03, "source": "autotuned"},
{"m": 5, "n": 4, "k": 22, "tile_m": 1, "tile_n": 1, "threads": 128, "grouping": 3, "minblocks": 16, "algorithm": "medium", "perf": 1126.7, "source": "autotuned"},
{"m": 5, "n": 4, "k": 23, "tile_m": 1, "tile_n": 1, "threads": 128, "grouping": 4, "minblocks": 14, "algorithm": "medium", "perf": 1135.53, "source": "autotuned"},
{"m": 5, "n": 4, "k": 25, "tile_m": 1, "tile_n": 1, "threads": 128, "grouping": 3, "minblocks": 16, "algorithm": "medium", "perf": 1184.31, "source": "autotuned"},
{"m": 5, "n": 4, "k": 26, "tile_m": 1, "tile_n": 1, "threads": 160, "grouping": 16, "minblocks": 9, "algorithm": "medium", "perf": 1142.17, "source": "autotuned"},
{"m": 5, "n": 4, "k": 28, "tile_m": 1, "tile_n": 1, "threads": 160, "grouping": 11, "minblocks": 10, "algorithm": "medium", "perf": 1196.49, "source": "autotuned"},
{"m": 5, "n": 4, "k": 32, "tile_m": 1, "tile_n": 1, "threads": 32, "grouping": 4, "minblocks": 23, "algorithm": "medium", "perf": 1245.14, "source": "autotuned"},
{"m": 5, "n": 4, "k": 45, "tile_m": 1, "tile_n": 1, "threads": 64, "grouping": 3, "minblocks": 17, "algorithm": "medium", "perf": 1310.16, "source": "autotuned"},
{"m": 5, "n": 5, "k": 4, "tile_m": 1, "tile_n": 1, "threads": 32, "grouping": 8, "minblocks": 15, "algorithm": "medium", "perf": 557.737, "source": "autotuned"},
{"m": 5, "n": 5, "k": 5, "tile_m": 1, "tile_n": 1, "threads": 32, "grouping": 9, "minblocks": 2, "algorithm": "medium", "perf": 695.086, "source": "autotuned"},
{"m": 5, "n": 5, "k": 6, "tile_m": 1, "tile_n": 1, "threads": 32, "grouping": 9, "minblocks": 2, "algorithm": "medium", "perf": 811.011, "source": "autotuned"},
{"m": 5, "n": 5, "k": 7, "tile_m": 1, "tile_n": 1, "threads": 64, "grouping": 9, "minblocks": 14, "algorithm": "medium", "perf": 803.107, "source": "autotuned"},
{"m": 5, "n": 5, "k": 8, "tile_m": 1, "tile_n": 1, "threads": 64, "grouping": 9, "minblocks": 16, "algorithm": "medium", "perf": 876.847, "source": "autotuned"},
{"m": 5, "n": 5, "k": 9, "tile_m": 1, "tile_n": 1, "threads": 64, "grouping": 4, "minblocks": 26, "algorithm": "medium", "perf": 967.401, "source": "autotuned"},
{"m": 5, "n": 5, "k": 10, "tile_m": 1, "tile_n": 1, "threads": 64, "grouping": 4, "minblocks": 9, "algorithm": "medium", "perf": 1002.24, "source": "autotuned"},
{"m": 5, "n": 5, "k": 12, "tile_m": 1, "tile_n": 1, "threads": 64, "grouping": 4, "minblocks": 6, "algorithm": "medium", "perf": 1130.87, "source": "autotuned"},
{"m": 5, "n": 5, "k": 13, "tile_m": 1, "tile_n": 1, "threads": 32, "grouping": 4, "minblocks": 22, "algorithm": "small", "perf": 1148.66, "source": "autotuned"},
{"m": 5, "n": 5, "k": 14, "tile_m": 1, "tile_n": 1, "threads": 32, "grouping": 4, "minblocks": 29, "algorithm": "small", "perf": 1201.59, "source": "autotuned"},
{"m": 5, "n": 5, "k": 15, "tile_m": 1, "tile_n": 1, "threads": 32, "grouping": 3, "minblocks": 6, "algorithm": "small", "perf": 1244.73, "source": "autotuned"},
{"m": 5, "n": 5, "k": 16, "tile_m": 1, "tile_n": 1, "threads": 32, "grouping": 2, "minblocks": 1, "algorithm": "small", "perf": 1321.81, "source": "autotuned"},
{"m": 5, "n": 5, "k": 22, "tile_m": 1, "tile_n": 1, "threads": 128, "grouping": 4, "minblocks": 14, "algorithm": "medium", "perf": 1408.73, "source": "autotuned"},
{"m": 5, "n": 5, "k": 23, "tile_m": 1, "tile_n": 1, "threads": 128, "grouping": 18, "minblocks": 2, "algorithm": "medium", "perf": 1399.14, "source": "autotuned"},
{"m": 5, "n": 5, "k": 24, "tile_m": 1, "tile_n": 1, "threads": 64, "grouping": 2, "minblocks": 1, "algorithm": "small", "perf": 1434.65, "source": "autotuned"},
{"m": 5, "n": 5, "k": 25, "tile_m": 1, "tile_n": 1, "threads": 128, "grouping": 4, "minblocks": 15, "algorithm": "medium", "perf": 1468.63, "source": "autotuned"},
{"m": 5, "n": 5, "k": 26, "tile_m": 1, "tile_n": 1, "threads": 32, "grouping": 4, "minblocks": 23, "algorithm": "medium", "perf": 1465.29, "source": "autotuned"},
{"m": 5, "n": 5, "k": 28, "tile_m": 1, "tile_n": 1, "threads": 32, "grouping": 4, "minblocks": 25, "algorithm": "medium", "perf": 1513.7, "source": "autotuned"},
{"m": 5, "n": 5, "k": 32, "tile_m": 1, "tile_n": 1, "threads": 32, "grouping": 4, "minblocks": 24, "algorithm": "medium", "perf": 1589.06, "source": "autotuned"},
{"m": 5, "n": 5, "k": 45, "tile_m": 1, "tile_n": 1, "threads": 32, "grouping": 2, "minblocks": 6, "algorithm": "medium", "perf": 1655.15, "source": "autotuned"},
{"m": 5, "n": 6, "k": 4, "tile_m": 1, "tile_n": 1, "threads": 32, "grouping": 9, "minblocks": 19, "algorithm": "medium", "perf": 673.023, "source": "autotuned"},
{"m": 5, "n": 6, "k": 5, "tile_m": 1, "tile_n": 1, "threads": 32, "grouping": 8, "minblocks": 17, "algorithm": "medium", "perf": 820.523, "source": "autotuned"},
{"m": 5, "n": 6, "k": 6, "tile_m": 1, "tile_n": 1, "threads": 64, "grouping": 8, "minblocks": 10, "algorithm": "medium", "perf": 881.939, "source": "autotuned"},
{"m": 5, "n": 6, "k": 7, "tile_m": 1, "tile_n": 1, "threads": 64, "grouping": 8, "minblocks": 10, "algorithm": "medium", "perf": 985.439, "source": "autotuned"},
{"m": 5, "n": 6, "k": 8, "tile_m": 1, "tile_n": 1, "threads": 64, "grouping": 9, "minblocks": 25, "algorithm": "medium", "perf": 1076.66, "source": "autotuned"},
{"m": 5, "n": 6, "k": 9, "tile_m": 1, "tile_n": 1, "threads": 64, "grouping": 8, "minblocks": 10, "algorithm": "medium", "perf": 1159.81, "source": "autotuned"},
{"m": 5, "n": 6, "k": 10, "tile_m": 1, "tile_n": 1, "threads": 64, "grouping": 4, "minblocks": 27, "algorithm": "medium", "perf": 1216.16, "source": "autotuned"},
{"m": 5, "n": 6, "k": 13, "tile_m": 1, "tile_n": 1, "threads": 96, "grouping": 8, "minblocks": 21, "algorithm": "medium", "perf": 1320.49, "source": "autotuned"},
{"m": 5, "n": 6, "k": 14, "tile_m": 1, "tile_n": 1, "threads": 96, "grouping": 8, "minblocks": 18, "algorithm": "medium", "perf": 1387.99, "source": "autotuned"},
{"m": 5, "n": 6, "k": 15, "tile_m": 1, "tile_n": 1, "threads": 96, "grouping": 8, "minblocks": 18, "algorithm": "medium", "perf": 1450.68, "source": "autotuned"},
{"m": 5, "n": 6, "k": 22, "tile_m": 1, "tile_n": 1, "threads": 160, "grouping": 11, "minblocks": 12, "algorithm": "medium", "perf": 1562.21, "source": "autotuned"},
{"m": 5, "n": 6, "k": 26, "tile_m": 1, "tile_n": 1, "threads": 160, "grouping": 16, "minblocks": 9, "algorithm": "medium", "perf": 1683.83, "source": "autotuned"},
{"m": 5, "n": 6, "k": 32, "tile_m": 1, "tile_n": 1, "threads": 32, "grouping": 2, "minblocks": 19, "algorithm": "medium", "perf": 1746.98, "source": "autotuned"},
{"m": 5, "n": 6, "k": 45, "tile_m": 1, "tile_n": 1, "w": 18, "v": 6, "threads": 32, "grouping": 16, "minblocks": 1, "algorithm": "largeDB2", "perf": 1909.47, "source": "autotuned"},
{"m": 5, "n": 7, "k": 4, "tile_m": 3, "tile_n": 1, "threads": 32, "grouping": 9, "minblocks": 1, "algorithm": "medium", "perf": 739.478, "source": "autotuned"},
{"m": 5, "n": 7, "k": 5, "tile_m": 1, "tile_n": 1, "threads": 64, "grouping": 11, "minblocks": 26, "algorithm": "medium", "perf": 788.035, "source": "autotuned"},
{"m": 5, "n": 7, "k": 6, "tile_m": 2, "tile_n": 1, "threads": 64, "grouping": 9, "minblocks": 21, "algorithm": "medium", "perf": 899.345, "source": "autotuned"},
{"m": 5, "n": 7, "k": 7, "tile_m": 2, "tile_n": 1, "threads": 64, "grouping": 9, "minblocks": 22, "algorithm": "medium", "perf": 977.24, "source": "autotuned"},
{"m": 5, "n": 7, "k": 8, "tile_m": 2, "tile_n": 1, "threads": 64, "grouping": 9, "minblocks": 21, "algorithm": "medium", "perf": 1079.15, "source": "autotuned"},
{"m": 5, "n": 7, "k": 9, "tile_m": 2, "tile_n": 1, "threads": 64, "grouping": 9, "minblocks": 24, "algorithm": "medium", "perf": 1156.27, "source": "autotuned"},
{"m": 5, "n": 7, "k": 10, "tile_m": 3, "tile_n": 1, "threads": 96, "grouping": 8, "minblocks": 16, "algorithm": "medium", "perf": 1200.41, "source": "autotuned"},
{"m": 5, "n": 7, "k": 13, "tile_m": 3, "tile_n": 1, "threads": 32, "grouping": 4, "minblocks": 27, "algorithm": "small", "perf": 1424.46, "source": "autotuned"},
{"m": 5, "n": 7, "k": 15, "tile_m": 3, "tile_n": 1, "threads": 128, "grouping": 8, "minblocks": 16, "algorithm": "medium", "perf": 1430.12, "source": "autotuned"},
{"m": 5, "n": 7, "k": 22, "tile_m": 3, "tile_n": 1, "threads": 32, "grouping": 3, "minblocks": 26, "algorithm": "medium", "perf": 1649.56, "source": "autotuned"},
{"m": 5, "n": 7, "k": 25, "tile_m": 3, "tile_n": 1, "threads": 32, "grouping": 3, "minblocks": 25, "algorithm": "medium", "perf": 1714.78, "source": "autotuned"},
{"m": 5, "n": 7, "k": 26, "tile_m": 3, "tile_n": 1, "threads": 32, "grouping": 3, "minblocks": 25, "algorithm": "medium", "perf": 1699.51, "source": "autotuned"},
{"m": 5, "n": 7, "k": 28, "tile_m": 3, "tile_n": 1, "threads": 32, "grouping": 8, "minblocks": 17, "algorithm": "medium", "perf": 1736.34, "source": "autotuned"},
{"m": 5, "n": 7, "k": 32, "tile_m": 3, "tile_n": 1, "threads": 32, "grouping": 4, "minblocks": 17, "algorithm": "medium", "perf": 1855.44, "source": "autotuned"},
{"m": 5, "n": 7, "k": 45, "tile_m": 3, "tile_n": 1, "w": 18, "v": 4, "threads": 32, "grouping": 16, "minblocks": 12, "algorithm": "largeDB2", "perf": 2007.73, "source": "autotuned"},
{"m": 5, "n": 8, "k": 4, "tile_m": 1, "tile_n": 2, "threads": 64, "grouping": 9, "minblocks": 16, "algorithm": "medium", "perf": 778.444, "source": "autotuned"},
{"m": 5, "n": 8, "k": 5, "tile_m": 2, "tile_n": 1, "threads": 64, "grouping": 9, "minblocks": 1, "algorithm": "medium", "perf": 900.267, "source": "autotuned"},
{"m": 5, "n": 8, "k": 6, "tile_m": 1, "tile_n": 2, "threads": 64, "grouping": 9, "minblocks": 17, "algorithm": "medium", "perf": 1055.54, "source": "autotuned"},
{"m": 5, "n": 8, "k": 7, "tile_m": 2, "tile_n": 1, "threads": 64, "grouping": 9, "minblocks": 24, "algorithm": "medium", "perf": 1134.58, "source": "autotuned"},
{"m": 5, "n": 8, "k": 8, "tile_m": 1, "tile_n": 2, "threads": 64, "grouping": 5, "minblocks": 31, "algorithm": "small", "perf": 1140.6, "source": "autotuned"},
{"m": 5, "n": 8, "k": 9, "tile_m": 4, "tile_n": 1, "threads": 96, "grouping": 8, "minblocks": 14, "algorithm": "medium", "perf": 1299.36, "source": "autotuned"},
{"m": 5, "n": 8, "k": 10, "tile_m": 3, "tile_n": 1, "threads": 96, "grouping": 8, "minblocks": 15, "algorithm": "medium", "perf": 1390.57, "source": "autotuned"},
{"m": 5, "n": 8, "k": 13, "tile_m": 3, "tile_n": 1, "threads": 128, "grouping": 11, "minblocks": 11, "algorithm": "medium", "perf": 1485.47, "source": "autotuned"},
{"m": 5, "n": 8, "k": 15, "tile_m": 3, "tile_n": 1, "threads": 128, "grouping": 11, "minblocks": 11, "algorithm": "medium", "perf": 1637.4, "source": "autotuned"},
{"m": 5, "n": 8, "k": 22, "tile_m": 3, "tile_n": 1, "threads": 32, "grouping": 8, "minblocks": 4, "algorithm": "medium", "perf": 1839.11, "source": "autotuned"},
{"m": 5, "n": 8, "k": 26, "tile_m": 3, "tile_n": 1, "threads": 32, "grouping": 8, "minblocks": 18, "algorithm": "medium", "perf": 1911.78, "source": "autotuned"},
{"m": 5, "n": 8, "k": 32, "tile_m": 3, "tile_n": 1, "threads": 32, "grouping": 4, "minblocks": 18, "algorithm": "medium", "perf": 2109.0, "source": "autotuned"},
{"m": 5, "n": 8, "k": 45, "tile_m": 3, "tile_n": 1, "w": 16, "v": 8, "threads": 32, "grouping": 16, "minblocks": 12, "algorithm": "largeDB2", "perf": 2277.75, "source": "autotuned"},
{"m": 5, "n": 9, "k": 4, "tile_m": 1, "tile_n": 1, "threads": 64, "grouping": 11, "minblocks": 15, "algorithm": "medium", "perf": 860.916, "source": "autotuned"},
{"m": 5, "n": 9, "k": 5, "tile_m": 1, "tile_n": 1, "threads": 64, "grouping": 11, "minblocks": 1, "algorithm": "medium", "perf": 1000.64, "source": "autotuned"},
{"m": 5, "n": 9, "k": 6, "tile_m": 1, "tile_n": 1, "threads": 64, "grouping": 11, "minblocks": 26, "algorithm": "medium", "perf": 1113.25, "source": "autotuned"},
{"m": 5, "n": 9, "k": 7, "tile_m": 3, "tile_n": 1, "threads": 64, "grouping": 13, "minblocks": 1, "algorithm": "medium", "perf": 1222.28, "source": "autotuned"},
{"m": 5, "n": 9, "k": 8, "tile_m": 3, "tile_n": 1, "threads": 96, "grouping": 8, "minblocks": 16, "algorithm": "medium", "perf": 1340.32, "source": "autotuned"},
{"m": 5, "n": 9, "k": 9, "tile_m": 3, "tile_n": 1, "threads": 96, "grouping": 11, "minblocks": 13, "algorithm": "medium", "perf": 1427.34, "source": "autotuned"},
{"m": 5, "n": 9, "k": 10, "tile_m": 3, "tile_n": 1, "threads": 96, "grouping": 8, "minblocks": 15, "algorithm": "medium", "perf": 1540.8, "source": "autotuned"},
{"m": 5, "n": 9, "k": 13, "tile_m": 3, "tile_n": 1, "threads": 128, "grouping": 8, "minblocks": 15, "algorithm": "medium", "perf": 1640.26, "source": "autotuned"},
{"m": 5, "n": 9, "k": 14, "tile_m": 3, "tile_n": 1, "threads": 128, "grouping": 11, "minblocks": 11, "algorithm": "medium", "perf": 1742.4, "source": "autotuned"},
{"m": 5, "n": 9, "k": 15, "tile_m": 3, "tile_n": 1, "threads": 32, "grouping": 6, "minblocks": 21, "algorithm": "medium", "perf": 1697.46, "source": "autotuned"},
{"m": 5, "n": 9, "k": 16, "tile_m": 3, "tile_n": 1, "threads": 32, "grouping": 6, "minblocks": 27, "algorithm": "medium", "perf": 1769.59, "source": "autotuned"},
{"m": 5, "n": 9, "k": 22, "tile_m": 3, "tile_n": 1, "threads": 32, "grouping": 8, "minblocks": 23, "algorithm": "medium", "perf": 2000.29, "source": "autotuned"},
{"m": 5, "n": 9, "k": 23, "tile_m": 3, "tile_n": 1, "threads": 32, "grouping": 8, "minblocks": 24, "algorithm": "medium", "perf": 2029.71, "source": "autotuned"},
{"m": 5, "n": 9, "k": 25, "tile_m": 3, "tile_n": 1, "threads": 32, "grouping": 8, "minblocks": 22, "algorithm": "medium", "perf": 2060.4, "source": "autotuned"},
{"m": 5, "n": 9, "k": 26, "tile_m": 3, "tile_n": 1, "threads": 32, "grouping": 8, "minblocks": 21, "algorithm": "medium", "perf": 2083.24, "source": "autotuned"},
{"m": 5, "n": 9, "k": 28, "tile_m": 3, "tile_n": 1, "threads": 32, "grouping": 8, "minblocks": 19, "algorithm": "medium", "perf": 2144.74, "source": "autotuned"},
{"m": 5, "n": 9, "k": 32, "tile_m": 3, "tile_n": 1, "threads": 32, "grouping": 8, "minblocks": 9, "algorithm": "medium", "perf": 2284.62, "source": "autotuned"},
{"m": 5, "n": 9, "k": 45, "tile_m": 3, "tile_n": 1, "w": 20, "v": 6, "threads": 32, "grouping": 16, "minblocks": 1, "algorithm": "largeDB2", "perf": 2423.49, "source": "autotuned"},
{"m": 5, "n": 10, "k": 4, "tile_m": 1, "tile_n": 2, "threads": 64, "grouping": 9, "minblocks": 18, "algorithm": "medium", "perf": 954.952, "source": "autotuned"},
{"m": 5, "n": 10, "k": 5, "tile_m": 1, "tile_n": 2, "threads": 64, "grouping": 9, "minblocks": 18, "algorithm": "medium", "perf": 1107.13, "source": "autotuned"},
{"m": 5, "n": 10, "k": 6, "tile_m": 1, "tile_n": 2, "threads": 64, "grouping": 9, "minblocks": 23, "algorithm": "medium", "perf": 1242.56, "source": "autotuned"},
{"m": 5, "n": 10, "k": 7, "tile_m": 3, "tile_n": 1, "threads": 96, "grouping": 11, "minblocks": 16, "algorithm": "medium", "perf": 1330.78, "source": "autotuned"},
{"m": 5, "n": 10, "k": 8, "tile_m": 3, "tile_n": 1, "threads": 96, "grouping": 11, "minblocks": 11, "algorithm": "medium", "perf": 1480.0, "source": "autotuned"},
{"m": 5, "n": 10, "k": 9, "tile_m": 3, "tile_n": 1, "threads": 96, "grouping": 11, "minblocks": 11, "algorithm": "medium", "perf": 1593.52, "source": "autotuned"},
{"m": 5, "n": 10, "k": 10, "tile_m": 3, "tile_n": 1, "threads": 128, "grouping": 8, "minblocks": 14, "algorithm": "medium", "perf": 1559.48, "source": "autotuned"},
{"m": 5, "n": 10, "k": 13, "tile_m": 3, "tile_n": 1, "threads": 32, "grouping": 6, "minblocks": 24, "algorithm": "medium", "perf": 1737.53, "source": "autotuned"},
{"m": 5, "n": 10, "k": 14, "tile_m": 3, "tile_n": 1, "threads": 32, "grouping": 6, "minblocks": 27, "algorithm": "medium", "perf": 1806.06, "source": "autotuned"},
{"m": 5, "n": 10, "k": 15, "tile_m": 3, "tile_n": 1, "threads": 32, "grouping": 7, "minblocks": 1, "algorithm": "medium", "perf": 1845.88, "source": "autotuned"},
{"m": 5, "n": 10, "k": 22, "tile_m": 3, "tile_n": 1, "threads": 32, "grouping": 8, "minblocks": 23, "algorithm": "medium", "perf": 2184.8, "source": "autotuned"},
{"m": 5, "n": 10, "k": 26, "tile_m": 3, "tile_n": 1, "w": 12, "v": 10, "threads": 32, "grouping": 16, "minblocks": 12, "algorithm": "largeDB2", "perf": 2347.77, "source": "autotuned"},
{"m": 5, "n": 10, "k": 32, "tile_m": 3, "tile_n": 1, "threads": 32, "grouping": 8, "minblocks": 2, "algorithm": "medium", "perf": 2481.4, "source": "autotuned"},
{"m": 5, "n": 10, "k": 45, "tile_m": 3, "tile_n": 1, "w": 18, "v": 10, "threads": 32, "grouping": 16, "minblocks": 2, "algorithm": "largeDB2", "perf": 2622.59, "source": "autotuned"},
{"m": 5, "n": 12, "k": 5, "tile_m": 1, "tile_n": 2, "threads": 64, "grouping": 11, "minblocks": 23, "algorithm": "medium", "perf": 1295.41, "source": "autotuned"},
{"m": 5, "n": 12, "k": 12, "tile_m": 3, "tile_n": 1, "threads": 32, "grouping": 5, "minblocks": 27, "algorithm": "medium", "perf": 1996.38, "source": "autotuned"},
{"m": 5, "n": 12, "k": 13, "tile_m": 3, "tile_n": 1, "threads": 32, "grouping": 7, "minblocks": 11, "algorithm": "medium", "perf": 2033.87, "source": "autotuned"},
{"m": 5, "n": 12, "k": 26, "tile_m": 3, "tile_n": 1, "w": 12, "v": 12, "threads": 32, "grouping": 16, "minblocks": 12, "algorithm": "largeDB2", "perf": 2666.36, "source": "autotuned"},
{"m": 5, "n": 12, "k": 32, "tile_m": 3, "tile_n": 1, "threads": 32, "grouping": 8, "minblocks": 14, "algorithm": "medium", "perf": 2847.44, "source": "autotuned"},
{"m": 5, "n": 13, "k": 4, "tile_m": 3, "tile_n": 1, "threads": 64, "grouping": 9, "minblocks": 2, "algorithm": "medium", "perf": 1173.74, "source": "autotuned"},
{"m": 5, "n": 13, "k": 5, "tile_m": 3, "tile_n": 1, "threads": 96, "grouping": 8, "minblocks": 14, "algorithm": "medium", "perf": 1325.52, "source": "autotuned"},
{"m": 5, "n": 13, "k": 6, "tile_m": 3, "tile_n": 1, "threads": 96, "grouping": 11, "minblocks": 12, "algorithm": "medium", "perf": 1546.38, "source": "autotuned"},
{"m": 5, "n": 13, "k": 7, "tile_m": 3, "tile_n": 1, "threads": 96, "grouping": 8, "minblocks": 16, "algorithm": "medium", "perf": 1682.94, "source": "autotuned"},
{"m": 5, "n": 13, "k": 8, "tile_m": 3, "tile_n": 1, "threads": 128, "grouping": 8, "minblocks": 14, "algorithm": "medium", "perf": 1726.92, "source": "autotuned"},
{"m": 5, "n": 13, "k": 9, "tile_m": 3, "tile_n": 1, "threads": 128, "grouping": 8, "minblocks": 16, "algorithm": "medium", "perf": 1868.74, "source": "autotuned"},
{"m": 5, "n": 13, "k": 10, "tile_m": 3, "tile_n": 1, "threads": 32, "grouping": 5, "minblocks": 26, "algorithm": "medium", "perf": 1894.76, "source": "autotuned"},
{"m": 5, "n": 13, "k": 12, "tile_m": 3, "tile_n": 1, "threads": 32, "grouping": 6, "minblocks": 22, "algorithm": "medium", "perf": 2091.46, "source": "autotuned"},
{"m": 5, "n": 13, "k": 13, "tile_m": 3, "tile_n": 1, "threads": 96, "grouping": 8, "minblocks": 16, "algorithm": "medium", "perf": 2113.54, "source": "autotuned"},
{"m": 5, "n": 13, "k": 14, "tile_m": 3, "tile_n": 1, "threads": 96, "grouping": 11, "minblocks": 12, "algorithm": "medium", "perf": 2202.03, "source": "autotuned"},
{"m": 5, "n": 13, "k": 15, "tile_m": 3, "tile_n": 1, "threads": 32, "grouping": 8, "minblocks": 9, "algorithm": "medium", "perf": 2234.8, "source": "autotuned"},
{"m": 5, "n": 13, "k": 16, "tile_m": 3, "tile_n": 1, "threads": 32, "grouping": 8, "minblocks": 4, "algorithm": "medium", "perf": 2351.02, "source": "autotuned"},
{"m": 5, "n": 13, "k": 22, "tile_m": 3, "tile_n": 1, "threads": 32, "grouping": 8, "minblocks": 12, "algorithm": "medium", "perf": 2702.78, "source": "autotuned"},
{"m": 5, "n": 13, "k": 23, "tile_m": 3, "tile_n": 1, "threads": 32, "grouping": 8, "minblocks": 2, "algorithm": "medium", "perf": 2732.69, "source": "autotuned"},
{"m": 5, "n": 13, "k": 24, "tile_m": 3, "tile_n": 1, "threads": 32, "grouping": 8, "minblocks": 11, "algorithm": "medium", "perf": 2779.76, "source": "autotuned"},
{"m": 5, "n": 13, "k": 25, "tile_m": 3, "tile_n": 1, "threads": 32, "grouping": 8, "minblocks": 1, "algorithm": "medium", "perf": 2765.14, "source": "autotuned"},
{"m": 5, "n": 13, "k": 26, "tile_m": 3, "tile_n": 1, "w": 12, "v": 10, "threads": 32, "grouping": 16, "minblocks": 4, "algorithm": "largeDB2", "perf": 2827.65, "source": "autotuned"},
{"m": 5, "n": 13, "k": 28, "tile_m": 3, "tile_n": 1, "w": 12, "v": 8, "threads": 32, "grouping": 16, "minblocks": 4, "algorithm": "largeDB2", "perf": 2871.56, "source": "autotuned"},
{"m": 5, "n": 13, "k": 32, "tile_m": 3, "tile_n": 1, "threads": 32, "grouping": 8, "minblocks": 10, "algorithm": "medium", "perf": 2958.27, "source": "autotuned"},
{"m": 5, "n": 13, "k": 45, "tile_m": 3, "tile_n": 1, "threads": 32, "grouping": 11, "minblocks": 2, "algorithm": "medium", "perf": 3093.75, "source": "autotuned"},
{"m": 5, "n": 14, "k": 5, "tile_m": 3, "tile_n": 1, "threads": 96, "grouping": 8, "minblocks": 14, "algorithm": "medium", "perf": 1419.58, "source": "autotuned"},
{"m": 5, "n": 14, "k": 6, "tile_m": 3, "tile_n": 1, "threads": 96, "grouping": 11, "minblocks": 13, "algorithm": "medium", "perf": 1669.01, "source": "autotuned"},
{"m": 5, "n": 14, "k": 9, "tile_m": 3, "tile_n": 1, "threads": 128, "grouping": 11, "minblocks": 12, "algorithm": "medium", "perf": 2003.97, "source": "autotuned"},
{"m": 5, "n": 14, "k": 10, "tile_m": 3, "tile_n": 1, "threads": 32, "grouping": 5, "minblocks": 25, "algorithm": "medium", "perf": 2039.36, "source": "autotuned"},
{"m": 5, "n": 14, "k": 13, "tile_m": 3, "tile_n": 1, "threads": 32, "grouping": 6, "minblocks": 25, "algorithm": "medium", "perf": 2259.2, "source": "autotuned"},
{"m": 5, "n": 14, "k": 14, "tile_m": 3, "tile_n": 1, "threads": 32, "grouping": 7, "minblocks": 25, "algorithm": "medium", "perf": 2302.99, "source": "autotuned"},
{"m": 5, "n": 15, "k": 4, "tile_m": 3, "tile_n": 1, "threads": 64, "grouping": 9, "minblocks": 20, "algorithm": "medium", "perf": 1348.37, "source": "autotuned"},
{"m": 5, "n": 15, "k": 5, "tile_m": 3, "tile_n": 1, "threads": 96, "grouping": 8, "minblocks": 16, "algorithm": "medium", "perf": 1546.97, "source": "autotuned"},
{"m": 5, "n": 15, "k": 6, "tile_m": 3, "tile_n": 1, "threads": 96, "grouping": 11, "minblocks": 14, "algorithm": "medium", "perf": 1772.98, "source": "autotuned"},
{"m": 5, "n": 15, "k": 7, "tile_m": 3, "tile_n": 1, "threads": 128, "grouping": 11, "minblocks": 12, "algorithm": "medium", "perf": 1785.74, "source": "autotuned"},
{"m": 5, "n": 15, "k": 8, "tile_m": 3, "tile_n": 1, "threads": 128, "grouping": 11, "minblocks": 12, "algorithm": "medium", "perf": 1943.93, "source": "autotuned"},
{"m": 5, "n": 15, "k": 9, "tile_m": 3, "tile_n": 1, "threads": 32, "grouping": 5, "minblocks": 25, "algorithm": "medium", "perf": 2022.26, "source": "autotuned"},
{"m": 5, "n": 15, "k": 10, "tile_m": 3, "tile_n": 1, "threads": 32, "grouping": 5, "minblocks": 26, "algorithm": "medium", "perf": 2142.76, "source": "autotuned"},
{"m": 5, "n": 15, "k": 13, "tile_m": 3, "tile_n": 1, "threads": 32, "grouping": 6, "minblocks": 27, "algorithm": "medium", "perf": 2344.95, "source": "autotuned"},
{"m": 5, "n": 15, "k": 15, "tile_m": 3, "tile_n": 1, "threads": 96, "grouping": 11, "minblocks": 13, "algorithm": "medium", "perf": 2529.91, "source": "autotuned"},
{"m": 5, "n": 15, "k": 16, "tile_m": 3, "tile_n": 1, "threads": 96, "grouping": 11, "minblocks": 13, "algorithm": "medium", "perf": 2666.91, "source": "autotuned"},
{"m": 5, "n": 15, "k": 22, "tile_m": 3, "tile_n": 1, "threads": 32, "grouping": 8, "minblocks": 3, "algorithm": "medium", "perf": 2972.37, "source": "autotuned"},
{"m": 5, "n": 15, "k": 25, "tile_m": 3, "tile_n": 1, "threads": 32, "grouping": 8, "minblocks": 1, "algorithm": "medium", "perf": 3045.61, "source": "autotuned"},
{"m": 5, "n": 15, "k": 26, "tile_m": 3, "tile_n": 1, "w": 10, "v": 12, "threads": 32, "grouping": 16, "minblocks": 12, "algorithm": "largeDB2", "perf": 3115.16, "source": "autotuned"},
{"m": 5, "n": 15, "k": 45, "tile_m": 3, "tile_n": 1, "threads": 32, "grouping": 11, "minblocks": 4, "algorithm": "medium", "perf": 3398.71, "source": "autotuned"},
{"m": 5, "n": 16, "k": 4, "tile_m": 3, "tile_n": 1, "threads": 96, "grouping": 8, "minblocks": 14, "algorithm": "medium", "perf": 1415.25, "source": "autotuned"},
{"m": 5, "n": 16, "k": 5, "tile_m": 3, "tile_n": 1, "threads": 96, "grouping": 8, "minblocks": 15, "algorithm": "medium", "perf": 1641.81, "source": "autotuned"},
{"m": 5, "n": 16, "k": 9, "tile_m": 3, "tile_n": 1, "threads": 32, "grouping": 5, "minblocks": 25, "algorithm": "medium", "perf": 2142.4, "source": "autotuned"},
{"m": 5, "n": 16, "k": 13, "tile_m": 3, "tile_n": 1, "threads": 32, "grouping": 7, "minblocks": 25, "algorithm": "medium", "perf": 2511.85, "source": "autotuned"},
{"m": 5, "n": 16, "k": 15, "tile_m": 3, "tile_n": 1, "threads": 96, "grouping": 8, "minblocks": 15, "algorithm": "medium", "perf": 2709.65, "source": "autotuned"},
{"m": 5, "n": 16, "k": 16, "tile_m": 3, "tile_n": 1, "w": 6, "v": 16, "threads": 32, "grouping": 16, "minblocks": 8, "algorithm": "largeDB2", "perf": 3030.93, "source": "autotuned"},
{"m": 5, "n": 16, "k": 22, "tile_m": 3, "tile_n": 1, "w": 10, "v": 16, "threads": 32, "grouping": 16, "minblocks": 12, "algorithm": "largeDB2", "perf": 3309.3, "source": "autotuned"},
{"m": 5, "n": 16, "k": 23, "tile_m": 3, "tile_n": 1, "w": 10, "v": 16, "threads": 32, "grouping": 16, "minblocks": 8, "algorithm": "largeDB2", "perf": 3282.83, "source": "autotuned"},
{"m": 5, "n": 16, "k": 25, "tile_m": 3, "tile_n": 1, "threads": 32, "grouping": 8, "minblocks": 13, "algorithm": "medium", "perf": 3262.78, "source": "autotuned"},
{"m": 5, "n": 16, "k": 26, "tile_m": 3, "tile_n": 1, "w": 10, "v": 16, "threads": 32, "grouping": 16, "minblocks": 4, "algorithm": "largeDB2", "perf": 3332.59, "source": "autotuned"},
{"m": 5, "n": 16, "k": 32, "tile_m": 3, "tile_n": 1, "threads": 32, "grouping": 8, "minblocks": 10, "algorithm": "medium", "perf": 3344.17, "source": "autotuned"},
{"m": 5, "n": 16, "k": 45, "tile_m": 3, "tile_n": 1, "threads": 32, "grouping": 11, "minblocks": 6, "algorithm": "medium", "perf": 3556.08, "source": "autotuned"},
{"m": 5, "n": 22, "k": 4, "tile_m": 3, "tile_n": 2, "threads": 96, "grouping": 12, "minblocks": 12, "algorithm": "medium", "perf": 1689.82, "source": "autotuned"},
{"m": 5, "n": 22, "k": 5, "tile_m": 3, "tile_n": 2, "threads": 32, "grouping": 6, "minblocks": 26, "algorithm": "medium", "perf": 1894.77, "source": "autotuned"},
{"m": 5, "n": 22, "k": 6, "tile_m": 3, "tile_n": 2, "threads": 32, "grouping": 8, "minblocks": 6, "algorithm": "medium", "perf": 2190.95, "source": "autotuned"},
{"m": 5, "n": 22, "k": 7, "tile_m": 5, "tile_n": 1, "threads": 32, "grouping": 5, "minblocks": 26, "algorithm": "medium", "perf": 2114.96, "source": "autotuned"},
{"m": 5, "n": 22, "k": 8, "tile_m": 3, "tile_n": 2, "threads": 32, "grouping": 5, "minblocks": 27, "algorithm": "medium", "perf": 2377.29, "source": "autotuned"},
{"m": 5, "n": 22, "k": 9, "tile_m": 5, "tile_n": 1, "threads": 64, "grouping": 9, "minblocks": 16, "algorithm": "medium", "perf": 2318.77, "source": "autotuned"},
{"m": 5, "n": 22, "k": 10, "tile_m": 3, "tile_n": 2, "threads": 32, "grouping": 5, "minblocks": 25, "algorithm": "medium", "perf": 2632.97, "source": "autotuned"},
{"m": 5, "n": 22, "k": 13, "tile_m": 3, "tile_n": 2, "w": 6, "v": 22, "threads": 32, "grouping": 16, "minblocks": 1, "algorithm": "largeDB2", "perf": 2902.99, "source": "autotuned"},
{"m": 5, "n": 22, "k": 15, "tile_m": 3, "tile_n": 2, "w": 6, "v": 22, "threads": 32, "grouping": 16, "minblocks": 8, "algorithm": "largeDB2", "perf": 3007.19, "source": "autotuned"},
{"m": 5, "n": 22, "k": 16, "tile_m": 3, "tile_n": 2, "threads": 32, "grouping": 8, "minblocks": 2, "algorithm": "medium", "perf": 3294.27, "source": "autotuned"},
{"m": 5, "n": 22, "k": 22, "tile_m": 3, "tile_n": 2, "threads": 32, "grouping": 8, "minblocks": 13, "algorithm": "medium", "perf": 3450.34, "source": "autotuned"},
{"m": 5, "n": 22, "k": 23, "tile_m": 3, "tile_n": 2, "w": 10, "v": 12, "threads": 32, "grouping": 16, "minblocks": 12, "algorithm": "largeDB2", "perf": 3273.99, "source": "autotuned"},
{"m": 5, "n": 22, "k": 25, "tile_m": 3, "tile_n": 2, "w": 12, "v": 22, "threads": 32, "grouping": 16, "minblocks": 8, "algorithm": "largeDB2", "perf": 3338.42, "source": "autotuned"},
{"m": 5, "n": 22, "k": 26, "tile_m": 3, "tile_n": 2, "w": 10, "v": 22, "threads": 32, "grouping": 16, "minblocks": 2, "algorithm": "largeDB2", "perf": 3331.46, "source": "autotuned"},
{"m": 5, "n": 22, "k": 32, "tile_m": 3, "tile_n": 2, "threads": 32, "grouping": 12, "minblocks": 9, "algorithm": "medium", "perf": 3655.12, "source": "autotuned"},
{"m": 5, "n": 22, "k": 45, "tile_m": 3, "tile_n": 2, "w": 18, "v": 22, "threads": 32, "grouping": 16, "minblocks": 8, "algorithm": "largeDB2", "perf": 3859.35, "source": "autotuned"},
{"m": 5, "n": 23, "k": 4, "tile_m": 5, "tile_n": 1, "threads": 96, "grouping": 8, "minblocks": 16, "algorithm": "medium", "perf": 1770.04, "source": "autotuned"},
{"m": 5, "n": 23, "k": 5, "tile_m": 3, "tile_n": 2, "threads": 32, "grouping": 8, "minblocks": 5, "algorithm": "medium", "perf": 1989.26, "source": "autotuned"},
{"m": 5, "n": 23, "k": 9, "tile_m": 3, "tile_n": 2, "threads": 32, "grouping": 5, "minblocks": 25, "algorithm": "medium", "perf": 2467.99, "source": "autotuned"},
{"m": 5, "n": 23, "k": 13, "tile_m": 3, "tile_n": 2, "threads": 32, "grouping": 8, "minblocks": 2, "algorithm": "medium", "perf": 2951.09, "source": "autotuned"},
{"m": 5, "n": 23, "k": 16, "tile_m": 3, "tile_n": 2, "threads": 32, "grouping": 8, "minblocks": 8, "algorithm": "medium", "perf": 3260.54, "source": "autotuned"},
{"m": 5, "n": 23, "k": 22, "tile_m": 5, "tile_n": 1, "threads": 32, "grouping": 8, "minblocks": 13, "algorithm": "medium", "perf": 3265.54, "source": "autotuned"},
{"m": 5, "n": 23, "k": 23, "tile_m": 3, "tile_n": 2, "w": 10, "v": 16, "threads": 32, "grouping": 16, "minblocks": 8, "algorithm": "largeDB2", "perf": 3216.81, "source": "autotuned"},
{"m": 5, "n": 23, "k": 26, "tile_m": 3, "tile_n": 2, "threads": 32, "grouping": 12, "minblocks": 4, "algorithm": "medium", "perf": 3441.81, "source": "autotuned"},
{"m": 5, "n": 24, "k": 5, "tile_m": 5, "tile_n": 1, "threads": 32, "grouping": 8, "minblocks": 8, "algorithm": "medium", "perf": 2052.98, "source": "autotuned"},
{"m": 5, "n": 24, "k": 13, "tile_m": 3, "tile_n": 2, "w": 6, "v": 24, "threads": 32, "grouping": 16, "minblocks": 8, "algorithm": "largeDB2", "perf": 3145.35, "source": "autotuned"},
{"m": 5, "n": 24, "k": 24, "tile_m": 3, "tile_n": 2, "threads": 32, "grouping": 12, "minblocks": 8, "algorithm": "medium", "perf": 3659.45, "source": "autotuned"},
{"m": 5, "n": 24, "k": 26, "tile_m": 3, "tile_n": 2, "threads": 32, "grouping": 12, "minblocks": 1, "algorithm": "medium", "perf": 3659.89, "source": "autotuned"},
{"m": 5, "n": 24, "k": 32, "tile_m": 3, "tile_n": 2, "threads": 32, "grouping": 12, "minblocks": 4, "algorithm": "medium", "perf": 3829.71, "source": "autotuned"},
{"m": 5, "n": 25, "k": 4, "tile_m": 3, "tile_n": 2, "threads": 32, "grouping": 7, "minblocks": 25, "algorithm": "medium", "perf": 1806.14, "source": "autotuned"},
{"m": 5, "n": 25, "k": 5, "tile_m": 3, "tile_n": 2, "threads": 32, "grouping": 8, "minblocks": 25, "algorithm": "medium", "perf": 2146.59, "source": "autotuned"},
{"m": 5, "n": 25, "k": 7, "tile_m": 3, "tile_n": 1, "threads": 64, "grouping": 7, "minblocks": 24, "algorithm": "medium", "perf": 2383.09, "source": "autotuned"},
{"m": 5, "n": 25, "k": 9, "tile_m": 5, "tile_n": 1, "threads": 64, "grouping": 9, "minblocks": 13, "algorithm": "medium", "perf": 2649.02, "source": "autotuned"},
{"m": 5, "n": 25, "k": 13, "tile_m": 3, "tile_n": 2, "threads": 32, "grouping": 8, "minblocks": 8, "algorithm": "medium", "perf": 3136.32, "source": "autotuned"},
{"m": 5, "n": 25, "k": 15, "tile_m": 3, "tile_n": 2, "threads": 32, "grouping": 8, "minblocks": 11, "algorithm": "medium", "perf": 3317.66, "source": "autotuned"},
{"m": 5, "n": 25, "k": 16, "tile_m": 3, "tile_n": 2, "threads": 32, "grouping": 8, "minblocks": 15, "algorithm": "medium", "perf": 3450.34, "source": "autotuned"},
{"m": 5, "n": 25, "k": 22, "tile_m": 3, "tile_n": 2, "w": 10, "v": 24, "threads": 32, "grouping": 16, "minblocks": 1, "algorithm": "largeDB2", "perf": 3397.17, "source": "autotuned"},
{"m": 5, "n": 25, "k": 25, "tile_m": 5, "tile_n": 1, "threads": 32, "grouping": 12, "minblocks": 10, "algorithm": "medium", "perf": 3582.78, "source": "autotuned"},
{"m": 5, "n": 25, "k": 26, "tile_m": 3, "tile_n": 2, "threads": 32, "grouping": 12, "minblocks": 1, "algorithm": "medium", "perf": 3620.28, "source": "autotuned"},
{"m": 5, "n": 25, "k": 28, "tile_m": 3, "tile_n": 2, "threads": 32, "grouping": 12, "minblocks": 8, "algorithm": "medium", "perf": 3653.32, "source": "autotuned"},
{"m": 5, "n": 25, "k": 32, "tile_m": 3, "tile_n": 2, "threads": 32, "grouping": 12, "minblocks": 4, "algorithm": "medium", "perf": 3783.09, "source": "autotuned"},
{"m": 5, "n": 25, "k": 45, "tile_m": 3, "tile_n": 2, "w": 16, "v": 18, "threads": 32, "grouping": 16, "minblocks": 12, "algorithm": "largeDB2", "perf": 3982.14, "source": "autotuned"},
{"m": 5, "n": 26, "k": 4, "tile_m": 3, "tile_n": 2, "threads": 32, "grouping": 8, "minblocks": 3, "algorithm": "medium", "perf": 1936.69, "source": "autotuned"},
{"m": 5, "n": 26, "k": 5, "tile_m": 5, "tile_n": 1, "threads": 32, "grouping": 8, "minblocks": 2, "algorithm": "medium", "perf": 2215.14, "source": "autotuned"},
{"m": 5, "n": 26, "k": 6, "tile_m": 3, "tile_n": 2, "threads": 32, "grouping": 8, "minblocks": 9, "algorithm": "medium", "perf": 2628.19, "source": "autotuned"},
{"m": 5, "n": 26, "k": 7, "tile_m": 3, "tile_n": 1, "threads": 64, "grouping": 7, "minblocks": 24, "algorithm": "medium", "perf": 2449.03, "source": "autotuned"},
{"m": 5, "n": 26, "k": 8, "tile_m": 3, "tile_n": 2, "threads": 32, "grouping": 5, "minblocks": 25, "algorithm": "medium", "perf": 2731.11, "source": "autotuned"},
{"m": 5, "n": 26, "k": 9, "tile_m": 5, "tile_n": 1, "threads": 64, "grouping": 9, "minblocks": 18, "algorithm": "medium", "perf": 2733.86, "source": "autotuned"},
{"m": 5, "n": 26, "k": 10, "tile_m": 3, "tile_n": 2, "threads": 32, "grouping": 8, "minblocks": 10, "algorithm": "medium", "perf": 2953.23, "source": "autotuned"},
{"m": 5, "n": 26, "k": 12, "tile_m": 3, "tile_n": 2, "threads": 32, "grouping": 8, "minblocks": 14, "algorithm": "medium", "perf": 3298.26, "source": "autotuned"},
{"m": 5, "n": 26, "k": 13, "tile_m": 3, "tile_n": 2, "w": 6, "v": 26, "threads": 32, "grouping": 16, "minblocks": 1, "algorithm": "largeDB2", "perf": 3426.08, "source": "autotuned"},
{"m": 5, "n": 26, "k": 15, "tile_m": 3, "tile_n": 2, "w": 6, "v": 26, "threads": 32, "grouping": 16, "minblocks": 1, "algorithm": "largeDB2", "perf": 3505.14, "source": "autotuned"},
{"m": 5, "n": 26, "k": 16, "tile_m": 3, "tile_n": 2, "threads": 32, "grouping": 8, "minblocks": 13, "algorithm": "medium", "perf": 3773.85, "source": "autotuned"},
{"m": 5, "n": 26, "k": 22, "tile_m": 3, "tile_n": 2, "w": 10, "v": 26, "threads": 32, "grouping": 16, "minblocks": 4, "algorithm": "largeDB2", "perf": 3498.49, "source": "autotuned"},
{"m": 5, "n": 26, "k": 23, "tile_m": 3, "tile_n": 2, "threads": 32, "grouping": 11, "minblocks": 6, "algorithm": "medium", "perf": 3659.75, "source": "autotuned"},
{"m": 5, "n": 26, "k": 24, "tile_m": 3, "tile_n": 2, "threads": 32, "grouping": 12, "minblocks": 8, "algorithm": "medium", "perf": 3824.72, "source": "autotuned"},
{"m": 5, "n": 26, "k": 25, "tile_m": 5, "tile_n": 1, "threads": 32, "grouping": 12, "minblocks": 7, "algorithm": "medium", "perf": 3646.0, "source": "autotuned"},
{"m": 5, "n": 26, "k": 26, "tile_m": 3, "tile_n": 2, "threads": 32, "grouping": 12, "minblocks": 6, "algorithm": "medium", "perf": 3892.24, "source": "autotuned"},
{"m": 5, "n": 26, "k": 28, "tile_m": 3, "tile_n": 2, "threads": 32, "grouping": 12, "minblocks": 8, "algorithm": "medium", "perf": 3902.61, "source": "autotuned"},
{"m": 5, "n": 26, "k": 32, "tile_m": 3, "tile_n": 2, "threads": 32, "grouping": 12, "minblocks": 8, "algorithm": "medium", "perf": 4079.71, "source": "autotuned"},
{"m": 5, "n": 26, "k": 45, "tile_m": 3, "tile_n": 2, "w": 18, "v": 26, "threads": 32, "grouping": 16, "minblocks": 8, "algorithm": "largeDB2", "perf": 4143.38, "source": "autotuned"},
{"m": 5, "n": 28, "k": 4, "tile_m": 3, "tile_n": 2, "threads": 32, "grouping": 8, "minblocks": 15, "algorithm": "medium", "perf": 2079.27, "source": "autotuned"},
{"m": 5, "n": 28, "k": 5, "tile_m": 5, "tile_n": 1, "threads": 32, "grouping": 8, "minblocks": 1, "algorithm": "medium", "perf": 2380.74, "source": "autotuned"},
{"m": 5, "n": 28, "k": 7, "tile_m": 5, "tile_n": 1, "threads": 64, "grouping": 9, "minblocks": 15, "algorithm": "medium", "perf": 2483.36, "source": "autotuned"},
{"m": 5, "n": 28, "k": 9, "tile_m": 5, "tile_n": 1, "threads": 64, "grouping": 9, "minblocks": 14, "algorithm": "medium", "perf": 2910.84, "source": "autotuned"},
{"m": 5, "n": 28, "k": 13, "tile_m": 3, "tile_n": 2, "w": 6, "v": 28, "threads": 32, "grouping": 16, "minblocks": 4, "algorithm": "largeDB2", "perf": 3567.41, "source": "autotuned"},
{"m": 5, "n": 28, "k": 25, "tile_m": 3, "tile_n": 2, "threads": 32, "grouping": 11, "minblocks": 8, "algorithm": "medium", "perf": 3836.11, "source": "autotuned"},
{"m": 5, "n": 28, "k": 26, "tile_m": 3, "tile_n": 2, "threads": 32, "grouping": 12, "minblocks": 2, "algorithm": "medium", "perf": 4045.71, "source": "autotuned"},
{"m": 5, "n": 28, "k": 28, "tile_m": 3, "tile_n": 2, "threads": 32, "grouping": 12, "minblocks": 6, "algorithm": "medium", "perf": 4046.67, "source": "autotuned"},
{"m": 5, "n": 28, "k": 32, "tile_m": 3, "tile_n": 2, "threads": 32, "grouping": 12, "minblocks": 7, "algorithm": "medium", "perf": 4257.19, "source": "autotuned"},
{"m": 5, "n": 28, "k": 45, "tile_m": 3, "tile_n": 2, "w": 18, "v": 28, "threads": 32, "grouping": 16, "minblocks": 12, "algorithm": "largeDB2", "perf": 4221.01, "source": "autotuned"},
{"m": 5, "n": 32, "k": 4, "tile_m": 5, "tile_n": 1, "threads": 32, "grouping": 8, "minblocks": 5, "algorithm": "medium", "perf": 2238.05, "source": "autotuned"},
{"m": 5, "n": 32, "k": 5, "tile_m": 5, "tile_n": 1, "threads": 32, "grouping": 8, "minblocks": 10, "algorithm": "medium", "perf": 2594.84, "source": "autotuned"},
{"m": 5, "n": 32, "k": 6, "tile_m": 3, "tile_n": 2, "threads": 32, "grouping": 8, "minblocks": 22, "algorithm": "medium", "perf": 3050.81, "source": "autotuned"},
{"m": 5, "n": 32, "k": 7, "tile_m": 5, "tile_n": 1, "threads": 64, "grouping": 9, "minblocks": 14, "algorithm": "medium", "perf": 2894.96, "source": "autotuned"},
{"m": 5, "n": 32, "k": 8, "tile_m": 5, "tile_n": 1, "threads": 64, "grouping": 9, "minblocks": 16, "algorithm": "medium", "perf": 3110.28, "source": "autotuned"},
{"m": 5, "n": 32, "k": 9, "tile_m": 3, "tile_n": 2, "w": 4, "v": 32, "threads": 32, "grouping": 16, "minblocks": 8, "algorithm": "largeDB2", "perf": 3350.86, "source": "autotuned"},
{"m": 5, "n": 32, "k": 10, "tile_m": 3, "tile_n": 2, "w": 4, "v": 32, "threads": 32, "grouping": 16, "minblocks": 4, "algorithm": "largeDB2", "perf": 3610.54, "source": "autotuned"},
{"m": 5, "n": 32, "k": 12, "tile_m": 3, "tile_n": 2, "threads": 32, "grouping": 8, "minblocks": 13, "algorithm": "medium", "perf": 3872.18, "source": "autotuned"},
{"m": 5, "n": 32, "k": 13, "tile_m": 3, "tile_n": 2, "w": 6, "v": 32, "threads": 32, "grouping": 16, "minblocks": 2, "algorithm": "largeDB2", "perf": 4036.18, "source": "autotuned"},
{"m": 5, "n": 32, "k": 16, "tile_m": 3, "tile_n": 2, "threads": 32, "grouping": 8, "minblocks": 13, "algorithm": "medium", "perf": 4097.28, "source": "autotuned"},
{"m": 5, "n": 32, "k": 22, "tile_m": 3, "tile_n": 2, "threads": 32, "grouping": 12, "minblocks": 7, "algorithm": "medium", "perf": 4290.54, "source": "autotuned"},
{"m": 5, "n": 32, "k": 24, "tile_m": 3, "tile_n": 2, "threads": 32, "grouping": 12, "minblocks": 2, "algorithm": "medium", "perf": 4360.05, "source": "autotuned"},
{"m": 5, "n": 32, "k": 25, "tile_m": 3, "tile_n": 2, "threads": 32, "grouping": 11, "minblocks": 2, "algorithm": "medium", "perf": 4234.13, "source": "autotuned"},
{"m": 5, "n": 32, "k": 26, "tile_m": 3, "tile_n": 2, "threads": 32, "grouping": 12, "minblocks": 3, "algorithm": "medium", "perf": 4422.21, "source": "autotuned"},
{"m": 5, "n": 32, "k": 28, "tile_m": 3, "tile_n": 2, "threads": 32, "grouping": 12, "minblocks": 5, "algorithm": "medium", "perf": 4403.6, "source": "autotuned"},
{"m": 5, "n": 32, "k": 32, "tile_m": 3, "tile_n": 2, "threads": 32, "grouping": 12, "minblocks": 1, "algorithm": "medium", "perf": 4629.35, "source": "autotuned"},
{"m": 5, "n": 32, "k": 45, "tile_m": 3, "tile_n": 2, "w": 22, "v": 32, "threads": 32, "grouping": 16, "minblocks": 1, "algorithm": "largeDB2", "perf": 4466.05, "source": "autotuned"},
{"m": 5, "n": 45, "k": 4, "tile_m": 3, "tile_n": 3, "threads": 32, "grouping": 8, "minblocks": 3, "algorithm": "medium", "perf": 2610.09, "source": "autotuned"},
{"m": 5, "n": 45, "k": 5, "tile_m": 3, "tile_n": 3, "threads": 32, "grouping": 8, "minblocks": 5, "algorithm": "medium", "perf": 3051.24, "source": "autotuned"},
{"m": 5, "n": 45, "k": 6, "tile_m": 3, "tile_n": 3, "threads": 32, "grouping": 8, "minblocks": 2, "algorithm": "medium", "perf": 3459.66, "source": "autotuned"},
{"m": 5, "n": 45, "k": 7, "tile_m": 5, "tile_n": 2, "threads": 32, "grouping": 8, "minblocks": 7, "algorithm": "medium", "perf": 3238.9, "source": "autotuned"},
{"m": 5, "n": 45, "k": 8, "tile_m": 3, "tile_n": 3, "threads": 96, "grouping": 11, "minblocks": 12, "algorithm": "medium", "perf": 3460.4, "source": "autotuned"},
{"m": 5, "n": 45, "k": 9, "tile_m": 3, "tile_n": 3, "threads": 32, "grouping": 8, "minblocks": 16, "algorithm": "medium", "perf": 3675.17, "source": "autotuned"},
{"m": 5, "n": 45, "k": 10, "tile_m": 3, "tile_n": 3, "threads": 32, "grouping": 8, "minblocks": 16, "algorithm": "medium", "perf": 3810.88, "source": "autotuned"},
{"m": 5, "n": 45, "k": 13, "tile_m": 3, "tile_n": 3, "threads": 32, "grouping": 11, "minblocks": 4, "algorithm": "medium", "perf": 4175.4, "source": "autotuned"},
{"m": 5, "n": 45, "k": 15, "tile_m": 3, "tile_n": 3, "threads": 32, "grouping": 11, "minblocks": 4, "algorithm": "medium", "perf": 4264.49, "source": "autotuned"},
{"m": 5, "n": 45, "k": 16, "tile_m": 3, "tile_n": 3, "threads": 32, "grouping": 11, "minblocks": 3, "algorithm": "medium", "perf": 4372.07, "source": "autotuned"},
{"m": 5, "n": 45, "k": 22, "tile_m": 3, "tile_n": 3, "threads": 32, "grouping": 16, "minblocks": 2, "algorithm": "medium", "perf": 4155.14, "source": "autotuned"},
{"m": 5, "n": 45, "k": 25, "tile_m": 3, "tile_n": 3, "threads": 32, "grouping": 16, "minblocks": 3, "algorithm": "medium", "perf": 4316.1, "source": "autotuned"},
{"m": 5, "n": 45, "k": 26, "tile_m": 3, "tile_n": 3, "threads": 32, "grouping": 16, "minblocks": 4, "algorithm": "medium", "perf": 4345.42, "source": "autotuned"},
{"m": 5, "n": 45, "k": 28, "tile_m": 3, "tile_n": 3, "threads": 32, "grouping": 16, "minblocks": 5, "algorithm": "medium", "perf": 4423.47, "source": "autotuned"},
{"m": 5, "n": 45, "k": 32, "tile_m": 3, "tile_n": 3, "threads": 32, "grouping": 16, "minblocks": 2, "algorithm": "medium", "perf": 4573.83, "source": "autotuned"},
{"m": 5, "n": 45, "k": 45, "tile_m": 5, "tile_n": 2, "w": 16, "v": 28, "threads": 32, "grouping": 16, "minblocks": 8, "algorithm": "largeDB2", "perf": 4510.09, "source": "autotuned"},
{"m": 6, "n": 4, "k": 4, "tile_m": 1, "tile_n": 1, "threads": 32, "grouping": 8, "minblocks": 5, "algorithm": "medium", "perf": 541.907, "source": "autotuned"},
{"m": 6, "n": 4, "k": 5, "tile_m": 1, "tile_n": 1, "threads": 32, "grouping": 9, "minblocks": 11, "algorithm": "medium", "perf": 668.983, "source": "autotuned"},
{"m": 6, "n": 4, "k": 6, "tile_m": 1, "tile_n": 1, "threads": 64, "grouping": 9, "minblocks": 17, "algorithm": "medium", "perf": 728.613, "source": "autotuned"},
{"m": 6, "n": 4, "k": 7, "tile_m": 1, "tile_n": 1, "threads": 64, "grouping": 9, "minblocks": 7, "algorithm": "medium", "perf": 823.187, "source": "autotuned"},
{"m": 6, "n": 4, "k": 8, "tile_m": 1, "tile_n": 1, "threads": 64, "grouping": 9, "minblocks": 5, "algorithm": "medium", "perf": 897.477, "source": "autotuned"},
{"m": 6, "n": 4, "k": 9, "tile_m": 1, "tile_n": 1, "threads": 64, "grouping": 9, "minblocks": 17, "algorithm": "medium", "perf": 976.286, "source": "autotuned"},
{"m": 6, "n": 4, "k": 10, "tile_m": 1, "tile_n": 1, "threads": 64, "grouping": 9, "minblocks": 8, "algorithm": "medium", "perf": 1048.1, "source": "autotuned"},
{"m": 6, "n": 4, "k": 13, "tile_m": 1, "tile_n": 1, "threads": 96, "grouping": 8, "minblocks": 16, "algorithm": "medium", "perf": 1159.89, "source": "autotuned"},
{"m": 6, "n": 4, "k": 15, "tile_m": 1, "tile_n": 1, "threads": 96, "grouping": 8, "minblocks": 20, "algorithm": "medium", "perf": 1285.31, "source": "autotuned"},
{"m": 6, "n": 4, "k": 22, "tile_m": 1, "tile_n": 1, "threads": 96, "grouping": 8, "minblocks": 15, "algorithm": "medium", "perf": 1414.01, "source": "autotuned"},
{"m": 6, "n": 4, "k": 26, "tile_m": 1, "tile_n": 1, "threads": 160, "grouping": 11, "minblocks": 12, "algorithm": "medium", "perf": 1517.43, "source": "autotuned"},
{"m": 6, "n": 4, "k": 32, "tile_m": 1, "tile_n": 1, "threads": 32, "grouping": 3, "minblocks": 4, "algorithm": "medium", "perf": 1609.93, "source": "autotuned"},
{"m": 6, "n": 4, "k": 45, "tile_m": 1, "tile_n": 1, "w": 20, "v": 4, "threads": 32, "grouping": 16, "minblocks": 2, "algorithm": "largeDB2", "perf": 1810.71, "source": "autotuned"},
{"m": 6, "n": 5, "k": 4, "tile_m": 1, "tile_n": 1, "threads": 32, "grouping": 8, "minblocks": 7, "algorithm": "medium", "perf": 688.008, "source": "autotuned"},
{"m": 6, "n": 5, "k": 5, "tile_m": 1, "tile_n": 1, "threads": 32, "grouping": 8, "minblocks": 10, "algorithm": "medium", "perf": 843.302, "source": "autotuned"},
{"m": 6, "n": 5, "k": 6, "tile_m": 1, "tile_n": 1, "threads": 64, "grouping": 8, "minblocks": 10, "algorithm": "medium", "perf": 912.045, "source": "autotuned"},
{"m": 6, "n": 5, "k": 7, "tile_m": 1, "tile_n": 1, "threads": 64, "grouping": 8, "minblocks": 10, "algorithm": "medium", "perf": 1022.77, "source": "autotuned"},
{"m": 6, "n": 5, "k": 8, "tile_m": 1, "tile_n": 1, "threads": 64, "grouping": 8, "minblocks": 10, "algorithm": "medium", "perf": 1169.34, "source": "autotuned"},
{"m": 6, "n": 5, "k": 9, "tile_m": 1, "tile_n": 1, "threads": 64, "grouping": 9, "minblocks": 26, "algorithm": "medium", "perf": 1222.46, "source": "autotuned"},
{"m": 6, "n": 5, "k": 10, "tile_m": 1, "tile_n": 1, "threads": 64, "grouping": 9, "minblocks": 6, "algorithm": "medium", "perf": 1295.96, "source": "autotuned"},
{"m": 6, "n": 5, "k": 13, "tile_m": 1, "tile_n": 1, "threads": 96, "grouping": 8, "minblocks": 20, "algorithm": "medium", "perf": 1427.22, "source": "autotuned"},
{"m": 6, "n": 5, "k": 14, "tile_m": 1, "tile_n": 1, "threads": 96, "grouping": 8, "minblocks": 10, "algorithm": "medium", "perf": 1494.58, "source": "autotuned"},
{"m": 6, "n": 5, "k": 15, "tile_m": 1, "tile_n": 1, "threads": 96, "grouping": 8, "minblocks": 17, "algorithm": "medium", "perf": 1584.38, "source": "autotuned"},
{"m": 6, "n": 5, "k": 22, "tile_m": 1, "tile_n": 1, "threads": 160, "grouping": 11, "minblocks": 12, "algorithm": "medium", "perf": 1715.32, "source": "autotuned"},
{"m": 6, "n": 5, "k": 26, "tile_m": 1, "tile_n": 1, "threads": 160, "grouping": 11, "minblocks": 11, "algorithm": "medium", "perf": 1877.0, "source": "autotuned"},
{"m": 6, "n": 5, "k": 32, "tile_m": 1, "tile_n": 1, "threads": 32, "grouping": 2, "minblocks": 19, "algorithm": "medium", "perf": 1967.52, "source": "autotuned"},
{"m": 6, "n": 5, "k": 45, "tile_m": 1, "tile_n": 1, "w": 18, "v": 4, "threads": 32, "grouping": 16, "minblocks": 12, "algorithm": "largeDB2", "perf": 2144.28, "source": "autotuned"},
{"m": 6, "n": 6, "k": 4, "tile_m": 1, "tile_n": 2, "threads": 32, "grouping": 10, "minblocks": 16, "algorithm": "medium", "perf": 772.552, "source": "autotuned"},
{"m": 6, "n": 6, "k": 5, "tile_m": 1, "tile_n": 2, "threads": 32, "grouping": 9, "minblocks": 13, "algorithm": "medium", "perf": 930.07, "source": "autotuned"},
{"m": 6, "n": 6, "k": 6, "tile_m": 1, "tile_n": 2, "threads": 64, "grouping": 9, "minblocks": 11, "algorithm": "medium", "perf": 1011.15, "source": "autotuned"},
{"m": 6, "n": 6, "k": 7, "tile_m": 1, "tile_n": 2, "threads": 64, "grouping": 9, "minblocks": 19, "algorithm": "medium", "perf": 1126.38, "source": "autotuned"},
{"m": 6, "n": 6, "k": 8, "tile_m": 1, "tile_n": 2, "threads": 64, "grouping": 9, "minblocks": 16, "algorithm": "medium", "perf": 1237.8, "source": "autotuned"},
{"m": 6, "n": 6, "k": 9, "tile_m": 1, "tile_n": 2, "threads": 64, "grouping": 9, "minblocks": 23, "algorithm": "medium", "perf": 1299.28, "source": "autotuned"},
{"m": 6, "n": 6, "k": 10, "tile_m": 1, "tile_n": 2, "threads": 64, "grouping": 9, "minblocks": 24, "algorithm": "medium", "perf": 1414.98, "source": "autotuned"},
{"m": 6, "n": 6, "k": 13, "tile_m": 1, "tile_n": 2, "threads": 32, "grouping": 4, "minblocks": 7, "algorithm": "small", "perf": 1572.58, "source": "autotuned"},
{"m": 6, "n": 6, "k": 14, "tile_m": 1, "tile_n": 2, "threads": 32, "grouping": 7, "minblocks": 11, "algorithm": "small", "perf": 1611.16, "source": "autotuned"},
{"m": 6, "n": 6, "k": 15, "tile_m": 1, "tile_n": 2, "threads": 32, "grouping": 4, "minblocks": 8, "algorithm": "small", "perf": 1680.72, "source": "autotuned"},
{"m": 6, "n": 6, "k": 22, "tile_m": 1, "tile_n": 2, "threads": 32, "grouping": 8, "minblocks": 27, "algorithm": "medium", "perf": 1852.2, "source": "autotuned"},
{"m": 6, "n": 6, "k": 26, "tile_m": 1, "tile_n": 2, "threads": 32, "grouping": 8, "minblocks": 1, "algorithm": "medium", "perf": 1974.34, "source": "autotuned"},
{"m": 6, "n": 6, "k": 32, "tile_m": 1, "tile_n": 2, "threads": 32, "grouping": 8, "minblocks": 10, "algorithm": "medium", "perf": 2114.42, "source": "autotuned"},
{"m": 6, "n": 6, "k": 45, "tile_m": 1, "tile_n": 2, "threads": 32, "grouping": 8, "minblocks": 1, "algorithm": "medium", "perf": 2364.22, "source": "autotuned"},
{"m": 6, "n": 7, "k": 4, "tile_m": 1, "tile_n": 2, "threads": 32, "grouping": 9, "minblocks": 9, "algorithm": "medium", "perf": 895.441, "source": "autotuned"},
{"m": 6, "n": 7, "k": 5, "tile_m": 1, "tile_n": 2, "threads": 64, "grouping": 8, "minblocks": 23, "algorithm": "medium", "perf": 999.909, "source": "autotuned"},
{"m": 6, "n": 7, "k": 6, "tile_m": 1, "tile_n": 2, "threads": 64, "grouping": 9, "minblocks": 21, "algorithm": "medium", "perf": 1154.27, "source": "autotuned"},
{"m": 6, "n": 7, "k": 7, "tile_m": 1, "tile_n": 2, "threads": 64, "grouping": 9, "minblocks": 24, "algorithm": "medium", "perf": 1275.36, "source": "autotuned"},
{"m": 6, "n": 7, "k": 8, "tile_m": 1, "tile_n": 2, "threads": 64, "grouping": 9, "minblocks": 23, "algorithm": "medium", "perf": 1390.57, "source": "autotuned"},
{"m": 6, "n": 7, "k": 9, "tile_m": 1, "tile_n": 2, "threads": 64, "grouping": 9, "minblocks": 24, "algorithm": "medium", "perf": 1509.73, "source": "autotuned"},
{"m": 6, "n": 7, "k": 10, "tile_m": 1, "tile_n": 2, "threads": 96, "grouping": 8, "minblocks": 19, "algorithm": "medium", "perf": 1497.15, "source": "autotuned"},
{"m": 6, "n": 7, "k": 13, "tile_m": 1, "tile_n": 2, "threads": 96, "grouping": 8, "minblocks": 20, "algorithm": "medium", "perf": 1754.64, "source": "autotuned"},
{"m": 6, "n": 7, "k": 15, "tile_m": 1, "tile_n": 2, "threads": 128, "grouping": 8, "minblocks": 16, "algorithm": "medium", "perf": 1807.63, "source": "autotuned"},
{"m": 6, "n": 7, "k": 22, "tile_m": 1, "tile_n": 2, "threads": 160, "grouping": 11, "minblocks": 12, "algorithm": "medium", "perf": 2030.03, "source": "autotuned"},
{"m": 6, "n": 7, "k": 26, "tile_m": 1, "tile_n": 2, "threads": 32, "grouping": 8, "minblocks": 20, "algorithm": "medium", "perf": 2099.56, "source": "autotuned"},
{"m": 6, "n": 7, "k": 32, "tile_m": 1, "tile_n": 2, "threads": 32, "grouping": 4, "minblocks": 3, "algorithm": "medium", "perf": 2239.87, "source": "autotuned"},
{"m": 6, "n": 7, "k": 45, "tile_m": 1, "tile_n": 2, "threads": 32, "grouping": 8, "minblocks": 3, "algorithm": "medium", "perf": 2402.28, "source": "autotuned"},
{"m": 6, "n": 8, "k": 4, "tile_m": 1, "tile_n": 2, "threads": 64, "grouping": 9, "minblocks": 18, "algorithm": "medium", "perf": 994.971, "source": "autotuned"},
{"m": 6, "n": 8, "k": 5, "tile_m": 1, "tile_n": 2, "threads": 64, "grouping": 9, "minblocks": 18, "algorithm": "medium", "perf": 1200.84, "source": "autotuned"},
{"m": 6, "n": 8, "k": 6, "tile_m": 1, "tile_n": 2, "threads": 64, "grouping": 9, "minblocks": 18, "algorithm": "medium", "perf": 1352.39, "source": "autotuned"},
{"m": 6, "n": 8, "k": 7, "tile_m": 1, "tile_n": 2, "threads": 64, "grouping": 13, "minblocks": 13, "algorithm": "medium", "perf": 1501.74, "source": "autotuned"},
{"m": 6, "n": 8, "k": 8, "tile_m": 1, "tile_n": 2, "threads": 64, "grouping": 5, "minblocks": 30, "algorithm": "small", "perf": 1446.78, "source": "autotuned"},
{"m": 6, "n": 8, "k": 9, "tile_m": 1, "tile_n": 2, "threads": 96, "grouping": 9, "minblocks": 14, "algorithm": "medium", "perf": 1627.41, "source": "autotuned"},
{"m": 6, "n": 8, "k": 10, "tile_m": 1, "tile_n": 2, "threads": 96, "grouping": 9, "minblocks": 14, "algorithm": "medium", "perf": 1740.4, "source": "autotuned"},
{"m": 6, "n": 8, "k": 13, "tile_m": 1, "tile_n": 2, "threads": 128, "grouping": 8, "minblocks": 16, "algorithm": "medium", "perf": 1900.43, "source": "autotuned"},
{"m": 6, "n": 8, "k": 15, "tile_m": 1, "tile_n": 2, "threads": 128, "grouping": 9, "minblocks": 14, "algorithm": "medium", "perf": 2086.19, "source": "autotuned"},
{"m": 6, "n": 8, "k": 22, "tile_m": 1, "tile_n": 2, "threads": 32, "grouping": 8, "minblocks": 24, "algorithm": "medium", "perf": 2232.4, "source": "autotuned"},
{"m": 6, "n": 8, "k": 26, "tile_m": 1, "tile_n": 2, "threads": 32, "grouping": 8, "minblocks": 17, "algorithm": "medium", "perf": 2388.81, "source": "autotuned"},
{"m": 6, "n": 8, "k": 32, "tile_m": 1, "tile_n": 2, "w": 12, "v": 8, "threads": 32, "grouping": 16, "minblocks": 8, "algorithm": "largeDB2", "perf": 2678.54, "source": "autotuned"},
{"m": 6, "n": 8, "k": 45, "tile_m": 1, "tile_n": 2, "w": 20, "v": 8, "threads": 32, "grouping": 16, "minblocks": 4, "algorithm": "largeDB2", "perf": 2727.44, "source": "autotuned"},
{"m": 6, "n": 9, "k": 4, "tile_m": 1, "tile_n": 2, "threads": 64, "grouping": 8, "minblocks": 24, "algorithm": "medium", "perf": 1071.69, "source": "autotuned"},
{"m": 6, "n": 9, "k": 5, "tile_m": 1, "tile_n": 2, "threads": 64, "grouping": 9, "minblocks": 4, "algorithm": "medium", "perf": 1275.03, "source": "autotuned"},
{"m": 6, "n": 9, "k": 6, "tile_m": 1, "tile_n": 2, "threads": 64, "grouping": 9, "minblocks": 23, "algorithm": "medium", "perf": 1465.47, "source": "autotuned"},
{"m": 6, "n": 9, "k": 7, "tile_m": 1, "tile_n": 2, "threads": 64, "grouping": 9, "minblocks": 24, "algorithm": "medium", "perf": 1637.3, "source": "autotuned"},
{"m": 6, "n": 9, "k": 8, "tile_m": 1, "tile_n": 2, "threads": 96, "grouping": 8, "minblocks": 18, "algorithm": "medium", "perf": 1684.27, "source": "autotuned"},
{"m": 6, "n": 9, "k": 9, "tile_m": 1, "tile_n": 2, "threads": 96, "grouping": 9, "minblocks": 20, "algorithm": "medium", "perf": 1758.87, "source": "autotuned"},
{"m": 6, "n": 9, "k": 10, "tile_m": 1, "tile_n": 2, "threads": 96, "grouping": 8, "minblocks": 14, "algorithm": "medium", "perf": 1902.88, "source": "autotuned"},
{"m": 6, "n": 9, "k": 13, "tile_m": 1, "tile_n": 2, "threads": 128, "grouping": 8, "minblocks": 16, "algorithm": "medium", "perf": 2077.93, "source": "autotuned"},
{"m": 6, "n": 9, "k": 14, "tile_m": 1, "tile_n": 2, "threads": 128, "grouping": 8, "minblocks": 15, "algorithm": "medium", "perf": 2200.36, "source": "autotuned"},
{"m": 6, "n": 9, "k": 15, "tile_m": 1, "tile_n": 2, "threads": 96, "grouping": 8, "minblocks": 15, "algorithm": "medium", "perf": 2109.3, "source": "autotuned"},
{"m": 6, "n": 9, "k": 22, "tile_m": 1, "tile_n": 2, "threads": 32, "grouping": 8, "minblocks": 1, "algorithm": "medium", "perf": 2381.98, "source": "autotuned"},
{"m": 6, "n": 9, "k": 26, "tile_m": 1, "tile_n": 2, "threads": 32, "grouping": 8, "minblocks": 3, "algorithm": "medium", "perf": 2548.89, "source": "autotuned"},
{"m": 6, "n": 9, "k": 32, "tile_m": 1, "tile_n": 2, "threads": 32, "grouping": 8, "minblocks": 3, "algorithm": "medium", "perf": 2781.56, "source": "autotuned"},
{"m": 6, "n": 9, "k": 45, "tile_m": 1, "tile_n": 2, "threads": 32, "grouping": 8, "minblocks": 5, "algorithm": "medium", "perf": 2878.68, "source": "autotuned"},
{"m": 6, "n": 10, "k": 4, "tile_m": 1, "tile_n": 2, "threads": 64, "grouping": 9, "minblocks": 3, "algorithm": "medium", "perf": 1206.76, "source": "autotuned"},
{"m": 6, "n": 10, "k": 5, "tile_m": 1, "tile_n": 2, "threads": 64, "grouping": 9, "minblocks": 21, "algorithm": "medium", "perf": 1428.35, "source": "autotuned"},
{"m": 6, "n": 10, "k": 6, "tile_m": 1, "tile_n": 2, "threads": 64, "grouping": 9, "minblocks": 17, "algorithm": "medium", "perf": 1655.24, "source": "autotuned"},
{"m": 6, "n": 10, "k": 7, "tile_m": 1, "tile_n": 2, "threads": 96, "grouping": 8, "minblocks": 20, "algorithm": "medium", "perf": 1682.38, "source": "autotuned"},
{"m": 6, "n": 10, "k": 8, "tile_m": 1, "tile_n": 2, "threads": 96, "grouping": 9, "minblocks": 16, "algorithm": "medium", "perf": 1880.39, "source": "autotuned"},
{"m": 6, "n": 10, "k": 9, "tile_m": 1, "tile_n": 2, "threads": 96, "grouping": 8, "minblocks": 20, "algorithm": "medium", "perf": 1950.99, "source": "autotuned"},
{"m": 6, "n": 10, "k": 10, "tile_m": 1, "tile_n": 2, "threads": 128, "grouping": 9, "minblocks": 16, "algorithm": "medium", "perf": 1991.33, "source": "autotuned"},
{"m": 6, "n": 10, "k": 13, "tile_m": 1, "tile_n": 2, "threads": 96, "grouping": 8, "minblocks": 15, "algorithm": "medium", "perf": 2190.54, "source": "autotuned"},
{"m": 6, "n": 10, "k": 14, "tile_m": 1, "tile_n": 2, "threads": 96, "grouping": 8, "minblocks": 15, "algorithm": "medium", "perf": 2309.77, "source": "autotuned"},
{"m": 6, "n": 10, "k": 15, "tile_m": 1, "tile_n": 2, "threads": 96, "grouping": 8, "minblocks": 16, "algorithm": "medium", "perf": 2353.44, "source": "autotuned"},
{"m": 6, "n": 10, "k": 22, "tile_m": 1, "tile_n": 2, "threads": 32, "grouping": 8, "minblocks": 21, "algorithm": "medium", "perf": 2666.9, "source": "autotuned"},
{"m": 6, "n": 10, "k": 26, "tile_m": 1, "tile_n": 2, "w": 10, "v": 10, "threads": 32, "grouping": 16, "minblocks": 2, "algorithm": "largeDB2", "perf": 2897.84, "source": "autotuned"},
{"m": 6, "n": 10, "k": 32, "tile_m": 1, "tile_n": 2, "w": 14, "v": 10, "threads": 32, "grouping": 16, "minblocks": 4, "algorithm": "largeDB2", "perf": 3061.53, "source": "autotuned"},
{"m": 6, "n": 10, "k": 45, "tile_m": 1, "tile_n": 2, "w": 16, "v": 10, "threads": 32, "grouping": 16, "minblocks": 12, "algorithm": "largeDB2", "perf": 3128.69, "source": "autotuned"},
{"m": 6, "n": 13, "k": 4, "tile_m": 3, "tile_n": 1, "threads": 64, "grouping": 9, "minblocks": 1, "algorithm": "medium", "perf": 1404.74, "source": "autotuned"},
{"m": 6, "n": 13, "k": 5, "tile_m": 3, "tile_n": 1, "threads": 96, "grouping": 8, "minblocks": 14, "algorithm": "medium", "perf": 1614.78, "source": "autotuned"},
{"m": 6, "n": 13, "k": 6, "tile_m": 3, "tile_n": 1, "threads": 96, "grouping": 11, "minblocks": 12, "algorithm": "medium", "perf": 1840.31, "source": "autotuned"},
{"m": 6, "n": 13, "k": 7, "tile_m": 3, "tile_n": 1, "threads": 96, "grouping": 8, "minblocks": 14, "algorithm": "medium", "perf": 2049.42, "source": "autotuned"},
{"m": 6, "n": 13, "k": 8, "tile_m": 3, "tile_n": 1, "threads": 128, "grouping": 8, "minblocks": 16, "algorithm": "medium", "perf": 2066.87, "source": "autotuned"},
{"m": 6, "n": 13, "k": 9, "tile_m": 3, "tile_n": 1, "threads": 128, "grouping": 11, "minblocks": 12, "algorithm": "medium", "perf": 2216.03, "source": "autotuned"},
{"m": 6, "n": 13, "k": 10, "tile_m": 3, "tile_n": 1, "threads": 32, "grouping": 5, "minblocks": 25, "algorithm": "medium", "perf": 2264.45, "source": "autotuned"},
{"m": 6, "n": 13, "k": 13, "tile_m": 3, "tile_n": 1, "threads": 96, "grouping": 11, "minblocks": 11, "algorithm": "medium", "perf": 2521.09, "source": "autotuned"},
{"m": 6, "n": 13, "k": 14, "tile_m": 3, "tile_n": 1, "threads": 96, "grouping": 8, "minblocks": 15, "algorithm": "medium", "perf": 2623.53, "source": "autotuned"},
{"m": 6, "n": 13, "k": 15, "tile_m": 3, "tile_n": 1, "threads": 32, "grouping": 7, "minblocks": 27, "algorithm": "medium", "perf": 2683.09, "source": "autotuned"},
{"m": 6, "n": 13, "k": 22, "tile_m": 3, "tile_n": 1, "threads": 32, "grouping": 8, "minblocks": 18, "algorithm": "medium", "perf": 3134.82, "source": "autotuned"},
{"m": 6, "n": 13, "k": 26, "tile_m": 3, "tile_n": 1, "threads": 32, "grouping": 8, "minblocks": 8, "algorithm": "medium", "perf": 3299.49, "source": "autotuned"},
{"m": 6, "n": 13, "k": 32, "tile_m": 3, "tile_n": 1, "threads": 32, "grouping": 8, "minblocks": 2, "algorithm": "medium", "perf": 3433.42, "source": "autotuned"},
{"m": 6, "n": 13, "k": 45, "tile_m": 3, "tile_n": 1, "threads": 32, "grouping": 11, "minblocks": 2, "algorithm": "medium", "perf": 3658.66, "source": "autotuned"},
{"m": 6, "n": 14, "k": 5, "tile_m": 3, "tile_n": 1, "threads": 96, "grouping": 8, "minblocks": 16, "algorithm": "medium", "perf": 1717.72, "source": "autotuned"},
{"m": 6, "n": 14, "k": 6, "tile_m": 3, "tile_n": 1, "threads": 96, "grouping": 8, "minblocks": 14, "algorithm": "medium", "perf": 1992.06, "source": "autotuned"},
{"m": 6, "n": 14, "k": 9, "tile_m": 3, "tile_n": 1, "threads": 128, "grouping": 9, "minblocks": 14, "algorithm": "medium", "perf": 2358.63, "source": "autotuned"},
{"m": 6, "n": 14, "k": 10, "tile_m": 3, "tile_n": 1, "threads": 32, "grouping": 6, "minblocks": 24, "algorithm": "medium", "perf": 2427.5, "source": "autotuned"},
{"m": 6, "n": 14, "k": 13, "tile_m": 3, "tile_n": 1, "threads": 32, "grouping": 6, "minblocks": 27, "algorithm": "medium", "perf": 2707.47, "source": "autotuned"},
{"m": 6, "n": 14, "k": 14, "tile_m": 3, "tile_n": 1, "threads": 32, "grouping": 6, "minblocks": 27, "algorithm": "medium", "perf": 2749.16, "source": "autotuned"},
{"m": 6, "n": 15, "k": 4, "tile_m": 3, "tile_n": 1, "threads": 64, "grouping": 9, "minblocks": 17, "algorithm": "medium", "perf": 1612.3, "source": "autotuned"},
{"m": 6, "n": 15, "k": 5, "tile_m": 3, "tile_n": 1, "threads": 96, "grouping": 11, "minblocks": 13, "algorithm": "medium", "perf": 1828.19, "source": "autotuned"},
{"m": 6, "n": 15, "k": 6, "tile_m": 3, "tile_n": 1, "threads": 96, "grouping": 8, "minblocks": 14, "algorithm": "medium", "perf": 2117.95, "source": "autotuned"},
{"m": 6, "n": 15, "k": 7, "tile_m": 3, "tile_n": 1, "threads": 128, "grouping": 11, "minblocks": 12, "algorithm": "medium", "perf": 2123.38, "source": "autotuned"},
{"m": 6, "n": 15, "k": 8, "tile_m": 3, "tile_n": 1, "threads": 128, "grouping": 11, "minblocks": 11, "algorithm": "medium", "perf": 2357.3, "source": "autotuned"},
{"m": 6, "n": 15, "k": 9, "tile_m": 3, "tile_n": 1, "threads": 32, "grouping": 6, "minblocks": 23, "algorithm": "medium", "perf": 2384.5, "source": "autotuned"},
{"m": 6, "n": 15, "k": 10, "tile_m": 3, "tile_n": 1, "threads": 32, "grouping": 6, "minblocks": 24, "algorithm": "medium", "perf": 2569.41, "source": "autotuned"},
{"m": 6, "n": 15, "k": 13, "tile_m": 3, "tile_n": 1, "threads": 32, "grouping": 8, "minblocks": 5, "algorithm": "medium", "perf": 2779.97, "source": "autotuned"},
{"m": 6, "n": 15, "k": 15, "tile_m": 3, "tile_n": 1, "threads": 96, "grouping": 11, "minblocks": 12, "algorithm": "medium", "perf": 3003.16, "source": "autotuned"},
{"m": 6, "n": 22, "k": 4, "tile_m": 3, "tile_n": 2, "threads": 96, "grouping": 16, "minblocks": 3, "algorithm": "medium", "perf": 2007.57, "source": "autotuned"},
{"m": 6, "n": 22, "k": 5, "tile_m": 3, "tile_n": 2, "threads": 32, "grouping": 8, "minblocks": 6, "algorithm": "medium", "perf": 2369.16, "source": "autotuned"},
{"m": 6, "n": 22, "k": 6, "tile_m": 3, "tile_n": 1, "threads": 64, "grouping": 7, "minblocks": 22, "algorithm": "medium", "perf": 2291.06, "source": "autotuned"},
{"m": 6, "n": 22, "k": 7, "tile_m": 3, "tile_n": 2, "threads": 32, "grouping": 5, "minblocks": 25, "algorithm": "medium", "perf": 2556.54, "source": "autotuned"},
{"m": 6, "n": 22, "k": 8, "tile_m": 3, "tile_n": 2, "threads": 32, "grouping": 5, "minblocks": 25, "algorithm": "medium", "perf": 2736.61, "source": "autotuned"},
{"m": 6, "n": 22, "k": 9, "tile_m": 3, "tile_n": 2, "threads": 32, "grouping": 5, "minblocks": 25, "algorithm": "medium", "perf": 2909.11, "source": "autotuned"},
{"m": 6, "n": 22, "k": 10, "tile_m": 3, "tile_n": 2, "threads": 32, "grouping": 5, "minblocks": 25, "algorithm": "medium", "perf": 3167.3, "source": "autotuned"},
{"m": 6, "n": 22, "k": 13, "tile_m": 3, "tile_n": 2, "threads": 32, "grouping": 8, "minblocks": 14, "algorithm": "medium", "perf": 3630.14, "source": "autotuned"},
{"m": 6, "n": 22, "k": 22, "tile_m": 3, "tile_n": 2, "threads": 32, "grouping": 8, "minblocks": 13, "algorithm": "medium", "perf": 4004.01, "source": "autotuned"},
{"m": 6, "n": 22, "k": 32, "tile_m": 3, "tile_n": 2, "threads": 32, "grouping": 12, "minblocks": 4, "algorithm": "medium", "perf": 4298.39, "source": "autotuned"},
{"m": 6, "n": 26, "k": 4, "tile_m": 3, "tile_n": 2, "threads": 32, "grouping": 8, "minblocks": 14, "algorithm": "medium", "perf": 2265.68, "source": "autotuned"},
{"m": 6, "n": 26, "k": 5, "tile_m": 3, "tile_n": 2, "threads": 32, "grouping": 8, "minblocks": 21, "algorithm": "medium", "perf": 2665.22, "source": "autotuned"},
{"m": 6, "n": 26, "k": 6, "tile_m": 3, "tile_n": 1, "threads": 64, "grouping": 8, "minblocks": 22, "algorithm": "medium", "perf": 2667.5, "source": "autotuned"},
{"m": 6, "n": 26, "k": 7, "tile_m": 3, "tile_n": 1, "threads": 64, "grouping": 7, "minblocks": 24, "algorithm": "medium", "perf": 2917.86, "source": "autotuned"},
{"m": 6, "n": 26, "k": 8, "tile_m": 3, "tile_n": 2, "threads": 32, "grouping": 5, "minblocks": 27, "algorithm": "medium", "perf": 3131.94, "source": "autotuned"},
{"m": 6, "n": 26, "k": 9, "tile_m": 3, "tile_n": 2, "threads": 32, "grouping": 5, "minblocks": 26, "algorithm": "medium", "perf": 3288.12, "source": "autotuned"},
{"m": 6, "n": 26, "k": 10, "tile_m": 3, "tile_n": 2, "threads": 32, "grouping": 8, "minblocks": 1, "algorithm": "medium", "perf": 3522.55, "source": "autotuned"},
{"m": 6, "n": 26, "k": 13, "tile_m": 3, "tile_n": 2, "threads": 32, "grouping": 8, "minblocks": 12, "algorithm": "medium", "perf": 4005.2, "source": "autotuned"},
{"m": 6, "n": 26, "k": 26, "tile_m": 3, "tile_n": 2, "threads": 32, "grouping": 12, "minblocks": 6, "algorithm": "medium", "perf": 4508.07, "source": "autotuned"},
{"m": 6, "n": 26, "k": 45, "tile_m": 3, "tile_n": 2, "w": 16, "v": 26, "threads": 32, "grouping": 16, "minblocks": 4, "algorithm": "largeDB2", "perf": 4822.94, "source": "autotuned"},
{"m": 6, "n": 32, "k": 4, "tile_m": 3, "tile_n": 2, "threads": 32, "grouping": 8, "minblocks": 27, "algorithm": "medium", "perf": 2691.45, "source": "autotuned"},
{"m": 6, "n": 32, "k": 5, "tile_m": 3, "tile_n": 2, "threads": 32, "grouping": 8, "minblocks": 26, "algorithm": "medium", "perf": 3178.99, "source": "autotuned"},
{"m": 6, "n": 32, "k": 6, "tile_m": 3, "tile_n": 1, "threads": 64, "grouping": 9, "minblocks": 22, "algorithm": "medium", "perf": 3142.51, "source": "autotuned"},
{"m": 6, "n": 32, "k": 7, "tile_m": 3, "tile_n": 1, "threads": 64, "grouping": 8, "minblocks": 22, "algorithm": "medium", "perf": 3420.92, "source": "autotuned"},
{"m": 6, "n": 32, "k": 8, "tile_m": 3, "tile_n": 2, "threads": 96, "grouping": 8, "minblocks": 14, "algorithm": "medium", "perf": 3677.99, "source": "autotuned"},
{"m": 6, "n": 32, "k": 9, "tile_m": 3, "tile_n": 2, "w": 4, "v": 32, "threads": 32, "grouping": 16, "minblocks": 1, "algorithm": "largeDB2", "perf": 3993.33, "source": "autotuned"},
{"m": 6, "n": 32, "k": 10, "tile_m": 3, "tile_n": 2, "w": 4, "v": 32, "threads": 32, "grouping": 16, "minblocks": 8, "algorithm": "largeDB2", "perf": 4327.3, "source": "autotuned"},
{"m": 6, "n": 32, "k": 13, "tile_m": 3, "tile_n": 2, "w": 6, "v": 32, "threads": 32, "grouping": 16, "minblocks": 8, "algorithm": "largeDB2", "perf": 4710.91, "source": "autotuned"},
{"m": 6, "n": 32, "k": 22, "tile_m": 3, "tile_n": 2, "threads": 32, "grouping": 12, "minblocks": 2, "algorithm": "medium", "perf": 4990.54, "source": "autotuned"},
{"m": 6, "n": 32, "k": 32, "tile_m": 3, "tile_n": 2, "threads": 32, "grouping": 12, "minblocks": 3, "algorithm": "medium", "perf": 5361.37, "source": "autotuned"},
{"m": 6, "n": 45, "k": 4, "tile_m": 3, "tile_n": 3, "threads": 32, "grouping": 8, "minblocks": 13, "algorithm": "medium", "perf": 3216.16, "source": "autotuned"},
{"m": 6, "n": 45, "k": 5, "tile_m": 3, "tile_n": 3, "threads": 32, "grouping": 8, "minblocks": 13, "algorithm": "medium", "perf": 3700.91, "source": "autotuned"},
{"m": 6, "n": 45, "k": 6, "tile_m": 3, "tile_n": 3, "threads": 32, "grouping": 7, "minblocks": 17, "algorithm": "medium", "perf": 3598.84, "source": "autotuned"},
{"m": 6, "n": 45, "k": 7, "tile_m": 3, "tile_n": 3, "threads": 32, "grouping": 8, "minblocks": 14, "algorithm": "medium", "perf": 3938.73, "source": "autotuned"},
{"m": 6, "n": 45, "k": 8, "tile_m": 4, "tile_n": 3, "threads": 32, "grouping": 8, "minblocks": 15, "algorithm": "medium", "perf": 4223.37, "source": "autotuned"},
{"m": 6, "n": 45, "k": 9, "tile_m": 3, "tile_n": 3, "threads": 32, "grouping": 8, "minblocks": 16, "algorithm": "medium", "perf": 4447.05, "source": "autotuned"},
{"m": 6, "n": 45, "k": 10, "tile_m": 3, "tile_n": 3, "threads": 32, "grouping": 8, "minblocks": 15, "algorithm": "medium", "perf": 4571.89, "source": "autotuned"},
{"m": 6, "n": 45, "k": 13, "tile_m": 3, "tile_n": 3, "threads": 32, "grouping": 11, "minblocks": 12, "algorithm": "medium", "perf": 5008.7, "source": "autotuned"},
{"m": 6, "n": 45, "k": 26, "tile_m": 3, "tile_n": 3, "threads": 32, "grouping": 16, "minblocks": 6, "algorithm": "medium", "perf": 5144.46, "source": "autotuned"},
{"m": 6, "n": 45, "k": 45, "tile_m": 3, "tile_n": 3, "w": 16, "v": 42, "threads": 32, "grouping": 16, "minblocks": 2, "algorithm": "largeDB2", "perf": 5337.64, "source": "autotuned"},
{"m": 7, "n": 4, "k": 4, "tile_m": 1, "tile_n": 1, "threads": 32, "grouping": 8, "minblocks": 16, "algorithm": "medium", "perf": 639.311, "source": "autotuned"},
{"m": 7, "n": 4, "k": 5, "tile_m": 1, "tile_n": 1, "threads": 64, "grouping": 8, "minblocks": 8, "algorithm": "medium", "perf": 717.429, "source": "autotuned"},
{"m": 7, "n": 4, "k": 6, "tile_m": 1, "tile_n": 1, "threads": 64, "grouping": 8, "minblocks": 8, "algorithm": "medium", "perf": 804.703, "source": "autotuned"},
{"m": 7, "n": 4, "k": 7, "tile_m": 1, "tile_n": 1, "threads": 64, "grouping": 8, "minblocks": 8, "algorithm": "medium", "perf": 890.352, "source": "autotuned"},
{"m": 7, "n": 4, "k": 8, "tile_m": 1, "tile_n": 1, "threads": 64, "grouping": 8, "minblocks": 8, "algorithm": "medium", "perf": 995.786, "source": "autotuned"},
{"m": 7, "n": 4, "k": 9, "tile_m": 1, "tile_n": 1, "threads": 64, "grouping": 8, "minblocks": 8, "algorithm": "medium", "perf": 1048.9, "source": "autotuned"},
{"m": 7, "n": 4, "k": 10, "tile_m": 1, "tile_n": 1, "threads": 96, "grouping": 8, "minblocks": 17, "algorithm": "medium", "perf": 1076.51, "source": "autotuned"},
{"m": 7, "n": 4, "k": 13, "tile_m": 1, "tile_n": 1, "threads": 96, "grouping": 8, "minblocks": 20, "algorithm": "medium", "perf": 1241.59, "source": "autotuned"},
{"m": 7, "n": 4, "k": 15, "tile_m": 1, "tile_n": 1, "threads": 128, "grouping": 4, "minblocks": 16, "algorithm": "medium", "perf": 1270.47, "source": "autotuned"},
{"m": 7, "n": 4, "k": 22, "tile_m": 1, "tile_n": 1, "threads": 32, "grouping": 4, "minblocks": 23, "algorithm": "medium", "perf": 1476.09, "source": "autotuned"},
{"m": 7, "n": 4, "k": 25, "tile_m": 1, "tile_n": 1, "threads": 128, "grouping": 8, "minblocks": 15, "algorithm": "medium", "perf": 1475.06, "source": "autotuned"},
{"m": 7, "n": 4, "k": 26, "tile_m": 1, "tile_n": 1, "threads": 128, "grouping": 8, "minblocks": 14, "algorithm": "medium", "perf": 1505.15, "source": "autotuned"},
{"m": 7, "n": 4, "k": 28, "tile_m": 1, "tile_n": 1, "threads": 128, "grouping": 9, "minblocks": 15, "algorithm": "medium", "perf": 1562.24, "source": "autotuned"},
{"m": 7, "n": 4, "k": 32, "tile_m": 1, "tile_n": 1, "threads": 32, "grouping": 4, "minblocks": 2, "algorithm": "medium", "perf": 1616.71, "source": "autotuned"},
{"m": 7, "n": 4, "k": 45, "tile_m": 1, "tile_n": 1, "w": 16, "v": 4, "threads": 32, "grouping": 16, "minblocks": 12, "algorithm": "largeDB2", "perf": 1834.34, "source": "autotuned"},
{"m": 7, "n": 5, "k": 4, "tile_m": 2, "tile_n": 1, "threads": 32, "grouping": 9, "minblocks": 22, "algorithm": "medium", "perf": 731.578, "source": "autotuned"},
{"m": 7, "n": 5, "k": 5, "tile_m": 2, "tile_n": 1, "threads": 64, "grouping": 9, "minblocks": 16, "algorithm": "medium", "perf": 820.064, "source": "autotuned"},
{"m": 7, "n": 5, "k": 6, "tile_m": 2, "tile_n": 1, "threads": 64, "grouping": 9, "minblocks": 23, "algorithm": "medium", "perf": 936.871, "source": "autotuned"},
{"m": 7, "n": 5, "k": 7, "tile_m": 2, "tile_n": 1, "threads": 64, "grouping": 8, "minblocks": 23, "algorithm": "medium", "perf": 1040.45, "source": "autotuned"},
{"m": 7, "n": 5, "k": 8, "tile_m": 2, "tile_n": 1, "threads": 64, "grouping": 9, "minblocks": 24, "algorithm": "medium", "perf": 1144.06, "source": "autotuned"},
{"m": 7, "n": 5, "k": 9, "tile_m": 2, "tile_n": 1, "threads": 64, "grouping": 9, "minblocks": 1, "algorithm": "medium", "perf": 1212.28, "source": "autotuned"},
{"m": 7, "n": 5, "k": 10, "tile_m": 2, "tile_n": 1, "threads": 96, "grouping": 8, "minblocks": 20, "algorithm": "medium", "perf": 1242.03, "source": "autotuned"},
{"m": 7, "n": 5, "k": 13, "tile_m": 2, "tile_n": 1, "threads": 96, "grouping": 8, "minblocks": 20, "algorithm": "medium", "perf": 1444.39, "source": "autotuned"},
{"m": 7, "n": 5, "k": 15, "tile_m": 2, "tile_n": 1, "threads": 128, "grouping": 8, "minblocks": 16, "algorithm": "medium", "perf": 1486.25, "source": "autotuned"},
{"m": 7, "n": 5, "k": 22, "tile_m": 2, "tile_n": 1, "threads": 160, "grouping": 16, "minblocks": 8, "algorithm": "medium", "perf": 1639.9, "source": "autotuned"},
{"m": 7, "n": 5, "k": 25, "tile_m": 4, "tile_n": 1, "threads": 32, "grouping": 8, "minblocks": 10, "algorithm": "medium", "perf": 1681.6, "source": "autotuned"},
{"m": 7, "n": 5, "k": 26, "tile_m": 4, "tile_n": 1, "threads": 32, "grouping": 8, "minblocks": 6, "algorithm": "medium", "perf": 1704.16, "source": "autotuned"},
{"m": 7, "n": 5, "k": 28, "tile_m": 4, "tile_n": 1, "threads": 32, "grouping": 8, "minblocks": 17, "algorithm": "medium", "perf": 1732.76, "source": "autotuned"},
{"m": 7, "n": 5, "k": 32, "tile_m": 4, "tile_n": 1, "threads": 32, "grouping": 8, "minblocks": 3, "algorithm": "medium", "perf": 1835.27, "source": "autotuned"},
{"m": 7, "n": 5, "k": 45, "tile_m": 2, "tile_n": 1, "w": 18, "v": 4, "threads": 32, "grouping": 16, "minblocks": 12, "algorithm": "largeDB2", "perf": 1987.11, "source": "autotuned"},
{"m": 7, "n": 6, "k": 4, "tile_m": 4, "tile_n": 1, "threads": 32, "grouping": 9, "minblocks": 1, "algorithm": "medium", "perf": 875.089, "source": "autotuned"},
{"m": 7, "n": 6, "k": 5, "tile_m": 2, "tile_n": 1, "threads": 64, "grouping": 9, "minblocks": 7, "algorithm": "medium", "perf": 987.245, "source": "autotuned"},
{"m": 7, "n": 6, "k": 6, "tile_m": 2, "tile_n": 1, "threads": 64, "grouping": 9, "minblocks": 14, "algorithm": "medium", "perf": 1120.96, "source": "autotuned"},
{"m": 7, "n": 6, "k": 7, "tile_m": 2, "tile_n": 1, "threads": 64, "grouping": 9, "minblocks": 23, "algorithm": "medium", "perf": 1239.28, "source": "autotuned"},
{"m": 7, "n": 6, "k": 8, "tile_m": 2, "tile_n": 1, "threads": 64, "grouping": 9, "minblocks": 23, "algorithm": "medium", "perf": 1373.83, "source": "autotuned"},
{"m": 7, "n": 6, "k": 9, "tile_m": 2, "tile_n": 1, "threads": 64, "grouping": 9, "minblocks": 24, "algorithm": "medium", "perf": 1444.54, "source": "autotuned"},
{"m": 7, "n": 6, "k": 10, "tile_m": 2, "tile_n": 1, "threads": 96, "grouping": 8, "minblocks": 18, "algorithm": "medium", "perf": 1484.92, "source": "autotuned"},
{"m": 7, "n": 6, "k": 13, "tile_m": 4, "tile_n": 1, "threads": 96, "grouping": 8, "minblocks": 16, "algorithm": "medium", "perf": 1722.19, "source": "autotuned"},
{"m": 7, "n": 6, "k": 15, "tile_m": 2, "tile_n": 1, "threads": 128, "grouping": 8, "minblocks": 15, "algorithm": "medium", "perf": 1763.18, "source": "autotuned"},
{"m": 7, "n": 6, "k": 22, "tile_m": 2, "tile_n": 1, "threads": 160, "grouping": 16, "minblocks": 8, "algorithm": "medium", "perf": 1946.5, "source": "autotuned"},
{"m": 7, "n": 6, "k": 26, "tile_m": 4, "tile_n": 1, "threads": 32, "grouping": 8, "minblocks": 5, "algorithm": "medium", "perf": 2018.44, "source": "autotuned"},
{"m": 7, "n": 6, "k": 32, "tile_m": 4, "tile_n": 1, "threads": 32, "grouping": 8, "minblocks": 4, "algorithm": "medium", "perf": 2151.45, "source": "autotuned"},
{"m": 7, "n": 6, "k": 45, "tile_m": 2, "tile_n": 1, "w": 18, "v": 6, "threads": 32, "grouping": 16, "minblocks": 2, "algorithm": "largeDB2", "perf": 2360.78, "source": "autotuned"},
{"m": 7, "n": 7, "k": 4, "tile_m": 2, "tile_n": 1, "threads": 32, "grouping": 9, "minblocks": 1, "algorithm": "medium", "perf": 1006.18, "source": "autotuned"},
{"m": 7, "n": 7, "k": 5, "tile_m": 2, "tile_n": 1, "threads": 64, "grouping": 9, "minblocks": 11, "algorithm": "medium", "perf": 1105.8, "source": "autotuned"},
{"m": 7, "n": 7, "k": 6, "tile_m": 2, "tile_n": 1, "threads": 64, "grouping": 8, "minblocks": 22, "algorithm": "medium", "perf": 1266.47, "source": "autotuned"},
{"m": 7, "n": 7, "k": 7, "tile_m": 2, "tile_n": 1, "threads": 64, "grouping": 9, "minblocks": 23, "algorithm": "medium", "perf": 1369.54, "source": "autotuned"},
{"m": 7, "n": 7, "k": 8, "tile_m": 2, "tile_n": 1, "threads": 64, "grouping": 9, "minblocks": 24, "algorithm": "medium", "perf": 1512.1, "source": "autotuned"},
{"m": 7, "n": 7, "k": 9, "tile_m": 2, "tile_n": 1, "threads": 64, "grouping": 7, "minblocks": 26, "algorithm": "medium", "perf": 1631.69, "source": "autotuned"},
{"m": 7, "n": 7, "k": 10, "tile_m": 4, "tile_n": 1, "threads": 32, "grouping": 4, "minblocks": 30, "algorithm": "small", "perf": 1709.52, "source": "autotuned"},
{"m": 7, "n": 7, "k": 13, "tile_m": 4, "tile_n": 1, "threads": 32, "grouping": 5, "minblocks": 25, "algorithm": "small", "perf": 1989.94, "source": "autotuned"},
{"m": 7, "n": 7, "k": 15, "tile_m": 2, "tile_n": 1, "threads": 128, "grouping": 9, "minblocks": 16, "algorithm": "medium", "perf": 1958.46, "source": "autotuned"},
{"m": 7, "n": 7, "k": 22, "tile_m": 4, "tile_n": 1, "threads": 32, "grouping": 8, "minblocks": 24, "algorithm": "medium", "perf": 2319.0, "source": "autotuned"},
{"m": 7, "n": 7, "k": 25, "tile_m": 4, "tile_n": 1, "threads": 32, "grouping": 8, "minblocks": 22, "algorithm": "medium", "perf": 2381.7, "source": "autotuned"},
{"m": 7, "n": 7, "k": 26, "tile_m": 4, "tile_n": 1, "threads": 32, "grouping": 8, "minblocks": 7, "algorithm": "medium", "perf": 2395.99, "source": "autotuned"},
{"m": 7, "n": 7, "k": 28, "tile_m": 4, "tile_n": 1, "threads": 32, "grouping": 8, "minblocks": 12, "algorithm": "medium", "perf": 2376.27, "source": "autotuned"},
{"m": 7, "n": 7, "k": 32, "tile_m": 4, "tile_n": 1, "threads": 32, "grouping": 8, "minblocks": 17, "algorithm": "medium", "perf": 2559.9, "source": "autotuned"},
{"m": 7, "n": 7, "k": 45, "tile_m": 4, "tile_n": 1, "threads": 32, "grouping": 8, "minblocks": 12, "algorithm": "medium", "perf": 2800.52, "source": "autotuned"},
{"m": 7, "n": 8, "k": 4, "tile_m": 2, "tile_n": 1, "threads": 64, "grouping": 9, "minblocks": 9, "algorithm": "medium", "perf": 1089.74, "source": "autotuned"},
{"m": 7, "n": 8, "k": 5, "tile_m": 2, "tile_n": 1, "threads": 64, "grouping": 9, "minblocks": 22, "algorithm": "medium", "perf": 1287.76, "source": "autotuned"},
{"m": 7, "n": 8, "k": 6, "tile_m": 2, "tile_n": 1, "threads": 64, "grouping": 9, "minblocks": 21, "algorithm": "medium", "perf": 1487.55, "source": "autotuned"},
{"m": 7, "n": 8, "k": 7, "tile_m": 2, "tile_n": 1, "threads": 64, "grouping": 11, "minblocks": 2, "algorithm": "medium", "perf": 1585.88, "source": "autotuned"},
{"m": 7, "n": 8, "k": 8, "tile_m": 2, "tile_n": 1, "threads": 64, "grouping": 7, "minblocks": 8, "algorithm": "small", "perf": 1598.17, "source": "autotuned"},
{"m": 7, "n": 8, "k": 9, "tile_m": 4, "tile_n": 1, "threads": 96, "grouping": 8, "minblocks": 16, "algorithm": "medium", "perf": 1808.1, "source": "autotuned"},
{"m": 7, "n": 8, "k": 10, "tile_m": 4, "tile_n": 1, "threads": 96, "grouping": 8, "minblocks": 15, "algorithm": "medium", "perf": 1903.0, "source": "autotuned"},
{"m": 7, "n": 8, "k": 13, "tile_m": 2, "tile_n": 1, "threads": 128, "grouping": 9, "minblocks": 16, "algorithm": "medium", "perf": 2083.1, "source": "autotuned"},
{"m": 7, "n": 8, "k": 15, "tile_m": 2, "tile_n": 1, "threads": 128, "grouping": 9, "minblocks": 14, "algorithm": "medium", "perf": 2212.88, "source": "autotuned"},
{"m": 7, "n": 8, "k": 22, "tile_m": 4, "tile_n": 1, "threads": 32, "grouping": 8, "minblocks": 8, "algorithm": "medium", "perf": 2449.1, "source": "autotuned"},
{"m": 7, "n": 8, "k": 26, "tile_m": 4, "tile_n": 1, "threads": 32, "grouping": 8, "minblocks": 18, "algorithm": "medium", "perf": 2570.4, "source": "autotuned"},
{"m": 7, "n": 8, "k": 32, "tile_m": 4, "tile_n": 1, "w": 14, "v": 8, "threads": 32, "grouping": 16, "minblocks": 4, "algorithm": "largeDB2", "perf": 2822.93, "source": "autotuned"},
{"m": 7, "n": 8, "k": 45, "tile_m": 4, "tile_n": 1, "w": 16, "v": 8, "threads": 32, "grouping": 16, "minblocks": 12, "algorithm": "largeDB2", "perf": 2875.97, "source": "autotuned"},
{"m": 7, "n": 9, "k": 4, "tile_m": 1, "tile_n": 1, "threads": 64, "grouping": 11, "minblocks": 5, "algorithm": "medium", "perf": 1130.19, "source": "autotuned"},
{"m": 7, "n": 9, "k": 5, "tile_m": 1, "tile_n": 1, "threads": 64, "grouping": 6, "minblocks": 22, "algorithm": "medium", "perf": 1308.44, "source": "autotuned"},
{"m": 7, "n": 9, "k": 6, "tile_m": 2, "tile_n": 2, "threads": 64, "grouping": 9, "minblocks": 20, "algorithm": "medium", "perf": 1481.58, "source": "autotuned"},
{"m": 7, "n": 9, "k": 7, "tile_m": 4, "tile_n": 1, "threads": 64, "grouping": 9, "minblocks": 23, "algorithm": "medium", "perf": 1608.52, "source": "autotuned"},
{"m": 7, "n": 9, "k": 8, "tile_m": 4, "tile_n": 1, "threads": 96, "grouping": 8, "minblocks": 16, "algorithm": "medium", "perf": 1765.1, "source": "autotuned"},
{"m": 7, "n": 9, "k": 9, "tile_m": 4, "tile_n": 1, "threads": 96, "grouping": 8, "minblocks": 16, "algorithm": "medium", "perf": 1903.57, "source": "autotuned"},
{"m": 7, "n": 9, "k": 10, "tile_m": 4, "tile_n": 1, "threads": 96, "grouping": 8, "minblocks": 16, "algorithm": "medium", "perf": 2035.66, "source": "autotuned"},
{"m": 7, "n": 9, "k": 13, "tile_m": 4, "tile_n": 1, "threads": 128, "grouping": 8, "minblocks": 15, "algorithm": "medium", "perf": 2149.9, "source": "autotuned"},
{"m": 7, "n": 9, "k": 15, "tile_m": 4, "tile_n": 1, "threads": 32, "grouping": 8, "minblocks": 16, "algorithm": "medium", "perf": 2157.07, "source": "autotuned"},
{"m": 7, "n": 9, "k": 22, "tile_m": 4, "tile_n": 1, "threads": 32, "grouping": 8, "minblocks": 4, "algorithm": "medium", "perf": 2508.62, "source": "autotuned"},
{"m": 7, "n": 9, "k": 25, "tile_m": 4, "tile_n": 1, "threads": 32, "grouping": 8, "minblocks": 3, "algorithm": "medium", "perf": 2565.35, "source": "autotuned"},
{"m": 7, "n": 9, "k": 26, "tile_m": 4, "tile_n": 1, "threads": 32, "grouping": 8, "minblocks": 4, "algorithm": "medium", "perf": 2592.0, "source": "autotuned"},
{"m": 7, "n": 9, "k": 28, "tile_m": 4, "tile_n": 1, "threads": 32, "grouping": 8, "minblocks": 17, "algorithm": "medium", "perf": 2668.36, "source": "autotuned"},
{"m": 7, "n": 9, "k": 32, "tile_m": 4, "tile_n": 1, "threads": 32, "grouping": 8, "minblocks": 15, "algorithm": "medium", "perf": 2793.76, "source": "autotuned"},
{"m": 7, "n": 9, "k": 45, "tile_m": 4, "tile_n": 1, "w": 18, "v": 8, "threads": 32, "grouping": 16, "minblocks": 12, "algorithm": "largeDB2", "perf": 2950.97, "source": "autotuned"},
{"m": 7, "n": 10, "k": 4, "tile_m": 2, "tile_n": 2, "threads": 64, "grouping": 8, "minblocks": 4, "algorithm": "medium", "perf": 1255.1, "source": "autotuned"},
{"m": 7, "n": 10, "k": 5, "tile_m": 4, "tile_n": 1, "threads": 64, "grouping": 9, "minblocks": 19, "algorithm": "medium", "perf": 1434.2, "source": "autotuned"},
{"m": 7, "n": 10, "k": 6, "tile_m": 2, "tile_n": 2, "threads": 64, "grouping": 9, "minblocks": 22, "algorithm": "medium", "perf": 1643.13, "source": "autotuned"},
{"m": 7, "n": 10, "k": 7, "tile_m": 4, "tile_n": 1, "threads": 96, "grouping": 8, "minblocks": 16, "algorithm": "medium", "perf": 1770.27, "source": "autotuned"},
{"m": 7, "n": 10, "k": 8, "tile_m": 4, "tile_n": 1, "threads": 96, "grouping": 8, "minblocks": 14, "algorithm": "medium", "perf": 1948.43, "source": "autotuned"},
{"m": 7, "n": 10, "k": 9, "tile_m": 4, "tile_n": 1, "threads": 96, "grouping": 8, "minblocks": 15, "algorithm": "medium", "perf": 2114.01, "source": "autotuned"},
{"m": 7, "n": 10, "k": 10, "tile_m": 2, "tile_n": 2, "threads": 128, "grouping": 8, "minblocks": 14, "algorithm": "medium", "perf": 2051.3, "source": "autotuned"},
{"m": 7, "n": 10, "k": 13, "tile_m": 4, "tile_n": 1, "threads": 32, "grouping": 5, "minblocks": 26, "algorithm": "medium", "perf": 2232.77, "source": "autotuned"},
{"m": 7, "n": 10, "k": 15, "tile_m": 4, "tile_n": 1, "threads": 32, "grouping": 8, "minblocks": 19, "algorithm": "medium", "perf": 2371.43, "source": "autotuned"},
{"m": 7, "n": 10, "k": 22, "tile_m": 4, "tile_n": 1, "threads": 32, "grouping": 8, "minblocks": 3, "algorithm": "medium", "perf": 2759.48, "source": "autotuned"},
{"m": 7, "n": 10, "k": 26, "tile_m": 4, "tile_n": 1, "w": 12, "v": 10, "threads": 32, "grouping": 16, "minblocks": 2, "algorithm": "largeDB2", "perf": 2973.98, "source": "autotuned"},
{"m": 7, "n": 10, "k": 32, "tile_m": 4, "tile_n": 1, "w": 12, "v": 10, "threads": 32, "grouping": 16, "minblocks": 1, "algorithm": "largeDB2", "perf": 3112.95, "source": "autotuned"},
{"m": 7, "n": 10, "k": 45, "tile_m": 4, "tile_n": 1, "w": 18, "v": 6, "threads": 32, "grouping": 16, "minblocks": 4, "algorithm": "largeDB2", "perf": 3243.98, "source": "autotuned"},
{"m": 7, "n": 13, "k": 4, "tile_m": 4, "tile_n": 1, "threads": 64, "grouping": 9, "minblocks": 7, "algorithm": "medium", "perf": 1605.48, "source": "autotuned"},
{"m": 7, "n": 13, "k": 5, "tile_m": 4, "tile_n": 1, "threads": 96, "grouping": 8, "minblocks": 14, "algorithm": "medium", "perf": 1786.43, "source": "autotuned"},
{"m": 7, "n": 13, "k": 6, "tile_m": 4, "tile_n": 1, "threads": 96, "grouping": 8, "minblocks": 14, "algorithm": "medium", "perf": 2027.98, "source": "autotuned"},
{"m": 7, "n": 13, "k": 7, "tile_m": 4, "tile_n": 1, "threads": 96, "grouping": 8, "minblocks": 15, "algorithm": "medium", "perf": 2291.22, "source": "autotuned"},
{"m": 7, "n": 13, "k": 8, "tile_m": 4, "tile_n": 1, "threads": 128, "grouping": 8, "minblocks": 13, "algorithm": "medium", "perf": 2248.43, "source": "autotuned"},
{"m": 7, "n": 13, "k": 9, "tile_m": 4, "tile_n": 1, "threads": 128, "grouping": 8, "minblocks": 14, "algorithm": "medium", "perf": 2461.21, "source": "autotuned"},
{"m": 7, "n": 13, "k": 10, "tile_m": 4, "tile_n": 1, "threads": 32, "grouping": 5, "minblocks": 27, "algorithm": "medium", "perf": 2453.09, "source": "autotuned"},
{"m": 7, "n": 13, "k": 13, "tile_m": 4, "tile_n": 1, "threads": 32, "grouping": 8, "minblocks": 18, "algorithm": "medium", "perf": 2740.55, "source": "autotuned"},
{"m": 7, "n": 13, "k": 15, "tile_m": 4, "tile_n": 1, "threads": 32, "grouping": 8, "minblocks": 12, "algorithm": "medium", "perf": 2923.83, "source": "autotuned"},
{"m": 7, "n": 13, "k": 22, "tile_m": 4, "tile_n": 1, "threads": 32, "grouping": 8, "minblocks": 2, "algorithm": "medium", "perf": 3423.29, "source": "autotuned"},
{"m": 7, "n": 13, "k": 25, "tile_m": 4, "tile_n": 1, "threads": 32, "grouping": 8, "minblocks": 12, "algorithm": "medium", "perf": 3481.81, "source": "autotuned"},
{"m": 7, "n": 13, "k": 26, "tile_m": 4, "tile_n": 1, "w": 12, "v": 8, "threads": 32, "grouping": 16, "minblocks": 2, "algorithm": "largeDB2", "perf": 3549.4, "source": "autotuned"},
{"m": 7, "n": 13, "k": 28, "tile_m": 4, "tile_n": 1, "w": 12, "v": 8, "threads": 32, "grouping": 16, "minblocks": 12, "algorithm": "largeDB2", "perf": 3594.92, "source": "autotuned"},
{"m": 7, "n": 13, "k": 32, "tile_m": 4, "tile_n": 1, "w": 12, "v": 10, "threads": 32, "grouping": 16, "minblocks": 8, "algorithm": "largeDB2", "perf": 3588.43, "source": "autotuned"},
{"m": 7, "n": 13, "k": 45, "tile_m": 4, "tile_n": 1, "w": 18, "v": 12, "threads": 32, "grouping": 16, "minblocks": 8, "algorithm": "largeDB2", "perf": 3868.06, "source": "autotuned"},
{"m": 7, "n": 15, "k": 4, "tile_m": 4, "tile_n": 1, "threads": 64, "grouping": 9, "minblocks": 5, "algorithm": "medium", "perf": 1846.87, "source": "autotuned"},
{"m": 7, "n": 15, "k": 5, "tile_m": 4, "tile_n": 1, "threads": 96, "grouping": 8, "minblocks": 14, "algorithm": "medium", "perf": 2064.75, "source": "autotuned"},
{"m": 7, "n": 15, "k": 6, "tile_m": 4, "tile_n": 1, "threads": 96, "grouping": 8, "minblocks": 16, "algorithm": "medium", "perf": 2361.22, "source": "autotuned"},
{"m": 7, "n": 15, "k": 7, "tile_m": 4, "tile_n": 1, "threads": 128, "grouping": 8, "minblocks": 16, "algorithm": "medium", "perf": 2341.06, "source": "autotuned"},
{"m": 7, "n": 15, "k": 8, "tile_m": 4, "tile_n": 1, "threads": 128, "grouping": 8, "minblocks": 16, "algorithm": "medium", "perf": 2592.26, "source": "autotuned"},
{"m": 7, "n": 15, "k": 9, "tile_m": 4, "tile_n": 1, "threads": 32, "grouping": 5, "minblocks": 27, "algorithm": "medium", "perf": 2631.44, "source": "autotuned"},
{"m": 7, "n": 15, "k": 10, "tile_m": 4, "tile_n": 1, "threads": 32, "grouping": 5, "minblocks": 27, "algorithm": "medium", "perf": 2722.98, "source": "autotuned"},
{"m": 7, "n": 15, "k": 13, "tile_m": 4, "tile_n": 1, "threads": 32, "grouping": 8, "minblocks": 1, "algorithm": "medium", "perf": 3035.03, "source": "autotuned"},
{"m": 7, "n": 15, "k": 15, "tile_m": 4, "tile_n": 1, "threads": 32, "grouping": 8, "minblocks": 3, "algorithm": "medium", "perf": 3232.25, "source": "autotuned"},
{"m": 7, "n": 22, "k": 4, "tile_m": 2, "tile_n": 3, "threads": 96, "grouping": 11, "minblocks": 12, "algorithm": "medium", "perf": 2287.7, "source": "autotuned"},
{"m": 7, "n": 22, "k": 5, "tile_m": 4, "tile_n": 1, "threads": 64, "grouping": 8, "minblocks": 19, "algorithm": "medium", "perf": 2388.81, "source": "autotuned"},
{"m": 7, "n": 22, "k": 6, "tile_m": 4, "tile_n": 1, "threads": 64, "grouping": 8, "minblocks": 24, "algorithm": "medium", "perf": 2580.15, "source": "autotuned"},
{"m": 7, "n": 22, "k": 7, "tile_m": 2, "tile_n": 3, "threads": 32, "grouping": 6, "minblocks": 23, "algorithm": "medium", "perf": 2816.84, "source": "autotuned"},
{"m": 7, "n": 22, "k": 8, "tile_m": 4, "tile_n": 1, "threads": 64, "grouping": 9, "minblocks": 20, "algorithm": "medium", "perf": 3045.93, "source": "autotuned"},
{"m": 7, "n": 22, "k": 9, "tile_m": 2, "tile_n": 3, "threads": 32, "grouping": 6, "minblocks": 24, "algorithm": "medium", "perf": 3161.36, "source": "autotuned"},
{"m": 7, "n": 22, "k": 10, "tile_m": 4, "tile_n": 2, "threads": 32, "grouping": 8, "minblocks": 17, "algorithm": "medium", "perf": 3378.25, "source": "autotuned"},
{"m": 7, "n": 22, "k": 13, "tile_m": 2, "tile_n": 3, "threads": 32, "grouping": 8, "minblocks": 16, "algorithm": "medium", "perf": 3846.27, "source": "autotuned"},
{"m": 7, "n": 22, "k": 22, "tile_m": 2, "tile_n": 3, "w": 10, "v": 22, "threads": 32, "grouping": 16, "minblocks": 12, "algorithm": "largeDB2", "perf": 4197.84, "source": "autotuned"},
{"m": 7, "n": 22, "k": 32, "tile_m": 2, "tile_n": 3, "threads": 32, "grouping": 11, "minblocks": 7, "algorithm": "medium", "perf": 4651.97, "source": "autotuned"},
{"m": 7, "n": 25, "k": 4, "tile_m": 4, "tile_n": 2, "threads": 32, "grouping": 8, "minblocks": 14, "algorithm": "medium", "perf": 2394.63, "source": "autotuned"},
{"m": 7, "n": 25, "k": 5, "tile_m": 4, "tile_n": 2, "threads": 128, "grouping": 16, "minblocks": 8, "algorithm": "medium", "perf": 2616.1, "source": "autotuned"},
{"m": 7, "n": 25, "k": 7, "tile_m": 4, "tile_n": 1, "threads": 64, "grouping": 9, "minblocks": 19, "algorithm": "medium", "perf": 3010.77, "source": "autotuned"},
{"m": 7, "n": 25, "k": 9, "tile_m": 4, "tile_n": 2, "threads": 32, "grouping": 8, "minblocks": 9, "algorithm": "medium", "perf": 3451.78, "source": "autotuned"},
{"m": 7, "n": 25, "k": 13, "tile_m": 4, "tile_n": 2, "threads": 32, "grouping": 8, "minblocks": 17, "algorithm": "medium", "perf": 4078.33, "source": "autotuned"},
{"m": 7, "n": 25, "k": 25, "tile_m": 4, "tile_n": 2, "threads": 32, "grouping": 11, "minblocks": 9, "algorithm": "medium", "perf": 4555.55, "source": "autotuned"},
{"m": 7, "n": 25, "k": 26, "tile_m": 4, "tile_n": 2, "threads": 32, "grouping": 12, "minblocks": 6, "algorithm": "medium", "perf": 4647.47, "source": "autotuned"},
{"m": 7, "n": 25, "k": 28, "tile_m": 4, "tile_n": 2, "threads": 32, "grouping": 12, "minblocks": 8, "algorithm": "medium", "perf": 4619.73, "source": "autotuned"},
{"m": 7, "n": 25, "k": 32, "tile_m": 4, "tile_n": 2, "w": 14, "v": 22, "threads": 32, "grouping": 16, "minblocks": 8, "algorithm": "largeDB2", "perf": 4760.69, "source": "autotuned"},
{"m": 7, "n": 25, "k": 45, "tile_m": 4, "tile_n": 2, "w": 16, "v": 24, "threads": 32, "grouping": 16, "minblocks": 12, "algorithm": "largeDB2", "perf": 5154.28, "source": "autotuned"},
{"m": 7, "n": 26, "k": 4, "tile_m": 4, "tile_n": 2, "threads": 32, "grouping": 8, "minblocks": 25, "algorithm": "medium", "perf": 2529.6, "source": "autotuned"},
{"m": 7, "n": 26, "k": 5, "tile_m": 4, "tile_n": 1, "threads": 64, "grouping": 8, "minblocks": 24, "algorithm": "medium", "perf": 2587.17, "source": "autotuned"},
{"m": 7, "n": 26, "k": 6, "tile_m": 4, "tile_n": 1, "threads": 64, "grouping": 9, "minblocks": 19, "algorithm": "medium", "perf": 2904.46, "source": "autotuned"},
{"m": 7, "n": 26, "k": 7, "tile_m": 4, "tile_n": 1, "threads": 64, "grouping": 8, "minblocks": 22, "algorithm": "medium", "perf": 3125.23, "source": "autotuned"},
{"m": 7, "n": 26, "k": 8, "tile_m": 4, "tile_n": 2, "threads": 32, "grouping": 8, "minblocks": 14, "algorithm": "medium", "perf": 3453.36, "source": "autotuned"},
{"m": 7, "n": 26, "k": 9, "tile_m": 4, "tile_n": 2, "threads": 32, "grouping": 8, "minblocks": 13, "algorithm": "medium", "perf": 3477.74, "source": "autotuned"},
{"m": 7, "n": 26, "k": 10, "tile_m": 4, "tile_n": 2, "threads": 32, "grouping": 8, "minblocks": 13, "algorithm": "medium", "perf": 3892.88, "source": "autotuned"},
{"m": 7, "n": 26, "k": 13, "tile_m": 4, "tile_n": 2, "w": 6, "v": 26, "threads": 32, "grouping": 16, "minblocks": 4, "algorithm": "largeDB2", "perf": 4407.34, "source": "autotuned"},
{"m": 7, "n": 26, "k": 25, "tile_m": 4, "tile_n": 2, "threads": 32, "grouping": 11, "minblocks": 4, "algorithm": "medium", "perf": 4589.67, "source": "autotuned"},
{"m": 7, "n": 26, "k": 26, "tile_m": 4, "tile_n": 2, "threads": 32, "grouping": 12, "minblocks": 7, "algorithm": "medium", "perf": 4841.61, "source": "autotuned"},
{"m": 7, "n": 26, "k": 28, "tile_m": 4, "tile_n": 2, "threads": 32, "grouping": 12, "minblocks": 8, "algorithm": "medium", "perf": 4928.38, "source": "autotuned"},
{"m": 7, "n": 26, "k": 32, "tile_m": 4, "tile_n": 2, "w": 14, "v": 26, "threads": 32, "grouping": 16, "minblocks": 12, "algorithm": "largeDB2", "perf": 5020.82, "source": "autotuned"},
{"m": 7, "n": 26, "k": 45, "tile_m": 4, "tile_n": 2, "w": 16, "v": 26, "threads": 32, "grouping": 16, "minblocks": 12, "algorithm": "largeDB2", "perf": 5378.05, "source": "autotuned"},
{"m": 7, "n": 28, "k": 4, "tile_m": 4, "tile_n": 2, "threads": 32, "grouping": 8, "minblocks": 9, "algorithm": "medium", "perf": 2701.81, "source": "autotuned"},
{"m": 7, "n": 28, "k": 5, "tile_m": 4, "tile_n": 1, "threads": 64, "grouping": 8, "minblocks": 24, "algorithm": "medium", "perf": 2742.75, "source": "autotuned"},
{"m": 7, "n": 28, "k": 7, "tile_m": 4, "tile_n": 2, "threads": 32, "grouping": 6, "minblocks": 22, "algorithm": "medium", "perf": 3192.52, "source": "autotuned"},
{"m": 7, "n": 28, "k": 9, "tile_m": 4, "tile_n": 2, "threads": 32, "grouping": 8, "minblocks": 15, "algorithm": "medium", "perf": 3726.05, "source": "autotuned"},
{"m": 7, "n": 28, "k": 13, "tile_m": 4, "tile_n": 2, "threads": 32, "grouping": 8, "minblocks": 16, "algorithm": "medium", "perf": 4285.49, "source": "autotuned"},
{"m": 7, "n": 28, "k": 25, "tile_m": 4, "tile_n": 2, "threads": 32, "grouping": 11, "minblocks": 3, "algorithm": "medium", "perf": 4853.0, "source": "autotuned"},
{"m": 7, "n": 28, "k": 26, "tile_m": 4, "tile_n": 2, "threads": 32, "grouping": 12, "minblocks": 4, "algorithm": "medium", "perf": 5084.03, "source": "autotuned"},
{"m": 7, "n": 28, "k": 28, "tile_m": 4, "tile_n": 2, "w": 12, "v": 28, "threads": 32, "grouping": 16, "minblocks": 12, "algorithm": "largeDB2", "perf": 4938.27, "source": "autotuned"},
{"m": 7, "n": 28, "k": 32, "tile_m": 4, "tile_n": 2, "w": 12, "v": 28, "threads": 32, "grouping": 16, "minblocks": 12, "algorithm": "largeDB2", "perf": 5228.3, "source": "autotuned"},
{"m": 7, "n": 28, "k": 45, "tile_m": 4, "tile_n": 2, "w": 16, "v": 28, "threads": 32, "grouping": 16, "minblocks": 12, "algorithm": "largeDB2", "perf": 5567.58, "source": "autotuned"},
{"m": 7, "n": 32, "k": 4, "tile_m": 4, "tile_n": 2, "threads": 32, "grouping": 8, "minblocks": 3, "algorithm": "medium", "perf": 2989.9, "source": "autotuned"},
{"m": 7, "n": 32, "k": 5, "tile_m": 4, "tile_n": 1, "threads": 64, "grouping": 9, "minblocks": 19, "algorithm": "medium", "perf": 3142.24, "source": "autotuned"},
{"m": 7, "n": 32, "k": 6, "tile_m": 7, "tile_n": 1, "threads": 64, "grouping": 9, "minblocks": 19, "algorithm": "medium", "perf": 3474.95, "source": "autotuned"},
{"m": 7, "n": 32, "k": 7, "tile_m": 7, "tile_n": 1, "threads": 64, "grouping": 8, "minblocks": 19, "algorithm": "medium", "perf": 3672.05, "source": "autotuned"},
{"m": 7, "n": 32, "k": 8, "tile_m": 4, "tile_n": 2, "threads": 32, "grouping": 8, "minblocks": 14, "algorithm": "medium", "perf": 4061.69, "source": "autotuned"},
{"m": 7, "n": 32, "k": 9, "tile_m": 4, "tile_n": 2, "w": 4, "v": 32, "threads": 32, "grouping": 16, "minblocks": 1, "algorithm": "largeDB2", "perf": 4344.62, "source": "autotuned"},
{"m": 7, "n": 32, "k": 10, "tile_m": 4, "tile_n": 2, "w": 4, "v": 32, "threads": 32, "grouping": 16, "minblocks": 8, "algorithm": "largeDB2", "perf": 4725.22, "source": "autotuned"},
{"m": 7, "n": 32, "k": 13, "tile_m": 4, "tile_n": 2, "w": 6, "v": 32, "threads": 32, "grouping": 16, "minblocks": 8, "algorithm": "largeDB2", "perf": 5153.31, "source": "autotuned"},
{"m": 7, "n": 32, "k": 22, "tile_m": 4, "tile_n": 2, "threads": 32, "grouping": 12, "minblocks": 7, "algorithm": "medium", "perf": 5540.88, "source": "autotuned"},
{"m": 7, "n": 32, "k": 25, "tile_m": 4, "tile_n": 2, "threads": 32, "grouping": 11, "minblocks": 5, "algorithm": "medium", "perf": 5394.94, "source": "autotuned"},
{"m": 7, "n": 32, "k": 26, "tile_m": 4, "tile_n": 2, "w": 12, "v": 32, "threads": 32, "grouping": 16, "minblocks": 4, "algorithm": "largeDB2", "perf": 5234.34, "source": "autotuned"},
{"m": 7, "n": 32, "k": 28, "tile_m": 4, "tile_n": 2, "w": 12, "v": 32, "threads": 32, "grouping": 16, "minblocks": 1, "algorithm": "largeDB2", "perf": 5399.28, "source": "autotuned"},
{"m": 7, "n": 32, "k": 32, "tile_m": 4, "tile_n": 2, "w": 12, "v": 32, "threads": 32, "grouping": 16, "minblocks": 8, "algorithm": "largeDB2", "perf": 5587.2, "source": "autotuned"},
{"m": 7, "n": 32, "k": 45, "tile_m": 4, "tile_n": 2, "w": 22, "v": 32, "threads": 32, "grouping": 16, "minblocks": 8, "algorithm": "largeDB2", "perf": 5835.16, "source": "autotuned"},
{"m": 7, "n": 45, "k": 4, "tile_m": 4, "tile_n": 3, "threads": 32, "grouping": 8, "minblocks": 10, "algorithm": "medium", "perf": 3576.15, "source": "autotuned"},
{"m": 7, "n": 45, "k": 5, "tile_m": 4, "tile_n": 2, "threads": 64, "grouping": 9, "minblocks": 18, "algorithm": "medium", "perf": 3740.99, "source": "autotuned"},
{"m": 7, "n": 45, "k": 6, "tile_m": 4, "tile_n": 3, "threads": 32, "grouping": 8, "minblocks": 4, "algorithm": "medium", "perf": 4004.07, "source": "autotuned"},
{"m": 7, "n": 45, "k": 7, "tile_m": 4, "tile_n": 3, "threads": 32, "grouping": 8, "minblocks": 15, "algorithm": "medium", "perf": 4371.16, "source": "autotuned"},
{"m": 7, "n": 45, "k": 8, "tile_m": 4, "tile_n": 3, "threads": 32, "grouping": 8, "minblocks": 13, "algorithm": "medium", "perf": 4727.22, "source": "autotuned"},
{"m": 7, "n": 45, "k": 9, "tile_m": 4, "tile_n": 3, "threads": 32, "grouping": 8, "minblocks": 13, "algorithm": "medium", "perf": 5003.77, "source": "autotuned"},
{"m": 7, "n": 45, "k": 10, "tile_m": 4, "tile_n": 3, "threads": 32, "grouping": 8, "minblocks": 13, "algorithm": "medium", "perf": 4975.24, "source": "autotuned"},
{"m": 7, "n": 45, "k": 13, "tile_m": 4, "tile_n": 3, "threads": 32, "grouping": 11, "minblocks": 8, "algorithm": "medium", "perf": 5373.34, "source": "autotuned"},
{"m": 7, "n": 45, "k": 25, "tile_m": 4, "tile_n": 3, "threads": 32, "grouping": 16, "minblocks": 6, "algorithm": "medium", "perf": 5636.15, "source": "autotuned"},
{"m": 7, "n": 45, "k": 26, "tile_m": 4, "tile_n": 3, "threads": 32, "grouping": 16, "minblocks": 4, "algorithm": "medium", "perf": 5722.39, "source": "autotuned"},
{"m": 7, "n": 45, "k": 28, "tile_m": 4, "tile_n": 3, "threads": 32, "grouping": 16, "minblocks": 4, "algorithm": "medium", "perf": 5819.76, "source": "autotuned"},
{"m": 7, "n": 45, "k": 32, "tile_m": 4, "tile_n": 3, "threads": 32, "grouping": 16, "minblocks": 3, "algorithm": "medium", "perf": 6005.45, "source": "autotuned"},
{"m": 7, "n": 45, "k": 45, "tile_m": 4, "tile_n": 3, "w": 16, "v": 44, "threads": 32, "grouping": 16, "minblocks": 2, "algorithm": "largeDB2", "perf": 5993.84, "source": "autotuned"},
{"m": 8, "n": 4, "k": 4, "tile_m": 1, "tile_n": 1, "threads": 32, "grouping": 6, "minblocks": 16, "algorithm": "medium", "perf": 606.914, "source": "autotuned"},
{"m": 8, "n": 4, "k": 5, "tile_m": 1, "tile_n": 1, "threads": 64, "grouping": 9, "minblocks": 6, "algorithm": "medium", "perf": 837.958, "source": "autotuned"},
{"m": 8, "n": 4, "k": 6, "tile_m": 1, "tile_n": 1, "threads": 64, "grouping": 9, "minblocks": 9, "algorithm": "medium", "perf": 974.924, "source": "autotuned"},
{"m": 8, "n": 4, "k": 7, "tile_m": 1, "tile_n": 1, "threads": 64, "grouping": 9, "minblocks": 22, "algorithm": "medium", "perf": 1093.12, "source": "autotuned"},
{"m": 8, "n": 4, "k": 8, "tile_m": 1, "tile_n": 1, "threads": 64, "grouping": 6, "minblocks": 2, "algorithm": "small", "perf": 1028.78, "source": "autotuned"},
{"m": 8, "n": 4, "k": 9, "tile_m": 1, "tile_n": 1, "threads": 96, "grouping": 11, "minblocks": 1, "algorithm": "medium", "perf": 1200.49, "source": "autotuned"},
{"m": 8, "n": 4, "k": 10, "tile_m": 1, "tile_n": 1, "threads": 96, "grouping": 9, "minblocks": 17, "algorithm": "medium", "perf": 1321.75, "source": "autotuned"},
{"m": 8, "n": 4, "k": 13, "tile_m": 1, "tile_n": 1, "threads": 128, "grouping": 11, "minblocks": 15, "algorithm": "medium", "perf": 1430.33, "source": "autotuned"},
{"m": 8, "n": 4, "k": 15, "tile_m": 1, "tile_n": 1, "threads": 128, "grouping": 4, "minblocks": 13, "algorithm": "medium", "perf": 1565.38, "source": "autotuned"},
{"m": 8, "n": 4, "k": 22, "tile_m": 1, "tile_n": 1, "threads": 96, "grouping": 6, "minblocks": 21, "algorithm": "medium", "perf": 1828.03, "source": "autotuned"},
{"m": 8, "n": 4, "k": 26, "tile_m": 1, "tile_n": 1, "threads": 32, "grouping": 3, "minblocks": 24, "algorithm": "medium", "perf": 1869.97, "source": "autotuned"},
{"m": 8, "n": 4, "k": 32, "tile_m": 1, "tile_n": 1, "w": 12, "v": 4, "threads": 32, "grouping": 16, "minblocks": 1, "algorithm": "largeDB2", "perf": 2147.05, "source": "autotuned"},
{"m": 8, "n": 4, "k": 45, "tile_m": 1, "tile_n": 1, "w": 20, "v": 4, "threads": 32, "grouping": 16, "minblocks": 4, "algorithm": "largeDB2", "perf": 2268.87, "source": "autotuned"},
{"m": 8, "n": 5, "k": 4, "tile_m": 2, "tile_n": 1, "threads": 64, "grouping": 9, "minblocks": 16, "algorithm": "medium", "perf": 802.926, "source": "autotuned"},
{"m": 8, "n": 5, "k": 5, "tile_m": 2, "tile_n": 1, "threads": 64, "grouping": 9, "minblocks": 13, "algorithm": "medium", "perf": 957.532, "source": "autotuned"},
{"m": 8, "n": 5, "k": 6, "tile_m": 2, "tile_n": 1, "threads": 64, "grouping": 9, "minblocks": 10, "algorithm": "medium", "perf": 1105.16, "source": "autotuned"},
{"m": 8, "n": 5, "k": 7, "tile_m": 2, "tile_n": 1, "threads": 64, "grouping": 8, "minblocks": 24, "algorithm": "medium", "perf": 1228.09, "source": "autotuned"},
{"m": 8, "n": 5, "k": 8, "tile_m": 2, "tile_n": 1, "threads": 64, "grouping": 5, "minblocks": 27, "algorithm": "small", "perf": 1184.43, "source": "autotuned"},
{"m": 8, "n": 5, "k": 9, "tile_m": 1, "tile_n": 2, "threads": 96, "grouping": 8, "minblocks": 20, "algorithm": "medium", "perf": 1360.12, "source": "autotuned"},
{"m": 8, "n": 5, "k": 10, "tile_m": 1, "tile_n": 2, "threads": 96, "grouping": 8, "minblocks": 17, "algorithm": "medium", "perf": 1456.54, "source": "autotuned"},
{"m": 8, "n": 5, "k": 13, "tile_m": 1, "tile_n": 2, "threads": 128, "grouping": 9, "minblocks": 14, "algorithm": "medium", "perf": 1570.5, "source": "autotuned"},
{"m": 8, "n": 5, "k": 15, "tile_m": 1, "tile_n": 2, "threads": 128, "grouping": 8, "minblocks": 13, "algorithm": "medium", "perf": 1737.16, "source": "autotuned"},
{"m": 8, "n": 5, "k": 22, "tile_m": 1, "tile_n": 2, "threads": 32, "grouping": 8, "minblocks": 25, "algorithm": "medium", "perf": 1900.07, "source": "autotuned"},
{"m": 8, "n": 5, "k": 26, "tile_m": 1, "tile_n": 2, "threads": 32, "grouping": 8, "minblocks": 7, "algorithm": "medium", "perf": 1981.89, "source": "autotuned"},
{"m": 8, "n": 5, "k": 32, "tile_m": 1, "tile_n": 2, "threads": 32, "grouping": 4, "minblocks": 2, "algorithm": "medium", "perf": 2171.81, "source": "autotuned"},
{"m": 8, "n": 5, "k": 45, "tile_m": 1, "tile_n": 2, "w": 20, "v": 4, "threads": 32, "grouping": 16, "minblocks": 1, "algorithm": "largeDB2", "perf": 2334.35, "source": "autotuned"},
{"m": 8, "n": 6, "k": 4, "tile_m": 1, "tile_n": 2, "threads": 64, "grouping": 9, "minblocks": 18, "algorithm": "medium", "perf": 996.4, "source": "autotuned"},
{"m": 8, "n": 6, "k": 5, "tile_m": 1, "tile_n": 2, "threads": 64, "grouping": 9, "minblocks": 18, "algorithm": "medium", "perf": 1167.16, "source": "autotuned"},
{"m": 8, "n": 6, "k": 6, "tile_m": 1, "tile_n": 2, "threads": 64, "grouping": 9, "minblocks": 18, "algorithm": "medium", "perf": 1356.68, "source": "autotuned"},
{"m": 8, "n": 6, "k": 7, "tile_m": 1, "tile_n": 2, "threads": 64, "grouping": 13, "minblocks": 13, "algorithm": "medium", "perf": 1493.62, "source": "autotuned"},
{"m": 8, "n": 6, "k": 8, "tile_m": 1, "tile_n": 2, "threads": 64, "grouping": 5, "minblocks": 29, "algorithm": "small", "perf": 1440.17, "source": "autotuned"},
{"m": 8, "n": 6, "k": 9, "tile_m": 1, "tile_n": 2, "threads": 96, "grouping": 8, "minblocks": 19, "algorithm": "medium", "perf": 1632.02, "source": "autotuned"},
{"m": 8, "n": 6, "k": 10, "tile_m": 1, "tile_n": 2, "threads": 96, "grouping": 8, "minblocks": 19, "algorithm": "medium", "perf": 1762.52, "source": "autotuned"},
{"m": 8, "n": 6, "k": 13, "tile_m": 1, "tile_n": 2, "threads": 128, "grouping": 8, "minblocks": 16, "algorithm": "medium", "perf": 1926.53, "source": "autotuned"},
{"m": 8, "n": 6, "k": 15, "tile_m": 1, "tile_n": 2, "threads": 128, "grouping": 8, "minblocks": 13, "algorithm": "medium", "perf": 2084.41, "source": "autotuned"},
{"m": 8, "n": 6, "k": 22, "tile_m": 1, "tile_n": 2, "threads": 32, "grouping": 8, "minblocks": 21, "algorithm": "medium", "perf": 2248.38, "source": "autotuned"},
{"m": 8, "n": 6, "k": 26, "tile_m": 1, "tile_n": 2, "threads": 32, "grouping": 8, "minblocks": 8, "algorithm": "medium", "perf": 2375.17, "source": "autotuned"},
{"m": 8, "n": 6, "k": 32, "tile_m": 1, "tile_n": 2, "w": 12, "v": 6, "threads": 32, "grouping": 16, "minblocks": 12, "algorithm": "largeDB2", "perf": 2677.96, "source": "autotuned"},
{"m": 8, "n": 6, "k": 45, "tile_m": 1, "tile_n": 2, "w": 20, "v": 6, "threads": 32, "grouping": 16, "minblocks": 8, "algorithm": "largeDB2", "perf": 2709.65, "source": "autotuned"},
{"m": 8, "n": 7, "k": 4, "tile_m": 1, "tile_n": 2, "threads": 64, "grouping": 8, "minblocks": 23, "algorithm": "medium", "perf": 1123.52, "source": "autotuned"},
{"m": 8, "n": 7, "k": 5, "tile_m": 1, "tile_n": 2, "threads": 64, "grouping": 9, "minblocks": 3, "algorithm": "medium", "perf": 1337.95, "source": "autotuned"},
{"m": 8, "n": 7, "k": 6, "tile_m": 1, "tile_n": 2, "threads": 64, "grouping": 9, "minblocks": 22, "algorithm": "medium", "perf": 1543.68, "source": "autotuned"},
{"m": 8, "n": 7, "k": 7, "tile_m": 1, "tile_n": 2, "threads": 64, "grouping": 9, "minblocks": 26, "algorithm": "medium", "perf": 1689.95, "source": "autotuned"},
{"m": 8, "n": 7, "k": 8, "tile_m": 1, "tile_n": 2, "threads": 64, "grouping": 5, "minblocks": 25, "algorithm": "small", "perf": 1611.58, "source": "autotuned"},
{"m": 8, "n": 7, "k": 9, "tile_m": 1, "tile_n": 2, "threads": 96, "grouping": 8, "minblocks": 21, "algorithm": "medium", "perf": 1887.35, "source": "autotuned"},
{"m": 8, "n": 7, "k": 10, "tile_m": 1, "tile_n": 2, "threads": 96, "grouping": 8, "minblocks": 20, "algorithm": "medium", "perf": 2016.67, "source": "autotuned"},
{"m": 8, "n": 7, "k": 13, "tile_m": 1, "tile_n": 2, "threads": 128, "grouping": 9, "minblocks": 13, "algorithm": "medium", "perf": 2213.85, "source": "autotuned"},
{"m": 8, "n": 7, "k": 15, "tile_m": 1, "tile_n": 2, "threads": 128, "grouping": 9, "minblocks": 16, "algorithm": "medium", "perf": 2399.77, "source": "autotuned"},
{"m": 8, "n": 7, "k": 22, "tile_m": 1, "tile_n": 2, "threads": 32, "grouping": 8, "minblocks": 11, "algorithm": "medium", "perf": 2554.17, "source": "autotuned"},
{"m": 8, "n": 7, "k": 26, "tile_m": 1, "tile_n": 2, "threads": 32, "grouping": 8, "minblocks": 6, "algorithm": "medium", "perf": 2694.02, "source": "autotuned"},
{"m": 8, "n": 7, "k": 32, "tile_m": 1, "tile_n": 2, "w": 12, "v": 6, "threads": 32, "grouping": 16, "minblocks": 4, "algorithm": "largeDB2", "perf": 2937.82, "source": "autotuned"},
{"m": 8, "n": 7, "k": 45, "tile_m": 1, "tile_n": 2, "w": 18, "v": 6, "threads": 32, "grouping": 16, "minblocks": 8, "algorithm": "largeDB2", "perf": 2994.7, "source": "autotuned"},
{"m": 8, "n": 8, "k": 4, "tile_m": 1, "tile_n": 1, "threads": 64, "grouping": 13, "minblocks": 26, "algorithm": "medium", "perf": 1247.02, "source": "autotuned"},
{"m": 8, "n": 8, "k": 5, "tile_m": 1, "tile_n": 2, "threads": 64, "grouping": 7, "minblocks": 26, "algorithm": "medium", "perf": 1492.22, "source": "autotuned"},
{"m": 8, "n": 8, "k": 6, "tile_m": 1, "tile_n": 2, "threads": 64, "grouping": 9, "minblocks": 7, "algorithm": "medium", "perf": 1789.47, "source": "autotuned"},
{"m": 8, "n": 8, "k": 7, "tile_m": 1, "tile_n": 2, "threads": 64, "grouping": 9, "minblocks": 6, "algorithm": "medium", "perf": 1932.25, "source": "autotuned"},
{"m": 8, "n": 8, "k": 8, "tile_m": 1, "tile_n": 2, "threads": 64, "grouping": 9, "minblocks": 1, "algorithm": "small", "perf": 2043.87, "source": "autotuned"},
{"m": 8, "n": 8, "k": 9, "tile_m": 1, "tile_n": 2, "threads": 96, "grouping": 8, "minblocks": 18, "algorithm": "medium", "perf": 2153.75, "source": "autotuned"},
{"m": 8, "n": 8, "k": 10, "tile_m": 1, "tile_n": 2, "threads": 32, "grouping": 4, "minblocks": 16, "algorithm": "small", "perf": 2366.04, "source": "autotuned"},
{"m": 8, "n": 8, "k": 13, "tile_m": 1, "tile_n": 2, "threads": 128, "grouping": 8, "minblocks": 13, "algorithm": "medium", "perf": 2496.78, "source": "autotuned"},
{"m": 8, "n": 8, "k": 15, "tile_m": 1, "tile_n": 2, "threads": 128, "grouping": 9, "minblocks": 15, "algorithm": "medium", "perf": 2720.99, "source": "autotuned"},
{"m": 8, "n": 8, "k": 22, "tile_m": 1, "tile_n": 2, "threads": 32, "grouping": 8, "minblocks": 21, "algorithm": "medium", "perf": 3046.92, "source": "autotuned"},
{"m": 8, "n": 8, "k": 26, "tile_m": 1, "tile_n": 2, "threads": 32, "grouping": 8, "minblocks": 1, "algorithm": "medium", "perf": 3179.17, "source": "autotuned"},
{"m": 8, "n": 8, "k": 32, "tile_m": 1, "tile_n": 2, "threads": 32, "grouping": 8, "minblocks": 9, "algorithm": "medium", "perf": 3675.79, "source": "autotuned"},
{"m": 8, "n": 8, "k": 45, "tile_m": 1, "tile_n": 2, "threads": 32, "grouping": 8, "minblocks": 10, "algorithm": "medium", "perf": 3688.73, "source": "autotuned"},
{"m": 8, "n": 9, "k": 4, "tile_m": 4, "tile_n": 1, "threads": 64, "grouping": 9, "minblocks": 8, "algorithm": "medium", "perf": 1311.16, "source": "autotuned"},
{"m": 8, "n": 9, "k": 5, "tile_m": 4, "tile_n": 1, "threads": 64, "grouping": 9, "minblocks": 13, "algorithm": "medium", "perf": 1537.98, "source": "autotuned"},
{"m": 8, "n": 9, "k": 6, "tile_m": 4, "tile_n": 1, "threads": 64, "grouping": 9, "minblocks": 24, "algorithm": "medium", "perf": 1728.05, "source": "autotuned"},
{"m": 8, "n": 9, "k": 7, "tile_m": 4, "tile_n": 1, "threads": 64, "grouping": 9, "minblocks": 19, "algorithm": "medium", "perf": 1924.27, "source": "autotuned"},
{"m": 8, "n": 9, "k": 8, "tile_m": 4, "tile_n": 1, "threads": 96, "grouping": 8, "minblocks": 14, "algorithm": "medium", "perf": 2022.7, "source": "autotuned"},
{"m": 8, "n": 9, "k": 9, "tile_m": 4, "tile_n": 1, "threads": 96, "grouping": 8, "minblocks": 15, "algorithm": "medium", "perf": 2186.37, "source": "autotuned"},
{"m": 8, "n": 9, "k": 10, "tile_m": 4, "tile_n": 1, "threads": 96, "grouping": 8, "minblocks": 16, "algorithm": "medium", "perf": 2313.65, "source": "autotuned"},
{"m": 8, "n": 9, "k": 13, "tile_m": 1, "tile_n": 3, "threads": 128, "grouping": 11, "minblocks": 12, "algorithm": "medium", "perf": 2461.93, "source": "autotuned"},
{"m": 8, "n": 9, "k": 15, "tile_m": 4, "tile_n": 1, "threads": 160, "grouping": 16, "minblocks": 8, "algorithm": "medium", "perf": 2499.73, "source": "autotuned"},
{"m": 8, "n": 9, "k": 22, "tile_m": 4, "tile_n": 1, "threads": 32, "grouping": 8, "minblocks": 8, "algorithm": "medium", "perf": 2828.01, "source": "autotuned"},
{"m": 8, "n": 9, "k": 26, "tile_m": 4, "tile_n": 1, "threads": 32, "grouping": 8, "minblocks": 17, "algorithm": "medium", "perf": 2935.09, "source": "autotuned"},
{"m": 8, "n": 9, "k": 32, "tile_m": 4, "tile_n": 1, "w": 12, "v": 6, "threads": 32, "grouping": 16, "minblocks": 4, "algorithm": "largeDB2", "perf": 3233.33, "source": "autotuned"},
{"m": 8, "n": 9, "k": 45, "tile_m": 4, "tile_n": 1, "w": 16, "v": 6, "threads": 32, "grouping": 16, "minblocks": 12, "algorithm": "largeDB2", "perf": 3378.4, "source": "autotuned"},
{"m": 8, "n": 10, "k": 4, "tile_m": 1, "tile_n": 2, "threads": 64, "grouping": 9, "minblocks": 13, "algorithm": "medium", "perf": 1488.84, "source": "autotuned"},
{"m": 8, "n": 10, "k": 5, "tile_m": 1, "tile_n": 2, "threads": 64, "grouping": 9, "minblocks": 21, "algorithm": "medium", "perf": 1727.8, "source": "autotuned"},
{"m": 8, "n": 10, "k": 6, "tile_m": 1, "tile_n": 3, "threads": 64, "grouping": 8, "minblocks": 17, "algorithm": "medium", "perf": 1957.64, "source": "autotuned"},
{"m": 8, "n": 10, "k": 7, "tile_m": 1, "tile_n": 3, "threads": 96, "grouping": 8, "minblocks": 14, "algorithm": "medium", "perf": 2028.95, "source": "autotuned"},
{"m": 8, "n": 10, "k": 8, "tile_m": 4, "tile_n": 1, "threads": 96, "grouping": 8, "minblocks": 16, "algorithm": "medium", "perf": 2264.3, "source": "autotuned"},
{"m": 8, "n": 10, "k": 9, "tile_m": 4, "tile_n": 1, "threads": 96, "grouping": 8, "minblocks": 14, "algorithm": "medium", "perf": 2414.0, "source": "autotuned"},
{"m": 8, "n": 10, "k": 10, "tile_m": 4, "tile_n": 1, "threads": 128, "grouping": 8, "minblocks": 14, "algorithm": "medium", "perf": 2387.38, "source": "autotuned"},
{"m": 8, "n": 10, "k": 13, "tile_m": 4, "tile_n": 1, "threads": 160, "grouping": 16, "minblocks": 8, "algorithm": "medium", "perf": 2571.88, "source": "autotuned"},
{"m": 8, "n": 10, "k": 15, "tile_m": 1, "tile_n": 3, "threads": 160, "grouping": 16, "minblocks": 9, "algorithm": "medium", "perf": 2792.22, "source": "autotuned"},
{"m": 8, "n": 10, "k": 22, "tile_m": 4, "tile_n": 1, "threads": 32, "grouping": 8, "minblocks": 2, "algorithm": "medium", "perf": 3155.92, "source": "autotuned"},
{"m": 8, "n": 10, "k": 26, "tile_m": 4, "tile_n": 1, "w": 10, "v": 10, "threads": 32, "grouping": 16, "minblocks": 4, "algorithm": "largeDB2", "perf": 3378.59, "source": "autotuned"},
{"m": 8, "n": 10, "k": 32, "tile_m": 4, "tile_n": 1, "threads": 32, "grouping": 8, "minblocks": 1, "algorithm": "medium", "perf": 3501.95, "source": "autotuned"},
{"m": 8, "n": 10, "k": 45, "tile_m": 1, "tile_n": 3, "w": 18, "v": 10, "threads": 32, "grouping": 16, "minblocks": 8, "algorithm": "largeDB2", "perf": 3626.51, "source": "autotuned"},
{"m": 8, "n": 13, "k": 4, "tile_m": 4, "tile_n": 1, "threads": 64, "grouping": 9, "minblocks": 18, "algorithm": "medium", "perf": 1872.49, "source": "autotuned"},
{"m": 8, "n": 13, "k": 5, "tile_m": 4, "tile_n": 1, "threads": 96, "grouping": 8, "minblocks": 14, "algorithm": "medium", "perf": 2048.56, "source": "autotuned"},
{"m": 8, "n": 13, "k": 6, "tile_m": 4, "tile_n": 1, "threads": 96, "grouping": 12, "minblocks": 11, "algorithm": "medium", "perf": 2355.9, "source": "autotuned"},
{"m": 8, "n": 13, "k": 7, "tile_m": 4, "tile_n": 1, "threads": 96, "grouping": 8, "minblocks": 15, "algorithm": "medium", "perf": 2139.99, "source": "autotuned"},
{"m": 8, "n": 13, "k": 8, "tile_m": 4, "tile_n": 1, "threads": 128, "grouping": 8, "minblocks": 16, "algorithm": "medium", "perf": 2656.15, "source": "autotuned"},
{"m": 8, "n": 13, "k": 9, "tile_m": 4, "tile_n": 1, "threads": 128, "grouping": 8, "minblocks": 13, "algorithm": "medium", "perf": 2826.71, "source": "autotuned"},
{"m": 8, "n": 13, "k": 10, "tile_m": 4, "tile_n": 1, "threads": 160, "grouping": 16, "minblocks": 8, "algorithm": "medium", "perf": 2789.08, "source": "autotuned"},
{"m": 8, "n": 13, "k": 13, "tile_m": 4, "tile_n": 1, "threads": 32, "grouping": 8, "minblocks": 4, "algorithm": "medium", "perf": 3094.79, "source": "autotuned"},
{"m": 8, "n": 13, "k": 15, "tile_m": 4, "tile_n": 1, "threads": 32, "grouping": 8, "minblocks": 15, "algorithm": "medium", "perf": 3306.99, "source": "autotuned"},
{"m": 8, "n": 13, "k": 22, "tile_m": 4, "tile_n": 1, "threads": 32, "grouping": 8, "minblocks": 15, "algorithm": "medium", "perf": 3840.13, "source": "autotuned"},
{"m": 8, "n": 13, "k": 26, "tile_m": 4, "tile_n": 1, "w": 12, "v": 8, "threads": 32, "grouping": 16, "minblocks": 12, "algorithm": "largeDB2", "perf": 4040.1, "source": "autotuned"},
{"m": 8, "n": 13, "k": 32, "tile_m": 4, "tile_n": 1, "w": 12, "v": 8, "threads": 32, "grouping": 16, "minblocks": 4, "algorithm": "largeDB2", "perf": 4088.06, "source": "autotuned"},
{"m": 8, "n": 13, "k": 45, "tile_m": 4, "tile_n": 1, "w": 18, "v": 8, "threads": 32, "grouping": 16, "minblocks": 4, "algorithm": "largeDB2", "perf": 4308.09, "source": "autotuned"},
{"m": 8, "n": 15, "k": 4, "tile_m": 4, "tile_n": 1, "threads": 64, "grouping": 9, "minblocks": 15, "algorithm": "medium", "perf": 2147.21, "source": "autotuned"},
{"m": 8, "n": 15, "k": 5, "tile_m": 4, "tile_n": 1, "threads": 96, "grouping": 9, "minblocks": 16, "algorithm": "medium", "perf": 2368.54, "source": "autotuned"},
{"m": 8, "n": 15, "k": 6, "tile_m": 4, "tile_n": 1, "threads": 96, "grouping": 12, "minblocks": 11, "algorithm": "medium", "perf": 2656.5, "source": "autotuned"},
{"m": 8, "n": 15, "k": 7, "tile_m": 4, "tile_n": 1, "threads": 128, "grouping": 8, "minblocks": 13, "algorithm": "medium", "perf": 2716.78, "source": "autotuned"},
{"m": 8, "n": 15, "k": 8, "tile_m": 4, "tile_n": 1, "threads": 128, "grouping": 8, "minblocks": 15, "algorithm": "medium", "perf": 2993.02, "source": "autotuned"},
{"m": 8, "n": 15, "k": 9, "tile_m": 4, "tile_n": 1, "threads": 160, "grouping": 16, "minblocks": 8, "algorithm": "medium", "perf": 2934.25, "source": "autotuned"},
{"m": 8, "n": 15, "k": 10, "tile_m": 4, "tile_n": 1, "threads": 32, "grouping": 5, "minblocks": 25, "algorithm": "medium", "perf": 3128.42, "source": "autotuned"},
{"m": 8, "n": 15, "k": 13, "tile_m": 4, "tile_n": 1, "threads": 32, "grouping": 8, "minblocks": 10, "algorithm": "medium", "perf": 3431.53, "source": "autotuned"},
{"m": 8, "n": 15, "k": 15, "tile_m": 4, "tile_n": 1, "threads": 32, "grouping": 8, "minblocks": 3, "algorithm": "medium", "perf": 3684.64, "source": "autotuned"},
{"m": 8, "n": 22, "k": 4, "tile_m": 2, "tile_n": 3, "threads": 96, "grouping": 11, "minblocks": 11, "algorithm": "medium", "perf": 2637.53, "source": "autotuned"},
{"m": 8, "n": 22, "k": 5, "tile_m": 2, "tile_n": 3, "threads": 128, "grouping": 16, "minblocks": 8, "algorithm": "medium", "perf": 2760.72, "source": "autotuned"},
{"m": 8, "n": 22, "k": 6, "tile_m": 4, "tile_n": 1, "threads": 64, "grouping": 9, "minblocks": 20, "algorithm": "medium", "perf": 3010.27, "source": "autotuned"},
{"m": 8, "n": 22, "k": 7, "tile_m": 4, "tile_n": 1, "threads": 64, "grouping": 9, "minblocks": 20, "algorithm": "medium", "perf": 3294.27, "source": "autotuned"},
{"m": 8, "n": 22, "k": 8, "tile_m": 2, "tile_n": 3, "threads": 32, "grouping": 6, "minblocks": 24, "algorithm": "medium", "perf": 3435.22, "source": "autotuned"},
{"m": 8, "n": 22, "k": 9, "tile_m": 2, "tile_n": 3, "threads": 32, "grouping": 7, "minblocks": 21, "algorithm": "medium", "perf": 3584.83, "source": "autotuned"},
{"m": 8, "n": 22, "k": 10, "tile_m": 2, "tile_n": 3, "threads": 32, "grouping": 8, "minblocks": 15, "algorithm": "medium", "perf": 3869.34, "source": "autotuned"},
{"m": 8, "n": 22, "k": 13, "tile_m": 2, "tile_n": 3, "w": 6, "v": 22, "threads": 32, "grouping": 16, "minblocks": 12, "algorithm": "largeDB2", "perf": 4382.83, "source": "autotuned"},
{"m": 8, "n": 22, "k": 22, "tile_m": 2, "tile_n": 3, "w": 10, "v": 22, "threads": 32, "grouping": 16, "minblocks": 4, "algorithm": "largeDB2", "perf": 4719.59, "source": "autotuned"},
{"m": 8, "n": 22, "k": 32, "tile_m": 2, "tile_n": 3, "threads": 32, "grouping": 11, "minblocks": 4, "algorithm": "medium", "perf": 5291.57, "source": "autotuned"},
{"m": 8, "n": 26, "k": 4, "tile_m": 4, "tile_n": 1, "threads": 128, "grouping": 9, "minblocks": 16, "algorithm": "medium", "perf": 2623.22, "source": "autotuned"},
{"m": 8, "n": 26, "k": 5, "tile_m": 4, "tile_n": 1, "threads": 64, "grouping": 8, "minblocks": 24, "algorithm": "medium", "perf": 2891.13, "source": "autotuned"},
{"m": 8, "n": 26, "k": 6, "tile_m": 4, "tile_n": 1, "threads": 64, "grouping": 9, "minblocks": 17, "algorithm": "medium", "perf": 3285.24, "source": "autotuned"},
{"m": 8, "n": 26, "k": 7, "tile_m": 4, "tile_n": 1, "threads": 64, "grouping": 8, "minblocks": 22, "algorithm": "medium", "perf": 3569.74, "source": "autotuned"},
{"m": 8, "n": 26, "k": 8, "tile_m": 2, "tile_n": 4, "threads": 32, "grouping": 8, "minblocks": 7, "algorithm": "medium", "perf": 3659.43, "source": "autotuned"},
{"m": 8, "n": 26, "k": 9, "tile_m": 4, "tile_n": 2, "threads": 32, "grouping": 8, "minblocks": 13, "algorithm": "medium", "perf": 3863.66, "source": "autotuned"},
{"m": 8, "n": 26, "k": 10, "tile_m": 4, "tile_n": 2, "threads": 32, "grouping": 8, "minblocks": 15, "algorithm": "medium", "perf": 4164.08, "source": "autotuned"},
{"m": 8, "n": 26, "k": 13, "tile_m": 4, "tile_n": 2, "w": 6, "v": 26, "threads": 32, "grouping": 16, "minblocks": 4, "algorithm": "largeDB2", "perf": 4739.11, "source": "autotuned"},
{"m": 8, "n": 26, "k": 26, "tile_m": 4, "tile_n": 2, "threads": 32, "grouping": 12, "minblocks": 9, "algorithm": "medium", "perf": 5379.21, "source": "autotuned"},
{"m": 8, "n": 26, "k": 45, "tile_m": 4, "tile_n": 2, "w": 16, "v": 26, "threads": 32, "grouping": 16, "minblocks": 2, "algorithm": "largeDB2", "perf": 5975.06, "source": "autotuned"},
{"m": 8, "n": 32, "k": 4, "tile_m": 4, "tile_n": 1, "threads": 64, "grouping": 9, "minblocks": 18, "algorithm": "medium", "perf": 3168.0, "source": "autotuned"},
{"m": 8, "n": 32, "k": 5, "tile_m": 4, "tile_n": 1, "threads": 64, "grouping": 9, "minblocks": 16, "algorithm": "medium", "perf": 3540.28, "source": "autotuned"},
{"m": 8, "n": 32, "k": 6, "tile_m": 4, "tile_n": 1, "threads": 64, "grouping": 9, "minblocks": 22, "algorithm": "medium", "perf": 3940.96, "source": "autotuned"},
{"m": 8, "n": 32, "k": 7, "tile_m": 4, "tile_n": 1, "threads": 64, "grouping": 9, "minblocks": 19, "algorithm": "medium", "perf": 4168.74, "source": "autotuned"},
{"m": 8, "n": 32, "k": 8, "tile_m": 2, "tile_n": 4, "threads": 32, "grouping": 8, "minblocks": 14, "algorithm": "medium", "perf": 4502.51, "source": "autotuned"},
{"m": 8, "n": 32, "k": 9, "tile_m": 4, "tile_n": 2, "w": 4, "v": 32, "threads": 32, "grouping": 16, "minblocks": 8, "algorithm": "largeDB2", "perf": 4715.06, "source": "autotuned"},
{"m": 8, "n": 32, "k": 10, "tile_m": 4, "tile_n": 2, "w": 4, "v": 32, "threads": 32, "grouping": 16, "minblocks": 4, "algorithm": "largeDB2", "perf": 5126.73, "source": "autotuned"},
{"m": 8, "n": 32, "k": 13, "tile_m": 4, "tile_n": 2, "w": 6, "v": 32, "threads": 32, "grouping": 16, "minblocks": 12, "algorithm": "largeDB2", "perf": 5481.4, "source": "autotuned"},
{"m": 8, "n": 32, "k": 22, "tile_m": 4, "tile_n": 2, "threads": 32, "grouping": 12, "minblocks": 5, "algorithm": "medium", "perf": 5991.24, "source": "autotuned"},
{"m": 8, "n": 32, "k": 32, "tile_m": 4, "tile_n": 2, "threads": 32, "grouping": 16, "minblocks": 4, "algorithm": "medium", "perf": 6345.81, "source": "autotuned"},
{"m": 8, "n": 45, "k": 4, "tile_m": 2, "tile_n": 3, "threads": 64, "grouping": 9, "minblocks": 16, "algorithm": "medium", "perf": 3646.71, "source": "autotuned"},
{"m": 8, "n": 45, "k": 5, "tile_m": 2, "tile_n": 3, "threads": 64, "grouping": 9, "minblocks": 20, "algorithm": "medium", "perf": 4011.65, "source": "autotuned"},
{"m": 8, "n": 45, "k": 6, "tile_m": 4, "tile_n": 3, "threads": 32, "grouping": 8, "minblocks": 15, "algorithm": "medium", "perf": 4422.18, "source": "autotuned"},
{"m": 8, "n": 45, "k": 7, "tile_m": 4, "tile_n": 3, "threads": 32, "grouping": 8, "minblocks": 15, "algorithm": "medium", "perf": 4843.01, "source": "autotuned"},
{"m": 8, "n": 45, "k": 8, "tile_m": 4, "tile_n": 3, "threads": 32, "grouping": 8, "minblocks": 16, "algorithm": "medium", "perf": 5142.17, "source": "autotuned"},
{"m": 8, "n": 45, "k": 9, "tile_m": 4, "tile_n": 3, "w": 4, "v": 36, "threads": 32, "grouping": 16, "minblocks": 12, "algorithm": "largeDB2", "perf": 5410.71, "source": "autotuned"},
{"m": 8, "n": 45, "k": 10, "tile_m": 4, "tile_n": 3, "threads": 32, "grouping": 8, "minblocks": 14, "algorithm": "medium", "perf": 5617.98, "source": "autotuned"},
{"m": 8, "n": 45, "k": 13, "tile_m": 4, "tile_n": 3, "threads": 32, "grouping": 11, "minblocks": 1, "algorithm": "medium", "perf": 5983.97, "source": "autotuned"},
{"m": 8, "n": 45, "k": 26, "tile_m": 4, "tile_n": 3, "threads": 32, "grouping": 16, "minblocks": 4, "algorithm": "medium", "perf": 6482.52, "source": "autotuned"},
{"m": 8, "n": 45, "k": 45, "tile_m": 4, "tile_n": 3, "w": 16, "v": 28, "threads": 32, "grouping": 16, "minblocks": 8, "algorithm": "largeDB2", "perf": 6756.8, "source": "autotuned"},
{"m": 9, "n": 4, "k": 4, "tile_m": 1, "tile_n": 1, "threads": 64, "grouping": 9, "minblocks": 13, "algorithm": "medium", "perf": 710.844, "source": "autotuned"},
{"m": 9, "n": 4, "k": 5, "tile_m": 2, "tile_n": 1, "threads": 64, "grouping": 9, "minblocks": 21, "algorithm": "medium", "perf": 815.376, "source": "autotuned"},
{"m": 9, "n": 4, "k": 6, "tile_m": 1, "tile_n": 2, "threads": 64, "grouping": 9, "minblocks": 23, "algorithm": "medium", "perf": 942.804, "source": "autotuned"},
{"m": 9, "n": 4, "k": 7, "tile_m": 1, "tile_n": 1, "threads": 64, "grouping": 7, "minblocks": 4, "algorithm": "medium", "perf": 1010.96, "source": "autotuned"},
{"m": 9, "n": 4, "k": 8, "tile_m": 1, "tile_n": 2, "threads": 96, "grouping": 9, "minblocks": 19, "algorithm": "medium", "perf": 1071.43, "source": "autotuned"},
{"m": 9, "n": 4, "k": 9, "tile_m": 1, "tile_n": 4, "threads": 96, "grouping": 8, "minblocks": 16, "algorithm": "medium", "perf": 1149.08, "source": "autotuned"},
{"m": 9, "n": 4, "k": 10, "tile_m": 1, "tile_n": 4, "threads": 96, "grouping": 8, "minblocks": 16, "algorithm": "medium", "perf": 1243.28, "source": "autotuned"},
{"m": 9, "n": 4, "k": 13, "tile_m": 1, "tile_n": 4, "threads": 32, "grouping": 5, "minblocks": 27, "algorithm": "medium", "perf": 1324.03, "source": "autotuned"},
{"m": 9, "n": 4, "k": 15, "tile_m": 1, "tile_n": 4, "threads": 32, "grouping": 5, "minblocks": 26, "algorithm": "medium", "perf": 1370.84, "source": "autotuned"},
{"m": 9, "n": 4, "k": 16, "tile_m": 1, "tile_n": 4, "threads": 32, "grouping": 5, "minblocks": 27, "algorithm": "medium", "perf": 1378.11, "source": "autotuned"},
{"m": 9, "n": 4, "k": 22, "tile_m": 1, "tile_n": 4, "threads": 32, "grouping": 8, "minblocks": 6, "algorithm": "medium", "perf": 1531.01, "source": "autotuned"},
{"m": 9, "n": 4, "k": 23, "tile_m": 1, "tile_n": 4, "threads": 32, "grouping": 8, "minblocks": 1, "algorithm": "medium", "perf": 1560.59, "source": "autotuned"},
{"m": 9, "n": 4, "k": 25, "tile_m": 1, "tile_n": 4, "threads": 32, "grouping": 8, "minblocks": 6, "algorithm": "medium", "perf": 1539.14, "source": "autotuned"},
{"m": 9, "n": 4, "k": 26, "tile_m": 1, "tile_n": 2, "threads": 128, "grouping": 8, "minblocks": 15, "algorithm": "medium", "perf": 1619.45, "source": "autotuned"},
{"m": 9, "n": 4, "k": 28, "tile_m": 1, "tile_n": 4, "w": 10, "v": 4, "threads": 32, "grouping": 16, "minblocks": 12, "algorithm": "largeDB2", "perf": 1755.88, "source": "autotuned"},
{"m": 9, "n": 4, "k": 32, "tile_m": 1, "tile_n": 2, "w": 12, "v": 4, "threads": 32, "grouping": 16, "minblocks": 12, "algorithm": "largeDB2", "perf": 1762.29, "source": "autotuned"},
{"m": 9, "n": 4, "k": 45, "tile_m": 1, "tile_n": 4, "w": 16, "v": 4, "threads": 32, "grouping": 16, "minblocks": 12, "algorithm": "largeDB2", "perf": 1888.7, "source": "autotuned"},
{"m": 9, "n": 5, "k": 4, "tile_m": 1, "tile_n": 1, "threads": 64, "grouping": 11, "minblocks": 4, "algorithm": "medium", "perf": 873.445, "source": "autotuned"},
{"m": 9, "n": 5, "k": 5, "tile_m": 1, "tile_n": 1, "threads": 64, "grouping": 11, "minblocks": 1, "algorithm": "medium", "perf": 1009.45, "source": "autotuned"},
{"m": 9, "n": 5, "k": 6, "tile_m": 1, "tile_n": 1, "threads": 64, "grouping": 11, "minblocks": 25, "algorithm": "medium", "perf": 1137.93, "source": "autotuned"},
{"m": 9, "n": 5, "k": 7, "tile_m": 1, "tile_n": 1, "threads": 64, "grouping": 6, "minblocks": 12, "algorithm": "medium", "perf": 1247.22, "source": "autotuned"},
{"m": 9, "n": 5, "k": 8, "tile_m": 1, "tile_n": 1, "threads": 96, "grouping": 6, "minblocks": 11, "algorithm": "medium", "perf": 1283.29, "source": "autotuned"},
{"m": 9, "n": 5, "k": 9, "tile_m": 1, "tile_n": 1, "threads": 96, "grouping": 6, "minblocks": 7, "algorithm": "medium", "perf": 1361.01, "source": "autotuned"},
{"m": 9, "n": 5, "k": 10, "tile_m": 1, "tile_n": 1, "threads": 96, "grouping": 6, "minblocks": 9, "algorithm": "medium", "perf": 1426.84, "source": "autotuned"},
{"m": 9, "n": 5, "k": 13, "tile_m": 2, "tile_n": 1, "threads": 128, "grouping": 9, "minblocks": 16, "algorithm": "medium", "perf": 1562.27, "source": "autotuned"},
{"m": 9, "n": 5, "k": 14, "tile_m": 2, "tile_n": 1, "threads": 128, "grouping": 9, "minblocks": 13, "algorithm": "medium", "perf": 1629.97, "source": "autotuned"},
{"m": 9, "n": 5, "k": 15, "tile_m": 1, "tile_n": 2, "threads": 96, "grouping": 8, "minblocks": 14, "algorithm": "medium", "perf": 1589.56, "source": "autotuned"},
{"m": 9, "n": 5, "k": 16, "tile_m": 1, "tile_n": 2, "threads": 96, "grouping": 8, "minblocks": 15, "algorithm": "medium", "perf": 1667.41, "source": "autotuned"},
{"m": 9, "n": 5, "k": 22, "tile_m": 1, "tile_n": 2, "threads": 128, "grouping": 8, "minblocks": 16, "algorithm": "medium", "perf": 1797.57, "source": "autotuned"},
{"m": 9, "n": 5, "k": 23, "tile_m": 1, "tile_n": 2, "threads": 128, "grouping": 9, "minblocks": 14, "algorithm": "medium", "perf": 1819.02, "source": "autotuned"},
{"m": 9, "n": 5, "k": 25, "tile_m": 1, "tile_n": 2, "threads": 128, "grouping": 8, "minblocks": 16, "algorithm": "medium", "perf": 1891.64, "source": "autotuned"},
{"m": 9, "n": 5, "k": 26, "tile_m": 1, "tile_n": 2, "threads": 32, "grouping": 4, "minblocks": 11, "algorithm": "medium", "perf": 1804.17, "source": "autotuned"},
{"m": 9, "n": 5, "k": 32, "tile_m": 1, "tile_n": 2, "w": 12, "v": 4, "threads": 32, "grouping": 16, "minblocks": 1, "algorithm": "largeDB2", "perf": 1989.57, "source": "autotuned"},
{"m": 9, "n": 5, "k": 45, "tile_m": 2, "tile_n": 1, "w": 18, "v": 4, "threads": 32, "grouping": 16, "minblocks": 4, "algorithm": "largeDB2", "perf": 2101.64, "source": "autotuned"},
{"m": 9, "n": 6, "k": 4, "tile_m": 1, "tile_n": 2, "threads": 64, "grouping": 11, "minblocks": 23, "algorithm": "medium", "perf": 1007.51, "source": "autotuned"},
{"m": 9, "n": 6, "k": 5, "tile_m": 1, "tile_n": 2, "threads": 64, "grouping": 11, "minblocks": 21, "algorithm": "medium", "perf": 1194.95, "source": "autotuned"},
{"m": 9, "n": 6, "k": 6, "tile_m": 1, "tile_n": 2, "threads": 64, "grouping": 9, "minblocks": 23, "algorithm": "medium", "perf": 1336.79, "source": "autotuned"},
{"m": 9, "n": 6, "k": 7, "tile_m": 1, "tile_n": 2, "threads": 64, "grouping": 9, "minblocks": 5, "algorithm": "medium", "perf": 1468.33, "source": "autotuned"},
{"m": 9, "n": 6, "k": 8, "tile_m": 1, "tile_n": 2, "threads": 96, "grouping": 9, "minblocks": 21, "algorithm": "medium", "perf": 1517.02, "source": "autotuned"},
{"m": 9, "n": 6, "k": 9, "tile_m": 1, "tile_n": 2, "threads": 96, "grouping": 9, "minblocks": 17, "algorithm": "medium", "perf": 1593.94, "source": "autotuned"},
{"m": 9, "n": 6, "k": 10, "tile_m": 1, "tile_n": 2, "threads": 96, "grouping": 9, "minblocks": 20, "algorithm": "medium", "perf": 1729.62, "source": "autotuned"},
{"m": 9, "n": 6, "k": 13, "tile_m": 2, "tile_n": 1, "threads": 128, "grouping": 9, "minblocks": 16, "algorithm": "medium", "perf": 1863.81, "source": "autotuned"},
{"m": 9, "n": 6, "k": 14, "tile_m": 2, "tile_n": 1, "threads": 128, "grouping": 9, "minblocks": 13, "algorithm": "medium", "perf": 1932.56, "source": "autotuned"},
{"m": 9, "n": 6, "k": 15, "tile_m": 1, "tile_n": 2, "threads": 96, "grouping": 8, "minblocks": 14, "algorithm": "medium", "perf": 1895.48, "source": "autotuned"},
{"m": 9, "n": 6, "k": 22, "tile_m": 1, "tile_n": 2, "threads": 32, "grouping": 8, "minblocks": 23, "algorithm": "medium", "perf": 2054.94, "source": "autotuned"},
{"m": 9, "n": 6, "k": 26, "tile_m": 1, "tile_n": 2, "threads": 32, "grouping": 8, "minblocks": 17, "algorithm": "medium", "perf": 2156.11, "source": "autotuned"},
{"m": 9, "n": 6, "k": 32, "tile_m": 2, "tile_n": 1, "w": 12, "v": 6, "threads": 32, "grouping": 16, "minblocks": 4, "algorithm": "largeDB2", "perf": 2342.65, "source": "autotuned"},
{"m": 9, "n": 6, "k": 45, "tile_m": 1, "tile_n": 2, "w": 18, "v": 6, "threads": 32, "grouping": 16, "minblocks": 12, "algorithm": "largeDB2", "perf": 2470.28, "source": "autotuned"},
{"m": 9, "n": 7, "k": 4, "tile_m": 1, "tile_n": 1, "threads": 64, "grouping": 11, "minblocks": 21, "algorithm": "medium", "perf": 1134.66, "source": "autotuned"},
{"m": 9, "n": 7, "k": 5, "tile_m": 1, "tile_n": 1, "threads": 64, "grouping": 7, "minblocks": 3, "algorithm": "medium", "perf": 1295.2, "source": "autotuned"},
{"m": 9, "n": 7, "k": 6, "tile_m": 1, "tile_n": 1, "threads": 64, "grouping": 7, "minblocks": 11, "algorithm": "medium", "perf": 1459.74, "source": "autotuned"},
{"m": 9, "n": 7, "k": 7, "tile_m": 1, "tile_n": 1, "threads": 64, "grouping": 7, "minblocks": 15, "algorithm": "medium", "perf": 1584.18, "source": "autotuned"},
{"m": 9, "n": 7, "k": 8, "tile_m": 5, "tile_n": 1, "threads": 96, "grouping": 8, "minblocks": 14, "algorithm": "medium", "perf": 1622.82, "source": "autotuned"},
{"m": 9, "n": 7, "k": 9, "tile_m": 6, "tile_n": 1, "threads": 32, "grouping": 4, "minblocks": 31, "algorithm": "small", "perf": 1762.91, "source": "autotuned"},
{"m": 9, "n": 7, "k": 10, "tile_m": 6, "tile_n": 1, "threads": 32, "grouping": 4, "minblocks": 29, "algorithm": "small", "perf": 1863.04, "source": "autotuned"},
{"m": 9, "n": 7, "k": 13, "tile_m": 6, "tile_n": 1, "threads": 32, "grouping": 4, "minblocks": 30, "algorithm": "small", "perf": 2034.91, "source": "autotuned"},
{"m": 9, "n": 7, "k": 15, "tile_m": 6, "tile_n": 1, "threads": 32, "grouping": 5, "minblocks": 25, "algorithm": "medium", "perf": 2006.67, "source": "autotuned"},
{"m": 9, "n": 7, "k": 22, "tile_m": 6, "tile_n": 1, "threads": 32, "grouping": 8, "minblocks": 13, "algorithm": "medium", "perf": 2304.32, "source": "autotuned"},
{"m": 9, "n": 7, "k": 25, "tile_m": 6, "tile_n": 1, "threads": 32, "grouping": 8, "minblocks": 16, "algorithm": "medium", "perf": 2359.03, "source": "autotuned"},
{"m": 9, "n": 7, "k": 26, "tile_m": 6, "tile_n": 1, "threads": 32, "grouping": 8, "minblocks": 13, "algorithm": "medium", "perf": 2396.49, "source": "autotuned"},
{"m": 9, "n": 7, "k": 28, "tile_m": 6, "tile_n": 1, "w": 12, "v": 6, "threads": 32, "grouping": 16, "minblocks": 2, "algorithm": "largeDB2", "perf": 2465.44, "source": "autotuned"},
{"m": 9, "n": 7, "k": 32, "tile_m": 6, "tile_n": 1, "w": 14, "v": 6, "threads": 32, "grouping": 16, "minblocks": 2, "algorithm": "largeDB2", "perf": 2553.77, "source": "autotuned"},
{"m": 9, "n": 7, "k": 45, "tile_m": 6, "tile_n": 1, "w": 18, "v": 6, "threads": 32, "grouping": 16, "minblocks": 8, "algorithm": "largeDB2", "perf": 2676.63, "source": "autotuned"},
{"m": 9, "n": 8, "k": 4, "tile_m": 2, "tile_n": 2, "threads": 64, "grouping": 9, "minblocks": 20, "algorithm": "medium", "perf": 1251.3, "source": "autotuned"},
{"m": 9, "n": 8, "k": 5, "tile_m": 3, "tile_n": 1, "threads": 64, "grouping": 9, "minblocks": 24, "algorithm": "medium", "perf": 1424.2, "source": "autotuned"},
{"m": 9, "n": 8, "k": 6, "tile_m": 2, "tile_n": 2, "threads": 64, "grouping": 8, "minblocks": 22, "algorithm": "medium", "perf": 1624.13, "source": "autotuned"},
{"m": 9, "n": 8, "k": 7, "tile_m": 2, "tile_n": 2, "threads": 64, "grouping": 9, "minblocks": 24, "algorithm": "medium", "perf": 1736.48, "source": "autotuned"},
{"m": 9, "n": 8, "k": 8, "tile_m": 5, "tile_n": 1, "threads": 96, "grouping": 8, "minblocks": 16, "algorithm": "medium", "perf": 1860.93, "source": "autotuned"},
{"m": 9, "n": 8, "k": 9, "tile_m": 5, "tile_n": 1, "threads": 96, "grouping": 8, "minblocks": 15, "algorithm": "medium", "perf": 1972.75, "source": "autotuned"},
{"m": 9, "n": 8, "k": 10, "tile_m": 6, "tile_n": 1, "threads": 32, "grouping": 4, "minblocks": 31, "algorithm": "small", "perf": 1778.85, "source": "autotuned"},
{"m": 9, "n": 8, "k": 13, "tile_m": 5, "tile_n": 1, "threads": 128, "grouping": 8, "minblocks": 13, "algorithm": "medium", "perf": 2198.66, "source": "autotuned"},
{"m": 9, "n": 8, "k": 15, "tile_m": 6, "tile_n": 1, "threads": 32, "grouping": 5, "minblocks": 27, "algorithm": "medium", "perf": 2259.69, "source": "autotuned"},
{"m": 9, "n": 8, "k": 22, "tile_m": 6, "tile_n": 1, "threads": 32, "grouping": 8, "minblocks": 20, "algorithm": "medium", "perf": 2578.21, "source": "autotuned"},
{"m": 9, "n": 8, "k": 26, "tile_m": 6, "tile_n": 1, "threads": 32, "grouping": 8, "minblocks": 13, "algorithm": "medium", "perf": 2671.94, "source": "autotuned"},
{"m": 9, "n": 8, "k": 32, "tile_m": 6, "tile_n": 1, "w": 14, "v": 8, "threads": 32, "grouping": 16, "minblocks": 2, "algorithm": "largeDB2", "perf": 2951.74, "source": "autotuned"},
{"m": 9, "n": 8, "k": 45, "tile_m": 6, "tile_n": 1, "w": 20, "v": 8, "threads": 32, "grouping": 16, "minblocks": 12, "algorithm": "largeDB2", "perf": 3020.51, "source": "autotuned"},
{"m": 9, "n": 9, "k": 4, "tile_m": 1, "tile_n": 3, "threads": 64, "grouping": 8, "minblocks": 17, "algorithm": "medium", "perf": 1372.24, "source": "autotuned"},
{"m": 9, "n": 9, "k": 5, "tile_m": 1, "tile_n": 3, "threads": 64, "grouping": 8, "minblocks": 17, "algorithm": "medium", "perf": 1609.35, "source": "autotuned"},
{"m": 9, "n": 9, "k": 6, "tile_m": 5, "tile_n": 1, "threads": 32, "grouping": 5, "minblocks": 31, "algorithm": "small", "perf": 1791.8, "source": "autotuned"},
{"m": 9, "n": 9, "k": 7, "tile_m": 5, "tile_n": 1, "threads": 96, "grouping": 11, "minblocks": 13, "algorithm": "medium", "perf": 1952.42, "source": "autotuned"},
{"m": 9, "n": 9, "k": 8, "tile_m": 5, "tile_n": 1, "threads": 32, "grouping": 8, "minblocks": 7, "algorithm": "small", "perf": 2109.24, "source": "autotuned"},
{"m": 9, "n": 9, "k": 9, "tile_m": 5, "tile_n": 1, "threads": 32, "grouping": 8, "minblocks": 3, "algorithm": "small", "perf": 2232.46, "source": "autotuned"},
{"m": 9, "n": 9, "k": 10, "tile_m": 5, "tile_n": 1, "threads": 32, "grouping": 8, "minblocks": 10, "algorithm": "small", "perf": 2374.72, "source": "autotuned"},
{"m": 9, "n": 9, "k": 12, "tile_m": 5, "tile_n": 1, "threads": 96, "grouping": 8, "minblocks": 15, "algorithm": "small", "perf": 2403.22, "source": "autotuned"},
{"m": 9, "n": 9, "k": 13, "tile_m": 5, "tile_n": 1, "threads": 96, "grouping": 8, "minblocks": 15, "algorithm": "small", "perf": 2477.89, "source": "autotuned"},
{"m": 9, "n": 9, "k": 14, "tile_m": 5, "tile_n": 1, "threads": 96, "grouping": 8, "minblocks": 15, "algorithm": "small", "perf": 2600.65, "source": "autotuned"},
{"m": 9, "n": 9, "k": 15, "tile_m": 5, "tile_n": 1, "threads": 32, "grouping": 8, "minblocks": 24, "algorithm": "medium", "perf": 2598.63, "source": "autotuned"},
{"m": 9, "n": 9, "k": 16, "tile_m": 5, "tile_n": 1, "threads": 32, "grouping": 8, "minblocks": 3, "algorithm": "medium", "perf": 2703.35, "source": "autotuned"},
{"m": 9, "n": 9, "k": 17, "tile_m": 5, "tile_n": 1, "threads": 32, "grouping": 8, "minblocks": 25, "algorithm": "medium", "perf": 2756.7, "source": "autotuned"},
{"m": 9, "n": 9, "k": 22, "tile_m": 5, "tile_n": 1, "threads": 32, "grouping": 8, "minblocks": 4, "algorithm": "medium", "perf": 2869.8, "source": "autotuned"},
{"m": 9, "n": 9, "k": 23, "tile_m": 5, "tile_n": 1, "threads": 32, "grouping": 8, "minblocks": 15, "algorithm": "medium", "perf": 2899.76, "source": "autotuned"},
{"m": 9, "n": 9, "k": 25, "tile_m": 5, "tile_n": 1, "threads": 32, "grouping": 8, "minblocks": 8, "algorithm": "medium", "perf": 2919.48, "source": "autotuned"},
{"m": 9, "n": 9, "k": 26, "tile_m": 5, "tile_n": 1, "threads": 32, "grouping": 8, "minblocks": 17, "algorithm": "medium", "perf": 2934.88, "source": "autotuned"},
{"m": 9, "n": 9, "k": 28, "tile_m": 5, "tile_n": 1, "threads": 32, "grouping": 11, "minblocks": 2, "algorithm": "medium", "perf": 3029.79, "source": "autotuned"},
{"m": 9, "n": 9, "k": 32, "tile_m": 5, "tile_n": 1, "threads": 32, "grouping": 8, "minblocks": 4, "algorithm": "medium", "perf": 3366.19, "source": "autotuned"},
{"m": 9, "n": 9, "k": 45, "tile_m": 5, "tile_n": 1, "threads": 32, "grouping": 11, "minblocks": 8, "algorithm": "medium", "perf": 3328.79, "source": "autotuned"},
{"m": 9, "n": 10, "k": 4, "tile_m": 1, "tile_n": 2, "threads": 64, "grouping": 9, "minblocks": 21, "algorithm": "medium", "perf": 1529.71, "source": "autotuned"},
{"m": 9, "n": 10, "k": 5, "tile_m": 3, "tile_n": 1, "threads": 64, "grouping": 9, "minblocks": 23, "algorithm": "medium", "perf": 1764.23, "source": "autotuned"},
{"m": 9, "n": 10, "k": 6, "tile_m": 3, "tile_n": 1, "threads": 64, "grouping": 11, "minblocks": 3, "algorithm": "medium", "perf": 1926.48, "source": "autotuned"},
{"m": 9, "n": 10, "k": 7, "tile_m": 5, "tile_n": 1, "threads": 96, "grouping": 11, "minblocks": 13, "algorithm": "medium", "perf": 2089.29, "source": "autotuned"},
{"m": 9, "n": 10, "k": 8, "tile_m": 5, "tile_n": 1, "threads": 96, "grouping": 8, "minblocks": 14, "algorithm": "medium", "perf": 2279.19, "source": "autotuned"},
{"m": 9, "n": 10, "k": 9, "tile_m": 5, "tile_n": 1, "threads": 96, "grouping": 8, "minblocks": 16, "algorithm": "medium", "perf": 2413.86, "source": "autotuned"},
{"m": 9, "n": 10, "k": 10, "tile_m": 5, "tile_n": 1, "threads": 128, "grouping": 11, "minblocks": 11, "algorithm": "medium", "perf": 2336.06, "source": "autotuned"},
{"m": 9, "n": 10, "k": 13, "tile_m": 5, "tile_n": 1, "threads": 32, "grouping": 8, "minblocks": 4, "algorithm": "medium", "perf": 2536.0, "source": "autotuned"},
{"m": 9, "n": 10, "k": 14, "tile_m": 5, "tile_n": 1, "threads": 32, "grouping": 8, "minblocks": 4, "algorithm": "medium", "perf": 2649.12, "source": "autotuned"},
{"m": 9, "n": 10, "k": 15, "tile_m": 5, "tile_n": 1, "threads": 32, "grouping": 8, "minblocks": 23, "algorithm": "medium", "perf": 2735.49, "source": "autotuned"},
{"m": 9, "n": 10, "k": 22, "tile_m": 5, "tile_n": 1, "threads": 32, "grouping": 8, "minblocks": 2, "algorithm": "medium", "perf": 2991.87, "source": "autotuned"},
{"m": 9, "n": 10, "k": 26, "tile_m": 5, "tile_n": 1, "w": 12, "v": 10, "threads": 32, "grouping": 16, "minblocks": 12, "algorithm": "largeDB2", "perf": 3253.73, "source": "autotuned"},
{"m": 9, "n": 10, "k": 32, "tile_m": 5, "tile_n": 1, "w": 14, "v": 10, "threads": 32, "grouping": 16, "minblocks": 12, "algorithm": "largeDB2", "perf": 3374.41, "source": "autotuned"},
{"m": 9, "n": 10, "k": 45, "tile_m": 5, "tile_n": 1, "w": 16, "v": 10, "threads": 32, "grouping": 16, "minblocks": 12, "algorithm": "largeDB2", "perf": 3531.03, "source": "autotuned"},
{"m": 9, "n": 12, "k": 9, "tile_m": 5, "tile_n": 1, "threads": 128, "grouping": 11, "minblocks": 11, "algorithm": "medium", "perf": 2650.53, "source": "autotuned"},
{"m": 9, "n": 12, "k": 10, "tile_m": 5, "tile_n": 1, "threads": 128, "grouping": 11, "minblocks": 12, "algorithm": "medium", "perf": 2810.72, "source": "autotuned"},
{"m": 9, "n": 12, "k": 32, "tile_m": 5, "tile_n": 1, "w": 14, "v": 6, "threads": 32, "grouping": 16, "minblocks": 1, "algorithm": "largeDB2", "perf": 3851.18, "source": "autotuned"},
{"m": 9, "n": 13, "k": 4, "tile_m": 6, "tile_n": 1, "threads": 64, "grouping": 9, "minblocks": 18, "algorithm": "medium", "perf": 1821.04, "source": "autotuned"},
{"m": 9, "n": 13, "k": 5, "tile_m": 5, "tile_n": 1, "threads": 96, "grouping": 11, "minblocks": 12, "algorithm": "medium", "perf": 2125.73, "source": "autotuned"},
{"m": 9, "n": 13, "k": 6, "tile_m": 5, "tile_n": 1, "threads": 96, "grouping": 11, "minblocks": 13, "algorithm": "medium", "perf": 2418.01, "source": "autotuned"},
{"m": 9, "n": 13, "k": 7, "tile_m": 5, "tile_n": 1, "threads": 96, "grouping": 8, "minblocks": 16, "algorithm": "medium", "perf": 2632.01, "source": "autotuned"},
{"m": 9, "n": 13, "k": 8, "tile_m": 5, "tile_n": 1, "threads": 128, "grouping": 11, "minblocks": 12, "algorithm": "medium", "perf": 2611.41, "source": "autotuned"},
{"m": 9, "n": 13, "k": 9, "tile_m": 5, "tile_n": 1, "threads": 128, "grouping": 11, "minblocks": 12, "algorithm": "medium", "perf": 2830.15, "source": "autotuned"},
{"m": 9, "n": 13, "k": 10, "tile_m": 5, "tile_n": 1, "threads": 160, "grouping": 16, "minblocks": 8, "algorithm": "medium", "perf": 2799.25, "source": "autotuned"},
{"m": 9, "n": 13, "k": 13, "tile_m": 5, "tile_n": 1, "threads": 32, "grouping": 8, "minblocks": 24, "algorithm": "medium", "perf": 3114.59, "source": "autotuned"},
{"m": 9, "n": 13, "k": 14, "tile_m": 5, "tile_n": 1, "threads": 32, "grouping": 8, "minblocks": 24, "algorithm": "medium", "perf": 3284.53, "source": "autotuned"},
{"m": 9, "n": 13, "k": 15, "tile_m": 5, "tile_n": 1, "threads": 32, "grouping": 8, "minblocks": 23, "algorithm": "medium", "perf": 3291.07, "source": "autotuned"},
{"m": 9, "n": 13, "k": 16, "tile_m": 5, "tile_n": 1, "threads": 32, "grouping": 8, "minblocks": 22, "algorithm": "medium", "perf": 3396.47, "source": "autotuned"},
{"m": 9, "n": 13, "k": 22, "tile_m": 5, "tile_n": 1, "w": 10, "v": 10, "threads": 32, "grouping": 16, "minblocks": 2, "algorithm": "largeDB2", "perf": 3724.85, "source": "autotuned"},
{"m": 9, "n": 13, "k": 23, "tile_m": 5, "tile_n": 1, "w": 10, "v": 8, "threads": 32, "grouping": 16, "minblocks": 8, "algorithm": "largeDB2", "perf": 3721.87, "source": "autotuned"},
{"m": 9, "n": 13, "k": 25, "tile_m": 5, "tile_n": 1, "w": 12, "v": 8, "threads": 32, "grouping": 16, "minblocks": 12, "algorithm": "largeDB2", "perf": 3842.3, "source": "autotuned"},
{"m": 9, "n": 13, "k": 26, "tile_m": 5, "tile_n": 1, "w": 12, "v": 8, "threads": 32, "grouping": 16, "minblocks": 12, "algorithm": "largeDB2", "perf": 3864.06, "source": "autotuned"},
{"m": 9, "n": 13, "k": 32, "tile_m": 5, "tile_n": 1, "w": 14, "v": 8, "threads": 32, "grouping": 16, "minblocks": 4, "algorithm": "largeDB2", "perf": 4001.25, "source": "autotuned"},
{"m": 9, "n": 13, "k": 45, "tile_m": 5, "tile_n": 1, "threads": 32, "grouping": 11, "minblocks": 3, "algorithm": "medium", "perf": 4308.68, "source": "autotuned"},
{"m": 9, "n": 14, "k": 5, "tile_m": 5, "tile_n": 1, "threads": 96, "grouping": 11, "minblocks": 11, "algorithm": "medium", "perf": 2291.19, "source": "autotuned"},
{"m": 9, "n": 14, "k": 6, "tile_m": 5, "tile_n": 1, "threads": 96, "grouping": 11, "minblocks": 13, "algorithm": "medium", "perf": 2585.42, "source": "autotuned"},
{"m": 9, "n": 14, "k": 9, "tile_m": 5, "tile_n": 1, "threads": 128, "grouping": 11, "minblocks": 12, "algorithm": "medium", "perf": 3080.2, "source": "autotuned"},
{"m": 9, "n": 14, "k": 10, "tile_m": 5, "tile_n": 1, "threads": 160, "grouping": 16, "minblocks": 8, "algorithm": "medium", "perf": 3033.03, "source": "autotuned"},
{"m": 9, "n": 14, "k": 13, "tile_m": 5, "tile_n": 1, "threads": 32, "grouping": 8, "minblocks": 22, "algorithm": "medium", "perf": 3312.04, "source": "autotuned"},
{"m": 9, "n": 14, "k": 14, "tile_m": 5, "tile_n": 1, "threads": 32, "grouping": 8, "minblocks": 5, "algorithm": "medium", "perf": 3428.22, "source": "autotuned"},
{"m": 9, "n": 15, "k": 4, "tile_m": 5, "tile_n": 1, "threads": 96, "grouping": 8, "minblocks": 15, "algorithm": "medium", "perf": 2082.8, "source": "autotuned"},
{"m": 9, "n": 15, "k": 5, "tile_m": 5, "tile_n": 1, "threads": 96, "grouping": 11, "minblocks": 12, "algorithm": "medium", "perf": 2443.96, "source": "autotuned"},
{"m": 9, "n": 15, "k": 6, "tile_m": 5, "tile_n": 1, "threads": 96, "grouping": 11, "minblocks": 13, "algorithm": "medium", "perf": 2709.27, "source": "autotuned"},
{"m": 9, "n": 15, "k": 7, "tile_m": 5, "tile_n": 1, "threads": 128, "grouping": 11, "minblocks": 11, "algorithm": "medium", "perf": 2764.02, "source": "autotuned"},
{"m": 9, "n": 15, "k": 8, "tile_m": 5, "tile_n": 1, "threads": 128, "grouping": 11, "minblocks": 11, "algorithm": "medium", "perf": 2975.39, "source": "autotuned"},
{"m": 9, "n": 15, "k": 9, "tile_m": 5, "tile_n": 1, "threads": 32, "grouping": 6, "minblocks": 27, "algorithm": "medium", "perf": 2999.46, "source": "autotuned"},
{"m": 9, "n": 15, "k": 10, "tile_m": 5, "tile_n": 1, "threads": 160, "grouping": 16, "minblocks": 8, "algorithm": "medium", "perf": 3220.4, "source": "autotuned"},
{"m": 9, "n": 15, "k": 13, "tile_m": 5, "tile_n": 1, "threads": 32, "grouping": 8, "minblocks": 23, "algorithm": "medium", "perf": 3542.47, "source": "autotuned"},
{"m": 9, "n": 15, "k": 15, "tile_m": 5, "tile_n": 1, "threads": 32, "grouping": 8, "minblocks": 22, "algorithm": "medium", "perf": 3671.84, "source": "autotuned"},
{"m": 9, "n": 15, "k": 16, "tile_m": 5, "tile_n": 1, "threads": 32, "grouping": 8, "minblocks": 17, "algorithm": "medium", "perf": 3848.73, "source": "autotuned"},
{"m": 9, "n": 15, "k": 22, "tile_m": 5, "tile_n": 1, "w": 10, "v": 10, "threads": 32, "grouping": 16, "minblocks": 2, "algorithm": "largeDB2", "perf": 4191.79, "source": "autotuned"},
{"m": 9, "n": 15, "k": 25, "tile_m": 5, "tile_n": 1, "w": 10, "v": 8, "threads": 32, "grouping": 16, "minblocks": 12, "algorithm": "largeDB2", "perf": 4139.01, "source": "autotuned"},
{"m": 9, "n": 15, "k": 26, "tile_m": 5, "tile_n": 1, "w": 10, "v": 8, "threads": 32, "grouping": 16, "minblocks": 2, "algorithm": "largeDB2", "perf": 4294.04, "source": "autotuned"},
{"m": 9, "n": 15, "k": 45, "tile_m": 5, "tile_n": 1, "w": 16, "v": 10, "threads": 32, "grouping": 16, "minblocks": 12, "algorithm": "largeDB2", "perf": 4758.73, "source": "autotuned"},
{"m": 9, "n": 16, "k": 4, "tile_m": 5, "tile_n": 1, "threads": 96, "grouping": 8, "minblocks": 15, "algorithm": "medium", "perf": 2243.19, "source": "autotuned"},
{"m": 9, "n": 16, "k": 5, "tile_m": 5, "tile_n": 1, "threads": 96, "grouping": 8, "minblocks": 14, "algorithm": "medium", "perf": 2631.95, "source": "autotuned"},
{"m": 9, "n": 16, "k": 9, "tile_m": 5, "tile_n": 1, "threads": 32, "grouping": 6, "minblocks": 25, "algorithm": "medium", "perf": 3236.52, "source": "autotuned"},
{"m": 9, "n": 16, "k": 13, "tile_m": 5, "tile_n": 1, "threads": 32, "grouping": 8, "minblocks": 3, "algorithm": "medium", "perf": 3753.93, "source": "autotuned"},
{"m": 9, "n": 16, "k": 15, "tile_m": 5, "tile_n": 1, "threads": 32, "grouping": 8, "minblocks": 20, "algorithm": "medium", "perf": 3941.4, "source": "autotuned"},
{"m": 9, "n": 16, "k": 16, "tile_m": 5, "tile_n": 1, "w": 6, "v": 16, "threads": 32, "grouping": 16, "minblocks": 12, "algorithm": "largeDB2", "perf": 4296.64, "source": "autotuned"},
{"m": 9, "n": 16, "k": 17, "tile_m": 5, "tile_n": 1, "w": 8, "v": 16, "threads": 32, "grouping": 16, "minblocks": 12, "algorithm": "largeDB2", "perf": 4327.97, "source": "autotuned"},
{"m": 9, "n": 16, "k": 22, "tile_m": 5, "tile_n": 1, "w": 10, "v": 16, "threads": 32, "grouping": 16, "minblocks": 12, "algorithm": "largeDB2", "perf": 4564.08, "source": "autotuned"},
{"m": 9, "n": 16, "k": 23, "tile_m": 5, "tile_n": 1, "w": 10, "v": 16, "threads": 32, "grouping": 16, "minblocks": 12, "algorithm": "largeDB2", "perf": 4635.78, "source": "autotuned"},
{"m": 9, "n": 16, "k": 25, "tile_m": 5, "tile_n": 1, "w": 10, "v": 16, "threads": 32, "grouping": 16, "minblocks": 12, "algorithm": "largeDB2", "perf": 4554.54, "source": "autotuned"},
{"m": 9, "n": 16, "k": 26, "tile_m": 5, "tile_n": 1, "w": 10, "v": 16, "threads": 32, "grouping": 16, "minblocks": 12, "algorithm": "largeDB2", "perf": 4584.05, "source": "autotuned"},
{"m": 9, "n": 16, "k": 45, "tile_m": 5, "tile_n": 1, "w": 16, "v": 16, "threads": 32, "grouping": 16, "minblocks": 1, "algorithm": "largeDB2", "perf": 5128.18, "source": "autotuned"},
{"m": 9, "n": 17, "k": 9, "tile_m": 5, "tile_n": 2, "threads": 32, "grouping": 5, "minblocks": 27, "algorithm": "medium", "perf": 3055.67, "source": "autotuned"},
{"m": 9, "n": 17, "k": 16, "tile_m": 5, "tile_n": 2, "threads": 32, "grouping": 8, "minblocks": 17, "algorithm": "medium", "perf": 3928.08, "source": "autotuned"},
{"m": 9, "n": 17, "k": 17, "tile_m": 5, "tile_n": 2, "threads": 32, "grouping": 8, "minblocks": 17, "algorithm": "medium", "perf": 3805.21, "source": "autotuned"},
{"m": 9, "n": 17, "k": 22, "tile_m": 5, "tile_n": 2, "threads": 32, "grouping": 8, "minblocks": 13, "algorithm": "medium", "perf": 3983.11, "source": "autotuned"},
{"m": 9, "n": 17, "k": 23, "tile_m": 5, "tile_n": 2, "w": 10, "v": 16, "threads": 32, "grouping": 16, "minblocks": 8, "algorithm": "largeDB2", "perf": 4001.63, "source": "autotuned"},
{"m": 9, "n": 22, "k": 4, "tile_m": 5, "tile_n": 2, "threads": 96, "grouping": 11, "minblocks": 11, "algorithm": "medium", "perf": 2663.32, "source": "autotuned"},
{"m": 9, "n": 22, "k": 5, "tile_m": 5, "tile_n": 2, "threads": 128, "grouping": 16, "minblocks": 8, "algorithm": "medium", "perf": 2717.52, "source": "autotuned"},
{"m": 9, "n": 22, "k": 6, "tile_m": 5, "tile_n": 2, "threads": 32, "grouping": 5, "minblocks": 26, "algorithm": "medium", "perf": 2995.64, "source": "autotuned"},
{"m": 9, "n": 22, "k": 7, "tile_m": 5, "tile_n": 2, "threads": 32, "grouping": 6, "minblocks": 24, "algorithm": "medium", "perf": 3260.49, "source": "autotuned"},
{"m": 9, "n": 22, "k": 8, "tile_m": 5, "tile_n": 2, "threads": 32, "grouping": 8, "minblocks": 13, "algorithm": "medium", "perf": 3491.18, "source": "autotuned"},
{"m": 9, "n": 22, "k": 9, "tile_m": 5, "tile_n": 2, "threads": 32, "grouping": 8, "minblocks": 16, "algorithm": "medium", "perf": 3612.59, "source": "autotuned"},
{"m": 9, "n": 22, "k": 10, "tile_m": 5, "tile_n": 2, "threads": 32, "grouping": 8, "minblocks": 16, "algorithm": "medium", "perf": 4031.11, "source": "autotuned"},
{"m": 9, "n": 22, "k": 13, "tile_m": 5, "tile_n": 2, "w": 6, "v": 22, "threads": 32, "grouping": 16, "minblocks": 8, "algorithm": "largeDB2", "perf": 4298.5, "source": "autotuned"},
{"m": 9, "n": 22, "k": 15, "tile_m": 5, "tile_n": 2, "w": 6, "v": 22, "threads": 32, "grouping": 16, "minblocks": 8, "algorithm": "largeDB2", "perf": 4511.66, "source": "autotuned"},
{"m": 9, "n": 22, "k": 16, "tile_m": 5, "tile_n": 2, "threads": 32, "grouping": 8, "minblocks": 16, "algorithm": "medium", "perf": 4701.77, "source": "autotuned"},
{"m": 9, "n": 22, "k": 17, "tile_m": 5, "tile_n": 2, "w": 8, "v": 22, "threads": 32, "grouping": 16, "minblocks": 1, "algorithm": "largeDB2", "perf": 4495.4, "source": "autotuned"},
{"m": 9, "n": 22, "k": 22, "tile_m": 5, "tile_n": 2, "w": 10, "v": 22, "threads": 32, "grouping": 16, "minblocks": 1, "algorithm": "largeDB2", "perf": 4712.36, "source": "autotuned"},
{"m": 9, "n": 22, "k": 23, "tile_m": 5, "tile_n": 2, "w": 8, "v": 22, "threads": 32, "grouping": 16, "minblocks": 12, "algorithm": "largeDB2", "perf": 4839.33, "source": "autotuned"},
{"m": 9, "n": 22, "k": 25, "tile_m": 5, "tile_n": 2, "w": 10, "v": 22, "threads": 32, "grouping": 16, "minblocks": 1, "algorithm": "largeDB2", "perf": 4979.77, "source": "autotuned"},
{"m": 9, "n": 22, "k": 26, "tile_m": 5, "tile_n": 2, "w": 10, "v": 22, "threads": 32, "grouping": 16, "minblocks": 2, "algorithm": "largeDB2", "perf": 4993.16, "source": "autotuned"},
{"m": 9, "n": 22, "k": 32, "tile_m": 5, "tile_n": 2, "w": 14, "v": 22, "threads": 32, "grouping": 16, "minblocks": 2, "algorithm": "largeDB2", "perf": 5296.36, "source": "autotuned"},
{"m": 9, "n": 22, "k": 45, "tile_m": 5, "tile_n": 2, "w": 16, "v": 20, "threads": 32, "grouping": 16, "minblocks": 8, "algorithm": "largeDB2", "perf": 5710.88, "source": "autotuned"},
{"m": 9, "n": 23, "k": 4, "tile_m": 5, "tile_n": 2, "threads": 96, "grouping": 11, "minblocks": 11, "algorithm": "medium", "perf": 2762.09, "source": "autotuned"},
{"m": 9, "n": 23, "k": 5, "tile_m": 5, "tile_n": 2, "threads": 128, "grouping": 16, "minblocks": 8, "algorithm": "medium", "perf": 2855.41, "source": "autotuned"},
{"m": 9, "n": 23, "k": 9, "tile_m": 5, "tile_n": 2, "threads": 32, "grouping": 8, "minblocks": 9, "algorithm": "medium", "perf": 3842.44, "source": "autotuned"},
{"m": 9, "n": 23, "k": 13, "tile_m": 5, "tile_n": 2, "threads": 32, "grouping": 8, "minblocks": 18, "algorithm": "medium", "perf": 4545.11, "source": "autotuned"},
{"m": 9, "n": 23, "k": 16, "tile_m": 5, "tile_n": 2, "threads": 32, "grouping": 8, "minblocks": 14, "algorithm": "medium", "perf": 4785.32, "source": "autotuned"},
{"m": 9, "n": 23, "k": 17, "tile_m": 5, "tile_n": 2, "threads": 32, "grouping": 8, "minblocks": 14, "algorithm": "medium", "perf": 4720.74, "source": "autotuned"},
{"m": 9, "n": 23, "k": 22, "tile_m": 5, "tile_n": 2, "w": 8, "v": 16, "threads": 32, "grouping": 16, "minblocks": 12, "algorithm": "largeDB2", "perf": 4775.08, "source": "autotuned"},
{"m": 9, "n": 23, "k": 23, "tile_m": 5, "tile_n": 2, "w": 10, "v": 22, "threads": 32, "grouping": 16, "minblocks": 8, "algorithm": "largeDB2", "perf": 4804.12, "source": "autotuned"},
{"m": 9, "n": 23, "k": 26, "tile_m": 5, "tile_n": 2, "w": 10, "v": 22, "threads": 32, "grouping": 16, "minblocks": 8, "algorithm": "largeDB2", "perf": 5020.53, "source": "autotuned"},
{"m": 9, "n": 25, "k": 4, "tile_m": 5, "tile_n": 2, "threads": 128, "grouping": 16, "minblocks": 9, "algorithm": "medium", "perf": 2631.81, "source": "autotuned"},
{"m": 9, "n": 25, "k": 5, "tile_m": 5, "tile_n": 2, "threads": 128, "grouping": 16, "minblocks": 8, "algorithm": "medium", "perf": 3069.39, "source": "autotuned"},
{"m": 9, "n": 25, "k": 9, "tile_m": 5, "tile_n": 2, "threads": 32, "grouping": 8, "minblocks": 10, "algorithm": "medium", "perf": 4011.15, "source": "autotuned"},
{"m": 9, "n": 25, "k": 13, "tile_m": 5, "tile_n": 2, "threads": 32, "grouping": 8, "minblocks": 16, "algorithm": "medium", "perf": 4700.26, "source": "autotuned"},
{"m": 9, "n": 25, "k": 15, "tile_m": 5, "tile_n": 2, "threads": 32, "grouping": 8, "minblocks": 13, "algorithm": "medium", "perf": 4822.94, "source": "autotuned"},
{"m": 9, "n": 25, "k": 16, "tile_m": 5, "tile_n": 2, "threads": 32, "grouping": 8, "minblocks": 13, "algorithm": "medium", "perf": 4026.6, "source": "autotuned"},
{"m": 9, "n": 25, "k": 22, "tile_m": 5, "tile_n": 2, "w": 10, "v": 24, "threads": 32, "grouping": 16, "minblocks": 2, "algorithm": "largeDB2", "perf": 5138.24, "source": "autotuned"},
{"m": 9, "n": 25, "k": 25, "tile_m": 5, "tile_n": 2, "w": 10, "v": 24, "threads": 32, "grouping": 16, "minblocks": 12, "algorithm": "largeDB2", "perf": 5203.54, "source": "autotuned"},
{"m": 9, "n": 25, "k": 26, "tile_m": 5, "tile_n": 2, "w": 10, "v": 16, "threads": 32, "grouping": 16, "minblocks": 12, "algorithm": "largeDB2", "perf": 5297.37, "source": "autotuned"},
{"m": 9, "n": 25, "k": 45, "tile_m": 5, "tile_n": 2, "w": 16, "v": 24, "threads": 32, "grouping": 16, "minblocks": 12, "algorithm": "largeDB2", "perf": 6026.28, "source": "autotuned"},
{"m": 9, "n": 26, "k": 4, "tile_m": 5, "tile_n": 2, "threads": 128, "grouping": 16, "minblocks": 8, "algorithm": "medium", "perf": 2787.22, "source": "autotuned"},
{"m": 9, "n": 26, "k": 5, "tile_m": 5, "tile_n": 1, "threads": 64, "grouping": 8, "minblocks": 24, "algorithm": "medium", "perf": 2980.3, "source": "autotuned"},
{"m": 9, "n": 26, "k": 6, "tile_m": 5, "tile_n": 2, "threads": 32, "grouping": 5, "minblocks": 25, "algorithm": "medium", "perf": 3361.91, "source": "autotuned"},
{"m": 9, "n": 26, "k": 7, "tile_m": 5, "tile_n": 2, "threads": 32, "grouping": 6, "minblocks": 22, "algorithm": "medium", "perf": 3650.41, "source": "autotuned"},
{"m": 9, "n": 26, "k": 8, "tile_m": 5, "tile_n": 2, "threads": 32, "grouping": 8, "minblocks": 13, "algorithm": "medium", "perf": 3934.0, "source": "autotuned"},
{"m": 9, "n": 26, "k": 9, "tile_m": 5, "tile_n": 2, "threads": 32, "grouping": 8, "minblocks": 18, "algorithm": "medium", "perf": 4043.49, "source": "autotuned"},
{"m": 9, "n": 26, "k": 10, "tile_m": 5, "tile_n": 2, "threads": 32, "grouping": 8, "minblocks": 14, "algorithm": "medium", "perf": 4546.87, "source": "autotuned"},
{"m": 9, "n": 26, "k": 13, "tile_m": 5, "tile_n": 2, "w": 6, "v": 26, "threads": 32, "grouping": 16, "minblocks": 8, "algorithm": "largeDB2", "perf": 4892.2, "source": "autotuned"},
{"m": 9, "n": 26, "k": 15, "tile_m": 5, "tile_n": 2, "threads": 32, "grouping": 8, "minblocks": 13, "algorithm": "medium", "perf": 4764.04, "source": "autotuned"},
{"m": 9, "n": 26, "k": 16, "tile_m": 5, "tile_n": 2, "threads": 32, "grouping": 8, "minblocks": 13, "algorithm": "medium", "perf": 5287.3, "source": "autotuned"},
{"m": 9, "n": 26, "k": 22, "tile_m": 5, "tile_n": 2, "w": 10, "v": 26, "threads": 32, "grouping": 16, "minblocks": 2, "algorithm": "largeDB2", "perf": 5173.75, "source": "autotuned"},
{"m": 9, "n": 26, "k": 23, "tile_m": 5, "tile_n": 2, "threads": 32, "grouping": 11, "minblocks": 7, "algorithm": "medium", "perf": 5309.35, "source": "autotuned"},
{"m": 9, "n": 26, "k": 25, "tile_m": 5, "tile_n": 2, "w": 10, "v": 26, "threads": 32, "grouping": 16, "minblocks": 1, "algorithm": "largeDB2", "perf": 5393.39, "source": "autotuned"},
{"m": 9, "n": 26, "k": 26, "tile_m": 5, "tile_n": 2, "w": 10, "v": 24, "threads": 32, "grouping": 16, "minblocks": 2, "algorithm": "largeDB2", "perf": 5494.34, "source": "autotuned"},
{"m": 9, "n": 26, "k": 45, "tile_m": 5, "tile_n": 2, "w": 16, "v": 24, "threads": 32, "grouping": 16, "minblocks": 8, "algorithm": "largeDB2", "perf": 6214.33, "source": "autotuned"},
{"m": 9, "n": 32, "k": 4, "tile_m": 5, "tile_n": 1, "threads": 64, "grouping": 9, "minblocks": 19, "algorithm": "medium", "perf": 3284.95, "source": "autotuned"},
{"m": 9, "n": 32, "k": 5, "tile_m": 5, "tile_n": 1, "threads": 64, "grouping": 8, "minblocks": 24, "algorithm": "medium", "perf": 3622.63, "source": "autotuned"},
{"m": 9, "n": 32, "k": 6, "tile_m": 5, "tile_n": 2, "threads": 96, "grouping": 11, "minblocks": 12, "algorithm": "medium", "perf": 4045.4, "source": "autotuned"},
{"m": 9, "n": 32, "k": 7, "tile_m": 5, "tile_n": 2, "threads": 32, "grouping": 8, "minblocks": 7, "algorithm": "medium", "perf": 4383.98, "source": "autotuned"},
{"m": 9, "n": 32, "k": 8, "tile_m": 5, "tile_n": 2, "threads": 32, "grouping": 8, "minblocks": 15, "algorithm": "medium", "perf": 4856.13, "source": "autotuned"},
{"m": 9, "n": 32, "k": 9, "tile_m": 5, "tile_n": 2, "threads": 32, "grouping": 8, "minblocks": 16, "algorithm": "medium", "perf": 5049.29, "source": "autotuned"},
{"m": 9, "n": 32, "k": 10, "tile_m": 5, "tile_n": 2, "threads": 32, "grouping": 8, "minblocks": 14, "algorithm": "medium", "perf": 5503.15, "source": "autotuned"},
{"m": 9, "n": 32, "k": 13, "tile_m": 5, "tile_n": 2, "w": 6, "v": 32, "threads": 32, "grouping": 16, "minblocks": 4, "algorithm": "largeDB2", "perf": 5860.99, "source": "autotuned"},
{"m": 9, "n": 32, "k": 22, "tile_m": 5, "tile_n": 2, "threads": 32, "grouping": 11, "minblocks": 8, "algorithm": "medium", "perf": 6197.5, "source": "autotuned"},
{"m": 9, "n": 32, "k": 32, "tile_m": 5, "tile_n": 2, "w": 12, "v": 32, "threads": 32, "grouping": 16, "minblocks": 12, "algorithm": "largeDB2", "perf": 6675.51, "source": "autotuned"},
{"m": 9, "n": 45, "k": 4, "tile_m": 5, "tile_n": 2, "threads": 64, "grouping": 9, "minblocks": 13, "algorithm": "medium", "perf": 3868.88, "source": "autotuned"},
{"m": 9, "n": 45, "k": 5, "tile_m": 5, "tile_n": 2, "threads": 64, "grouping": 9, "minblocks": 16, "algorithm": "medium", "perf": 4228.88, "source": "autotuned"},
{"m": 9, "n": 45, "k": 6, "tile_m": 5, "tile_n": 2, "threads": 64, "grouping": 9, "minblocks": 15, "algorithm": "medium", "perf": 4508.08, "source": "autotuned"},
{"m": 9, "n": 45, "k": 7, "tile_m": 5, "tile_n": 3, "threads": 32, "grouping": 8, "minblocks": 15, "algorithm": "medium", "perf": 5039.34, "source": "autotuned"},
{"m": 9, "n": 45, "k": 8, "tile_m": 5, "tile_n": 3, "threads": 32, "grouping": 8, "minblocks": 16, "algorithm": "medium", "perf": 5267.08, "source": "autotuned"},
{"m": 9, "n": 45, "k": 9, "tile_m": 5, "tile_n": 3, "w": 4, "v": 24, "threads": 32, "grouping": 16, "minblocks": 12, "algorithm": "largeDB2", "perf": 5455.57, "source": "autotuned"},
{"m": 9, "n": 45, "k": 10, "tile_m": 5, "tile_n": 3, "w": 4, "v": 44, "threads": 32, "grouping": 16, "minblocks": 8, "algorithm": "largeDB2", "perf": 5618.95, "source": "autotuned"},
{"m": 9, "n": 45, "k": 13, "tile_m": 5, "tile_n": 3, "threads": 32, "grouping": 11, "minblocks": 5, "algorithm": "medium", "perf": 6179.09, "source": "autotuned"},
{"m": 9, "n": 45, "k": 15, "tile_m": 5, "tile_n": 3, "threads": 32, "grouping": 11, "minblocks": 9, "algorithm": "medium", "perf": 6286.45, "source": "autotuned"},
{"m": 9, "n": 45, "k": 16, "tile_m": 5, "tile_n": 3, "threads": 32, "grouping": 11, "minblocks": 9, "algorithm": "medium", "perf": 6428.45, "source": "autotuned"},
{"m": 9, "n": 45, "k": 22, "tile_m": 5, "tile_n": 3, "w": 10, "v": 44, "threads": 32, "grouping": 16, "minblocks": 1, "algorithm": "largeDB2", "perf": 6611.86, "source": "autotuned"},
{"m": 9, "n": 45, "k": 25, "tile_m": 5, "tile_n": 3, "w": 12, "v": 44, "threads": 32, "grouping": 16, "minblocks": 8, "algorithm": "largeDB2", "perf": 6788.31, "source": "autotuned"},
{"m": 9, "n": 45, "k": 26, "tile_m": 5, "tile_n": 3, "w": 10, "v": 24, "threads": 32, "grouping": 16, "minblocks": 2, "algorithm": "largeDB2", "perf": 6887.5, "source": "autotuned"},
{"m": 9, "n": 45, "k": 45, "tile_m": 5, "tile_n": 3, "w": 16, "v": 38, "threads": 32, "grouping": 16, "minblocks": 1, "algorithm": "largeDB2", "perf": 7267.09, "source": "autotuned"},
{"m": 10, "n": 4, "k": 4, "tile_m": 1, "tile_n": 2, "threads": 64, "grouping": 9, "minblocks": 5, "algorithm": "medium", "perf": 818.08, "source": "autotuned"},
{"m": 10, "n": 4, "k": 5, "tile_m": 1, "tile_n": 2, "threads": 64, "grouping": 9, "minblocks": 23, "algorithm": "medium", "perf": 958.494, "source": "autotuned"},
{"m": 10, "n": 4, "k": 6, "tile_m": 1, "tile_n": 2, "threads": 64, "grouping": 9, "minblocks": 22, "algorithm": "medium", "perf": 1114.04, "source": "autotuned"},
{"m": 10, "n": 4, "k": 7, "tile_m": 1, "tile_n": 2, "threads": 96, "grouping": 9, "minblocks": 14, "algorithm": "medium", "perf": 1144.91, "source": "autotuned"},
{"m": 10, "n": 4, "k": 8, "tile_m": 1, "tile_n": 2, "threads": 96, "grouping": 8, "minblocks": 14, "algorithm": "medium", "perf": 1274.91, "source": "autotuned"},
{"m": 10, "n": 4, "k": 9, "tile_m": 1, "tile_n": 2, "threads": 96, "grouping": 9, "minblocks": 16, "algorithm": "medium", "perf": 1358.16, "source": "autotuned"},
{"m": 10, "n": 4, "k": 10, "tile_m": 1, "tile_n": 2, "threads": 128, "grouping": 8, "minblocks": 14, "algorithm": "medium", "perf": 1368.63, "source": "autotuned"},
{"m": 10, "n": 4, "k": 13, "tile_m": 1, "tile_n": 2, "threads": 64, "grouping": 9, "minblocks": 20, "algorithm": "medium", "perf": 1531.02, "source": "autotuned"},
{"m": 10, "n": 4, "k": 15, "tile_m": 1, "tile_n": 2, "threads": 64, "grouping": 9, "minblocks": 20, "algorithm": "medium", "perf": 1669.97, "source": "autotuned"},
{"m": 10, "n": 4, "k": 22, "tile_m": 1, "tile_n": 2, "threads": 96, "grouping": 8, "minblocks": 20, "algorithm": "medium", "perf": 1911.27, "source": "autotuned"},
{"m": 10, "n": 4, "k": 26, "tile_m": 1, "tile_n": 2, "w": 12, "v": 4, "threads": 32, "grouping": 16, "minblocks": 2, "algorithm": "largeDB2", "perf": 2044.86, "source": "autotuned"},
{"m": 10, "n": 4, "k": 32, "tile_m": 1, "tile_n": 2, "w": 12, "v": 4, "threads": 32, "grouping": 16, "minblocks": 2, "algorithm": "largeDB2", "perf": 2166.9, "source": "autotuned"},
{"m": 10, "n": 4, "k": 45, "tile_m": 1, "tile_n": 2, "w": 16, "v": 4, "threads": 32, "grouping": 16, "minblocks": 12, "algorithm": "largeDB2", "perf": 2262.96, "source": "autotuned"},
{"m": 10, "n": 5, "k": 4, "tile_m": 1, "tile_n": 2, "threads": 64, "grouping": 9, "minblocks": 18, "algorithm": "medium", "perf": 1029.37, "source": "autotuned"},
{"m": 10, "n": 5, "k": 5, "tile_m": 1, "tile_n": 2, "threads": 64, "grouping": 9, "minblocks": 18, "algorithm": "medium", "perf": 1214.56, "source": "autotuned"},
{"m": 10, "n": 5, "k": 6, "tile_m": 1, "tile_n": 2, "threads": 64, "grouping": 9, "minblocks": 18, "algorithm": "medium", "perf": 1364.06, "source": "autotuned"},
{"m": 10, "n": 5, "k": 7, "tile_m": 1, "tile_n": 2, "threads": 96, "grouping": 8, "minblocks": 20, "algorithm": "medium", "perf": 1393.91, "source": "autotuned"},
{"m": 10, "n": 5, "k": 8, "tile_m": 1, "tile_n": 2, "threads": 96, "grouping": 9, "minblocks": 16, "algorithm": "medium", "perf": 1545.46, "source": "autotuned"},
{"m": 10, "n": 5, "k": 9, "tile_m": 1, "tile_n": 2, "threads": 96, "grouping": 8, "minblocks": 18, "algorithm": "medium", "perf": 1662.4, "source": "autotuned"},
{"m": 10, "n": 5, "k": 10, "tile_m": 1, "tile_n": 2, "threads": 128, "grouping": 8, "minblocks": 15, "algorithm": "medium", "perf": 1657.68, "source": "autotuned"},
{"m": 10, "n": 5, "k": 13, "tile_m": 1, "tile_n": 2, "threads": 96, "grouping": 8, "minblocks": 15, "algorithm": "medium", "perf": 1819.42, "source": "autotuned"},
{"m": 10, "n": 5, "k": 14, "tile_m": 1, "tile_n": 2, "threads": 96, "grouping": 8, "minblocks": 15, "algorithm": "medium", "perf": 1922.12, "source": "autotuned"},
{"m": 10, "n": 5, "k": 15, "tile_m": 1, "tile_n": 2, "threads": 96, "grouping": 8, "minblocks": 16, "algorithm": "medium", "perf": 1982.78, "source": "autotuned"},
{"m": 10, "n": 5, "k": 22, "tile_m": 1, "tile_n": 2, "threads": 32, "grouping": 8, "minblocks": 7, "algorithm": "medium", "perf": 2259.01, "source": "autotuned"},
{"m": 10, "n": 5, "k": 26, "tile_m": 1, "tile_n": 2, "w": 12, "v": 4, "threads": 32, "grouping": 16, "minblocks": 12, "algorithm": "largeDB2", "perf": 2381.21, "source": "autotuned"},
{"m": 10, "n": 5, "k": 32, "tile_m": 1, "tile_n": 2, "threads": 32, "grouping": 8, "minblocks": 8, "algorithm": "medium", "perf": 2563.14, "source": "autotuned"},
{"m": 10, "n": 5, "k": 45, "tile_m": 1, "tile_n": 2, "w": 18, "v": 4, "threads": 32, "grouping": 16, "minblocks": 4, "algorithm": "largeDB2", "perf": 2674.95, "source": "autotuned"},
{"m": 10, "n": 6, "k": 4, "tile_m": 1, "tile_n": 2, "threads": 64, "grouping": 9, "minblocks": 18, "algorithm": "medium", "perf": 1208.74, "source": "autotuned"},
{"m": 10, "n": 6, "k": 5, "tile_m": 1, "tile_n": 2, "threads": 64, "grouping": 9, "minblocks": 11, "algorithm": "medium", "perf": 1428.52, "source": "autotuned"},
{"m": 10, "n": 6, "k": 6, "tile_m": 1, "tile_n": 2, "threads": 64, "grouping": 9, "minblocks": 21, "algorithm": "medium", "perf": 1645.23, "source": "autotuned"},
{"m": 10, "n": 6, "k": 7, "tile_m": 1, "tile_n": 2, "threads": 96, "grouping": 12, "minblocks": 12, "algorithm": "medium", "perf": 1673.6, "source": "autotuned"},
{"m": 10, "n": 6, "k": 8, "tile_m": 1, "tile_n": 2, "threads": 96, "grouping": 9, "minblocks": 16, "algorithm": "medium", "perf": 1884.36, "source": "autotuned"},
{"m": 10, "n": 6, "k": 9, "tile_m": 1, "tile_n": 2, "threads": 96, "grouping": 9, "minblocks": 15, "algorithm": "medium", "perf": 1976.12, "source": "autotuned"},
{"m": 10, "n": 6, "k": 10, "tile_m": 1, "tile_n": 2, "threads": 128, "grouping": 8, "minblocks": 15, "algorithm": "medium", "perf": 2012.36, "source": "autotuned"},
{"m": 10, "n": 6, "k": 13, "tile_m": 1, "tile_n": 2, "threads": 96, "grouping": 8, "minblocks": 17, "algorithm": "medium", "perf": 2192.47, "source": "autotuned"},
{"m": 10, "n": 6, "k": 14, "tile_m": 1, "tile_n": 2, "threads": 96, "grouping": 8, "minblocks": 16, "algorithm": "medium", "perf": 2298.49, "source": "autotuned"},
{"m": 10, "n": 6, "k": 15, "tile_m": 1, "tile_n": 2, "threads": 96, "grouping": 8, "minblocks": 16, "algorithm": "medium", "perf": 2369.16, "source": "autotuned"},
{"m": 10, "n": 6, "k": 22, "tile_m": 1, "tile_n": 2, "threads": 32, "grouping": 8, "minblocks": 10, "algorithm": "medium", "perf": 2654.98, "source": "autotuned"},
{"m": 10, "n": 6, "k": 26, "tile_m": 1, "tile_n": 2, "w": 10, "v": 6, "threads": 32, "grouping": 16, "minblocks": 1, "algorithm": "largeDB2", "perf": 2910.0, "source": "autotuned"},
{"m": 10, "n": 6, "k": 32, "tile_m": 1, "tile_n": 2, "w": 12, "v": 6, "threads": 32, "grouping": 16, "minblocks": 8, "algorithm": "largeDB2", "perf": 3065.6, "source": "autotuned"},
{"m": 10, "n": 6, "k": 45, "tile_m": 1, "tile_n": 2, "threads": 32, "grouping": 8, "minblocks": 2, "algorithm": "medium", "perf": 3117.86, "source": "autotuned"},
{"m": 10, "n": 7, "k": 4, "tile_m": 1, "tile_n": 3, "threads": 64, "grouping": 9, "minblocks": 1, "algorithm": "medium", "perf": 1244.33, "source": "autotuned"},
{"m": 10, "n": 7, "k": 5, "tile_m": 1, "tile_n": 3, "threads": 64, "grouping": 9, "minblocks": 4, "algorithm": "medium", "perf": 1460.35, "source": "autotuned"},
{"m": 10, "n": 7, "k": 6, "tile_m": 1, "tile_n": 3, "threads": 64, "grouping": 9, "minblocks": 13, "algorithm": "medium", "perf": 1664.23, "source": "autotuned"},
{"m": 10, "n": 7, "k": 7, "tile_m": 1, "tile_n": 3, "threads": 96, "grouping": 11, "minblocks": 13, "algorithm": "medium", "perf": 1773.35, "source": "autotuned"},
{"m": 10, "n": 7, "k": 8, "tile_m": 1, "tile_n": 3, "threads": 96, "grouping": 8, "minblocks": 14, "algorithm": "medium", "perf": 1947.82, "source": "autotuned"},
{"m": 10, "n": 7, "k": 9, "tile_m": 1, "tile_n": 3, "threads": 96, "grouping": 8, "minblocks": 14, "algorithm": "medium", "perf": 2106.57, "source": "autotuned"},
{"m": 10, "n": 7, "k": 10, "tile_m": 1, "tile_n": 3, "threads": 128, "grouping": 11, "minblocks": 11, "algorithm": "medium", "perf": 2033.78, "source": "autotuned"},
{"m": 10, "n": 7, "k": 13, "tile_m": 1, "tile_n": 3, "threads": 32, "grouping": 7, "minblocks": 26, "algorithm": "medium", "perf": 2247.62, "source": "autotuned"},
{"m": 10, "n": 7, "k": 15, "tile_m": 1, "tile_n": 3, "threads": 160, "grouping": 16, "minblocks": 8, "algorithm": "medium", "perf": 2395.03, "source": "autotuned"},
{"m": 10, "n": 7, "k": 22, "tile_m": 1, "tile_n": 3, "threads": 32, "grouping": 8, "minblocks": 6, "algorithm": "medium", "perf": 2747.18, "source": "autotuned"},
{"m": 10, "n": 7, "k": 26, "tile_m": 1, "tile_n": 3, "threads": 32, "grouping": 8, "minblocks": 14, "algorithm": "medium", "perf": 2839.46, "source": "autotuned"},
{"m": 10, "n": 7, "k": 32, "tile_m": 1, "tile_n": 3, "threads": 32, "grouping": 11, "minblocks": 4, "algorithm": "medium", "perf": 3009.27, "source": "autotuned"},
{"m": 10, "n": 7, "k": 45, "tile_m": 1, "tile_n": 3, "threads": 32, "grouping": 8, "minblocks": 8, "algorithm": "medium", "perf": 3117.73, "source": "autotuned"},
{"m": 10, "n": 8, "k": 4, "tile_m": 1, "tile_n": 4, "threads": 64, "grouping": 8, "minblocks": 17, "algorithm": "medium", "perf": 1494.72, "source": "autotuned"},
{"m": 10, "n": 8, "k": 5, "tile_m": 1, "tile_n": 2, "threads": 64, "grouping": 9, "minblocks": 24, "algorithm": "medium", "perf": 1717.99, "source": "autotuned"},
{"m": 10, "n": 8, "k": 6, "tile_m": 1, "tile_n": 4, "threads": 64, "grouping": 8, "minblocks": 17, "algorithm": "medium", "perf": 1952.75, "source": "autotuned"},
{"m": 10, "n": 8, "k": 7, "tile_m": 1, "tile_n": 3, "threads": 96, "grouping": 11, "minblocks": 14, "algorithm": "medium", "perf": 2008.78, "source": "autotuned"},
{"m": 10, "n": 8, "k": 8, "tile_m": 1, "tile_n": 3, "threads": 96, "grouping": 8, "minblocks": 15, "algorithm": "medium", "perf": 2248.81, "source": "autotuned"},
{"m": 10, "n": 8, "k": 9, "tile_m": 1, "tile_n": 3, "threads": 96, "grouping": 8, "minblocks": 14, "algorithm": "medium", "perf": 2347.81, "source": "autotuned"},
{"m": 10, "n": 8, "k": 10, "tile_m": 1, "tile_n": 3, "threads": 128, "grouping": 11, "minblocks": 12, "algorithm": "medium", "perf": 2323.16, "source": "autotuned"},
{"m": 10, "n": 8, "k": 13, "tile_m": 1, "tile_n": 3, "threads": 32, "grouping": 7, "minblocks": 25, "algorithm": "medium", "perf": 2524.04, "source": "autotuned"},
{"m": 10, "n": 8, "k": 15, "tile_m": 1, "tile_n": 3, "threads": 32, "grouping": 7, "minblocks": 27, "algorithm": "medium", "perf": 2738.08, "source": "autotuned"},
{"m": 10, "n": 8, "k": 22, "tile_m": 1, "tile_n": 3, "threads": 32, "grouping": 8, "minblocks": 7, "algorithm": "medium", "perf": 3087.14, "source": "autotuned"},
{"m": 10, "n": 8, "k": 26, "tile_m": 1, "tile_n": 3, "threads": 32, "grouping": 8, "minblocks": 3, "algorithm": "medium", "perf": 3206.76, "source": "autotuned"},
{"m": 10, "n": 8, "k": 32, "tile_m": 1, "tile_n": 3, "threads": 32, "grouping": 8, "minblocks": 10, "algorithm": "medium", "perf": 3426.97, "source": "autotuned"},
{"m": 10, "n": 8, "k": 45, "tile_m": 1, "tile_n": 3, "w": 16, "v": 8, "threads": 32, "grouping": 16, "minblocks": 1, "algorithm": "largeDB2", "perf": 3377.11, "source": "autotuned"},
{"m": 10, "n": 9, "k": 4, "tile_m": 1, "tile_n": 3, "threads": 64, "grouping": 9, "minblocks": 13, "algorithm": "medium", "perf": 1603.01, "source": "autotuned"},
{"m": 10, "n": 9, "k": 5, "tile_m": 1, "tile_n": 3, "threads": 64, "grouping": 9, "minblocks": 18, "algorithm": "medium", "perf": 1888.7, "source": "autotuned"},
{"m": 10, "n": 9, "k": 6, "tile_m": 1, "tile_n": 3, "threads": 64, "grouping": 9, "minblocks": 12, "algorithm": "medium", "perf": 2110.75, "source": "autotuned"},
{"m": 10, "n": 9, "k": 7, "tile_m": 1, "tile_n": 3, "threads": 96, "grouping": 11, "minblocks": 14, "algorithm": "medium", "perf": 2338.62, "source": "autotuned"},
{"m": 10, "n": 9, "k": 8, "tile_m": 1, "tile_n": 3, "threads": 96, "grouping": 11, "minblocks": 14, "algorithm": "medium", "perf": 2474.5, "source": "autotuned"},
{"m": 10, "n": 9, "k": 9, "tile_m": 1, "tile_n": 3, "threads": 96, "grouping": 11, "minblocks": 14, "algorithm": "medium", "perf": 2624.44, "source": "autotuned"},
{"m": 10, "n": 9, "k": 10, "tile_m": 1, "tile_n": 3, "threads": 128, "grouping": 11, "minblocks": 11, "algorithm": "medium", "perf": 2607.19, "source": "autotuned"},
{"m": 10, "n": 9, "k": 13, "tile_m": 1, "tile_n": 3, "threads": 160, "grouping": 16, "minblocks": 8, "algorithm": "medium", "perf": 2822.2, "source": "autotuned"},
{"m": 10, "n": 9, "k": 14, "tile_m": 1, "tile_n": 3, "threads": 32, "grouping": 7, "minblocks": 27, "algorithm": "medium", "perf": 2944.85, "source": "autotuned"},
{"m": 10, "n": 9, "k": 15, "tile_m": 1, "tile_n": 3, "threads": 160, "grouping": 16, "minblocks": 8, "algorithm": "medium", "perf": 3033.14, "source": "autotuned"},
{"m": 10, "n": 9, "k": 22, "tile_m": 1, "tile_n": 3, "threads": 32, "grouping": 8, "minblocks": 12, "algorithm": "medium", "perf": 3342.82, "source": "autotuned"},
{"m": 10, "n": 9, "k": 26, "tile_m": 1, "tile_n": 3, "threads": 32, "grouping": 8, "minblocks": 5, "algorithm": "medium", "perf": 3509.34, "source": "autotuned"},
{"m": 10, "n": 9, "k": 32, "tile_m": 1, "tile_n": 3, "threads": 32, "grouping": 8, "minblocks": 5, "algorithm": "medium", "perf": 3778.23, "source": "autotuned"},
{"m": 10, "n": 9, "k": 45, "tile_m": 1, "tile_n": 3, "threads": 32, "grouping": 11, "minblocks": 4, "algorithm": "medium", "perf": 3768.62, "source": "autotuned"},
{"m": 10, "n": 10, "k": 4, "tile_m": 1, "tile_n": 4, "threads": 64, "grouping": 9, "minblocks": 17, "algorithm": "medium", "perf": 1781.14, "source": "autotuned"},
{"m": 10, "n": 10, "k": 5, "tile_m": 1, "tile_n": 4, "threads": 64, "grouping": 9, "minblocks": 18, "algorithm": "medium", "perf": 2041.45, "source": "autotuned"},
{"m": 10, "n": 10, "k": 6, "tile_m": 1, "tile_n": 4, "threads": 64, "grouping": 9, "minblocks": 18, "algorithm": "medium", "perf": 2308.41, "source": "autotuned"},
{"m": 10, "n": 10, "k": 7, "tile_m": 1, "tile_n": 4, "threads": 96, "grouping": 8, "minblocks": 14, "algorithm": "medium", "perf": 1979.33, "source": "autotuned"},
{"m": 10, "n": 10, "k": 8, "tile_m": 1, "tile_n": 4, "threads": 96, "grouping": 8, "minblocks": 14, "algorithm": "medium", "perf": 2642.83, "source": "autotuned"},
{"m": 10, "n": 10, "k": 9, "tile_m": 1, "tile_n": 4, "threads": 96, "grouping": 9, "minblocks": 14, "algorithm": "medium", "perf": 2783.27, "source": "autotuned"},
{"m": 10, "n": 10, "k": 10, "tile_m": 1, "tile_n": 4, "threads": 128, "grouping": 8, "minblocks": 14, "algorithm": "medium", "perf": 2787.03, "source": "autotuned"},
{"m": 10, "n": 10, "k": 13, "tile_m": 1, "tile_n": 4, "threads": 32, "grouping": 8, "minblocks": 22, "algorithm": "medium", "perf": 3038.33, "source": "autotuned"},
{"m": 10, "n": 10, "k": 14, "tile_m": 1, "tile_n": 4, "threads": 32, "grouping": 8, "minblocks": 5, "algorithm": "medium", "perf": 3166.62, "source": "autotuned"},
{"m": 10, "n": 10, "k": 15, "tile_m": 1, "tile_n": 4, "threads": 32, "grouping": 8, "minblocks": 7, "algorithm": "medium", "perf": 3249.53, "source": "autotuned"},
{"m": 10, "n": 10, "k": 22, "tile_m": 1, "tile_n": 4, "threads": 32, "grouping": 8, "minblocks": 8, "algorithm": "medium", "perf": 3623.13, "source": "autotuned"},
{"m": 10, "n": 10, "k": 26, "tile_m": 1, "tile_n": 4, "threads": 32, "grouping": 8, "minblocks": 7, "algorithm": "medium", "perf": 3867.38, "source": "autotuned"},
{"m": 10, "n": 10, "k": 32, "tile_m": 1, "tile_n": 4, "threads": 32, "grouping": 8, "minblocks": 5, "algorithm": "medium", "perf": 4149.96, "source": "autotuned"},
{"m": 10, "n": 10, "k": 45, "tile_m": 1, "tile_n": 4, "threads": 32, "grouping": 16, "minblocks": 2, "algorithm": "medium", "perf": 4138.59, "source": "autotuned"},
{"m": 10, "n": 12, "k": 10, "tile_m": 1, "tile_n": 4, "threads": 128, "grouping": 8, "minblocks": 15, "algorithm": "medium", "perf": 3283.3, "source": "autotuned"},
{"m": 10, "n": 13, "k": 4, "tile_m": 6, "tile_n": 1, "threads": 64, "grouping": 9, "minblocks": 16, "algorithm": "medium", "perf": 2048.89, "source": "autotuned"},
{"m": 10, "n": 13, "k": 5, "tile_m": 5, "tile_n": 1, "threads": 96, "grouping": 8, "minblocks": 14, "algorithm": "medium", "perf": 2361.66, "source": "autotuned"},
{"m": 10, "n": 13, "k": 6, "tile_m": 5, "tile_n": 1, "threads": 96, "grouping": 11, "minblocks": 13, "algorithm": "medium", "perf": 2681.25, "source": "autotuned"},
{"m": 10, "n": 13, "k": 7, "tile_m": 5, "tile_n": 1, "threads": 96, "grouping": 11, "minblocks": 13, "algorithm": "medium", "perf": 2939.32, "source": "autotuned"},
{"m": 10, "n": 13, "k": 8, "tile_m": 5, "tile_n": 1, "threads": 128, "grouping": 11, "minblocks": 11, "algorithm": "medium", "perf": 2927.74, "source": "autotuned"},
{"m": 10, "n": 13, "k": 9, "tile_m": 5, "tile_n": 1, "threads": 128, "grouping": 11, "minblocks": 11, "algorithm": "medium", "perf": 3165.72, "source": "autotuned"},
{"m": 10, "n": 13, "k": 10, "tile_m": 5, "tile_n": 1, "threads": 160, "grouping": 16, "minblocks": 8, "algorithm": "medium", "perf": 3101.95, "source": "autotuned"},
{"m": 10, "n": 13, "k": 13, "tile_m": 5, "tile_n": 1, "threads": 32, "grouping": 8, "minblocks": 19, "algorithm": "medium", "perf": 3462.17, "source": "autotuned"},
{"m": 10, "n": 13, "k": 14, "tile_m": 5, "tile_n": 1, "threads": 32, "grouping": 8, "minblocks": 6, "algorithm": "medium", "perf": 3599.15, "source": "autotuned"},
{"m": 10, "n": 13, "k": 15, "tile_m": 5, "tile_n": 1, "threads": 32, "grouping": 8, "minblocks": 22, "algorithm": "medium", "perf": 3681.55, "source": "autotuned"},
{"m": 10, "n": 13, "k": 22, "tile_m": 5, "tile_n": 1, "threads": 32, "grouping": 8, "minblocks": 13, "algorithm": "medium", "perf": 4084.07, "source": "autotuned"},
{"m": 10, "n": 13, "k": 26, "tile_m": 5, "tile_n": 1, "w": 12, "v": 8, "threads": 32, "grouping": 16, "minblocks": 12, "algorithm": "largeDB2", "perf": 4214.03, "source": "autotuned"},
{"m": 10, "n": 13, "k": 32, "tile_m": 5, "tile_n": 1, "w": 12, "v": 8, "threads": 32, "grouping": 16, "minblocks": 8, "algorithm": "largeDB2", "perf": 4352.82, "source": "autotuned"},
{"m": 10, "n": 13, "k": 45, "tile_m": 5, "tile_n": 1, "threads": 32, "grouping": 11, "minblocks": 4, "algorithm": "medium", "perf": 4612.58, "source": "autotuned"},
{"m": 10, "n": 14, "k": 5, "tile_m": 5, "tile_n": 1, "threads": 96, "grouping": 11, "minblocks": 13, "algorithm": "medium", "perf": 2526.26, "source": "autotuned"},
{"m": 10, "n": 14, "k": 6, "tile_m": 5, "tile_n": 1, "threads": 96, "grouping": 8, "minblocks": 14, "algorithm": "medium", "perf": 2875.5, "source": "autotuned"},
{"m": 10, "n": 14, "k": 9, "tile_m": 5, "tile_n": 1, "threads": 128, "grouping": 11, "minblocks": 11, "algorithm": "medium", "perf": 3371.04, "source": "autotuned"},
{"m": 10, "n": 14, "k": 10, "tile_m": 5, "tile_n": 1, "threads": 160, "grouping": 16, "minblocks": 8, "algorithm": "medium", "perf": 3301.95, "source": "autotuned"},
{"m": 10, "n": 14, "k": 13, "tile_m": 5, "tile_n": 1, "threads": 32, "grouping": 8, "minblocks": 2, "algorithm": "medium", "perf": 3680.4, "source": "autotuned"},
{"m": 10, "n": 14, "k": 14, "tile_m": 5, "tile_n": 1, "threads": 32, "grouping": 8, "minblocks": 23, "algorithm": "medium", "perf": 3833.06, "source": "autotuned"},
{"m": 10, "n": 15, "k": 4, "tile_m": 6, "tile_n": 1, "threads": 64, "grouping": 9, "minblocks": 16, "algorithm": "medium", "perf": 2377.92, "source": "autotuned"},
{"m": 10, "n": 15, "k": 5, "tile_m": 5, "tile_n": 1, "threads": 96, "grouping": 11, "minblocks": 11, "algorithm": "medium", "perf": 2697.47, "source": "autotuned"},
{"m": 10, "n": 15, "k": 6, "tile_m": 5, "tile_n": 1, "threads": 96, "grouping": 8, "minblocks": 14, "algorithm": "medium", "perf": 3054.19, "source": "autotuned"},
{"m": 10, "n": 15, "k": 7, "tile_m": 5, "tile_n": 1, "threads": 128, "grouping": 11, "minblocks": 11, "algorithm": "medium", "perf": 3090.03, "source": "autotuned"},
{"m": 10, "n": 15, "k": 8, "tile_m": 5, "tile_n": 1, "threads": 128, "grouping": 11, "minblocks": 11, "algorithm": "medium", "perf": 3379.43, "source": "autotuned"},
{"m": 10, "n": 15, "k": 9, "tile_m": 5, "tile_n": 1, "threads": 32, "grouping": 6, "minblocks": 27, "algorithm": "medium", "perf": 3332.55, "source": "autotuned"},
{"m": 10, "n": 15, "k": 10, "tile_m": 5, "tile_n": 1, "threads": 160, "grouping": 16, "minblocks": 8, "algorithm": "medium", "perf": 3509.87, "source": "autotuned"},
{"m": 10, "n": 15, "k": 13, "tile_m": 5, "tile_n": 1, "threads": 32, "grouping": 8, "minblocks": 20, "algorithm": "medium", "perf": 3880.52, "source": "autotuned"},
{"m": 10, "n": 15, "k": 15, "tile_m": 5, "tile_n": 1, "threads": 32, "grouping": 8, "minblocks": 15, "algorithm": "medium", "perf": 4058.25, "source": "autotuned"},
{"m": 10, "n": 22, "k": 4, "tile_m": 1, "tile_n": 8, "threads": 96, "grouping": 12, "minblocks": 12, "algorithm": "medium", "perf": 2930.06, "source": "autotuned"},
{"m": 10, "n": 22, "k": 5, "tile_m": 1, "tile_n": 8, "threads": 128, "grouping": 16, "minblocks": 8, "algorithm": "medium", "perf": 3135.69, "source": "autotuned"},
{"m": 10, "n": 22, "k": 6, "tile_m": 5, "tile_n": 2, "threads": 32, "grouping": 5, "minblocks": 26, "algorithm": "medium", "perf": 3273.75, "source": "autotuned"},
{"m": 10, "n": 22, "k": 7, "tile_m": 5, "tile_n": 2, "threads": 32, "grouping": 5, "minblocks": 27, "algorithm": "medium", "perf": 3596.1, "source": "autotuned"},
{"m": 10, "n": 22, "k": 8, "tile_m": 5, "tile_n": 2, "threads": 32, "grouping": 8, "minblocks": 13, "algorithm": "medium", "perf": 3821.35, "source": "autotuned"},
{"m": 10, "n": 22, "k": 9, "tile_m": 5, "tile_n": 2, "threads": 32, "grouping": 8, "minblocks": 11, "algorithm": "medium", "perf": 4117.71, "source": "autotuned"},
{"m": 10, "n": 22, "k": 10, "tile_m": 5, "tile_n": 2, "threads": 32, "grouping": 8, "minblocks": 14, "algorithm": "medium", "perf": 4408.43, "source": "autotuned"},
{"m": 10, "n": 22, "k": 13, "tile_m": 5, "tile_n": 2, "threads": 32, "grouping": 8, "minblocks": 16, "algorithm": "medium", "perf": 4960.37, "source": "autotuned"},
{"m": 10, "n": 22, "k": 22, "tile_m": 5, "tile_n": 2, "w": 8, "v": 22, "threads": 32, "grouping": 16, "minblocks": 8, "algorithm": "largeDB2", "perf": 5254.9, "source": "autotuned"},
{"m": 10, "n": 22, "k": 32, "tile_m": 5, "tile_n": 2, "w": 12, "v": 22, "threads": 32, "grouping": 16, "minblocks": 8, "algorithm": "largeDB2", "perf": 5831.24, "source": "autotuned"},
{"m": 10, "n": 26, "k": 4, "tile_m": 5, "tile_n": 2, "threads": 128, "grouping": 16, "minblocks": 8, "algorithm": "medium", "perf": 2999.5, "source": "autotuned"},
{"m": 10, "n": 26, "k": 5, "tile_m": 5, "tile_n": 1, "threads": 64, "grouping": 9, "minblocks": 20, "algorithm": "medium", "perf": 3355.41, "source": "autotuned"},
{"m": 10, "n": 26, "k": 6, "tile_m": 5, "tile_n": 1, "threads": 64, "grouping": 8, "minblocks": 23, "algorithm": "medium", "perf": 3693.46, "source": "autotuned"},
{"m": 10, "n": 26, "k": 7, "tile_m": 5, "tile_n": 2, "threads": 32, "grouping": 8, "minblocks": 16, "algorithm": "medium", "perf": 4026.32, "source": "autotuned"},
{"m": 10, "n": 26, "k": 8, "tile_m": 5, "tile_n": 2, "threads": 32, "grouping": 8, "minblocks": 15, "algorithm": "medium", "perf": 4428.49, "source": "autotuned"},
{"m": 10, "n": 26, "k": 9, "tile_m": 5, "tile_n": 2, "threads": 32, "grouping": 8, "minblocks": 10, "algorithm": "medium", "perf": 4726.84, "source": "autotuned"},
{"m": 10, "n": 26, "k": 10, "tile_m": 5, "tile_n": 2, "threads": 32, "grouping": 8, "minblocks": 13, "algorithm": "medium", "perf": 4994.36, "source": "autotuned"},
{"m": 10, "n": 26, "k": 13, "tile_m": 5, "tile_n": 2, "w": 6, "v": 26, "threads": 32, "grouping": 16, "minblocks": 8, "algorithm": "largeDB2", "perf": 5488.73, "source": "autotuned"},
{"m": 10, "n": 26, "k": 26, "tile_m": 5, "tile_n": 2, "w": 10, "v": 18, "threads": 32, "grouping": 16, "minblocks": 12, "algorithm": "largeDB2", "perf": 5985.94, "source": "autotuned"},
{"m": 10, "n": 26, "k": 45, "tile_m": 5, "tile_n": 2, "w": 16, "v": 26, "threads": 32, "grouping": 16, "minblocks": 1, "algorithm": "largeDB2", "perf": 6841.58, "source": "autotuned"},
{"m": 10, "n": 32, "k": 4, "tile_m": 5, "tile_n": 1, "threads": 64, "grouping": 9, "minblocks": 13, "algorithm": "medium", "perf": 3618.08, "source": "autotuned"},
{"m": 10, "n": 32, "k": 5, "tile_m": 5, "tile_n": 1, "threads": 64, "grouping": 9, "minblocks": 19, "algorithm": "medium", "perf": 4050.43, "source": "autotuned"},
{"m": 10, "n": 32, "k": 6, "tile_m": 5, "tile_n": 2, "threads": 96, "grouping": 11, "minblocks": 11, "algorithm": "medium", "perf": 4445.83, "source": "autotuned"},
{"m": 10, "n": 32, "k": 7, "tile_m": 5, "tile_n": 2, "threads": 32, "grouping": 8, "minblocks": 4, "algorithm": "medium", "perf": 4739.21, "source": "autotuned"},
{"m": 10, "n": 32, "k": 8, "tile_m": 5, "tile_n": 2, "threads": 32, "grouping": 8, "minblocks": 13, "algorithm": "medium", "perf": 5250.23, "source": "autotuned"},
{"m": 10, "n": 32, "k": 9, "tile_m": 5, "tile_n": 2, "threads": 32, "grouping": 8, "minblocks": 16, "algorithm": "medium", "perf": 5615.79, "source": "autotuned"},
{"m": 10, "n": 32, "k": 10, "tile_m": 5, "tile_n": 2, "w": 4, "v": 32, "threads": 32, "grouping": 16, "minblocks": 2, "algorithm": "largeDB2", "perf": 6235.71, "source": "autotuned"},
{"m": 10, "n": 32, "k": 13, "tile_m": 5, "tile_n": 2, "threads": 32, "grouping": 8, "minblocks": 13, "algorithm": "medium", "perf": 6260.73, "source": "autotuned"},
{"m": 10, "n": 32, "k": 22, "tile_m": 5, "tile_n": 2, "threads": 32, "grouping": 11, "minblocks": 5, "algorithm": "medium", "perf": 6717.52, "source": "autotuned"},
{"m": 10, "n": 32, "k": 32, "tile_m": 5, "tile_n": 2, "w": 12, "v": 32, "threads": 32, "grouping": 16, "minblocks": 12, "algorithm": "largeDB2", "perf": 7287.08, "source": "autotuned"},
{"m": 10, "n": 45, "k": 4, "tile_m": 5, "tile_n": 2, "threads": 64, "grouping": 9, "minblocks": 14, "algorithm": "medium", "perf": 4121.85, "source": "autotuned"},
{"m": 10, "n": 45, "k": 5, "tile_m": 6, "tile_n": 2, "threads": 64, "grouping": 9, "minblocks": 15, "algorithm": "medium", "perf": 4608.32, "source": "autotuned"},
{"m": 10, "n": 45, "k": 6, "tile_m": 5, "tile_n": 3, "threads": 32, "grouping": 8, "minblocks": 14, "algorithm": "medium", "perf": 4935.3, "source": "autotuned"},
{"m": 10, "n": 45, "k": 7, "tile_m": 5, "tile_n": 3, "threads": 32, "grouping": 8, "minblocks": 15, "algorithm": "medium", "perf": 5454.68, "source": "autotuned"},
{"m": 10, "n": 45, "k": 8, "tile_m": 5, "tile_n": 3, "threads": 32, "grouping": 8, "minblocks": 13, "algorithm": "medium", "perf": 5746.48, "source": "autotuned"},
{"m": 10, "n": 45, "k": 9, "tile_m": 5, "tile_n": 3, "threads": 32, "grouping": 8, "minblocks": 16, "algorithm": "medium", "perf": 5949.0, "source": "autotuned"},
{"m": 10, "n": 45, "k": 10, "tile_m": 5, "tile_n": 3, "w": 4, "v": 30, "threads": 32, "grouping": 16, "minblocks": 12, "algorithm": "largeDB2", "perf": 5818.28, "source": "autotuned"},
{"m": 10, "n": 45, "k": 13, "tile_m": 5, "tile_n": 3, "threads": 32, "grouping": 11, "minblocks": 5, "algorithm": "medium", "perf": 6741.74, "source": "autotuned"},
{"m": 10, "n": 45, "k": 26, "tile_m": 5, "tile_n": 3, "w": 12, "v": 42, "threads": 32, "grouping": 16, "minblocks": 8, "algorithm": "largeDB2", "perf": 7492.74, "source": "autotuned"},
{"m": 10, "n": 45, "k": 45, "tile_m": 5, "tile_n": 3, "w": 16, "v": 42, "threads": 32, "grouping": 16, "minblocks": 1, "algorithm": "largeDB2", "perf": 7902.34, "source": "autotuned"},
{"m": 11, "n": 11, "k": 11, "tile_m": 2, "tile_n": 3, "threads": 96, "grouping": 8, "minblocks": 14, "algorithm": "small", "perf": 3233.34, "source": "autotuned"},
{"m": 12, "n": 12, "k": 12, "tile_m": 2, "tile_n": 3, "threads": 32, "grouping": 8, "minblocks": 11, "algorithm": "medium", "perf": 4018.53, "source": "autotuned"},
{"m": 13, "n": 4, "k": 4, "tile_m": 1, "tile_n": 2, "threads": 64, "grouping": 11, "minblocks": 22, "algorithm": "medium", "perf": 977.366, "source": "autotuned"},
{"m": 13, "n": 4, "k": 5, "tile_m": 1, "tile_n": 4, "threads": 96, "grouping": 8, "minblocks": 15, "algorithm": "medium", "perf": 1076.48, "source": "autotuned"},
{"m": 13, "n": 4, "k": 6, "tile_m": 1, "tile_n": 4, "threads": 96, "grouping": 8, "minblocks": 16, "algorithm": "medium", "perf": 1239.71, "source": "autotuned"},
{"m": 13, "n": 4, "k": 7, "tile_m": 1, "tile_n": 4, "threads": 32, "grouping": 5, "minblocks": 27, "algorithm": "medium", "perf": 1394.29, "source": "autotuned"},
{"m": 13, "n": 4, "k": 8, "tile_m": 1, "tile_n": 4, "threads": 128, "grouping": 8, "minblocks": 13, "algorithm": "medium", "perf": 1374.27, "source": "autotuned"},
{"m": 13, "n": 4, "k": 9, "tile_m": 1, "tile_n": 2, "threads": 64, "grouping": 8, "minblocks": 24, "algorithm": "medium", "perf": 1459.1, "source": "autotuned"},
{"m": 13, "n": 4, "k": 10, "tile_m": 1, "tile_n": 4, "threads": 32, "grouping": 5, "minblocks": 27, "algorithm": "medium", "perf": 1515.22, "source": "autotuned"},
{"m": 13, "n": 4, "k": 13, "tile_m": 1, "tile_n": 2, "threads": 64, "grouping": 9, "minblocks": 22, "algorithm": "medium", "perf": 1727.97, "source": "autotuned"},
{"m": 13, "n": 4, "k": 15, "tile_m": 1, "tile_n": 4, "threads": 32, "grouping": 5, "minblocks": 25, "algorithm": "medium", "perf": 1812.41, "source": "autotuned"},
{"m": 13, "n": 4, "k": 16, "tile_m": 1, "tile_n": 4, "threads": 32, "grouping": 5, "minblocks": 25, "algorithm": "medium", "perf": 1871.37, "source": "autotuned"},
{"m": 13, "n": 4, "k": 22, "tile_m": 1, "tile_n": 4, "w": 8, "v": 4, "threads": 32, "grouping": 16, "minblocks": 12, "algorithm": "largeDB2", "perf": 2169.81, "source": "autotuned"},
{"m": 13, "n": 4, "k": 23, "tile_m": 1, "tile_n": 4, "w": 8, "v": 4, "threads": 32, "grouping": 16, "minblocks": 12, "algorithm": "largeDB2", "perf": 2194.78, "source": "autotuned"},
{"m": 13, "n": 4, "k": 25, "tile_m": 1, "tile_n": 4, "w": 12, "v": 4, "threads": 32, "grouping": 16, "minblocks": 12, "algorithm": "largeDB2", "perf": 2214.5, "source": "autotuned"},
{"m": 13, "n": 4, "k": 26, "tile_m": 1, "tile_n": 4, "w": 12, "v": 4, "threads": 32, "grouping": 16, "minblocks": 12, "algorithm": "largeDB2", "perf": 2264.94, "source": "autotuned"},
{"m": 13, "n": 4, "k": 32, "tile_m": 1, "tile_n": 4, "w": 12, "v": 4, "threads": 32, "grouping": 16, "minblocks": 12, "algorithm": "largeDB2", "perf": 2379.83, "source": "autotuned"},
{"m": 13, "n": 4, "k": 45, "tile_m": 1, "tile_n": 4, "w": 18, "v": 4, "threads": 32, "grouping": 16, "minblocks": 2, "algorithm": "largeDB2", "perf": 2413.62, "source": "autotuned"},
{"m": 13, "n": 5, "k": 4, "tile_m": 2, "tile_n": 2, "threads": 64, "grouping": 8, "minblocks": 22, "algorithm": "medium", "perf": 1107.91, "source": "autotuned"},
{"m": 13, "n": 5, "k": 5, "tile_m": 1, "tile_n": 5, "threads": 32, "grouping": 6, "minblocks": 22, "algorithm": "medium", "perf": 1235.14, "source": "autotuned"},
{"m": 13, "n": 5, "k": 6, "tile_m": 1, "tile_n": 5, "threads": 32, "grouping": 6, "minblocks": 27, "algorithm": "medium", "perf": 1431.48, "source": "autotuned"},
{"m": 13, "n": 5, "k": 7, "tile_m": 2, "tile_n": 2, "threads": 96, "grouping": 8, "minblocks": 15, "algorithm": "medium", "perf": 1526.0, "source": "autotuned"},
{"m": 13, "n": 5, "k": 8, "tile_m": 2, "tile_n": 2, "threads": 128, "grouping": 8, "minblocks": 14, "algorithm": "medium", "perf": 1547.34, "source": "autotuned"},
{"m": 13, "n": 5, "k": 9, "tile_m": 2, "tile_n": 2, "threads": 128, "grouping": 8, "minblocks": 15, "algorithm": "medium", "perf": 1631.33, "source": "autotuned"},
{"m": 13, "n": 5, "k": 10, "tile_m": 1, "tile_n": 5, "threads": 32, "grouping": 5, "minblocks": 25, "algorithm": "medium", "perf": 1663.82, "source": "autotuned"},
{"m": 13, "n": 5, "k": 13, "tile_m": 2, "tile_n": 2, "threads": 96, "grouping": 8, "minblocks": 15, "algorithm": "medium", "perf": 1880.45, "source": "autotuned"},
{"m": 13, "n": 5, "k": 14, "tile_m": 1, "tile_n": 5, "threads": 32, "grouping": 8, "minblocks": 6, "algorithm": "medium", "perf": 1929.2, "source": "autotuned"},
{"m": 13, "n": 5, "k": 15, "tile_m": 1, "tile_n": 5, "threads": 32, "grouping": 8, "minblocks": 23, "algorithm": "medium", "perf": 1963.04, "source": "autotuned"},
{"m": 13, "n": 5, "k": 16, "tile_m": 1, "tile_n": 5, "threads": 32, "grouping": 8, "minblocks": 9, "algorithm": "medium", "perf": 2026.94, "source": "autotuned"},
{"m": 13, "n": 5, "k": 22, "tile_m": 1, "tile_n": 5, "threads": 32, "grouping": 8, "minblocks": 19, "algorithm": "medium", "perf": 2299.29, "source": "autotuned"},
{"m": 13, "n": 5, "k": 23, "tile_m": 1, "tile_n": 5, "threads": 32, "grouping": 8, "minblocks": 16, "algorithm": "medium", "perf": 2322.15, "source": "autotuned"},
{"m": 13, "n": 5, "k": 25, "tile_m": 1, "tile_n": 5, "threads": 32, "grouping": 8, "minblocks": 2, "algorithm": "medium", "perf": 2339.34, "source": "autotuned"},
{"m": 13, "n": 5, "k": 26, "tile_m": 1, "tile_n": 5, "threads": 32, "grouping": 8, "minblocks": 17, "algorithm": "medium", "perf": 2325.35, "source": "autotuned"},
{"m": 13, "n": 5, "k": 32, "tile_m": 1, "tile_n": 5, "threads": 32, "grouping": 8, "minblocks": 13, "algorithm": "medium", "perf": 2407.23, "source": "autotuned"},
{"m": 13, "n": 5, "k": 45, "tile_m": 2, "tile_n": 2, "w": 16, "v": 4, "threads": 32, "grouping": 16, "minblocks": 8, "algorithm": "largeDB2", "perf": 2484.85, "source": "autotuned"},
{"m": 13, "n": 6, "k": 4, "tile_m": 2, "tile_n": 2, "threads": 64, "grouping": 8, "minblocks": 23, "algorithm": "medium", "perf": 1348.44, "source": "autotuned"},
{"m": 13, "n": 6, "k": 5, "tile_m": 1, "tile_n": 6, "threads": 32, "grouping": 5, "minblocks": 25, "algorithm": "medium", "perf": 1463.01, "source": "autotuned"},
{"m": 13, "n": 6, "k": 6, "tile_m": 2, "tile_n": 2, "threads": 96, "grouping": 8, "minblocks": 14, "algorithm": "medium", "perf": 1674.71, "source": "autotuned"},
{"m": 13, "n": 6, "k": 7, "tile_m": 1, "tile_n": 6, "threads": 96, "grouping": 16, "minblocks": 7, "algorithm": "medium", "perf": 1770.93, "source": "autotuned"},
{"m": 13, "n": 6, "k": 8, "tile_m": 1, "tile_n": 6, "threads": 128, "grouping": 8, "minblocks": 16, "algorithm": "medium", "perf": 1847.55, "source": "autotuned"},
{"m": 13, "n": 6, "k": 9, "tile_m": 1, "tile_n": 3, "threads": 64, "grouping": 6, "minblocks": 21, "algorithm": "medium", "perf": 1928.55, "source": "autotuned"},
{"m": 13, "n": 6, "k": 10, "tile_m": 1, "tile_n": 6, "threads": 32, "grouping": 5, "minblocks": 25, "algorithm": "medium", "perf": 2017.44, "source": "autotuned"},
{"m": 13, "n": 6, "k": 13, "tile_m": 1, "tile_n": 6, "threads": 32, "grouping": 5, "minblocks": 25, "algorithm": "medium", "perf": 2208.24, "source": "autotuned"},
{"m": 13, "n": 6, "k": 14, "tile_m": 2, "tile_n": 2, "threads": 96, "grouping": 8, "minblocks": 14, "algorithm": "medium", "perf": 2269.26, "source": "autotuned"},
{"m": 13, "n": 6, "k": 15, "tile_m": 1, "tile_n": 6, "threads": 32, "grouping": 8, "minblocks": 16, "algorithm": "medium", "perf": 2300.7, "source": "autotuned"},
{"m": 13, "n": 6, "k": 22, "tile_m": 2, "tile_n": 2, "threads": 32, "grouping": 8, "minblocks": 18, "algorithm": "medium", "perf": 2639.66, "source": "autotuned"},
{"m": 13, "n": 6, "k": 26, "tile_m": 2, "tile_n": 2, "w": 12, "v": 6, "threads": 32, "grouping": 16, "minblocks": 8, "algorithm": "largeDB2", "perf": 2738.31, "source": "autotuned"},
{"m": 13, "n": 6, "k": 32, "tile_m": 2, "tile_n": 2, "w": 14, "v": 6, "threads": 32, "grouping": 16, "minblocks": 8, "algorithm": "largeDB2", "perf": 2898.51, "source": "autotuned"},
{"m": 13, "n": 6, "k": 45, "tile_m": 2, "tile_n": 2, "w": 18, "v": 4, "threads": 32, "grouping": 16, "minblocks": 2, "algorithm": "largeDB2", "perf": 2403.76, "source": "autotuned"},
{"m": 13, "n": 7, "k": 4, "tile_m": 2, "tile_n": 2, "threads": 64, "grouping": 8, "minblocks": 23, "algorithm": "medium", "perf": 1514.17, "source": "autotuned"},
{"m": 13, "n": 7, "k": 5, "tile_m": 2, "tile_n": 2, "threads": 96, "grouping": 11, "minblocks": 15, "algorithm": "medium", "perf": 1618.23, "source": "autotuned"},
{"m": 13, "n": 7, "k": 6, "tile_m": 2, "tile_n": 2, "threads": 96, "grouping": 8, "minblocks": 14, "algorithm": "medium", "perf": 1850.0, "source": "autotuned"},
{"m": 13, "n": 7, "k": 7, "tile_m": 2, "tile_n": 2, "threads": 96, "grouping": 9, "minblocks": 14, "algorithm": "medium", "perf": 2006.43, "source": "autotuned"},
{"m": 13, "n": 7, "k": 8, "tile_m": 2, "tile_n": 2, "threads": 128, "grouping": 11, "minblocks": 11, "algorithm": "medium", "perf": 2040.19, "source": "autotuned"},
{"m": 13, "n": 7, "k": 9, "tile_m": 2, "tile_n": 2, "threads": 128, "grouping": 8, "minblocks": 13, "algorithm": "medium", "perf": 2182.35, "source": "autotuned"},
{"m": 13, "n": 7, "k": 10, "tile_m": 2, "tile_n": 2, "threads": 32, "grouping": 7, "minblocks": 25, "algorithm": "medium", "perf": 2150.8, "source": "autotuned"},
{"m": 13, "n": 7, "k": 13, "tile_m": 2, "tile_n": 2, "threads": 96, "grouping": 8, "minblocks": 16, "algorithm": "medium", "perf": 2488.16, "source": "autotuned"},
{"m": 13, "n": 7, "k": 15, "tile_m": 2, "tile_n": 2, "threads": 32, "grouping": 8, "minblocks": 22, "algorithm": "medium", "perf": 2477.59, "source": "autotuned"},
{"m": 13, "n": 7, "k": 22, "tile_m": 8, "tile_n": 1, "threads": 32, "grouping": 8, "minblocks": 13, "algorithm": "medium", "perf": 2829.9, "source": "autotuned"},
{"m": 13, "n": 7, "k": 26, "tile_m": 2, "tile_n": 2, "w": 12, "v": 6, "threads": 32, "grouping": 16, "minblocks": 12, "algorithm": "largeDB2", "perf": 2929.86, "source": "autotuned"},
{"m": 13, "n": 7, "k": 32, "tile_m": 2, "tile_n": 2, "w": 12, "v": 4, "threads": 32, "grouping": 16, "minblocks": 4, "algorithm": "largeDB2", "perf": 2995.28, "source": "autotuned"},
{"m": 13, "n": 7, "k": 45, "tile_m": 2, "tile_n": 2, "w": 16, "v": 6, "threads": 32, "grouping": 16, "minblocks": 2, "algorithm": "largeDB2", "perf": 3184.46, "source": "autotuned"},
{"m": 13, "n": 8, "k": 4, "tile_m": 2, "tile_n": 2, "threads": 64, "grouping": 8, "minblocks": 22, "algorithm": "medium", "perf": 1711.3, "source": "autotuned"},
{"m": 13, "n": 8, "k": 5, "tile_m": 2, "tile_n": 2, "threads": 96, "grouping": 11, "minblocks": 16, "algorithm": "medium", "perf": 1874.46, "source": "autotuned"},
{"m": 13, "n": 8, "k": 6, "tile_m": 2, "tile_n": 2, "threads": 96, "grouping": 11, "minblocks": 15, "algorithm": "medium", "perf": 2122.39, "source": "autotuned"},
{"m": 13, "n": 8, "k": 7, "tile_m": 2, "tile_n": 2, "threads": 96, "grouping": 9, "minblocks": 15, "algorithm": "medium", "perf": 2253.34, "source": "autotuned"},
{"m": 13, "n": 8, "k": 8, "tile_m": 2, "tile_n": 2, "threads": 128, "grouping": 8, "minblocks": 14, "algorithm": "medium", "perf": 2293.15, "source": "autotuned"},
{"m": 13, "n": 8, "k": 9, "tile_m": 2, "tile_n": 2, "threads": 128, "grouping": 9, "minblocks": 14, "algorithm": "medium", "perf": 2440.71, "source": "autotuned"},
{"m": 13, "n": 8, "k": 10, "tile_m": 2, "tile_n": 2, "threads": 160, "grouping": 16, "minblocks": 8, "algorithm": "medium", "perf": 2460.85, "source": "autotuned"},
{"m": 13, "n": 8, "k": 13, "tile_m": 2, "tile_n": 2, "threads": 64, "grouping": 7, "minblocks": 18, "algorithm": "medium", "perf": 2677.48, "source": "autotuned"},
{"m": 13, "n": 8, "k": 15, "tile_m": 2, "tile_n": 2, "threads": 32, "grouping": 8, "minblocks": 24, "algorithm": "medium", "perf": 2773.58, "source": "autotuned"},
{"m": 13, "n": 8, "k": 22, "tile_m": 8, "tile_n": 1, "w": 8, "v": 8, "threads": 32, "grouping": 16, "minblocks": 8, "algorithm": "largeDB2", "perf": 3251.02, "source": "autotuned"},
{"m": 13, "n": 8, "k": 26, "tile_m": 8, "tile_n": 1, "w": 12, "v": 8, "threads": 32, "grouping": 16, "minblocks": 2, "algorithm": "largeDB2", "perf": 3372.62, "source": "autotuned"},
{"m": 13, "n": 8, "k": 32, "tile_m": 8, "tile_n": 1, "w": 12, "v": 8, "threads": 32, "grouping": 16, "minblocks": 2, "algorithm": "largeDB2", "perf": 3446.21, "source": "autotuned"},
{"m": 13, "n": 8, "k": 45, "tile_m": 2, "tile_n": 2, "w": 18, "v": 6, "threads": 32, "grouping": 16, "minblocks": 8, "algorithm": "largeDB2", "perf": 3566.38, "source": "autotuned"},
{"m": 13, "n": 9, "k": 4, "tile_m": 3, "tile_n": 2, "threads": 64, "grouping": 9, "minblocks": 15, "algorithm": "medium", "perf": 1750.83, "source": "autotuned"},
{"m": 13, "n": 9, "k": 5, "tile_m": 7, "tile_n": 1, "threads": 96, "grouping": 11, "minblocks": 11, "algorithm": "medium", "perf": 1966.84, "source": "autotuned"},
{"m": 13, "n": 9, "k": 6, "tile_m": 7, "tile_n": 1, "threads": 96, "grouping": 11, "minblocks": 13, "algorithm": "medium", "perf": 2168.13, "source": "autotuned"},
{"m": 13, "n": 9, "k": 7, "tile_m": 7, "tile_n": 1, "threads": 96, "grouping": 11, "minblocks": 13, "algorithm": "medium", "perf": 2416.68, "source": "autotuned"},
{"m": 13, "n": 9, "k": 8, "tile_m": 2, "tile_n": 3, "threads": 128, "grouping": 13, "minblocks": 10, "algorithm": "medium", "perf": 2344.79, "source": "autotuned"},
{"m": 13, "n": 9, "k": 9, "tile_m": 3, "tile_n": 2, "threads": 128, "grouping": 11, "minblocks": 11, "algorithm": "medium", "perf": 2478.95, "source": "autotuned"},
{"m": 13, "n": 9, "k": 10, "tile_m": 7, "tile_n": 1, "threads": 32, "grouping": 8, "minblocks": 20, "algorithm": "medium", "perf": 2506.67, "source": "autotuned"},
{"m": 13, "n": 9, "k": 13, "tile_m": 7, "tile_n": 1, "threads": 32, "grouping": 8, "minblocks": 22, "algorithm": "medium", "perf": 2801.98, "source": "autotuned"},
{"m": 13, "n": 9, "k": 14, "tile_m": 7, "tile_n": 1, "threads": 32, "grouping": 8, "minblocks": 21, "algorithm": "medium", "perf": 2917.73, "source": "autotuned"},
{"m": 13, "n": 9, "k": 15, "tile_m": 7, "tile_n": 1, "threads": 32, "grouping": 8, "minblocks": 21, "algorithm": "medium", "perf": 2908.6, "source": "autotuned"},
{"m": 13, "n": 9, "k": 16, "tile_m": 7, "tile_n": 1, "threads": 32, "grouping": 8, "minblocks": 16, "algorithm": "medium", "perf": 3023.55, "source": "autotuned"},
{"m": 13, "n": 9, "k": 22, "tile_m": 7, "tile_n": 1, "threads": 32, "grouping": 8, "minblocks": 14, "algorithm": "medium", "perf": 3268.56, "source": "autotuned"},
{"m": 13, "n": 9, "k": 23, "tile_m": 7, "tile_n": 1, "threads": 32, "grouping": 8, "minblocks": 13, "algorithm": "medium", "perf": 3262.84, "source": "autotuned"},
{"m": 13, "n": 9, "k": 25, "tile_m": 7, "tile_n": 1, "w": 12, "v": 8, "threads": 32, "grouping": 16, "minblocks": 12, "algorithm": "largeDB2", "perf": 3353.48, "source": "autotuned"},
{"m": 13, "n": 9, "k": 26, "tile_m": 7, "tile_n": 1, "w": 12, "v": 8, "threads": 32, "grouping": 16, "minblocks": 1, "algorithm": "largeDB2", "perf": 3350.34, "source": "autotuned"},
{"m": 13, "n": 9, "k": 32, "tile_m": 7, "tile_n": 1, "w": 14, "v": 8, "threads": 32, "grouping": 16, "minblocks": 12, "algorithm": "largeDB2", "perf": 3514.39, "source": "autotuned"},
{"m": 13, "n": 9, "k": 45, "tile_m": 7, "tile_n": 1, "w": 18, "v": 8, "threads": 32, "grouping": 16, "minblocks": 12, "algorithm": "largeDB2", "perf": 3667.58, "source": "autotuned"},
{"m": 13, "n": 10, "k": 4, "tile_m": 3, "tile_n": 2, "threads": 64, "grouping": 11, "minblocks": 8, "algorithm": "medium", "perf": 1918.24, "source": "autotuned"},
{"m": 13, "n": 10, "k": 5, "tile_m": 7, "tile_n": 1, "threads": 96, "grouping": 11, "minblocks": 13, "algorithm": "medium", "perf": 2115.02, "source": "autotuned"},
{"m": 13, "n": 10, "k": 6, "tile_m": 7, "tile_n": 1, "threads": 96, "grouping": 11, "minblocks": 13, "algorithm": "medium", "perf": 2394.76, "source": "autotuned"},
{"m": 13, "n": 10, "k": 7, "tile_m": 7, "tile_n": 1, "threads": 96, "grouping": 11, "minblocks": 13, "algorithm": "medium", "perf": 2652.11, "source": "autotuned"},
{"m": 13, "n": 10, "k": 8, "tile_m": 3, "tile_n": 2, "threads": 128, "grouping": 11, "minblocks": 11, "algorithm": "medium", "perf": 2595.41, "source": "autotuned"},
{"m": 13, "n": 10, "k": 9, "tile_m": 7, "tile_n": 1, "threads": 128, "grouping": 16, "minblocks": 9, "algorithm": "medium", "perf": 2769.44, "source": "autotuned"},
{"m": 13, "n": 10, "k": 10, "tile_m": 7, "tile_n": 1, "threads": 32, "grouping": 7, "minblocks": 22, "algorithm": "medium", "perf": 2814.73, "source": "autotuned"},
{"m": 13, "n": 10, "k": 13, "tile_m": 7, "tile_n": 1, "threads": 32, "grouping": 8, "minblocks": 22, "algorithm": "medium", "perf": 3080.09, "source": "autotuned"},
{"m": 13, "n": 10, "k": 14, "tile_m": 7, "tile_n": 1, "threads": 32, "grouping": 8, "minblocks": 18, "algorithm": "medium", "perf": 3225.1, "source": "autotuned"},
{"m": 13, "n": 10, "k": 15, "tile_m": 7, "tile_n": 1, "threads": 32, "grouping": 8, "minblocks": 18, "algorithm": "medium", "perf": 3212.64, "source": "autotuned"},
{"m": 13, "n": 10, "k": 22, "tile_m": 7, "tile_n": 1, "w": 10, "v": 10, "threads": 32, "grouping": 16, "minblocks": 2, "algorithm": "largeDB2", "perf": 3689.1, "source": "autotuned"},
{"m": 13, "n": 10, "k": 26, "tile_m": 7, "tile_n": 1, "w": 12, "v": 10, "threads": 32, "grouping": 16, "minblocks": 8, "algorithm": "largeDB2", "perf": 3840.65, "source": "autotuned"},
{"m": 13, "n": 10, "k": 32, "tile_m": 7, "tile_n": 1, "w": 14, "v": 10, "threads": 32, "grouping": 16, "minblocks": 4, "algorithm": "largeDB2", "perf": 3893.92, "source": "autotuned"},
{"m": 13, "n": 10, "k": 45, "tile_m": 7, "tile_n": 1, "w": 18, "v": 10, "threads": 32, "grouping": 16, "minblocks": 1, "algorithm": "largeDB2", "perf": 4168.96, "source": "autotuned"},
{"m": 13, "n": 13, "k": 4, "tile_m": 7, "tile_n": 1, "threads": 96, "grouping": 11, "minblocks": 13, "algorithm": "medium", "perf": 2456.47, "source": "autotuned"},
{"m": 13, "n": 13, "k": 5, "tile_m": 7, "tile_n": 1, "threads": 96, "grouping": 11, "minblocks": 12, "algorithm": "medium", "perf": 2691.31, "source": "autotuned"},
{"m": 13, "n": 13, "k": 6, "tile_m": 7, "tile_n": 1, "threads": 96, "grouping": 11, "minblocks": 13, "algorithm": "medium", "perf": 3070.59, "source": "autotuned"},
{"m": 13, "n": 13, "k": 7, "tile_m": 7, "tile_n": 1, "threads": 96, "grouping": 11, "minblocks": 13, "algorithm": "medium", "perf": 3353.27, "source": "autotuned"},
{"m": 13, "n": 13, "k": 8, "tile_m": 8, "tile_n": 1, "threads": 32, "grouping": 8, "minblocks": 22, "algorithm": "medium", "perf": 3354.04, "source": "autotuned"},
{"m": 13, "n": 13, "k": 9, "tile_m": 8, "tile_n": 1, "threads": 32, "grouping": 8, "minblocks": 22, "algorithm": "medium", "perf": 3530.11, "source": "autotuned"},
{"m": 13, "n": 13, "k": 10, "tile_m": 7, "tile_n": 1, "threads": 32, "grouping": 8, "minblocks": 24, "algorithm": "medium", "perf": 3727.15, "source": "autotuned"},
{"m": 13, "n": 13, "k": 13, "tile_m": 7, "tile_n": 1, "threads": 32, "grouping": 8, "minblocks": 18, "algorithm": "medium", "perf": 4038.38, "source": "autotuned"},
{"m": 13, "n": 13, "k": 14, "tile_m": 7, "tile_n": 1, "threads": 32, "grouping": 11, "minblocks": 17, "algorithm": "medium", "perf": 4097.54, "source": "autotuned"},
