src/acc/libsmm_acc/libcusmm/parameters_P100.json
[
{"m": 4, "n": 4, "k": 4, "tile_m": 1, "tile_n": 1, "threads": 32, "grouping": 16, "minblocks": 9, "algorithm": "medium", "perf": 146.542, "source": "autotuned"},
{"m": 4, "n": 4, "k": 5, "tile_m": 1, "tile_n": 1, "threads": 32, "grouping": 18, "minblocks": 10, "algorithm": "medium", "perf": 177.041, "source": "autotuned"},
{"m": 4, "n": 4, "k": 6, "tile_m": 1, "tile_n": 1, "threads": 32, "grouping": 16, "minblocks": 16, "algorithm": "medium", "perf": 206.475, "source": "autotuned"},
{"m": 4, "n": 4, "k": 7, "tile_m": 1, "tile_n": 1, "threads": 32, "grouping": 16, "minblocks": 9, "algorithm": "medium", "perf": 219.254, "source": "autotuned"},
{"m": 4, "n": 4, "k": 8, "threads": 32, "grouping": 12, "minblocks": 28, "algorithm": "tiny", "perf": 224.843, "source": "autotuned"},
{"m": 4, "n": 4, "k": 9, "tile_m": 1, "tile_n": 1, "threads": 32, "grouping": 16, "minblocks": 2, "algorithm": "medium", "perf": 212.125, "source": "autotuned"},
{"m": 4, "n": 4, "k": 10, "tile_m": 1, "tile_n": 1, "threads": 32, "grouping": 16, "minblocks": 23, "algorithm": "medium", "perf": 230.568, "source": "autotuned"},
{"m": 4, "n": 4, "k": 13, "tile_m": 1, "tile_n": 1, "threads": 32, "grouping": 12, "minblocks": 26, "algorithm": "medium", "perf": 277.241, "source": "autotuned"},
{"m": 4, "n": 4, "k": 15, "tile_m": 1, "tile_n": 1, "threads": 32, "grouping": 12, "minblocks": 18, "algorithm": "medium", "perf": 306.278, "source": "autotuned"},
{"m": 4, "n": 4, "k": 25, "tile_m": 1, "tile_n": 1, "threads": 32, "grouping": 18, "minblocks": 17, "algorithm": "medium", "perf": 296.162, "source": "autotuned"},
{"m": 4, "n": 4, "k": 26, "tile_m": 1, "tile_n": 1, "threads": 32, "grouping": 16, "minblocks": 18, "algorithm": "medium", "perf": 298.901, "source": "autotuned"},
{"m": 4, "n": 4, "k": 28, "tile_m": 1, "tile_n": 1, "threads": 32, "grouping": 16, "minblocks": 11, "algorithm": "medium", "perf": 299.878, "source": "autotuned"},
{"m": 4, "n": 4, "k": 32, "tile_m": 1, "tile_n": 1, "threads": 32, "grouping": 3, "minblocks": 14, "algorithm": "small", "perf": 303.953, "source": "autotuned"},
{"m": 4, "n": 4, "k": 45, "tile_m": 1, "tile_n": 1, "threads": 64, "grouping": 3, "minblocks": 2, "algorithm": "medium", "perf": 294.358, "source": "autotuned"},
{"m": 4, "n": 5, "k": 4, "tile_m": 1, "tile_n": 1, "threads": 32, "grouping": 18, "minblocks": 11, "algorithm": "medium", "perf": 177.692, "source": "autotuned"},
{"m": 4, "n": 5, "k": 5, "tile_m": 1, "tile_n": 1, "threads": 32, "grouping": 16, "minblocks": 11, "algorithm": "medium", "perf": 217.191, "source": "autotuned"},
{"m": 4, "n": 5, "k": 6, "tile_m": 1, "tile_n": 1, "threads": 32, "grouping": 16, "minblocks": 22, "algorithm": "medium", "perf": 236.563, "source": "autotuned"},
{"m": 4, "n": 5, "k": 7, "tile_m": 1, "tile_n": 1, "threads": 32, "grouping": 16, "minblocks": 21, "algorithm": "medium", "perf": 211.342, "source": "autotuned"},
{"m": 4, "n": 5, "k": 8, "tile_m": 1, "tile_n": 1, "threads": 32, "grouping": 16, "minblocks": 1, "algorithm": "medium", "perf": 221.036, "source": "autotuned"},
{"m": 4, "n": 5, "k": 9, "tile_m": 1, "tile_n": 1, "threads": 32, "grouping": 16, "minblocks": 4, "algorithm": "medium", "perf": 229.753, "source": "autotuned"},
{"m": 4, "n": 5, "k": 13, "tile_m": 1, "tile_n": 1, "threads": 32, "grouping": 13, "minblocks": 9, "algorithm": "medium", "perf": 289.348, "source": "autotuned"},
{"m": 4, "n": 5, "k": 25, "tile_m": 1, "tile_n": 1, "threads": 32, "grouping": 3, "minblocks": 13, "algorithm": "medium", "perf": 321.429, "source": "autotuned"},
{"m": 4, "n": 5, "k": 26, "tile_m": 1, "tile_n": 1, "threads": 32, "grouping": 3, "minblocks": 10, "algorithm": "medium", "perf": 314.511, "source": "autotuned"},
{"m": 4, "n": 5, "k": 28, "tile_m": 1, "tile_n": 1, "threads": 32, "grouping": 4, "minblocks": 1, "algorithm": "medium", "perf": 320.416, "source": "autotuned"},
{"m": 4, "n": 5, "k": 32, "tile_m": 1, "tile_n": 1, "threads": 64, "grouping": 3, "minblocks": 21, "algorithm": "medium", "perf": 329.232, "source": "autotuned"},
{"m": 4, "n": 5, "k": 45, "tile_m": 1, "tile_n": 1, "threads": 64, "grouping": 4, "minblocks": 9, "algorithm": "medium", "perf": 321.273, "source": "autotuned"},
{"m": 4, "n": 6, "k": 4, "tile_m": 1, "tile_n": 1, "threads": 32, "grouping": 18, "minblocks": 15, "algorithm": "medium", "perf": 212.803, "source": "autotuned"},
{"m": 4, "n": 6, "k": 5, "tile_m": 1, "tile_n": 1, "threads": 32, "grouping": 16, "minblocks": 5, "algorithm": "medium", "perf": 249.115, "source": "autotuned"},
{"m": 4, "n": 6, "k": 6, "tile_m": 1, "tile_n": 1, "threads": 32, "grouping": 16, "minblocks": 7, "algorithm": "medium", "perf": 220.182, "source": "autotuned"},
{"m": 4, "n": 6, "k": 7, "tile_m": 1, "tile_n": 1, "threads": 32, "grouping": 16, "minblocks": 25, "algorithm": "medium", "perf": 249.712, "source": "autotuned"},
{"m": 4, "n": 6, "k": 8, "tile_m": 1, "tile_n": 1, "threads": 32, "grouping": 16, "minblocks": 11, "algorithm": "medium", "perf": 261.366, "source": "autotuned"},
{"m": 4, "n": 6, "k": 9, "tile_m": 1, "tile_n": 1, "threads": 32, "grouping": 13, "minblocks": 7, "algorithm": "medium", "perf": 270.512, "source": "autotuned"},
{"m": 4, "n": 7, "k": 4, "tile_m": 1, "tile_n": 1, "threads": 32, "grouping": 18, "minblocks": 3, "algorithm": "medium", "perf": 247.865, "source": "autotuned"},
{"m": 4, "n": 7, "k": 5, "tile_m": 1, "tile_n": 1, "threads": 32, "grouping": 16, "minblocks": 10, "algorithm": "medium", "perf": 221.348, "source": "autotuned"},
{"m": 4, "n": 7, "k": 6, "tile_m": 1, "tile_n": 1, "threads": 32, "grouping": 15, "minblocks": 21, "algorithm": "medium", "perf": 253.675, "source": "autotuned"},
{"m": 4, "n": 7, "k": 7, "tile_m": 1, "tile_n": 1, "threads": 32, "grouping": 16, "minblocks": 26, "algorithm": "medium", "perf": 283.879, "source": "autotuned"},
{"m": 4, "n": 7, "k": 8, "tile_m": 1, "tile_n": 1, "threads": 32, "grouping": 13, "minblocks": 27, "algorithm": "medium", "perf": 296.012, "source": "autotuned"},
{"m": 4, "n": 7, "k": 9, "tile_m": 1, "tile_n": 1, "threads": 32, "grouping": 13, "minblocks": 1, "algorithm": "medium", "perf": 308.449, "source": "autotuned"},
{"m": 4, "n": 7, "k": 13, "tile_m": 1, "tile_n": 1, "threads": 32, "grouping": 11, "minblocks": 20, "algorithm": "medium", "perf": 367.159, "source": "autotuned"},
{"m": 4, "n": 7, "k": 25, "tile_m": 1, "tile_n": 1, "threads": 64, "grouping": 4, "minblocks": 3, "algorithm": "medium", "perf": 359.977, "source": "autotuned"},
{"m": 4, "n": 7, "k": 26, "tile_m": 1, "tile_n": 1, "threads": 64, "grouping": 4, "minblocks": 18, "algorithm": "medium", "perf": 366.138, "source": "autotuned"},
{"m": 4, "n": 7, "k": 28, "tile_m": 1, "tile_n": 1, "threads": 64, "grouping": 4, "minblocks": 9, "algorithm": "medium", "perf": 366.881, "source": "autotuned"},
{"m": 4, "n": 7, "k": 32, "tile_m": 1, "tile_n": 1, "threads": 64, "grouping": 4, "minblocks": 17, "algorithm": "medium", "perf": 372.257, "source": "autotuned"},
{"m": 4, "n": 7, "k": 45, "tile_m": 1, "tile_n": 1, "threads": 64, "grouping": 4, "minblocks": 1, "algorithm": "medium", "perf": 364.346, "source": "autotuned"},
{"m": 4, "n": 8, "k": 4, "tile_m": 1, "tile_n": 1, "threads": 32, "grouping": 16, "minblocks": 27, "algorithm": "medium", "perf": 238.702, "source": "autotuned"},
{"m": 4, "n": 8, "k": 5, "tile_m": 1, "tile_n": 1, "threads": 32, "grouping": 16, "minblocks": 2, "algorithm": "medium", "perf": 250.59, "source": "autotuned"},
{"m": 4, "n": 8, "k": 6, "tile_m": 1, "tile_n": 1, "threads": 32, "grouping": 15, "minblocks": 19, "algorithm": "medium", "perf": 289.589, "source": "autotuned"},
{"m": 4, "n": 8, "k": 7, "tile_m": 1, "tile_n": 1, "threads": 32, "grouping": 13, "minblocks": 13, "algorithm": "medium", "perf": 321.553, "source": "autotuned"},
{"m": 4, "n": 8, "k": 8, "tile_m": 1, "tile_n": 1, "threads": 32, "grouping": 11, "minblocks": 25, "algorithm": "medium", "perf": 316.767, "source": "autotuned"},
{"m": 4, "n": 8, "k": 9, "tile_m": 1, "tile_n": 1, "threads": 32, "grouping": 13, "minblocks": 27, "algorithm": "medium", "perf": 338.79, "source": "autotuned"},
{"m": 4, "n": 9, "k": 4, "tile_m": 2, "tile_n": 1, "threads": 32, "grouping": 16, "minblocks": 2, "algorithm": "medium", "perf": 227.781, "source": "autotuned"},
{"m": 4, "n": 9, "k": 5, "tile_m": 2, "tile_n": 1, "threads": 32, "grouping": 16, "minblocks": 7, "algorithm": "medium", "perf": 266.956, "source": "autotuned"},
{"m": 4, "n": 9, "k": 6, "tile_m": 2, "tile_n": 1, "threads": 32, "grouping": 13, "minblocks": 7, "algorithm": "medium", "perf": 312.537, "source": "autotuned"},
{"m": 4, "n": 9, "k": 7, "tile_m": 2, "tile_n": 1, "threads": 32, "grouping": 12, "minblocks": 8, "algorithm": "medium", "perf": 337.427, "source": "autotuned"},
{"m": 4, "n": 9, "k": 8, "tile_m": 2, "tile_n": 1, "threads": 32, "grouping": 13, "minblocks": 19, "algorithm": "medium", "perf": 339.161, "source": "autotuned"},
{"m": 4, "n": 9, "k": 9, "tile_m": 2, "tile_n": 1, "threads": 32, "grouping": 13, "minblocks": 21, "algorithm": "medium", "perf": 345.165, "source": "autotuned"},
{"m": 4, "n": 9, "k": 13, "tile_m": 1, "tile_n": 2, "threads": 32, "grouping": 13, "minblocks": 5, "algorithm": "medium", "perf": 387.107, "source": "autotuned"},
{"m": 4, "n": 9, "k": 25, "tile_m": 1, "tile_n": 1, "threads": 64, "grouping": 4, "minblocks": 6, "algorithm": "medium", "perf": 386.259, "source": "autotuned"},
{"m": 4, "n": 9, "k": 26, "tile_m": 1, "tile_n": 1, "threads": 64, "grouping": 4, "minblocks": 17, "algorithm": "medium", "perf": 388.032, "source": "autotuned"},
{"m": 4, "n": 9, "k": 28, "tile_m": 1, "tile_n": 1, "threads": 64, "grouping": 4, "minblocks": 16, "algorithm": "medium", "perf": 393.694, "source": "autotuned"},
{"m": 4, "n": 9, "k": 32, "tile_m": 1, "tile_n": 1, "threads": 64, "grouping": 4, "minblocks": 8, "algorithm": "medium", "perf": 394.752, "source": "autotuned"},
{"m": 4, "n": 9, "k": 45, "tile_m": 1, "tile_n": 1, "threads": 128, "grouping": 4, "minblocks": 4, "algorithm": "medium", "perf": 391.427, "source": "autotuned"},
{"m": 4, "n": 10, "k": 4, "tile_m": 2, "tile_n": 1, "threads": 32, "grouping": 16, "minblocks": 2, "algorithm": "medium", "perf": 250.088, "source": "autotuned"},
{"m": 4, "n": 10, "k": 10, "tile_m": 2, "tile_n": 1, "threads": 32, "grouping": 13, "minblocks": 11, "algorithm": "medium", "perf": 391.438, "source": "autotuned"},
{"m": 4, "n": 10, "k": 15, "tile_m": 2, "tile_n": 1, "threads": 32, "grouping": 13, "minblocks": 12, "algorithm": "medium", "perf": 397.304, "source": "autotuned"},
{"m": 4, "n": 13, "k": 4, "tile_m": 2, "tile_n": 1, "threads": 32, "grouping": 16, "minblocks": 6, "algorithm": "medium", "perf": 311.366, "source": "autotuned"},
{"m": 4, "n": 13, "k": 5, "tile_m": 1, "tile_n": 2, "threads": 32, "grouping": 13, "minblocks": 10, "algorithm": "medium", "perf": 351.076, "source": "autotuned"},
{"m": 4, "n": 13, "k": 7, "tile_m": 1, "tile_n": 2, "threads": 32, "grouping": 12, "minblocks": 17, "algorithm": "medium", "perf": 428.77, "source": "autotuned"},
{"m": 4, "n": 13, "k": 9, "tile_m": 1, "tile_n": 2, "threads": 32, "grouping": 13, "minblocks": 19, "algorithm": "medium", "perf": 418.275, "source": "autotuned"},
{"m": 4, "n": 13, "k": 13, "tile_m": 1, "tile_n": 1, "threads": 64, "grouping": 6, "minblocks": 5, "algorithm": "medium", "perf": 420.747, "source": "autotuned"},
{"m": 4, "n": 13, "k": 25, "tile_m": 1, "tile_n": 1, "threads": 64, "grouping": 4, "minblocks": 13, "algorithm": "medium", "perf": 427.859, "source": "autotuned"},
{"m": 4, "n": 13, "k": 26, "tile_m": 1, "tile_n": 1, "threads": 64, "grouping": 4, "minblocks": 9, "algorithm": "medium", "perf": 434.909, "source": "autotuned"},
{"m": 4, "n": 13, "k": 28, "tile_m": 1, "tile_n": 1, "threads": 128, "grouping": 4, "minblocks": 2, "algorithm": "medium", "perf": 436.522, "source": "autotuned"},
{"m": 4, "n": 13, "k": 32, "tile_m": 1, "tile_n": 1, "threads": 64, "grouping": 4, "minblocks": 8, "algorithm": "medium", "perf": 438.394, "source": "autotuned"},
{"m": 4, "n": 13, "k": 45, "tile_m": 1, "tile_n": 1, "threads": 128, "grouping": 4, "minblocks": 2, "algorithm": "medium", "perf": 436.72, "source": "autotuned"},
{"m": 4, "n": 15, "k": 4, "tile_m": 2, "tile_n": 1, "threads": 32, "grouping": 13, "minblocks": 5, "algorithm": "medium", "perf": 354.445, "source": "autotuned"},
{"m": 4, "n": 15, "k": 10, "tile_m": 1, "tile_n": 2, "threads": 32, "grouping": 13, "minblocks": 14, "algorithm": "medium", "perf": 431.464, "source": "autotuned"},
{"m": 4, "n": 15, "k": 15, "tile_m": 1, "tile_n": 1, "threads": 64, "grouping": 26, "minblocks": 12, "algorithm": "medium", "perf": 442.867, "source": "autotuned"},
{"m": 4, "n": 25, "k": 4, "tile_m": 5, "tile_n": 1, "threads": 32, "grouping": 13, "minblocks": 7, "algorithm": "medium", "perf": 445.525, "source": "autotuned"},
{"m": 4, "n": 25, "k": 5, "tile_m": 6, "tile_n": 1, "threads": 32, "grouping": 13, "minblocks": 2, "algorithm": "medium", "perf": 455.615, "source": "autotuned"},
{"m": 4, "n": 25, "k": 7, "tile_m": 4, "tile_n": 1, "threads": 32, "grouping": 16, "minblocks": 8, "algorithm": "medium", "perf": 454.983, "source": "autotuned"},
{"m": 4, "n": 25, "k": 9, "tile_m": 2, "tile_n": 1, "threads": 64, "grouping": 24, "minblocks": 7, "algorithm": "medium", "perf": 458.769, "source": "autotuned"},
{"m": 4, "n": 25, "k": 13, "tile_m": 2, "tile_n": 1, "threads": 64, "grouping": 4, "minblocks": 13, "algorithm": "medium", "perf": 471.674, "source": "autotuned"},
{"m": 4, "n": 25, "k": 25, "tile_m": 2, "tile_n": 1, "threads": 128, "grouping": 3, "minblocks": 5, "algorithm": "medium", "perf": 481.216, "source": "autotuned"},
{"m": 4, "n": 25, "k": 26, "tile_m": 2, "tile_n": 1, "threads": 128, "grouping": 4, "minblocks": 6, "algorithm": "medium", "perf": 484.075, "source": "autotuned"},
{"m": 4, "n": 25, "k": 28, "tile_m": 1, "tile_n": 1, "threads": 128, "grouping": 3, "minblocks": 2, "algorithm": "medium", "perf": 486.834, "source": "autotuned"},
{"m": 4, "n": 25, "k": 32, "tile_m": 1, "tile_n": 2, "threads": 128, "grouping": 3, "minblocks": 2, "algorithm": "medium", "perf": 492.058, "source": "autotuned"},
{"m": 4, "n": 25, "k": 45, "tile_m": 1, "tile_n": 1, "threads": 192, "grouping": 3, "minblocks": 3, "algorithm": "medium", "perf": 490.296, "source": "autotuned"},
{"m": 4, "n": 26, "k": 4, "tile_m": 4, "tile_n": 1, "threads": 32, "grouping": 12, "minblocks": 2, "algorithm": "medium", "perf": 450.52, "source": "autotuned"},
{"m": 4, "n": 26, "k": 5, "tile_m": 4, "tile_n": 1, "threads": 32, "grouping": 13, "minblocks": 3, "algorithm": "medium", "perf": 452.479, "source": "autotuned"},
{"m": 4, "n": 26, "k": 7, "tile_m": 2, "tile_n": 2, "threads": 32, "grouping": 18, "minblocks": 4, "algorithm": "medium", "perf": 462.349, "source": "autotuned"},
{"m": 4, "n": 26, "k": 9, "tile_m": 2, "tile_n": 1, "threads": 64, "grouping": 26, "minblocks": 1, "algorithm": "medium", "perf": 458.638, "source": "autotuned"},
{"m": 4, "n": 26, "k": 13, "tile_m": 1, "tile_n": 2, "threads": 64, "grouping": 26, "minblocks": 7, "algorithm": "medium", "perf": 475.833, "source": "autotuned"},
{"m": 4, "n": 26, "k": 25, "tile_m": 1, "tile_n": 1, "threads": 128, "grouping": 3, "minblocks": 5, "algorithm": "medium", "perf": 485.815, "source": "autotuned"},
{"m": 4, "n": 26, "k": 26, "tile_m": 2, "tile_n": 1, "threads": 128, "grouping": 3, "minblocks": 6, "algorithm": "medium", "perf": 486.965, "source": "autotuned"},
{"m": 4, "n": 26, "k": 28, "tile_m": 1, "tile_n": 1, "threads": 128, "grouping": 3, "minblocks": 5, "algorithm": "medium", "perf": 488.784, "source": "autotuned"},
{"m": 4, "n": 26, "k": 32, "tile_m": 1, "tile_n": 1, "threads": 160, "grouping": 2, "minblocks": 3, "algorithm": "medium", "perf": 494.485, "source": "autotuned"},
{"m": 4, "n": 26, "k": 45, "tile_m": 1, "tile_n": 1, "threads": 192, "grouping": 3, "minblocks": 1, "algorithm": "medium", "perf": 494.086, "source": "autotuned"},
{"m": 4, "n": 28, "k": 4, "tile_m": 1, "tile_n": 5, "threads": 32, "grouping": 13, "minblocks": 6, "algorithm": "medium", "perf": 442.777, "source": "autotuned"},
{"m": 4, "n": 28, "k": 5, "tile_m": 6, "tile_n": 1, "threads": 32, "grouping": 13, "minblocks": 23, "algorithm": "medium", "perf": 450.581, "source": "autotuned"},
{"m": 4, "n": 28, "k": 7, "tile_m": 4, "tile_n": 1, "threads": 64, "grouping": 22, "minblocks": 8, "algorithm": "medium", "perf": 462.427, "source": "autotuned"},
{"m": 4, "n": 28, "k": 9, "tile_m": 2, "tile_n": 1, "threads": 64, "grouping": 26, "minblocks": 17, "algorithm": "medium", "perf": 474.408, "source": "autotuned"},
{"m": 4, "n": 28, "k": 13, "tile_m": 2, "tile_n": 1, "threads": 64, "grouping": 32, "minblocks": 7, "algorithm": "medium", "perf": 484.113, "source": "autotuned"},
{"m": 4, "n": 28, "k": 25, "tile_m": 1, "tile_n": 1, "threads": 128, "grouping": 5, "minblocks": 7, "algorithm": "medium", "perf": 487.596, "source": "autotuned"},
{"m": 4, "n": 28, "k": 26, "tile_m": 2, "tile_n": 1, "threads": 128, "grouping": 4, "minblocks": 3, "algorithm": "medium", "perf": 487.843, "source": "autotuned"},
{"m": 4, "n": 28, "k": 28, "tile_m": 1, "tile_n": 1, "threads": 128, "grouping": 4, "minblocks": 5, "algorithm": "medium", "perf": 489.847, "source": "autotuned"},
{"m": 4, "n": 28, "k": 32, "tile_m": 2, "tile_n": 1, "threads": 192, "grouping": 4, "minblocks": 3, "algorithm": "medium", "perf": 497.128, "source": "autotuned"},
{"m": 4, "n": 28, "k": 45, "tile_m": 1, "tile_n": 1, "threads": 192, "grouping": 3, "minblocks": 2, "algorithm": "medium", "perf": 502.934, "source": "autotuned"},
{"m": 4, "n": 32, "k": 4, "tile_m": 4, "tile_n": 1, "threads": 32, "grouping": 13, "minblocks": 2, "algorithm": "medium", "perf": 460.973, "source": "autotuned"},
{"m": 4, "n": 32, "k": 5, "tile_m": 5, "tile_n": 1, "threads": 32, "grouping": 17, "minblocks": 5, "algorithm": "medium", "perf": 463.913, "source": "autotuned"},
{"m": 4, "n": 32, "k": 7, "tile_m": 2, "tile_n": 1, "threads": 64, "grouping": 4, "minblocks": 21, "algorithm": "medium", "perf": 475.538, "source": "autotuned"},
{"m": 4, "n": 32, "k": 9, "tile_m": 1, "tile_n": 2, "threads": 64, "grouping": 4, "minblocks": 8, "algorithm": "medium", "perf": 481.514, "source": "autotuned"},
{"m": 4, "n": 32, "k": 13, "tile_m": 1, "tile_n": 2, "threads": 64, "grouping": 32, "minblocks": 5, "algorithm": "medium", "perf": 491.05, "source": "autotuned"},
{"m": 4, "n": 32, "k": 25, "tile_m": 1, "tile_n": 1, "threads": 128, "grouping": 5, "minblocks": 6, "algorithm": "medium", "perf": 495.767, "source": "autotuned"},
{"m": 4, "n": 32, "k": 26, "tile_m": 1, "tile_n": 2, "w": 8, "v": 16, "threads": 64, "grouping": 16, "minblocks": 1, "algorithm": "largeDB2", "perf": 500.984, "source": "autotuned"},
{"m": 4, "n": 32, "k": 28, "tile_m": 1, "tile_n": 1, "threads": 256, "grouping": 5, "minblocks": 6, "algorithm": "medium", "perf": 501.158, "source": "autotuned"},
{"m": 4, "n": 32, "k": 32, "tile_m": 1, "tile_n": 1, "threads": 256, "grouping": 4, "minblocks": 1, "algorithm": "medium", "perf": 508.453, "source": "autotuned"},
{"m": 4, "n": 32, "k": 45, "tile_m": 1, "tile_n": 1, "threads": 192, "grouping": 3, "minblocks": 3, "algorithm": "medium", "perf": 513.575, "source": "autotuned"},
{"m": 4, "n": 45, "k": 4, "tile_m": 1, "tile_n": 3, "threads": 64, "grouping": 19, "minblocks": 2, "algorithm": "medium", "perf": 451.602, "source": "autotuned"},
{"m": 4, "n": 45, "k": 5, "tile_m": 1, "tile_n": 6, "threads": 64, "grouping": 26, "minblocks": 12, "algorithm": "medium", "perf": 455.413, "source": "autotuned"},
{"m": 4, "n": 45, "k": 7, "tile_m": 4, "tile_n": 1, "threads": 64, "grouping": 26, "minblocks": 4, "algorithm": "medium", "perf": 473.951, "source": "autotuned"},
{"m": 4, "n": 45, "k": 9, "tile_m": 1, "tile_n": 2, "threads": 96, "grouping": 29, "minblocks": 12, "algorithm": "medium", "perf": 476.94, "source": "autotuned"},
{"m": 4, "n": 45, "k": 13, "tile_m": 2, "tile_n": 2, "threads": 64, "grouping": 26, "minblocks": 5, "algorithm": "medium", "perf": 489.857, "source": "autotuned"},
{"m": 4, "n": 45, "k": 25, "tile_m": 2, "tile_n": 1, "threads": 128, "grouping": 3, "minblocks": 2, "algorithm": "medium", "perf": 508.404, "source": "autotuned"},
{"m": 4, "n": 45, "k": 26, "tile_m": 1, "tile_n": 1, "threads": 192, "grouping": 4, "minblocks": 4, "algorithm": "medium", "perf": 512.756, "source": "autotuned"},
{"m": 4, "n": 45, "k": 28, "tile_m": 2, "tile_n": 1, "threads": 128, "grouping": 3, "minblocks": 4, "algorithm": "medium", "perf": 516.097, "source": "autotuned"},
{"m": 4, "n": 45, "k": 32, "tile_m": 1, "tile_n": 2, "threads": 192, "grouping": 3, "minblocks": 2, "algorithm": "medium", "perf": 523.467, "source": "autotuned"},
{"m": 4, "n": 45, "k": 45, "tile_m": 1, "tile_n": 1, "threads": 256, "grouping": 3, "minblocks": 1, "algorithm": "medium", "perf": 529.993, "source": "autotuned"},
{"m": 5, "n": 4, "k": 4, "tile_m": 1, "tile_n": 1, "threads": 32, "grouping": 18, "minblocks": 15, "algorithm": "medium", "perf": 177.029, "source": "autotuned"},
{"m": 5, "n": 4, "k": 5, "tile_m": 1, "tile_n": 1, "threads": 32, "grouping": 18, "minblocks": 3, "algorithm": "medium", "perf": 214.145, "source": "autotuned"},
{"m": 5, "n": 4, "k": 6, "tile_m": 1, "tile_n": 1, "threads": 32, "grouping": 16, "minblocks": 1, "algorithm": "medium", "perf": 233.353, "source": "autotuned"},
{"m": 5, "n": 4, "k": 7, "tile_m": 1, "tile_n": 1, "threads": 32, "grouping": 16, "minblocks": 24, "algorithm": "medium", "perf": 211.838, "source": "autotuned"},
{"m": 5, "n": 4, "k": 8, "tile_m": 1, "tile_n": 1, "threads": 32, "grouping": 16, "minblocks": 4, "algorithm": "medium", "perf": 220.845, "source": "autotuned"},
{"m": 5, "n": 4, "k": 9, "tile_m": 1, "tile_n": 1, "threads": 32, "grouping": 16, "minblocks": 14, "algorithm": "medium", "perf": 228.292, "source": "autotuned"},
{"m": 5, "n": 4, "k": 13, "tile_m": 1, "tile_n": 1, "threads": 32, "grouping": 13, "minblocks": 20, "algorithm": "medium", "perf": 276.437, "source": "autotuned"},
{"m": 5, "n": 4, "k": 25, "tile_m": 1, "tile_n": 1, "threads": 32, "grouping": 16, "minblocks": 8, "algorithm": "medium", "perf": 312.504, "source": "autotuned"},
{"m": 5, "n": 4, "k": 26, "tile_m": 1, "tile_n": 1, "threads": 32, "grouping": 9, "minblocks": 17, "algorithm": "medium", "perf": 310.699, "source": "autotuned"},
{"m": 5, "n": 4, "k": 28, "tile_m": 1, "tile_n": 1, "threads": 64, "grouping": 4, "minblocks": 23, "algorithm": "medium", "perf": 314.448, "source": "autotuned"},
{"m": 5, "n": 4, "k": 32, "tile_m": 1, "tile_n": 1, "threads": 64, "grouping": 3, "minblocks": 21, "algorithm": "medium", "perf": 327.177, "source": "autotuned"},
{"m": 5, "n": 4, "k": 45, "tile_m": 1, "tile_n": 1, "threads": 64, "grouping": 3, "minblocks": 5, "algorithm": "medium", "perf": 314.251, "source": "autotuned"},
{"m": 5, "n": 5, "k": 4, "tile_m": 1, "tile_n": 1, "threads": 32, "grouping": 16, "minblocks": 1, "algorithm": "medium", "perf": 225.089, "source": "autotuned"},
{"m": 5, "n": 5, "k": 5, "tile_m": 1, "tile_n": 1, "threads": 32, "grouping": 16, "minblocks": 15, "algorithm": "medium", "perf": 260.59, "source": "autotuned"},
{"m": 5, "n": 5, "k": 6, "tile_m": 1, "tile_n": 1, "threads": 32, "grouping": 16, "minblocks": 10, "algorithm": "medium", "perf": 285.889, "source": "autotuned"},
{"m": 5, "n": 5, "k": 7, "tile_m": 1, "tile_n": 1, "threads": 32, "grouping": 13, "minblocks": 17, "algorithm": "medium", "perf": 262.967, "source": "autotuned"},
{"m": 5, "n": 5, "k": 8, "tile_m": 1, "tile_n": 1, "threads": 32, "grouping": 16, "minblocks": 14, "algorithm": "medium", "perf": 288.785, "source": "autotuned"},
{"m": 5, "n": 5, "k": 9, "tile_m": 1, "tile_n": 1, "threads": 32, "grouping": 13, "minblocks": 17, "algorithm": "medium", "perf": 311.74, "source": "autotuned"},
{"m": 5, "n": 5, "k": 12, "tile_m": 1, "tile_n": 1, "threads": 32, "grouping": 12, "minblocks": 3, "algorithm": "medium", "perf": 375.736, "source": "autotuned"},
{"m": 5, "n": 5, "k": 13, "tile_m": 1, "tile_n": 1, "threads": 32, "grouping": 13, "minblocks": 17, "algorithm": "medium", "perf": 363.798, "source": "autotuned"},
{"m": 5, "n": 5, "k": 16, "tile_m": 1, "tile_n": 1, "threads": 32, "grouping": 13, "minblocks": 13, "algorithm": "medium", "perf": 384.724, "source": "autotuned"},
{"m": 5, "n": 5, "k": 24, "tile_m": 1, "tile_n": 1, "threads": 64, "grouping": 4, "minblocks": 22, "algorithm": "medium", "perf": 372.44, "source": "autotuned"},
{"m": 5, "n": 5, "k": 25, "tile_m": 1, "tile_n": 1, "threads": 64, "grouping": 3, "minblocks": 23, "algorithm": "medium", "perf": 364.992, "source": "autotuned"},
{"m": 5, "n": 5, "k": 26, "tile_m": 1, "tile_n": 1, "threads": 64, "grouping": 4, "minblocks": 4, "algorithm": "medium", "perf": 358.249, "source": "autotuned"},
{"m": 5, "n": 5, "k": 28, "tile_m": 1, "tile_n": 1, "threads": 64, "grouping": 4, "minblocks": 12, "algorithm": "medium", "perf": 359.923, "source": "autotuned"},
{"m": 5, "n": 5, "k": 32, "tile_m": 1, "tile_n": 1, "threads": 32, "grouping": 2, "minblocks": 17, "algorithm": "medium", "perf": 370.681, "source": "autotuned"},
{"m": 5, "n": 5, "k": 45, "tile_m": 1, "tile_n": 1, "threads": 64, "grouping": 3, "minblocks": 12, "algorithm": "medium", "perf": 356.319, "source": "autotuned"},
{"m": 5, "n": 6, "k": 4, "tile_m": 1, "tile_n": 1, "threads": 32, "grouping": 18, "minblocks": 23, "algorithm": "medium", "perf": 264.288, "source": "autotuned"},
{"m": 5, "n": 6, "k": 5, "tile_m": 1, "tile_n": 1, "threads": 32, "grouping": 16, "minblocks": 6, "algorithm": "medium", "perf": 293.115, "source": "autotuned"},
{"m": 5, "n": 6, "k": 6, "tile_m": 1, "tile_n": 1, "threads": 32, "grouping": 15, "minblocks": 7, "algorithm": "medium", "perf": 274.264, "source": "autotuned"},
{"m": 5, "n": 6, "k": 7, "tile_m": 1, "tile_n": 1, "threads": 32, "grouping": 16, "minblocks": 20, "algorithm": "medium", "perf": 273.457, "source": "autotuned"},
{"m": 5, "n": 6, "k": 8, "tile_m": 1, "tile_n": 1, "threads": 32, "grouping": 13, "minblocks": 7, "algorithm": "medium", "perf": 305.918, "source": "autotuned"},
{"m": 5, "n": 6, "k": 9, "tile_m": 1, "tile_n": 1, "threads": 32, "grouping": 13, "minblocks": 16, "algorithm": "medium", "perf": 328.197, "source": "autotuned"},
{"m": 5, "n": 7, "k": 4, "tile_m": 2, "tile_n": 1, "threads": 32, "grouping": 16, "minblocks": 20, "algorithm": "medium", "perf": 262.885, "source": "autotuned"},
{"m": 5, "n": 7, "k": 5, "tile_m": 2, "tile_n": 1, "threads": 32, "grouping": 16, "minblocks": 2, "algorithm": "medium", "perf": 256.737, "source": "autotuned"},
{"m": 5, "n": 7, "k": 6, "tile_m": 2, "tile_n": 1, "threads": 32, "grouping": 16, "minblocks": 20, "algorithm": "medium", "perf": 291.538, "source": "autotuned"},
{"m": 5, "n": 7, "k": 7, "tile_m": 1, "tile_n": 2, "threads": 32, "grouping": 16, "minblocks": 10, "algorithm": "medium", "perf": 295.189, "source": "autotuned"},
{"m": 5, "n": 7, "k": 8, "tile_m": 2, "tile_n": 1, "threads": 32, "grouping": 13, "minblocks": 25, "algorithm": "medium", "perf": 327.718, "source": "autotuned"},
{"m": 5, "n": 7, "k": 9, "tile_m": 2, "tile_n": 1, "threads": 32, "grouping": 13, "minblocks": 16, "algorithm": "medium", "perf": 349.89, "source": "autotuned"},
{"m": 5, "n": 7, "k": 13, "tile_m": 2, "tile_n": 1, "threads": 32, "grouping": 13, "minblocks": 18, "algorithm": "medium", "perf": 396.99, "source": "autotuned"},
{"m": 5, "n": 7, "k": 25, "tile_m": 1, "tile_n": 1, "threads": 64, "grouping": 26, "minblocks": 10, "algorithm": "medium", "perf": 395.03, "source": "autotuned"},
{"m": 5, "n": 7, "k": 26, "tile_m": 1, "tile_n": 1, "threads": 64, "grouping": 4, "minblocks": 3, "algorithm": "medium", "perf": 400.328, "source": "autotuned"},
{"m": 5, "n": 7, "k": 28, "tile_m": 1, "tile_n": 1, "threads": 64, "grouping": 4, "minblocks": 4, "algorithm": "medium", "perf": 400.111, "source": "autotuned"},
{"m": 5, "n": 7, "k": 32, "tile_m": 1, "tile_n": 1, "threads": 64, "grouping": 4, "minblocks": 4, "algorithm": "medium", "perf": 408.48, "source": "autotuned"},
{"m": 5, "n": 7, "k": 45, "tile_m": 1, "tile_n": 1, "threads": 96, "grouping": 3, "minblocks": 7, "algorithm": "medium", "perf": 402.851, "source": "autotuned"},
{"m": 5, "n": 8, "k": 4, "tile_m": 2, "tile_n": 1, "threads": 32, "grouping": 16, "minblocks": 9, "algorithm": "medium", "perf": 260.853, "source": "autotuned"},
{"m": 5, "n": 8, "k": 5, "tile_m": 2, "tile_n": 1, "threads": 32, "grouping": 16, "minblocks": 20, "algorithm": "medium", "perf": 290.836, "source": "autotuned"},
{"m": 5, "n": 8, "k": 6, "tile_m": 1, "tile_n": 2, "threads": 32, "grouping": 16, "minblocks": 3, "algorithm": "medium", "perf": 332.611, "source": "autotuned"},
{"m": 5, "n": 8, "k": 7, "tile_m": 1, "tile_n": 2, "threads": 32, "grouping": 16, "minblocks": 14, "algorithm": "medium", "perf": 332.852, "source": "autotuned"},
{"m": 5, "n": 8, "k": 8, "tile_m": 2, "tile_n": 1, "threads": 32, "grouping": 13, "minblocks": 14, "algorithm": "medium", "perf": 364.813, "source": "autotuned"},
{"m": 5, "n": 8, "k": 9, "tile_m": 1, "tile_n": 2, "threads": 32, "grouping": 13, "minblocks": 14, "algorithm": "medium", "perf": 383.158, "source": "autotuned"},
{"m": 5, "n": 9, "k": 4, "tile_m": 1, "tile_n": 2, "threads": 32, "grouping": 16, "minblocks": 16, "algorithm": "medium", "perf": 273.232, "source": "autotuned"},
{"m": 5, "n": 9, "k": 5, "tile_m": 2, "tile_n": 1, "threads": 32, "grouping": 16, "minblocks": 7, "algorithm": "medium", "perf": 321.78, "source": "autotuned"},
{"m": 5, "n": 9, "k": 6, "tile_m": 1, "tile_n": 2, "threads": 32, "grouping": 13, "minblocks": 5, "algorithm": "medium", "perf": 370.575, "source": "autotuned"},
{"m": 5, "n": 9, "k": 7, "tile_m": 2, "tile_n": 1, "threads": 32, "grouping": 13, "minblocks": 21, "algorithm": "medium", "perf": 372.988, "source": "autotuned"},
{"m": 5, "n": 9, "k": 8, "tile_m": 1, "tile_n": 2, "threads": 32, "grouping": 13, "minblocks": 2, "algorithm": "medium", "perf": 397.604, "source": "autotuned"},
{"m": 5, "n": 9, "k": 9, "tile_m": 1, "tile_n": 2, "threads": 32, "grouping": 13, "minblocks": 24, "algorithm": "medium", "perf": 420.547, "source": "autotuned"},
{"m": 5, "n": 9, "k": 13, "tile_m": 2, "tile_n": 1, "threads": 32, "grouping": 13, "minblocks": 26, "algorithm": "medium", "perf": 428.436, "source": "autotuned"},
{"m": 5, "n": 9, "k": 25, "tile_m": 1, "tile_n": 1, "threads": 64, "grouping": 26, "minblocks": 7, "algorithm": "medium", "perf": 437.524, "source": "autotuned"},
{"m": 5, "n": 9, "k": 26, "tile_m": 1, "tile_n": 1, "threads": 64, "grouping": 4, "minblocks": 12, "algorithm": "medium", "perf": 442.884, "source": "autotuned"},
{"m": 5, "n": 9, "k": 28, "tile_m": 1, "tile_n": 1, "threads": 64, "grouping": 4, "minblocks": 11, "algorithm": "medium", "perf": 446.122, "source": "autotuned"},
{"m": 5, "n": 9, "k": 32, "tile_m": 1, "tile_n": 1, "threads": 96, "grouping": 4, "minblocks": 2, "algorithm": "medium", "perf": 451.393, "source": "autotuned"},
{"m": 5, "n": 9, "k": 45, "tile_m": 1, "tile_n": 1, "threads": 128, "grouping": 4, "minblocks": 4, "algorithm": "medium", "perf": 448.595, "source": "autotuned"},
{"m": 5, "n": 12, "k": 5, "tile_m": 1, "tile_n": 2, "threads": 32, "grouping": 12, "minblocks": 12, "algorithm": "medium", "perf": 403.762, "source": "autotuned"},
{"m": 5, "n": 12, "k": 12, "tile_m": 1, "tile_n": 2, "threads": 32, "grouping": 13, "minblocks": 2, "algorithm": "medium", "perf": 482.763, "source": "autotuned"},
{"m": 5, "n": 12, "k": 13, "tile_m": 1, "tile_n": 2, "threads": 32, "grouping": 4, "minblocks": 9, "algorithm": "medium", "perf": 472.41, "source": "autotuned"},
{"m": 5, "n": 12, "k": 26, "tile_m": 1, "tile_n": 1, "threads": 64, "grouping": 4, "minblocks": 5, "algorithm": "medium", "perf": 493.318, "source": "autotuned"},
{"m": 5, "n": 12, "k": 32, "tile_m": 1, "tile_n": 1, "threads": 96, "grouping": 3, "minblocks": 2, "algorithm": "medium", "perf": 499.203, "source": "autotuned"},
{"m": 5, "n": 13, "k": 4, "tile_m": 3, "tile_n": 1, "threads": 32, "grouping": 13, "minblocks": 14, "algorithm": "medium", "perf": 371.523, "source": "autotuned"},
{"m": 5, "n": 13, "k": 5, "tile_m": 3, "tile_n": 1, "threads": 32, "grouping": 12, "minblocks": 3, "algorithm": "medium", "perf": 420.528, "source": "autotuned"},
{"m": 5, "n": 13, "k": 7, "tile_m": 3, "tile_n": 1, "threads": 32, "grouping": 13, "minblocks": 15, "algorithm": "medium", "perf": 463.048, "source": "autotuned"},
{"m": 5, "n": 13, "k": 9, "tile_m": 3, "tile_n": 1, "threads": 32, "grouping": 16, "minblocks": 15, "algorithm": "medium", "perf": 476.293, "source": "autotuned"},
{"m": 5, "n": 13, "k": 12, "tile_m": 1, "tile_n": 3, "threads": 64, "grouping": 22, "minblocks": 17, "algorithm": "medium", "perf": 487.729, "source": "autotuned"},
{"m": 5, "n": 13, "k": 13, "tile_m": 1, "tile_n": 3, "threads": 32, "grouping": 5, "minblocks": 1, "algorithm": "medium", "perf": 469.163, "source": "autotuned"},
{"m": 5, "n": 13, "k": 16, "tile_m": 1, "tile_n": 3, "threads": 96, "grouping": 29, "minblocks": 8, "algorithm": "medium", "perf": 486.36, "source": "autotuned"},
{"m": 5, "n": 13, "k": 24, "tile_m": 3, "tile_n": 1, "threads": 64, "grouping": 3, "minblocks": 4, "algorithm": "medium", "perf": 491.279, "source": "autotuned"},
{"m": 5, "n": 13, "k": 25, "tile_m": 1, "tile_n": 1, "threads": 128, "grouping": 5, "minblocks": 12, "algorithm": "medium", "perf": 485.413, "source": "autotuned"},
{"m": 5, "n": 13, "k": 26, "tile_m": 3, "tile_n": 1, "threads": 64, "grouping": 4, "minblocks": 5, "algorithm": "medium", "perf": 487.003, "source": "autotuned"},
{"m": 5, "n": 13, "k": 28, "tile_m": 1, "tile_n": 1, "threads": 96, "grouping": 4, "minblocks": 8, "algorithm": "medium", "perf": 491.337, "source": "autotuned"},
{"m": 5, "n": 13, "k": 32, "tile_m": 1, "tile_n": 1, "threads": 128, "grouping": 5, "minblocks": 2, "algorithm": "medium", "perf": 504.563, "source": "autotuned"},
{"m": 5, "n": 13, "k": 45, "tile_m": 1, "tile_n": 1, "threads": 128, "grouping": 3, "minblocks": 3, "algorithm": "medium", "perf": 499.154, "source": "autotuned"},
{"m": 5, "n": 16, "k": 5, "tile_m": 3, "tile_n": 1, "threads": 32, "grouping": 11, "minblocks": 16, "algorithm": "medium", "perf": 500.621, "source": "autotuned"},
{"m": 5, "n": 16, "k": 13, "tile_m": 1, "tile_n": 3, "threads": 64, "grouping": 4, "minblocks": 20, "algorithm": "medium", "perf": 504.808, "source": "autotuned"},
{"m": 5, "n": 16, "k": 16, "tile_m": 1, "tile_n": 1, "threads": 96, "grouping": 6, "minblocks": 14, "algorithm": "medium", "perf": 518.964, "source": "autotuned"},
{"m": 5, "n": 16, "k": 32, "tile_m": 1, "tile_n": 1, "threads": 128, "grouping": 4, "minblocks": 1, "algorithm": "medium", "perf": 532.529, "source": "autotuned"},
{"m": 5, "n": 24, "k": 5, "tile_m": 1, "tile_n": 4, "threads": 32, "grouping": 13, "minblocks": 19, "algorithm": "medium", "perf": 529.873, "source": "autotuned"},
{"m": 5, "n": 24, "k": 13, "tile_m": 1, "tile_n": 2, "threads": 96, "grouping": 32, "minblocks": 12, "algorithm": "medium", "perf": 547.828, "source": "autotuned"},
{"m": 5, "n": 24, "k": 24, "tile_m": 1, "tile_n": 2, "w": 8, "v": 24, "threads": 64, "grouping": 16, "minblocks": 4, "algorithm": "largeDB2", "perf": 573.313, "source": "autotuned"},
{"m": 5, "n": 24, "k": 26, "tile_m": 1, "tile_n": 2, "threads": 160, "grouping": 3, "minblocks": 8, "algorithm": "medium", "perf": 570.406, "source": "autotuned"},
{"m": 5, "n": 24, "k": 32, "tile_m": 1, "tile_n": 1, "threads": 192, "grouping": 2, "minblocks": 5, "algorithm": "medium", "perf": 579.512, "source": "autotuned"},
{"m": 5, "n": 25, "k": 4, "tile_m": 5, "tile_n": 1, "threads": 32, "grouping": 13, "minblocks": 1, "algorithm": "medium", "perf": 498.541, "source": "autotuned"},
{"m": 5, "n": 25, "k": 5, "tile_m": 6, "tile_n": 1, "threads": 32, "grouping": 15, "minblocks": 8, "algorithm": "medium", "perf": 512.665, "source": "autotuned"},
{"m": 5, "n": 25, "k": 7, "tile_m": 4, "tile_n": 1, "threads": 64, "grouping": 22, "minblocks": 3, "algorithm": "medium", "perf": 511.578, "source": "autotuned"},
{"m": 5, "n": 25, "k": 9, "tile_m": 3, "tile_n": 1, "threads": 64, "grouping": 26, "minblocks": 10, "algorithm": "medium", "perf": 542.861, "source": "autotuned"},
{"m": 5, "n": 25, "k": 13, "tile_m": 1, "tile_n": 1, "threads": 128, "grouping": 6, "minblocks": 12, "algorithm": "medium", "perf": 540.652, "source": "autotuned"},
{"m": 5, "n": 25, "k": 25, "tile_m": 1, "tile_n": 1, "threads": 128, "grouping": 3, "minblocks": 5, "algorithm": "medium", "perf": 567.148, "source": "autotuned"},
{"m": 5, "n": 25, "k": 26, "tile_m": 1, "tile_n": 1, "threads": 160, "grouping": 5, "minblocks": 1, "algorithm": "medium", "perf": 571.256, "source": "autotuned"},
{"m": 5, "n": 25, "k": 28, "tile_m": 1, "tile_n": 1, "threads": 192, "grouping": 4, "minblocks": 7, "algorithm": "medium", "perf": 571.421, "source": "autotuned"},
{"m": 5, "n": 25, "k": 32, "tile_m": 1, "tile_n": 1, "threads": 224, "grouping": 3, "minblocks": 6, "algorithm": "medium", "perf": 584.779, "source": "autotuned"},
{"m": 5, "n": 25, "k": 45, "tile_m": 1, "tile_n": 1, "threads": 256, "grouping": 3, "minblocks": 2, "algorithm": "medium", "perf": 583.507, "source": "autotuned"},
{"m": 5, "n": 26, "k": 4, "tile_m": 5, "tile_n": 1, "threads": 32, "grouping": 13, "minblocks": 11, "algorithm": "medium", "perf": 507.889, "source": "autotuned"},
{"m": 5, "n": 26, "k": 5, "tile_m": 5, "tile_n": 1, "threads": 32, "grouping": 16, "minblocks": 1, "algorithm": "medium", "perf": 520.031, "source": "autotuned"},
{"m": 5, "n": 26, "k": 7, "tile_m": 3, "tile_n": 1, "threads": 64, "grouping": 22, "minblocks": 15, "algorithm": "medium", "perf": 521.285, "source": "autotuned"},
{"m": 5, "n": 26, "k": 9, "tile_m": 3, "tile_n": 1, "threads": 64, "grouping": 26, "minblocks": 9, "algorithm": "medium", "perf": 549.571, "source": "autotuned"},
{"m": 5, "n": 26, "k": 12, "tile_m": 3, "tile_n": 1, "threads": 64, "grouping": 32, "minblocks": 2, "algorithm": "medium", "perf": 554.52, "source": "autotuned"},
{"m": 5, "n": 26, "k": 13, "tile_m": 1, "tile_n": 3, "threads": 96, "grouping": 32, "minblocks": 12, "algorithm": "medium", "perf": 549.535, "source": "autotuned"},
{"m": 5, "n": 26, "k": 24, "tile_m": 1, "tile_n": 2, "threads": 128, "grouping": 4, "minblocks": 6, "algorithm": "medium", "perf": 571.163, "source": "autotuned"},
{"m": 5, "n": 26, "k": 25, "tile_m": 1, "tile_n": 2, "threads": 128, "grouping": 4, "minblocks": 7, "algorithm": "medium", "perf": 568.459, "source": "autotuned"},
{"m": 5, "n": 26, "k": 26, "tile_m": 1, "tile_n": 2, "threads": 160, "grouping": 4, "minblocks": 2, "algorithm": "medium", "perf": 572.317, "source": "autotuned"},
{"m": 5, "n": 26, "k": 28, "tile_m": 1, "tile_n": 2, "threads": 160, "grouping": 5, "minblocks": 7, "algorithm": "medium", "perf": 573.92, "source": "autotuned"},
{"m": 5, "n": 26, "k": 32, "tile_m": 1, "tile_n": 2, "threads": 224, "grouping": 3, "minblocks": 6, "algorithm": "medium", "perf": 584.452, "source": "autotuned"},
{"m": 5, "n": 26, "k": 45, "tile_m": 1, "tile_n": 1, "threads": 256, "grouping": 3, "minblocks": 4, "algorithm": "medium", "perf": 587.258, "source": "autotuned"},
{"m": 5, "n": 28, "k": 4, "tile_m": 1, "tile_n": 5, "threads": 32, "grouping": 16, "minblocks": 21, "algorithm": "medium", "perf": 507.593, "source": "autotuned"},
{"m": 5, "n": 28, "k": 5, "tile_m": 5, "tile_n": 1, "threads": 32, "grouping": 19, "minblocks": 10, "algorithm": "medium", "perf": 526.317, "source": "autotuned"},
{"m": 5, "n": 28, "k": 7, "tile_m": 3, "tile_n": 1, "threads": 64, "grouping": 26, "minblocks": 13, "algorithm": "medium", "perf": 538.63, "source": "autotuned"},
{"m": 5, "n": 28, "k": 9, "tile_m": 3, "tile_n": 1, "threads": 64, "grouping": 26, "minblocks": 2, "algorithm": "medium", "perf": 561.006, "source": "autotuned"},
{"m": 5, "n": 28, "k": 13, "tile_m": 1, "tile_n": 3, "threads": 96, "grouping": 32, "minblocks": 11, "algorithm": "medium", "perf": 561.153, "source": "autotuned"},
{"m": 5, "n": 28, "k": 25, "tile_m": 3, "tile_n": 1, "threads": 128, "grouping": 4, "minblocks": 6, "algorithm": "medium", "perf": 577.262, "source": "autotuned"},
{"m": 5, "n": 28, "k": 26, "tile_m": 1, "tile_n": 1, "threads": 160, "grouping": 4, "minblocks": 5, "algorithm": "medium", "perf": 578.939, "source": "autotuned"},
{"m": 5, "n": 28, "k": 28, "tile_m": 2, "tile_n": 1, "threads": 160, "grouping": 4, "minblocks": 5, "algorithm": "medium", "perf": 581.324, "source": "autotuned"},
{"m": 5, "n": 28, "k": 32, "tile_m": 3, "tile_n": 1, "threads": 128, "grouping": 3, "minblocks": 2, "algorithm": "medium", "perf": 589.399, "source": "autotuned"},
{"m": 5, "n": 28, "k": 45, "tile_m": 1, "tile_n": 1, "threads": 256, "grouping": 3, "minblocks": 3, "algorithm": "medium", "perf": 595.274, "source": "autotuned"},
{"m": 5, "n": 32, "k": 4, "tile_m": 6, "tile_n": 1, "threads": 32, "grouping": 16, "minblocks": 20, "algorithm": "medium", "perf": 523.602, "source": "autotuned"},
{"m": 5, "n": 32, "k": 5, "tile_m": 6, "tile_n": 1, "threads": 32, "grouping": 16, "minblocks": 15, "algorithm": "medium", "perf": 535.714, "source": "autotuned"},
{"m": 5, "n": 32, "k": 7, "tile_m": 3, "tile_n": 1, "threads": 64, "grouping": 26, "minblocks": 4, "algorithm": "medium", "perf": 554.629, "source": "autotuned"},
{"m": 5, "n": 32, "k": 9, "tile_m": 3, "tile_n": 1, "threads": 64, "grouping": 30, "minblocks": 1, "algorithm": "medium", "perf": 565.992, "source": "autotuned"},
{"m": 5, "n": 32, "k": 12, "tile_m": 2, "tile_n": 1, "threads": 96, "grouping": 32, "minblocks": 10, "algorithm": "medium", "perf": 574.485, "source": "autotuned"},
{"m": 5, "n": 32, "k": 13, "tile_m": 1, "tile_n": 3, "threads": 96, "grouping": 32, "minblocks": 10, "algorithm": "medium", "perf": 572.183, "source": "autotuned"},
{"m": 5, "n": 32, "k": 16, "tile_m": 2, "tile_n": 1, "threads": 128, "grouping": 5, "minblocks": 4, "algorithm": "medium", "perf": 583.958, "source": "autotuned"},
{"m": 5, "n": 32, "k": 24, "tile_m": 2, "tile_n": 1, "threads": 160, "grouping": 4, "minblocks": 4, "algorithm": "medium", "perf": 593.51, "source": "autotuned"},
{"m": 5, "n": 32, "k": 25, "tile_m": 3, "tile_n": 1, "threads": 128, "grouping": 5, "minblocks": 1, "algorithm": "medium", "perf": 593.335, "source": "autotuned"},
{"m": 5, "n": 32, "k": 26, "tile_m": 1, "tile_n": 1, "threads": 256, "grouping": 4, "minblocks": 6, "algorithm": "medium", "perf": 593.116, "source": "autotuned"},
{"m": 5, "n": 32, "k": 28, "tile_m": 3, "tile_n": 1, "threads": 128, "grouping": 4, "minblocks": 3, "algorithm": "medium", "perf": 596.857, "source": "autotuned"},
{"m": 5, "n": 32, "k": 32, "tile_m": 1, "tile_n": 1, "threads": 256, "grouping": 4, "minblocks": 5, "algorithm": "medium", "perf": 610.053, "source": "autotuned"},
{"m": 5, "n": 32, "k": 45, "tile_m": 1, "tile_n": 1, "threads": 256, "grouping": 3, "minblocks": 2, "algorithm": "medium", "perf": 612.697, "source": "autotuned"},
{"m": 5, "n": 45, "k": 4, "tile_m": 5, "tile_n": 1, "threads": 64, "grouping": 22, "minblocks": 15, "algorithm": "medium", "perf": 510.03, "source": "autotuned"},
{"m": 5, "n": 45, "k": 5, "tile_m": 1, "tile_n": 4, "threads": 64, "grouping": 26, "minblocks": 15, "algorithm": "medium", "perf": 528.041, "source": "autotuned"},
{"m": 5, "n": 45, "k": 7, "tile_m": 1, "tile_n": 4, "threads": 64, "grouping": 26, "minblocks": 4, "algorithm": "medium", "perf": 553.915, "source": "autotuned"},
{"m": 5, "n": 45, "k": 9, "tile_m": 3, "tile_n": 1, "threads": 96, "grouping": 29, "minblocks": 3, "algorithm": "medium", "perf": 564.82, "source": "autotuned"},
{"m": 5, "n": 45, "k": 13, "tile_m": 1, "tile_n": 2, "threads": 128, "grouping": 5, "minblocks": 8, "algorithm": "medium", "perf": 579.618, "source": "autotuned"},
{"m": 5, "n": 45, "k": 25, "tile_m": 3, "tile_n": 1, "threads": 128, "grouping": 4, "minblocks": 2, "algorithm": "medium", "perf": 612.003, "source": "autotuned"},
{"m": 5, "n": 45, "k": 26, "tile_m": 1, "tile_n": 2, "threads": 192, "grouping": 3, "minblocks": 4, "algorithm": "medium", "perf": 612.137, "source": "autotuned"},
{"m": 5, "n": 45, "k": 28, "tile_m": 3, "tile_n": 1, "threads": 160, "grouping": 3, "minblocks": 1, "algorithm": "medium", "perf": 623.505, "source": "autotuned"},
{"m": 5, "n": 45, "k": 32, "tile_m": 3, "tile_n": 1, "threads": 192, "grouping": 4, "minblocks": 2, "algorithm": "medium", "perf": 630.854, "source": "autotuned"},
{"m": 5, "n": 45, "k": 45, "tile_m": 1, "tile_n": 1, "threads": 256, "grouping": 3, "minblocks": 1, "algorithm": "medium", "perf": 635.739, "source": "autotuned"},
{"m": 6, "n": 4, "k": 4, "tile_m": 1, "tile_n": 1, "threads": 32, "grouping": 18, "minblocks": 3, "algorithm": "medium", "perf": 212.84, "source": "autotuned"},
{"m": 6, "n": 4, "k": 5, "tile_m": 1, "tile_n": 1, "threads": 32, "grouping": 16, "minblocks": 25, "algorithm": "medium", "perf": 250.003, "source": "autotuned"},
{"m": 6, "n": 4, "k": 6, "tile_m": 1, "tile_n": 1, "threads": 32, "grouping": 16, "minblocks": 24, "algorithm": "medium", "perf": 227.238, "source": "autotuned"},
{"m": 6, "n": 4, "k": 7, "tile_m": 1, "tile_n": 1, "threads": 32, "grouping": 16, "minblocks": 5, "algorithm": "medium", "perf": 253.726, "source": "autotuned"},
{"m": 6, "n": 4, "k": 8, "tile_m": 1, "tile_n": 1, "threads": 32, "grouping": 16, "minblocks": 13, "algorithm": "medium", "perf": 260.467, "source": "autotuned"},
{"m": 6, "n": 4, "k": 9, "tile_m": 1, "tile_n": 1, "threads": 32, "grouping": 13, "minblocks": 12, "algorithm": "medium", "perf": 268.788, "source": "autotuned"},
{"m": 6, "n": 5, "k": 4, "tile_m": 1, "tile_n": 1, "threads": 32, "grouping": 18, "minblocks": 25, "algorithm": "medium", "perf": 265.113, "source": "autotuned"},
{"m": 6, "n": 5, "k": 5, "tile_m": 1, "tile_n": 1, "threads": 32, "grouping": 16, "minblocks": 4, "algorithm": "medium", "perf": 292.379, "source": "autotuned"},
{"m": 6, "n": 5, "k": 6, "tile_m": 1, "tile_n": 1, "threads": 32, "grouping": 16, "minblocks": 20, "algorithm": "medium", "perf": 278.719, "source": "autotuned"},
{"m": 6, "n": 5, "k": 7, "tile_m": 1, "tile_n": 1, "threads": 32, "grouping": 16, "minblocks": 13, "algorithm": "medium", "perf": 273.867, "source": "autotuned"},
{"m": 6, "n": 5, "k": 8, "tile_m": 1, "tile_n": 1, "threads": 32, "grouping": 13, "minblocks": 13, "algorithm": "medium", "perf": 306.256, "source": "autotuned"},
{"m": 6, "n": 5, "k": 9, "tile_m": 1, "tile_n": 1, "threads": 32, "grouping": 12, "minblocks": 2, "algorithm": "medium", "perf": 330.458, "source": "autotuned"},
{"m": 6, "n": 6, "k": 4, "tile_m": 1, "tile_n": 2, "threads": 32, "grouping": 16, "minblocks": 20, "algorithm": "medium", "perf": 279.038, "source": "autotuned"},
{"m": 6, "n": 6, "k": 5, "tile_m": 1, "tile_n": 2, "threads": 32, "grouping": 13, "minblocks": 13, "algorithm": "medium", "perf": 324.604, "source": "autotuned"},
{"m": 6, "n": 6, "k": 6, "tile_m": 2, "tile_n": 1, "threads": 32, "grouping": 13, "minblocks": 26, "algorithm": "medium", "perf": 309.661, "source": "autotuned"},
{"m": 6, "n": 6, "k": 7, "tile_m": 2, "tile_n": 1, "threads": 32, "grouping": 13, "minblocks": 11, "algorithm": "medium", "perf": 347.979, "source": "autotuned"},
{"m": 6, "n": 6, "k": 8, "tile_m": 1, "tile_n": 2, "threads": 32, "grouping": 13, "minblocks": 4, "algorithm": "medium", "perf": 388.615, "source": "autotuned"},
{"m": 6, "n": 6, "k": 9, "tile_m": 1, "tile_n": 2, "threads": 32, "grouping": 11, "minblocks": 15, "algorithm": "medium", "perf": 414.229, "source": "autotuned"},
{"m": 6, "n": 7, "k": 4, "tile_m": 1, "tile_n": 2, "threads": 32, "grouping": 16, "minblocks": 22, "algorithm": "medium", "perf": 310.207, "source": "autotuned"},
{"m": 6, "n": 7, "k": 5, "tile_m": 1, "tile_n": 2, "threads": 32, "grouping": 16, "minblocks": 2, "algorithm": "medium", "perf": 307.915, "source": "autotuned"},
{"m": 6, "n": 7, "k": 6, "tile_m": 1, "tile_n": 2, "threads": 32, "grouping": 13, "minblocks": 27, "algorithm": "medium", "perf": 311.923, "source": "autotuned"},
{"m": 6, "n": 7, "k": 7, "tile_m": 2, "tile_n": 1, "threads": 32, "grouping": 13, "minblocks": 18, "algorithm": "medium", "perf": 348.666, "source": "autotuned"},
{"m": 6, "n": 7, "k": 8, "tile_m": 2, "tile_n": 1, "threads": 32, "grouping": 13, "minblocks": 3, "algorithm": "medium", "perf": 391.768, "source": "autotuned"},
{"m": 6, "n": 7, "k": 9, "tile_m": 1, "tile_n": 2, "threads": 32, "grouping": 13, "minblocks": 16, "algorithm": "medium", "perf": 421.422, "source": "autotuned"},
{"m": 6, "n": 8, "k": 4, "tile_m": 2, "tile_n": 1, "threads": 32, "grouping": 16, "minblocks": 13, "algorithm": "medium", "perf": 306.933, "source": "autotuned"},
{"m": 6, "n": 8, "k": 5, "tile_m": 1, "tile_n": 2, "threads": 32, "grouping": 16, "minblocks": 27, "algorithm": "medium", "perf": 346.794, "source": "autotuned"},
{"m": 6, "n": 8, "k": 6, "tile_m": 1, "tile_n": 2, "threads": 32, "grouping": 13, "minblocks": 2, "algorithm": "medium", "perf": 356.722, "source": "autotuned"},
{"m": 6, "n": 8, "k": 7, "tile_m": 1, "tile_n": 2, "threads": 32, "grouping": 13, "minblocks": 1, "algorithm": "medium", "perf": 397.923, "source": "autotuned"},
{"m": 6, "n": 8, "k": 8, "tile_m": 2, "tile_n": 1, "threads": 32, "grouping": 13, "minblocks": 2, "algorithm": "medium", "perf": 434.94, "source": "autotuned"},
{"m": 6, "n": 8, "k": 9, "tile_m": 1, "tile_n": 2, "threads": 32, "grouping": 13, "minblocks": 19, "algorithm": "medium", "perf": 449.288, "source": "autotuned"},
{"m": 6, "n": 9, "k": 4, "tile_m": 1, "tile_n": 2, "threads": 32, "grouping": 16, "minblocks": 26, "algorithm": "medium", "perf": 326.343, "source": "autotuned"},
{"m": 6, "n": 9, "k": 5, "tile_m": 1, "tile_n": 2, "threads": 32, "grouping": 13, "minblocks": 17, "algorithm": "medium", "perf": 387.121, "source": "autotuned"},
{"m": 6, "n": 9, "k": 6, "tile_m": 1, "tile_n": 2, "threads": 32, "grouping": 12, "minblocks": 13, "algorithm": "medium", "perf": 390.83, "source": "autotuned"},
{"m": 6, "n": 9, "k": 7, "tile_m": 1, "tile_n": 2, "threads": 32, "grouping": 13, "minblocks": 4, "algorithm": "medium", "perf": 440.029, "source": "autotuned"},
{"m": 6, "n": 9, "k": 8, "tile_m": 1, "tile_n": 2, "threads": 32, "grouping": 13, "minblocks": 27, "algorithm": "medium", "perf": 468.53, "source": "autotuned"},
{"m": 6, "n": 9, "k": 9, "tile_m": 1, "tile_n": 2, "threads": 32, "grouping": 13, "minblocks": 13, "algorithm": "medium", "perf": 476.022, "source": "autotuned"},
{"m": 7, "n": 4, "k": 4, "tile_m": 1, "tile_n": 1, "threads": 32, "grouping": 18, "minblocks": 9, "algorithm": "medium", "perf": 247.91, "source": "autotuned"},
{"m": 7, "n": 4, "k": 5, "tile_m": 1, "tile_n": 1, "threads": 32, "grouping": 16, "minblocks": 11, "algorithm": "medium", "perf": 222.094, "source": "autotuned"},
{"m": 7, "n": 4, "k": 6, "tile_m": 1, "tile_n": 1, "threads": 32, "grouping": 16, "minblocks": 3, "algorithm": "medium", "perf": 256.908, "source": "autotuned"},
{"m": 7, "n": 4, "k": 7, "tile_m": 1, "tile_n": 1, "threads": 32, "grouping": 16, "minblocks": 20, "algorithm": "medium", "perf": 286.148, "source": "autotuned"},
{"m": 7, "n": 4, "k": 8, "tile_m": 1, "tile_n": 1, "threads": 32, "grouping": 16, "minblocks": 15, "algorithm": "medium", "perf": 296.218, "source": "autotuned"},
{"m": 7, "n": 4, "k": 9, "tile_m": 1, "tile_n": 1, "threads": 32, "grouping": 13, "minblocks": 8, "algorithm": "medium", "perf": 306.346, "source": "autotuned"},
{"m": 7, "n": 4, "k": 13, "tile_m": 1, "tile_n": 1, "threads": 32, "grouping": 12, "minblocks": 25, "algorithm": "medium", "perf": 361.319, "source": "autotuned"},
{"m": 7, "n": 4, "k": 25, "tile_m": 1, "tile_n": 1, "threads": 64, "grouping": 4, "minblocks": 21, "algorithm": "medium", "perf": 356.58, "source": "autotuned"},
{"m": 7, "n": 4, "k": 26, "tile_m": 1, "tile_n": 1, "threads": 64, "grouping": 4, "minblocks": 21, "algorithm": "medium", "perf": 362.674, "source": "autotuned"},
{"m": 7, "n": 4, "k": 28, "tile_m": 1, "tile_n": 1, "threads": 64, "grouping": 6, "minblocks": 5, "algorithm": "medium", "perf": 363.829, "source": "autotuned"},
{"m": 7, "n": 4, "k": 32, "tile_m": 1, "tile_n": 1, "threads": 64, "grouping": 3, "minblocks": 8, "algorithm": "medium", "perf": 371.107, "source": "autotuned"},
{"m": 7, "n": 4, "k": 45, "tile_m": 1, "tile_n": 1, "threads": 64, "grouping": 4, "minblocks": 9, "algorithm": "medium", "perf": 363.482, "source": "autotuned"},
{"m": 7, "n": 5, "k": 4, "tile_m": 2, "tile_n": 1, "threads": 32, "grouping": 16, "minblocks": 19, "algorithm": "medium", "perf": 270.919, "source": "autotuned"},
{"m": 7, "n": 5, "k": 5, "tile_m": 2, "tile_n": 1, "threads": 32, "grouping": 16, "minblocks": 27, "algorithm": "medium", "perf": 263.9, "source": "autotuned"},
{"m": 7, "n": 5, "k": 6, "tile_m": 2, "tile_n": 1, "threads": 32, "grouping": 16, "minblocks": 23, "algorithm": "medium", "perf": 304.548, "source": "autotuned"},
{"m": 7, "n": 5, "k": 7, "tile_m": 2, "tile_n": 1, "threads": 32, "grouping": 16, "minblocks": 20, "algorithm": "medium", "perf": 302.41, "source": "autotuned"},
{"m": 7, "n": 5, "k": 8, "tile_m": 2, "tile_n": 1, "threads": 32, "grouping": 16, "minblocks": 14, "algorithm": "medium", "perf": 332.161, "source": "autotuned"},
{"m": 7, "n": 5, "k": 9, "tile_m": 2, "tile_n": 1, "threads": 32, "grouping": 13, "minblocks": 25, "algorithm": "medium", "perf": 349.89, "source": "autotuned"},
{"m": 7, "n": 5, "k": 13, "tile_m": 2, "tile_n": 1, "threads": 32, "grouping": 13, "minblocks": 21, "algorithm": "medium", "perf": 397.427, "source": "autotuned"},
{"m": 7, "n": 5, "k": 25, "tile_m": 2, "tile_n": 1, "threads": 64, "grouping": 4, "minblocks": 20, "algorithm": "medium", "perf": 400.125, "source": "autotuned"},
{"m": 7, "n": 5, "k": 26, "tile_m": 1, "tile_n": 1, "threads": 64, "grouping": 4, "minblocks": 12, "algorithm": "medium", "perf": 397.999, "source": "autotuned"},
{"m": 7, "n": 5, "k": 28, "tile_m": 2, "tile_n": 1, "threads": 64, "grouping": 4, "minblocks": 7, "algorithm": "medium", "perf": 402.797, "source": "autotuned"},
{"m": 7, "n": 5, "k": 32, "tile_m": 1, "tile_n": 1, "threads": 64, "grouping": 3, "minblocks": 11, "algorithm": "medium", "perf": 409.525, "source": "autotuned"},
{"m": 7, "n": 5, "k": 45, "tile_m": 1, "tile_n": 1, "threads": 96, "grouping": 3, "minblocks": 5, "algorithm": "medium", "perf": 401.97, "source": "autotuned"},
{"m": 7, "n": 6, "k": 4, "tile_m": 2, "tile_n": 1, "threads": 32, "grouping": 16, "minblocks": 24, "algorithm": "medium", "perf": 313.286, "source": "autotuned"},
{"m": 7, "n": 6, "k": 5, "tile_m": 2, "tile_n": 1, "threads": 32, "grouping": 16, "minblocks": 19, "algorithm": "medium", "perf": 312.621, "source": "autotuned"},
{"m": 7, "n": 6, "k": 6, "tile_m": 2, "tile_n": 1, "threads": 32, "grouping": 16, "minblocks": 3, "algorithm": "medium", "perf": 321.111, "source": "autotuned"},
{"m": 7, "n": 6, "k": 7, "tile_m": 2, "tile_n": 1, "threads": 32, "grouping": 16, "minblocks": 12, "algorithm": "medium", "perf": 350.795, "source": "autotuned"},
{"m": 7, "n": 6, "k": 8, "tile_m": 2, "tile_n": 1, "threads": 32, "grouping": 13, "minblocks": 13, "algorithm": "medium", "perf": 385.441, "source": "autotuned"},
{"m": 7, "n": 6, "k": 9, "tile_m": 2, "tile_n": 1, "threads": 32, "grouping": 13, "minblocks": 15, "algorithm": "medium", "perf": 418.272, "source": "autotuned"},
{"m": 7, "n": 7, "k": 4, "tile_m": 2, "tile_n": 1, "threads": 32, "grouping": 13, "minblocks": 1, "algorithm": "medium", "perf": 364.566, "source": "autotuned"},
{"m": 7, "n": 7, "k": 5, "tile_m": 2, "tile_n": 1, "threads": 32, "grouping": 13, "minblocks": 11, "algorithm": "medium", "perf": 358.669, "source": "autotuned"},
{"m": 7, "n": 7, "k": 6, "tile_m": 1, "tile_n": 2, "threads": 32, "grouping": 13, "minblocks": 3, "algorithm": "medium", "perf": 406.525, "source": "autotuned"},
{"m": 7, "n": 7, "k": 7, "tile_m": 2, "tile_n": 1, "threads": 32, "grouping": 11, "minblocks": 27, "algorithm": "medium", "perf": 449.927, "source": "autotuned"},
{"m": 7, "n": 7, "k": 8, "tile_m": 2, "tile_n": 1, "threads": 32, "grouping": 11, "minblocks": 12, "algorithm": "medium", "perf": 495.144, "source": "autotuned"},
{"m": 7, "n": 7, "k": 9, "tile_m": 1, "tile_n": 2, "threads": 32, "grouping": 13, "minblocks": 5, "algorithm": "medium", "perf": 495.72, "source": "autotuned"},
{"m": 7, "n": 7, "k": 13, "tile_m": 2, "tile_n": 1, "threads": 32, "grouping": 18, "minblocks": 27, "algorithm": "medium", "perf": 488.334, "source": "autotuned"},
{"m": 7, "n": 7, "k": 25, "tile_m": 2, "tile_n": 1, "threads": 64, "grouping": 4, "minblocks": 10, "algorithm": "medium", "perf": 489.312, "source": "autotuned"},
{"m": 7, "n": 7, "k": 26, "tile_m": 2, "tile_n": 1, "threads": 64, "grouping": 4, "minblocks": 1, "algorithm": "medium", "perf": 490.132, "source": "autotuned"},
{"m": 7, "n": 7, "k": 28, "tile_m": 2, "tile_n": 1, "threads": 64, "grouping": 4, "minblocks": 9, "algorithm": "medium", "perf": 490.192, "source": "autotuned"},
{"m": 7, "n": 7, "k": 32, "tile_m": 1, "tile_n": 1, "threads": 128, "grouping": 4, "minblocks": 11, "algorithm": "medium", "perf": 499.565, "source": "autotuned"},
{"m": 7, "n": 7, "k": 45, "tile_m": 1, "tile_n": 1, "threads": 160, "grouping": 3, "minblocks": 7, "algorithm": "medium", "perf": 491.99, "source": "autotuned"},
{"m": 7, "n": 8, "k": 4, "tile_m": 2, "tile_n": 1, "threads": 32, "grouping": 16, "minblocks": 12, "algorithm": "medium", "perf": 354.633, "source": "autotuned"},
{"m": 7, "n": 8, "k": 5, "tile_m": 2, "tile_n": 1, "threads": 32, "grouping": 16, "minblocks": 9, "algorithm": "medium", "perf": 359.16, "source": "autotuned"},
{"m": 7, "n": 8, "k": 6, "tile_m": 2, "tile_n": 1, "threads": 32, "grouping": 16, "minblocks": 19, "algorithm": "medium", "perf": 411.24, "source": "autotuned"},
{"m": 7, "n": 8, "k": 7, "tile_m": 2, "tile_n": 1, "threads": 32, "grouping": 13, "minblocks": 18, "algorithm": "medium", "perf": 455.7, "source": "autotuned"},
{"m": 7, "n": 8, "k": 8, "tile_m": 2, "tile_n": 1, "threads": 32, "grouping": 13, "minblocks": 23, "algorithm": "medium", "perf": 500.053, "source": "autotuned"},
{"m": 7, "n": 8, "k": 9, "tile_m": 1, "tile_n": 2, "threads": 32, "grouping": 11, "minblocks": 3, "algorithm": "medium", "perf": 501.545, "source": "autotuned"},
{"m": 7, "n": 9, "k": 4, "tile_m": 3, "tile_n": 1, "threads": 32, "grouping": 16, "minblocks": 25, "algorithm": "medium", "perf": 357.248, "source": "autotuned"},
{"m": 7, "n": 9, "k": 5, "tile_m": 3, "tile_n": 1, "threads": 32, "grouping": 16, "minblocks": 5, "algorithm": "medium", "perf": 380.106, "source": "autotuned"},
{"m": 7, "n": 9, "k": 6, "tile_m": 1, "tile_n": 3, "threads": 32, "grouping": 13, "minblocks": 1, "algorithm": "medium", "perf": 421.294, "source": "autotuned"},
{"m": 7, "n": 9, "k": 7, "tile_m": 3, "tile_n": 1, "threads": 32, "grouping": 13, "minblocks": 26, "algorithm": "medium", "perf": 474.232, "source": "autotuned"},
{"m": 7, "n": 9, "k": 8, "tile_m": 3, "tile_n": 1, "threads": 32, "grouping": 13, "minblocks": 25, "algorithm": "medium", "perf": 498.036, "source": "autotuned"},
{"m": 7, "n": 9, "k": 9, "tile_m": 1, "tile_n": 3, "threads": 32, "grouping": 13, "minblocks": 19, "algorithm": "medium", "perf": 512.04, "source": "autotuned"},
{"m": 7, "n": 9, "k": 13, "tile_m": 1, "tile_n": 1, "threads": 64, "grouping": 5, "minblocks": 22, "algorithm": "medium", "perf": 509.15, "source": "autotuned"},
{"m": 7, "n": 9, "k": 25, "tile_m": 1, "tile_n": 1, "threads": 64, "grouping": 4, "minblocks": 9, "algorithm": "medium", "perf": 538.393, "source": "autotuned"},
{"m": 7, "n": 9, "k": 26, "tile_m": 1, "tile_n": 1, "threads": 64, "grouping": 32, "minblocks": 2, "algorithm": "medium", "perf": 539.44, "source": "autotuned"},
{"m": 7, "n": 9, "k": 28, "tile_m": 1, "tile_n": 1, "w": 14, "v": 8, "threads": 64, "grouping": 16, "minblocks": 8, "algorithm": "largeDB2", "perf": 544.807, "source": "autotuned"},
{"m": 7, "n": 9, "k": 32, "tile_m": 1, "tile_n": 1, "threads": 64, "grouping": 3, "minblocks": 10, "algorithm": "medium", "perf": 550.841, "source": "autotuned"},
{"m": 7, "n": 9, "k": 45, "tile_m": 1, "tile_n": 1, "threads": 128, "grouping": 3, "minblocks": 8, "algorithm": "medium", "perf": 548.66, "source": "autotuned"},
{"m": 7, "n": 13, "k": 4, "tile_m": 4, "tile_n": 1, "threads": 32, "grouping": 15, "minblocks": 24, "algorithm": "medium", "perf": 473.871, "source": "autotuned"},
{"m": 7, "n": 13, "k": 5, "tile_m": 2, "tile_n": 2, "threads": 32, "grouping": 13, "minblocks": 20, "algorithm": "medium", "perf": 484.652, "source": "autotuned"},
{"m": 7, "n": 13, "k": 7, "tile_m": 4, "tile_n": 1, "threads": 32, "grouping": 14, "minblocks": 22, "algorithm": "medium", "perf": 568.233, "source": "autotuned"},
{"m": 7, "n": 13, "k": 9, "tile_m": 2, "tile_n": 2, "threads": 32, "grouping": 12, "minblocks": 25, "algorithm": "medium", "perf": 575.698, "source": "autotuned"},
{"m": 7, "n": 13, "k": 13, "tile_m": 2, "tile_n": 1, "threads": 64, "grouping": 26, "minblocks": 17, "algorithm": "medium", "perf": 576.55, "source": "autotuned"},
{"m": 7, "n": 13, "k": 25, "tile_m": 2, "tile_n": 1, "threads": 64, "grouping": 6, "minblocks": 2, "algorithm": "medium", "perf": 602.965, "source": "autotuned"},
{"m": 7, "n": 13, "k": 26, "tile_m": 2, "tile_n": 1, "threads": 96, "grouping": 5, "minblocks": 1, "algorithm": "medium", "perf": 607.199, "source": "autotuned"},
{"m": 7, "n": 13, "k": 28, "tile_m": 2, "tile_n": 1, "threads": 96, "grouping": 4, "minblocks": 8, "algorithm": "medium", "perf": 615.391, "source": "autotuned"},
{"m": 7, "n": 13, "k": 32, "tile_m": 1, "tile_n": 1, "threads": 96, "grouping": 4, "minblocks": 2, "algorithm": "medium", "perf": 622.982, "source": "autotuned"},
{"m": 7, "n": 13, "k": 45, "tile_m": 1, "tile_n": 1, "threads": 128, "grouping": 3, "minblocks": 2, "algorithm": "medium", "perf": 626.534, "source": "autotuned"},
{"m": 7, "n": 25, "k": 4, "tile_m": 4, "tile_n": 2, "threads": 32, "grouping": 16, "minblocks": 10, "algorithm": "medium", "perf": 580.16, "source": "autotuned"},
{"m": 7, "n": 25, "k": 5, "tile_m": 4, "tile_n": 1, "threads": 64, "grouping": 22, "minblocks": 18, "algorithm": "medium", "perf": 597.952, "source": "autotuned"},
{"m": 7, "n": 25, "k": 7, "tile_m": 4, "tile_n": 1, "threads": 64, "grouping": 22, "minblocks": 12, "algorithm": "medium", "perf": 658.065, "source": "autotuned"},
{"m": 7, "n": 25, "k": 9, "tile_m": 1, "tile_n": 3, "threads": 64, "grouping": 22, "minblocks": 2, "algorithm": "medium", "perf": 683.511, "source": "autotuned"},
{"m": 7, "n": 25, "k": 13, "tile_m": 1, "tile_n": 3, "threads": 96, "grouping": 29, "minblocks": 11, "algorithm": "medium", "perf": 697.002, "source": "autotuned"},
{"m": 7, "n": 25, "k": 25, "tile_m": 1, "tile_n": 2, "threads": 192, "grouping": 4, "minblocks": 3, "algorithm": "medium", "perf": 721.815, "source": "autotuned"},
{"m": 7, "n": 25, "k": 26, "tile_m": 1, "tile_n": 2, "threads": 192, "grouping": 5, "minblocks": 3, "algorithm": "medium", "perf": 726.291, "source": "autotuned"},
{"m": 7, "n": 25, "k": 28, "tile_m": 1, "tile_n": 2, "threads": 224, "grouping": 4, "minblocks": 6, "algorithm": "medium", "perf": 733.469, "source": "autotuned"},
{"m": 7, "n": 25, "k": 32, "tile_m": 1, "tile_n": 3, "threads": 128, "grouping": 3, "minblocks": 4, "algorithm": "medium", "perf": 738.173, "source": "autotuned"},
{"m": 7, "n": 25, "k": 45, "tile_m": 1, "tile_n": 2, "w": 22, "v": 24, "threads": 96, "grouping": 16, "minblocks": 4, "algorithm": "largeDB2", "perf": 744.304, "source": "autotuned"},
{"m": 7, "n": 26, "k": 4, "tile_m": 4, "tile_n": 2, "threads": 32, "grouping": 16, "minblocks": 7, "algorithm": "medium", "perf": 597.715, "source": "autotuned"},
{"m": 7, "n": 26, "k": 5, "tile_m": 4, "tile_n": 2, "threads": 64, "grouping": 22, "minblocks": 14, "algorithm": "medium", "perf": 612.13, "source": "autotuned"},
{"m": 7, "n": 26, "k": 7, "tile_m": 4, "tile_n": 1, "threads": 64, "grouping": 22, "minblocks": 9, "algorithm": "medium", "perf": 669.6, "source": "autotuned"},
{"m": 7, "n": 26, "k": 9, "tile_m": 1, "tile_n": 3, "threads": 64, "grouping": 26, "minblocks": 14, "algorithm": "medium", "perf": 695, "source": "autotuned"},
{"m": 7, "n": 26, "k": 13, "tile_m": 1, "tile_n": 3, "threads": 96, "grouping": 32, "minblocks": 10, "algorithm": "medium", "perf": 708.859, "source": "autotuned"},
{"m": 7, "n": 26, "k": 25, "tile_m": 1, "tile_n": 2, "threads": 192, "grouping": 4, "minblocks": 7, "algorithm": "medium", "perf": 732.407, "source": "autotuned"},
{"m": 7, "n": 26, "k": 26, "tile_m": 1, "tile_n": 2, "threads": 192, "grouping": 5, "minblocks": 2, "algorithm": "medium", "perf": 739.029, "source": "autotuned"},
{"m": 7, "n": 26, "k": 28, "tile_m": 1, "tile_n": 2, "threads": 224, "grouping": 4, "minblocks": 6, "algorithm": "medium", "perf": 743.234, "source": "autotuned"},
{"m": 7, "n": 26, "k": 32, "tile_m": 1, "tile_n": 2, "threads": 256, "grouping": 4, "minblocks": 5, "algorithm": "medium", "perf": 753.794, "source": "autotuned"},
{"m": 7, "n": 26, "k": 45, "tile_m": 2, "tile_n": 2, "w": 16, "v": 26, "threads": 64, "grouping": 16, "minblocks": 8, "algorithm": "largeDB2", "perf": 753.616, "source": "autotuned"},
{"m": 7, "n": 28, "k": 4, "tile_m": 4, "tile_n": 2, "threads": 32, "grouping": 16, "minblocks": 16, "algorithm": "medium", "perf": 621.956, "source": "autotuned"},
{"m": 7, "n": 28, "k": 5, "tile_m": 4, "tile_n": 1, "threads": 64, "grouping": 22, "minblocks": 12, "algorithm": "medium", "perf": 630.557, "source": "autotuned"},
{"m": 7, "n": 28, "k": 7, "tile_m": 4, "tile_n": 1, "threads": 64, "grouping": 26, "minblocks": 8, "algorithm": "medium", "perf": 687.436, "source": "autotuned"},
{"m": 7, "n": 28, "k": 9, "tile_m": 2, "tile_n": 2, "threads": 64, "grouping": 26, "minblocks": 11, "algorithm": "medium", "perf": 709.918, "source": "autotuned"},
{"m": 7, "n": 28, "k": 13, "tile_m": 2, "tile_n": 2, "threads": 96, "grouping": 12, "minblocks": 7, "algorithm": "medium", "perf": 710.614, "source": "autotuned"},
{"m": 7, "n": 28, "k": 25, "tile_m": 1, "tile_n": 2, "threads": 192, "grouping": 5, "minblocks": 3, "algorithm": "medium", "perf": 746.919, "source": "autotuned"},
{"m": 7, "n": 28, "k": 26, "tile_m": 2, "tile_n": 1, "threads": 192, "grouping": 4, "minblocks": 6, "algorithm": "medium", "perf": 752.82, "source": "autotuned"},
{"m": 7, "n": 28, "k": 28, "tile_m": 2, "tile_n": 1, "threads": 224, "grouping": 4, "minblocks": 6, "algorithm": "medium", "perf": 754.704, "source": "autotuned"},
{"m": 7, "n": 28, "k": 32, "tile_m": 2, "tile_n": 1, "threads": 128, "grouping": 4, "minblocks": 1, "algorithm": "medium", "perf": 766.488, "source": "autotuned"},
{"m": 7, "n": 28, "k": 45, "tile_m": 2, "tile_n": 1, "w": 12, "v": 24, "threads": 128, "grouping": 16, "minblocks": 2, "algorithm": "largeDB2", "perf": 770.322, "source": "autotuned"},
{"m": 7, "n": 32, "k": 4, "tile_m": 4, "tile_n": 2, "threads": 32, "grouping": 19, "minblocks": 15, "algorithm": "medium", "perf": 627.174, "source": "autotuned"},
{"m": 7, "n": 32, "k": 5, "tile_m": 4, "tile_n": 1, "threads": 64, "grouping": 21, "minblocks": 3, "algorithm": "medium", "perf": 656.782, "source": "autotuned"},
{"m": 7, "n": 32, "k": 7, "tile_m": 2, "tile_n": 2, "threads": 64, "grouping": 22, "minblocks": 11, "algorithm": "medium", "perf": 701.471, "source": "autotuned"},
{"m": 7, "n": 32, "k": 9, "tile_m": 4, "tile_n": 1, "threads": 64, "grouping": 32, "minblocks": 2, "algorithm": "medium", "perf": 721.47, "source": "autotuned"},
{"m": 7, "n": 32, "k": 13, "tile_m": 4, "tile_n": 1, "threads": 96, "grouping": 6, "minblocks": 10, "algorithm": "medium", "perf": 736.094, "source": "autotuned"},
{"m": 7, "n": 32, "k": 25, "tile_m": 2, "tile_n": 1, "threads": 192, "grouping": 4, "minblocks": 1, "algorithm": "medium", "perf": 769.295, "source": "autotuned"},
{"m": 7, "n": 32, "k": 26, "tile_m": 2, "tile_n": 1, "threads": 192, "grouping": 4, "minblocks": 1, "algorithm": "medium", "perf": 776.776, "source": "autotuned"},
{"m": 7, "n": 32, "k": 28, "tile_m": 2, "tile_n": 1, "threads": 256, "grouping": 4, "minblocks": 5, "algorithm": "medium", "perf": 778.504, "source": "autotuned"},
{"m": 7, "n": 32, "k": 32, "tile_m": 2, "tile_n": 2, "w": 16, "v": 32, "threads": 64, "grouping": 16, "minblocks": 2, "algorithm": "largeDB2", "perf": 790.893, "source": "autotuned"},
{"m": 7, "n": 32, "k": 45, "tile_m": 2, "tile_n": 1, "w": 12, "v": 32, "threads": 128, "grouping": 16, "minblocks": 2, "algorithm": "largeDB2", "perf": 802.202, "source": "autotuned"},
{"m": 7, "n": 45, "k": 4, "tile_m": 2, "tile_n": 3, "threads": 64, "grouping": 28, "minblocks": 2, "algorithm": "medium", "perf": 631.988, "source": "autotuned"},
{"m": 7, "n": 45, "k": 5, "tile_m": 1, "tile_n": 5, "threads": 64, "grouping": 27, "minblocks": 5, "algorithm": "medium", "perf": 663.525, "source": "autotuned"},
{"m": 7, "n": 45, "k": 7, "tile_m": 1, "tile_n": 5, "threads": 64, "grouping": 32, "minblocks": 7, "algorithm": "medium", "perf": 709.225, "source": "autotuned"},
{"m": 7, "n": 45, "k": 9, "tile_m": 4, "tile_n": 1, "threads": 128, "grouping": 32, "minblocks": 10, "algorithm": "medium", "perf": 727.897, "source": "autotuned"},
{"m": 7, "n": 45, "k": 13, "tile_m": 4, "tile_n": 1, "threads": 128, "grouping": 29, "minblocks": 3, "algorithm": "medium", "perf": 755.771, "source": "autotuned"},
{"m": 7, "n": 45, "k": 25, "tile_m": 2, "tile_n": 1, "threads": 192, "grouping": 4, "minblocks": 1, "algorithm": "medium", "perf": 801.315, "source": "autotuned"},
{"m": 7, "n": 45, "k": 26, "tile_m": 2, "tile_n": 1, "threads": 224, "grouping": 3, "minblocks": 3, "algorithm": "medium", "perf": 810.209, "source": "autotuned"},
{"m": 7, "n": 45, "k": 28, "tile_m": 2, "tile_n": 1, "threads": 256, "grouping": 3, "minblocks": 4, "algorithm": "medium", "perf": 818.919, "source": "autotuned"},
{"m": 7, "n": 45, "k": 32, "tile_m": 2, "tile_n": 1, "threads": 256, "grouping": 3, "minblocks": 3, "algorithm": "medium", "perf": 832.676, "source": "autotuned"},
{"m": 7, "n": 45, "k": 45, "tile_m": 4, "tile_n": 1, "w": 12, "v": 32, "threads": 96, "grouping": 16, "minblocks": 2, "algorithm": "largeDB2", "perf": 841.043, "source": "autotuned"},
{"m": 8, "n": 4, "k": 4, "tile_m": 1, "tile_n": 1, "threads": 32, "grouping": 18, "minblocks": 27, "algorithm": "medium", "perf": 241.107, "source": "autotuned"},
{"m": 8, "n": 4, "k": 5, "tile_m": 1, "tile_n": 1, "threads": 32, "grouping": 16, "minblocks": 12, "algorithm": "medium", "perf": 253.28, "source": "autotuned"},
{"m": 8, "n": 4, "k": 6, "tile_m": 1, "tile_n": 1, "threads": 32, "grouping": 16, "minblocks": 8, "algorithm": "medium", "perf": 292.754, "source": "autotuned"},
{"m": 8, "n": 4, "k": 7, "tile_m": 1, "tile_n": 1, "threads": 32, "grouping": 16, "minblocks": 5, "algorithm": "medium", "perf": 322.969, "source": "autotuned"},
{"m": 8, "n": 4, "k": 8, "tile_m": 1, "tile_n": 1, "threads": 32, "grouping": 9, "minblocks": 7, "algorithm": "small", "perf": 312.182, "source": "autotuned"},
{"m": 8, "n": 4, "k": 9, "tile_m": 1, "tile_n": 1, "threads": 32, "grouping": 13, "minblocks": 25, "algorithm": "medium", "perf": 336.929, "source": "autotuned"},
{"m": 8, "n": 5, "k": 4, "tile_m": 2, "tile_n": 1, "threads": 32, "grouping": 16, "minblocks": 27, "algorithm": "medium", "perf": 261.066, "source": "autotuned"},
{"m": 8, "n": 5, "k": 5, "tile_m": 2, "tile_n": 1, "threads": 32, "grouping": 16, "minblocks": 25, "algorithm": "medium", "perf": 297.369, "source": "autotuned"},
{"m": 8, "n": 5, "k": 6, "tile_m": 1, "tile_n": 2, "threads": 32, "grouping": 13, "minblocks": 25, "algorithm": "medium", "perf": 344.888, "source": "autotuned"},
{"m": 8, "n": 5, "k": 7, "tile_m": 1, "tile_n": 2, "threads": 32, "grouping": 13, "minblocks": 21, "algorithm": "medium", "perf": 335.855, "source": "autotuned"},
{"m": 8, "n": 5, "k": 8, "tile_m": 2, "tile_n": 1, "threads": 32, "grouping": 13, "minblocks": 4, "algorithm": "medium", "perf": 362.704, "source": "autotuned"},
{"m": 8, "n": 5, "k": 9, "tile_m": 2, "tile_n": 1, "threads": 32, "grouping": 13, "minblocks": 27, "algorithm": "medium", "perf": 388.028, "source": "autotuned"},
{"m": 8, "n": 6, "k": 4, "tile_m": 1, "tile_n": 2, "threads": 32, "grouping": 15, "minblocks": 24, "algorithm": "medium", "perf": 306.873, "source": "autotuned"},
{"m": 8, "n": 6, "k": 5, "tile_m": 2, "tile_n": 1, "threads": 32, "grouping": 16, "minblocks": 19, "algorithm": "medium", "perf": 351.046, "source": "autotuned"},
{"m": 8, "n": 6, "k": 6, "tile_m": 2, "tile_n": 1, "threads": 32, "grouping": 13, "minblocks": 20, "algorithm": "medium", "perf": 357.061, "source": "autotuned"},
{"m": 8, "n": 6, "k": 7, "tile_m": 2, "tile_n": 1, "threads": 32, "grouping": 13, "minblocks": 25, "algorithm": "medium", "perf": 398.063, "source": "autotuned"},
{"m": 8, "n": 6, "k": 8, "tile_m": 2, "tile_n": 1, "threads": 32, "grouping": 13, "minblocks": 27, "algorithm": "medium", "perf": 432.142, "source": "autotuned"},
{"m": 8, "n": 6, "k": 9, "tile_m": 2, "tile_n": 1, "threads": 32, "grouping": 13, "minblocks": 2, "algorithm": "medium", "perf": 451.4, "source": "autotuned"},
{"m": 8, "n": 7, "k": 4, "tile_m": 1, "tile_n": 2, "threads": 32, "grouping": 15, "minblocks": 11, "algorithm": "medium", "perf": 354.317, "source": "autotuned"},
{"m": 8, "n": 7, "k": 5, "tile_m": 2, "tile_n": 1, "threads": 32, "grouping": 16, "minblocks": 6, "algorithm": "medium", "perf": 358.106, "source": "autotuned"},
{"m": 8, "n": 7, "k": 6, "tile_m": 1, "tile_n": 2, "threads": 32, "grouping": 13, "minblocks": 17, "algorithm": "medium", "perf": 412.399, "source": "autotuned"},
{"m": 8, "n": 7, "k": 7, "tile_m": 1, "tile_n": 2, "threads": 32, "grouping": 13, "minblocks": 11, "algorithm": "medium", "perf": 463.962, "source": "autotuned"},
{"m": 8, "n": 7, "k": 8, "tile_m": 2, "tile_n": 1, "threads": 32, "grouping": 13, "minblocks": 25, "algorithm": "medium", "perf": 495.994, "source": "autotuned"},
{"m": 8, "n": 7, "k": 9, "tile_m": 1, "tile_n": 2, "threads": 32, "grouping": 13, "minblocks": 26, "algorithm": "medium", "perf": 501.068, "source": "autotuned"},
{"m": 8, "n": 8, "k": 4, "tile_m": 1, "tile_n": 2, "threads": 32, "grouping": 16, "minblocks": 11, "algorithm": "medium", "perf": 423.915, "source": "autotuned"},
{"m": 8, "n": 8, "k": 5, "tile_m": 1, "tile_n": 2, "threads": 32, "grouping": 13, "minblocks": 12, "algorithm": "medium", "perf": 468.053, "source": "autotuned"},
{"m": 8, "n": 8, "k": 6, "tile_m": 2, "tile_n": 1, "threads": 32, "grouping": 11, "minblocks": 17, "algorithm": "medium", "perf": 531.999, "source": "autotuned"},
{"m": 8, "n": 8, "k": 7, "tile_m": 2, "tile_n": 1, "threads": 32, "grouping": 11, "minblocks": 1, "algorithm": "medium", "perf": 571.337, "source": "autotuned"},
{"m": 8, "n": 8, "k": 8, "tile_m": 2, "tile_n": 1, "threads": 32, "grouping": 13, "minblocks": 25, "algorithm": "medium", "perf": 605.152, "source": "autotuned"},
{"m": 8, "n": 8, "k": 9, "tile_m": 2, "tile_n": 1, "threads": 32, "grouping": 13, "minblocks": 5, "algorithm": "medium", "perf": 571.958, "source": "autotuned"},
{"m": 8, "n": 9, "k": 4, "tile_m": 1, "tile_n": 3, "threads": 32, "grouping": 15, "minblocks": 25, "algorithm": "medium", "perf": 378.51, "source": "autotuned"},
{"m": 8, "n": 9, "k": 5, "tile_m": 1, "tile_n": 3, "threads": 32, "grouping": 16, "minblocks": 12, "algorithm": "medium", "perf": 433.932, "source": "autotuned"},
{"m": 8, "n": 9, "k": 6, "tile_m": 1, "tile_n": 3, "threads": 32, "grouping": 13, "minblocks": 12, "algorithm": "medium", "perf": 500.839, "source": "autotuned"},
{"m": 8, "n": 9, "k": 7, "tile_m": 1, "tile_n": 3, "threads": 32, "grouping": 11, "minblocks": 25, "algorithm": "medium", "perf": 544.839, "source": "autotuned"},
{"m": 8, "n": 9, "k": 8, "tile_m": 1, "tile_n": 3, "threads": 32, "grouping": 13, "minblocks": 9, "algorithm": "medium", "perf": 572.229, "source": "autotuned"},
{"m": 8, "n": 9, "k": 9, "tile_m": 1, "tile_n": 3, "threads": 32, "grouping": 16, "minblocks": 20, "algorithm": "medium", "perf": 567.681, "source": "autotuned"},
{"m": 9, "n": 4, "k": 4, "tile_m": 2, "tile_n": 1, "threads": 32, "grouping": 16, "minblocks": 27, "algorithm": "medium", "perf": 223.697, "source": "autotuned"},
{"m": 9, "n": 4, "k": 5, "tile_m": 2, "tile_n": 1, "threads": 32, "grouping": 16, "minblocks": 12, "algorithm": "medium", "perf": 264.552, "source": "autotuned"},
{"m": 9, "n": 4, "k": 6, "tile_m": 2, "tile_n": 1, "threads": 32, "grouping": 16, "minblocks": 12, "algorithm": "medium", "perf": 305.331, "source": "autotuned"},
{"m": 9, "n": 4, "k": 7, "tile_m": 1, "tile_n": 2, "threads": 32, "grouping": 13, "minblocks": 25, "algorithm": "medium", "perf": 335.175, "source": "autotuned"},
{"m": 9, "n": 4, "k": 8, "tile_m": 1, "tile_n": 2, "threads": 32, "grouping": 16, "minblocks": 26, "algorithm": "medium", "perf": 321.571, "source": "autotuned"},
{"m": 9, "n": 4, "k": 9, "tile_m": 2, "tile_n": 1, "threads": 32, "grouping": 13, "minblocks": 6, "algorithm": "medium", "perf": 341.86, "source": "autotuned"},
{"m": 9, "n": 4, "k": 13, "tile_m": 1, "tile_n": 2, "threads": 32, "grouping": 13, "minblocks": 5, "algorithm": "medium", "perf": 381.012, "source": "autotuned"},
{"m": 9, "n": 4, "k": 25, "tile_m": 1, "tile_n": 1, "threads": 64, "grouping": 5, "minblocks": 4, "algorithm": "medium", "perf": 380.088, "source": "autotuned"},
{"m": 9, "n": 4, "k": 26, "tile_m": 1, "tile_n": 1, "threads": 64, "grouping": 29, "minblocks": 1, "algorithm": "medium", "perf": 384.187, "source": "autotuned"},
{"m": 9, "n": 4, "k": 28, "tile_m": 1, "tile_n": 1, "threads": 64, "grouping": 7, "minblocks": 5, "algorithm": "medium", "perf": 389.01, "source": "autotuned"},
{"m": 9, "n": 4, "k": 32, "tile_m": 1, "tile_n": 1, "threads": 64, "grouping": 4, "minblocks": 11, "algorithm": "medium", "perf": 391.946, "source": "autotuned"},
{"m": 9, "n": 4, "k": 45, "tile_m": 1, "tile_n": 1, "threads": 96, "grouping": 3, "minblocks": 9, "algorithm": "medium", "perf": 387.535, "source": "autotuned"},
{"m": 9, "n": 5, "k": 4, "tile_m": 2, "tile_n": 1, "threads": 32, "grouping": 16, "minblocks": 2, "algorithm": "medium", "perf": 274.355, "source": "autotuned"},
{"m": 9, "n": 5, "k": 5, "tile_m": 2, "tile_n": 1, "threads": 32, "grouping": 16, "minblocks": 7, "algorithm": "medium", "perf": 325.528, "source": "autotuned"},
{"m": 9, "n": 5, "k": 6, "tile_m": 2, "tile_n": 1, "threads": 32, "grouping": 16, "minblocks": 3, "algorithm": "medium", "perf": 371.15, "source": "autotuned"},
{"m": 9, "n": 5, "k": 7, "tile_m": 1, "tile_n": 2, "threads": 32, "grouping": 13, "minblocks": 1, "algorithm": "medium", "perf": 371.567, "source": "autotuned"},
{"m": 9, "n": 5, "k": 8, "tile_m": 1, "tile_n": 2, "threads": 32, "grouping": 13, "minblocks": 19, "algorithm": "medium", "perf": 394.72, "source": "autotuned"},
{"m": 9, "n": 5, "k": 9, "tile_m": 2, "tile_n": 1, "threads": 32, "grouping": 13, "minblocks": 2, "algorithm": "medium", "perf": 417.155, "source": "autotuned"},
{"m": 9, "n": 5, "k": 13, "tile_m": 1, "tile_n": 2, "threads": 32, "grouping": 16, "minblocks": 13, "algorithm": "medium", "perf": 424.207, "source": "autotuned"},
{"m": 9, "n": 5, "k": 25, "tile_m": 1, "tile_n": 1, "threads": 64, "grouping": 4, "minblocks": 15, "algorithm": "medium", "perf": 441.803, "source": "autotuned"},
{"m": 9, "n": 5, "k": 26, "tile_m": 1, "tile_n": 1, "threads": 64, "grouping": 4, "minblocks": 3, "algorithm": "medium", "perf": 441.181, "source": "autotuned"},
{"m": 9, "n": 5, "k": 28, "tile_m": 1, "tile_n": 1, "threads": 64, "grouping": 4, "minblocks": 13, "algorithm": "medium", "perf": 447.972, "source": "autotuned"},
{"m": 9, "n": 5, "k": 32, "tile_m": 1, "tile_n": 1, "threads": 64, "grouping": 4, "minblocks": 5, "algorithm": "medium", "perf": 455.083, "source": "autotuned"},
{"m": 9, "n": 5, "k": 45, "tile_m": 1, "tile_n": 1, "threads": 128, "grouping": 5, "minblocks": 2, "algorithm": "medium", "perf": 447.72, "source": "autotuned"},
{"m": 9, "n": 6, "k": 4, "tile_m": 2, "tile_n": 1, "threads": 32, "grouping": 16, "minblocks": 16, "algorithm": "medium", "perf": 324.725, "source": "autotuned"},
{"m": 9, "n": 6, "k": 5, "tile_m": 2, "tile_n": 1, "threads": 32, "grouping": 16, "minblocks": 2, "algorithm": "medium", "perf": 383.299, "source": "autotuned"},
{"m": 9, "n": 6, "k": 6, "tile_m": 2, "tile_n": 1, "threads": 32, "grouping": 13, "minblocks": 9, "algorithm": "medium", "perf": 384.354, "source": "autotuned"},
{"m": 9, "n": 6, "k": 7, "tile_m": 1, "tile_n": 2, "threads": 32, "grouping": 13, "minblocks": 15, "algorithm": "medium", "perf": 435.21, "source": "autotuned"},
{"m": 9, "n": 6, "k": 8, "tile_m": 1, "tile_n": 2, "threads": 32, "grouping": 13, "minblocks": 14, "algorithm": "medium", "perf": 469.311, "source": "autotuned"},
{"m": 9, "n": 6, "k": 9, "tile_m": 1, "tile_n": 2, "threads": 32, "grouping": 13, "minblocks": 9, "algorithm": "medium", "perf": 476.433, "source": "autotuned"},
{"m": 9, "n": 7, "k": 4, "tile_m": 3, "tile_n": 1, "threads": 32, "grouping": 16, "minblocks": 3, "algorithm": "medium", "perf": 360.754, "source": "autotuned"},
{"m": 9, "n": 7, "k": 5, "tile_m": 3, "tile_n": 1, "threads": 32, "grouping": 16, "minblocks": 5, "algorithm": "medium", "perf": 379.473, "source": "autotuned"},
{"m": 9, "n": 7, "k": 6, "tile_m": 1, "tile_n": 3, "threads": 32, "grouping": 13, "minblocks": 20, "algorithm": "medium", "perf": 420.882, "source": "autotuned"},
{"m": 9, "n": 7, "k": 7, "tile_m": 3, "tile_n": 1, "threads": 32, "grouping": 13, "minblocks": 27, "algorithm": "medium", "perf": 478.365, "source": "autotuned"},
{"m": 9, "n": 7, "k": 8, "tile_m": 3, "tile_n": 1, "threads": 32, "grouping": 13, "minblocks": 1, "algorithm": "medium", "perf": 493.848, "source": "autotuned"},
{"m": 9, "n": 7, "k": 9, "tile_m": 3, "tile_n": 1, "threads": 32, "grouping": 13, "minblocks": 2, "algorithm": "medium", "perf": 516.64, "source": "autotuned"},
{"m": 9, "n": 7, "k": 13, "tile_m": 1, "tile_n": 3, "threads": 32, "grouping": 13, "minblocks": 1, "algorithm": "medium", "perf": 510.27, "source": "autotuned"},
{"m": 9, "n": 7, "k": 25, "tile_m": 1, "tile_n": 1, "threads": 64, "grouping": 4, "minblocks": 12, "algorithm": "medium", "perf": 537.082, "source": "autotuned"},
{"m": 9, "n": 7, "k": 26, "tile_m": 1, "tile_n": 1, "threads": 64, "grouping": 4, "minblocks": 2, "algorithm": "medium", "perf": 540.279, "source": "autotuned"},
{"m": 9, "n": 7, "k": 28, "tile_m": 1, "tile_n": 1, "threads": 96, "grouping": 4, "minblocks": 11, "algorithm": "medium", "perf": 545.866, "source": "autotuned"},
{"m": 9, "n": 7, "k": 32, "tile_m": 1, "tile_n": 1, "threads": 128, "grouping": 4, "minblocks": 11, "algorithm": "medium", "perf": 551.821, "source": "autotuned"},
{"m": 9, "n": 7, "k": 45, "tile_m": 1, "tile_n": 1, "threads": 128, "grouping": 4, "minblocks": 3, "algorithm": "medium", "perf": 550.203, "source": "autotuned"},
{"m": 9, "n": 8, "k": 4, "tile_m": 3, "tile_n": 1, "threads": 32, "grouping": 15, "minblocks": 3, "algorithm": "medium", "perf": 375.31, "source": "autotuned"},
{"m": 9, "n": 8, "k": 5, "tile_m": 3, "tile_n": 1, "threads": 32, "grouping": 16, "minblocks": 26, "algorithm": "medium", "perf": 428.946, "source": "autotuned"},
{"m": 9, "n": 8, "k": 6, "tile_m": 1, "tile_n": 3, "threads": 32, "grouping": 13, "minblocks": 22, "algorithm": "medium", "perf": 484.981, "source": "autotuned"},
{"m": 9, "n": 8, "k": 7, "tile_m": 3, "tile_n": 1, "threads": 32, "grouping": 13, "minblocks": 9, "algorithm": "medium", "perf": 540.555, "source": "autotuned"},
{"m": 9, "n": 8, "k": 8, "tile_m": 3, "tile_n": 1, "threads": 32, "grouping": 13, "minblocks": 2, "algorithm": "medium", "perf": 563.409, "source": "autotuned"},
{"m": 9, "n": 8, "k": 9, "tile_m": 1, "tile_n": 3, "threads": 32, "grouping": 16, "minblocks": 20, "algorithm": "medium", "perf": 561.368, "source": "autotuned"},
{"m": 9, "n": 9, "k": 4, "tile_m": 3, "tile_n": 1, "threads": 32, "grouping": 13, "minblocks": 16, "algorithm": "medium", "perf": 449.812, "source": "autotuned"},
{"m": 9, "n": 9, "k": 5, "tile_m": 3, "tile_n": 1, "threads": 32, "grouping": 12, "minblocks": 25, "algorithm": "medium", "perf": 520.817, "source": "autotuned"},
{"m": 9, "n": 9, "k": 6, "tile_m": 3, "tile_n": 1, "threads": 32, "grouping": 12, "minblocks": 11, "algorithm": "medium", "perf": 584.233, "source": "autotuned"},
{"m": 9, "n": 9, "k": 7, "tile_m": 3, "tile_n": 1, "threads": 32, "grouping": 13, "minblocks": 25, "algorithm": "medium", "perf": 593.141, "source": "autotuned"},
{"m": 9, "n": 9, "k": 8, "tile_m": 3, "tile_n": 1, "threads": 32, "grouping": 16, "minblocks": 2, "algorithm": "medium", "perf": 609.153, "source": "autotuned"},
{"m": 9, "n": 9, "k": 9, "tile_m": 1, "tile_n": 3, "threads": 32, "grouping": 13, "minblocks": 20, "algorithm": "medium", "perf": 596.262, "source": "autotuned"},
{"m": 9, "n": 9, "k": 10, "tile_m": 3, "tile_n": 1, "threads": 32, "grouping": 18, "minblocks": 5, "algorithm": "medium", "perf": 598.238, "source": "autotuned"},
{"m": 9, "n": 9, "k": 12, "tile_m": 3, "tile_n": 1, "threads": 32, "grouping": 18, "minblocks": 16, "algorithm": "medium", "perf": 608.863, "source": "autotuned"},
{"m": 9, "n": 9, "k": 13, "tile_m": 1, "tile_n": 3, "threads": 32, "grouping": 21, "minblocks": 3, "algorithm": "medium", "perf": 598.854, "source": "autotuned"},
{"m": 9, "n": 9, "k": 22, "tile_m": 1, "tile_n": 2, "threads": 64, "grouping": 26, "minblocks": 2, "algorithm": "medium", "perf": 602.914, "source": "autotuned"},
{"m": 9, "n": 9, "k": 25, "tile_m": 1, "tile_n": 1, "threads": 128, "grouping": 5, "minblocks": 11, "algorithm": "medium", "perf": 604.486, "source": "autotuned"},
{"m": 9, "n": 9, "k": 26, "tile_m": 1, "tile_n": 1, "threads": 128, "grouping": 5, "minblocks": 9, "algorithm": "medium", "perf": 606.896, "source": "autotuned"},
{"m": 9, "n": 9, "k": 28, "tile_m": 1, "tile_n": 1, "threads": 128, "grouping": 4, "minblocks": 12, "algorithm": "medium", "perf": 623.854, "source": "autotuned"},
{"m": 9, "n": 9, "k": 32, "tile_m": 1, "tile_n": 1, "threads": 96, "grouping": 4, "minblocks": 2, "algorithm": "medium", "perf": 619.696, "source": "autotuned"},
{"m": 9, "n": 9, "k": 45, "tile_m": 1, "tile_n": 1, "threads": 224, "grouping": 4, "minblocks": 6, "algorithm": "medium", "perf": 621.925, "source": "autotuned"},
{"m": 9, "n": 10, "k": 9, "tile_m": 3, "tile_n": 1, "threads": 32, "grouping": 13, "minblocks": 16, "algorithm": "medium", "perf": 603.196, "source": "autotuned"},
{"m": 9, "n": 10, "k": 10, "tile_m": 3, "tile_n": 1, "threads": 32, "grouping": 11, "minblocks": 2, "algorithm": "medium", "perf": 590.348, "source": "autotuned"},
{"m": 9, "n": 10, "k": 12, "tile_m": 3, "tile_n": 1, "threads": 64, "grouping": 22, "minblocks": 18, "algorithm": "medium", "perf": 616.887, "source": "autotuned"},
{"m": 9, "n": 10, "k": 32, "tile_m": 1, "tile_n": 2, "threads": 128, "grouping": 4, "minblocks": 10, "algorithm": "medium", "perf": 649.51, "source": "autotuned"},
{"m": 9, "n": 12, "k": 9, "tile_m": 1, "tile_n": 4, "threads": 32, "grouping": 13, "minblocks": 25, "algorithm": "medium", "perf": 636.186, "source": "autotuned"},
{"m": 9, "n": 12, "k": 10, "tile_m": 2, "tile_n": 2, "threads": 32, "grouping": 12, "minblocks": 17, "algorithm": "medium", "perf": 641.738, "source": "autotuned"},
{"m": 9, "n": 12, "k": 12, "tile_m": 1, "tile_n": 2, "threads": 64, "grouping": 22, "minblocks": 15, "algorithm": "medium", "perf": 653.32, "source": "autotuned"},
{"m": 9, "n": 12, "k": 32, "tile_m": 1, "tile_n": 2, "w": 8, "v": 12, "threads": 64, "grouping": 16, "minblocks": 1, "algorithm": "largeDB2", "perf": 699.295, "source": "autotuned"},
{"m": 9, "n": 13, "k": 4, "tile_m": 5, "tile_n": 1, "threads": 32, "grouping": 12, "minblocks": 8, "algorithm": "medium", "perf": 520.652, "source": "autotuned"},
{"m": 9, "n": 13, "k": 5, "tile_m": 5, "tile_n": 1, "threads": 32, "grouping": 13, "minblocks": 13, "algorithm": "medium", "perf": 570.99, "source": "autotuned"},
{"m": 9, "n": 13, "k": 7, "tile_m": 1, "tile_n": 5, "threads": 32, "grouping": 16, "minblocks": 2, "algorithm": "medium", "perf": 619.584, "source": "autotuned"},
{"m": 9, "n": 13, "k": 9, "tile_m": 5, "tile_n": 1, "threads": 32, "grouping": 12, "minblocks": 21, "algorithm": "medium", "perf": 635.789, "source": "autotuned"},
{"m": 9, "n": 13, "k": 13, "tile_m": 1, "tile_n": 2, "threads": 64, "grouping": 26, "minblocks": 18, "algorithm": "medium", "perf": 675.011, "source": "autotuned"},
{"m": 9, "n": 13, "k": 25, "tile_m": 1, "tile_n": 2, "threads": 64, "grouping": 26, "minblocks": 6, "algorithm": "medium", "perf": 695.157, "source": "autotuned"},
{"m": 9, "n": 13, "k": 26, "tile_m": 1, "tile_n": 2, "w": 12, "v": 12, "threads": 64, "grouping": 16, "minblocks": 2, "algorithm": "largeDB2", "perf": 706.349, "source": "autotuned"},
{"m": 9, "n": 13, "k": 28, "tile_m": 1, "tile_n": 2, "w": 12, "v": 8, "threads": 64, "grouping": 16, "minblocks": 2, "algorithm": "largeDB2", "perf": 709.773, "source": "autotuned"},
{"m": 9, "n": 13, "k": 32, "tile_m": 1, "tile_n": 2, "w": 14, "v": 8, "threads": 64, "grouping": 16, "minblocks": 1, "algorithm": "largeDB2", "perf": 720.317, "source": "autotuned"},
{"m": 9, "n": 13, "k": 45, "tile_m": 1, "tile_n": 1, "threads": 160, "grouping": 3, "minblocks": 6, "algorithm": "medium", "perf": 722.283, "source": "autotuned"},
{"m": 9, "n": 22, "k": 9, "tile_m": 2, "tile_n": 2, "threads": 96, "grouping": 32, "minblocks": 5, "algorithm": "medium", "perf": 751.681, "source": "autotuned"},
{"m": 9, "n": 22, "k": 22, "tile_m": 1, "tile_n": 2, "threads": 128, "grouping": 5, "minblocks": 7, "algorithm": "medium", "perf": 814.968, "source": "autotuned"},
{"m": 9, "n": 22, "k": 32, "tile_m": 2, "tile_n": 2, "w": 16, "v": 22, "threads": 64, "grouping": 16, "minblocks": 1, "algorithm": "largeDB2", "perf": 851.65, "source": "autotuned"},
{"m": 9, "n": 25, "k": 4, "tile_m": 1, "tile_n": 4, "threads": 64, "grouping": 22, "minblocks": 19, "algorithm": "medium", "perf": 627.071, "source": "autotuned"},
{"m": 9, "n": 25, "k": 5, "tile_m": 1, "tile_n": 4, "threads": 64, "grouping": 22, "minblocks": 11, "algorithm": "medium", "perf": 697.048, "source": "autotuned"},
{"m": 9, "n": 25, "k": 7, "tile_m": 1, "tile_n": 4, "threads": 64, "grouping": 27, "minblocks": 11, "algorithm": "medium", "perf": 759.221, "source": "autotuned"},
{"m": 9, "n": 25, "k": 9, "tile_m": 1, "tile_n": 4, "threads": 96, "grouping": 29, "minblocks": 10, "algorithm": "medium", "perf": 780.691, "source": "autotuned"},
{"m": 9, "n": 25, "k": 13, "tile_m": 1, "tile_n": 4, "threads": 128, "grouping": 9, "minblocks": 9, "algorithm": "medium", "perf": 806.204, "source": "autotuned"},
{"m": 9, "n": 25, "k": 25, "tile_m": 1, "tile_n": 2, "threads": 128, "grouping": 4, "minblocks": 5, "algorithm": "medium", "perf": 850.306, "source": "autotuned"},
{"m": 9, "n": 25, "k": 26, "tile_m": 1, "tile_n": 2, "threads": 128, "grouping": 4, "minblocks": 5, "algorithm": "medium", "perf": 860.479, "source": "autotuned"},
{"m": 9, "n": 25, "k": 28, "tile_m": 2, "tile_n": 1, "threads": 160, "grouping": 4, "minblocks": 6, "algorithm": "medium", "perf": 868.917, "source": "autotuned"},
{"m": 9, "n": 25, "k": 32, "tile_m": 2, "tile_n": 1, "threads": 160, "grouping": 4, "minblocks": 4, "algorithm": "medium", "perf": 876.897, "source": "autotuned"},
{"m": 9, "n": 25, "k": 45, "tile_m": 1, "tile_n": 2, "w": 14, "v": 14, "threads": 128, "grouping": 16, "minblocks": 2, "algorithm": "largeDB2", "perf": 889.424, "source": "autotuned"},
{"m": 9, "n": 26, "k": 4, "tile_m": 1, "tile_n": 4, "threads": 64, "grouping": 22, "minblocks": 20, "algorithm": "medium", "perf": 651.805, "source": "autotuned"},
{"m": 9, "n": 26, "k": 5, "tile_m": 1, "tile_n": 4, "threads": 64, "grouping": 26, "minblocks": 19, "algorithm": "medium", "perf": 709.356, "source": "autotuned"},
{"m": 9, "n": 26, "k": 7, "tile_m": 1, "tile_n": 4, "threads": 64, "grouping": 26, "minblocks": 11, "algorithm": "medium", "perf": 779.501, "source": "autotuned"},
{"m": 9, "n": 26, "k": 9, "tile_m": 1, "tile_n": 4, "threads": 96, "grouping": 26, "minblocks": 11, "algorithm": "medium", "perf": 790.313, "source": "autotuned"},
{"m": 9, "n": 26, "k": 13, "tile_m": 1, "tile_n": 4, "threads": 128, "grouping": 32, "minblocks": 9, "algorithm": "medium", "perf": 820.423, "source": "autotuned"},
{"m": 9, "n": 26, "k": 25, "tile_m": 1, "tile_n": 2, "threads": 128, "grouping": 4, "minblocks": 1, "algorithm": "medium", "perf": 859.973, "source": "autotuned"},
{"m": 9, "n": 26, "k": 26, "tile_m": 1, "tile_n": 5, "w": 10, "v": 26, "threads": 64, "grouping": 16, "minblocks": 1, "algorithm": "largeDB2", "perf": 873.449, "source": "autotuned"},
{"m": 9, "n": 26, "k": 28, "tile_m": 1, "tile_n": 3, "w": 10, "v": 14, "threads": 96, "grouping": 16, "minblocks": 2, "algorithm": "largeDB2", "perf": 879.817, "source": "autotuned"},
{"m": 9, "n": 26, "k": 32, "tile_m": 1, "tile_n": 2, "threads": 128, "grouping": 3, "minblocks": 3, "algorithm": "medium", "perf": 884.616, "source": "autotuned"},
{"m": 9, "n": 26, "k": 45, "tile_m": 1, "tile_n": 2, "w": 12, "v": 16, "threads": 128, "grouping": 16, "minblocks": 1, "algorithm": "largeDB2", "perf": 907.729, "source": "autotuned"},
{"m": 9, "n": 28, "k": 4, "tile_m": 1, "tile_n": 4, "threads": 64, "grouping": 22, "minblocks": 14, "algorithm": "medium", "perf": 687.488, "source": "autotuned"},
{"m": 9, "n": 28, "k": 5, "tile_m": 1, "tile_n": 4, "threads": 64, "grouping": 21, "minblocks": 10, "algorithm": "medium", "perf": 735.829, "source": "autotuned"},
{"m": 9, "n": 28, "k": 7, "tile_m": 1, "tile_n": 4, "threads": 64, "grouping": 26, "minblocks": 14, "algorithm": "medium", "perf": 806.204, "source": "autotuned"},
{"m": 9, "n": 28, "k": 9, "tile_m": 3, "tile_n": 1, "threads": 96, "grouping": 26, "minblocks": 11, "algorithm": "medium", "perf": 821.996, "source": "autotuned"},
{"m": 9, "n": 28, "k": 13, "tile_m": 1, "tile_n": 4, "threads": 128, "grouping": 21, "minblocks": 7, "algorithm": "medium", "perf": 840.047, "source": "autotuned"},
{"m": 9, "n": 28, "k": 25, "tile_m": 1, "tile_n": 2, "threads": 128, "grouping": 5, "minblocks": 1, "algorithm": "medium", "perf": 890.192, "source": "autotuned"},
{"m": 9, "n": 28, "k": 26, "tile_m": 1, "tile_n": 2, "threads": 256, "grouping": 4, "minblocks": 6, "algorithm": "medium", "perf": 897.077, "source": "autotuned"},
{"m": 9, "n": 28, "k": 28, "tile_m": 1, "tile_n": 2, "threads": 256, "grouping": 4, "minblocks": 5, "algorithm": "medium", "perf": 904.627, "source": "autotuned"},
{"m": 9, "n": 28, "k": 32, "tile_m": 1, "tile_n": 2, "threads": 160, "grouping": 3, "minblocks": 4, "algorithm": "medium", "perf": 915.991, "source": "autotuned"},
{"m": 9, "n": 28, "k": 45, "tile_m": 1, "tile_n": 2, "w": 10, "v": 28, "threads": 128, "grouping": 16, "minblocks": 2, "algorithm": "largeDB2", "perf": 927.821, "source": "autotuned"},
{"m": 9, "n": 32, "k": 4, "tile_m": 5, "tile_n": 1, "threads": 64, "grouping": 22, "minblocks": 14, "algorithm": "medium", "perf": 721.352, "source": "autotuned"},
{"m": 9, "n": 32, "k": 5, "tile_m": 3, "tile_n": 2, "threads": 64, "grouping": 26, "minblocks": 3, "algorithm": "medium", "perf": 765.332, "source": "autotuned"},
{"m": 9, "n": 32, "k": 7, "tile_m": 1, "tile_n": 5, "threads": 64, "grouping": 26, "minblocks": 6, "algorithm": "medium", "perf": 832, "source": "autotuned"},
{"m": 9, "n": 32, "k": 9, "tile_m": 2, "tile_n": 2, "threads": 96, "grouping": 32, "minblocks": 3, "algorithm": "medium", "perf": 851.008, "source": "autotuned"},
{"m": 9, "n": 32, "k": 10, "tile_m": 3, "tile_n": 1, "threads": 96, "grouping": 32, "minblocks": 3, "algorithm": "medium", "perf": 854.866, "source": "autotuned"},
{"m": 9, "n": 32, "k": 12, "tile_m": 5, "tile_n": 1, "threads": 128, "grouping": 5, "minblocks": 10, "algorithm": "medium", "perf": 866.147, "source": "autotuned"},
{"m": 9, "n": 32, "k": 13, "tile_m": 5, "tile_n": 1, "threads": 128, "grouping": 5, "minblocks": 10, "algorithm": "medium", "perf": 869.42, "source": "autotuned"},
{"m": 9, "n": 32, "k": 22, "tile_m": 3, "tile_n": 2, "w": 8, "v": 32, "threads": 64, "grouping": 16, "minblocks": 1, "algorithm": "largeDB2", "perf": 910.237, "source": "autotuned"},
{"m": 9, "n": 32, "k": 25, "tile_m": 3, "tile_n": 1, "w": 10, "v": 26, "threads": 96, "grouping": 16, "minblocks": 2, "algorithm": "largeDB2", "perf": 918.498, "source": "autotuned"},
{"m": 9, "n": 32, "k": 26, "tile_m": 3, "tile_n": 1, "w": 10, "v": 18, "threads": 96, "grouping": 16, "minblocks": 2, "algorithm": "largeDB2", "perf": 925, "source": "autotuned"},
{"m": 9, "n": 32, "k": 28, "tile_m": 3, "tile_n": 1, "w": 10, "v": 26, "threads": 96, "grouping": 16, "minblocks": 1, "algorithm": "largeDB2", "perf": 928.218, "source": "autotuned"},
{"m": 9, "n": 32, "k": 32, "tile_m": 1, "tile_n": 5, "w": 12, "v": 32, "threads": 64, "grouping": 16, "minblocks": 4, "algorithm": "largeDB2", "perf": 944.428, "source": "autotuned"},
{"m": 9, "n": 32, "k": 45, "tile_m": 3, "tile_n": 1, "w": 10, "v": 28, "threads": 96, "grouping": 16, "minblocks": 4, "algorithm": "largeDB2", "perf": 965.569, "source": "autotuned"},
{"m": 9, "n": 45, "k": 4, "tile_m": 6, "tile_n": 2, "threads": 64, "grouping": 30, "minblocks": 10, "algorithm": "medium", "perf": 732.692, "source": "autotuned"},
{"m": 9, "n": 45, "k": 5, "tile_m": 5, "tile_n": 2, "threads": 64, "grouping": 30, "minblocks": 11, "algorithm": "medium", "perf": 771.67, "source": "autotuned"},
{"m": 9, "n": 45, "k": 7, "tile_m": 1, "tile_n": 5, "threads": 96, "grouping": 29, "minblocks": 10, "algorithm": "medium", "perf": 833.778, "source": "autotuned"},
{"m": 9, "n": 45, "k": 9, "tile_m": 1, "tile_n": 5, "threads": 128, "grouping": 32, "minblocks": 9, "algorithm": "medium", "perf": 859.465, "source": "autotuned"},
{"m": 9, "n": 45, "k": 13, "tile_m": 1, "tile_n": 3, "threads": 160, "grouping": 5, "minblocks": 7, "algorithm": "medium", "perf": 903.628, "source": "autotuned"},
{"m": 9, "n": 45, "k": 25, "tile_m": 5, "tile_n": 1, "threads": 256, "grouping": 24, "minblocks": 4, "algorithm": "medium", "perf": 967.166, "source": "autotuned"},
{"m": 9, "n": 45, "k": 26, "tile_m": 5, "tile_n": 1, "w": 10, "v": 18, "threads": 96, "grouping": 16, "minblocks": 4, "algorithm": "largeDB2", "perf": 977.295, "source": "autotuned"},
{"m": 9, "n": 45, "k": 28, "tile_m": 5, "tile_n": 1, "threads": 256, "grouping": 4, "minblocks": 4, "algorithm": "medium", "perf": 990.414, "source": "autotuned"},
{"m": 9, "n": 45, "k": 32, "tile_m": 5, "tile_n": 1, "threads": 128, "grouping": 3, "minblocks": 3, "algorithm": "medium", "perf": 1004.63, "source": "autotuned"},
{"m": 9, "n": 45, "k": 45, "tile_m": 2, "tile_n": 2, "w": 12, "v": 16, "threads": 128, "grouping": 16, "minblocks": 1, "algorithm": "largeDB2", "perf": 1022.05, "source": "autotuned"},
{"m": 10, "n": 4, "k": 4, "tile_m": 1, "tile_n": 2, "threads": 32, "grouping": 16, "minblocks": 1, "algorithm": "medium", "perf": 247.284, "source": "autotuned"},
{"m": 10, "n": 4, "k": 10, "tile_m": 1, "tile_n": 2, "threads": 32, "grouping": 13, "minblocks": 22, "algorithm": "medium", "perf": 389.557, "source": "autotuned"},
{"m": 10, "n": 4, "k": 15, "tile_m": 1, "tile_n": 1, "threads": 64, "grouping": 6, "minblocks": 27, "algorithm": "medium", "perf": 396.818, "source": "autotuned"},
{"m": 10, "n": 9, "k": 9, "tile_m": 1, "tile_n": 3, "threads": 32, "grouping": 16, "minblocks": 22, "algorithm": "medium", "perf": 617.477, "source": "autotuned"},
{"m": 10, "n": 9, "k": 10, "tile_m": 1, "tile_n": 3, "threads": 32, "grouping": 11, "minblocks": 6, "algorithm": "medium", "perf": 598.408, "source": "autotuned"},
{"m": 10, "n": 9, "k": 12, "tile_m": 1, "tile_n": 3, "threads": 32, "grouping": 12, "minblocks": 10, "algorithm": "medium", "perf": 630.235, "source": "autotuned"},
{"m": 10, "n": 9, "k": 32, "tile_m": 1, "tile_n": 1, "threads": 96, "grouping": 4, "minblocks": 7, "algorithm": "medium", "perf": 654.862, "source": "autotuned"},
{"m": 10, "n": 10, "k": 4, "tile_m": 2, "tile_n": 2, "threads": 32, "grouping": 13, "minblocks": 22, "algorithm": "medium", "perf": 526.19, "source": "autotuned"},
{"m": 10, "n": 10, "k": 9, "tile_m": 1, "tile_n": 4, "threads": 32, "grouping": 19, "minblocks": 23, "algorithm": "medium", "perf": 645.292, "source": "autotuned"},
{"m": 10, "n": 10, "k": 10, "tile_m": 1, "tile_n": 4, "threads": 32, "grouping": 18, "minblocks": 22, "algorithm": "medium", "perf": 663.631, "source": "autotuned"},
{"m": 10, "n": 10, "k": 11, "tile_m": 1, "tile_n": 2, "threads": 64, "grouping": 6, "minblocks": 19, "algorithm": "medium", "perf": 649.449, "source": "autotuned"},
{"m": 10, "n": 10, "k": 12, "tile_m": 1, "tile_n": 2, "threads": 64, "grouping": 22, "minblocks": 3, "algorithm": "medium", "perf": 678.945, "source": "autotuned"},
{"m": 10, "n": 10, "k": 15, "tile_m": 1, "tile_n": 2, "threads": 64, "grouping": 24, "minblocks": 4, "algorithm": "medium", "perf": 666.283, "source": "autotuned"},
{"m": 10, "n": 10, "k": 32, "tile_m": 1, "tile_n": 2, "threads": 128, "grouping": 3, "minblocks": 8, "algorithm": "medium", "perf": 692.008, "source": "autotuned"},
{"m": 10, "n": 12, "k": 9, "tile_m": 1, "tile_n": 4, "threads": 32, "grouping": 13, "minblocks": 15, "algorithm": "medium", "perf": 669.43, "source": "autotuned"},
{"m": 10, "n": 12, "k": 10, "tile_m": 1, "tile_n": 2, "threads": 64, "grouping": 22, "minblocks": 6, "algorithm": "medium", "perf": 690.625, "source": "autotuned"},
{"m": 10, "n": 12, "k": 12, "tile_m": 1, "tile_n": 2, "w": 6, "v": 12, "threads": 64, "grouping": 16, "minblocks": 8, "algorithm": "largeDB2", "perf": 710.062, "source": "autotuned"},
{"m": 10, "n": 12, "k": 32, "tile_m": 1, "tile_n": 2, "threads": 128, "grouping": 3, "minblocks": 4, "algorithm": "medium", "perf": 749.015, "source": "autotuned"},
{"m": 10, "n": 15, "k": 4, "tile_m": 5, "tile_n": 1, "threads": 32, "grouping": 13, "minblocks": 7, "algorithm": "medium", "perf": 610.102, "source": "autotuned"},
{"m": 10, "n": 15, "k": 10, "tile_m": 1, "tile_n": 3, "threads": 64, "grouping": 24, "minblocks": 17, "algorithm": "medium", "perf": 729.268, "source": "autotuned"},
{"m": 10, "n": 15, "k": 15, "tile_m": 1, "tile_n": 3, "threads": 64, "grouping": 22, "minblocks": 6, "algorithm": "medium", "perf": 749.635, "source": "autotuned"},
{"m": 10, "n": 32, "k": 9, "tile_m": 2, "tile_n": 2, "threads": 96, "grouping": 32, "minblocks": 9, "algorithm": "medium", "perf": 905.73, "source": "autotuned"},
{"m": 10, "n": 32, "k": 10, "tile_m": 1, "tile_n": 6, "threads": 128, "grouping": 32, "minblocks": 9, "algorithm": "medium", "perf": 906.799, "source": "autotuned"},
{"m": 10, "n": 32, "k": 12, "tile_m": 1, "tile_n": 3, "threads": 128, "grouping": 32, "minblocks": 10, "algorithm": "medium", "perf": 938.098, "source": "autotuned"},
{"m": 10, "n": 32, "k": 32, "tile_m": 1, "tile_n": 2, "threads": 192, "grouping": 3, "minblocks": 2, "algorithm": "medium", "perf": 1031.68, "source": "autotuned"},
{"m": 11, "n": 11, "k": 11, "tile_m": 2, "tile_n": 2, "threads": 64, "grouping": 26, "minblocks": 5, "algorithm": "medium", "perf": 702.059, "source": "autotuned"},
{"m": 11, "n": 11, "k": 12, "tile_m": 1, "tile_n": 3, "threads": 64, "grouping": 26, "minblocks": 7, "algorithm": "medium", "perf": 710.594, "source": "autotuned"},
{"m": 11, "n": 11, "k": 20, "tile_m": 2, "tile_n": 2, "threads": 96, "grouping": 32, "minblocks": 10, "algorithm": "medium", "perf": 718.795, "source": "autotuned"},
{"m": 11, "n": 11, "k": 25, "tile_m": 2, "tile_n": 1, "threads": 96, "grouping": 32, "minblocks": 8, "algorithm": "medium", "perf": 723.132, "source": "autotuned"},
{"m": 11, "n": 11, "k": 32, "tile_m": 2, "tile_n": 1, "threads": 128, "grouping": 4, "minblocks": 2, "algorithm": "medium", "perf": 748.109, "source": "autotuned"},
{"m": 11, "n": 12, "k": 11, "tile_m": 2, "tile_n": 2, "threads": 64, "grouping": 26, "minblocks": 6, "algorithm": "medium", "perf": 693.544, "source": "autotuned"},
{"m": 11, "n": 12, "k": 12, "tile_m": 1, "tile_n": 3, "threads": 64, "grouping": 26, "minblocks": 17, "algorithm": "medium", "perf": 710.581, "source": "autotuned"},
{"m": 11, "n": 12, "k": 20, "tile_m": 2, "tile_n": 2, "threads": 64, "grouping": 7, "minblocks": 13, "algorithm": "medium", "perf": 732.24, "source": "autotuned"},
{"m": 11, "n": 12, "k": 25, "tile_m": 2, "tile_n": 1, "threads": 96, "grouping": 5, "minblocks": 8, "algorithm": "medium", "perf": 740.308, "source": "autotuned"},
{"m": 11, "n": 12, "k": 32, "tile_m": 2, "tile_n": 1, "threads": 128, "grouping": 4, "minblocks": 6, "algorithm": "medium", "perf": 766.012, "source": "autotuned"},
{"m": 11, "n": 20, "k": 11, "tile_m": 2, "tile_n": 2, "threads": 64, "grouping": 26, "minblocks": 11, "algorithm": "medium", "perf": 859.155, "source": "autotuned"},
{"m": 11, "n": 20, "k": 12, "tile_m": 2, "tile_n": 2, "threads": 64, "grouping": 26, "minblocks": 9, "algorithm": "medium", "perf": 859.574, "source": "autotuned"},
{"m": 11, "n": 20, "k": 20, "tile_m": 4, "tile_n": 1, "w": 10, "v": 8, "threads": 64, "grouping": 16, "minblocks": 2, "algorithm": "largeDB2", "perf": 900.568, "source": "autotuned"},
{"m": 11, "n": 20, "k": 25, "tile_m": 2, "tile_n": 1, "threads": 128, "grouping": 4, "minblocks": 7, "algorithm": "medium", "perf": 918.74, "source": "autotuned"},
{"m": 11, "n": 20, "k": 32, "tile_m": 2, "tile_n": 1, "threads": 128, "grouping": 4, "minblocks": 5, "algorithm": "medium", "perf": 948.189, "source": "autotuned"},
{"m": 11, "n": 25, "k": 11, "tile_m": 1, "tile_n": 5, "threads": 128, "grouping": 32, "minblocks": 9, "algorithm": "medium", "perf": 895.515, "source": "autotuned"},
{"m": 11, "n": 25, "k": 12, "tile_m": 1, "tile_n": 5, "threads": 64, "grouping": 32, "minblocks": 1, "algorithm": "medium", "perf": 894.023, "source": "autotuned"},
{"m": 11, "n": 25, "k": 20, "tile_m": 2, "tile_n": 3, "w": 10, "v": 24, "threads": 64, "grouping": 16, "minblocks": 1, "algorithm": "largeDB2", "perf": 968.954, "source": "autotuned"},
{"m": 11, "n": 25, "k": 25, "tile_m": 2, "tile_n": 3, "w": 10, "v": 22, "threads": 64, "grouping": 16, "minblocks": 4, "algorithm": "largeDB2", "perf": 972.814, "source": "autotuned"},
{"m": 11, "n": 25, "k": 32, "tile_m": 2, "tile_n": 1, "threads": 192, "grouping": 4, "minblocks": 5, "algorithm": "medium", "perf": 1003.35, "source": "autotuned"},
{"m": 11, "n": 32, "k": 11, "tile_m": 6, "tile_n": 1, "threads": 128, "grouping": 32, "minblocks": 9, "algorithm": "medium", "perf": 967.416, "source": "autotuned"},
{"m": 11, "n": 32, "k": 12, "tile_m": 6, "tile_n": 1, "w": 6, "v": 28, "threads": 64, "grouping": 16, "minblocks": 8, "algorithm": "largeDB2", "perf": 971.263, "source": "autotuned"},
{"m": 11, "n": 32, "k": 20, "tile_m": 3, "tile_n": 2, "w": 10, "v": 32, "threads": 64, "grouping": 16, "minblocks": 2, "algorithm": "largeDB2", "perf": 1040.31, "source": "autotuned"},
{"m": 11, "n": 32, "k": 25, "tile_m": 2, "tile_n": 1, "threads": 192, "grouping": 4, "minblocks": 4, "algorithm": "medium", "perf": 1053.09, "source": "autotuned"},
{"m": 11, "n": 32, "k": 32, "tile_m": 2, "tile_n": 2, "w": 8, "v": 8, "threads": 96, "grouping": 16, "minblocks": 4, "algorithm": "largeDB2", "perf": 1093.93, "source": "autotuned"},
{"m": 12, "n": 5, "k": 5, "tile_m": 2, "tile_n": 1, "threads": 32, "grouping": 11, "minblocks": 6, "algorithm": "medium", "perf": 414.313, "source": "autotuned"},
{"m": 12, "n": 5, "k": 12, "tile_m": 2, "tile_n": 1, "threads": 32, "grouping": 13, "minblocks": 1, "algorithm": "medium", "perf": 489.381, "source": "autotuned"},
{"m": 12, "n": 5, "k": 13, "tile_m": 2, "tile_n": 1, "threads": 32, "grouping": 4, "minblocks": 8, "algorithm": "medium", "perf": 472.929, "source": "autotuned"},
{"m": 12, "n": 5, "k": 26, "tile_m": 1, "tile_n": 1, "threads": 96, "grouping": 5, "minblocks": 6, "algorithm": "medium", "perf": 492.364, "source": "autotuned"},
{"m": 12, "n": 5, "k": 32, "tile_m": 1, "tile_n": 1, "threads": 64, "grouping": 3, "minblocks": 1, "algorithm": "medium", "perf": 501.048, "source": "autotuned"},
{"m": 12, "n": 9, "k": 9, "tile_m": 4, "tile_n": 1, "threads": 32, "grouping": 13, "minblocks": 25, "algorithm": "medium", "perf": 630.854, "source": "autotuned"},
{"m": 12, "n": 9, "k": 10, "tile_m": 2, "tile_n": 2, "threads": 64, "grouping": 18, "minblocks": 16, "algorithm": "medium", "perf": 645.924, "source": "autotuned"},
{"m": 12, "n": 9, "k": 12, "tile_m": 1, "tile_n": 2, "threads": 64, "grouping": 22, "minblocks": 5, "algorithm": "medium", "perf": 663.387, "source": "autotuned"},
{"m": 12, "n": 9, "k": 32, "tile_m": 1, "tile_n": 2, "w": 16, "v": 6, "threads": 64, "grouping": 16, "minblocks": 2, "algorithm": "largeDB2", "perf": 698.588, "source": "autotuned"},
{"m": 12, "n": 10, "k": 9, "tile_m": 4, "tile_n": 1, "threads": 32, "grouping": 12, "minblocks": 10, "algorithm": "medium", "perf": 663.302, "source": "autotuned"},
{"m": 12, "n": 10, "k": 10, "tile_m": 1, "tile_n": 2, "threads": 64, "grouping": 22, "minblocks": 12, "algorithm": "medium", "perf": 695.265, "source": "autotuned"},
{"m": 12, "n": 10, "k": 12, "tile_m": 1, "tile_n": 2, "w": 6, "v": 10, "threads": 64, "grouping": 16, "minblocks": 2, "algorithm": "largeDB2", "perf": 707.143, "source": "autotuned"},
{"m": 12, "n": 10, "k": 32, "tile_m": 1, "tile_n": 2, "w": 8, "v": 10, "threads": 64, "grouping": 16, "minblocks": 12, "algorithm": "largeDB2", "perf": 743.602, "source": "autotuned"},
{"m": 12, "n": 11, "k": 11, "tile_m": 1, "tile_n": 3, "threads": 64, "grouping": 26, "minblocks": 10, "algorithm": "medium", "perf": 707.91, "source": "autotuned"},
{"m": 12, "n": 11, "k": 12, "tile_m": 1, "tile_n": 3, "threads": 64, "grouping": 26, "minblocks": 18, "algorithm": "medium", "perf": 722.854, "source": "autotuned"},
{"m": 12, "n": 11, "k": 20, "tile_m": 1, "tile_n": 3, "threads": 64, "grouping": 6, "minblocks": 5, "algorithm": "medium", "perf": 748.533, "source": "autotuned"},
{"m": 12, "n": 11, "k": 25, "tile_m": 1, "tile_n": 2, "threads": 96, "grouping": 5, "minblocks": 6, "algorithm": "medium", "perf": 746.389, "source": "autotuned"},
{"m": 12, "n": 11, "k": 32, "tile_m": 2, "tile_n": 1, "threads": 128, "grouping": 4, "minblocks": 5, "algorithm": "medium", "perf": 772.265, "source": "autotuned"},
{"m": 12, "n": 12, "k": 5, "tile_m": 6, "tile_n": 1, "threads": 32, "grouping": 15, "minblocks": 3, "algorithm": "medium", "perf": 704.113, "source": "autotuned"},
{"m": 12, "n": 12, "k": 9, "tile_m": 1, "tile_n": 3, "threads": 64, "grouping": 22, "minblocks": 10, "algorithm": "medium", "perf": 766.851, "source": "autotuned"},
{"m": 12, "n": 12, "k": 10, "tile_m": 1, "tile_n": 3, "threads": 64, "grouping": 22, "minblocks": 5, "algorithm": "medium", "perf": 782.428, "source": "autotuned"},
{"m": 12, "n": 12, "k": 11, "tile_m": 1, "tile_n": 3, "threads": 64, "grouping": 26, "minblocks": 1, "algorithm": "medium", "perf": 773.895, "source": "autotuned"},
{"m": 12, "n": 12, "k": 12, "tile_m": 1, "tile_n": 3, "threads": 64, "grouping": 26, "minblocks": 1, "algorithm": "medium", "perf": 787.849, "source": "autotuned"},
{"m": 12, "n": 12, "k": 13, "tile_m": 1, "tile_n": 3, "threads": 64, "grouping": 32, "minblocks": 1, "algorithm": "medium", "perf": 783.946, "source": "autotuned"},
{"m": 12, "n": 12, "k": 16, "tile_m": 1, "tile_n": 3, "threads": 64, "grouping": 32, "minblocks": 14, "algorithm": "medium", "perf": 797.978, "source": "autotuned"},
{"m": 12, "n": 12, "k": 20, "tile_m": 1, "tile_n": 3, "threads": 64, "grouping": 32, "minblocks": 3, "algorithm": "medium", "perf": 789.883, "source": "autotuned"},
{"m": 12, "n": 12, "k": 25, "tile_m": 1, "tile_n": 2, "threads": 128, "grouping": 6, "minblocks": 5, "algorithm": "medium", "perf": 798.948, "source": "autotuned"},
{"m": 12, "n": 12, "k": 26, "tile_m": 1, "tile_n": 3, "threads": 160, "grouping": 5, "minblocks": 8, "algorithm": "medium", "perf": 794.647, "source": "autotuned"},
{"m": 12, "n": 12, "k": 32, "tile_m": 1, "tile_n": 2, "threads": 128, "grouping": 4, "minblocks": 5, "algorithm": "medium", "perf": 821.891, "source": "autotuned"},
{"m": 12, "n": 13, "k": 5, "tile_m": 3, "tile_n": 2, "threads": 32, "grouping": 14, "minblocks": 12, "algorithm": "medium", "perf": 671.755, "source": "autotuned"},
{"m": 12, "n": 13, "k": 12, "tile_m": 1, "tile_n": 3, "threads": 64, "grouping": 24, "minblocks": 17, "algorithm": "medium", "perf": 785.316, "source": "autotuned"},
{"m": 12, "n": 13, "k": 13, "tile_m": 2, "tile_n": 2, "threads": 64, "grouping": 26, "minblocks": 12, "algorithm": "medium", "perf": 777.453, "source": "autotuned"},
{"m": 12, "n": 13, "k": 26, "tile_m": 1, "tile_n": 2, "threads": 96, "grouping": 5, "minblocks": 3, "algorithm": "medium", "perf": 821.309, "source": "autotuned"},
{"m": 12, "n": 13, "k": 32, "tile_m": 1, "tile_n": 2, "threads": 128, "grouping": 4, "minblocks": 6, "algorithm": "medium", "perf": 841.375, "source": "autotuned"},
{"m": 12, "n": 16, "k": 12, "tile_m": 3, "tile_n": 1, "threads": 64, "grouping": 26, "minblocks": 12, "algorithm": "medium", "perf": 850.387, "source": "autotuned"},
{"m": 12, "n": 16, "k": 16, "tile_m": 1, "tile_n": 2, "threads": 96, "grouping": 32, "minblocks": 7, "algorithm": "medium", "perf": 884.496, "source": "autotuned"},
{"m": 12, "n": 16, "k": 32, "tile_m": 1, "tile_n": 2, "threads": 192, "grouping": 4, "minblocks": 3, "algorithm": "medium", "perf": 928.761, "source": "autotuned"},
{"m": 12, "n": 20, "k": 11, "tile_m": 1, "tile_n": 4, "threads": 64, "grouping": 26, "minblocks": 11, "algorithm": "medium", "perf": 895.574, "source": "autotuned"},
{"m": 12, "n": 20, "k": 12, "tile_m": 2, "tile_n": 2, "threads": 64, "grouping": 26, "minblocks": 8, "algorithm": "medium", "perf": 908.586, "source": "autotuned"},
{"m": 12, "n": 20, "k": 20, "tile_m": 1, "tile_n": 3, "w": 10, "v": 12, "threads": 96, "grouping": 16, "minblocks": 4, "algorithm": "largeDB2", "perf": 960.877, "source": "autotuned"},
{"m": 12, "n": 20, "k": 25, "tile_m": 1, "tile_n": 2, "threads": 128, "grouping": 5, "minblocks": 4, "algorithm": "medium", "perf": 972.699, "source": "autotuned"},
{"m": 12, "n": 20, "k": 32, "tile_m": 2, "tile_n": 2, "w": 16, "v": 20, "threads": 64, "grouping": 16, "minblocks": 4, "algorithm": "largeDB2", "perf": 1003.8, "source": "autotuned"},
{"m": 12, "n": 25, "k": 11, "tile_m": 1, "tile_n": 5, "threads": 64, "grouping": 32, "minblocks": 7, "algorithm": "medium", "perf": 936.728, "source": "autotuned"},
{"m": 12, "n": 25, "k": 12, "tile_m": 1, "tile_n": 5, "threads": 96, "grouping": 32, "minblocks": 10, "algorithm": "medium", "perf": 953.604, "source": "autotuned"},
{"m": 12, "n": 25, "k": 20, "tile_m": 2, "tile_n": 3, "w": 10, "v": 24, "threads": 64, "grouping": 16, "minblocks": 1, "algorithm": "largeDB2", "perf": 1028.48, "source": "autotuned"},
{"m": 12, "n": 25, "k": 25, "tile_m": 1, "tile_n": 2, "threads": 192, "grouping": 4, "minblocks": 6, "algorithm": "medium", "perf": 1042.81, "source": "autotuned"},
{"m": 12, "n": 25, "k": 32, "tile_m": 1, "tile_n": 2, "threads": 192, "grouping": 3, "minblocks": 3, "algorithm": "medium", "perf": 1082.11, "source": "autotuned"},
{"m": 12, "n": 26, "k": 5, "tile_m": 1, "tile_n": 6, "threads": 64, "grouping": 26, "minblocks": 12, "algorithm": "medium", "perf": 857.411, "source": "autotuned"},
{"m": 12, "n": 26, "k": 12, "tile_m": 1, "tile_n": 2, "threads": 160, "grouping": 9, "minblocks": 3, "algorithm": "medium", "perf": 961.121, "source": "autotuned"},
{"m": 12, "n": 26, "k": 13, "tile_m": 1, "tile_n": 6, "threads": 96, "grouping": 5, "minblocks": 11, "algorithm": "medium", "perf": 975.617, "source": "autotuned"},
{"m": 12, "n": 26, "k": 26, "tile_m": 1, "tile_n": 2, "threads": 192, "grouping": 4, "minblocks": 1, "algorithm": "medium", "perf": 1066.53, "source": "autotuned"},
{"m": 12, "n": 26, "k": 32, "tile_m": 1, "tile_n": 2, "threads": 192, "grouping": 4, "minblocks": 1, "algorithm": "medium", "perf": 1099.3, "source": "autotuned"},
{"m": 12, "n": 32, "k": 5, "tile_m": 6, "tile_n": 1, "threads": 64, "grouping": 29, "minblocks": 12, "algorithm": "medium", "perf": 905.659, "source": "autotuned"},
{"m": 12, "n": 32, "k": 9, "tile_m": 1, "tile_n": 4, "threads": 128, "grouping": 32, "minblocks": 9, "algorithm": "medium", "perf": 1009.07, "source": "autotuned"},
{"m": 12, "n": 32, "k": 10, "tile_m": 1, "tile_n": 4, "threads": 128, "grouping": 32, "minblocks": 10, "algorithm": "medium", "perf": 1022.68, "source": "autotuned"},
{"m": 12, "n": 32, "k": 11, "tile_m": 1, "tile_n": 4, "threads": 96, "grouping": 32, "minblocks": 10, "algorithm": "medium", "perf": 1031.57, "source": "autotuned"},
{"m": 12, "n": 32, "k": 12, "tile_m": 1, "tile_n": 4, "threads": 96, "grouping": 4, "minblocks": 11, "algorithm": "medium", "perf": 1037.69, "source": "autotuned"},
{"m": 12, "n": 32, "k": 13, "tile_m": 1, "tile_n": 4, "threads": 160, "grouping": 5, "minblocks": 8, "algorithm": "medium", "perf": 1052.61, "source": "autotuned"},
{"m": 12, "n": 32, "k": 16, "tile_m": 1, "tile_n": 4, "threads": 128, "grouping": 4, "minblocks": 8, "algorithm": "medium", "perf": 1084.77, "source": "autotuned"},
{"m": 12, "n": 32, "k": 20, "tile_m": 1, "tile_n": 2, "threads": 192, "grouping": 4, "minblocks": 1, "algorithm": "medium", "perf": 1106.6, "source": "autotuned"},
{"m": 12, "n": 32, "k": 25, "tile_m": 1, "tile_n": 2, "threads": 192, "grouping": 4, "minblocks": 3, "algorithm": "medium", "perf": 1128.97, "source": "autotuned"},
{"m": 12, "n": 32, "k": 26, "tile_m": 1, "tile_n": 2, "threads": 192, "grouping": 4, "minblocks": 3, "algorithm": "medium", "perf": 1139.65, "source": "autotuned"},
{"m": 12, "n": 32, "k": 32, "tile_m": 1, "tile_n": 2, "threads": 192, "grouping": 3, "minblocks": 4, "algorithm": "medium", "perf": 1180.17, "source": "autotuned"},
{"m": 13, "n": 4, "k": 4, "tile_m": 2, "tile_n": 1, "threads": 32, "grouping": 16, "minblocks": 6, "algorithm": "medium", "perf": 309.329, "source": "autotuned"},
{"m": 13, "n": 4, "k": 5, "tile_m": 1, "tile_n": 2, "threads": 32, "grouping": 16, "minblocks": 19, "algorithm": "medium", "perf": 351.076, "source": "autotuned"},
{"m": 13, "n": 4, "k": 7, "tile_m": 2, "tile_n": 1, "threads": 32, "grouping": 11, "minblocks": 12, "algorithm": "medium", "perf": 430.38, "source": "autotuned"},
{"m": 13, "n": 4, "k": 9, "tile_m": 1, "tile_n": 2, "threads": 32, "grouping": 13, "minblocks": 7, "algorithm": "medium", "perf": 412.394, "source": "autotuned"},
{"m": 13, "n": 4, "k": 13, "tile_m": 1, "tile_n": 1, "threads": 64, "grouping": 4, "minblocks": 27, "algorithm": "medium", "perf": 421.461, "source": "autotuned"},
{"m": 13, "n": 4, "k": 25, "tile_m": 1, "tile_n": 1, "threads": 128, "grouping": 4, "minblocks": 1, "algorithm": "medium", "perf": 422.942, "source": "autotuned"},
{"m": 13, "n": 4, "k": 26, "tile_m": 1, "tile_n": 1, "threads": 128, "grouping": 4, "minblocks": 10, "algorithm": "medium", "perf": 428.057, "source": "autotuned"},
{"m": 13, "n": 4, "k": 28, "tile_m": 1, "tile_n": 1, "threads": 128, "grouping": 4, "minblocks": 2, "algorithm": "medium", "perf": 436.195, "source": "autotuned"},
{"m": 13, "n": 4, "k": 32, "tile_m": 1, "tile_n": 1, "threads": 160, "grouping": 4, "minblocks": 5, "algorithm": "medium", "perf": 440.449, "source": "autotuned"},
{"m": 13, "n": 4, "k": 45, "tile_m": 1, "tile_n": 1, "threads": 192, "grouping": 3, "minblocks": 5, "algorithm": "medium", "perf": 436.899, "source": "autotuned"},
{"m": 13, "n": 5, "k": 4, "tile_m": 1, "tile_n": 3, "threads": 32, "grouping": 16, "minblocks": 13, "algorithm": "medium", "perf": 362.493, "source": "autotuned"},
{"m": 13, "n": 5, "k": 5, "tile_m": 1, "tile_n": 3, "threads": 32, "grouping": 13, "minblocks": 1, "algorithm": "medium", "perf": 414.824, "source": "autotuned"},
{"m": 13, "n": 5, "k": 7, "tile_m": 1, "tile_n": 3, "threads": 32, "grouping": 13, "minblocks": 16, "algorithm": "medium", "perf": 451.746, "source": "autotuned"},
{"m": 13, "n": 5, "k": 9, "tile_m": 3, "tile_n": 1, "threads": 32, "grouping": 13, "minblocks": 18, "algorithm": "medium", "perf": 474.015, "source": "autotuned"},
{"m": 13, "n": 5, "k": 12, "tile_m": 1, "tile_n": 3, "threads": 64, "grouping": 18, "minblocks": 16, "algorithm": "medium", "perf": 489.219, "source": "autotuned"},
{"m": 13, "n": 5, "k": 13, "tile_m": 1, "tile_n": 3, "threads": 32, "grouping": 6, "minblocks": 12, "algorithm": "medium", "perf": 460.079, "source": "autotuned"},
{"m": 13, "n": 5, "k": 16, "tile_m": 1, "tile_n": 3, "threads": 96, "grouping": 30, "minblocks": 3, "algorithm": "medium", "perf": 482.507, "source": "autotuned"},
{"m": 13, "n": 5, "k": 24, "tile_m": 1, "tile_n": 2, "threads": 64, "grouping": 5, "minblocks": 1, "algorithm": "medium", "perf": 491.453, "source": "autotuned"},
{"m": 13, "n": 5, "k": 25, "tile_m": 1, "tile_n": 2, "threads": 128, "grouping": 5, "minblocks": 11, "algorithm": "medium", "perf": 487.722, "source": "autotuned"},
{"m": 13, "n": 5, "k": 26, "tile_m": 1, "tile_n": 2, "threads": 64, "grouping": 4, "minblocks": 1, "algorithm": "medium", "perf": 485.067, "source": "autotuned"},
{"m": 13, "n": 5, "k": 28, "tile_m": 1, "tile_n": 1, "threads": 96, "grouping": 3, "minblocks": 7, "algorithm": "medium", "perf": 493.982, "source": "autotuned"},
{"m": 13, "n": 5, "k": 32, "tile_m": 1, "tile_n": 1, "threads": 96, "grouping": 3, "minblocks": 4, "algorithm": "medium", "perf": 501.16, "source": "autotuned"},
{"m": 13, "n": 5, "k": 45, "tile_m": 1, "tile_n": 1, "threads": 128, "grouping": 4, "minblocks": 5, "algorithm": "medium", "perf": 501.227, "source": "autotuned"},
{"m": 13, "n": 7, "k": 4, "tile_m": 1, "tile_n": 4, "threads": 32, "grouping": 13, "minblocks": 12, "algorithm": "medium", "perf": 476.167, "source": "autotuned"},
{"m": 13, "n": 7, "k": 5, "tile_m": 2, "tile_n": 2, "threads": 32, "grouping": 13, "minblocks": 13, "algorithm": "medium", "perf": 472.557, "source": "autotuned"},
{"m": 13, "n": 7, "k": 7, "tile_m": 4, "tile_n": 1, "threads": 32, "grouping": 13, "minblocks": 22, "algorithm": "medium", "perf": 566.505, "source": "autotuned"},
{"m": 13, "n": 7, "k": 9, "tile_m": 2, "tile_n": 2, "threads": 32, "grouping": 16, "minblocks": 23, "algorithm": "medium", "perf": 562.908, "source": "autotuned"},
{"m": 13, "n": 7, "k": 13, "tile_m": 1, "tile_n": 2, "threads": 64, "grouping": 6, "minblocks": 9, "algorithm": "medium", "perf": 575.653, "source": "autotuned"},
{"m": 13, "n": 7, "k": 25, "tile_m": 1, "tile_n": 2, "w": 12, "v": 6, "threads": 64, "grouping": 16, "minblocks": 2, "algorithm": "largeDB2", "perf": 598.682, "source": "autotuned"},
{"m": 13, "n": 7, "k": 26, "tile_m": 1, "tile_n": 2, "w": 12, "v": 4, "threads": 64, "grouping": 16, "minblocks": 2, "algorithm": "largeDB2", "perf": 609.262, "source": "autotuned"},
{"m": 13, "n": 7, "k": 28, "tile_m": 1, "tile_n": 1, "threads": 128, "grouping": 5, "minblocks": 4, "algorithm": "medium", "perf": 611.772, "source": "autotuned"},
{"m": 13, "n": 7, "k": 32, "tile_m": 1, "tile_n": 1, "threads": 128, "grouping": 6, "minblocks": 5, "algorithm": "medium", "perf": 622.583, "source": "autotuned"},
{"m": 13, "n": 7, "k": 45, "tile_m": 1, "tile_n": 1, "threads": 128, "grouping": 3, "minblocks": 6, "algorithm": "medium", "perf": 627.27, "source": "autotuned"},
{"m": 13, "n": 9, "k": 4, "tile_m": 5, "tile_n": 1, "threads": 32, "grouping": 13, "minblocks": 27, "algorithm": "medium", "perf": 500.98, "source": "autotuned"},
{"m": 13, "n": 9, "k": 5, "tile_m": 1, "tile_n": 5, "threads": 32, "grouping": 13, "minblocks": 12, "algorithm": "medium", "perf": 558.304, "source": "autotuned"},
{"m": 13, "n": 9, "k": 7, "tile_m": 1, "tile_n": 5, "threads": 32, "grouping": 14, "minblocks": 25, "algorithm": "medium", "perf": 614.166, "source": "autotuned"},
{"m": 13, "n": 9, "k": 9, "tile_m": 2, "tile_n": 1, "threads": 64, "grouping": 26, "minblocks": 19, "algorithm": "medium", "perf": 633.01, "source": "autotuned"},
{"m": 13, "n": 9, "k": 13, "tile_m": 2, "tile_n": 1, "threads": 64, "grouping": 22, "minblocks": 3, "algorithm": "medium", "perf": 674.039, "source": "autotuned"},
{"m": 13, "n": 9, "k": 25, "tile_m": 2, "tile_n": 1, "w": 12, "v": 8, "threads": 64, "grouping": 16, "minblocks": 2, "algorithm": "largeDB2", "perf": 696.232, "source": "autotuned"},
{"m": 13, "n": 9, "k": 26, "tile_m": 2, "tile_n": 1, "w": 10, "v": 8, "threads": 64, "grouping": 16, "minblocks": 12, "algorithm": "largeDB2", "perf": 700.495, "source": "autotuned"},
{"m": 13, "n": 9, "k": 28, "tile_m": 2, "tile_n": 1, "w": 14, "v": 6, "threads": 64, "grouping": 16, "minblocks": 2, "algorithm": "largeDB2", "perf": 716.029, "source": "autotuned"},
{"m": 13, "n": 9, "k": 32, "tile_m": 2, "tile_n": 1, "w": 14, "v": 8, "threads": 64, "grouping": 16, "minblocks": 2, "algorithm": "largeDB2", "perf": 717.374, "source": "autotuned"},
{"m": 13, "n": 9, "k": 45, "tile_m": 2, "tile_n": 1, "w": 14, "v": 6, "threads": 64, "grouping": 16, "minblocks": 12, "algorithm": "largeDB2", "perf": 720.997, "source": "autotuned"},
{"m": 13, "n": 12, "k": 5, "tile_m": 1, "tile_n": 6, "threads": 32, "grouping": 13, "minblocks": 23, "algorithm": "medium", "perf": 669.522, "source": "autotuned"},
{"m": 13, "n": 12, "k": 12, "tile_m": 1, "tile_n": 3, "threads": 64, "grouping": 26, "minblocks": 17, "algorithm": "medium", "perf": 782.744, "source": "autotuned"},
{"m": 13, "n": 12, "k": 13, "tile_m": 3, "tile_n": 1, "threads": 64, "grouping": 22, "minblocks": 6, "algorithm": "medium", "perf": 773.206, "source": "autotuned"},
{"m": 13, "n": 12, "k": 26, "tile_m": 1, "tile_n": 3, "threads": 128, "grouping": 5, "minblocks": 9, "algorithm": "medium", "perf": 802.307, "source": "autotuned"},
{"m": 13, "n": 12, "k": 32, "tile_m": 4, "tile_n": 1, "w": 16, "v": 12, "threads": 64, "grouping": 16, "minblocks": 2, "algorithm": "largeDB2", "perf": 828.44, "source": "autotuned"},
{"m": 13, "n": 13, "k": 4, "tile_m": 4, "tile_n": 2, "threads": 32, "grouping": 15, "minblocks": 15, "algorithm": "medium", "perf": 645.445, "source": "autotuned"},
{"m": 13, "n": 13, "k": 5, "tile_m": 3, "tile_n": 3, "threads": 32, "grouping": 17, "minblocks": 13, "algorithm": "medium", "perf": 687.167, "source": "autotuned"},
{"m": 13, "n": 13, "k": 7, "tile_m": 4, "tile_n": 2, "threads": 32, "grouping": 20, "minblocks": 14, "algorithm": "medium", "perf": 753.739, "source": "autotuned"},
{"m": 13, "n": 13, "k": 9, "tile_m": 4, "tile_n": 1, "threads": 64, "grouping": 26, "minblocks": 5, "algorithm": "medium", "perf": 798.832, "source": "autotuned"},
{"m": 13, "n": 13, "k": 12, "tile_m": 2, "tile_n": 2, "threads": 64, "grouping": 26, "minblocks": 4, "algorithm": "medium", "perf": 819.816, "source": "autotuned"},
{"m": 13, "n": 13, "k": 13, "tile_m": 4, "tile_n": 1, "threads": 64, "grouping": 32, "minblocks": 6, "algorithm": "medium", "perf": 808.211, "source": "autotuned"},
{"m": 13, "n": 13, "k": 14, "tile_m": 2, "tile_n": 2, "threads": 96, "grouping": 32, "minblocks": 10, "algorithm": "medium", "perf": 828.516, "source": "autotuned"},
{"m": 13, "n": 13, "k": 16, "tile_m": 2, "tile_n": 2, "threads": 64, "grouping": 32, "minblocks": 7, "algorithm": "medium", "perf": 829.325, "source": "autotuned"},
{"m": 13, "n": 13, "k": 24, "tile_m": 1, "tile_n": 2, "threads": 128, "grouping": 5, "minblocks": 4, "algorithm": "medium", "perf": 846.028, "source": "autotuned"},
{"m": 13, "n": 13, "k": 25, "tile_m": 2, "tile_n": 1, "threads": 128, "grouping": 5, "minblocks": 5, "algorithm": "medium", "perf": 843.072, "source": "autotuned"},
{"m": 13, "n": 13, "k": 26, "tile_m": 2, "tile_n": 1, "threads": 128, "grouping": 4, "minblocks": 1, "algorithm": "medium", "perf": 847.219, "source": "autotuned"},
{"m": 13, "n": 13, "k": 28, "tile_m": 2, "tile_n": 1, "threads": 128, "grouping": 4, "minblocks": 7, "algorithm": "medium", "perf": 855.86, "source": "autotuned"},
{"m": 13, "n": 13, "k": 32, "tile_m": 2, "tile_n": 1, "threads": 160, "grouping": 5, "minblocks": 2, "algorithm": "medium", "perf": 869.632, "source": "autotuned"},
{"m": 13, "n": 13, "k": 45, "tile_m": 2, "tile_n": 1, "threads": 128, "grouping": 3, "minblocks": 3, "algorithm": "medium", "perf": 862.482, "source": "autotuned"},
{"m": 13, "n": 14, "k": 13, "tile_m": 2, "tile_n": 2, "threads": 64, "grouping": 26, "minblocks": 3, "algorithm": "medium", "perf": 818.092, "source": "autotuned"},
{"m": 13, "n": 14, "k": 14, "tile_m": 1, "tile_n": 2, "threads": 96, "grouping": 32, "minblocks": 6, "algorithm": "medium", "perf": 824.853, "source": "autotuned"},
{"m": 13, "n": 14, "k": 25, "tile_m": 1, "tile_n": 2, "threads": 128, "grouping": 6, "minblocks": 1, "algorithm": "medium", "perf": 867.323, "source": "autotuned"},
{"m": 13, "n": 14, "k": 26, "tile_m": 1, "tile_n": 2, "threads": 128, "grouping": 5, "minblocks": 7, "algorithm": "medium", "perf": 875.867, "source": "autotuned"},
{"m": 13, "n": 14, "k": 32, "tile_m": 2, "tile_n": 2, "w": 16, "v": 14, "threads": 64, "grouping": 16, "minblocks": 4, "algorithm": "largeDB2", "perf": 894.079, "source": "autotuned"},
{"m": 13, "n": 16, "k": 5, "tile_m": 4, "tile_n": 2, "threads": 32, "grouping": 17, "minblocks": 14, "algorithm": "medium", "perf": 721.863, "source": "autotuned"},
{"m": 13, "n": 16, "k": 13, "tile_m": 2, "tile_n": 2, "threads": 64, "grouping": 26, "minblocks": 1, "algorithm": "medium", "perf": 866.035, "source": "autotuned"},
{"m": 13, "n": 16, "k": 16, "tile_m": 4, "tile_n": 1, "threads": 96, "grouping": 4, "minblocks": 13, "algorithm": "medium", "perf": 894.502, "source": "autotuned"},
{"m": 13, "n": 16, "k": 32, "tile_m": 4, "tile_n": 1, "w": 16, "v": 16, "threads": 64, "grouping": 16, "minblocks": 4, "algorithm": "largeDB2", "perf": 942.893, "source": "autotuned"},
{"m": 13, "n": 24, "k": 5, "tile_m": 2, "tile_n": 3, "threads": 64, "grouping": 26, "minblocks": 10, "algorithm": "medium", "perf": 834.262, "source": "autotuned"},
{"m": 13, "n": 24, "k": 13, "tile_m": 4, "tile_n": 1, "threads": 96, "grouping": 5, "minblocks": 12, "algorithm": "medium", "perf": 976.165, "source": "autotuned"},
{"m": 13, "n": 24, "k": 24, "tile_m": 3, "tile_n": 2, "w": 12, "v": 20, "threads": 64, "grouping": 16, "minblocks": 1, "algorithm": "largeDB2", "perf": 1079.09, "source": "autotuned"},
{"m": 13, "n": 24, "k": 26, "tile_m": 2, "tile_n": 3, "w": 10, "v": 22, "threads": 64, "grouping": 16, "minblocks": 8, "algorithm": "largeDB2", "perf": 1075.11, "source": "autotuned"},
{"m": 13, "n": 24, "k": 32, "tile_m": 2, "tile_n": 3, "w": 16, "v": 22, "threads": 64, "grouping": 16, "minblocks": 4, "algorithm": "largeDB2", "perf": 1104.28, "source": "autotuned"},
{"m": 13, "n": 25, "k": 4, "tile_m": 2, "tile_n": 3, "threads": 64, "grouping": 25, "minblocks": 9, "algorithm": "medium", "perf": 775.128, "source": "autotuned"},
{"m": 13, "n": 25, "k": 5, "tile_m": 2, "tile_n": 3, "threads": 64, "grouping": 27, "minblocks": 5, "algorithm": "medium", "perf": 818.248, "source": "autotuned"},
{"m": 13, "n": 25, "k": 7, "tile_m": 2, "tile_n": 2, "threads": 96, "grouping": 32, "minblocks": 10, "algorithm": "medium", "perf": 895.315, "source": "autotuned"},
{"m": 13, "n": 25, "k": 9, "tile_m": 2, "tile_n": 2, "threads": 96, "grouping": 32, "minblocks": 9, "algorithm": "medium", "perf": 937.417, "source": "autotuned"},
{"m": 13, "n": 25, "k": 13, "tile_m": 1, "tile_n": 3, "threads": 128, "grouping": 7, "minblocks": 9, "algorithm": "medium", "perf": 972.388, "source": "autotuned"},
{"m": 13, "n": 25, "k": 14, "tile_m": 1, "tile_n": 4, "threads": 96, "grouping": 32, "minblocks": 9, "algorithm": "medium", "perf": 993.182, "source": "autotuned"},
{"m": 13, "n": 25, "k": 25, "tile_m": 2, "tile_n": 3, "w": 10, "v": 14, "threads": 64, "grouping": 16, "minblocks": 2, "algorithm": "largeDB2", "perf": 1071.67, "source": "autotuned"},
{"m": 13, "n": 25, "k": 26, "tile_m": 2, "tile_n": 3, "w": 10, "v": 22, "threads": 64, "grouping": 16, "minblocks": 8, "algorithm": "largeDB2", "perf": 1087.2, "source": "autotuned"},
{"m": 13, "n": 25, "k": 28, "tile_m": 2, "tile_n": 3, "w": 14, "v": 14, "threads": 64, "grouping": 16, "minblocks": 4, "algorithm": "largeDB2", "perf": 1098.76, "source": "autotuned"},
{"m": 13, "n": 25, "k": 32, "tile_m": 2, "tile_n": 3, "w": 16, "v": 20, "threads": 64, "grouping": 16, "minblocks": 8, "algorithm": "largeDB2", "perf": 1113.24, "source": "autotuned"},
{"m": 13, "n": 25, "k": 45, "tile_m": 2, "tile_n": 3, "w": 10, "v": 14, "threads": 64, "grouping": 16, "minblocks": 1, "algorithm": "largeDB2", "perf": 1134.6, "source": "autotuned"},
{"m": 13, "n": 26, "k": 4, "tile_m": 2, "tile_n": 3, "threads": 64, "grouping": 24, "minblocks": 3, "algorithm": "medium", "perf": 796.636, "source": "autotuned"},
{"m": 13, "n": 26, "k": 5, "tile_m": 2, "tile_n": 3, "threads": 64, "grouping": 26, "minblocks": 10, "algorithm": "medium", "perf": 799.952, "source": "autotuned"},
{"m": 13, "n": 26, "k": 7, "tile_m": 2, "tile_n": 2, "threads": 96, "grouping": 32, "minblocks": 9, "algorithm": "medium", "perf": 916.63, "source": "autotuned"},
{"m": 13, "n": 26, "k": 9, "tile_m": 1, "tile_n": 3, "threads": 128, "grouping": 32, "minblocks": 12, "algorithm": "medium", "perf": 954.576, "source": "autotuned"},
{"m": 13, "n": 26, "k": 12, "tile_m": 1, "tile_n": 3, "threads": 160, "grouping": 6, "minblocks": 9, "algorithm": "medium", "perf": 999.327, "source": "autotuned"},
{"m": 13, "n": 26, "k": 13, "tile_m": 1, "tile_n": 4, "threads": 96, "grouping": 32, "minblocks": 10, "algorithm": "medium", "perf": 1007.42, "source": "autotuned"},
{"m": 13, "n": 26, "k": 14, "tile_m": 1, "tile_n": 3, "threads": 128, "grouping": 5, "minblocks": 10, "algorithm": "medium", "perf": 1015.55, "source": "autotuned"},
{"m": 13, "n": 26, "k": 24, "tile_m": 2, "tile_n": 2, "w": 8, "v": 26, "threads": 96, "grouping": 16, "minblocks": 1, "algorithm": "largeDB2", "perf": 1094.14, "source": "autotuned"},
{"m": 13, "n": 26, "k": 25, "tile_m": 1, "tile_n": 3, "threads": 128, "grouping": 4, "minblocks": 4, "algorithm": "medium", "perf": 1087.67, "source": "autotuned"},
{"m": 13, "n": 26, "k": 26, "tile_m": 2, "tile_n": 2, "w": 10, "v": 10, "threads": 96, "grouping": 16, "minblocks": 1, "algorithm": "largeDB2", "perf": 1091.97, "source": "autotuned"},
{"m": 13, "n": 26, "k": 28, "tile_m": 2, "tile_n": 2, "w": 14, "v": 26, "threads": 96, "grouping": 16, "minblocks": 1, "algorithm": "largeDB2", "perf": 1110.06, "source": "autotuned"},
{"m": 13, "n": 26, "k": 32, "tile_m": 2, "tile_n": 2, "w": 16, "v": 26, "threads": 96, "grouping": 16, "minblocks": 1, "algorithm": "largeDB2", "perf": 1133.28, "source": "autotuned"},
{"m": 13, "n": 26, "k": 45, "tile_m": 2, "tile_n": 3, "w": 12, "v": 26, "threads": 64, "grouping": 16, "minblocks": 8, "algorithm": "largeDB2", "perf": 1150.11, "source": "autotuned"},
{"m": 13, "n": 28, "k": 4, "tile_m": 4, "tile_n": 4, "threads": 64, "grouping": 24, "minblocks": 12, "algorithm": "medium", "perf": 824.545, "source": "autotuned"},
{"m": 13, "n": 28, "k": 5, "tile_m": 1, "tile_n": 4, "threads": 96, "grouping": 9, "minblocks": 14, "algorithm": "medium", "perf": 835.315, "source": "autotuned"},
{"m": 13, "n": 28, "k": 7, "tile_m": 1, "tile_n": 4, "threads": 96, "grouping": 32, "minblocks": 9, "algorithm": "medium", "perf": 942.428, "source": "autotuned"},
{"m": 13, "n": 28, "k": 9, "tile_m": 1, "tile_n": 4, "threads": 128, "grouping": 29, "minblocks": 10, "algorithm": "medium", "perf": 986.164, "source": "autotuned"},
{"m": 13, "n": 28, "k": 13, "tile_m": 1, "tile_n": 4, "threads": 96, "grouping": 32, "minblocks": 9, "algorithm": "medium", "perf": 1028.12, "source": "autotuned"},
{"m": 13, "n": 28, "k": 25, "tile_m": 4, "tile_n": 2, "threads": 64, "grouping": 4, "minblocks": 2, "algorithm": "medium", "perf": 1096.2, "source": "autotuned"},
{"m": 13, "n": 28, "k": 26, "tile_m": 4, "tile_n": 2, "threads": 64, "grouping": 4, "minblocks": 2, "algorithm": "medium", "perf": 1109.32, "source": "autotuned"},
{"m": 13, "n": 28, "k": 28, "tile_m": 2, "tile_n": 4, "w": 14, "v": 26, "threads": 64, "grouping": 16, "minblocks": 2, "algorithm": "largeDB2", "perf": 1123.07, "source": "autotuned"},
{"m": 13, "n": 28, "k": 32, "tile_m": 4, "tile_n": 2, "threads": 64, "grouping": 30, "minblocks": 1, "algorithm": "medium", "perf": 1134.83, "source": "autotuned"},
{"m": 13, "n": 28, "k": 45, "tile_m": 4, "tile_n": 2, "w": 14, "v": 20, "threads": 64, "grouping": 16, "minblocks": 1, "algorithm": "largeDB2", "perf": 1175.77, "source": "autotuned"},
{"m": 13, "n": 32, "k": 4, "tile_m": 2, "tile_n": 4, "threads": 64, "grouping": 26, "minblocks": 6, "algorithm": "medium", "perf": 873.764, "source": "autotuned"},
{"m": 13, "n": 32, "k": 5, "tile_m": 2, "tile_n": 4, "threads": 64, "grouping": 32, "minblocks": 6, "algorithm": "medium", "perf": 870.626, "source": "autotuned"},
{"m": 13, "n": 32, "k": 7, "tile_m": 1, "tile_n": 5, "threads": 96, "grouping": 32, "minblocks": 9, "algorithm": "medium", "perf": 981.108, "source": "autotuned"},
{"m": 13, "n": 32, "k": 9, "tile_m": 1, "tile_n": 5, "threads": 96, "grouping": 32, "minblocks": 9, "algorithm": "medium", "perf": 1008.75, "source": "autotuned"},
{"m": 13, "n": 32, "k": 12, "tile_m": 4, "tile_n": 2, "w": 6, "v": 20, "threads": 64, "grouping": 16, "minblocks": 1, "algorithm": "largeDB2", "perf": 1074.65, "source": "autotuned"},
{"m": 13, "n": 32, "k": 13, "tile_m": 4, "tile_n": 1, "threads": 128, "grouping": 5, "minblocks": 9, "algorithm": "medium", "perf": 1073.99, "source": "autotuned"},
{"m": 13, "n": 32, "k": 14, "tile_m": 4, "tile_n": 1, "threads": 128, "grouping": 5, "minblocks": 9, "algorithm": "medium", "perf": 1087.04, "source": "autotuned"},
{"m": 13, "n": 32, "k": 16, "tile_m": 4, "tile_n": 1, "threads": 128, "grouping": 4, "minblocks": 8, "algorithm": "medium", "perf": 1122.91, "source": "autotuned"},
{"m": 13, "n": 32, "k": 24, "tile_m": 4, "tile_n": 2, "w": 12, "v": 28, "threads": 64, "grouping": 16, "minblocks": 1, "algorithm": "largeDB2", "perf": 1168.27, "source": "autotuned"},
{"m": 13, "n": 32, "k": 25, "tile_m": 4, "tile_n": 2, "threads": 64, "grouping": 4, "minblocks": 2, "algorithm": "medium", "perf": 1155.19, "source": "autotuned"},
{"m": 13, "n": 32, "k": 26, "tile_m": 4, "tile_n": 2, "threads": 64, "grouping": 4, "minblocks": 4, "algorithm": "medium", "perf": 1166.22, "source": "autotuned"},
{"m": 13, "n": 32, "k": 28, "tile_m": 4, "tile_n": 2, "threads": 64, "grouping": 3, "minblocks": 1, "algorithm": "medium", "perf": 1176.77, "source": "autotuned"},
{"m": 13, "n": 32, "k": 32, "tile_m": 2, "tile_n": 2, "w": 12, "v": 14, "threads": 128, "grouping": 16, "minblocks": 1, "algorithm": "largeDB2", "perf": 1205.05, "source": "autotuned"},
{"m": 13, "n": 32, "k": 45, "tile_m": 2, "tile_n": 2, "w": 12, "v": 32, "threads": 128, "grouping": 16, "minblocks": 1, "algorithm": "largeDB2", "perf": 1231.88, "source": "autotuned"},
{"m": 13, "n": 45, "k": 4, "tile_m": 2, "tile_n": 5, "threads": 64, "grouping": 32, "minblocks": 5, "algorithm": "medium", "perf": 879.247, "source": "autotuned"},
{"m": 13, "n": 45, "k": 5, "tile_m": 1, "tile_n": 5, "threads": 128, "grouping": 32, "minblocks": 9, "algorithm": "medium", "perf": 909.587, "source": "autotuned"},
{"m": 13, "n": 45, "k": 7, "tile_m": 1, "tile_n": 5, "threads": 128, "grouping": 32, "minblocks": 9, "algorithm": "medium", "perf": 1015.1, "source": "autotuned"},
{"m": 13, "n": 45, "k": 9, "tile_m": 1, "tile_n": 5, "threads": 128, "grouping": 32, "minblocks": 9, "algorithm": "medium", "perf": 1091.53, "source": "autotuned"},
{"m": 13, "n": 45, "k": 13, "tile_m": 1, "tile_n": 5, "threads": 192, "grouping": 29, "minblocks": 5, "algorithm": "medium", "perf": 1152.46, "source": "autotuned"},
{"m": 13, "n": 45, "k": 25, "tile_m": 4, "tile_n": 3, "threads": 64, "grouping": 29, "minblocks": 4, "algorithm": "medium", "perf": 1240.6, "source": "autotuned"},
{"m": 13, "n": 45, "k": 26, "tile_m": 4, "tile_n": 3, "threads": 64, "grouping": 4, "minblocks": 4, "algorithm": "medium", "perf": 1247.15, "source": "autotuned"},
{"m": 13, "n": 45, "k": 28, "tile_m": 2, "tile_n": 4, "w": 14, "v": 20, "threads": 96, "grouping": 16, "minblocks": 4, "algorithm": "largeDB2", "perf": 1271.38, "source": "autotuned"},
{"m": 13, "n": 45, "k": 32, "tile_m": 4, "tile_n": 3, "w": 8, "v": 12, "threads": 64, "grouping": 16, "minblocks": 4, "algorithm": "largeDB2", "perf": 1291.85, "source": "autotuned"},
{"m": 13, "n": 45, "k": 45, "tile_m": 2, "tile_n": 5, "w": 12, "v": 26, "threads": 64, "grouping": 16, "minblocks": 4, "algorithm": "largeDB2", "perf": 1331.96, "source": "autotuned"},
{"m": 14, "n": 13, "k": 13, "tile_m": 2, "tile_n": 2, "threads": 64, "grouping": 26, "minblocks": 4, "algorithm": "medium", "perf": 819.111, "source": "autotuned"},
{"m": 14, "n": 13, "k": 14, "tile_m": 1, "tile_n": 4, "threads": 64, "grouping": 32, "minblocks": 3, "algorithm": "medium", "perf": 829.012, "source": "autotuned"},
{"m": 14, "n": 13, "k": 25, "tile_m": 2, "tile_n": 1, "threads": 128, "grouping": 5, "minblocks": 7, "algorithm": "medium", "perf": 861.359, "source": "autotuned"},
{"m": 14, "n": 13, "k": 26, "tile_m": 1, "tile_n": 2, "threads": 128, "grouping": 5, "minblocks": 7, "algorithm": "medium", "perf": 876.462, "source": "autotuned"},
{"m": 14, "n": 13, "k": 32, "tile_m": 1, "tile_n": 2, "threads": 128, "grouping": 4, "minblocks": 6, "algorithm": "medium", "perf": 900.065, "source": "autotuned"},
{"m": 14, "n": 14, "k": 13, "tile_m": 1, "tile_n": 4, "threads": 96, "grouping": 32, "minblocks": 9, "algorithm": "medium", "perf": 876.026, "source": "autotuned"},
{"m": 14, "n": 14, "k": 14, "tile_m": 2, "tile_n": 2, "threads": 64, "grouping": 26, "minblocks": 7, "algorithm": "medium", "perf": 878.284, "source": "autotuned"},
{"m": 14, "n": 14, "k": 16, "tile_m": 1, "tile_n": 2, "threads": 128, "grouping": 32, "minblocks": 4, "algorithm": "medium", "perf": 902.555, "source": "autotuned"},
{"m": 14, "n": 14, "k": 25, "tile_m": 1, "tile_n": 2, "threads": 128, "grouping": 6, "minblocks": 3, "algorithm": "medium", "perf": 915.718, "source": "autotuned"},
{"m": 14, "n": 14, "k": 26, "tile_m": 1, "tile_n": 2, "threads": 128, "grouping": 5, "minblocks": 5, "algorithm": "medium", "perf": 924.538, "source": "autotuned"},
{"m": 14, "n": 14, "k": 29, "tile_m": 1, "tile_n": 2, "threads": 128, "grouping": 4, "minblocks": 3, "algorithm": "medium", "perf": 924.968, "source": "autotuned"},
{"m": 14, "n": 14, "k": 32, "tile_m": 1, "tile_n": 2, "threads": 128, "grouping": 4, "minblocks": 5, "algorithm": "medium", "perf": 948.827, "source": "autotuned"},
{"m": 14, "n": 16, "k": 14, "tile_m": 1, "tile_n": 4, "threads": 64, "grouping": 29, "minblocks": 1, "algorithm": "medium", "perf": 920.926, "source": "autotuned"},
{"m": 14, "n": 16, "k": 16, "tile_m": 1, "tile_n": 4, "threads": 64, "grouping": 24, "minblocks": 11, "algorithm": "medium", "perf": 934.112, "source": "autotuned"},
{"m": 14, "n": 16, "k": 29, "tile_m": 1, "tile_n": 2, "threads": 128, "grouping": 4, "minblocks": 5, "algorithm": "medium", "perf": 985.695, "source": "autotuned"},
{"m": 14, "n": 25, "k": 13, "tile_m": 1, "tile_n": 3, "threads": 128, "grouping": 32, "minblocks": 9, "algorithm": "medium", "perf": 1036.53, "source": "autotuned"},
{"m": 14, "n": 25, "k": 14, "tile_m": 1, "tile_n": 3, "threads": 128, "grouping": 6, "minblocks": 10, "algorithm": "medium", "perf": 1064.78, "source": "autotuned"},
{"m": 14, "n": 25, "k": 25, "tile_m": 1, "tile_n": 2, "threads": 192, "grouping": 4, "minblocks": 5, "algorithm": "medium", "perf": 1135.93, "source": "autotuned"},
{"m": 14, "n": 25, "k": 26, "tile_m": 1, "tile_n": 2, "threads": 192, "grouping": 4, "minblocks": 1, "algorithm": "medium", "perf": 1146.21, "source": "autotuned"},
{"m": 14, "n": 25, "k": 32, "tile_m": 1, "tile_n": 2, "threads": 224, "grouping": 3, "minblocks": 2, "algorithm": "medium", "perf": 1180.89, "source": "autotuned"},
{"m": 14, "n": 26, "k": 13, "tile_m": 1, "tile_n": 3, "threads": 128, "grouping": 6, "minblocks": 10, "algorithm": "medium", "perf": 1059.97, "source": "autotuned"},
{"m": 14, "n": 26, "k": 14, "tile_m": 1, "tile_n": 3, "threads": 128, "grouping": 4, "minblocks": 10, "algorithm": "medium", "perf": 1080.3, "source": "autotuned"},
{"m": 14, "n": 26, "k": 25, "tile_m": 1, "tile_n": 3, "threads": 128, "grouping": 3, "minblocks": 2, "algorithm": "medium", "perf": 1164.2, "source": "autotuned"},
{"m": 14, "n": 26, "k": 26, "tile_m": 1, "tile_n": 2, "threads": 192, "grouping": 4, "minblocks": 5, "algorithm": "medium", "perf": 1170.35, "source": "autotuned"},
{"m": 14, "n": 26, "k": 32, "tile_m": 1, "tile_n": 2, "threads": 224, "grouping": 4, "minblocks": 4, "algorithm": "medium", "perf": 1204.18, "source": "autotuned"},
{"m": 14, "n": 29, "k": 14, "tile_m": 1, "tile_n": 5, "threads": 128, "grouping": 5, "minblocks": 8, "algorithm": "medium", "perf": 1099.41, "source": "autotuned"},
{"m": 14, "n": 29, "k": 16, "tile_m": 1, "tile_n": 5, "threads": 128, "grouping": 4, "minblocks": 7, "algorithm": "medium", "perf": 1136.55, "source": "autotuned"},
{"m": 14, "n": 29, "k": 29, "tile_m": 1, "tile_n": 3, "threads": 160, "grouping": 4, "minblocks": 2, "algorithm": "medium", "perf": 1205.08, "source": "autotuned"},
{"m": 14, "n": 29, "k": 32, "tile_m": 1, "tile_n": 3, "threads": 160, "grouping": 4, "minblocks": 3, "algorithm": "medium", "perf": 1227.39, "source": "autotuned"},
{"m": 14, "n": 32, "k": 13, "tile_m": 1, "tile_n": 4, "threads": 128, "grouping": 4, "minblocks": 9, "algorithm": "medium", "perf": 1144.56, "source": "autotuned"},
{"m": 14, "n": 32, "k": 14, "tile_m": 1, "tile_n": 4, "threads": 128, "grouping": 5, "minblocks": 8, "algorithm": "medium", "perf": 1157.34, "source": "autotuned"},
{"m": 14, "n": 32, "k": 25, "tile_m": 1, "tile_n": 3, "threads": 224, "grouping": 4, "minblocks": 5, "algorithm": "medium", "perf": 1247.65, "source": "autotuned"},
{"m": 14, "n": 32, "k": 26, "tile_m": 1, "tile_n": 2, "threads": 224, "grouping": 4, "minblocks": 4, "algorithm": "medium", "perf": 1256.51, "source": "autotuned"},
{"m": 14, "n": 32, "k": 29, "tile_m": 1, "tile_n": 3, "threads": 160, "grouping": 3, "minblocks": 4, "algorithm": "medium", "perf": 1258.33, "source": "autotuned"},
{"m": 14, "n": 32, "k": 32, "tile_m": 1, "tile_n": 3, "threads": 224, "grouping": 3, "minblocks": 4, "algorithm": "medium", "perf": 1281.96, "source": "autotuned"},
{"m": 15, "n": 4, "k": 4, "tile_m": 2, "tile_n": 1, "threads": 32, "grouping": 16, "minblocks": 21, "algorithm": "medium", "perf": 349.797, "source": "autotuned"},
{"m": 15, "n": 4, "k": 10, "tile_m": 2, "tile_n": 1, "threads": 32, "grouping": 13, "minblocks": 5, "algorithm": "medium", "perf": 430.134, "source": "autotuned"},
{"m": 15, "n": 4, "k": 15, "tile_m": 2, "tile_n": 1, "threads": 64, "grouping": 6, "minblocks": 11, "algorithm": "medium", "perf": 443.27, "source": "autotuned"},
{"m": 15, "n": 10, "k": 4, "tile_m": 5, "tile_n": 1, "threads": 32, "grouping": 12, "minblocks": 22, "algorithm": "medium", "perf": 594.569, "source": "autotuned"},
{"m": 15, "n": 10, "k": 10, "tile_m": 2, "tile_n": 2, "threads": 64, "grouping": 22, "minblocks": 6, "algorithm": "medium", "perf": 728.427, "source": "autotuned"},
{"m": 15, "n": 10, "k": 15, "tile_m": 2, "tile_n": 2, "threads": 64, "grouping": 29, "minblocks": 9, "algorithm": "medium", "perf": 747.245, "source": "autotuned"},
{"m": 15, "n": 15, "k": 4, "tile_m": 2, "tile_n": 2, "threads": 64, "grouping": 19, "minblocks": 6, "algorithm": "medium", "perf": 738.168, "source": "autotuned"},
{"m": 15, "n": 15, "k": 10, "tile_m": 2, "tile_n": 2, "threads": 64, "grouping": 29, "minblocks": 10, "algorithm": "medium", "perf": 904.696, "source": "autotuned"},
{"m": 15, "n": 15, "k": 15, "tile_m": 2, "tile_n": 2, "threads": 64, "grouping": 32, "minblocks": 2, "algorithm": "medium", "perf": 928.082, "source": "autotuned"},
{"m": 16, "n": 5, "k": 5, "tile_m": 1, "tile_n": 3, "threads": 32, "grouping": 12, "minblocks": 23, "algorithm": "medium", "perf": 501.288, "source": "autotuned"},
{"m": 16, "n": 5, "k": 13, "tile_m": 1, "tile_n": 3, "threads": 64, "grouping": 4, "minblocks": 19, "algorithm": "medium", "perf": 503.261, "source": "autotuned"},
{"m": 16, "n": 5, "k": 16, "tile_m": 1, "tile_n": 3, "threads": 96, "grouping": 29, "minblocks": 11, "algorithm": "medium", "perf": 524.682, "source": "autotuned"},
{"m": 16, "n": 5, "k": 32, "tile_m": 1, "tile_n": 1, "threads": 128, "grouping": 32, "minblocks": 3, "algorithm": "medium", "perf": 534.391, "source": "autotuned"},
{"m": 16, "n": 12, "k": 12, "tile_m": 1, "tile_n": 3, "threads": 64, "grouping": 26, "minblocks": 15, "algorithm": "medium", "perf": 854.169, "source": "autotuned"},
{"m": 16, "n": 12, "k": 16, "tile_m": 1, "tile_n": 2, "threads": 96, "grouping": 32, "minblocks": 11, "algorithm": "medium", "perf": 887.754, "source": "autotuned"},
{"m": 16, "n": 12, "k": 32, "tile_m": 2, "tile_n": 1, "threads": 160, "grouping": 5, "minblocks": 3, "algorithm": "medium", "perf": 925.265, "source": "autotuned"},
{"m": 16, "n": 13, "k": 5, "tile_m": 2, "tile_n": 4, "threads": 32, "grouping": 16, "minblocks": 4, "algorithm": "medium", "perf": 723.746, "source": "autotuned"},
{"m": 16, "n": 13, "k": 13, "tile_m": 2, "tile_n": 2, "threads": 64, "grouping": 26, "minblocks": 9, "algorithm": "medium", "perf": 871.757, "source": "autotuned"},
{"m": 16, "n": 13, "k": 16, "tile_m": 2, "tile_n": 2, "threads": 64, "grouping": 32, "minblocks": 1, "algorithm": "medium", "perf": 897.477, "source": "autotuned"},
{"m": 16, "n": 13, "k": 32, "tile_m": 1, "tile_n": 2, "threads": 160, "grouping": 4, "minblocks": 1, "algorithm": "medium", "perf": 953.971, "source": "autotuned"},
{"m": 16, "n": 14, "k": 14, "tile_m": 2, "tile_n": 2, "threads": 64, "grouping": 32, "minblocks": 12, "algorithm": "medium", "perf": 927.004, "source": "autotuned"},
{"m": 16, "n": 14, "k": 16, "tile_m": 1, "tile_n": 4, "threads": 96, "grouping": 5, "minblocks": 11, "algorithm": "medium", "perf": 936.063, "source": "autotuned"},
{"m": 16, "n": 14, "k": 29, "tile_m": 1, "tile_n": 2, "threads": 128, "grouping": 4, "minblocks": 3, "algorithm": "medium", "perf": 985.795, "source": "autotuned"},
{"m": 16, "n": 16, "k": 5, "tile_m": 2, "tile_n": 5, "threads": 32, "grouping": 19, "minblocks": 14, "algorithm": "medium", "perf": 857.219, "source": "autotuned"},
{"m": 16, "n": 16, "k": 12, "tile_m": 2, "tile_n": 2, "threads": 64, "grouping": 32, "minblocks": 3, "algorithm": "medium", "perf": 1009.93, "source": "autotuned"},
{"m": 16, "n": 16, "k": 13, "tile_m": 2, "tile_n": 2, "threads": 64, "grouping": 26, "minblocks": 9, "algorithm": "medium", "perf": 1001.92, "source": "autotuned"},
{"m": 16, "n": 16, "k": 14, "tile_m": 2, "tile_n": 2, "threads": 64, "grouping": 32, "minblocks": 12, "algorithm": "medium", "perf": 1018.98, "source": "autotuned"},
{"m": 16, "n": 16, "k": 16, "tile_m": 2, "tile_n": 2, "threads": 64, "grouping": 29, "minblocks": 8, "algorithm": "small", "perf": 1035.54, "source": "autotuned"},
{"m": 16, "n": 16, "k": 29, "tile_m": 1, "tile_n": 2, "threads": 160, "grouping": 4, "minblocks": 2, "algorithm": "medium", "perf": 1062.17, "source": "autotuned"},
{"m": 16, "n": 16, "k": 32, "tile_m": 1, "tile_n": 2, "threads": 192, "grouping": 4, "minblocks": 3, "algorithm": "medium", "perf": 1086.81, "source": "autotuned"},
{"m": 16, "n": 16, "k": 55, "tile_m": 1, "tile_n": 2, "threads": 128, "grouping": 3, "minblocks": 1, "algorithm": "medium", "perf": 1104.86, "source": "autotuned"},
{"m": 16, "n": 29, "k": 14, "tile_m": 1, "tile_n": 5, "threads": 128, "grouping": 4, "minblocks": 9, "algorithm": "medium", "perf": 1221.28, "source": "autotuned"},
{"m": 16, "n": 29, "k": 16, "tile_m": 1, "tile_n": 4, "threads": 128, "grouping": 4, "minblocks": 7, "algorithm": "medium", "perf": 1236.07, "source": "autotuned"},
{"m": 16, "n": 29, "k": 29, "tile_m": 1, "tile_n": 3, "threads": 160, "grouping": 4, "minblocks": 4, "algorithm": "medium", "perf": 1318.25, "source": "autotuned"},
{"m": 16, "n": 29, "k": 55, "tile_m": 1, "tile_n": 3, "w": 16, "v": 16, "threads": 160, "grouping": 16, "minblocks": 1, "algorithm": "largeDB2", "perf": 1388.25, "source": "autotuned"},
{"m": 16, "n": 32, "k": 5, "tile_m": 1, "tile_n": 6, "threads": 96, "grouping": 32, "minblocks": 9, "algorithm": "medium", "perf": 1015.49, "source": "autotuned"},
{"m": 16, "n": 32, "k": 12, "tile_m": 1, "tile_n": 4, "threads": 128, "grouping": 4, "minblocks": 8, "algorithm": "medium", "perf": 1231.07, "source": "autotuned"},
{"m": 16, "n": 32, "k": 13, "tile_m": 1, "tile_n": 4, "threads": 128, "grouping": 5, "minblocks": 8, "algorithm": "medium", "perf": 1239.79, "source": "autotuned"},
{"m": 16, "n": 32, "k": 16, "tile_m": 1, "tile_n": 4, "threads": 160, "grouping": 4, "minblocks": 7, "algorithm": "medium", "perf": 1304.45, "source": "autotuned"},
{"m": 16, "n": 32, "k": 32, "tile_m": 1, "tile_n": 3, "threads": 192, "grouping": 3, "minblocks": 3, "algorithm": "medium", "perf": 1401.94, "source": "autotuned"},
{"m": 16, "n": 55, "k": 16, "tile_m": 1, "tile_n": 5, "threads": 192, "grouping": 4, "minblocks": 5, "algorithm": "medium", "perf": 1477.07, "source": "autotuned"},
{"m": 16, "n": 55, "k": 29, "tile_m": 1, "tile_n": 5, "threads": 192, "grouping": 32, "minblocks": 2, "algorithm": "medium", "perf": 1548.78, "source": "autotuned"},
{"m": 16, "n": 55, "k": 55, "tile_m": 2, "tile_n": 2, "w": 14, "v": 40, "threads": 224, "grouping": 16, "minblocks": 1, "algorithm": "largeDB2", "perf": 1648.17, "source": "autotuned"},
{"m": 17, "n": 17, "k": 17, "tile_m": 1, "tile_n": 6, "threads": 128, "grouping": 6, "minblocks": 9, "algorithm": "medium", "perf": 1025.78, "source": "autotuned"},
{"m": 18, "n": 18, "k": 18, "tile_m": 1, "tile_n": 4, "threads": 128, "grouping": 4, "minblocks": 8, "algorithm": "medium", "perf": 1117.66, "source": "autotuned"},
{"m": 19, "n": 19, "k": 19, "tile_m": 1, "tile_n": 4, "threads": 160, "grouping": 4, "minblocks": 7, "algorithm": "medium", "perf": 1155.59, "source": "autotuned"},
{"m": 20, "n": 11, "k": 20, "tile_m": 1, "tile_n": 2, "w": 10, "v": 8, "threads": 128, "grouping": 16, "minblocks": 1, "algorithm": "largeDB2", "perf": 904.021, "source": "autotuned"},
{"m": 20, "n": 11, "k": 32, "tile_m": 1, "tile_n": 2, "w": 16, "v": 8, "threads": 128, "grouping": 16, "minblocks": 1, "algorithm": "largeDB2", "perf": 944.417, "source": "autotuned"},
{"m": 20, "n": 12, "k": 20, "tile_m": 1, "tile_n": 2, "w": 10, "v": 4, "threads": 128, "grouping": 16, "minblocks": 4, "algorithm": "largeDB2", "perf": 960.236, "source": "autotuned"},
{"m": 20, "n": 12, "k": 32, "tile_m": 1, "tile_n": 2, "w": 16, "v": 12, "threads": 128, "grouping": 16, "minblocks": 4, "algorithm": "largeDB2", "perf": 1001.05, "source": "autotuned"},
{"m": 20, "n": 20, "k": 20, "tile_m": 1, "tile_n": 4, "threads": 160, "grouping": 4, "minblocks": 7, "algorithm": "medium", "perf": 1246.17, "source": "autotuned"},
{"m": 20, "n": 25, "k": 12, "tile_m": 3, "tile_n": 3, "w": 6, "v": 18, "threads": 64, "grouping": 16, "minblocks": 4, "algorithm": "largeDB2", "perf": 1244.17, "source": "autotuned"},
{"m": 20, "n": 25, "k": 20, "tile_m": 3, "tile_n": 2, "w": 10, "v": 16, "threads": 96, "grouping": 16, "minblocks": 4, "algorithm": "largeDB2", "perf": 1334.34, "source": "autotuned"},
{"m": 20, "n": 25, "k": 25, "tile_m": 3, "tile_n": 3, "w": 10, "v": 22, "threads": 64, "grouping": 16, "minblocks": 8, "algorithm": "largeDB2", "perf": 1361.83, "source": "autotuned"},
{"m": 20, "n": 25, "k": 32, "tile_m": 3, "tile_n": 2, "w": 16, "v": 18, "threads": 96, "grouping": 16, "minblocks": 4, "algorithm": "largeDB2", "perf": 1400.96, "source": "autotuned"},
{"m": 20, "n": 11, "k": 11, "tile_m": 1, "tile_n": 4, "threads": 64, "grouping": 24, "minblocks": 1, "algorithm": "medium", "perf": 849.388, "source": "autotuned"},
{"m": 20, "n": 11, "k": 12, "tile_m": 1, "tile_n": 4, "threads": 64, "grouping": 24, "minblocks": 11, "algorithm": "medium", "perf": 853.531, "source": "autotuned"},
{"m": 20, "n": 11, "k": 25, "tile_m": 1, "tile_n": 2, "threads": 128, "grouping": 4, "minblocks": 4, "algorithm": "medium", "perf": 922.024, "source": "autotuned"},
{"m": 20, "n": 12, "k": 11, "tile_m": 1, "tile_n": 4, "threads": 64, "grouping": 26, "minblocks": 12, "algorithm": "medium", "perf": 897.705, "source": "autotuned"},
{"m": 20, "n": 12, "k": 12, "tile_m": 1, "tile_n": 4, "threads": 64, "grouping": 29, "minblocks": 4, "algorithm": "medium", "perf": 906.799, "source": "autotuned"},
{"m": 20, "n": 12, "k": 25, "tile_m": 1, "tile_n": 2, "threads": 128, "grouping": 4, "minblocks": 2, "algorithm": "medium", "perf": 970.235, "source": "autotuned"},
{"m": 20, "n": 20, "k": 11, "tile_m": 1, "tile_n": 5, "threads": 96, "grouping": 32, "minblocks": 12, "algorithm": "medium", "perf": 1153.6, "source": "autotuned"},
{"m": 20, "n": 20, "k": 12, "tile_m": 1, "tile_n": 5, "threads": 96, "grouping": 4, "minblocks": 12, "algorithm": "medium", "perf": 1160.25, "source": "autotuned"},
{"m": 20, "n": 20, "k": 25, "tile_m": 1, "tile_n": 4, "threads": 160, "grouping": 4, "minblocks": 6, "algorithm": "medium", "perf": 1275.85, "source": "autotuned"},
{"m": 20, "n": 20, "k": 32, "tile_m": 1, "tile_n": 3, "threads": 160, "grouping": 3, "minblocks": 2, "algorithm": "medium", "perf": 1309.2, "source": "autotuned"},
{"m": 20, "n": 25, "k": 11, "tile_m": 3, "tile_n": 2, "threads": 96, "grouping": 29, "minblocks": 10, "algorithm": "medium", "perf": 1187.93, "source": "autotuned"},
{"m": 20, "n": 32, "k": 11, "tile_m": 1, "tile_n": 6, "threads": 128, "grouping": 5, "minblocks": 8, "algorithm": "medium", "perf": 1336.45, "source": "autotuned"},
{"m": 20, "n": 32, "k": 12, "tile_m": 1, "tile_n": 6, "threads": 128, "grouping": 4, "minblocks": 7, "algorithm": "medium", "perf": 1364.22, "source": "autotuned"},
{"m": 20, "n": 32, "k": 20, "tile_m": 1, "tile_n": 4, "threads": 160, "grouping": 4, "minblocks": 5, "algorithm": "medium", "perf": 1493.29, "source": "autotuned"},
{"m": 20, "n": 32, "k": 25, "tile_m": 1, "tile_n": 4, "threads": 160, "grouping": 4, "minblocks": 4, "algorithm": "medium", "perf": 1517.83, "source": "autotuned"},
{"m": 20, "n": 32, "k": 32, "tile_m": 1, "tile_n": 4, "threads": 256, "grouping": 32, "minblocks": 3, "algorithm": "medium", "perf": 1557.15, "source": "autotuned"},
{"m": 21, "n": 21, "k": 21, "tile_m": 3, "tile_n": 3, "threads": 64, "grouping": 5, "minblocks": 4, "algorithm": "medium", "perf": 1259.48, "source": "autotuned"},
{"m": 22, "n": 9, "k": 9, "tile_m": 1, "tile_n": 5, "threads": 64, "grouping": 22, "minblocks": 14, "algorithm": "medium", "perf": 745.394, "source": "autotuned"},
{"m": 22, "n": 9, "k": 22, "tile_m": 1, "tile_n": 2, "threads": 128, "grouping": 4, "minblocks": 4, "algorithm": "medium", "perf": 816.342, "source": "autotuned"},
{"m": 22, "n": 9, "k": 32, "tile_m": 1, "tile_n": 2, "threads": 160, "grouping": 4, "minblocks": 3, "algorithm": "medium", "perf": 851.574, "source": "autotuned"},
{"m": 22, "n": 22, "k": 9, "tile_m": 1, "tile_n": 6, "threads": 96, "grouping": 32, "minblocks": 9, "algorithm": "medium", "perf": 1180.32, "source": "autotuned"},
{"m": 22, "n": 22, "k": 22, "tile_m": 3, "tile_n": 3, "threads": 64, "grouping": 4, "minblocks": 5, "algorithm": "medium", "perf": 1354.56, "source": "autotuned"},
{"m": 22, "n": 22, "k": 32, "tile_m": 3, "tile_n": 3, "threads": 64, "grouping": 3, "minblocks": 2, "algorithm": "medium", "perf": 1423.15, "source": "autotuned"},
{"m": 22, "n": 32, "k": 9, "tile_m": 3, "tile_n": 4, "threads": 64, "grouping": 30, "minblocks": 4, "algorithm": "medium", "perf": 1281.35, "source": "autotuned"},
{"m": 22, "n": 32, "k": 22, "tile_m": 1, "tile_n": 4, "threads": 192, "grouping": 4, "minblocks": 5, "algorithm": "medium", "perf": 1571.65, "source": "autotuned"},
{"m": 22, "n": 32, "k": 32, "tile_m": 3, "tile_n": 4, "w": 16, "v": 20, "threads": 64, "grouping": 16, "minblocks": 1, "algorithm": "largeDB2", "perf": 1641.78, "source": "autotuned"},
{"m": 23, "n": 23, "k": 23, "tile_m": 3, "tile_n": 2, "threads": 96, "grouping": 4, "minblocks": 4, "algorithm": "medium", "perf": 1399.21, "source": "autotuned"},
{"m": 24, "n": 5, "k": 5, "tile_m": 1, "tile_n": 5, "threads": 32, "grouping": 13, "minblocks": 16, "algorithm": "medium", "perf": 537.802, "source": "autotuned"},
{"m": 24, "n": 5, "k": 13, "tile_m": 1, "tile_n": 3, "threads": 96, "grouping": 32, "minblocks": 3, "algorithm": "medium", "perf": 547.371, "source": "autotuned"},
{"m": 24, "n": 5, "k": 24, "tile_m": 1, "tile_n": 1, "threads": 128, "grouping": 32, "minblocks": 7, "algorithm": "medium", "perf": 570.165, "source": "autotuned"},
{"m": 24, "n": 5, "k": 26, "tile_m": 1, "tile_n": 1, "threads": 192, "grouping": 4, "minblocks": 8, "algorithm": "medium", "perf": 574.898, "source": "autotuned"},
{"m": 24, "n": 5, "k": 32, "tile_m": 1, "tile_n": 1, "threads": 192, "grouping": 3, "minblocks": 1, "algorithm": "medium", "perf": 586.204, "source": "autotuned"},
{"m": 24, "n": 13, "k": 5, "tile_m": 3, "tile_n": 2, "threads": 64, "grouping": 26, "minblocks": 9, "algorithm": "medium", "perf": 828.944, "source": "autotuned"},
{"m": 24, "n": 13, "k": 13, "tile_m": 1, "tile_n": 5, "threads": 96, "grouping": 6, "minblocks": 11, "algorithm": "medium", "perf": 980.411, "source": "autotuned"},
{"m": 24, "n": 13, "k": 24, "tile_m": 3, "tile_n": 2, "w": 12, "v": 12, "threads": 64, "grouping": 16, "minblocks": 4, "algorithm": "largeDB2", "perf": 1080.39, "source": "autotuned"},
{"m": 24, "n": 13, "k": 26, "tile_m": 1, "tile_n": 3, "threads": 128, "grouping": 3, "minblocks": 2, "algorithm": "medium", "perf": 1074.3, "source": "autotuned"},
{"m": 24, "n": 13, "k": 32, "tile_m": 1, "tile_n": 3, "threads": 128, "grouping": 3, "minblocks": 2, "algorithm": "medium", "perf": 1107.01, "source": "autotuned"},
{"m": 24, "n": 24, "k": 5, "tile_m": 3, "tile_n": 3, "threads": 64, "grouping": 32, "minblocks": 8, "algorithm": "medium", "perf": 1126.34, "source": "autotuned"},
{"m": 24, "n": 24, "k": 13, "tile_m": 1, "tile_n": 6, "threads": 160, "grouping": 4, "minblocks": 8, "algorithm": "medium", "perf": 1384.19, "source": "autotuned"},
{"m": 24, "n": 24, "k": 24, "tile_m": 1, "tile_n": 3, "threads": 192, "grouping": 3, "minblocks": 5, "algorithm": "medium", "perf": 1523.95, "source": "autotuned"},
{"m": 24, "n": 24, "k": 26, "tile_m": 1, "tile_n": 3, "threads": 224, "grouping": 4, "minblocks": 1, "algorithm": "medium", "perf": 1513.76, "source": "autotuned"},
{"m": 24, "n": 24, "k": 32, "tile_m": 1, "tile_n": 3, "threads": 192, "grouping": 3, "minblocks": 1, "algorithm": "medium", "perf": 1578.31, "source": "autotuned"},
{"m": 24, "n": 26, "k": 5, "tile_m": 1, "tile_n": 6, "threads": 160, "grouping": 12, "minblocks": 8, "algorithm": "medium", "perf": 1069.19, "source": "autotuned"},
{"m": 24, "n": 26, "k": 13, "tile_m": 1, "tile_n": 6, "threads": 128, "grouping": 5, "minblocks": 8, "algorithm": "medium", "perf": 1390.67, "source": "autotuned"},
{"m": 24, "n": 26, "k": 24, "tile_m": 3, "tile_n": 4, "threads": 64, "grouping": 3, "minblocks": 4, "algorithm": "medium", "perf": 1507.26, "source": "autotuned"},
{"m": 24, "n": 26, "k": 26, "tile_m": 1, "tile_n": 3, "threads": 256, "grouping": 32, "minblocks": 3, "algorithm": "medium", "perf": 1507.58, "source": "autotuned"},
{"m": 24, "n": 26, "k": 32, "tile_m": 3, "tile_n": 4, "w": 16, "v": 18, "threads": 64, "grouping": 16, "minblocks": 1, "algorithm": "largeDB2", "perf": 1559.19, "source": "autotuned"},
{"m": 24, "n": 32, "k": 5, "tile_m": 1, "tile_n": 4, "threads": 192, "grouping": 10, "minblocks": 7, "algorithm": "medium", "perf": 1142.19, "source": "autotuned"},
{"m": 24, "n": 32, "k": 13, "tile_m": 3, "tile_n": 4, "threads": 64, "grouping": 24, "minblocks": 5, "algorithm": "medium", "perf": 1488.17, "source": "autotuned"},
{"m": 24, "n": 32, "k": 24, "tile_m": 3, "tile_n": 2, "threads": 128, "grouping": 32, "minblocks": 2, "algorithm": "medium", "perf": 1672.01, "source": "autotuned"},
{"m": 24, "n": 32, "k": 26, "tile_m": 1, "tile_n": 4, "threads": 224, "grouping": 3, "minblocks": 4, "algorithm": "medium", "perf": 1681.57, "source": "autotuned"},
{"m": 24, "n": 32, "k": 32, "tile_m": 3, "tile_n": 5, "w": 8, "v": 32, "threads": 64, "grouping": 16, "minblocks": 2, "algorithm": "largeDB2", "perf": 1724.89, "source": "autotuned"},
{"m": 25, "n": 4, "k": 4, "tile_m": 1, "tile_n": 4, "threads": 32, "grouping": 13, "minblocks": 20, "algorithm": "medium", "perf": 445.461, "source": "autotuned"},
{"m": 25, "n": 4, "k": 5, "tile_m": 1, "tile_n": 5, "threads": 32, "grouping": 12, "minblocks": 11, "algorithm": "medium", "perf": 455.068, "source": "autotuned"},
{"m": 25, "n": 4, "k": 7, "tile_m": 1, "tile_n": 4, "threads": 32, "grouping": 16, "minblocks": 15, "algorithm": "medium", "perf": 457.448, "source": "autotuned"},
{"m": 25, "n": 4, "k": 9, "tile_m": 1, "tile_n": 5, "threads": 64, "grouping": 26, "minblocks": 10, "algorithm": "medium", "perf": 453.929, "source": "autotuned"},
{"m": 25, "n": 4, "k": 13, "tile_m": 1, "tile_n": 2, "threads": 64, "grouping": 4, "minblocks": 12, "algorithm": "medium", "perf": 469.649, "source": "autotuned"},
{"m": 25, "n": 4, "k": 25, "tile_m": 1, "tile_n": 2, "threads": 128, "grouping": 3, "minblocks": 1, "algorithm": "medium", "perf": 480.107, "source": "autotuned"},
{"m": 25, "n": 4, "k": 26, "tile_m": 1, "tile_n": 2, "threads": 128, "grouping": 3, "minblocks": 8, "algorithm": "medium", "perf": 482.817, "source": "autotuned"},
{"m": 25, "n": 4, "k": 28, "tile_m": 1, "tile_n": 2, "threads": 128, "grouping": 3, "minblocks": 1, "algorithm": "medium", "perf": 487.851, "source": "autotuned"},
{"m": 25, "n": 4, "k": 32, "tile_m": 1, "tile_n": 2, "threads": 160, "grouping": 3, "minblocks": 2, "algorithm": "medium", "perf": 489.45, "source": "autotuned"},
{"m": 25, "n": 4, "k": 45, "tile_m": 1, "tile_n": 1, "threads": 192, "grouping": 2, "minblocks": 2, "algorithm": "medium", "perf": 489.336, "source": "autotuned"},
{"m": 25, "n": 5, "k": 4, "tile_m": 1, "tile_n": 6, "threads": 32, "grouping": 13, "minblocks": 24, "algorithm": "medium", "perf": 501.601, "source": "autotuned"},
{"m": 25, "n": 5, "k": 5, "tile_m": 1, "tile_n": 5, "threads": 32, "grouping": 16, "minblocks": 16, "algorithm": "medium", "perf": 516.776, "source": "autotuned"},
{"m": 25, "n": 5, "k": 7, "tile_m": 1, "tile_n": 5, "threads": 64, "grouping": 22, "minblocks": 13, "algorithm": "medium", "perf": 515.647, "source": "autotuned"},
{"m": 25, "n": 5, "k": 9, "tile_m": 1, "tile_n": 6, "threads": 64, "grouping": 26, "minblocks": 15, "algorithm": "medium", "perf": 540.279, "source": "autotuned"},
{"m": 25, "n": 5, "k": 13, "tile_m": 3, "tile_n": 1, "threads": 96, "grouping": 32, "minblocks": 10, "algorithm": "medium", "perf": 542.948, "source": "autotuned"},
{"m": 25, "n": 5, "k": 25, "tile_m": 1, "tile_n": 1, "threads": 128, "grouping": 3, "minblocks": 8, "algorithm": "medium", "perf": 570.33, "source": "autotuned"},
{"m": 25, "n": 5, "k": 26, "tile_m": 1, "tile_n": 1, "threads": 192, "grouping": 4, "minblocks": 4, "algorithm": "medium", "perf": 569.355, "source": "autotuned"},
{"m": 25, "n": 5, "k": 28, "tile_m": 1, "tile_n": 1, "threads": 192, "grouping": 4, "minblocks": 2, "algorithm": "medium", "perf": 571.981, "source": "autotuned"},
{"m": 25, "n": 5, "k": 32, "tile_m": 1, "tile_n": 1, "threads": 192, "grouping": 3, "minblocks": 2, "algorithm": "medium", "perf": 588.39, "source": "autotuned"},
{"m": 25, "n": 5, "k": 45, "tile_m": 1, "tile_n": 1, "threads": 256, "grouping": 3, "minblocks": 1, "algorithm": "medium", "perf": 585.125, "source": "autotuned"},
{"m": 25, "n": 7, "k": 4, "tile_m": 3, "tile_n": 3, "threads": 32, "grouping": 15, "minblocks": 2, "algorithm": "medium", "perf": 580.754, "source": "autotuned"},
{"m": 25, "n": 7, "k": 5, "tile_m": 3, "tile_n": 1, "threads": 64, "grouping": 21, "minblocks": 19, "algorithm": "medium", "perf": 598.77, "source": "autotuned"},
{"m": 25, "n": 7, "k": 7, "tile_m": 3, "tile_n": 1, "threads": 64, "grouping": 22, "minblocks": 3, "algorithm": "medium", "perf": 660.441, "source": "autotuned"},
{"m": 25, "n": 7, "k": 9, "tile_m": 3, "tile_n": 1, "threads": 64, "grouping": 26, "minblocks": 10, "algorithm": "medium", "perf": 684.274, "source": "autotuned"},
{"m": 25, "n": 7, "k": 13, "tile_m": 3, "tile_n": 1, "threads": 96, "grouping": 29, "minblocks": 1, "algorithm": "medium", "perf": 698.671, "source": "autotuned"},
{"m": 25, "n": 7, "k": 25, "tile_m": 1, "tile_n": 3, "threads": 192, "grouping": 4, "minblocks": 7, "algorithm": "medium", "perf": 718.262, "source": "autotuned"},
{"m": 25, "n": 7, "k": 26, "tile_m": 3, "tile_n": 1, "threads": 192, "grouping": 29, "minblocks": 3, "algorithm": "medium", "perf": 721.455, "source": "autotuned"},
{"m": 25, "n": 7, "k": 28, "tile_m": 1, "tile_n": 2, "threads": 128, "grouping": 4, "minblocks": 2, "algorithm": "medium", "perf": 724.329, "source": "autotuned"},
{"m": 25, "n": 7, "k": 32, "tile_m": 3, "tile_n": 1, "w": 16, "v": 6, "threads": 64, "grouping": 16, "minblocks": 4, "algorithm": "largeDB2", "perf": 735.427, "source": "autotuned"},
{"m": 25, "n": 7, "k": 45, "tile_m": 3, "tile_n": 1, "threads": 128, "grouping": 30, "minblocks": 4, "algorithm": "medium", "perf": 735.753, "source": "autotuned"},
{"m": 25, "n": 9, "k": 4, "tile_m": 1, "tile_n": 5, "threads": 64, "grouping": 24, "minblocks": 3, "algorithm": "medium", "perf": 615.95, "source": "autotuned"},
{"m": 25, "n": 9, "k": 5, "tile_m": 1, "tile_n": 5, "threads": 64, "grouping": 24, "minblocks": 2, "algorithm": "medium", "perf": 696.734, "source": "autotuned"},
{"m": 25, "n": 9, "k": 7, "tile_m": 1, "tile_n": 5, "threads": 64, "grouping": 26, "minblocks": 13, "algorithm": "medium", "perf": 767.41, "source": "autotuned"},
{"m": 25, "n": 9, "k": 9, "tile_m": 1, "tile_n": 5, "threads": 96, "grouping": 32, "minblocks": 10, "algorithm": "medium", "perf": 772.896, "source": "autotuned"},
{"m": 25, "n": 9, "k": 13, "tile_m": 1, "tile_n": 3, "threads": 128, "grouping": 32, "minblocks": 9, "algorithm": "medium", "perf": 812.472, "source": "autotuned"},
{"m": 25, "n": 9, "k": 25, "tile_m": 1, "tile_n": 2, "threads": 128, "grouping": 4, "minblocks": 1, "algorithm": "medium", "perf": 854.308, "source": "autotuned"},
{"m": 25, "n": 9, "k": 26, "tile_m": 1, "tile_n": 2, "threads": 128, "grouping": 4, "minblocks": 5, "algorithm": "medium", "perf": 860.057, "source": "autotuned"},
{"m": 25, "n": 9, "k": 28, "tile_m": 1, "tile_n": 2, "w": 10, "v": 8, "threads": 128, "grouping": 16, "minblocks": 4, "algorithm": "largeDB2", "perf": 875.354, "source": "autotuned"},
{"m": 25, "n": 9, "k": 32, "tile_m": 1, "tile_n": 2, "threads": 160, "grouping": 3, "minblocks": 4, "algorithm": "medium", "perf": 882.376, "source": "autotuned"},
{"m": 25, "n": 9, "k": 45, "tile_m": 1, "tile_n": 2, "w": 14, "v": 8, "threads": 128, "grouping": 16, "minblocks": 1, "algorithm": "largeDB2", "perf": 892.009, "source": "autotuned"},
{"m": 25, "n": 11, "k": 11, "tile_m": 1, "tile_n": 6, "threads": 128, "grouping": 32, "minblocks": 9, "algorithm": "medium", "perf": 883.488, "source": "autotuned"},
{"m": 25, "n": 11, "k": 12, "tile_m": 1, "tile_n": 4, "threads": 96, "grouping": 32, "minblocks": 10, "algorithm": "medium", "perf": 895.478, "source": "autotuned"},
{"m": 25, "n": 11, "k": 20, "tile_m": 2, "tile_n": 3, "w": 10, "v": 8, "threads": 64, "grouping": 16, "minblocks": 4, "algorithm": "largeDB2", "perf": 956.932, "source": "autotuned"},
{"m": 25, "n": 11, "k": 25, "tile_m": 2, "tile_n": 3, "w": 10, "v": 6, "threads": 64, "grouping": 16, "minblocks": 8, "algorithm": "largeDB2", "perf": 962.602, "source": "autotuned"},
{"m": 25, "n": 11, "k": 32, "tile_m": 3, "tile_n": 2, "w": 16, "v": 6, "threads": 64, "grouping": 16, "minblocks": 1, "algorithm": "largeDB2", "perf": 996.876, "source": "autotuned"},
{"m": 25, "n": 12, "k": 11, "tile_m": 1, "tile_n": 4, "threads": 96, "grouping": 6, "minblocks": 13, "algorithm": "medium", "perf": 921.389, "source": "autotuned"},
{"m": 25, "n": 12, "k": 12, "tile_m": 1, "tile_n": 4, "threads": 96, "grouping": 32, "minblocks": 9, "algorithm": "medium", "perf": 945.839, "source": "autotuned"},
{"m": 25, "n": 12, "k": 20, "tile_m": 3, "tile_n": 2, "w": 10, "v": 12, "threads": 64, "grouping": 16, "minblocks": 4, "algorithm": "largeDB2", "perf": 1028.89, "source": "autotuned"},
{"m": 25, "n": 12, "k": 25, "tile_m": 3, "tile_n": 2, "w": 10, "v": 12, "threads": 64, "grouping": 16, "minblocks": 1, "algorithm": "largeDB2", "perf": 1042.28, "source": "autotuned"},
{"m": 25, "n": 12, "k": 32, "tile_m": 3, "tile_n": 2, "w": 16, "v": 12, "threads": 64, "grouping": 16, "minblocks": 1, "algorithm": "largeDB2", "perf": 1070.25, "source": "autotuned"},
{"m": 25, "n": 13, "k": 4, "tile_m": 3, "tile_n": 2, "threads": 64, "grouping": 26, "minblocks": 7, "algorithm": "medium", "perf": 772.213, "source": "autotuned"},
{"m": 25, "n": 13, "k": 5, "tile_m": 3, "tile_n": 2, "threads": 64, "grouping": 26, "minblocks": 9, "algorithm": "medium", "perf": 811.652, "source": "autotuned"},
{"m": 25, "n": 13, "k": 7, "tile_m": 3, "tile_n": 2, "threads": 64, "grouping": 29, "minblocks": 1, "algorithm": "medium", "perf": 894.47, "source": "autotuned"},
{"m": 25, "n": 13, "k": 9, "tile_m": 3, "tile_n": 2, "threads": 64, "grouping": 32, "minblocks": 7, "algorithm": "medium", "perf": 937.943, "source": "autotuned"},
{"m": 25, "n": 13, "k": 13, "tile_m": 1, "tile_n": 3, "threads": 128, "grouping": 7, "minblocks": 10, "algorithm": "medium", "perf": 975.605, "source": "autotuned"},
{"m": 25, "n": 13, "k": 14, "tile_m": 1, "tile_n": 3, "threads": 128, "grouping": 7, "minblocks": 10, "algorithm": "medium", "perf": 992.46, "source": "autotuned"},
{"m": 25, "n": 13, "k": 25, "tile_m": 1, "tile_n": 3, "threads": 128, "grouping": 4, "minblocks": 5, "algorithm": "medium", "perf": 1066.09, "source": "autotuned"},
{"m": 25, "n": 13, "k": 26, "tile_m": 3, "tile_n": 2, "w": 12, "v": 4, "threads": 64, "grouping": 16, "minblocks": 2, "algorithm": "largeDB2", "perf": 1073.76, "source": "autotuned"},
{"m": 25, "n": 13, "k": 28, "tile_m": 3, "tile_n": 2, "w": 12, "v": 12, "threads": 64, "grouping": 16, "minblocks": 1, "algorithm": "largeDB2", "perf": 1099.51, "source": "autotuned"},
{"m": 25, "n": 13, "k": 32, "tile_m": 3, "tile_n": 2, "w": 14, "v": 12, "threads": 64, "grouping": 16, "minblocks": 2, "algorithm": "largeDB2", "perf": 1111.26, "source": "autotuned"},
{"m": 25, "n": 13, "k": 45, "tile_m": 3, "tile_n": 2, "w": 12, "v": 10, "threads": 64, "grouping": 16, "minblocks": 1, "algorithm": "largeDB2", "perf": 1133.67, "source": "autotuned"},
{"m": 25, "n": 14, "k": 13, "tile_m": 1, "tile_n": 3, "threads": 128, "grouping": 6, "minblocks": 9, "algorithm": "medium", "perf": 1028.26, "source": "autotuned"},
{"m": 25, "n": 14, "k": 14, "tile_m": 1, "tile_n": 3, "threads": 128, "grouping": 6, "minblocks": 9, "algorithm": "medium", "perf": 1048.08, "source": "autotuned"},
{"m": 25, "n": 14, "k": 25, "tile_m": 1, "tile_n": 3, "threads": 128, "grouping": 3, "minblocks": 1, "algorithm": "medium", "perf": 1119.23, "source": "autotuned"},
{"m": 25, "n": 14, "k": 26, "tile_m": 1, "tile_n": 3, "threads": 128, "grouping": 3, "minblocks": 3, "algorithm": "medium", "perf": 1118.61, "source": "autotuned"},
{"m": 25, "n": 14, "k": 32, "tile_m": 3, "tile_n": 2, "w": 16, "v": 14, "threads": 64, "grouping": 16, "minblocks": 2, "algorithm": "largeDB2", "perf": 1161.79, "source": "autotuned"},
{"m": 25, "n": 20, "k": 11, "tile_m": 1, "tile_n": 4, "threads": 128, "grouping": 6, "minblocks": 10, "algorithm": "medium", "perf": 1206.16, "source": "autotuned"},
{"m": 25, "n": 20, "k": 12, "tile_m": 3, "tile_n": 3, "w": 6, "v": 20, "threads": 64, "grouping": 16, "minblocks": 4, "algorithm": "largeDB2", "perf": 1253.35, "source": "autotuned"},
{"m": 25, "n": 20, "k": 20, "tile_m": 3, "tile_n": 2, "w": 10, "v": 16, "threads": 96, "grouping": 16, "minblocks": 4, "algorithm": "largeDB2", "perf": 1333.39, "source": "autotuned"},
{"m": 25, "n": 20, "k": 25, "tile_m": 3, "tile_n": 3, "w": 10, "v": 16, "threads": 64, "grouping": 16, "minblocks": 4, "algorithm": "largeDB2", "perf": 1355.68, "source": "autotuned"},
{"m": 25, "n": 20, "k": 32, "tile_m": 3, "tile_n": 2, "w": 16, "v": 18, "threads": 96, "grouping": 16, "minblocks": 4, "algorithm": "largeDB2", "perf": 1408.81, "source": "autotuned"},
{"m": 25, "n": 25, "k": 4, "tile_m": 3, "tile_n": 4, "threads": 64, "grouping": 32, "minblocks": 4, "algorithm": "medium", "perf": 976.486, "source": "autotuned"},
{"m": 25, "n": 25, "k": 5, "tile_m": 1, "tile_n": 5, "threads": 128, "grouping": 32, "minblocks": 9, "algorithm": "medium", "perf": 1070.36, "source": "autotuned"},
{"m": 25, "n": 25, "k": 7, "tile_m": 1, "tile_n": 5, "threads": 128, "grouping": 32, "minblocks": 9, "algorithm": "medium", "perf": 1194.1, "source": "autotuned"},
{"m": 25, "n": 25, "k": 9, "tile_m": 1, "tile_n": 5, "threads": 128, "grouping": 32, "minblocks": 9, "algorithm": "medium", "perf": 1269.67, "source": "autotuned"},
{"m": 25, "n": 25, "k": 11, "tile_m": 1, "tile_n": 5, "threads": 128, "grouping": 32, "minblocks": 9, "algorithm": "medium", "perf": 1340.23, "source": "autotuned"},
{"m": 25, "n": 25, "k": 12, "tile_m": 1, "tile_n": 5, "threads": 128, "grouping": 32, "minblocks": 9, "algorithm": "medium", "perf": 1365.39, "source": "autotuned"},
{"m": 25, "n": 25, "k": 13, "tile_m": 1, "tile_n": 5, "threads": 128, "grouping": 29, "minblocks": 5, "algorithm": "medium", "perf": 1367.05, "source": "autotuned"},
{"m": 25, "n": 25, "k": 14, "tile_m": 1, "tile_n": 5, "threads": 192, "grouping": 29, "minblocks": 5, "algorithm": "medium", "perf": 1390.72, "source": "autotuned"},
{"m": 25, "n": 25, "k": 20, "tile_m": 1, "tile_n": 5, "threads": 192, "grouping": 5, "minblocks": 6, "algorithm": "medium", "perf": 1480.51, "source": "autotuned"},
{"m": 25, "n": 25, "k": 25, "tile_m": 3, "tile_n": 4, "threads": 64, "grouping": 3, "minblocks": 4, "algorithm": "medium", "perf": 1504.46, "source": "autotuned"},
{"m": 25, "n": 25, "k": 26, "tile_m": 3, "tile_n": 4, "threads": 64, "grouping": 30, "minblocks": 1, "algorithm": "medium", "perf": 1498.12, "source": "autotuned"},
{"m": 25, "n": 25, "k": 28, "tile_m": 3, "tile_n": 4, "threads": 64, "grouping": 4, "minblocks": 2, "algorithm": "medium", "perf": 1526.33, "source": "autotuned"},
{"m": 25, "n": 25, "k": 32, "tile_m": 3, "tile_n": 4, "w": 8, "v": 24, "threads": 64, "grouping": 16, "minblocks": 2, "algorithm": "largeDB2", "perf": 1548.35, "source": "autotuned"},
{"m": 25, "n": 25, "k": 45, "tile_m": 3, "tile_n": 4, "w": 20, "v": 8, "threads": 64, "grouping": 16, "minblocks": 2, "algorithm": "largeDB2", "perf": 1587.51, "source": "autotuned"},
{"m": 25, "n": 26, "k": 4, "tile_m": 3, "tile_n": 4, "threads": 64, "grouping": 32, "minblocks": 5, "algorithm": "medium", "perf": 974.726, "source": "autotuned"},
{"m": 25, "n": 26, "k": 5, "tile_m": 1, "tile_n": 6, "threads": 160, "grouping": 14, "minblocks": 8, "algorithm": "medium", "perf": 1032.18, "source": "autotuned"},
{"m": 25, "n": 26, "k": 7, "tile_m": 1, "tile_n": 6, "threads": 192, "grouping": 10, "minblocks": 8, "algorithm": "medium", "perf": 1153.33, "source": "autotuned"},
{"m": 25, "n": 26, "k": 9, "tile_m": 3, "tile_n": 4, "threads": 64, "grouping": 27, "minblocks": 3, "algorithm": "medium", "perf": 1238.92, "source": "autotuned"},
{"m": 25, "n": 26, "k": 13, "tile_m": 1, "tile_n": 6, "threads": 128, "grouping": 24, "minblocks": 6, "algorithm": "medium", "perf": 1358.07, "source": "autotuned"},
{"m": 25, "n": 26, "k": 14, "tile_m": 1, "tile_n": 6, "threads": 128, "grouping": 24, "minblocks": 6, "algorithm": "medium", "perf": 1398.79, "source": "autotuned"},
{"m": 25, "n": 26, "k": 25, "tile_m": 3, "tile_n": 4, "w": 8, "v": 26, "threads": 64, "grouping": 16, "minblocks": 2, "algorithm": "largeDB2", "perf": 1510.79, "source": "autotuned"},
{"m": 25, "n": 26, "k": 26, "tile_m": 3, "tile_n": 4, "w": 8, "v": 26, "threads": 64, "grouping": 16, "minblocks": 8, "algorithm": "largeDB2", "perf": 1521.72, "source": "autotuned"},
{"m": 25, "n": 26, "k": 28, "tile_m": 3, "tile_n": 4, "w": 8, "v": 26, "threads": 64, "grouping": 16, "minblocks": 2, "algorithm": "largeDB2", "perf": 1547.14, "source": "autotuned"},
{"m": 25, "n": 26, "k": 32, "tile_m": 3, "tile_n": 4, "w": 8, "v": 26, "threads": 64, "grouping": 16, "minblocks": 4, "algorithm": "largeDB2", "perf": 1582.6, "source": "autotuned"},
{"m": 25, "n": 26, "k": 45, "tile_m": 3, "tile_n": 4, "w": 18, "v": 26, "threads": 64, "grouping": 16, "minblocks": 2, "algorithm": "largeDB2", "perf": 1621.87, "source": "autotuned"},
{"m": 25, "n": 28, "k": 4, "tile_m": 3, "tile_n": 4, "threads": 64, "grouping": 32, "minblocks": 3, "algorithm": "medium", "perf": 1038.23, "source": "autotuned"},
{"m": 25, "n": 28, "k": 5, "tile_m": 1, "tile_n": 6, "threads": 160, "grouping": 9, "minblocks": 8, "algorithm": "medium", "perf": 1102.36, "source": "autotuned"},
{"m": 25, "n": 28, "k": 7, "tile_m": 1, "tile_n": 6, "threads": 128, "grouping": 7, "minblocks": 8, "algorithm": "medium", "perf": 1200.18, "source": "autotuned"},
{"m": 25, "n": 28, "k": 9, "tile_m": 1, "tile_n": 6, "threads": 128, "grouping": 6, "minblocks": 8, "algorithm": "medium", "perf": 1319.69, "source": "autotuned"},
{"m": 25, "n": 28, "k": 13, "tile_m": 1, "tile_n": 6, "threads": 128, "grouping": 4, "minblocks": 8, "algorithm": "medium", "perf": 1432.84, "source": "autotuned"},
{"m": 25, "n": 28, "k": 25, "tile_m": 3, "tile_n": 4, "threads": 64, "grouping": 3, "minblocks": 2, "algorithm": "medium", "perf": 1590.64, "source": "autotuned"},
{"m": 25, "n": 28, "k": 26, "tile_m": 3, "tile_n": 4, "w": 8, "v": 28, "threads": 64, "grouping": 16, "minblocks": 2, "algorithm": "largeDB2", "perf": 1589.92, "source": "autotuned"},
{"m": 25, "n": 28, "k": 28, "tile_m": 3, "tile_n": 4, "w": 8, "v": 28, "threads": 64, "grouping": 16, "minblocks": 1, "algorithm": "largeDB2", "perf": 1612.35, "source": "autotuned"},
{"m": 25, "n": 28, "k": 32, "tile_m": 3, "tile_n": 4, "w": 8, "v": 28, "threads": 64, "grouping": 16, "minblocks": 4, "algorithm": "largeDB2", "perf": 1653.53, "source": "autotuned"},
{"m": 25, "n": 28, "k": 45, "tile_m": 3, "tile_n": 4, "w": 18, "v": 28, "threads": 64, "grouping": 16, "minblocks": 4, "algorithm": "largeDB2", "perf": 1684.81, "source": "autotuned"},
{"m": 25, "n": 32, "k": 4, "tile_m": 5, "tile_n": 1, "threads": 160, "grouping": 12, "minblocks": 7, "algorithm": "medium", "perf": 1025.19, "source": "autotuned"},
{"m": 25, "n": 32, "k": 5, "tile_m": 5, "tile_n": 1, "threads": 192, "grouping": 16, "minblocks": 7, "algorithm": "medium", "perf": 1111.36, "source": "autotuned"},
{"m": 25, "n": 32, "k": 7, "tile_m": 3, "tile_n": 5, "threads": 64, "grouping": 24, "minblocks": 3, "algorithm": "medium", "perf": 1256.28, "source": "autotuned"},
{"m": 25, "n": 32, "k": 9, "tile_m": 5, "tile_n": 3, "threads": 64, "grouping": 29, "minblocks": 2, "algorithm": "medium", "perf": 1364.67, "source": "autotuned"},
{"m": 25, "n": 32, "k": 11, "tile_m": 3, "tile_n": 5, "threads": 64, "grouping": 24, "minblocks": 6, "algorithm": "medium", "perf": 1423.93, "source": "autotuned"},
{"m": 25, "n": 32, "k": 12, "tile_m": 7, "tile_n": 2, "w": 6, "v": 32, "threads": 64, "grouping": 16, "minblocks": 4, "algorithm": "largeDB2", "perf": 1481.41, "source": "autotuned"},
{"m": 25, "n": 32, "k": 13, "tile_m": 3, "tile_n": 5, "threads": 64, "grouping": 29, "minblocks": 1, "algorithm": "medium", "perf": 1484.69, "source": "autotuned"},
{"m": 25, "n": 32, "k": 14, "tile_m": 3, "tile_n": 5, "threads": 64, "grouping": 29, "minblocks": 4, "algorithm": "medium", "perf": 1517.54, "source": "autotuned"},
{"m": 25, "n": 32, "k": 20, "tile_m": 3, "tile_n": 5, "threads": 64, "grouping": 3, "minblocks": 3, "algorithm": "medium", "perf": 1636.95, "source": "autotuned"},
{"m": 25, "n": 32, "k": 25, "tile_m": 5, "tile_n": 3, "threads": 64, "grouping": 29, "minblocks": 1, "algorithm": "medium", "perf": 1655.28, "source": "autotuned"},
{"m": 25, "n": 32, "k": 26, "tile_m": 3, "tile_n": 5, "threads": 64, "grouping": 3, "minblocks": 3, "algorithm": "medium", "perf": 1680.88, "source": "autotuned"},
{"m": 25, "n": 32, "k": 28, "tile_m": 5, "tile_n": 3, "w": 14, "v": 32, "threads": 64, "grouping": 16, "minblocks": 1, "algorithm": "largeDB2", "perf": 1689.82, "source": "autotuned"},
{"m": 25, "n": 32, "k": 32, "tile_m": 5, "tile_n": 3, "w": 8, "v": 32, "threads": 64, "grouping": 16, "minblocks": 1, "algorithm": "largeDB2", "perf": 1750.62, "source": "autotuned"},
{"m": 25, "n": 32, "k": 45, "tile_m": 5, "tile_n": 3, "w": 8, "v": 32, "threads": 64, "grouping": 16, "minblocks": 4, "algorithm": "largeDB2", "perf": 1784.12, "source": "autotuned"},
{"m": 25, "n": 45, "k": 4, "tile_m": 3, "tile_n": 5, "threads": 96, "grouping": 30, "minblocks": 4, "algorithm": "medium", "perf": 1026.08, "source": "autotuned"},
{"m": 25, "n": 45, "k": 5, "tile_m": 5, "tile_n": 2, "threads": 128, "grouping": 24, "minblocks": 2, "algorithm": "medium", "perf": 1149.65, "source": "autotuned"},
{"m": 25, "n": 45, "k": 7, "tile_m": 3, "tile_n": 5, "threads": 96, "grouping": 24, "minblocks": 2, "algorithm": "medium", "perf": 1315.18, "source": "autotuned"},
{"m": 25, "n": 45, "k": 9, "tile_m": 5, "tile_n": 2, "threads": 128, "grouping": 32, "minblocks": 3, "algorithm": "medium", "perf": 1432.35, "source": "autotuned"},
{"m": 25, "n": 45, "k": 13, "tile_m": 3, "tile_n": 5, "threads": 96, "grouping": 24, "minblocks": 1, "algorithm": "medium", "perf": 1592.59, "source": "autotuned"},
{"m": 25, "n": 45, "k": 25, "tile_m": 5, "tile_n": 4, "w": 10, "v": 22, "threads": 64, "grouping": 16, "minblocks": 1, "algorithm": "largeDB2", "perf": 1834.49, "source": "autotuned"},
{"m": 25, "n": 45, "k": 26, "tile_m": 5, "tile_n": 4, "w": 10, "v": 44, "threads": 64, "grouping": 16, "minblocks": 4, "algorithm": "largeDB2", "perf": 1856.86, "source": "autotuned"},
{"m": 25, "n": 45, "k": 28, "tile_m": 5, "tile_n": 4, "w": 10, "v": 44, "threads": 64, "grouping": 16, "minblocks": 1, "algorithm": "largeDB2", "perf": 1880.32, "source": "autotuned"},
{"m": 25, "n": 45, "k": 32, "tile_m": 5, "tile_n": 4, "w": 8, "v": 22, "threads": 64, "grouping": 16, "minblocks": 1, "algorithm": "largeDB2", "perf": 1931.76, "source": "autotuned"},
{"m": 25, "n": 45, "k": 45, "tile_m": 5, "tile_n": 4, "w": 10, "v": 14, "threads": 64, "grouping": 16, "minblocks": 4, "algorithm": "largeDB2", "perf": 2021.91, "source": "autotuned"},
{"m": 26, "n": 4, "k": 4, "tile_m": 1, "tile_n": 4, "threads": 32, "grouping": 13, "minblocks": 8, "algorithm": "medium", "perf": 455.983, "source": "autotuned"},
{"m": 26, "n": 4, "k": 5, "tile_m": 1, "tile_n": 4, "threads": 32, "grouping": 13, "minblocks": 13, "algorithm": "medium", "perf": 453.07, "source": "autotuned"},
{"m": 26, "n": 4, "k": 7, "tile_m": 1, "tile_n": 4, "threads": 32, "grouping": 16, "minblocks": 8, "algorithm": "medium", "perf": 462.367, "source": "autotuned"},
{"m": 26, "n": 4, "k": 9, "tile_m": 1, "tile_n": 2, "threads": 64, "grouping": 26, "minblocks": 7, "algorithm": "medium", "perf": 461.91, "source": "autotuned"},
{"m": 26, "n": 4, "k": 13, "tile_m": 1, "tile_n": 2, "threads": 64, "grouping": 32, "minblocks": 1, "algorithm": "medium", "perf": 478.188, "source": "autotuned"},
{"m": 26, "n": 4, "k": 25, "tile_m": 1, "tile_n": 2, "threads": 128, "grouping": 3, "minblocks": 2, "algorithm": "medium", "perf": 483.153, "source": "autotuned"},
{"m": 26, "n": 4, "k": 26, "tile_m": 1, "tile_n": 2, "threads": 128, "grouping": 3, "minblocks": 4, "algorithm": "medium", "perf": 487.755, "source": "autotuned"},
{"m": 26, "n": 4, "k": 28, "tile_m": 1, "tile_n": 2, "threads": 128, "grouping": 3, "minblocks": 3, "algorithm": "medium", "perf": 489.503, "source": "autotuned"},
{"m": 26, "n": 4, "k": 32, "tile_m": 1, "tile_n": 1, "threads": 192, "grouping": 3, "minblocks": 4, "algorithm": "medium", "perf": 493.24, "source": "autotuned"},
{"m": 26, "n": 4, "k": 45, "tile_m": 1, "tile_n": 1, "threads": 256, "grouping": 2, "minblocks": 2, "algorithm": "medium", "perf": 495.988, "source": "autotuned"},
{"m": 26, "n": 5, "k": 4, "tile_m": 1, "tile_n": 5, "threads": 32, "grouping": 13, "minblocks": 27, "algorithm": "medium", "perf": 513.002, "source": "autotuned"},
{"m": 26, "n": 5, "k": 5, "tile_m": 5, "tile_n": 1, "threads": 32, "grouping": 18, "minblocks": 10, "algorithm": "medium", "perf": 517.591, "source": "autotuned"},
{"m": 26, "n": 5, "k": 7, "tile_m": 1, "tile_n": 3, "threads": 64, "grouping": 22, "minblocks": 1, "algorithm": "medium", "perf": 525.335, "source": "autotuned"},
{"m": 26, "n": 5, "k": 9, "tile_m": 1, "tile_n": 3, "threads": 64, "grouping": 26, "minblocks": 12, "algorithm": "medium", "perf": 550.268, "source": "autotuned"},
{"m": 26, "n": 5, "k": 12, "tile_m": 1, "tile_n": 3, "threads": 64, "grouping": 32, "minblocks": 11, "algorithm": "medium", "perf": 560.898, "source": "autotuned"},
{"m": 26, "n": 5, "k": 13, "tile_m": 1, "tile_n": 3, "threads": 96, "grouping": 29, "minblocks": 9, "algorithm": "medium", "perf": 549.663, "source": "autotuned"},
{"m": 26, "n": 5, "k": 24, "tile_m": 1, "tile_n": 2, "threads": 128, "grouping": 4, "minblocks": 4, "algorithm": "medium", "perf": 573.419, "source": "autotuned"},
{"m": 26, "n": 5, "k": 25, "tile_m": 1, "tile_n": 2, "threads": 128, "grouping": 4, "minblocks": 7, "algorithm": "medium", "perf": 570.821, "source": "autotuned"},
{"m": 26, "n": 5, "k": 26, "tile_m": 1, "tile_n": 2, "threads": 192, "grouping": 4, "minblocks": 7, "algorithm": "medium", "perf": 573.903, "source": "autotuned"},
{"m": 26, "n": 5, "k": 28, "tile_m": 1, "tile_n": 3, "threads": 160, "grouping": 24, "minblocks": 3, "algorithm": "medium", "perf": 573.438, "source": "autotuned"},
{"m": 26, "n": 5, "k": 32, "tile_m": 1, "tile_n": 1, "threads": 224, "grouping": 3, "minblocks": 6, "algorithm": "medium", "perf": 587.174, "source": "autotuned"},
{"m": 26, "n": 5, "k": 45, "tile_m": 1, "tile_n": 1, "threads": 256, "grouping": 3, "minblocks": 1, "algorithm": "medium", "perf": 590.001, "source": "autotuned"},
{"m": 26, "n": 7, "k": 4, "tile_m": 2, "tile_n": 4, "threads": 32, "grouping": 16, "minblocks": 1, "algorithm": "medium", "perf": 594.471, "source": "autotuned"},
{"m": 26, "n": 7, "k": 5, "tile_m": 3, "tile_n": 1, "threads": 64, "grouping": 22, "minblocks": 17, "algorithm": "medium", "perf": 613.113, "source": "autotuned"},
{"m": 26, "n": 7, "k": 7, "tile_m": 1, "tile_n": 4, "threads": 64, "grouping": 22, "minblocks": 6, "algorithm": "medium", "perf": 672.9, "source": "autotuned"},
{"m": 26, "n": 7, "k": 9, "tile_m": 3, "tile_n": 1, "threads": 64, "grouping": 26, "minblocks": 1, "algorithm": "medium", "perf": 697.663, "source": "autotuned"},
{"m": 26, "n": 7, "k": 13, "tile_m": 3, "tile_n": 1, "threads": 96, "grouping": 32, "minblocks": 7, "algorithm": "medium", "perf": 710.135, "source": "autotuned"},
{"m": 26, "n": 7, "k": 25, "tile_m": 1, "tile_n": 2, "threads": 192, "grouping": 4, "minblocks": 7, "algorithm": "medium", "perf": 730.136, "source": "autotuned"},
{"m": 26, "n": 7, "k": 26, "tile_m": 1, "tile_n": 2, "threads": 192, "grouping": 5, "minblocks": 3, "algorithm": "medium", "perf": 735.317, "source": "autotuned"},
{"m": 26, "n": 7, "k": 28, "tile_m": 1, "tile_n": 2, "threads": 224, "grouping": 4, "minblocks": 6, "algorithm": "medium", "perf": 737.392, "source": "autotuned"},
{"m": 26, "n": 7, "k": 32, "tile_m": 1, "tile_n": 2, "threads": 256, "grouping": 4, "minblocks": 5, "algorithm": "medium", "perf": 751.816, "source": "autotuned"},
{"m": 26, "n": 7, "k": 45, "tile_m": 1, "tile_n": 1, "threads": 192, "grouping": 3, "minblocks": 4, "algorithm": "medium", "perf": 754.379, "source": "autotuned"},
{"m": 26, "n": 9, "k": 4, "tile_m": 1, "tile_n": 5, "threads": 64, "grouping": 24, "minblocks": 4, "algorithm": "medium", "perf": 645.89, "source": "autotuned"},
{"m": 26, "n": 9, "k": 5, "tile_m": 1, "tile_n": 5, "threads": 64, "grouping": 26, "minblocks": 16, "algorithm": "medium", "perf": 708.797, "source": "autotuned"},
{"m": 26, "n": 9, "k": 7, "tile_m": 1, "tile_n": 5, "threads": 64, "grouping": 25, "minblocks": 15, "algorithm": "medium", "perf": 783.549, "source": "autotuned"},
{"m": 26, "n": 9, "k": 9, "tile_m": 1, "tile_n": 5, "threads": 96, "grouping": 32, "minblocks": 11, "algorithm": "medium", "perf": 797.252, "source": "autotuned"},
{"m": 26, "n": 9, "k": 13, "tile_m": 1, "tile_n": 3, "threads": 128, "grouping": 18, "minblocks": 4, "algorithm": "medium", "perf": 821.531, "source": "autotuned"},
{"m": 26, "n": 9, "k": 25, "tile_m": 1, "tile_n": 3, "threads": 128, "grouping": 4, "minblocks": 6, "algorithm": "medium", "perf": 862.508, "source": "autotuned"},
{"m": 26, "n": 9, "k": 26, "tile_m": 1, "tile_n": 3, "threads": 256, "grouping": 5, "minblocks": 5, "algorithm": "medium", "perf": 871.198, "source": "autotuned"},
{"m": 26, "n": 9, "k": 28, "tile_m": 1, "tile_n": 3, "threads": 128, "grouping": 4, "minblocks": 3, "algorithm": "medium", "perf": 877.813, "source": "autotuned"},
{"m": 26, "n": 9, "k": 32, "tile_m": 1, "tile_n": 3, "threads": 128, "grouping": 3, "minblocks": 5, "algorithm": "medium", "perf": 895.509, "source": "autotuned"},
{"m": 26, "n": 9, "k": 45, "tile_m": 3, "tile_n": 1, "w": 10, "v": 6, "threads": 96, "grouping": 16, "minblocks": 8, "algorithm": "largeDB2", "perf": 902.055, "source": "autotuned"},
{"m": 26, "n": 12, "k": 5, "tile_m": 1, "tile_n": 6, "threads": 64, "grouping": 24, "minblocks": 11, "algorithm": "medium", "perf": 853.834, "source": "autotuned"},
{"m": 26, "n": 12, "k": 12, "tile_m": 1, "tile_n": 2, "threads": 160, "grouping": 6, "minblocks": 11, "algorithm": "medium", "perf": 965.748, "source": "autotuned"},
{"m": 26, "n": 12, "k": 13, "tile_m": 1, "tile_n": 2, "threads": 160, "grouping": 6, "minblocks": 1, "algorithm": "medium", "perf": 969.942, "source": "autotuned"},
{"m": 26, "n": 12, "k": 26, "tile_m": 1, "tile_n": 2, "threads": 192, "grouping": 4, "minblocks": 6, "algorithm": "medium", "perf": 1059.98, "source": "autotuned"},
{"m": 26, "n": 12, "k": 32, "tile_m": 1, "tile_n": 2, "threads": 192, "grouping": 3, "minblocks": 3, "algorithm": "medium", "perf": 1091.93, "source": "autotuned"},
{"m": 26, "n": 13, "k": 4, "tile_m": 3, "tile_n": 2, "threads": 64, "grouping": 26, "minblocks": 8, "algorithm": "medium", "perf": 799.987, "source": "autotuned"},
{"m": 26, "n": 13, "k": 5, "tile_m": 3, "tile_n": 2, "threads": 64, "grouping": 26, "minblocks": 2, "algorithm": "medium", "perf": 797.258, "source": "autotuned"},
{"m": 26, "n": 13, "k": 7, "tile_m": 1, "tile_n": 5, "threads": 96, "grouping": 26, "minblocks": 13, "algorithm": "medium", "perf": 922.13, "source": "autotuned"},
{"m": 26, "n": 13, "k": 9, "tile_m": 1, "tile_n": 5, "threads": 128, "grouping": 32, "minblocks": 10, "algorithm": "medium", "perf": 949.735, "source": "autotuned"},
{"m": 26, "n": 13, "k": 12, "tile_m": 1, "tile_n": 5, "threads": 96, "grouping": 32, "minblocks": 10, "algorithm": "medium", "perf": 997.362, "source": "autotuned"},
{"m": 26, "n": 13, "k": 13, "tile_m": 1, "tile_n": 5, "threads": 96, "grouping": 6, "minblocks": 11, "algorithm": "medium", "perf": 991.96, "source": "autotuned"},
{"m": 26, "n": 13, "k": 14, "tile_m": 1, "tile_n": 4, "threads": 128, "grouping": 24, "minblocks": 6, "algorithm": "medium", "perf": 1008.41, "source": "autotuned"},
{"m": 26, "n": 13, "k": 24, "tile_m": 3, "tile_n": 2, "w": 12, "v": 12, "threads": 64, "grouping": 16, "minblocks": 1, "algorithm": "largeDB2", "perf": 1092.08, "source": "autotuned"},
{"m": 26, "n": 13, "k": 25, "tile_m": 1, "tile_n": 2, "threads": 192, "grouping": 4, "minblocks": 5, "algorithm": "medium", "perf": 1088.18, "source": "autotuned"},
{"m": 26, "n": 13, "k": 26, "tile_m": 1, "tile_n": 2, "threads": 192, "grouping": 4, "minblocks": 3, "algorithm": "medium", "perf": 1101.37, "source": "autotuned"},
{"m": 26, "n": 13, "k": 28, "tile_m": 3, "tile_n": 2, "w": 14, "v": 8, "threads": 64, "grouping": 16, "minblocks": 2, "algorithm": "largeDB2", "perf": 1105.61, "source": "autotuned"},
{"m": 26, "n": 13, "k": 32, "tile_m": 3, "tile_n": 2, "w": 14, "v": 12, "threads": 64, "grouping": 16, "minblocks": 8, "algorithm": "largeDB2", "perf": 1128.15, "source": "autotuned"},
{"m": 26, "n": 13, "k": 45, "tile_m": 3, "tile_n": 2, "w": 12, "v": 8, "threads": 64, "grouping": 16, "minblocks": 1, "algorithm": "largeDB2", "perf": 1156.84, "source": "autotuned"},
{"m": 26, "n": 14, "k": 13, "tile_m": 1, "tile_n": 5, "threads": 96, "grouping": 4, "minblocks": 11, "algorithm": "medium", "perf": 1046.07, "source": "autotuned"},
{"m": 26, "n": 14, "k": 14, "tile_m": 1, "tile_n": 5, "threads": 128, "grouping": 5, "minblocks": 9, "algorithm": "medium", "perf": 1076.05, "source": "autotuned"},
{"m": 26, "n": 14, "k": 25, "tile_m": 1, "tile_n": 2, "threads": 192, "grouping": 4, "minblocks": 2, "algorithm": "medium", "perf": 1153.33, "source": "autotuned"},
{"m": 26, "n": 14, "k": 26, "tile_m": 1, "tile_n": 2, "threads": 192, "grouping": 4, "minblocks": 2, "algorithm": "medium", "perf": 1159.6, "source": "autotuned"},
{"m": 26, "n": 14, "k": 32, "tile_m": 3, "tile_n": 2, "w": 16, "v": 14, "threads": 64, "grouping": 16, "minblocks": 4, "algorithm": "largeDB2", "perf": 1196.64, "source": "autotuned"},
{"m": 26, "n": 24, "k": 5, "tile_m": 1, "tile_n": 4, "threads": 160, "grouping": 32, "minblocks": 9, "algorithm": "medium", "perf": 1078.8, "source": "autotuned"},
{"m": 26, "n": 24, "k": 13, "tile_m": 1, "tile_n": 6, "threads": 128, "grouping": 4, "minblocks": 7, "algorithm": "medium", "perf": 1387.5, "source": "autotuned"},
{"m": 26, "n": 24, "k": 24, "tile_m": 1, "tile_n": 4, "threads": 160, "grouping": 3, "minblocks": 5, "algorithm": "medium", "perf": 1530.31, "source": "autotuned"},
{"m": 26, "n": 24, "k": 26, "tile_m": 1, "tile_n": 4, "threads": 192, "grouping": 24, "minblocks": 4, "algorithm": "medium", "perf": 1507.25, "source": "autotuned"},
{"m": 26, "n": 24, "k": 32, "tile_m": 1, "tile_n": 4, "threads": 256, "grouping": 32, "minblocks": 3, "algorithm": "medium", "perf": 1570.75, "source": "autotuned"},
{"m": 26, "n": 25, "k": 4, "tile_m": 3, "tile_n": 4, "threads": 64, "grouping": 32, "minblocks": 8, "algorithm": "medium", "perf": 973.176, "source": "autotuned"},
{"m": 26, "n": 25, "k": 5, "tile_m": 1, "tile_n": 5, "threads": 160, "grouping": 13, "minblocks": 8, "algorithm": "medium", "perf": 1040.55, "source": "autotuned"},
{"m": 26, "n": 25, "k": 7, "tile_m": 1, "tile_n": 4, "threads": 192, "grouping": 18, "minblocks": 8, "algorithm": "medium", "perf": 1170.93, "source": "autotuned"},
{"m": 26, "n": 25, "k": 9, "tile_m": 3, "tile_n": 4, "threads": 64, "grouping": 26, "minblocks": 3, "algorithm": "medium", "perf": 1241.28, "source": "autotuned"},
{"m": 26, "n": 25, "k": 13, "tile_m": 1, "tile_n": 5, "threads": 160, "grouping": 6, "minblocks": 6, "algorithm": "medium", "perf": 1351.85, "source": "autotuned"},
{"m": 26, "n": 25, "k": 14, "tile_m": 1, "tile_n": 5, "threads": 192, "grouping": 29, "minblocks": 6, "algorithm": "medium", "perf": 1386.15, "source": "autotuned"},
{"m": 26, "n": 25, "k": 25, "tile_m": 3, "tile_n": 4, "threads": 64, "grouping": 30, "minblocks": 4, "algorithm": "medium", "perf": 1508.73, "source": "autotuned"},
{"m": 26, "n": 25, "k": 26, "tile_m": 3, "tile_n": 5, "threads": 64, "grouping": 29, "minblocks": 2, "algorithm": "medium", "perf": 1524.65, "source": "autotuned"},
{"m": 26, "n": 25, "k": 28, "tile_m": 1, "tile_n": 5, "threads": 192, "grouping": 24, "minblocks": 4, "algorithm": "medium", "perf": 1536.17, "source": "autotuned"},
{"m": 26, "n": 25, "k": 32, "tile_m": 3, "tile_n": 4, "w": 8, "v": 22, "threads": 64, "grouping": 16, "minblocks": 8, "algorithm": "largeDB2", "perf": 1588.12, "source": "autotuned"},
{"m": 26, "n": 25, "k": 45, "tile_m": 3, "tile_n": 4, "w": 18, "v": 20, "threads": 64, "grouping": 16, "minblocks": 4, "algorithm": "largeDB2", "perf": 1619.09, "source": "autotuned"},
{"m": 26, "n": 26, "k": 4, "tile_m": 3, "tile_n": 4, "threads": 64, "grouping": 32, "minblocks": 5, "algorithm": "medium", "perf": 1064.38, "source": "autotuned"},
{"m": 26, "n": 26, "k": 5, "tile_m": 3, "tile_n": 2, "threads": 160, "grouping": 9, "minblocks": 8, "algorithm": "medium", "perf": 1092.54, "source": "autotuned"},
{"m": 26, "n": 26, "k": 7, "tile_m": 1, "tile_n": 4, "threads": 192, "grouping": 9, "minblocks": 8, "algorithm": "medium", "perf": 1229.79, "source": "autotuned"},
{"m": 26, "n": 26, "k": 9, "tile_m": 1, "tile_n": 5, "threads": 160, "grouping": 9, "minblocks": 7, "algorithm": "medium", "perf": 1308.23, "source": "autotuned"},
{"m": 26, "n": 26, "k": 12, "tile_m": 1, "tile_n": 5, "threads": 160, "grouping": 5, "minblocks": 7, "algorithm": "medium", "perf": 1442.33, "source": "autotuned"},
{"m": 26, "n": 26, "k": 13, "tile_m": 1, "tile_n": 5, "threads": 160, "grouping": 5, "minblocks": 6, "algorithm": "medium", "perf": 1449.82, "source": "autotuned"},
{"m": 26, "n": 26, "k": 14, "tile_m": 1, "tile_n": 5, "threads": 160, "grouping": 5, "minblocks": 6, "algorithm": "medium", "perf": 1481.84, "source": "autotuned"},
{"m": 26, "n": 26, "k": 24, "tile_m": 3, "tile_n": 4, "threads": 64, "grouping": 3, "minblocks": 4, "algorithm": "medium", "perf": 1576.45, "source": "autotuned"},
{"m": 26, "n": 26, "k": 25, "tile_m": 1, "tile_n": 4, "threads": 192, "grouping": 32, "minblocks": 1, "algorithm": "medium", "perf": 1587.9, "source": "autotuned"},
{"m": 26, "n": 26, "k": 26, "tile_m": 1, "tile_n": 4, "threads": 192, "grouping": 4, "minblocks": 4, "algorithm": "medium", "perf": 1597.11, "source": "autotuned"},
{"m": 26, "n": 26, "k": 28, "tile_m": 3, "tile_n": 4, "threads": 64, "grouping": 3, "minblocks": 2, "algorithm": "medium", "perf": 1611.35, "source": "autotuned"},
{"m": 26, "n": 26, "k": 32, "tile_m": 3, "tile_n": 4, "threads": 64, "grouping": 3, "minblocks": 2, "algorithm": "medium", "perf": 1634.06, "source": "autotuned"},
{"m": 26, "n": 26, "k": 45, "tile_m": 3, "tile_n": 4, "w": 18, "v": 14, "threads": 64, "grouping": 16, "minblocks": 4, "algorithm": "largeDB2", "perf": 1658.01, "source": "autotuned"},
{"m": 26, "n": 28, "k": 4, "tile_m": 3, "tile_n": 4, "threads": 64, "grouping": 32, "minblocks": 2, "algorithm": "medium", "perf": 1060.2, "source": "autotuned"},
{"m": 26, "n": 28, "k": 5, "tile_m": 1, "tile_n": 5, "threads": 160, "grouping": 9, "minblocks": 8, "algorithm": "medium", "perf": 1126.12, "source": "autotuned"},
{"m": 26, "n": 28, "k": 7, "tile_m": 1, "tile_n": 4, "threads": 224, "grouping": 27, "minblocks": 6, "algorithm": "medium", "perf": 1233.99, "source": "autotuned"},
{"m": 26, "n": 28, "k": 9, "tile_m": 3, "tile_n": 4, "threads": 64, "grouping": 25, "minblocks": 3, "algorithm": "medium", "perf": 1333.66, "source": "autotuned"},
{"m": 26, "n": 28, "k": 13, "tile_m": 1, "tile_n": 5, "threads": 160, "grouping": 5, "minblocks": 6, "algorithm": "medium", "perf": 1462.23, "source": "autotuned"},
{"m": 26, "n": 28, "k": 25, "tile_m": 3, "tile_n": 4, "w": 8, "v": 28, "threads": 64, "grouping": 16, "minblocks": 1, "algorithm": "largeDB2", "perf": 1614.7, "source": "autotuned"},
{"m": 26, "n": 28, "k": 26, "tile_m": 3, "tile_n": 4, "w": 8, "v": 28, "threads": 64, "grouping": 16, "minblocks": 1, "algorithm": "largeDB2", "perf": 1634.02, "source": "autotuned"},
{"m": 26, "n": 28, "k": 28, "tile_m": 3, "tile_n": 4, "w": 8, "v": 28, "threads": 64, "grouping": 16, "minblocks": 2, "algorithm": "largeDB2", "perf": 1644.78, "source": "autotuned"},
{"m": 26, "n": 28, "k": 32, "tile_m": 3, "tile_n": 4, "w": 8, "v": 28, "threads": 64, "grouping": 16, "minblocks": 1, "algorithm": "largeDB2", "perf": 1687.3, "source": "autotuned"},
{"m": 26, "n": 28, "k": 45, "tile_m": 3, "tile_n": 3, "w": 16, "v": 28, "threads": 96, "grouping": 16, "minblocks": 1, "algorithm": "largeDB2", "perf": 1724.14, "source": "autotuned"},
{"m": 26, "n": 32, "k": 4, "tile_m": 1, "tile_n": 6, "threads": 160, "grouping": 12, "minblocks": 7, "algorithm": "medium", "perf": 1067.11, "source": "autotuned"},
{"m": 26, "n": 32, "k": 5, "tile_m": 1, "tile_n": 6, "threads": 192, "grouping": 12, "minblocks": 6, "algorithm": "medium", "perf": 1162.16, "source": "autotuned"},
{"m": 26, "n": 32, "k": 7, "tile_m": 3, "tile_n": 5, "threads": 64, "grouping": 26, "minblocks": 6, "algorithm": "medium", "perf": 1279.84, "source": "autotuned"},
{"m": 26, "n": 32, "k": 9, "tile_m": 1, "tile_n": 6, "threads": 160, "grouping": 10, "minblocks": 7, "algorithm": "medium", "perf": 1389.5, "source": "autotuned"},
{"m": 26, "n": 32, "k": 12, "tile_m": 7, "tile_n": 2, "w": 6, "v": 32, "threads": 64, "grouping": 16, "minblocks": 1, "algorithm": "largeDB2", "perf": 1501.3, "source": "autotuned"},
{"m": 26, "n": 32, "k": 13, "tile_m": 1, "tile_n": 6, "threads": 160, "grouping": 5, "minblocks": 6, "algorithm": "medium", "perf": 1539.69, "source": "autotuned"},
{"m": 26, "n": 32, "k": 14, "tile_m": 1, "tile_n": 6, "threads": 160, "grouping": 5, "minblocks": 6, "algorithm": "medium", "perf": 1590.16, "source": "autotuned"},
{"m": 26, "n": 32, "k": 24, "tile_m": 3, "tile_n": 5, "threads": 64, "grouping": 3, "minblocks": 3, "algorithm": "medium", "perf": 1705.11, "source": "autotuned"},
{"m": 26, "n": 32, "k": 25, "tile_m": 3, "tile_n": 5, "threads": 64, "grouping": 3, "minblocks": 2, "algorithm": "medium", "perf": 1687.93, "source": "autotuned"},
{"m": 26, "n": 32, "k": 26, "tile_m": 3, "tile_n": 5, "threads": 64, "grouping": 3, "minblocks": 2, "algorithm": "medium", "perf": 1732.07, "source": "autotuned"},
{"m": 26, "n": 32, "k": 28, "tile_m": 3, "tile_n": 5, "w": 14, "v": 26, "threads": 64, "grouping": 16, "minblocks": 1, "algorithm": "largeDB2", "perf": 1728.22, "source": "autotuned"},
{"m": 26, "n": 32, "k": 32, "tile_m": 3, "tile_n": 5, "w": 8, "v": 32, "threads": 64, "grouping": 16, "minblocks": 4, "algorithm": "largeDB2", "perf": 1778.97, "source": "autotuned"},
{"m": 26, "n": 32, "k": 45, "tile_m": 3, "tile_n": 5, "w": 16, "v": 30, "threads": 64, "grouping": 16, "minblocks": 1, "algorithm": "largeDB2", "perf": 1831.59, "source": "autotuned"},
{"m": 26, "n": 45, "k": 4, "tile_m": 1, "tile_n": 6, "threads": 224, "grouping": 29, "minblocks": 5, "algorithm": "medium", "perf": 1073.89, "source": "autotuned"},
{"m": 26, "n": 45, "k": 5, "tile_m": 1, "tile_n": 5, "threads": 256, "grouping": 29, "minblocks": 5, "algorithm": "medium", "perf": 1204.58, "source": "autotuned"},
{"m": 26, "n": 45, "k": 7, "tile_m": 3, "tile_n": 5, "threads": 96, "grouping": 25, "minblocks": 3, "algorithm": "medium", "perf": 1351.98, "source": "autotuned"},
{"m": 26, "n": 45, "k": 9, "tile_m": 1, "tile_n": 5, "threads": 256, "grouping": 29, "minblocks": 5, "algorithm": "medium", "perf": 1490.07, "source": "autotuned"},
{"m": 26, "n": 45, "k": 13, "tile_m": 3, "tile_n": 5, "threads": 96, "grouping": 24, "minblocks": 2, "algorithm": "medium", "perf": 1646.86, "source": "autotuned"},
{"m": 26, "n": 45, "k": 25, "tile_m": 1, "tile_n": 5, "threads": 256, "grouping": 32, "minblocks": 3, "algorithm": "medium", "perf": 1858.51, "source": "autotuned"},
{"m": 26, "n": 45, "k": 26, "tile_m": 7, "tile_n": 3, "w": 8, "v": 42, "threads": 64, "grouping": 16, "minblocks": 2, "algorithm": "largeDB2", "perf": 1878.25, "source": "autotuned"},
{"m": 26, "n": 45, "k": 28, "tile_m": 7, "tile_n": 3, "w": 8, "v": 38, "threads": 64, "grouping": 16, "minblocks": 2, "algorithm": "largeDB2", "perf": 1924.64, "source": "autotuned"},
{"m": 26, "n": 45, "k": 32, "tile_m": 7, "tile_n": 3, "w": 8, "v": 22, "threads": 64, "grouping": 16, "minblocks": 1, "algorithm": "largeDB2", "perf": 1985.28, "source": "autotuned"},
{"m": 26, "n": 45, "k": 45, "tile_m": 7, "tile_n": 3, "w": 14, "v": 36, "threads": 64, "grouping": 16, "minblocks": 4, "algorithm": "largeDB2", "perf": 2060.31, "source": "autotuned"},
{"m": 27, "n": 27, "k": 27, "tile_m": 3, "tile_n": 4, "threads": 64, "grouping": 3, "minblocks": 3, "algorithm": "medium", "perf": 1627.88, "source": "autotuned"},
{"m": 28, "n": 4, "k": 4, "tile_m": 1, "tile_n": 5, "threads": 32, "grouping": 13, "minblocks": 23, "algorithm": "medium", "perf": 461.401, "source": "autotuned"},
{"m": 28, "n": 4, "k": 5, "tile_m": 1, "tile_n": 5, "threads": 32, "grouping": 13, "minblocks": 21, "algorithm": "medium", "perf": 448.695, "source": "autotuned"},
{"m": 28, "n": 4, "k": 7, "tile_m": 1, "tile_n": 2, "threads": 64, "grouping": 24, "minblocks": 7, "algorithm": "medium", "perf": 463.739, "source": "autotuned"},
{"m": 28, "n": 4, "k": 9, "tile_m": 1, "tile_n": 2, "threads": 64, "grouping": 5, "minblocks": 2, "algorithm": "medium", "perf": 475.527, "source": "autotuned"},
{"m": 28, "n": 4, "k": 13, "tile_m": 1, "tile_n": 2, "threads": 64, "grouping": 29, "minblocks": 6, "algorithm": "medium", "perf": 481.891, "source": "autotuned"},
{"m": 28, "n": 4, "k": 25, "tile_m": 1, "tile_n": 2, "threads": 128, "grouping": 4, "minblocks": 4, "algorithm": "medium", "perf": 486.812, "source": "autotuned"},
{"m": 28, "n": 4, "k": 26, "tile_m": 1, "tile_n": 2, "threads": 128, "grouping": 32, "minblocks": 1, "algorithm": "medium", "perf": 486.174, "source": "autotuned"},
{"m": 28, "n": 4, "k": 28, "tile_m": 1, "tile_n": 2, "threads": 128, "grouping": 6, "minblocks": 3, "algorithm": "medium", "perf": 487.386, "source": "autotuned"},
{"m": 28, "n": 4, "k": 32, "tile_m": 1, "tile_n": 1, "threads": 192, "grouping": 4, "minblocks": 1, "algorithm": "medium", "perf": 493.569, "source": "autotuned"},
{"m": 28, "n": 4, "k": 45, "tile_m": 1, "tile_n": 1, "threads": 256, "grouping": 2, "minblocks": 3, "algorithm": "medium", "perf": 499.71, "source": "autotuned"},
{"m": 28, "n": 5, "k": 4, "tile_m": 1, "tile_n": 5, "threads": 32, "grouping": 15, "minblocks": 13, "algorithm": "medium", "perf": 512.554, "source": "autotuned"},
{"m": 28, "n": 5, "k": 5, "tile_m": 1, "tile_n": 5, "threads": 32, "grouping": 16, "minblocks": 24, "algorithm": "medium", "perf": 527.04, "source": "autotuned"},
{"m": 28, "n": 5, "k": 7, "tile_m": 1, "tile_n": 5, "threads": 64, "grouping": 22, "minblocks": 17, "algorithm": "medium", "perf": 539.965, "source": "autotuned"},
{"m": 28, "n": 5, "k": 9, "tile_m": 3, "tile_n": 1, "threads": 64, "grouping": 26, "minblocks": 12, "algorithm": "medium", "perf": 563.57, "source": "autotuned"},
{"m": 28, "n": 5, "k": 13, "tile_m": 1, "tile_n": 3, "threads": 96, "grouping": 29, "minblocks": 3, "algorithm": "medium", "perf": 557.175, "source": "autotuned"},
{"m": 28, "n": 5, "k": 25, "tile_m": 1, "tile_n": 3, "threads": 192, "grouping": 4, "minblocks": 7, "algorithm": "medium", "perf": 578.247, "source": "autotuned"},
{"m": 28, "n": 5, "k": 26, "tile_m": 1, "tile_n": 2, "threads": 160, "grouping": 5, "minblocks": 3, "algorithm": "medium", "perf": 579.676, "source": "autotuned"},
{"m": 28, "n": 5, "k": 28, "tile_m": 1, "tile_n": 1, "threads": 160, "grouping": 4, "minblocks": 1, "algorithm": "medium", "perf": 584.008, "source": "autotuned"},
{"m": 28, "n": 5, "k": 32, "tile_m": 1, "tile_n": 2, "threads": 192, "grouping": 4, "minblocks": 3, "algorithm": "medium", "perf": 594.508, "source": "autotuned"},
{"m": 28, "n": 5, "k": 45, "tile_m": 1, "tile_n": 1, "threads": 256, "grouping": 3, "minblocks": 3, "algorithm": "medium", "perf": 598.534, "source": "autotuned"},
{"m": 28, "n": 7, "k": 4, "tile_m": 2, "tile_n": 4, "threads": 32, "grouping": 17, "minblocks": 10, "algorithm": "medium", "perf": 622.45, "source": "autotuned"},
{"m": 28, "n": 7, "k": 5, "tile_m": 1, "tile_n": 4, "threads": 64, "grouping": 22, "minblocks": 7, "algorithm": "medium", "perf": 627.062, "source": "autotuned"},
{"m": 28, "n": 7, "k": 7, "tile_m": 1, "tile_n": 5, "threads": 64, "grouping": 26, "minblocks": 9, "algorithm": "medium", "perf": 683.291, "source": "autotuned"},
{"m": 28, "n": 7, "k": 9, "tile_m": 1, "tile_n": 4, "threads": 64, "grouping": 24, "minblocks": 1, "algorithm": "medium", "perf": 714.393, "source": "autotuned"},
{"m": 28, "n": 7, "k": 13, "tile_m": 1, "tile_n": 3, "threads": 96, "grouping": 29, "minblocks": 9, "algorithm": "medium", "perf": 722.039, "source": "autotuned"},
{"m": 28, "n": 7, "k": 25, "tile_m": 1, "tile_n": 2, "threads": 192, "grouping": 4, "minblocks": 6, "algorithm": "medium", "perf": 745.291, "source": "autotuned"},
{"m": 28, "n": 7, "k": 26, "tile_m": 1, "tile_n": 2, "threads": 192, "grouping": 4, "minblocks": 4, "algorithm": "medium", "perf": 747.448, "source": "autotuned"},
{"m": 28, "n": 7, "k": 28, "tile_m": 1, "tile_n": 2, "threads": 224, "grouping": 3, "minblocks": 6, "algorithm": "medium", "perf": 754.047, "source": "autotuned"},
{"m": 28, "n": 7, "k": 32, "tile_m": 1, "tile_n": 2, "threads": 256, "grouping": 4, "minblocks": 5, "algorithm": "medium", "perf": 768.773, "source": "autotuned"},
{"m": 28, "n": 7, "k": 45, "tile_m": 1, "tile_n": 2, "threads": 192, "grouping": 3, "minblocks": 2, "algorithm": "medium", "perf": 768.667, "source": "autotuned"},
{"m": 28, "n": 9, "k": 4, "tile_m": 1, "tile_n": 5, "threads": 64, "grouping": 24, "minblocks": 11, "algorithm": "medium", "perf": 686.434, "source": "autotuned"},
{"m": 28, "n": 9, "k": 5, "tile_m": 1, "tile_n": 5, "threads": 64, "grouping": 22, "minblocks": 19, "algorithm": "medium", "perf": 738.32, "source": "autotuned"},
{"m": 28, "n": 9, "k": 7, "tile_m": 1, "tile_n": 5, "threads": 64, "grouping": 26, "minblocks": 16, "algorithm": "medium", "perf": 808.579, "source": "autotuned"},
{"m": 28, "n": 9, "k": 9, "tile_m": 1, "tile_n": 3, "threads": 96, "grouping": 32, "minblocks": 3, "algorithm": "medium", "perf": 825.886, "source": "autotuned"},
{"m": 28, "n": 9, "k": 13, "tile_m": 1, "tile_n": 3, "threads": 128, "grouping": 32, "minblocks": 9, "algorithm": "medium", "perf": 844.884, "source": "autotuned"},
{"m": 28, "n": 9, "k": 25, "tile_m": 1, "tile_n": 3, "threads": 256, "grouping": 4, "minblocks": 6, "algorithm": "medium", "perf": 895.124, "source": "autotuned"},
{"m": 28, "n": 9, "k": 26, "tile_m": 1, "tile_n": 3, "threads": 256, "grouping": 4, "minblocks": 6, "algorithm": "medium", "perf": 891.424, "source": "autotuned"},
{"m": 28, "n": 9, "k": 28, "tile_m": 1, "tile_n": 2, "threads": 256, "grouping": 5, "minblocks": 5, "algorithm": "medium", "perf": 897.496, "source": "autotuned"},
{"m": 28, "n": 9, "k": 32, "tile_m": 1, "tile_n": 3, "threads": 128, "grouping": 3, "minblocks": 3, "algorithm": "medium", "perf": 918.668, "source": "autotuned"},
{"m": 28, "n": 9, "k": 45, "tile_m": 1, "tile_n": 3, "w": 10, "v": 4, "threads": 96, "grouping": 16, "minblocks": 4, "algorithm": "largeDB2", "perf": 930.129, "source": "autotuned"},
{"m": 28, "n": 13, "k": 4, "tile_m": 2, "tile_n": 4, "threads": 64, "grouping": 26, "minblocks": 7, "algorithm": "medium", "perf": 836.442, "source": "autotuned"},
{"m": 28, "n": 13, "k": 5, "tile_m": 1, "tile_n": 5, "threads": 96, "grouping": 12, "minblocks": 12, "algorithm": "medium", "perf": 827.406, "source": "autotuned"},
{"m": 28, "n": 13, "k": 7, "tile_m": 1, "tile_n": 5, "threads": 96, "grouping": 26, "minblocks": 11, "algorithm": "medium", "perf": 960.632, "source": "autotuned"},
{"m": 28, "n": 13, "k": 9, "tile_m": 1, "tile_n": 5, "threads": 128, "grouping": 32, "minblocks": 9, "algorithm": "medium", "perf": 996.46, "source": "autotuned"},
{"m": 28, "n": 13, "k": 13, "tile_m": 1, "tile_n": 5, "threads": 96, "grouping": 4, "minblocks": 10, "algorithm": "medium", "perf": 1030.59, "source": "autotuned"},
{"m": 28, "n": 13, "k": 25, "tile_m": 1, "tile_n": 3, "threads": 192, "grouping": 5, "minblocks": 5, "algorithm": "medium", "perf": 1115.36, "source": "autotuned"},
{"m": 28, "n": 13, "k": 26, "tile_m": 1, "tile_n": 3, "threads": 160, "grouping": 4, "minblocks": 4, "algorithm": "medium", "perf": 1114.24, "source": "autotuned"},
{"m": 28, "n": 13, "k": 28, "tile_m": 1, "tile_n": 4, "w": 10, "v": 12, "threads": 128, "grouping": 16, "minblocks": 2, "algorithm": "largeDB2", "perf": 1122.82, "source": "autotuned"},
{"m": 28, "n": 13, "k": 32, "tile_m": 1, "tile_n": 5, "threads": 128, "grouping": 24, "minblocks": 4, "algorithm": "medium", "perf": 1145.54, "source": "autotuned"},
{"m": 28, "n": 13, "k": 45, "tile_m": 1, "tile_n": 7, "w": 12, "v": 8, "threads": 64, "grouping": 16, "minblocks": 8, "algorithm": "largeDB2", "perf": 1176.78, "source": "autotuned"},
{"m": 28, "n": 25, "k": 4, "tile_m": 4, "tile_n": 3, "threads": 64, "grouping": 32, "minblocks": 3, "algorithm": "medium", "perf": 1029.26, "source": "autotuned"},
{"m": 28, "n": 25, "k": 5, "tile_m": 1, "tile_n": 5, "threads": 160, "grouping": 9, "minblocks": 8, "algorithm": "medium", "perf": 1103.4, "source": "autotuned"},
{"m": 28, "n": 25, "k": 7, "tile_m": 5, "tile_n": 3, "threads": 64, "grouping": 24, "minblocks": 2, "algorithm": "medium", "perf": 1185.57, "source": "autotuned"},
{"m": 28, "n": 25, "k": 9, "tile_m": 1, "tile_n": 5, "threads": 160, "grouping": 10, "minblocks": 7, "algorithm": "medium", "perf": 1283.85, "source": "autotuned"},
{"m": 28, "n": 25, "k": 13, "tile_m": 1, "tile_n": 5, "threads": 160, "grouping": 29, "minblocks": 5, "algorithm": "medium", "perf": 1423.58, "source": "autotuned"},
{"m": 28, "n": 25, "k": 25, "tile_m": 3, "tile_n": 5, "threads": 64, "grouping": 3, "minblocks": 3, "algorithm": "medium", "perf": 1582.11, "source": "autotuned"},
{"m": 28, "n": 25, "k": 26, "tile_m": 3, "tile_n": 5, "threads": 64, "grouping": 3, "minblocks": 4, "algorithm": "medium", "perf": 1581.68, "source": "autotuned"},
{"m": 28, "n": 25, "k": 28, "tile_m": 1, "tile_n": 5, "threads": 160, "grouping": 24, "minblocks": 4, "algorithm": "medium", "perf": 1601.02, "source": "autotuned"},
{"m": 28, "n": 25, "k": 32, "tile_m": 3, "tile_n": 3, "threads": 128, "grouping": 32, "minblocks": 1, "algorithm": "medium", "perf": 1631.38, "source": "autotuned"},
{"m": 28, "n": 25, "k": 45, "tile_m": 3, "tile_n": 5, "w": 12, "v": 14, "threads": 64, "grouping": 16, "minblocks": 4, "algorithm": "largeDB2", "perf": 1683.73, "source": "autotuned"},
{"m": 28, "n": 26, "k": 4, "tile_m": 4, "tile_n": 3, "threads": 64, "grouping": 32, "minblocks": 2, "algorithm": "medium", "perf": 1046.4, "source": "autotuned"},
{"m": 28, "n": 26, "k": 5, "tile_m": 1, "tile_n": 6, "threads": 160, "grouping": 9, "minblocks": 8, "algorithm": "medium", "perf": 1116.46, "source": "autotuned"},
{"m": 28, "n": 26, "k": 7, "tile_m": 5, "tile_n": 3, "threads": 64, "grouping": 25, "minblocks": 4, "algorithm": "medium", "perf": 1206.91, "source": "autotuned"},
{"m": 28, "n": 26, "k": 9, "tile_m": 5, "tile_n": 3, "threads": 64, "grouping": 21, "minblocks": 2, "algorithm": "medium", "perf": 1308.19, "source": "autotuned"},
{"m": 28, "n": 26, "k": 13, "tile_m": 3, "tile_n": 5, "threads": 64, "grouping": 5, "minblocks": 5, "algorithm": "medium", "perf": 1440.64, "source": "autotuned"},
{"m": 28, "n": 26, "k": 25, "tile_m": 3, "tile_n": 5, "threads": 64, "grouping": 3, "minblocks": 2, "algorithm": "medium", "perf": 1615.94, "source": "autotuned"},
{"m": 28, "n": 26, "k": 26, "tile_m": 3, "tile_n": 5, "threads": 64, "grouping": 3, "minblocks": 3, "algorithm": "medium", "perf": 1620.78, "source": "autotuned"},
{"m": 28, "n": 26, "k": 28, "tile_m": 3, "tile_n": 3, "threads": 96, "grouping": 3, "minblocks": 1, "algorithm": "medium", "perf": 1637.82, "source": "autotuned"},
{"m": 28, "n": 26, "k": 32, "tile_m": 3, "tile_n": 3, "threads": 128, "grouping": 32, "minblocks": 2, "algorithm": "medium", "perf": 1665.27, "source": "autotuned"},
{"m": 28, "n": 26, "k": 45, "tile_m": 3, "tile_n": 3, "w": 16, "v": 26, "threads": 96, "grouping": 16, "minblocks": 2, "algorithm": "largeDB2", "perf": 1738.17, "source": "autotuned"},
{"m": 28, "n": 28, "k": 4, "tile_m": 2, "tile_n": 4, "threads": 128, "grouping": 24, "minblocks": 3, "algorithm": "medium", "perf": 1053.5, "source": "autotuned"},
{"m": 28, "n": 28, "k": 5, "tile_m": 1, "tile_n": 6, "threads": 160, "grouping": 9, "minblocks": 7, "algorithm": "medium", "perf": 1153.08, "source": "autotuned"},
{"m": 28, "n": 28, "k": 7, "tile_m": 5, "tile_n": 3, "threads": 64, "grouping": 25, "minblocks": 3, "algorithm": "medium", "perf": 1291.9, "source": "autotuned"},
{"m": 28, "n": 28, "k": 9, "tile_m": 5, "tile_n": 3, "threads": 64, "grouping": 29, "minblocks": 3, "algorithm": "medium", "perf": 1407.79, "source": "autotuned"},
{"m": 28, "n": 28, "k": 13, "tile_m": 1, "tile_n": 6, "threads": 160, "grouping": 5, "minblocks": 6, "algorithm": "medium", "perf": 1560.57, "source": "autotuned"},
{"m": 28, "n": 28, "k": 25, "tile_m": 3, "tile_n": 5, "threads": 64, "grouping": 3, "minblocks": 3, "algorithm": "medium", "perf": 1712.97, "source": "autotuned"},
{"m": 28, "n": 28, "k": 26, "tile_m": 3, "tile_n": 5, "threads": 64, "grouping": 3, "minblocks": 2, "algorithm": "medium", "perf": 1708.21, "source": "autotuned"},
{"m": 28, "n": 28, "k": 28, "tile_m": 3, "tile_n": 5, "threads": 64, "grouping": 3, "minblocks": 3, "algorithm": "medium", "perf": 1700.13, "source": "autotuned"},
{"m": 28, "n": 28, "k": 32, "tile_m": 3, "tile_n": 5, "threads": 96, "grouping": 3, "minblocks": 2, "algorithm": "medium", "perf": 1753.32, "source": "autotuned"},
{"m": 28, "n": 28, "k": 45, "tile_m": 5, "tile_n": 3, "w": 8, "v": 14, "threads": 64, "grouping": 16, "minblocks": 4, "algorithm": "largeDB2", "perf": 1784.75, "source": "autotuned"},
{"m": 28, "n": 32, "k": 4, "tile_m": 3, "tile_n": 2, "threads": 160, "grouping": 29, "minblocks": 5, "algorithm": "medium", "perf": 1074.89, "source": "autotuned"},
{"m": 28, "n": 32, "k": 5, "tile_m": 1, "tile_n": 4, "threads": 224, "grouping": 9, "minblocks": 6, "algorithm": "medium", "perf": 1179.11, "source": "autotuned"},
{"m": 28, "n": 32, "k": 7, "tile_m": 1, "tile_n": 4, "threads": 256, "grouping": 29, "minblocks": 5, "algorithm": "medium", "perf": 1331.58, "source": "autotuned"},
{"m": 28, "n": 32, "k": 9, "tile_m": 4, "tile_n": 4, "threads": 64, "grouping": 29, "minblocks": 2, "algorithm": "medium", "perf": 1423.42, "source": "autotuned"},
{"m": 28, "n": 32, "k": 13, "tile_m": 3, "tile_n": 2, "threads": 160, "grouping": 29, "minblocks": 5, "algorithm": "medium", "perf": 1552.86, "source": "autotuned"},
{"m": 28, "n": 32, "k": 25, "tile_m": 1, "tile_n": 4, "threads": 224, "grouping": 4, "minblocks": 4, "algorithm": "medium", "perf": 1787.13, "source": "autotuned"},
{"m": 28, "n": 32, "k": 26, "tile_m": 1, "tile_n": 4, "threads": 256, "grouping": 32, "minblocks": 3, "algorithm": "medium", "perf": 1777.2, "source": "autotuned"},
{"m": 28, "n": 32, "k": 28, "tile_m": 5, "tile_n": 2, "threads": 96, "grouping": 3, "minblocks": 2, "algorithm": "medium", "perf": 1795.81, "source": "autotuned"},
{"m": 28, "n": 32, "k": 32, "tile_m": 5, "tile_n": 2, "w": 16, "v": 18, "threads": 96, "grouping": 16, "minblocks": 4, "algorithm": "largeDB2", "perf": 1849.83, "source": "autotuned"},
{"m": 28, "n": 32, "k": 45, "tile_m": 3, "tile_n": 6, "w": 10, "v": 16, "threads": 64, "grouping": 16, "minblocks": 1, "algorithm": "largeDB2", "perf": 1909.3, "source": "autotuned"},
{"m": 28, "n": 45, "k": 4, "tile_m": 3, "tile_n": 5, "threads": 96, "grouping": 29, "minblocks": 1, "algorithm": "medium", "perf": 1163.62, "source": "autotuned"},
{"m": 28, "n": 45, "k": 5, "tile_m": 1, "tile_n": 5, "threads": 256, "grouping": 16, "minblocks": 4, "algorithm": "medium", "perf": 1262.25, "source": "autotuned"},
{"m": 28, "n": 45, "k": 7, "tile_m": 3, "tile_n": 5, "threads": 96, "grouping": 25, "minblocks": 4, "algorithm": "medium", "perf": 1441, "source": "autotuned"},
{"m": 28, "n": 45, "k": 9, "tile_m": 3, "tile_n": 4, "threads": 128, "grouping": 32, "minblocks": 1, "algorithm": "medium", "perf": 1569.32, "source": "autotuned"},
{"m": 28, "n": 45, "k": 13, "tile_m": 3, "tile_n": 5, "threads": 96, "grouping": 24, "minblocks": 4, "algorithm": "medium", "perf": 1754.86, "source": "autotuned"},
{"m": 28, "n": 45, "k": 25, "tile_m": 3, "tile_n": 4, "threads": 128, "grouping": 32, "minblocks": 2, "algorithm": "medium", "perf": 1976.24, "source": "autotuned"},
{"m": 28, "n": 45, "k": 26, "tile_m": 3, "tile_n": 4, "threads": 128, "grouping": 32, "minblocks": 3, "algorithm": "medium", "perf": 1998.55, "source": "autotuned"},
{"m": 28, "n": 45, "k": 28, "tile_m": 7, "tile_n": 3, "w": 8, "v": 20, "threads": 64, "grouping": 16, "minblocks": 4, "algorithm": "largeDB2", "perf": 2023.14, "source": "autotuned"},
{"m": 28, "n": 45, "k": 32, "tile_m": 7, "tile_n": 3, "w": 8, "v": 20, "threads": 64, "grouping": 16, "minblocks": 1, "algorithm": "largeDB2", "perf": 2082.87, "source": "autotuned"},
{"m": 28, "n": 45, "k": 45, "tile_m": 7, "tile_n": 3, "w": 8, "v": 40, "threads": 64, "grouping": 16, "minblocks": 2, "algorithm": "largeDB2", "perf": 2164.99, "source": "autotuned"},
{"m": 29, "n": 14, "k": 14, "tile_m": 1, "tile_n": 5, "threads": 128, "grouping": 6, "minblocks": 9, "algorithm": "medium", "perf": 1094.19, "source": "autotuned"},
{"m": 29, "n": 14, "k": 16, "tile_m": 1, "tile_n": 5, "threads": 128, "grouping": 5, "minblocks": 8, "algorithm": "medium", "perf": 1132.98, "source": "autotuned"},
{"m": 29, "n": 14, "k": 29, "tile_m": 3, "tile_n": 3, "w": 12, "v": 14, "threads": 64, "grouping": 16, "minblocks": 8, "algorithm": "largeDB2", "perf": 1191.43, "source": "autotuned"},
{"m": 29, "n": 14, "k": 32, "tile_m": 3, "tile_n": 3, "threads": 64, "grouping": 29, "minblocks": 1, "algorithm": "medium", "perf": 1211.15, "source": "autotuned"},
{"m": 29, "n": 16, "k": 14, "tile_m": 1, "tile_n": 4, "threads": 128, "grouping": 4, "minblocks": 9, "algorithm": "medium", "perf": 1200.6, "source": "autotuned"},
{"m": 29, "n": 16, "k": 16, "tile_m": 1, "tile_n": 4, "threads": 128, "grouping": 4, "minblocks": 8, "algorithm": "medium", "perf": 1237.1, "source": "autotuned"},
{"m": 29, "n": 16, "k": 29, "tile_m": 3, "tile_n": 1, "w": 10, "v": 14, "threads": 160, "grouping": 16, "minblocks": 1, "algorithm": "largeDB2", "perf": 1302.52, "source": "autotuned"},
{"m": 29, "n": 16, "k": 55, "tile_m": 3, "tile_n": 3, "w": 14, "v": 16, "threads": 64, "grouping": 16, "minblocks": 1, "algorithm": "largeDB2", "perf": 1381.48, "source": "autotuned"},
{"m": 29, "n": 29, "k": 14, "tile_m": 3, "tile_n": 2, "threads": 160, "grouping": 32, "minblocks": 1, "algorithm": "medium", "perf": 1562.65, "source": "autotuned"},
{"m": 29, "n": 29, "k": 16, "tile_m": 3, "tile_n": 2, "threads": 160, "grouping": 32, "minblocks": 1, "algorithm": "medium", "perf": 1616.32, "source": "autotuned"},
{"m": 29, "n": 29, "k": 29, "tile_m": 3, "tile_n": 5, "threads": 96, "grouping": 24, "minblocks": 3, "algorithm": "medium", "perf": 1736.13, "source": "autotuned"},
{"m": 29, "n": 29, "k": 32, "tile_m": 3, "tile_n": 5, "threads": 96, "grouping": 3, "minblocks": 2, "algorithm": "medium", "perf": 1807.51, "source": "autotuned"},
{"m": 29, "n": 29, "k": 55, "tile_m": 3, "tile_n": 5, "w": 12, "v": 26, "threads": 64, "grouping": 16, "minblocks": 1, "algorithm": "largeDB2", "perf": 1881.61, "source": "autotuned"},
{"m": 29, "n": 32, "k": 14, "tile_m": 3, "tile_n": 2, "threads": 192, "grouping": 29, "minblocks": 5, "algorithm": "medium", "perf": 1630.9, "source": "autotuned"},
{"m": 29, "n": 32, "k": 29, "tile_m": 5, "tile_n": 2, "w": 12, "v": 28, "threads": 96, "grouping": 16, "minblocks": 1, "algorithm": "largeDB2", "perf": 1818.21, "source": "autotuned"},
{"m": 29, "n": 32, "k": 32, "tile_m": 3, "tile_n": 3, "threads": 128, "grouping": 32, "minblocks": 2, "algorithm": "medium", "perf": 1865.52, "source": "autotuned"},
{"m": 29, "n": 32, "k": 55, "tile_m": 3, "tile_n": 6, "w": 10, "v": 32, "threads": 64, "grouping": 16, "minblocks": 4, "algorithm": "largeDB2", "perf": 1977.23, "source": "autotuned"},
{"m": 29, "n": 55, "k": 16, "tile_m": 3, "tile_n": 5, "threads": 128, "grouping": 32, "minblocks": 1, "algorithm": "medium", "perf": 1958.07, "source": "autotuned"},
{"m": 29, "n": 55, "k": 29, "tile_m": 3, "tile_n": 5, "threads": 128, "grouping": 32, "minblocks": 1, "algorithm": "medium", "perf": 2173.7, "source": "autotuned"},
{"m": 29, "n": 55, "k": 32, "tile_m": 4, "tile_n": 7, "w": 8, "v": 36, "threads": 64, "grouping": 16, "minblocks": 4, "algorithm": "largeDB2", "perf": 2227.18, "source": "autotuned"},
{"m": 29, "n": 55, "k": 55, "tile_m": 5, "tile_n": 6, "w": 6, "v": 36, "threads": 64, "grouping": 16, "minblocks": 4, "algorithm": "largeDB2", "perf": 2364.15, "source": "autotuned"},
{"m": 30, "n": 30, "k": 30, "tile_m": 5, "tile_n": 3, "threads": 64, "grouping": 3, "minblocks": 1, "algorithm": "medium", "perf": 1838.1, "source": "autotuned"},
{"m": 31, "n": 31, "k": 31, "tile_m": 4, "tile_n": 4, "threads": 64, "grouping": 24, "minblocks": 1, "algorithm": "medium", "perf": 1830.67, "source": "autotuned"},
{"m": 32, "n": 4, "k": 4, "tile_m": 1, "tile_n": 6, "threads": 32, "grouping": 13, "minblocks": 2, "algorithm": "medium", "perf": 463.773, "source": "autotuned"},
{"m": 32, "n": 4, "k": 5, "tile_m": 1, "tile_n": 4, "threads": 32, "grouping": 16, "minblocks": 13, "algorithm": "medium", "perf": 469.138, "source": "autotuned"},
{"m": 32, "n": 4, "k": 7, "tile_m": 1, "tile_n": 2, "threads": 64, "grouping": 24, "minblocks": 7, "algorithm": "medium", "perf": 479.728, "source": "autotuned"},
{"m": 32, "n": 4, "k": 9, "tile_m": 1, "tile_n": 2, "threads": 64, "grouping": 6, "minblocks": 15, "algorithm": "medium", "perf": 482.038, "source": "autotuned"},
{"m": 32, "n": 4, "k": 13, "tile_m": 1, "tile_n": 2, "threads": 64, "grouping": 26, "minblocks": 11, "algorithm": "medium", "perf": 493.254, "source": "autotuned"},
{"m": 32, "n": 4, "k": 25, "tile_m": 1, "tile_n": 1, "threads": 160, "grouping": 4, "minblocks": 5, "algorithm": "medium", "perf": 498.236, "source": "autotuned"},
{"m": 32, "n": 4, "k": 26, "tile_m": 1, "tile_n": 1, "threads": 192, "grouping": 3, "minblocks": 5, "algorithm": "medium", "perf": 498.907, "source": "autotuned"},
{"m": 32, "n": 4, "k": 28, "tile_m": 1, "tile_n": 2, "threads": 256, "grouping": 4, "minblocks": 6, "algorithm": "medium", "perf": 503.858, "source": "autotuned"},
{"m": 32, "n": 4, "k": 32, "tile_m": 1, "tile_n": 1, "threads": 256, "grouping": 3, "minblocks": 1, "algorithm": "medium", "perf": 510.352, "source": "autotuned"},
{"m": 32, "n": 4, "k": 45, "tile_m": 1, "tile_n": 1, "threads": 256, "grouping": 3, "minblocks": 3, "algorithm": "medium", "perf": 514.431, "source": "autotuned"},
{"m": 32, "n": 5, "k": 4, "tile_m": 1, "tile_n": 5, "threads": 32, "grouping": 17, "minblocks": 26, "algorithm": "medium", "perf": 521.537, "source": "autotuned"},
{"m": 32, "n": 5, "k": 5, "tile_m": 1, "tile_n": 5, "threads": 32, "grouping": 16, "minblocks": 14, "algorithm": "medium", "perf": 535.38, "source": "autotuned"},
{"m": 32, "n": 5, "k": 7, "tile_m": 1, "tile_n": 5, "threads": 64, "grouping": 26, "minblocks": 13, "algorithm": "medium", "perf": 556.583, "source": "autotuned"},
{"m": 32, "n": 5, "k": 9, "tile_m": 1, "tile_n": 3, "threads": 64, "grouping": 29, "minblocks": 9, "algorithm": "medium", "perf": 568.533, "source": "autotuned"},
{"m": 32, "n": 5, "k": 12, "tile_m": 1, "tile_n": 3, "threads": 96, "grouping": 32, "minblocks": 5, "algorithm": "medium", "perf": 578.088, "source": "autotuned"},
{"m": 32, "n": 5, "k": 13, "tile_m": 1, "tile_n": 2, "threads": 96, "grouping": 32, "minblocks": 10, "algorithm": "medium", "perf": 571.398, "source": "autotuned"},
{"m": 32, "n": 5, "k": 16, "tile_m": 1, "tile_n": 2, "threads": 128, "grouping": 32, "minblocks": 7, "algorithm": "medium", "perf": 590.624, "source": "autotuned"},
{"m": 32, "n": 5, "k": 24, "tile_m": 1, "tile_n": 1, "threads": 192, "grouping": 5, "minblocks": 5, "algorithm": "medium", "perf": 595.227, "source": "autotuned"},
{"m": 32, "n": 5, "k": 25, "tile_m": 1, "tile_n": 1, "threads": 192, "grouping": 3, "minblocks": 1, "algorithm": "medium", "perf": 593.569, "source": "autotuned"},
{"m": 32, "n": 5, "k": 26, "tile_m": 1, "tile_n": 2, "threads": 160, "grouping": 4, "minblocks": 4, "algorithm": "medium", "perf": 597.402, "source": "autotuned"},
{"m": 32, "n": 5, "k": 28, "tile_m": 1, "tile_n": 1, "threads": 192, "grouping": 3, "minblocks": 1, "algorithm": "medium", "perf": 604.614, "source": "autotuned"},
{"m": 32, "n": 5, "k": 32, "tile_m": 1, "tile_n": 1, "threads": 256, "grouping": 3, "minblocks": 2, "algorithm": "medium", "perf": 611.583, "source": "autotuned"},
{"m": 32, "n": 5, "k": 45, "tile_m": 1, "tile_n": 1, "threads": 256, "grouping": 3, "minblocks": 3, "algorithm": "medium", "perf": 618.945, "source": "autotuned"},
{"m": 32, "n": 7, "k": 4, "tile_m": 2, "tile_n": 4, "threads": 32, "grouping": 19, "minblocks": 13, "algorithm": "medium", "perf": 635.452, "source": "autotuned"},
{"m": 32, "n": 7, "k": 5, "tile_m": 1, "tile_n": 4, "threads": 64, "grouping": 22, "minblocks": 4, "algorithm": "medium", "perf": 657.342, "source": "autotuned"},
{"m": 32, "n": 7, "k": 7, "tile_m": 1, "tile_n": 4, "threads": 64, "grouping": 26, "minblocks": 7, "algorithm": "medium", "perf": 710.551, "source": "autotuned"},
{"m": 32, "n": 7, "k": 9, "tile_m": 1, "tile_n": 4, "threads": 64, "grouping": 26, "minblocks": 12, "algorithm": "medium", "perf": 727.544, "source": "autotuned"},
{"m": 32, "n": 7, "k": 13, "tile_m": 1, "tile_n": 2, "threads": 128, "grouping": 32, "minblocks": 6, "algorithm": "medium", "perf": 739.552, "source": "autotuned"},
{"m": 32, "n": 7, "k": 25, "tile_m": 1, "tile_n": 2, "threads": 192, "grouping": 4, "minblocks": 4, "algorithm": "medium", "perf": 775.794, "source": "autotuned"},
{"m": 32, "n": 7, "k": 26, "tile_m": 1, "tile_n": 2, "threads": 192, "grouping": 4, "minblocks": 3, "algorithm": "medium", "perf": 776.845, "source": "autotuned"},
{"m": 32, "n": 7, "k": 28, "tile_m": 1, "tile_n": 2, "threads": 224, "grouping": 4, "minblocks": 3, "algorithm": "medium", "perf": 780.958, "source": "autotuned"},
{"m": 32, "n": 7, "k": 32, "tile_m": 1, "tile_n": 2, "threads": 256, "grouping": 4, "minblocks": 4, "algorithm": "medium", "perf": 799.863, "source": "autotuned"},
{"m": 32, "n": 7, "k": 45, "tile_m": 1, "tile_n": 1, "threads": 256, "grouping": 3, "minblocks": 3, "algorithm": "medium", "perf": 803.204, "source": "autotuned"},
{"m": 32, "n": 9, "k": 4, "tile_m": 1, "tile_n": 5, "threads": 64, "grouping": 24, "minblocks": 11, "algorithm": "medium", "perf": 719.416, "source": "autotuned"},
{"m": 32, "n": 9, "k": 5, "tile_m": 1, "tile_n": 6, "threads": 64, "grouping": 23, "minblocks": 13, "algorithm": "medium", "perf": 768.086, "source": "autotuned"},
{"m": 32, "n": 9, "k": 7, "tile_m": 1, "tile_n": 6, "threads": 64, "grouping": 25, "minblocks": 14, "algorithm": "medium", "perf": 830.63, "source": "autotuned"},
{"m": 32, "n": 9, "k": 9, "tile_m": 1, "tile_n": 5, "threads": 96, "grouping": 32, "minblocks": 10, "algorithm": "medium", "perf": 853.67, "source": "autotuned"},
{"m": 32, "n": 9, "k": 10, "tile_m": 1, "tile_n": 3, "threads": 96, "grouping": 29, "minblocks": 10, "algorithm": "medium", "perf": 863.579, "source": "autotuned"},
{"m": 32, "n": 9, "k": 12, "tile_m": 1, "tile_n": 3, "threads": 128, "grouping": 6, "minblocks": 11, "algorithm": "medium", "perf": 873.588, "source": "autotuned"},
{"m": 32, "n": 9, "k": 13, "tile_m": 1, "tile_n": 3, "threads": 128, "grouping": 4, "minblocks": 5, "algorithm": "medium", "perf": 873.679, "source": "autotuned"},
{"m": 32, "n": 9, "k": 22, "tile_m": 1, "tile_n": 3, "threads": 224, "grouping": 4, "minblocks": 5, "algorithm": "medium", "perf": 922.783, "source": "autotuned"},
{"m": 32, "n": 9, "k": 25, "tile_m": 1, "tile_n": 3, "threads": 256, "grouping": 4, "minblocks": 5, "algorithm": "medium", "perf": 926.612, "source": "autotuned"},
{"m": 32, "n": 9, "k": 26, "tile_m": 1, "tile_n": 3, "threads": 256, "grouping": 4, "minblocks": 5, "algorithm": "medium", "perf": 937.269, "source": "autotuned"},
{"m": 32, "n": 9, "k": 28, "tile_m": 1, "tile_n": 2, "threads": 160, "grouping": 3, "minblocks": 1, "algorithm": "medium", "perf": 943.269, "source": "autotuned"},
{"m": 32, "n": 9, "k": 32, "tile_m": 1, "tile_n": 3, "w": 8, "v": 8, "threads": 96, "grouping": 16, "minblocks": 2, "algorithm": "largeDB2", "perf": 954.006, "source": "autotuned"},
{"m": 32, "n": 9, "k": 45, "tile_m": 1, "tile_n": 3, "w": 10, "v": 4, "threads": 96, "grouping": 16, "minblocks": 1, "algorithm": "largeDB2", "perf": 967.274, "source": "autotuned"},
{"m": 32, "n": 10, "k": 9, "tile_m": 1, "tile_n": 5, "threads": 96, "grouping": 32, "minblocks": 10, "algorithm": "medium", "perf": 918.728, "source": "autotuned"},
{"m": 32, "n": 10, "k": 10, "tile_m": 1, "tile_n": 5, "threads": 128, "grouping": 32, "minblocks": 9, "algorithm": "medium", "perf": 915.443, "source": "autotuned"},
{"m": 32, "n": 10, "k": 12, "tile_m": 1, "tile_n": 3, "threads": 128, "grouping": 32, "minblocks": 9, "algorithm": "medium", "perf": 944.867, "source": "autotuned"},
{"m": 32, "n": 10, "k": 32, "tile_m": 1, "tile_n": 2, "threads": 192, "grouping": 3, "minblocks": 1, "algorithm": "medium", "perf": 1031.19, "source": "autotuned"},
{"m": 32, "n": 11, "k": 11, "tile_m": 1, "tile_n": 4, "threads": 128, "grouping": 4, "minblocks": 11, "algorithm": "medium", "perf": 978.001, "source": "autotuned"},
{"m": 32, "n": 11, "k": 12, "tile_m": 1, "tile_n": 3, "threads": 160, "grouping": 5, "minblocks": 9, "algorithm": "medium", "perf": 984.847, "source": "autotuned"},
{"m": 32, "n": 11, "k": 20, "tile_m": 1, "tile_n": 3, "threads": 224, "grouping": 4, "minblocks": 6, "algorithm": "medium", "perf": 1051.13, "source": "autotuned"},
{"m": 32, "n": 11, "k": 25, "tile_m": 1, "tile_n": 3, "threads": 160, "grouping": 3, "minblocks": 2, "algorithm": "medium", "perf": 1058.32, "source": "autotuned"},
{"m": 32, "n": 11, "k": 32, "tile_m": 1, "tile_n": 2, "threads": 192, "grouping": 3, "minblocks": 4, "algorithm": "medium", "perf": 1102.32, "source": "autotuned"},
{"m": 32, "n": 12, "k": 5, "tile_m": 1, "tile_n": 6, "threads": 64, "grouping": 26, "minblocks": 12, "algorithm": "medium", "perf": 908.801, "source": "autotuned"},
{"m": 32, "n": 12, "k": 9, "tile_m": 1, "tile_n": 3, "threads": 128, "grouping": 32, "minblocks": 10, "algorithm": "medium", "perf": 1015.3, "source": "autotuned"},
{"m": 32, "n": 12, "k": 10, "tile_m": 1, "tile_n": 3, "threads": 128, "grouping": 32, "minblocks": 11, "algorithm": "medium", "perf": 1036.39, "source": "autotuned"},
{"m": 32, "n": 12, "k": 11, "tile_m": 1, "tile_n": 4, "threads": 96, "grouping": 32, "minblocks": 11, "algorithm": "medium", "perf": 1023.16, "source": "autotuned"},
{"m": 32, "n": 12, "k": 12, "tile_m": 1, "tile_n": 3, "threads": 160, "grouping": 5, "minblocks": 9, "algorithm": "medium", "perf": 1047.84, "source": "autotuned"},
{"m": 32, "n": 12, "k": 13, "tile_m": 1, "tile_n": 4, "threads": 160, "grouping": 4, "minblocks": 9, "algorithm": "medium", "perf": 1058.78, "source": "autotuned"},
{"m": 32, "n": 12, "k": 16, "tile_m": 1, "tile_n": 3, "threads": 128, "grouping": 4, "minblocks": 2, "algorithm": "medium", "perf": 1090.93, "source": "autotuned"},
{"m": 32, "n": 12, "k": 20, "tile_m": 1, "tile_n": 3, "threads": 128, "grouping": 3, "minblocks": 6, "algorithm": "medium", "perf": 1116.25, "source": "autotuned"},
{"m": 32, "n": 12, "k": 25, "tile_m": 1, "tile_n": 2, "threads": 192, "grouping": 4, "minblocks": 5, "algorithm": "medium", "perf": 1131.14, "source": "autotuned"},
{"m": 32, "n": 12, "k": 26, "tile_m": 1, "tile_n": 2, "threads": 192, "grouping": 4, "minblocks": 5, "algorithm": "medium", "perf": 1144.79, "source": "autotuned"},
{"m": 32, "n": 12, "k": 32, "tile_m": 1, "tile_n": 2, "threads": 192, "grouping": 3, "minblocks": 4, "algorithm": "medium", "perf": 1176.59, "source": "autotuned"},
{"m": 32, "n": 13, "k": 4, "tile_m": 2, "tile_n": 4, "threads": 64, "grouping": 26, "minblocks": 1, "algorithm": "medium", "perf": 880.033, "source": "autotuned"},
{"m": 32, "n": 13, "k": 5, "tile_m": 1, "tile_n": 5, "threads": 96, "grouping": 24, "minblocks": 11, "algorithm": "medium", "perf": 897.283, "source": "autotuned"},
{"m": 32, "n": 13, "k": 7, "tile_m": 1, "tile_n": 5, "threads": 96, "grouping": 29, "minblocks": 11, "algorithm": "medium", "perf": 1013.1, "source": "autotuned"},
{"m": 32, "n": 13, "k": 9, "tile_m": 1, "tile_n": 5, "threads": 128, "grouping": 32, "minblocks": 9, "algorithm": "medium", "perf": 1040.81, "source": "autotuned"},
{"m": 32, "n": 13, "k": 12, "tile_m": 1, "tile_n": 3, "threads": 160, "grouping": 5, "minblocks": 9, "algorithm": "medium", "perf": 1085.48, "source": "autotuned"},
{"m": 32, "n": 13, "k": 13, "tile_m": 1, "tile_n": 5, "threads": 128, "grouping": 4, "minblocks": 8, "algorithm": "medium", "perf": 1085.19, "source": "autotuned"},
{"m": 32, "n": 13, "k": 14, "tile_m": 1, "tile_n": 5, "threads": 128, "grouping": 4, "minblocks": 7, "algorithm": "medium", "perf": 1105.19, "source": "autotuned"},
{"m": 32, "n": 13, "k": 16, "tile_m": 1, "tile_n": 4, "threads": 128, "grouping": 4, "minblocks": 7, "algorithm": "medium", "perf": 1140.15, "source": "autotuned"},
{"m": 32, "n": 13, "k": 24, "tile_m": 1, "tile_n": 4, "w": 12, "v": 10, "threads": 128, "grouping": 16, "minblocks": 1, "algorithm": "largeDB2", "perf": 1184.2, "source": "autotuned"},
{"m": 32, "n": 13, "k": 25, "tile_m": 1, "tile_n": 3, "threads": 224, "grouping": 4, "minblocks": 5, "algorithm": "medium", "perf": 1177.19, "source": "autotuned"},
{"m": 32, "n": 13, "k": 26, "tile_m": 1, "tile_n": 2, "threads": 224, "grouping": 4, "minblocks": 3, "algorithm": "medium", "perf": 1192.35, "source": "autotuned"},
{"m": 32, "n": 13, "k": 28, "tile_m": 1, "tile_n": 2, "threads": 224, "grouping": 4, "minblocks": 2, "algorithm": "medium", "perf": 1204.64, "source": "autotuned"},
{"m": 32, "n": 13, "k": 32, "tile_m": 1, "tile_n": 3, "threads": 192, "grouping": 3, "minblocks": 4, "algorithm": "medium", "perf": 1221.29, "source": "autotuned"},
{"m": 32, "n": 13, "k": 45, "tile_m": 1, "tile_n": 3, "w": 12, "v": 8, "threads": 160, "grouping": 16, "minblocks": 2, "algorithm": "largeDB2", "perf": 1240.12, "source": "autotuned"},
{"m": 32, "n": 14, "k": 13, "tile_m": 1, "tile_n": 5, "threads": 128, "grouping": 4, "minblocks": 9, "algorithm": "medium", "perf": 1143.59, "source": "autotuned"},
{"m": 32, "n": 14, "k": 14, "tile_m": 1, "tile_n": 4, "threads": 128, "grouping": 5, "minblocks": 8, "algorithm": "medium", "perf": 1160.77, "source": "autotuned"},
{"m": 32, "n": 14, "k": 25, "tile_m": 1, "tile_n": 3, "threads": 224, "grouping": 3, "minblocks": 5, "algorithm": "medium", "perf": 1240.88, "source": "autotuned"},
{"m": 32, "n": 14, "k": 26, "tile_m": 1, "tile_n": 2, "threads": 224, "grouping": 4, "minblocks": 5, "algorithm": "medium", "perf": 1258.77, "source": "autotuned"},
{"m": 32, "n": 14, "k": 29, "tile_m": 1, "tile_n": 3, "threads": 160, "grouping": 3, "minblocks": 4, "algorithm": "medium", "perf": 1262.69, "source": "autotuned"},
{"m": 32, "n": 14, "k": 32, "tile_m": 1, "tile_n": 2, "threads": 224, "grouping": 3, "minblocks": 1, "algorithm": "medium", "perf": 1286.87, "source": "autotuned"},
{"m": 32, "n": 16, "k": 5, "tile_m": 1, "tile_n": 6, "threads": 96, "grouping": 32, "minblocks": 10, "algorithm": "medium", "perf": 1010.78, "source": "autotuned"},
{"m": 32, "n": 16, "k": 12, "tile_m": 1, "tile_n": 4, "threads": 128, "grouping": 4, "minblocks": 10, "algorithm": "medium", "perf": 1235.03, "source": "autotuned"},
{"m": 32, "n": 16, "k": 13, "tile_m": 1, "tile_n": 5, "threads": 128, "grouping": 4, "minblocks": 9, "algorithm": "medium", "perf": 1239.79, "source": "autotuned"},
{"m": 32, "n": 16, "k": 16, "tile_m": 1, "tile_n": 4, "threads": 160, "grouping": 5, "minblocks": 7, "algorithm": "medium", "perf": 1289.33, "source": "autotuned"},
{"m": 32, "n": 16, "k": 32, "tile_m": 1, "tile_n": 4, "w": 12, "v": 16, "threads": 128, "grouping": 16, "minblocks": 2, "algorithm": "largeDB2", "perf": 1400.34, "source": "autotuned"},
{"m": 32, "n": 20, "k": 11, "tile_m": 1, "tile_n": 5, "threads": 128, "grouping": 4, "minblocks": 9, "algorithm": "medium", "perf": 1342.48, "source": "autotuned"},
{"m": 32, "n": 20, "k": 12, "tile_m": 1, "tile_n": 5, "threads": 128, "grouping": 4, "minblocks": 8, "algorithm": "medium", "perf": 1367.22, "source": "autotuned"},
{"m": 32, "n": 20, "k": 20, "tile_m": 1, "tile_n": 4, "threads": 192, "grouping": 4, "minblocks": 5, "algorithm": "medium", "perf": 1490.8, "source": "autotuned"},
{"m": 32, "n": 20, "k": 25, "tile_m": 1, "tile_n": 4, "threads": 160, "grouping": 4, "minblocks": 4, "algorithm": "medium", "perf": 1527.53, "source": "autotuned"},
{"m": 32, "n": 20, "k": 32, "tile_m": 1, "tile_n": 3, "threads": 224, "grouping": 3, "minblocks": 1, "algorithm": "medium", "perf": 1575.35, "source": "autotuned"},
{"m": 32, "n": 22, "k": 9, "tile_m": 1, "tile_n": 6, "threads": 128, "grouping": 6, "minblocks": 8, "algorithm": "medium", "perf": 1313.03, "source": "autotuned"},
{"m": 32, "n": 22, "k": 22, "tile_m": 1, "tile_n": 4, "threads": 192, "grouping": 5, "minblocks": 4, "algorithm": "medium", "perf": 1573.89, "source": "autotuned"},
{"m": 32, "n": 22, "k": 32, "tile_m": 1, "tile_n": 3, "threads": 256, "grouping": 32, "minblocks": 2, "algorithm": "medium", "perf": 1639.19, "source": "autotuned"},
{"m": 32, "n": 24, "k": 5, "tile_m": 1, "tile_n": 4, "threads": 192, "grouping": 9, "minblocks": 7, "algorithm": "medium", "perf": 1147.88, "source": "autotuned"},
{"m": 32, "n": 24, "k": 13, "tile_m": 1, "tile_n": 6, "threads": 160, "grouping": 29, "minblocks": 5, "algorithm": "medium", "perf": 1516.34, "source": "autotuned"},
{"m": 32, "n": 24, "k": 24, "tile_m": 1, "tile_n": 6, "threads": 128, "grouping": 3, "minblocks": 4, "algorithm": "medium", "perf": 1673.42, "source": "autotuned"},
{"m": 32, "n": 24, "k": 26, "tile_m": 1, "tile_n": 4, "threads": 224, "grouping": 3, "minblocks": 4, "algorithm": "medium", "perf": 1689.58, "source": "autotuned"},
{"m": 32, "n": 24, "k": 32, "tile_m": 1, "tile_n": 4, "w": 16, "v": 24, "threads": 192, "grouping": 16, "minblocks": 1, "algorithm": "largeDB2", "perf": 1736.99, "source": "autotuned"},
{"m": 32, "n": 25, "k": 4, "tile_m": 1, "tile_n": 5, "threads": 192, "grouping": 12, "minblocks": 7, "algorithm": "medium", "perf": 1051.58, "source": "autotuned"},
{"m": 32, "n": 25, "k": 5, "tile_m": 1, "tile_n": 5, "threads": 192, "grouping": 9, "minblocks": 7, "algorithm": "medium", "perf": 1163.15, "source": "autotuned"},
{"m": 32, "n": 25, "k": 7, "tile_m": 1, "tile_n": 5, "threads": 256, "grouping": 16, "minblocks": 5, "algorithm": "medium", "perf": 1273.22, "source": "autotuned"},
{"m": 32, "n": 25, "k": 9, "tile_m": 1, "tile_n": 5, "threads": 160, "grouping": 6, "minblocks": 7, "algorithm": "medium", "perf": 1389.05, "source": "autotuned"},
{"m": 32, "n": 25, "k": 11, "tile_m": 1, "tile_n": 5, "threads": 160, "grouping": 29, "minblocks": 5, "algorithm": "medium", "perf": 1465.98, "source": "autotuned"},
{"m": 32, "n": 25, "k": 12, "tile_m": 1, "tile_n": 5, "threads": 160, "grouping": 5, "minblocks": 7, "algorithm": "medium", "perf": 1501.64, "source": "autotuned"},
{"m": 32, "n": 25, "k": 13, "tile_m": 1, "tile_n": 5, "threads": 160, "grouping": 4, "minblocks": 7, "algorithm": "medium", "perf": 1543.97, "source": "autotuned"},
{"m": 32, "n": 25, "k": 14, "tile_m": 1, "tile_n": 5, "threads": 160, "grouping": 29, "minblocks": 5, "algorithm": "medium", "perf": 1565.97, "source": "autotuned"},
{"m": 32, "n": 25, "k": 20, "tile_m": 1, "tile_n": 5, "threads": 224, "grouping": 4, "minblocks": 5, "algorithm": "medium", "perf": 1673.05, "source": "autotuned"},
{"m": 32, "n": 25, "k": 25, "tile_m": 1, "tile_n": 5, "threads": 160, "grouping": 3, "minblocks": 4, "algorithm": "medium", "perf": 1683.41, "source": "autotuned"},
{"m": 32, "n": 25, "k": 26, "tile_m": 1, "tile_n": 5, "threads": 192, "grouping": 4, "minblocks": 4, "algorithm": "medium", "perf": 1695.86, "source": "autotuned"},
{"m": 32, "n": 25, "k": 28, "tile_m": 1, "tile_n": 5, "threads": 224, "grouping": 32, "minblocks": 3, "algorithm": "medium", "perf": 1709.63, "source": "autotuned"},
{"m": 32, "n": 25, "k": 32, "tile_m": 1, "tile_n": 5, "threads": 256, "grouping": 32, "minblocks": 3, "algorithm": "medium", "perf": 1751.37, "source": "autotuned"},
{"m": 32, "n": 25, "k": 45, "tile_m": 3, "tile_n": 5, "w": 16, "v": 20, "threads": 64, "grouping": 16, "minblocks": 1, "algorithm": "largeDB2", "perf": 1795.15, "source": "autotuned"},
{"m": 32, "n": 26, "k": 4, "tile_m": 1, "tile_n": 6, "threads": 160, "grouping": 10, "minblocks": 7, "algorithm": "medium", "perf": 1059.64, "source": "autotuned"},
{"m": 32, "n": 26, "k": 5, "tile_m": 1, "tile_n": 6, "threads": 192, "grouping": 24, "minblocks": 6, "algorithm": "medium", "perf": 1158.06, "source": "autotuned"},
{"m": 32, "n": 26, "k": 7, "tile_m": 5, "tile_n": 3, "threads": 64, "grouping": 24, "minblocks": 3, "algorithm": "medium", "perf": 1280.12, "source": "autotuned"},
{"m": 32, "n": 26, "k": 9, "tile_m": 1, "tile_n": 6, "threads": 160, "grouping": 6, "minblocks": 7, "algorithm": "medium", "perf": 1392.26, "source": "autotuned"},
{"m": 32, "n": 26, "k": 12, "tile_m": 5, "tile_n": 3, "threads": 64, "grouping": 24, "minblocks": 1, "algorithm": "medium", "perf": 1502.2, "source": "autotuned"},
{"m": 32, "n": 26, "k": 13, "tile_m": 1, "tile_n": 6, "threads": 160, "grouping": 5, "minblocks": 6, "algorithm": "medium", "perf": 1540.86, "source": "autotuned"},
{"m": 32, "n": 26, "k": 14, "tile_m": 1, "tile_n": 6, "threads": 160, "grouping": 4, "minblocks": 6, "algorithm": "medium", "perf": 1592.55, "source": "autotuned"},
{"m": 32, "n": 26, "k": 24, "tile_m": 5, "tile_n": 3, "w": 12, "v": 26, "threads": 64, "grouping": 16, "minblocks": 1, "algorithm": "largeDB2", "perf": 1704.87, "source": "autotuned"},
{"m": 32, "n": 26, "k": 25, "tile_m": 5, "tile_n": 3, "threads": 64, "grouping": 3, "minblocks": 3, "algorithm": "medium", "perf": 1702.43, "source": "autotuned"},
{"m": 32, "n": 26, "k": 26, "tile_m": 1, "tile_n": 4, "threads": 224, "grouping": 32, "minblocks": 3, "algorithm": "medium", "perf": 1710.53, "source": "autotuned"},
{"m": 32, "n": 26, "k": 28, "tile_m": 2, "tile_n": 5, "w": 14, "v": 24, "threads": 96, "grouping": 16, "minblocks": 4, "algorithm": "largeDB2", "perf": 1736.93, "source": "autotuned"},
{"m": 32, "n": 26, "k": 32, "tile_m": 1, "tile_n": 5, "w": 16, "v": 26, "threads": 192, "grouping": 16, "minblocks": 2, "algorithm": "largeDB2", "perf": 1778.77, "source": "autotuned"},
{"m": 32, "n": 26, "k": 45, "tile_m": 2, "tile_n": 7, "w": 12, "v": 26, "threads": 64, "grouping": 16, "minblocks": 1, "algorithm": "largeDB2", "perf": 1845.15, "source": "autotuned"},
{"m": 32, "n": 28, "k": 4, "tile_m": 1, "tile_n": 6, "threads": 160, "grouping": 29, "minblocks": 5, "algorithm": "medium", "perf": 1093.69, "source": "autotuned"},
{"m": 32, "n": 28, "k": 5, "tile_m": 1, "tile_n": 5, "threads": 192, "grouping": 10, "minblocks": 6, "algorithm": "medium", "perf": 1203.06, "source": "autotuned"},
{"m": 32, "n": 28, "k": 7, "tile_m": 1, "tile_n": 4, "threads": 256, "grouping": 24, "minblocks": 6, "algorithm": "medium", "perf": 1352.54, "source": "autotuned"},
{"m": 32, "n": 28, "k": 9, "tile_m": 1, "tile_n": 6, "threads": 160, "grouping": 6, "minblocks": 6, "algorithm": "medium", "perf": 1453.34, "source": "autotuned"},
{"m": 32, "n": 28, "k": 13, "tile_m": 1, "tile_n": 6, "threads": 160, "grouping": 29, "minblocks": 5, "algorithm": "medium", "perf": 1612.39, "source": "autotuned"},
{"m": 32, "n": 28, "k": 25, "tile_m": 1, "tile_n": 4, "threads": 224, "grouping": 4, "minblocks": 4, "algorithm": "medium", "perf": 1803.09, "source": "autotuned"},
{"m": 32, "n": 28, "k": 26, "tile_m": 1, "tile_n": 4, "threads": 224, "grouping": 32, "minblocks": 3, "algorithm": "medium", "perf": 1791.09, "source": "autotuned"},
{"m": 32, "n": 28, "k": 28, "tile_m": 2, "tile_n": 7, "w": 10, "v": 26, "threads": 64, "grouping": 16, "minblocks": 1, "algorithm": "largeDB2", "perf": 1810.27, "source": "autotuned"},
{"m": 32, "n": 28, "k": 32, "tile_m": 1, "tile_n": 5, "w": 16, "v": 28, "threads": 192, "grouping": 16, "minblocks": 1, "algorithm": "largeDB2", "perf": 1860.59, "source": "autotuned"},
{"m": 32, "n": 28, "k": 45, "tile_m": 2, "tile_n": 7, "w": 12, "v": 8, "threads": 64, "grouping": 16, "minblocks": 1, "algorithm": "largeDB2", "perf": 1916.4, "source": "autotuned"},
{"m": 32, "n": 29, "k": 14, "tile_m": 1, "tile_n": 6, "threads": 160, "grouping": 4, "minblocks": 6, "algorithm": "medium", "perf": 1690.58, "source": "autotuned"},
{"m": 32, "n": 29, "k": 29, "tile_m": 1, "tile_n": 5, "threads": 192, "grouping": 32, "minblocks": 3, "algorithm": "medium", "perf": 1821.2, "source": "autotuned"},
{"m": 32, "n": 29, "k": 32, "tile_m": 1, "tile_n": 5, "threads": 192, "grouping": 32, "minblocks": 2, "algorithm": "medium", "perf": 1879.76, "source": "autotuned"},
{"m": 32, "n": 29, "k": 55, "tile_m": 6, "tile_n": 3, "w": 14, "v": 18, "threads": 64, "grouping": 16, "minblocks": 2, "algorithm": "largeDB2", "perf": 1972.82, "source": "autotuned"},
{"m": 32, "n": 32, "k": 4, "tile_m": 2, "tile_n": 4, "threads": 128, "grouping": 29, "minblocks": 1, "algorithm": "medium", "perf": 1153.41, "source": "autotuned"},
{"m": 32, "n": 32, "k": 5, "tile_m": 1, "tile_n": 6, "threads": 192, "grouping": 29, "minblocks": 5, "algorithm": "medium", "perf": 1275.62, "source": "autotuned"},
{"m": 32, "n": 32, "k": 7, "tile_m": 4, "tile_n": 4, "threads": 64, "grouping": 29, "minblocks": 1, "algorithm": "medium", "perf": 1445.13, "source": "autotuned"},
{"m": 32, "n": 32, "k": 9, "tile_m": 4, "tile_n": 4, "threads": 64, "grouping": 30, "minblocks": 2, "algorithm": "medium", "perf": 1569.35, "source": "autotuned"},
{"m": 32, "n": 32, "k": 10, "tile_m": 1, "tile_n": 6, "threads": 192, "grouping": 29, "minblocks": 5, "algorithm": "medium", "perf": 1639.09, "source": "autotuned"},
{"m": 32, "n": 32, "k": 11, "tile_m": 1, "tile_n": 6, "threads": 192, "grouping": 29, "minblocks": 5, "algorithm": "medium", "perf": 1658.37, "source": "autotuned"},
{"m": 32, "n": 32, "k": 12, "tile_m": 1, "tile_n": 6, "threads": 192, "grouping": 29, "minblocks": 5, "algorithm": "medium", "perf": 1716.9, "source": "autotuned"},
{"m": 32, "n": 32, "k": 13, "tile_m": 1, "tile_n": 6, "threads": 192, "grouping": 5, "minblocks": 5, "algorithm": "medium", "perf": 1747.15, "source": "autotuned"},
{"m": 32, "n": 32, "k": 14, "tile_m": 1, "tile_n": 6, "threads": 192, "grouping": 5, "minblocks": 5, "algorithm": "medium", "perf": 1782.16, "source": "autotuned"},
{"m": 32, "n": 32, "k": 16, "tile_m": 1, "tile_n": 6, "threads": 192, "grouping": 4, "minblocks": 5, "algorithm": "medium", "perf": 1837.55, "source": "autotuned"},
{"m": 32, "n": 32, "k": 20, "tile_m": 1, "tile_n": 4, "threads": 256, "grouping": 5, "minblocks": 4, "algorithm": "medium", "perf": 1879.26, "source": "autotuned"},
{"m": 32, "n": 32, "k": 22, "tile_m": 1, "tile_n": 4, "threads": 256, "grouping": 4, "minblocks": 4, "algorithm": "medium", "perf": 1920.38, "source": "autotuned"},
{"m": 32, "n": 32, "k": 24, "tile_m": 4, "tile_n": 4, "threads": 64, "grouping": 3, "minblocks": 3, "algorithm": "medium", "perf": 1928.13, "source": "autotuned"},
{"m": 32, "n": 32, "k": 25, "tile_m": 1, "tile_n": 4, "threads": 256, "grouping": 32, "minblocks": 3, "algorithm": "medium", "perf": 1922.43, "source": "autotuned"},
{"m": 32, "n": 32, "k": 26, "tile_m": 1, "tile_n": 4, "threads": 256, "grouping": 32, "minblocks": 3, "algorithm": "medium", "perf": 1932.91, "source": "autotuned"},
{"m": 32, "n": 32, "k": 28, "tile_m": 4, "tile_n": 4, "threads": 64, "grouping": 3, "minblocks": 1, "algorithm": "medium", "perf": 1945.61, "source": "autotuned"},
{"m": 32, "n": 32, "k": 29, "tile_m": 1, "tile_n": 4, "threads": 256, "grouping": 3, "minblocks": 3, "algorithm": "medium", "perf": 1953.05, "source": "autotuned"},
{"m": 32, "n": 32, "k": 32, "tile_m": 4, "tile_n": 4, "w": 8, "v": 32, "threads": 64, "grouping": 16, "minblocks": 2, "algorithm": "largeDB2", "perf": 1988.65, "source": "autotuned"},
{"m": 32, "n": 32, "k": 45, "tile_m": 2, "tile_n": 8, "w": 10, "v": 16, "threads": 64, "grouping": 16, "minblocks": 1, "algorithm": "largeDB2", "perf": 2049.85, "source": "autotuned"},
{"m": 32, "n": 32, "k": 55, "tile_m": 2, "tile_n": 8, "w": 10, "v": 32, "threads": 64, "grouping": 16, "minblocks": 2, "algorithm": "largeDB2", "perf": 2095.89, "source": "autotuned"},
{"m": 32, "n": 45, "k": 4, "tile_m": 2, "tile_n": 6, "threads": 192, "grouping": 32, "minblocks": 1, "algorithm": "medium", "perf": 1189.96, "source": "autotuned"},
