src/acc/libsmm_acc/libcusmm/parameters_V100.json
[
{"m": 4, "n": 4, "k": 4, "tile_m": 1, "tile_n": 1, "threads": 32, "grouping": 10, "minblocks": 1, "algorithm": "medium", "perf": 246.008, "source": "autotuned"},
{"m": 4, "n": 4, "k": 5, "tile_m": 1, "tile_n": 1, "threads": 32, "grouping": 8, "minblocks": 3, "algorithm": "medium", "perf": 295.995, "source": "autotuned"},
{"m": 4, "n": 4, "k": 6, "tile_m": 1, "tile_n": 1, "threads": 32, "grouping": 7, "minblocks": 14, "algorithm": "medium", "perf": 346.775, "source": "autotuned"},
{"m": 4, "n": 4, "k": 7, "tile_m": 1, "tile_n": 1, "threads": 32, "grouping": 7, "minblocks": 13, "algorithm": "medium", "perf": 392.944, "source": "autotuned"},
{"m": 4, "n": 4, "k": 8, "tile_m": 1, "tile_n": 1, "threads": 32, "grouping": 7, "minblocks": 16, "algorithm": "medium", "perf": 405.137, "source": "autotuned"},
{"m": 4, "n": 4, "k": 9, "tile_m": 1, "tile_n": 1, "threads": 32, "grouping": 5, "minblocks": 2, "algorithm": "medium", "perf": 385.195, "source": "autotuned"},
{"m": 4, "n": 4, "k": 10, "tile_m": 1, "tile_n": 1, "threads": 32, "grouping": 5, "minblocks": 22, "algorithm": "medium", "perf": 404.271, "source": "autotuned"},
{"m": 4, "n": 4, "k": 13, "tile_m": 1, "tile_n": 1, "threads": 64, "grouping": 5, "minblocks": 25, "algorithm": "medium", "perf": 438.293, "source": "autotuned"},
{"m": 4, "n": 4, "k": 15, "tile_m": 1, "tile_n": 1, "threads": 64, "grouping": 5, "minblocks": 25, "algorithm": "medium", "perf": 471.731, "source": "autotuned"},
{"m": 4, "n": 4, "k": 22, "tile_m": 1, "tile_n": 1, "threads": 32, "grouping": 3, "minblocks": 24, "algorithm": "medium", "perf": 479.602, "source": "autotuned"},
{"m": 4, "n": 4, "k": 23, "tile_m": 1, "tile_n": 1, "threads": 32, "grouping": 3, "minblocks": 25, "algorithm": "medium", "perf": 469.625, "source": "autotuned"},
{"m": 4, "n": 4, "k": 25, "tile_m": 1, "tile_n": 1, "threads": 32, "grouping": 2, "minblocks": 26, "algorithm": "medium", "perf": 468.707, "source": "autotuned"},
{"m": 4, "n": 4, "k": 26, "tile_m": 1, "tile_n": 1, "threads": 32, "grouping": 3, "minblocks": 7, "algorithm": "medium", "perf": 472.517, "source": "autotuned"},
{"m": 4, "n": 4, "k": 28, "tile_m": 1, "tile_n": 1, "threads": 32, "grouping": 2, "minblocks": 12, "algorithm": "medium", "perf": 473.832, "source": "autotuned"},
{"m": 4, "n": 4, "k": 32, "tile_m": 1, "tile_n": 1, "threads": 32, "grouping": 2, "minblocks": 16, "algorithm": "medium", "perf": 469.584, "source": "autotuned"},
{"m": 4, "n": 4, "k": 45, "tile_m": 1, "tile_n": 1, "threads": 64, "grouping": 3, "minblocks": 3, "algorithm": "medium", "perf": 440.299, "source": "autotuned"},
{"m": 4, "n": 5, "k": 4, "tile_m": 1, "tile_n": 1, "threads": 32, "grouping": 10, "minblocks": 1, "algorithm": "medium", "perf": 308.153, "source": "autotuned"},
{"m": 4, "n": 5, "k": 5, "tile_m": 1, "tile_n": 1, "threads": 32, "grouping": 10, "minblocks": 14, "algorithm": "medium", "perf": 364.843, "source": "autotuned"},
{"m": 4, "n": 5, "k": 6, "tile_m": 1, "tile_n": 1, "threads": 32, "grouping": 7, "minblocks": 15, "algorithm": "medium", "perf": 421.298, "source": "autotuned"},
{"m": 4, "n": 5, "k": 7, "tile_m": 1, "tile_n": 1, "threads": 32, "grouping": 5, "minblocks": 16, "algorithm": "medium", "perf": 386.405, "source": "autotuned"},
{"m": 4, "n": 5, "k": 8, "tile_m": 1, "tile_n": 1, "threads": 64, "grouping": 5, "minblocks": 4, "algorithm": "medium", "perf": 406.801, "source": "autotuned"},
{"m": 4, "n": 5, "k": 9, "tile_m": 1, "tile_n": 1, "threads": 64, "grouping": 5, "minblocks": 7, "algorithm": "medium", "perf": 422.926, "source": "autotuned"},
{"m": 4, "n": 5, "k": 13, "tile_m": 2, "tile_n": 1, "threads": 64, "grouping": 5, "minblocks": 26, "algorithm": "medium", "perf": 462.967, "source": "autotuned"},
{"m": 4, "n": 5, "k": 22, "tile_m": 1, "tile_n": 1, "threads": 96, "grouping": 4, "minblocks": 18, "algorithm": "medium", "perf": 492.481, "source": "autotuned"},
{"m": 4, "n": 5, "k": 23, "tile_m": 1, "tile_n": 1, "threads": 128, "grouping": 5, "minblocks": 16, "algorithm": "medium", "perf": 490.113, "source": "autotuned"},
{"m": 4, "n": 5, "k": 25, "tile_m": 1, "tile_n": 1, "threads": 32, "grouping": 2, "minblocks": 6, "algorithm": "medium", "perf": 486.609, "source": "autotuned"},
{"m": 4, "n": 5, "k": 26, "tile_m": 1, "tile_n": 1, "threads": 32, "grouping": 2, "minblocks": 7, "algorithm": "medium", "perf": 481.038, "source": "autotuned"},
{"m": 4, "n": 5, "k": 28, "tile_m": 1, "tile_n": 1, "threads": 32, "grouping": 2, "minblocks": 6, "algorithm": "medium", "perf": 489.975, "source": "autotuned"},
{"m": 4, "n": 5, "k": 32, "tile_m": 1, "tile_n": 1, "threads": 32, "grouping": 2, "minblocks": 14, "algorithm": "medium", "perf": 496.239, "source": "autotuned"},
{"m": 4, "n": 5, "k": 45, "tile_m": 1, "tile_n": 1, "threads": 32, "grouping": 1, "minblocks": 6, "algorithm": "medium", "perf": 468.896, "source": "autotuned"},
{"m": 4, "n": 6, "k": 4, "tile_m": 1, "tile_n": 1, "threads": 32, "grouping": 10, "minblocks": 8, "algorithm": "medium", "perf": 368.735, "source": "autotuned"},
{"m": 4, "n": 6, "k": 5, "tile_m": 1, "tile_n": 1, "threads": 32, "grouping": 10, "minblocks": 13, "algorithm": "medium", "perf": 435.89, "source": "autotuned"},
{"m": 4, "n": 6, "k": 6, "tile_m": 1, "tile_n": 1, "threads": 32, "grouping": 10, "minblocks": 6, "algorithm": "medium", "perf": 407.925, "source": "autotuned"},
{"m": 4, "n": 6, "k": 7, "tile_m": 1, "tile_n": 1, "threads": 32, "grouping": 5, "minblocks": 22, "algorithm": "medium", "perf": 462.645, "source": "autotuned"},
{"m": 4, "n": 6, "k": 8, "tile_m": 1, "tile_n": 1, "threads": 64, "grouping": 5, "minblocks": 9, "algorithm": "medium", "perf": 479.855, "source": "autotuned"},
{"m": 4, "n": 6, "k": 9, "tile_m": 1, "tile_n": 1, "threads": 64, "grouping": 5, "minblocks": 25, "algorithm": "medium", "perf": 485.334, "source": "autotuned"},
{"m": 4, "n": 7, "k": 4, "tile_m": 1, "tile_n": 1, "threads": 32, "grouping": 10, "minblocks": 3, "algorithm": "medium", "perf": 428.942, "source": "autotuned"},
{"m": 4, "n": 7, "k": 5, "tile_m": 1, "tile_n": 1, "threads": 32, "grouping": 10, "minblocks": 13, "algorithm": "medium", "perf": 412.602, "source": "autotuned"},
{"m": 4, "n": 7, "k": 6, "tile_m": 1, "tile_n": 1, "threads": 32, "grouping": 10, "minblocks": 1, "algorithm": "medium", "perf": 475.905, "source": "autotuned"},
{"m": 4, "n": 7, "k": 7, "tile_m": 2, "tile_n": 1, "threads": 32, "grouping": 5, "minblocks": 1, "algorithm": "medium", "perf": 516.037, "source": "autotuned"},
{"m": 4, "n": 7, "k": 8, "tile_m": 1, "tile_n": 1, "threads": 64, "grouping": 5, "minblocks": 11, "algorithm": "medium", "perf": 525.403, "source": "autotuned"},
{"m": 4, "n": 7, "k": 13, "tile_m": 1, "tile_n": 1, "threads": 64, "grouping": 3, "minblocks": 25, "algorithm": "medium", "perf": 581.761, "source": "autotuned"},
{"m": 4, "n": 7, "k": 25, "tile_m": 1, "tile_n": 1, "threads": 32, "grouping": 2, "minblocks": 9, "algorithm": "medium", "perf": 549.47, "source": "autotuned"},
{"m": 4, "n": 7, "k": 26, "tile_m": 1, "tile_n": 1, "threads": 32, "grouping": 2, "minblocks": 19, "algorithm": "medium", "perf": 548.753, "source": "autotuned"},
{"m": 4, "n": 7, "k": 28, "tile_m": 1, "tile_n": 1, "threads": 128, "grouping": 4, "minblocks": 13, "algorithm": "medium", "perf": 555.309, "source": "autotuned"},
{"m": 4, "n": 7, "k": 32, "tile_m": 1, "tile_n": 1, "threads": 32, "grouping": 2, "minblocks": 8, "algorithm": "medium", "perf": 563.644, "source": "autotuned"},
{"m": 4, "n": 7, "k": 45, "tile_m": 1, "tile_n": 1, "threads": 32, "grouping": 2, "minblocks": 7, "algorithm": "medium", "perf": 529.874, "source": "autotuned"},
{"m": 4, "n": 8, "k": 4, "tile_m": 1, "tile_n": 1, "threads": 32, "grouping": 7, "minblocks": 1, "algorithm": "medium", "perf": 433.171, "source": "autotuned"},
{"m": 4, "n": 8, "k": 5, "tile_m": 1, "tile_n": 1, "threads": 32, "grouping": 10, "minblocks": 16, "algorithm": "medium", "perf": 477.871, "source": "autotuned"},
{"m": 4, "n": 8, "k": 6, "tile_m": 1, "tile_n": 1, "threads": 32, "grouping": 10, "minblocks": 23, "algorithm": "medium", "perf": 551.799, "source": "autotuned"},
{"m": 4, "n": 8, "k": 7, "tile_m": 2, "tile_n": 1, "threads": 32, "grouping": 5, "minblocks": 25, "algorithm": "medium", "perf": 569.968, "source": "autotuned"},
{"m": 4, "n": 8, "k": 8, "tile_m": 1, "tile_n": 1, "threads": 64, "grouping": 5, "minblocks": 25, "algorithm": "medium", "perf": 566.549, "source": "autotuned"},
{"m": 4, "n": 8, "k": 9, "tile_m": 1, "tile_n": 1, "threads": 64, "grouping": 5, "minblocks": 25, "algorithm": "medium", "perf": 560.233, "source": "autotuned"},
{"m": 4, "n": 9, "k": 4, "tile_m": 2, "tile_n": 1, "threads": 32, "grouping": 8, "minblocks": 5, "algorithm": "medium", "perf": 413.149, "source": "autotuned"},
{"m": 4, "n": 9, "k": 5, "tile_m": 2, "tile_n": 1, "threads": 32, "grouping": 5, "minblocks": 25, "algorithm": "medium", "perf": 492.074, "source": "autotuned"},
{"m": 4, "n": 9, "k": 6, "tile_m": 2, "tile_n": 1, "threads": 32, "grouping": 5, "minblocks": 10, "algorithm": "medium", "perf": 541.308, "source": "autotuned"},
{"m": 4, "n": 9, "k": 7, "tile_m": 2, "tile_n": 1, "threads": 32, "grouping": 9, "minblocks": 24, "algorithm": "medium", "perf": 581.319, "source": "autotuned"},
{"m": 4, "n": 9, "k": 8, "tile_m": 2, "tile_n": 1, "threads": 64, "grouping": 5, "minblocks": 26, "algorithm": "medium", "perf": 561.045, "source": "autotuned"},
{"m": 4, "n": 9, "k": 9, "tile_m": 2, "tile_n": 1, "threads": 64, "grouping": 5, "minblocks": 27, "algorithm": "medium", "perf": 583.137, "source": "autotuned"},
{"m": 4, "n": 9, "k": 13, "tile_m": 2, "tile_n": 1, "threads": 64, "grouping": 4, "minblocks": 26, "algorithm": "medium", "perf": 621.518, "source": "autotuned"},
{"m": 4, "n": 9, "k": 22, "tile_m": 2, "tile_n": 1, "threads": 96, "grouping": 3, "minblocks": 15, "algorithm": "medium", "perf": 586.676, "source": "autotuned"},
{"m": 4, "n": 9, "k": 23, "tile_m": 2, "tile_n": 1, "threads": 96, "grouping": 3, "minblocks": 14, "algorithm": "medium", "perf": 580.338, "source": "autotuned"},
{"m": 4, "n": 9, "k": 25, "tile_m": 1, "tile_n": 1, "threads": 128, "grouping": 3, "minblocks": 14, "algorithm": "medium", "perf": 578.701, "source": "autotuned"},
{"m": 4, "n": 9, "k": 26, "tile_m": 2, "tile_n": 1, "threads": 128, "grouping": 3, "minblocks": 12, "algorithm": "medium", "perf": 579.831, "source": "autotuned"},
{"m": 4, "n": 9, "k": 28, "tile_m": 2, "tile_n": 1, "threads": 128, "grouping": 3, "minblocks": 11, "algorithm": "medium", "perf": 589.888, "source": "autotuned"},
{"m": 4, "n": 9, "k": 32, "tile_m": 2, "tile_n": 1, "threads": 32, "grouping": 2, "minblocks": 13, "algorithm": "medium", "perf": 597.201, "source": "autotuned"},
{"m": 4, "n": 9, "k": 45, "tile_m": 2, "tile_n": 1, "threads": 32, "grouping": 2, "minblocks": 15, "algorithm": "medium", "perf": 571.751, "source": "autotuned"},
{"m": 4, "n": 10, "k": 4, "tile_m": 2, "tile_n": 1, "threads": 32, "grouping": 8, "minblocks": 12, "algorithm": "medium", "perf": 461.137, "source": "autotuned"},
{"m": 4, "n": 10, "k": 10, "tile_m": 2, "tile_n": 1, "threads": 64, "grouping": 4, "minblocks": 27, "algorithm": "medium", "perf": 642.821, "source": "autotuned"},
{"m": 4, "n": 10, "k": 15, "tile_m": 2, "tile_n": 1, "threads": 64, "grouping": 3, "minblocks": 24, "algorithm": "medium", "perf": 623.118, "source": "autotuned"},
{"m": 4, "n": 13, "k": 4, "tile_m": 2, "tile_n": 1, "threads": 32, "grouping": 8, "minblocks": 2, "algorithm": "medium", "perf": 580.161, "source": "autotuned"},
{"m": 4, "n": 13, "k": 5, "tile_m": 2, "tile_n": 1, "threads": 32, "grouping": 8, "minblocks": 16, "algorithm": "medium", "perf": 622.204, "source": "autotuned"},
{"m": 4, "n": 13, "k": 7, "tile_m": 2, "tile_n": 1, "threads": 32, "grouping": 7, "minblocks": 9, "algorithm": "medium", "perf": 681.111, "source": "autotuned"},
{"m": 4, "n": 13, "k": 9, "tile_m": 2, "tile_n": 1, "threads": 64, "grouping": 4, "minblocks": 25, "algorithm": "medium", "perf": 671.288, "source": "autotuned"},
{"m": 4, "n": 13, "k": 13, "tile_m": 2, "tile_n": 1, "threads": 64, "grouping": 3, "minblocks": 23, "algorithm": "medium", "perf": 658.006, "source": "autotuned"},
{"m": 4, "n": 13, "k": 22, "tile_m": 2, "tile_n": 1, "threads": 96, "grouping": 3, "minblocks": 14, "algorithm": "medium", "perf": 645.508, "source": "autotuned"},
{"m": 4, "n": 13, "k": 23, "tile_m": 2, "tile_n": 1, "threads": 96, "grouping": 2, "minblocks": 14, "algorithm": "medium", "perf": 637.149, "source": "autotuned"},
{"m": 4, "n": 13, "k": 25, "tile_m": 1, "tile_n": 1, "threads": 128, "grouping": 3, "minblocks": 13, "algorithm": "medium", "perf": 629.5, "source": "autotuned"},
{"m": 4, "n": 13, "k": 26, "tile_m": 2, "tile_n": 1, "threads": 128, "grouping": 3, "minblocks": 12, "algorithm": "medium", "perf": 637.134, "source": "autotuned"},
{"m": 4, "n": 13, "k": 28, "tile_m": 2, "tile_n": 1, "threads": 128, "grouping": 2, "minblocks": 11, "algorithm": "medium", "perf": 642.176, "source": "autotuned"},
{"m": 4, "n": 13, "k": 32, "tile_m": 2, "tile_n": 1, "threads": 32, "grouping": 2, "minblocks": 16, "algorithm": "medium", "perf": 647.889, "source": "autotuned"},
{"m": 4, "n": 13, "k": 45, "tile_m": 1, "tile_n": 1, "threads": 224, "grouping": 2, "minblocks": 8, "algorithm": "medium", "perf": 628.519, "source": "autotuned"},
{"m": 4, "n": 15, "k": 4, "tile_m": 2, "tile_n": 1, "threads": 32, "grouping": 8, "minblocks": 12, "algorithm": "medium", "perf": 643.765, "source": "autotuned"},
{"m": 4, "n": 15, "k": 10, "tile_m": 2, "tile_n": 1, "threads": 64, "grouping": 3, "minblocks": 21, "algorithm": "medium", "perf": 674.671, "source": "autotuned"},
{"m": 4, "n": 15, "k": 15, "tile_m": 2, "tile_n": 1, "threads": 64, "grouping": 4, "minblocks": 17, "algorithm": "medium", "perf": 664.565, "source": "autotuned"},
{"m": 4, "n": 22, "k": 4, "tile_m": 1, "tile_n": 3, "threads": 32, "grouping": 7, "minblocks": 9, "algorithm": "medium", "perf": 721.241, "source": "autotuned"},
{"m": 4, "n": 22, "k": 5, "tile_m": 1, "tile_n": 3, "threads": 32, "grouping": 4, "minblocks": 4, "algorithm": "medium", "perf": 698.948, "source": "autotuned"},
{"m": 4, "n": 22, "k": 9, "tile_m": 1, "tile_n": 3, "threads": 64, "grouping": 3, "minblocks": 19, "algorithm": "medium", "perf": 675.48, "source": "autotuned"},
{"m": 4, "n": 22, "k": 13, "tile_m": 2, "tile_n": 1, "threads": 64, "grouping": 3, "minblocks": 3, "algorithm": "medium", "perf": 683.974, "source": "autotuned"},
{"m": 4, "n": 22, "k": 22, "tile_m": 1, "tile_n": 3, "threads": 96, "grouping": 3, "minblocks": 11, "algorithm": "medium", "perf": 694.29, "source": "autotuned"},
{"m": 4, "n": 22, "k": 23, "tile_m": 1, "tile_n": 2, "threads": 96, "grouping": 3, "minblocks": 12, "algorithm": "medium", "perf": 691.473, "source": "autotuned"},
{"m": 4, "n": 22, "k": 26, "tile_m": 1, "tile_n": 1, "threads": 128, "grouping": 3, "minblocks": 2, "algorithm": "medium", "perf": 693.046, "source": "autotuned"},
{"m": 4, "n": 23, "k": 4, "tile_m": 1, "tile_n": 3, "threads": 32, "grouping": 7, "minblocks": 12, "algorithm": "medium", "perf": 704.138, "source": "autotuned"},
{"m": 4, "n": 23, "k": 5, "tile_m": 1, "tile_n": 3, "threads": 32, "grouping": 4, "minblocks": 4, "algorithm": "medium", "perf": 693.297, "source": "autotuned"},
{"m": 4, "n": 23, "k": 13, "tile_m": 1, "tile_n": 3, "threads": 64, "grouping": 2, "minblocks": 20, "algorithm": "medium", "perf": 688.521, "source": "autotuned"},
{"m": 4, "n": 23, "k": 22, "tile_m": 2, "tile_n": 1, "threads": 96, "grouping": 2, "minblocks": 13, "algorithm": "medium", "perf": 696.548, "source": "autotuned"},
{"m": 4, "n": 23, "k": 23, "tile_m": 1, "tile_n": 3, "threads": 96, "grouping": 2, "minblocks": 11, "algorithm": "medium", "perf": 697.693, "source": "autotuned"},
{"m": 4, "n": 23, "k": 26, "tile_m": 1, "tile_n": 1, "threads": 128, "grouping": 3, "minblocks": 7, "algorithm": "medium", "perf": 693.63, "source": "autotuned"},
{"m": 4, "n": 25, "k": 4, "tile_m": 4, "tile_n": 1, "threads": 32, "grouping": 8, "minblocks": 16, "algorithm": "medium", "perf": 689.717, "source": "autotuned"},
{"m": 4, "n": 25, "k": 5, "tile_m": 2, "tile_n": 3, "threads": 32, "grouping": 9, "minblocks": 22, "algorithm": "medium", "perf": 679.56, "source": "autotuned"},
{"m": 4, "n": 25, "k": 7, "tile_m": 2, "tile_n": 1, "threads": 64, "grouping": 5, "minblocks": 26, "algorithm": "medium", "perf": 673.897, "source": "autotuned"},
{"m": 4, "n": 25, "k": 9, "tile_m": 2, "tile_n": 1, "threads": 64, "grouping": 3, "minblocks": 23, "algorithm": "medium", "perf": 673.553, "source": "autotuned"},
{"m": 4, "n": 25, "k": 13, "tile_m": 2, "tile_n": 1, "threads": 64, "grouping": 3, "minblocks": 2, "algorithm": "medium", "perf": 692.688, "source": "autotuned"},
{"m": 4, "n": 25, "k": 25, "tile_m": 2, "tile_n": 1, "threads": 128, "grouping": 2, "minblocks": 10, "algorithm": "medium", "perf": 699.011, "source": "autotuned"},
{"m": 4, "n": 25, "k": 26, "tile_m": 2, "tile_n": 1, "threads": 128, "grouping": 3, "minblocks": 8, "algorithm": "medium", "perf": 702.163, "source": "autotuned"},
{"m": 4, "n": 25, "k": 28, "tile_m": 2, "tile_n": 1, "threads": 128, "grouping": 3, "minblocks": 2, "algorithm": "medium", "perf": 703.031, "source": "autotuned"},
{"m": 4, "n": 25, "k": 32, "tile_m": 2, "tile_n": 1, "threads": 160, "grouping": 2, "minblocks": 8, "algorithm": "medium", "perf": 714.509, "source": "autotuned"},
{"m": 4, "n": 25, "k": 45, "tile_m": 2, "tile_n": 1, "threads": 192, "grouping": 3, "minblocks": 6, "algorithm": "medium", "perf": 709.255, "source": "autotuned"},
{"m": 4, "n": 26, "k": 4, "tile_m": 4, "tile_n": 1, "threads": 32, "grouping": 8, "minblocks": 8, "algorithm": "medium", "perf": 713.203, "source": "autotuned"},
{"m": 4, "n": 26, "k": 5, "tile_m": 2, "tile_n": 3, "threads": 32, "grouping": 3, "minblocks": 25, "algorithm": "medium", "perf": 682.143, "source": "autotuned"},
{"m": 4, "n": 26, "k": 7, "tile_m": 2, "tile_n": 2, "threads": 32, "grouping": 4, "minblocks": 26, "algorithm": "medium", "perf": 682.312, "source": "autotuned"},
{"m": 4, "n": 26, "k": 9, "tile_m": 2, "tile_n": 1, "threads": 64, "grouping": 3, "minblocks": 22, "algorithm": "medium", "perf": 679.23, "source": "autotuned"},
{"m": 4, "n": 26, "k": 13, "tile_m": 2, "tile_n": 1, "threads": 64, "grouping": 3, "minblocks": 5, "algorithm": "medium", "perf": 697.924, "source": "autotuned"},
{"m": 4, "n": 26, "k": 22, "tile_m": 2, "tile_n": 1, "threads": 96, "grouping": 2, "minblocks": 10, "algorithm": "medium", "perf": 706.743, "source": "autotuned"},
{"m": 4, "n": 26, "k": 23, "tile_m": 2, "tile_n": 1, "threads": 96, "grouping": 3, "minblocks": 6, "algorithm": "medium", "perf": 697.513, "source": "autotuned"},
{"m": 4, "n": 26, "k": 25, "tile_m": 2, "tile_n": 1, "threads": 128, "grouping": 3, "minblocks": 2, "algorithm": "medium", "perf": 700.508, "source": "autotuned"},
{"m": 4, "n": 26, "k": 26, "tile_m": 2, "tile_n": 1, "threads": 128, "grouping": 3, "minblocks": 10, "algorithm": "medium", "perf": 711.801, "source": "autotuned"},
{"m": 4, "n": 26, "k": 28, "tile_m": 2, "tile_n": 1, "threads": 128, "grouping": 2, "minblocks": 1, "algorithm": "medium", "perf": 713.949, "source": "autotuned"},
{"m": 4, "n": 26, "k": 32, "tile_m": 2, "tile_n": 1, "threads": 160, "grouping": 2, "minblocks": 8, "algorithm": "medium", "perf": 722.448, "source": "autotuned"},
{"m": 4, "n": 26, "k": 45, "tile_m": 2, "tile_n": 1, "threads": 192, "grouping": 3, "minblocks": 1, "algorithm": "medium", "perf": 714.8, "source": "autotuned"},
{"m": 4, "n": 28, "k": 4, "tile_m": 4, "tile_n": 1, "threads": 32, "grouping": 8, "minblocks": 8, "algorithm": "medium", "perf": 713.43, "source": "autotuned"},
{"m": 4, "n": 28, "k": 5, "tile_m": 4, "tile_n": 1, "threads": 32, "grouping": 4, "minblocks": 26, "algorithm": "medium", "perf": 691.419, "source": "autotuned"},
{"m": 4, "n": 28, "k": 7, "tile_m": 4, "tile_n": 1, "threads": 32, "grouping": 3, "minblocks": 3, "algorithm": "medium", "perf": 688.417, "source": "autotuned"},
{"m": 4, "n": 28, "k": 9, "tile_m": 2, "tile_n": 1, "threads": 64, "grouping": 2, "minblocks": 21, "algorithm": "medium", "perf": 696.35, "source": "autotuned"},
{"m": 4, "n": 28, "k": 13, "tile_m": 2, "tile_n": 1, "threads": 64, "grouping": 3, "minblocks": 16, "algorithm": "medium", "perf": 693.509, "source": "autotuned"},
{"m": 4, "n": 28, "k": 25, "tile_m": 4, "tile_n": 1, "threads": 128, "grouping": 3, "minblocks": 9, "algorithm": "medium", "perf": 705.866, "source": "autotuned"},
{"m": 4, "n": 28, "k": 26, "tile_m": 4, "tile_n": 1, "threads": 128, "grouping": 3, "minblocks": 7, "algorithm": "medium", "perf": 718.173, "source": "autotuned"},
{"m": 4, "n": 28, "k": 28, "tile_m": 2, "tile_n": 1, "threads": 128, "grouping": 3, "minblocks": 3, "algorithm": "medium", "perf": 720.648, "source": "autotuned"},
{"m": 4, "n": 28, "k": 32, "tile_m": 2, "tile_n": 1, "threads": 160, "grouping": 3, "minblocks": 7, "algorithm": "medium", "perf": 730.663, "source": "autotuned"},
{"m": 4, "n": 28, "k": 45, "tile_m": 2, "tile_n": 1, "threads": 192, "grouping": 3, "minblocks": 1, "algorithm": "medium", "perf": 721.599, "source": "autotuned"},
{"m": 4, "n": 32, "k": 4, "tile_m": 2, "tile_n": 2, "threads": 32, "grouping": 8, "minblocks": 17, "algorithm": "medium", "perf": 713.191, "source": "autotuned"},
{"m": 4, "n": 32, "k": 5, "tile_m": 1, "tile_n": 5, "threads": 32, "grouping": 4, "minblocks": 26, "algorithm": "medium", "perf": 697.466, "source": "autotuned"},
{"m": 4, "n": 32, "k": 7, "tile_m": 2, "tile_n": 3, "threads": 32, "grouping": 3, "minblocks": 8, "algorithm": "medium", "perf": 716.759, "source": "autotuned"},
{"m": 4, "n": 32, "k": 9, "tile_m": 2, "tile_n": 1, "threads": 64, "grouping": 3, "minblocks": 5, "algorithm": "medium", "perf": 715.929, "source": "autotuned"},
{"m": 4, "n": 32, "k": 13, "tile_m": 2, "tile_n": 1, "threads": 64, "grouping": 3, "minblocks": 11, "algorithm": "medium", "perf": 718.173, "source": "autotuned"},
{"m": 4, "n": 32, "k": 25, "tile_m": 4, "tile_n": 1, "threads": 128, "grouping": 3, "minblocks": 8, "algorithm": "medium", "perf": 731.936, "source": "autotuned"},
{"m": 4, "n": 32, "k": 26, "tile_m": 1, "tile_n": 2, "threads": 128, "grouping": 3, "minblocks": 4, "algorithm": "medium", "perf": 734.347, "source": "autotuned"},
{"m": 4, "n": 32, "k": 28, "tile_m": 1, "tile_n": 2, "threads": 128, "grouping": 3, "minblocks": 2, "algorithm": "medium", "perf": 733.854, "source": "autotuned"},
{"m": 4, "n": 32, "k": 32, "tile_m": 1, "tile_n": 2, "threads": 160, "grouping": 3, "minblocks": 6, "algorithm": "medium", "perf": 747.315, "source": "autotuned"},
{"m": 4, "n": 32, "k": 45, "tile_m": 2, "tile_n": 1, "threads": 192, "grouping": 2, "minblocks": 5, "algorithm": "medium", "perf": 750.234, "source": "autotuned"},
{"m": 4, "n": 45, "k": 4, "tile_m": 1, "tile_n": 7, "threads": 32, "grouping": 8, "minblocks": 27, "algorithm": "medium", "perf": 661.936, "source": "autotuned"},
{"m": 4, "n": 45, "k": 5, "tile_m": 1, "tile_n": 6, "threads": 32, "grouping": 4, "minblocks": 25, "algorithm": "medium", "perf": 669.852, "source": "autotuned"},
{"m": 4, "n": 45, "k": 7, "tile_m": 2, "tile_n": 3, "threads": 32, "grouping": 3, "minblocks": 20, "algorithm": "medium", "perf": 679.091, "source": "autotuned"},
{"m": 4, "n": 45, "k": 9, "tile_m": 2, "tile_n": 1, "threads": 96, "grouping": 4, "minblocks": 6, "algorithm": "medium", "perf": 689.661, "source": "autotuned"},
{"m": 4, "n": 45, "k": 13, "tile_m": 1, "tile_n": 3, "threads": 64, "grouping": 3, "minblocks": 12, "algorithm": "medium", "perf": 711.079, "source": "autotuned"},
{"m": 4, "n": 45, "k": 25, "tile_m": 2, "tile_n": 1, "threads": 192, "grouping": 3, "minblocks": 1, "algorithm": "medium", "perf": 736.487, "source": "autotuned"},
{"m": 4, "n": 45, "k": 26, "tile_m": 2, "tile_n": 1, "threads": 192, "grouping": 3, "minblocks": 6, "algorithm": "medium", "perf": 742.618, "source": "autotuned"},
{"m": 4, "n": 45, "k": 28, "tile_m": 1, "tile_n": 2, "threads": 192, "grouping": 3, "minblocks": 2, "algorithm": "medium", "perf": 745.832, "source": "autotuned"},
{"m": 4, "n": 45, "k": 32, "tile_m": 2, "tile_n": 1, "threads": 192, "grouping": 3, "minblocks": 2, "algorithm": "medium", "perf": 760.801, "source": "autotuned"},
{"m": 4, "n": 45, "k": 45, "tile_m": 1, "tile_n": 2, "threads": 256, "grouping": 3, "minblocks": 2, "algorithm": "medium", "perf": 759.612, "source": "autotuned"},
{"m": 5, "n": 4, "k": 4, "tile_m": 1, "tile_n": 1, "threads": 32, "grouping": 10, "minblocks": 15, "algorithm": "medium", "perf": 298.03, "source": "autotuned"},
{"m": 5, "n": 4, "k": 5, "tile_m": 1, "tile_n": 1, "threads": 32, "grouping": 10, "minblocks": 14, "algorithm": "medium", "perf": 346.1, "source": "autotuned"},
{"m": 5, "n": 4, "k": 6, "tile_m": 1, "tile_n": 1, "threads": 32, "grouping": 7, "minblocks": 2, "algorithm": "medium", "perf": 395.26, "source": "autotuned"},
{"m": 5, "n": 4, "k": 7, "tile_m": 1, "tile_n": 1, "threads": 32, "grouping": 5, "minblocks": 23, "algorithm": "medium", "perf": 358.983, "source": "autotuned"},
{"m": 5, "n": 4, "k": 8, "tile_m": 1, "tile_n": 1, "threads": 64, "grouping": 10, "minblocks": 24, "algorithm": "medium", "perf": 378.392, "source": "autotuned"},
{"m": 5, "n": 4, "k": 9, "tile_m": 1, "tile_n": 1, "threads": 64, "grouping": 5, "minblocks": 8, "algorithm": "medium", "perf": 392.962, "source": "autotuned"},
{"m": 5, "n": 4, "k": 13, "tile_m": 1, "tile_n": 1, "threads": 64, "grouping": 5, "minblocks": 25, "algorithm": "medium", "perf": 427.297, "source": "autotuned"},
{"m": 5, "n": 4, "k": 22, "tile_m": 1, "tile_n": 1, "threads": 128, "grouping": 5, "minblocks": 14, "algorithm": "medium", "perf": 479.602, "source": "autotuned"},
{"m": 5, "n": 4, "k": 23, "tile_m": 1, "tile_n": 1, "threads": 128, "grouping": 3, "minblocks": 14, "algorithm": "medium", "perf": 475.792, "source": "autotuned"},
{"m": 5, "n": 4, "k": 25, "tile_m": 1, "tile_n": 1, "threads": 128, "grouping": 3, "minblocks": 14, "algorithm": "medium", "perf": 480.624, "source": "autotuned"},
{"m": 5, "n": 4, "k": 26, "tile_m": 1, "tile_n": 1, "threads": 128, "grouping": 5, "minblocks": 16, "algorithm": "medium", "perf": 468.896, "source": "autotuned"},
{"m": 5, "n": 4, "k": 28, "tile_m": 1, "tile_n": 1, "threads": 128, "grouping": 4, "minblocks": 15, "algorithm": "medium", "perf": 478.41, "source": "autotuned"},
{"m": 5, "n": 4, "k": 32, "tile_m": 1, "tile_n": 1, "threads": 32, "grouping": 1, "minblocks": 9, "algorithm": "medium", "perf": 475.743, "source": "autotuned"},
{"m": 5, "n": 4, "k": 45, "tile_m": 1, "tile_n": 1, "threads": 32, "grouping": 1, "minblocks": 21, "algorithm": "medium", "perf": 457.174, "source": "autotuned"},
{"m": 5, "n": 5, "k": 4, "tile_m": 1, "tile_n": 1, "threads": 32, "grouping": 10, "minblocks": 12, "algorithm": "medium", "perf": 363.486, "source": "autotuned"},
{"m": 5, "n": 5, "k": 5, "tile_m": 1, "tile_n": 1, "threads": 32, "grouping": 7, "minblocks": 1, "algorithm": "medium", "perf": 430.294, "source": "autotuned"},
{"m": 5, "n": 5, "k": 6, "tile_m": 1, "tile_n": 1, "threads": 32, "grouping": 7, "minblocks": 6, "algorithm": "medium", "perf": 487.699, "source": "autotuned"},
{"m": 5, "n": 5, "k": 7, "tile_m": 1, "tile_n": 1, "threads": 32, "grouping": 5, "minblocks": 16, "algorithm": "medium", "perf": 434.941, "source": "autotuned"},
{"m": 5, "n": 5, "k": 8, "tile_m": 1, "tile_n": 1, "threads": 32, "grouping": 5, "minblocks": 1, "algorithm": "medium", "perf": 465.891, "source": "autotuned"},
{"m": 5, "n": 5, "k": 9, "tile_m": 1, "tile_n": 1, "threads": 32, "grouping": 5, "minblocks": 25, "algorithm": "medium", "perf": 480.266, "source": "autotuned"},
{"m": 5, "n": 5, "k": 12, "tile_m": 1, "tile_n": 1, "threads": 32, "grouping": 5, "minblocks": 25, "algorithm": "medium", "perf": 537.755, "source": "autotuned"},
{"m": 5, "n": 5, "k": 13, "tile_m": 1, "tile_n": 1, "threads": 32, "grouping": 4, "minblocks": 12, "algorithm": "medium", "perf": 540.485, "source": "autotuned"},
{"m": 5, "n": 5, "k": 16, "tile_m": 1, "tile_n": 1, "threads": 32, "grouping": 4, "minblocks": 3, "algorithm": "medium", "perf": 585.973, "source": "autotuned"},
{"m": 5, "n": 5, "k": 22, "tile_m": 1, "tile_n": 1, "threads": 32, "grouping": 2, "minblocks": 12, "algorithm": "medium", "perf": 552.18, "source": "autotuned"},
{"m": 5, "n": 5, "k": 23, "tile_m": 1, "tile_n": 1, "threads": 32, "grouping": 2, "minblocks": 19, "algorithm": "medium", "perf": 551.265, "source": "autotuned"},
{"m": 5, "n": 5, "k": 24, "tile_m": 1, "tile_n": 1, "threads": 32, "grouping": 2, "minblocks": 7, "algorithm": "medium", "perf": 560.713, "source": "autotuned"},
{"m": 5, "n": 5, "k": 25, "tile_m": 1, "tile_n": 1, "threads": 32, "grouping": 2, "minblocks": 24, "algorithm": "medium", "perf": 543.459, "source": "autotuned"},
{"m": 5, "n": 5, "k": 26, "tile_m": 1, "tile_n": 1, "threads": 32, "grouping": 2, "minblocks": 22, "algorithm": "medium", "perf": 539.234, "source": "autotuned"},
{"m": 5, "n": 5, "k": 28, "tile_m": 1, "tile_n": 1, "threads": 64, "grouping": 2, "minblocks": 24, "algorithm": "medium", "perf": 539.9, "source": "autotuned"},
{"m": 5, "n": 5, "k": 32, "tile_m": 3, "tile_n": 1, "threads": 32, "grouping": 2, "minblocks": 12, "algorithm": "medium", "perf": 558.21, "source": "autotuned"},
{"m": 5, "n": 5, "k": 45, "tile_m": 1, "tile_n": 1, "threads": 128, "grouping": 3, "minblocks": 12, "algorithm": "medium", "perf": 525.597, "source": "autotuned"},
{"m": 5, "n": 6, "k": 4, "tile_m": 1, "tile_n": 1, "threads": 32, "grouping": 10, "minblocks": 1, "algorithm": "medium", "perf": 438.832, "source": "autotuned"},
{"m": 5, "n": 6, "k": 5, "tile_m": 1, "tile_n": 1, "threads": 32, "grouping": 10, "minblocks": 15, "algorithm": "medium", "perf": 516.845, "source": "autotuned"},
{"m": 5, "n": 6, "k": 6, "tile_m": 1, "tile_n": 1, "threads": 32, "grouping": 5, "minblocks": 27, "algorithm": "medium", "perf": 481.695, "source": "autotuned"},
{"m": 5, "n": 6, "k": 7, "tile_m": 1, "tile_n": 1, "threads": 64, "grouping": 5, "minblocks": 6, "algorithm": "medium", "perf": 496.549, "source": "autotuned"},
{"m": 5, "n": 6, "k": 8, "tile_m": 1, "tile_n": 1, "threads": 64, "grouping": 5, "minblocks": 25, "algorithm": "medium", "perf": 532.953, "source": "autotuned"},
{"m": 5, "n": 6, "k": 9, "tile_m": 1, "tile_n": 1, "threads": 64, "grouping": 5, "minblocks": 26, "algorithm": "medium", "perf": 553.846, "source": "autotuned"},
{"m": 5, "n": 7, "k": 4, "tile_m": 3, "tile_n": 1, "threads": 32, "grouping": 10, "minblocks": 16, "algorithm": "medium", "perf": 416.574, "source": "autotuned"},
{"m": 5, "n": 7, "k": 5, "tile_m": 3, "tile_n": 1, "threads": 32, "grouping": 10, "minblocks": 5, "algorithm": "medium", "perf": 445.927, "source": "autotuned"},
{"m": 5, "n": 7, "k": 6, "tile_m": 3, "tile_n": 1, "threads": 32, "grouping": 10, "minblocks": 2, "algorithm": "medium", "perf": 503.652, "source": "autotuned"},
{"m": 5, "n": 7, "k": 7, "tile_m": 3, "tile_n": 1, "threads": 64, "grouping": 10, "minblocks": 19, "algorithm": "medium", "perf": 512.586, "source": "autotuned"},
{"m": 5, "n": 7, "k": 8, "tile_m": 3, "tile_n": 1, "threads": 64, "grouping": 10, "minblocks": 19, "algorithm": "medium", "perf": 557.338, "source": "autotuned"},
{"m": 5, "n": 7, "k": 9, "tile_m": 3, "tile_n": 1, "threads": 64, "grouping": 10, "minblocks": 22, "algorithm": "medium", "perf": 590.81, "source": "autotuned"},
{"m": 5, "n": 7, "k": 13, "tile_m": 3, "tile_n": 1, "threads": 96, "grouping": 13, "minblocks": 16, "algorithm": "medium", "perf": 608.599, "source": "autotuned"},
{"m": 5, "n": 7, "k": 25, "tile_m": 1, "tile_n": 1, "threads": 128, "grouping": 3, "minblocks": 13, "algorithm": "medium", "perf": 592.774, "source": "autotuned"},
{"m": 5, "n": 7, "k": 26, "tile_m": 3, "tile_n": 1, "threads": 32, "grouping": 2, "minblocks": 26, "algorithm": "medium", "perf": 599.357, "source": "autotuned"},
{"m": 5, "n": 7, "k": 28, "tile_m": 3, "tile_n": 1, "threads": 32, "grouping": 2, "minblocks": 25, "algorithm": "medium", "perf": 591.972, "source": "autotuned"},
{"m": 5, "n": 7, "k": 32, "tile_m": 3, "tile_n": 1, "threads": 32, "grouping": 2, "minblocks": 17, "algorithm": "medium", "perf": 617.18, "source": "autotuned"},
{"m": 5, "n": 7, "k": 45, "tile_m": 3, "tile_n": 1, "threads": 32, "grouping": 1, "minblocks": 6, "algorithm": "medium", "perf": 587.119, "source": "autotuned"},
{"m": 5, "n": 8, "k": 4, "tile_m": 3, "tile_n": 1, "threads": 32, "grouping": 10, "minblocks": 2, "algorithm": "medium", "perf": 439.326, "source": "autotuned"},
{"m": 5, "n": 8, "k": 5, "tile_m": 3, "tile_n": 1, "threads": 32, "grouping": 10, "minblocks": 13, "algorithm": "medium", "perf": 510.7, "source": "autotuned"},
{"m": 5, "n": 8, "k": 6, "tile_m": 3, "tile_n": 1, "threads": 32, "grouping": 10, "minblocks": 3, "algorithm": "medium", "perf": 570.354, "source": "autotuned"},
{"m": 5, "n": 8, "k": 7, "tile_m": 4, "tile_n": 1, "threads": 64, "grouping": 13, "minblocks": 21, "algorithm": "medium", "perf": 577.392, "source": "autotuned"},
{"m": 5, "n": 8, "k": 8, "tile_m": 3, "tile_n": 1, "threads": 64, "grouping": 10, "minblocks": 25, "algorithm": "medium", "perf": 593.793, "source": "autotuned"},
{"m": 5, "n": 8, "k": 9, "tile_m": 3, "tile_n": 1, "threads": 64, "grouping": 10, "minblocks": 23, "algorithm": "medium", "perf": 608.298, "source": "autotuned"},
{"m": 5, "n": 9, "k": 4, "tile_m": 3, "tile_n": 1, "threads": 32, "grouping": 10, "minblocks": 5, "algorithm": "medium", "perf": 481.098, "source": "autotuned"},
{"m": 5, "n": 9, "k": 5, "tile_m": 3, "tile_n": 1, "threads": 32, "grouping": 10, "minblocks": 1, "algorithm": "medium", "perf": 564.498, "source": "autotuned"},
{"m": 5, "n": 9, "k": 6, "tile_m": 3, "tile_n": 1, "threads": 32, "grouping": 10, "minblocks": 11, "algorithm": "medium", "perf": 610.45, "source": "autotuned"},
{"m": 5, "n": 9, "k": 7, "tile_m": 3, "tile_n": 1, "threads": 64, "grouping": 10, "minblocks": 25, "algorithm": "medium", "perf": 636.859, "source": "autotuned"},
{"m": 5, "n": 9, "k": 8, "tile_m": 3, "tile_n": 1, "threads": 64, "grouping": 10, "minblocks": 23, "algorithm": "medium", "perf": 626.219, "source": "autotuned"},
{"m": 5, "n": 9, "k": 9, "tile_m": 3, "tile_n": 1, "threads": 64, "grouping": 10, "minblocks": 21, "algorithm": "medium", "perf": 653.5, "source": "autotuned"},
{"m": 5, "n": 9, "k": 13, "tile_m": 1, "tile_n": 2, "threads": 128, "grouping": 5, "minblocks": 14, "algorithm": "medium", "perf": 644.103, "source": "autotuned"},
{"m": 5, "n": 9, "k": 16, "tile_m": 1, "tile_n": 2, "threads": 96, "grouping": 4, "minblocks": 18, "algorithm": "medium", "perf": 674.517, "source": "autotuned"},
{"m": 5, "n": 9, "k": 22, "tile_m": 1, "tile_n": 1, "threads": 128, "grouping": 3, "minblocks": 16, "algorithm": "medium", "perf": 648.108, "source": "autotuned"},
{"m": 5, "n": 9, "k": 23, "tile_m": 1, "tile_n": 1, "threads": 128, "grouping": 4, "minblocks": 13, "algorithm": "medium", "perf": 649.547, "source": "autotuned"},
{"m": 5, "n": 9, "k": 25, "tile_m": 3, "tile_n": 1, "threads": 32, "grouping": 2, "minblocks": 26, "algorithm": "medium", "perf": 651.245, "source": "autotuned"},
{"m": 5, "n": 9, "k": 26, "tile_m": 3, "tile_n": 1, "threads": 32, "grouping": 2, "minblocks": 26, "algorithm": "medium", "perf": 647.326, "source": "autotuned"},
{"m": 5, "n": 9, "k": 28, "tile_m": 1, "tile_n": 1, "threads": 160, "grouping": 3, "minblocks": 12, "algorithm": "medium", "perf": 655.242, "source": "autotuned"},
{"m": 5, "n": 9, "k": 32, "tile_m": 3, "tile_n": 1, "threads": 32, "grouping": 2, "minblocks": 12, "algorithm": "medium", "perf": 675.633, "source": "autotuned"},
{"m": 5, "n": 9, "k": 45, "tile_m": 3, "tile_n": 1, "threads": 32, "grouping": 2, "minblocks": 8, "algorithm": "medium", "perf": 645.929, "source": "autotuned"},
{"m": 5, "n": 12, "k": 5, "tile_m": 3, "tile_n": 1, "threads": 32, "grouping": 10, "minblocks": 10, "algorithm": "medium", "perf": 691.538, "source": "autotuned"},
{"m": 5, "n": 12, "k": 12, "tile_m": 3, "tile_n": 1, "threads": 64, "grouping": 3, "minblocks": 21, "algorithm": "medium", "perf": 751.708, "source": "autotuned"},
{"m": 5, "n": 12, "k": 13, "tile_m": 1, "tile_n": 2, "threads": 96, "grouping": 3, "minblocks": 21, "algorithm": "medium", "perf": 717.136, "source": "autotuned"},
{"m": 5, "n": 12, "k": 26, "tile_m": 3, "tile_n": 1, "threads": 64, "grouping": 2, "minblocks": 16, "algorithm": "medium", "perf": 709.313, "source": "autotuned"},
{"m": 5, "n": 12, "k": 32, "tile_m": 1, "tile_n": 1, "threads": 192, "grouping": 3, "minblocks": 10, "algorithm": "medium", "perf": 733.427, "source": "autotuned"},
{"m": 5, "n": 13, "k": 4, "tile_m": 3, "tile_n": 1, "threads": 32, "grouping": 10, "minblocks": 1, "algorithm": "medium", "perf": 669.163, "source": "autotuned"},
{"m": 5, "n": 13, "k": 5, "tile_m": 3, "tile_n": 1, "threads": 32, "grouping": 8, "minblocks": 1, "algorithm": "medium", "perf": 709.666, "source": "autotuned"},
{"m": 5, "n": 13, "k": 7, "tile_m": 3, "tile_n": 1, "threads": 64, "grouping": 10, "minblocks": 20, "algorithm": "medium", "perf": 717.806, "source": "autotuned"},
{"m": 5, "n": 13, "k": 9, "tile_m": 3, "tile_n": 1, "threads": 64, "grouping": 5, "minblocks": 21, "algorithm": "medium", "perf": 733.531, "source": "autotuned"},
{"m": 5, "n": 13, "k": 12, "tile_m": 3, "tile_n": 1, "threads": 64, "grouping": 3, "minblocks": 23, "algorithm": "medium", "perf": 758.992, "source": "autotuned"},
{"m": 5, "n": 13, "k": 13, "tile_m": 3, "tile_n": 1, "threads": 96, "grouping": 3, "minblocks": 16, "algorithm": "medium", "perf": 718.762, "source": "autotuned"},
{"m": 5, "n": 13, "k": 16, "tile_m": 3, "tile_n": 1, "threads": 96, "grouping": 4, "minblocks": 13, "algorithm": "medium", "perf": 747.584, "source": "autotuned"},
{"m": 5, "n": 13, "k": 22, "tile_m": 3, "tile_n": 1, "threads": 128, "grouping": 4, "minblocks": 10, "algorithm": "medium", "perf": 725.379, "source": "autotuned"},
{"m": 5, "n": 13, "k": 23, "tile_m": 3, "tile_n": 1, "threads": 32, "grouping": 2, "minblocks": 22, "algorithm": "medium", "perf": 720.143, "source": "autotuned"},
{"m": 5, "n": 13, "k": 24, "tile_m": 3, "tile_n": 1, "threads": 128, "grouping": 4, "minblocks": 10, "algorithm": "medium", "perf": 741.677, "source": "autotuned"},
{"m": 5, "n": 13, "k": 25, "tile_m": 3, "tile_n": 1, "threads": 128, "grouping": 4, "minblocks": 10, "algorithm": "medium", "perf": 722.723, "source": "autotuned"},
{"m": 5, "n": 13, "k": 26, "tile_m": 3, "tile_n": 1, "threads": 32, "grouping": 2, "minblocks": 23, "algorithm": "medium", "perf": 723.641, "source": "autotuned"},
{"m": 5, "n": 13, "k": 28, "tile_m": 3, "tile_n": 1, "threads": 32, "grouping": 2, "minblocks": 4, "algorithm": "medium", "perf": 718.646, "source": "autotuned"},
{"m": 5, "n": 13, "k": 32, "tile_m": 3, "tile_n": 1, "threads": 32, "grouping": 2, "minblocks": 17, "algorithm": "medium", "perf": 750.234, "source": "autotuned"},
{"m": 5, "n": 13, "k": 45, "tile_m": 3, "tile_n": 1, "threads": 32, "grouping": 2, "minblocks": 2, "algorithm": "medium", "perf": 725.673, "source": "autotuned"},
{"m": 5, "n": 16, "k": 5, "tile_m": 3, "tile_n": 1, "threads": 32, "grouping": 8, "minblocks": 17, "algorithm": "medium", "perf": 805.342, "source": "autotuned"},
{"m": 5, "n": 16, "k": 9, "tile_m": 3, "tile_n": 1, "threads": 64, "grouping": 4, "minblocks": 24, "algorithm": "medium", "perf": 775.76, "source": "autotuned"},
{"m": 5, "n": 16, "k": 13, "tile_m": 3, "tile_n": 1, "threads": 32, "grouping": 2, "minblocks": 27, "algorithm": "medium", "perf": 772.853, "source": "autotuned"},
{"m": 5, "n": 16, "k": 16, "tile_m": 3, "tile_n": 1, "threads": 96, "grouping": 3, "minblocks": 14, "algorithm": "medium", "perf": 787.938, "source": "autotuned"},
{"m": 5, "n": 16, "k": 23, "tile_m": 3, "tile_n": 1, "threads": 128, "grouping": 3, "minblocks": 12, "algorithm": "medium", "perf": 770.975, "source": "autotuned"},
{"m": 5, "n": 16, "k": 32, "tile_m": 3, "tile_n": 1, "threads": 32, "grouping": 2, "minblocks": 3, "algorithm": "medium", "perf": 792.327, "source": "autotuned"},
{"m": 5, "n": 22, "k": 4, "tile_m": 3, "tile_n": 2, "threads": 32, "grouping": 9, "minblocks": 2, "algorithm": "medium", "perf": 794.063, "source": "autotuned"},
{"m": 5, "n": 22, "k": 5, "tile_m": 5, "tile_n": 1, "threads": 32, "grouping": 4, "minblocks": 26, "algorithm": "medium", "perf": 791.304, "source": "autotuned"},
{"m": 5, "n": 22, "k": 9, "tile_m": 5, "tile_n": 1, "threads": 64, "grouping": 3, "minblocks": 19, "algorithm": "medium", "perf": 788.463, "source": "autotuned"},
{"m": 5, "n": 22, "k": 13, "tile_m": 5, "tile_n": 1, "threads": 96, "grouping": 4, "minblocks": 13, "algorithm": "medium", "perf": 784.236, "source": "autotuned"},
{"m": 5, "n": 22, "k": 22, "tile_m": 3, "tile_n": 1, "threads": 128, "grouping": 3, "minblocks": 12, "algorithm": "medium", "perf": 804.773, "source": "autotuned"},
{"m": 5, "n": 22, "k": 23, "tile_m": 5, "tile_n": 1, "threads": 128, "grouping": 3, "minblocks": 9, "algorithm": "medium", "perf": 807.012, "source": "autotuned"},
{"m": 5, "n": 22, "k": 26, "tile_m": 3, "tile_n": 1, "threads": 160, "grouping": 2, "minblocks": 8, "algorithm": "medium", "perf": 803.622, "source": "autotuned"},
{"m": 5, "n": 23, "k": 4, "tile_m": 3, "tile_n": 2, "threads": 32, "grouping": 9, "minblocks": 5, "algorithm": "medium", "perf": 765.772, "source": "autotuned"},
{"m": 5, "n": 23, "k": 5, "tile_m": 5, "tile_n": 1, "threads": 32, "grouping": 8, "minblocks": 26, "algorithm": "medium", "perf": 772.399, "source": "autotuned"},
{"m": 5, "n": 23, "k": 9, "tile_m": 5, "tile_n": 1, "threads": 64, "grouping": 3, "minblocks": 18, "algorithm": "medium", "perf": 790.675, "source": "autotuned"},
{"m": 5, "n": 23, "k": 13, "tile_m": 3, "tile_n": 1, "threads": 128, "grouping": 4, "minblocks": 11, "algorithm": "medium", "perf": 791.671, "source": "autotuned"},
{"m": 5, "n": 23, "k": 16, "tile_m": 5, "tile_n": 1, "threads": 96, "grouping": 3, "minblocks": 13, "algorithm": "medium", "perf": 831.147, "source": "autotuned"},
{"m": 5, "n": 23, "k": 22, "tile_m": 5, "tile_n": 1, "threads": 128, "grouping": 3, "minblocks": 10, "algorithm": "medium", "perf": 811.151, "source": "autotuned"},
{"m": 5, "n": 23, "k": 23, "tile_m": 3, "tile_n": 1, "threads": 128, "grouping": 3, "minblocks": 11, "algorithm": "medium", "perf": 804.019, "source": "autotuned"},
{"m": 5, "n": 23, "k": 26, "tile_m": 5, "tile_n": 1, "threads": 160, "grouping": 3, "minblocks": 7, "algorithm": "medium", "perf": 803.475, "source": "autotuned"},
{"m": 5, "n": 24, "k": 5, "tile_m": 3, "tile_n": 2, "threads": 32, "grouping": 8, "minblocks": 25, "algorithm": "medium", "perf": 796.427, "source": "autotuned"},
{"m": 5, "n": 24, "k": 13, "tile_m": 5, "tile_n": 1, "threads": 96, "grouping": 4, "minblocks": 13, "algorithm": "medium", "perf": 806.037, "source": "autotuned"},
{"m": 5, "n": 24, "k": 24, "tile_m": 5, "tile_n": 1, "threads": 128, "grouping": 2, "minblocks": 10, "algorithm": "medium", "perf": 841.384, "source": "autotuned"},
{"m": 5, "n": 24, "k": 26, "tile_m": 5, "tile_n": 1, "threads": 160, "grouping": 4, "minblocks": 7, "algorithm": "medium", "perf": 828.284, "source": "autotuned"},
{"m": 5, "n": 24, "k": 32, "tile_m": 1, "tile_n": 2, "threads": 192, "grouping": 2, "minblocks": 7, "algorithm": "medium", "perf": 845.334, "source": "autotuned"},
{"m": 5, "n": 25, "k": 4, "tile_m": 5, "tile_n": 1, "threads": 32, "grouping": 9, "minblocks": 5, "algorithm": "medium", "perf": 797.443, "source": "autotuned"},
{"m": 5, "n": 25, "k": 5, "tile_m": 3, "tile_n": 2, "threads": 32, "grouping": 9, "minblocks": 21, "algorithm": "medium", "perf": 784.633, "source": "autotuned"},
{"m": 5, "n": 25, "k": 7, "tile_m": 5, "tile_n": 1, "threads": 64, "grouping": 4, "minblocks": 19, "algorithm": "medium", "perf": 770.487, "source": "autotuned"},
{"m": 5, "n": 25, "k": 9, "tile_m": 3, "tile_n": 1, "threads": 64, "grouping": 3, "minblocks": 19, "algorithm": "medium", "perf": 800.91, "source": "autotuned"},
{"m": 5, "n": 25, "k": 13, "tile_m": 5, "tile_n": 1, "threads": 96, "grouping": 3, "minblocks": 11, "algorithm": "medium", "perf": 806.303, "source": "autotuned"},
{"m": 5, "n": 25, "k": 25, "tile_m": 3, "tile_n": 1, "threads": 128, "grouping": 2, "minblocks": 10, "algorithm": "medium", "perf": 824.361, "source": "autotuned"},
{"m": 5, "n": 25, "k": 26, "tile_m": 5, "tile_n": 1, "threads": 160, "grouping": 3, "minblocks": 7, "algorithm": "medium", "perf": 821.517, "source": "autotuned"},
{"m": 5, "n": 25, "k": 28, "tile_m": 5, "tile_n": 1, "threads": 160, "grouping": 3, "minblocks": 7, "algorithm": "medium", "perf": 828.857, "source": "autotuned"},
{"m": 5, "n": 25, "k": 32, "tile_m": 3, "tile_n": 1, "threads": 192, "grouping": 3, "minblocks": 5, "algorithm": "medium", "perf": 844.859, "source": "autotuned"},
{"m": 5, "n": 25, "k": 45, "tile_m": 5, "tile_n": 1, "threads": 288, "grouping": 3, "minblocks": 4, "algorithm": "medium", "perf": 835.988, "source": "autotuned"},
{"m": 5, "n": 26, "k": 4, "tile_m": 5, "tile_n": 1, "threads": 32, "grouping": 10, "minblocks": 4, "algorithm": "medium", "perf": 807.706, "source": "autotuned"},
{"m": 5, "n": 26, "k": 5, "tile_m": 5, "tile_n": 1, "threads": 32, "grouping": 9, "minblocks": 27, "algorithm": "medium", "perf": 791.356, "source": "autotuned"},
{"m": 5, "n": 26, "k": 7, "tile_m": 5, "tile_n": 1, "threads": 64, "grouping": 4, "minblocks": 19, "algorithm": "medium", "perf": 786.815, "source": "autotuned"},
{"m": 5, "n": 26, "k": 9, "tile_m": 5, "tile_n": 1, "threads": 64, "grouping": 3, "minblocks": 17, "algorithm": "medium", "perf": 796.818, "source": "autotuned"},
{"m": 5, "n": 26, "k": 12, "tile_m": 5, "tile_n": 1, "threads": 64, "grouping": 4, "minblocks": 12, "algorithm": "medium", "perf": 816.155, "source": "autotuned"},
{"m": 5, "n": 26, "k": 13, "tile_m": 5, "tile_n": 1, "threads": 96, "grouping": 3, "minblocks": 13, "algorithm": "medium", "perf": 802.23, "source": "autotuned"},
{"m": 5, "n": 26, "k": 22, "tile_m": 5, "tile_n": 1, "threads": 128, "grouping": 3, "minblocks": 9, "algorithm": "medium", "perf": 823.99, "source": "autotuned"},
{"m": 5, "n": 26, "k": 23, "tile_m": 3, "tile_n": 1, "threads": 128, "grouping": 3, "minblocks": 10, "algorithm": "medium", "perf": 827.597, "source": "autotuned"},
{"m": 5, "n": 26, "k": 24, "tile_m": 5, "tile_n": 1, "threads": 128, "grouping": 3, "minblocks": 9, "algorithm": "medium", "perf": 848.091, "source": "autotuned"},
{"m": 5, "n": 26, "k": 25, "tile_m": 3, "tile_n": 1, "threads": 128, "grouping": 3, "minblocks": 10, "algorithm": "medium", "perf": 828.214, "source": "autotuned"},
{"m": 5, "n": 26, "k": 26, "tile_m": 5, "tile_n": 1, "threads": 160, "grouping": 3, "minblocks": 7, "algorithm": "medium", "perf": 830.522, "source": "autotuned"},
{"m": 5, "n": 26, "k": 28, "tile_m": 5, "tile_n": 1, "threads": 160, "grouping": 3, "minblocks": 7, "algorithm": "medium", "perf": 836.658, "source": "autotuned"},
{"m": 5, "n": 26, "k": 32, "tile_m": 3, "tile_n": 1, "threads": 224, "grouping": 4, "minblocks": 5, "algorithm": "medium", "perf": 855.53, "source": "autotuned"},
{"m": 5, "n": 26, "k": 45, "tile_m": 3, "tile_n": 1, "threads": 256, "grouping": 2, "minblocks": 5, "algorithm": "medium", "perf": 849.24, "source": "autotuned"},
{"m": 5, "n": 28, "k": 4, "tile_m": 5, "tile_n": 1, "threads": 32, "grouping": 9, "minblocks": 6, "algorithm": "medium", "perf": 799.005, "source": "autotuned"},
{"m": 5, "n": 28, "k": 5, "tile_m": 5, "tile_n": 1, "threads": 32, "grouping": 8, "minblocks": 27, "algorithm": "medium", "perf": 784.792, "source": "autotuned"},
{"m": 5, "n": 28, "k": 7, "tile_m": 5, "tile_n": 1, "threads": 64, "grouping": 4, "minblocks": 19, "algorithm": "medium", "perf": 783.827, "source": "autotuned"},
{"m": 5, "n": 28, "k": 9, "tile_m": 3, "tile_n": 1, "threads": 64, "grouping": 3, "minblocks": 22, "algorithm": "medium", "perf": 805.649, "source": "autotuned"},
{"m": 5, "n": 28, "k": 13, "tile_m": 5, "tile_n": 1, "threads": 96, "grouping": 3, "minblocks": 13, "algorithm": "medium", "perf": 810.823, "source": "autotuned"},
{"m": 5, "n": 28, "k": 25, "tile_m": 5, "tile_n": 1, "threads": 128, "grouping": 3, "minblocks": 9, "algorithm": "medium", "perf": 839.457, "source": "autotuned"},
{"m": 5, "n": 28, "k": 26, "tile_m": 3, "tile_n": 1, "threads": 160, "grouping": 3, "minblocks": 8, "algorithm": "medium", "perf": 840.78, "source": "autotuned"},
{"m": 5, "n": 28, "k": 28, "tile_m": 3, "tile_n": 1, "threads": 192, "grouping": 3, "minblocks": 5, "algorithm": "medium", "perf": 848.995, "source": "autotuned"},
{"m": 5, "n": 28, "k": 32, "tile_m": 3, "tile_n": 1, "threads": 192, "grouping": 3, "minblocks": 6, "algorithm": "medium", "perf": 869.837, "source": "autotuned"},
{"m": 5, "n": 28, "k": 45, "tile_m": 5, "tile_n": 1, "threads": 256, "grouping": 3, "minblocks": 4, "algorithm": "medium", "perf": 859.985, "source": "autotuned"},
{"m": 5, "n": 32, "k": 4, "tile_m": 5, "tile_n": 1, "threads": 32, "grouping": 9, "minblocks": 27, "algorithm": "medium", "perf": 805.336, "source": "autotuned"},
{"m": 5, "n": 32, "k": 5, "tile_m": 3, "tile_n": 2, "threads": 32, "grouping": 4, "minblocks": 25, "algorithm": "medium", "perf": 804.973, "source": "autotuned"},
{"m": 5, "n": 32, "k": 7, "tile_m": 3, "tile_n": 1, "threads": 64, "grouping": 4, "minblocks": 19, "algorithm": "medium", "perf": 819.405, "source": "autotuned"},
{"m": 5, "n": 32, "k": 9, "tile_m": 3, "tile_n": 1, "threads": 64, "grouping": 4, "minblocks": 15, "algorithm": "medium", "perf": 827.845, "source": "autotuned"},
{"m": 5, "n": 32, "k": 12, "tile_m": 3, "tile_n": 1, "threads": 64, "grouping": 3, "minblocks": 4, "algorithm": "medium", "perf": 841.384, "source": "autotuned"},
{"m": 5, "n": 32, "k": 13, "tile_m": 5, "tile_n": 1, "threads": 96, "grouping": 3, "minblocks": 13, "algorithm": "medium", "perf": 846.251, "source": "autotuned"},
{"m": 5, "n": 32, "k": 16, "tile_m": 3, "tile_n": 1, "threads": 96, "grouping": 4, "minblocks": 2, "algorithm": "medium", "perf": 862.803, "source": "autotuned"},
{"m": 5, "n": 32, "k": 24, "tile_m": 3, "tile_n": 1, "threads": 128, "grouping": 3, "minblocks": 9, "algorithm": "medium", "perf": 876.186, "source": "autotuned"},
{"m": 5, "n": 32, "k": 25, "tile_m": 5, "tile_n": 1, "threads": 128, "grouping": 3, "minblocks": 8, "algorithm": "medium", "perf": 866.321, "source": "autotuned"},
{"m": 5, "n": 32, "k": 26, "tile_m": 3, "tile_n": 1, "threads": 192, "grouping": 3, "minblocks": 6, "algorithm": "medium", "perf": 868.868, "source": "autotuned"},
{"m": 5, "n": 32, "k": 28, "tile_m": 5, "tile_n": 1, "threads": 160, "grouping": 3, "minblocks": 7, "algorithm": "medium", "perf": 873.454, "source": "autotuned"},
{"m": 5, "n": 32, "k": 32, "tile_m": 3, "tile_n": 1, "threads": 192, "grouping": 3, "minblocks": 5, "algorithm": "medium", "perf": 890.816, "source": "autotuned"},
{"m": 5, "n": 32, "k": 45, "tile_m": 3, "tile_n": 1, "threads": 288, "grouping": 3, "minblocks": 4, "algorithm": "medium", "perf": 889.606, "source": "autotuned"},
{"m": 5, "n": 45, "k": 4, "tile_m": 5, "tile_n": 2, "threads": 32, "grouping": 10, "minblocks": 11, "algorithm": "medium", "perf": 751.005, "source": "autotuned"},
{"m": 5, "n": 45, "k": 5, "tile_m": 3, "tile_n": 2, "threads": 64, "grouping": 4, "minblocks": 18, "algorithm": "medium", "perf": 769.065, "source": "autotuned"},
{"m": 5, "n": 45, "k": 7, "tile_m": 5, "tile_n": 1, "threads": 64, "grouping": 3, "minblocks": 18, "algorithm": "medium", "perf": 795.933, "source": "autotuned"},
{"m": 5, "n": 45, "k": 9, "tile_m": 3, "tile_n": 2, "threads": 64, "grouping": 3, "minblocks": 16, "algorithm": "medium", "perf": 816.787, "source": "autotuned"},
{"m": 5, "n": 45, "k": 13, "tile_m": 3, "tile_n": 1, "threads": 128, "grouping": 3, "minblocks": 9, "algorithm": "medium", "perf": 842.717, "source": "autotuned"},
{"m": 5, "n": 45, "k": 25, "tile_m": 3, "tile_n": 1, "threads": 128, "grouping": 3, "minblocks": 2, "algorithm": "medium", "perf": 885.081, "source": "autotuned"},
{"m": 5, "n": 45, "k": 26, "tile_m": 5, "tile_n": 1, "threads": 160, "grouping": 3, "minblocks": 6, "algorithm": "medium", "perf": 893.5, "source": "autotuned"},
{"m": 5, "n": 45, "k": 28, "tile_m": 5, "tile_n": 1, "threads": 192, "grouping": 3, "minblocks": 4, "algorithm": "medium", "perf": 897.887, "source": "autotuned"},
{"m": 5, "n": 45, "k": 32, "tile_m": 3, "tile_n": 1, "threads": 192, "grouping": 3, "minblocks": 2, "algorithm": "medium", "perf": 916.161, "source": "autotuned"},
{"m": 5, "n": 45, "k": 45, "tile_m": 3, "tile_n": 1, "threads": 256, "grouping": 3, "minblocks": 3, "algorithm": "medium", "perf": 919.182, "source": "autotuned"},
{"m": 6, "n": 4, "k": 4, "tile_m": 1, "tile_n": 1, "threads": 32, "grouping": 10, "minblocks": 15, "algorithm": "medium", "perf": 369.751, "source": "autotuned"},
{"m": 6, "n": 4, "k": 5, "tile_m": 1, "tile_n": 1, "threads": 32, "grouping": 10, "minblocks": 1, "algorithm": "medium", "perf": 437.31, "source": "autotuned"},
{"m": 6, "n": 4, "k": 6, "tile_m": 1, "tile_n": 1, "threads": 32, "grouping": 10, "minblocks": 8, "algorithm": "medium", "perf": 408.922, "source": "autotuned"},
{"m": 6, "n": 4, "k": 7, "tile_m": 1, "tile_n": 1, "threads": 32, "grouping": 5, "minblocks": 15, "algorithm": "medium", "perf": 459.907, "source": "autotuned"},
{"m": 6, "n": 4, "k": 8, "tile_m": 1, "tile_n": 1, "threads": 64, "grouping": 5, "minblocks": 2, "algorithm": "medium", "perf": 477.56, "source": "autotuned"},
{"m": 6, "n": 4, "k": 9, "tile_m": 1, "tile_n": 1, "threads": 64, "grouping": 5, "minblocks": 25, "algorithm": "medium", "perf": 482.086, "source": "autotuned"},
{"m": 6, "n": 5, "k": 4, "tile_m": 1, "tile_n": 1, "threads": 32, "grouping": 10, "minblocks": 3, "algorithm": "medium", "perf": 454.274, "source": "autotuned"},
{"m": 6, "n": 5, "k": 5, "tile_m": 1, "tile_n": 1, "threads": 32, "grouping": 8, "minblocks": 10, "algorithm": "medium", "perf": 543.411, "source": "autotuned"},
{"m": 6, "n": 5, "k": 6, "tile_m": 1, "tile_n": 1, "threads": 32, "grouping": 10, "minblocks": 22, "algorithm": "medium", "perf": 509.28, "source": "autotuned"},
{"m": 6, "n": 5, "k": 7, "tile_m": 1, "tile_n": 1, "threads": 64, "grouping": 5, "minblocks": 27, "algorithm": "medium", "perf": 530.719, "source": "autotuned"},
{"m": 6, "n": 5, "k": 8, "tile_m": 1, "tile_n": 1, "threads": 64, "grouping": 5, "minblocks": 25, "algorithm": "medium", "perf": 567.27, "source": "autotuned"},
{"m": 6, "n": 5, "k": 9, "tile_m": 1, "tile_n": 1, "threads": 64, "grouping": 5, "minblocks": 25, "algorithm": "medium", "perf": 586.779, "source": "autotuned"},
{"m": 6, "n": 6, "k": 4, "tile_m": 1, "tile_n": 2, "threads": 32, "grouping": 13, "minblocks": 23, "algorithm": "medium", "perf": 436.777, "source": "autotuned"},
{"m": 6, "n": 6, "k": 5, "tile_m": 1, "tile_n": 2, "threads": 32, "grouping": 13, "minblocks": 7, "algorithm": "medium", "perf": 514.148, "source": "autotuned"},
{"m": 6, "n": 6, "k": 6, "tile_m": 1, "tile_n": 2, "threads": 64, "grouping": 13, "minblocks": 21, "algorithm": "medium", "perf": 519.349, "source": "autotuned"},
{"m": 6, "n": 6, "k": 7, "tile_m": 1, "tile_n": 2, "threads": 64, "grouping": 13, "minblocks": 24, "algorithm": "medium", "perf": 551.619, "source": "autotuned"},
{"m": 6, "n": 6, "k": 8, "tile_m": 1, "tile_n": 2, "threads": 64, "grouping": 13, "minblocks": 26, "algorithm": "medium", "perf": 599.955, "source": "autotuned"},
{"m": 6, "n": 7, "k": 4, "tile_m": 1, "tile_n": 2, "threads": 32, "grouping": 13, "minblocks": 8, "algorithm": "medium", "perf": 510.693, "source": "autotuned"},
{"m": 6, "n": 7, "k": 5, "tile_m": 1, "tile_n": 2, "threads": 32, "grouping": 10, "minblocks": 3, "algorithm": "medium", "perf": 546.154, "source": "autotuned"},
{"m": 6, "n": 7, "k": 6, "tile_m": 1, "tile_n": 2, "threads": 64, "grouping": 10, "minblocks": 19, "algorithm": "medium", "perf": 578.921, "source": "autotuned"},
{"m": 6, "n": 7, "k": 7, "tile_m": 1, "tile_n": 2, "threads": 64, "grouping": 13, "minblocks": 26, "algorithm": "medium", "perf": 620.416, "source": "autotuned"},
{"m": 6, "n": 7, "k": 8, "tile_m": 1, "tile_n": 2, "threads": 64, "grouping": 13, "minblocks": 27, "algorithm": "medium", "perf": 679.445, "source": "autotuned"},
{"m": 6, "n": 7, "k": 9, "tile_m": 1, "tile_n": 2, "threads": 64, "grouping": 5, "minblocks": 25, "algorithm": "medium", "perf": 703.892, "source": "autotuned"},
{"m": 6, "n": 8, "k": 4, "tile_m": 1, "tile_n": 2, "threads": 32, "grouping": 8, "minblocks": 8, "algorithm": "medium", "perf": 537.011, "source": "autotuned"},
{"m": 6, "n": 8, "k": 5, "tile_m": 1, "tile_n": 2, "threads": 32, "grouping": 5, "minblocks": 4, "algorithm": "medium", "perf": 622.638, "source": "autotuned"},
{"m": 6, "n": 8, "k": 6, "tile_m": 1, "tile_n": 2, "threads": 64, "grouping": 13, "minblocks": 22, "algorithm": "medium", "perf": 652.165, "source": "autotuned"},
{"m": 6, "n": 8, "k": 7, "tile_m": 1, "tile_n": 2, "threads": 64, "grouping": 5, "minblocks": 27, "algorithm": "medium", "perf": 697.9, "source": "autotuned"},
{"m": 6, "n": 8, "k": 8, "tile_m": 1, "tile_n": 2, "threads": 64, "grouping": 9, "minblocks": 27, "algorithm": "medium", "perf": 731.135, "source": "autotuned"},
{"m": 6, "n": 8, "k": 9, "tile_m": 1, "tile_n": 2, "threads": 64, "grouping": 4, "minblocks": 26, "algorithm": "medium", "perf": 729.606, "source": "autotuned"},
{"m": 6, "n": 9, "k": 4, "tile_m": 1, "tile_n": 2, "threads": 32, "grouping": 10, "minblocks": 1, "algorithm": "medium", "perf": 586.525, "source": "autotuned"},
{"m": 6, "n": 9, "k": 5, "tile_m": 1, "tile_n": 2, "threads": 32, "grouping": 10, "minblocks": 11, "algorithm": "medium", "perf": 677.531, "source": "autotuned"},
{"m": 6, "n": 9, "k": 6, "tile_m": 1, "tile_n": 2, "threads": 64, "grouping": 10, "minblocks": 27, "algorithm": "medium", "perf": 696.243, "source": "autotuned"},
{"m": 6, "n": 9, "k": 7, "tile_m": 1, "tile_n": 2, "threads": 64, "grouping": 10, "minblocks": 26, "algorithm": "medium", "perf": 760.106, "source": "autotuned"},
{"m": 6, "n": 9, "k": 8, "tile_m": 1, "tile_n": 2, "threads": 64, "grouping": 5, "minblocks": 25, "algorithm": "medium", "perf": 755.906, "source": "autotuned"},
{"m": 6, "n": 9, "k": 9, "tile_m": 1, "tile_n": 2, "threads": 64, "grouping": 4, "minblocks": 25, "algorithm": "medium", "perf": 768.741, "source": "autotuned"},
{"m": 7, "n": 4, "k": 4, "tile_m": 1, "tile_n": 1, "threads": 32, "grouping": 10, "minblocks": 16, "algorithm": "medium", "perf": 412.809, "source": "autotuned"},
{"m": 7, "n": 4, "k": 5, "tile_m": 1, "tile_n": 1, "threads": 32, "grouping": 10, "minblocks": 25, "algorithm": "medium", "perf": 391.024, "source": "autotuned"},
{"m": 7, "n": 4, "k": 6, "tile_m": 1, "tile_n": 1, "threads": 32, "grouping": 5, "minblocks": 7, "algorithm": "medium", "perf": 447.672, "source": "autotuned"},
{"m": 7, "n": 4, "k": 7, "tile_m": 1, "tile_n": 1, "threads": 32, "grouping": 5, "minblocks": 10, "algorithm": "medium", "perf": 480.486, "source": "autotuned"},
{"m": 7, "n": 4, "k": 8, "tile_m": 1, "tile_n": 1, "threads": 64, "grouping": 5, "minblocks": 14, "algorithm": "medium", "perf": 492.186, "source": "autotuned"},
{"m": 7, "n": 4, "k": 9, "tile_m": 1, "tile_n": 1, "threads": 64, "grouping": 5, "minblocks": 27, "algorithm": "medium", "perf": 519.029, "source": "autotuned"},
{"m": 7, "n": 4, "k": 13, "tile_m": 1, "tile_n": 1, "threads": 64, "grouping": 4, "minblocks": 25, "algorithm": "medium", "perf": 561.624, "source": "autotuned"},
{"m": 7, "n": 4, "k": 25, "tile_m": 1, "tile_n": 1, "threads": 128, "grouping": 3, "minblocks": 14, "algorithm": "medium", "perf": 538.874, "source": "autotuned"},
{"m": 7, "n": 4, "k": 26, "tile_m": 1, "tile_n": 1, "threads": 128, "grouping": 3, "minblocks": 13, "algorithm": "medium", "perf": 544.314, "source": "autotuned"},
{"m": 7, "n": 4, "k": 28, "tile_m": 1, "tile_n": 1, "threads": 128, "grouping": 3, "minblocks": 13, "algorithm": "medium", "perf": 553.272, "source": "autotuned"},
{"m": 7, "n": 4, "k": 32, "tile_m": 1, "tile_n": 1, "threads": 160, "grouping": 4, "minblocks": 11, "algorithm": "medium", "perf": 549.476, "source": "autotuned"},
{"m": 7, "n": 4, "k": 45, "tile_m": 1, "tile_n": 1, "threads": 192, "grouping": 4, "minblocks": 10, "algorithm": "medium", "perf": 527.092, "source": "autotuned"},
{"m": 7, "n": 5, "k": 4, "tile_m": 4, "tile_n": 1, "threads": 32, "grouping": 8, "minblocks": 13, "algorithm": "medium", "perf": 412.862, "source": "autotuned"},
{"m": 7, "n": 5, "k": 5, "tile_m": 2, "tile_n": 1, "threads": 32, "grouping": 5, "minblocks": 13, "algorithm": "medium", "perf": 440.647, "source": "autotuned"},
{"m": 7, "n": 5, "k": 6, "tile_m": 2, "tile_n": 1, "threads": 32, "grouping": 5, "minblocks": 17, "algorithm": "medium", "perf": 497.706, "source": "autotuned"},
{"m": 7, "n": 5, "k": 7, "tile_m": 4, "tile_n": 1, "threads": 64, "grouping": 13, "minblocks": 19, "algorithm": "medium", "perf": 513.429, "source": "autotuned"},
{"m": 7, "n": 5, "k": 9, "tile_m": 4, "tile_n": 1, "threads": 64, "grouping": 13, "minblocks": 20, "algorithm": "medium", "perf": 586.3, "source": "autotuned"},
{"m": 7, "n": 5, "k": 13, "tile_m": 2, "tile_n": 1, "threads": 96, "grouping": 13, "minblocks": 21, "algorithm": "medium", "perf": 608.599, "source": "autotuned"},
{"m": 7, "n": 5, "k": 25, "tile_m": 1, "tile_n": 1, "threads": 128, "grouping": 3, "minblocks": 15, "algorithm": "medium", "perf": 596.467, "source": "autotuned"},
{"m": 7, "n": 5, "k": 26, "tile_m": 2, "tile_n": 1, "threads": 64, "grouping": 2, "minblocks": 23, "algorithm": "medium", "perf": 578.722, "source": "autotuned"},
{"m": 7, "n": 5, "k": 28, "tile_m": 1, "tile_n": 1, "threads": 160, "grouping": 3, "minblocks": 10, "algorithm": "medium", "perf": 585.374, "source": "autotuned"},
{"m": 7, "n": 5, "k": 32, "tile_m": 2, "tile_n": 2, "threads": 32, "grouping": 1, "minblocks": 4, "algorithm": "medium", "perf": 601.751, "source": "autotuned"},
{"m": 7, "n": 5, "k": 45, "tile_m": 2, "tile_n": 1, "threads": 64, "grouping": 2, "minblocks": 3, "algorithm": "medium", "perf": 582.16, "source": "autotuned"},
{"m": 7, "n": 6, "k": 5, "tile_m": 2, "tile_n": 1, "threads": 32, "grouping": 5, "minblocks": 3, "algorithm": "medium", "perf": 532.017, "source": "autotuned"},
{"m": 7, "n": 6, "k": 6, "tile_m": 4, "tile_n": 1, "threads": 64, "grouping": 13, "minblocks": 19, "algorithm": "medium", "perf": 561.04, "source": "autotuned"},
{"m": 7, "n": 6, "k": 7, "tile_m": 4, "tile_n": 1, "threads": 64, "grouping": 13, "minblocks": 19, "algorithm": "medium", "perf": 602.177, "source": "autotuned"},
{"m": 7, "n": 6, "k": 8, "tile_m": 2, "tile_n": 1, "threads": 64, "grouping": 13, "minblocks": 25, "algorithm": "medium", "perf": 655.348, "source": "autotuned"},
{"m": 7, "n": 6, "k": 9, "tile_m": 4, "tile_n": 1, "threads": 64, "grouping": 9, "minblocks": 21, "algorithm": "medium", "perf": 679.328, "source": "autotuned"},
{"m": 7, "n": 7, "k": 4, "tile_m": 4, "tile_n": 1, "threads": 32, "grouping": 13, "minblocks": 16, "algorithm": "medium", "perf": 570.156, "source": "autotuned"},
{"m": 7, "n": 7, "k": 6, "tile_m": 4, "tile_n": 1, "threads": 32, "grouping": 9, "minblocks": 17, "algorithm": "medium", "perf": 630.712, "source": "autotuned"},
{"m": 7, "n": 7, "k": 7, "tile_m": 4, "tile_n": 1, "threads": 32, "grouping": 8, "minblocks": 27, "algorithm": "medium", "perf": 674.449, "source": "autotuned"},
{"m": 7, "n": 7, "k": 8, "tile_m": 4, "tile_n": 1, "threads": 32, "grouping": 9, "minblocks": 27, "algorithm": "medium", "perf": 729.115, "source": "autotuned"},
{"m": 7, "n": 7, "k": 9, "tile_m": 4, "tile_n": 1, "threads": 32, "grouping": 9, "minblocks": 21, "algorithm": "medium", "perf": 748.054, "source": "autotuned"},
{"m": 7, "n": 7, "k": 13, "tile_m": 2, "tile_n": 1, "threads": 32, "grouping": 4, "minblocks": 2, "algorithm": "medium", "perf": 723.398, "source": "autotuned"},
{"m": 7, "n": 7, "k": 25, "tile_m": 2, "tile_n": 2, "threads": 32, "grouping": 2, "minblocks": 10, "algorithm": "medium", "perf": 714.426, "source": "autotuned"},
{"m": 7, "n": 7, "k": 26, "tile_m": 2, "tile_n": 1, "threads": 64, "grouping": 2, "minblocks": 19, "algorithm": "medium", "perf": 715.418, "source": "autotuned"},
{"m": 7, "n": 7, "k": 28, "tile_m": 2, "tile_n": 1, "threads": 64, "grouping": 2, "minblocks": 15, "algorithm": "medium", "perf": 722.838, "source": "autotuned"},
{"m": 7, "n": 7, "k": 32, "tile_m": 4, "tile_n": 1, "threads": 32, "grouping": 2, "minblocks": 12, "algorithm": "medium", "perf": 745.885, "source": "autotuned"},
{"m": 7, "n": 7, "k": 45, "tile_m": 2, "tile_n": 1, "threads": 64, "grouping": 2, "minblocks": 4, "algorithm": "medium", "perf": 713.538, "source": "autotuned"},
{"m": 7, "n": 8, "k": 4, "tile_m": 2, "tile_n": 1, "threads": 32, "grouping": 10, "minblocks": 8, "algorithm": "medium", "perf": 608.405, "source": "autotuned"},
{"m": 7, "n": 8, "k": 5, "tile_m": 4, "tile_n": 1, "threads": 64, "grouping": 13, "minblocks": 19, "algorithm": "medium", "perf": 651.642, "source": "autotuned"},
{"m": 7, "n": 8, "k": 6, "tile_m": 4, "tile_n": 1, "threads": 64, "grouping": 9, "minblocks": 24, "algorithm": "medium", "perf": 717.014, "source": "autotuned"},
{"m": 7, "n": 8, "k": 7, "tile_m": 4, "tile_n": 1, "threads": 64, "grouping": 9, "minblocks": 22, "algorithm": "medium", "perf": 772.091, "source": "autotuned"},
{"m": 7, "n": 8, "k": 8, "tile_m": 2, "tile_n": 1, "threads": 64, "grouping": 10, "minblocks": 27, "algorithm": "medium", "perf": 787.746, "source": "autotuned"},
{"m": 7, "n": 8, "k": 9, "tile_m": 2, "tile_n": 1, "threads": 64, "grouping": 4, "minblocks": 26, "algorithm": "medium", "perf": 768.533, "source": "autotuned"},
{"m": 7, "n": 9, "k": 4, "tile_m": 4, "tile_n": 1, "threads": 32, "grouping": 10, "minblocks": 1, "algorithm": "medium", "perf": 627.635, "source": "autotuned"},
{"m": 7, "n": 9, "k": 5, "tile_m": 4, "tile_n": 1, "threads": 64, "grouping": 13, "minblocks": 24, "algorithm": "medium", "perf": 690.695, "source": "autotuned"},
{"m": 7, "n": 9, "k": 6, "tile_m": 4, "tile_n": 1, "threads": 64, "grouping": 13, "minblocks": 21, "algorithm": "medium", "perf": 751.319, "source": "autotuned"},
{"m": 7, "n": 9, "k": 7, "tile_m": 4, "tile_n": 1, "threads": 64, "grouping": 13, "minblocks": 23, "algorithm": "medium", "perf": 797.512, "source": "autotuned"},
{"m": 7, "n": 9, "k": 8, "tile_m": 4, "tile_n": 1, "threads": 64, "grouping": 10, "minblocks": 20, "algorithm": "medium", "perf": 782.853, "source": "autotuned"},
{"m": 7, "n": 9, "k": 9, "tile_m": 4, "tile_n": 1, "threads": 64, "grouping": 4, "minblocks": 24, "algorithm": "medium", "perf": 778.312, "source": "autotuned"},
{"m": 7, "n": 9, "k": 13, "tile_m": 1, "tile_n": 1, "threads": 128, "grouping": 4, "minblocks": 14, "algorithm": "medium", "perf": 783.727, "source": "autotuned"},
{"m": 7, "n": 9, "k": 25, "tile_m": 4, "tile_n": 1, "threads": 32, "grouping": 2, "minblocks": 24, "algorithm": "medium", "perf": 771.004, "source": "autotuned"},
{"m": 7, "n": 9, "k": 26, "tile_m": 1, "tile_n": 1, "threads": 256, "grouping": 4, "minblocks": 8, "algorithm": "medium", "perf": 774.135, "source": "autotuned"},
{"m": 7, "n": 9, "k": 28, "tile_m": 4, "tile_n": 1, "threads": 64, "grouping": 2, "minblocks": 15, "algorithm": "medium", "perf": 773.538, "source": "autotuned"},
{"m": 7, "n": 9, "k": 32, "tile_m": 2, "tile_n": 2, "threads": 32, "grouping": 2, "minblocks": 7, "algorithm": "medium", "perf": 806.222, "source": "autotuned"},
{"m": 7, "n": 9, "k": 45, "tile_m": 4, "tile_n": 1, "threads": 32, "grouping": 2, "minblocks": 16, "algorithm": "medium", "perf": 775.68, "source": "autotuned"},
{"m": 7, "n": 13, "k": 4, "tile_m": 4, "tile_n": 1, "threads": 32, "grouping": 9, "minblocks": 1, "algorithm": "medium", "perf": 837.383, "source": "autotuned"},
{"m": 7, "n": 13, "k": 5, "tile_m": 4, "tile_n": 1, "threads": 64, "grouping": 10, "minblocks": 24, "algorithm": "medium", "perf": 817.077, "source": "autotuned"},
{"m": 7, "n": 13, "k": 7, "tile_m": 4, "tile_n": 1, "threads": 64, "grouping": 4, "minblocks": 24, "algorithm": "medium", "perf": 879.853, "source": "autotuned"},
{"m": 7, "n": 13, "k": 9, "tile_m": 4, "tile_n": 1, "threads": 64, "grouping": 4, "minblocks": 21, "algorithm": "medium", "perf": 882.819, "source": "autotuned"},
{"m": 7, "n": 13, "k": 13, "tile_m": 4, "tile_n": 1, "threads": 96, "grouping": 4, "minblocks": 11, "algorithm": "medium", "perf": 864.026, "source": "autotuned"},
{"m": 7, "n": 13, "k": 25, "tile_m": 4, "tile_n": 1, "threads": 32, "grouping": 3, "minblocks": 2, "algorithm": "medium", "perf": 873.66, "source": "autotuned"},
{"m": 7, "n": 13, "k": 26, "tile_m": 4, "tile_n": 1, "threads": 32, "grouping": 3, "minblocks": 17, "algorithm": "medium", "perf": 882.585, "source": "autotuned"},
{"m": 7, "n": 13, "k": 28, "tile_m": 4, "tile_n": 1, "threads": 32, "grouping": 2, "minblocks": 17, "algorithm": "medium", "perf": 884.999, "source": "autotuned"},
{"m": 7, "n": 13, "k": 32, "tile_m": 2, "tile_n": 2, "threads": 32, "grouping": 2, "minblocks": 17, "algorithm": "medium", "perf": 919.479, "source": "autotuned"},
{"m": 7, "n": 13, "k": 45, "tile_m": 4, "tile_n": 1, "threads": 32, "grouping": 2, "minblocks": 8, "algorithm": "medium", "perf": 893.084, "source": "autotuned"},
{"m": 7, "n": 25, "k": 4, "tile_m": 7, "tile_n": 1, "threads": 32, "grouping": 9, "minblocks": 21, "algorithm": "medium", "perf": 951.384, "source": "autotuned"},
{"m": 7, "n": 25, "k": 5, "tile_m": 7, "tile_n": 1, "threads": 64, "grouping": 10, "minblocks": 20, "algorithm": "medium", "perf": 943.183, "source": "autotuned"},
{"m": 7, "n": 25, "k": 7, "tile_m": 4, "tile_n": 1, "threads": 64, "grouping": 4, "minblocks": 20, "algorithm": "medium", "perf": 950.204, "source": "autotuned"},
{"m": 7, "n": 25, "k": 9, "tile_m": 4, "tile_n": 1, "threads": 64, "grouping": 4, "minblocks": 13, "algorithm": "medium", "perf": 984.683, "source": "autotuned"},
{"m": 7, "n": 25, "k": 13, "tile_m": 7, "tile_n": 1, "threads": 96, "grouping": 4, "minblocks": 10, "algorithm": "medium", "perf": 1007.31, "source": "autotuned"},
{"m": 7, "n": 25, "k": 25, "tile_m": 2, "tile_n": 1, "threads": 192, "grouping": 3, "minblocks": 7, "algorithm": "medium", "perf": 1038.69, "source": "autotuned"},
{"m": 7, "n": 25, "k": 26, "tile_m": 2, "tile_n": 2, "threads": 192, "grouping": 3, "minblocks": 6, "algorithm": "medium", "perf": 1048.39, "source": "autotuned"},
{"m": 7, "n": 25, "k": 28, "tile_m": 4, "tile_n": 1, "threads": 256, "grouping": 3, "minblocks": 5, "algorithm": "medium", "perf": 1044.36, "source": "autotuned"},
{"m": 7, "n": 25, "k": 32, "tile_m": 1, "tile_n": 3, "threads": 256, "grouping": 3, "minblocks": 5, "algorithm": "medium", "perf": 1076.16, "source": "autotuned"},
{"m": 7, "n": 25, "k": 45, "tile_m": 4, "tile_n": 1, "threads": 320, "grouping": 3, "minblocks": 4, "algorithm": "medium", "perf": 1071.86, "source": "autotuned"},
{"m": 7, "n": 26, "k": 4, "tile_m": 7, "tile_n": 1, "threads": 32, "grouping": 8, "minblocks": 26, "algorithm": "medium", "perf": 959.977, "source": "autotuned"},
{"m": 7, "n": 26, "k": 5, "tile_m": 4, "tile_n": 1, "threads": 64, "grouping": 11, "minblocks": 23, "algorithm": "medium", "perf": 929.153, "source": "autotuned"},
{"m": 7, "n": 26, "k": 7, "tile_m": 4, "tile_n": 1, "threads": 64, "grouping": 4, "minblocks": 22, "algorithm": "medium", "perf": 966.104, "source": "autotuned"},
{"m": 7, "n": 26, "k": 9, "tile_m": 4, "tile_n": 1, "threads": 64, "grouping": 3, "minblocks": 23, "algorithm": "medium", "perf": 987.395, "source": "autotuned"},
{"m": 7, "n": 26, "k": 13, "tile_m": 7, "tile_n": 1, "threads": 96, "grouping": 3, "minblocks": 12, "algorithm": "medium", "perf": 1018.74, "source": "autotuned"},
{"m": 7, "n": 26, "k": 25, "tile_m": 4, "tile_n": 1, "threads": 192, "grouping": 4, "minblocks": 5, "algorithm": "medium", "perf": 1048.39, "source": "autotuned"},
{"m": 7, "n": 26, "k": 26, "tile_m": 4, "tile_n": 1, "threads": 192, "grouping": 3, "minblocks": 5, "algorithm": "medium", "perf": 1054.07, "source": "autotuned"},
{"m": 7, "n": 26, "k": 28, "tile_m": 1, "tile_n": 3, "threads": 224, "grouping": 4, "minblocks": 5, "algorithm": "medium", "perf": 1066.74, "source": "autotuned"},
{"m": 7, "n": 26, "k": 32, "tile_m": 4, "tile_n": 2, "threads": 32, "grouping": 2, "minblocks": 1, "algorithm": "medium", "perf": 1096.73, "source": "autotuned"},
{"m": 7, "n": 26, "k": 45, "tile_m": 4, "tile_n": 1, "threads": 320, "grouping": 3, "minblocks": 4, "algorithm": "medium", "perf": 1090.98, "source": "autotuned"},
{"m": 7, "n": 28, "k": 4, "tile_m": 7, "tile_n": 1, "threads": 32, "grouping": 9, "minblocks": 27, "algorithm": "medium", "perf": 982.927, "source": "autotuned"},
{"m": 7, "n": 28, "k": 5, "tile_m": 7, "tile_n": 1, "threads": 64, "grouping": 4, "minblocks": 23, "algorithm": "medium", "perf": 928.32, "source": "autotuned"},
{"m": 7, "n": 28, "k": 7, "tile_m": 7, "tile_n": 1, "threads": 64, "grouping": 4, "minblocks": 20, "algorithm": "medium", "perf": 972.281, "source": "autotuned"},
{"m": 7, "n": 28, "k": 9, "tile_m": 7, "tile_n": 1, "threads": 64, "grouping": 3, "minblocks": 17, "algorithm": "medium", "perf": 1013.11, "source": "autotuned"},
{"m": 7, "n": 28, "k": 13, "tile_m": 7, "tile_n": 1, "threads": 96, "grouping": 3, "minblocks": 11, "algorithm": "medium", "perf": 1037.78, "source": "autotuned"},
{"m": 7, "n": 28, "k": 25, "tile_m": 4, "tile_n": 1, "threads": 192, "grouping": 3, "minblocks": 6, "algorithm": "medium", "perf": 1076.16, "source": "autotuned"},
{"m": 7, "n": 28, "k": 26, "tile_m": 4, "tile_n": 1, "threads": 192, "grouping": 3, "minblocks": 6, "algorithm": "medium", "perf": 1091.09, "source": "autotuned"},
{"m": 7, "n": 28, "k": 28, "tile_m": 4, "tile_n": 1, "threads": 224, "grouping": 4, "minblocks": 5, "algorithm": "medium", "perf": 1088.08, "source": "autotuned"},
{"m": 7, "n": 28, "k": 32, "tile_m": 4, "tile_n": 1, "threads": 256, "grouping": 3, "minblocks": 5, "algorithm": "medium", "perf": 1113.98, "source": "autotuned"},
{"m": 7, "n": 28, "k": 45, "tile_m": 2, "tile_n": 2, "threads": 320, "grouping": 3, "minblocks": 3, "algorithm": "medium", "perf": 1110.25, "source": "autotuned"},
{"m": 7, "n": 32, "k": 4, "tile_m": 7, "tile_n": 1, "threads": 32, "grouping": 4, "minblocks": 25, "algorithm": "medium", "perf": 968.388, "source": "autotuned"},
{"m": 7, "n": 32, "k": 5, "tile_m": 4, "tile_n": 1, "threads": 64, "grouping": 4, "minblocks": 24, "algorithm": "medium", "perf": 982.45, "source": "autotuned"},
{"m": 7, "n": 32, "k": 7, "tile_m": 5, "tile_n": 1, "threads": 64, "grouping": 4, "minblocks": 20, "algorithm": "medium", "perf": 1027.27, "source": "autotuned"},
{"m": 7, "n": 32, "k": 9, "tile_m": 7, "tile_n": 1, "threads": 64, "grouping": 3, "minblocks": 15, "algorithm": "medium", "perf": 1044.53, "source": "autotuned"},
{"m": 7, "n": 32, "k": 13, "tile_m": 4, "tile_n": 1, "threads": 96, "grouping": 3, "minblocks": 12, "algorithm": "medium", "perf": 1074.08, "source": "autotuned"},
{"m": 7, "n": 32, "k": 25, "tile_m": 7, "tile_n": 1, "threads": 224, "grouping": 3, "minblocks": 5, "algorithm": "medium", "perf": 1112.64, "source": "autotuned"},
{"m": 7, "n": 32, "k": 26, "tile_m": 7, "tile_n": 1, "threads": 224, "grouping": 4, "minblocks": 5, "algorithm": "medium", "perf": 1128.45, "source": "autotuned"},
{"m": 7, "n": 32, "k": 28, "tile_m": 4, "tile_n": 1, "threads": 224, "grouping": 3, "minblocks": 5, "algorithm": "medium", "perf": 1133.3, "source": "autotuned"},
{"m": 7, "n": 32, "k": 32, "tile_m": 2, "tile_n": 1, "threads": 256, "grouping": 3, "minblocks": 2, "algorithm": "medium", "perf": 1145.16, "source": "autotuned"},
{"m": 7, "n": 32, "k": 45, "tile_m": 4, "tile_n": 1, "threads": 320, "grouping": 3, "minblocks": 4, "algorithm": "medium", "perf": 1159.87, "source": "autotuned"},
{"m": 7, "n": 45, "k": 4, "tile_m": 7, "tile_n": 2, "threads": 32, "grouping": 4, "minblocks": 17, "algorithm": "medium", "perf": 920.742, "source": "autotuned"},
{"m": 7, "n": 45, "k": 5, "tile_m": 5, "tile_n": 1, "threads": 96, "grouping": 4, "minblocks": 15, "algorithm": "medium", "perf": 954.678, "source": "autotuned"},
{"m": 7, "n": 45, "k": 7, "tile_m": 2, "tile_n": 3, "threads": 64, "grouping": 4, "minblocks": 11, "algorithm": "medium", "perf": 1004.78, "source": "autotuned"},
{"m": 7, "n": 45, "k": 9, "tile_m": 2, "tile_n": 3, "threads": 64, "grouping": 3, "minblocks": 15, "algorithm": "medium", "perf": 1051.89, "source": "autotuned"},
{"m": 7, "n": 45, "k": 13, "tile_m": 4, "tile_n": 1, "threads": 128, "grouping": 3, "minblocks": 10, "algorithm": "medium", "perf": 1087.89, "source": "autotuned"},
{"m": 7, "n": 45, "k": 25, "tile_m": 2, "tile_n": 2, "threads": 224, "grouping": 3, "minblocks": 5, "algorithm": "medium", "perf": 1161.18, "source": "autotuned"},
{"m": 7, "n": 45, "k": 26, "tile_m": 4, "tile_n": 1, "threads": 256, "grouping": 2, "minblocks": 5, "algorithm": "medium", "perf": 1167.25, "source": "autotuned"},
{"m": 7, "n": 45, "k": 28, "tile_m": 4, "tile_n": 1, "threads": 224, "grouping": 3, "minblocks": 5, "algorithm": "medium", "perf": 1176.58, "source": "autotuned"},
{"m": 7, "n": 45, "k": 32, "tile_m": 2, "tile_n": 2, "threads": 256, "grouping": 2, "minblocks": 4, "algorithm": "medium", "perf": 1207.27, "source": "autotuned"},
{"m": 7, "n": 45, "k": 45, "tile_m": 4, "tile_n": 1, "threads": 320, "grouping": 2, "minblocks": 3, "algorithm": "medium", "perf": 1213.99, "source": "autotuned"},
{"m": 8, "n": 4, "k": 4, "tile_m": 1, "tile_n": 1, "threads": 32, "grouping": 7, "minblocks": 1, "algorithm": "medium", "perf": 431.726, "source": "autotuned"},
{"m": 8, "n": 4, "k": 5, "tile_m": 1, "tile_n": 1, "threads": 32, "grouping": 10, "minblocks": 11, "algorithm": "medium", "perf": 477.505, "source": "autotuned"},
{"m": 8, "n": 4, "k": 6, "tile_m": 1, "tile_n": 1, "threads": 32, "grouping": 10, "minblocks": 23, "algorithm": "medium", "perf": 546.389, "source": "autotuned"},
{"m": 8, "n": 4, "k": 7, "tile_m": 1, "tile_n": 1, "threads": 32, "grouping": 5, "minblocks": 5, "algorithm": "medium", "perf": 565.522, "source": "autotuned"},
{"m": 8, "n": 4, "k": 8, "tile_m": 1, "tile_n": 1, "threads": 64, "grouping": 5, "minblocks": 27, "algorithm": "medium", "perf": 566.549, "source": "autotuned"},
{"m": 8, "n": 5, "k": 5, "tile_m": 1, "tile_n": 2, "threads": 32, "grouping": 10, "minblocks": 12, "algorithm": "medium", "perf": 520.996, "source": "autotuned"},
{"m": 8, "n": 5, "k": 6, "tile_m": 1, "tile_n": 2, "threads": 32, "grouping": 10, "minblocks": 1, "algorithm": "medium", "perf": 584.015, "source": "autotuned"},
{"m": 8, "n": 5, "k": 7, "tile_m": 1, "tile_n": 2, "threads": 64, "grouping": 13, "minblocks": 26, "algorithm": "medium", "perf": 596.162, "source": "autotuned"},
{"m": 8, "n": 6, "k": 4, "tile_m": 1, "tile_n": 2, "threads": 32, "grouping": 8, "minblocks": 1, "algorithm": "medium", "perf": 535.147, "source": "autotuned"},
{"m": 8, "n": 6, "k": 5, "tile_m": 1, "tile_n": 2, "threads": 32, "grouping": 5, "minblocks": 1, "algorithm": "medium", "perf": 623.198, "source": "autotuned"},
{"m": 8, "n": 6, "k": 7, "tile_m": 1, "tile_n": 2, "threads": 64, "grouping": 5, "minblocks": 25, "algorithm": "medium", "perf": 692.73, "source": "autotuned"},
{"m": 8, "n": 6, "k": 8, "tile_m": 1, "tile_n": 2, "threads": 64, "grouping": 10, "minblocks": 26, "algorithm": "medium", "perf": 730.266, "source": "autotuned"},
{"m": 8, "n": 6, "k": 9, "tile_m": 1, "tile_n": 2, "threads": 64, "grouping": 4, "minblocks": 27, "algorithm": "medium", "perf": 725.755, "source": "autotuned"},
{"m": 8, "n": 7, "k": 5, "tile_m": 1, "tile_n": 2, "threads": 64, "grouping": 13, "minblocks": 25, "algorithm": "medium", "perf": 674.466, "source": "autotuned"},
{"m": 8, "n": 7, "k": 6, "tile_m": 1, "tile_n": 2, "threads": 64, "grouping": 10, "minblocks": 25, "algorithm": "medium", "perf": 737.422, "source": "autotuned"},
{"m": 8, "n": 7, "k": 8, "tile_m": 1, "tile_n": 2, "threads": 64, "grouping": 5, "minblocks": 25, "algorithm": "medium", "perf": 809.675, "source": "autotuned"},
{"m": 8, "n": 7, "k": 9, "tile_m": 1, "tile_n": 2, "threads": 64, "grouping": 4, "minblocks": 25, "algorithm": "medium", "perf": 807.945, "source": "autotuned"},
{"m": 8, "n": 8, "k": 4, "tile_m": 1, "tile_n": 2, "threads": 32, "grouping": 10, "minblocks": 4, "algorithm": "medium", "perf": 751.703, "source": "autotuned"},
{"m": 8, "n": 8, "k": 8, "tile_m": 1, "tile_n": 2, "threads": 32, "grouping": 4, "minblocks": 13, "algorithm": "medium", "perf": 948.152, "source": "autotuned"},
{"m": 8, "n": 8, "k": 9, "tile_m": 1, "tile_n": 2, "threads": 32, "grouping": 4, "minblocks": 24, "algorithm": "medium", "perf": 873.252, "source": "autotuned"},
{"m": 8, "n": 9, "k": 4, "tile_m": 1, "tile_n": 3, "threads": 64, "grouping": 13, "minblocks": 22, "algorithm": "medium", "perf": 703.856, "source": "autotuned"},
{"m": 8, "n": 9, "k": 6, "tile_m": 1, "tile_n": 3, "threads": 64, "grouping": 10, "minblocks": 22, "algorithm": "medium", "perf": 842.134, "source": "autotuned"},
{"m": 8, "n": 9, "k": 8, "tile_m": 1, "tile_n": 3, "threads": 96, "grouping": 10, "minblocks": 19, "algorithm": "medium", "perf": 855.471, "source": "autotuned"},
{"m": 8, "n": 9, "k": 9, "tile_m": 1, "tile_n": 3, "threads": 96, "grouping": 14, "minblocks": 14, "algorithm": "medium", "perf": 845.869, "source": "autotuned"},
{"m": 9, "n": 4, "k": 4, "tile_m": 1, "tile_n": 4, "threads": 32, "grouping": 8, "minblocks": 17, "algorithm": "medium", "perf": 375.31, "source": "autotuned"},
{"m": 9, "n": 4, "k": 5, "tile_m": 1, "tile_n": 4, "threads": 32, "grouping": 8, "minblocks": 26, "algorithm": "medium", "perf": 439.162, "source": "autotuned"},
{"m": 9, "n": 4, "k": 6, "tile_m": 1, "tile_n": 4, "threads": 32, "grouping": 5, "minblocks": 25, "algorithm": "medium", "perf": 483.505, "source": "autotuned"},
{"m": 9, "n": 4, "k": 7, "tile_m": 1, "tile_n": 4, "threads": 32, "grouping": 5, "minblocks": 25, "algorithm": "medium", "perf": 518.811, "source": "autotuned"},
{"m": 9, "n": 4, "k": 9, "tile_m": 1, "tile_n": 4, "threads": 64, "grouping": 13, "minblocks": 19, "algorithm": "medium", "perf": 531.703, "source": "autotuned"},
{"m": 9, "n": 4, "k": 13, "tile_m": 2, "tile_n": 1, "threads": 64, "grouping": 4, "minblocks": 22, "algorithm": "medium", "perf": 578.535, "source": "autotuned"},
{"m": 9, "n": 4, "k": 22, "tile_m": 1, "tile_n": 1, "threads": 128, "grouping": 3, "minblocks": 15, "algorithm": "medium", "perf": 577.272, "source": "autotuned"},
{"m": 9, "n": 4, "k": 23, "tile_m": 1, "tile_n": 1, "threads": 96, "grouping": 2, "minblocks": 18, "algorithm": "medium", "perf": 574.223, "source": "autotuned"},
{"m": 9, "n": 4, "k": 25, "tile_m": 1, "tile_n": 1, "threads": 128, "grouping": 3, "minblocks": 13, "algorithm": "medium", "perf": 567.038, "source": "autotuned"},
{"m": 9, "n": 4, "k": 26, "tile_m": 1, "tile_n": 1, "threads": 128, "grouping": 3, "minblocks": 15, "algorithm": "medium", "perf": 575.2, "source": "autotuned"},
{"m": 9, "n": 4, "k": 28, "tile_m": 1, "tile_n": 1, "threads": 128, "grouping": 2, "minblocks": 13, "algorithm": "medium", "perf": 579.048, "source": "autotuned"},
{"m": 9, "n": 4, "k": 32, "tile_m": 1, "tile_n": 1, "threads": 160, "grouping": 3, "minblocks": 10, "algorithm": "medium", "perf": 585.549, "source": "autotuned"},
{"m": 9, "n": 5, "k": 4, "tile_m": 1, "tile_n": 1, "threads": 64, "grouping": 10, "minblocks": 21, "algorithm": "medium", "perf": 458.869, "source": "autotuned"},
{"m": 9, "n": 5, "k": 5, "tile_m": 1, "tile_n": 1, "threads": 64, "grouping": 10, "minblocks": 24, "algorithm": "medium", "perf": 532.058, "source": "autotuned"},
{"m": 9, "n": 5, "k": 6, "tile_m": 1, "tile_n": 2, "threads": 32, "grouping": 10, "minblocks": 14, "algorithm": "medium", "perf": 561.861, "source": "autotuned"},
{"m": 9, "n": 5, "k": 8, "tile_m": 1, "tile_n": 2, "threads": 64, "grouping": 10, "minblocks": 26, "algorithm": "medium", "perf": 607.333, "source": "autotuned"},
{"m": 9, "n": 5, "k": 9, "tile_m": 2, "tile_n": 1, "threads": 64, "grouping": 10, "minblocks": 25, "algorithm": "medium", "perf": 631.071, "source": "autotuned"},
{"m": 9, "n": 5, "k": 13, "tile_m": 1, "tile_n": 1, "threads": 128, "grouping": 5, "minblocks": 14, "algorithm": "medium", "perf": 650.478, "source": "autotuned"},
{"m": 9, "n": 5, "k": 16, "tile_m": 1, "tile_n": 1, "threads": 96, "grouping": 4, "minblocks": 18, "algorithm": "medium", "perf": 681.007, "source": "autotuned"},
{"m": 9, "n": 5, "k": 22, "tile_m": 1, "tile_n": 1, "threads": 128, "grouping": 3, "minblocks": 13, "algorithm": "medium", "perf": 656.849, "source": "autotuned"},
{"m": 9, "n": 5, "k": 23, "tile_m": 1, "tile_n": 1, "threads": 128, "grouping": 3, "minblocks": 13, "algorithm": "medium", "perf": 655.614, "source": "autotuned"},
{"m": 9, "n": 5, "k": 25, "tile_m": 1, "tile_n": 1, "threads": 128, "grouping": 3, "minblocks": 15, "algorithm": "medium", "perf": 656.774, "source": "autotuned"},
{"m": 9, "n": 5, "k": 26, "tile_m": 1, "tile_n": 1, "threads": 160, "grouping": 4, "minblocks": 10, "algorithm": "medium", "perf": 640.209, "source": "autotuned"},
{"m": 9, "n": 5, "k": 32, "tile_m": 1, "tile_n": 1, "threads": 192, "grouping": 4, "minblocks": 10, "algorithm": "medium", "perf": 678.178, "source": "autotuned"},
{"m": 9, "n": 5, "k": 45, "tile_m": 1, "tile_n": 1, "threads": 256, "grouping": 3, "minblocks": 8, "algorithm": "medium", "perf": 645.929, "source": "autotuned"},
{"m": 9, "n": 6, "k": 4, "tile_m": 2, "tile_n": 1, "threads": 32, "grouping": 10, "minblocks": 6, "algorithm": "medium", "perf": 542.835, "source": "autotuned"},
{"m": 9, "n": 6, "k": 5, "tile_m": 2, "tile_n": 1, "threads": 32, "grouping": 10, "minblocks": 4, "algorithm": "medium", "perf": 619.213, "source": "autotuned"},
{"m": 9, "n": 6, "k": 6, "tile_m": 1, "tile_n": 2, "threads": 64, "grouping": 13, "minblocks": 25, "algorithm": "medium", "perf": 646.841, "source": "autotuned"},
{"m": 9, "n": 6, "k": 7, "tile_m": 2, "tile_n": 1, "threads": 64, "grouping": 10, "minblocks": 25, "algorithm": "medium", "perf": 696.311, "source": "autotuned"},
{"m": 9, "n": 6, "k": 8, "tile_m": 2, "tile_n": 1, "threads": 64, "grouping": 10, "minblocks": 25, "algorithm": "medium", "perf": 710.748, "source": "autotuned"},
{"m": 9, "n": 7, "k": 4, "tile_m": 6, "tile_n": 1, "threads": 32, "grouping": 8, "minblocks": 25, "algorithm": "medium", "perf": 605.959, "source": "autotuned"},
{"m": 9, "n": 7, "k": 5, "tile_m": 6, "tile_n": 1, "threads": 64, "grouping": 13, "minblocks": 20, "algorithm": "medium", "perf": 657.579, "source": "autotuned"},
{"m": 9, "n": 7, "k": 7, "tile_m": 6, "tile_n": 1, "threads": 64, "grouping": 13, "minblocks": 18, "algorithm": "medium", "perf": 768.916, "source": "autotuned"},
{"m": 9, "n": 7, "k": 9, "tile_m": 6, "tile_n": 1, "threads": 64, "grouping": 13, "minblocks": 15, "algorithm": "medium", "perf": 772.147, "source": "autotuned"},
{"m": 9, "n": 7, "k": 13, "tile_m": 1, "tile_n": 1, "threads": 96, "grouping": 4, "minblocks": 20, "algorithm": "medium", "perf": 775.811, "source": "autotuned"},
{"m": 9, "n": 7, "k": 25, "tile_m": 1, "tile_n": 1, "threads": 192, "grouping": 4, "minblocks": 10, "algorithm": "medium", "perf": 769.283, "source": "autotuned"},
{"m": 9, "n": 7, "k": 28, "tile_m": 1, "tile_n": 1, "threads": 256, "grouping": 4, "minblocks": 8, "algorithm": "medium", "perf": 778.217, "source": "autotuned"},
{"m": 9, "n": 7, "k": 32, "tile_m": 1, "tile_n": 1, "threads": 256, "grouping": 4, "minblocks": 8, "algorithm": "medium", "perf": 799.404, "source": "autotuned"},
{"m": 9, "n": 8, "k": 4, "tile_m": 6, "tile_n": 1, "threads": 64, "grouping": 13, "minblocks": 17, "algorithm": "medium", "perf": 667.45, "source": "autotuned"},
{"m": 9, "n": 8, "k": 5, "tile_m": 6, "tile_n": 1, "threads": 64, "grouping": 13, "minblocks": 17, "algorithm": "medium", "perf": 734.394, "source": "autotuned"},
{"m": 9, "n": 8, "k": 6, "tile_m": 6, "tile_n": 1, "threads": 64, "grouping": 13, "minblocks": 19, "algorithm": "medium", "perf": 802.799, "source": "autotuned"},
{"m": 9, "n": 8, "k": 8, "tile_m": 2, "tile_n": 2, "threads": 96, "grouping": 13, "minblocks": 15, "algorithm": "medium", "perf": 818.438, "source": "autotuned"},
{"m": 9, "n": 9, "k": 4, "tile_m": 5, "tile_n": 1, "threads": 32, "grouping": 10, "minblocks": 24, "algorithm": "medium", "perf": 721.956, "source": "autotuned"},
{"m": 9, "n": 9, "k": 5, "tile_m": 5, "tile_n": 1, "threads": 32, "grouping": 10, "minblocks": 23, "algorithm": "medium", "perf": 798.279, "source": "autotuned"},
{"m": 9, "n": 9, "k": 6, "tile_m": 5, "tile_n": 1, "threads": 32, "grouping": 10, "minblocks": 11, "algorithm": "medium", "perf": 851.583, "source": "autotuned"},
{"m": 9, "n": 9, "k": 7, "tile_m": 5, "tile_n": 1, "threads": 64, "grouping": 10, "minblocks": 22, "algorithm": "medium", "perf": 882.204, "source": "autotuned"},
{"m": 9, "n": 9, "k": 8, "tile_m": 5, "tile_n": 1, "threads": 32, "grouping": 4, "minblocks": 26, "algorithm": "medium", "perf": 897.133, "source": "autotuned"},
{"m": 9, "n": 9, "k": 9, "tile_m": 5, "tile_n": 1, "threads": 32, "grouping": 3, "minblocks": 26, "algorithm": "medium", "perf": 894.306, "source": "autotuned"},
{"m": 9, "n": 9, "k": 10, "tile_m": 5, "tile_n": 1, "threads": 32, "grouping": 3, "minblocks": 27, "algorithm": "medium", "perf": 891.564, "source": "autotuned"},
{"m": 9, "n": 9, "k": 12, "tile_m": 5, "tile_n": 1, "threads": 32, "grouping": 3, "minblocks": 25, "algorithm": "medium", "perf": 904.749, "source": "autotuned"},
{"m": 9, "n": 9, "k": 13, "tile_m": 5, "tile_n": 1, "threads": 32, "grouping": 3, "minblocks": 25, "algorithm": "medium", "perf": 885.963, "source": "autotuned"},
{"m": 9, "n": 9, "k": 16, "tile_m": 1, "tile_n": 3, "threads": 32, "grouping": 3, "minblocks": 3, "algorithm": "medium", "perf": 915.109, "source": "autotuned"},
{"m": 9, "n": 9, "k": 17, "tile_m": 2, "tile_n": 2, "threads": 32, "grouping": 3, "minblocks": 2, "algorithm": "medium", "perf": 879.336, "source": "autotuned"},
{"m": 9, "n": 9, "k": 22, "tile_m": 5, "tile_n": 1, "threads": 32, "grouping": 3, "minblocks": 9, "algorithm": "medium", "perf": 884.267, "source": "autotuned"},
{"m": 9, "n": 9, "k": 23, "tile_m": 5, "tile_n": 1, "threads": 32, "grouping": 3, "minblocks": 15, "algorithm": "medium", "perf": 881.057, "source": "autotuned"},
{"m": 9, "n": 9, "k": 25, "tile_m": 2, "tile_n": 2, "threads": 32, "grouping": 2, "minblocks": 13, "algorithm": "medium", "perf": 889.476, "source": "autotuned"},
{"m": 9, "n": 9, "k": 26, "tile_m": 5, "tile_n": 1, "threads": 32, "grouping": 3, "minblocks": 4, "algorithm": "medium", "perf": 889.636, "source": "autotuned"},
{"m": 9, "n": 9, "k": 28, "tile_m": 5, "tile_n": 1, "threads": 32, "grouping": 2, "minblocks": 1, "algorithm": "medium", "perf": 899.71, "source": "autotuned"},
{"m": 9, "n": 9, "k": 45, "tile_m": 3, "tile_n": 1, "threads": 128, "grouping": 3, "minblocks": 8, "algorithm": "medium", "perf": 887.859, "source": "autotuned"},
{"m": 9, "n": 10, "k": 10, "tile_m": 1, "tile_n": 2, "threads": 128, "grouping": 5, "minblocks": 13, "algorithm": "medium", "perf": 898.622, "source": "autotuned"},
{"m": 9, "n": 10, "k": 32, "tile_m": 5, "tile_n": 1, "threads": 32, "grouping": 2, "minblocks": 4, "algorithm": "medium", "perf": 952.679, "source": "autotuned"},
{"m": 9, "n": 12, "k": 9, "tile_m": 2, "tile_n": 2, "threads": 128, "grouping": 4, "minblocks": 16, "algorithm": "medium", "perf": 959.51, "source": "autotuned"},
{"m": 9, "n": 12, "k": 10, "tile_m": 2, "tile_n": 2, "threads": 128, "grouping": 6, "minblocks": 12, "algorithm": "medium", "perf": 962.088, "source": "autotuned"},
{"m": 9, "n": 12, "k": 32, "tile_m": 5, "tile_n": 1, "threads": 32, "grouping": 2, "minblocks": 11, "algorithm": "medium", "perf": 1028.89, "source": "autotuned"},
{"m": 9, "n": 13, "k": 4, "tile_m": 5, "tile_n": 1, "threads": 64, "grouping": 10, "minblocks": 23, "algorithm": "medium", "perf": 932.634, "source": "autotuned"},
{"m": 9, "n": 13, "k": 5, "tile_m": 5, "tile_n": 1, "threads": 64, "grouping": 10, "minblocks": 21, "algorithm": "medium", "perf": 931.325, "source": "autotuned"},
{"m": 9, "n": 13, "k": 9, "tile_m": 5, "tile_n": 1, "threads": 128, "grouping": 6, "minblocks": 11, "algorithm": "medium", "perf": 954.731, "source": "autotuned"},
{"m": 9, "n": 13, "k": 13, "tile_m": 1, "tile_n": 2, "threads": 128, "grouping": 3, "minblocks": 14, "algorithm": "medium", "perf": 984.455, "source": "autotuned"},
{"m": 9, "n": 13, "k": 16, "tile_m": 5, "tile_n": 1, "threads": 32, "grouping": 3, "minblocks": 22, "algorithm": "medium", "perf": 1020.2, "source": "autotuned"},
{"m": 9, "n": 13, "k": 22, "tile_m": 5, "tile_n": 1, "threads": 64, "grouping": 3, "minblocks": 16, "algorithm": "medium", "perf": 992.026, "source": "autotuned"},
{"m": 9, "n": 13, "k": 23, "tile_m": 5, "tile_n": 1, "threads": 32, "grouping": 2, "minblocks": 11, "algorithm": "medium", "perf": 1008.27, "source": "autotuned"},
{"m": 9, "n": 13, "k": 26, "tile_m": 5, "tile_n": 1, "threads": 32, "grouping": 3, "minblocks": 9, "algorithm": "medium", "perf": 1007.6, "source": "autotuned"},
{"m": 9, "n": 16, "k": 5, "tile_m": 5, "tile_n": 1, "threads": 64, "grouping": 9, "minblocks": 24, "algorithm": "medium", "perf": 1049.8, "source": "autotuned"},
{"m": 9, "n": 16, "k": 9, "tile_m": 5, "tile_n": 1, "threads": 96, "grouping": 4, "minblocks": 13, "algorithm": "medium", "perf": 1049.44, "source": "autotuned"},
{"m": 9, "n": 16, "k": 13, "tile_m": 5, "tile_n": 1, "threads": 128, "grouping": 4, "minblocks": 10, "algorithm": "medium", "perf": 1071.58, "source": "autotuned"},
{"m": 9, "n": 16, "k": 16, "tile_m": 5, "tile_n": 1, "threads": 32, "grouping": 3, "minblocks": 17, "algorithm": "medium", "perf": 1100.21, "source": "autotuned"},
{"m": 9, "n": 16, "k": 17, "tile_m": 5, "tile_n": 1, "threads": 32, "grouping": 3, "minblocks": 18, "algorithm": "medium", "perf": 1087.28, "source": "autotuned"},
{"m": 9, "n": 16, "k": 22, "tile_m": 5, "tile_n": 1, "threads": 32, "grouping": 3, "minblocks": 10, "algorithm": "medium", "perf": 1100.47, "source": "autotuned"},
{"m": 9, "n": 16, "k": 23, "tile_m": 5, "tile_n": 1, "threads": 32, "grouping": 2, "minblocks": 20, "algorithm": "medium", "perf": 1092.09, "source": "autotuned"},
{"m": 9, "n": 17, "k": 9, "tile_m": 1, "tile_n": 2, "threads": 96, "grouping": 10, "minblocks": 17, "algorithm": "medium", "perf": 1007.55, "source": "autotuned"},
{"m": 9, "n": 17, "k": 16, "tile_m": 1, "tile_n": 2, "threads": 160, "grouping": 3, "minblocks": 11, "algorithm": "medium", "perf": 1095.06, "source": "autotuned"},
{"m": 9, "n": 17, "k": 17, "tile_m": 1, "tile_n": 2, "threads": 160, "grouping": 4, "minblocks": 11, "algorithm": "medium", "perf": 1071.59, "source": "autotuned"},
{"m": 9, "n": 17, "k": 22, "tile_m": 3, "tile_n": 2, "threads": 64, "grouping": 3, "minblocks": 12, "algorithm": "medium", "perf": 1078.61, "source": "autotuned"},
{"m": 9, "n": 17, "k": 23, "tile_m": 3, "tile_n": 2, "threads": 32, "grouping": 2, "minblocks": 20, "algorithm": "medium", "perf": 1082.66, "source": "autotuned"},
{"m": 9, "n": 22, "k": 4, "tile_m": 5, "tile_n": 1, "threads": 64, "grouping": 10, "minblocks": 23, "algorithm": "medium", "perf": 1032.38, "source": "autotuned"},
{"m": 9, "n": 22, "k": 9, "tile_m": 5, "tile_n": 1, "threads": 96, "grouping": 4, "minblocks": 13, "algorithm": "medium", "perf": 1102.68, "source": "autotuned"},
{"m": 9, "n": 22, "k": 13, "tile_m": 5, "tile_n": 1, "threads": 128, "grouping": 3, "minblocks": 10, "algorithm": "medium", "perf": 1125.11, "source": "autotuned"},
{"m": 9, "n": 22, "k": 16, "tile_m": 5, "tile_n": 1, "threads": 160, "grouping": 4, "minblocks": 7, "algorithm": "medium", "perf": 1165.93, "source": "autotuned"},
{"m": 9, "n": 22, "k": 17, "tile_m": 5, "tile_n": 1, "threads": 160, "grouping": 3, "minblocks": 8, "algorithm": "medium", "perf": 1143.83, "source": "autotuned"},
{"m": 9, "n": 22, "k": 22, "tile_m": 9, "tile_n": 1, "threads": 32, "grouping": 2, "minblocks": 15, "algorithm": "medium", "perf": 1163.2, "source": "autotuned"},
{"m": 9, "n": 22, "k": 23, "tile_m": 9, "tile_n": 1, "threads": 32, "grouping": 2, "minblocks": 16, "algorithm": "medium", "perf": 1163.88, "source": "autotuned"},
{"m": 9, "n": 22, "k": 26, "tile_m": 9, "tile_n": 1, "threads": 32, "grouping": 2, "minblocks": 15, "algorithm": "medium", "perf": 1186.82, "source": "autotuned"},
{"m": 9, "n": 23, "k": 4, "tile_m": 5, "tile_n": 1, "threads": 64, "grouping": 10, "minblocks": 24, "algorithm": "medium", "perf": 1039.39, "source": "autotuned"},
{"m": 9, "n": 23, "k": 5, "tile_m": 5, "tile_n": 1, "threads": 64, "grouping": 10, "minblocks": 20, "algorithm": "medium", "perf": 1043.06, "source": "autotuned"},
{"m": 9, "n": 23, "k": 9, "tile_m": 5, "tile_n": 1, "threads": 96, "grouping": 4, "minblocks": 13, "algorithm": "medium", "perf": 1101.62, "source": "autotuned"},
{"m": 9, "n": 23, "k": 13, "tile_m": 6, "tile_n": 1, "threads": 128, "grouping": 4, "minblocks": 9, "algorithm": "medium", "perf": 1146.44, "source": "autotuned"},
{"m": 9, "n": 23, "k": 16, "tile_m": 5, "tile_n": 1, "threads": 160, "grouping": 4, "minblocks": 7, "algorithm": "medium", "perf": 1186.48, "source": "autotuned"},
{"m": 9, "n": 23, "k": 17, "tile_m": 5, "tile_n": 1, "threads": 160, "grouping": 4, "minblocks": 7, "algorithm": "medium", "perf": 1153.25, "source": "autotuned"},
{"m": 9, "n": 23, "k": 22, "tile_m": 5, "tile_n": 1, "threads": 64, "grouping": 3, "minblocks": 13, "algorithm": "medium", "perf": 1190.96, "source": "autotuned"},
{"m": 9, "n": 23, "k": 23, "tile_m": 9, "tile_n": 1, "threads": 32, "grouping": 2, "minblocks": 4, "algorithm": "medium", "perf": 1177.76, "source": "autotuned"},
{"m": 9, "n": 23, "k": 26, "tile_m": 5, "tile_n": 1, "threads": 96, "grouping": 3, "minblocks": 9, "algorithm": "medium", "perf": 1194.34, "source": "autotuned"},
{"m": 9, "n": 26, "k": 4, "tile_m": 5, "tile_n": 1, "threads": 64, "grouping": 10, "minblocks": 23, "algorithm": "medium", "perf": 1049.02, "source": "autotuned"},
{"m": 9, "n": 26, "k": 5, "tile_m": 5, "tile_n": 1, "threads": 64, "grouping": 4, "minblocks": 22, "algorithm": "medium", "perf": 1062.13, "source": "autotuned"},
{"m": 9, "n": 26, "k": 9, "tile_m": 5, "tile_n": 1, "threads": 96, "grouping": 3, "minblocks": 16, "algorithm": "medium", "perf": 1135.3, "source": "autotuned"},
{"m": 9, "n": 26, "k": 13, "tile_m": 9, "tile_n": 1, "threads": 128, "grouping": 4, "minblocks": 8, "algorithm": "medium", "perf": 1180.7, "source": "autotuned"},
{"m": 9, "n": 26, "k": 22, "tile_m": 5, "tile_n": 1, "threads": 224, "grouping": 4, "minblocks": 5, "algorithm": "medium", "perf": 1227.07, "source": "autotuned"},
{"m": 9, "n": 26, "k": 23, "tile_m": 5, "tile_n": 2, "threads": 32, "grouping": 2, "minblocks": 3, "algorithm": "medium", "perf": 1223.56, "source": "autotuned"},
{"m": 9, "n": 26, "k": 26, "tile_m": 5, "tile_n": 1, "threads": 256, "grouping": 3, "minblocks": 5, "algorithm": "medium", "perf": 1246.86, "source": "autotuned"},
{"m": 10, "n": 10, "k": 10, "tile_m": 5, "tile_n": 1, "threads": 32, "grouping": 3, "minblocks": 27, "algorithm": "medium", "perf": 977.584, "source": "autotuned"},
{"m": 10, "n": 10, "k": 32, "tile_m": 1, "tile_n": 4, "threads": 64, "grouping": 3, "minblocks": 8, "algorithm": "medium", "perf": 1027.72, "source": "autotuned"},
{"m": 10, "n": 12, "k": 10, "tile_m": 1, "tile_n": 2, "threads": 128, "grouping": 4, "minblocks": 14, "algorithm": "medium", "perf": 1050.75, "source": "autotuned"},
{"m": 10, "n": 15, "k": 10, "tile_m": 1, "tile_n": 2, "threads": 128, "grouping": 4, "minblocks": 16, "algorithm": "medium", "perf": 1071.76, "source": "autotuned"},
{"m": 10, "n": 15, "k": 15, "tile_m": 1, "tile_n": 2, "threads": 160, "grouping": 5, "minblocks": 9, "algorithm": "medium", "perf": 1088.77, "source": "autotuned"},
{"m": 11, "n": 11, "k": 11, "tile_m": 6, "tile_n": 1, "threads": 32, "grouping": 3, "minblocks": 26, "algorithm": "medium", "perf": 1022.85, "source": "autotuned"},
{"m": 12, "n": 12, "k": 12, "tile_m": 6, "tile_n": 1, "threads": 32, "grouping": 3, "minblocks": 19, "algorithm": "medium", "perf": 1148.64, "source": "autotuned"},
{"m": 13, "n": 4, "k": 4, "tile_m": 1, "tile_n": 4, "threads": 32, "grouping": 8, "minblocks": 26, "algorithm": "medium", "perf": 538.053, "source": "autotuned"},
{"m": 13, "n": 4, "k": 5, "tile_m": 1, "tile_n": 4, "threads": 32, "grouping": 9, "minblocks": 1, "algorithm": "medium", "perf": 580.215, "source": "autotuned"},
{"m": 13, "n": 4, "k": 9, "tile_m": 2, "tile_n": 1, "threads": 64, "grouping": 4, "minblocks": 25, "algorithm": "medium", "perf": 646.473, "source": "autotuned"},
{"m": 13, "n": 4, "k": 13, "tile_m": 2, "tile_n": 1, "threads": 64, "grouping": 3, "minblocks": 21, "algorithm": "medium", "perf": 636.567, "source": "autotuned"},
{"m": 13, "n": 4, "k": 22, "tile_m": 1, "tile_n": 2, "threads": 96, "grouping": 3, "minblocks": 15, "algorithm": "medium", "perf": 632.137, "source": "autotuned"},
{"m": 13, "n": 4, "k": 23, "tile_m": 2, "tile_n": 1, "threads": 96, "grouping": 3, "minblocks": 13, "algorithm": "medium", "perf": 625.163, "source": "autotuned"},
{"m": 13, "n": 4, "k": 26, "tile_m": 1, "tile_n": 1, "threads": 128, "grouping": 2, "minblocks": 15, "algorithm": "medium", "perf": 632.236, "source": "autotuned"},
{"m": 13, "n": 5, "k": 4, "tile_m": 1, "tile_n": 5, "threads": 32, "grouping": 10, "minblocks": 19, "algorithm": "medium", "perf": 601.518, "source": "autotuned"},
{"m": 13, "n": 5, "k": 5, "tile_m": 1, "tile_n": 5, "threads": 32, "grouping": 10, "minblocks": 27, "algorithm": "medium", "perf": 657.575, "source": "autotuned"},
{"m": 13, "n": 5, "k": 9, "tile_m": 2, "tile_n": 2, "threads": 64, "grouping": 4, "minblocks": 22, "algorithm": "medium", "perf": 712.892, "source": "autotuned"},
{"m": 13, "n": 5, "k": 13, "tile_m": 1, "tile_n": 3, "threads": 96, "grouping": 3, "minblocks": 15, "algorithm": "medium", "perf": 702.088, "source": "autotuned"},
{"m": 13, "n": 5, "k": 16, "tile_m": 1, "tile_n": 3, "threads": 96, "grouping": 4, "minblocks": 13, "algorithm": "medium", "perf": 738.124, "source": "autotuned"},
{"m": 13, "n": 5, "k": 22, "tile_m": 1, "tile_n": 1, "threads": 128, "grouping": 2, "minblocks": 13, "algorithm": "medium", "perf": 719.495, "source": "autotuned"},
{"m": 13, "n": 5, "k": 23, "tile_m": 1, "tile_n": 1, "threads": 128, "grouping": 2, "minblocks": 15, "algorithm": "medium", "perf": 713.614, "source": "autotuned"},
{"m": 13, "n": 5, "k": 26, "tile_m": 1, "tile_n": 1, "threads": 160, "grouping": 3, "minblocks": 10, "algorithm": "medium", "perf": 712.358, "source": "autotuned"},
{"m": 13, "n": 9, "k": 4, "tile_m": 7, "tile_n": 1, "threads": 64, "grouping": 10, "minblocks": 19, "algorithm": "medium", "perf": 877.374, "source": "autotuned"},
{"m": 13, "n": 9, "k": 5, "tile_m": 7, "tile_n": 1, "threads": 64, "grouping": 10, "minblocks": 20, "algorithm": "medium", "perf": 879.219, "source": "autotuned"},
{"m": 13, "n": 9, "k": 9, "tile_m": 2, "tile_n": 1, "threads": 128, "grouping": 4, "minblocks": 14, "algorithm": "medium", "perf": 970.648, "source": "autotuned"},
{"m": 13, "n": 9, "k": 13, "tile_m": 2, "tile_n": 1, "threads": 128, "grouping": 4, "minblocks": 15, "algorithm": "medium", "perf": 972.888, "source": "autotuned"},
{"m": 13, "n": 9, "k": 16, "tile_m": 2, "tile_n": 1, "threads": 224, "grouping": 5, "minblocks": 7, "algorithm": "medium", "perf": 1001.38, "source": "autotuned"},
{"m": 13, "n": 9, "k": 22, "tile_m": 2, "tile_n": 1, "threads": 224, "grouping": 4, "minblocks": 8, "algorithm": "medium", "perf": 978.269, "source": "autotuned"},
{"m": 13, "n": 9, "k": 23, "tile_m": 7, "tile_n": 1, "threads": 64, "grouping": 2, "minblocks": 15, "algorithm": "medium", "perf": 981.528, "source": "autotuned"},
{"m": 13, "n": 9, "k": 26, "tile_m": 1, "tile_n": 1, "threads": 256, "grouping": 4, "minblocks": 8, "algorithm": "medium", "perf": 990.302, "source": "autotuned"},
{"m": 13, "n": 13, "k": 4, "tile_m": 8, "tile_n": 1, "threads": 64, "grouping": 9, "minblocks": 24, "algorithm": "medium", "perf": 1111.68, "source": "autotuned"},
{"m": 13, "n": 13, "k": 5, "tile_m": 8, "tile_n": 1, "threads": 32, "grouping": 9, "minblocks": 22, "algorithm": "medium", "perf": 1109.06, "source": "autotuned"},
{"m": 13, "n": 13, "k": 9, "tile_m": 8, "tile_n": 1, "threads": 32, "grouping": 9, "minblocks": 22, "algorithm": "medium", "perf": 1135.75, "source": "autotuned"},
{"m": 13, "n": 13, "k": 13, "tile_m": 7, "tile_n": 1, "threads": 64, "grouping": 4, "minblocks": 13, "algorithm": "medium", "perf": 1164.52, "source": "autotuned"},
{"m": 13, "n": 13, "k": 16, "tile_m": 7, "tile_n": 1, "threads": 64, "grouping": 3, "minblocks": 12, "algorithm": "medium", "perf": 1230.31, "source": "autotuned"},
{"m": 13, "n": 13, "k": 17, "tile_m": 4, "tile_n": 2, "threads": 32, "grouping": 3, "minblocks": 2, "algorithm": "medium", "perf": 1199.08, "source": "autotuned"},
{"m": 13, "n": 13, "k": 22, "tile_m": 7, "tile_n": 1, "threads": 64, "grouping": 3, "minblocks": 11, "algorithm": "medium", "perf": 1215.28, "source": "autotuned"},
{"m": 13, "n": 13, "k": 23, "tile_m": 7, "tile_n": 1, "threads": 64, "grouping": 3, "minblocks": 12, "algorithm": "medium", "perf": 1223.86, "source": "autotuned"},
{"m": 13, "n": 13, "k": 26, "tile_m": 7, "tile_n": 1, "threads": 96, "grouping": 3, "minblocks": 10, "algorithm": "medium", "perf": 1220.15, "source": "autotuned"},
{"m": 13, "n": 16, "k": 5, "tile_m": 7, "tile_n": 1, "threads": 96, "grouping": 13, "minblocks": 14, "algorithm": "medium", "perf": 1169.67, "source": "autotuned"},
{"m": 13, "n": 16, "k": 9, "tile_m": 7, "tile_n": 1, "threads": 32, "grouping": 3, "minblocks": 25, "algorithm": "medium", "perf": 1217.94, "source": "autotuned"},
{"m": 13, "n": 16, "k": 13, "tile_m": 7, "tile_n": 1, "threads": 32, "grouping": 3, "minblocks": 19, "algorithm": "medium", "perf": 1261.88, "source": "autotuned"},
{"m": 13, "n": 16, "k": 16, "tile_m": 7, "tile_n": 1, "threads": 32, "grouping": 2, "minblocks": 19, "algorithm": "medium", "perf": 1316.52, "source": "autotuned"},
{"m": 13, "n": 16, "k": 23, "tile_m": 7, "tile_n": 1, "threads": 32, "grouping": 2, "minblocks": 18, "algorithm": "medium", "perf": 1333.01, "source": "autotuned"},
{"m": 13, "n": 17, "k": 13, "tile_m": 1, "tile_n": 2, "threads": 224, "grouping": 4, "minblocks": 9, "algorithm": "medium", "perf": 1240.09, "source": "autotuned"},
{"m": 13, "n": 17, "k": 17, "tile_m": 1, "tile_n": 2, "threads": 224, "grouping": 4, "minblocks": 7, "algorithm": "medium", "perf": 1269.37, "source": "autotuned"},
{"m": 13, "n": 17, "k": 23, "tile_m": 4, "tile_n": 3, "threads": 32, "grouping": 3, "minblocks": 3, "algorithm": "medium", "perf": 1303.07, "source": "autotuned"},
{"m": 13, "n": 22, "k": 4, "tile_m": 8, "tile_n": 1, "threads": 96, "grouping": 13, "minblocks": 14, "algorithm": "medium", "perf": 1203.83, "source": "autotuned"},
{"m": 13, "n": 22, "k": 5, "tile_m": 7, "tile_n": 1, "threads": 128, "grouping": 6, "minblocks": 12, "algorithm": "medium", "perf": 1187.22, "source": "autotuned"},
{"m": 13, "n": 22, "k": 9, "tile_m": 2, "tile_n": 2, "threads": 128, "grouping": 4, "minblocks": 11, "algorithm": "medium", "perf": 1308.67, "source": "autotuned"},
{"m": 13, "n": 22, "k": 13, "tile_m": 3, "tile_n": 4, "threads": 32, "grouping": 3, "minblocks": 13, "algorithm": "medium", "perf": 1346.22, "source": "autotuned"},
{"m": 13, "n": 22, "k": 22, "tile_m": 4, "tile_n": 3, "threads": 32, "grouping": 2, "minblocks": 1, "algorithm": "medium", "perf": 1453.46, "source": "autotuned"},
{"m": 13, "n": 22, "k": 23, "tile_m": 4, "tile_n": 3, "threads": 32, "grouping": 2, "minblocks": 2, "algorithm": "medium", "perf": 1457.16, "source": "autotuned"},
{"m": 13, "n": 22, "k": 26, "tile_m": 4, "tile_n": 3, "threads": 32, "grouping": 2, "minblocks": 6, "algorithm": "medium", "perf": 1480.46, "source": "autotuned"},
{"m": 13, "n": 23, "k": 4, "tile_m": 7, "tile_n": 1, "threads": 64, "grouping": 10, "minblocks": 19, "algorithm": "medium", "perf": 1197.81, "source": "autotuned"},
{"m": 13, "n": 23, "k": 5, "tile_m": 7, "tile_n": 1, "threads": 128, "grouping": 6, "minblocks": 12, "algorithm": "medium", "perf": 1214.22, "source": "autotuned"},
{"m": 13, "n": 23, "k": 9, "tile_m": 7, "tile_n": 1, "threads": 128, "grouping": 4, "minblocks": 10, "algorithm": "medium", "perf": 1310.86, "source": "autotuned"},
{"m": 13, "n": 23, "k": 13, "tile_m": 7, "tile_n": 1, "threads": 64, "grouping": 3, "minblocks": 13, "algorithm": "medium", "perf": 1362.06, "source": "autotuned"},
{"m": 13, "n": 23, "k": 16, "tile_m": 7, "tile_n": 1, "threads": 64, "grouping": 3, "minblocks": 13, "algorithm": "medium", "perf": 1447.81, "source": "autotuned"},
{"m": 13, "n": 23, "k": 17, "tile_m": 4, "tile_n": 3, "threads": 32, "grouping": 3, "minblocks": 8, "algorithm": "medium", "perf": 1430.26, "source": "autotuned"},
{"m": 13, "n": 23, "k": 22, "tile_m": 7, "tile_n": 1, "threads": 64, "grouping": 3, "minblocks": 10, "algorithm": "medium", "perf": 1470.51, "source": "autotuned"},
{"m": 13, "n": 23, "k": 23, "tile_m": 4, "tile_n": 3, "threads": 32, "grouping": 2, "minblocks": 1, "algorithm": "medium", "perf": 1478.54, "source": "autotuned"},
{"m": 13, "n": 23, "k": 26, "tile_m": 7, "tile_n": 1, "threads": 64, "grouping": 2, "minblocks": 9, "algorithm": "medium", "perf": 1500.66, "source": "autotuned"},
{"m": 13, "n": 26, "k": 4, "tile_m": 8, "tile_n": 1, "threads": 64, "grouping": 13, "minblocks": 17, "algorithm": "medium", "perf": 1215.84, "source": "autotuned"},
{"m": 13, "n": 26, "k": 5, "tile_m": 7, "tile_n": 1, "threads": 96, "grouping": 6, "minblocks": 11, "algorithm": "medium", "perf": 1225.27, "source": "autotuned"},
{"m": 13, "n": 26, "k": 9, "tile_m": 2, "tile_n": 2, "threads": 128, "grouping": 4, "minblocks": 11, "algorithm": "medium", "perf": 1382.06, "source": "autotuned"},
{"m": 13, "n": 26, "k": 13, "tile_m": 7, "tile_n": 1, "threads": 192, "grouping": 4, "minblocks": 6, "algorithm": "medium", "perf": 1417.56, "source": "autotuned"},
{"m": 13, "n": 26, "k": 22, "tile_m": 7, "tile_n": 2, "threads": 32, "grouping": 2, "minblocks": 2, "algorithm": "medium", "perf": 1536.42, "source": "autotuned"},
{"m": 13, "n": 26, "k": 23, "tile_m": 7, "tile_n": 2, "threads": 32, "grouping": 2, "minblocks": 11, "algorithm": "medium", "perf": 1536.74, "source": "autotuned"},
{"m": 13, "n": 26, "k": 26, "tile_m": 7, "tile_n": 1, "threads": 64, "grouping": 2, "minblocks": 7, "algorithm": "medium", "perf": 1558.37, "source": "autotuned"},
{"m": 14, "n": 14, "k": 14, "tile_m": 7, "tile_n": 1, "threads": 32, "grouping": 3, "minblocks": 16, "algorithm": "medium", "perf": 1285.95, "source": "autotuned"},
{"m": 15, "n": 15, "k": 15, "tile_m": 2, "tile_n": 4, "threads": 32, "grouping": 3, "minblocks": 2, "algorithm": "medium", "perf": 1348.44, "source": "autotuned"},
{"m": 16, "n": 5, "k": 5, "tile_m": 1, "tile_n": 3, "threads": 32, "grouping": 8, "minblocks": 26, "algorithm": "medium", "perf": 796.959, "source": "autotuned"},
{"m": 16, "n": 5, "k": 9, "tile_m": 1, "tile_n": 3, "threads": 64, "grouping": 4, "minblocks": 22, "algorithm": "medium", "perf": 780.707, "source": "autotuned"},
{"m": 16, "n": 5, "k": 13, "tile_m": 1, "tile_n": 1, "threads": 96, "grouping": 2, "minblocks": 19, "algorithm": "medium", "perf": 767.06, "source": "autotuned"},
{"m": 16, "n": 5, "k": 16, "tile_m": 1, "tile_n": 1, "threads": 96, "grouping": 4, "minblocks": 8, "algorithm": "medium", "perf": 789.126, "source": "autotuned"},
{"m": 16, "n": 5, "k": 23, "tile_m": 1, "tile_n": 1, "threads": 128, "grouping": 2, "minblocks": 13, "algorithm": "medium", "perf": 781.229, "source": "autotuned"},
{"m": 16, "n": 9, "k": 5, "tile_m": 1, "tile_n": 5, "threads": 64, "grouping": 9, "minblocks": 22, "algorithm": "medium", "perf": 1052.33, "source": "autotuned"},
{"m": 16, "n": 9, "k": 9, "tile_m": 1, "tile_n": 3, "threads": 96, "grouping": 5, "minblocks": 14, "algorithm": "medium", "perf": 1060.21, "source": "autotuned"},
{"m": 16, "n": 9, "k": 13, "tile_m": 1, "tile_n": 2, "threads": 128, "grouping": 3, "minblocks": 13, "algorithm": "medium", "perf": 1071.99, "source": "autotuned"},
{"m": 16, "n": 9, "k": 16, "tile_m": 1, "tile_n": 2, "threads": 160, "grouping": 4, "minblocks": 11, "algorithm": "medium", "perf": 1104.43, "source": "autotuned"},
{"m": 16, "n": 9, "k": 17, "tile_m": 1, "tile_n": 2, "threads": 160, "grouping": 3, "minblocks": 10, "algorithm": "medium", "perf": 1089.7, "source": "autotuned"},
{"m": 16, "n": 9, "k": 22, "tile_m": 3, "tile_n": 2, "threads": 32, "grouping": 3, "minblocks": 18, "algorithm": "medium", "perf": 1097.3, "source": "autotuned"},
{"m": 16, "n": 9, "k": 23, "tile_m": 1, "tile_n": 5, "threads": 32, "grouping": 3, "minblocks": 9, "algorithm": "medium", "perf": 1089.58, "source": "autotuned"},
{"m": 16, "n": 13, "k": 5, "tile_m": 1, "tile_n": 4, "threads": 96, "grouping": 12, "minblocks": 19, "algorithm": "medium", "perf": 1184.66, "source": "autotuned"},
{"m": 16, "n": 13, "k": 9, "tile_m": 1, "tile_n": 2, "threads": 128, "grouping": 4, "minblocks": 14, "algorithm": "medium", "perf": 1239.17, "source": "autotuned"},
{"m": 16, "n": 13, "k": 13, "tile_m": 1, "tile_n": 2, "threads": 224, "grouping": 4, "minblocks": 8, "algorithm": "medium", "perf": 1283.89, "source": "autotuned"},
{"m": 16, "n": 13, "k": 16, "tile_m": 2, "tile_n": 4, "threads": 32, "grouping": 3, "minblocks": 5, "algorithm": "medium", "perf": 1315.31, "source": "autotuned"},
{"m": 16, "n": 13, "k": 23, "tile_m": 1, "tile_n": 7, "threads": 32, "grouping": 2, "minblocks": 17, "algorithm": "medium", "perf": 1319.04, "source": "autotuned"},
{"m": 16, "n": 16, "k": 5, "tile_m": 1, "tile_n": 8, "threads": 32, "grouping": 8, "minblocks": 27, "algorithm": "medium", "perf": 1305.79, "source": "autotuned"},
{"m": 16, "n": 16, "k": 9, "tile_m": 1, "tile_n": 8, "threads": 32, "grouping": 3, "minblocks": 26, "algorithm": "medium", "perf": 1397.65, "source": "autotuned"},
{"m": 16, "n": 16, "k": 13, "tile_m": 2, "tile_n": 4, "threads": 32, "grouping": 3, "minblocks": 7, "algorithm": "medium", "perf": 1449.51, "source": "autotuned"},
{"m": 16, "n": 16, "k": 16, "tile_m": 1, "tile_n": 4, "threads": 128, "grouping": 3, "minblocks": 10, "algorithm": "medium", "perf": 1523.53, "source": "autotuned"},
{"m": 16, "n": 16, "k": 17, "tile_m": 2, "tile_n": 2, "threads": 64, "grouping": 3, "minblocks": 11, "algorithm": "medium", "perf": 1482.75, "source": "autotuned"},
{"m": 16, "n": 16, "k": 22, "tile_m": 1, "tile_n": 4, "threads": 128, "grouping": 3, "minblocks": 8, "algorithm": "medium", "perf": 1529.11, "source": "autotuned"},
{"m": 16, "n": 16, "k": 23, "tile_m": 2, "tile_n": 2, "threads": 64, "grouping": 3, "minblocks": 2, "algorithm": "medium", "perf": 1515.27, "source": "autotuned"},
{"m": 16, "n": 17, "k": 9, "tile_m": 1, "tile_n": 3, "threads": 160, "grouping": 4, "minblocks": 11, "algorithm": "medium", "perf": 1368.03, "source": "autotuned"},
{"m": 16, "n": 17, "k": 16, "tile_m": 1, "tile_n": 9, "threads": 32, "grouping": 2, "minblocks": 19, "algorithm": "medium", "perf": 1493.26, "source": "autotuned"},
{"m": 16, "n": 17, "k": 17, "tile_m": 1, "tile_n": 9, "threads": 32, "grouping": 2, "minblocks": 13, "algorithm": "medium", "perf": 1443.65, "source": "autotuned"},
{"m": 16, "n": 17, "k": 22, "tile_m": 2, "tile_n": 5, "threads": 32, "grouping": 2, "minblocks": 6, "algorithm": "medium", "perf": 1498.59, "source": "autotuned"},
{"m": 16, "n": 17, "k": 23, "tile_m": 2, "tile_n": 5, "threads": 32, "grouping": 2, "minblocks": 6, "algorithm": "medium", "perf": 1490.94, "source": "autotuned"},
{"m": 16, "n": 22, "k": 9, "tile_m": 1, "tile_n": 3, "threads": 224, "grouping": 5, "minblocks": 8, "algorithm": "medium", "perf": 1476.24, "source": "autotuned"},
{"m": 16, "n": 22, "k": 16, "tile_m": 1, "tile_n": 6, "threads": 64, "grouping": 3, "minblocks": 12, "algorithm": "medium", "perf": 1642.34, "source": "autotuned"},
{"m": 16, "n": 22, "k": 17, "tile_m": 2, "tile_n": 3, "threads": 96, "grouping": 3, "minblocks": 10, "algorithm": "medium", "perf": 1601.36, "source": "autotuned"},
{"m": 16, "n": 22, "k": 22, "tile_m": 2, "tile_n": 3, "threads": 64, "grouping": 2, "minblocks": 11, "algorithm": "medium", "perf": 1678.29, "source": "autotuned"},
{"m": 16, "n": 22, "k": 23, "tile_m": 2, "tile_n": 6, "threads": 32, "grouping": 2, "minblocks": 4, "algorithm": "medium", "perf": 1667.16, "source": "autotuned"},
{"m": 16, "n": 23, "k": 5, "tile_m": 1, "tile_n": 3, "threads": 128, "grouping": 5, "minblocks": 16, "algorithm": "medium", "perf": 1387.02, "source": "autotuned"},
{"m": 16, "n": 23, "k": 9, "tile_m": 1, "tile_n": 3, "threads": 160, "grouping": 5, "minblocks": 9, "algorithm": "medium", "perf": 1493.7, "source": "autotuned"},
{"m": 16, "n": 23, "k": 13, "tile_m": 1, "tile_n": 3, "threads": 224, "grouping": 3, "minblocks": 7, "algorithm": "medium", "perf": 1582.33, "source": "autotuned"},
{"m": 16, "n": 23, "k": 16, "tile_m": 1, "tile_n": 6, "threads": 64, "grouping": 2, "minblocks": 16, "algorithm": "medium", "perf": 1664.11, "source": "autotuned"},
{"m": 16, "n": 23, "k": 17, "tile_m": 1, "tile_n": 2, "threads": 288, "grouping": 3, "minblocks": 7, "algorithm": "medium", "perf": 1618.44, "source": "autotuned"},
{"m": 16, "n": 23, "k": 22, "tile_m": 2, "tile_n": 6, "threads": 32, "grouping": 2, "minblocks": 9, "algorithm": "medium", "perf": 1695.08, "source": "autotuned"},
{"m": 16, "n": 23, "k": 23, "tile_m": 4, "tile_n": 3, "threads": 32, "grouping": 2, "minblocks": 8, "algorithm": "medium", "perf": 1687.93, "source": "autotuned"},
{"m": 17, "n": 9, "k": 9, "tile_m": 3, "tile_n": 1, "threads": 96, "grouping": 4, "minblocks": 15, "algorithm": "medium", "perf": 1017.05, "source": "autotuned"},
{"m": 17, "n": 9, "k": 16, "tile_m": 3, "tile_n": 1, "threads": 160, "grouping": 6, "minblocks": 9, "algorithm": "medium", "perf": 1093.49, "source": "autotuned"},
{"m": 17, "n": 9, "k": 17, "tile_m": 3, "tile_n": 1, "threads": 160, "grouping": 3, "minblocks": 11, "algorithm": "medium", "perf": 1070.7, "source": "autotuned"},
{"m": 17, "n": 9, "k": 22, "tile_m": 3, "tile_n": 2, "threads": 32, "grouping": 3, "minblocks": 5, "algorithm": "medium", "perf": 1087.55, "source": "autotuned"},
{"m": 17, "n": 9, "k": 23, "tile_m": 3, "tile_n": 2, "threads": 32, "grouping": 3, "minblocks": 9, "algorithm": "medium", "perf": 1093.2, "source": "autotuned"},
{"m": 17, "n": 13, "k": 13, "tile_m": 3, "tile_n": 1, "threads": 224, "grouping": 4, "minblocks": 8, "algorithm": "medium", "perf": 1246.95, "source": "autotuned"},
{"m": 17, "n": 13, "k": 17, "tile_m": 9, "tile_n": 1, "threads": 32, "grouping": 3, "minblocks": 20, "algorithm": "medium", "perf": 1287.34, "source": "autotuned"},
{"m": 17, "n": 13, "k": 23, "tile_m": 9, "tile_n": 1, "threads": 32, "grouping": 2, "minblocks": 15, "algorithm": "medium", "perf": 1325.03, "source": "autotuned"},
{"m": 17, "n": 16, "k": 9, "tile_m": 9, "tile_n": 1, "threads": 32, "grouping": 3, "minblocks": 26, "algorithm": "medium", "perf": 1370.02, "source": "autotuned"},
{"m": 17, "n": 16, "k": 16, "tile_m": 9, "tile_n": 1, "threads": 32, "grouping": 2, "minblocks": 19, "algorithm": "medium", "perf": 1466.93, "source": "autotuned"},
{"m": 17, "n": 16, "k": 17, "tile_m": 9, "tile_n": 1, "threads": 32, "grouping": 3, "minblocks": 13, "algorithm": "medium", "perf": 1452.87, "source": "autotuned"},
{"m": 17, "n": 16, "k": 22, "tile_m": 9, "tile_n": 1, "threads": 32, "grouping": 2, "minblocks": 14, "algorithm": "medium", "perf": 1490.38, "source": "autotuned"},
{"m": 17, "n": 16, "k": 23, "tile_m": 9, "tile_n": 1, "threads": 32, "grouping": 2, "minblocks": 15, "algorithm": "medium", "perf": 1493.66, "source": "autotuned"},
{"m": 17, "n": 17, "k": 9, "tile_m": 3, "tile_n": 4, "threads": 32, "grouping": 13, "minblocks": 4, "algorithm": "medium", "perf": 1368.12, "source": "autotuned"},
{"m": 17, "n": 17, "k": 13, "tile_m": 3, "tile_n": 4, "threads": 32, "grouping": 3, "minblocks": 5, "algorithm": "medium", "perf": 1446.94, "source": "autotuned"},
{"m": 17, "n": 17, "k": 16, "tile_m": 3, "tile_n": 2, "threads": 64, "grouping": 3, "minblocks": 11, "algorithm": "medium", "perf": 1524.54, "source": "autotuned"},
{"m": 17, "n": 17, "k": 17, "tile_m": 3, "tile_n": 2, "threads": 64, "grouping": 3, "minblocks": 11, "algorithm": "medium", "perf": 1499.4, "source": "autotuned"},
{"m": 17, "n": 17, "k": 22, "tile_m": 3, "tile_n": 2, "threads": 128, "grouping": 3, "minblocks": 8, "algorithm": "medium", "perf": 1536.35, "source": "autotuned"},
{"m": 17, "n": 17, "k": 23, "tile_m": 3, "tile_n": 2, "threads": 128, "grouping": 3, "minblocks": 7, "algorithm": "medium", "perf": 1539.49, "source": "autotuned"},
{"m": 17, "n": 22, "k": 9, "tile_m": 3, "tile_n": 5, "threads": 32, "grouping": 3, "minblocks": 8, "algorithm": "medium", "perf": 1429.34, "source": "autotuned"},
{"m": 17, "n": 22, "k": 16, "tile_m": 5, "tile_n": 3, "threads": 32, "grouping": 3, "minblocks": 3, "algorithm": "medium", "perf": 1638.17, "source": "autotuned"},
{"m": 17, "n": 22, "k": 17, "tile_m": 9, "tile_n": 1, "threads": 64, "grouping": 2, "minblocks": 11, "algorithm": "medium", "perf": 1606.06, "source": "autotuned"},
{"m": 17, "n": 22, "k": 22, "tile_m": 3, "tile_n": 2, "threads": 96, "grouping": 2, "minblocks": 9, "algorithm": "medium", "perf": 1673.45, "source": "autotuned"},
{"m": 17, "n": 22, "k": 23, "tile_m": 3, "tile_n": 5, "threads": 32, "grouping": 2, "minblocks": 5, "algorithm": "medium", "perf": 1680.38, "source": "autotuned"},
{"m": 17, "n": 23, "k": 9, "tile_m": 3, "tile_n": 5, "threads": 32, "grouping": 3, "minblocks": 12, "algorithm": "medium", "perf": 1457.2, "source": "autotuned"},
{"m": 17, "n": 23, "k": 13, "tile_m": 3, "tile_n": 5, "threads": 32, "grouping": 3, "minblocks": 6, "algorithm": "medium", "perf": 1557.3, "source": "autotuned"},
{"m": 17, "n": 23, "k": 16, "tile_m": 10, "tile_n": 1, "threads": 64, "grouping": 3, "minblocks": 12, "algorithm": "medium", "perf": 1659.79, "source": "autotuned"},
{"m": 17, "n": 23, "k": 17, "tile_m": 3, "tile_n": 5, "threads": 32, "grouping": 3, "minblocks": 3, "algorithm": "medium", "perf": 1632.08, "source": "autotuned"},
{"m": 17, "n": 23, "k": 22, "tile_m": 3, "tile_n": 5, "threads": 32, "grouping": 2, "minblocks": 4, "algorithm": "medium", "perf": 1699.3, "source": "autotuned"},
{"m": 17, "n": 23, "k": 23, "tile_m": 3, "tile_n": 5, "threads": 32, "grouping": 2, "minblocks": 12, "algorithm": "medium", "perf": 1707.42, "source": "autotuned"},
{"m": 18, "n": 18, "k": 18, "tile_m": 3, "tile_n": 2, "threads": 64, "grouping": 3, "minblocks": 9, "algorithm": "medium", "perf": 1597.87, "source": "autotuned"},
{"m": 19, "n": 19, "k": 19, "tile_m": 2, "tile_n": 4, "threads": 64, "grouping": 3, "minblocks": 5, "algorithm": "medium", "perf": 1648.65, "source": "autotuned"},
{"m": 20, "n": 11, "k": 11, "tile_m": 1, "tile_n": 3, "threads": 128, "grouping": 4, "minblocks": 12, "algorithm": "medium", "perf": 1224.09, "source": "autotuned"},
{"m": 20, "n": 11, "k": 12, "tile_m": 1, "tile_n": 2, "threads": 160, "grouping": 4, "minblocks": 11, "algorithm": "medium", "perf": 1236.34, "source": "autotuned"},
{"m": 20, "n": 11, "k": 20, "tile_m": 1, "tile_n": 3, "threads": 224, "grouping": 3, "minblocks": 8, "algorithm": "medium", "perf": 1297.58, "source": "autotuned"},
{"m": 20, "n": 11, "k": 25, "tile_m": 1, "tile_n": 2, "threads": 288, "grouping": 3, "minblocks": 6, "algorithm": "medium", "perf": 1299.21, "source": "autotuned"},
{"m": 20, "n": 11, "k": 32, "tile_m": 2, "tile_n": 4, "threads": 32, "grouping": 2, "minblocks": 5, "algorithm": "medium", "perf": 1369.72, "source": "autotuned"},
{"m": 20, "n": 12, "k": 11, "tile_m": 1, "tile_n": 4, "threads": 224, "grouping": 4, "minblocks": 7, "algorithm": "medium", "perf": 1264.76, "source": "autotuned"},
{"m": 20, "n": 12, "k": 12, "tile_m": 1, "tile_n": 3, "threads": 160, "grouping": 4, "minblocks": 9, "algorithm": "medium", "perf": 1309.5, "source": "autotuned"},
{"m": 20, "n": 12, "k": 20, "tile_m": 1, "tile_n": 2, "threads": 256, "grouping": 3, "minblocks": 8, "algorithm": "medium", "perf": 1376.58, "source": "autotuned"},
{"m": 20, "n": 12, "k": 25, "tile_m": 10, "tile_n": 1, "threads": 32, "grouping": 2, "minblocks": 15, "algorithm": "medium", "perf": 1369.04, "source": "autotuned"},
{"m": 20, "n": 12, "k": 32, "tile_m": 2, "tile_n": 4, "threads": 32, "grouping": 2, "minblocks": 1, "algorithm": "medium", "perf": 1446.23, "source": "autotuned"},
{"m": 20, "n": 20, "k": 11, "tile_m": 1, "tile_n": 8, "threads": 64, "grouping": 3, "minblocks": 13, "algorithm": "medium", "perf": 1630.94, "source": "autotuned"},
{"m": 20, "n": 20, "k": 20, "tile_m": 1, "tile_n": 7, "threads": 64, "grouping": 3, "minblocks": 5, "algorithm": "medium", "perf": 1792.94, "source": "autotuned"},
{"m": 20, "n": 20, "k": 25, "tile_m": 1, "tile_n": 7, "threads": 128, "grouping": 2, "minblocks": 7, "algorithm": "medium", "perf": 1820.96, "source": "autotuned"},
{"m": 20, "n": 20, "k": 32, "tile_m": 1, "tile_n": 7, "threads": 64, "grouping": 2, "minblocks": 2, "algorithm": "medium", "perf": 1926.77, "source": "autotuned"},
{"m": 20, "n": 25, "k": 11, "tile_m": 10, "tile_n": 1, "threads": 64, "grouping": 3, "minblocks": 14, "algorithm": "medium", "perf": 1702.26, "source": "autotuned"},
{"m": 20, "n": 25, "k": 12, "tile_m": 1, "tile_n": 9, "threads": 64, "grouping": 3, "minblocks": 14, "algorithm": "medium", "perf": 1747.44, "source": "autotuned"},
{"m": 20, "n": 25, "k": 20, "tile_m": 1, "tile_n": 9, "threads": 64, "grouping": 2, "minblocks": 9, "algorithm": "medium", "perf": 1894.53, "source": "autotuned"},
{"m": 20, "n": 25, "k": 25, "tile_m": 1, "tile_n": 5, "threads": 128, "grouping": 3, "minblocks": 7, "algorithm": "medium", "perf": 1928.03, "source": "autotuned"},
{"m": 20, "n": 25, "k": 32, "tile_m": 1, "tile_n": 5, "threads": 160, "grouping": 2, "minblocks": 6, "algorithm": "medium", "perf": 2044.24, "source": "autotuned"},
{"m": 20, "n": 32, "k": 12, "tile_m": 1, "tile_n": 4, "threads": 256, "grouping": 5, "minblocks": 5, "algorithm": "medium", "perf": 1962.47, "source": "autotuned"},
{"m": 20, "n": 32, "k": 20, "tile_m": 10, "tile_n": 1, "threads": 64, "grouping": 2, "minblocks": 7, "algorithm": "medium", "perf": 2132.1, "source": "autotuned"},
{"m": 20, "n": 32, "k": 25, "tile_m": 10, "tile_n": 1, "threads": 128, "grouping": 3, "minblocks": 6, "algorithm": "medium", "perf": 2171.45, "source": "autotuned"},
{"m": 20, "n": 32, "k": 32, "tile_m": 10, "tile_n": 1, "threads": 64, "grouping": 2, "minblocks": 7, "algorithm": "medium", "perf": 2308.41, "source": "autotuned"},
{"m": 21, "n": 21, "k": 21, "tile_m": 3, "tile_n": 3, "threads": 64, "grouping": 3, "minblocks": 4, "algorithm": "medium", "perf": 1831.9, "source": "autotuned"},
{"m": 22, "n": 4, "k": 4, "tile_m": 1, "tile_n": 4, "threads": 32, "grouping": 8, "minblocks": 15, "algorithm": "medium", "perf": 711.621, "source": "autotuned"},
{"m": 22, "n": 4, "k": 5, "tile_m": 3, "tile_n": 1, "threads": 32, "grouping": 4, "minblocks": 6, "algorithm": "medium", "perf": 688.022, "source": "autotuned"},
{"m": 22, "n": 4, "k": 9, "tile_m": 1, "tile_n": 4, "threads": 64, "grouping": 4, "minblocks": 20, "algorithm": "medium", "perf": 675.403, "source": "autotuned"},
{"m": 22, "n": 4, "k": 13, "tile_m": 3, "tile_n": 1, "threads": 64, "grouping": 2, "minblocks": 19, "algorithm": "medium", "perf": 683.239, "source": "autotuned"},
{"m": 22, "n": 4, "k": 22, "tile_m": 3, "tile_n": 1, "threads": 96, "grouping": 3, "minblocks": 12, "algorithm": "medium", "perf": 693.792, "source": "autotuned"},
{"m": 22, "n": 4, "k": 23, "tile_m": 1, "tile_n": 2, "threads": 96, "grouping": 3, "minblocks": 1, "algorithm": "medium", "perf": 681.694, "source": "autotuned"},
{"m": 22, "n": 4, "k": 26, "tile_m": 3, "tile_n": 1, "threads": 128, "grouping": 2, "minblocks": 10, "algorithm": "medium", "perf": 689.746, "source": "autotuned"},
{"m": 22, "n": 5, "k": 4, "tile_m": 1, "tile_n": 5, "threads": 32, "grouping": 9, "minblocks": 27, "algorithm": "medium", "perf": 784.759, "source": "autotuned"},
{"m": 22, "n": 5, "k": 5, "tile_m": 1, "tile_n": 5, "threads": 32, "grouping": 4, "minblocks": 27, "algorithm": "medium", "perf": 787.494, "source": "autotuned"},
{"m": 22, "n": 5, "k": 9, "tile_m": 1, "tile_n": 5, "threads": 64, "grouping": 3, "minblocks": 20, "algorithm": "medium", "perf": 784.145, "source": "autotuned"},
{"m": 22, "n": 5, "k": 13, "tile_m": 1, "tile_n": 3, "threads": 96, "grouping": 3, "minblocks": 15, "algorithm": "medium", "perf": 781.451, "source": "autotuned"},
{"m": 22, "n": 5, "k": 22, "tile_m": 1, "tile_n": 5, "threads": 128, "grouping": 3, "minblocks": 9, "algorithm": "medium", "perf": 807.134, "source": "autotuned"},
{"m": 22, "n": 5, "k": 23, "tile_m": 1, "tile_n": 3, "threads": 128, "grouping": 3, "minblocks": 10, "algorithm": "medium", "perf": 803.426, "source": "autotuned"},
{"m": 22, "n": 5, "k": 26, "tile_m": 1, "tile_n": 3, "threads": 160, "grouping": 3, "minblocks": 7, "algorithm": "medium", "perf": 801.203, "source": "autotuned"},
{"m": 22, "n": 9, "k": 4, "tile_m": 1, "tile_n": 9, "threads": 64, "grouping": 13, "minblocks": 17, "algorithm": "medium", "perf": 1024.46, "source": "autotuned"},
{"m": 22, "n": 9, "k": 5, "tile_m": 1, "tile_n": 9, "threads": 64, "grouping": 15, "minblocks": 18, "algorithm": "medium", "perf": 1018.92, "source": "autotuned"},
{"m": 22, "n": 9, "k": 9, "tile_m": 1, "tile_n": 3, "threads": 96, "grouping": 4, "minblocks": 13, "algorithm": "medium", "perf": 1090.92, "source": "autotuned"},
{"m": 22, "n": 9, "k": 13, "tile_m": 1, "tile_n": 3, "threads": 128, "grouping": 4, "minblocks": 10, "algorithm": "medium", "perf": 1141.06, "source": "autotuned"},
{"m": 22, "n": 9, "k": 16, "tile_m": 1, "tile_n": 3, "threads": 160, "grouping": 4, "minblocks": 8, "algorithm": "medium", "perf": 1169.51, "source": "autotuned"},
{"m": 22, "n": 9, "k": 17, "tile_m": 1, "tile_n": 3, "threads": 160, "grouping": 4, "minblocks": 9, "algorithm": "medium", "perf": 1142.02, "source": "autotuned"},
{"m": 22, "n": 9, "k": 22, "tile_m": 1, "tile_n": 3, "threads": 256, "grouping": 4, "minblocks": 6, "algorithm": "medium", "perf": 1178.83, "source": "autotuned"},
{"m": 22, "n": 9, "k": 23, "tile_m": 1, "tile_n": 2, "threads": 224, "grouping": 3, "minblocks": 9, "algorithm": "medium", "perf": 1170.96, "source": "autotuned"},
{"m": 22, "n": 9, "k": 26, "tile_m": 1, "tile_n": 2, "threads": 256, "grouping": 4, "minblocks": 6, "algorithm": "medium", "perf": 1190.75, "source": "autotuned"},
{"m": 22, "n": 9, "k": 32, "tile_m": 3, "tile_n": 3, "threads": 32, "grouping": 2, "minblocks": 9, "algorithm": "medium", "perf": 1243.07, "source": "autotuned"},
{"m": 22, "n": 13, "k": 4, "tile_m": 11, "tile_n": 1, "threads": 64, "grouping": 13, "minblocks": 15, "algorithm": "medium", "perf": 1203.83, "source": "autotuned"},
{"m": 22, "n": 13, "k": 5, "tile_m": 1, "tile_n": 4, "threads": 128, "grouping": 6, "minblocks": 11, "algorithm": "medium", "perf": 1199.03, "source": "autotuned"},
{"m": 22, "n": 13, "k": 9, "tile_m": 1, "tile_n": 5, "threads": 128, "grouping": 4, "minblocks": 11, "algorithm": "medium", "perf": 1316.36, "source": "autotuned"},
{"m": 22, "n": 13, "k": 13, "tile_m": 3, "tile_n": 4, "threads": 32, "grouping": 3, "minblocks": 7, "algorithm": "medium", "perf": 1361.0, "source": "autotuned"},
{"m": 22, "n": 13, "k": 22, "tile_m": 1, "tile_n": 2, "threads": 288, "grouping": 3, "minblocks": 7, "algorithm": "medium", "perf": 1459.53, "source": "autotuned"},
{"m": 22, "n": 13, "k": 23, "tile_m": 3, "tile_n": 4, "threads": 32, "grouping": 2, "minblocks": 3, "algorithm": "medium", "perf": 1465.16, "source": "autotuned"},
{"m": 22, "n": 13, "k": 26, "tile_m": 3, "tile_n": 4, "threads": 32, "grouping": 2, "minblocks": 12, "algorithm": "medium", "perf": 1486.77, "source": "autotuned"},
{"m": 22, "n": 16, "k": 9, "tile_m": 1, "tile_n": 4, "threads": 224, "grouping": 4, "minblocks": 7, "algorithm": "medium", "perf": 1448.79, "source": "autotuned"},
{"m": 22, "n": 16, "k": 16, "tile_m": 11, "tile_n": 1, "threads": 32, "grouping": 2, "minblocks": 13, "algorithm": "medium", "perf": 1651.97, "source": "autotuned"},
{"m": 22, "n": 16, "k": 17, "tile_m": 11, "tile_n": 1, "threads": 32, "grouping": 2, "minblocks": 3, "algorithm": "medium", "perf": 1592.98, "source": "autotuned"},
{"m": 22, "n": 16, "k": 22, "tile_m": 3, "tile_n": 4, "threads": 32, "grouping": 2, "minblocks": 11, "algorithm": "medium", "perf": 1671.89, "source": "autotuned"},
{"m": 22, "n": 16, "k": 23, "tile_m": 3, "tile_n": 4, "threads": 32, "grouping": 2, "minblocks": 6, "algorithm": "medium", "perf": 1664.08, "source": "autotuned"},
{"m": 22, "n": 17, "k": 9, "tile_m": 1, "tile_n": 4, "threads": 160, "grouping": 5, "minblocks": 9, "algorithm": "medium", "perf": 1456.55, "source": "autotuned"},
{"m": 22, "n": 17, "k": 16, "tile_m": 3, "tile_n": 5, "threads": 32, "grouping": 3, "minblocks": 11, "algorithm": "medium", "perf": 1635.33, "source": "autotuned"},
{"m": 22, "n": 17, "k": 17, "tile_m": 3, "tile_n": 2, "threads": 96, "grouping": 3, "minblocks": 10, "algorithm": "medium", "perf": 1595.45, "source": "autotuned"},
{"m": 22, "n": 17, "k": 22, "tile_m": 3, "tile_n": 5, "threads": 32, "grouping": 2, "minblocks": 9, "algorithm": "medium", "perf": 1675.6, "source": "autotuned"},
{"m": 22, "n": 17, "k": 23, "tile_m": 3, "tile_n": 5, "threads": 32, "grouping": 2, "minblocks": 7, "algorithm": "medium", "perf": 1681.7, "source": "autotuned"},
{"m": 22, "n": 22, "k": 4, "tile_m": 11, "tile_n": 1, "threads": 96, "grouping": 6, "minblocks": 12, "algorithm": "medium", "perf": 1421.19, "source": "autotuned"},
{"m": 22, "n": 22, "k": 5, "tile_m": 1, "tile_n": 6, "threads": 128, "grouping": 5, "minblocks": 12, "algorithm": "medium", "perf": 1463.93, "source": "autotuned"},
{"m": 22, "n": 22, "k": 9, "tile_m": 11, "tile_n": 1, "threads": 64, "grouping": 3, "minblocks": 13, "algorithm": "medium", "perf": 1663.75, "source": "autotuned"},
{"m": 22, "n": 22, "k": 13, "tile_m": 1, "tile_n": 6, "threads": 96, "grouping": 3, "minblocks": 12, "algorithm": "medium", "perf": 1800.33, "source": "autotuned"},
{"m": 22, "n": 22, "k": 16, "tile_m": 3, "tile_n": 3, "threads": 64, "grouping": 3, "minblocks": 8, "algorithm": "medium", "perf": 1916.32, "source": "autotuned"},
{"m": 22, "n": 22, "k": 17, "tile_m": 3, "tile_n": 2, "threads": 96, "grouping": 3, "minblocks": 9, "algorithm": "medium", "perf": 1870.44, "source": "autotuned"},
{"m": 22, "n": 22, "k": 22, "tile_m": 3, "tile_n": 3, "threads": 64, "grouping": 2, "minblocks": 2, "algorithm": "medium", "perf": 1960.01, "source": "autotuned"},
{"m": 22, "n": 22, "k": 23, "tile_m": 3, "tile_n": 2, "threads": 96, "grouping": 2, "minblocks": 7, "algorithm": "medium", "perf": 1955.08, "source": "autotuned"},
{"m": 22, "n": 22, "k": 26, "tile_m": 3, "tile_n": 3, "threads": 64, "grouping": 3, "minblocks": 1, "algorithm": "medium", "perf": 1990.71, "source": "autotuned"},
{"m": 22, "n": 22, "k": 32, "tile_m": 3, "tile_n": 3, "threads": 96, "grouping": 2, "minblocks": 5, "algorithm": "medium", "perf": 2080.88, "source": "autotuned"},
{"m": 22, "n": 23, "k": 4, "tile_m": 1, "tile_n": 7, "threads": 96, "grouping": 5, "minblocks": 13, "algorithm": "medium", "perf": 1421.46, "source": "autotuned"},
{"m": 22, "n": 23, "k": 5, "tile_m": 1, "tile_n": 6, "threads": 128, "grouping": 6, "minblocks": 10, "algorithm": "medium", "perf": 1484.33, "source": "autotuned"},
{"m": 22, "n": 23, "k": 9, "tile_m": 1, "tile_n": 3, "threads": 224, "grouping": 4, "minblocks": 7, "algorithm": "medium", "perf": 1662.16, "source": "autotuned"},
{"m": 22, "n": 23, "k": 13, "tile_m": 1, "tile_n": 6, "threads": 96, "grouping": 3, "minblocks": 10, "algorithm": "medium", "perf": 1770.26, "source": "autotuned"},
{"m": 22, "n": 23, "k": 16, "tile_m": 3, "tile_n": 2, "threads": 96, "grouping": 3, "minblocks": 10, "algorithm": "medium", "perf": 1877.7, "source": "autotuned"},
{"m": 22, "n": 23, "k": 17, "tile_m": 3, "tile_n": 2, "threads": 96, "grouping": 3, "minblocks": 10, "algorithm": "medium", "perf": 1852.86, "source": "autotuned"},
{"m": 22, "n": 23, "k": 22, "tile_m": 3, "tile_n": 2, "threads": 128, "grouping": 3, "minblocks": 8, "algorithm": "medium", "perf": 1926.55, "source": "autotuned"},
{"m": 22, "n": 23, "k": 23, "tile_m": 3, "tile_n": 2, "threads": 96, "grouping": 2, "minblocks": 9, "algorithm": "medium", "perf": 1934.26, "source": "autotuned"},
{"m": 22, "n": 23, "k": 26, "tile_m": 3, "tile_n": 3, "threads": 64, "grouping": 2, "minblocks": 7, "algorithm": "medium", "perf": 1969.68, "source": "autotuned"},
{"m": 22, "n": 26, "k": 4, "tile_m": 1, "tile_n": 7, "threads": 96, "grouping": 5, "minblocks": 13, "algorithm": "medium", "perf": 1462.44, "source": "autotuned"},
{"m": 22, "n": 26, "k": 5, "tile_m": 1, "tile_n": 7, "threads": 128, "grouping": 5, "minblocks": 10, "algorithm": "medium", "perf": 1534.81, "source": "autotuned"},
{"m": 22, "n": 26, "k": 9, "tile_m": 1, "tile_n": 4, "threads": 256, "grouping": 6, "minblocks": 6, "algorithm": "medium", "perf": 1747.8, "source": "autotuned"},
{"m": 22, "n": 26, "k": 13, "tile_m": 11, "tile_n": 1, "threads": 64, "grouping": 3, "minblocks": 11, "algorithm": "medium", "perf": 1869.4, "source": "autotuned"},
{"m": 22, "n": 26, "k": 22, "tile_m": 3, "tile_n": 2, "threads": 128, "grouping": 3, "minblocks": 6, "algorithm": "medium", "perf": 2021.4, "source": "autotuned"},
{"m": 22, "n": 26, "k": 23, "tile_m": 1, "tile_n": 7, "threads": 128, "grouping": 3, "minblocks": 6, "algorithm": "medium", "perf": 2024.94, "source": "autotuned"},
{"m": 22, "n": 26, "k": 26, "tile_m": 3, "tile_n": 2, "threads": 128, "grouping": 3, "minblocks": 6, "algorithm": "medium", "perf": 2073.98, "source": "autotuned"},
{"m": 22, "n": 32, "k": 9, "tile_m": 1, "tile_n": 5, "threads": 224, "grouping": 4, "minblocks": 6, "algorithm": "medium", "perf": 1904.44, "source": "autotuned"},
{"m": 22, "n": 32, "k": 22, "tile_m": 3, "tile_n": 4, "threads": 64, "grouping": 2, "minblocks": 8, "algorithm": "medium", "perf": 2244.91, "source": "autotuned"},
{"m": 22, "n": 32, "k": 32, "tile_m": 3, "tile_n": 4, "threads": 64, "grouping": 2, "minblocks": 6, "algorithm": "medium", "perf": 2417.23, "source": "autotuned"},
{"m": 23, "n": 4, "k": 4, "tile_m": 1, "tile_n": 4, "threads": 32, "grouping": 8, "minblocks": 8, "algorithm": "medium", "perf": 697.748, "source": "autotuned"},
{"m": 23, "n": 4, "k": 5, "tile_m": 1, "tile_n": 4, "threads": 32, "grouping": 4, "minblocks": 27, "algorithm": "medium", "perf": 692.1, "source": "autotuned"},
{"m": 23, "n": 4, "k": 9, "tile_m": 1, "tile_n": 4, "threads": 64, "grouping": 4, "minblocks": 17, "algorithm": "medium", "perf": 675.284, "source": "autotuned"},
{"m": 23, "n": 4, "k": 13, "tile_m": 3, "tile_n": 1, "threads": 64, "grouping": 2, "minblocks": 20, "algorithm": "medium", "perf": 685.798, "source": "autotuned"},
{"m": 23, "n": 4, "k": 22, "tile_m": 3, "tile_n": 1, "threads": 96, "grouping": 3, "minblocks": 13, "algorithm": "medium", "perf": 689.119, "source": "autotuned"},
{"m": 23, "n": 4, "k": 23, "tile_m": 1, "tile_n": 4, "threads": 96, "grouping": 2, "minblocks": 12, "algorithm": "medium", "perf": 685.403, "source": "autotuned"},
{"m": 23, "n": 4, "k": 26, "tile_m": 3, "tile_n": 1, "threads": 128, "grouping": 3, "minblocks": 8, "algorithm": "medium", "perf": 692.026, "source": "autotuned"},
{"m": 23, "n": 5, "k": 4, "tile_m": 1, "tile_n": 5, "threads": 32, "grouping": 10, "minblocks": 9, "algorithm": "medium", "perf": 765.819, "source": "autotuned"},
{"m": 23, "n": 5, "k": 5, "tile_m": 1, "tile_n": 5, "threads": 32, "grouping": 5, "minblocks": 26, "algorithm": "medium", "perf": 770.232, "source": "autotuned"},
{"m": 23, "n": 5, "k": 9, "tile_m": 1, "tile_n": 5, "threads": 64, "grouping": 3, "minblocks": 19, "algorithm": "medium", "perf": 794.315, "source": "autotuned"},
{"m": 23, "n": 5, "k": 13, "tile_m": 1, "tile_n": 5, "threads": 96, "grouping": 4, "minblocks": 13, "algorithm": "medium", "perf": 779.905, "source": "autotuned"},
{"m": 23, "n": 5, "k": 16, "tile_m": 1, "tile_n": 5, "threads": 96, "grouping": 3, "minblocks": 10, "algorithm": "medium", "perf": 818.943, "source": "autotuned"},
{"m": 23, "n": 5, "k": 22, "tile_m": 3, "tile_n": 1, "threads": 128, "grouping": 2, "minblocks": 12, "algorithm": "medium", "perf": 803.171, "source": "autotuned"},
{"m": 23, "n": 5, "k": 23, "tile_m": 1, "tile_n": 5, "threads": 128, "grouping": 3, "minblocks": 9, "algorithm": "medium", "perf": 799.948, "source": "autotuned"},
{"m": 23, "n": 5, "k": 26, "tile_m": 1, "tile_n": 5, "threads": 160, "grouping": 4, "minblocks": 6, "algorithm": "medium", "perf": 800.518, "source": "autotuned"},
{"m": 23, "n": 9, "k": 4, "tile_m": 1, "tile_n": 9, "threads": 64, "grouping": 12, "minblocks": 17, "algorithm": "medium", "perf": 1023.81, "source": "autotuned"},
{"m": 23, "n": 9, "k": 5, "tile_m": 12, "tile_n": 1, "threads": 64, "grouping": 13, "minblocks": 15, "algorithm": "medium", "perf": 1023.47, "source": "autotuned"},
{"m": 23, "n": 9, "k": 9, "tile_m": 1, "tile_n": 9, "threads": 96, "grouping": 4, "minblocks": 11, "algorithm": "medium", "perf": 1100.22, "source": "autotuned"},
{"m": 23, "n": 9, "k": 13, "tile_m": 1, "tile_n": 3, "threads": 128, "grouping": 3, "minblocks": 12, "algorithm": "medium", "perf": 1131.5, "source": "autotuned"},
{"m": 23, "n": 9, "k": 16, "tile_m": 3, "tile_n": 1, "threads": 192, "grouping": 4, "minblocks": 8, "algorithm": "medium", "perf": 1178.32, "source": "autotuned"},
{"m": 23, "n": 9, "k": 17, "tile_m": 2, "tile_n": 2, "threads": 160, "grouping": 4, "minblocks": 8, "algorithm": "medium", "perf": 1150.36, "source": "autotuned"},
{"m": 23, "n": 9, "k": 22, "tile_m": 3, "tile_n": 3, "threads": 32, "grouping": 3, "minblocks": 3, "algorithm": "medium", "perf": 1179.45, "source": "autotuned"},
{"m": 23, "n": 9, "k": 23, "tile_m": 3, "tile_n": 3, "threads": 32, "grouping": 3, "minblocks": 1, "algorithm": "medium", "perf": 1176.02, "source": "autotuned"},
{"m": 23, "n": 9, "k": 26, "tile_m": 3, "tile_n": 3, "threads": 32, "grouping": 2, "minblocks": 6, "algorithm": "medium", "perf": 1195.58, "source": "autotuned"},
{"m": 23, "n": 13, "k": 4, "tile_m": 12, "tile_n": 1, "threads": 64, "grouping": 14, "minblocks": 15, "algorithm": "medium", "perf": 1177.19, "source": "autotuned"},
{"m": 23, "n": 13, "k": 5, "tile_m": 2, "tile_n": 3, "threads": 128, "grouping": 6, "minblocks": 12, "algorithm": "medium", "perf": 1175.8, "source": "autotuned"},
{"m": 23, "n": 13, "k": 9, "tile_m": 2, "tile_n": 2, "threads": 128, "grouping": 4, "minblocks": 12, "algorithm": "medium", "perf": 1317.59, "source": "autotuned"},
{"m": 23, "n": 13, "k": 13, "tile_m": 3, "tile_n": 4, "threads": 32, "grouping": 3, "minblocks": 16, "algorithm": "medium", "perf": 1370.54, "source": "autotuned"},
{"m": 23, "n": 13, "k": 16, "tile_m": 3, "tile_n": 2, "threads": 64, "grouping": 3, "minblocks": 11, "algorithm": "medium", "perf": 1458.25, "source": "autotuned"},
{"m": 23, "n": 13, "k": 17, "tile_m": 3, "tile_n": 4, "threads": 32, "grouping": 3, "minblocks": 10, "algorithm": "medium", "perf": 1421.47, "source": "autotuned"},
{"m": 23, "n": 13, "k": 22, "tile_m": 3, "tile_n": 4, "threads": 32, "grouping": 3, "minblocks": 9, "algorithm": "medium", "perf": 1476.23, "source": "autotuned"},
{"m": 23, "n": 13, "k": 23, "tile_m": 3, "tile_n": 4, "threads": 32, "grouping": 2, "minblocks": 5, "algorithm": "medium", "perf": 1468.44, "source": "autotuned"},
{"m": 23, "n": 13, "k": 26, "tile_m": 3, "tile_n": 4, "threads": 32, "grouping": 2, "minblocks": 4, "algorithm": "medium", "perf": 1500.18, "source": "autotuned"},
{"m": 23, "n": 16, "k": 5, "tile_m": 3, "tile_n": 1, "threads": 128, "grouping": 5, "minblocks": 13, "algorithm": "medium", "perf": 1345.94, "source": "autotuned"},
{"m": 23, "n": 16, "k": 9, "tile_m": 2, "tile_n": 2, "threads": 224, "grouping": 4, "minblocks": 9, "algorithm": "medium", "perf": 1472.9, "source": "autotuned"},
{"m": 23, "n": 16, "k": 13, "tile_m": 3, "tile_n": 1, "threads": 224, "grouping": 3, "minblocks": 8, "algorithm": "medium", "perf": 1560.32, "source": "autotuned"},
{"m": 23, "n": 16, "k": 16, "tile_m": 12, "tile_n": 1, "threads": 32, "grouping": 2, "minblocks": 15, "algorithm": "medium", "perf": 1649.82, "source": "autotuned"},
{"m": 23, "n": 16, "k": 17, "tile_m": 3, "tile_n": 4, "threads": 32, "grouping": 2, "minblocks": 6, "algorithm": "medium", "perf": 1621.65, "source": "autotuned"},
{"m": 23, "n": 16, "k": 22, "tile_m": 3, "tile_n": 4, "threads": 32, "grouping": 2, "minblocks": 6, "algorithm": "medium", "perf": 1694.73, "source": "autotuned"},
{"m": 23, "n": 16, "k": 23, "tile_m": 3, "tile_n": 4, "threads": 32, "grouping": 2, "minblocks": 1, "algorithm": "medium", "perf": 1691.64, "source": "autotuned"},
{"m": 23, "n": 17, "k": 9, "tile_m": 2, "tile_n": 2, "threads": 224, "grouping": 4, "minblocks": 8, "algorithm": "medium", "perf": 1469.57, "source": "autotuned"},
{"m": 23, "n": 17, "k": 13, "tile_m": 3, "tile_n": 5, "threads": 32, "grouping": 3, "minblocks": 9, "algorithm": "medium", "perf": 1559.69, "source": "autotuned"},
{"m": 23, "n": 17, "k": 16, "tile_m": 3, "tile_n": 5, "threads": 32, "grouping": 3, "minblocks": 4, "algorithm": "medium", "perf": 1653.36, "source": "autotuned"},
{"m": 23, "n": 17, "k": 17, "tile_m": 3, "tile_n": 5, "threads": 32, "grouping": 3, "minblocks": 10, "algorithm": "medium", "perf": 1624.37, "source": "autotuned"},
{"m": 23, "n": 17, "k": 22, "tile_m": 3, "tile_n": 5, "threads": 32, "grouping": 2, "minblocks": 7, "algorithm": "medium", "perf": 1698.96, "source": "autotuned"},
{"m": 23, "n": 17, "k": 23, "tile_m": 3, "tile_n": 5, "threads": 32, "grouping": 2, "minblocks": 7, "algorithm": "medium", "perf": 1701.82, "source": "autotuned"},
{"m": 23, "n": 22, "k": 4, "tile_m": 3, "tile_n": 2, "threads": 96, "grouping": 6, "minblocks": 13, "algorithm": "medium", "perf": 1410.89, "source": "autotuned"},
{"m": 23, "n": 22, "k": 5, "tile_m": 3, "tile_n": 2, "threads": 128, "grouping": 6, "minblocks": 9, "algorithm": "medium", "perf": 1455.1, "source": "autotuned"},
{"m": 23, "n": 22, "k": 9, "tile_m": 2, "tile_n": 2, "threads": 224, "grouping": 4, "minblocks": 7, "algorithm": "medium", "perf": 1654.71, "source": "autotuned"},
{"m": 23, "n": 22, "k": 13, "tile_m": 12, "tile_n": 1, "threads": 64, "grouping": 3, "minblocks": 11, "algorithm": "medium", "perf": 1752.81, "source": "autotuned"},
{"m": 23, "n": 22, "k": 16, "tile_m": 3, "tile_n": 2, "threads": 96, "grouping": 3, "minblocks": 10, "algorithm": "medium", "perf": 1880.75, "source": "autotuned"},
{"m": 23, "n": 22, "k": 17, "tile_m": 3, "tile_n": 3, "threads": 64, "grouping": 3, "minblocks": 2, "algorithm": "medium", "perf": 1844.78, "source": "autotuned"},
{"m": 23, "n": 22, "k": 22, "tile_m": 3, "tile_n": 2, "threads": 96, "grouping": 3, "minblocks": 7, "algorithm": "medium", "perf": 1925.66, "source": "autotuned"},
{"m": 23, "n": 22, "k": 23, "tile_m": 3, "tile_n": 3, "threads": 64, "grouping": 2, "minblocks": 8, "algorithm": "medium", "perf": 1921.8, "source": "autotuned"},
{"m": 23, "n": 22, "k": 26, "tile_m": 3, "tile_n": 3, "threads": 64, "grouping": 2, "minblocks": 8, "algorithm": "medium", "perf": 1986.83, "source": "autotuned"},
{"m": 23, "n": 23, "k": 4, "tile_m": 3, "tile_n": 2, "threads": 96, "grouping": 6, "minblocks": 4, "algorithm": "medium", "perf": 1404.74, "source": "autotuned"},
{"m": 23, "n": 23, "k": 5, "tile_m": 2, "tile_n": 5, "threads": 64, "grouping": 5, "minblocks": 16, "algorithm": "medium", "perf": 1489.35, "source": "autotuned"},
{"m": 23, "n": 23, "k": 9, "tile_m": 3, "tile_n": 2, "threads": 128, "grouping": 4, "minblocks": 10, "algorithm": "medium", "perf": 1725.75, "source": "autotuned"},
{"m": 23, "n": 23, "k": 13, "tile_m": 3, "tile_n": 3, "threads": 64, "grouping": 3, "minblocks": 8, "algorithm": "medium", "perf": 1867.64, "source": "autotuned"},
{"m": 23, "n": 23, "k": 16, "tile_m": 3, "tile_n": 3, "threads": 64, "grouping": 3, "minblocks": 3, "algorithm": "medium", "perf": 1969.45, "source": "autotuned"},
{"m": 23, "n": 23, "k": 17, "tile_m": 3, "tile_n": 2, "threads": 128, "grouping": 3, "minblocks": 7, "algorithm": "medium", "perf": 1941.68, "source": "autotuned"},
{"m": 23, "n": 23, "k": 22, "tile_m": 3, "tile_n": 2, "threads": 128, "grouping": 2, "minblocks": 7, "algorithm": "medium", "perf": 2026.63, "source": "autotuned"},
{"m": 23, "n": 23, "k": 23, "tile_m": 3, "tile_n": 2, "threads": 128, "grouping": 2, "minblocks": 7, "algorithm": "medium", "perf": 2028.24, "source": "autotuned"},
{"m": 23, "n": 23, "k": 26, "tile_m": 3, "tile_n": 3, "threads": 64, "grouping": 2, "minblocks": 1, "algorithm": "medium", "perf": 2065.19, "source": "autotuned"},
{"m": 23, "n": 26, "k": 4, "tile_m": 3, "tile_n": 2, "threads": 128, "grouping": 6, "minblocks": 10, "algorithm": "medium", "perf": 1471.74, "source": "autotuned"},
{"m": 23, "n": 26, "k": 5, "tile_m": 12, "tile_n": 1, "threads": 128, "grouping": 6, "minblocks": 8, "algorithm": "medium", "perf": 1522.69, "source": "autotuned"},
{"m": 23, "n": 26, "k": 9, "tile_m": 2, "tile_n": 2, "threads": 256, "grouping": 4, "minblocks": 7, "algorithm": "medium", "perf": 1743.61, "source": "autotuned"},
{"m": 23, "n": 26, "k": 13, "tile_m": 12, "tile_n": 1, "threads": 64, "grouping": 3, "minblocks": 12, "algorithm": "medium", "perf": 1884.43, "source": "autotuned"},
{"m": 23, "n": 26, "k": 22, "tile_m": 3, "tile_n": 4, "threads": 64, "grouping": 2, "minblocks": 8, "algorithm": "medium", "perf": 2067.9, "source": "autotuned"},
{"m": 23, "n": 26, "k": 23, "tile_m": 3, "tile_n": 2, "threads": 128, "grouping": 3, "minblocks": 6, "algorithm": "medium", "perf": 2073.49, "source": "autotuned"},
{"m": 23, "n": 26, "k": 26, "tile_m": 3, "tile_n": 2, "threads": 128, "grouping": 2, "minblocks": 6, "algorithm": "medium", "perf": 2115.65, "source": "autotuned"},
{"m": 24, "n": 5, "k": 5, "tile_m": 1, "tile_n": 5, "threads": 32, "grouping": 4, "minblocks": 26, "algorithm": "medium", "perf": 796.427, "source": "autotuned"},
{"m": 24, "n": 5, "k": 13, "tile_m": 1, "tile_n": 3, "threads": 96, "grouping": 2, "minblocks": 14, "algorithm": "medium", "perf": 807.706, "source": "autotuned"},
{"m": 24, "n": 5, "k": 24, "tile_m": 3, "tile_n": 2, "threads": 128, "grouping": 3, "minblocks": 8, "algorithm": "medium", "perf": 835.528, "source": "autotuned"},
{"m": 24, "n": 5, "k": 26, "tile_m": 1, "tile_n": 2, "threads": 160, "grouping": 4, "minblocks": 5, "algorithm": "medium", "perf": 823.042, "source": "autotuned"},
{"m": 24, "n": 5, "k": 32, "tile_m": 1, "tile_n": 1, "threads": 192, "grouping": 3, "minblocks": 1, "algorithm": "medium", "perf": 841.384, "source": "autotuned"},
{"m": 24, "n": 13, "k": 5, "tile_m": 1, "tile_n": 3, "threads": 128, "grouping": 5, "minblocks": 14, "algorithm": "medium", "perf": 1250.39, "source": "autotuned"},
{"m": 24, "n": 13, "k": 13, "tile_m": 1, "tile_n": 3, "threads": 192, "grouping": 4, "minblocks": 8, "algorithm": "medium", "perf": 1424.6, "source": "autotuned"},
{"m": 24, "n": 13, "k": 24, "tile_m": 3, "tile_n": 4, "threads": 32, "grouping": 2, "minblocks": 12, "algorithm": "medium", "perf": 1553.58, "source": "autotuned"},
{"m": 24, "n": 13, "k": 26, "tile_m": 3, "tile_n": 4, "threads": 32, "grouping": 2, "minblocks": 7, "algorithm": "medium", "perf": 1549.36, "source": "autotuned"},
{"m": 24, "n": 13, "k": 32, "tile_m": 3, "tile_n": 2, "threads": 64, "grouping": 2, "minblocks": 2, "algorithm": "medium", "perf": 1611.52, "source": "autotuned"},
{"m": 24, "n": 24, "k": 5, "tile_m": 1, "tile_n": 6, "threads": 128, "grouping": 4, "minblocks": 12, "algorithm": "medium", "perf": 1593.42, "source": "autotuned"},
{"m": 24, "n": 24, "k": 13, "tile_m": 1, "tile_n": 6, "threads": 128, "grouping": 3, "minblocks": 9, "algorithm": "medium", "perf": 1983.67, "source": "autotuned"},
{"m": 24, "n": 24, "k": 24, "tile_m": 3, "tile_n": 3, "threads": 64, "grouping": 2, "minblocks": 1, "algorithm": "medium", "perf": 2213.95, "source": "autotuned"},
{"m": 24, "n": 24, "k": 26, "tile_m": 3, "tile_n": 3, "threads": 64, "grouping": 2, "minblocks": 6, "algorithm": "medium", "perf": 2211.71, "source": "autotuned"},
{"m": 24, "n": 24, "k": 32, "tile_m": 3, "tile_n": 2, "threads": 128, "grouping": 2, "minblocks": 5, "algorithm": "medium", "perf": 2310.88, "source": "autotuned"},
{"m": 24, "n": 26, "k": 5, "tile_m": 1, "tile_n": 6, "threads": 128, "grouping": 5, "minblocks": 10, "algorithm": "medium", "perf": 1612.07, "source": "autotuned"},
{"m": 24, "n": 26, "k": 13, "tile_m": 1, "tile_n": 7, "threads": 96, "grouping": 3, "minblocks": 10, "algorithm": "medium", "perf": 1965.73, "source": "autotuned"},
{"m": 24, "n": 26, "k": 24, "tile_m": 1, "tile_n": 6, "threads": 128, "grouping": 3, "minblocks": 6, "algorithm": "medium", "perf": 2194.44, "source": "autotuned"},
{"m": 24, "n": 26, "k": 26, "tile_m": 1, "tile_n": 7, "threads": 128, "grouping": 2, "minblocks": 7, "algorithm": "medium", "perf": 2182.89, "source": "autotuned"},
{"m": 24, "n": 26, "k": 32, "tile_m": 3, "tile_n": 4, "threads": 64, "grouping": 2, "minblocks": 3, "algorithm": "medium", "perf": 2311.83, "source": "autotuned"},
{"m": 24, "n": 32, "k": 5, "tile_m": 1, "tile_n": 4, "threads": 192, "grouping": 5, "minblocks": 7, "algorithm": "medium", "perf": 1756.65, "source": "autotuned"},
{"m": 24, "n": 32, "k": 13, "tile_m": 12, "tile_n": 1, "threads": 64, "grouping": 3, "minblocks": 9, "algorithm": "medium", "perf": 2142.55, "source": "autotuned"},
{"m": 24, "n": 32, "k": 24, "tile_m": 3, "tile_n": 2, "threads": 128, "grouping": 2, "minblocks": 7, "algorithm": "medium", "perf": 2451.83, "source": "autotuned"},
{"m": 24, "n": 32, "k": 26, "tile_m": 3, "tile_n": 4, "threads": 64, "grouping": 3, "minblocks": 2, "algorithm": "medium", "perf": 2431.93, "source": "autotuned"},
{"m": 24, "n": 32, "k": 32, "tile_m": 3, "tile_n": 4, "threads": 64, "grouping": 2, "minblocks": 3, "algorithm": "medium", "perf": 2560.8, "source": "autotuned"},
{"m": 25, "n": 4, "k": 4, "tile_m": 1, "tile_n": 4, "threads": 32, "grouping": 9, "minblocks": 20, "algorithm": "medium", "perf": 688.492, "source": "autotuned"},
{"m": 25, "n": 4, "k": 5, "tile_m": 1, "tile_n": 4, "threads": 32, "grouping": 4, "minblocks": 26, "algorithm": "medium", "perf": 677.205, "source": "autotuned"},
{"m": 25, "n": 4, "k": 7, "tile_m": 1, "tile_n": 4, "threads": 32, "grouping": 3, "minblocks": 26, "algorithm": "medium", "perf": 692.721, "source": "autotuned"},
{"m": 25, "n": 4, "k": 9, "tile_m": 1, "tile_n": 4, "threads": 64, "grouping": 3, "minblocks": 22, "algorithm": "medium", "perf": 684.905, "source": "autotuned"},
{"m": 25, "n": 4, "k": 13, "tile_m": 1, "tile_n": 4, "threads": 64, "grouping": 2, "minblocks": 19, "algorithm": "medium", "perf": 692.688, "source": "autotuned"},
{"m": 25, "n": 4, "k": 25, "tile_m": 1, "tile_n": 4, "threads": 128, "grouping": 2, "minblocks": 10, "algorithm": "medium", "perf": 691.588, "source": "autotuned"},
{"m": 25, "n": 4, "k": 26, "tile_m": 1, "tile_n": 2, "threads": 128, "grouping": 3, "minblocks": 6, "algorithm": "medium", "perf": 694.661, "source": "autotuned"},
{"m": 25, "n": 4, "k": 28, "tile_m": 1, "tile_n": 2, "threads": 128, "grouping": 3, "minblocks": 2, "algorithm": "medium", "perf": 696.043, "source": "autotuned"},
{"m": 25, "n": 4, "k": 32, "tile_m": 1, "tile_n": 2, "threads": 192, "grouping": 3, "minblocks": 3, "algorithm": "medium", "perf": 711.123, "source": "autotuned"},
{"m": 25, "n": 4, "k": 45, "tile_m": 1, "tile_n": 2, "threads": 192, "grouping": 2, "minblocks": 6, "algorithm": "medium", "perf": 704.519, "source": "autotuned"},
{"m": 25, "n": 5, "k": 4, "tile_m": 1, "tile_n": 5, "threads": 32, "grouping": 9, "minblocks": 23, "algorithm": "medium", "perf": 784.633, "source": "autotuned"},
{"m": 25, "n": 5, "k": 5, "tile_m": 1, "tile_n": 5, "threads": 32, "grouping": 9, "minblocks": 24, "algorithm": "medium", "perf": 770.704, "source": "autotuned"},
{"m": 25, "n": 5, "k": 7, "tile_m": 1, "tile_n": 5, "threads": 64, "grouping": 3, "minblocks": 23, "algorithm": "medium", "perf": 779.902, "source": "autotuned"},
{"m": 25, "n": 5, "k": 9, "tile_m": 1, "tile_n": 5, "threads": 64, "grouping": 3, "minblocks": 17, "algorithm": "medium", "perf": 794.332, "source": "autotuned"},
{"m": 25, "n": 5, "k": 13, "tile_m": 1, "tile_n": 5, "threads": 96, "grouping": 3, "minblocks": 13, "algorithm": "medium", "perf": 797.264, "source": "autotuned"},
{"m": 25, "n": 5, "k": 25, "tile_m": 1, "tile_n": 5, "threads": 128, "grouping": 2, "minblocks": 9, "algorithm": "medium", "perf": 822.625, "source": "autotuned"},
{"m": 25, "n": 5, "k": 26, "tile_m": 1, "tile_n": 5, "threads": 160, "grouping": 2, "minblocks": 7, "algorithm": "medium", "perf": 808.442, "source": "autotuned"},
{"m": 25, "n": 5, "k": 28, "tile_m": 1, "tile_n": 5, "threads": 160, "grouping": 3, "minblocks": 7, "algorithm": "medium", "perf": 814.46, "source": "autotuned"},
{"m": 25, "n": 5, "k": 32, "tile_m": 1, "tile_n": 3, "threads": 192, "grouping": 3, "minblocks": 6, "algorithm": "medium", "perf": 844.859, "source": "autotuned"},
{"m": 25, "n": 5, "k": 45, "tile_m": 1, "tile_n": 5, "threads": 256, "grouping": 3, "minblocks": 4, "algorithm": "medium", "perf": 832.032, "source": "autotuned"},
{"m": 25, "n": 7, "k": 4, "tile_m": 1, "tile_n": 7, "threads": 32, "grouping": 9, "minblocks": 21, "algorithm": "medium", "perf": 951.384, "source": "autotuned"},
{"m": 25, "n": 7, "k": 5, "tile_m": 1, "tile_n": 7, "threads": 64, "grouping": 11, "minblocks": 19, "algorithm": "medium", "perf": 920.51, "source": "autotuned"},
{"m": 25, "n": 7, "k": 7, "tile_m": 1, "tile_n": 7, "threads": 64, "grouping": 10, "minblocks": 19, "algorithm": "medium", "perf": 947.852, "source": "autotuned"},
{"m": 25, "n": 7, "k": 9, "tile_m": 1, "tile_n": 7, "threads": 64, "grouping": 3, "minblocks": 17, "algorithm": "medium", "perf": 970.814, "source": "autotuned"},
{"m": 25, "n": 7, "k": 13, "tile_m": 1, "tile_n": 7, "threads": 96, "grouping": 3, "minblocks": 12, "algorithm": "medium", "perf": 996.022, "source": "autotuned"},
{"m": 25, "n": 7, "k": 25, "tile_m": 3, "tile_n": 1, "threads": 192, "grouping": 3, "minblocks": 6, "algorithm": "medium", "perf": 1030.87, "source": "autotuned"},
{"m": 25, "n": 7, "k": 26, "tile_m": 3, "tile_n": 1, "threads": 192, "grouping": 3, "minblocks": 6, "algorithm": "medium", "perf": 1040.72, "source": "autotuned"},
{"m": 25, "n": 7, "k": 28, "tile_m": 3, "tile_n": 1, "threads": 256, "grouping": 3, "minblocks": 6, "algorithm": "medium", "perf": 1041.99, "source": "autotuned"},
{"m": 25, "n": 7, "k": 32, "tile_m": 1, "tile_n": 7, "threads": 32, "grouping": 2, "minblocks": 9, "algorithm": "medium", "perf": 1078.37, "source": "autotuned"},
{"m": 25, "n": 7, "k": 45, "tile_m": 3, "tile_n": 1, "threads": 320, "grouping": 3, "minblocks": 4, "algorithm": "medium", "perf": 1067.21, "source": "autotuned"},
{"m": 25, "n": 9, "k": 4, "tile_m": 1, "tile_n": 9, "threads": 64, "grouping": 13, "minblocks": 16, "algorithm": "medium", "perf": 1018.77, "source": "autotuned"},
{"m": 25, "n": 9, "k": 5, "tile_m": 1, "tile_n": 9, "threads": 64, "grouping": 10, "minblocks": 19, "algorithm": "medium", "perf": 1031.57, "source": "autotuned"},
{"m": 25, "n": 9, "k": 7, "tile_m": 1, "tile_n": 9, "threads": 64, "grouping": 4, "minblocks": 17, "algorithm": "medium", "perf": 1090.63, "source": "autotuned"},
{"m": 25, "n": 9, "k": 9, "tile_m": 1, "tile_n": 9, "threads": 96, "grouping": 4, "minblocks": 12, "algorithm": "medium", "perf": 1110.54, "source": "autotuned"},
{"m": 25, "n": 9, "k": 13, "tile_m": 1, "tile_n": 3, "threads": 128, "grouping": 4, "minblocks": 11, "algorithm": "medium", "perf": 1161.08, "source": "autotuned"},
{"m": 25, "n": 9, "k": 25, "tile_m": 1, "tile_n": 3, "threads": 256, "grouping": 3, "minblocks": 6, "algorithm": "medium", "perf": 1218.26, "source": "autotuned"},
{"m": 25, "n": 9, "k": 26, "tile_m": 1, "tile_n": 3, "threads": 256, "grouping": 3, "minblocks": 5, "algorithm": "medium", "perf": 1219.13, "source": "autotuned"},
{"m": 25, "n": 9, "k": 28, "tile_m": 1, "tile_n": 3, "threads": 256, "grouping": 4, "minblocks": 5, "algorithm": "medium", "perf": 1243.81, "source": "autotuned"},
{"m": 25, "n": 9, "k": 32, "tile_m": 3, "tile_n": 3, "threads": 32, "grouping": 2, "minblocks": 6, "algorithm": "medium", "perf": 1281.24, "source": "autotuned"},
{"m": 25, "n": 9, "k": 45, "tile_m": 1, "tile_n": 3, "threads": 416, "grouping": 4, "minblocks": 3, "algorithm": "medium", "perf": 1264.33, "source": "autotuned"},
{"m": 25, "n": 11, "k": 11, "tile_m": 1, "tile_n": 4, "threads": 128, "grouping": 4, "minblocks": 9, "algorithm": "medium", "perf": 1260.81, "source": "autotuned"},
{"m": 25, "n": 11, "k": 12, "tile_m": 5, "tile_n": 1, "threads": 160, "grouping": 4, "minblocks": 8, "algorithm": "medium", "perf": 1273.55, "source": "autotuned"},
{"m": 25, "n": 11, "k": 20, "tile_m": 5, "tile_n": 2, "threads": 32, "grouping": 3, "minblocks": 2, "algorithm": "medium", "perf": 1350.23, "source": "autotuned"},
{"m": 25, "n": 11, "k": 25, "tile_m": 5, "tile_n": 2, "threads": 32, "grouping": 2, "minblocks": 12, "algorithm": "medium", "perf": 1377.63, "source": "autotuned"},
{"m": 25, "n": 11, "k": 32, "tile_m": 5, "tile_n": 2, "threads": 64, "grouping": 2, "minblocks": 8, "algorithm": "medium", "perf": 1452.92, "source": "autotuned"},
{"m": 25, "n": 12, "k": 11, "tile_m": 5, "tile_n": 1, "threads": 160, "grouping": 4, "minblocks": 8, "algorithm": "medium", "perf": 1311.32, "source": "autotuned"},
{"m": 25, "n": 12, "k": 12, "tile_m": 1, "tile_n": 3, "threads": 160, "grouping": 4, "minblocks": 9, "algorithm": "medium", "perf": 1355.85, "source": "autotuned"},
{"m": 25, "n": 12, "k": 20, "tile_m": 1, "tile_n": 4, "threads": 256, "grouping": 4, "minblocks": 5, "algorithm": "medium", "perf": 1439.07, "source": "autotuned"},
{"m": 25, "n": 13, "k": 4, "tile_m": 1, "tile_n": 7, "threads": 64, "grouping": 13, "minblocks": 17, "algorithm": "medium", "perf": 1172.24, "source": "autotuned"},
{"m": 25, "n": 13, "k": 5, "tile_m": 1, "tile_n": 5, "threads": 128, "grouping": 6, "minblocks": 12, "algorithm": "medium", "perf": 1201.28, "source": "autotuned"},
{"m": 25, "n": 13, "k": 7, "tile_m": 3, "tile_n": 2, "threads": 96, "grouping": 4, "minblocks": 12, "algorithm": "medium", "perf": 1288.33, "source": "autotuned"},
{"m": 25, "n": 13, "k": 9, "tile_m": 1, "tile_n": 5, "threads": 128, "grouping": 4, "minblocks": 11, "algorithm": "medium", "perf": 1349.59, "source": "autotuned"},
{"m": 25, "n": 13, "k": 13, "tile_m": 1, "tile_n": 3, "threads": 192, "grouping": 4, "minblocks": 8, "algorithm": "medium", "perf": 1380.55, "source": "autotuned"},
{"m": 25, "n": 13, "k": 14, "tile_m": 1, "tile_n": 3, "threads": 192, "grouping": 3, "minblocks": 10, "algorithm": "medium", "perf": 1408.24, "source": "autotuned"},
{"m": 25, "n": 13, "k": 25, "tile_m": 3, "tile_n": 2, "threads": 128, "grouping": 3, "minblocks": 8, "algorithm": "medium", "perf": 1523.91, "source": "autotuned"},
{"m": 25, "n": 13, "k": 26, "tile_m": 3, "tile_n": 2, "threads": 96, "grouping": 2, "minblocks": 8, "algorithm": "medium", "perf": 1512.28, "source": "autotuned"},
{"m": 25, "n": 13, "k": 28, "tile_m": 3, "tile_n": 2, "threads": 96, "grouping": 3, "minblocks": 6, "algorithm": "medium", "perf": 1543.2, "source": "autotuned"},
{"m": 25, "n": 13, "k": 32, "tile_m": 7, "tile_n": 2, "threads": 32, "grouping": 2, "minblocks": 10, "algorithm": "medium", "perf": 1604.12, "source": "autotuned"},
{"m": 25, "n": 13, "k": 45, "tile_m": 3, "tile_n": 2, "threads": 64, "grouping": 2, "minblocks": 6, "algorithm": "medium", "perf": 1600.38, "source": "autotuned"},
{"m": 25, "n": 14, "k": 13, "tile_m": 1, "tile_n": 3, "threads": 192, "grouping": 4, "minblocks": 8, "algorithm": "medium", "perf": 1451.35, "source": "autotuned"},
{"m": 25, "n": 14, "k": 14, "tile_m": 1, "tile_n": 3, "threads": 224, "grouping": 3, "minblocks": 7, "algorithm": "medium", "perf": 1482.32, "source": "autotuned"},
{"m": 25, "n": 14, "k": 26, "tile_m": 3, "tile_n": 2, "threads": 96, "grouping": 3, "minblocks": 8, "algorithm": "medium", "perf": 1595.12, "source": "autotuned"},
{"m": 25, "n": 14, "k": 32, "tile_m": 3, "tile_n": 2, "threads": 64, "grouping": 2, "minblocks": 2, "algorithm": "medium", "perf": 1680.53, "source": "autotuned"},
{"m": 25, "n": 20, "k": 11, "tile_m": 1, "tile_n": 4, "threads": 288, "grouping": 4, "minblocks": 7, "algorithm": "medium", "perf": 1691.1, "source": "autotuned"},
{"m": 25, "n": 20, "k": 12, "tile_m": 1, "tile_n": 4, "threads": 320, "grouping": 5, "minblocks": 6, "algorithm": "medium", "perf": 1720.72, "source": "autotuned"},
{"m": 25, "n": 20, "k": 20, "tile_m": 3, "tile_n": 3, "threads": 64, "grouping": 3, "minblocks": 3, "algorithm": "medium", "perf": 1886.91, "source": "autotuned"},
{"m": 25, "n": 20, "k": 25, "tile_m": 3, "tile_n": 2, "threads": 96, "grouping": 3, "minblocks": 6, "algorithm": "medium", "perf": 1909.19, "source": "autotuned"},
{"m": 25, "n": 20, "k": 32, "tile_m": 3, "tile_n": 3, "threads": 64, "grouping": 3, "minblocks": 4, "algorithm": "medium", "perf": 2038.68, "source": "autotuned"},
{"m": 25, "n": 25, "k": 4, "tile_m": 1, "tile_n": 5, "threads": 128, "grouping": 6, "minblocks": 12, "algorithm": "medium", "perf": 1485.73, "source": "autotuned"},
{"m": 25, "n": 25, "k": 5, "tile_m": 1, "tile_n": 5, "threads": 128, "grouping": 5, "minblocks": 12, "algorithm": "medium", "perf": 1575.59, "source": "autotuned"},
{"m": 25, "n": 25, "k": 7, "tile_m": 1, "tile_n": 9, "threads": 96, "grouping": 4, "minblocks": 11, "algorithm": "medium", "perf": 1702.42, "source": "autotuned"},
{"m": 25, "n": 25, "k": 9, "tile_m": 3, "tile_n": 4, "threads": 64, "grouping": 4, "minblocks": 2, "algorithm": "medium", "perf": 1812.74, "source": "autotuned"},
{"m": 25, "n": 25, "k": 11, "tile_m": 3, "tile_n": 4, "threads": 64, "grouping": 3, "minblocks": 1, "algorithm": "medium", "perf": 1890.71, "source": "autotuned"},
{"m": 25, "n": 25, "k": 12, "tile_m": 5, "tile_n": 3, "threads": 64, "grouping": 3, "minblocks": 1, "algorithm": "medium", "perf": 1953.74, "source": "autotuned"},
{"m": 25, "n": 25, "k": 13, "tile_m": 3, "tile_n": 5, "threads": 64, "grouping": 3, "minblocks": 6, "algorithm": "medium", "perf": 1968.88, "source": "autotuned"},
{"m": 25, "n": 25, "k": 14, "tile_m": 3, "tile_n": 4, "threads": 64, "grouping": 3, "minblocks": 5, "algorithm": "medium", "perf": 2006.28, "source": "autotuned"},
{"m": 25, "n": 25, "k": 20, "tile_m": 3, "tile_n": 4, "threads": 64, "grouping": 3, "minblocks": 4, "algorithm": "medium", "perf": 2131.35, "source": "autotuned"},
{"m": 25, "n": 25, "k": 25, "tile_m": 3, "tile_n": 4, "threads": 64, "grouping": 3, "minblocks": 3, "algorithm": "medium", "perf": 2191.41, "source": "autotuned"},
{"m": 25, "n": 25, "k": 26, "tile_m": 3, "tile_n": 4, "threads": 96, "grouping": 3, "minblocks": 2, "algorithm": "medium", "perf": 2199.01, "source": "autotuned"},
{"m": 25, "n": 25, "k": 28, "tile_m": 3, "tile_n": 3, "threads": 128, "grouping": 3, "minblocks": 1, "algorithm": "medium", "perf": 2205.83, "source": "autotuned"},
{"m": 25, "n": 25, "k": 32, "tile_m": 3, "tile_n": 3, "threads": 128, "grouping": 3, "minblocks": 2, "algorithm": "medium", "perf": 2298.51, "source": "autotuned"},
{"m": 25, "n": 25, "k": 45, "tile_m": 3, "tile_n": 3, "threads": 128, "grouping": 3, "minblocks": 1, "algorithm": "medium", "perf": 2299.51, "source": "autotuned"},
{"m": 25, "n": 26, "k": 4, "tile_m": 1, "tile_n": 9, "threads": 128, "grouping": 6, "minblocks": 9, "algorithm": "medium", "perf": 1505.1, "source": "autotuned"},
{"m": 25, "n": 26, "k": 5, "tile_m": 1, "tile_n": 9, "threads": 160, "grouping": 6, "minblocks": 8, "algorithm": "medium", "perf": 1562.99, "source": "autotuned"},
{"m": 25, "n": 26, "k": 7, "tile_m": 3, "tile_n": 2, "threads": 192, "grouping": 5, "minblocks": 8, "algorithm": "medium", "perf": 1727.51, "source": "autotuned"},
{"m": 25, "n": 26, "k": 9, "tile_m": 3, "tile_n": 2, "threads": 256, "grouping": 5, "minblocks": 6, "algorithm": "medium", "perf": 1769.71, "source": "autotuned"},
{"m": 25, "n": 26, "k": 13, "tile_m": 3, "tile_n": 4, "threads": 64, "grouping": 3, "minblocks": 3, "algorithm": "medium", "perf": 1923.39, "source": "autotuned"},
{"m": 25, "n": 26, "k": 14, "tile_m": 3, "tile_n": 4, "threads": 64, "grouping": 3, "minblocks": 3, "algorithm": "medium", "perf": 1957.32, "source": "autotuned"},
{"m": 25, "n": 26, "k": 25, "tile_m": 3, "tile_n": 4, "threads": 64, "grouping": 3, "minblocks": 4, "algorithm": "medium", "perf": 2161.58, "source": "autotuned"},
{"m": 25, "n": 26, "k": 26, "tile_m": 3, "tile_n": 4, "threads": 64, "grouping": 3, "minblocks": 1, "algorithm": "medium", "perf": 2159.22, "source": "autotuned"},
{"m": 25, "n": 26, "k": 28, "tile_m": 3, "tile_n": 4, "threads": 64, "grouping": 2, "minblocks": 1, "algorithm": "medium", "perf": 2202.3, "source": "autotuned"},
{"m": 25, "n": 26, "k": 32, "tile_m": 3, "tile_n": 4, "threads": 64, "grouping": 2, "minblocks": 1, "algorithm": "medium", "perf": 2305.68, "source": "autotuned"},
{"m": 25, "n": 26, "k": 45, "tile_m": 3, "tile_n": 4, "threads": 64, "grouping": 2, "minblocks": 5, "algorithm": "medium", "perf": 2334.51, "source": "autotuned"},
{"m": 25, "n": 28, "k": 4, "tile_m": 1, "tile_n": 6, "threads": 128, "grouping": 6, "minblocks": 12, "algorithm": "medium", "perf": 1549.16, "source": "autotuned"},
{"m": 25, "n": 28, "k": 5, "tile_m": 1, "tile_n": 6, "threads": 128, "grouping": 5, "minblocks": 11, "algorithm": "medium", "perf": 1616.88, "source": "autotuned"},
{"m": 25, "n": 28, "k": 7, "tile_m": 3, "tile_n": 2, "threads": 256, "grouping": 5, "minblocks": 6, "algorithm": "medium", "perf": 1760.61, "source": "autotuned"},
{"m": 25, "n": 28, "k": 9, "tile_m": 1, "tile_n": 6, "threads": 256, "grouping": 6, "minblocks": 5, "algorithm": "medium", "perf": 1846.28, "source": "autotuned"},
{"m": 25, "n": 28, "k": 13, "tile_m": 3, "tile_n": 4, "threads": 64, "grouping": 3, "minblocks": 2, "algorithm": "medium", "perf": 2007.98, "source": "autotuned"},
{"m": 25, "n": 28, "k": 25, "tile_m": 3, "tile_n": 4, "threads": 64, "grouping": 3, "minblocks": 6, "algorithm": "medium", "perf": 2238.93, "source": "autotuned"},
{"m": 25, "n": 28, "k": 28, "tile_m": 3, "tile_n": 4, "threads": 64, "grouping": 2, "minblocks": 3, "algorithm": "medium", "perf": 2303.35, "source": "autotuned"},
{"m": 25, "n": 28, "k": 32, "tile_m": 3, "tile_n": 4, "threads": 64, "grouping": 2, "minblocks": 2, "algorithm": "medium", "perf": 2395.28, "source": "autotuned"},
{"m": 25, "n": 28, "k": 45, "tile_m": 3, "tile_n": 4, "threads": 64, "grouping": 1, "minblocks": 3, "algorithm": "medium", "perf": 2401.66, "source": "autotuned"},
{"m": 25, "n": 32, "k": 4, "tile_m": 1, "tile_n": 7, "threads": 160, "grouping": 6, "minblocks": 8, "algorithm": "medium", "perf": 1604.78, "source": "autotuned"},
{"m": 25, "n": 32, "k": 5, "tile_m": 1, "tile_n": 11, "threads": 128, "grouping": 5, "minblocks": 9, "algorithm": "medium", "perf": 1712.86, "source": "autotuned"},
{"m": 25, "n": 32, "k": 7, "tile_m": 3, "tile_n": 2, "threads": 256, "grouping": 6, "minblocks": 6, "algorithm": "medium", "perf": 1882.31, "source": "autotuned"},
{"m": 25, "n": 32, "k": 9, "tile_m": 7, "tile_n": 2, "threads": 64, "grouping": 3, "minblocks": 2, "algorithm": "medium", "perf": 1923.68, "source": "autotuned"},
{"m": 25, "n": 32, "k": 11, "tile_m": 7, "tile_n": 2, "threads": 64, "grouping": 3, "minblocks": 8, "algorithm": "medium", "perf": 2058.0, "source": "autotuned"},
{"m": 25, "n": 32, "k": 12, "tile_m": 7, "tile_n": 2, "threads": 64, "grouping": 3, "minblocks": 8, "algorithm": "medium", "perf": 2113.34, "source": "autotuned"},
{"m": 25, "n": 32, "k": 13, "tile_m": 5, "tile_n": 3, "threads": 64, "grouping": 3, "minblocks": 1, "algorithm": "medium", "perf": 2129.49, "source": "autotuned"},
{"m": 25, "n": 32, "k": 14, "tile_m": 5, "tile_n": 3, "threads": 64, "grouping": 3, "minblocks": 2, "algorithm": "medium", "perf": 2179.1, "source": "autotuned"},
{"m": 25, "n": 32, "k": 20, "tile_m": 3, "tile_n": 5, "threads": 64, "grouping": 3, "minblocks": 6, "algorithm": "medium", "perf": 2319.12, "source": "autotuned"},
{"m": 25, "n": 32, "k": 25, "tile_m": 7, "tile_n": 2, "threads": 64, "grouping": 2, "minblocks": 1, "algorithm": "medium", "perf": 2380.19, "source": "autotuned"},
{"m": 25, "n": 32, "k": 26, "tile_m": 7, "tile_n": 2, "threads": 64, "grouping": 2, "minblocks": 1, "algorithm": "medium", "perf": 2405.19, "source": "autotuned"},
{"m": 25, "n": 32, "k": 28, "tile_m": 7, "tile_n": 2, "threads": 64, "grouping": 2, "minblocks": 2, "algorithm": "medium", "perf": 2445.47, "source": "autotuned"},
{"m": 25, "n": 32, "k": 32, "tile_m": 3, "tile_n": 5, "threads": 64, "grouping": 2, "minblocks": 1, "algorithm": "medium", "perf": 2543.17, "source": "autotuned"},
{"m": 25, "n": 32, "k": 45, "tile_m": 7, "tile_n": 2, "threads": 64, "grouping": 2, "minblocks": 1, "algorithm": "medium", "perf": 2534.58, "source": "autotuned"},
{"m": 25, "n": 45, "k": 4, "tile_m": 1, "tile_n": 9, "threads": 192, "grouping": 7, "minblocks": 6, "algorithm": "medium", "perf": 1681.3, "source": "autotuned"},
{"m": 25, "n": 45, "k": 5, "tile_m": 1, "tile_n": 9, "threads": 128, "grouping": 5, "minblocks": 8, "algorithm": "medium", "perf": 1844.44, "source": "autotuned"},
{"m": 25, "n": 45, "k": 7, "tile_m": 1, "tile_n": 9, "threads": 192, "grouping": 5, "minblocks": 6, "algorithm": "medium", "perf": 2028.88, "source": "autotuned"},
{"m": 25, "n": 45, "k": 9, "tile_m": 1, "tile_n": 9, "threads": 256, "grouping": 5, "minblocks": 4, "algorithm": "medium", "perf": 2114.73, "source": "autotuned"},
{"m": 25, "n": 45, "k": 13, "tile_m": 1, "tile_n": 9, "threads": 128, "grouping": 3, "minblocks": 7, "algorithm": "medium", "perf": 2282.07, "source": "autotuned"},
{"m": 25, "n": 45, "k": 25, "tile_m": 3, "tile_n": 4, "threads": 128, "grouping": 3, "minblocks": 2, "algorithm": "medium", "perf": 2621.81, "source": "autotuned"},
{"m": 25, "n": 45, "k": 26, "tile_m": 5, "tile_n": 2, "threads": 128, "grouping": 3, "minblocks": 4, "algorithm": "medium", "perf": 2612.42, "source": "autotuned"},
{"m": 25, "n": 45, "k": 28, "tile_m": 3, "tile_n": 5, "threads": 128, "grouping": 1, "minblocks": 7, "algorithm": "medium", "perf": 2678.19, "source": "autotuned"},
{"m": 25, "n": 45, "k": 32, "tile_m": 3, "tile_n": 5, "threads": 160, "grouping": 1, "minblocks": 5, "algorithm": "medium", "perf": 2804.03, "source": "autotuned"},
{"m": 25, "n": 45, "k": 45, "tile_m": 7, "tile_n": 2, "threads": 96, "grouping": 2, "minblocks": 3, "algorithm": "medium", "perf": 2769.88, "source": "autotuned"},
{"m": 26, "n": 4, "k": 4, "tile_m": 1, "tile_n": 4, "threads": 32, "grouping": 9, "minblocks": 6, "algorithm": "medium", "perf": 699.77, "source": "autotuned"},
{"m": 26, "n": 4, "k": 5, "tile_m": 1, "tile_n": 4, "threads": 32, "grouping": 3, "minblocks": 26, "algorithm": "medium", "perf": 688.995, "source": "autotuned"},
{"m": 26, "n": 4, "k": 9, "tile_m": 1, "tile_n": 4, "threads": 64, "grouping": 4, "minblocks": 17, "algorithm": "medium", "perf": 677.491, "source": "autotuned"},
{"m": 26, "n": 4, "k": 13, "tile_m": 1, "tile_n": 4, "threads": 64, "grouping": 3, "minblocks": 17, "algorithm": "medium", "perf": 693.116, "source": "autotuned"},
{"m": 26, "n": 4, "k": 22, "tile_m": 1, "tile_n": 4, "threads": 96, "grouping": 3, "minblocks": 10, "algorithm": "medium", "perf": 703.614, "source": "autotuned"},
{"m": 26, "n": 4, "k": 23, "tile_m": 1, "tile_n": 2, "threads": 96, "grouping": 3, "minblocks": 3, "algorithm": "medium", "perf": 694.92, "source": "autotuned"},
{"m": 26, "n": 4, "k": 26, "tile_m": 1, "tile_n": 2, "threads": 128, "grouping": 3, "minblocks": 3, "algorithm": "medium", "perf": 708.26, "source": "autotuned"},
{"m": 26, "n": 5, "k": 4, "tile_m": 1, "tile_n": 5, "threads": 32, "grouping": 9, "minblocks": 22, "algorithm": "medium", "perf": 804.323, "source": "autotuned"},
{"m": 26, "n": 5, "k": 5, "tile_m": 1, "tile_n": 5, "threads": 32, "grouping": 5, "minblocks": 26, "algorithm": "medium", "perf": 784.372, "source": "autotuned"},
{"m": 26, "n": 5, "k": 9, "tile_m": 1, "tile_n": 3, "threads": 64, "grouping": 3, "minblocks": 23, "algorithm": "medium", "perf": 802.5, "source": "autotuned"},
{"m": 26, "n": 5, "k": 13, "tile_m": 1, "tile_n": 5, "threads": 96, "grouping": 3, "minblocks": 13, "algorithm": "medium", "perf": 801.035, "source": "autotuned"},
{"m": 26, "n": 5, "k": 22, "tile_m": 1, "tile_n": 5, "threads": 128, "grouping": 3, "minblocks": 9, "algorithm": "medium", "perf": 819.975, "source": "autotuned"},
{"m": 26, "n": 5, "k": 23, "tile_m": 1, "tile_n": 5, "threads": 128, "grouping": 3, "minblocks": 8, "algorithm": "medium", "perf": 821.742, "source": "autotuned"},
{"m": 26, "n": 5, "k": 26, "tile_m": 1, "tile_n": 2, "threads": 160, "grouping": 4, "minblocks": 7, "algorithm": "medium", "perf": 826.193, "source": "autotuned"},
{"m": 26, "n": 9, "k": 4, "tile_m": 1, "tile_n": 9, "threads": 64, "grouping": 13, "minblocks": 15, "algorithm": "medium", "perf": 1043.71, "source": "autotuned"},
{"m": 26, "n": 9, "k": 5, "tile_m": 1, "tile_n": 5, "threads": 64, "grouping": 4, "minblocks": 24, "algorithm": "medium", "perf": 1052.58, "source": "autotuned"},
{"m": 26, "n": 9, "k": 9, "tile_m": 1, "tile_n": 9, "threads": 96, "grouping": 4, "minblocks": 12, "algorithm": "medium", "perf": 1138.73, "source": "autotuned"},
{"m": 26, "n": 9, "k": 13, "tile_m": 1, "tile_n": 3, "threads": 128, "grouping": 3, "minblocks": 12, "algorithm": "medium", "perf": 1184.14, "source": "autotuned"},
{"m": 26, "n": 9, "k": 22, "tile_m": 1, "tile_n": 3, "threads": 256, "grouping": 4, "minblocks": 5, "algorithm": "medium", "perf": 1229.9, "source": "autotuned"},
{"m": 26, "n": 9, "k": 23, "tile_m": 1, "tile_n": 3, "threads": 256, "grouping": 3, "minblocks": 6, "algorithm": "medium", "perf": 1228.59, "source": "autotuned"},
{"m": 26, "n": 9, "k": 26, "tile_m": 1, "tile_n": 3, "threads": 256, "grouping": 3, "minblocks": 6, "algorithm": "medium", "perf": 1249.07, "source": "autotuned"},
{"m": 26, "n": 13, "k": 4, "tile_m": 1, "tile_n": 7, "threads": 64, "grouping": 13, "minblocks": 17, "algorithm": "medium", "perf": 1216.94, "source": "autotuned"},
{"m": 26, "n": 13, "k": 5, "tile_m": 1, "tile_n": 5, "threads": 96, "grouping": 5, "minblocks": 14, "algorithm": "medium", "perf": 1229.6, "source": "autotuned"},
{"m": 26, "n": 13, "k": 9, "tile_m": 1, "tile_n": 5, "threads": 128, "grouping": 4, "minblocks": 10, "algorithm": "medium", "perf": 1378.77, "source": "autotuned"},
{"m": 26, "n": 13, "k": 13, "tile_m": 1, "tile_n": 4, "threads": 192, "grouping": 3, "minblocks": 8, "algorithm": "medium", "perf": 1417.71, "source": "autotuned"},
{"m": 26, "n": 13, "k": 22, "tile_m": 1, "tile_n": 3, "threads": 288, "grouping": 3, "minblocks": 6, "algorithm": "medium", "perf": 1533.15, "source": "autotuned"},
{"m": 26, "n": 13, "k": 23, "tile_m": 5, "tile_n": 3, "threads": 32, "grouping": 2, "minblocks": 4, "algorithm": "medium", "perf": 1533.11, "source": "autotuned"},
{"m": 26, "n": 13, "k": 26, "tile_m": 3, "tile_n": 2, "threads": 128, "grouping": 3, "minblocks": 7, "algorithm": "medium", "perf": 1554.51, "source": "autotuned"},
{"m": 26, "n": 22, "k": 4, "tile_m": 1, "tile_n": 6, "threads": 128, "grouping": 6, "minblocks": 11, "algorithm": "medium", "perf": 1499.81, "source": "autotuned"},
{"m": 26, "n": 22, "k": 5, "tile_m": 1, "tile_n": 6, "threads": 128, "grouping": 5, "minblocks": 10, "algorithm": "medium", "perf": 1535.64, "source": "autotuned"},
{"m": 26, "n": 22, "k": 9, "tile_m": 1, "tile_n": 4, "threads": 256, "grouping": 4, "minblocks": 7, "algorithm": "medium", "perf": 1734.07, "source": "autotuned"},
{"m": 26, "n": 22, "k": 13, "tile_m": 1, "tile_n": 11, "threads": 64, "grouping": 3, "minblocks": 12, "algorithm": "medium", "perf": 1854.64, "source": "autotuned"},
{"m": 26, "n": 22, "k": 22, "tile_m": 1, "tile_n": 8, "threads": 128, "grouping": 2, "minblocks": 7, "algorithm": "medium", "perf": 2013.32, "source": "autotuned"},
{"m": 26, "n": 22, "k": 23, "tile_m": 1, "tile_n": 8, "threads": 128, "grouping": 3, "minblocks": 6, "algorithm": "medium", "perf": 2014.1, "source": "autotuned"},
{"m": 26, "n": 22, "k": 26, "tile_m": 1, "tile_n": 8, "threads": 96, "grouping": 2, "minblocks": 6, "algorithm": "medium", "perf": 2055.64, "source": "autotuned"},
{"m": 26, "n": 23, "k": 4, "tile_m": 1, "tile_n": 6, "threads": 128, "grouping": 6, "minblocks": 12, "algorithm": "medium", "perf": 1491.55, "source": "autotuned"},
{"m": 26, "n": 23, "k": 5, "tile_m": 1, "tile_n": 6, "threads": 128, "grouping": 4, "minblocks": 12, "algorithm": "medium", "perf": 1542.12, "source": "autotuned"},
{"m": 26, "n": 23, "k": 9, "tile_m": 1, "tile_n": 3, "threads": 256, "grouping": 4, "minblocks": 7, "algorithm": "medium", "perf": 1784.05, "source": "autotuned"},
{"m": 26, "n": 23, "k": 13, "tile_m": 1, "tile_n": 4, "threads": 352, "grouping": 4, "minblocks": 5, "algorithm": "medium", "perf": 1883.67, "source": "autotuned"},
{"m": 26, "n": 23, "k": 22, "tile_m": 1, "tile_n": 8, "threads": 128, "grouping": 3, "minblocks": 6, "algorithm": "medium", "perf": 2063.9, "source": "autotuned"},
{"m": 26, "n": 23, "k": 23, "tile_m": 1, "tile_n": 6, "threads": 160, "grouping": 3, "minblocks": 6, "algorithm": "medium", "perf": 2052.66, "source": "autotuned"},
{"m": 26, "n": 23, "k": 26, "tile_m": 1, "tile_n": 8, "threads": 96, "grouping": 2, "minblocks": 6, "algorithm": "medium", "perf": 2108.1, "source": "autotuned"},
{"m": 26, "n": 26, "k": 4, "tile_m": 1, "tile_n": 9, "threads": 128, "grouping": 6, "minblocks": 9, "algorithm": "medium", "perf": 1540.78, "source": "autotuned"},
{"m": 26, "n": 26, "k": 5, "tile_m": 1, "tile_n": 9, "threads": 96, "grouping": 4, "minblocks": 11, "algorithm": "medium", "perf": 1601.64, "source": "autotuned"},
{"m": 26, "n": 26, "k": 9, "tile_m": 1, "tile_n": 9, "threads": 128, "grouping": 4, "minblocks": 9, "algorithm": "medium", "perf": 1892.58, "source": "autotuned"},
{"m": 26, "n": 26, "k": 13, "tile_m": 1, "tile_n": 9, "threads": 96, "grouping": 3, "minblocks": 9, "algorithm": "medium", "perf": 2050.56, "source": "autotuned"},
{"m": 26, "n": 26, "k": 22, "tile_m": 3, "tile_n": 4, "threads": 64, "grouping": 2, "minblocks": 4, "algorithm": "medium", "perf": 2248.36, "source": "autotuned"},
{"m": 26, "n": 26, "k": 23, "tile_m": 3, "tile_n": 4, "threads": 64, "grouping": 2, "minblocks": 1, "algorithm": "medium", "perf": 2245.79, "source": "autotuned"},
{"m": 26, "n": 26, "k": 26, "tile_m": 3, "tile_n": 4, "threads": 96, "grouping": 2, "minblocks": 5, "algorithm": "medium", "perf": 2288.66, "source": "autotuned"},
{"m": 27, "n": 27, "k": 27, "tile_m": 3, "tile_n": 4, "threads": 96, "grouping": 2, "minblocks": 5, "algorithm": "medium", "perf": 2376.96, "source": "autotuned"},
{"m": 28, "n": 4, "k": 5, "tile_m": 1, "tile_n": 4, "threads": 32, "grouping": 5, "minblocks": 25, "algorithm": "medium", "perf": 673.287, "source": "autotuned"},
{"m": 28, "n": 4, "k": 13, "tile_m": 1, "tile_n": 4, "threads": 64, "grouping": 3, "minblocks": 15, "algorithm": "medium", "perf": 692.231, "source": "autotuned"},
{"m": 28, "n": 4, "k": 28, "tile_m": 1, "tile_n": 2, "threads": 128, "grouping": 3, "minblocks": 2, "algorithm": "medium", "perf": 713.815, "source": "autotuned"},
{"m": 28, "n": 5, "k": 25, "tile_m": 1, "tile_n": 5, "threads": 128, "grouping": 3, "minblocks": 8, "algorithm": "medium", "perf": 830.956, "source": "autotuned"},
{"m": 28, "n": 28, "k": 28, "tile_m": 1, "tile_n": 7, "threads": 128, "grouping": 3, "minblocks": 5, "algorithm": "medium", "perf": 2506.43, "source": "autotuned"},
{"m": 29, "n": 14, "k": 14, "tile_m": 5, "tile_n": 3, "threads": 32, "grouping": 3, "minblocks": 2, "algorithm": "medium", "perf": 1545.05, "source": "autotuned"},
{"m": 29, "n": 14, "k": 16, "tile_m": 5, "tile_n": 3, "threads": 32, "grouping": 3, "minblocks": 1, "algorithm": "medium", "perf": 1615.89, "source": "autotuned"},
{"m": 29, "n": 14, "k": 29, "tile_m": 5, "tile_n": 3, "w": 10, "v": 8, "threads": 32, "grouping": 16, "minblocks": 4, "algorithm": "largeDB2", "perf": 1693.49, "source": "autotuned"},
{"m": 29, "n": 14, "k": 32, "tile_m": 3, "tile_n": 2, "threads": 128, "grouping": 3, "minblocks": 6, "algorithm": "medium", "perf": 1770.9, "source": "autotuned"},
{"m": 29, "n": 16, "k": 14, "tile_m": 3, "tile_n": 1, "threads": 256, "grouping": 3, "minblocks": 8, "algorithm": "medium", "perf": 1706.42, "source": "autotuned"},
{"m": 29, "n": 16, "k": 16, "tile_m": 3, "tile_n": 2, "threads": 96, "grouping": 3, "minblocks": 10, "algorithm": "medium", "perf": 1749.29, "source": "autotuned"},
{"m": 29, "n": 29, "k": 14, "tile_m": 3, "tile_n": 2, "threads": 160, "grouping": 3, "minblocks": 7, "algorithm": "medium", "perf": 2271.93, "source": "autotuned"},
{"m": 29, "n": 29, "k": 16, "tile_m": 3, "tile_n": 5, "threads": 96, "grouping": 3, "minblocks": 5, "algorithm": "medium", "perf": 2399.04, "source": "autotuned"},
{"m": 29, "n": 29, "k": 29, "tile_m": 3, "tile_n": 3, "threads": 128, "grouping": 3, "minblocks": 4, "algorithm": "medium", "perf": 2547.24, "source": "autotuned"},
{"m": 29, "n": 29, "k": 32, "tile_m": 3, "tile_n": 3, "threads": 128, "grouping": 3, "minblocks": 4, "algorithm": "medium", "perf": 2645.48, "source": "autotuned"},
{"m": 29, "n": 32, "k": 14, "tile_m": 3, "tile_n": 2, "threads": 160, "grouping": 3, "minblocks": 7, "algorithm": "medium", "perf": 2320.73, "source": "autotuned"},
{"m": 29, "n": 32, "k": 29, "tile_m": 3, "tile_n": 3, "threads": 128, "grouping": 3, "minblocks": 1, "algorithm": "medium", "perf": 2639.95, "source": "autotuned"},
{"m": 29, "n": 32, "k": 32, "tile_m": 3, "tile_n": 2, "threads": 256, "grouping": 3, "minblocks": 4, "algorithm": "medium", "perf": 2714.3, "source": "autotuned"},
{"m": 30, "n": 30, "k": 30, "tile_m": 3, "tile_n": 3, "threads": 128, "grouping": 3, "minblocks": 3, "algorithm": "medium", "perf": 2650.57, "source": "autotuned"},
{"m": 31, "n": 31, "k": 31, "tile_m": 2, "tile_n": 4, "threads": 128, "grouping": 3, "minblocks": 3, "algorithm": "medium", "perf": 2700.28, "source": "autotuned"},
{"m": 32, "n": 4, "k": 13, "tile_m": 1, "tile_n": 2, "threads": 96, "grouping": 3, "minblocks": 14, "algorithm": "medium", "perf": 712.551, "source": "autotuned"},
{"m": 32, "n": 4, "k": 25, "tile_m": 1, "tile_n": 2, "threads": 128, "grouping": 3, "minblocks": 5, "algorithm": "medium", "perf": 728.383, "source": "autotuned"},
{"m": 32, "n": 4, "k": 26, "tile_m": 1, "tile_n": 2, "threads": 128, "grouping": 3, "minblocks": 6, "algorithm": "medium", "perf": 734.347, "source": "autotuned"},
{"m": 32, "n": 4, "k": 28, "tile_m": 1, "tile_n": 2, "threads": 128, "grouping": 3, "minblocks": 6, "algorithm": "medium", "perf": 738.692, "source": "autotuned"},
{"m": 32, "n": 4, "k": 32, "tile_m": 1, "tile_n": 2, "threads": 160, "grouping": 3, "minblocks": 6, "algorithm": "medium", "perf": 748.772, "source": "autotuned"},
{"m": 32, "n": 5, "k": 4, "tile_m": 2, "tile_n": 3, "threads": 32, "grouping": 5, "minblocks": 2, "algorithm": "medium", "perf": 788.628, "source": "autotuned"},
{"m": 32, "n": 5, "k": 5, "tile_m": 1, "tile_n": 5, "threads": 32, "grouping": 4, "minblocks": 25, "algorithm": "medium", "perf": 806.704, "source": "autotuned"},
{"m": 32, "n": 5, "k": 7, "tile_m": 1, "tile_n": 3, "threads": 64, "grouping": 4, "minblocks": 7, "algorithm": "medium", "perf": 809.076, "source": "autotuned"},
{"m": 32, "n": 5, "k": 16, "tile_m": 1, "tile_n": 2, "threads": 96, "grouping": 3, "minblocks": 2, "algorithm": "medium", "perf": 860.484, "source": "autotuned"},
{"m": 32, "n": 5, "k": 26, "tile_m": 1, "tile_n": 2, "threads": 160, "grouping": 3, "minblocks": 3, "algorithm": "medium", "perf": 863.101, "source": "autotuned"},
{"m": 32, "n": 5, "k": 45, "tile_m": 1, "tile_n": 2, "threads": 256, "grouping": 3, "minblocks": 2, "algorithm": "medium", "perf": 884.942, "source": "autotuned"},
{"m": 32, "n": 7, "k": 4, "tile_m": 1, "tile_n": 7, "threads": 32, "grouping": 5, "minblocks": 25, "algorithm": "medium", "perf": 950.689, "source": "autotuned"},
{"m": 32, "n": 7, "k": 7, "tile_m": 1, "tile_n": 7, "threads": 64, "grouping": 5, "minblocks": 15, "algorithm": "medium", "perf": 1006.18, "source": "autotuned"},
{"m": 32, "n": 7, "k": 9, "tile_m": 1, "tile_n": 7, "threads": 64, "grouping": 4, "minblocks": 14, "algorithm": "medium", "perf": 1044.53, "source": "autotuned"},
{"m": 32, "n": 7, "k": 13, "tile_m": 1, "tile_n": 4, "threads": 96, "grouping": 3, "minblocks": 12, "algorithm": "medium", "perf": 1070.92, "source": "autotuned"},
{"m": 32, "n": 7, "k": 26, "tile_m": 1, "tile_n": 4, "threads": 224, "grouping": 3, "minblocks": 5, "algorithm": "medium", "perf": 1130.79, "source": "autotuned"},
{"m": 32, "n": 7, "k": 32, "tile_m": 1, "tile_n": 2, "threads": 256, "grouping": 3, "minblocks": 5, "algorithm": "medium", "perf": 1158.98, "source": "autotuned"},
{"m": 32, "n": 7, "k": 45, "tile_m": 1, "tile_n": 2, "threads": 320, "grouping": 3, "minblocks": 4, "algorithm": "medium", "perf": 1155.62, "source": "autotuned"},
{"m": 32, "n": 9, "k": 7, "tile_m": 1, "tile_n": 5, "threads": 64, "grouping": 4, "minblocks": 13, "algorithm": "medium", "perf": 1189.05, "source": "autotuned"},
{"m": 32, "n": 9, "k": 12, "tile_m": 1, "tile_n": 3, "threads": 128, "grouping": 3, "minblocks": 11, "algorithm": "medium", "perf": 1266.02, "source": "autotuned"},
{"m": 32, "n": 9, "k": 13, "tile_m": 1, "tile_n": 3, "threads": 128, "grouping": 3, "minblocks": 11, "algorithm": "medium", "perf": 1272.14, "source": "autotuned"},
{"m": 32, "n": 9, "k": 25, "tile_m": 1, "tile_n": 3, "threads": 256, "grouping": 3, "minblocks": 5, "algorithm": "medium", "perf": 1334.41, "source": "autotuned"},
{"m": 32, "n": 9, "k": 26, "tile_m": 1, "tile_n": 3, "threads": 256, "grouping": 3, "minblocks": 5, "algorithm": "medium", "perf": 1345.25, "source": "autotuned"},
{"m": 32, "n": 9, "k": 32, "tile_m": 1, "tile_n": 3, "threads": 320, "grouping": 3, "minblocks": 4, "algorithm": "medium", "perf": 1380.62, "source": "autotuned"},
{"m": 32, "n": 9, "k": 45, "tile_m": 1, "tile_n": 3, "threads": 416, "grouping": 3, "minblocks": 3, "algorithm": "medium", "perf": 1398.6, "source": "autotuned"},
{"m": 32, "n": 10, "k": 9, "tile_m": 1, "tile_n": 4, "threads": 96, "grouping": 3, "minblocks": 16, "algorithm": "medium", "perf": 1295.37, "source": "autotuned"},
{"m": 32, "n": 10, "k": 10, "tile_m": 1, "tile_n": 3, "threads": 128, "grouping": 3, "minblocks": 11, "algorithm": "medium", "perf": 1316.2, "source": "autotuned"},
{"m": 32, "n": 10, "k": 32, "tile_m": 1, "tile_n": 2, "threads": 352, "grouping": 3, "minblocks": 4, "algorithm": "medium", "perf": 1486.53, "source": "autotuned"},
{"m": 32, "n": 11, "k": 11, "tile_m": 1, "tile_n": 3, "threads": 128, "grouping": 3, "minblocks": 11, "algorithm": "medium", "perf": 1401.98, "source": "autotuned"},
{"m": 32, "n": 11, "k": 12, "tile_m": 1, "tile_n": 3, "threads": 192, "grouping": 3, "minblocks": 8, "algorithm": "medium", "perf": 1409.69, "source": "autotuned"},
{"m": 32, "n": 11, "k": 20, "tile_m": 1, "tile_n": 4, "threads": 224, "grouping": 3, "minblocks": 5, "algorithm": "medium", "perf": 1507.32, "source": "autotuned"},
{"m": 32, "n": 11, "k": 32, "tile_m": 1, "tile_n": 3, "threads": 384, "grouping": 3, "minblocks": 4, "algorithm": "medium", "perf": 1595.66, "source": "autotuned"},
{"m": 32, "n": 12, "k": 11, "tile_m": 1, "tile_n": 3, "threads": 160, "grouping": 4, "minblocks": 8, "algorithm": "medium", "perf": 1472.58, "source": "autotuned"},
{"m": 32, "n": 12, "k": 20, "tile_m": 1, "tile_n": 3, "threads": 256, "grouping": 3, "minblocks": 6, "algorithm": "medium", "perf": 1614.85, "source": "autotuned"},
{"m": 32, "n": 12, "k": 26, "tile_m": 1, "tile_n": 3, "threads": 320, "grouping": 3, "minblocks": 4, "algorithm": "medium", "perf": 1631.17, "source": "autotuned"},
{"m": 32, "n": 12, "k": 32, "tile_m": 1, "tile_n": 3, "threads": 512, "grouping": 4, "minblocks": 3, "algorithm": "medium", "perf": 1687.2, "source": "autotuned"},
{"m": 32, "n": 13, "k": 7, "tile_m": 1, "tile_n": 7, "threads": 96, "grouping": 4, "minblocks": 11, "algorithm": "medium", "perf": 1444.9, "source": "autotuned"},
{"m": 32, "n": 13, "k": 9, "tile_m": 1, "tile_n": 3, "threads": 160, "grouping": 4, "minblocks": 9, "algorithm": "medium", "perf": 1494.08, "source": "autotuned"},
{"m": 32, "n": 13, "k": 13, "tile_m": 1, "tile_n": 2, "threads": 256, "grouping": 3, "minblocks": 7, "algorithm": "medium", "perf": 1560.49, "source": "autotuned"},
{"m": 32, "n": 13, "k": 16, "tile_m": 1, "tile_n": 5, "threads": 224, "grouping": 3, "minblocks": 5, "algorithm": "medium", "perf": 1621.29, "source": "autotuned"},
{"m": 32, "n": 13, "k": 28, "tile_m": 1, "tile_n": 2, "threads": 384, "grouping": 3, "minblocks": 5, "algorithm": "medium", "perf": 1714.82, "source": "autotuned"},
{"m": 32, "n": 14, "k": 13, "tile_m": 1, "tile_n": 3, "threads": 224, "grouping": 3, "minblocks": 7, "algorithm": "medium", "perf": 1640.15, "source": "autotuned"},
{"m": 32, "n": 16, "k": 5, "tile_m": 1, "tile_n": 4, "threads": 192, "grouping": 5, "minblocks": 9, "algorithm": "medium", "perf": 1495.79, "source": "autotuned"},
{"m": 32, "n": 16, "k": 12, "tile_m": 1, "tile_n": 4, "threads": 224, "grouping": 4, "minblocks": 6, "algorithm": "medium", "perf": 1794.95, "source": "autotuned"},
{"m": 32, "n": 16, "k": 13, "tile_m": 1, "tile_n": 4, "threads": 256, "grouping": 4, "minblocks": 6, "algorithm": "medium", "perf": 1798.83, "source": "autotuned"},
{"m": 32, "n": 20, "k": 11, "tile_m": 1, "tile_n": 4, "threads": 224, "grouping": 4, "minblocks": 6, "algorithm": "medium", "perf": 1930.43, "source": "autotuned"},
{"m": 32, "n": 20, "k": 20, "tile_m": 1, "tile_n": 5, "threads": 128, "grouping": 3, "minblocks": 7, "algorithm": "medium", "perf": 2135.9, "source": "autotuned"},
{"m": 32, "n": 22, "k": 9, "tile_m": 1, "tile_n": 4, "threads": 320, "grouping": 4, "minblocks": 5, "algorithm": "medium", "perf": 1904.44, "source": "autotuned"},
{"m": 32, "n": 24, "k": 5, "tile_m": 1, "tile_n": 4, "threads": 224, "grouping": 5, "minblocks": 8, "algorithm": "medium", "perf": 1756.65, "source": "autotuned"},
{"m": 32, "n": 24, "k": 13, "tile_m": 1, "tile_n": 12, "threads": 64, "grouping": 3, "minblocks": 9, "algorithm": "medium", "perf": 2172.37, "source": "autotuned"},
{"m": 32, "n": 24, "k": 24, "tile_m": 1, "tile_n": 8, "threads": 96, "grouping": 3, "minblocks": 6, "algorithm": "medium", "perf": 2431.14, "source": "autotuned"},
{"m": 32, "n": 24, "k": 26, "tile_m": 1, "tile_n": 6, "threads": 128, "grouping": 3, "minblocks": 5, "algorithm": "medium", "perf": 2435.09, "source": "autotuned"},
{"m": 32, "n": 24, "k": 32, "tile_m": 1, "tile_n": 6, "threads": 128, "grouping": 3, "minblocks": 3, "algorithm": "medium", "perf": 2543.84, "source": "autotuned"},
{"m": 32, "n": 25, "k": 5, "tile_m": 1, "tile_n": 5, "threads": 224, "grouping": 5, "minblocks": 7, "algorithm": "medium", "perf": 1752.88, "source": "autotuned"},
{"m": 32, "n": 25, "k": 7, "tile_m": 1, "tile_n": 5, "threads": 192, "grouping": 4, "minblocks": 7, "algorithm": "medium", "perf": 1916.66, "source": "autotuned"},
{"m": 32, "n": 25, "k": 11, "tile_m": 1, "tile_n": 4, "threads": 384, "grouping": 5, "minblocks": 5, "algorithm": "medium", "perf": 2094.56, "source": "autotuned"},
{"m": 32, "n": 25, "k": 13, "tile_m": 1, "tile_n": 9, "threads": 96, "grouping": 3, "minblocks": 9, "algorithm": "medium", "perf": 2181.89, "source": "autotuned"},
{"m": 32, "n": 25, "k": 26, "tile_m": 1, "tile_n": 5, "threads": 192, "grouping": 3, "minblocks": 5, "algorithm": "medium", "perf": 2429.15, "source": "autotuned"},
{"m": 32, "n": 25, "k": 32, "tile_m": 1, "tile_n": 7, "threads": 128, "grouping": 3, "minblocks": 4, "algorithm": "medium", "perf": 2519.15, "source": "autotuned"},
{"m": 32, "n": 25, "k": 45, "tile_m": 1, "tile_n": 7, "threads": 128, "grouping": 3, "minblocks": 1, "algorithm": "medium", "perf": 2569.3, "source": "autotuned"},
{"m": 32, "n": 26, "k": 5, "tile_m": 1, "tile_n": 5, "threads": 192, "grouping": 5, "minblocks": 8, "algorithm": "medium", "perf": 1789.55, "source": "autotuned"},
{"m": 32, "n": 26, "k": 7, "tile_m": 1, "tile_n": 4, "threads": 256, "grouping": 4, "minblocks": 7, "algorithm": "medium", "perf": 1986.08, "source": "autotuned"},
{"m": 32, "n": 26, "k": 9, "tile_m": 1, "tile_n": 4, "threads": 320, "grouping": 4, "minblocks": 5, "algorithm": "medium", "perf": 2071.44, "source": "autotuned"},
{"m": 32, "n": 26, "k": 12, "tile_m": 1, "tile_n": 10, "threads": 96, "grouping": 3, "minblocks": 9, "algorithm": "medium", "perf": 2213.46, "source": "autotuned"},
{"m": 32, "n": 26, "k": 24, "tile_m": 1, "tile_n": 9, "threads": 96, "grouping": 3, "minblocks": 6, "algorithm": "medium", "perf": 2496.78, "source": "autotuned"},
{"m": 32, "n": 26, "k": 28, "tile_m": 1, "tile_n": 7, "threads": 128, "grouping": 3, "minblocks": 5, "algorithm": "medium", "perf": 2514.02, "source": "autotuned"},
{"m": 32, "n": 26, "k": 32, "tile_m": 1, "tile_n": 7, "threads": 128, "grouping": 3, "minblocks": 4, "algorithm": "medium", "perf": 2625.43, "source": "autotuned"},
{"m": 32, "n": 26, "k": 45, "tile_m": 1, "tile_n": 7, "threads": 128, "grouping": 3, "minblocks": 1, "algorithm": "medium", "perf": 2612.42, "source": "autotuned"},
{"m": 32, "n": 28, "k": 4, "tile_m": 1, "tile_n": 4, "threads": 224, "grouping": 5, "minblocks": 7, "algorithm": "medium", "perf": 1706.12, "source": "autotuned"},
{"m": 32, "n": 28, "k": 13, "tile_m": 1, "tile_n": 4, "threads": 480, "grouping": 4, "minblocks": 4, "algorithm": "medium", "perf": 2294.83, "source": "autotuned"},
{"m": 32, "n": 28, "k": 25, "tile_m": 2, "tile_n": 7, "threads": 64, "grouping": 3, "minblocks": 2, "algorithm": "medium", "perf": 2558.66, "source": "autotuned"},
{"m": 32, "n": 28, "k": 26, "tile_m": 1, "tile_n": 7, "threads": 128, "grouping": 3, "minblocks": 5, "algorithm": "medium", "perf": 2600.81, "source": "autotuned"},
{"m": 32, "n": 28, "k": 28, "tile_m": 1, "tile_n": 7, "threads": 128, "grouping": 3, "minblocks": 5, "algorithm": "medium", "perf": 2649.48, "source": "autotuned"},
{"m": 32, "n": 28, "k": 32, "tile_m": 1, "tile_n": 7, "threads": 128, "grouping": 3, "minblocks": 4, "algorithm": "medium", "perf": 2746.52, "source": "autotuned"},
{"m": 32, "n": 28, "k": 45, "tile_m": 1, "tile_n": 7, "threads": 128, "grouping": 3, "minblocks": 1, "algorithm": "medium", "perf": 2759.99, "source": "autotuned"},
{"m": 32, "n": 29, "k": 29, "tile_m": 1, "tile_n": 8, "threads": 128, "grouping": 3, "minblocks": 5, "algorithm": "medium", "perf": 2631.69, "source": "autotuned"},
{"m": 32, "n": 32, "k": 4, "tile_m": 2, "tile_n": 8, "threads": 64, "grouping": 32, "minblocks": 5, "algorithm": "medium", "perf": 1811.89, "source": "autotuned"},
{"m": 32, "n": 32, "k": 7, "tile_m": 1, "tile_n": 8, "threads": 128, "grouping": 4, "minblocks": 8, "algorithm": "medium", "perf": 2196.76, "source": "autotuned"},
{"m": 32, "n": 32, "k": 10, "tile_m": 2, "tile_n": 8, "threads": 64, "grouping": 4, "minblocks": 2, "algorithm": "medium", "perf": 2425.0, "source": "autotuned"},
{"m": 32, "n": 32, "k": 11, "tile_m": 1, "tile_n": 9, "threads": 128, "grouping": 3, "minblocks": 7, "algorithm": "medium", "perf": 2468.06, "source": "autotuned"},
{"m": 32, "n": 32, "k": 16, "tile_m": 1, "tile_n": 8, "threads": 128, "grouping": 3, "minblocks": 5, "algorithm": "medium", "perf": 2733.95, "source": "autotuned"},
{"m": 32, "n": 32, "k": 22, "tile_m": 1, "tile_n": 8, "threads": 128, "grouping": 3, "minblocks": 4, "algorithm": "medium", "perf": 2801.94, "source": "autotuned"},
{"m": 32, "n": 32, "k": 24, "tile_m": 1, "tile_n": 8, "threads": 128, "grouping": 3, "minblocks": 1, "algorithm": "medium", "perf": 2848.85, "source": "autotuned"},
{"m": 32, "n": 32, "k": 25, "tile_m": 1, "tile_n": 8, "threads": 160, "grouping": 3, "minblocks": 3, "algorithm": "medium", "perf": 2821.09, "source": "autotuned"},
{"m": 32, "n": 32, "k": 26, "tile_m": 3, "tile_n": 4, "threads": 128, "grouping": 3, "minblocks": 1, "algorithm": "medium", "perf": 2853.46, "source": "autotuned"},
{"m": 32, "n": 32, "k": 29, "tile_m": 1, "tile_n": 8, "threads": 128, "grouping": 3, "minblocks": 2, "algorithm": "medium", "perf": 2876.93, "source": "autotuned"},
{"m": 32, "n": 32, "k": 32, "tile_m": 1, "tile_n": 8, "threads": 128, "grouping": 3, "minblocks": 1, "algorithm": "medium", "perf": 2970.84, "source": "autotuned"},
{"m": 32, "n": 32, "k": 45, "tile_m": 2, "tile_n": 4, "threads": 256, "grouping": 4, "minblocks": 1, "algorithm": "medium", "perf": 2972.04, "source": "autotuned"},
{"m": 32, "n": 45, "k": 5, "tile_m": 1, "tile_n": 8, "threads": 256, "grouping": 5, "minblocks": 5, "algorithm": "medium", "perf": 2090.44, "source": "autotuned"},
{"m": 32, "n": 45, "k": 7, "tile_m": 1, "tile_n": 6, "threads": 256, "grouping": 4, "minblocks": 6, "algorithm": "medium", "perf": 2357.34, "source": "autotuned"},
{"m": 32, "n": 45, "k": 9, "tile_m": 1, "tile_n": 6, "threads": 320, "grouping": 5, "minblocks": 4, "algorithm": "medium", "perf": 2485.44, "source": "autotuned"},
{"m": 32, "n": 45, "k": 28, "tile_m": 1, "tile_n": 12, "threads": 128, "grouping": 3, "minblocks": 4, "algorithm": "medium", "perf": 3112.08, "source": "autotuned"},
{"m": 45, "n": 45, "k": 45, "tile_m": 3, "tile_n": 8, "w": 16, "v": 32, "threads": 96, "grouping": 16, "minblocks": 1, "algorithm": "largeDB2", "perf": 3610.99, "source": "autotuned"},
{"m": 55, "n": 55, "k": 32, "tile_m": 2, "tile_n": 7, "threads": 256, "grouping": 5, "minblocks": 2, "algorithm": "medium", "perf": 3960.66, "source": "autotuned"},
{"m": 56, "n": 56, "k": 56, "tile_m": 7, "tile_n": 4, "w": 20, "v": 44, "threads": 128, "grouping": 16, "minblocks": 2, "algorithm": "largeDB2", "perf": 4524.45, "source": "autotuned"},
{"m": 64, "n": 64, "k": 64, "tile_m": 2, "tile_n": 8, "w": 24, "v": 56, "threads": 256, "grouping": 16, "minblocks": 2, "algorithm": "largeDB2", "perf": 5272.92, "source": "autotuned"},
{"m": 72, "n": 72, "k": 72, "tile_m": 5, "tile_n": 9, "w": 12, "v": 36, "threads": 128, "grouping": 16, "minblocks": 1, "algorithm": "largeDB2", "perf": 5054.05, "source": "autotuned"}
]