src/acc/libsmm_acc/libcusmm/parameters_K40.json
[
{"m": 5, "n": 5, "k": 5, "threads": 64, "grouping": 16, "minblocks": 1, "algorithm": "tiny", "perf": 30.4899, "source": "autotuned"},
{"m": 6, "n": 6, "k": 6, "threads": 128, "grouping": 16, "minblocks": 1, "algorithm": "tiny", "perf": 44.1711, "source": "autotuned"},
{"m": 7, "n": 7, "k": 7, "threads": 96, "grouping": 16, "minblocks": 1, "algorithm": "tiny", "perf": 64.2483, "source": "autotuned"},
{"m": 8, "n": 8, "k": 8, "tile_m": 1, "tile_n": 1, "threads": 64, "grouping": 16, "minblocks": 4, "algorithm": "small", "perf": 95.1028, "source": "autotuned"},
{"m": 9, "n": 9, "k": 9, "tile_m": 1, "tile_n": 1, "threads": 96, "grouping": 16, "minblocks": 4, "algorithm": "small", "perf": 111.384, "source": "autotuned"},
{"m": 10, "n": 10, "k": 10, "tile_m": 1, "tile_n": 1, "threads": 128, "grouping": 16, "minblocks": 4, "algorithm": "small", "perf": 132.089, "source": "autotuned"},
{"m": 11, "n": 11, "k": 11, "tile_m": 1, "tile_n": 1, "threads": 128, "grouping": 16, "minblocks": 4, "algorithm": "small", "perf": 162.566, "source": "autotuned"},
{"m": 12, "n": 12, "k": 12, "tile_m": 1, "tile_n": 2, "w": 6, "v": 8, "threads": 96, "grouping": 16, "minblocks": 4, "algorithm": "largeDB2", "perf": 174.853, "source": "autotuned"},
{"m": 13, "n": 13, "k": 13, "tile_m": 2, "tile_n": 1, "threads": 96, "grouping": 16, "minblocks": 12, "algorithm": "small", "perf": 184.195, "source": "autotuned"},
{"m": 14, "n": 14, "k": 14, "tile_m": 2, "tile_n": 2, "threads": 96, "grouping": 16, "minblocks": 12, "algorithm": "medium", "perf": 205.751, "source": "autotuned"},
{"m": 15, "n": 15, "k": 15, "tile_m": 2, "tile_n": 2, "threads": 96, "grouping": 16, "minblocks": 12, "algorithm": "medium", "perf": 221.72, "source": "autotuned"},
{"m": 16, "n": 16, "k": 16, "tile_m": 2, "tile_n": 2, "w": 8, "v": 16, "threads": 128, "grouping": 16, "minblocks": 12, "algorithm": "largeDB2", "perf": 279.888, "source": "autotuned"},
{"m": 17, "n": 17, "k": 17, "tile_m": 2, "tile_n": 2, "w": 6, "v": 12, "threads": 128, "grouping": 16, "minblocks": 12, "algorithm": "largeDB2", "perf": 248.155, "source": "autotuned"},
{"m": 22, "n": 22, "k": 22, "tile_m": 3, "tile_n": 2, "w": 8, "v": 22, "threads": 96, "grouping": 16, "minblocks": 12, "algorithm": "largeDB2", "perf": 354.045, "source": "autotuned"},
{"m": 23, "n": 23, "k": 23, "tile_m": 3, "tile_n": 2, "w": 8, "v": 20, "threads": 96, "grouping": 16, "minblocks": 12, "algorithm": "largeDB2", "perf": 384.495, "source": "autotuned"},
{"m": 24, "n": 24, "k": 24, "tile_m": 3, "tile_n": 2, "w": 8, "v": 20, "threads": 96, "grouping": 16, "minblocks": 12, "algorithm": "largeDB2", "perf": 439.977, "source": "autotuned"},
{"m": 26, "n": 26, "k": 26, "tile_m": 2, "tile_n": 3, "w": 12, "v": 26, "threads": 128, "grouping": 16, "minblocks": 8, "algorithm": "largeDB2", "perf": 405.2, "source": "autotuned"},
{"m": 29, "n": 29, "k": 29, "tile_m": 2, "tile_n": 5, "w": 10, "v": 16, "threads": 96, "grouping": 16, "minblocks": 8, "algorithm": "largeDB2", "perf": 426.072, "source": "autotuned"},
{"m": 32, "n": 32, "k": 32, "tile_m": 2, "tile_n": 4, "w": 12, "v": 20, "threads": 128, "grouping": 16, "minblocks": 8, "algorithm": "largeDB2", "perf": 530.707, "source": "autotuned"}
]