src/acc/libsmm_acc/libcusmm/parameters_K80.json
[
{"m": 5, "n": 5, "k": 5, "threads": 64, "grouping": 16, "minblocks": 1, "algorithm": "tiny", "perf": 33.4544},
{"m": 6, "n": 6, "k": 6, "threads": 96, "grouping": 16, "minblocks": 1, "algorithm": "tiny", "perf": 47.3645},
{"m": 7, "n": 7, "k": 7, "threads": 96, "grouping": 16, "minblocks": 1, "algorithm": "tiny", "perf": 70.7194},
{"m": 8, "n": 8, "k": 8, "threads": 96, "grouping": 16, "minblocks": 1, "algorithm": "tiny", "perf": 103.662},
{"m": 9, "n": 9, "k": 9, "tile_m": 1, "tile_n": 1, "threads": 96, "grouping": 16, "minblocks": 4, "algorithm": "small", "perf": 117.001},
{"m": 10, "n": 10, "k": 10, "tile_m": 2, "tile_n": 1, "w": 4, "v": 10, "threads": 96, "grouping": 16, "minblocks": 4, "algorithm": "largeDB2", "perf": 115.19},
{"m": 11, "n": 11, "k": 11, "tile_m": 1, "tile_n": 1, "threads": 128, "grouping": 16, "minblocks": 1, "algorithm": "small", "perf": 168.009},
{"m": 12, "n": 12, "k": 12, "tile_m": 3, "tile_n": 2, "w": 6, "v": 12, "threads": 96, "grouping": 16, "minblocks": 4, "algorithm": "largeDB2", "perf": 193.79},
{"m": 13, "n": 13, "k": 13, "tile_m": 2, "tile_n": 2, "threads": 96, "grouping": 16, "minblocks": 12, "algorithm": "medium", "perf": 204.17},
{"m": 14, "n": 14, "k": 14, "tile_m": 4, "tile_n": 2, "threads": 96, "grouping": 16, "minblocks": 1, "algorithm": "medium", "perf": 239.224},
{"m": 15, "n": 15, "k": 15, "tile_m": 4, "tile_n": 2, "threads": 96, "grouping": 16, "minblocks": 8, "algorithm": "medium", "perf": 275.724},
{"m": 16, "n": 16, "k": 16, "tile_m": 4, "tile_n": 2, "w": 8, "v": 16, "threads": 128, "grouping": 16, "minblocks": 1, "algorithm": "largeDB2", "perf": 322.824},
{"m": 17, "n": 17, "k": 17, "tile_m": 2, "tile_n": 3, "w": 6, "v": 14, "threads": 128, "grouping": 16, "minblocks": 8, "algorithm": "largeDB2", "perf": 279.903},
{"m": 22, "n": 22, "k": 22, "tile_m": 3, "tile_n": 3, "w": 8, "v": 22, "threads": 96, "grouping": 16, "minblocks": 8, "algorithm": "largeDB2", "perf": 405.672},
{"m": 23, "n": 23, "k": 23, "tile_m": 3, "tile_n": 3, "w": 8, "v": 12, "threads": 96, "grouping": 16, "minblocks": 8, "algorithm": "largeDB2", "perf": 439.289},
{"m": 24, "n": 24, "k": 24, "tile_m": 6, "tile_n": 3, "w": 12, "v": 24, "threads": 96, "grouping": 16, "minblocks": 4, "algorithm": "largeDB2", "perf": 506.39},
{"m": 26, "n": 26, "k": 26, "tile_m": 3, "tile_n": 4, "w": 10, "v": 26, "threads": 96, "grouping": 16, "minblocks": 4, "algorithm": "largeDB2", "perf": 464.067},
{"m": 29, "n": 29, "k": 29, "tile_m": 3, "tile_n": 5, "w": 12, "v": 28, "threads": 96, "grouping": 16, "minblocks": 1, "algorithm": "largeDB2", "perf": 491.026},
{"m": 32, "n": 32, "k": 32, "tile_m": 4, "tile_n": 4, "w": 8, "v": 26, "threads": 128, "grouping": 16, "minblocks": 1, "algorithm": "largeDB2", "perf": 594.053}
]