src/acc/libsmm_acc/libcusmm/parameters_P100.json
[
{"m": 4, "n": 4, "k": 4, "tile_m": 1, "tile_n": 1, "threads": 32, "grouping": 16, "minblocks": 9, "algorithm": "medium", "perf": 146.542},
{"m": 4, "n": 4, "k": 5, "tile_m": 1, "tile_n": 1, "threads": 32, "grouping": 18, "minblocks": 10, "algorithm": "medium", "perf": 177.041},
{"m": 4, "n": 4, "k": 6, "tile_m": 1, "tile_n": 1, "threads": 32, "grouping": 16, "minblocks": 16, "algorithm": "medium", "perf": 206.475},
{"m": 4, "n": 4, "k": 7, "tile_m": 1, "tile_n": 1, "threads": 32, "grouping": 16, "minblocks": 9, "algorithm": "medium", "perf": 219.254},
{"m": 4, "n": 4, "k": 8, "threads": 32, "grouping": 12, "minblocks": 28, "algorithm": "tiny", "perf": 224.843},
{"m": 4, "n": 4, "k": 9, "tile_m": 1, "tile_n": 1, "threads": 32, "grouping": 16, "minblocks": 2, "algorithm": "medium", "perf": 212.125},
{"m": 4, "n": 4, "k": 10, "tile_m": 1, "tile_n": 1, "threads": 32, "grouping": 16, "minblocks": 23, "algorithm": "medium", "perf": 230.568},
{"m": 4, "n": 4, "k": 13, "tile_m": 1, "tile_n": 1, "threads": 32, "grouping": 12, "minblocks": 26, "algorithm": "medium", "perf": 277.241},
{"m": 4, "n": 4, "k": 15, "tile_m": 1, "tile_n": 1, "threads": 32, "grouping": 12, "minblocks": 18, "algorithm": "medium", "perf": 306.278},
{"m": 4, "n": 4, "k": 25, "tile_m": 1, "tile_n": 1, "threads": 32, "grouping": 18, "minblocks": 17, "algorithm": "medium", "perf": 296.162},
{"m": 4, "n": 4, "k": 26, "tile_m": 1, "tile_n": 1, "threads": 32, "grouping": 16, "minblocks": 18, "algorithm": "medium", "perf": 298.901},
{"m": 4, "n": 4, "k": 28, "tile_m": 1, "tile_n": 1, "threads": 32, "grouping": 16, "minblocks": 11, "algorithm": "medium", "perf": 299.878},
{"m": 4, "n": 4, "k": 32, "tile_m": 1, "tile_n": 1, "threads": 32, "grouping": 3, "minblocks": 14, "algorithm": "small", "perf": 303.953},
{"m": 4, "n": 4, "k": 45, "tile_m": 1, "tile_n": 1, "threads": 64, "grouping": 3, "minblocks": 2, "algorithm": "medium", "perf": 294.358},
{"m": 4, "n": 5, "k": 4, "tile_m": 1, "tile_n": 1, "threads": 32, "grouping": 18, "minblocks": 11, "algorithm": "medium", "perf": 177.692},
{"m": 4, "n": 5, "k": 5, "tile_m": 1, "tile_n": 1, "threads": 32, "grouping": 16, "minblocks": 11, "algorithm": "medium", "perf": 217.191},
{"m": 4, "n": 5, "k": 6, "tile_m": 1, "tile_n": 1, "threads": 32, "grouping": 16, "minblocks": 22, "algorithm": "medium", "perf": 236.563},
{"m": 4, "n": 5, "k": 7, "tile_m": 1, "tile_n": 1, "threads": 32, "grouping": 16, "minblocks": 21, "algorithm": "medium", "perf": 211.342},
{"m": 4, "n": 5, "k": 8, "tile_m": 1, "tile_n": 1, "threads": 32, "grouping": 16, "minblocks": 1, "algorithm": "medium", "perf": 221.036},
{"m": 4, "n": 5, "k": 9, "tile_m": 1, "tile_n": 1, "threads": 32, "grouping": 16, "minblocks": 4, "algorithm": "medium", "perf": 229.753},
{"m": 4, "n": 5, "k": 13, "tile_m": 1, "tile_n": 1, "threads": 32, "grouping": 13, "minblocks": 9, "algorithm": "medium", "perf": 289.348},
{"m": 4, "n": 5, "k": 25, "tile_m": 1, "tile_n": 1, "threads": 32, "grouping": 3, "minblocks": 13, "algorithm": "medium", "perf": 321.429},
{"m": 4, "n": 5, "k": 26, "tile_m": 1, "tile_n": 1, "threads": 32, "grouping": 3, "minblocks": 10, "algorithm": "medium", "perf": 314.511},
{"m": 4, "n": 5, "k": 28, "tile_m": 1, "tile_n": 1, "threads": 32, "grouping": 4, "minblocks": 1, "algorithm": "medium", "perf": 320.416},
{"m": 4, "n": 5, "k": 32, "tile_m": 1, "tile_n": 1, "threads": 64, "grouping": 3, "minblocks": 21, "algorithm": "medium", "perf": 329.232},
{"m": 4, "n": 5, "k": 45, "tile_m": 1, "tile_n": 1, "threads": 64, "grouping": 4, "minblocks": 9, "algorithm": "medium", "perf": 321.273},
{"m": 4, "n": 6, "k": 4, "tile_m": 1, "tile_n": 1, "threads": 32, "grouping": 18, "minblocks": 15, "algorithm": "medium", "perf": 212.803},
{"m": 4, "n": 6, "k": 5, "tile_m": 1, "tile_n": 1, "threads": 32, "grouping": 16, "minblocks": 5, "algorithm": "medium", "perf": 249.115},
{"m": 4, "n": 6, "k": 6, "tile_m": 1, "tile_n": 1, "threads": 32, "grouping": 16, "minblocks": 7, "algorithm": "medium", "perf": 220.182},
{"m": 4, "n": 6, "k": 7, "tile_m": 1, "tile_n": 1, "threads": 32, "grouping": 16, "minblocks": 25, "algorithm": "medium", "perf": 249.712},
{"m": 4, "n": 6, "k": 8, "tile_m": 1, "tile_n": 1, "threads": 32, "grouping": 16, "minblocks": 11, "algorithm": "medium", "perf": 261.366},
{"m": 4, "n": 6, "k": 9, "tile_m": 1, "tile_n": 1, "threads": 32, "grouping": 13, "minblocks": 7, "algorithm": "medium", "perf": 270.512},
{"m": 4, "n": 7, "k": 4, "tile_m": 1, "tile_n": 1, "threads": 32, "grouping": 18, "minblocks": 3, "algorithm": "medium", "perf": 247.865},
{"m": 4, "n": 7, "k": 5, "tile_m": 1, "tile_n": 1, "threads": 32, "grouping": 16, "minblocks": 10, "algorithm": "medium", "perf": 221.348},
{"m": 4, "n": 7, "k": 6, "tile_m": 1, "tile_n": 1, "threads": 32, "grouping": 15, "minblocks": 21, "algorithm": "medium", "perf": 253.675},
{"m": 4, "n": 7, "k": 7, "tile_m": 1, "tile_n": 1, "threads": 32, "grouping": 16, "minblocks": 26, "algorithm": "medium", "perf": 283.879},
{"m": 4, "n": 7, "k": 8, "tile_m": 1, "tile_n": 1, "threads": 32, "grouping": 13, "minblocks": 27, "algorithm": "medium", "perf": 296.012},
{"m": 4, "n": 7, "k": 9, "tile_m": 1, "tile_n": 1, "threads": 32, "grouping": 13, "minblocks": 1, "algorithm": "medium", "perf": 308.449},
{"m": 4, "n": 7, "k": 13, "tile_m": 1, "tile_n": 1, "threads": 32, "grouping": 11, "minblocks": 20, "algorithm": "medium", "perf": 367.159},
{"m": 4, "n": 7, "k": 25, "tile_m": 1, "tile_n": 1, "threads": 64, "grouping": 4, "minblocks": 3, "algorithm": "medium", "perf": 359.977},
{"m": 4, "n": 7, "k": 26, "tile_m": 1, "tile_n": 1, "threads": 64, "grouping": 4, "minblocks": 18, "algorithm": "medium", "perf": 366.138},
{"m": 4, "n": 7, "k": 28, "tile_m": 1, "tile_n": 1, "threads": 64, "grouping": 4, "minblocks": 9, "algorithm": "medium", "perf": 366.881},
{"m": 4, "n": 7, "k": 32, "tile_m": 1, "tile_n": 1, "threads": 64, "grouping": 4, "minblocks": 17, "algorithm": "medium", "perf": 372.257},
{"m": 4, "n": 7, "k": 45, "tile_m": 1, "tile_n": 1, "threads": 64, "grouping": 4, "minblocks": 1, "algorithm": "medium", "perf": 364.346},
{"m": 4, "n": 8, "k": 4, "tile_m": 1, "tile_n": 1, "threads": 32, "grouping": 16, "minblocks": 27, "algorithm": "medium", "perf": 238.702},
{"m": 4, "n": 8, "k": 5, "tile_m": 1, "tile_n": 1, "threads": 32, "grouping": 16, "minblocks": 2, "algorithm": "medium", "perf": 250.59},
{"m": 4, "n": 8, "k": 6, "tile_m": 1, "tile_n": 1, "threads": 32, "grouping": 15, "minblocks": 19, "algorithm": "medium", "perf": 289.589},
{"m": 4, "n": 8, "k": 7, "tile_m": 1, "tile_n": 1, "threads": 32, "grouping": 13, "minblocks": 13, "algorithm": "medium", "perf": 321.553},
{"m": 4, "n": 8, "k": 8, "tile_m": 1, "tile_n": 1, "threads": 32, "grouping": 11, "minblocks": 25, "algorithm": "medium", "perf": 316.767},
{"m": 4, "n": 8, "k": 9, "tile_m": 1, "tile_n": 1, "threads": 32, "grouping": 13, "minblocks": 27, "algorithm": "medium", "perf": 338.79},
{"m": 4, "n": 9, "k": 4, "tile_m": 2, "tile_n": 1, "threads": 32, "grouping": 16, "minblocks": 2, "algorithm": "medium", "perf": 227.781},
{"m": 4, "n": 9, "k": 5, "tile_m": 2, "tile_n": 1, "threads": 32, "grouping": 16, "minblocks": 7, "algorithm": "medium", "perf": 266.956},
{"m": 4, "n": 9, "k": 6, "tile_m": 2, "tile_n": 1, "threads": 32, "grouping": 13, "minblocks": 7, "algorithm": "medium", "perf": 312.537},
{"m": 4, "n": 9, "k": 7, "tile_m": 2, "tile_n": 1, "threads": 32, "grouping": 12, "minblocks": 8, "algorithm": "medium", "perf": 337.427},
{"m": 4, "n": 9, "k": 8, "tile_m": 2, "tile_n": 1, "threads": 32, "grouping": 13, "minblocks": 19, "algorithm": "medium", "perf": 339.161},
{"m": 4, "n": 9, "k": 9, "tile_m": 2, "tile_n": 1, "threads": 32, "grouping": 13, "minblocks": 21, "algorithm": "medium", "perf": 345.165},
{"m": 4, "n": 9, "k": 13, "tile_m": 1, "tile_n": 2, "threads": 32, "grouping": 13, "minblocks": 5, "algorithm": "medium", "perf": 387.107},
{"m": 4, "n": 9, "k": 25, "tile_m": 1, "tile_n": 1, "threads": 64, "grouping": 4, "minblocks": 6, "algorithm": "medium", "perf": 386.259},
{"m": 4, "n": 9, "k": 26, "tile_m": 1, "tile_n": 1, "threads": 64, "grouping": 4, "minblocks": 17, "algorithm": "medium", "perf": 388.032},
{"m": 4, "n": 9, "k": 28, "tile_m": 1, "tile_n": 1, "threads": 64, "grouping": 4, "minblocks": 16, "algorithm": "medium", "perf": 393.694},
{"m": 4, "n": 9, "k": 32, "tile_m": 1, "tile_n": 1, "threads": 64, "grouping": 4, "minblocks": 8, "algorithm": "medium", "perf": 394.752},
{"m": 4, "n": 9, "k": 45, "tile_m": 1, "tile_n": 1, "threads": 128, "grouping": 4, "minblocks": 4, "algorithm": "medium", "perf": 391.427},
{"m": 4, "n": 10, "k": 4, "tile_m": 2, "tile_n": 1, "threads": 32, "grouping": 16, "minblocks": 2, "algorithm": "medium", "perf": 250.088},
{"m": 4, "n": 10, "k": 10, "tile_m": 2, "tile_n": 1, "threads": 32, "grouping": 13, "minblocks": 11, "algorithm": "medium", "perf": 391.438},
{"m": 4, "n": 10, "k": 15, "tile_m": 2, "tile_n": 1, "threads": 32, "grouping": 13, "minblocks": 12, "algorithm": "medium", "perf": 397.304},
{"m": 4, "n": 13, "k": 4, "tile_m": 2, "tile_n": 1, "threads": 32, "grouping": 16, "minblocks": 6, "algorithm": "medium", "perf": 311.366},
{"m": 4, "n": 13, "k": 5, "tile_m": 1, "tile_n": 2, "threads": 32, "grouping": 13, "minblocks": 10, "algorithm": "medium", "perf": 351.076},
{"m": 4, "n": 13, "k": 7, "tile_m": 1, "tile_n": 2, "threads": 32, "grouping": 12, "minblocks": 17, "algorithm": "medium", "perf": 428.77},
{"m": 4, "n": 13, "k": 9, "tile_m": 1, "tile_n": 2, "threads": 32, "grouping": 13, "minblocks": 19, "algorithm": "medium", "perf": 418.275},
{"m": 4, "n": 13, "k": 13, "tile_m": 1, "tile_n": 1, "threads": 64, "grouping": 6, "minblocks": 5, "algorithm": "medium", "perf": 420.747},
{"m": 4, "n": 13, "k": 25, "tile_m": 1, "tile_n": 1, "threads": 64, "grouping": 4, "minblocks": 13, "algorithm": "medium", "perf": 427.859},
{"m": 4, "n": 13, "k": 26, "tile_m": 1, "tile_n": 1, "threads": 64, "grouping": 4, "minblocks": 9, "algorithm": "medium", "perf": 434.909},
{"m": 4, "n": 13, "k": 28, "tile_m": 1, "tile_n": 1, "threads": 128, "grouping": 4, "minblocks": 2, "algorithm": "medium", "perf": 436.522},
{"m": 4, "n": 13, "k": 32, "tile_m": 1, "tile_n": 1, "threads": 64, "grouping": 4, "minblocks": 8, "algorithm": "medium", "perf": 438.394},
{"m": 4, "n": 13, "k": 45, "tile_m": 1, "tile_n": 1, "threads": 128, "grouping": 4, "minblocks": 2, "algorithm": "medium", "perf": 436.72},
{"m": 4, "n": 15, "k": 4, "tile_m": 2, "tile_n": 1, "threads": 32, "grouping": 13, "minblocks": 5, "algorithm": "medium", "perf": 354.445},
{"m": 4, "n": 15, "k": 10, "tile_m": 1, "tile_n": 2, "threads": 32, "grouping": 13, "minblocks": 14, "algorithm": "medium", "perf": 431.464},
{"m": 4, "n": 15, "k": 15, "tile_m": 1, "tile_n": 1, "threads": 64, "grouping": 26, "minblocks": 12, "algorithm": "medium", "perf": 442.867},
{"m": 4, "n": 25, "k": 4, "tile_m": 5, "tile_n": 1, "threads": 32, "grouping": 13, "minblocks": 7, "algorithm": "medium", "perf": 445.525},
{"m": 4, "n": 25, "k": 5, "tile_m": 6, "tile_n": 1, "threads": 32, "grouping": 13, "minblocks": 2, "algorithm": "medium", "perf": 455.615},
{"m": 4, "n": 25, "k": 7, "tile_m": 4, "tile_n": 1, "threads": 32, "grouping": 16, "minblocks": 8, "algorithm": "medium", "perf": 454.983},
{"m": 4, "n": 25, "k": 9, "tile_m": 2, "tile_n": 1, "threads": 64, "grouping": 24, "minblocks": 7, "algorithm": "medium", "perf": 458.769},
{"m": 4, "n": 25, "k": 13, "tile_m": 2, "tile_n": 1, "threads": 64, "grouping": 4, "minblocks": 13, "algorithm": "medium", "perf": 471.674},
{"m": 4, "n": 25, "k": 25, "tile_m": 2, "tile_n": 1, "threads": 128, "grouping": 3, "minblocks": 5, "algorithm": "medium", "perf": 481.216},
{"m": 4, "n": 25, "k": 26, "tile_m": 2, "tile_n": 1, "threads": 128, "grouping": 4, "minblocks": 6, "algorithm": "medium", "perf": 484.075},
{"m": 4, "n": 25, "k": 28, "tile_m": 1, "tile_n": 1, "threads": 128, "grouping": 3, "minblocks": 2, "algorithm": "medium", "perf": 486.834},
{"m": 4, "n": 25, "k": 32, "tile_m": 1, "tile_n": 2, "threads": 128, "grouping": 3, "minblocks": 2, "algorithm": "medium", "perf": 492.058},
{"m": 4, "n": 25, "k": 45, "tile_m": 1, "tile_n": 1, "threads": 192, "grouping": 3, "minblocks": 3, "algorithm": "medium", "perf": 490.296},
{"m": 4, "n": 26, "k": 4, "tile_m": 4, "tile_n": 1, "threads": 32, "grouping": 12, "minblocks": 2, "algorithm": "medium", "perf": 450.52},
{"m": 4, "n": 26, "k": 5, "tile_m": 4, "tile_n": 1, "threads": 32, "grouping": 13, "minblocks": 3, "algorithm": "medium", "perf": 452.479},
{"m": 4, "n": 26, "k": 7, "tile_m": 2, "tile_n": 2, "threads": 32, "grouping": 18, "minblocks": 4, "algorithm": "medium", "perf": 462.349},
{"m": 4, "n": 26, "k": 9, "tile_m": 2, "tile_n": 1, "threads": 64, "grouping": 26, "minblocks": 1, "algorithm": "medium", "perf": 458.638},
{"m": 4, "n": 26, "k": 13, "tile_m": 1, "tile_n": 2, "threads": 64, "grouping": 26, "minblocks": 7, "algorithm": "medium", "perf": 475.833},
{"m": 4, "n": 26, "k": 25, "tile_m": 1, "tile_n": 1, "threads": 128, "grouping": 3, "minblocks": 5, "algorithm": "medium", "perf": 485.815},
{"m": 4, "n": 26, "k": 26, "tile_m": 2, "tile_n": 1, "threads": 128, "grouping": 3, "minblocks": 6, "algorithm": "medium", "perf": 486.965},
{"m": 4, "n": 26, "k": 28, "tile_m": 1, "tile_n": 1, "threads": 128, "grouping": 3, "minblocks": 5, "algorithm": "medium", "perf": 488.784},
{"m": 4, "n": 26, "k": 32, "tile_m": 1, "tile_n": 1, "threads": 160, "grouping": 2, "minblocks": 3, "algorithm": "medium", "perf": 494.485},
{"m": 4, "n": 26, "k": 45, "tile_m": 1, "tile_n": 1, "threads": 192, "grouping": 3, "minblocks": 1, "algorithm": "medium", "perf": 494.086},
{"m": 4, "n": 28, "k": 4, "tile_m": 1, "tile_n": 5, "threads": 32, "grouping": 13, "minblocks": 6, "algorithm": "medium", "perf": 442.777},
{"m": 4, "n": 28, "k": 5, "tile_m": 6, "tile_n": 1, "threads": 32, "grouping": 13, "minblocks": 23, "algorithm": "medium", "perf": 450.581},
{"m": 4, "n": 28, "k": 7, "tile_m": 4, "tile_n": 1, "threads": 64, "grouping": 22, "minblocks": 8, "algorithm": "medium", "perf": 462.427},
{"m": 4, "n": 28, "k": 9, "tile_m": 2, "tile_n": 1, "threads": 64, "grouping": 26, "minblocks": 17, "algorithm": "medium", "perf": 474.408},
{"m": 4, "n": 28, "k": 13, "tile_m": 2, "tile_n": 1, "threads": 64, "grouping": 32, "minblocks": 7, "algorithm": "medium", "perf": 484.113},
{"m": 4, "n": 28, "k": 25, "tile_m": 1, "tile_n": 1, "threads": 128, "grouping": 5, "minblocks": 7, "algorithm": "medium", "perf": 487.596},
{"m": 4, "n": 28, "k": 26, "tile_m": 2, "tile_n": 1, "threads": 128, "grouping": 4, "minblocks": 3, "algorithm": "medium", "perf": 487.843},
{"m": 4, "n": 28, "k": 28, "tile_m": 1, "tile_n": 1, "threads": 128, "grouping": 4, "minblocks": 5, "algorithm": "medium", "perf": 489.847},
{"m": 4, "n": 28, "k": 32, "tile_m": 2, "tile_n": 1, "threads": 192, "grouping": 4, "minblocks": 3, "algorithm": "medium", "perf": 497.128},
{"m": 4, "n": 28, "k": 45, "tile_m": 1, "tile_n": 1, "threads": 192, "grouping": 3, "minblocks": 2, "algorithm": "medium", "perf": 502.934},
{"m": 4, "n": 32, "k": 4, "tile_m": 4, "tile_n": 1, "threads": 32, "grouping": 13, "minblocks": 2, "algorithm": "medium", "perf": 460.973},
{"m": 4, "n": 32, "k": 5, "tile_m": 5, "tile_n": 1, "threads": 32, "grouping": 17, "minblocks": 5, "algorithm": "medium", "perf": 463.913},
{"m": 4, "n": 32, "k": 7, "tile_m": 2, "tile_n": 1, "threads": 64, "grouping": 4, "minblocks": 21, "algorithm": "medium", "perf": 475.538},
{"m": 4, "n": 32, "k": 9, "tile_m": 1, "tile_n": 2, "threads": 64, "grouping": 4, "minblocks": 8, "algorithm": "medium", "perf": 481.514},
{"m": 4, "n": 32, "k": 13, "tile_m": 1, "tile_n": 2, "threads": 64, "grouping": 32, "minblocks": 5, "algorithm": "medium", "perf": 491.05},
{"m": 4, "n": 32, "k": 25, "tile_m": 1, "tile_n": 1, "threads": 128, "grouping": 5, "minblocks": 6, "algorithm": "medium", "perf": 495.767},
{"m": 4, "n": 32, "k": 26, "tile_m": 1, "tile_n": 2, "w": 8, "v": 16, "threads": 64, "grouping": 16, "minblocks": 1, "algorithm": "largeDB2", "perf": 500.984},
{"m": 4, "n": 32, "k": 28, "tile_m": 1, "tile_n": 1, "threads": 256, "grouping": 5, "minblocks": 6, "algorithm": "medium", "perf": 501.158},
{"m": 4, "n": 32, "k": 32, "tile_m": 1, "tile_n": 1, "threads": 256, "grouping": 4, "minblocks": 1, "algorithm": "medium", "perf": 508.453},
{"m": 4, "n": 32, "k": 45, "tile_m": 1, "tile_n": 1, "threads": 192, "grouping": 3, "minblocks": 3, "algorithm": "medium", "perf": 513.575},
{"m": 4, "n": 45, "k": 4, "tile_m": 1, "tile_n": 3, "threads": 64, "grouping": 19, "minblocks": 2, "algorithm": "medium", "perf": 451.602},
{"m": 4, "n": 45, "k": 5, "tile_m": 1, "tile_n": 6, "threads": 64, "grouping": 26, "minblocks": 12, "algorithm": "medium", "perf": 455.413},
{"m": 4, "n": 45, "k": 7, "tile_m": 4, "tile_n": 1, "threads": 64, "grouping": 26, "minblocks": 4, "algorithm": "medium", "perf": 473.951},
{"m": 4, "n": 45, "k": 9, "tile_m": 1, "tile_n": 2, "threads": 96, "grouping": 29, "minblocks": 12, "algorithm": "medium", "perf": 476.94},
{"m": 4, "n": 45, "k": 13, "tile_m": 2, "tile_n": 2, "threads": 64, "grouping": 26, "minblocks": 5, "algorithm": "medium", "perf": 489.857},
{"m": 4, "n": 45, "k": 25, "tile_m": 2, "tile_n": 1, "threads": 128, "grouping": 3, "minblocks": 2, "algorithm": "medium", "perf": 508.404},
{"m": 4, "n": 45, "k": 26, "tile_m": 1, "tile_n": 1, "threads": 192, "grouping": 4, "minblocks": 4, "algorithm": "medium", "perf": 512.756},
{"m": 4, "n": 45, "k": 28, "tile_m": 2, "tile_n": 1, "threads": 128, "grouping": 3, "minblocks": 4, "algorithm": "medium", "perf": 516.097},
{"m": 4, "n": 45, "k": 32, "tile_m": 1, "tile_n": 2, "threads": 192, "grouping": 3, "minblocks": 2, "algorithm": "medium", "perf": 523.467},
{"m": 4, "n": 45, "k": 45, "tile_m": 1, "tile_n": 1, "threads": 256, "grouping": 3, "minblocks": 1, "algorithm": "medium", "perf": 529.993},
{"m": 5, "n": 4, "k": 4, "tile_m": 1, "tile_n": 1, "threads": 32, "grouping": 18, "minblocks": 15, "algorithm": "medium", "perf": 177.029},
{"m": 5, "n": 4, "k": 5, "tile_m": 1, "tile_n": 1, "threads": 32, "grouping": 18, "minblocks": 3, "algorithm": "medium", "perf": 214.145},
{"m": 5, "n": 4, "k": 6, "tile_m": 1, "tile_n": 1, "threads": 32, "grouping": 16, "minblocks": 1, "algorithm": "medium", "perf": 233.353},
{"m": 5, "n": 4, "k": 7, "tile_m": 1, "tile_n": 1, "threads": 32, "grouping": 16, "minblocks": 24, "algorithm": "medium", "perf": 211.838},
{"m": 5, "n": 4, "k": 8, "tile_m": 1, "tile_n": 1, "threads": 32, "grouping": 16, "minblocks": 4, "algorithm": "medium", "perf": 220.845},
{"m": 5, "n": 4, "k": 9, "tile_m": 1, "tile_n": 1, "threads": 32, "grouping": 16, "minblocks": 14, "algorithm": "medium", "perf": 228.292},
{"m": 5, "n": 4, "k": 13, "tile_m": 1, "tile_n": 1, "threads": 32, "grouping": 13, "minblocks": 20, "algorithm": "medium", "perf": 276.437},
{"m": 5, "n": 4, "k": 25, "tile_m": 1, "tile_n": 1, "threads": 32, "grouping": 16, "minblocks": 8, "algorithm": "medium", "perf": 312.504},
{"m": 5, "n": 4, "k": 26, "tile_m": 1, "tile_n": 1, "threads": 32, "grouping": 9, "minblocks": 17, "algorithm": "medium", "perf": 310.699},
{"m": 5, "n": 4, "k": 28, "tile_m": 1, "tile_n": 1, "threads": 64, "grouping": 4, "minblocks": 23, "algorithm": "medium", "perf": 314.448},
{"m": 5, "n": 4, "k": 32, "tile_m": 1, "tile_n": 1, "threads": 64, "grouping": 3, "minblocks": 21, "algorithm": "medium", "perf": 327.177},
{"m": 5, "n": 4, "k": 45, "tile_m": 1, "tile_n": 1, "threads": 64, "grouping": 3, "minblocks": 5, "algorithm": "medium", "perf": 314.251},
{"m": 5, "n": 5, "k": 4, "tile_m": 1, "tile_n": 1, "threads": 32, "grouping": 16, "minblocks": 1, "algorithm": "medium", "perf": 225.089},
{"m": 5, "n": 5, "k": 5, "tile_m": 1, "tile_n": 1, "threads": 32, "grouping": 16, "minblocks": 15, "algorithm": "medium", "perf": 260.59},
{"m": 5, "n": 5, "k": 6, "tile_m": 1, "tile_n": 1, "threads": 32, "grouping": 16, "minblocks": 10, "algorithm": "medium", "perf": 285.889},
{"m": 5, "n": 5, "k": 7, "tile_m": 1, "tile_n": 1, "threads": 32, "grouping": 13, "minblocks": 17, "algorithm": "medium", "perf": 262.967},
{"m": 5, "n": 5, "k": 8, "tile_m": 1, "tile_n": 1, "threads": 32, "grouping": 16, "minblocks": 14, "algorithm": "medium", "perf": 288.785},
{"m": 5, "n": 5, "k": 9, "tile_m": 1, "tile_n": 1, "threads": 32, "grouping": 13, "minblocks": 17, "algorithm": "medium", "perf": 311.74},
{"m": 5, "n": 5, "k": 12, "tile_m": 1, "tile_n": 1, "threads": 32, "grouping": 12, "minblocks": 3, "algorithm": "medium", "perf": 375.736},
{"m": 5, "n": 5, "k": 13, "tile_m": 1, "tile_n": 1, "threads": 32, "grouping": 13, "minblocks": 17, "algorithm": "medium", "perf": 363.798},
{"m": 5, "n": 5, "k": 16, "tile_m": 1, "tile_n": 1, "threads": 32, "grouping": 13, "minblocks": 13, "algorithm": "medium", "perf": 384.724},
{"m": 5, "n": 5, "k": 24, "tile_m": 1, "tile_n": 1, "threads": 64, "grouping": 4, "minblocks": 22, "algorithm": "medium", "perf": 372.44},
{"m": 5, "n": 5, "k": 25, "tile_m": 1, "tile_n": 1, "threads": 64, "grouping": 3, "minblocks": 23, "algorithm": "medium", "perf": 364.992},
{"m": 5, "n": 5, "k": 26, "tile_m": 1, "tile_n": 1, "threads": 64, "grouping": 4, "minblocks": 4, "algorithm": "medium", "perf": 358.249},
{"m": 5, "n": 5, "k": 28, "tile_m": 1, "tile_n": 1, "threads": 64, "grouping": 4, "minblocks": 12, "algorithm": "medium", "perf": 359.923},
{"m": 5, "n": 5, "k": 32, "tile_m": 1, "tile_n": 1, "threads": 32, "grouping": 2, "minblocks": 17, "algorithm": "medium", "perf": 370.681},
{"m": 5, "n": 5, "k": 45, "tile_m": 1, "tile_n": 1, "threads": 64, "grouping": 3, "minblocks": 12, "algorithm": "medium", "perf": 356.319},
{"m": 5, "n": 6, "k": 4, "tile_m": 1, "tile_n": 1, "threads": 32, "grouping": 18, "minblocks": 23, "algorithm": "medium", "perf": 264.288},
{"m": 5, "n": 6, "k": 5, "tile_m": 1, "tile_n": 1, "threads": 32, "grouping": 16, "minblocks": 6, "algorithm": "medium", "perf": 293.115},
{"m": 5, "n": 6, "k": 6, "tile_m": 1, "tile_n": 1, "threads": 32, "grouping": 15, "minblocks": 7, "algorithm": "medium", "perf": 274.264},
{"m": 5, "n": 6, "k": 7, "tile_m": 1, "tile_n": 1, "threads": 32, "grouping": 16, "minblocks": 20, "algorithm": "medium", "perf": 273.457},
{"m": 5, "n": 6, "k": 8, "tile_m": 1, "tile_n": 1, "threads": 32, "grouping": 13, "minblocks": 7, "algorithm": "medium", "perf": 305.918},
{"m": 5, "n": 6, "k": 9, "tile_m": 1, "tile_n": 1, "threads": 32, "grouping": 13, "minblocks": 16, "algorithm": "medium", "perf": 328.197},
{"m": 5, "n": 7, "k": 4, "tile_m": 2, "tile_n": 1, "threads": 32, "grouping": 16, "minblocks": 20, "algorithm": "medium", "perf": 262.885},
{"m": 5, "n": 7, "k": 5, "tile_m": 2, "tile_n": 1, "threads": 32, "grouping": 16, "minblocks": 2, "algorithm": "medium", "perf": 256.737},
{"m": 5, "n": 7, "k": 6, "tile_m": 2, "tile_n": 1, "threads": 32, "grouping": 16, "minblocks": 20, "algorithm": "medium", "perf": 291.538},
{"m": 5, "n": 7, "k": 7, "tile_m": 1, "tile_n": 2, "threads": 32, "grouping": 16, "minblocks": 10, "algorithm": "medium", "perf": 295.189},
{"m": 5, "n": 7, "k": 8, "tile_m": 2, "tile_n": 1, "threads": 32, "grouping": 13, "minblocks": 25, "algorithm": "medium", "perf": 327.718},
{"m": 5, "n": 7, "k": 9, "tile_m": 2, "tile_n": 1, "threads": 32, "grouping": 13, "minblocks": 16, "algorithm": "medium", "perf": 349.89},
{"m": 5, "n": 7, "k": 13, "tile_m": 2, "tile_n": 1, "threads": 32, "grouping": 13, "minblocks": 18, "algorithm": "medium", "perf": 396.99},
{"m": 5, "n": 7, "k": 25, "tile_m": 1, "tile_n": 1, "threads": 64, "grouping": 26, "minblocks": 10, "algorithm": "medium", "perf": 395.03},
{"m": 5, "n": 7, "k": 26, "tile_m": 1, "tile_n": 1, "threads": 64, "grouping": 4, "minblocks": 3, "algorithm": "medium", "perf": 400.328},
{"m": 5, "n": 7, "k": 28, "tile_m": 1, "tile_n": 1, "threads": 64, "grouping": 4, "minblocks": 4, "algorithm": "medium", "perf": 400.111},
{"m": 5, "n": 7, "k": 32, "tile_m": 1, "tile_n": 1, "threads": 64, "grouping": 4, "minblocks": 4, "algorithm": "medium", "perf": 408.48},
{"m": 5, "n": 7, "k": 45, "tile_m": 1, "tile_n": 1, "threads": 96, "grouping": 3, "minblocks": 7, "algorithm": "medium", "perf": 402.851},
{"m": 5, "n": 8, "k": 4, "tile_m": 2, "tile_n": 1, "threads": 32, "grouping": 16, "minblocks": 9, "algorithm": "medium", "perf": 260.853},
{"m": 5, "n": 8, "k": 5, "tile_m": 2, "tile_n": 1, "threads": 32, "grouping": 16, "minblocks": 20, "algorithm": "medium", "perf": 290.836},
{"m": 5, "n": 8, "k": 6, "tile_m": 1, "tile_n": 2, "threads": 32, "grouping": 16, "minblocks": 3, "algorithm": "medium", "perf": 332.611},
{"m": 5, "n": 8, "k": 7, "tile_m": 1, "tile_n": 2, "threads": 32, "grouping": 16, "minblocks": 14, "algorithm": "medium", "perf": 332.852},
{"m": 5, "n": 8, "k": 8, "tile_m": 2, "tile_n": 1, "threads": 32, "grouping": 13, "minblocks": 14, "algorithm": "medium", "perf": 364.813},
{"m": 5, "n": 8, "k": 9, "tile_m": 1, "tile_n": 2, "threads": 32, "grouping": 13, "minblocks": 14, "algorithm": "medium", "perf": 383.158},
{"m": 5, "n": 9, "k": 4, "tile_m": 1, "tile_n": 2, "threads": 32, "grouping": 16, "minblocks": 16, "algorithm": "medium", "perf": 273.232},
{"m": 5, "n": 9, "k": 5, "tile_m": 2, "tile_n": 1, "threads": 32, "grouping": 16, "minblocks": 7, "algorithm": "medium", "perf": 321.78},
{"m": 5, "n": 9, "k": 6, "tile_m": 1, "tile_n": 2, "threads": 32, "grouping": 13, "minblocks": 5, "algorithm": "medium", "perf": 370.575},
{"m": 5, "n": 9, "k": 7, "tile_m": 2, "tile_n": 1, "threads": 32, "grouping": 13, "minblocks": 21, "algorithm": "medium", "perf": 372.988},
{"m": 5, "n": 9, "k": 8, "tile_m": 1, "tile_n": 2, "threads": 32, "grouping": 13, "minblocks": 2, "algorithm": "medium", "perf": 397.604},
{"m": 5, "n": 9, "k": 9, "tile_m": 1, "tile_n": 2, "threads": 32, "grouping": 13, "minblocks": 24, "algorithm": "medium", "perf": 420.547},
{"m": 5, "n": 9, "k": 13, "tile_m": 2, "tile_n": 1, "threads": 32, "grouping": 13, "minblocks": 26, "algorithm": "medium", "perf": 428.436},
{"m": 5, "n": 9, "k": 25, "tile_m": 1, "tile_n": 1, "threads": 64, "grouping": 26, "minblocks": 7, "algorithm": "medium", "perf": 437.524},
{"m": 5, "n": 9, "k": 26, "tile_m": 1, "tile_n": 1, "threads": 64, "grouping": 4, "minblocks": 12, "algorithm": "medium", "perf": 442.884},
{"m": 5, "n": 9, "k": 28, "tile_m": 1, "tile_n": 1, "threads": 64, "grouping": 4, "minblocks": 11, "algorithm": "medium", "perf": 446.122},
{"m": 5, "n": 9, "k": 32, "tile_m": 1, "tile_n": 1, "threads": 96, "grouping": 4, "minblocks": 2, "algorithm": "medium", "perf": 451.393},
{"m": 5, "n": 9, "k": 45, "tile_m": 1, "tile_n": 1, "threads": 128, "grouping": 4, "minblocks": 4, "algorithm": "medium", "perf": 448.595},
{"m": 5, "n": 12, "k": 5, "tile_m": 1, "tile_n": 2, "threads": 32, "grouping": 12, "minblocks": 12, "algorithm": "medium", "perf": 403.762},
{"m": 5, "n": 12, "k": 12, "tile_m": 1, "tile_n": 2, "threads": 32, "grouping": 13, "minblocks": 2, "algorithm": "medium", "perf": 482.763},
{"m": 5, "n": 12, "k": 13, "tile_m": 1, "tile_n": 2, "threads": 32, "grouping": 4, "minblocks": 9, "algorithm": "medium", "perf": 472.41},
{"m": 5, "n": 12, "k": 26, "tile_m": 1, "tile_n": 1, "threads": 64, "grouping": 4, "minblocks": 5, "algorithm": "medium", "perf": 493.318},
{"m": 5, "n": 12, "k": 32, "tile_m": 1, "tile_n": 1, "threads": 96, "grouping": 3, "minblocks": 2, "algorithm": "medium", "perf": 499.203},
{"m": 5, "n": 13, "k": 4, "tile_m": 3, "tile_n": 1, "threads": 32, "grouping": 13, "minblocks": 14, "algorithm": "medium", "perf": 371.523},
{"m": 5, "n": 13, "k": 5, "tile_m": 3, "tile_n": 1, "threads": 32, "grouping": 12, "minblocks": 3, "algorithm": "medium", "perf": 420.528},
{"m": 5, "n": 13, "k": 7, "tile_m": 3, "tile_n": 1, "threads": 32, "grouping": 13, "minblocks": 15, "algorithm": "medium", "perf": 463.048},
{"m": 5, "n": 13, "k": 9, "tile_m": 3, "tile_n": 1, "threads": 32, "grouping": 16, "minblocks": 15, "algorithm": "medium", "perf": 476.293},
{"m": 5, "n": 13, "k": 12, "tile_m": 1, "tile_n": 3, "threads": 64, "grouping": 22, "minblocks": 17, "algorithm": "medium", "perf": 487.729},
{"m": 5, "n": 13, "k": 13, "tile_m": 1, "tile_n": 3, "threads": 32, "grouping": 5, "minblocks": 1, "algorithm": "medium", "perf": 469.163},
{"m": 5, "n": 13, "k": 16, "tile_m": 1, "tile_n": 3, "threads": 96, "grouping": 29, "minblocks": 8, "algorithm": "medium", "perf": 486.36},
{"m": 5, "n": 13, "k": 24, "tile_m": 3, "tile_n": 1, "threads": 64, "grouping": 3, "minblocks": 4, "algorithm": "medium", "perf": 491.279},
{"m": 5, "n": 13, "k": 25, "tile_m": 1, "tile_n": 1, "threads": 128, "grouping": 5, "minblocks": 12, "algorithm": "medium", "perf": 485.413},
{"m": 5, "n": 13, "k": 26, "tile_m": 3, "tile_n": 1, "threads": 64, "grouping": 4, "minblocks": 5, "algorithm": "medium", "perf": 487.003},
{"m": 5, "n": 13, "k": 28, "tile_m": 1, "tile_n": 1, "threads": 96, "grouping": 4, "minblocks": 8, "algorithm": "medium", "perf": 491.337},
{"m": 5, "n": 13, "k": 32, "tile_m": 1, "tile_n": 1, "threads": 128, "grouping": 5, "minblocks": 2, "algorithm": "medium", "perf": 504.563},
{"m": 5, "n": 13, "k": 45, "tile_m": 1, "tile_n": 1, "threads": 128, "grouping": 3, "minblocks": 3, "algorithm": "medium", "perf": 499.154},
{"m": 5, "n": 16, "k": 5, "tile_m": 3, "tile_n": 1, "threads": 32, "grouping": 11, "minblocks": 16, "algorithm": "medium", "perf": 500.621},
{"m": 5, "n": 16, "k": 13, "tile_m": 1, "tile_n": 3, "threads": 64, "grouping": 4, "minblocks": 20, "algorithm": "medium", "perf": 504.808},
{"m": 5, "n": 16, "k": 16, "tile_m": 1, "tile_n": 1, "threads": 96, "grouping": 6, "minblocks": 14, "algorithm": "medium", "perf": 518.964},
{"m": 5, "n": 16, "k": 32, "tile_m": 1, "tile_n": 1, "threads": 128, "grouping": 4, "minblocks": 1, "algorithm": "medium", "perf": 532.529},
{"m": 5, "n": 24, "k": 5, "tile_m": 1, "tile_n": 4, "threads": 32, "grouping": 13, "minblocks": 19, "algorithm": "medium", "perf": 529.873},
{"m": 5, "n": 24, "k": 13, "tile_m": 1, "tile_n": 2, "threads": 96, "grouping": 32, "minblocks": 12, "algorithm": "medium", "perf": 547.828},
{"m": 5, "n": 24, "k": 24, "tile_m": 1, "tile_n": 2, "w": 8, "v": 24, "threads": 64, "grouping": 16, "minblocks": 4, "algorithm": "largeDB2", "perf": 573.313},
{"m": 5, "n": 24, "k": 26, "tile_m": 1, "tile_n": 2, "threads": 160, "grouping": 3, "minblocks": 8, "algorithm": "medium", "perf": 570.406},
{"m": 5, "n": 24, "k": 32, "tile_m": 1, "tile_n": 1, "threads": 192, "grouping": 2, "minblocks": 5, "algorithm": "medium", "perf": 579.512},
{"m": 5, "n": 25, "k": 4, "tile_m": 5, "tile_n": 1, "threads": 32, "grouping": 13, "minblocks": 1, "algorithm": "medium", "perf": 498.541},
{"m": 5, "n": 25, "k": 5, "tile_m": 6, "tile_n": 1, "threads": 32, "grouping": 15, "minblocks": 8, "algorithm": "medium", "perf": 512.665},
{"m": 5, "n": 25, "k": 7, "tile_m": 4, "tile_n": 1, "threads": 64, "grouping": 22, "minblocks": 3, "algorithm": "medium", "perf": 511.578},
{"m": 5, "n": 25, "k": 9, "tile_m": 3, "tile_n": 1, "threads": 64, "grouping": 26, "minblocks": 10, "algorithm": "medium", "perf": 542.861},
{"m": 5, "n": 25, "k": 13, "tile_m": 1, "tile_n": 1, "threads": 128, "grouping": 6, "minblocks": 12, "algorithm": "medium", "perf": 540.652},
{"m": 5, "n": 25, "k": 25, "tile_m": 1, "tile_n": 1, "threads": 128, "grouping": 3, "minblocks": 5, "algorithm": "medium", "perf": 567.148},
{"m": 5, "n": 25, "k": 26, "tile_m": 1, "tile_n": 1, "threads": 160, "grouping": 5, "minblocks": 1, "algorithm": "medium", "perf": 571.256},
{"m": 5, "n": 25, "k": 28, "tile_m": 1, "tile_n": 1, "threads": 192, "grouping": 4, "minblocks": 7, "algorithm": "medium", "perf": 571.421},
{"m": 5, "n": 25, "k": 32, "tile_m": 1, "tile_n": 1, "threads": 224, "grouping": 3, "minblocks": 6, "algorithm": "medium", "perf": 584.779},
{"m": 5, "n": 25, "k": 45, "tile_m": 1, "tile_n": 1, "threads": 256, "grouping": 3, "minblocks": 2, "algorithm": "medium", "perf": 583.507},
{"m": 5, "n": 26, "k": 4, "tile_m": 5, "tile_n": 1, "threads": 32, "grouping": 13, "minblocks": 11, "algorithm": "medium", "perf": 507.889},
{"m": 5, "n": 26, "k": 5, "tile_m": 5, "tile_n": 1, "threads": 32, "grouping": 16, "minblocks": 1, "algorithm": "medium", "perf": 520.031},
{"m": 5, "n": 26, "k": 7, "tile_m": 3, "tile_n": 1, "threads": 64, "grouping": 22, "minblocks": 15, "algorithm": "medium", "perf": 521.285},
{"m": 5, "n": 26, "k": 9, "tile_m": 3, "tile_n": 1, "threads": 64, "grouping": 26, "minblocks": 9, "algorithm": "medium", "perf": 549.571},
{"m": 5, "n": 26, "k": 12, "tile_m": 3, "tile_n": 1, "threads": 64, "grouping": 32, "minblocks": 2, "algorithm": "medium", "perf": 554.52},
{"m": 5, "n": 26, "k": 13, "tile_m": 1, "tile_n": 3, "threads": 96, "grouping": 32, "minblocks": 12, "algorithm": "medium", "perf": 549.535},
{"m": 5, "n": 26, "k": 24, "tile_m": 1, "tile_n": 2, "threads": 128, "grouping": 4, "minblocks": 6, "algorithm": "medium", "perf": 571.163},
{"m": 5, "n": 26, "k": 25, "tile_m": 1, "tile_n": 2, "threads": 128, "grouping": 4, "minblocks": 7, "algorithm": "medium", "perf": 568.459},
{"m": 5, "n": 26, "k": 26, "tile_m": 1, "tile_n": 2, "threads": 160, "grouping": 4, "minblocks": 2, "algorithm": "medium", "perf": 572.317},
{"m": 5, "n": 26, "k": 28, "tile_m": 1, "tile_n": 2, "threads": 160, "grouping": 5, "minblocks": 7, "algorithm": "medium", "perf": 573.92},
{"m": 5, "n": 26, "k": 32, "tile_m": 1, "tile_n": 2, "threads": 224, "grouping": 3, "minblocks": 6, "algorithm": "medium", "perf": 584.452},
{"m": 5, "n": 26, "k": 45, "tile_m": 1, "tile_n": 1, "threads": 256, "grouping": 3, "minblocks": 4, "algorithm": "medium", "perf": 587.258},
{"m": 5, "n": 28, "k": 4, "tile_m": 1, "tile_n": 5, "threads": 32, "grouping": 16, "minblocks": 21, "algorithm": "medium", "perf": 507.593},
{"m": 5, "n": 28, "k": 5, "tile_m": 5, "tile_n": 1, "threads": 32, "grouping": 19, "minblocks": 10, "algorithm": "medium", "perf": 526.317},
{"m": 5, "n": 28, "k": 7, "tile_m": 3, "tile_n": 1, "threads": 64, "grouping": 26, "minblocks": 13, "algorithm": "medium", "perf": 538.63},
{"m": 5, "n": 28, "k": 9, "tile_m": 3, "tile_n": 1, "threads": 64, "grouping": 26, "minblocks": 2, "algorithm": "medium", "perf": 561.006},
{"m": 5, "n": 28, "k": 13, "tile_m": 1, "tile_n": 3, "threads": 96, "grouping": 32, "minblocks": 11, "algorithm": "medium", "perf": 561.153},
{"m": 5, "n": 28, "k": 25, "tile_m": 3, "tile_n": 1, "threads": 128, "grouping": 4, "minblocks": 6, "algorithm": "medium", "perf": 577.262},
{"m": 5, "n": 28, "k": 26, "tile_m": 1, "tile_n": 1, "threads": 160, "grouping": 4, "minblocks": 5, "algorithm": "medium", "perf": 578.939},
{"m": 5, "n": 28, "k": 28, "tile_m": 2, "tile_n": 1, "threads": 160, "grouping": 4, "minblocks": 5, "algorithm": "medium", "perf": 581.324},
{"m": 5, "n": 28, "k": 32, "tile_m": 3, "tile_n": 1, "threads": 128, "grouping": 3, "minblocks": 2, "algorithm": "medium", "perf": 589.399},
{"m": 5, "n": 28, "k": 45, "tile_m": 1, "tile_n": 1, "threads": 256, "grouping": 3, "minblocks": 3, "algorithm": "medium", "perf": 595.274},
{"m": 5, "n": 32, "k": 4, "tile_m": 6, "tile_n": 1, "threads": 32, "grouping": 16, "minblocks": 20, "algorithm": "medium", "perf": 523.602},
{"m": 5, "n": 32, "k": 5, "tile_m": 6, "tile_n": 1, "threads": 32, "grouping": 16, "minblocks": 15, "algorithm": "medium", "perf": 535.714},
{"m": 5, "n": 32, "k": 7, "tile_m": 3, "tile_n": 1, "threads": 64, "grouping": 26, "minblocks": 4, "algorithm": "medium", "perf": 554.629},
{"m": 5, "n": 32, "k": 9, "tile_m": 3, "tile_n": 1, "threads": 64, "grouping": 30, "minblocks": 1, "algorithm": "medium", "perf": 565.992},
{"m": 5, "n": 32, "k": 12, "tile_m": 2, "tile_n": 1, "threads": 96, "grouping": 32, "minblocks": 10, "algorithm": "medium", "perf": 574.485},
{"m": 5, "n": 32, "k": 13, "tile_m": 1, "tile_n": 3, "threads": 96, "grouping": 32, "minblocks": 10, "algorithm": "medium", "perf": 572.183},
{"m": 5, "n": 32, "k": 16, "tile_m": 2, "tile_n": 1, "threads": 128, "grouping": 5, "minblocks": 4, "algorithm": "medium", "perf": 583.958},
{"m": 5, "n": 32, "k": 24, "tile_m": 2, "tile_n": 1, "threads": 160, "grouping": 4, "minblocks": 4, "algorithm": "medium", "perf": 593.51},
{"m": 5, "n": 32, "k": 25, "tile_m": 3, "tile_n": 1, "threads": 128, "grouping": 5, "minblocks": 1, "algorithm": "medium", "perf": 593.335},
{"m": 5, "n": 32, "k": 26, "tile_m": 1, "tile_n": 1, "threads": 256, "grouping": 4, "minblocks": 6, "algorithm": "medium", "perf": 593.116},
{"m": 5, "n": 32, "k": 28, "tile_m": 3, "tile_n": 1, "threads": 128, "grouping": 4, "minblocks": 3, "algorithm": "medium", "perf": 596.857},
{"m": 5, "n": 32, "k": 32, "tile_m": 1, "tile_n": 1, "threads": 256, "grouping": 4, "minblocks": 5, "algorithm": "medium", "perf": 610.053},
{"m": 5, "n": 32, "k": 45, "tile_m": 1, "tile_n": 1, "threads": 256, "grouping": 3, "minblocks": 2, "algorithm": "medium", "perf": 612.697},
{"m": 5, "n": 45, "k": 4, "tile_m": 5, "tile_n": 1, "threads": 64, "grouping": 22, "minblocks": 15, "algorithm": "medium", "perf": 510.03},
{"m": 5, "n": 45, "k": 5, "tile_m": 1, "tile_n": 4, "threads": 64, "grouping": 26, "minblocks": 15, "algorithm": "medium", "perf": 528.041},
{"m": 5, "n": 45, "k": 7, "tile_m": 1, "tile_n": 4, "threads": 64, "grouping": 26, "minblocks": 4, "algorithm": "medium", "perf": 553.915},
{"m": 5, "n": 45, "k": 9, "tile_m": 3, "tile_n": 1, "threads": 96, "grouping": 29, "minblocks": 3, "algorithm": "medium", "perf": 564.82},
{"m": 5, "n": 45, "k": 13, "tile_m": 1, "tile_n": 2, "threads": 128, "grouping": 5, "minblocks": 8, "algorithm": "medium", "perf": 579.618},
{"m": 5, "n": 45, "k": 25, "tile_m": 3, "tile_n": 1, "threads": 128, "grouping": 4, "minblocks": 2, "algorithm": "medium", "perf": 612.003},
{"m": 5, "n": 45, "k": 26, "tile_m": 1, "tile_n": 2, "threads": 192, "grouping": 3, "minblocks": 4, "algorithm": "medium", "perf": 612.137},
{"m": 5, "n": 45, "k": 28, "tile_m": 3, "tile_n": 1, "threads": 160, "grouping": 3, "minblocks": 1, "algorithm": "medium", "perf": 623.505},
{"m": 5, "n": 45, "k": 32, "tile_m": 3, "tile_n": 1, "threads": 192, "grouping": 4, "minblocks": 2, "algorithm": "medium", "perf": 630.854},
{"m": 5, "n": 45, "k": 45, "tile_m": 1, "tile_n": 1, "threads": 256, "grouping": 3, "minblocks": 1, "algorithm": "medium", "perf": 635.739},
{"m": 6, "n": 4, "k": 4, "tile_m": 1, "tile_n": 1, "threads": 32, "grouping": 18, "minblocks": 3, "algorithm": "medium", "perf": 212.84},
{"m": 6, "n": 4, "k": 5, "tile_m": 1, "tile_n": 1, "threads": 32, "grouping": 16, "minblocks": 25, "algorithm": "medium", "perf": 250.003},
{"m": 6, "n": 4, "k": 6, "tile_m": 1, "tile_n": 1, "threads": 32, "grouping": 16, "minblocks": 24, "algorithm": "medium", "perf": 227.238},
{"m": 6, "n": 4, "k": 7, "tile_m": 1, "tile_n": 1, "threads": 32, "grouping": 16, "minblocks": 5, "algorithm": "medium", "perf": 253.726},
{"m": 6, "n": 4, "k": 8, "tile_m": 1, "tile_n": 1, "threads": 32, "grouping": 16, "minblocks": 13, "algorithm": "medium", "perf": 260.467},
{"m": 6, "n": 4, "k": 9, "tile_m": 1, "tile_n": 1, "threads": 32, "grouping": 13, "minblocks": 12, "algorithm": "medium", "perf": 268.788},
{"m": 6, "n": 5, "k": 4, "tile_m": 1, "tile_n": 1, "threads": 32, "grouping": 18, "minblocks": 25, "algorithm": "medium", "perf": 265.113},
{"m": 6, "n": 5, "k": 5, "tile_m": 1, "tile_n": 1, "threads": 32, "grouping": 16, "minblocks": 4, "algorithm": "medium", "perf": 292.379},
{"m": 6, "n": 5, "k": 6, "tile_m": 1, "tile_n": 1, "threads": 32, "grouping": 16, "minblocks": 20, "algorithm": "medium", "perf": 278.719},
{"m": 6, "n": 5, "k": 7, "tile_m": 1, "tile_n": 1, "threads": 32, "grouping": 16, "minblocks": 13, "algorithm": "medium", "perf": 273.867},
{"m": 6, "n": 5, "k": 8, "tile_m": 1, "tile_n": 1, "threads": 32, "grouping": 13, "minblocks": 13, "algorithm": "medium", "perf": 306.256},
{"m": 6, "n": 5, "k": 9, "tile_m": 1, "tile_n": 1, "threads": 32, "grouping": 12, "minblocks": 2, "algorithm": "medium", "perf": 330.458},
{"m": 6, "n": 6, "k": 4, "tile_m": 1, "tile_n": 2, "threads": 32, "grouping": 16, "minblocks": 20, "algorithm": "medium", "perf": 279.038},
{"m": 6, "n": 6, "k": 5, "tile_m": 1, "tile_n": 2, "threads": 32, "grouping": 13, "minblocks": 13, "algorithm": "medium", "perf": 324.604},
{"m": 6, "n": 6, "k": 6, "tile_m": 2, "tile_n": 1, "threads": 32, "grouping": 13, "minblocks": 26, "algorithm": "medium", "perf": 309.661},
{"m": 6, "n": 6, "k": 7, "tile_m": 2, "tile_n": 1, "threads": 32, "grouping": 13, "minblocks": 11, "algorithm": "medium", "perf": 347.979},
{"m": 6, "n": 6, "k": 8, "tile_m": 1, "tile_n": 2, "threads": 32, "grouping": 13, "minblocks": 4, "algorithm": "medium", "perf": 388.615},
{"m": 6, "n": 6, "k": 9, "tile_m": 1, "tile_n": 2, "threads": 32, "grouping": 11, "minblocks": 15, "algorithm": "medium", "perf": 414.229},
{"m": 6, "n": 7, "k": 4, "tile_m": 1, "tile_n": 2, "threads": 32, "grouping": 16, "minblocks": 22, "algorithm": "medium", "perf": 310.207},
{"m": 6, "n": 7, "k": 5, "tile_m": 1, "tile_n": 2, "threads": 32, "grouping": 16, "minblocks": 2, "algorithm": "medium", "perf": 307.915},
{"m": 6, "n": 7, "k": 6, "tile_m": 1, "tile_n": 2, "threads": 32, "grouping": 13, "minblocks": 27, "algorithm": "medium", "perf": 311.923},
{"m": 6, "n": 7, "k": 7, "tile_m": 2, "tile_n": 1, "threads": 32, "grouping": 13, "minblocks": 18, "algorithm": "medium", "perf": 348.666},
{"m": 6, "n": 7, "k": 8, "tile_m": 2, "tile_n": 1, "threads": 32, "grouping": 13, "minblocks": 3, "algorithm": "medium", "perf": 391.768},
{"m": 6, "n": 7, "k": 9, "tile_m": 1, "tile_n": 2, "threads": 32, "grouping": 13, "minblocks": 16, "algorithm": "medium", "perf": 421.422},
{"m": 6, "n": 8, "k": 4, "tile_m": 2, "tile_n": 1, "threads": 32, "grouping": 16, "minblocks": 13, "algorithm": "medium", "perf": 306.933},
{"m": 6, "n": 8, "k": 5, "tile_m": 1, "tile_n": 2, "threads": 32, "grouping": 16, "minblocks": 27, "algorithm": "medium", "perf": 346.794},
{"m": 6, "n": 8, "k": 6, "tile_m": 1, "tile_n": 2, "threads": 32, "grouping": 13, "minblocks": 2, "algorithm": "medium", "perf": 356.722},
{"m": 6, "n": 8, "k": 7, "tile_m": 1, "tile_n": 2, "threads": 32, "grouping": 13, "minblocks": 1, "algorithm": "medium", "perf": 397.923},
{"m": 6, "n": 8, "k": 8, "tile_m": 2, "tile_n": 1, "threads": 32, "grouping": 13, "minblocks": 2, "algorithm": "medium", "perf": 434.94},
{"m": 6, "n": 8, "k": 9, "tile_m": 1, "tile_n": 2, "threads": 32, "grouping": 13, "minblocks": 19, "algorithm": "medium", "perf": 449.288},
{"m": 6, "n": 9, "k": 4, "tile_m": 1, "tile_n": 2, "threads": 32, "grouping": 16, "minblocks": 26, "algorithm": "medium", "perf": 326.343},
{"m": 6, "n": 9, "k": 5, "tile_m": 1, "tile_n": 2, "threads": 32, "grouping": 13, "minblocks": 17, "algorithm": "medium", "perf": 387.121},
{"m": 6, "n": 9, "k": 6, "tile_m": 1, "tile_n": 2, "threads": 32, "grouping": 12, "minblocks": 13, "algorithm": "medium", "perf": 390.83},
{"m": 6, "n": 9, "k": 7, "tile_m": 1, "tile_n": 2, "threads": 32, "grouping": 13, "minblocks": 4, "algorithm": "medium", "perf": 440.029},
{"m": 6, "n": 9, "k": 8, "tile_m": 1, "tile_n": 2, "threads": 32, "grouping": 13, "minblocks": 27, "algorithm": "medium", "perf": 468.53},
{"m": 6, "n": 9, "k": 9, "tile_m": 1, "tile_n": 2, "threads": 32, "grouping": 13, "minblocks": 13, "algorithm": "medium", "perf": 476.022},
{"m": 7, "n": 4, "k": 4, "tile_m": 1, "tile_n": 1, "threads": 32, "grouping": 18, "minblocks": 9, "algorithm": "medium", "perf": 247.91},
{"m": 7, "n": 4, "k": 5, "tile_m": 1, "tile_n": 1, "threads": 32, "grouping": 16, "minblocks": 11, "algorithm": "medium", "perf": 222.094},
{"m": 7, "n": 4, "k": 6, "tile_m": 1, "tile_n": 1, "threads": 32, "grouping": 16, "minblocks": 3, "algorithm": "medium", "perf": 256.908},
{"m": 7, "n": 4, "k": 7, "tile_m": 1, "tile_n": 1, "threads": 32, "grouping": 16, "minblocks": 20, "algorithm": "medium", "perf": 286.148},
{"m": 7, "n": 4, "k": 8, "tile_m": 1, "tile_n": 1, "threads": 32, "grouping": 16, "minblocks": 15, "algorithm": "medium", "perf": 296.218},
{"m": 7, "n": 4, "k": 9, "tile_m": 1, "tile_n": 1, "threads": 32, "grouping": 13, "minblocks": 8, "algorithm": "medium", "perf": 306.346},
{"m": 7, "n": 4, "k": 13, "tile_m": 1, "tile_n": 1, "threads": 32, "grouping": 12, "minblocks": 25, "algorithm": "medium", "perf": 361.319},
{"m": 7, "n": 4, "k": 25, "tile_m": 1, "tile_n": 1, "threads": 64, "grouping": 4, "minblocks": 21, "algorithm": "medium", "perf": 356.58},
{"m": 7, "n": 4, "k": 26, "tile_m": 1, "tile_n": 1, "threads": 64, "grouping": 4, "minblocks": 21, "algorithm": "medium", "perf": 362.674},
{"m": 7, "n": 4, "k": 28, "tile_m": 1, "tile_n": 1, "threads": 64, "grouping": 6, "minblocks": 5, "algorithm": "medium", "perf": 363.829},
{"m": 7, "n": 4, "k": 32, "tile_m": 1, "tile_n": 1, "threads": 64, "grouping": 3, "minblocks": 8, "algorithm": "medium", "perf": 371.107},
{"m": 7, "n": 4, "k": 45, "tile_m": 1, "tile_n": 1, "threads": 64, "grouping": 4, "minblocks": 9, "algorithm": "medium", "perf": 363.482},
{"m": 7, "n": 5, "k": 4, "tile_m": 2, "tile_n": 1, "threads": 32, "grouping": 16, "minblocks": 19, "algorithm": "medium", "perf": 270.919},
{"m": 7, "n": 5, "k": 5, "tile_m": 2, "tile_n": 1, "threads": 32, "grouping": 16, "minblocks": 27, "algorithm": "medium", "perf": 263.9},
{"m": 7, "n": 5, "k": 6, "tile_m": 2, "tile_n": 1, "threads": 32, "grouping": 16, "minblocks": 23, "algorithm": "medium", "perf": 304.548},
{"m": 7, "n": 5, "k": 7, "tile_m": 2, "tile_n": 1, "threads": 32, "grouping": 16, "minblocks": 20, "algorithm": "medium", "perf": 302.41},
{"m": 7, "n": 5, "k": 8, "tile_m": 2, "tile_n": 1, "threads": 32, "grouping": 16, "minblocks": 14, "algorithm": "medium", "perf": 332.161},
{"m": 7, "n": 5, "k": 9, "tile_m": 2, "tile_n": 1, "threads": 32, "grouping": 13, "minblocks": 25, "algorithm": "medium", "perf": 349.89},
{"m": 7, "n": 5, "k": 13, "tile_m": 2, "tile_n": 1, "threads": 32, "grouping": 13, "minblocks": 21, "algorithm": "medium", "perf": 397.427},
{"m": 7, "n": 5, "k": 25, "tile_m": 2, "tile_n": 1, "threads": 64, "grouping": 4, "minblocks": 20, "algorithm": "medium", "perf": 400.125},
{"m": 7, "n": 5, "k": 26, "tile_m": 1, "tile_n": 1, "threads": 64, "grouping": 4, "minblocks": 12, "algorithm": "medium", "perf": 397.999},
{"m": 7, "n": 5, "k": 28, "tile_m": 2, "tile_n": 1, "threads": 64, "grouping": 4, "minblocks": 7, "algorithm": "medium", "perf": 402.797},
{"m": 7, "n": 5, "k": 32, "tile_m": 1, "tile_n": 1, "threads": 64, "grouping": 3, "minblocks": 11, "algorithm": "medium", "perf": 409.525},
{"m": 7, "n": 5, "k": 45, "tile_m": 1, "tile_n": 1, "threads": 96, "grouping": 3, "minblocks": 5, "algorithm": "medium", "perf": 401.97},
{"m": 7, "n": 6, "k": 4, "tile_m": 2, "tile_n": 1, "threads": 32, "grouping": 16, "minblocks": 24, "algorithm": "medium", "perf": 313.286},
{"m": 7, "n": 6, "k": 5, "tile_m": 2, "tile_n": 1, "threads": 32, "grouping": 16, "minblocks": 19, "algorithm": "medium", "perf": 312.621},
{"m": 7, "n": 6, "k": 6, "tile_m": 2, "tile_n": 1, "threads": 32, "grouping": 16, "minblocks": 3, "algorithm": "medium", "perf": 321.111},
{"m": 7, "n": 6, "k": 7, "tile_m": 2, "tile_n": 1, "threads": 32, "grouping": 16, "minblocks": 12, "algorithm": "medium", "perf": 350.795},
{"m": 7, "n": 6, "k": 8, "tile_m": 2, "tile_n": 1, "threads": 32, "grouping": 13, "minblocks": 13, "algorithm": "medium", "perf": 385.441},
{"m": 7, "n": 6, "k": 9, "tile_m": 2, "tile_n": 1, "threads": 32, "grouping": 13, "minblocks": 15, "algorithm": "medium", "perf": 418.272},
{"m": 7, "n": 7, "k": 4, "tile_m": 2, "tile_n": 1, "threads": 32, "grouping": 13, "minblocks": 1, "algorithm": "medium", "perf": 364.566},
{"m": 7, "n": 7, "k": 5, "tile_m": 2, "tile_n": 1, "threads": 32, "grouping": 13, "minblocks": 11, "algorithm": "medium", "perf": 358.669},
{"m": 7, "n": 7, "k": 6, "tile_m": 1, "tile_n": 2, "threads": 32, "grouping": 13, "minblocks": 3, "algorithm": "medium", "perf": 406.525},
{"m": 7, "n": 7, "k": 7, "tile_m": 2, "tile_n": 1, "threads": 32, "grouping": 11, "minblocks": 27, "algorithm": "medium", "perf": 449.927},
{"m": 7, "n": 7, "k": 8, "tile_m": 2, "tile_n": 1, "threads": 32, "grouping": 11, "minblocks": 12, "algorithm": "medium", "perf": 495.144},
{"m": 7, "n": 7, "k": 9, "tile_m": 1, "tile_n": 2, "threads": 32, "grouping": 13, "minblocks": 5, "algorithm": "medium", "perf": 495.72},
{"m": 7, "n": 7, "k": 13, "tile_m": 2, "tile_n": 1, "threads": 32, "grouping": 18, "minblocks": 27, "algorithm": "medium", "perf": 488.334},
{"m": 7, "n": 7, "k": 25, "tile_m": 2, "tile_n": 1, "threads": 64, "grouping": 4, "minblocks": 10, "algorithm": "medium", "perf": 489.312},
{"m": 7, "n": 7, "k": 26, "tile_m": 2, "tile_n": 1, "threads": 64, "grouping": 4, "minblocks": 1, "algorithm": "medium", "perf": 490.132},
{"m": 7, "n": 7, "k": 28, "tile_m": 2, "tile_n": 1, "threads": 64, "grouping": 4, "minblocks": 9, "algorithm": "medium", "perf": 490.192},
{"m": 7, "n": 7, "k": 32, "tile_m": 1, "tile_n": 1, "threads": 128, "grouping": 4, "minblocks": 11, "algorithm": "medium", "perf": 499.565},
{"m": 7, "n": 7, "k": 45, "tile_m": 1, "tile_n": 1, "threads": 160, "grouping": 3, "minblocks": 7, "algorithm": "medium", "perf": 491.99},
{"m": 7, "n": 8, "k": 4, "tile_m": 2, "tile_n": 1, "threads": 32, "grouping": 16, "minblocks": 12, "algorithm": "medium", "perf": 354.633},
{"m": 7, "n": 8, "k": 5, "tile_m": 2, "tile_n": 1, "threads": 32, "grouping": 16, "minblocks": 9, "algorithm": "medium", "perf": 359.16},
{"m": 7, "n": 8, "k": 6, "tile_m": 2, "tile_n": 1, "threads": 32, "grouping": 16, "minblocks": 19, "algorithm": "medium", "perf": 411.24},
{"m": 7, "n": 8, "k": 7, "tile_m": 2, "tile_n": 1, "threads": 32, "grouping": 13, "minblocks": 18, "algorithm": "medium", "perf": 455.7},
{"m": 7, "n": 8, "k": 8, "tile_m": 2, "tile_n": 1, "threads": 32, "grouping": 13, "minblocks": 23, "algorithm": "medium", "perf": 500.053},
{"m": 7, "n": 8, "k": 9, "tile_m": 1, "tile_n": 2, "threads": 32, "grouping": 11, "minblocks": 3, "algorithm": "medium", "perf": 501.545},
{"m": 7, "n": 9, "k": 4, "tile_m": 3, "tile_n": 1, "threads": 32, "grouping": 16, "minblocks": 25, "algorithm": "medium", "perf": 357.248},
{"m": 7, "n": 9, "k": 5, "tile_m": 3, "tile_n": 1, "threads": 32, "grouping": 16, "minblocks": 5, "algorithm": "medium", "perf": 380.106},
{"m": 7, "n": 9, "k": 6, "tile_m": 1, "tile_n": 3, "threads": 32, "grouping": 13, "minblocks": 1, "algorithm": "medium", "perf": 421.294},
{"m": 7, "n": 9, "k": 7, "tile_m": 3, "tile_n": 1, "threads": 32, "grouping": 13, "minblocks": 26, "algorithm": "medium", "perf": 474.232},
{"m": 7, "n": 9, "k": 8, "tile_m": 3, "tile_n": 1, "threads": 32, "grouping": 13, "minblocks": 25, "algorithm": "medium", "perf": 498.036},
{"m": 7, "n": 9, "k": 9, "tile_m": 1, "tile_n": 3, "threads": 32, "grouping": 13, "minblocks": 19, "algorithm": "medium", "perf": 512.04},
{"m": 7, "n": 9, "k": 13, "tile_m": 1, "tile_n": 1, "threads": 64, "grouping": 5, "minblocks": 22, "algorithm": "medium", "perf": 509.15},
{"m": 7, "n": 9, "k": 25, "tile_m": 1, "tile_n": 1, "threads": 64, "grouping": 4, "minblocks": 9, "algorithm": "medium", "perf": 538.393},
{"m": 7, "n": 9, "k": 26, "tile_m": 1, "tile_n": 1, "threads": 64, "grouping": 32, "minblocks": 2, "algorithm": "medium", "perf": 539.44},
{"m": 7, "n": 9, "k": 28, "tile_m": 1, "tile_n": 1, "w": 14, "v": 8, "threads": 64, "grouping": 16, "minblocks": 8, "algorithm": "largeDB2", "perf": 544.807},
{"m": 7, "n": 9, "k": 32, "tile_m": 1, "tile_n": 1, "threads": 64, "grouping": 3, "minblocks": 10, "algorithm": "medium", "perf": 550.841},
{"m": 7, "n": 9, "k": 45, "tile_m": 1, "tile_n": 1, "threads": 128, "grouping": 3, "minblocks": 8, "algorithm": "medium", "perf": 548.66},
{"m": 7, "n": 13, "k": 4, "tile_m": 4, "tile_n": 1, "threads": 32, "grouping": 15, "minblocks": 24, "algorithm": "medium", "perf": 473.871},
{"m": 7, "n": 13, "k": 5, "tile_m": 2, "tile_n": 2, "threads": 32, "grouping": 13, "minblocks": 20, "algorithm": "medium", "perf": 484.652},
{"m": 7, "n": 13, "k": 7, "tile_m": 4, "tile_n": 1, "threads": 32, "grouping": 14, "minblocks": 22, "algorithm": "medium", "perf": 568.233},
{"m": 7, "n": 13, "k": 9, "tile_m": 2, "tile_n": 2, "threads": 32, "grouping": 12, "minblocks": 25, "algorithm": "medium", "perf": 575.698},
{"m": 7, "n": 13, "k": 13, "tile_m": 2, "tile_n": 1, "threads": 64, "grouping": 26, "minblocks": 17, "algorithm": "medium", "perf": 576.55},
{"m": 7, "n": 13, "k": 25, "tile_m": 2, "tile_n": 1, "threads": 64, "grouping": 6, "minblocks": 2, "algorithm": "medium", "perf": 602.965},
{"m": 7, "n": 13, "k": 26, "tile_m": 2, "tile_n": 1, "threads": 96, "grouping": 5, "minblocks": 1, "algorithm": "medium", "perf": 607.199},
{"m": 7, "n": 13, "k": 28, "tile_m": 2, "tile_n": 1, "threads": 96, "grouping": 4, "minblocks": 8, "algorithm": "medium", "perf": 615.391},
{"m": 7, "n": 13, "k": 32, "tile_m": 1, "tile_n": 1, "threads": 96, "grouping": 4, "minblocks": 2, "algorithm": "medium", "perf": 622.982},
{"m": 7, "n": 13, "k": 45, "tile_m": 1, "tile_n": 1, "threads": 128, "grouping": 3, "minblocks": 2, "algorithm": "medium", "perf": 626.534},
{"m": 7, "n": 25, "k": 4, "tile_m": 4, "tile_n": 2, "threads": 32, "grouping": 16, "minblocks": 10, "algorithm": "medium", "perf": 580.16},
{"m": 7, "n": 25, "k": 5, "tile_m": 4, "tile_n": 1, "threads": 64, "grouping": 22, "minblocks": 18, "algorithm": "medium", "perf": 597.952},
{"m": 7, "n": 25, "k": 7, "tile_m": 4, "tile_n": 1, "threads": 64, "grouping": 22, "minblocks": 12, "algorithm": "medium", "perf": 658.065},
{"m": 7, "n": 25, "k": 9, "tile_m": 1, "tile_n": 3, "threads": 64, "grouping": 22, "minblocks": 2, "algorithm": "medium", "perf": 683.511},
{"m": 7, "n": 25, "k": 13, "tile_m": 1, "tile_n": 3, "threads": 96, "grouping": 29, "minblocks": 11, "algorithm": "medium", "perf": 697.002},
{"m": 7, "n": 25, "k": 25, "tile_m": 1, "tile_n": 2, "threads": 192, "grouping": 4, "minblocks": 3, "algorithm": "medium", "perf": 721.815},
{"m": 7, "n": 25, "k": 26, "tile_m": 1, "tile_n": 2, "threads": 192, "grouping": 5, "minblocks": 3, "algorithm": "medium", "perf": 726.291},
{"m": 7, "n": 25, "k": 28, "tile_m": 1, "tile_n": 2, "threads": 224, "grouping": 4, "minblocks": 6, "algorithm": "medium", "perf": 733.469},
{"m": 7, "n": 25, "k": 32, "tile_m": 1, "tile_n": 3, "threads": 128, "grouping": 3, "minblocks": 4, "algorithm": "medium", "perf": 738.173},
{"m": 7, "n": 25, "k": 45, "tile_m": 1, "tile_n": 2, "w": 22, "v": 24, "threads": 96, "grouping": 16, "minblocks": 4, "algorithm": "largeDB2", "perf": 744.304},
{"m": 7, "n": 26, "k": 4, "tile_m": 4, "tile_n": 2, "threads": 32, "grouping": 16, "minblocks": 7, "algorithm": "medium", "perf": 597.715},
{"m": 7, "n": 26, "k": 5, "tile_m": 4, "tile_n": 2, "threads": 64, "grouping": 22, "minblocks": 14, "algorithm": "medium", "perf": 612.13},
{"m": 7, "n": 26, "k": 7, "tile_m": 4, "tile_n": 1, "threads": 64, "grouping": 22, "minblocks": 9, "algorithm": "medium", "perf": 669.6},
{"m": 7, "n": 26, "k": 9, "tile_m": 1, "tile_n": 3, "threads": 64, "grouping": 26, "minblocks": 14, "algorithm": "medium", "perf": 695},
{"m": 7, "n": 26, "k": 13, "tile_m": 1, "tile_n": 3, "threads": 96, "grouping": 32, "minblocks": 10, "algorithm": "medium", "perf": 708.859},
{"m": 7, "n": 26, "k": 25, "tile_m": 1, "tile_n": 2, "threads": 192, "grouping": 4, "minblocks": 7, "algorithm": "medium", "perf": 732.407},
{"m": 7, "n": 26, "k": 26, "tile_m": 1, "tile_n": 2, "threads": 192, "grouping": 5, "minblocks": 2, "algorithm": "medium", "perf": 739.029},
{"m": 7, "n": 26, "k": 28, "tile_m": 1, "tile_n": 2, "threads": 224, "grouping": 4, "minblocks": 6, "algorithm": "medium", "perf": 743.234},
{"m": 7, "n": 26, "k": 32, "tile_m": 1, "tile_n": 2, "threads": 256, "grouping": 4, "minblocks": 5, "algorithm": "medium", "perf": 753.794},
{"m": 7, "n": 26, "k": 45, "tile_m": 2, "tile_n": 2, "w": 16, "v": 26, "threads": 64, "grouping": 16, "minblocks": 8, "algorithm": "largeDB2", "perf": 753.616},
{"m": 7, "n": 28, "k": 4, "tile_m": 4, "tile_n": 2, "threads": 32, "grouping": 16, "minblocks": 16, "algorithm": "medium", "perf": 621.956},
{"m": 7, "n": 28, "k": 5, "tile_m": 4, "tile_n": 1, "threads": 64, "grouping": 22, "minblocks": 12, "algorithm": "medium", "perf": 630.557},
{"m": 7, "n": 28, "k": 7, "tile_m": 4, "tile_n": 1, "threads": 64, "grouping": 26, "minblocks": 8, "algorithm": "medium", "perf": 687.436},
{"m": 7, "n": 28, "k": 9, "tile_m": 2, "tile_n": 2, "threads": 64, "grouping": 26, "minblocks": 11, "algorithm": "medium", "perf": 709.918},
{"m": 7, "n": 28, "k": 13, "tile_m": 2, "tile_n": 2, "threads": 96, "grouping": 12, "minblocks": 7, "algorithm": "medium", "perf": 710.614},
{"m": 7, "n": 28, "k": 25, "tile_m": 1, "tile_n": 2, "threads": 192, "grouping": 5, "minblocks": 3, "algorithm": "medium", "perf": 746.919},
{"m": 7, "n": 28, "k": 26, "tile_m": 2, "tile_n": 1, "threads": 192, "grouping": 4, "minblocks": 6, "algorithm": "medium", "perf": 752.82},
{"m": 7, "n": 28, "k": 28, "tile_m": 2, "tile_n": 1, "threads": 224, "grouping": 4, "minblocks": 6, "algorithm": "medium", "perf": 754.704},
{"m": 7, "n": 28, "k": 32, "tile_m": 2, "tile_n": 1, "threads": 128, "grouping": 4, "minblocks": 1, "algorithm": "medium", "perf": 766.488},
{"m": 7, "n": 28, "k": 45, "tile_m": 2, "tile_n": 1, "w": 12, "v": 24, "threads": 128, "grouping": 16, "minblocks": 2, "algorithm": "largeDB2", "perf": 770.322},
{"m": 7, "n": 32, "k": 4, "tile_m": 4, "tile_n": 2, "threads": 32, "grouping": 19, "minblocks": 15, "algorithm": "medium", "perf": 627.174},
{"m": 7, "n": 32, "k": 5, "tile_m": 4, "tile_n": 1, "threads": 64, "grouping": 21, "minblocks": 3, "algorithm": "medium", "perf": 656.782},
{"m": 7, "n": 32, "k": 7, "tile_m": 2, "tile_n": 2, "threads": 64, "grouping": 22, "minblocks": 11, "algorithm": "medium", "perf": 701.471},
{"m": 7, "n": 32, "k": 9, "tile_m": 4, "tile_n": 1, "threads": 64, "grouping": 32, "minblocks": 2, "algorithm": "medium", "perf": 721.47},
{"m": 7, "n": 32, "k": 13, "tile_m": 4, "tile_n": 1, "threads": 96, "grouping": 6, "minblocks": 10, "algorithm": "medium", "perf": 736.094},
{"m": 7, "n": 32, "k": 25, "tile_m": 2, "tile_n": 1, "threads": 192, "grouping": 4, "minblocks": 1, "algorithm": "medium", "perf": 769.295},
{"m": 7, "n": 32, "k": 26, "tile_m": 2, "tile_n": 1, "threads": 192, "grouping": 4, "minblocks": 1, "algorithm": "medium", "perf": 776.776},
{"m": 7, "n": 32, "k": 28, "tile_m": 2, "tile_n": 1, "threads": 256, "grouping": 4, "minblocks": 5, "algorithm": "medium", "perf": 778.504},
{"m": 7, "n": 32, "k": 32, "tile_m": 2, "tile_n": 2, "w": 16, "v": 32, "threads": 64, "grouping": 16, "minblocks": 2, "algorithm": "largeDB2", "perf": 790.893},
{"m": 7, "n": 32, "k": 45, "tile_m": 2, "tile_n": 1, "w": 12, "v": 32, "threads": 128, "grouping": 16, "minblocks": 2, "algorithm": "largeDB2", "perf": 802.202},
{"m": 7, "n": 45, "k": 4, "tile_m": 2, "tile_n": 3, "threads": 64, "grouping": 28, "minblocks": 2, "algorithm": "medium", "perf": 631.988},
{"m": 7, "n": 45, "k": 5, "tile_m": 1, "tile_n": 5, "threads": 64, "grouping": 27, "minblocks": 5, "algorithm": "medium", "perf": 663.525},
{"m": 7, "n": 45, "k": 7, "tile_m": 1, "tile_n": 5, "threads": 64, "grouping": 32, "minblocks": 7, "algorithm": "medium", "perf": 709.225},
{"m": 7, "n": 45, "k": 9, "tile_m": 4, "tile_n": 1, "threads": 128, "grouping": 32, "minblocks": 10, "algorithm": "medium", "perf": 727.897},
{"m": 7, "n": 45, "k": 13, "tile_m": 4, "tile_n": 1, "threads": 128, "grouping": 29, "minblocks": 3, "algorithm": "medium", "perf": 755.771},
{"m": 7, "n": 45, "k": 25, "tile_m": 2, "tile_n": 1, "threads": 192, "grouping": 4, "minblocks": 1, "algorithm": "medium", "perf": 801.315},
{"m": 7, "n": 45, "k": 26, "tile_m": 2, "tile_n": 1, "threads": 224, "grouping": 3, "minblocks": 3, "algorithm": "medium", "perf": 810.209},
{"m": 7, "n": 45, "k": 28, "tile_m": 2, "tile_n": 1, "threads": 256, "grouping": 3, "minblocks": 4, "algorithm": "medium", "perf": 818.919},
{"m": 7, "n": 45, "k": 32, "tile_m": 2, "tile_n": 1, "threads": 256, "grouping": 3, "minblocks": 3, "algorithm": "medium", "perf": 832.676},
{"m": 7, "n": 45, "k": 45, "tile_m": 4, "tile_n": 1, "w": 12, "v": 32, "threads": 96, "grouping": 16, "minblocks": 2, "algorithm": "largeDB2", "perf": 841.043},
{"m": 8, "n": 4, "k": 4, "tile_m": 1, "tile_n": 1, "threads": 32, "grouping": 18, "minblocks": 27, "algorithm": "medium", "perf": 241.107},
{"m": 8, "n": 4, "k": 5, "tile_m": 1, "tile_n": 1, "threads": 32, "grouping": 16, "minblocks": 12, "algorithm": "medium", "perf": 253.28},
{"m": 8, "n": 4, "k": 6, "tile_m": 1, "tile_n": 1, "threads": 32, "grouping": 16, "minblocks": 8, "algorithm": "medium", "perf": 292.754},
{"m": 8, "n": 4, "k": 7, "tile_m": 1, "tile_n": 1, "threads": 32, "grouping": 16, "minblocks": 5, "algorithm": "medium", "perf": 322.969},
{"m": 8, "n": 4, "k": 8, "tile_m": 1, "tile_n": 1, "threads": 32, "grouping": 9, "minblocks": 7, "algorithm": "small", "perf": 312.182},
{"m": 8, "n": 4, "k": 9, "tile_m": 1, "tile_n": 1, "threads": 32, "grouping": 13, "minblocks": 25, "algorithm": "medium", "perf": 336.929},
{"m": 8, "n": 5, "k": 4, "tile_m": 2, "tile_n": 1, "threads": 32, "grouping": 16, "minblocks": 27, "algorithm": "medium", "perf": 261.066},
{"m": 8, "n": 5, "k": 5, "tile_m": 2, "tile_n": 1, "threads": 32, "grouping": 16, "minblocks": 25, "algorithm": "medium", "perf": 297.369},
{"m": 8, "n": 5, "k": 6, "tile_m": 1, "tile_n": 2, "threads": 32, "grouping": 13, "minblocks": 25, "algorithm": "medium", "perf": 344.888},
{"m": 8, "n": 5, "k": 7, "tile_m": 1, "tile_n": 2, "threads": 32, "grouping": 13, "minblocks": 21, "algorithm": "medium", "perf": 335.855},
{"m": 8, "n": 5, "k": 8, "tile_m": 2, "tile_n": 1, "threads": 32, "grouping": 13, "minblocks": 4, "algorithm": "medium", "perf": 362.704},
{"m": 8, "n": 5, "k": 9, "tile_m": 2, "tile_n": 1, "threads": 32, "grouping": 13, "minblocks": 27, "algorithm": "medium", "perf": 388.028},
{"m": 8, "n": 6, "k": 4, "tile_m": 1, "tile_n": 2, "threads": 32, "grouping": 15, "minblocks": 24, "algorithm": "medium", "perf": 306.873},
{"m": 8, "n": 6, "k": 5, "tile_m": 2, "tile_n": 1, "threads": 32, "grouping": 16, "minblocks": 19, "algorithm": "medium", "perf": 351.046},
{"m": 8, "n": 6, "k": 6, "tile_m": 2, "tile_n": 1, "threads": 32, "grouping": 13, "minblocks": 20, "algorithm": "medium", "perf": 357.061},
{"m": 8, "n": 6, "k": 7, "tile_m": 2, "tile_n": 1, "threads": 32, "grouping": 13, "minblocks": 25, "algorithm": "medium", "perf": 398.063},
{"m": 8, "n": 6, "k": 8, "tile_m": 2, "tile_n": 1, "threads": 32, "grouping": 13, "minblocks": 27, "algorithm": "medium", "perf": 432.142},
{"m": 8, "n": 6, "k": 9, "tile_m": 2, "tile_n": 1, "threads": 32, "grouping": 13, "minblocks": 2, "algorithm": "medium", "perf": 451.4},
{"m": 8, "n": 7, "k": 4, "tile_m": 1, "tile_n": 2, "threads": 32, "grouping": 15, "minblocks": 11, "algorithm": "medium", "perf": 354.317},
{"m": 8, "n": 7, "k": 5, "tile_m": 2, "tile_n": 1, "threads": 32, "grouping": 16, "minblocks": 6, "algorithm": "medium", "perf": 358.106},
{"m": 8, "n": 7, "k": 6, "tile_m": 1, "tile_n": 2, "threads": 32, "grouping": 13, "minblocks": 17, "algorithm": "medium", "perf": 412.399},
{"m": 8, "n": 7, "k": 7, "tile_m": 1, "tile_n": 2, "threads": 32, "grouping": 13, "minblocks": 11, "algorithm": "medium", "perf": 463.962},
{"m": 8, "n": 7, "k": 8, "tile_m": 2, "tile_n": 1, "threads": 32, "grouping": 13, "minblocks": 25, "algorithm": "medium", "perf": 495.994},
{"m": 8, "n": 7, "k": 9, "tile_m": 1, "tile_n": 2, "threads": 32, "grouping": 13, "minblocks": 26, "algorithm": "medium", "perf": 501.068},
{"m": 8, "n": 8, "k": 4, "tile_m": 1, "tile_n": 2, "threads": 32, "grouping": 16, "minblocks": 11, "algorithm": "medium", "perf": 423.915},
{"m": 8, "n": 8, "k": 5, "tile_m": 1, "tile_n": 2, "threads": 32, "grouping": 13, "minblocks": 12, "algorithm": "medium", "perf": 468.053},
{"m": 8, "n": 8, "k": 6, "tile_m": 2, "tile_n": 1, "threads": 32, "grouping": 11, "minblocks": 17, "algorithm": "medium", "perf": 531.999},
{"m": 8, "n": 8, "k": 7, "tile_m": 2, "tile_n": 1, "threads": 32, "grouping": 11, "minblocks": 1, "algorithm": "medium", "perf": 571.337},
{"m": 8, "n": 8, "k": 8, "tile_m": 2, "tile_n": 1, "threads": 32, "grouping": 13, "minblocks": 25, "algorithm": "medium", "perf": 605.152},
{"m": 8, "n": 8, "k": 9, "tile_m": 2, "tile_n": 1, "threads": 32, "grouping": 13, "minblocks": 5, "algorithm": "medium", "perf": 571.958},
{"m": 8, "n": 9, "k": 4, "tile_m": 1, "tile_n": 3, "threads": 32, "grouping": 15, "minblocks": 25, "algorithm": "medium", "perf": 378.51},
{"m": 8, "n": 9, "k": 5, "tile_m": 1, "tile_n": 3, "threads": 32, "grouping": 16, "minblocks": 12, "algorithm": "medium", "perf": 433.932},
{"m": 8, "n": 9, "k": 6, "tile_m": 1, "tile_n": 3, "threads": 32, "grouping": 13, "minblocks": 12, "algorithm": "medium", "perf": 500.839},
{"m": 8, "n": 9, "k": 7, "tile_m": 1, "tile_n": 3, "threads": 32, "grouping": 11, "minblocks": 25, "algorithm": "medium", "perf": 544.839},
{"m": 8, "n": 9, "k": 8, "tile_m": 1, "tile_n": 3, "threads": 32, "grouping": 13, "minblocks": 9, "algorithm": "medium", "perf": 572.229},
{"m": 8, "n": 9, "k": 9, "tile_m": 1, "tile_n": 3, "threads": 32, "grouping": 16, "minblocks": 20, "algorithm": "medium", "perf": 567.681},
{"m": 9, "n": 4, "k": 4, "tile_m": 2, "tile_n": 1, "threads": 32, "grouping": 16, "minblocks": 27, "algorithm": "medium", "perf": 223.697},
{"m": 9, "n": 4, "k": 5, "tile_m": 2, "tile_n": 1, "threads": 32, "grouping": 16, "minblocks": 12, "algorithm": "medium", "perf": 264.552},
{"m": 9, "n": 4, "k": 6, "tile_m": 2, "tile_n": 1, "threads": 32, "grouping": 16, "minblocks": 12, "algorithm": "medium", "perf": 305.331},
{"m": 9, "n": 4, "k": 7, "tile_m": 1, "tile_n": 2, "threads": 32, "grouping": 13, "minblocks": 25, "algorithm": "medium", "perf": 335.175},
{"m": 9, "n": 4, "k": 8, "tile_m": 1, "tile_n": 2, "threads": 32, "grouping": 16, "minblocks": 26, "algorithm": "medium", "perf": 321.571},
{"m": 9, "n": 4, "k": 9, "tile_m": 2, "tile_n": 1, "threads": 32, "grouping": 13, "minblocks": 6, "algorithm": "medium", "perf": 341.86},
{"m": 9, "n": 4, "k": 13, "tile_m": 1, "tile_n": 2, "threads": 32, "grouping": 13, "minblocks": 5, "algorithm": "medium", "perf": 381.012},
{"m": 9, "n": 4, "k": 25, "tile_m": 1, "tile_n": 1, "threads": 64, "grouping": 5, "minblocks": 4, "algorithm": "medium", "perf": 380.088},
{"m": 9, "n": 4, "k": 26, "tile_m": 1, "tile_n": 1, "threads": 64, "grouping": 29, "minblocks": 1, "algorithm": "medium", "perf": 384.187},
{"m": 9, "n": 4, "k": 28, "tile_m": 1, "tile_n": 1, "threads": 64, "grouping": 7, "minblocks": 5, "algorithm": "medium", "perf": 389.01},
{"m": 9, "n": 4, "k": 32, "tile_m": 1, "tile_n": 1, "threads": 64, "grouping": 4, "minblocks": 11, "algorithm": "medium", "perf": 391.946},
{"m": 9, "n": 4, "k": 45, "tile_m": 1, "tile_n": 1, "threads": 96, "grouping": 3, "minblocks": 9, "algorithm": "medium", "perf": 387.535},
{"m": 9, "n": 5, "k": 4, "tile_m": 2, "tile_n": 1, "threads": 32, "grouping": 16, "minblocks": 2, "algorithm": "medium", "perf": 274.355},
{"m": 9, "n": 5, "k": 5, "tile_m": 2, "tile_n": 1, "threads": 32, "grouping": 16, "minblocks": 7, "algorithm": "medium", "perf": 325.528},
{"m": 9, "n": 5, "k": 6, "tile_m": 2, "tile_n": 1, "threads": 32, "grouping": 16, "minblocks": 3, "algorithm": "medium", "perf": 371.15},
{"m": 9, "n": 5, "k": 7, "tile_m": 1, "tile_n": 2, "threads": 32, "grouping": 13, "minblocks": 1, "algorithm": "medium", "perf": 371.567},
{"m": 9, "n": 5, "k": 8, "tile_m": 1, "tile_n": 2, "threads": 32, "grouping": 13, "minblocks": 19, "algorithm": "medium", "perf": 394.72},
{"m": 9, "n": 5, "k": 9, "tile_m": 2, "tile_n": 1, "threads": 32, "grouping": 13, "minblocks": 2, "algorithm": "medium", "perf": 417.155},
{"m": 9, "n": 5, "k": 13, "tile_m": 1, "tile_n": 2, "threads": 32, "grouping": 16, "minblocks": 13, "algorithm": "medium", "perf": 424.207},
{"m": 9, "n": 5, "k": 25, "tile_m": 1, "tile_n": 1, "threads": 64, "grouping": 4, "minblocks": 15, "algorithm": "medium", "perf": 441.803},
{"m": 9, "n": 5, "k": 26, "tile_m": 1, "tile_n": 1, "threads": 64, "grouping": 4, "minblocks": 3, "algorithm": "medium", "perf": 441.181},
{"m": 9, "n": 5, "k": 28, "tile_m": 1, "tile_n": 1, "threads": 64, "grouping": 4, "minblocks": 13, "algorithm": "medium", "perf": 447.972},
{"m": 9, "n": 5, "k": 32, "tile_m": 1, "tile_n": 1, "threads": 64, "grouping": 4, "minblocks": 5, "algorithm": "medium", "perf": 455.083},
{"m": 9, "n": 5, "k": 45, "tile_m": 1, "tile_n": 1, "threads": 128, "grouping": 5, "minblocks": 2, "algorithm": "medium", "perf": 447.72},
{"m": 9, "n": 6, "k": 4, "tile_m": 2, "tile_n": 1, "threads": 32, "grouping": 16, "minblocks": 16, "algorithm": "medium", "perf": 324.725},
{"m": 9, "n": 6, "k": 5, "tile_m": 2, "tile_n": 1, "threads": 32, "grouping": 16, "minblocks": 2, "algorithm": "medium", "perf": 383.299},
{"m": 9, "n": 6, "k": 6, "tile_m": 2, "tile_n": 1, "threads": 32, "grouping": 13, "minblocks": 9, "algorithm": "medium", "perf": 384.354},
{"m": 9, "n": 6, "k": 7, "tile_m": 1, "tile_n": 2, "threads": 32, "grouping": 13, "minblocks": 15, "algorithm": "medium", "perf": 435.21},
{"m": 9, "n": 6, "k": 8, "tile_m": 1, "tile_n": 2, "threads": 32, "grouping": 13, "minblocks": 14, "algorithm": "medium", "perf": 469.311},
{"m": 9, "n": 6, "k": 9, "tile_m": 1, "tile_n": 2, "threads": 32, "grouping": 13, "minblocks": 9, "algorithm": "medium", "perf": 476.433},
{"m": 9, "n": 7, "k": 4, "tile_m": 3, "tile_n": 1, "threads": 32, "grouping": 16, "minblocks": 3, "algorithm": "medium", "perf": 360.754},
{"m": 9, "n": 7, "k": 5, "tile_m": 3, "tile_n": 1, "threads": 32, "grouping": 16, "minblocks": 5, "algorithm": "medium", "perf": 379.473},
{"m": 9, "n": 7, "k": 6, "tile_m": 1, "tile_n": 3, "threads": 32, "grouping": 13, "minblocks": 20, "algorithm": "medium", "perf": 420.882},
{"m": 9, "n": 7, "k": 7, "tile_m": 3, "tile_n": 1, "threads": 32, "grouping": 13, "minblocks": 27, "algorithm": "medium", "perf": 478.365},
{"m": 9, "n": 7, "k": 8, "tile_m": 3, "tile_n": 1, "threads": 32, "grouping": 13, "minblocks": 1, "algorithm": "medium", "perf": 493.848},
{"m": 9, "n": 7, "k": 9, "tile_m": 3, "tile_n": 1, "threads": 32, "grouping": 13, "minblocks": 2, "algorithm": "medium", "perf": 516.64},
{"m": 9, "n": 7, "k": 13, "tile_m": 1, "tile_n": 3, "threads": 32, "grouping": 13, "minblocks": 1, "algorithm": "medium", "perf": 510.27},
{"m": 9, "n": 7, "k": 25, "tile_m": 1, "tile_n": 1, "threads": 64, "grouping": 4, "minblocks": 12, "algorithm": "medium", "perf": 537.082},
{"m": 9, "n": 7, "k": 26, "tile_m": 1, "tile_n": 1, "threads": 64, "grouping": 4, "minblocks": 2, "algorithm": "medium", "perf": 540.279},
{"m": 9, "n": 7, "k": 28, "tile_m": 1, "tile_n": 1, "threads": 96, "grouping": 4, "minblocks": 11, "algorithm": "medium", "perf": 545.866},
{"m": 9, "n": 7, "k": 32, "tile_m": 1, "tile_n": 1, "threads": 128, "grouping": 4, "minblocks": 11, "algorithm": "medium", "perf": 551.821},
{"m": 9, "n": 7, "k": 45, "tile_m": 1, "tile_n": 1, "threads": 128, "grouping": 4, "minblocks": 3, "algorithm": "medium", "perf": 550.203},
{"m": 9, "n": 8, "k": 4, "tile_m": 3, "tile_n": 1, "threads": 32, "grouping": 15, "minblocks": 3, "algorithm": "medium", "perf": 375.31},
{"m": 9, "n": 8, "k": 5, "tile_m": 3, "tile_n": 1, "threads": 32, "grouping": 16, "minblocks": 26, "algorithm": "medium", "perf": 428.946},
{"m": 9, "n": 8, "k": 6, "tile_m": 1, "tile_n": 3, "threads": 32, "grouping": 13, "minblocks": 22, "algorithm": "medium", "perf": 484.981},
{"m": 9, "n": 8, "k": 7, "tile_m": 3, "tile_n": 1, "threads": 32, "grouping": 13, "minblocks": 9, "algorithm": "medium", "perf": 540.555},
{"m": 9, "n": 8, "k": 8, "tile_m": 3, "tile_n": 1, "threads": 32, "grouping": 13, "minblocks": 2, "algorithm": "medium", "perf": 563.409},
{"m": 9, "n": 8, "k": 9, "tile_m": 1, "tile_n": 3, "threads": 32, "grouping": 16, "minblocks": 20, "algorithm": "medium", "perf": 561.368},
{"m": 9, "n": 9, "k": 4, "tile_m": 3, "tile_n": 1, "threads": 32, "grouping": 13, "minblocks": 16, "algorithm": "medium", "perf": 449.812},
{"m": 9, "n": 9, "k": 5, "tile_m": 3, "tile_n": 1, "threads": 32, "grouping": 12, "minblocks": 25, "algorithm": "medium", "perf": 520.817},
{"m": 9, "n": 9, "k": 6, "tile_m": 3, "tile_n": 1, "threads": 32, "grouping": 12, "minblocks": 11, "algorithm": "medium", "perf": 584.233},
{"m": 9, "n": 9, "k": 7, "tile_m": 3, "tile_n": 1, "threads": 32, "grouping": 13, "minblocks": 25, "algorithm": "medium", "perf": 593.141},
{"m": 9, "n": 9, "k": 8, "tile_m": 3, "tile_n": 1, "threads": 32, "grouping": 16, "minblocks": 2, "algorithm": "medium", "perf": 609.153},
{"m": 9, "n": 9, "k": 9, "tile_m": 1, "tile_n": 3, "threads": 32, "grouping": 13, "minblocks": 20, "algorithm": "medium", "perf": 596.262},
{"m": 9, "n": 9, "k": 10, "tile_m": 3, "tile_n": 1, "threads": 32, "grouping": 18, "minblocks": 5, "algorithm": "medium", "perf": 598.238},
{"m": 9, "n": 9, "k": 12, "tile_m": 3, "tile_n": 1, "threads": 32, "grouping": 18, "minblocks": 16, "algorithm": "medium", "perf": 608.863},
{"m": 9, "n": 9, "k": 13, "tile_m": 1, "tile_n": 3, "threads": 32, "grouping": 21, "minblocks": 3, "algorithm": "medium", "perf": 598.854},
{"m": 9, "n": 9, "k": 22, "tile_m": 1, "tile_n": 2, "threads": 64, "grouping": 26, "minblocks": 2, "algorithm": "medium", "perf": 602.914},
{"m": 9, "n": 9, "k": 25, "tile_m": 1, "tile_n": 1, "threads": 128, "grouping": 5, "minblocks": 11, "algorithm": "medium", "perf": 604.486},
{"m": 9, "n": 9, "k": 26, "tile_m": 1, "tile_n": 1, "threads": 128, "grouping": 5, "minblocks": 9, "algorithm": "medium", "perf": 606.896},
{"m": 9, "n": 9, "k": 28, "tile_m": 1, "tile_n": 1, "threads": 128, "grouping": 4, "minblocks": 12, "algorithm": "medium", "perf": 623.854},
{"m": 9, "n": 9, "k": 32, "tile_m": 1, "tile_n": 1, "threads": 96, "grouping": 4, "minblocks": 2, "algorithm": "medium", "perf": 619.696},
{"m": 9, "n": 9, "k": 45, "tile_m": 1, "tile_n": 1, "threads": 224, "grouping": 4, "minblocks": 6, "algorithm": "medium", "perf": 621.925},
{"m": 9, "n": 10, "k": 9, "tile_m": 3, "tile_n": 1, "threads": 32, "grouping": 13, "minblocks": 16, "algorithm": "medium", "perf": 603.196},
{"m": 9, "n": 10, "k": 10, "tile_m": 3, "tile_n": 1, "threads": 32, "grouping": 11, "minblocks": 2, "algorithm": "medium", "perf": 590.348},
{"m": 9, "n": 10, "k": 12, "tile_m": 3, "tile_n": 1, "threads": 64, "grouping": 22, "minblocks": 18, "algorithm": "medium", "perf": 616.887},
{"m": 9, "n": 10, "k": 32, "tile_m": 1, "tile_n": 2, "threads": 128, "grouping": 4, "minblocks": 10, "algorithm": "medium", "perf": 649.51},
{"m": 9, "n": 12, "k": 9, "tile_m": 1, "tile_n": 4, "threads": 32, "grouping": 13, "minblocks": 25, "algorithm": "medium", "perf": 636.186},
{"m": 9, "n": 12, "k": 10, "tile_m": 2, "tile_n": 2, "threads": 32, "grouping": 12, "minblocks": 17, "algorithm": "medium", "perf": 641.738},
{"m": 9, "n": 12, "k": 12, "tile_m": 1, "tile_n": 2, "threads": 64, "grouping": 22, "minblocks": 15, "algorithm": "medium", "perf": 653.32},
{"m": 9, "n": 12, "k": 32, "tile_m": 1, "tile_n": 2, "w": 8, "v": 12, "threads": 64, "grouping": 16, "minblocks": 1, "algorithm": "largeDB2", "perf": 699.295},
{"m": 9, "n": 13, "k": 4, "tile_m": 5, "tile_n": 1, "threads": 32, "grouping": 12, "minblocks": 8, "algorithm": "medium", "perf": 520.652},
{"m": 9, "n": 13, "k": 5, "tile_m": 5, "tile_n": 1, "threads": 32, "grouping": 13, "minblocks": 13, "algorithm": "medium", "perf": 570.99},
{"m": 9, "n": 13, "k": 7, "tile_m": 1, "tile_n": 5, "threads": 32, "grouping": 16, "minblocks": 2, "algorithm": "medium", "perf": 619.584},
{"m": 9, "n": 13, "k": 9, "tile_m": 5, "tile_n": 1, "threads": 32, "grouping": 12, "minblocks": 21, "algorithm": "medium", "perf": 635.789},
{"m": 9, "n": 13, "k": 13, "tile_m": 1, "tile_n": 2, "threads": 64, "grouping": 26, "minblocks": 18, "algorithm": "medium", "perf": 675.011},
{"m": 9, "n": 13, "k": 25, "tile_m": 1, "tile_n": 2, "threads": 64, "grouping": 26, "minblocks": 6, "algorithm": "medium", "perf": 695.157},
{"m": 9, "n": 13, "k": 26, "tile_m": 1, "tile_n": 2, "w": 12, "v": 12, "threads": 64, "grouping": 16, "minblocks": 2, "algorithm": "largeDB2", "perf": 706.349},
{"m": 9, "n": 13, "k": 28, "tile_m": 1, "tile_n": 2, "w": 12, "v": 8, "threads": 64, "grouping": 16, "minblocks": 2, "algorithm": "largeDB2", "perf": 709.773},
{"m": 9, "n": 13, "k": 32, "tile_m": 1, "tile_n": 2, "w": 14, "v": 8, "threads": 64, "grouping": 16, "minblocks": 1, "algorithm": "largeDB2", "perf": 720.317},
{"m": 9, "n": 13, "k": 45, "tile_m": 1, "tile_n": 1, "threads": 160, "grouping": 3, "minblocks": 6, "algorithm": "medium", "perf": 722.283},
{"m": 9, "n": 22, "k": 9, "tile_m": 2, "tile_n": 2, "threads": 96, "grouping": 32, "minblocks": 5, "algorithm": "medium", "perf": 751.681},
{"m": 9, "n": 22, "k": 22, "tile_m": 1, "tile_n": 2, "threads": 128, "grouping": 5, "minblocks": 7, "algorithm": "medium", "perf": 814.968},
{"m": 9, "n": 22, "k": 32, "tile_m": 2, "tile_n": 2, "w": 16, "v": 22, "threads": 64, "grouping": 16, "minblocks": 1, "algorithm": "largeDB2", "perf": 851.65},
{"m": 9, "n": 25, "k": 4, "tile_m": 1, "tile_n": 4, "threads": 64, "grouping": 22, "minblocks": 19, "algorithm": "medium", "perf": 627.071},
{"m": 9, "n": 25, "k": 5, "tile_m": 1, "tile_n": 4, "threads": 64, "grouping": 22, "minblocks": 11, "algorithm": "medium", "perf": 697.048},
{"m": 9, "n": 25, "k": 7, "tile_m": 1, "tile_n": 4, "threads": 64, "grouping": 27, "minblocks": 11, "algorithm": "medium", "perf": 759.221},
{"m": 9, "n": 25, "k": 9, "tile_m": 1, "tile_n": 4, "threads": 96, "grouping": 29, "minblocks": 10, "algorithm": "medium", "perf": 780.691},
{"m": 9, "n": 25, "k": 13, "tile_m": 1, "tile_n": 4, "threads": 128, "grouping": 9, "minblocks": 9, "algorithm": "medium", "perf": 806.204},
{"m": 9, "n": 25, "k": 25, "tile_m": 1, "tile_n": 2, "threads": 128, "grouping": 4, "minblocks": 5, "algorithm": "medium", "perf": 850.306},
{"m": 9, "n": 25, "k": 26, "tile_m": 1, "tile_n": 2, "threads": 128, "grouping": 4, "minblocks": 5, "algorithm": "medium", "perf": 860.479},
{"m": 9, "n": 25, "k": 28, "tile_m": 2, "tile_n": 1, "threads": 160, "grouping": 4, "minblocks": 6, "algorithm": "medium", "perf": 868.917},
{"m": 9, "n": 25, "k": 32, "tile_m": 2, "tile_n": 1, "threads": 160, "grouping": 4, "minblocks": 4, "algorithm": "medium", "perf": 876.897},
{"m": 9, "n": 25, "k": 45, "tile_m": 1, "tile_n": 2, "w": 14, "v": 14, "threads": 128, "grouping": 16, "minblocks": 2, "algorithm": "largeDB2", "perf": 889.424},
{"m": 9, "n": 26, "k": 4, "tile_m": 1, "tile_n": 4, "threads": 64, "grouping": 22, "minblocks": 20, "algorithm": "medium", "perf": 651.805},
{"m": 9, "n": 26, "k": 5, "tile_m": 1, "tile_n": 4, "threads": 64, "grouping": 26, "minblocks": 19, "algorithm": "medium", "perf": 709.356},
{"m": 9, "n": 26, "k": 7, "tile_m": 1, "tile_n": 4, "threads": 64, "grouping": 26, "minblocks": 11, "algorithm": "medium", "perf": 779.501},
{"m": 9, "n": 26, "k": 9, "tile_m": 1, "tile_n": 4, "threads": 96, "grouping": 26, "minblocks": 11, "algorithm": "medium", "perf": 790.313},
{"m": 9, "n": 26, "k": 13, "tile_m": 1, "tile_n": 4, "threads": 128, "grouping": 32, "minblocks": 9, "algorithm": "medium", "perf": 820.423},
{"m": 9, "n": 26, "k": 25, "tile_m": 1, "tile_n": 2, "threads": 128, "grouping": 4, "minblocks": 1, "algorithm": "medium", "perf": 859.973},
{"m": 9, "n": 26, "k": 26, "tile_m": 1, "tile_n": 5, "w": 10, "v": 26, "threads": 64, "grouping": 16, "minblocks": 1, "algorithm": "largeDB2", "perf": 873.449},
{"m": 9, "n": 26, "k": 28, "tile_m": 1, "tile_n": 3, "w": 10, "v": 14, "threads": 96, "grouping": 16, "minblocks": 2, "algorithm": "largeDB2", "perf": 879.817},
{"m": 9, "n": 26, "k": 32, "tile_m": 1, "tile_n": 2, "threads": 128, "grouping": 3, "minblocks": 3, "algorithm": "medium", "perf": 884.616},
{"m": 9, "n": 26, "k": 45, "tile_m": 1, "tile_n": 2, "w": 12, "v": 16, "threads": 128, "grouping": 16, "minblocks": 1, "algorithm": "largeDB2", "perf": 907.729},
{"m": 9, "n": 28, "k": 4, "tile_m": 1, "tile_n": 4, "threads": 64, "grouping": 22, "minblocks": 14, "algorithm": "medium", "perf": 687.488},
{"m": 9, "n": 28, "k": 5, "tile_m": 1, "tile_n": 4, "threads": 64, "grouping": 21, "minblocks": 10, "algorithm": "medium", "perf": 735.829},
{"m": 9, "n": 28, "k": 7, "tile_m": 1, "tile_n": 4, "threads": 64, "grouping": 26, "minblocks": 14, "algorithm": "medium", "perf": 806.204},
{"m": 9, "n": 28, "k": 9, "tile_m": 3, "tile_n": 1, "threads": 96, "grouping": 26, "minblocks": 11, "algorithm": "medium", "perf": 821.996},
{"m": 9, "n": 28, "k": 13, "tile_m": 1, "tile_n": 4, "threads": 128, "grouping": 21, "minblocks": 7, "algorithm": "medium", "perf": 840.047},
{"m": 9, "n": 28, "k": 25, "tile_m": 1, "tile_n": 2, "threads": 128, "grouping": 5, "minblocks": 1, "algorithm": "medium", "perf": 890.192},
{"m": 9, "n": 28, "k": 26, "tile_m": 1, "tile_n": 2, "threads": 256, "grouping": 4, "minblocks": 6, "algorithm": "medium", "perf": 897.077},
{"m": 9, "n": 28, "k": 28, "tile_m": 1, "tile_n": 2, "threads": 256, "grouping": 4, "minblocks": 5, "algorithm": "medium", "perf": 904.627},
{"m": 9, "n": 28, "k": 32, "tile_m": 1, "tile_n": 2, "threads": 160, "grouping": 3, "minblocks": 4, "algorithm": "medium", "perf": 915.991},
{"m": 9, "n": 28, "k": 45, "tile_m": 1, "tile_n": 2, "w": 10, "v": 28, "threads": 128, "grouping": 16, "minblocks": 2, "algorithm": "largeDB2", "perf": 927.821},
{"m": 9, "n": 32, "k": 4, "tile_m": 5, "tile_n": 1, "threads": 64, "grouping": 22, "minblocks": 14, "algorithm": "medium", "perf": 721.352},
{"m": 9, "n": 32, "k": 5, "tile_m": 3, "tile_n": 2, "threads": 64, "grouping": 26, "minblocks": 3, "algorithm": "medium", "perf": 765.332},
{"m": 9, "n": 32, "k": 7, "tile_m": 1, "tile_n": 5, "threads": 64, "grouping": 26, "minblocks": 6, "algorithm": "medium", "perf": 832},
{"m": 9, "n": 32, "k": 9, "tile_m": 2, "tile_n": 2, "threads": 96, "grouping": 32, "minblocks": 3, "algorithm": "medium", "perf": 851.008},
{"m": 9, "n": 32, "k": 10, "tile_m": 3, "tile_n": 1, "threads": 96, "grouping": 32, "minblocks": 3, "algorithm": "medium", "perf": 854.866},
{"m": 9, "n": 32, "k": 12, "tile_m": 5, "tile_n": 1, "threads": 128, "grouping": 5, "minblocks": 10, "algorithm": "medium", "perf": 866.147},
{"m": 9, "n": 32, "k": 13, "tile_m": 5, "tile_n": 1, "threads": 128, "grouping": 5, "minblocks": 10, "algorithm": "medium", "perf": 869.42},
{"m": 9, "n": 32, "k": 22, "tile_m": 3, "tile_n": 2, "w": 8, "v": 32, "threads": 64, "grouping": 16, "minblocks": 1, "algorithm": "largeDB2", "perf": 910.237},
{"m": 9, "n": 32, "k": 25, "tile_m": 3, "tile_n": 1, "w": 10, "v": 26, "threads": 96, "grouping": 16, "minblocks": 2, "algorithm": "largeDB2", "perf": 918.498},
{"m": 9, "n": 32, "k": 26, "tile_m": 3, "tile_n": 1, "w": 10, "v": 18, "threads": 96, "grouping": 16, "minblocks": 2, "algorithm": "largeDB2", "perf": 925},
{"m": 9, "n": 32, "k": 28, "tile_m": 3, "tile_n": 1, "w": 10, "v": 26, "threads": 96, "grouping": 16, "minblocks": 1, "algorithm": "largeDB2", "perf": 928.218},
{"m": 9, "n": 32, "k": 32, "tile_m": 1, "tile_n": 5, "w": 12, "v": 32, "threads": 64, "grouping": 16, "minblocks": 4, "algorithm": "largeDB2", "perf": 944.428},
{"m": 9, "n": 32, "k": 45, "tile_m": 3, "tile_n": 1, "w": 10, "v": 28, "threads": 96, "grouping": 16, "minblocks": 4, "algorithm": "largeDB2", "perf": 965.569},
{"m": 9, "n": 45, "k": 4, "tile_m": 6, "tile_n": 2, "threads": 64, "grouping": 30, "minblocks": 10, "algorithm": "medium", "perf": 732.692},
{"m": 9, "n": 45, "k": 5, "tile_m": 5, "tile_n": 2, "threads": 64, "grouping": 30, "minblocks": 11, "algorithm": "medium", "perf": 771.67},
{"m": 9, "n": 45, "k": 7, "tile_m": 1, "tile_n": 5, "threads": 96, "grouping": 29, "minblocks": 10, "algorithm": "medium", "perf": 833.778},
{"m": 9, "n": 45, "k": 9, "tile_m": 1, "tile_n": 5, "threads": 128, "grouping": 32, "minblocks": 9, "algorithm": "medium", "perf": 859.465},
{"m": 9, "n": 45, "k": 13, "tile_m": 1, "tile_n": 3, "threads": 160, "grouping": 5, "minblocks": 7, "algorithm": "medium", "perf": 903.628},
{"m": 9, "n": 45, "k": 25, "tile_m": 5, "tile_n": 1, "threads": 256, "grouping": 24, "minblocks": 4, "algorithm": "medium", "perf": 967.166},
{"m": 9, "n": 45, "k": 26, "tile_m": 5, "tile_n": 1, "w": 10, "v": 18, "threads": 96, "grouping": 16, "minblocks": 4, "algorithm": "largeDB2", "perf": 977.295},
{"m": 9, "n": 45, "k": 28, "tile_m": 5, "tile_n": 1, "threads": 256, "grouping": 4, "minblocks": 4, "algorithm": "medium", "perf": 990.414},
{"m": 9, "n": 45, "k": 32, "tile_m": 5, "tile_n": 1, "threads": 128, "grouping": 3, "minblocks": 3, "algorithm": "medium", "perf": 1004.63},
{"m": 9, "n": 45, "k": 45, "tile_m": 2, "tile_n": 2, "w": 12, "v": 16, "threads": 128, "grouping": 16, "minblocks": 1, "algorithm": "largeDB2", "perf": 1022.05},
{"m": 10, "n": 4, "k": 4, "tile_m": 1, "tile_n": 2, "threads": 32, "grouping": 16, "minblocks": 1, "algorithm": "medium", "perf": 247.284},
{"m": 10, "n": 4, "k": 10, "tile_m": 1, "tile_n": 2, "threads": 32, "grouping": 13, "minblocks": 22, "algorithm": "medium", "perf": 389.557},
{"m": 10, "n": 4, "k": 15, "tile_m": 1, "tile_n": 1, "threads": 64, "grouping": 6, "minblocks": 27, "algorithm": "medium", "perf": 396.818},
{"m": 10, "n": 9, "k": 9, "tile_m": 1, "tile_n": 3, "threads": 32, "grouping": 16, "minblocks": 22, "algorithm": "medium", "perf": 617.477},
{"m": 10, "n": 9, "k": 10, "tile_m": 1, "tile_n": 3, "threads": 32, "grouping": 11, "minblocks": 6, "algorithm": "medium", "perf": 598.408},
{"m": 10, "n": 9, "k": 12, "tile_m": 1, "tile_n": 3, "threads": 32, "grouping": 12, "minblocks": 10, "algorithm": "medium", "perf": 630.235},
{"m": 10, "n": 9, "k": 32, "tile_m": 1, "tile_n": 1, "threads": 96, "grouping": 4, "minblocks": 7, "algorithm": "medium", "perf": 654.862},
{"m": 10, "n": 10, "k": 4, "tile_m": 2, "tile_n": 2, "threads": 32, "grouping": 13, "minblocks": 22, "algorithm": "medium", "perf": 526.19},
{"m": 10, "n": 10, "k": 9, "tile_m": 1, "tile_n": 4, "threads": 32, "grouping": 19, "minblocks": 23, "algorithm": "medium", "perf": 645.292},
{"m": 10, "n": 10, "k": 10, "tile_m": 1, "tile_n": 4, "threads": 32, "grouping": 18, "minblocks": 22, "algorithm": "medium", "perf": 663.631},
{"m": 10, "n": 10, "k": 11, "tile_m": 1, "tile_n": 2, "threads": 64, "grouping": 6, "minblocks": 19, "algorithm": "medium", "perf": 649.449},
{"m": 10, "n": 10, "k": 12, "tile_m": 1, "tile_n": 2, "threads": 64, "grouping": 22, "minblocks": 3, "algorithm": "medium", "perf": 678.945},
{"m": 10, "n": 10, "k": 15, "tile_m": 1, "tile_n": 2, "threads": 64, "grouping": 24, "minblocks": 4, "algorithm": "medium", "perf": 666.283},
{"m": 10, "n": 10, "k": 32, "tile_m": 1, "tile_n": 2, "threads": 128, "grouping": 3, "minblocks": 8, "algorithm": "medium", "perf": 692.008},
{"m": 10, "n": 12, "k": 9, "tile_m": 1, "tile_n": 4, "threads": 32, "grouping": 13, "minblocks": 15, "algorithm": "medium", "perf": 669.43},
{"m": 10, "n": 12, "k": 10, "tile_m": 1, "tile_n": 2, "threads": 64, "grouping": 22, "minblocks": 6, "algorithm": "medium", "perf": 690.625},
{"m": 10, "n": 12, "k": 12, "tile_m": 1, "tile_n": 2, "w": 6, "v": 12, "threads": 64, "grouping": 16, "minblocks": 8, "algorithm": "largeDB2", "perf": 710.062},
{"m": 10, "n": 12, "k": 32, "tile_m": 1, "tile_n": 2, "threads": 128, "grouping": 3, "minblocks": 4, "algorithm": "medium", "perf": 749.015},
{"m": 10, "n": 15, "k": 4, "tile_m": 5, "tile_n": 1, "threads": 32, "grouping": 13, "minblocks": 7, "algorithm": "medium", "perf": 610.102},
{"m": 10, "n": 15, "k": 10, "tile_m": 1, "tile_n": 3, "threads": 64, "grouping": 24, "minblocks": 17, "algorithm": "medium", "perf": 729.268},
{"m": 10, "n": 15, "k": 15, "tile_m": 1, "tile_n": 3, "threads": 64, "grouping": 22, "minblocks": 6, "algorithm": "medium", "perf": 749.635},
{"m": 10, "n": 32, "k": 9, "tile_m": 2, "tile_n": 2, "threads": 96, "grouping": 32, "minblocks": 9, "algorithm": "medium", "perf": 905.73},
{"m": 10, "n": 32, "k": 10, "tile_m": 1, "tile_n": 6, "threads": 128, "grouping": 32, "minblocks": 9, "algorithm": "medium", "perf": 906.799},
{"m": 10, "n": 32, "k": 12, "tile_m": 1, "tile_n": 3, "threads": 128, "grouping": 32, "minblocks": 10, "algorithm": "medium", "perf": 938.098},
{"m": 10, "n": 32, "k": 32, "tile_m": 1, "tile_n": 2, "threads": 192, "grouping": 3, "minblocks": 2, "algorithm": "medium", "perf": 1031.68},
{"m": 11, "n": 11, "k": 11, "tile_m": 2, "tile_n": 2, "threads": 64, "grouping": 26, "minblocks": 5, "algorithm": "medium", "perf": 702.059},
{"m": 11, "n": 11, "k": 12, "tile_m": 1, "tile_n": 3, "threads": 64, "grouping": 26, "minblocks": 7, "algorithm": "medium", "perf": 710.594},
{"m": 11, "n": 11, "k": 20, "tile_m": 2, "tile_n": 2, "threads": 96, "grouping": 32, "minblocks": 10, "algorithm": "medium", "perf": 718.795},
{"m": 11, "n": 11, "k": 25, "tile_m": 2, "tile_n": 1, "threads": 96, "grouping": 32, "minblocks": 8, "algorithm": "medium", "perf": 723.132},
{"m": 11, "n": 11, "k": 32, "tile_m": 2, "tile_n": 1, "threads": 128, "grouping": 4, "minblocks": 2, "algorithm": "medium", "perf": 748.109},
{"m": 11, "n": 12, "k": 11, "tile_m": 2, "tile_n": 2, "threads": 64, "grouping": 26, "minblocks": 6, "algorithm": "medium", "perf": 693.544},
{"m": 11, "n": 12, "k": 12, "tile_m": 1, "tile_n": 3, "threads": 64, "grouping": 26, "minblocks": 17, "algorithm": "medium", "perf": 710.581},
{"m": 11, "n": 12, "k": 20, "tile_m": 2, "tile_n": 2, "threads": 64, "grouping": 7, "minblocks": 13, "algorithm": "medium", "perf": 732.24},
{"m": 11, "n": 12, "k": 25, "tile_m": 2, "tile_n": 1, "threads": 96, "grouping": 5, "minblocks": 8, "algorithm": "medium", "perf": 740.308},
{"m": 11, "n": 12, "k": 32, "tile_m": 2, "tile_n": 1, "threads": 128, "grouping": 4, "minblocks": 6, "algorithm": "medium", "perf": 766.012},
{"m": 11, "n": 20, "k": 11, "tile_m": 2, "tile_n": 2, "threads": 64, "grouping": 26, "minblocks": 11, "algorithm": "medium", "perf": 859.155},
{"m": 11, "n": 20, "k": 12, "tile_m": 2, "tile_n": 2, "threads": 64, "grouping": 26, "minblocks": 9, "algorithm": "medium", "perf": 859.574},
{"m": 11, "n": 20, "k": 20, "tile_m": 4, "tile_n": 1, "w": 10, "v": 8, "threads": 64, "grouping": 16, "minblocks": 2, "algorithm": "largeDB2", "perf": 900.568},
{"m": 11, "n": 20, "k": 25, "tile_m": 2, "tile_n": 1, "threads": 128, "grouping": 4, "minblocks": 7, "algorithm": "medium", "perf": 918.74},
{"m": 11, "n": 20, "k": 32, "tile_m": 2, "tile_n": 1, "threads": 128, "grouping": 4, "minblocks": 5, "algorithm": "medium", "perf": 948.189},
{"m": 11, "n": 25, "k": 11, "tile_m": 1, "tile_n": 5, "threads": 128, "grouping": 32, "minblocks": 9, "algorithm": "medium", "perf": 895.515},
{"m": 11, "n": 25, "k": 12, "tile_m": 1, "tile_n": 5, "threads": 64, "grouping": 32, "minblocks": 1, "algorithm": "medium", "perf": 894.023},
{"m": 11, "n": 25, "k": 20, "tile_m": 2, "tile_n": 3, "w": 10, "v": 24, "threads": 64, "grouping": 16, "minblocks": 1, "algorithm": "largeDB2", "perf": 968.954},
{"m": 11, "n": 25, "k": 25, "tile_m": 2, "tile_n": 3, "w": 10, "v": 22, "threads": 64, "grouping": 16, "minblocks": 4, "algorithm": "largeDB2", "perf": 972.814},
{"m": 11, "n": 25, "k": 32, "tile_m": 2, "tile_n": 1, "threads": 192, "grouping": 4, "minblocks": 5, "algorithm": "medium", "perf": 1003.35},
{"m": 11, "n": 32, "k": 11, "tile_m": 6, "tile_n": 1, "threads": 128, "grouping": 32, "minblocks": 9, "algorithm": "medium", "perf": 967.416},
{"m": 11, "n": 32, "k": 12, "tile_m": 6, "tile_n": 1, "w": 6, "v": 28, "threads": 64, "grouping": 16, "minblocks": 8, "algorithm": "largeDB2", "perf": 971.263},
{"m": 11, "n": 32, "k": 20, "tile_m": 3, "tile_n": 2, "w": 10, "v": 32, "threads": 64, "grouping": 16, "minblocks": 2, "algorithm": "largeDB2", "perf": 1040.31},
{"m": 11, "n": 32, "k": 25, "tile_m": 2, "tile_n": 1, "threads": 192, "grouping": 4, "minblocks": 4, "algorithm": "medium", "perf": 1053.09},
{"m": 11, "n": 32, "k": 32, "tile_m": 2, "tile_n": 2, "w": 8, "v": 8, "threads": 96, "grouping": 16, "minblocks": 4, "algorithm": "largeDB2", "perf": 1093.93},
{"m": 12, "n": 5, "k": 5, "tile_m": 2, "tile_n": 1, "threads": 32, "grouping": 11, "minblocks": 6, "algorithm": "medium", "perf": 414.313},
{"m": 12, "n": 5, "k": 12, "tile_m": 2, "tile_n": 1, "threads": 32, "grouping": 13, "minblocks": 1, "algorithm": "medium", "perf": 489.381},
{"m": 12, "n": 5, "k": 13, "tile_m": 2, "tile_n": 1, "threads": 32, "grouping": 4, "minblocks": 8, "algorithm": "medium", "perf": 472.929},
{"m": 12, "n": 5, "k": 26, "tile_m": 1, "tile_n": 1, "threads": 96, "grouping": 5, "minblocks": 6, "algorithm": "medium", "perf": 492.364},
{"m": 12, "n": 5, "k": 32, "tile_m": 1, "tile_n": 1, "threads": 64, "grouping": 3, "minblocks": 1, "algorithm": "medium", "perf": 501.048},
{"m": 12, "n": 9, "k": 9, "tile_m": 4, "tile_n": 1, "threads": 32, "grouping": 13, "minblocks": 25, "algorithm": "medium", "perf": 630.854},
{"m": 12, "n": 9, "k": 10, "tile_m": 2, "tile_n": 2, "threads": 64, "grouping": 18, "minblocks": 16, "algorithm": "medium", "perf": 645.924},
{"m": 12, "n": 9, "k": 12, "tile_m": 1, "tile_n": 2, "threads": 64, "grouping": 22, "minblocks": 5, "algorithm": "medium", "perf": 663.387},
{"m": 12, "n": 9, "k": 32, "tile_m": 1, "tile_n": 2, "w": 16, "v": 6, "threads": 64, "grouping": 16, "minblocks": 2, "algorithm": "largeDB2", "perf": 698.588},
{"m": 12, "n": 10, "k": 9, "tile_m": 4, "tile_n": 1, "threads": 32, "grouping": 12, "minblocks": 10, "algorithm": "medium", "perf": 663.302},
{"m": 12, "n": 10, "k": 10, "tile_m": 1, "tile_n": 2, "threads": 64, "grouping": 22, "minblocks": 12, "algorithm": "medium", "perf": 695.265},
{"m": 12, "n": 10, "k": 12, "tile_m": 1, "tile_n": 2, "w": 6, "v": 10, "threads": 64, "grouping": 16, "minblocks": 2, "algorithm": "largeDB2", "perf": 707.143},
{"m": 12, "n": 10, "k": 32, "tile_m": 1, "tile_n": 2, "w": 8, "v": 10, "threads": 64, "grouping": 16, "minblocks": 12, "algorithm": "largeDB2", "perf": 743.602},
{"m": 12, "n": 11, "k": 11, "tile_m": 1, "tile_n": 3, "threads": 64, "grouping": 26, "minblocks": 10, "algorithm": "medium", "perf": 707.91},
{"m": 12, "n": 11, "k": 12, "tile_m": 1, "tile_n": 3, "threads": 64, "grouping": 26, "minblocks": 18, "algorithm": "medium", "perf": 722.854},
{"m": 12, "n": 11, "k": 20, "tile_m": 1, "tile_n": 3, "threads": 64, "grouping": 6, "minblocks": 5, "algorithm": "medium", "perf": 748.533},
{"m": 12, "n": 11, "k": 25, "tile_m": 1, "tile_n": 2, "threads": 96, "grouping": 5, "minblocks": 6, "algorithm": "medium", "perf": 746.389},
{"m": 12, "n": 11, "k": 32, "tile_m": 2, "tile_n": 1, "threads": 128, "grouping": 4, "minblocks": 5, "algorithm": "medium", "perf": 772.265},
{"m": 12, "n": 12, "k": 5, "tile_m": 6, "tile_n": 1, "threads": 32, "grouping": 15, "minblocks": 3, "algorithm": "medium", "perf": 704.113},
{"m": 12, "n": 12, "k": 9, "tile_m": 1, "tile_n": 3, "threads": 64, "grouping": 22, "minblocks": 10, "algorithm": "medium", "perf": 766.851},
{"m": 12, "n": 12, "k": 10, "tile_m": 1, "tile_n": 3, "threads": 64, "grouping": 22, "minblocks": 5, "algorithm": "medium", "perf": 782.428},
{"m": 12, "n": 12, "k": 11, "tile_m": 1, "tile_n": 3, "threads": 64, "grouping": 26, "minblocks": 1, "algorithm": "medium", "perf": 773.895},
{"m": 12, "n": 12, "k": 12, "tile_m": 1, "tile_n": 3, "threads": 64, "grouping": 26, "minblocks": 1, "algorithm": "medium", "perf": 787.849},
{"m": 12, "n": 12, "k": 13, "tile_m": 1, "tile_n": 3, "threads": 64, "grouping": 32, "minblocks": 1, "algorithm": "medium", "perf": 783.946},
{"m": 12, "n": 12, "k": 16, "tile_m": 1, "tile_n": 3, "threads": 64, "grouping": 32, "minblocks": 14, "algorithm": "medium", "perf": 797.978},
{"m": 12, "n": 12, "k": 20, "tile_m": 1, "tile_n": 3, "threads": 64, "grouping": 32, "minblocks": 3, "algorithm": "medium", "perf": 789.883},
{"m": 12, "n": 12, "k": 25, "tile_m": 1, "tile_n": 2, "threads": 128, "grouping": 6, "minblocks": 5, "algorithm": "medium", "perf": 798.948},
{"m": 12, "n": 12, "k": 26, "tile_m": 1, "tile_n": 3, "threads": 160, "grouping": 5, "minblocks": 8, "algorithm": "medium", "perf": 794.647},
{"m": 12, "n": 12, "k": 32, "tile_m": 1, "tile_n": 2, "threads": 128, "grouping": 4, "minblocks": 5, "algorithm": "medium", "perf": 821.891},
{"m": 12, "n": 13, "k": 5, "tile_m": 3, "tile_n": 2, "threads": 32, "grouping": 14, "minblocks": 12, "algorithm": "medium", "perf": 671.755},
{"m": 12, "n": 13, "k": 12, "tile_m": 1, "tile_n": 3, "threads": 64, "grouping": 24, "minblocks": 17, "algorithm": "medium", "perf": 785.316},
{"m": 12, "n": 13, "k": 13, "tile_m": 2, "tile_n": 2, "threads": 64, "grouping": 26, "minblocks": 12, "algorithm": "medium", "perf": 777.453},
{"m": 12, "n": 13, "k": 26, "tile_m": 1, "tile_n": 2, "threads": 96, "grouping": 5, "minblocks": 3, "algorithm": "medium", "perf": 821.309},
{"m": 12, "n": 13, "k": 32, "tile_m": 1, "tile_n": 2, "threads": 128, "grouping": 4, "minblocks": 6, "algorithm": "medium", "perf": 841.375},
{"m": 12, "n": 16, "k": 12, "tile_m": 3, "tile_n": 1, "threads": 64, "grouping": 26, "minblocks": 12, "algorithm": "medium", "perf": 850.387},
{"m": 12, "n": 16, "k": 16, "tile_m": 1, "tile_n": 2, "threads": 96, "grouping": 32, "minblocks": 7, "algorithm": "medium", "perf": 884.496},
{"m": 12, "n": 16, "k": 32, "tile_m": 1, "tile_n": 2, "threads": 192, "grouping": 4, "minblocks": 3, "algorithm": "medium", "perf": 928.761},
{"m": 12, "n": 20, "k": 11, "tile_m": 1, "tile_n": 4, "threads": 64, "grouping": 26, "minblocks": 11, "algorithm": "medium", "perf": 895.574},
{"m": 12, "n": 20, "k": 12, "tile_m": 2, "tile_n": 2, "threads": 64, "grouping": 26, "minblocks": 8, "algorithm": "medium", "perf": 908.586},
{"m": 12, "n": 20, "k": 20, "tile_m": 1, "tile_n": 3, "w": 10, "v": 12, "threads": 96, "grouping": 16, "minblocks": 4, "algorithm": "largeDB2", "perf": 960.877},
{"m": 12, "n": 20, "k": 25, "tile_m": 1, "tile_n": 2, "threads": 128, "grouping": 5, "minblocks": 4, "algorithm": "medium", "perf": 972.699},
{"m": 12, "n": 20, "k": 32, "tile_m": 2, "tile_n": 2, "w": 16, "v": 20, "threads": 64, "grouping": 16, "minblocks": 4, "algorithm": "largeDB2", "perf": 1003.8},
{"m": 12, "n": 25, "k": 11, "tile_m": 1, "tile_n": 5, "threads": 64, "grouping": 32, "minblocks": 7, "algorithm": "medium", "perf": 936.728},
{"m": 12, "n": 25, "k": 12, "tile_m": 1, "tile_n": 5, "threads": 96, "grouping": 32, "minblocks": 10, "algorithm": "medium", "perf": 953.604},
{"m": 12, "n": 25, "k": 20, "tile_m": 2, "tile_n": 3, "w": 10, "v": 24, "threads": 64, "grouping": 16, "minblocks": 1, "algorithm": "largeDB2", "perf": 1028.48},
{"m": 12, "n": 25, "k": 25, "tile_m": 1, "tile_n": 2, "threads": 192, "grouping": 4, "minblocks": 6, "algorithm": "medium", "perf": 1042.81},
{"m": 12, "n": 25, "k": 32, "tile_m": 1, "tile_n": 2, "threads": 192, "grouping": 3, "minblocks": 3, "algorithm": "medium", "perf": 1082.11},
{"m": 12, "n": 26, "k": 5, "tile_m": 1, "tile_n": 6, "threads": 64, "grouping": 26, "minblocks": 12, "algorithm": "medium", "perf": 857.411},
{"m": 12, "n": 26, "k": 12, "tile_m": 1, "tile_n": 2, "threads": 160, "grouping": 9, "minblocks": 3, "algorithm": "medium", "perf": 961.121},
{"m": 12, "n": 26, "k": 13, "tile_m": 1, "tile_n": 6, "threads": 96, "grouping": 5, "minblocks": 11, "algorithm": "medium", "perf": 975.617},
{"m": 12, "n": 26, "k": 26, "tile_m": 1, "tile_n": 2, "threads": 192, "grouping": 4, "minblocks": 1, "algorithm": "medium", "perf": 1066.53},
{"m": 12, "n": 26, "k": 32, "tile_m": 1, "tile_n": 2, "threads": 192, "grouping": 4, "minblocks": 1, "algorithm": "medium", "perf": 1099.3},
{"m": 12, "n": 32, "k": 5, "tile_m": 6, "tile_n": 1, "threads": 64, "grouping": 29, "minblocks": 12, "algorithm": "medium", "perf": 905.659},
{"m": 12, "n": 32, "k": 9, "tile_m": 1, "tile_n": 4, "threads": 128, "grouping": 32, "minblocks": 9, "algorithm": "medium", "perf": 1009.07},
{"m": 12, "n": 32, "k": 10, "tile_m": 1, "tile_n": 4, "threads": 128, "grouping": 32, "minblocks": 10, "algorithm": "medium", "perf": 1022.68},
{"m": 12, "n": 32, "k": 11, "tile_m": 1, "tile_n": 4, "threads": 96, "grouping": 32, "minblocks": 10, "algorithm": "medium", "perf": 1031.57},
{"m": 12, "n": 32, "k": 12, "tile_m": 1, "tile_n": 4, "threads": 96, "grouping": 4, "minblocks": 11, "algorithm": "medium", "perf": 1037.69},
{"m": 12, "n": 32, "k": 13, "tile_m": 1, "tile_n": 4, "threads": 160, "grouping": 5, "minblocks": 8, "algorithm": "medium", "perf": 1052.61},
{"m": 12, "n": 32, "k": 16, "tile_m": 1, "tile_n": 4, "threads": 128, "grouping": 4, "minblocks": 8, "algorithm": "medium", "perf": 1084.77},
{"m": 12, "n": 32, "k": 20, "tile_m": 1, "tile_n": 2, "threads": 192, "grouping": 4, "minblocks": 1, "algorithm": "medium", "perf": 1106.6},
{"m": 12, "n": 32, "k": 25, "tile_m": 1, "tile_n": 2, "threads": 192, "grouping": 4, "minblocks": 3, "algorithm": "medium", "perf": 1128.97},
{"m": 12, "n": 32, "k": 26, "tile_m": 1, "tile_n": 2, "threads": 192, "grouping": 4, "minblocks": 3, "algorithm": "medium", "perf": 1139.65},
{"m": 12, "n": 32, "k": 32, "tile_m": 1, "tile_n": 2, "threads": 192, "grouping": 3, "minblocks": 4, "algorithm": "medium", "perf": 1180.17},
{"m": 13, "n": 4, "k": 4, "tile_m": 2, "tile_n": 1, "threads": 32, "grouping": 16, "minblocks": 6, "algorithm": "medium", "perf": 309.329},
{"m": 13, "n": 4, "k": 5, "tile_m": 1, "tile_n": 2, "threads": 32, "grouping": 16, "minblocks": 19, "algorithm": "medium", "perf": 351.076},
{"m": 13, "n": 4, "k": 7, "tile_m": 2, "tile_n": 1, "threads": 32, "grouping": 11, "minblocks": 12, "algorithm": "medium", "perf": 430.38},
{"m": 13, "n": 4, "k": 9, "tile_m": 1, "tile_n": 2, "threads": 32, "grouping": 13, "minblocks": 7, "algorithm": "medium", "perf": 412.394},
{"m": 13, "n": 4, "k": 13, "tile_m": 1, "tile_n": 1, "threads": 64, "grouping": 4, "minblocks": 27, "algorithm": "medium", "perf": 421.461},
{"m": 13, "n": 4, "k": 25, "tile_m": 1, "tile_n": 1, "threads": 128, "grouping": 4, "minblocks": 1, "algorithm": "medium", "perf": 422.942},
{"m": 13, "n": 4, "k": 26, "tile_m": 1, "tile_n": 1, "threads": 128, "grouping": 4, "minblocks": 10, "algorithm": "medium", "perf": 428.057},
{"m": 13, "n": 4, "k": 28, "tile_m": 1, "tile_n": 1, "threads": 128, "grouping": 4, "minblocks": 2, "algorithm": "medium", "perf": 436.195},
{"m": 13, "n": 4, "k": 32, "tile_m": 1, "tile_n": 1, "threads": 160, "grouping": 4, "minblocks": 5, "algorithm": "medium", "perf": 440.449},
{"m": 13, "n": 4, "k": 45, "tile_m": 1, "tile_n": 1, "threads": 192, "grouping": 3, "minblocks": 5, "algorithm": "medium", "perf": 436.899},
{"m": 13, "n": 5, "k": 4, "tile_m": 1, "tile_n": 3, "threads": 32, "grouping": 16, "minblocks": 13, "algorithm": "medium", "perf": 362.493},
{"m": 13, "n": 5, "k": 5, "tile_m": 1, "tile_n": 3, "threads": 32, "grouping": 13, "minblocks": 1, "algorithm": "medium", "perf": 414.824},
{"m": 13, "n": 5, "k": 7, "tile_m": 1, "tile_n": 3, "threads": 32, "grouping": 13, "minblocks": 16, "algorithm": "medium", "perf": 451.746},
{"m": 13, "n": 5, "k": 9, "tile_m": 3, "tile_n": 1, "threads": 32, "grouping": 13, "minblocks": 18, "algorithm": "medium", "perf": 474.015},
{"m": 13, "n": 5, "k": 12, "tile_m": 1, "tile_n": 3, "threads": 64, "grouping": 18, "minblocks": 16, "algorithm": "medium", "perf": 489.219},
{"m": 13, "n": 5, "k": 13, "tile_m": 1, "tile_n": 3, "threads": 32, "grouping": 6, "minblocks": 12, "algorithm": "medium", "perf": 460.079},
{"m": 13, "n": 5, "k": 16, "tile_m": 1, "tile_n": 3, "threads": 96, "grouping": 30, "minblocks": 3, "algorithm": "medium", "perf": 482.507},
{"m": 13, "n": 5, "k": 24, "tile_m": 1, "tile_n": 2, "threads": 64, "grouping": 5, "minblocks": 1, "algorithm": "medium", "perf": 491.453},
{"m": 13, "n": 5, "k": 25, "tile_m": 1, "tile_n": 2, "threads": 128, "grouping": 5, "minblocks": 11, "algorithm": "medium", "perf": 487.722},
{"m": 13, "n": 5, "k": 26, "tile_m": 1, "tile_n": 2, "threads": 64, "grouping": 4, "minblocks": 1, "algorithm": "medium", "perf": 485.067},
{"m": 13, "n": 5, "k": 28, "tile_m": 1, "tile_n": 1, "threads": 96, "grouping": 3, "minblocks": 7, "algorithm": "medium", "perf": 493.982},
{"m": 13, "n": 5, "k": 32, "tile_m": 1, "tile_n": 1, "threads": 96, "grouping": 3, "minblocks": 4, "algorithm": "medium", "perf": 501.16},
{"m": 13, "n": 5, "k": 45, "tile_m": 1, "tile_n": 1, "threads": 128, "grouping": 4, "minblocks": 5, "algorithm": "medium", "perf": 501.227},
{"m": 13, "n": 7, "k": 4, "tile_m": 1, "tile_n": 4, "threads": 32, "grouping": 13, "minblocks": 12, "algorithm": "medium", "perf": 476.167},
{"m": 13, "n": 7, "k": 5, "tile_m": 2, "tile_n": 2, "threads": 32, "grouping": 13, "minblocks": 13, "algorithm": "medium", "perf": 472.557},
{"m": 13, "n": 7, "k": 7, "tile_m": 4, "tile_n": 1, "threads": 32, "grouping": 13, "minblocks": 22, "algorithm": "medium", "perf": 566.505},
{"m": 13, "n": 7, "k": 9, "tile_m": 2, "tile_n": 2, "threads": 32, "grouping": 16, "minblocks": 23, "algorithm": "medium", "perf": 562.908},
{"m": 13, "n": 7, "k": 13, "tile_m": 1, "tile_n": 2, "threads": 64, "grouping": 6, "minblocks": 9, "algorithm": "medium", "perf": 575.653},
{"m": 13, "n": 7, "k": 25, "tile_m": 1, "tile_n": 2, "w": 12, "v": 6, "threads": 64, "grouping": 16, "minblocks": 2, "algorithm": "largeDB2", "perf": 598.682},
{"m": 13, "n": 7, "k": 26, "tile_m": 1, "tile_n": 2, "w": 12, "v": 4, "threads": 64, "grouping": 16, "minblocks": 2, "algorithm": "largeDB2", "perf": 609.262},
{"m": 13, "n": 7, "k": 28, "tile_m": 1, "tile_n": 1, "threads": 128, "grouping": 5, "minblocks": 4, "algorithm": "medium", "perf": 611.772},
{"m": 13, "n": 7, "k": 32, "tile_m": 1, "tile_n": 1, "threads": 128, "grouping": 6, "minblocks": 5, "algorithm": "medium", "perf": 622.583},
{"m": 13, "n": 7, "k": 45, "tile_m": 1, "tile_n": 1, "threads": 128, "grouping": 3, "minblocks": 6, "algorithm": "medium", "perf": 627.27},
{"m": 13, "n": 9, "k": 4, "tile_m": 5, "tile_n": 1, "threads": 32, "grouping": 13, "minblocks": 27, "algorithm": "medium", "perf": 500.98},
{"m": 13, "n": 9, "k": 5, "tile_m": 1, "tile_n": 5, "threads": 32, "grouping": 13, "minblocks": 12, "algorithm": "medium", "perf": 558.304},
{"m": 13, "n": 9, "k": 7, "tile_m": 1, "tile_n": 5, "threads": 32, "grouping": 14, "minblocks": 25, "algorithm": "medium", "perf": 614.166},
{"m": 13, "n": 9, "k": 9, "tile_m": 2, "tile_n": 1, "threads": 64, "grouping": 26, "minblocks": 19, "algorithm": "medium", "perf": 633.01},
{"m": 13, "n": 9, "k": 13, "tile_m": 2, "tile_n": 1, "threads": 64, "grouping": 22, "minblocks": 3, "algorithm": "medium", "perf": 674.039},
{"m": 13, "n": 9, "k": 25, "tile_m": 2, "tile_n": 1, "w": 12, "v": 8, "threads": 64, "grouping": 16, "minblocks": 2, "algorithm": "largeDB2", "perf": 696.232},
{"m": 13, "n": 9, "k": 26, "tile_m": 2, "tile_n": 1, "w": 10, "v": 8, "threads": 64, "grouping": 16, "minblocks": 12, "algorithm": "largeDB2", "perf": 700.495},
{"m": 13, "n": 9, "k": 28, "tile_m": 2, "tile_n": 1, "w": 14, "v": 6, "threads": 64, "grouping": 16, "minblocks": 2, "algorithm": "largeDB2", "perf": 716.029},
{"m": 13, "n": 9, "k": 32, "tile_m": 2, "tile_n": 1, "w": 14, "v": 8, "threads": 64, "grouping": 16, "minblocks": 2, "algorithm": "largeDB2", "perf": 717.374},
{"m": 13, "n": 9, "k": 45, "tile_m": 2, "tile_n": 1, "w": 14, "v": 6, "threads": 64, "grouping": 16, "minblocks": 12, "algorithm": "largeDB2", "perf": 720.997},
{"m": 13, "n": 12, "k": 5, "tile_m": 1, "tile_n": 6, "threads": 32, "grouping": 13, "minblocks": 23, "algorithm": "medium", "perf": 669.522},
{"m": 13, "n": 12, "k": 12, "tile_m": 1, "tile_n": 3, "threads": 64, "grouping": 26, "minblocks": 17, "algorithm": "medium", "perf": 782.744},
{"m": 13, "n": 12, "k": 13, "tile_m": 3, "tile_n": 1, "threads": 64, "grouping": 22, "minblocks": 6, "algorithm": "medium", "perf": 773.206},
{"m": 13, "n": 12, "k": 26, "tile_m": 1, "tile_n": 3, "threads": 128, "grouping": 5, "minblocks": 9, "algorithm": "medium", "perf": 802.307},
{"m": 13, "n": 12, "k": 32, "tile_m": 4, "tile_n": 1, "w": 16, "v": 12, "threads": 64, "grouping": 16, "minblocks": 2, "algorithm": "largeDB2", "perf": 828.44},
{"m": 13, "n": 13, "k": 4, "tile_m": 4, "tile_n": 2, "threads": 32, "grouping": 15, "minblocks": 15, "algorithm": "medium", "perf": 645.445},
{"m": 13, "n": 13, "k": 5, "tile_m": 3, "tile_n": 3, "threads": 32, "grouping": 17, "minblocks": 13, "algorithm": "medium", "perf": 687.167},
{"m": 13, "n": 13, "k": 7, "tile_m": 4, "tile_n": 2, "threads": 32, "grouping": 20, "minblocks": 14, "algorithm": "medium", "perf": 753.739},
{"m": 13, "n": 13, "k": 9, "tile_m": 4, "tile_n": 1, "threads": 64, "grouping": 26, "minblocks": 5, "algorithm": "medium", "perf": 798.832},
{"m": 13, "n": 13, "k": 12, "tile_m": 2, "tile_n": 2, "threads": 64, "grouping": 26, "minblocks": 4, "algorithm": "medium", "perf": 819.816},
{"m": 13, "n": 13, "k": 13, "tile_m": 4, "tile_n": 1, "threads": 64, "grouping": 32, "minblocks": 6, "algorithm": "medium", "perf": 808.211},
{"m": 13, "n": 13, "k": 14, "tile_m": 2, "tile_n": 2, "threads": 96, "grouping": 32, "minblocks": 10, "algorithm": "medium", "perf": 828.516},
{"m": 13, "n": 13, "k": 16, "tile_m": 2, "tile_n": 2, "threads": 64, "grouping": 32, "minblocks": 7, "algorithm": "medium", "perf": 829.325},
{"m": 13, "n": 13, "k": 24, "tile_m": 1, "tile_n": 2, "threads": 128, "grouping": 5, "minblocks": 4, "algorithm": "medium", "perf": 846.028},
{"m": 13, "n": 13, "k": 25, "tile_m": 2, "tile_n": 1, "threads": 128, "grouping": 5, "minblocks": 5, "algorithm": "medium", "perf": 843.072},
{"m": 13, "n": 13, "k": 26, "tile_m": 2, "tile_n": 1, "threads": 128, "grouping": 4, "minblocks": 1, "algorithm": "medium", "perf": 847.219},
{"m": 13, "n": 13, "k": 28, "tile_m": 2, "tile_n": 1, "threads": 128, "grouping": 4, "minblocks": 7, "algorithm": "medium", "perf": 855.86},
{"m": 13, "n": 13, "k": 32, "tile_m": 2, "tile_n": 1, "threads": 160, "grouping": 5, "minblocks": 2, "algorithm": "medium", "perf": 869.632},
{"m": 13, "n": 13, "k": 45, "tile_m": 2, "tile_n": 1, "threads": 128, "grouping": 3, "minblocks": 3, "algorithm": "medium", "perf": 862.482},
{"m": 13, "n": 14, "k": 13, "tile_m": 2, "tile_n": 2, "threads": 64, "grouping": 26, "minblocks": 3, "algorithm": "medium", "perf": 818.092},
{"m": 13, "n": 14, "k": 14, "tile_m": 1, "tile_n": 2, "threads": 96, "grouping": 32, "minblocks": 6, "algorithm": "medium", "perf": 824.853},
{"m": 13, "n": 14, "k": 25, "tile_m": 1, "tile_n": 2, "threads": 128, "grouping": 6, "minblocks": 1, "algorithm": "medium", "perf": 867.323},
{"m": 13, "n": 14, "k": 26, "tile_m": 1, "tile_n": 2, "threads": 128, "grouping": 5, "minblocks": 7, "algorithm": "medium", "perf": 875.867},
{"m": 13, "n": 14, "k": 32, "tile_m": 2, "tile_n": 2, "w": 16, "v": 14, "threads": 64, "grouping": 16, "minblocks": 4, "algorithm": "largeDB2", "perf": 894.079},
{"m": 13, "n": 16, "k": 5, "tile_m": 4, "tile_n": 2, "threads": 32, "grouping": 17, "minblocks": 14, "algorithm": "medium", "perf": 721.863},
{"m": 13, "n": 16, "k": 13, "tile_m": 2, "tile_n": 2, "threads": 64, "grouping": 26, "minblocks": 1, "algorithm": "medium", "perf": 866.035},
{"m": 13, "n": 16, "k": 16, "tile_m": 4, "tile_n": 1, "threads": 96, "grouping": 4, "minblocks": 13, "algorithm": "medium", "perf": 894.502},
{"m": 13, "n": 16, "k": 32, "tile_m": 4, "tile_n": 1, "w": 16, "v": 16, "threads": 64, "grouping": 16, "minblocks": 4, "algorithm": "largeDB2", "perf": 942.893},
{"m": 13, "n": 24, "k": 5, "tile_m": 2, "tile_n": 3, "threads": 64, "grouping": 26, "minblocks": 10, "algorithm": "medium", "perf": 834.262},
{"m": 13, "n": 24, "k": 13, "tile_m": 4, "tile_n": 1, "threads": 96, "grouping": 5, "minblocks": 12, "algorithm": "medium", "perf": 976.165},
{"m": 13, "n": 24, "k": 24, "tile_m": 3, "tile_n": 2, "w": 12, "v": 20, "threads": 64, "grouping": 16, "minblocks": 1, "algorithm": "largeDB2", "perf": 1079.09},
{"m": 13, "n": 24, "k": 26, "tile_m": 2, "tile_n": 3, "w": 10, "v": 22, "threads": 64, "grouping": 16, "minblocks": 8, "algorithm": "largeDB2", "perf": 1075.11},
{"m": 13, "n": 24, "k": 32, "tile_m": 2, "tile_n": 3, "w": 16, "v": 22, "threads": 64, "grouping": 16, "minblocks": 4, "algorithm": "largeDB2", "perf": 1104.28},
{"m": 13, "n": 25, "k": 4, "tile_m": 2, "tile_n": 3, "threads": 64, "grouping": 25, "minblocks": 9, "algorithm": "medium", "perf": 775.128},
{"m": 13, "n": 25, "k": 5, "tile_m": 2, "tile_n": 3, "threads": 64, "grouping": 27, "minblocks": 5, "algorithm": "medium", "perf": 818.248},
{"m": 13, "n": 25, "k": 7, "tile_m": 2, "tile_n": 2, "threads": 96, "grouping": 32, "minblocks": 10, "algorithm": "medium", "perf": 895.315},
{"m": 13, "n": 25, "k": 9, "tile_m": 2, "tile_n": 2, "threads": 96, "grouping": 32, "minblocks": 9, "algorithm": "medium", "perf": 937.417},
{"m": 13, "n": 25, "k": 13, "tile_m": 1, "tile_n": 3, "threads": 128, "grouping": 7, "minblocks": 9, "algorithm": "medium", "perf": 972.388},
{"m": 13, "n": 25, "k": 14, "tile_m": 1, "tile_n": 4, "threads": 96, "grouping": 32, "minblocks": 9, "algorithm": "medium", "perf": 993.182},
{"m": 13, "n": 25, "k": 25, "tile_m": 2, "tile_n": 3, "w": 10, "v": 14, "threads": 64, "grouping": 16, "minblocks": 2, "algorithm": "largeDB2", "perf": 1071.67},
{"m": 13, "n": 25, "k": 26, "tile_m": 2, "tile_n": 3, "w": 10, "v": 22, "threads": 64, "grouping": 16, "minblocks": 8, "algorithm": "largeDB2", "perf": 1087.2},
{"m": 13, "n": 25, "k": 28, "tile_m": 2, "tile_n": 3, "w": 14, "v": 14, "threads": 64, "grouping": 16, "minblocks": 4, "algorithm": "largeDB2", "perf": 1098.76},
{"m": 13, "n": 25, "k": 32, "tile_m": 2, "tile_n": 3, "w": 16, "v": 20, "threads": 64, "grouping": 16, "minblocks": 8, "algorithm": "largeDB2", "perf": 1113.24},
{"m": 13, "n": 25, "k": 45, "tile_m": 2, "tile_n": 3, "w": 10, "v": 14, "threads": 64, "grouping": 16, "minblocks": 1, "algorithm": "largeDB2", "perf": 1134.6},
{"m": 13, "n": 26, "k": 4, "tile_m": 2, "tile_n": 3, "threads": 64, "grouping": 24, "minblocks": 3, "algorithm": "medium", "perf": 796.636},
{"m": 13, "n": 26, "k": 5, "tile_m": 2, "tile_n": 3, "threads": 64, "grouping": 26, "minblocks": 10, "algorithm": "medium", "perf": 799.952},
{"m": 13, "n": 26, "k": 7, "tile_m": 2, "tile_n": 2, "threads": 96, "grouping": 32, "minblocks": 9, "algorithm": "medium", "perf": 916.63},
{"m": 13, "n": 26, "k": 9, "tile_m": 1, "tile_n": 3, "threads": 128, "grouping": 32, "minblocks": 12, "algorithm": "medium", "perf": 954.576},
{"m": 13, "n": 26, "k": 12, "tile_m": 1, "tile_n": 3, "threads": 160, "grouping": 6, "minblocks": 9, "algorithm": "medium", "perf": 999.327},
{"m": 13, "n": 26, "k": 13, "tile_m": 1, "tile_n": 4, "threads": 96, "grouping": 32, "minblocks": 10, "algorithm": "medium", "perf": 1007.42},
{"m": 13, "n": 26, "k": 14, "tile_m": 1, "tile_n": 3, "threads": 128, "grouping": 5, "minblocks": 10, "algorithm": "medium", "perf": 1015.55},
{"m": 13, "n": 26, "k": 24, "tile_m": 2, "tile_n": 2, "w": 8, "v": 26, "threads": 96, "grouping": 16, "minblocks": 1, "algorithm": "largeDB2", "perf": 1094.14},
{"m": 13, "n": 26, "k": 25, "tile_m": 1, "tile_n": 3, "threads": 128, "grouping": 4, "minblocks": 4, "algorithm": "medium", "perf": 1087.67},
{"m": 13, "n": 26, "k": 26, "tile_m": 2, "tile_n": 2, "w": 10, "v": 10, "threads": 96, "grouping": 16, "minblocks": 1, "algorithm": "largeDB2", "perf": 1091.97},
{"m": 13, "n": 26, "k": 28, "tile_m": 2, "tile_n": 2, "w": 14, "v": 26, "threads": 96, "grouping": 16, "minblocks": 1, "algorithm": "largeDB2", "perf": 1110.06},
{"m": 13, "n": 26, "k": 32, "tile_m": 2, "tile_n": 2, "w": 16, "v": 26, "threads": 96, "grouping": 16, "minblocks": 1, "algorithm": "largeDB2", "perf": 1133.28},
{"m": 13, "n": 26, "k": 45, "tile_m": 2, "tile_n": 3, "w": 12, "v": 26, "threads": 64, "grouping": 16, "minblocks": 8, "algorithm": "largeDB2", "perf": 1150.11},
{"m": 13, "n": 28, "k": 4, "tile_m": 4, "tile_n": 4, "threads": 64, "grouping": 24, "minblocks": 12, "algorithm": "medium", "perf": 824.545},
{"m": 13, "n": 28, "k": 5, "tile_m": 1, "tile_n": 4, "threads": 96, "grouping": 9, "minblocks": 14, "algorithm": "medium", "perf": 835.315},
{"m": 13, "n": 28, "k": 7, "tile_m": 1, "tile_n": 4, "threads": 96, "grouping": 32, "minblocks": 9, "algorithm": "medium", "perf": 942.428},
{"m": 13, "n": 28, "k": 9, "tile_m": 1, "tile_n": 4, "threads": 128, "grouping": 29, "minblocks": 10, "algorithm": "medium", "perf": 986.164},
{"m": 13, "n": 28, "k": 13, "tile_m": 1, "tile_n": 4, "threads": 96, "grouping": 32, "minblocks": 9, "algorithm": "medium", "perf": 1028.12},
{"m": 13, "n": 28, "k": 25, "tile_m": 4, "tile_n": 2, "threads": 64, "grouping": 4, "minblocks": 2, "algorithm": "medium", "perf": 1096.2},
{"m": 13, "n": 28, "k": 26, "tile_m": 4, "tile_n": 2, "threads": 64, "grouping": 4, "minblocks": 2, "algorithm": "medium", "perf": 1109.32},
{"m": 13, "n": 28, "k": 28, "tile_m": 2, "tile_n": 4, "w": 14, "v": 26, "threads": 64, "grouping": 16, "minblocks": 2, "algorithm": "largeDB2", "perf": 1123.07},
{"m": 13, "n": 28, "k": 32, "tile_m": 4, "tile_n": 2, "threads": 64, "grouping": 30, "minblocks": 1, "algorithm": "medium", "perf": 1134.83},
{"m": 13, "n": 28, "k": 45, "tile_m": 4, "tile_n": 2, "w": 14, "v": 20, "threads": 64, "grouping": 16, "minblocks": 1, "algorithm": "largeDB2", "perf": 1175.77},
{"m": 13, "n": 32, "k": 4, "tile_m": 2, "tile_n": 4, "threads": 64, "grouping": 26, "minblocks": 6, "algorithm": "medium", "perf": 873.764},
{"m": 13, "n": 32, "k": 5, "tile_m": 2, "tile_n": 4, "threads": 64, "grouping": 32, "minblocks": 6, "algorithm": "medium", "perf": 870.626},
{"m": 13, "n": 32, "k": 7, "tile_m": 1, "tile_n": 5, "threads": 96, "grouping": 32, "minblocks": 9, "algorithm": "medium", "perf": 981.108},
{"m": 13, "n": 32, "k": 9, "tile_m": 1, "tile_n": 5, "threads": 96, "grouping": 32, "minblocks": 9, "algorithm": "medium", "perf": 1008.75},
{"m": 13, "n": 32, "k": 12, "tile_m": 4, "tile_n": 2, "w": 6, "v": 20, "threads": 64, "grouping": 16, "minblocks": 1, "algorithm": "largeDB2", "perf": 1074.65},
{"m": 13, "n": 32, "k": 13, "tile_m": 4, "tile_n": 1, "threads": 128, "grouping": 5, "minblocks": 9, "algorithm": "medium", "perf": 1073.99},
{"m": 13, "n": 32, "k": 14, "tile_m": 4, "tile_n": 1, "threads": 128, "grouping": 5, "minblocks": 9, "algorithm": "medium", "perf": 1087.04},
{"m": 13, "n": 32, "k": 16, "tile_m": 4, "tile_n": 1, "threads": 128, "grouping": 4, "minblocks": 8, "algorithm": "medium", "perf": 1122.91},
{"m": 13, "n": 32, "k": 24, "tile_m": 4, "tile_n": 2, "w": 12, "v": 28, "threads": 64, "grouping": 16, "minblocks": 1, "algorithm": "largeDB2", "perf": 1168.27},
{"m": 13, "n": 32, "k": 25, "tile_m": 4, "tile_n": 2, "threads": 64, "grouping": 4, "minblocks": 2, "algorithm": "medium", "perf": 1155.19},
{"m": 13, "n": 32, "k": 26, "tile_m": 4, "tile_n": 2, "threads": 64, "grouping": 4, "minblocks": 4, "algorithm": "medium", "perf": 1166.22},
{"m": 13, "n": 32, "k": 28, "tile_m": 4, "tile_n": 2, "threads": 64, "grouping": 3, "minblocks": 1, "algorithm": "medium", "perf": 1176.77},
{"m": 13, "n": 32, "k": 32, "tile_m": 2, "tile_n": 2, "w": 12, "v": 14, "threads": 128, "grouping": 16, "minblocks": 1, "algorithm": "largeDB2", "perf": 1205.05},
{"m": 13, "n": 32, "k": 45, "tile_m": 2, "tile_n": 2, "w": 12, "v": 32, "threads": 128, "grouping": 16, "minblocks": 1, "algorithm": "largeDB2", "perf": 1231.88},
{"m": 13, "n": 45, "k": 4, "tile_m": 2, "tile_n": 5, "threads": 64, "grouping": 32, "minblocks": 5, "algorithm": "medium", "perf": 879.247},
{"m": 13, "n": 45, "k": 5, "tile_m": 1, "tile_n": 5, "threads": 128, "grouping": 32, "minblocks": 9, "algorithm": "medium", "perf": 909.587},
{"m": 13, "n": 45, "k": 7, "tile_m": 1, "tile_n": 5, "threads": 128, "grouping": 32, "minblocks": 9, "algorithm": "medium", "perf": 1015.1},
{"m": 13, "n": 45, "k": 9, "tile_m": 1, "tile_n": 5, "threads": 128, "grouping": 32, "minblocks": 9, "algorithm": "medium", "perf": 1091.53},
{"m": 13, "n": 45, "k": 13, "tile_m": 1, "tile_n": 5, "threads": 192, "grouping": 29, "minblocks": 5, "algorithm": "medium", "perf": 1152.46},
{"m": 13, "n": 45, "k": 25, "tile_m": 4, "tile_n": 3, "threads": 64, "grouping": 29, "minblocks": 4, "algorithm": "medium", "perf": 1240.6},
{"m": 13, "n": 45, "k": 26, "tile_m": 4, "tile_n": 3, "threads": 64, "grouping": 4, "minblocks": 4, "algorithm": "medium", "perf": 1247.15},
{"m": 13, "n": 45, "k": 28, "tile_m": 2, "tile_n": 4, "w": 14, "v": 20, "threads": 96, "grouping": 16, "minblocks": 4, "algorithm": "largeDB2", "perf": 1271.38},
{"m": 13, "n": 45, "k": 32, "tile_m": 4, "tile_n": 3, "w": 8, "v": 12, "threads": 64, "grouping": 16, "minblocks": 4, "algorithm": "largeDB2", "perf": 1291.85},
{"m": 13, "n": 45, "k": 45, "tile_m": 2, "tile_n": 5, "w": 12, "v": 26, "threads": 64, "grouping": 16, "minblocks": 4, "algorithm": "largeDB2", "perf": 1331.96},
{"m": 14, "n": 13, "k": 13, "tile_m": 2, "tile_n": 2, "threads": 64, "grouping": 26, "minblocks": 4, "algorithm": "medium", "perf": 819.111},
{"m": 14, "n": 13, "k": 14, "tile_m": 1, "tile_n": 4, "threads": 64, "grouping": 32, "minblocks": 3, "algorithm": "medium", "perf": 829.012},
{"m": 14, "n": 13, "k": 25, "tile_m": 2, "tile_n": 1, "threads": 128, "grouping": 5, "minblocks": 7, "algorithm": "medium", "perf": 861.359},
{"m": 14, "n": 13, "k": 26, "tile_m": 1, "tile_n": 2, "threads": 128, "grouping": 5, "minblocks": 7, "algorithm": "medium", "perf": 876.462},
{"m": 14, "n": 13, "k": 32, "tile_m": 1, "tile_n": 2, "threads": 128, "grouping": 4, "minblocks": 6, "algorithm": "medium", "perf": 900.065},
{"m": 14, "n": 14, "k": 13, "tile_m": 1, "tile_n": 4, "threads": 96, "grouping": 32, "minblocks": 9, "algorithm": "medium", "perf": 876.026},
{"m": 14, "n": 14, "k": 14, "tile_m": 2, "tile_n": 2, "threads": 64, "grouping": 26, "minblocks": 7, "algorithm": "medium", "perf": 878.284},
{"m": 14, "n": 14, "k": 16, "tile_m": 1, "tile_n": 2, "threads": 128, "grouping": 32, "minblocks": 4, "algorithm": "medium", "perf": 902.555},
{"m": 14, "n": 14, "k": 25, "tile_m": 1, "tile_n": 2, "threads": 128, "grouping": 6, "minblocks": 3, "algorithm": "medium", "perf": 915.718},
{"m": 14, "n": 14, "k": 26, "tile_m": 1, "tile_n": 2, "threads": 128, "grouping": 5, "minblocks": 5, "algorithm": "medium", "perf": 924.538},
{"m": 14, "n": 14, "k": 29, "tile_m": 1, "tile_n": 2, "threads": 128, "grouping": 4, "minblocks": 3, "algorithm": "medium", "perf": 924.968},
{"m": 14, "n": 14, "k": 32, "tile_m": 1, "tile_n": 2, "threads": 128, "grouping": 4, "minblocks": 5, "algorithm": "medium", "perf": 948.827},
{"m": 14, "n": 16, "k": 14, "tile_m": 1, "tile_n": 4, "threads": 64, "grouping": 29, "minblocks": 1, "algorithm": "medium", "perf": 920.926},
{"m": 14, "n": 16, "k": 16, "tile_m": 1, "tile_n": 4, "threads": 64, "grouping": 24, "minblocks": 11, "algorithm": "medium", "perf": 934.112},
{"m": 14, "n": 16, "k": 29, "tile_m": 1, "tile_n": 2, "threads": 128, "grouping": 4, "minblocks": 5, "algorithm": "medium", "perf": 985.695},
{"m": 14, "n": 25, "k": 13, "tile_m": 1, "tile_n": 3, "threads": 128, "grouping": 32, "minblocks": 9, "algorithm": "medium", "perf": 1036.53},
{"m": 14, "n": 25, "k": 14, "tile_m": 1, "tile_n": 3, "threads": 128, "grouping": 6, "minblocks": 10, "algorithm": "medium", "perf": 1064.78},
{"m": 14, "n": 25, "k": 25, "tile_m": 1, "tile_n": 2, "threads": 192, "grouping": 4, "minblocks": 5, "algorithm": "medium", "perf": 1135.93},
{"m": 14, "n": 25, "k": 26, "tile_m": 1, "tile_n": 2, "threads": 192, "grouping": 4, "minblocks": 1, "algorithm": "medium", "perf": 1146.21},
{"m": 14, "n": 25, "k": 32, "tile_m": 1, "tile_n": 2, "threads": 224, "grouping": 3, "minblocks": 2, "algorithm": "medium", "perf": 1180.89},
{"m": 14, "n": 26, "k": 13, "tile_m": 1, "tile_n": 3, "threads": 128, "grouping": 6, "minblocks": 10, "algorithm": "medium", "perf": 1059.97},
{"m": 14, "n": 26, "k": 14, "tile_m": 1, "tile_n": 3, "threads": 128, "grouping": 4, "minblocks": 10, "algorithm": "medium", "perf": 1080.3},
{"m": 14, "n": 26, "k": 25, "tile_m": 1, "tile_n": 3, "threads": 128, "grouping": 3, "minblocks": 2, "algorithm": "medium", "perf": 1164.2},
{"m": 14, "n": 26, "k": 26, "tile_m": 1, "tile_n": 2, "threads": 192, "grouping": 4, "minblocks": 5, "algorithm": "medium", "perf": 1170.35},
{"m": 14, "n": 26, "k": 32, "tile_m": 1, "tile_n": 2, "threads": 224, "grouping": 4, "minblocks": 4, "algorithm": "medium", "perf": 1204.18},
{"m": 14, "n": 29, "k": 14, "tile_m": 1, "tile_n": 5, "threads": 128, "grouping": 5, "minblocks": 8, "algorithm": "medium", "perf": 1099.41},
{"m": 14, "n": 29, "k": 16, "tile_m": 1, "tile_n": 5, "threads": 128, "grouping": 4, "minblocks": 7, "algorithm": "medium", "perf": 1136.55},
{"m": 14, "n": 29, "k": 29, "tile_m": 1, "tile_n": 3, "threads": 160, "grouping": 4, "minblocks": 2, "algorithm": "medium", "perf": 1205.08},
{"m": 14, "n": 29, "k": 32, "tile_m": 1, "tile_n": 3, "threads": 160, "grouping": 4, "minblocks": 3, "algorithm": "medium", "perf": 1227.39},
{"m": 14, "n": 32, "k": 13, "tile_m": 1, "tile_n": 4, "threads": 128, "grouping": 4, "minblocks": 9, "algorithm": "medium", "perf": 1144.56},
{"m": 14, "n": 32, "k": 14, "tile_m": 1, "tile_n": 4, "threads": 128, "grouping": 5, "minblocks": 8, "algorithm": "medium", "perf": 1157.34},
{"m": 14, "n": 32, "k": 25, "tile_m": 1, "tile_n": 3, "threads": 224, "grouping": 4, "minblocks": 5, "algorithm": "medium", "perf": 1247.65},
{"m": 14, "n": 32, "k": 26, "tile_m": 1, "tile_n": 2, "threads": 224, "grouping": 4, "minblocks": 4, "algorithm": "medium", "perf": 1256.51},
{"m": 14, "n": 32, "k": 29, "tile_m": 1, "tile_n": 3, "threads": 160, "grouping": 3, "minblocks": 4, "algorithm": "medium", "perf": 1258.33},
{"m": 14, "n": 32, "k": 32, "tile_m": 1, "tile_n": 3, "threads": 224, "grouping": 3, "minblocks": 4, "algorithm": "medium", "perf": 1281.96},
{"m": 15, "n": 4, "k": 4, "tile_m": 2, "tile_n": 1, "threads": 32, "grouping": 16, "minblocks": 21, "algorithm": "medium", "perf": 349.797},
{"m": 15, "n": 4, "k": 10, "tile_m": 2, "tile_n": 1, "threads": 32, "grouping": 13, "minblocks": 5, "algorithm": "medium", "perf": 430.134},
{"m": 15, "n": 4, "k": 15, "tile_m": 2, "tile_n": 1, "threads": 64, "grouping": 6, "minblocks": 11, "algorithm": "medium", "perf": 443.27},
{"m": 15, "n": 10, "k": 4, "tile_m": 5, "tile_n": 1, "threads": 32, "grouping": 12, "minblocks": 22, "algorithm": "medium", "perf": 594.569},
{"m": 15, "n": 10, "k": 10, "tile_m": 2, "tile_n": 2, "threads": 64, "grouping": 22, "minblocks": 6, "algorithm": "medium", "perf": 728.427},
{"m": 15, "n": 10, "k": 15, "tile_m": 2, "tile_n": 2, "threads": 64, "grouping": 29, "minblocks": 9, "algorithm": "medium", "perf": 747.245},
{"m": 15, "n": 15, "k": 4, "tile_m": 2, "tile_n": 2, "threads": 64, "grouping": 19, "minblocks": 6, "algorithm": "medium", "perf": 738.168},
{"m": 15, "n": 15, "k": 10, "tile_m": 2, "tile_n": 2, "threads": 64, "grouping": 29, "minblocks": 10, "algorithm": "medium", "perf": 904.696},
{"m": 15, "n": 15, "k": 15, "tile_m": 2, "tile_n": 2, "threads": 64, "grouping": 32, "minblocks": 2, "algorithm": "medium", "perf": 928.082},
{"m": 16, "n": 5, "k": 5, "tile_m": 1, "tile_n": 3, "threads": 32, "grouping": 12, "minblocks": 23, "algorithm": "medium", "perf": 501.288},
{"m": 16, "n": 5, "k": 13, "tile_m": 1, "tile_n": 3, "threads": 64, "grouping": 4, "minblocks": 19, "algorithm": "medium", "perf": 503.261},
{"m": 16, "n": 5, "k": 16, "tile_m": 1, "tile_n": 3, "threads": 96, "grouping": 29, "minblocks": 11, "algorithm": "medium", "perf": 524.682},
{"m": 16, "n": 5, "k": 32, "tile_m": 1, "tile_n": 1, "threads": 128, "grouping": 32, "minblocks": 3, "algorithm": "medium", "perf": 534.391},
{"m": 16, "n": 12, "k": 12, "tile_m": 1, "tile_n": 3, "threads": 64, "grouping": 26, "minblocks": 15, "algorithm": "medium", "perf": 854.169},
{"m": 16, "n": 12, "k": 16, "tile_m": 1, "tile_n": 2, "threads": 96, "grouping": 32, "minblocks": 11, "algorithm": "medium", "perf": 887.754},
{"m": 16, "n": 12, "k": 32, "tile_m": 2, "tile_n": 1, "threads": 160, "grouping": 5, "minblocks": 3, "algorithm": "medium", "perf": 925.265},
{"m": 16, "n": 13, "k": 5, "tile_m": 2, "tile_n": 4, "threads": 32, "grouping": 16, "minblocks": 4, "algorithm": "medium", "perf": 723.746},
{"m": 16, "n": 13, "k": 13, "tile_m": 2, "tile_n": 2, "threads": 64, "grouping": 26, "minblocks": 9, "algorithm": "medium", "perf": 871.757},
{"m": 16, "n": 13, "k": 16, "tile_m": 2, "tile_n": 2, "threads": 64, "grouping": 32, "minblocks": 1, "algorithm": "medium", "perf": 897.477},
{"m": 16, "n": 13, "k": 32, "tile_m": 1, "tile_n": 2, "threads": 160, "grouping": 4, "minblocks": 1, "algorithm": "medium", "perf": 953.971},
{"m": 16, "n": 14, "k": 14, "tile_m": 2, "tile_n": 2, "threads": 64, "grouping": 32, "minblocks": 12, "algorithm": "medium", "perf": 927.004},
{"m": 16, "n": 14, "k": 16, "tile_m": 1, "tile_n": 4, "threads": 96, "grouping": 5, "minblocks": 11, "algorithm": "medium", "perf": 936.063},
{"m": 16, "n": 14, "k": 29, "tile_m": 1, "tile_n": 2, "threads": 128, "grouping": 4, "minblocks": 3, "algorithm": "medium", "perf": 985.795},
{"m": 16, "n": 16, "k": 5, "tile_m": 2, "tile_n": 5, "threads": 32, "grouping": 19, "minblocks": 14, "algorithm": "medium", "perf": 857.219},
{"m": 16, "n": 16, "k": 12, "tile_m": 2, "tile_n": 2, "threads": 64, "grouping": 32, "minblocks": 3, "algorithm": "medium", "perf": 1009.93},
{"m": 16, "n": 16, "k": 13, "tile_m": 2, "tile_n": 2, "threads": 64, "grouping": 26, "minblocks": 9, "algorithm": "medium", "perf": 1001.92},
{"m": 16, "n": 16, "k": 14, "tile_m": 2, "tile_n": 2, "threads": 64, "grouping": 32, "minblocks": 12, "algorithm": "medium", "perf": 1018.98},
{"m": 16, "n": 16, "k": 16, "tile_m": 2, "tile_n": 2, "threads": 64, "grouping": 29, "minblocks": 8, "algorithm": "small", "perf": 1035.54},
{"m": 16, "n": 16, "k": 29, "tile_m": 1, "tile_n": 2, "threads": 160, "grouping": 4, "minblocks": 2, "algorithm": "medium", "perf": 1062.17},
{"m": 16, "n": 16, "k": 32, "tile_m": 1, "tile_n": 2, "threads": 192, "grouping": 4, "minblocks": 3, "algorithm": "medium", "perf": 1086.81},
{"m": 16, "n": 16, "k": 55, "tile_m": 1, "tile_n": 2, "threads": 128, "grouping": 3, "minblocks": 1, "algorithm": "medium", "perf": 1104.86},
{"m": 16, "n": 29, "k": 14, "tile_m": 1, "tile_n": 5, "threads": 128, "grouping": 4, "minblocks": 9, "algorithm": "medium", "perf": 1221.28},
{"m": 16, "n": 29, "k": 16, "tile_m": 1, "tile_n": 4, "threads": 128, "grouping": 4, "minblocks": 7, "algorithm": "medium", "perf": 1236.07},
{"m": 16, "n": 29, "k": 29, "tile_m": 1, "tile_n": 3, "threads": 160, "grouping": 4, "minblocks": 4, "algorithm": "medium", "perf": 1318.25},
{"m": 16, "n": 29, "k": 55, "tile_m": 1, "tile_n": 3, "w": 16, "v": 16, "threads": 160, "grouping": 16, "minblocks": 1, "algorithm": "largeDB2", "perf": 1388.25},
{"m": 16, "n": 32, "k": 5, "tile_m": 1, "tile_n": 6, "threads": 96, "grouping": 32, "minblocks": 9, "algorithm": "medium", "perf": 1015.49},
{"m": 16, "n": 32, "k": 12, "tile_m": 1, "tile_n": 4, "threads": 128, "grouping": 4, "minblocks": 8, "algorithm": "medium", "perf": 1231.07},
{"m": 16, "n": 32, "k": 13, "tile_m": 1, "tile_n": 4, "threads": 128, "grouping": 5, "minblocks": 8, "algorithm": "medium", "perf": 1239.79},
{"m": 16, "n": 32, "k": 16, "tile_m": 1, "tile_n": 4, "threads": 160, "grouping": 4, "minblocks": 7, "algorithm": "medium", "perf": 1304.45},
{"m": 16, "n": 32, "k": 32, "tile_m": 1, "tile_n": 3, "threads": 192, "grouping": 3, "minblocks": 3, "algorithm": "medium", "perf": 1401.94},
{"m": 16, "n": 55, "k": 16, "tile_m": 1, "tile_n": 5, "threads": 192, "grouping": 4, "minblocks": 5, "algorithm": "medium", "perf": 1477.07},
{"m": 16, "n": 55, "k": 29, "tile_m": 1, "tile_n": 5, "threads": 192, "grouping": 32, "minblocks": 2, "algorithm": "medium", "perf": 1548.78},
{"m": 16, "n": 55, "k": 55, "tile_m": 2, "tile_n": 2, "w": 14, "v": 40, "threads": 224, "grouping": 16, "minblocks": 1, "algorithm": "largeDB2", "perf": 1648.17},
{"m": 17, "n": 17, "k": 17, "tile_m": 1, "tile_n": 6, "threads": 128, "grouping": 6, "minblocks": 9, "algorithm": "medium", "perf": 1025.78},
{"m": 18, "n": 18, "k": 18, "tile_m": 1, "tile_n": 4, "threads": 128, "grouping": 4, "minblocks": 8, "algorithm": "medium", "perf": 1117.66},
{"m": 19, "n": 19, "k": 19, "tile_m": 1, "tile_n": 4, "threads": 160, "grouping": 4, "minblocks": 7, "algorithm": "medium", "perf": 1155.59},
{"m": 20, "n": 11, "k": 20, "tile_m": 1, "tile_n": 2, "w": 10, "v": 8, "threads": 128, "grouping": 16, "minblocks": 1, "algorithm": "largeDB2", "perf": 904.021},
{"m": 20, "n": 11, "k": 32, "tile_m": 1, "tile_n": 2, "w": 16, "v": 8, "threads": 128, "grouping": 16, "minblocks": 1, "algorithm": "largeDB2", "perf": 944.417},
{"m": 20, "n": 12, "k": 20, "tile_m": 1, "tile_n": 2, "w": 10, "v": 4, "threads": 128, "grouping": 16, "minblocks": 4, "algorithm": "largeDB2", "perf": 960.236},
{"m": 20, "n": 12, "k": 32, "tile_m": 1, "tile_n": 2, "w": 16, "v": 12, "threads": 128, "grouping": 16, "minblocks": 4, "algorithm": "largeDB2", "perf": 1001.05},
{"m": 20, "n": 20, "k": 20, "tile_m": 1, "tile_n": 4, "threads": 160, "grouping": 4, "minblocks": 7, "algorithm": "medium", "perf": 1246.17},
{"m": 20, "n": 25, "k": 12, "tile_m": 3, "tile_n": 3, "w": 6, "v": 18, "threads": 64, "grouping": 16, "minblocks": 4, "algorithm": "largeDB2", "perf": 1244.17},
{"m": 20, "n": 25, "k": 20, "tile_m": 3, "tile_n": 2, "w": 10, "v": 16, "threads": 96, "grouping": 16, "minblocks": 4, "algorithm": "largeDB2", "perf": 1334.34},
{"m": 20, "n": 25, "k": 25, "tile_m": 3, "tile_n": 3, "w": 10, "v": 22, "threads": 64, "grouping": 16, "minblocks": 8, "algorithm": "largeDB2", "perf": 1361.83},
{"m": 20, "n": 25, "k": 32, "tile_m": 3, "tile_n": 2, "w": 16, "v": 18, "threads": 96, "grouping": 16, "minblocks": 4, "algorithm": "largeDB2", "perf": 1400.96},
{"m": 20, "n": 11, "k": 11, "tile_m": 1, "tile_n": 4, "threads": 64, "grouping": 24, "minblocks": 1, "algorithm": "medium", "perf": 849.388},
{"m": 20, "n": 11, "k": 12, "tile_m": 1, "tile_n": 4, "threads": 64, "grouping": 24, "minblocks": 11, "algorithm": "medium", "perf": 853.531},
{"m": 20, "n": 11, "k": 25, "tile_m": 1, "tile_n": 2, "threads": 128, "grouping": 4, "minblocks": 4, "algorithm": "medium", "perf": 922.024},
{"m": 20, "n": 12, "k": 11, "tile_m": 1, "tile_n": 4, "threads": 64, "grouping": 26, "minblocks": 12, "algorithm": "medium", "perf": 897.705},
{"m": 20, "n": 12, "k": 12, "tile_m": 1, "tile_n": 4, "threads": 64, "grouping": 29, "minblocks": 4, "algorithm": "medium", "perf": 906.799},
{"m": 20, "n": 12, "k": 25, "tile_m": 1, "tile_n": 2, "threads": 128, "grouping": 4, "minblocks": 2, "algorithm": "medium", "perf": 970.235},
{"m": 20, "n": 20, "k": 11, "tile_m": 1, "tile_n": 5, "threads": 96, "grouping": 32, "minblocks": 12, "algorithm": "medium", "perf": 1153.6},
{"m": 20, "n": 20, "k": 12, "tile_m": 1, "tile_n": 5, "threads": 96, "grouping": 4, "minblocks": 12, "algorithm": "medium", "perf": 1160.25},
{"m": 20, "n": 20, "k": 25, "tile_m": 1, "tile_n": 4, "threads": 160, "grouping": 4, "minblocks": 6, "algorithm": "medium", "perf": 1275.85},
{"m": 20, "n": 20, "k": 32, "tile_m": 1, "tile_n": 3, "threads": 160, "grouping": 3, "minblocks": 2, "algorithm": "medium", "perf": 1309.2},
{"m": 20, "n": 25, "k": 11, "tile_m": 3, "tile_n": 2, "threads": 96, "grouping": 29, "minblocks": 10, "algorithm": "medium", "perf": 1187.93},
{"m": 20, "n": 32, "k": 11, "tile_m": 1, "tile_n": 6, "threads": 128, "grouping": 5, "minblocks": 8, "algorithm": "medium", "perf": 1336.45},
{"m": 20, "n": 32, "k": 12, "tile_m": 1, "tile_n": 6, "threads": 128, "grouping": 4, "minblocks": 7, "algorithm": "medium", "perf": 1364.22},
{"m": 20, "n": 32, "k": 20, "tile_m": 1, "tile_n": 4, "threads": 160, "grouping": 4, "minblocks": 5, "algorithm": "medium", "perf": 1493.29},
{"m": 20, "n": 32, "k": 25, "tile_m": 1, "tile_n": 4, "threads": 160, "grouping": 4, "minblocks": 4, "algorithm": "medium", "perf": 1517.83},
{"m": 20, "n": 32, "k": 32, "tile_m": 1, "tile_n": 4, "threads": 256, "grouping": 32, "minblocks": 3, "algorithm": "medium", "perf": 1557.15},
{"m": 21, "n": 21, "k": 21, "tile_m": 3, "tile_n": 3, "threads": 64, "grouping": 5, "minblocks": 4, "algorithm": "medium", "perf": 1259.48},
{"m": 22, "n": 9, "k": 9, "tile_m": 1, "tile_n": 5, "threads": 64, "grouping": 22, "minblocks": 14, "algorithm": "medium", "perf": 745.394},
{"m": 22, "n": 9, "k": 22, "tile_m": 1, "tile_n": 2, "threads": 128, "grouping": 4, "minblocks": 4, "algorithm": "medium", "perf": 816.342},
{"m": 22, "n": 9, "k": 32, "tile_m": 1, "tile_n": 2, "threads": 160, "grouping": 4, "minblocks": 3, "algorithm": "medium", "perf": 851.574},
{"m": 22, "n": 22, "k": 9, "tile_m": 1, "tile_n": 6, "threads": 96, "grouping": 32, "minblocks": 9, "algorithm": "medium", "perf": 1180.32},
{"m": 22, "n": 22, "k": 22, "tile_m": 3, "tile_n": 3, "threads": 64, "grouping": 4, "minblocks": 5, "algorithm": "medium", "perf": 1354.56},
{"m": 22, "n": 22, "k": 32, "tile_m": 3, "tile_n": 3, "threads": 64, "grouping": 3, "minblocks": 2, "algorithm": "medium", "perf": 1423.15},
{"m": 22, "n": 32, "k": 9, "tile_m": 3, "tile_n": 4, "threads": 64, "grouping": 30, "minblocks": 4, "algorithm": "medium", "perf": 1281.35},
{"m": 22, "n": 32, "k": 22, "tile_m": 1, "tile_n": 4, "threads": 192, "grouping": 4, "minblocks": 5, "algorithm": "medium", "perf": 1571.65},
{"m": 22, "n": 32, "k": 32, "tile_m": 3, "tile_n": 4, "w": 16, "v": 20, "threads": 64, "grouping": 16, "minblocks": 1, "algorithm": "largeDB2", "perf": 1641.78},
{"m": 23, "n": 23, "k": 23, "tile_m": 3, "tile_n": 2, "threads": 96, "grouping": 4, "minblocks": 4, "algorithm": "medium", "perf": 1399.21},
{"m": 24, "n": 5, "k": 5, "tile_m": 1, "tile_n": 5, "threads": 32, "grouping": 13, "minblocks": 16, "algorithm": "medium", "perf": 537.802},
{"m": 24, "n": 5, "k": 13, "tile_m": 1, "tile_n": 3, "threads": 96, "grouping": 32, "minblocks": 3, "algorithm": "medium", "perf": 547.371},
{"m": 24, "n": 5, "k": 24, "tile_m": 1, "tile_n": 1, "threads": 128, "grouping": 32, "minblocks": 7, "algorithm": "medium", "perf": 570.165},
{"m": 24, "n": 5, "k": 26, "tile_m": 1, "tile_n": 1, "threads": 192, "grouping": 4, "minblocks": 8, "algorithm": "medium", "perf": 574.898},
{"m": 24, "n": 5, "k": 32, "tile_m": 1, "tile_n": 1, "threads": 192, "grouping": 3, "minblocks": 1, "algorithm": "medium", "perf": 586.204},
{"m": 24, "n": 13, "k": 5, "tile_m": 3, "tile_n": 2, "threads": 64, "grouping": 26, "minblocks": 9, "algorithm": "medium", "perf": 828.944},
{"m": 24, "n": 13, "k": 13, "tile_m": 1, "tile_n": 5, "threads": 96, "grouping": 6, "minblocks": 11, "algorithm": "medium", "perf": 980.411},
{"m": 24, "n": 13, "k": 24, "tile_m": 3, "tile_n": 2, "w": 12, "v": 12, "threads": 64, "grouping": 16, "minblocks": 4, "algorithm": "largeDB2", "perf": 1080.39},
{"m": 24, "n": 13, "k": 26, "tile_m": 1, "tile_n": 3, "threads": 128, "grouping": 3, "minblocks": 2, "algorithm": "medium", "perf": 1074.3},
{"m": 24, "n": 13, "k": 32, "tile_m": 1, "tile_n": 3, "threads": 128, "grouping": 3, "minblocks": 2, "algorithm": "medium", "perf": 1107.01},
{"m": 24, "n": 24, "k": 5, "tile_m": 3, "tile_n": 3, "threads": 64, "grouping": 32, "minblocks": 8, "algorithm": "medium", "perf": 1126.34},
{"m": 24, "n": 24, "k": 13, "tile_m": 1, "tile_n": 6, "threads": 160, "grouping": 4, "minblocks": 8, "algorithm": "medium", "perf": 1384.19},
{"m": 24, "n": 24, "k": 24, "tile_m": 1, "tile_n": 3, "threads": 192, "grouping": 3, "minblocks": 5, "algorithm": "medium", "perf": 1523.95},
{"m": 24, "n": 24, "k": 26, "tile_m": 1, "tile_n": 3, "threads": 224, "grouping": 4, "minblocks": 1, "algorithm": "medium", "perf": 1513.76},
{"m": 24, "n": 24, "k": 32, "tile_m": 1, "tile_n": 3, "threads": 192, "grouping": 3, "minblocks": 1, "algorithm": "medium", "perf": 1578.31},
{"m": 24, "n": 26, "k": 5, "tile_m": 1, "tile_n": 6, "threads": 160, "grouping": 12, "minblocks": 8, "algorithm": "medium", "perf": 1069.19},
{"m": 24, "n": 26, "k": 13, "tile_m": 1, "tile_n": 6, "threads": 128, "grouping": 5, "minblocks": 8, "algorithm": "medium", "perf": 1390.67},
{"m": 24, "n": 26, "k": 24, "tile_m": 3, "tile_n": 4, "threads": 64, "grouping": 3, "minblocks": 4, "algorithm": "medium", "perf": 1507.26},
{"m": 24, "n": 26, "k": 26, "tile_m": 1, "tile_n": 3, "threads": 256, "grouping": 32, "minblocks": 3, "algorithm": "medium", "perf": 1507.58},
{"m": 24, "n": 26, "k": 32, "tile_m": 3, "tile_n": 4, "w": 16, "v": 18, "threads": 64, "grouping": 16, "minblocks": 1, "algorithm": "largeDB2", "perf": 1559.19},
{"m": 24, "n": 32, "k": 5, "tile_m": 1, "tile_n": 4, "threads": 192, "grouping": 10, "minblocks": 7, "algorithm": "medium", "perf": 1142.19},
{"m": 24, "n": 32, "k": 13, "tile_m": 3, "tile_n": 4, "threads": 64, "grouping": 24, "minblocks": 5, "algorithm": "medium", "perf": 1488.17},
{"m": 24, "n": 32, "k": 24, "tile_m": 3, "tile_n": 2, "threads": 128, "grouping": 32, "minblocks": 2, "algorithm": "medium", "perf": 1672.01},
{"m": 24, "n": 32, "k": 26, "tile_m": 1, "tile_n": 4, "threads": 224, "grouping": 3, "minblocks": 4, "algorithm": "medium", "perf": 1681.57},
{"m": 24, "n": 32, "k": 32, "tile_m": 3, "tile_n": 5, "w": 8, "v": 32, "threads": 64, "grouping": 16, "minblocks": 2, "algorithm": "largeDB2", "perf": 1724.89},
{"m": 25, "n": 4, "k": 4, "tile_m": 1, "tile_n": 4, "threads": 32, "grouping": 13, "minblocks": 20, "algorithm": "medium", "perf": 445.461},
{"m": 25, "n": 4, "k": 5, "tile_m": 1, "tile_n": 5, "threads": 32, "grouping": 12, "minblocks": 11, "algorithm": "medium", "perf": 455.068},
{"m": 25, "n": 4, "k": 7, "tile_m": 1, "tile_n": 4, "threads": 32, "grouping": 16, "minblocks": 15, "algorithm": "medium", "perf": 457.448},
{"m": 25, "n": 4, "k": 9, "tile_m": 1, "tile_n": 5, "threads": 64, "grouping": 26, "minblocks": 10, "algorithm": "medium", "perf": 453.929},
{"m": 25, "n": 4, "k": 13, "tile_m": 1, "tile_n": 2, "threads": 64, "grouping": 4, "minblocks": 12, "algorithm": "medium", "perf": 469.649},
{"m": 25, "n": 4, "k": 25, "tile_m": 1, "tile_n": 2, "threads": 128, "grouping": 3, "minblocks": 1, "algorithm": "medium", "perf": 480.107},
{"m": 25, "n": 4, "k": 26, "tile_m": 1, "tile_n": 2, "threads": 128, "grouping": 3, "minblocks": 8, "algorithm": "medium", "perf": 482.817},
{"m": 25, "n": 4, "k": 28, "tile_m": 1, "tile_n": 2, "threads": 128, "grouping": 3, "minblocks": 1, "algorithm": "medium", "perf": 487.851},
{"m": 25, "n": 4, "k": 32, "tile_m": 1, "tile_n": 2, "threads": 160, "grouping": 3, "minblocks": 2, "algorithm": "medium", "perf": 489.45},
{"m": 25, "n": 4, "k": 45, "tile_m": 1, "tile_n": 1, "threads": 192, "grouping": 2, "minblocks": 2, "algorithm": "medium", "perf": 489.336},
{"m": 25, "n": 5, "k": 4, "tile_m": 1, "tile_n": 6, "threads": 32, "grouping": 13, "minblocks": 24, "algorithm": "medium", "perf": 501.601},
{"m": 25, "n": 5, "k": 5, "tile_m": 1, "tile_n": 5, "threads": 32, "grouping": 16, "minblocks": 16, "algorithm": "medium", "perf": 516.776},
{"m": 25, "n": 5, "k": 7, "tile_m": 1, "tile_n": 5, "threads": 64, "grouping": 22, "minblocks": 13, "algorithm": "medium", "perf": 515.647},
{"m": 25, "n": 5, "k": 9, "tile_m": 1, "tile_n": 6, "threads": 64, "grouping": 26, "minblocks": 15, "algorithm": "medium", "perf": 540.279},
{"m": 25, "n": 5, "k": 13, "tile_m": 3, "tile_n": 1, "threads": 96, "grouping": 32, "minblocks": 10, "algorithm": "medium", "perf": 542.948},
{"m": 25, "n": 5, "k": 25, "tile_m": 1, "tile_n": 1, "threads": 128, "grouping": 3, "minblocks": 8, "algorithm": "medium", "perf": 570.33},
{"m": 25, "n": 5, "k": 26, "tile_m": 1, "tile_n": 1, "threads": 192, "grouping": 4, "minblocks": 4, "algorithm": "medium", "perf": 569.355},
{"m": 25, "n": 5, "k": 28, "tile_m": 1, "tile_n": 1, "threads": 192, "grouping": 4, "minblocks": 2, "algorithm": "medium", "perf": 571.981},
{"m": 25, "n": 5, "k": 32, "tile_m": 1, "tile_n": 1, "threads": 192, "grouping": 3, "minblocks": 2, "algorithm": "medium", "perf": 588.39},
{"m": 25, "n": 5, "k": 45, "tile_m": 1, "tile_n": 1, "threads": 256, "grouping": 3, "minblocks": 1, "algorithm": "medium", "perf": 585.125},
{"m": 25, "n": 7, "k": 4, "tile_m": 3, "tile_n": 3, "threads": 32, "grouping": 15, "minblocks": 2, "algorithm": "medium", "perf": 580.754},
{"m": 25, "n": 7, "k": 5, "tile_m": 3, "tile_n": 1, "threads": 64, "grouping": 21, "minblocks": 19, "algorithm": "medium", "perf": 598.77},
{"m": 25, "n": 7, "k": 7, "tile_m": 3, "tile_n": 1, "threads": 64, "grouping": 22, "minblocks": 3, "algorithm": "medium", "perf": 660.441},
{"m": 25, "n": 7, "k": 9, "tile_m": 3, "tile_n": 1, "threads": 64, "grouping": 26, "minblocks": 10, "algorithm": "medium", "perf": 684.274},
{"m": 25, "n": 7, "k": 13, "tile_m": 3, "tile_n": 1, "threads": 96, "grouping": 29, "minblocks": 1, "algorithm": "medium", "perf": 698.671},
{"m": 25, "n": 7, "k": 25, "tile_m": 1, "tile_n": 3, "threads": 192, "grouping": 4, "minblocks": 7, "algorithm": "medium", "perf": 718.262},
{"m": 25, "n": 7, "k": 26, "tile_m": 3, "tile_n": 1, "threads": 192, "grouping": 29, "minblocks": 3, "algorithm": "medium", "perf": 721.455},
{"m": 25, "n": 7, "k": 28, "tile_m": 1, "tile_n": 2, "threads": 128, "grouping": 4, "minblocks": 2, "algorithm": "medium", "perf": 724.329},
{"m": 25, "n": 7, "k": 32, "tile_m": 3, "tile_n": 1, "w": 16, "v": 6, "threads": 64, "grouping": 16, "minblocks": 4, "algorithm": "largeDB2", "perf": 735.427},
{"m": 25, "n": 7, "k": 45, "tile_m": 3, "tile_n": 1, "threads": 128, "grouping": 30, "minblocks": 4, "algorithm": "medium", "perf": 735.753},
{"m": 25, "n": 9, "k": 4, "tile_m": 1, "tile_n": 5, "threads": 64, "grouping": 24, "minblocks": 3, "algorithm": "medium", "perf": 615.95},
{"m": 25, "n": 9, "k": 5, "tile_m": 1, "tile_n": 5, "threads": 64, "grouping": 24, "minblocks": 2, "algorithm": "medium", "perf": 696.734},
{"m": 25, "n": 9, "k": 7, "tile_m": 1, "tile_n": 5, "threads": 64, "grouping": 26, "minblocks": 13, "algorithm": "medium", "perf": 767.41},
{"m": 25, "n": 9, "k": 9, "tile_m": 1, "tile_n": 5, "threads": 96, "grouping": 32, "minblocks": 10, "algorithm": "medium", "perf": 772.896},
{"m": 25, "n": 9, "k": 13, "tile_m": 1, "tile_n": 3, "threads": 128, "grouping": 32, "minblocks": 9, "algorithm": "medium", "perf": 812.472},
{"m": 25, "n": 9, "k": 25, "tile_m": 1, "tile_n": 2, "threads": 128, "grouping": 4, "minblocks": 1, "algorithm": "medium", "perf": 854.308},
{"m": 25, "n": 9, "k": 26, "tile_m": 1, "tile_n": 2, "threads": 128, "grouping": 4, "minblocks": 5, "algorithm": "medium", "perf": 860.057},
{"m": 25, "n": 9, "k": 28, "tile_m": 1, "tile_n": 2, "w": 10, "v": 8, "threads": 128, "grouping": 16, "minblocks": 4, "algorithm": "largeDB2", "perf": 875.354},
{"m": 25, "n": 9, "k": 32, "tile_m": 1, "tile_n": 2, "threads": 160, "grouping": 3, "minblocks": 4, "algorithm": "medium", "perf": 882.376},
{"m": 25, "n": 9, "k": 45, "tile_m": 1, "tile_n": 2, "w": 14, "v": 8, "threads": 128, "grouping": 16, "minblocks": 1, "algorithm": "largeDB2", "perf": 892.009},
{"m": 25, "n": 11, "k": 11, "tile_m": 1, "tile_n": 6, "threads": 128, "grouping": 32, "minblocks": 9, "algorithm": "medium", "perf": 883.488},
{"m": 25, "n": 11, "k": 12, "tile_m": 1, "tile_n": 4, "threads": 96, "grouping": 32, "minblocks": 10, "algorithm": "medium", "perf": 895.478},
{"m": 25, "n": 11, "k": 20, "tile_m": 2, "tile_n": 3, "w": 10, "v": 8, "threads": 64, "grouping": 16, "minblocks": 4, "algorithm": "largeDB2", "perf": 956.932},
{"m": 25, "n": 11, "k": 25, "tile_m": 2, "tile_n": 3, "w": 10, "v": 6, "threads": 64, "grouping": 16, "minblocks": 8, "algorithm": "largeDB2", "perf": 962.602},
{"m": 25, "n": 11, "k": 32, "tile_m": 3, "tile_n": 2, "w": 16, "v": 6, "threads": 64, "grouping": 16, "minblocks": 1, "algorithm": "largeDB2", "perf": 996.876},
{"m": 25, "n": 12, "k": 11, "tile_m": 1, "tile_n": 4, "threads": 96, "grouping": 6, "minblocks": 13, "algorithm": "medium", "perf": 921.389},
{"m": 25, "n": 12, "k": 12, "tile_m": 1, "tile_n": 4, "threads": 96, "grouping": 32, "minblocks": 9, "algorithm": "medium", "perf": 945.839},
{"m": 25, "n": 12, "k": 20, "tile_m": 3, "tile_n": 2, "w": 10, "v": 12, "threads": 64, "grouping": 16, "minblocks": 4, "algorithm": "largeDB2", "perf": 1028.89},
{"m": 25, "n": 12, "k": 25, "tile_m": 3, "tile_n": 2, "w": 10, "v": 12, "threads": 64, "grouping": 16, "minblocks": 1, "algorithm": "largeDB2", "perf": 1042.28},
{"m": 25, "n": 12, "k": 32, "tile_m": 3, "tile_n": 2, "w": 16, "v": 12, "threads": 64, "grouping": 16, "minblocks": 1, "algorithm": "largeDB2", "perf": 1070.25},
{"m": 25, "n": 13, "k": 4, "tile_m": 3, "tile_n": 2, "threads": 64, "grouping": 26, "minblocks": 7, "algorithm": "medium", "perf": 772.213},
{"m": 25, "n": 13, "k": 5, "tile_m": 3, "tile_n": 2, "threads": 64, "grouping": 26, "minblocks": 9, "algorithm": "medium", "perf": 811.652},
{"m": 25, "n": 13, "k": 7, "tile_m": 3, "tile_n": 2, "threads": 64, "grouping": 29, "minblocks": 1, "algorithm": "medium", "perf": 894.47},
{"m": 25, "n": 13, "k": 9, "tile_m": 3, "tile_n": 2, "threads": 64, "grouping": 32, "minblocks": 7, "algorithm": "medium", "perf": 937.943},
{"m": 25, "n": 13, "k": 13, "tile_m": 1, "tile_n": 3, "threads": 128, "grouping": 7, "minblocks": 10, "algorithm": "medium", "perf": 975.605},
{"m": 25, "n": 13, "k": 14, "tile_m": 1, "tile_n": 3, "threads": 128, "grouping": 7, "minblocks": 10, "algorithm": "medium", "perf": 992.46},
{"m": 25, "n": 13, "k": 25, "tile_m": 1, "tile_n": 3, "threads": 128, "grouping": 4, "minblocks": 5, "algorithm": "medium", "perf": 1066.09},
{"m": 25, "n": 13, "k": 26, "tile_m": 3, "tile_n": 2, "w": 12, "v": 4, "threads": 64, "grouping": 16, "minblocks": 2, "algorithm": "largeDB2", "perf": 1073.76},
{"m": 25, "n": 13, "k": 28, "tile_m": 3, "tile_n": 2, "w": 12, "v": 12, "threads": 64, "grouping": 16, "minblocks": 1, "algorithm": "largeDB2", "perf": 1099.51},
{"m": 25, "n": 13, "k": 32, "tile_m": 3, "tile_n": 2, "w": 14, "v": 12, "threads": 64, "grouping": 16, "minblocks": 2, "algorithm": "largeDB2", "perf": 1111.26},
{"m": 25, "n": 13, "k": 45, "tile_m": 3, "tile_n": 2, "w": 12, "v": 10, "threads": 64, "grouping": 16, "minblocks": 1, "algorithm": "largeDB2", "perf": 1133.67},
{"m": 25, "n": 14, "k": 13, "tile_m": 1, "tile_n": 3, "threads": 128, "grouping": 6, "minblocks": 9, "algorithm": "medium", "perf": 1028.26},
{"m": 25, "n": 14, "k": 14, "tile_m": 1, "tile_n": 3, "threads": 128, "grouping": 6, "minblocks": 9, "algorithm": "medium", "perf": 1048.08},
{"m": 25, "n": 14, "k": 25, "tile_m": 1, "tile_n": 3, "threads": 128, "grouping": 3, "minblocks": 1, "algorithm": "medium", "perf": 1119.23},
{"m": 25, "n": 14, "k": 26, "tile_m": 1, "tile_n": 3, "threads": 128, "grouping": 3, "minblocks": 3, "algorithm": "medium", "perf": 1118.61},
{"m": 25, "n": 14, "k": 32, "tile_m": 3, "tile_n": 2, "w": 16, "v": 14, "threads": 64, "grouping": 16, "minblocks": 2, "algorithm": "largeDB2", "perf": 1161.79},
{"m": 25, "n": 20, "k": 11, "tile_m": 1, "tile_n": 4, "threads": 128, "grouping": 6, "minblocks": 10, "algorithm": "medium", "perf": 1206.16},
{"m": 25, "n": 20, "k": 12, "tile_m": 3, "tile_n": 3, "w": 6, "v": 20, "threads": 64, "grouping": 16, "minblocks": 4, "algorithm": "largeDB2", "perf": 1253.35},
{"m": 25, "n": 20, "k": 20, "tile_m": 3, "tile_n": 2, "w": 10, "v": 16, "threads": 96, "grouping": 16, "minblocks": 4, "algorithm": "largeDB2", "perf": 1333.39},
{"m": 25, "n": 20, "k": 25, "tile_m": 3, "tile_n": 3, "w": 10, "v": 16, "threads": 64, "grouping": 16, "minblocks": 4, "algorithm": "largeDB2", "perf": 1355.68},
{"m": 25, "n": 20, "k": 32, "tile_m": 3, "tile_n": 2, "w": 16, "v": 18, "threads": 96, "grouping": 16, "minblocks": 4, "algorithm": "largeDB2", "perf": 1408.81},
{"m": 25, "n": 25, "k": 4, "tile_m": 3, "tile_n": 4, "threads": 64, "grouping": 32, "minblocks": 4, "algorithm": "medium", "perf": 976.486},
{"m": 25, "n": 25, "k": 5, "tile_m": 1, "tile_n": 5, "threads": 128, "grouping": 32, "minblocks": 9, "algorithm": "medium", "perf": 1070.36},
{"m": 25, "n": 25, "k": 7, "tile_m": 1, "tile_n": 5, "threads": 128, "grouping": 32, "minblocks": 9, "algorithm": "medium", "perf": 1194.1},
{"m": 25, "n": 25, "k": 9, "tile_m": 1, "tile_n": 5, "threads": 128, "grouping": 32, "minblocks": 9, "algorithm": "medium", "perf": 1269.67},
{"m": 25, "n": 25, "k": 11, "tile_m": 1, "tile_n": 5, "threads": 128, "grouping": 32, "minblocks": 9, "algorithm": "medium", "perf": 1340.23},
{"m": 25, "n": 25, "k": 12, "tile_m": 1, "tile_n": 5, "threads": 128, "grouping": 32, "minblocks": 9, "algorithm": "medium", "perf": 1365.39},
{"m": 25, "n": 25, "k": 13, "tile_m": 1, "tile_n": 5, "threads": 128, "grouping": 29, "minblocks": 5, "algorithm": "medium", "perf": 1367.05},
{"m": 25, "n": 25, "k": 14, "tile_m": 1, "tile_n": 5, "threads": 192, "grouping": 29, "minblocks": 5, "algorithm": "medium", "perf": 1390.72},
{"m": 25, "n": 25, "k": 20, "tile_m": 1, "tile_n": 5, "threads": 192, "grouping": 5, "minblocks": 6, "algorithm": "medium", "perf": 1480.51},
{"m": 25, "n": 25, "k": 25, "tile_m": 3, "tile_n": 4, "threads": 64, "grouping": 3, "minblocks": 4, "algorithm": "medium", "perf": 1504.46},
{"m": 25, "n": 25, "k": 26, "tile_m": 3, "tile_n": 4, "threads": 64, "grouping": 30, "minblocks": 1, "algorithm": "medium", "perf": 1498.12},
{"m": 25, "n": 25, "k": 28, "tile_m": 3, "tile_n": 4, "threads": 64, "grouping": 4, "minblocks": 2, "algorithm": "medium", "perf": 1526.33},
{"m": 25, "n": 25, "k": 32, "tile_m": 3, "tile_n": 4, "w": 8, "v": 24, "threads": 64, "grouping": 16, "minblocks": 2, "algorithm": "largeDB2", "perf": 1548.35},
{"m": 25, "n": 25, "k": 45, "tile_m": 3, "tile_n": 4, "w": 20, "v": 8, "threads": 64, "grouping": 16, "minblocks": 2, "algorithm": "largeDB2", "perf": 1587.51},
{"m": 25, "n": 26, "k": 4, "tile_m": 3, "tile_n": 4, "threads": 64, "grouping": 32, "minblocks": 5, "algorithm": "medium", "perf": 974.726},
{"m": 25, "n": 26, "k": 5, "tile_m": 1, "tile_n": 6, "threads": 160, "grouping": 14, "minblocks": 8, "algorithm": "medium", "perf": 1032.18},
{"m": 25, "n": 26, "k": 7, "tile_m": 1, "tile_n": 6, "threads": 192, "grouping": 10, "minblocks": 8, "algorithm": "medium", "perf": 1153.33},
{"m": 25, "n": 26, "k": 9, "tile_m": 3, "tile_n": 4, "threads": 64, "grouping": 27, "minblocks": 3, "algorithm": "medium", "perf": 1238.92},
{"m": 25, "n": 26, "k": 13, "tile_m": 1, "tile_n": 6, "threads": 128, "grouping": 24, "minblocks": 6, "algorithm": "medium", "perf": 1358.07},
{"m": 25, "n": 26, "k": 14, "tile_m": 1, "tile_n": 6, "threads": 128, "grouping": 24, "minblocks": 6, "algorithm": "medium", "perf": 1398.79},
{"m": 25, "n": 26, "k": 25, "tile_m": 3, "tile_n": 4, "w": 8, "v": 26, "threads": 64, "grouping": 16, "minblocks": 2, "algorithm": "largeDB2", "perf": 1510.79},
{"m": 25, "n": 26, "k": 26, "tile_m": 3, "tile_n": 4, "w": 8, "v": 26, "threads": 64, "grouping": 16, "minblocks": 8, "algorithm": "largeDB2", "perf": 1521.72},
{"m": 25, "n": 26, "k": 28, "tile_m": 3, "tile_n": 4, "w": 8, "v": 26, "threads": 64, "grouping": 16, "minblocks": 2, "algorithm": "largeDB2", "perf": 1547.14},
{"m": 25, "n": 26, "k": 32, "tile_m": 3, "tile_n": 4, "w": 8, "v": 26, "threads": 64, "grouping": 16, "minblocks": 4, "algorithm": "largeDB2", "perf": 1582.6},
{"m": 25, "n": 26, "k": 45, "tile_m": 3, "tile_n": 4, "w": 18, "v": 26, "threads": 64, "grouping": 16, "minblocks": 2, "algorithm": "largeDB2", "perf": 1621.87},
{"m": 25, "n": 28, "k": 4, "tile_m": 3, "tile_n": 4, "threads": 64, "grouping": 32, "minblocks": 3, "algorithm": "medium", "perf": 1038.23},
{"m": 25, "n": 28, "k": 5, "tile_m": 1, "tile_n": 6, "threads": 160, "grouping": 9, "minblocks": 8, "algorithm": "medium", "perf": 1102.36},
{"m": 25, "n": 28, "k": 7, "tile_m": 1, "tile_n": 6, "threads": 128, "grouping": 7, "minblocks": 8, "algorithm": "medium", "perf": 1200.18},
{"m": 25, "n": 28, "k": 9, "tile_m": 1, "tile_n": 6, "threads": 128, "grouping": 6, "minblocks": 8, "algorithm": "medium", "perf": 1319.69},
{"m": 25, "n": 28, "k": 13, "tile_m": 1, "tile_n": 6, "threads": 128, "grouping": 4, "minblocks": 8, "algorithm": "medium", "perf": 1432.84},
{"m": 25, "n": 28, "k": 25, "tile_m": 3, "tile_n": 4, "threads": 64, "grouping": 3, "minblocks": 2, "algorithm": "medium", "perf": 1590.64},
{"m": 25, "n": 28, "k": 26, "tile_m": 3, "tile_n": 4, "w": 8, "v": 28, "threads": 64, "grouping": 16, "minblocks": 2, "algorithm": "largeDB2", "perf": 1589.92},
{"m": 25, "n": 28, "k": 28, "tile_m": 3, "tile_n": 4, "w": 8, "v": 28, "threads": 64, "grouping": 16, "minblocks": 1, "algorithm": "largeDB2", "perf": 1612.35},
{"m": 25, "n": 28, "k": 32, "tile_m": 3, "tile_n": 4, "w": 8, "v": 28, "threads": 64, "grouping": 16, "minblocks": 4, "algorithm": "largeDB2", "perf": 1653.53},
{"m": 25, "n": 28, "k": 45, "tile_m": 3, "tile_n": 4, "w": 18, "v": 28, "threads": 64, "grouping": 16, "minblocks": 4, "algorithm": "largeDB2", "perf": 1684.81},
{"m": 25, "n": 32, "k": 4, "tile_m": 5, "tile_n": 1, "threads": 160, "grouping": 12, "minblocks": 7, "algorithm": "medium", "perf": 1025.19},
{"m": 25, "n": 32, "k": 5, "tile_m": 5, "tile_n": 1, "threads": 192, "grouping": 16, "minblocks": 7, "algorithm": "medium", "perf": 1111.36},
{"m": 25, "n": 32, "k": 7, "tile_m": 3, "tile_n": 5, "threads": 64, "grouping": 24, "minblocks": 3, "algorithm": "medium", "perf": 1256.28},
{"m": 25, "n": 32, "k": 9, "tile_m": 5, "tile_n": 3, "threads": 64, "grouping": 29, "minblocks": 2, "algorithm": "medium", "perf": 1364.67},
{"m": 25, "n": 32, "k": 11, "tile_m": 3, "tile_n": 5, "threads": 64, "grouping": 24, "minblocks": 6, "algorithm": "medium", "perf": 1423.93},
{"m": 25, "n": 32, "k": 12, "tile_m": 7, "tile_n": 2, "w": 6, "v": 32, "threads": 64, "grouping": 16, "minblocks": 4, "algorithm": "largeDB2", "perf": 1481.41},
{"m": 25, "n": 32, "k": 13, "tile_m": 3, "tile_n": 5, "threads": 64, "grouping": 29, "minblocks": 1, "algorithm": "medium", "perf": 1484.69},
{"m": 25, "n": 32, "k": 14, "tile_m": 3, "tile_n": 5, "threads": 64, "grouping": 29, "minblocks": 4, "algorithm": "medium", "perf": 1517.54},
{"m": 25, "n": 32, "k": 20, "tile_m": 3, "tile_n": 5, "threads": 64, "grouping": 3, "minblocks": 3, "algorithm": "medium", "perf": 1636.95},
{"m": 25, "n": 32, "k": 25, "tile_m": 5, "tile_n": 3, "threads": 64, "grouping": 29, "minblocks": 1, "algorithm": "medium", "perf": 1655.28},
{"m": 25, "n": 32, "k": 26, "tile_m": 3, "tile_n": 5, "threads": 64, "grouping": 3, "minblocks": 3, "algorithm": "medium", "perf": 1680.88},
{"m": 25, "n": 32, "k": 28, "tile_m": 5, "tile_n": 3, "w": 14, "v": 32, "threads": 64, "grouping": 16, "minblocks": 1, "algorithm": "largeDB2", "perf": 1689.82},
{"m": 25, "n": 32, "k": 32, "tile_m": 5, "tile_n": 3, "w": 8, "v": 32, "threads": 64, "grouping": 16, "minblocks": 1, "algorithm": "largeDB2", "perf": 1750.62},
{"m": 25, "n": 32, "k": 45, "tile_m": 5, "tile_n": 3, "w": 8, "v": 32, "threads": 64, "grouping": 16, "minblocks": 4, "algorithm": "largeDB2", "perf": 1784.12},
{"m": 25, "n": 45, "k": 4, "tile_m": 3, "tile_n": 5, "threads": 96, "grouping": 30, "minblocks": 4, "algorithm": "medium", "perf": 1026.08},
{"m": 25, "n": 45, "k": 5, "tile_m": 5, "tile_n": 2, "threads": 128, "grouping": 24, "minblocks": 2, "algorithm": "medium", "perf": 1149.65},
{"m": 25, "n": 45, "k": 7, "tile_m": 3, "tile_n": 5, "threads": 96, "grouping": 24, "minblocks": 2, "algorithm": "medium", "perf": 1315.18},
{"m": 25, "n": 45, "k": 9, "tile_m": 5, "tile_n": 2, "threads": 128, "grouping": 32, "minblocks": 3, "algorithm": "medium", "perf": 1432.35},
{"m": 25, "n": 45, "k": 13, "tile_m": 3, "tile_n": 5, "threads": 96, "grouping": 24, "minblocks": 1, "algorithm": "medium", "perf": 1592.59},
{"m": 25, "n": 45, "k": 25, "tile_m": 5, "tile_n": 4, "w": 10, "v": 22, "threads": 64, "grouping": 16, "minblocks": 1, "algorithm": "largeDB2", "perf": 1834.49},
{"m": 25, "n": 45, "k": 26, "tile_m": 5, "tile_n": 4, "w": 10, "v": 44, "threads": 64, "grouping": 16, "minblocks": 4, "algorithm": "largeDB2", "perf": 1856.86},
{"m": 25, "n": 45, "k": 28, "tile_m": 5, "tile_n": 4, "w": 10, "v": 44, "threads": 64, "grouping": 16, "minblocks": 1, "algorithm": "largeDB2", "perf": 1880.32},
{"m": 25, "n": 45, "k": 32, "tile_m": 5, "tile_n": 4, "w": 8, "v": 22, "threads": 64, "grouping": 16, "minblocks": 1, "algorithm": "largeDB2", "perf": 1931.76},
{"m": 25, "n": 45, "k": 45, "tile_m": 5, "tile_n": 4, "w": 10, "v": 14, "threads": 64, "grouping": 16, "minblocks": 4, "algorithm": "largeDB2", "perf": 2021.91},
{"m": 26, "n": 4, "k": 4, "tile_m": 1, "tile_n": 4, "threads": 32, "grouping": 13, "minblocks": 8, "algorithm": "medium", "perf": 455.983},
{"m": 26, "n": 4, "k": 5, "tile_m": 1, "tile_n": 4, "threads": 32, "grouping": 13, "minblocks": 13, "algorithm": "medium", "perf": 453.07},
{"m": 26, "n": 4, "k": 7, "tile_m": 1, "tile_n": 4, "threads": 32, "grouping": 16, "minblocks": 8, "algorithm": "medium", "perf": 462.367},
{"m": 26, "n": 4, "k": 9, "tile_m": 1, "tile_n": 2, "threads": 64, "grouping": 26, "minblocks": 7, "algorithm": "medium", "perf": 461.91},
{"m": 26, "n": 4, "k": 13, "tile_m": 1, "tile_n": 2, "threads": 64, "grouping": 32, "minblocks": 1, "algorithm": "medium", "perf": 478.188},
{"m": 26, "n": 4, "k": 25, "tile_m": 1, "tile_n": 2, "threads": 128, "grouping": 3, "minblocks": 2, "algorithm": "medium", "perf": 483.153},
{"m": 26, "n": 4, "k": 26, "tile_m": 1, "tile_n": 2, "threads": 128, "grouping": 3, "minblocks": 4, "algorithm": "medium", "perf": 487.755},
{"m": 26, "n": 4, "k": 28, "tile_m": 1, "tile_n": 2, "threads": 128, "grouping": 3, "minblocks": 3, "algorithm": "medium", "perf": 489.503},
{"m": 26, "n": 4, "k": 32, "tile_m": 1, "tile_n": 1, "threads": 192, "grouping": 3, "minblocks": 4, "algorithm": "medium", "perf": 493.24},
{"m": 26, "n": 4, "k": 45, "tile_m": 1, "tile_n": 1, "threads": 256, "grouping": 2, "minblocks": 2, "algorithm": "medium", "perf": 495.988},
{"m": 26, "n": 5, "k": 4, "tile_m": 1, "tile_n": 5, "threads": 32, "grouping": 13, "minblocks": 27, "algorithm": "medium", "perf": 513.002},
{"m": 26, "n": 5, "k": 5, "tile_m": 5, "tile_n": 1, "threads": 32, "grouping": 18, "minblocks": 10, "algorithm": "medium", "perf": 517.591},
{"m": 26, "n": 5, "k": 7, "tile_m": 1, "tile_n": 3, "threads": 64, "grouping": 22, "minblocks": 1, "algorithm": "medium", "perf": 525.335},
{"m": 26, "n": 5, "k": 9, "tile_m": 1, "tile_n": 3, "threads": 64, "grouping": 26, "minblocks": 12, "algorithm": "medium", "perf": 550.268},
{"m": 26, "n": 5, "k": 12, "tile_m": 1, "tile_n": 3, "threads": 64, "grouping": 32, "minblocks": 11, "algorithm": "medium", "perf": 560.898},
{"m": 26, "n": 5, "k": 13, "tile_m": 1, "tile_n": 3, "threads": 96, "grouping": 29, "minblocks": 9, "algorithm": "medium", "perf": 549.663},
{"m": 26, "n": 5, "k": 24, "tile_m": 1, "tile_n": 2, "threads": 128, "grouping": 4, "minblocks": 4, "algorithm": "medium", "perf": 573.419},
{"m": 26, "n": 5, "k": 25, "tile_m": 1, "tile_n": 2, "threads": 128, "grouping": 4, "minblocks": 7, "algorithm": "medium", "perf": 570.821},
{"m": 26, "n": 5, "k": 26, "tile_m": 1, "tile_n": 2, "threads": 192, "grouping": 4, "minblocks": 7, "algorithm": "medium", "perf": 573.903},
{"m": 26, "n": 5, "k": 28, "tile_m": 1, "tile_n": 3, "threads": 160, "grouping": 24, "minblocks": 3, "algorithm": "medium", "perf": 573.438},
{"m": 26, "n": 5, "k": 32, "tile_m": 1, "tile_n": 1, "threads": 224, "grouping": 3, "minblocks": 6, "algorithm": "medium", "perf": 587.174},
{"m": 26, "n": 5, "k": 45, "tile_m": 1, "tile_n": 1, "threads": 256, "grouping": 3, "minblocks": 1, "algorithm": "medium", "perf": 590.001},
{"m": 26, "n": 7, "k": 4, "tile_m": 2, "tile_n": 4, "threads": 32, "grouping": 16, "minblocks": 1, "algorithm": "medium", "perf": 594.471},
{"m": 26, "n": 7, "k": 5, "tile_m": 3, "tile_n": 1, "threads": 64, "grouping": 22, "minblocks": 17, "algorithm": "medium", "perf": 613.113},
{"m": 26, "n": 7, "k": 7, "tile_m": 1, "tile_n": 4, "threads": 64, "grouping": 22, "minblocks": 6, "algorithm": "medium", "perf": 672.9},
{"m": 26, "n": 7, "k": 9, "tile_m": 3, "tile_n": 1, "threads": 64, "grouping": 26, "minblocks": 1, "algorithm": "medium", "perf": 697.663},
{"m": 26, "n": 7, "k": 13, "tile_m": 3, "tile_n": 1, "threads": 96, "grouping": 32, "minblocks": 7, "algorithm": "medium", "perf": 710.135},
{"m": 26, "n": 7, "k": 25, "tile_m": 1, "tile_n": 2, "threads": 192, "grouping": 4, "minblocks": 7, "algorithm": "medium", "perf": 730.136},
{"m": 26, "n": 7, "k": 26, "tile_m": 1, "tile_n": 2, "threads": 192, "grouping": 5, "minblocks": 3, "algorithm": "medium", "perf": 735.317},
{"m": 26, "n": 7, "k": 28, "tile_m": 1, "tile_n": 2, "threads": 224, "grouping": 4, "minblocks": 6, "algorithm": "medium", "perf": 737.392},
{"m": 26, "n": 7, "k": 32, "tile_m": 1, "tile_n": 2, "threads": 256, "grouping": 4, "minblocks": 5, "algorithm": "medium", "perf": 751.816},
{"m": 26, "n": 7, "k": 45, "tile_m": 1, "tile_n": 1, "threads": 192, "grouping": 3, "minblocks": 4, "algorithm": "medium", "perf": 754.379},
{"m": 26, "n": 9, "k": 4, "tile_m": 1, "tile_n": 5, "threads": 64, "grouping": 24, "minblocks": 4, "algorithm": "medium", "perf": 645.89},
{"m": 26, "n": 9, "k": 5, "tile_m": 1, "tile_n": 5, "threads": 64, "grouping": 26, "minblocks": 16, "algorithm": "medium", "perf": 708.797},
{"m": 26, "n": 9, "k": 7, "tile_m": 1, "tile_n": 5, "threads": 64, "grouping": 25, "minblocks": 15, "algorithm": "medium", "perf": 783.549},
{"m": 26, "n": 9, "k": 9, "tile_m": 1, "tile_n": 5, "threads": 96, "grouping": 32, "minblocks": 11, "algorithm": "medium", "perf": 797.252},
{"m": 26, "n": 9, "k": 13, "tile_m": 1, "tile_n": 3, "threads": 128, "grouping": 18, "minblocks": 4, "algorithm": "medium", "perf": 821.531},
{"m": 26, "n": 9, "k": 25, "tile_m": 1, "tile_n": 3, "threads": 128, "grouping": 4, "minblocks": 6, "algorithm": "medium", "perf": 862.508},
{"m": 26, "n": 9, "k": 26, "tile_m": 1, "tile_n": 3, "threads": 256, "grouping": 5, "minblocks": 5, "algorithm": "medium", "perf": 871.198},
{"m": 26, "n": 9, "k": 28, "tile_m": 1, "tile_n": 3, "threads": 128, "grouping": 4, "minblocks": 3, "algorithm": "medium", "perf": 877.813},
{"m": 26, "n": 9, "k": 32, "tile_m": 1, "tile_n": 3, "threads": 128, "grouping": 3, "minblocks": 5, "algorithm": "medium", "perf": 895.509},
{"m": 26, "n": 9, "k": 45, "tile_m": 3, "tile_n": 1, "w": 10, "v": 6, "threads": 96, "grouping": 16, "minblocks": 8, "algorithm": "largeDB2", "perf": 902.055},
{"m": 26, "n": 12, "k": 5, "tile_m": 1, "tile_n": 6, "threads": 64, "grouping": 24, "minblocks": 11, "algorithm": "medium", "perf": 853.834},
{"m": 26, "n": 12, "k": 12, "tile_m": 1, "tile_n": 2, "threads": 160, "grouping": 6, "minblocks": 11, "algorithm": "medium", "perf": 965.748},
{"m": 26, "n": 12, "k": 13, "tile_m": 1, "tile_n": 2, "threads": 160, "grouping": 6, "minblocks": 1, "algorithm": "medium", "perf": 969.942},
{"m": 26, "n": 12, "k": 26, "tile_m": 1, "tile_n": 2, "threads": 192, "grouping": 4, "minblocks": 6, "algorithm": "medium", "perf": 1059.98},
{"m": 26, "n": 12, "k": 32, "tile_m": 1, "tile_n": 2, "threads": 192, "grouping": 3, "minblocks": 3, "algorithm": "medium", "perf": 1091.93},
{"m": 26, "n": 13, "k": 4, "tile_m": 3, "tile_n": 2, "threads": 64, "grouping": 26, "minblocks": 8, "algorithm": "medium", "perf": 799.987},
{"m": 26, "n": 13, "k": 5, "tile_m": 3, "tile_n": 2, "threads": 64, "grouping": 26, "minblocks": 2, "algorithm": "medium", "perf": 797.258},
{"m": 26, "n": 13, "k": 7, "tile_m": 1, "tile_n": 5, "threads": 96, "grouping": 26, "minblocks": 13, "algorithm": "medium", "perf": 922.13},
{"m": 26, "n": 13, "k": 9, "tile_m": 1, "tile_n": 5, "threads": 128, "grouping": 32, "minblocks": 10, "algorithm": "medium", "perf": 949.735},
{"m": 26, "n": 13, "k": 12, "tile_m": 1, "tile_n": 5, "threads": 96, "grouping": 32, "minblocks": 10, "algorithm": "medium", "perf": 997.362},
{"m": 26, "n": 13, "k": 13, "tile_m": 1, "tile_n": 5, "threads": 96, "grouping": 6, "minblocks": 11, "algorithm": "medium", "perf": 991.96},
{"m": 26, "n": 13, "k": 14, "tile_m": 1, "tile_n": 4, "threads": 128, "grouping": 24, "minblocks": 6, "algorithm": "medium", "perf": 1008.41},
{"m": 26, "n": 13, "k": 24, "tile_m": 3, "tile_n": 2, "w": 12, "v": 12, "threads": 64, "grouping": 16, "minblocks": 1, "algorithm": "largeDB2", "perf": 1092.08},
{"m": 26, "n": 13, "k": 25, "tile_m": 1, "tile_n": 2, "threads": 192, "grouping": 4, "minblocks": 5, "algorithm": "medium", "perf": 1088.18},
{"m": 26, "n": 13, "k": 26, "tile_m": 1, "tile_n": 2, "threads": 192, "grouping": 4, "minblocks": 3, "algorithm": "medium", "perf": 1101.37},
{"m": 26, "n": 13, "k": 28, "tile_m": 3, "tile_n": 2, "w": 14, "v": 8, "threads": 64, "grouping": 16, "minblocks": 2, "algorithm": "largeDB2", "perf": 1105.61},
{"m": 26, "n": 13, "k": 32, "tile_m": 3, "tile_n": 2, "w": 14, "v": 12, "threads": 64, "grouping": 16, "minblocks": 8, "algorithm": "largeDB2", "perf": 1128.15},
{"m": 26, "n": 13, "k": 45, "tile_m": 3, "tile_n": 2, "w": 12, "v": 8, "threads": 64, "grouping": 16, "minblocks": 1, "algorithm": "largeDB2", "perf": 1156.84},
{"m": 26, "n": 14, "k": 13, "tile_m": 1, "tile_n": 5, "threads": 96, "grouping": 4, "minblocks": 11, "algorithm": "medium", "perf": 1046.07},
{"m": 26, "n": 14, "k": 14, "tile_m": 1, "tile_n": 5, "threads": 128, "grouping": 5, "minblocks": 9, "algorithm": "medium", "perf": 1076.05},
{"m": 26, "n": 14, "k": 25, "tile_m": 1, "tile_n": 2, "threads": 192, "grouping": 4, "minblocks": 2, "algorithm": "medium", "perf": 1153.33},
{"m": 26, "n": 14, "k": 26, "tile_m": 1, "tile_n": 2, "threads": 192, "grouping": 4, "minblocks": 2, "algorithm": "medium", "perf": 1159.6},
{"m": 26, "n": 14, "k": 32, "tile_m": 3, "tile_n": 2, "w": 16, "v": 14, "threads": 64, "grouping": 16, "minblocks": 4, "algorithm": "largeDB2", "perf": 1196.64},
{"m": 26, "n": 24, "k": 5, "tile_m": 1, "tile_n": 4, "threads": 160, "grouping": 32, "minblocks": 9, "algorithm": "medium", "perf": 1078.8},
{"m": 26, "n": 24, "k": 13, "tile_m": 1, "tile_n": 6, "threads": 128, "grouping": 4, "minblocks": 7, "algorithm": "medium", "perf": 1387.5},
{"m": 26, "n": 24, "k": 24, "tile_m": 1, "tile_n": 4, "threads": 160, "grouping": 3, "minblocks": 5, "algorithm": "medium", "perf": 1530.31},
{"m": 26, "n": 24, "k": 26, "tile_m": 1, "tile_n": 4, "threads": 192, "grouping": 24, "minblocks": 4, "algorithm": "medium", "perf": 1507.25},
{"m": 26, "n": 24, "k": 32, "tile_m": 1, "tile_n": 4, "threads": 256, "grouping": 32, "minblocks": 3, "algorithm": "medium", "perf": 1570.75},
{"m": 26, "n": 25, "k": 4, "tile_m": 3, "tile_n": 4, "threads": 64, "grouping": 32, "minblocks": 8, "algorithm": "medium", "perf": 973.176},
{"m": 26, "n": 25, "k": 5, "tile_m": 1, "tile_n": 5, "threads": 160, "grouping": 13, "minblocks": 8, "algorithm": "medium", "perf": 1040.55},
{"m": 26, "n": 25, "k": 7, "tile_m": 1, "tile_n": 4, "threads": 192, "grouping": 18, "minblocks": 8, "algorithm": "medium", "perf": 1170.93},
{"m": 26, "n": 25, "k": 9, "tile_m": 3, "tile_n": 4, "threads": 64, "grouping": 26, "minblocks": 3, "algorithm": "medium", "perf": 1241.28},
{"m": 26, "n": 25, "k": 13, "tile_m": 1, "tile_n": 5, "threads": 160, "grouping": 6, "minblocks": 6, "algorithm": "medium", "perf": 1351.85},
{"m": 26, "n": 25, "k": 14, "tile_m": 1, "tile_n": 5, "threads": 192, "grouping": 29, "minblocks": 6, "algorithm": "medium", "perf": 1386.15},
{"m": 26, "n": 25, "k": 25, "tile_m": 3, "tile_n": 4, "threads": 64, "grouping": 30, "minblocks": 4, "algorithm": "medium", "perf": 1508.73},
{"m": 26, "n": 25, "k": 26, "tile_m": 3, "tile_n": 5, "threads": 64, "grouping": 29, "minblocks": 2, "algorithm": "medium", "perf": 1524.65},
{"m": 26, "n": 25, "k": 28, "tile_m": 1, "tile_n": 5, "threads": 192, "grouping": 24, "minblocks": 4, "algorithm": "medium", "perf": 1536.17},
{"m": 26, "n": 25, "k": 32, "tile_m": 3, "tile_n": 4, "w": 8, "v": 22, "threads": 64, "grouping": 16, "minblocks": 8, "algorithm": "largeDB2", "perf": 1588.12},
{"m": 26, "n": 25, "k": 45, "tile_m": 3, "tile_n": 4, "w": 18, "v": 20, "threads": 64, "grouping": 16, "minblocks": 4, "algorithm": "largeDB2", "perf": 1619.09},
{"m": 26, "n": 26, "k": 4, "tile_m": 3, "tile_n": 4, "threads": 64, "grouping": 32, "minblocks": 5, "algorithm": "medium", "perf": 1064.38},
{"m": 26, "n": 26, "k": 5, "tile_m": 3, "tile_n": 2, "threads": 160, "grouping": 9, "minblocks": 8, "algorithm": "medium", "perf": 1092.54},
{"m": 26, "n": 26, "k": 7, "tile_m": 1, "tile_n": 4, "threads": 192, "grouping": 9, "minblocks": 8, "algorithm": "medium", "perf": 1229.79},
{"m": 26, "n": 26, "k": 9, "tile_m": 1, "tile_n": 5, "threads": 160, "grouping": 9, "minblocks": 7, "algorithm": "medium", "perf": 1308.23},
{"m": 26, "n": 26, "k": 12, "tile_m": 1, "tile_n": 5, "threads": 160, "grouping": 5, "minblocks": 7, "algorithm": "medium", "perf": 1442.33},
{"m": 26, "n": 26, "k": 13, "tile_m": 1, "tile_n": 5, "threads": 160, "grouping": 5, "minblocks": 6, "algorithm": "medium", "perf": 1449.82},
{"m": 26, "n": 26, "k": 14, "tile_m": 1, "tile_n": 5, "threads": 160, "grouping": 5, "minblocks": 6, "algorithm": "medium", "perf": 1481.84},
{"m": 26, "n": 26, "k": 24, "tile_m": 3, "tile_n": 4, "threads": 64, "grouping": 3, "minblocks": 4, "algorithm": "medium", "perf": 1576.45},
{"m": 26, "n": 26, "k": 25, "tile_m": 1, "tile_n": 4, "threads": 192, "grouping": 32, "minblocks": 1, "algorithm": "medium", "perf": 1587.9},
{"m": 26, "n": 26, "k": 26, "tile_m": 1, "tile_n": 4, "threads": 192, "grouping": 4, "minblocks": 4, "algorithm": "medium", "perf": 1597.11},
{"m": 26, "n": 26, "k": 28, "tile_m": 3, "tile_n": 4, "threads": 64, "grouping": 3, "minblocks": 2, "algorithm": "medium", "perf": 1611.35},
{"m": 26, "n": 26, "k": 32, "tile_m": 3, "tile_n": 4, "threads": 64, "grouping": 3, "minblocks": 2, "algorithm": "medium", "perf": 1634.06},
{"m": 26, "n": 26, "k": 45, "tile_m": 3, "tile_n": 4, "w": 18, "v": 14, "threads": 64, "grouping": 16, "minblocks": 4, "algorithm": "largeDB2", "perf": 1658.01},
{"m": 26, "n": 28, "k": 4, "tile_m": 3, "tile_n": 4, "threads": 64, "grouping": 32, "minblocks": 2, "algorithm": "medium", "perf": 1060.2},
{"m": 26, "n": 28, "k": 5, "tile_m": 1, "tile_n": 5, "threads": 160, "grouping": 9, "minblocks": 8, "algorithm": "medium", "perf": 1126.12},
{"m": 26, "n": 28, "k": 7, "tile_m": 1, "tile_n": 4, "threads": 224, "grouping": 27, "minblocks": 6, "algorithm": "medium", "perf": 1233.99},
{"m": 26, "n": 28, "k": 9, "tile_m": 3, "tile_n": 4, "threads": 64, "grouping": 25, "minblocks": 3, "algorithm": "medium", "perf": 1333.66},
{"m": 26, "n": 28, "k": 13, "tile_m": 1, "tile_n": 5, "threads": 160, "grouping": 5, "minblocks": 6, "algorithm": "medium", "perf": 1462.23},
{"m": 26, "n": 28, "k": 25, "tile_m": 3, "tile_n": 4, "w": 8, "v": 28, "threads": 64, "grouping": 16, "minblocks": 1, "algorithm": "largeDB2", "perf": 1614.7},
{"m": 26, "n": 28, "k": 26, "tile_m": 3, "tile_n": 4, "w": 8, "v": 28, "threads": 64, "grouping": 16, "minblocks": 1, "algorithm": "largeDB2", "perf": 1634.02},
{"m": 26, "n": 28, "k": 28, "tile_m": 3, "tile_n": 4, "w": 8, "v": 28, "threads": 64, "grouping": 16, "minblocks": 2, "algorithm": "largeDB2", "perf": 1644.78},
{"m": 26, "n": 28, "k": 32, "tile_m": 3, "tile_n": 4, "w": 8, "v": 28, "threads": 64, "grouping": 16, "minblocks": 1, "algorithm": "largeDB2", "perf": 1687.3},
{"m": 26, "n": 28, "k": 45, "tile_m": 3, "tile_n": 3, "w": 16, "v": 28, "threads": 96, "grouping": 16, "minblocks": 1, "algorithm": "largeDB2", "perf": 1724.14},
{"m": 26, "n": 32, "k": 4, "tile_m": 1, "tile_n": 6, "threads": 160, "grouping": 12, "minblocks": 7, "algorithm": "medium", "perf": 1067.11},
{"m": 26, "n": 32, "k": 5, "tile_m": 1, "tile_n": 6, "threads": 192, "grouping": 12, "minblocks": 6, "algorithm": "medium", "perf": 1162.16},
{"m": 26, "n": 32, "k": 7, "tile_m": 3, "tile_n": 5, "threads": 64, "grouping": 26, "minblocks": 6, "algorithm": "medium", "perf": 1279.84},
{"m": 26, "n": 32, "k": 9, "tile_m": 1, "tile_n": 6, "threads": 160, "grouping": 10, "minblocks": 7, "algorithm": "medium", "perf": 1389.5},
{"m": 26, "n": 32, "k": 12, "tile_m": 7, "tile_n": 2, "w": 6, "v": 32, "threads": 64, "grouping": 16, "minblocks": 1, "algorithm": "largeDB2", "perf": 1501.3},
{"m": 26, "n": 32, "k": 13, "tile_m": 1, "tile_n": 6, "threads": 160, "grouping": 5, "minblocks": 6, "algorithm": "medium", "perf": 1539.69},
{"m": 26, "n": 32, "k": 14, "tile_m": 1, "tile_n": 6, "threads": 160, "grouping": 5, "minblocks": 6, "algorithm": "medium", "perf": 1590.16},
{"m": 26, "n": 32, "k": 24, "tile_m": 3, "tile_n": 5, "threads": 64, "grouping": 3, "minblocks": 3, "algorithm": "medium", "perf": 1705.11},
{"m": 26, "n": 32, "k": 25, "tile_m": 3, "tile_n": 5, "threads": 64, "grouping": 3, "minblocks": 2, "algorithm": "medium", "perf": 1687.93},
{"m": 26, "n": 32, "k": 26, "tile_m": 3, "tile_n": 5, "threads": 64, "grouping": 3, "minblocks": 2, "algorithm": "medium", "perf": 1732.07},
{"m": 26, "n": 32, "k": 28, "tile_m": 3, "tile_n": 5, "w": 14, "v": 26, "threads": 64, "grouping": 16, "minblocks": 1, "algorithm": "largeDB2", "perf": 1728.22},
{"m": 26, "n": 32, "k": 32, "tile_m": 3, "tile_n": 5, "w": 8, "v": 32, "threads": 64, "grouping": 16, "minblocks": 4, "algorithm": "largeDB2", "perf": 1778.97},
{"m": 26, "n": 32, "k": 45, "tile_m": 3, "tile_n": 5, "w": 16, "v": 30, "threads": 64, "grouping": 16, "minblocks": 1, "algorithm": "largeDB2", "perf": 1831.59},
{"m": 26, "n": 45, "k": 4, "tile_m": 1, "tile_n": 6, "threads": 224, "grouping": 29, "minblocks": 5, "algorithm": "medium", "perf": 1073.89},
{"m": 26, "n": 45, "k": 5, "tile_m": 1, "tile_n": 5, "threads": 256, "grouping": 29, "minblocks": 5, "algorithm": "medium", "perf": 1204.58},
{"m": 26, "n": 45, "k": 7, "tile_m": 3, "tile_n": 5, "threads": 96, "grouping": 25, "minblocks": 3, "algorithm": "medium", "perf": 1351.98},
{"m": 26, "n": 45, "k": 9, "tile_m": 1, "tile_n": 5, "threads": 256, "grouping": 29, "minblocks": 5, "algorithm": "medium", "perf": 1490.07},
{"m": 26, "n": 45, "k": 13, "tile_m": 3, "tile_n": 5, "threads": 96, "grouping": 24, "minblocks": 2, "algorithm": "medium", "perf": 1646.86},
{"m": 26, "n": 45, "k": 25, "tile_m": 1, "tile_n": 5, "threads": 256, "grouping": 32, "minblocks": 3, "algorithm": "medium", "perf": 1858.51},
{"m": 26, "n": 45, "k": 26, "tile_m": 7, "tile_n": 3, "w": 8, "v": 42, "threads": 64, "grouping": 16, "minblocks": 2, "algorithm": "largeDB2", "perf": 1878.25},
{"m": 26, "n": 45, "k": 28, "tile_m": 7, "tile_n": 3, "w": 8, "v": 38, "threads": 64, "grouping": 16, "minblocks": 2, "algorithm": "largeDB2", "perf": 1924.64},
{"m": 26, "n": 45, "k": 32, "tile_m": 7, "tile_n": 3, "w": 8, "v": 22, "threads": 64, "grouping": 16, "minblocks": 1, "algorithm": "largeDB2", "perf": 1985.28},
{"m": 26, "n": 45, "k": 45, "tile_m": 7, "tile_n": 3, "w": 14, "v": 36, "threads": 64, "grouping": 16, "minblocks": 4, "algorithm": "largeDB2", "perf": 2060.31},
{"m": 27, "n": 27, "k": 27, "tile_m": 3, "tile_n": 4, "threads": 64, "grouping": 3, "minblocks": 3, "algorithm": "medium", "perf": 1627.88},
{"m": 28, "n": 4, "k": 4, "tile_m": 1, "tile_n": 5, "threads": 32, "grouping": 13, "minblocks": 23, "algorithm": "medium", "perf": 461.401},
{"m": 28, "n": 4, "k": 5, "tile_m": 1, "tile_n": 5, "threads": 32, "grouping": 13, "minblocks": 21, "algorithm": "medium", "perf": 448.695},
{"m": 28, "n": 4, "k": 7, "tile_m": 1, "tile_n": 2, "threads": 64, "grouping": 24, "minblocks": 7, "algorithm": "medium", "perf": 463.739},
{"m": 28, "n": 4, "k": 9, "tile_m": 1, "tile_n": 2, "threads": 64, "grouping": 5, "minblocks": 2, "algorithm": "medium", "perf": 475.527},
{"m": 28, "n": 4, "k": 13, "tile_m": 1, "tile_n": 2, "threads": 64, "grouping": 29, "minblocks": 6, "algorithm": "medium", "perf": 481.891},
{"m": 28, "n": 4, "k": 25, "tile_m": 1, "tile_n": 2, "threads": 128, "grouping": 4, "minblocks": 4, "algorithm": "medium", "perf": 486.812},
{"m": 28, "n": 4, "k": 26, "tile_m": 1, "tile_n": 2, "threads": 128, "grouping": 32, "minblocks": 1, "algorithm": "medium", "perf": 486.174},
{"m": 28, "n": 4, "k": 28, "tile_m": 1, "tile_n": 2, "threads": 128, "grouping": 6, "minblocks": 3, "algorithm": "medium", "perf": 487.386},
{"m": 28, "n": 4, "k": 32, "tile_m": 1, "tile_n": 1, "threads": 192, "grouping": 4, "minblocks": 1, "algorithm": "medium", "perf": 493.569},
{"m": 28, "n": 4, "k": 45, "tile_m": 1, "tile_n": 1, "threads": 256, "grouping": 2, "minblocks": 3, "algorithm": "medium", "perf": 499.71},
{"m": 28, "n": 5, "k": 4, "tile_m": 1, "tile_n": 5, "threads": 32, "grouping": 15, "minblocks": 13, "algorithm": "medium", "perf": 512.554},
{"m": 28, "n": 5, "k": 5, "tile_m": 1, "tile_n": 5, "threads": 32, "grouping": 16, "minblocks": 24, "algorithm": "medium", "perf": 527.04},
{"m": 28, "n": 5, "k": 7, "tile_m": 1, "tile_n": 5, "threads": 64, "grouping": 22, "minblocks": 17, "algorithm": "medium", "perf": 539.965},
{"m": 28, "n": 5, "k": 9, "tile_m": 3, "tile_n": 1, "threads": 64, "grouping": 26, "minblocks": 12, "algorithm": "medium", "perf": 563.57},
{"m": 28, "n": 5, "k": 13, "tile_m": 1, "tile_n": 3, "threads": 96, "grouping": 29, "minblocks": 3, "algorithm": "medium", "perf": 557.175},
{"m": 28, "n": 5, "k": 25, "tile_m": 1, "tile_n": 3, "threads": 192, "grouping": 4, "minblocks": 7, "algorithm": "medium", "perf": 578.247},
{"m": 28, "n": 5, "k": 26, "tile_m": 1, "tile_n": 2, "threads": 160, "grouping": 5, "minblocks": 3, "algorithm": "medium", "perf": 579.676},
{"m": 28, "n": 5, "k": 28, "tile_m": 1, "tile_n": 1, "threads": 160, "grouping": 4, "minblocks": 1, "algorithm": "medium", "perf": 584.008},
{"m": 28, "n": 5, "k": 32, "tile_m": 1, "tile_n": 2, "threads": 192, "grouping": 4, "minblocks": 3, "algorithm": "medium", "perf": 594.508},
{"m": 28, "n": 5, "k": 45, "tile_m": 1, "tile_n": 1, "threads": 256, "grouping": 3, "minblocks": 3, "algorithm": "medium", "perf": 598.534},
{"m": 28, "n": 7, "k": 4, "tile_m": 2, "tile_n": 4, "threads": 32, "grouping": 17, "minblocks": 10, "algorithm": "medium", "perf": 622.45},
{"m": 28, "n": 7, "k": 5, "tile_m": 1, "tile_n": 4, "threads": 64, "grouping": 22, "minblocks": 7, "algorithm": "medium", "perf": 627.062},
{"m": 28, "n": 7, "k": 7, "tile_m": 1, "tile_n": 5, "threads": 64, "grouping": 26, "minblocks": 9, "algorithm": "medium", "perf": 683.291},
{"m": 28, "n": 7, "k": 9, "tile_m": 1, "tile_n": 4, "threads": 64, "grouping": 24, "minblocks": 1, "algorithm": "medium", "perf": 714.393},
{"m": 28, "n": 7, "k": 13, "tile_m": 1, "tile_n": 3, "threads": 96, "grouping": 29, "minblocks": 9, "algorithm": "medium", "perf": 722.039},
{"m": 28, "n": 7, "k": 25, "tile_m": 1, "tile_n": 2, "threads": 192, "grouping": 4, "minblocks": 6, "algorithm": "medium", "perf": 745.291},
{"m": 28, "n": 7, "k": 26, "tile_m": 1, "tile_n": 2, "threads": 192, "grouping": 4, "minblocks": 4, "algorithm": "medium", "perf": 747.448},
{"m": 28, "n": 7, "k": 28, "tile_m": 1, "tile_n": 2, "threads": 224, "grouping": 3, "minblocks": 6, "algorithm": "medium", "perf": 754.047},
{"m": 28, "n": 7, "k": 32, "tile_m": 1, "tile_n": 2, "threads": 256, "grouping": 4, "minblocks": 5, "algorithm": "medium", "perf": 768.773},
{"m": 28, "n": 7, "k": 45, "tile_m": 1, "tile_n": 2, "threads": 192, "grouping": 3, "minblocks": 2, "algorithm": "medium", "perf": 768.667},
{"m": 28, "n": 9, "k": 4, "tile_m": 1, "tile_n": 5, "threads": 64, "grouping": 24, "minblocks": 11, "algorithm": "medium", "perf": 686.434},
{"m": 28, "n": 9, "k": 5, "tile_m": 1, "tile_n": 5, "threads": 64, "grouping": 22, "minblocks": 19, "algorithm": "medium", "perf": 738.32},
{"m": 28, "n": 9, "k": 7, "tile_m": 1, "tile_n": 5, "threads": 64, "grouping": 26, "minblocks": 16, "algorithm": "medium", "perf": 808.579},
{"m": 28, "n": 9, "k": 9, "tile_m": 1, "tile_n": 3, "threads": 96, "grouping": 32, "minblocks": 3, "algorithm": "medium", "perf": 825.886},
{"m": 28, "n": 9, "k": 13, "tile_m": 1, "tile_n": 3, "threads": 128, "grouping": 32, "minblocks": 9, "algorithm": "medium", "perf": 844.884},
{"m": 28, "n": 9, "k": 25, "tile_m": 1, "tile_n": 3, "threads": 256, "grouping": 4, "minblocks": 6, "algorithm": "medium", "perf": 895.124},
{"m": 28, "n": 9, "k": 26, "tile_m": 1, "tile_n": 3, "threads": 256, "grouping": 4, "minblocks": 6, "algorithm": "medium", "perf": 891.424},
{"m": 28, "n": 9, "k": 28, "tile_m": 1, "tile_n": 2, "threads": 256, "grouping": 5, "minblocks": 5, "algorithm": "medium", "perf": 897.496},
{"m": 28, "n": 9, "k": 32, "tile_m": 1, "tile_n": 3, "threads": 128, "grouping": 3, "minblocks": 3, "algorithm": "medium", "perf": 918.668},
{"m": 28, "n": 9, "k": 45, "tile_m": 1, "tile_n": 3, "w": 10, "v": 4, "threads": 96, "grouping": 16, "minblocks": 4, "algorithm": "largeDB2", "perf": 930.129},
{"m": 28, "n": 13, "k": 4, "tile_m": 2, "tile_n": 4, "threads": 64, "grouping": 26, "minblocks": 7, "algorithm": "medium", "perf": 836.442},
{"m": 28, "n": 13, "k": 5, "tile_m": 1, "tile_n": 5, "threads": 96, "grouping": 12, "minblocks": 12, "algorithm": "medium", "perf": 827.406},
{"m": 28, "n": 13, "k": 7, "tile_m": 1, "tile_n": 5, "threads": 96, "grouping": 26, "minblocks": 11, "algorithm": "medium", "perf": 960.632},
{"m": 28, "n": 13, "k": 9, "tile_m": 1, "tile_n": 5, "threads": 128, "grouping": 32, "minblocks": 9, "algorithm": "medium", "perf": 996.46},
{"m": 28, "n": 13, "k": 13, "tile_m": 1, "tile_n": 5, "threads": 96, "grouping": 4, "minblocks": 10, "algorithm": "medium", "perf": 1030.59},
{"m": 28, "n": 13, "k": 25, "tile_m": 1, "tile_n": 3, "threads": 192, "grouping": 5, "minblocks": 5, "algorithm": "medium", "perf": 1115.36},
{"m": 28, "n": 13, "k": 26, "tile_m": 1, "tile_n": 3, "threads": 160, "grouping": 4, "minblocks": 4, "algorithm": "medium", "perf": 1114.24},
{"m": 28, "n": 13, "k": 28, "tile_m": 1, "tile_n": 4, "w": 10, "v": 12, "threads": 128, "grouping": 16, "minblocks": 2, "algorithm": "largeDB2", "perf": 1122.82},
{"m": 28, "n": 13, "k": 32, "tile_m": 1, "tile_n": 5, "threads": 128, "grouping": 24, "minblocks": 4, "algorithm": "medium", "perf": 1145.54},
{"m": 28, "n": 13, "k": 45, "tile_m": 1, "tile_n": 7, "w": 12, "v": 8, "threads": 64, "grouping": 16, "minblocks": 8, "algorithm": "largeDB2", "perf": 1176.78},
{"m": 28, "n": 25, "k": 4, "tile_m": 4, "tile_n": 3, "threads": 64, "grouping": 32, "minblocks": 3, "algorithm": "medium", "perf": 1029.26},
{"m": 28, "n": 25, "k": 5, "tile_m": 1, "tile_n": 5, "threads": 160, "grouping": 9, "minblocks": 8, "algorithm": "medium", "perf": 1103.4},
{"m": 28, "n": 25, "k": 7, "tile_m": 5, "tile_n": 3, "threads": 64, "grouping": 24, "minblocks": 2, "algorithm": "medium", "perf": 1185.57},
{"m": 28, "n": 25, "k": 9, "tile_m": 1, "tile_n": 5, "threads": 160, "grouping": 10, "minblocks": 7, "algorithm": "medium", "perf": 1283.85},
{"m": 28, "n": 25, "k": 13, "tile_m": 1, "tile_n": 5, "threads": 160, "grouping": 29, "minblocks": 5, "algorithm": "medium", "perf": 1423.58},
{"m": 28, "n": 25, "k": 25, "tile_m": 3, "tile_n": 5, "threads": 64, "grouping": 3, "minblocks": 3, "algorithm": "medium", "perf": 1582.11},
{"m": 28, "n": 25, "k": 26, "tile_m": 3, "tile_n": 5, "threads": 64, "grouping": 3, "minblocks": 4, "algorithm": "medium", "perf": 1581.68},
{"m": 28, "n": 25, "k": 28, "tile_m": 1, "tile_n": 5, "threads": 160, "grouping": 24, "minblocks": 4, "algorithm": "medium", "perf": 1601.02},
{"m": 28, "n": 25, "k": 32, "tile_m": 3, "tile_n": 3, "threads": 128, "grouping": 32, "minblocks": 1, "algorithm": "medium", "perf": 1631.38},
{"m": 28, "n": 25, "k": 45, "tile_m": 3, "tile_n": 5, "w": 12, "v": 14, "threads": 64, "grouping": 16, "minblocks": 4, "algorithm": "largeDB2", "perf": 1683.73},
{"m": 28, "n": 26, "k": 4, "tile_m": 4, "tile_n": 3, "threads": 64, "grouping": 32, "minblocks": 2, "algorithm": "medium", "perf": 1046.4},
{"m": 28, "n": 26, "k": 5, "tile_m": 1, "tile_n": 6, "threads": 160, "grouping": 9, "minblocks": 8, "algorithm": "medium", "perf": 1116.46},
{"m": 28, "n": 26, "k": 7, "tile_m": 5, "tile_n": 3, "threads": 64, "grouping": 25, "minblocks": 4, "algorithm": "medium", "perf": 1206.91},
{"m": 28, "n": 26, "k": 9, "tile_m": 5, "tile_n": 3, "threads": 64, "grouping": 21, "minblocks": 2, "algorithm": "medium", "perf": 1308.19},
{"m": 28, "n": 26, "k": 13, "tile_m": 3, "tile_n": 5, "threads": 64, "grouping": 5, "minblocks": 5, "algorithm": "medium", "perf": 1440.64},
{"m": 28, "n": 26, "k": 25, "tile_m": 3, "tile_n": 5, "threads": 64, "grouping": 3, "minblocks": 2, "algorithm": "medium", "perf": 1615.94},
{"m": 28, "n": 26, "k": 26, "tile_m": 3, "tile_n": 5, "threads": 64, "grouping": 3, "minblocks": 3, "algorithm": "medium", "perf": 1620.78},
{"m": 28, "n": 26, "k": 28, "tile_m": 3, "tile_n": 3, "threads": 96, "grouping": 3, "minblocks": 1, "algorithm": "medium", "perf": 1637.82},
{"m": 28, "n": 26, "k": 32, "tile_m": 3, "tile_n": 3, "threads": 128, "grouping": 32, "minblocks": 2, "algorithm": "medium", "perf": 1665.27},
{"m": 28, "n": 26, "k": 45, "tile_m": 3, "tile_n": 3, "w": 16, "v": 26, "threads": 96, "grouping": 16, "minblocks": 2, "algorithm": "largeDB2", "perf": 1738.17},
{"m": 28, "n": 28, "k": 4, "tile_m": 2, "tile_n": 4, "threads": 128, "grouping": 24, "minblocks": 3, "algorithm": "medium", "perf": 1053.5},
{"m": 28, "n": 28, "k": 5, "tile_m": 1, "tile_n": 6, "threads": 160, "grouping": 9, "minblocks": 7, "algorithm": "medium", "perf": 1153.08},
{"m": 28, "n": 28, "k": 7, "tile_m": 5, "tile_n": 3, "threads": 64, "grouping": 25, "minblocks": 3, "algorithm": "medium", "perf": 1291.9},
{"m": 28, "n": 28, "k": 9, "tile_m": 5, "tile_n": 3, "threads": 64, "grouping": 29, "minblocks": 3, "algorithm": "medium", "perf": 1407.79},
{"m": 28, "n": 28, "k": 13, "tile_m": 1, "tile_n": 6, "threads": 160, "grouping": 5, "minblocks": 6, "algorithm": "medium", "perf": 1560.57},
{"m": 28, "n": 28, "k": 25, "tile_m": 3, "tile_n": 5, "threads": 64, "grouping": 3, "minblocks": 3, "algorithm": "medium", "perf": 1712.97},
{"m": 28, "n": 28, "k": 26, "tile_m": 3, "tile_n": 5, "threads": 64, "grouping": 3, "minblocks": 2, "algorithm": "medium", "perf": 1708.21},
{"m": 28, "n": 28, "k": 28, "tile_m": 3, "tile_n": 5, "threads": 64, "grouping": 3, "minblocks": 3, "algorithm": "medium", "perf": 1700.13},
{"m": 28, "n": 28, "k": 32, "tile_m": 3, "tile_n": 5, "threads": 96, "grouping": 3, "minblocks": 2, "algorithm": "medium", "perf": 1753.32},
{"m": 28, "n": 28, "k": 45, "tile_m": 5, "tile_n": 3, "w": 8, "v": 14, "threads": 64, "grouping": 16, "minblocks": 4, "algorithm": "largeDB2", "perf": 1784.75},
{"m": 28, "n": 32, "k": 4, "tile_m": 3, "tile_n": 2, "threads": 160, "grouping": 29, "minblocks": 5, "algorithm": "medium", "perf": 1074.89},
{"m": 28, "n": 32, "k": 5, "tile_m": 1, "tile_n": 4, "threads": 224, "grouping": 9, "minblocks": 6, "algorithm": "medium", "perf": 1179.11},
{"m": 28, "n": 32, "k": 7, "tile_m": 1, "tile_n": 4, "threads": 256, "grouping": 29, "minblocks": 5, "algorithm": "medium", "perf": 1331.58},
{"m": 28, "n": 32, "k": 9, "tile_m": 4, "tile_n": 4, "threads": 64, "grouping": 29, "minblocks": 2, "algorithm": "medium", "perf": 1423.42},
{"m": 28, "n": 32, "k": 13, "tile_m": 3, "tile_n": 2, "threads": 160, "grouping": 29, "minblocks": 5, "algorithm": "medium", "perf": 1552.86},
{"m": 28, "n": 32, "k": 25, "tile_m": 1, "tile_n": 4, "threads": 224, "grouping": 4, "minblocks": 4, "algorithm": "medium", "perf": 1787.13},
{"m": 28, "n": 32, "k": 26, "tile_m": 1, "tile_n": 4, "threads": 256, "grouping": 32, "minblocks": 3, "algorithm": "medium", "perf": 1777.2},
{"m": 28, "n": 32, "k": 28, "tile_m": 5, "tile_n": 2, "threads": 96, "grouping": 3, "minblocks": 2, "algorithm": "medium", "perf": 1795.81},
{"m": 28, "n": 32, "k": 32, "tile_m": 5, "tile_n": 2, "w": 16, "v": 18, "threads": 96, "grouping": 16, "minblocks": 4, "algorithm": "largeDB2", "perf": 1849.83},
{"m": 28, "n": 32, "k": 45, "tile_m": 3, "tile_n": 6, "w": 10, "v": 16, "threads": 64, "grouping": 16, "minblocks": 1, "algorithm": "largeDB2", "perf": 1909.3},
{"m": 28, "n": 45, "k": 4, "tile_m": 3, "tile_n": 5, "threads": 96, "grouping": 29, "minblocks": 1, "algorithm": "medium", "perf": 1163.62},
{"m": 28, "n": 45, "k": 5, "tile_m": 1, "tile_n": 5, "threads": 256, "grouping": 16, "minblocks": 4, "algorithm": "medium", "perf": 1262.25},
{"m": 28, "n": 45, "k": 7, "tile_m": 3, "tile_n": 5, "threads": 96, "grouping": 25, "minblocks": 4, "algorithm": "medium", "perf": 1441},
{"m": 28, "n": 45, "k": 9, "tile_m": 3, "tile_n": 4, "threads": 128, "grouping": 32, "minblocks": 1, "algorithm": "medium", "perf": 1569.32},
{"m": 28, "n": 45, "k": 13, "tile_m": 3, "tile_n": 5, "threads": 96, "grouping": 24, "minblocks": 4, "algorithm": "medium", "perf": 1754.86},
{"m": 28, "n": 45, "k": 25, "tile_m": 3, "tile_n": 4, "threads": 128, "grouping": 32, "minblocks": 2, "algorithm": "medium", "perf": 1976.24},
{"m": 28, "n": 45, "k": 26, "tile_m": 3, "tile_n": 4, "threads": 128, "grouping": 32, "minblocks": 3, "algorithm": "medium", "perf": 1998.55},
{"m": 28, "n": 45, "k": 28, "tile_m": 7, "tile_n": 3, "w": 8, "v": 20, "threads": 64, "grouping": 16, "minblocks": 4, "algorithm": "largeDB2", "perf": 2023.14},
{"m": 28, "n": 45, "k": 32, "tile_m": 7, "tile_n": 3, "w": 8, "v": 20, "threads": 64, "grouping": 16, "minblocks": 1, "algorithm": "largeDB2", "perf": 2082.87},
{"m": 28, "n": 45, "k": 45, "tile_m": 7, "tile_n": 3, "w": 8, "v": 40, "threads": 64, "grouping": 16, "minblocks": 2, "algorithm": "largeDB2", "perf": 2164.99},
{"m": 29, "n": 14, "k": 14, "tile_m": 1, "tile_n": 5, "threads": 128, "grouping": 6, "minblocks": 9, "algorithm": "medium", "perf": 1094.19},
{"m": 29, "n": 14, "k": 16, "tile_m": 1, "tile_n": 5, "threads": 128, "grouping": 5, "minblocks": 8, "algorithm": "medium", "perf": 1132.98},
{"m": 29, "n": 14, "k": 29, "tile_m": 3, "tile_n": 3, "w": 12, "v": 14, "threads": 64, "grouping": 16, "minblocks": 8, "algorithm": "largeDB2", "perf": 1191.43},
{"m": 29, "n": 14, "k": 32, "tile_m": 3, "tile_n": 3, "threads": 64, "grouping": 29, "minblocks": 1, "algorithm": "medium", "perf": 1211.15},
{"m": 29, "n": 16, "k": 14, "tile_m": 1, "tile_n": 4, "threads": 128, "grouping": 4, "minblocks": 9, "algorithm": "medium", "perf": 1200.6},
{"m": 29, "n": 16, "k": 16, "tile_m": 1, "tile_n": 4, "threads": 128, "grouping": 4, "minblocks": 8, "algorithm": "medium", "perf": 1237.1},
{"m": 29, "n": 16, "k": 29, "tile_m": 3, "tile_n": 1, "w": 10, "v": 14, "threads": 160, "grouping": 16, "minblocks": 1, "algorithm": "largeDB2", "perf": 1302.52},
{"m": 29, "n": 16, "k": 55, "tile_m": 3, "tile_n": 3, "w": 14, "v": 16, "threads": 64, "grouping": 16, "minblocks": 1, "algorithm": "largeDB2", "perf": 1381.48},
{"m": 29, "n": 29, "k": 14, "tile_m": 3, "tile_n": 2, "threads": 160, "grouping": 32, "minblocks": 1, "algorithm": "medium", "perf": 1562.65},
{"m": 29, "n": 29, "k": 16, "tile_m": 3, "tile_n": 2, "threads": 160, "grouping": 32, "minblocks": 1, "algorithm": "medium", "perf": 1616.32},
{"m": 29, "n": 29, "k": 29, "tile_m": 3, "tile_n": 5, "threads": 96, "grouping": 24, "minblocks": 3, "algorithm": "medium", "perf": 1736.13},
{"m": 29, "n": 29, "k": 32, "tile_m": 3, "tile_n": 5, "threads": 96, "grouping": 3, "minblocks": 2, "algorithm": "medium", "perf": 1807.51},
{"m": 29, "n": 29, "k": 55, "tile_m": 3, "tile_n": 5, "w": 12, "v": 26, "threads": 64, "grouping": 16, "minblocks": 1, "algorithm": "largeDB2", "perf": 1881.61},
{"m": 29, "n": 32, "k": 14, "tile_m": 3, "tile_n": 2, "threads": 192, "grouping": 29, "minblocks": 5, "algorithm": "medium", "perf": 1630.9},
{"m": 29, "n": 32, "k": 29, "tile_m": 5, "tile_n": 2, "w": 12, "v": 28, "threads": 96, "grouping": 16, "minblocks": 1, "algorithm": "largeDB2", "perf": 1818.21},
{"m": 29, "n": 32, "k": 32, "tile_m": 3, "tile_n": 3, "threads": 128, "grouping": 32, "minblocks": 2, "algorithm": "medium", "perf": 1865.52},
{"m": 29, "n": 32, "k": 55, "tile_m": 3, "tile_n": 6, "w": 10, "v": 32, "threads": 64, "grouping": 16, "minblocks": 4, "algorithm": "largeDB2", "perf": 1977.23},
{"m": 29, "n": 55, "k": 16, "tile_m": 3, "tile_n": 5, "threads": 128, "grouping": 32, "minblocks": 1, "algorithm": "medium", "perf": 1958.07},
{"m": 29, "n": 55, "k": 29, "tile_m": 3, "tile_n": 5, "threads": 128, "grouping": 32, "minblocks": 1, "algorithm": "medium", "perf": 2173.7},
{"m": 29, "n": 55, "k": 32, "tile_m": 4, "tile_n": 7, "w": 8, "v": 36, "threads": 64, "grouping": 16, "minblocks": 4, "algorithm": "largeDB2", "perf": 2227.18},
{"m": 29, "n": 55, "k": 55, "tile_m": 5, "tile_n": 6, "w": 6, "v": 36, "threads": 64, "grouping": 16, "minblocks": 4, "algorithm": "largeDB2", "perf": 2364.15},
{"m": 30, "n": 30, "k": 30, "tile_m": 5, "tile_n": 3, "threads": 64, "grouping": 3, "minblocks": 1, "algorithm": "medium", "perf": 1838.1},
{"m": 31, "n": 31, "k": 31, "tile_m": 4, "tile_n": 4, "threads": 64, "grouping": 24, "minblocks": 1, "algorithm": "medium", "perf": 1830.67},
{"m": 32, "n": 4, "k": 4, "tile_m": 1, "tile_n": 6, "threads": 32, "grouping": 13, "minblocks": 2, "algorithm": "medium", "perf": 463.773},
{"m": 32, "n": 4, "k": 5, "tile_m": 1, "tile_n": 4, "threads": 32, "grouping": 16, "minblocks": 13, "algorithm": "medium", "perf": 469.138},
{"m": 32, "n": 4, "k": 7, "tile_m": 1, "tile_n": 2, "threads": 64, "grouping": 24, "minblocks": 7, "algorithm": "medium", "perf": 479.728},
{"m": 32, "n": 4, "k": 9, "tile_m": 1, "tile_n": 2, "threads": 64, "grouping": 6, "minblocks": 15, "algorithm": "medium", "perf": 482.038},
{"m": 32, "n": 4, "k": 13, "tile_m": 1, "tile_n": 2, "threads": 64, "grouping": 26, "minblocks": 11, "algorithm": "medium", "perf": 493.254},
{"m": 32, "n": 4, "k": 25, "tile_m": 1, "tile_n": 1, "threads": 160, "grouping": 4, "minblocks": 5, "algorithm": "medium", "perf": 498.236},
{"m": 32, "n": 4, "k": 26, "tile_m": 1, "tile_n": 1, "threads": 192, "grouping": 3, "minblocks": 5, "algorithm": "medium", "perf": 498.907},
{"m": 32, "n": 4, "k": 28, "tile_m": 1, "tile_n": 2, "threads": 256, "grouping": 4, "minblocks": 6, "algorithm": "medium", "perf": 503.858},
{"m": 32, "n": 4, "k": 32, "tile_m": 1, "tile_n": 1, "threads": 256, "grouping": 3, "minblocks": 1, "algorithm": "medium", "perf": 510.352},
{"m": 32, "n": 4, "k": 45, "tile_m": 1, "tile_n": 1, "threads": 256, "grouping": 3, "minblocks": 3, "algorithm": "medium", "perf": 514.431},
{"m": 32, "n": 5, "k": 4, "tile_m": 1, "tile_n": 5, "threads": 32, "grouping": 17, "minblocks": 26, "algorithm": "medium", "perf": 521.537},
{"m": 32, "n": 5, "k": 5, "tile_m": 1, "tile_n": 5, "threads": 32, "grouping": 16, "minblocks": 14, "algorithm": "medium", "perf": 535.38},
{"m": 32, "n": 5, "k": 7, "tile_m": 1, "tile_n": 5, "threads": 64, "grouping": 26, "minblocks": 13, "algorithm": "medium", "perf": 556.583},
{"m": 32, "n": 5, "k": 9, "tile_m": 1, "tile_n": 3, "threads": 64, "grouping": 29, "minblocks": 9, "algorithm": "medium", "perf": 568.533},
{"m": 32, "n": 5, "k": 12, "tile_m": 1, "tile_n": 3, "threads": 96, "grouping": 32, "minblocks": 5, "algorithm": "medium", "perf": 578.088},
{"m": 32, "n": 5, "k": 13, "tile_m": 1, "tile_n": 2, "threads": 96, "grouping": 32, "minblocks": 10, "algorithm": "medium", "perf": 571.398},
{"m": 32, "n": 5, "k": 16, "tile_m": 1, "tile_n": 2, "threads": 128, "grouping": 32, "minblocks": 7, "algorithm": "medium", "perf": 590.624},
{"m": 32, "n": 5, "k": 24, "tile_m": 1, "tile_n": 1, "threads": 192, "grouping": 5, "minblocks": 5, "algorithm": "medium", "perf": 595.227},
{"m": 32, "n": 5, "k": 25, "tile_m": 1, "tile_n": 1, "threads": 192, "grouping": 3, "minblocks": 1, "algorithm": "medium", "perf": 593.569},
{"m": 32, "n": 5, "k": 26, "tile_m": 1, "tile_n": 2, "threads": 160, "grouping": 4, "minblocks": 4, "algorithm": "medium", "perf": 597.402},
{"m": 32, "n": 5, "k": 28, "tile_m": 1, "tile_n": 1, "threads": 192, "grouping": 3, "minblocks": 1, "algorithm": "medium", "perf": 604.614},
{"m": 32, "n": 5, "k": 32, "tile_m": 1, "tile_n": 1, "threads": 256, "grouping": 3, "minblocks": 2, "algorithm": "medium", "perf": 611.583},
{"m": 32, "n": 5, "k": 45, "tile_m": 1, "tile_n": 1, "threads": 256, "grouping": 3, "minblocks": 3, "algorithm": "medium", "perf": 618.945},
{"m": 32, "n": 7, "k": 4, "tile_m": 2, "tile_n": 4, "threads": 32, "grouping": 19, "minblocks": 13, "algorithm": "medium", "perf": 635.452},
{"m": 32, "n": 7, "k": 5, "tile_m": 1, "tile_n": 4, "threads": 64, "grouping": 22, "minblocks": 4, "algorithm": "medium", "perf": 657.342},
{"m": 32, "n": 7, "k": 7, "tile_m": 1, "tile_n": 4, "threads": 64, "grouping": 26, "minblocks": 7, "algorithm": "medium", "perf": 710.551},
{"m": 32, "n": 7, "k": 9, "tile_m": 1, "tile_n": 4, "threads": 64, "grouping": 26, "minblocks": 12, "algorithm": "medium", "perf": 727.544},
{"m": 32, "n": 7, "k": 13, "tile_m": 1, "tile_n": 2, "threads": 128, "grouping": 32, "minblocks": 6, "algorithm": "medium", "perf": 739.552},
{"m": 32, "n": 7, "k": 25, "tile_m": 1, "tile_n": 2, "threads": 192, "grouping": 4, "minblocks": 4, "algorithm": "medium", "perf": 775.794},
{"m": 32, "n": 7, "k": 26, "tile_m": 1, "tile_n": 2, "threads": 192, "grouping": 4, "minblocks": 3, "algorithm": "medium", "perf": 776.845},
{"m": 32, "n": 7, "k": 28, "tile_m": 1, "tile_n": 2, "threads": 224, "grouping": 4, "minblocks": 3, "algorithm": "medium", "perf": 780.958},
{"m": 32, "n": 7, "k": 32, "tile_m": 1, "tile_n": 2, "threads": 256, "grouping": 4, "minblocks": 4, "algorithm": "medium", "perf": 799.863},
{"m": 32, "n": 7, "k": 45, "tile_m": 1, "tile_n": 1, "threads": 256, "grouping": 3, "minblocks": 3, "algorithm": "medium", "perf": 803.204},
{"m": 32, "n": 9, "k": 4, "tile_m": 1, "tile_n": 5, "threads": 64, "grouping": 24, "minblocks": 11, "algorithm": "medium", "perf": 719.416},
{"m": 32, "n": 9, "k": 5, "tile_m": 1, "tile_n": 6, "threads": 64, "grouping": 23, "minblocks": 13, "algorithm": "medium", "perf": 768.086},
{"m": 32, "n": 9, "k": 7, "tile_m": 1, "tile_n": 6, "threads": 64, "grouping": 25, "minblocks": 14, "algorithm": "medium", "perf": 830.63},
{"m": 32, "n": 9, "k": 9, "tile_m": 1, "tile_n": 5, "threads": 96, "grouping": 32, "minblocks": 10, "algorithm": "medium", "perf": 853.67},
{"m": 32, "n": 9, "k": 10, "tile_m": 1, "tile_n": 3, "threads": 96, "grouping": 29, "minblocks": 10, "algorithm": "medium", "perf": 863.579},
{"m": 32, "n": 9, "k": 12, "tile_m": 1, "tile_n": 3, "threads": 128, "grouping": 6, "minblocks": 11, "algorithm": "medium", "perf": 873.588},
{"m": 32, "n": 9, "k": 13, "tile_m": 1, "tile_n": 3, "threads": 128, "grouping": 4, "minblocks": 5, "algorithm": "medium", "perf": 873.679},
{"m": 32, "n": 9, "k": 22, "tile_m": 1, "tile_n": 3, "threads": 224, "grouping": 4, "minblocks": 5, "algorithm": "medium", "perf": 922.783},
{"m": 32, "n": 9, "k": 25, "tile_m": 1, "tile_n": 3, "threads": 256, "grouping": 4, "minblocks": 5, "algorithm": "medium", "perf": 926.612},
{"m": 32, "n": 9, "k": 26, "tile_m": 1, "tile_n": 3, "threads": 256, "grouping": 4, "minblocks": 5, "algorithm": "medium", "perf": 937.269},
{"m": 32, "n": 9, "k": 28, "tile_m": 1, "tile_n": 2, "threads": 160, "grouping": 3, "minblocks": 1, "algorithm": "medium", "perf": 943.269},
{"m": 32, "n": 9, "k": 32, "tile_m": 1, "tile_n": 3, "w": 8, "v": 8, "threads": 96, "grouping": 16, "minblocks": 2, "algorithm": "largeDB2", "perf": 954.006},
{"m": 32, "n": 9, "k": 45, "tile_m": 1, "tile_n": 3, "w": 10, "v": 4, "threads": 96, "grouping": 16, "minblocks": 1, "algorithm": "largeDB2", "perf": 967.274},
{"m": 32, "n": 10, "k": 9, "tile_m": 1, "tile_n": 5, "threads": 96, "grouping": 32, "minblocks": 10, "algorithm": "medium", "perf": 918.728},
{"m": 32, "n": 10, "k": 10, "tile_m": 1, "tile_n": 5, "threads": 128, "grouping": 32, "minblocks": 9, "algorithm": "medium", "perf": 915.443},
{"m": 32, "n": 10, "k": 12, "tile_m": 1, "tile_n": 3, "threads": 128, "grouping": 32, "minblocks": 9, "algorithm": "medium", "perf": 944.867},
{"m": 32, "n": 10, "k": 32, "tile_m": 1, "tile_n": 2, "threads": 192, "grouping": 3, "minblocks": 1, "algorithm": "medium", "perf": 1031.19},
{"m": 32, "n": 11, "k": 11, "tile_m": 1, "tile_n": 4, "threads": 128, "grouping": 4, "minblocks": 11, "algorithm": "medium", "perf": 978.001},
{"m": 32, "n": 11, "k": 12, "tile_m": 1, "tile_n": 3, "threads": 160, "grouping": 5, "minblocks": 9, "algorithm": "medium", "perf": 984.847},
{"m": 32, "n": 11, "k": 20, "tile_m": 1, "tile_n": 3, "threads": 224, "grouping": 4, "minblocks": 6, "algorithm": "medium", "perf": 1051.13},
{"m": 32, "n": 11, "k": 25, "tile_m": 1, "tile_n": 3, "threads": 160, "grouping": 3, "minblocks": 2, "algorithm": "medium", "perf": 1058.32},
{"m": 32, "n": 11, "k": 32, "tile_m": 1, "tile_n": 2, "threads": 192, "grouping": 3, "minblocks": 4, "algorithm": "medium", "perf": 1102.32},
{"m": 32, "n": 12, "k": 5, "tile_m": 1, "tile_n": 6, "threads": 64, "grouping": 26, "minblocks": 12, "algorithm": "medium", "perf": 908.801},
{"m": 32, "n": 12, "k": 9, "tile_m": 1, "tile_n": 3, "threads": 128, "grouping": 32, "minblocks": 10, "algorithm": "medium", "perf": 1015.3},
{"m": 32, "n": 12, "k": 10, "tile_m": 1, "tile_n": 3, "threads": 128, "grouping": 32, "minblocks": 11, "algorithm": "medium", "perf": 1036.39},
{"m": 32, "n": 12, "k": 11, "tile_m": 1, "tile_n": 4, "threads": 96, "grouping": 32, "minblocks": 11, "algorithm": "medium", "perf": 1023.16},
{"m": 32, "n": 12, "k": 12, "tile_m": 1, "tile_n": 3, "threads": 160, "grouping": 5, "minblocks": 9, "algorithm": "medium", "perf": 1047.84},
{"m": 32, "n": 12, "k": 13, "tile_m": 1, "tile_n": 4, "threads": 160, "grouping": 4, "minblocks": 9, "algorithm": "medium", "perf": 1058.78},
{"m": 32, "n": 12, "k": 16, "tile_m": 1, "tile_n": 3, "threads": 128, "grouping": 4, "minblocks": 2, "algorithm": "medium", "perf": 1090.93},
{"m": 32, "n": 12, "k": 20, "tile_m": 1, "tile_n": 3, "threads": 128, "grouping": 3, "minblocks": 6, "algorithm": "medium", "perf": 1116.25},
{"m": 32, "n": 12, "k": 25, "tile_m": 1, "tile_n": 2, "threads": 192, "grouping": 4, "minblocks": 5, "algorithm": "medium", "perf": 1131.14},
{"m": 32, "n": 12, "k": 26, "tile_m": 1, "tile_n": 2, "threads": 192, "grouping": 4, "minblocks": 5, "algorithm": "medium", "perf": 1144.79},
{"m": 32, "n": 12, "k": 32, "tile_m": 1, "tile_n": 2, "threads": 192, "grouping": 3, "minblocks": 4, "algorithm": "medium", "perf": 1176.59},
{"m": 32, "n": 13, "k": 4, "tile_m": 2, "tile_n": 4, "threads": 64, "grouping": 26, "minblocks": 1, "algorithm": "medium", "perf": 880.033},
{"m": 32, "n": 13, "k": 5, "tile_m": 1, "tile_n": 5, "threads": 96, "grouping": 24, "minblocks": 11, "algorithm": "medium", "perf": 897.283},
{"m": 32, "n": 13, "k": 7, "tile_m": 1, "tile_n": 5, "threads": 96, "grouping": 29, "minblocks": 11, "algorithm": "medium", "perf": 1013.1},
{"m": 32, "n": 13, "k": 9, "tile_m": 1, "tile_n": 5, "threads": 128, "grouping": 32, "minblocks": 9, "algorithm": "medium", "perf": 1040.81},
{"m": 32, "n": 13, "k": 12, "tile_m": 1, "tile_n": 3, "threads": 160, "grouping": 5, "minblocks": 9, "algorithm": "medium", "perf": 1085.48},
{"m": 32, "n": 13, "k": 13, "tile_m": 1, "tile_n": 5, "threads": 128, "grouping": 4, "minblocks": 8, "algorithm": "medium", "perf": 1085.19},
{"m": 32, "n": 13, "k": 14, "tile_m": 1, "tile_n": 5, "threads": 128, "grouping": 4, "minblocks": 7, "algorithm": "medium", "perf": 1105.19},
{"m": 32, "n": 13, "k": 16, "tile_m": 1, "tile_n": 4, "threads": 128, "grouping": 4, "minblocks": 7, "algorithm": "medium", "perf": 1140.15},
{"m": 32, "n": 13, "k": 24, "tile_m": 1, "tile_n": 4, "w": 12, "v": 10, "threads": 128, "grouping": 16, "minblocks": 1, "algorithm": "largeDB2", "perf": 1184.2},
{"m": 32, "n": 13, "k": 25, "tile_m": 1, "tile_n": 3, "threads": 224, "grouping": 4, "minblocks": 5, "algorithm": "medium", "perf": 1177.19},
{"m": 32, "n": 13, "k": 26, "tile_m": 1, "tile_n": 2, "threads": 224, "grouping": 4, "minblocks": 3, "algorithm": "medium", "perf": 1192.35},
{"m": 32, "n": 13, "k": 28, "tile_m": 1, "tile_n": 2, "threads": 224, "grouping": 4, "minblocks": 2, "algorithm": "medium", "perf": 1204.64},
{"m": 32, "n": 13, "k": 32, "tile_m": 1, "tile_n": 3, "threads": 192, "grouping": 3, "minblocks": 4, "algorithm": "medium", "perf": 1221.29},
{"m": 32, "n": 13, "k": 45, "tile_m": 1, "tile_n": 3, "w": 12, "v": 8, "threads": 160, "grouping": 16, "minblocks": 2, "algorithm": "largeDB2", "perf": 1240.12},
{"m": 32, "n": 14, "k": 13, "tile_m": 1, "tile_n": 5, "threads": 128, "grouping": 4, "minblocks": 9, "algorithm": "medium", "perf": 1143.59},
{"m": 32, "n": 14, "k": 14, "tile_m": 1, "tile_n": 4, "threads": 128, "grouping": 5, "minblocks": 8, "algorithm": "medium", "perf": 1160.77},
{"m": 32, "n": 14, "k": 25, "tile_m": 1, "tile_n": 3, "threads": 224, "grouping": 3, "minblocks": 5, "algorithm": "medium", "perf": 1240.88},
{"m": 32, "n": 14, "k": 26, "tile_m": 1, "tile_n": 2, "threads": 224, "grouping": 4, "minblocks": 5, "algorithm": "medium", "perf": 1258.77},
{"m": 32, "n": 14, "k": 29, "tile_m": 1, "tile_n": 3, "threads": 160, "grouping": 3, "minblocks": 4, "algorithm": "medium", "perf": 1262.69},
{"m": 32, "n": 14, "k": 32, "tile_m": 1, "tile_n": 2, "threads": 224, "grouping": 3, "minblocks": 1, "algorithm": "medium", "perf": 1286.87},
{"m": 32, "n": 16, "k": 5, "tile_m": 1, "tile_n": 6, "threads": 96, "grouping": 32, "minblocks": 10, "algorithm": "medium", "perf": 1010.78},
{"m": 32, "n": 16, "k": 12, "tile_m": 1, "tile_n": 4, "threads": 128, "grouping": 4, "minblocks": 10, "algorithm": "medium", "perf": 1235.03},
{"m": 32, "n": 16, "k": 13, "tile_m": 1, "tile_n": 5, "threads": 128, "grouping": 4, "minblocks": 9, "algorithm": "medium", "perf": 1239.79},
{"m": 32, "n": 16, "k": 16, "tile_m": 1, "tile_n": 4, "threads": 160, "grouping": 5, "minblocks": 7, "algorithm": "medium", "perf": 1289.33},
{"m": 32, "n": 16, "k": 32, "tile_m": 1, "tile_n": 4, "w": 12, "v": 16, "threads": 128, "grouping": 16, "minblocks": 2, "algorithm": "largeDB2", "perf": 1400.34},
{"m": 32, "n": 20, "k": 11, "tile_m": 1, "tile_n": 5, "threads": 128, "grouping": 4, "minblocks": 9, "algorithm": "medium", "perf": 1342.48},
{"m": 32, "n": 20, "k": 12, "tile_m": 1, "tile_n": 5, "threads": 128, "grouping": 4, "minblocks": 8, "algorithm": "medium", "perf": 1367.22},
{"m": 32, "n": 20, "k": 20, "tile_m": 1, "tile_n": 4, "threads": 192, "grouping": 4, "minblocks": 5, "algorithm": "medium", "perf": 1490.8},
{"m": 32, "n": 20, "k": 25, "tile_m": 1, "tile_n": 4, "threads": 160, "grouping": 4, "minblocks": 4, "algorithm": "medium", "perf": 1527.53},
{"m": 32, "n": 20, "k": 32, "tile_m": 1, "tile_n": 3, "threads": 224, "grouping": 3, "minblocks": 1, "algorithm": "medium", "perf": 1575.35},
{"m": 32, "n": 22, "k": 9, "tile_m": 1, "tile_n": 6, "threads": 128, "grouping": 6, "minblocks": 8, "algorithm": "medium", "perf": 1313.03},
{"m": 32, "n": 22, "k": 22, "tile_m": 1, "tile_n": 4, "threads": 192, "grouping": 5, "minblocks": 4, "algorithm": "medium", "perf": 1573.89},
{"m": 32, "n": 22, "k": 32, "tile_m": 1, "tile_n": 3, "threads": 256, "grouping": 32, "minblocks": 2, "algorithm": "medium", "perf": 1639.19},
{"m": 32, "n": 24, "k": 5, "tile_m": 1, "tile_n": 4, "threads": 192, "grouping": 9, "minblocks": 7, "algorithm": "medium", "perf": 1147.88},
{"m": 32, "n": 24, "k": 13, "tile_m": 1, "tile_n": 6, "threads": 160, "grouping": 29, "minblocks": 5, "algorithm": "medium", "perf": 1516.34},
{"m": 32, "n": 24, "k": 24, "tile_m": 1, "tile_n": 6, "threads": 128, "grouping": 3, "minblocks": 4, "algorithm": "medium", "perf": 1673.42},
{"m": 32, "n": 24, "k": 26, "tile_m": 1, "tile_n": 4, "threads": 224, "grouping": 3, "minblocks": 4, "algorithm": "medium", "perf": 1689.58},
{"m": 32, "n": 24, "k": 32, "tile_m": 1, "tile_n": 4, "w": 16, "v": 24, "threads": 192, "grouping": 16, "minblocks": 1, "algorithm": "largeDB2", "perf": 1736.99},
{"m": 32, "n": 25, "k": 4, "tile_m": 1, "tile_n": 5, "threads": 192, "grouping": 12, "minblocks": 7, "algorithm": "medium", "perf": 1051.58},
{"m": 32, "n": 25, "k": 5, "tile_m": 1, "tile_n": 5, "threads": 192, "grouping": 9, "minblocks": 7, "algorithm": "medium", "perf": 1163.15},
{"m": 32, "n": 25, "k": 7, "tile_m": 1, "tile_n": 5, "threads": 256, "grouping": 16, "minblocks": 5, "algorithm": "medium", "perf": 1273.22},
{"m": 32, "n": 25, "k": 9, "tile_m": 1, "tile_n": 5, "threads": 160, "grouping": 6, "minblocks": 7, "algorithm": "medium", "perf": 1389.05},
{"m": 32, "n": 25, "k": 11, "tile_m": 1, "tile_n": 5, "threads": 160, "grouping": 29, "minblocks": 5, "algorithm": "medium", "perf": 1465.98},
{"m": 32, "n": 25, "k": 12, "tile_m": 1, "tile_n": 5, "threads": 160, "grouping": 5, "minblocks": 7, "algorithm": "medium", "perf": 1501.64},
{"m": 32, "n": 25, "k": 13, "tile_m": 1, "tile_n": 5, "threads": 160, "grouping": 4, "minblocks": 7, "algorithm": "medium", "perf": 1543.97},
{"m": 32, "n": 25, "k": 14, "tile_m": 1, "tile_n": 5, "threads": 160, "grouping": 29, "minblocks": 5, "algorithm": "medium", "perf": 1565.97},
{"m": 32, "n": 25, "k": 20, "tile_m": 1, "tile_n": 5, "threads": 224, "grouping": 4, "minblocks": 5, "algorithm": "medium", "perf": 1673.05},
{"m": 32, "n": 25, "k": 25, "tile_m": 1, "tile_n": 5, "threads": 160, "grouping": 3, "minblocks": 4, "algorithm": "medium", "perf": 1683.41},
{"m": 32, "n": 25, "k": 26, "tile_m": 1, "tile_n": 5, "threads": 192, "grouping": 4, "minblocks": 4, "algorithm": "medium", "perf": 1695.86},
{"m": 32, "n": 25, "k": 28, "tile_m": 1, "tile_n": 5, "threads": 224, "grouping": 32, "minblocks": 3, "algorithm": "medium", "perf": 1709.63},
{"m": 32, "n": 25, "k": 32, "tile_m": 1, "tile_n": 5, "threads": 256, "grouping": 32, "minblocks": 3, "algorithm": "medium", "perf": 1751.37},
{"m": 32, "n": 25, "k": 45, "tile_m": 3, "tile_n": 5, "w": 16, "v": 20, "threads": 64, "grouping": 16, "minblocks": 1, "algorithm": "largeDB2", "perf": 1795.15},
{"m": 32, "n": 26, "k": 4, "tile_m": 1, "tile_n": 6, "threads": 160, "grouping": 10, "minblocks": 7, "algorithm": "medium", "perf": 1059.64},
{"m": 32, "n": 26, "k": 5, "tile_m": 1, "tile_n": 6, "threads": 192, "grouping": 24, "minblocks": 6, "algorithm": "medium", "perf": 1158.06},
{"m": 32, "n": 26, "k": 7, "tile_m": 5, "tile_n": 3, "threads": 64, "grouping": 24, "minblocks": 3, "algorithm": "medium", "perf": 1280.12},
{"m": 32, "n": 26, "k": 9, "tile_m": 1, "tile_n": 6, "threads": 160, "grouping": 6, "minblocks": 7, "algorithm": "medium", "perf": 1392.26},
{"m": 32, "n": 26, "k": 12, "tile_m": 5, "tile_n": 3, "threads": 64, "grouping": 24, "minblocks": 1, "algorithm": "medium", "perf": 1502.2},
{"m": 32, "n": 26, "k": 13, "tile_m": 1, "tile_n": 6, "threads": 160, "grouping": 5, "minblocks": 6, "algorithm": "medium", "perf": 1540.86},
{"m": 32, "n": 26, "k": 14, "tile_m": 1, "tile_n": 6, "threads": 160, "grouping": 4, "minblocks": 6, "algorithm": "medium", "perf": 1592.55},
{"m": 32, "n": 26, "k": 24, "tile_m": 5, "tile_n": 3, "w": 12, "v": 26, "threads": 64, "grouping": 16, "minblocks": 1, "algorithm": "largeDB2", "perf": 1704.87},
{"m": 32, "n": 26, "k": 25, "tile_m": 5, "tile_n": 3, "threads": 64, "grouping": 3, "minblocks": 3, "algorithm": "medium", "perf": 1702.43},
{"m": 32, "n": 26, "k": 26, "tile_m": 1, "tile_n": 4, "threads": 224, "grouping": 32, "minblocks": 3, "algorithm": "medium", "perf": 1710.53},
{"m": 32, "n": 26, "k": 28, "tile_m": 2, "tile_n": 5, "w": 14, "v": 24, "threads": 96, "grouping": 16, "minblocks": 4, "algorithm": "largeDB2", "perf": 1736.93},
{"m": 32, "n": 26, "k": 32, "tile_m": 1, "tile_n": 5, "w": 16, "v": 26, "threads": 192, "grouping": 16, "minblocks": 2, "algorithm": "largeDB2", "perf": 1778.77},
{"m": 32, "n": 26, "k": 45, "tile_m": 2, "tile_n": 7, "w": 12, "v": 26, "threads": 64, "grouping": 16, "minblocks": 1, "algorithm": "largeDB2", "perf": 1845.15},
{"m": 32, "n": 28, "k": 4, "tile_m": 1, "tile_n": 6, "threads": 160, "grouping": 29, "minblocks": 5, "algorithm": "medium", "perf": 1093.69},
{"m": 32, "n": 28, "k": 5, "tile_m": 1, "tile_n": 5, "threads": 192, "grouping": 10, "minblocks": 6, "algorithm": "medium", "perf": 1203.06},
{"m": 32, "n": 28, "k": 7, "tile_m": 1, "tile_n": 4, "threads": 256, "grouping": 24, "minblocks": 6, "algorithm": "medium", "perf": 1352.54},
{"m": 32, "n": 28, "k": 9, "tile_m": 1, "tile_n": 6, "threads": 160, "grouping": 6, "minblocks": 6, "algorithm": "medium", "perf": 1453.34},
{"m": 32, "n": 28, "k": 13, "tile_m": 1, "tile_n": 6, "threads": 160, "grouping": 29, "minblocks": 5, "algorithm": "medium", "perf": 1612.39},
{"m": 32, "n": 28, "k": 25, "tile_m": 1, "tile_n": 4, "threads": 224, "grouping": 4, "minblocks": 4, "algorithm": "medium", "perf": 1803.09},
{"m": 32, "n": 28, "k": 26, "tile_m": 1, "tile_n": 4, "threads": 224, "grouping": 32, "minblocks": 3, "algorithm": "medium", "perf": 1791.09},
{"m": 32, "n": 28, "k": 28, "tile_m": 2, "tile_n": 7, "w": 10, "v": 26, "threads": 64, "grouping": 16, "minblocks": 1, "algorithm": "largeDB2", "perf": 1810.27},
{"m": 32, "n": 28, "k": 32, "tile_m": 1, "tile_n": 5, "w": 16, "v": 28, "threads": 192, "grouping": 16, "minblocks": 1, "algorithm": "largeDB2", "perf": 1860.59},
{"m": 32, "n": 28, "k": 45, "tile_m": 2, "tile_n": 7, "w": 12, "v": 8, "threads": 64, "grouping": 16, "minblocks": 1, "algorithm": "largeDB2", "perf": 1916.4},
{"m": 32, "n": 29, "k": 14, "tile_m": 1, "tile_n": 6, "threads": 160, "grouping": 4, "minblocks": 6, "algorithm": "medium", "perf": 1690.58},
{"m": 32, "n": 29, "k": 29, "tile_m": 1, "tile_n": 5, "threads": 192, "grouping": 32, "minblocks": 3, "algorithm": "medium", "perf": 1821.2},
{"m": 32, "n": 29, "k": 32, "tile_m": 1, "tile_n": 5, "threads": 192, "grouping": 32, "minblocks": 2, "algorithm": "medium", "perf": 1879.76},
{"m": 32, "n": 29, "k": 55, "tile_m": 6, "tile_n": 3, "w": 14, "v": 18, "threads": 64, "grouping": 16, "minblocks": 2, "algorithm": "largeDB2", "perf": 1972.82},
{"m": 32, "n": 32, "k": 4, "tile_m": 2, "tile_n": 4, "threads": 128, "grouping": 29, "minblocks": 1, "algorithm": "medium", "perf": 1153.41},
{"m": 32, "n": 32, "k": 5, "tile_m": 1, "tile_n": 6, "threads": 192, "grouping": 29, "minblocks": 5, "algorithm": "medium", "perf": 1275.62},
{"m": 32, "n": 32, "k": 7, "tile_m": 4, "tile_n": 4, "threads": 64, "grouping": 29, "minblocks": 1, "algorithm": "medium", "perf": 1445.13},
{"m": 32, "n": 32, "k": 9, "tile_m": 4, "tile_n": 4, "threads": 64, "grouping": 30, "minblocks": 2, "algorithm": "medium", "perf": 1569.35},
{"m": 32, "n": 32, "k": 10, "tile_m": 1, "tile_n": 6, "threads": 192, "grouping": 29, "minblocks": 5, "algorithm": "medium", "perf": 1639.09},
{"m": 32, "n": 32, "k": 11, "tile_m": 1, "tile_n": 6, "threads": 192, "grouping": 29, "minblocks": 5, "algorithm": "medium", "perf": 1658.37},
{"m": 32, "n": 32, "k": 12, "tile_m": 1, "tile_n": 6, "threads": 192, "grouping": 29, "minblocks": 5, "algorithm": "medium", "perf": 1716.9},
{"m": 32, "n": 32, "k": 13, "tile_m": 1, "tile_n": 6, "threads": 192, "grouping": 5, "minblocks": 5, "algorithm": "medium", "perf": 1747.15},
{"m": 32, "n": 32, "k": 14, "tile_m": 1, "tile_n": 6, "threads": 192, "grouping": 5, "minblocks": 5, "algorithm": "medium", "perf": 1782.16},
{"m": 32, "n": 32, "k": 16, "tile_m": 1, "tile_n": 6, "threads": 192, "grouping": 4, "minblocks": 5, "algorithm": "medium", "perf": 1837.55},
{"m": 32, "n": 32, "k": 20, "tile_m": 1, "tile_n": 4, "threads": 256, "grouping": 5, "minblocks": 4, "algorithm": "medium", "perf": 1879.26},
{"m": 32, "n": 32, "k": 22, "tile_m": 1, "tile_n": 4, "threads": 256, "grouping": 4, "minblocks": 4, "algorithm": "medium", "perf": 1920.38},
{"m": 32, "n": 32, "k": 24, "tile_m": 4, "tile_n": 4, "threads": 64, "grouping": 3, "minblocks": 3, "algorithm": "medium", "perf": 1928.13},
{"m": 32, "n": 32, "k": 25, "tile_m": 1, "tile_n": 4, "threads": 256, "grouping": 32, "minblocks": 3, "algorithm": "medium", "perf": 1922.43},
{"m": 32, "n": 32, "k": 26, "tile_m": 1, "tile_n": 4, "threads": 256, "grouping": 32, "minblocks": 3, "algorithm": "medium", "perf": 1932.91},
{"m": 32, "n": 32, "k": 28, "tile_m": 4, "tile_n": 4, "threads": 64, "grouping": 3, "minblocks": 1, "algorithm": "medium", "perf": 1945.61},
{"m": 32, "n": 32, "k": 29, "tile_m": 1, "tile_n": 4, "threads": 256, "grouping": 3, "minblocks": 3, "algorithm": "medium", "perf": 1953.05},
{"m": 32, "n": 32, "k": 32, "tile_m": 4, "tile_n": 4, "w": 8, "v": 32, "threads": 64, "grouping": 16, "minblocks": 2, "algorithm": "largeDB2", "perf": 1988.65},
{"m": 32, "n": 32, "k": 45, "tile_m": 2, "tile_n": 8, "w": 10, "v": 16, "threads": 64, "grouping": 16, "minblocks": 1, "algorithm": "largeDB2", "perf": 2049.85},
{"m": 32, "n": 32, "k": 55, "tile_m": 2, "tile_n": 8, "w": 10, "v": 32, "threads": 64, "grouping": 16, "minblocks": 2, "algorithm": "largeDB2", "perf": 2095.89},
{"m": 32, "n": 45, "k": 4, "tile_m": 2, "tile_n": 6, "threads": 192, "grouping": 32, "minblocks": 1, "algorithm": "medium", "perf": 1189.96},
{"m": 32, "n": 45, "k": 5, "tile_m": 1, "tile_n": 6, "threads": 256, "grouping": 24, "minblocks": 4, "algorithm": "medium", "perf": 1353.3},
{"m": 32, "n": 45, "k": 7, "tile_m": 1, "tile_n": 6, "threads": 256, "grouping": 26, "minblocks": 4, "algorithm": "medium", "perf": 1511.94},
{"m": 32, "n": 45, "k": 9, "tile_m": 4, "tile_n": 4, "threads": 96, "grouping": 32, "minblocks": 2, "algorithm": "medium", "perf": 1646.51},
{"m": 32, "n": 45, "k": 13, "tile_m": 2, "tile_n": 6, "threads": 128, "grouping": 32, "minblocks": 1, "algorithm": "medium", "perf": 1808.85},
{"m": 32, "n": 45, "k": 25, "tile_m": 5, "tile_n": 5, "w": 8, "v": 40, "threads": 64, "grouping": 16, "minblocks": 4, "algorithm": "largeDB2", "perf": 2094.65},
{"m": 32, "n": 45, "k": 26, "tile_m": 5, "tile_n": 5, "w": 6, "v": 24, "threads": 64, "grouping": 16, "minblocks": 4, "algorithm": "largeDB2", "perf": 2121.03},
{"m": 32, "n": 45, "k": 28, "tile_m": 5, "tile_n": 5, "w": 8, "v": 34, "threads": 64, "grouping": 16, "minblocks": 1, "algorithm": "largeDB2", "perf": 2167.72},
{"m": 32, "n": 45, "k": 32, "tile_m": 5, "tile_n": 5, "w": 8, "v": 30, "threads": 64, "grouping": 16, "minblocks": 4, "algorithm": "largeDB2", "perf": 2242.67},
{"m": 32, "n": 45, "k": 45, "tile_m": 5, "tile_n": 5, "w": 8, "v": 16, "threads": 64, "grouping": 16, "minblocks": 4, "algorithm": "largeDB2", "perf": 2335},
{"m": 32, "n": 55, "k": 29, "tile_m": 4, "tile_n": 7, "w": 14, "v": 36, "threads": 64, "grouping": 16, "minblocks": 2, "algorithm": "largeDB2", "perf": 2308.45},
{"m": 32, "n": 55, "k": 32, "tile_m": 4, "tile_n": 7, "w": 8, "v": 38, "threads": 64, "grouping": 16, "minblocks": 1, "algorithm": "largeDB2", "perf": 2402.8},
{"m": 32, "n": 55, "k": 55, "tile_m": 6, "tile_n": 6, "w": 12, "v": 20, "threads": 64, "grouping": 16, "minblocks": 4, "algorithm": "largeDB2", "perf": 2483.08},
{"m": 45, "n": 4, "k": 4, "tile_m": 6, "tile_n": 1, "threads": 64, "grouping": 19, "minblocks": 16, "algorithm": "medium", "perf": 447.443},
{"m": 45, "n": 4, "k": 5, "tile_m": 6, "tile_n": 1, "threads": 64, "grouping": 25, "minblocks": 16, "algorithm": "medium", "perf": 452.508},
{"m": 45, "n": 4, "k": 7, "tile_m": 3, "tile_n": 1, "threads": 64, "grouping": 24, "minblocks": 2, "algorithm": "medium", "perf": 473.476},
{"m": 45, "n": 4, "k": 9, "tile_m": 1, "tile_n": 4, "threads": 64, "grouping": 29, "minblocks": 6, "algorithm": "medium", "perf": 479.338},
{"m": 45, "n": 4, "k": 13, "tile_m": 1, "tile_n": 2, "threads": 128, "grouping": 6, "minblocks": 4, "algorithm": "medium", "perf": 488.528},
{"m": 45, "n": 4, "k": 25, "tile_m": 1, "tile_n": 2, "threads": 128, "grouping": 3, "minblocks": 2, "algorithm": "medium", "perf": 509.978},
{"m": 45, "n": 4, "k": 26, "tile_m": 1, "tile_n": 2, "threads": 192, "grouping": 3, "minblocks": 1, "algorithm": "medium", "perf": 511.579},
{"m": 45, "n": 4, "k": 28, "tile_m": 1, "tile_n": 2, "threads": 128, "grouping": 3, "minblocks": 2, "algorithm": "medium", "perf": 517.616},
{"m": 45, "n": 4, "k": 32, "tile_m": 1, "tile_n": 2, "threads": 256, "grouping": 3, "minblocks": 3, "algorithm": "medium", "perf": 524.404},
{"m": 45, "n": 4, "k": 45, "tile_m": 1, "tile_n": 2, "threads": 256, "grouping": 3, "minblocks": 1, "algorithm": "medium", "perf": 530.028},
{"m": 45, "n": 5, "k": 4, "tile_m": 1, "tile_n": 6, "threads": 64, "grouping": 26, "minblocks": 10, "algorithm": "medium", "perf": 511.613},
{"m": 45, "n": 5, "k": 5, "tile_m": 1, "tile_n": 5, "threads": 64, "grouping": 26, "minblocks": 10, "algorithm": "medium", "perf": 529.849},
{"m": 45, "n": 5, "k": 7, "tile_m": 1, "tile_n": 5, "threads": 64, "grouping": 32, "minblocks": 7, "algorithm": "medium", "perf": 554.528},
{"m": 45, "n": 5, "k": 9, "tile_m": 1, "tile_n": 5, "threads": 64, "grouping": 26, "minblocks": 11, "algorithm": "medium", "perf": 565.503},
{"m": 45, "n": 5, "k": 13, "tile_m": 1, "tile_n": 3, "threads": 128, "grouping": 4, "minblocks": 9, "algorithm": "medium", "perf": 581.404},
{"m": 45, "n": 5, "k": 25, "tile_m": 1, "tile_n": 3, "threads": 192, "grouping": 3, "minblocks": 2, "algorithm": "medium", "perf": 614.32},
{"m": 45, "n": 5, "k": 26, "tile_m": 1, "tile_n": 2, "threads": 192, "grouping": 3, "minblocks": 4, "algorithm": "medium", "perf": 613.164},
{"m": 45, "n": 5, "k": 28, "tile_m": 1, "tile_n": 2, "threads": 256, "grouping": 3, "minblocks": 3, "algorithm": "medium", "perf": 622.314},
{"m": 45, "n": 5, "k": 32, "tile_m": 1, "tile_n": 2, "threads": 256, "grouping": 3, "minblocks": 1, "algorithm": "medium", "perf": 630.744},
{"m": 45, "n": 5, "k": 45, "tile_m": 1, "tile_n": 1, "threads": 256, "grouping": 3, "minblocks": 1, "algorithm": "medium", "perf": 638.115},
{"m": 45, "n": 7, "k": 4, "tile_m": 5, "tile_n": 1, "threads": 64, "grouping": 25, "minblocks": 14, "algorithm": "medium", "perf": 640.697},
{"m": 45, "n": 7, "k": 5, "tile_m": 5, "tile_n": 1, "threads": 64, "grouping": 26, "minblocks": 17, "algorithm": "medium", "perf": 669.324},
{"m": 45, "n": 7, "k": 7, "tile_m": 6, "tile_n": 1, "threads": 64, "grouping": 32, "minblocks": 11, "algorithm": "medium", "perf": 712.064},
{"m": 45, "n": 7, "k": 9, "tile_m": 1, "tile_n": 4, "threads": 96, "grouping": 32, "minblocks": 2, "algorithm": "medium", "perf": 727.757},
{"m": 45, "n": 7, "k": 13, "tile_m": 1, "tile_n": 4, "threads": 128, "grouping": 24, "minblocks": 4, "algorithm": "medium", "perf": 753.039},
{"m": 45, "n": 7, "k": 25, "tile_m": 1, "tile_n": 2, "threads": 192, "grouping": 3, "minblocks": 4, "algorithm": "medium", "perf": 807.2},
{"m": 45, "n": 7, "k": 26, "tile_m": 1, "tile_n": 2, "threads": 192, "grouping": 3, "minblocks": 3, "algorithm": "medium", "perf": 815.315},
{"m": 45, "n": 7, "k": 28, "tile_m": 1, "tile_n": 2, "threads": 256, "grouping": 3, "minblocks": 3, "algorithm": "medium", "perf": 821.715},
{"m": 45, "n": 7, "k": 32, "tile_m": 1, "tile_n": 2, "threads": 256, "grouping": 3, "minblocks": 3, "algorithm": "medium", "perf": 837.239},
{"m": 45, "n": 7, "k": 45, "tile_m": 1, "tile_n": 2, "w": 12, "v": 4, "threads": 192, "grouping": 16, "minblocks": 4, "algorithm": "largeDB2", "perf": 833.545},
{"m": 45, "n": 9, "k": 4, "tile_m": 3, "tile_n": 3, "threads": 64, "grouping": 32, "minblocks": 9, "algorithm": "medium", "perf": 735.448},
{"m": 45, "n": 9, "k": 5, "tile_m": 3, "tile_n": 3, "threads": 64, "grouping": 32, "minblocks": 3, "algorithm": "medium", "perf": 771.229},
{"m": 45, "n": 9, "k": 7, "tile_m": 1, "tile_n": 5, "threads": 96, "grouping": 32, "minblocks": 12, "algorithm": "medium", "perf": 843.763},
{"m": 45, "n": 9, "k": 9, "tile_m": 1, "tile_n": 5, "threads": 96, "grouping": 32, "minblocks": 11, "algorithm": "medium", "perf": 864.971},
{"m": 45, "n": 9, "k": 13, "tile_m": 1, "tile_n": 3, "threads": 160, "grouping": 5, "minblocks": 3, "algorithm": "medium", "perf": 908.669},
{"m": 45, "n": 9, "k": 25, "tile_m": 1, "tile_n": 3, "threads": 256, "grouping": 4, "minblocks": 1, "algorithm": "medium", "perf": 980.24},
{"m": 45, "n": 9, "k": 26, "tile_m": 1, "tile_n": 3, "threads": 256, "grouping": 3, "minblocks": 4, "algorithm": "medium", "perf": 988.361},
{"m": 45, "n": 9, "k": 28, "tile_m": 1, "tile_n": 2, "threads": 256, "grouping": 3, "minblocks": 3, "algorithm": "medium", "perf": 997.761},
{"m": 45, "n": 9, "k": 32, "tile_m": 1, "tile_n": 3, "threads": 160, "grouping": 3, "minblocks": 2, "algorithm": "medium", "perf": 1009.32},
{"m": 45, "n": 9, "k": 45, "tile_m": 1, "tile_n": 3, "threads": 256, "grouping": 3, "minblocks": 1, "algorithm": "medium", "perf": 1014.45},
{"m": 45, "n": 13, "k": 4, "tile_m": 5, "tile_n": 2, "threads": 64, "grouping": 32, "minblocks": 1, "algorithm": "medium", "perf": 885.5},
{"m": 45, "n": 13, "k": 5, "tile_m": 5, "tile_n": 1, "threads": 128, "grouping": 32, "minblocks": 9, "algorithm": "medium", "perf": 912.85},
{"m": 45, "n": 13, "k": 7, "tile_m": 5, "tile_n": 1, "threads": 128, "grouping": 32, "minblocks": 9, "algorithm": "medium", "perf": 1016.11},
{"m": 45, "n": 13, "k": 9, "tile_m": 5, "tile_n": 1, "threads": 128, "grouping": 32, "minblocks": 9, "algorithm": "medium", "perf": 1076.14},
{"m": 45, "n": 13, "k": 13, "tile_m": 1, "tile_n": 5, "threads": 192, "grouping": 5, "minblocks": 6, "algorithm": "medium", "perf": 1153.04},
{"m": 45, "n": 13, "k": 25, "tile_m": 3, "tile_n": 4, "w": 8, "v": 10, "threads": 64, "grouping": 16, "minblocks": 8, "algorithm": "largeDB2", "perf": 1237.7},
{"m": 45, "n": 13, "k": 26, "tile_m": 3, "tile_n": 4, "w": 8, "v": 12, "threads": 64, "grouping": 16, "minblocks": 4, "algorithm": "largeDB2", "perf": 1247.69},
{"m": 45, "n": 13, "k": 28, "tile_m": 5, "tile_n": 2, "w": 14, "v": 12, "threads": 64, "grouping": 16, "minblocks": 2, "algorithm": "largeDB2", "perf": 1268.39},
{"m": 45, "n": 13, "k": 32, "tile_m": 5, "tile_n": 2, "w": 12, "v": 10, "threads": 64, "grouping": 16, "minblocks": 2, "algorithm": "largeDB2", "perf": 1290.64},
{"m": 45, "n": 13, "k": 45, "tile_m": 5, "tile_n": 2, "w": 12, "v": 12, "threads": 64, "grouping": 16, "minblocks": 1, "algorithm": "largeDB2", "perf": 1334.66},
{"m": 45, "n": 25, "k": 4, "tile_m": 3, "tile_n": 5, "threads": 96, "grouping": 29, "minblocks": 4, "algorithm": "medium", "perf": 1027.95},
{"m": 45, "n": 25, "k": 5, "tile_m": 5, "tile_n": 2, "threads": 128, "grouping": 24, "minblocks": 4, "algorithm": "medium", "perf": 1152.55},
{"m": 45, "n": 25, "k": 7, "tile_m": 5, "tile_n": 3, "threads": 96, "grouping": 24, "minblocks": 1, "algorithm": "medium", "perf": 1310.14},
{"m": 45, "n": 25, "k": 9, "tile_m": 5, "tile_n": 2, "threads": 128, "grouping": 32, "minblocks": 3, "algorithm": "medium", "perf": 1429.19},
{"m": 45, "n": 25, "k": 13, "tile_m": 3, "tile_n": 5, "threads": 96, "grouping": 24, "minblocks": 4, "algorithm": "medium", "perf": 1595.31},
{"m": 45, "n": 25, "k": 25, "tile_m": 3, "tile_n": 7, "w": 10, "v": 14, "threads": 64, "grouping": 16, "minblocks": 2, "algorithm": "largeDB2", "perf": 1830.75},
{"m": 45, "n": 25, "k": 26, "tile_m": 5, "tile_n": 4, "w": 10, "v": 12, "threads": 64, "grouping": 16, "minblocks": 2, "algorithm": "largeDB2", "perf": 1854.31},
{"m": 45, "n": 25, "k": 28, "tile_m": 5, "tile_n": 4, "w": 12, "v": 22, "threads": 64, "grouping": 16, "minblocks": 4, "algorithm": "largeDB2", "perf": 1879.95},
{"m": 45, "n": 25, "k": 32, "tile_m": 5, "tile_n": 4, "w": 8, "v": 12, "threads": 64, "grouping": 16, "minblocks": 4, "algorithm": "largeDB2", "perf": 1929.59},
{"m": 45, "n": 25, "k": 45, "tile_m": 5, "tile_n": 4, "w": 12, "v": 16, "threads": 64, "grouping": 16, "minblocks": 2, "algorithm": "largeDB2", "perf": 2025.82},
{"m": 45, "n": 26, "k": 4, "tile_m": 3, "tile_n": 5, "threads": 96, "grouping": 29, "minblocks": 4, "algorithm": "medium", "perf": 1069.89},
{"m": 45, "n": 26, "k": 5, "tile_m": 3, "tile_n": 3, "threads": 160, "grouping": 24, "minblocks": 4, "algorithm": "medium", "perf": 1144.5},
{"m": 45, "n": 26, "k": 7, "tile_m": 3, "tile_n": 5, "threads": 96, "grouping": 24, "minblocks": 4, "algorithm": "medium", "perf": 1348.87},
{"m": 45, "n": 26, "k": 9, "tile_m": 5, "tile_n": 2, "threads": 128, "grouping": 32, "minblocks": 2, "algorithm": "medium", "perf": 1480.85},
{"m": 45, "n": 26, "k": 13, "tile_m": 3, "tile_n": 5, "threads": 96, "grouping": 24, "minblocks": 3, "algorithm": "medium", "perf": 1643.06},
{"m": 45, "n": 26, "k": 25, "tile_m": 5, "tile_n": 4, "w": 12, "v": 26, "threads": 64, "grouping": 16, "minblocks": 1, "algorithm": "largeDB2", "perf": 1877.75},
{"m": 45, "n": 26, "k": 26, "tile_m": 5, "tile_n": 4, "w": 12, "v": 26, "threads": 64, "grouping": 16, "minblocks": 4, "algorithm": "largeDB2", "perf": 1901.17},
{"m": 45, "n": 26, "k": 28, "tile_m": 3, "tile_n": 7, "w": 8, "v": 16, "threads": 64, "grouping": 16, "minblocks": 1, "algorithm": "largeDB2", "perf": 1935.75},
{"m": 45, "n": 26, "k": 32, "tile_m": 5, "tile_n": 4, "w": 8, "v": 26, "threads": 64, "grouping": 16, "minblocks": 2, "algorithm": "largeDB2", "perf": 1991.83},
{"m": 45, "n": 26, "k": 45, "tile_m": 5, "tile_n": 4, "w": 12, "v": 26, "threads": 64, "grouping": 16, "minblocks": 1, "algorithm": "largeDB2", "perf": 2075.74},
{"m": 45, "n": 28, "k": 4, "tile_m": 3, "tile_n": 5, "threads": 96, "grouping": 29, "minblocks": 3, "algorithm": "medium", "perf": 1161.39},
{"m": 45, "n": 28, "k": 5, "tile_m": 5, "tile_n": 2, "threads": 128, "grouping": 24, "minblocks": 4, "algorithm": "medium", "perf": 1229.89},
{"m": 45, "n": 28, "k": 7, "tile_m": 3, "tile_n": 5, "threads": 96, "grouping": 24, "minblocks": 4, "algorithm": "medium", "perf": 1432.27},
{"m": 45, "n": 28, "k": 9, "tile_m": 5, "tile_n": 2, "threads": 128, "grouping": 32, "minblocks": 2, "algorithm": "medium", "perf": 1563.84},
{"m": 45, "n": 28, "k": 13, "tile_m": 3, "tile_n": 5, "threads": 96, "grouping": 24, "minblocks": 4, "algorithm": "medium", "perf": 1719.62},
{"m": 45, "n": 28, "k": 25, "tile_m": 5, "tile_n": 4, "w": 12, "v": 20, "threads": 64, "grouping": 16, "minblocks": 4, "algorithm": "largeDB2", "perf": 1977.98},
{"m": 45, "n": 28, "k": 26, "tile_m": 5, "tile_n": 4, "w": 12, "v": 28, "threads": 64, "grouping": 16, "minblocks": 1, "algorithm": "largeDB2", "perf": 1994.7},
{"m": 45, "n": 28, "k": 28, "tile_m": 3, "tile_n": 7, "w": 14, "v": 28, "threads": 64, "grouping": 16, "minblocks": 2, "algorithm": "largeDB2", "perf": 2029.85},
{"m": 45, "n": 28, "k": 32, "tile_m": 5, "tile_n": 4, "w": 8, "v": 28, "threads": 64, "grouping": 16, "minblocks": 2, "algorithm": "largeDB2", "perf": 2089.27},
{"m": 45, "n": 28, "k": 45, "tile_m": 3, "tile_n": 7, "w": 8, "v": 16, "threads": 64, "grouping": 16, "minblocks": 2, "algorithm": "largeDB2", "perf": 2179.89},
{"m": 45, "n": 32, "k": 4, "tile_m": 6, "tile_n": 2, "threads": 192, "grouping": 32, "minblocks": 2, "algorithm": "medium", "perf": 1191.44},
{"m": 45, "n": 32, "k": 5, "tile_m": 3, "tile_n": 4, "threads": 128, "grouping": 25, "minblocks": 2, "algorithm": "medium", "perf": 1315.4},
{"m": 45, "n": 32, "k": 7, "tile_m": 3, "tile_n": 4, "threads": 128, "grouping": 32, "minblocks": 1, "algorithm": "medium", "perf": 1521.68},
{"m": 45, "n": 32, "k": 9, "tile_m": 3, "tile_n": 4, "threads": 128, "grouping": 32, "minblocks": 1, "algorithm": "medium", "perf": 1691.63},
{"m": 45, "n": 32, "k": 13, "tile_m": 3, "tile_n": 4, "threads": 128, "grouping": 32, "minblocks": 1, "algorithm": "medium", "perf": 1848.13},
{"m": 45, "n": 32, "k": 25, "tile_m": 3, "tile_n": 4, "threads": 128, "grouping": 32, "minblocks": 1, "algorithm": "medium", "perf": 2107.65},
{"m": 45, "n": 32, "k": 26, "tile_m": 3, "tile_n": 4, "threads": 128, "grouping": 32, "minblocks": 1, "algorithm": "medium", "perf": 2137},
{"m": 45, "n": 32, "k": 28, "tile_m": 6, "tile_n": 4, "w": 8, "v": 8, "threads": 64, "grouping": 16, "minblocks": 1, "algorithm": "largeDB2", "perf": 2172},
{"m": 45, "n": 32, "k": 32, "tile_m": 6, "tile_n": 4, "w": 8, "v": 16, "threads": 64, "grouping": 16, "minblocks": 2, "algorithm": "largeDB2", "perf": 2249.68},
{"m": 45, "n": 32, "k": 45, "tile_m": 6, "tile_n": 4, "w": 8, "v": 16, "threads": 64, "grouping": 16, "minblocks": 2, "algorithm": "largeDB2", "perf": 2341.8},
{"m": 45, "n": 45, "k": 4, "tile_m": 6, "tile_n": 2, "threads": 192, "grouping": 32, "minblocks": 2, "algorithm": "medium", "perf": 1271.92},
{"m": 45, "n": 45, "k": 5, "tile_m": 6, "tile_n": 2, "threads": 256, "grouping": 29, "minblocks": 1, "algorithm": "medium", "perf": 1313.41},
{"m": 45, "n": 45, "k": 7, "tile_m": 3, "tile_n": 4, "threads": 192, "grouping": 29, "minblocks": 1, "algorithm": "medium", "perf": 1559.15},
{"m": 45, "n": 45, "k": 9, "tile_m": 3, "tile_n": 4, "threads": 192, "grouping": 29, "minblocks": 2, "algorithm": "medium", "perf": 1743.9},
{"m": 45, "n": 45, "k": 13, "tile_m": 6, "tile_n": 6, "w": 6, "v": 28, "threads": 64, "grouping": 16, "minblocks": 2, "algorithm": "largeDB2", "perf": 1951.48},
{"m": 45, "n": 45, "k": 25, "tile_m": 6, "tile_n": 6, "w": 12, "v": 26, "threads": 64, "grouping": 16, "minblocks": 2, "algorithm": "largeDB2", "perf": 2366.95},
{"m": 45, "n": 45, "k": 26, "tile_m": 6, "tile_n": 6, "w": 10, "v": 26, "threads": 64, "grouping": 16, "minblocks": 1, "algorithm": "largeDB2", "perf": 2409.7},
{"m": 45, "n": 45, "k": 28, "tile_m": 7, "tile_n": 5, "w": 14, "v": 18, "threads": 64, "grouping": 16, "minblocks": 1, "algorithm": "largeDB2", "perf": 2479.64},
{"m": 45, "n": 45, "k": 32, "tile_m": 7, "tile_n": 5, "w": 12, "v": 22, "threads": 64, "grouping": 16, "minblocks": 4, "algorithm": "largeDB2", "perf": 2550.51},
{"m": 45, "n": 45, "k": 45, "tile_m": 6, "tile_n": 6, "w": 12, "v": 18, "threads": 64, "grouping": 16, "minblocks": 2, "algorithm": "largeDB2", "perf": 2690.9},
{"m": 55, "n": 16, "k": 16, "tile_m": 1, "tile_n": 4, "threads": 256, "grouping": 4, "minblocks": 5, "algorithm": "medium", "perf": 1448.91},
{"m": 55, "n": 16, "k": 29, "tile_m": 2, "tile_n": 8, "w": 8, "v": 8, "threads": 64, "grouping": 16, "minblocks": 8, "algorithm": "largeDB2", "perf": 1544.22},
{"m": 55, "n": 16, "k": 55, "tile_m": 2, "tile_n": 8, "w": 8, "v": 12, "threads": 64, "grouping": 16, "minblocks": 4, "algorithm": "largeDB2", "perf": 1652.51},
{"m": 55, "n": 29, "k": 16, "tile_m": 7, "tile_n": 4, "w": 8, "v": 22, "threads": 64, "grouping": 16, "minblocks": 2, "algorithm": "largeDB2", "perf": 1916.32},
{"m": 55, "n": 29, "k": 29, "tile_m": 3, "tile_n": 6, "w": 10, "v": 18, "threads": 96, "grouping": 16, "minblocks": 4, "algorithm": "largeDB2", "perf": 2161.11},
{"m": 55, "n": 29, "k": 32, "tile_m": 7, "tile_n": 4, "w": 8, "v": 22, "threads": 64, "grouping": 16, "minblocks": 2, "algorithm": "largeDB2", "perf": 2241.72},
{"m": 55, "n": 29, "k": 55, "tile_m": 3, "tile_n": 6, "w": 14, "v": 16, "threads": 96, "grouping": 16, "minblocks": 2, "algorithm": "largeDB2", "perf": 2370.43},
{"m": 55, "n": 32, "k": 29, "tile_m": 7, "tile_n": 4, "w": 14, "v": 20, "threads": 64, "grouping": 16, "minblocks": 1, "algorithm": "largeDB2", "perf": 2315.88},
{"m": 55, "n": 32, "k": 32, "tile_m": 7, "tile_n": 4, "w": 8, "v": 24, "threads": 64, "grouping": 16, "minblocks": 1, "algorithm": "largeDB2", "perf": 2400.75},
{"m": 55, "n": 32, "k": 55, "tile_m": 7, "tile_n": 4, "w": 6, "v": 12, "threads": 64, "grouping": 16, "minblocks": 4, "algorithm": "largeDB2", "perf": 2531.29},
{"m": 55, "n": 55, "k": 16, "tile_m": 7, "tile_n": 4, "w": 8, "v": 32, "threads": 128, "grouping": 16, "minblocks": 1, "algorithm": "largeDB2", "perf": 2371.04},
{"m": 55, "n": 55, "k": 29, "tile_m": 7, "tile_n": 7, "w": 10, "v": 28, "threads": 64, "grouping": 16, "minblocks": 1, "algorithm": "largeDB2", "perf": 2634.65},
{"m": 55, "n": 55, "k": 32, "tile_m": 7, "tile_n": 7, "w": 10, "v": 28, "threads": 64, "grouping": 16, "minblocks": 2, "algorithm": "largeDB2", "perf": 2696.5},
{"m": 55, "n": 55, "k": 55, "tile_m": 7, "tile_n": 7, "w": 10, "v": 24, "threads": 64, "grouping": 16, "minblocks": 1, "algorithm": "largeDB2", "perf": 2934.2},
{"m": 64, "n": 64, "k": 64, "tile_m": 9, "tile_n": 4, "w": 22, "v": 32, "threads": 128, "grouping": 16, "minblocks": 2, "algorithm": "largeDB2", "perf": 3072.53},
{"m": 78, "n": 78, "k": 78, "tile_m": 10, "tile_n": 5, "w": 8, "v": 30, "threads": 128, "grouping": 16, "minblocks": 1, "algorithm": "largeDB1", "perf": 3319.77}
]