src/acc/opencl/smm/params/tune_multiply_PVC.csv
DEVICE;TYPEID;M;N;K;S;GFLOPS;BS;BM;BN;BK;WS;WG;LU;NZ;AL;TB;TC;AP;AA;AB;AC
Intel(R) Data Center GPU Max 1550 [0x0bd5];3;2;2;2;30000;0;4;2;1;1;1;-2;-1;0;1;1;1;0;0;0;0;0
Intel(R) Data Center GPU Max 1550 [0x0bd5];3;3;3;1;30000;0;6;3;1;1;1;-2;0;0;0;0;1;0;0;0;0;0
Intel(R) Data Center GPU Max 1550 [0x0bd5];3;3;3;3;30000;0;5;3;1;2;1;-2;-2;0;1;1;1;0;0;0;0;0
Intel(R) Data Center GPU Max 1550 [0x0bd5];3;4;4;4;30000;0;5;4;1;2;1;-1;-1;0;1;1;1;0;2;0;0;0
Intel(R) Data Center GPU Max 1550 [0x0bd5];3;4;4;5;30000;0;10;4;1;4;1;-2;-1;0;1;0;1;0;0;2;0;0
Intel(R) Data Center GPU Max 1550 [0x0bd5];3;4;4;7;30000;0;10;4;1;2;1;-2;0;0;0;1;1;0;0;2;0;0
Intel(R) Data Center GPU Max 1550 [0x0bd5];3;4;4;9;30000;0;9;4;1;1;1;-2;0;0;1;0;1;0;2;2;0;0
Intel(R) Data Center GPU Max 1550 [0x0bd5];3;4;4;10;30000;0;9;4;1;4;1;-1;-1;0;0;0;1;0;0;2;0;0
Intel(R) Data Center GPU Max 1550 [0x0bd5];3;4;4;13;30000;0;8;4;1;1;1;-2;-1;0;0;1;1;0;2;0;0;0
Intel(R) Data Center GPU Max 1550 [0x0bd5];3;4;4;15;30000;0;8;4;1;1;1;-1;-2;0;1;0;1;0;2;0;0;0
Intel(R) Data Center GPU Max 1550 [0x0bd5];3;4;4;17;30000;0;8;4;1;2;1;-2;5;0;1;0;1;0;0;0;1;0
Intel(R) Data Center GPU Max 1550 [0x0bd5];3;4;4;25;30000;0;8;4;1;1;1;-2;0;0;1;0;1;0;2;0;0;0
Intel(R) Data Center GPU Max 1550 [0x0bd5];3;4;4;26;30000;0;8;4;1;1;1;-1;0;0;1;1;1;0;2;0;0;0
Intel(R) Data Center GPU Max 1550 [0x0bd5];3;4;4;28;30000;0;8;4;1;1;1;-2;-2;0;0;1;1;0;2;0;0;0
Intel(R) Data Center GPU Max 1550 [0x0bd5];3;4;4;32;30000;0;8;4;1;1;1;-1;-1;0;1;0;1;0;2;0;0;0
Intel(R) Data Center GPU Max 1550 [0x0bd5];3;4;4;45;30000;0;8;4;1;1;4;-1;-2;0;1;1;1;0;0;0;0;0
Intel(R) Data Center GPU Max 1550 [0x0bd5];3;4;5;4;30000;0;10;4;1;3;1;-2;-1;0;0;1;1;0;0;1;0;0
Intel(R) Data Center GPU Max 1550 [0x0bd5];3;4;5;5;30000;0;11;4;1;2;1;-2;4;0;0;0;1;0;2;0;0;0
Intel(R) Data Center GPU Max 1550 [0x0bd5];3;4;5;7;30000;0;11;4;1;2;1;-2;0;0;0;1;1;0;2;2;0;0
Intel(R) Data Center GPU Max 1550 [0x0bd5];3;4;5;9;30000;0;9;4;1;4;1;-2;-1;0;0;0;1;0;2;2;0;0
Intel(R) Data Center GPU Max 1550 [0x0bd5];3;4;5;13;30000;0;8;4;1;1;1;-1;-1;0;0;0;1;0;2;2;0;0
Intel(R) Data Center GPU Max 1550 [0x0bd5];3;4;5;17;30000;0;8;4;1;1;1;-2;0;1;1;1;1;0;2;0;0;0
Intel(R) Data Center GPU Max 1550 [0x0bd5];3;4;5;25;30000;0;8;4;1;1;1;-1;-1;0;1;1;1;0;2;0;0;0
Intel(R) Data Center GPU Max 1550 [0x0bd5];3;4;5;26;30000;0;8;4;1;1;5;-1;0;0;0;0;1;0;2;0;0;0
Intel(R) Data Center GPU Max 1550 [0x0bd5];3;4;5;28;30000;0;8;4;1;1;5;0;-1;0;1;0;1;1;0;2;0;0
Intel(R) Data Center GPU Max 1550 [0x0bd5];3;4;5;32;30000;0;8;4;1;1;1;0;-2;0;0;0;1;1;2;2;0;0
Intel(R) Data Center GPU Max 1550 [0x0bd5];3;4;5;45;30000;0;8;4;1;1;5;-1;-1;0;1;1;1;0;2;0;0;0
Intel(R) Data Center GPU Max 1550 [0x0bd5];3;4;7;4;30000;0;11;4;1;4;1;-2;-1;0;0;0;1;1;0;2;0;0
Intel(R) Data Center GPU Max 1550 [0x0bd5];3;4;7;5;30000;0;11;4;1;4;1;-2;0;1;0;0;1;1;2;0;0;0
Intel(R) Data Center GPU Max 1550 [0x0bd5];3;4;7;7;30000;0;12;4;1;2;1;-2;0;0;1;1;1;0;0;2;0;0
Intel(R) Data Center GPU Max 1550 [0x0bd5];3;4;7;9;30000;0;9;4;1;1;1;-1;0;1;1;0;1;1;2;2;0;0
Intel(R) Data Center GPU Max 1550 [0x0bd5];3;4;7;13;30000;0;8;4;1;1;1;-1;-2;0;1;0;1;1;0;2;0;0
Intel(R) Data Center GPU Max 1550 [0x0bd5];3;4;7;25;30000;0;8;4;1;1;7;-2;0;0;0;0;1;1;2;0;0;0
Intel(R) Data Center GPU Max 1550 [0x0bd5];3;4;7;26;30000;0;8;4;1;1;7;-1;0;0;0;1;1;1;2;0;0;0
Intel(R) Data Center GPU Max 1550 [0x0bd5];3;4;7;28;30000;0;8;4;1;1;7;-1;-2;0;0;0;1;1;0;2;0;0
Intel(R) Data Center GPU Max 1550 [0x0bd5];3;4;7;32;30000;0;8;4;1;1;7;-1;-1;0;0;1;1;1;0;0;0;0
Intel(R) Data Center GPU Max 1550 [0x0bd5];3;4;7;45;30000;0;8;4;1;1;7;-2;-2;0;1;1;1;1;0;0;1;0
Intel(R) Data Center GPU Max 1550 [0x0bd5];3;4;9;4;30000;0;16;4;1;2;1;1;0;0;0;0;1;1;2;0;0;0
Intel(R) Data Center GPU Max 1550 [0x0bd5];3;4;9;5;30000;0;14;4;1;2;1;-1;-1;0;1;1;1;1;2;0;0;0
Intel(R) Data Center GPU Max 1550 [0x0bd5];3;4;9;7;30000;0;11;4;1;1;1;-1;-2;0;1;0;1;1;2;2;0;0
Intel(R) Data Center GPU Max 1550 [0x0bd5];3;4;9;9;30000;0;9;4;1;1;1;-2;-2;0;0;0;1;1;0;0;0;0
Intel(R) Data Center GPU Max 1550 [0x0bd5];3;4;9;13;30000;0;8;4;1;1;1;-1;-1;0;0;0;1;1;2;2;0;0
Intel(R) Data Center GPU Max 1550 [0x0bd5];3;4;9;25;30000;0;8;4;1;1;9;-1;0;0;1;0;1;1;0;0;0;0
Intel(R) Data Center GPU Max 1550 [0x0bd5];3;4;9;26;30000;0;8;4;1;1;9;-1;-2;0;0;0;1;1;2;2;0;0
Intel(R) Data Center GPU Max 1550 [0x0bd5];3;4;9;28;30000;0;8;4;1;1;9;-1;-1;0;1;1;1;1;2;0;0;0
Intel(R) Data Center GPU Max 1550 [0x0bd5];3;4;9;32;30000;0;8;4;1;1;9;-1;0;0;0;1;1;1;2;0;0;0
Intel(R) Data Center GPU Max 1550 [0x0bd5];3;4;9;45;30000;0;4;4;1;1;9;-1;-1;0;0;0;1;0;2;0;0;0
Intel(R) Data Center GPU Max 1550 [0x0bd5];3;4;10;4;30000;0;12;4;1;1;1;-1;-1;0;1;0;1;1;0;0;0;0
Intel(R) Data Center GPU Max 1550 [0x0bd5];3;4;10;10;30000;0;9;4;1;1;1;-1;-2;0;0;0;1;1;2;0;0;0
Intel(R) Data Center GPU Max 1550 [0x0bd5];3;4;10;15;30000;0;8;4;1;1;10;-1;-2;0;1;0;1;1;0;2;0;0
Intel(R) Data Center GPU Max 1550 [0x0bd5];3;4;13;4;30000;0;16;4;1;2;1;0;0;0;0;0;1;1;2;0;0;0
Intel(R) Data Center GPU Max 1550 [0x0bd5];3;4;13;5;30000;0;14;4;1;4;1;-1;-2;0;1;0;1;1;0;0;0;0
Intel(R) Data Center GPU Max 1550 [0x0bd5];3;4;13;7;30000;0;11;4;1;2;1;-1;-1;0;1;1;1;1;0;0;0;0
Intel(R) Data Center GPU Max 1550 [0x0bd5];3;4;13;9;30000;0;8;4;1;4;1;-2;-2;0;1;0;1;1;0;2;0;0
Intel(R) Data Center GPU Max 1550 [0x0bd5];3;4;13;13;30000;0;8;4;1;1;1;-1;-2;0;1;1;1;1;2;0;0;0
Intel(R) Data Center GPU Max 1550 [0x0bd5];3;4;13;17;30000;0;8;4;1;1;1;-1;-2;1;0;0;1;1;0;2;0;0
Intel(R) Data Center GPU Max 1550 [0x0bd5];3;4;13;25;30000;0;8;4;1;1;13;-1;0;0;0;0;1;1;2;2;0;0
Intel(R) Data Center GPU Max 1550 [0x0bd5];3;4;13;26;30000;0;8;4;1;1;13;-2;-1;0;0;0;1;1;2;2;0;0
Intel(R) Data Center GPU Max 1550 [0x0bd5];3;4;13;28;30000;0;8;4;1;2;13;-2;1;0;1;0;1;1;2;2;1;0
Intel(R) Data Center GPU Max 1550 [0x0bd5];3;4;13;32;30000;0;8;4;1;1;1;-2;0;0;1;0;1;1;0;0;0;0
Intel(R) Data Center GPU Max 1550 [0x0bd5];3;4;13;45;30000;0;4;4;1;1;13;-1;0;0;1;0;1;1;0;0;0;0
Intel(R) Data Center GPU Max 1550 [0x0bd5];3;4;15;4;30000;0;16;4;1;1;1;-2;-2;0;0;0;1;1;2;0;0;0
Intel(R) Data Center GPU Max 1550 [0x0bd5];3;4;15;10;30000;0;8;4;1;1;15;-1;0;0;1;1;1;1;2;0;0;0
Intel(R) Data Center GPU Max 1550 [0x0bd5];3;4;15;15;30000;0;8;4;1;1;15;-1;-1;0;0;0;1;1;0;2;0;0
Intel(R) Data Center GPU Max 1550 [0x0bd5];3;4;17;4;30000;0;17;4;1;2;1;1;-2;0;0;0;1;1;2;0;0;0
Intel(R) Data Center GPU Max 1550 [0x0bd5];3;4;17;5;30000;0;14;4;1;3;1;1;-1;0;0;0;1;1;0;2;0;0
Intel(R) Data Center GPU Max 1550 [0x0bd5];3;4;17;13;30000;0;8;4;1;2;1;1;5;0;0;0;1;1;2;0;0;0
Intel(R) Data Center GPU Max 1550 [0x0bd5];3;4;17;17;30000;0;8;4;1;1;1;-1;-2;0;0;0;1;0;2;2;0;0
Intel(R) Data Center GPU Max 1550 [0x0bd5];3;4;17;32;30000;0;8;4;1;1;1;1;0;0;0;0;1;1;0;0;0;0
Intel(R) Data Center GPU Max 1550 [0x0bd5];3;4;25;4;30000;0;17;4;1;3;1;-2;-1;0;1;0;1;1;2;2;0;0
Intel(R) Data Center GPU Max 1550 [0x0bd5];3;4;25;5;30000;0;14;4;1;4;1;0;0;0;0;1;1;1;2;0;0;0
Intel(R) Data Center GPU Max 1550 [0x0bd5];3;4;25;7;30000;0;8;4;1;3;25;-1;-2;0;0;0;1;1;0;2;0;0
Intel(R) Data Center GPU Max 1550 [0x0bd5];3;4;25;9;30000;0;8;4;1;1;25;-2;0;1;0;0;1;1;0;0;0;0
Intel(R) Data Center GPU Max 1550 [0x0bd5];3;4;25;13;30000;0;9;4;1;1;25;-1;0;0;1;1;1;1;2;0;0;0
Intel(R) Data Center GPU Max 1550 [0x0bd5];3;4;25;25;30000;0;8;4;1;1;25;-2;0;0;1;0;1;1;2;0;0;0
Intel(R) Data Center GPU Max 1550 [0x0bd5];3;4;25;26;30000;0;8;4;1;1;25;-2;0;0;0;0;1;1;0;0;0;0
Intel(R) Data Center GPU Max 1550 [0x0bd5];3;4;25;28;30000;0;8;4;1;1;25;-1;0;0;1;0;1;0;2;0;0;0
Intel(R) Data Center GPU Max 1550 [0x0bd5];3;4;25;32;30000;0;8;4;1;1;25;1;-2;0;0;1;1;1;0;0;0;0
Intel(R) Data Center GPU Max 1550 [0x0bd5];3;4;25;45;30000;0;8;4;1;1;25;-1;0;0;0;0;1;1;0;0;0;0
Intel(R) Data Center GPU Max 1550 [0x0bd5];3;4;26;4;30000;0;17;4;1;4;1;-2;0;1;1;0;1;1;0;2;0;0
Intel(R) Data Center GPU Max 1550 [0x0bd5];3;4;26;5;30000;0;14;4;1;2;26;-1;3;0;0;0;1;1;0;2;0;0
Intel(R) Data Center GPU Max 1550 [0x0bd5];3;4;26;7;30000;0;8;4;1;3;26;-1;-1;1;1;0;1;1;0;0;0;0
Intel(R) Data Center GPU Max 1550 [0x0bd5];3;4;26;9;30000;0;8;4;1;1;26;0;-2;1;0;1;1;1;2;0;0;0
Intel(R) Data Center GPU Max 1550 [0x0bd5];3;4;26;13;30000;0;8;4;1;1;26;1;0;0;1;0;1;1;0;2;0;0
Intel(R) Data Center GPU Max 1550 [0x0bd5];3;4;26;25;30000;0;8;4;1;1;26;-2;4;0;0;0;1;0;0;0;0;0
Intel(R) Data Center GPU Max 1550 [0x0bd5];3;4;26;26;30000;0;8;4;1;1;26;-2;-1;0;0;0;1;1;2;0;0;0
Intel(R) Data Center GPU Max 1550 [0x0bd5];3;4;26;28;30000;0;8;4;1;1;26;0;-2;1;0;0;1;1;0;0;0;0
Intel(R) Data Center GPU Max 1550 [0x0bd5];3;4;26;32;30000;0;8;4;1;1;26;-2;-1;1;0;0;1;1;2;0;0;0
Intel(R) Data Center GPU Max 1550 [0x0bd5];3;4;26;45;30000;0;8;4;1;1;26;0;0;0;1;1;1;1;2;0;0;0
Intel(R) Data Center GPU Max 1550 [0x0bd5];3;4;28;4;30000;0;17;4;1;2;1;-2;-1;1;0;1;1;1;2;0;0;0
Intel(R) Data Center GPU Max 1550 [0x0bd5];3;4;28;5;30000;0;17;4;1;4;28;-1;-2;0;0;0;1;1;0;2;0;0
Intel(R) Data Center GPU Max 1550 [0x0bd5];3;4;28;7;30000;0;8;4;1;3;28;-1;-2;0;1;0;1;1;2;2;0;0
Intel(R) Data Center GPU Max 1550 [0x0bd5];3;4;28;9;30000;0;8;4;1;1;28;-1;0;0;0;0;1;1;0;2;0;0
Intel(R) Data Center GPU Max 1550 [0x0bd5];3;4;28;13;30000;0;8;4;1;1;28;0;-2;1;0;0;1;1;2;2;0;0
Intel(R) Data Center GPU Max 1550 [0x0bd5];3;4;28;25;30000;0;8;4;1;1;28;0;0;0;0;1;1;1;2;0;0;0
Intel(R) Data Center GPU Max 1550 [0x0bd5];3;4;28;26;30000;0;8;4;1;1;28;0;-1;1;0;0;1;0;2;0;0;0
Intel(R) Data Center GPU Max 1550 [0x0bd5];3;4;28;28;30000;0;8;4;1;1;28;0;-2;1;1;0;1;1;0;2;0;0
Intel(R) Data Center GPU Max 1550 [0x0bd5];3;4;28;32;30000;0;8;4;1;1;28;1;-2;1;1;1;1;1;0;0;0;0
Intel(R) Data Center GPU Max 1550 [0x0bd5];3;4;28;45;30000;0;8;4;1;1;28;0;-1;0;0;0;1;0;2;0;0;0
Intel(R) Data Center GPU Max 1550 [0x0bd5];3;4;32;4;30000;0;20;4;1;2;1;0;-1;1;0;0;1;1;0;0;0;0
Intel(R) Data Center GPU Max 1550 [0x0bd5];3;4;32;5;30000;0;22;4;1;1;1;0;-1;1;1;0;1;1;2;0;0;0
Intel(R) Data Center GPU Max 1550 [0x0bd5];3;4;32;7;30000;0;21;4;1;4;32;-1;0;1;1;0;1;1;2;2;0;0
Intel(R) Data Center GPU Max 1550 [0x0bd5];3;4;32;9;30000;0;8;4;1;1;32;1;-1;1;1;0;1;1;0;0;0;0
Intel(R) Data Center GPU Max 1550 [0x0bd5];3;4;32;13;30000;0;8;4;1;1;1;-1;0;1;1;0;1;0;2;0;0;0
Intel(R) Data Center GPU Max 1550 [0x0bd5];3;4;32;17;30000;0;8;4;1;1;1;-2;0;0;1;1;1;1;0;2;0;0
Intel(R) Data Center GPU Max 1550 [0x0bd5];3;4;32;25;30000;0;8;4;1;1;32;1;-1;0;0;0;1;0;0;0;0;0
Intel(R) Data Center GPU Max 1550 [0x0bd5];3;4;32;26;30000;0;8;4;1;1;32;1;0;0;0;0;1;0;0;0;0;0
Intel(R) Data Center GPU Max 1550 [0x0bd5];3;4;32;28;30000;0;8;4;1;1;32;0;-2;0;0;0;1;0;0;0;0;0
Intel(R) Data Center GPU Max 1550 [0x0bd5];3;4;32;32;30000;0;8;4;1;1;1;0;0;0;0;0;1;0;0;0;0;0
Intel(R) Data Center GPU Max 1550 [0x0bd5];3;4;32;45;30000;0;4;4;1;1;32;-1;-2;0;0;0;1;0;0;0;0;0
Intel(R) Data Center GPU Max 1550 [0x0bd5];3;4;45;4;30000;0;15;4;1;2;45;-1;-2;1;1;0;1;1;0;2;0;0
Intel(R) Data Center GPU Max 1550 [0x0bd5];3;4;45;5;30000;0;15;4;1;4;45;-2;-2;0;0;1;1;0;2;0;0;0
Intel(R) Data Center GPU Max 1550 [0x0bd5];3;4;45;7;30000;0;10;4;1;2;45;0;3;0;1;0;1;0;0;0;0;0
Intel(R) Data Center GPU Max 1550 [0x0bd5];3;4;45;9;30000;0;15;4;1;2;45;1;-1;0;1;0;1;1;2;2;0;0
Intel(R) Data Center GPU Max 1550 [0x0bd5];3;4;45;13;30000;0;6;4;1;1;45;1;-1;0;0;0;1;0;0;2;0;0
Intel(R) Data Center GPU Max 1550 [0x0bd5];3;4;45;25;30000;0;4;4;1;1;45;-1;6;0;0;0;1;0;0;0;0;0
Intel(R) Data Center GPU Max 1550 [0x0bd5];3;4;45;26;30000;0;4;4;1;1;45;-2;0;0;0;0;1;0;2;0;0;0
Intel(R) Data Center GPU Max 1550 [0x0bd5];3;4;45;28;30000;0;4;4;1;1;45;0;0;0;0;0;1;0;0;0;0;0
Intel(R) Data Center GPU Max 1550 [0x0bd5];3;4;45;32;30000;0;4;4;1;1;45;-1;5;0;0;0;1;0;0;0;0;0
Intel(R) Data Center GPU Max 1550 [0x0bd5];3;4;45;45;30000;0;3;4;1;1;45;-2;-1;0;0;0;1;0;0;0;0;0
Intel(R) Data Center GPU Max 1550 [0x0bd5];3;5;4;4;30000;0;12;5;1;1;1;-1;-1;0;0;1;1;0;2;1;0;0
Intel(R) Data Center GPU Max 1550 [0x0bd5];3;5;4;5;30000;0;13;5;1;1;1;-1;-1;0;1;0;1;0;2;2;0;0
Intel(R) Data Center GPU Max 1550 [0x0bd5];3;5;4;7;30000;0;12;5;1;1;1;-1;-2;0;0;1;1;0;2;2;0;0
Intel(R) Data Center GPU Max 1550 [0x0bd5];3;5;4;9;30000;0;11;5;1;1;1;-2;0;0;1;1;1;0;0;0;0;0
Intel(R) Data Center GPU Max 1550 [0x0bd5];3;5;4;13;30000;0;9;5;1;1;1;-2;-1;1;0;0;1;0;2;2;0;0
Intel(R) Data Center GPU Max 1550 [0x0bd5];3;5;4;17;30000;0;8;5;1;1;1;-1;-1;1;0;0;1;0;2;0;0;0
Intel(R) Data Center GPU Max 1550 [0x0bd5];3;5;4;25;30000;0;8;5;1;1;1;-2;0;0;1;0;1;0;0;0;0;0
Intel(R) Data Center GPU Max 1550 [0x0bd5];3;5;4;26;30000;0;8;5;1;1;5;-1;-1;0;1;1;1;0;0;2;0;0
Intel(R) Data Center GPU Max 1550 [0x0bd5];3;5;4;28;30000;0;8;5;1;1;5;-1;-1;0;0;0;1;0;0;2;0;0
Intel(R) Data Center GPU Max 1550 [0x0bd5];3;5;4;32;30000;0;8;5;1;1;1;-2;-2;0;1;1;1;0;0;0;0;0
Intel(R) Data Center GPU Max 1550 [0x0bd5];3;5;4;45;30000;0;8;5;1;1;5;-2;-1;0;1;0;1;0;0;0;0;0
Intel(R) Data Center GPU Max 1550 [0x0bd5];3;5;5;4;30000;0;13;5;1;1;1;-2;-1;0;1;0;1;0;0;0;0;0
Intel(R) Data Center GPU Max 1550 [0x0bd5];3;5;5;5;30000;0;9;5;1;4;1;-2;-2;1;1;1;1;1;2;0;0;0
Intel(R) Data Center GPU Max 1550 [0x0bd5];3;5;5;7;30000;0;11;5;1;2;1;0;3;0;0;0;1;0;2;0;0;0
Intel(R) Data Center GPU Max 1550 [0x0bd5];3;5;5;9;30000;0;11;5;1;1;1;-2;6;0;1;0;1;1;0;2;0;0
Intel(R) Data Center GPU Max 1550 [0x0bd5];3;5;5;13;30000;0;8;5;1;1;1;-2;-1;0;0;0;1;0;0;0;0;0
Intel(R) Data Center GPU Max 1550 [0x0bd5];3;5;5;16;30000;0;8;5;1;1;1;-2;-1;0;0;0;1;0;0;2;0;0
Intel(R) Data Center GPU Max 1550 [0x0bd5];3;5;5;17;30000;0;8;5;1;1;1;-2;-2;1;0;0;1;0;0;0;0;0
Intel(R) Data Center GPU Max 1550 [0x0bd5];3;5;5;24;30000;0;8;5;1;1;1;-1;-1;0;0;0;1;0;0;0;0;0
Intel(R) Data Center GPU Max 1550 [0x0bd5];3;5;5;26;30000;0;8;5;1;1;1;-1;-2;0;1;0;1;0;0;2;0;0
Intel(R) Data Center GPU Max 1550 [0x0bd5];3;5;5;28;30000;0;8;5;1;1;5;-1;-2;0;0;0;1;0;0;0;0;0
Intel(R) Data Center GPU Max 1550 [0x0bd5];3;5;5;32;30000;0;8;5;1;1;1;-2;-2;0;1;0;1;0;0;0;0;0
Intel(R) Data Center GPU Max 1550 [0x0bd5];3;5;7;4;30000;0;13;5;1;1;1;-1;0;0;0;0;1;1;0;0;0;0
Intel(R) Data Center GPU Max 1550 [0x0bd5];3;5;7;5;30000;0;12;5;1;1;1;-1;-1;0;0;1;1;0;0;0;0;0
Intel(R) Data Center GPU Max 1550 [0x0bd5];3;5;7;7;30000;0;11;5;1;1;1;-1;0;0;1;1;1;0;0;2;0;0
Intel(R) Data Center GPU Max 1550 [0x0bd5];3;5;7;9;30000;0;11;5;1;1;1;-2;-2;0;0;0;1;0;0;2;0;0
Intel(R) Data Center GPU Max 1550 [0x0bd5];3;5;7;13;30000;0;8;5;1;1;1;-2;-2;0;1;0;1;1;0;2;0;0
Intel(R) Data Center GPU Max 1550 [0x0bd5];3;5;9;4;30000;0;17;5;1;4;1;-1;0;1;0;0;1;1;2;2;0;0
Intel(R) Data Center GPU Max 1550 [0x0bd5];3;5;9;5;30000;0;16;5;1;1;1;-1;-2;0;0;1;1;1;0;0;0;0
Intel(R) Data Center GPU Max 1550 [0x0bd5];3;5;9;7;30000;0;12;5;1;1;1;1;-1;0;0;1;1;1;2;2;0;0
Intel(R) Data Center GPU Max 1550 [0x0bd5];3;5;9;9;30000;0;11;5;1;1;1;-1;-1;0;0;1;1;1;2;0;0;0
Intel(R) Data Center GPU Max 1550 [0x0bd5];3;5;13;4;30000;0;16;5;1;1;1;-2;-2;0;0;0;1;1;0;2;0;0
Intel(R) Data Center GPU Max 1550 [0x0bd5];3;5;13;5;30000;0;17;5;1;1;1;-1;-2;1;1;1;1;1;0;0;0;0
Intel(R) Data Center GPU Max 1550 [0x0bd5];3;5;13;7;30000;0;14;5;1;1;1;-1;0;1;1;0;1;1;0;2;0;0
Intel(R) Data Center GPU Max 1550 [0x0bd5];3;5;13;13;30000;0;8;5;1;1;1;-1;-2;1;1;0;1;1;2;2;0;0
Intel(R) Data Center GPU Max 1550 [0x0bd5];3;5;13;16;30000;0;8;5;1;1;1;-2;0;0;0;0;1;0;2;0;0;0
Intel(R) Data Center GPU Max 1550 [0x0bd5];3;5;13;17;30000;0;8;5;1;1;1;-1;-1;1;1;0;1;1;0;0;0;0
Intel(R) Data Center GPU Max 1550 [0x0bd5];3;5;13;24;30000;0;8;5;1;1;1;-2;4;1;1;0;1;1;2;2;0;0
Intel(R) Data Center GPU Max 1550 [0x0bd5];3;5;13;26;30000;0;8;5;1;1;1;-1;3;0;0;0;1;1;0;2;0;0
Intel(R) Data Center GPU Max 1550 [0x0bd5];3;5;13;32;30000;0;8;5;1;1;1;-1;-2;0;0;0;1;1;2;2;0;0
Intel(R) Data Center GPU Max 1550 [0x0bd5];3;5;13;45;30000;0;8;5;1;1;13;-1;0;0;1;1;1;1;0;0;0;0
Intel(R) Data Center GPU Max 1550 [0x0bd5];3;5;14;28;30000;0;8;5;1;1;14;-2;-2;0;0;0;1;1;0;0;0;0
Intel(R) Data Center GPU Max 1550 [0x0bd5];3;5;16;5;30000;0;16;5;1;1;1;-2;-2;0;1;0;1;1;2;0;0;0
Intel(R) Data Center GPU Max 1550 [0x0bd5];3;5;16;13;30000;0;8;5;1;1;1;-2;0;1;1;0;1;0;0;0;0;0
Intel(R) Data Center GPU Max 1550 [0x0bd5];3;5;16;16;30000;0;8;5;1;1;1;-2;-1;1;1;0;1;1;0;0;0;0
Intel(R) Data Center GPU Max 1550 [0x0bd5];3;5;16;24;30000;0;8;5;1;1;1;-2;-2;0;1;0;1;1;0;0;0;0
Intel(R) Data Center GPU Max 1550 [0x0bd5];3;5;16;26;30000;0;8;5;1;1;1;-2;-1;1;0;0;1;1;2;0;0;0
Intel(R) Data Center GPU Max 1550 [0x0bd5];3;5;17;4;30000;0;18;5;1;1;1;1;-1;0;1;0;1;1;2;2;0;0
Intel(R) Data Center GPU Max 1550 [0x0bd5];3;5;17;5;30000;0;17;5;1;1;1;-1;0;0;1;1;1;1;0;0;0;0
Intel(R) Data Center GPU Max 1550 [0x0bd5];3;5;17;13;30000;0;8;5;1;1;1;-2;0;1;0;0;1;1;2;2;0;0
Intel(R) Data Center GPU Max 1550 [0x0bd5];3;5;17;17;30000;0;8;5;1;1;1;-1;-2;0;1;0;1;1;0;0;0;0
Intel(R) Data Center GPU Max 1550 [0x0bd5];3;5;17;32;30000;0;8;5;1;1;1;-1;-2;0;0;1;1;1;2;0;0;0
Intel(R) Data Center GPU Max 1550 [0x0bd5];3;5;24;5;30000;0;22;5;1;1;1;-2;0;0;0;0;1;1;2;0;0;0
Intel(R) Data Center GPU Max 1550 [0x0bd5];3;5;24;13;30000;0;17;5;1;1;1;-1;-2;1;1;0;1;1;2;2;0;0
Intel(R) Data Center GPU Max 1550 [0x0bd5];3;5;24;16;30000;0;17;5;1;1;1;-1;2;1;1;0;1;1;2;0;0;0
Intel(R) Data Center GPU Max 1550 [0x0bd5];3;5;24;24;30000;0;8;5;1;1;24;-1;0;1;1;0;1;0;0;0;0;0
Intel(R) Data Center GPU Max 1550 [0x0bd5];3;5;24;26;30000;0;8;5;1;1;24;-2;0;1;0;0;1;0;0;0;0;0
Intel(R) Data Center GPU Max 1550 [0x0bd5];3;5;24;32;30000;0;8;5;1;1;24;0;-1;0;0;0;1;0;0;0;0;0
Intel(R) Data Center GPU Max 1550 [0x0bd5];3;5;25;4;30000;0;17;5;1;3;1;0;0;0;0;1;1;0;2;0;0;0
Intel(R) Data Center GPU Max 1550 [0x0bd5];3;5;25;5;30000;0;21;5;1;1;25;1;0;1;1;0;1;1;0;2;0;0
Intel(R) Data Center GPU Max 1550 [0x0bd5];3;5;25;7;30000;0;14;5;1;1;25;-2;-1;1;0;1;1;1;0;0;0;0
Intel(R) Data Center GPU Max 1550 [0x0bd5];3;5;25;9;30000;0;8;5;1;1;25;-1;-2;1;0;1;1;1;2;0;0;0
Intel(R) Data Center GPU Max 1550 [0x0bd5];3;5;25;13;30000;0;8;5;1;1;25;0;-1;0;1;0;1;1;0;0;0;0
Intel(R) Data Center GPU Max 1550 [0x0bd5];3;5;25;25;30000;0;8;5;1;1;25;0;-1;1;0;0;1;1;0;0;0;0
Intel(R) Data Center GPU Max 1550 [0x0bd5];3;5;25;26;30000;0;8;5;1;1;25;-2;-2;0;0;0;1;1;2;0;0;0
Intel(R) Data Center GPU Max 1550 [0x0bd5];3;5;25;28;30000;0;8;5;1;1;25;-1;0;0;0;0;1;1;2;0;0;0
Intel(R) Data Center GPU Max 1550 [0x0bd5];3;5;25;32;30000;0;8;5;1;1;25;-1;-2;0;1;0;1;0;0;0;0;0
Intel(R) Data Center GPU Max 1550 [0x0bd5];3;5;25;45;30000;0;8;5;1;1;25;-1;0;0;0;0;1;1;0;0;0;0
Intel(R) Data Center GPU Max 1550 [0x0bd5];3;5;26;4;30000;0;22;5;1;1;26;1;-2;1;0;1;1;1;0;0;0;0
Intel(R) Data Center GPU Max 1550 [0x0bd5];3;5;26;5;30000;0;21;5;1;1;1;1;0;1;0;0;1;1;2;0;0;0
Intel(R) Data Center GPU Max 1550 [0x0bd5];3;5;26;7;30000;0;17;5;1;1;26;-1;0;1;1;1;1;1;2;0;0;0
Intel(R) Data Center GPU Max 1550 [0x0bd5];3;5;26;9;30000;0;8;5;1;4;26;-2;-2;1;0;1;1;0;0;0;0;0
Intel(R) Data Center GPU Max 1550 [0x0bd5];3;5;26;13;30000;0;8;5;1;1;1;1;0;1;1;0;1;1;0;0;0;0
Intel(R) Data Center GPU Max 1550 [0x0bd5];3;5;26;16;30000;0;8;5;1;1;1;-2;-1;0;1;1;1;1;0;0;0;0
Intel(R) Data Center GPU Max 1550 [0x0bd5];3;5;26;24;30000;0;8;5;1;1;26;-1;-2;0;1;0;1;0;2;0;0;0
Intel(R) Data Center GPU Max 1550 [0x0bd5];3;5;26;25;30000;0;8;5;1;1;26;-2;-1;0;0;0;1;1;0;0;0;0
Intel(R) Data Center GPU Max 1550 [0x0bd5];3;5;26;26;30000;0;8;5;1;1;26;-1;-2;1;1;1;1;1;2;0;0;0
Intel(R) Data Center GPU Max 1550 [0x0bd5];3;5;26;28;30000;0;8;5;1;1;26;0;-2;1;0;1;1;1;0;0;0;0
Intel(R) Data Center GPU Max 1550 [0x0bd5];3;5;26;32;30000;0;8;5;1;1;26;-1;0;0;0;1;1;1;0;0;0;0
Intel(R) Data Center GPU Max 1550 [0x0bd5];3;5;26;45;30000;0;8;5;1;1;26;-2;0;0;0;0;1;1;2;0;0;0
Intel(R) Data Center GPU Max 1550 [0x0bd5];3;5;28;4;30000;0;22;5;1;1;28;1;-1;0;0;0;1;1;0;2;0;0
Intel(R) Data Center GPU Max 1550 [0x0bd5];3;5;28;5;30000;0;22;5;1;1;28;-2;0;0;0;0;1;1;2;2;0;0
Intel(R) Data Center GPU Max 1550 [0x0bd5];3;5;28;7;30000;0;17;5;1;1;28;0;-1;1;0;0;1;1;0;2;0;0
Intel(R) Data Center GPU Max 1550 [0x0bd5];3;5;28;9;30000;0;17;5;1;1;28;1;-1;1;0;0;1;1;0;0;0;0
Intel(R) Data Center GPU Max 1550 [0x0bd5];3;5;28;13;30000;0;8;5;1;1;28;-1;-1;0;0;1;1;0;0;0;0;0
Intel(R) Data Center GPU Max 1550 [0x0bd5];3;5;28;14;30000;0;8;5;1;1;28;-1;-1;1;1;0;1;1;2;0;0;0
Intel(R) Data Center GPU Max 1550 [0x0bd5];3;5;28;25;30000;0;8;5;1;1;28;-1;0;0;1;1;1;1;0;0;0;0
Intel(R) Data Center GPU Max 1550 [0x0bd5];3;5;28;26;30000;0;8;5;1;1;28;0;-2;0;0;0;1;1;2;0;0;0
Intel(R) Data Center GPU Max 1550 [0x0bd5];3;5;28;28;30000;0;8;5;1;1;28;-2;0;1;1;1;1;1;2;0;0;0
Intel(R) Data Center GPU Max 1550 [0x0bd5];3;5;28;32;30000;0;8;5;1;1;28;-2;-2;1;1;1;1;1;2;0;0;0
Intel(R) Data Center GPU Max 1550 [0x0bd5];3;5;28;45;30000;0;8;5;1;1;28;1;-2;0;1;0;1;1;2;0;0;0
Intel(R) Data Center GPU Max 1550 [0x0bd5];3;5;32;4;30000;0;22;5;1;1;1;0;-2;1;0;0;1;1;0;2;0;0
Intel(R) Data Center GPU Max 1550 [0x0bd5];3;5;32;5;30000;0;22;5;1;1;1;-1;-2;1;1;0;1;1;0;2;0;0
Intel(R) Data Center GPU Max 1550 [0x0bd5];3;5;32;7;30000;0;22;5;1;1;32;-2;-2;1;0;1;1;1;2;0;0;0
Intel(R) Data Center GPU Max 1550 [0x0bd5];3;5;32;9;30000;0;22;5;1;1;32;0;-1;1;0;0;1;0;2;2;0;0
Intel(R) Data Center GPU Max 1550 [0x0bd5];3;5;32;13;30000;0;8;5;1;1;1;-2;0;0;1;0;1;0;2;0;0;0
Intel(R) Data Center GPU Max 1550 [0x0bd5];3;5;32;17;30000;0;8;5;1;1;1;-1;-2;0;1;0;1;0;2;2;0;0
Intel(R) Data Center GPU Max 1550 [0x0bd5];3;5;32;24;30000;0;8;5;1;1;32;-1;0;0;0;0;1;1;0;0;0;0
Intel(R) Data Center GPU Max 1550 [0x0bd5];3;5;32;25;30000;0;8;5;1;1;32;-1;2;0;1;0;1;0;2;0;0;0
Intel(R) Data Center GPU Max 1550 [0x0bd5];3;5;32;26;30000;0;8;5;1;1;32;-1;0;0;0;1;1;0;0;0;0;0
Intel(R) Data Center GPU Max 1550 [0x0bd5];3;5;32;28;30000;0;8;5;1;1;32;-1;-1;0;1;0;1;1;2;0;0;0
Intel(R) Data Center GPU Max 1550 [0x0bd5];3;5;32;32;30000;0;8;5;1;1;1;-1;0;0;0;1;1;0;0;0;0;0
Intel(R) Data Center GPU Max 1550 [0x0bd5];3;5;32;45;30000;0;8;5;1;1;32;-2;-1;0;0;0;1;0;0;0;0;0
Intel(R) Data Center GPU Max 1550 [0x0bd5];3;5;45;4;30000;0;17;5;1;3;45;-1;-2;1;0;0;1;0;2;2;0;0
Intel(R) Data Center GPU Max 1550 [0x0bd5];3;5;45;5;30000;0;17;5;1;2;45;1;2;1;0;1;1;0;0;0;0;0
Intel(R) Data Center GPU Max 1550 [0x0bd5];3;5;45;7;30000;0;15;5;1;2;45;-1;4;0;1;0;1;0;2;0;0;0
Intel(R) Data Center GPU Max 1550 [0x0bd5];3;5;45;9;30000;0;15;5;1;4;45;-2;-1;0;0;0;1;0;2;2;0;0
Intel(R) Data Center GPU Max 1550 [0x0bd5];3;5;45;13;30000;0;8;5;1;3;45;-2;-2;0;1;1;1;0;2;0;0;0
Intel(R) Data Center GPU Max 1550 [0x0bd5];3;5;45;25;30000;0;5;5;1;1;45;-2;-1;0;0;0;1;0;0;0;0;0
Intel(R) Data Center GPU Max 1550 [0x0bd5];3;5;45;26;30000;0;6;5;1;1;45;-2;-1;0;0;0;1;0;2;0;0;0
Intel(R) Data Center GPU Max 1550 [0x0bd5];3;5;45;28;30000;0;5;5;1;1;45;-1;-2;1;0;1;1;0;0;0;0;0
Intel(R) Data Center GPU Max 1550 [0x0bd5];3;5;45;32;30000;0;4;5;1;1;45;-1;-2;0;0;0;1;0;0;0;0;0
Intel(R) Data Center GPU Max 1550 [0x0bd5];3;5;45;45;30000;0;7;5;1;1;45;-1;0;1;0;0;1;1;2;2;0;1
Intel(R) Data Center GPU Max 1550 [0x0bd5];3;6;6;6;30000;0;9;6;1;3;1;-2;0;0;1;0;1;1;0;0;0;0
Intel(R) Data Center GPU Max 1550 [0x0bd5];3;6;6;7;30000;0;10;6;1;1;1;-1;-1;1;1;0;1;0;0;0;0;0
Intel(R) Data Center GPU Max 1550 [0x0bd5];3;6;6;8;30000;0;12;6;1;1;1;-1;-1;1;0;0;1;0;0;0;0;0
Intel(R) Data Center GPU Max 1550 [0x0bd5];3;6;7;6;30000;0;14;6;1;1;1;-2;-2;0;1;0;1;1;0;0;0;0
Intel(R) Data Center GPU Max 1550 [0x0bd5];3;6;7;7;30000;0;11;6;1;1;1;-2;0;1;0;0;1;1;2;0;0;0
Intel(R) Data Center GPU Max 1550 [0x0bd5];3;6;7;8;30000;0;11;6;1;1;1;-1;-1;0;0;1;1;1;0;0;0;0
Intel(R) Data Center GPU Max 1550 [0x0bd5];3;6;8;6;30000;0;16;6;1;3;1;-2;2;0;1;0;1;0;2;2;0;0
Intel(R) Data Center GPU Max 1550 [0x0bd5];3;6;8;7;30000;0;16;6;1;1;1;1;0;0;0;1;1;1;0;2;0;0
Intel(R) Data Center GPU Max 1550 [0x0bd5];3;6;8;8;30000;0;16;6;1;1;1;-1;-2;0;1;1;1;1;0;0;0;0
Intel(R) Data Center GPU Max 1550 [0x0bd5];3;7;4;4;30000;0;16;7;1;1;1;-1;-2;0;1;0;1;0;2;0;0;0
Intel(R) Data Center GPU Max 1550 [0x0bd5];3;7;4;5;30000;0;16;7;1;6;1;-2;-2;1;0;1;1;0;0;0;0;0
Intel(R) Data Center GPU Max 1550 [0x0bd5];3;7;4;7;30000;0;10;7;1;1;1;-1;-2;0;0;0;1;0;2;0;0;0
Intel(R) Data Center GPU Max 1550 [0x0bd5];3;7;4;9;30000;0;12;7;1;2;1;-2;1;0;1;1;1;0;2;1;0;0
Intel(R) Data Center GPU Max 1550 [0x0bd5];3;7;4;13;30000;0;9;7;1;1;1;-1;0;0;1;0;1;0;2;1;0;0
Intel(R) Data Center GPU Max 1550 [0x0bd5];3;7;4;25;30000;0;8;7;1;1;7;1;-2;1;0;0;1;1;0;0;0;0
Intel(R) Data Center GPU Max 1550 [0x0bd5];3;7;4;26;30000;0;8;7;1;1;7;0;-2;0;0;0;1;0;2;0;0;0
Intel(R) Data Center GPU Max 1550 [0x0bd5];3;7;4;28;30000;0;8;7;1;1;7;1;-2;0;1;0;1;1;2;0;0;0
Intel(R) Data Center GPU Max 1550 [0x0bd5];3;7;4;32;30000;0;8;7;1;1;7;1;0;0;0;0;1;1;2;0;0;0
Intel(R) Data Center GPU Max 1550 [0x0bd5];3;7;4;45;30000;0;8;7;1;1;7;1;0;0;0;1;1;1;2;0;0;0
Intel(R) Data Center GPU Max 1550 [0x0bd5];3;7;5;4;30000;0;16;7;1;3;1;-1;4;0;1;0;1;0;2;0;0;0
Intel(R) Data Center GPU Max 1550 [0x0bd5];3;7;5;5;30000;0;16;7;1;1;1;-2;0;0;0;0;1;1;0;2;0;0
Intel(R) Data Center GPU Max 1550 [0x0bd5];3;7;5;7;30000;0;13;7;1;1;1;-2;0;0;1;1;1;1;2;0;0;0
Intel(R) Data Center GPU Max 1550 [0x0bd5];3;7;5;9;30000;0;11;7;1;2;1;-1;2;0;1;0;1;0;2;1;0;0
Intel(R) Data Center GPU Max 1550 [0x0bd5];3;7;5;13;30000;0;11;7;1;1;1;0;0;0;1;1;1;1;2;0;0;0
Intel(R) Data Center GPU Max 1550 [0x0bd5];3;7;5;25;30000;0;8;7;1;1;7;-2;-2;1;0;0;1;1;0;0;1;0
Intel(R) Data Center GPU Max 1550 [0x0bd5];3;7;5;26;30000;0;8;7;1;1;7;1;0;0;1;0;1;1;2;0;0;0
Intel(R) Data Center GPU Max 1550 [0x0bd5];3;7;5;28;30000;0;8;7;1;1;7;-2;0;1;0;0;1;1;2;0;1;0
Intel(R) Data Center GPU Max 1550 [0x0bd5];3;7;5;32;30000;0;8;7;1;1;7;-1;0;1;1;0;1;1;2;2;1;0
Intel(R) Data Center GPU Max 1550 [0x0bd5];3;7;5;45;30000;0;8;7;1;1;7;-2;0;0;0;1;1;1;0;0;0;0
Intel(R) Data Center GPU Max 1550 [0x0bd5];3;7;6;6;30000;0;16;7;1;1;1;-1;-1;0;0;0;1;0;2;0;0;0
Intel(R) Data Center GPU Max 1550 [0x0bd5];3;7;6;7;30000;0;11;7;1;7;1;-2;0;1;0;1;1;1;0;0;0;0
Intel(R) Data Center GPU Max 1550 [0x0bd5];3;7;6;8;30000;0;12;7;1;6;1;-1;-2;0;0;1;1;0;0;2;0;0
Intel(R) Data Center GPU Max 1550 [0x0bd5];3;7;7;4;30000;0;16;7;1;1;1;-1;0;0;0;0;1;0;0;2;0;0
Intel(R) Data Center GPU Max 1550 [0x0bd5];3;7;7;5;30000;0;17;7;1;1;1;-1;0;0;1;0;1;1;2;2;0;0
Intel(R) Data Center GPU Max 1550 [0x0bd5];3;7;7;6;30000;0;16;7;1;1;1;-2;-2;1;1;0;1;0;0;2;0;0
Intel(R) Data Center GPU Max 1550 [0x0bd5];3;7;7;7;30000;0;9;7;1;2;1;1;-2;0;1;0;1;1;0;2;0;0
Intel(R) Data Center GPU Max 1550 [0x0bd5];3;7;7;8;30000;0;11;7;1;1;1;-2;-1;1;1;0;1;0;0;2;0;0
Intel(R) Data Center GPU Max 1550 [0x0bd5];3;7;7;9;30000;0;14;7;1;1;1;-2;-1;0;0;1;1;0;0;0;0;0
Intel(R) Data Center GPU Max 1550 [0x0bd5];3;7;7;13;30000;0;12;7;1;1;1;-2;-1;0;1;0;1;0;0;2;0;0
Intel(R) Data Center GPU Max 1550 [0x0bd5];3;7;7;25;30000;0;8;7;1;1;7;-1;-2;0;1;0;1;0;0;0;0;0
Intel(R) Data Center GPU Max 1550 [0x0bd5];3;7;7;26;30000;0;8;7;1;1;7;-1;-2;0;1;0;1;0;0;0;0;0
Intel(R) Data Center GPU Max 1550 [0x0bd5];3;7;7;28;30000;0;8;7;1;1;7;-1;-2;0;0;0;1;0;0;0;0;0
Intel(R) Data Center GPU Max 1550 [0x0bd5];3;7;7;32;30000;0;8;7;1;1;7;-1;0;1;0;1;1;0;0;0;0;0
Intel(R) Data Center GPU Max 1550 [0x0bd5];3;7;7;45;30000;0;8;7;1;1;7;-1;-1;0;0;0;1;0;0;0;0;0
Intel(R) Data Center GPU Max 1550 [0x0bd5];3;7;8;6;30000;0;16;7;1;1;1;-2;-2;0;1;0;1;0;0;2;0;0
Intel(R) Data Center GPU Max 1550 [0x0bd5];3;7;8;7;30000;0;16;7;1;1;1;-2;0;0;1;0;1;1;0;2;0;0
Intel(R) Data Center GPU Max 1550 [0x0bd5];3;7;8;8;30000;0;16;7;1;2;1;-1;-1;1;1;1;1;0;0;2;0;0
Intel(R) Data Center GPU Max 1550 [0x0bd5];3;7;9;4;30000;0;16;7;1;1;1;-1;-1;0;0;0;1;0;2;0;0;0
Intel(R) Data Center GPU Max 1550 [0x0bd5];3;7;9;5;30000;0;18;7;1;1;1;-1;-2;0;0;1;1;1;2;0;0;0
Intel(R) Data Center GPU Max 1550 [0x0bd5];3;7;9;7;30000;0;17;7;1;1;1;-1;0;0;1;0;1;1;2;2;0;0
Intel(R) Data Center GPU Max 1550 [0x0bd5];3;7;9;9;30000;0;17;7;1;2;9;-2;5;0;1;0;1;1;2;0;0;0
Intel(R) Data Center GPU Max 1550 [0x0bd5];3;7;9;13;30000;0;9;7;1;1;9;-1;-2;1;1;0;1;1;0;2;0;0
Intel(R) Data Center GPU Max 1550 [0x0bd5];3;7;9;25;30000;0;9;7;1;3;9;-1;-2;1;1;1;1;0;1;0;0;0
Intel(R) Data Center GPU Max 1550 [0x0bd5];3;7;9;26;30000;0;8;7;1;5;9;-1;-1;0;1;0;1;1;2;2;1;0
Intel(R) Data Center GPU Max 1550 [0x0bd5];3;7;9;28;30000;0;8;7;1;1;9;-1;-2;1;0;0;1;1;2;2;1;0
Intel(R) Data Center GPU Max 1550 [0x0bd5];3;7;9;32;30000;0;8;7;1;1;9;-1;-2;1;1;0;1;1;0;0;1;0
Intel(R) Data Center GPU Max 1550 [0x0bd5];3;7;9;45;30000;0;8;7;1;1;9;1;0;0;0;0;1;1;2;0;0;0
Intel(R) Data Center GPU Max 1550 [0x0bd5];3;7;13;4;30000;0;20;7;1;1;1;-2;-1;0;0;1;1;1;2;0;0;0
Intel(R) Data Center GPU Max 1550 [0x0bd5];3;7;13;5;30000;0;17;7;1;2;1;-2;1;0;1;1;1;0;2;0;0;0
Intel(R) Data Center GPU Max 1550 [0x0bd5];3;7;13;7;30000;0;14;7;1;1;1;-2;0;1;1;1;1;1;2;0;0;0
Intel(R) Data Center GPU Max 1550 [0x0bd5];3;7;13;13;30000;0;9;7;1;1;1;-2;-2;1;1;1;1;1;0;0;0;0
Intel(R) Data Center GPU Max 1550 [0x0bd5];3;7;32;13;30000;0;21;7;1;5;32;0;-2;0;0;0;1;0;0;0;0;0
Intel(R) Data Center GPU Max 1550 [0x0bd5];3;7;32;25;30000;0;8;7;1;1;32;0;-1;0;1;0;1;0;0;0;0;0
Intel(R) Data Center GPU Max 1550 [0x0bd5];3;7;32;26;30000;0;8;7;1;1;32;-1;-2;0;0;1;1;0;2;0;0;0
Intel(R) Data Center GPU Max 1550 [0x0bd5];3;7;32;28;30000;0;8;7;1;1;32;-2;-2;0;0;0;1;0;2;0;0;0
Intel(R) Data Center GPU Max 1550 [0x0bd5];3;7;32;32;30000;0;8;7;1;1;32;0;0;0;0;0;1;0;2;0;0;0
Intel(R) Data Center GPU Max 1550 [0x0bd5];3;7;32;45;30000;0;15;7;1;1;32;1;0;1;1;0;1;0;2;2;0;1
Intel(R) Data Center GPU Max 1550 [0x0bd5];3;7;45;4;30000;0;42;7;1;1;45;-2;-1;1;0;1;1;0;2;0;0;0
Intel(R) Data Center GPU Max 1550 [0x0bd5];3;7;45;5;30000;0;55;7;1;3;45;-2;-1;1;0;1;1;1;0;0;0;0
Intel(R) Data Center GPU Max 1550 [0x0bd5];3;7;45;7;30000;0;15;7;1;3;45;1;-1;1;1;0;1;0;2;2;0;0
Intel(R) Data Center GPU Max 1550 [0x0bd5];3;7;45;9;30000;0;41;7;1;5;45;0;-2;0;0;1;1;0;0;0;0;0
Intel(R) Data Center GPU Max 1550 [0x0bd5];3;7;45;13;30000;0;15;7;1;3;45;-1;5;0;1;0;1;0;0;2;0;0
Intel(R) Data Center GPU Max 1550 [0x0bd5];3;7;45;25;30000;0;15;7;1;1;45;1;0;1;1;0;1;1;0;0;0;0
Intel(R) Data Center GPU Max 1550 [0x0bd5];3;7;45;26;30000;0;10;7;1;1;45;-1;0;0;0;0;1;0;2;0;0;1
Intel(R) Data Center GPU Max 1550 [0x0bd5];3;7;45;28;30000;0;13;7;1;1;45;0;-2;1;0;0;1;1;2;0;0;1
Intel(R) Data Center GPU Max 1550 [0x0bd5];3;7;45;32;30000;0;8;7;1;1;45;-2;0;1;0;1;1;1;2;0;0;1
Intel(R) Data Center GPU Max 1550 [0x0bd5];3;7;45;45;30000;0;9;7;1;1;45;1;0;1;1;1;1;1;2;0;0;1
Intel(R) Data Center GPU Max 1550 [0x0bd5];3;8;6;6;30000;0;16;8;1;6;1;-1;-1;0;0;1;1;0;0;0;0;0
Intel(R) Data Center GPU Max 1550 [0x0bd5];3;8;6;7;30000;0;13;8;1;4;1;0;-2;0;1;1;1;0;0;2;0;0
Intel(R) Data Center GPU Max 1550 [0x0bd5];3;8;6;8;30000;0;11;8;1;5;1;-2;-2;1;0;1;1;1;2;2;0;0
Intel(R) Data Center GPU Max 1550 [0x0bd5];3;8;7;6;30000;0;16;8;1;4;1;-2;-1;0;0;0;1;0;0;0;0;0
Intel(R) Data Center GPU Max 1550 [0x0bd5];3;8;7;7;30000;0;16;8;1;4;1;-2;-2;0;0;1;1;1;0;2;0;0
Intel(R) Data Center GPU Max 1550 [0x0bd5];3;8;7;8;30000;0;16;8;1;1;1;-2;3;0;0;1;1;0;0;2;0;0
Intel(R) Data Center GPU Max 1550 [0x0bd5];3;8;8;6;30000;0;19;8;1;1;1;-2;2;0;1;0;1;0;0;1;0;0
Intel(R) Data Center GPU Max 1550 [0x0bd5];3;8;8;7;30000;0;16;8;1;1;1;-1;0;0;0;1;1;0;0;0;0;0
Intel(R) Data Center GPU Max 1550 [0x0bd5];3;8;8;8;30000;0;4;8;1;2;1;-1;-1;0;1;1;1;1;0;0;0;0
Intel(R) Data Center GPU Max 1550 [0x0bd5];3;9;4;4;30000;0;12;1;4;9;1;-1;-1;0;1;0;1;1;2;0;0;0
Intel(R) Data Center GPU Max 1550 [0x0bd5];3;9;4;5;30000;0;16;9;1;1;1;0;0;0;0;0;1;0;2;2;0;0
Intel(R) Data Center GPU Max 1550 [0x0bd5];3;9;4;7;30000;0;16;9;1;1;1;-1;0;0;0;1;1;0;0;2;0;0
Intel(R) Data Center GPU Max 1550 [0x0bd5];3;9;4;9;30000;0;10;9;1;6;1;-1;-2;0;1;0;1;0;2;2;1;0
Intel(R) Data Center GPU Max 1550 [0x0bd5];3;9;4;13;30000;0;8;9;1;1;1;-1;0;0;0;0;1;0;2;1;0;0
Intel(R) Data Center GPU Max 1550 [0x0bd5];3;9;4;25;30000;0;8;9;1;1;9;-1;-1;0;0;1;1;1;2;2;0;0
Intel(R) Data Center GPU Max 1550 [0x0bd5];3;9;4;26;30000;0;8;9;1;1;9;-1;0;0;1;1;1;0;0;2;0;0
Intel(R) Data Center GPU Max 1550 [0x0bd5];3;9;4;28;30000;0;8;9;1;1;9;-1;-2;0;1;0;1;0;0;1;0;0
Intel(R) Data Center GPU Max 1550 [0x0bd5];3;9;4;32;30000;0;8;9;1;1;9;-1;0;0;1;1;1;0;2;2;0;0
Intel(R) Data Center GPU Max 1550 [0x0bd5];3;9;4;45;30000;0;8;9;1;1;9;-1;0;0;0;0;1;1;2;1;0;0
Intel(R) Data Center GPU Max 1550 [0x0bd5];3;9;5;4;30000;0;16;9;1;1;1;-1;-2;0;0;1;1;1;2;0;0;0
Intel(R) Data Center GPU Max 1550 [0x0bd5];3;9;5;5;30000;0;16;9;1;1;1;0;-2;0;1;0;1;0;2;2;0;0
Intel(R) Data Center GPU Max 1550 [0x0bd5];3;9;5;7;30000;0;16;9;1;1;1;-2;-2;1;0;1;1;0;0;2;0;0
Intel(R) Data Center GPU Max 1550 [0x0bd5];3;9;5;9;30000;0;11;9;1;1;1;-1;-1;1;0;1;1;0;0;2;0;0
Intel(R) Data Center GPU Max 1550 [0x0bd5];3;9;5;13;30000;0;11;9;1;1;9;-1;0;0;1;1;1;1;0;2;0;0
Intel(R) Data Center GPU Max 1550 [0x0bd5];3;9;5;25;30000;0;8;9;1;1;9;-1;0;1;0;0;1;1;0;0;1;0
Intel(R) Data Center GPU Max 1550 [0x0bd5];3;9;5;26;30000;0;8;9;1;3;9;-1;1;0;0;0;1;1;0;2;1;0
Intel(R) Data Center GPU Max 1550 [0x0bd5];3;9;5;28;30000;0;8;9;1;1;9;-1;0;0;0;1;1;1;0;2;0;0
Intel(R) Data Center GPU Max 1550 [0x0bd5];3;9;5;32;30000;0;8;9;1;1;9;-1;-2;0;0;1;1;1;2;2;0;0
Intel(R) Data Center GPU Max 1550 [0x0bd5];3;9;5;45;30000;0;8;9;1;1;9;-1;0;0;1;0;1;0;0;1;0;0
Intel(R) Data Center GPU Max 1550 [0x0bd5];3;9;7;4;30000;0;17;9;1;1;1;-1;-1;0;1;0;1;1;0;0;0;0
Intel(R) Data Center GPU Max 1550 [0x0bd5];3;9;7;5;30000;0;16;9;1;1;1;1;-2;0;1;0;1;0;2;2;0;0
Intel(R) Data Center GPU Max 1550 [0x0bd5];3;9;7;7;30000;0;14;9;1;1;1;-2;0;0;0;1;1;1;0;2;0;0
Intel(R) Data Center GPU Max 1550 [0x0bd5];3;9;7;9;30000;0;11;9;1;5;9;1;-1;0;1;0;1;0;2;0;0;0
Intel(R) Data Center GPU Max 1550 [0x0bd5];3;9;7;13;30000;0;9;9;1;5;9;-1;0;0;1;1;1;1;0;2;1;0
Intel(R) Data Center GPU Max 1550 [0x0bd5];3;9;7;25;30000;0;8;9;1;1;9;-1;-2;0;0;1;1;1;2;2;0;0
Intel(R) Data Center GPU Max 1550 [0x0bd5];3;9;7;26;30000;0;8;9;1;9;9;-1;0;1;1;0;1;1;1;0;0;0
Intel(R) Data Center GPU Max 1550 [0x0bd5];3;9;7;28;30000;0;8;9;1;1;9;-1;-1;0;0;1;1;1;0;0;0;0
Intel(R) Data Center GPU Max 1550 [0x0bd5];3;9;7;32;30000;0;8;9;1;1;9;-1;0;0;0;0;1;1;0;0;0;0
Intel(R) Data Center GPU Max 1550 [0x0bd5];3;9;7;45;30000;0;8;9;1;1;9;-1;-2;1;0;1;1;1;0;0;0;0
Intel(R) Data Center GPU Max 1550 [0x0bd5];3;9;9;4;30000;0;18;9;1;7;1;-1;0;1;0;0;1;1;2;2;0;0
Intel(R) Data Center GPU Max 1550 [0x0bd5];3;9;9;5;30000;0;18;9;1;1;1;-1;0;0;1;0;1;0;0;1;0;0
Intel(R) Data Center GPU Max 1550 [0x0bd5];3;9;9;7;30000;0;17;9;1;1;9;-1;-1;1;0;0;1;0;0;2;0;0
Intel(R) Data Center GPU Max 1550 [0x0bd5];3;9;9;9;30000;0;8;9;1;2;1;-1;1;0;1;0;1;1;0;0;0;0
Intel(R) Data Center GPU Max 1550 [0x0bd5];3;9;9;13;30000;0;14;9;1;1;9;-1;-1;1;1;0;1;0;0;2;0;0
Intel(R) Data Center GPU Max 1550 [0x0bd5];3;9;9;16;30000;0;11;9;1;5;0;-1;-2;1;0;0;1;0;0;0;0;0
Intel(R) Data Center GPU Max 1550 [0x0bd5];3;9;9;22;30000;0;8;9;1;3;1;-1;-1;0;1;0;1;1;2;0;1;0
Intel(R) Data Center GPU Max 1550 [0x0bd5];3;9;9;25;30000;0;8;9;1;1;9;-1;0;1;0;0;1;0;0;0;0;0
Intel(R) Data Center GPU Max 1550 [0x0bd5];3;9;9;26;30000;0;8;9;1;1;9;-1;-2;1;0;1;1;0;0;0;0;0
Intel(R) Data Center GPU Max 1550 [0x0bd5];3;9;9;28;30000;0;8;9;1;1;9;-1;-2;0;0;0;1;0;0;2;0;0
Intel(R) Data Center GPU Max 1550 [0x0bd5];3;9;9;32;30000;0;8;9;1;1;1;-1;-2;1;0;1;1;0;0;0;0;0
Intel(R) Data Center GPU Max 1550 [0x0bd5];3;9;9;45;30000;0;8;9;1;1;9;-1;-2;0;1;0;1;0;0;0;0;0
Intel(R) Data Center GPU Max 1550 [0x0bd5];3;9;13;4;30000;0;25;9;1;1;1;-1;-1;1;0;0;1;1;0;2;0;0
Intel(R) Data Center GPU Max 1550 [0x0bd5];3;9;13;5;30000;0;22;9;1;1;13;-2;0;0;0;1;1;1;0;2;0;0
Intel(R) Data Center GPU Max 1550 [0x0bd5];3;9;13;7;30000;0;16;9;1;4;13;-2;1;1;0;0;1;0;0;2;0;0
Intel(R) Data Center GPU Max 1550 [0x0bd5];3;9;13;9;30000;0;17;9;1;1;13;-1;-2;0;0;0;1;0;0;1;0;0
Intel(R) Data Center GPU Max 1550 [0x0bd5];3;9;13;13;30000;0;14;9;1;8;13;-1;-1;1;1;0;1;1;0;2;1;0
Intel(R) Data Center GPU Max 1550 [0x0bd5];3;9;13;25;30000;0;8;9;1;1;13;-2;0;1;0;0;1;0;0;0;0;0
Intel(R) Data Center GPU Max 1550 [0x0bd5];3;9;13;26;30000;0;8;9;1;1;13;-1;0;1;1;0;1;1;0;0;0;0
Intel(R) Data Center GPU Max 1550 [0x0bd5];3;9;13;28;30000;0;8;9;1;1;13;-1;-2;1;0;1;1;1;0;0;1;0
Intel(R) Data Center GPU Max 1550 [0x0bd5];3;9;13;32;30000;0;8;9;1;1;13;-1;0;1;1;0;1;1;0;2;0;0
Intel(R) Data Center GPU Max 1550 [0x0bd5];3;9;13;45;30000;0;8;9;1;1;13;-2;-2;1;1;0;1;1;0;0;0;0
Intel(R) Data Center GPU Max 1550 [0x0bd5];3;9;16;9;30000;0;18;9;1;9;1;-2;-1;1;1;1;1;0;1;2;0;0
Intel(R) Data Center GPU Max 1550 [0x0bd5];3;9;16;16;30000;0;15;9;1;1;1;-2;0;1;1;1;1;1;0;0;0;0
Intel(R) Data Center GPU Max 1550 [0x0bd5];3;9;16;22;30000;0;11;9;1;1;1;1;-2;1;1;1;1;1;0;0;1;0
Intel(R) Data Center GPU Max 1550 [0x0bd5];3;9;22;9;30000;0;17;9;1;6;1;1;0;0;0;0;1;1;2;2;0;0
Intel(R) Data Center GPU Max 1550 [0x0bd5];3;9;22;16;30000;0;9;9;1;9;1;0;-1;1;1;0;1;0;2;2;1;0
Intel(R) Data Center GPU Max 1550 [0x0bd5];3;9;22;22;30000;0;8;9;1;5;1;0;1;0;1;0;1;0;1;0;0;0
Intel(R) Data Center GPU Max 1550 [0x0bd5];3;9;22;32;30000;0;8;9;1;1;1;-2;-1;1;0;0;1;1;2;0;0;0
Intel(R) Data Center GPU Max 1550 [0x0bd5];3;9;25;4;30000;0;32;9;1;9;25;-1;-2;1;1;0;1;1;2;2;0;0
Intel(R) Data Center GPU Max 1550 [0x0bd5];3;9;25;5;30000;0;30;9;1;1;25;-1;0;1;0;1;1;0;0;0;0;0
Intel(R) Data Center GPU Max 1550 [0x0bd5];3;9;25;7;30000;0;21;9;1;1;25;1;0;1;1;0;1;1;0;0;0;0
Intel(R) Data Center GPU Max 1550 [0x0bd5];3;9;25;9;30000;0;17;9;1;9;25;1;-1;0;0;0;1;0;2;0;0;0
Intel(R) Data Center GPU Max 1550 [0x0bd5];3;9;25;13;30000;0;9;9;1;6;25;0;-1;1;1;0;1;1;2;2;0;0
Intel(R) Data Center GPU Max 1550 [0x0bd5];3;9;25;25;30000;0;8;9;1;9;25;-2;1;1;0;1;1;1;0;2;1;0
Intel(R) Data Center GPU Max 1550 [0x0bd5];3;9;25;26;30000;0;8;9;1;1;25;0;-2;1;0;1;1;1;2;0;1;0
Intel(R) Data Center GPU Max 1550 [0x0bd5];3;9;25;28;30000;0;8;9;1;1;25;-2;-1;1;0;0;1;1;2;0;0;0
Intel(R) Data Center GPU Max 1550 [0x0bd5];3;9;25;32;30000;0;9;9;1;1;25;-1;0;1;0;0;1;1;0;0;1;0
Intel(R) Data Center GPU Max 1550 [0x0bd5];3;9;25;45;30000;0;15;9;1;1;25;-2;0;0;1;0;1;1;2;0;0;1
Intel(R) Data Center GPU Max 1550 [0x0bd5];3;9;26;4;30000;0;30;9;1;7;26;1;0;1;1;0;1;0;2;0;0;0
Intel(R) Data Center GPU Max 1550 [0x0bd5];3;9;26;5;30000;0;27;9;1;8;26;0;-2;1;1;0;1;1;2;2;0;0
Intel(R) Data Center GPU Max 1550 [0x0bd5];3;9;26;7;30000;0;18;9;1;2;26;-1;1;1;1;0;1;0;1;0;0;0
Intel(R) Data Center GPU Max 1550 [0x0bd5];3;9;26;9;30000;0;17;9;1;7;26;1;0;0;0;0;1;0;2;0;0;0
Intel(R) Data Center GPU Max 1550 [0x0bd5];3;9;26;13;30000;0;8;9;1;3;26;-1;0;0;0;1;1;0;0;0;0;0
Intel(R) Data Center GPU Max 1550 [0x0bd5];3;9;26;25;30000;0;8;9;1;1;26;-1;1;1;0;0;1;1;2;0;0;0
Intel(R) Data Center GPU Max 1550 [0x0bd5];3;9;26;26;30000;0;8;9;1;1;26;-2;0;1;1;1;1;1;2;0;1;0
Intel(R) Data Center GPU Max 1550 [0x0bd5];3;9;26;28;30000;0;8;9;1;1;26;1;-2;1;0;0;1;0;1;0;0;0
Intel(R) Data Center GPU Max 1550 [0x0bd5];3;9;26;32;30000;0;8;9;1;1;26;-2;-2;1;0;1;1;1;2;0;1;0
Intel(R) Data Center GPU Max 1550 [0x0bd5];3;9;26;45;30000;0;16;9;1;1;26;0;0;1;1;1;1;1;2;0;0;1
Intel(R) Data Center GPU Max 1550 [0x0bd5];3;9;28;4;30000;0;33;9;1;1;28;-1;-1;0;0;0;1;0;2;2;0;0
Intel(R) Data Center GPU Max 1550 [0x0bd5];3;9;28;5;30000;0;28;9;1;4;28;-2;-2;0;1;0;1;0;0;0;0;0
Intel(R) Data Center GPU Max 1550 [0x0bd5];3;9;28;7;30000;0;23;9;1;1;28;-1;-2;1;1;1;1;1;0;0;0;0
Intel(R) Data Center GPU Max 1550 [0x0bd5];3;9;28;9;30000;0;21;9;1;7;28;-2;-2;0;1;1;1;1;1;0;0;0
Intel(R) Data Center GPU Max 1550 [0x0bd5];3;9;28;13;30000;0;15;9;1;4;28;0;1;1;1;0;1;0;2;2;0;0
Intel(R) Data Center GPU Max 1550 [0x0bd5];3;9;28;25;30000;0;8;9;1;1;28;0;0;0;1;0;1;0;1;0;0;0
Intel(R) Data Center GPU Max 1550 [0x0bd5];3;9;28;26;30000;0;10;9;1;1;28;-2;0;0;1;1;1;0;0;0;1;0
Intel(R) Data Center GPU Max 1550 [0x0bd5];3;9;28;28;30000;0;8;9;1;1;28;-1;0;1;0;1;1;0;2;0;1;0
Intel(R) Data Center GPU Max 1550 [0x0bd5];3;9;28;32;30000;0;16;9;1;1;28;-1;-2;0;0;0;1;1;2;0;0;1
Intel(R) Data Center GPU Max 1550 [0x0bd5];3;9;28;45;30000;0;15;9;1;1;28;-2;0;0;1;0;1;1;2;0;0;1
Intel(R) Data Center GPU Max 1550 [0x0bd5];3;9;32;4;30000;0;32;9;1;5;32;0;-1;1;1;1;1;1;0;2;0;0
Intel(R) Data Center GPU Max 1550 [0x0bd5];3;9;32;5;30000;0;28;9;1;3;32;0;-2;0;0;0;1;0;0;0;0;0
Intel(R) Data Center GPU Max 1550 [0x0bd5];3;9;32;7;30000;0;28;9;1;9;32;1;-1;1;0;0;1;0;1;2;0;0
Intel(R) Data Center GPU Max 1550 [0x0bd5];3;9;32;9;30000;0;22;9;1;9;1;0;-1;1;0;0;1;1;2;0;1;0
Intel(R) Data Center GPU Max 1550 [0x0bd5];3;9;32;13;30000;0;9;9;1;4;32;0;0;0;0;1;1;0;0;0;0;0
Intel(R) Data Center GPU Max 1550 [0x0bd5];3;9;32;22;30000;0;8;9;1;1;1;-1;1;1;0;0;1;0;0;0;0;0
Intel(R) Data Center GPU Max 1550 [0x0bd5];3;9;32;25;30000;0;8;9;1;1;32;-1;1;1;1;1;1;1;2;0;0;0
Intel(R) Data Center GPU Max 1550 [0x0bd5];3;9;32;26;30000;0;8;9;1;1;32;1;1;1;0;0;1;1;2;0;0;0
Intel(R) Data Center GPU Max 1550 [0x0bd5];3;9;32;28;30000;0;15;9;1;1;32;-1;0;0;0;0;1;1;2;0;0;1
Intel(R) Data Center GPU Max 1550 [0x0bd5];3;9;32;32;30000;0;15;9;1;1;1;-2;0;1;1;1;1;1;2;0;0;1
Intel(R) Data Center GPU Max 1550 [0x0bd5];3;9;32;45;30000;0;15;9;1;1;32;-1;0;0;1;0;1;1;2;0;0;1
Intel(R) Data Center GPU Max 1550 [0x0bd5];3;9;45;32;30000;0;10;9;1;1;45;1;0;1;0;0;1;0;2;0;0;1
Intel(R) Data Center GPU Max 1550 [0x0bd5];3;9;45;45;30000;0;9;9;1;1;45;0;0;1;1;0;1;1;2;0;0;1
Intel(R) Data Center GPU Max 1550 [0x0bd5];3;10;4;4;30000;0;16;10;1;1;1;-1;-1;0;0;0;1;1;2;0;0;0
Intel(R) Data Center GPU Max 1550 [0x0bd5];3;10;4;10;30000;0;12;10;1;1;1;-1;-2;0;0;1;1;0;2;1;0;0
Intel(R) Data Center GPU Max 1550 [0x0bd5];3;10;10;4;30000;0;20;10;1;4;1;-1;0;1;1;0;1;1;2;2;0;0
Intel(R) Data Center GPU Max 1550 [0x0bd5];3;10;10;10;30000;0;8;10;1;2;1;-1;-2;0;1;0;1;1;0;2;0;0
Intel(R) Data Center GPU Max 1550 [0x0bd5];3;13;4;4;30000;0;16;13;1;1;1;-1;-1;0;1;1;1;0;0;0;0;0
Intel(R) Data Center GPU Max 1550 [0x0bd5];3;13;4;5;30000;0;16;13;1;1;1;-1;-1;0;1;1;1;0;0;2;0;0
Intel(R) Data Center GPU Max 1550 [0x0bd5];3;13;4;7;30000;0;11;13;1;7;1;-2;-2;0;1;0;1;0;0;2;0;0
Intel(R) Data Center GPU Max 1550 [0x0bd5];3;13;4;9;30000;0;9;13;1;4;1;-1;1;0;0;1;1;0;2;0;1;0
Intel(R) Data Center GPU Max 1550 [0x0bd5];3;13;4;13;30000;0;9;13;1;2;1;-2;1;1;1;1;1;0;0;0;1;0
Intel(R) Data Center GPU Max 1550 [0x0bd5];3;13;4;17;30000;0;8;13;1;13;1;-1;-1;0;0;1;1;1;0;0;1;0
Intel(R) Data Center GPU Max 1550 [0x0bd5];3;13;4;32;30000;0;8;13;1;11;1;-2;0;0;1;1;1;1;2;2;0;0
Intel(R) Data Center GPU Max 1550 [0x0bd5];3;13;5;4;30000;0;16;13;1;1;1;-2;0;0;0;1;1;1;2;2;0;0
Intel(R) Data Center GPU Max 1550 [0x0bd5];3;13;5;5;30000;0;16;13;1;1;1;-1;-2;0;1;1;1;0;2;2;0;0
Intel(R) Data Center GPU Max 1550 [0x0bd5];3;13;5;7;30000;0;13;13;1;2;1;-2;-1;1;0;1;1;0;2;0;0;0
Intel(R) Data Center GPU Max 1550 [0x0bd5];3;13;5;13;30000;0;8;13;1;6;1;-1;-2;0;1;0;1;1;2;2;1;0
Intel(R) Data Center GPU Max 1550 [0x0bd5];3;13;5;16;30000;0;8;13;1;10;1;-2;-1;1;1;1;1;0;0;0;1;0
Intel(R) Data Center GPU Max 1550 [0x0bd5];3;13;5;17;30000;0;8;13;1;7;1;-2;-2;0;1;0;1;1;0;2;1;0
Intel(R) Data Center GPU Max 1550 [0x0bd5];3;13;5;24;30000;0;8;13;1;11;1;-1;0;0;1;1;1;0;0;0;0;0
Intel(R) Data Center GPU Max 1550 [0x0bd5];3;13;5;26;30000;0;8;13;1;10;1;-1;-2;0;0;0;1;0;0;2;1;0
Intel(R) Data Center GPU Max 1550 [0x0bd5];3;13;5;32;30000;0;8;13;1;1;1;-2;0;0;1;0;1;0;0;2;0;0
Intel(R) Data Center GPU Max 1550 [0x0bd5];3;13;5;45;30000;0;8;13;1;1;13;-2;0;0;1;1;1;0;0;1;0;0
Intel(R) Data Center GPU Max 1550 [0x0bd5];3;13;7;4;30000;0;17;13;1;1;1;-1;0;1;1;1;1;1;2;2;0;0
Intel(R) Data Center GPU Max 1550 [0x0bd5];3;13;7;5;30000;0;17;13;1;1;1;-1;0;0;1;1;1;0;2;2;0;0
Intel(R) Data Center GPU Max 1550 [0x0bd5];3;13;7;7;30000;0;14;13;1;10;1;-1;-1;0;1;0;1;0;2;2;0;0
Intel(R) Data Center GPU Max 1550 [0x0bd5];3;13;7;9;30000;0;12;13;1;11;13;-2;-1;1;0;1;1;1;2;0;0;0
Intel(R) Data Center GPU Max 1550 [0x0bd5];3;13;7;13;30000;0;9;13;1;6;1;-1;-1;1;1;1;1;0;0;0;1;0
Intel(R) Data Center GPU Max 1550 [0x0bd5];3;13;7;25;30000;0;8;13;1;1;13;-2;-1;1;0;0;1;1;0;0;0;0
Intel(R) Data Center GPU Max 1550 [0x0bd5];3;13;7;26;30000;0;8;13;1;1;13;-2;-2;1;0;1;1;1;0;2;0;0
Intel(R) Data Center GPU Max 1550 [0x0bd5];3;13;7;28;30000;0;8;13;1;1;13;-2;-1;0;0;1;1;0;2;0;0;0
Intel(R) Data Center GPU Max 1550 [0x0bd5];3;13;7;32;30000;0;8;13;1;1;13;0;-2;1;1;1;1;0;0;0;1;0
Intel(R) Data Center GPU Max 1550 [0x0bd5];3;13;7;45;30000;0;8;13;1;1;13;1;-2;0;0;0;1;1;0;0;1;0
Intel(R) Data Center GPU Max 1550 [0x0bd5];3;13;9;4;30000;0;19;13;1;1;1;-1;-1;1;0;1;1;1;0;2;0;0
Intel(R) Data Center GPU Max 1550 [0x0bd5];3;13;9;5;30000;0;17;13;1;1;13;-1;-1;0;0;0;1;1;0;2;0;0
Intel(R) Data Center GPU Max 1550 [0x0bd5];3;13;9;7;30000;0;17;13;1;13;13;-1;-1;1;0;1;1;0;2;0;0;0
Intel(R) Data Center GPU Max 1550 [0x0bd5];3;13;9;9;30000;0;14;13;1;10;13;-2;-1;1;1;1;1;1;2;0;0;0
Intel(R) Data Center GPU Max 1550 [0x0bd5];3;13;9;13;30000;0;8;13;1;1;13;-1;-1;1;0;1;1;1;0;2;0;0
Intel(R) Data Center GPU Max 1550 [0x0bd5];3;13;9;25;30000;0;8;13;1;1;13;-1;-1;1;1;0;1;0;0;0;0;0
Intel(R) Data Center GPU Max 1550 [0x0bd5];3;13;9;26;30000;0;8;13;1;1;13;-2;0;1;1;0;1;1;0;0;0;0
Intel(R) Data Center GPU Max 1550 [0x0bd5];3;13;9;28;30000;0;8;13;1;1;13;-2;-1;0;1;0;1;0;2;0;0;0
Intel(R) Data Center GPU Max 1550 [0x0bd5];3;13;9;32;30000;0;8;13;1;1;13;-2;0;1;0;0;1;1;2;2;0;0
Intel(R) Data Center GPU Max 1550 [0x0bd5];3;13;9;45;30000;0;8;13;1;1;13;0;-2;0;1;1;1;1;2;0;1;0
Intel(R) Data Center GPU Max 1550 [0x0bd5];3;13;13;4;30000;0;23;13;1;1;1;-2;-2;1;0;1;1;0;0;0;0;0
Intel(R) Data Center GPU Max 1550 [0x0bd5];3;13;13;5;30000;0;24;13;1;1;1;-2;-2;1;1;1;1;0;0;0;0;0
Intel(R) Data Center GPU Max 1550 [0x0bd5];3;13;13;7;30000;0;22;13;1;1;1;-2;-2;1;0;1;1;0;0;2;0;0
Intel(R) Data Center GPU Max 1550 [0x0bd5];3;13;13;9;30000;0;18;13;1;1;13;-1;-1;1;0;0;1;0;0;0;0;0
Intel(R) Data Center GPU Max 1550 [0x0bd5];3;13;13;13;30000;0;8;13;1;4;1;-1;-2;0;1;1;1;1;0;0;0;0
Intel(R) Data Center GPU Max 1550 [0x0bd5];3;13;13;14;30000;0;21;13;1;1;13;-1;-2;1;0;0;1;0;0;2;0;0
Intel(R) Data Center GPU Max 1550 [0x0bd5];3;13;13;17;30000;0;8;13;1;1;1;-1;-1;1;1;0;1;0;0;0;0;0
Intel(R) Data Center GPU Max 1550 [0x0bd5];3;13;13;24;30000;0;8;13;1;1;13;-1;-2;1;1;1;1;0;0;0;0;0
Intel(R) Data Center GPU Max 1550 [0x0bd5];3;13;13;25;30000;0;8;13;1;1;13;-1;0;1;0;1;1;0;0;0;0;0
Intel(R) Data Center GPU Max 1550 [0x0bd5];3;13;13;26;30000;0;9;13;1;1;13;-1;-1;1;1;0;1;0;0;0;0;0
Intel(R) Data Center GPU Max 1550 [0x0bd5];3;13;13;28;30000;0;8;13;1;1;13;-1;-1;1;1;0;1;1;0;0;0;0
Intel(R) Data Center GPU Max 1550 [0x0bd5];3;13;13;32;30000;0;8;13;1;1;1;-1;0;1;0;0;1;0;0;2;0;0
Intel(R) Data Center GPU Max 1550 [0x0bd5];3;13;13;45;30000;0;8;13;1;1;13;-2;0;0;0;0;1;0;0;0;0;0
Intel(R) Data Center GPU Max 1550 [0x0bd5];3;13;14;13;30000;0;15;13;1;2;14;-1;-1;1;0;0;1;0;1;2;0;0
Intel(R) Data Center GPU Max 1550 [0x0bd5];3;13;14;14;30000;0;13;13;1;2;14;-1;1;0;0;1;1;1;2;0;1;0
Intel(R) Data Center GPU Max 1550 [0x0bd5];3;13;14;25;30000;0;8;13;1;1;14;-2;-1;1;1;0;1;1;0;0;0;0
Intel(R) Data Center GPU Max 1550 [0x0bd5];3;13;14;26;30000;0;8;13;1;1;14;-2;0;1;0;1;1;0;0;0;0;0
Intel(R) Data Center GPU Max 1550 [0x0bd5];3;13;14;32;30000;0;8;13;1;1;14;-2;-2;1;0;1;1;1;0;0;0;0
Intel(R) Data Center GPU Max 1550 [0x0bd5];3;13;16;5;30000;0;20;13;1;9;1;-1;0;1;0;0;1;0;2;2;0;0
Intel(R) Data Center GPU Max 1550 [0x0bd5];3;13;17;4;30000;0;19;13;1;11;1;-1;-1;1;1;0;1;1;2;1;0;0
Intel(R) Data Center GPU Max 1550 [0x0bd5];3;13;17;5;30000;0;19;13;1;10;1;0;-1;1;1;0;1;0;1;0;0;0
Intel(R) Data Center GPU Max 1550 [0x0bd5];3;13;17;13;30000;0;9;13;1;9;1;1;-1;1;1;0;1;1;2;0;1;0
Intel(R) Data Center GPU Max 1550 [0x0bd5];3;13;17;17;30000;0;8;13;1;1;1;-2;1;1;0;1;1;1;2;0;0;0
Intel(R) Data Center GPU Max 1550 [0x0bd5];3;13;17;32;30000;0;8;13;1;1;1;1;-2;1;0;0;1;1;2;0;1;0
Intel(R) Data Center GPU Max 1550 [0x0bd5];3;13;24;5;30000;0;22;13;1;5;1;1;-1;1;1;0;1;0;1;0;0;0
Intel(R) Data Center GPU Max 1550 [0x0bd5];3;13;24;13;30000;0;8;13;1;8;24;-1;-1;0;0;0;1;0;1;0;0;0
Intel(R) Data Center GPU Max 1550 [0x0bd5];3;13;24;24;30000;0;8;13;1;1;24;-2;1;1;0;1;1;1;2;0;0;0
Intel(R) Data Center GPU Max 1550 [0x0bd5];3;13;24;26;30000;0;19;13;1;1;24;1;0;0;1;0;1;1;2;0;0;1
Intel(R) Data Center GPU Max 1550 [0x0bd5];3;13;24;32;30000;0;16;13;1;1;24;0;0;1;0;0;1;0;2;0;0;1
Intel(R) Data Center GPU Max 1550 [0x0bd5];3;13;25;4;30000;0;24;13;1;4;25;-2;1;1;1;0;1;0;2;1;0;0
Intel(R) Data Center GPU Max 1550 [0x0bd5];3;13;25;5;30000;0;22;13;1;3;25;0;-1;1;1;1;1;0;1;0;0;0
Intel(R) Data Center GPU Max 1550 [0x0bd5];3;13;25;7;30000;0;15;8;1;13;25;-2;5;0;1;1;1;0;1;2;0;0
Intel(R) Data Center GPU Max 1550 [0x0bd5];3;13;25;9;30000;0;15;8;1;4;25;-2;6;0;0;0;1;0;1;2;0;0
Intel(R) Data Center GPU Max 1550 [0x0bd5];3;13;25;13;30000;0;8;13;1;7;25;-2;-1;1;1;0;1;0;1;2;0;0
Intel(R) Data Center GPU Max 1550 [0x0bd5];3;13;25;14;30000;0;15;8;1;7;25;0;1;1;1;0;1;1;0;0;0;0
Intel(R) Data Center GPU Max 1550 [0x0bd5];3;13;25;25;30000;0;15;8;1;1;25;-1;4;1;0;1;1;0;2;0;0;1
Intel(R) Data Center GPU Max 1550 [0x0bd5];3;13;25;26;30000;0;15;13;1;1;25;-1;-2;1;1;0;1;1;2;0;0;1
Intel(R) Data Center GPU Max 1550 [0x0bd5];3;13;25;28;30000;0;8;8;1;1;25;-1;0;0;1;1;1;0;1;0;0;0
Intel(R) Data Center GPU Max 1550 [0x0bd5];3;13;25;32;30000;0;4;8;1;1;25;-1;0;0;0;0;1;0;0;0;0;0
Intel(R) Data Center GPU Max 1550 [0x0bd5];3;13;25;45;30000;0;15;13;1;1;25;1;0;1;0;0;1;1;0;0;0;1
Intel(R) Data Center GPU Max 1550 [0x0bd5];3;13;26;4;30000;0;15;8;1;11;26;0;6;0;0;0;1;1;0;0;0;0
Intel(R) Data Center GPU Max 1550 [0x0bd5];3;13;26;5;30000;0;23;13;1;13;1;0;-2;1;0;0;1;0;1;0;0;0
Intel(R) Data Center GPU Max 1550 [0x0bd5];3;13;26;7;30000;0;22;13;1;13;26;0;-2;1;1;0;1;1;0;0;0;0
Intel(R) Data Center GPU Max 1550 [0x0bd5];3;13;26;9;30000;0;16;13;1;11;26;-1;-1;1;0;0;1;0;2;2;0;0
Intel(R) Data Center GPU Max 1550 [0x0bd5];3;13;26;13;30000;0;8;13;1;13;26;0;0;0;1;0;1;0;1;2;0;0
Intel(R) Data Center GPU Max 1550 [0x0bd5];3;13;26;14;30000;0;8;13;1;11;26;-2;-2;1;1;0;1;0;1;2;0;0
Intel(R) Data Center GPU Max 1550 [0x0bd5];3;13;26;24;30000;0;15;13;1;1;26;-1;-2;0;1;0;1;1;2;0;0;1
Intel(R) Data Center GPU Max 1550 [0x0bd5];3;13;26;25;30000;0;15;13;1;1;26;-1;0;1;0;0;1;1;2;0;0;1
Intel(R) Data Center GPU Max 1550 [0x0bd5];3;13;26;26;30000;0;18;13;1;1;26;-1;0;0;1;0;1;1;2;0;0;1
Intel(R) Data Center GPU Max 1550 [0x0bd5];3;13;26;28;30000;0;16;13;1;1;26;-1;-2;0;1;1;1;1;2;0;0;1
Intel(R) Data Center GPU Max 1550 [0x0bd5];3;13;26;32;30000;0;15;13;1;1;26;-1;0;0;0;0;1;1;2;0;0;1
Intel(R) Data Center GPU Max 1550 [0x0bd5];3;13;26;45;30000;0;15;13;1;1;26;1;0;1;1;1;1;1;2;0;0;1
Intel(R) Data Center GPU Max 1550 [0x0bd5];3;13;28;4;30000;0;27;13;1;4;28;-1;-1;1;0;0;1;1;2;1;0;0
Intel(R) Data Center GPU Max 1550 [0x0bd5];3;13;28;5;30000;0;19;13;1;9;28;-1;-2;1;0;0;1;1;2;2;0;0
Intel(R) Data Center GPU Max 1550 [0x0bd5];3;13;28;7;30000;0;23;13;1;10;28;-1;-2;1;0;0;1;1;2;0;0;0
Intel(R) Data Center GPU Max 1550 [0x0bd5];3;13;28;9;30000;0;17;13;1;10;28;1;-1;1;1;1;1;0;2;0;0;0
Intel(R) Data Center GPU Max 1550 [0x0bd5];3;13;28;13;30000;0;8;13;1;13;28;0;-1;0;0;0;1;0;1;2;0;0
Intel(R) Data Center GPU Max 1550 [0x0bd5];3;13;28;25;30000;0;15;13;1;1;28;0;0;1;0;0;1;0;2;2;0;1
Intel(R) Data Center GPU Max 1550 [0x0bd5];3;13;28;26;30000;0;16;13;1;1;28;-1;-2;1;1;0;1;0;2;0;0;1
Intel(R) Data Center GPU Max 1550 [0x0bd5];3;13;28;28;30000;0;15;13;1;1;28;-1;-2;0;0;0;1;1;2;2;0;1
Intel(R) Data Center GPU Max 1550 [0x0bd5];3;13;28;32;30000;0;15;13;1;1;28;-1;0;1;1;1;1;1;2;0;1;1
Intel(R) Data Center GPU Max 1550 [0x0bd5];3;13;28;45;30000;0;15;13;1;1;28;-2;0;1;1;0;1;1;2;0;0;1
Intel(R) Data Center GPU Max 1550 [0x0bd5];3;13;32;4;30000;0;27;13;1;11;1;-2;-1;1;0;0;1;1;0;1;0;0
Intel(R) Data Center GPU Max 1550 [0x0bd5];3;13;32;5;30000;0;23;13;1;9;1;0;-1;0;1;0;1;0;1;1;0;0
Intel(R) Data Center GPU Max 1550 [0x0bd5];3;13;32;7;30000;0;25;13;1;6;32;0;-1;1;1;1;1;1;2;2;0;0
Intel(R) Data Center GPU Max 1550 [0x0bd5];3;13;32;9;30000;0;18;13;1;10;32;0;-2;1;1;1;1;0;2;2;0;0
Intel(R) Data Center GPU Max 1550 [0x0bd5];3;13;32;13;30000;0;10;13;1;1;0;1;1;1;1;1;1;1;0;0;0;0
Intel(R) Data Center GPU Max 1550 [0x0bd5];3;13;32;14;30000;0;8;13;1;10;32;-2;-1;0;1;0;1;0;1;0;0;0
Intel(R) Data Center GPU Max 1550 [0x0bd5];3;13;32;17;30000;0;8;13;1;1;1;-1;1;1;1;0;1;1;0;0;0;0
Intel(R) Data Center GPU Max 1550 [0x0bd5];3;13;32;24;30000;0;16;13;1;1;32;-2;-2;1;1;0;1;0;2;2;0;1
Intel(R) Data Center GPU Max 1550 [0x0bd5];3;13;32;25;30000;0;15;13;1;1;32;1;-2;1;0;0;1;0;2;0;0;1
Intel(R) Data Center GPU Max 1550 [0x0bd5];3;13;32;26;30000;0;15;13;1;1;32;-1;0;1;1;0;1;0;2;0;0;1
Intel(R) Data Center GPU Max 1550 [0x0bd5];3;13;32;28;30000;0;16;13;1;1;32;-1;-2;1;0;1;1;0;2;0;0;1
Intel(R) Data Center GPU Max 1550 [0x0bd5];3;13;32;32;30000;0;15;13;1;1;1;0;0;1;0;0;1;0;0;0;0;1
Intel(R) Data Center GPU Max 1550 [0x0bd5];3;13;32;45;30000;0;15;13;1;1;32;1;-2;1;1;1;1;1;2;0;0;1
Intel(R) Data Center GPU Max 1550 [0x0bd5];3;13;45;4;30000;0;26;13;1;1;45;-2;1;1;0;0;1;1;2;0;0;0
Intel(R) Data Center GPU Max 1550 [0x0bd5];3;13;45;5;30000;0;32;8;1;4;45;1;-1;0;1;0;1;0;2;2;0;0
Intel(R) Data Center GPU Max 1550 [0x0bd5];3;13;45;7;30000;0;35;13;1;5;45;-2;-2;0;0;0;1;0;0;0;0;0
Intel(R) Data Center GPU Max 1550 [0x0bd5];3;13;45;9;30000;0;28;13;1;8;45;1;0;1;0;0;1;0;2;2;0;0
Intel(R) Data Center GPU Max 1550 [0x0bd5];3;13;45;13;30000;0;15;13;1;11;45;1;-2;0;1;0;1;0;1;0;0;0
Intel(R) Data Center GPU Max 1550 [0x0bd5];3;13;45;25;30000;0;17;8;1;9;45;0;1;1;0;1;1;0;1;0;1;1
Intel(R) Data Center GPU Max 1550 [0x0bd5];3;13;45;26;30000;0;15;13;1;1;45;0;-2;1;0;0;1;0;2;0;0;1
Intel(R) Data Center GPU Max 1550 [0x0bd5];3;13;45;28;30000;0;8;8;1;7;45;-1;-2;0;1;0;1;0;1;2;1;1
Intel(R) Data Center GPU Max 1550 [0x0bd5];3;13;45;32;30000;0;7;8;1;13;45;1;0;0;1;0;1;1;0;0;0;1
Intel(R) Data Center GPU Max 1550 [0x0bd5];3;13;45;45;30000;0;30;13;1;1;45;-1;0;1;0;1;1;0;2;0;0;1
Intel(R) Data Center GPU Max 1550 [0x0bd5];3;14;5;28;30000;0;8;14;1;9;14;-2;0;0;0;0;1;1;2;2;1;0
Intel(R) Data Center GPU Max 1550 [0x0bd5];3;14;13;13;30000;0;8;14;1;7;14;-2;-1;0;0;0;1;0;0;2;1;0
Intel(R) Data Center GPU Max 1550 [0x0bd5];3;14;13;14;30000;0;8;14;1;1;14;-1;0;1;1;1;1;1;0;0;0;0
Intel(R) Data Center GPU Max 1550 [0x0bd5];3;14;13;25;30000;0;8;14;1;1;14;-2;-2;1;1;0;1;1;0;0;0;0
Intel(R) Data Center GPU Max 1550 [0x0bd5];3;14;13;26;30000;0;8;14;1;1;14;-1;-1;0;0;1;1;0;0;0;0;0
Intel(R) Data Center GPU Max 1550 [0x0bd5];3;14;13;32;30000;0;8;14;1;1;14;-2;-1;0;0;0;1;0;0;0;0;0
Intel(R) Data Center GPU Max 1550 [0x0bd5];3;14;14;13;30000;0;22;14;1;1;14;-2;-1;1;1;0;1;0;0;2;0;0
Intel(R) Data Center GPU Max 1550 [0x0bd5];3;14;14;14;30000;0;8;14;1;5;14;-1;-1;0;1;0;1;1;2;2;0;0
Intel(R) Data Center GPU Max 1550 [0x0bd5];3;14;14;16;30000;0;21;14;1;1;14;-1;-1;1;0;0;1;0;0;0;0;0
Intel(R) Data Center GPU Max 1550 [0x0bd5];3;14;14;25;30000;0;8;14;1;1;14;-2;-1;0;1;1;1;1;0;2;0;0
Intel(R) Data Center GPU Max 1550 [0x0bd5];3;14;14;26;30000;0;8;14;1;1;14;-1;-2;0;0;0;1;0;0;0;0;0
Intel(R) Data Center GPU Max 1550 [0x0bd5];3;14;14;28;30000;0;8;14;1;1;14;-2;0;1;1;0;1;1;0;2;0;0
Intel(R) Data Center GPU Max 1550 [0x0bd5];3;14;14;29;30000;0;8;14;1;1;14;-2;-2;1;1;0;1;0;0;2;0;0
Intel(R) Data Center GPU Max 1550 [0x0bd5];3;14;14;32;30000;0;8;14;1;1;14;-2;-1;1;1;0;1;1;0;2;0;0
Intel(R) Data Center GPU Max 1550 [0x0bd5];3;14;16;14;30000;0;18;14;1;11;16;-2;0;1;0;1;1;0;1;2;0;0
Intel(R) Data Center GPU Max 1550 [0x0bd5];3;14;16;16;30000;0;17;14;1;4;16;-1;-1;1;0;1;1;0;1;2;0;0
Intel(R) Data Center GPU Max 1550 [0x0bd5];3;14;16;29;30000;0;8;14;1;1;16;-2;-2;0;1;1;1;1;0;0;0;0
Intel(R) Data Center GPU Max 1550 [0x0bd5];3;14;25;13;30000;0;8;14;1;1;25;1;1;0;1;0;1;0;0;0;0;0
Intel(R) Data Center GPU Max 1550 [0x0bd5];3;14;25;14;30000;0;8;14;1;13;25;-2;0;0;0;0;1;0;1;2;0;0
Intel(R) Data Center GPU Max 1550 [0x0bd5];3;14;25;25;30000;0;15;14;1;1;25;-1;-1;0;1;0;1;0;2;0;0;1
Intel(R) Data Center GPU Max 1550 [0x0bd5];3;14;25;26;30000;0;15;8;1;1;25;1;3;1;0;0;1;1;2;0;0;0
Intel(R) Data Center GPU Max 1550 [0x0bd5];3;14;28;5;30000;0;32;14;1;13;28;-2;0;1;1;1;1;0;0;2;0;0
Intel(R) Data Center GPU Max 1550 [0x0bd5];3;14;28;14;30000;0;8;14;1;9;28;-2;0;0;0;0;1;0;1;2;0;0
Intel(R) Data Center GPU Max 1550 [0x0bd5];3;14;28;28;30000;0;16;14;1;1;28;-1;0;0;0;1;1;1;2;0;0;1
Intel(R) Data Center GPU Max 1550 [0x0bd5];3;14;29;32;30000;0;15;14;1;1;29;-2;-1;1;0;0;1;0;2;0;0;1
Intel(R) Data Center GPU Max 1550 [0x0bd5];3;14;32;29;30000;0;16;14;1;1;32;1;-1;0;1;0;1;0;2;0;0;1
Intel(R) Data Center GPU Max 1550 [0x0bd5];3;14;32;32;30000;0;16;14;1;1;32;-1;0;1;1;1;1;1;0;0;0;1
Intel(R) Data Center GPU Max 1550 [0x0bd5];3;15;4;4;30000;0;16;15;1;1;1;-2;-1;0;1;0;1;0;2;2;0;0
Intel(R) Data Center GPU Max 1550 [0x0bd5];3;15;15;15;30000;0;8;15;1;8;1;-1;-2;0;1;0;1;1;2;2;0;0
Intel(R) Data Center GPU Max 1550 [0x0bd5];3;16;5;5;30000;0;16;16;1;10;1;-1;0;0;1;1;1;0;0;0;0;0
Intel(R) Data Center GPU Max 1550 [0x0bd5];3;16;5;13;30000;0;8;8;1;15;1;-1;0;0;0;0;1;1;2;2;1;0
Intel(R) Data Center GPU Max 1550 [0x0bd5];3;16;5;16;30000;0;8;16;1;7;1;-2;-1;0;1;0;1;0;0;0;1;0
Intel(R) Data Center GPU Max 1550 [0x0bd5];3;16;5;24;30000;0;8;16;1;4;1;-1;-1;0;0;0;1;1;0;2;1;0
Intel(R) Data Center GPU Max 1550 [0x0bd5];3;16;5;26;30000;0;8;16;1;14;1;-1;-2;1;1;0;1;0;0;2;1;0
Intel(R) Data Center GPU Max 1550 [0x0bd5];3;16;7;3;30000;0;24;16;1;7;1;-1;1;0;0;1;1;0;2;0;0;0
Intel(R) Data Center GPU Max 1550 [0x0bd5];3;16;9;9;30000;0;15;16;1;2;1;-1;-2;1;1;0;1;0;0;0;0;0
Intel(R) Data Center GPU Max 1550 [0x0bd5];3;16;9;16;30000;0;8;16;1;1;1;-1;-2;1;1;0;1;1;0;2;0;0
Intel(R) Data Center GPU Max 1550 [0x0bd5];3;16;9;22;30000;0;8;16;1;1;1;-1;0;0;1;0;1;1;0;2;0;0
Intel(R) Data Center GPU Max 1550 [0x0bd5];3;16;13;5;30000;0;22;16;1;8;1;-1;-1;1;1;0;1;1;2;2;0;0
Intel(R) Data Center GPU Max 1550 [0x0bd5];3;16;16;5;30000;0;32;16;1;1;1;-1;0;1;0;1;1;0;0;0;0;0
Intel(R) Data Center GPU Max 1550 [0x0bd5];3;16;16;9;30000;0;25;16;1;1;1;-1;-2;1;1;0;1;0;0;0;0;0
Intel(R) Data Center GPU Max 1550 [0x0bd5];3;16;16;16;30000;0;8;16;1;3;1;-2;1;0;1;0;1;0;0;2;0;0
Intel(R) Data Center GPU Max 1550 [0x0bd5];3;16;16;22;30000;0;21;16;1;1;1;-2;0;1;0;1;1;0;0;2;0;0
Intel(R) Data Center GPU Max 1550 [0x0bd5];3;16;16;55;30000;0;8;16;1;1;16;-2;0;1;1;0;1;1;2;0;0;0
Intel(R) Data Center GPU Max 1550 [0x0bd5];3;16;22;9;30000;0;21;16;1;9;1;-2;-1;1;1;1;1;1;0;0;1;0
Intel(R) Data Center GPU Max 1550 [0x0bd5];3;16;22;16;30000;0;8;16;1;1;1;-1;1;1;0;1;1;0;2;0;0;0
Intel(R) Data Center GPU Max 1550 [0x0bd5];3;16;22;22;30000;0;8;16;1;1;1;0;1;1;1;0;1;1;2;0;0;0
Intel(R) Data Center GPU Max 1550 [0x0bd5];3;16;24;5;30000;0;22;16;1;13;1;-2;-2;1;0;1;1;1;0;2;0;0
Intel(R) Data Center GPU Max 1550 [0x0bd5];3;16;26;5;30000;0;22;16;1;6;1;1;-1;1;1;0;1;0;2;0;0;0
Intel(R) Data Center GPU Max 1550 [0x0bd5];3;16;29;29;30000;0;16;16;1;1;29;-2;0;1;1;1;1;0;0;0;0;1
Intel(R) Data Center GPU Max 1550 [0x0bd5];3;16;29;55;30000;0;15;16;1;1;29;0;0;1;0;1;1;1;2;0;0;1
Intel(R) Data Center GPU Max 1550 [0x0bd5];3;16;55;16;30000;0;31;16;1;1;55;1;0;1;0;0;1;0;2;2;0;1
Intel(R) Data Center GPU Max 1550 [0x0bd5];3;16;55;29;30000;0;32;16;1;1;55;-1;0;0;1;0;1;0;2;0;0;1
Intel(R) Data Center GPU Max 1550 [0x0bd5];3;16;55;55;30000;0;15;16;1;1;55;1;1;1;1;0;1;0;2;0;0;0
Intel(R) Data Center GPU Max 1550 [0x0bd5];3;17;1;1;30000;0;15;17;1;1;17;1;1;0;1;0;1;1;0;2;0;0
Intel(R) Data Center GPU Max 1550 [0x0bd5];3;17;4;4;30000;0;16;17;1;1;1;-1;-1;0;0;1;1;0;2;0;0;0
Intel(R) Data Center GPU Max 1550 [0x0bd5];3;17;4;5;30000;0;17;17;1;3;1;-1;-2;0;1;0;1;1;2;2;0;0
Intel(R) Data Center GPU Max 1550 [0x0bd5];3;17;4;13;30000;0;9;17;1;1;1;-2;0;0;1;1;1;0;2;0;0;0
Intel(R) Data Center GPU Max 1550 [0x0bd5];3;17;4;17;30000;0;8;17;1;1;1;-2;-2;0;1;0;1;1;0;2;0;0
Intel(R) Data Center GPU Max 1550 [0x0bd5];3;17;4;32;30000;0;8;17;1;1;1;-1;-2;0;1;1;1;1;2;0;0;0
Intel(R) Data Center GPU Max 1550 [0x0bd5];3;17;5;4;30000;0;16;17;1;1;1;-2;-2;0;0;0;1;0;0;0;0;0
Intel(R) Data Center GPU Max 1550 [0x0bd5];3;17;5;5;30000;0;16;17;1;12;1;-2;-2;0;1;0;1;0;0;2;0;0
Intel(R) Data Center GPU Max 1550 [0x0bd5];3;17;5;13;30000;0;8;17;1;4;1;-1;-2;0;1;1;1;0;0;2;1;0
Intel(R) Data Center GPU Max 1550 [0x0bd5];3;17;5;17;30000;0;8;17;1;2;1;-2;-1;0;0;0;1;1;0;2;1;0
Intel(R) Data Center GPU Max 1550 [0x0bd5];3;17;5;32;30000;0;8;17;1;1;1;-1;0;0;1;0;1;1;0;0;0;0
Intel(R) Data Center GPU Max 1550 [0x0bd5];3;17;13;4;30000;0;19;17;1;1;1;-1;0;1;0;0;1;0;0;2;0;0
Intel(R) Data Center GPU Max 1550 [0x0bd5];3;17;13;5;30000;0;22;17;1;3;1;-2;1;1;0;0;1;1;2;2;0;0
Intel(R) Data Center GPU Max 1550 [0x0bd5];3;17;13;13;30000;0;14;17;1;1;1;-1;0;1;1;1;1;1;2;0;0;0
Intel(R) Data Center GPU Max 1550 [0x0bd5];3;17;13;17;30000;0;14;17;1;1;1;-2;-2;1;0;0;1;1;2;0;0;0
Intel(R) Data Center GPU Max 1550 [0x0bd5];3;17;13;32;30000;0;8;17;1;1;1;-1;0;1;1;0;1;1;2;0;0;0
Intel(R) Data Center GPU Max 1550 [0x0bd5];3;17;17;4;30000;0;21;17;1;6;1;-2;1;0;0;1;1;0;0;0;0;0
Intel(R) Data Center GPU Max 1550 [0x0bd5];3;17;17;5;30000;0;17;17;1;10;1;-2;-1;0;1;0;1;1;2;2;0;0
Intel(R) Data Center GPU Max 1550 [0x0bd5];3;17;17;13;30000;0;8;17;1;1;1;0;1;1;1;1;1;1;2;0;0;0
Intel(R) Data Center GPU Max 1550 [0x0bd5];3;17;17;17;30000;0;8;17;1;4;1;-1;-1;0;1;1;1;1;2;2;0;0
Intel(R) Data Center GPU Max 1550 [0x0bd5];3;17;17;32;30000;0;17;17;1;1;1;0;0;1;1;0;1;1;2;0;0;1
Intel(R) Data Center GPU Max 1550 [0x0bd5];3;17;17;35;30000;0;15;17;1;1;1;-2;-2;1;1;1;1;0;2;0;0;1
Intel(R) Data Center GPU Max 1550 [0x0bd5];3;17;32;4;30000;0;36;17;1;10;1;-2;-1;0;0;0;1;0;0;2;0;0
Intel(R) Data Center GPU Max 1550 [0x0bd5];3;17;32;5;30000;0;28;17;1;8;1;-2;1;0;0;1;1;1;2;0;0;0
Intel(R) Data Center GPU Max 1550 [0x0bd5];3;17;32;13;30000;0;11;17;1;1;0;-2;1;1;0;1;1;1;0;0;0;0
Intel(R) Data Center GPU Max 1550 [0x0bd5];3;17;32;17;30000;0;27;17;1;1;1;-1;0;0;1;1;1;1;2;0;0;1
Intel(R) Data Center GPU Max 1550 [0x0bd5];3;17;32;32;30000;0;16;17;1;1;1;1;0;1;1;0;1;1;2;0;0;1
Intel(R) Data Center GPU Max 1550 [0x0bd5];3;17;32;35;30000;0;15;17;1;1;1;0;0;0;0;0;1;1;2;0;0;1
Intel(R) Data Center GPU Max 1550 [0x0bd5];3;17;35;17;30000;0;15;17;1;1;1;-2;-2;1;1;1;1;0;2;0;0;1
Intel(R) Data Center GPU Max 1550 [0x0bd5];3;17;35;32;30000;0;30;17;1;1;1;-1;-2;0;0;0;1;1;0;0;0;1
Intel(R) Data Center GPU Max 1550 [0x0bd5];3;17;35;35;30000;0;16;17;1;1;1;1;0;1;0;1;1;1;2;0;0;1
Intel(R) Data Center GPU Max 1550 [0x0bd5];3;20;20;20;30000;0;8;20;1;1;1;-1;1;0;1;0;1;0;0;0;0;0
Intel(R) Data Center GPU Max 1550 [0x0bd5];3;22;9;9;30000;0;14;22;1;1;1;-1;-1;1;1;0;1;1;0;2;0;0
Intel(R) Data Center GPU Max 1550 [0x0bd5];3;22;9;16;30000;0;8;22;1;1;1;-1;-2;1;1;0;1;1;0;2;0;0
Intel(R) Data Center GPU Max 1550 [0x0bd5];3;22;9;22;30000;0;8;22;1;1;1;-1;0;0;0;0;1;1;0;2;0;0
Intel(R) Data Center GPU Max 1550 [0x0bd5];3;22;9;32;30000;0;8;22;1;1;1;-1;-2;1;0;0;1;1;2;0;0;0
Intel(R) Data Center GPU Max 1550 [0x0bd5];3;22;16;9;30000;0;22;22;1;1;1;-1;-2;1;1;0;1;1;2;0;0;0
Intel(R) Data Center GPU Max 1550 [0x0bd5];3;22;16;16;30000;0;15;22;1;1;1;-1;0;1;0;1;1;1;2;0;0;0
Intel(R) Data Center GPU Max 1550 [0x0bd5];3;22;16;22;30000;0;8;22;1;1;1;-2;-2;1;1;1;1;0;2;0;0;0
Intel(R) Data Center GPU Max 1550 [0x0bd5];3;22;22;9;30000;0;13;22;1;1;1;-2;1;0;0;0;1;0;0;0;0;0
Intel(R) Data Center GPU Max 1550 [0x0bd5];3;22;22;16;30000;0;8;22;1;1;1;-2;1;0;1;0;1;0;0;0;0;0
Intel(R) Data Center GPU Max 1550 [0x0bd5];3;22;22;22;30000;0;15;22;1;1;1;-2;-1;0;0;0;1;0;2;0;0;1
Intel(R) Data Center GPU Max 1550 [0x0bd5];3;22;22;32;30000;0;15;22;1;1;1;-1;-2;0;1;0;1;0;0;0;0;1
Intel(R) Data Center GPU Max 1550 [0x0bd5];3;22;32;9;30000;0;41;22;1;10;1;1;-2;0;1;0;1;0;1;2;1;0
Intel(R) Data Center GPU Max 1550 [0x0bd5];3;22;32;22;30000;0;17;22;1;1;1;-2;-1;1;1;0;1;1;2;0;0;1
Intel(R) Data Center GPU Max 1550 [0x0bd5];3;22;32;32;30000;0;15;22;1;1;1;1;-1;1;1;1;1;0;0;0;0;1
Intel(R) Data Center GPU Max 1550 [0x0bd5];3;23;23;23;30000;0;15;23;1;1;1;-1;-1;0;0;0;1;0;2;0;0;1
Intel(R) Data Center GPU Max 1550 [0x0bd5];3;24;5;5;30000;0;17;8;1;21;1;-1;0;1;0;0;1;1;2;0;1;0
Intel(R) Data Center GPU Max 1550 [0x0bd5];3;24;5;13;30000;0;8;8;1;17;1;-1;3;1;1;0;1;0;2;1;0;0
Intel(R) Data Center GPU Max 1550 [0x0bd5];3;24;5;16;30000;0;8;8;1;7;1;-1;4;1;1;0;1;0;2;2;1;0
Intel(R) Data Center GPU Max 1550 [0x0bd5];3;24;5;24;30000;0;8;8;1;1;24;0;-2;1;1;0;1;1;0;0;0;0
Intel(R) Data Center GPU Max 1550 [0x0bd5];3;24;5;26;30000;0;6;8;1;19;24;0;0;0;0;0;1;0;0;1;1;0
Intel(R) Data Center GPU Max 1550 [0x0bd5];3;24;5;32;30000;0;1;8;1;6;24;-2;1;0;0;0;0;0;2;1;1;0
Intel(R) Data Center GPU Max 1550 [0x0bd5];3;24;13;5;30000;0;20;24;1;24;1;-2;-2;1;1;1;1;0;0;1;0;0
Intel(R) Data Center GPU Max 1550 [0x0bd5];3;24;13;13;30000;0;15;8;1;17;24;1;3;0;0;0;1;0;1;2;0;0
Intel(R) Data Center GPU Max 1550 [0x0bd5];3;24;13;24;30000;0;6;8;1;1;24;0;5;1;0;1;1;0;0;0;0;0
Intel(R) Data Center GPU Max 1550 [0x0bd5];3;24;13;26;30000;0;17;24;1;1;24;-1;-1;0;0;1;1;0;2;0;0;1
Intel(R) Data Center GPU Max 1550 [0x0bd5];3;24;13;32;30000;0;5;8;1;1;24;-1;-2;1;0;0;1;0;2;2;0;1
Intel(R) Data Center GPU Max 1550 [0x0bd5];3;24;16;5;30000;0;24;24;1;8;1;-2;-2;1;1;0;1;0;0;1;0;0
Intel(R) Data Center GPU Max 1550 [0x0bd5];3;24;24;5;30000;0;32;8;1;18;24;-1;3;1;1;1;1;1;2;2;0;0
Intel(R) Data Center GPU Max 1550 [0x0bd5];3;24;24;13;30000;0;15;24;1;10;24;-2;-1;0;1;0;1;0;2;2;0;0
Intel(R) Data Center GPU Max 1550 [0x0bd5];3;24;24;24;30000;0;15;24;1;1;1;-2;-1;0;1;0;1;1;0;0;0;1
Intel(R) Data Center GPU Max 1550 [0x0bd5];3;24;24;26;30000;0;16;24;1;1;1;0;-1;0;1;0;1;0;2;0;0;1
Intel(R) Data Center GPU Max 1550 [0x0bd5];3;24;24;32;30000;0;15;24;1;1;1;0;-1;0;0;1;1;0;2;0;0;1
Intel(R) Data Center GPU Max 1550 [0x0bd5];3;24;26;5;30000;0;32;8;1;16;26;1;4;0;1;0;1;1;2;2;0;0
Intel(R) Data Center GPU Max 1550 [0x0bd5];3;24;26;13;30000;0;13;8;1;23;26;-2;5;0;1;0;1;1;1;2;0;0
Intel(R) Data Center GPU Max 1550 [0x0bd5];3;24;26;24;30000;0;13;8;1;6;1;1;1;0;0;0;1;0;0;2;1;1
Intel(R) Data Center GPU Max 1550 [0x0bd5];3;24;26;26;30000;0;16;24;1;1;26;-1;-1;0;1;0;1;0;2;0;0;1
Intel(R) Data Center GPU Max 1550 [0x0bd5];3;24;26;32;30000;0;15;24;1;1;1;-1;-1;1;1;0;1;0;2;0;0;1
Intel(R) Data Center GPU Max 1550 [0x0bd5];3;24;32;5;30000;0;32;8;1;19;32;1;4;0;0;0;1;1;1;2;0;0
Intel(R) Data Center GPU Max 1550 [0x0bd5];3;24;32;13;30000;0;32;8;1;8;32;0;-2;0;1;0;1;1;1;2;0;0
Intel(R) Data Center GPU Max 1550 [0x0bd5];3;24;32;24;30000;0;19;24;1;1;1;1;-1;0;1;1;1;1;2;0;0;1
Intel(R) Data Center GPU Max 1550 [0x0bd5];3;24;32;26;30000;0;11;8;1;8;32;-2;-2;0;0;1;1;0;1;0;0;1
Intel(R) Data Center GPU Max 1550 [0x0bd5];3;24;32;32;30000;0;15;24;1;1;1;-1;-1;1;1;0;1;1;2;0;0;1
Intel(R) Data Center GPU Max 1550 [0x0bd5];3;25;4;4;30000;0;16;25;1;1;1;-2;-1;0;1;0;1;0;0;1;0;0
Intel(R) Data Center GPU Max 1550 [0x0bd5];3;25;4;5;30000;0;11;8;1;11;1;-1;3;1;0;1;1;0;0;0;0;0
Intel(R) Data Center GPU Max 1550 [0x0bd5];3;25;4;7;30000;0;9;8;1;24;25;-1;3;1;0;1;1;0;0;0;1;0
Intel(R) Data Center GPU Max 1550 [0x0bd5];3;25;4;9;30000;0;8;8;1;23;25;0;3;0;0;0;1;0;1;2;0;0
Intel(R) Data Center GPU Max 1550 [0x0bd5];3;25;4;13;30000;0;8;25;1;9;25;0;-1;0;1;0;1;0;2;0;0;0
Intel(R) Data Center GPU Max 1550 [0x0bd5];3;25;4;25;30000;0;10;8;1;13;25;-2;0;0;1;1;1;0;2;1;1;0
Intel(R) Data Center GPU Max 1550 [0x0bd5];3;25;4;26;30000;0;8;8;1;1;25;1;0;0;1;1;1;0;0;0;0;0
Intel(R) Data Center GPU Max 1550 [0x0bd5];3;25;4;28;30000;0;8;8;1;1;25;1;1;0;1;0;1;1;2;0;0;0
Intel(R) Data Center GPU Max 1550 [0x0bd5];3;25;4;32;30000;0;8;8;1;1;25;0;4;0;0;0;1;1;2;0;0;0
Intel(R) Data Center GPU Max 1550 [0x0bd5];3;25;4;45;30000;0;8;8;1;1;25;0;4;0;0;0;1;1;2;0;0;0
Intel(R) Data Center GPU Max 1550 [0x0bd5];3;25;5;4;30000;0;16;25;1;23;1;-2;0;1;0;0;1;1;0;1;0;0
Intel(R) Data Center GPU Max 1550 [0x0bd5];3;25;5;5;30000;0;9;8;1;16;25;-1;5;0;0;0;1;0;2;2;0;0
Intel(R) Data Center GPU Max 1550 [0x0bd5];3;25;5;7;30000;0;8;8;1;13;25;-1;3;0;1;0;1;0;1;2;0;0
Intel(R) Data Center GPU Max 1550 [0x0bd5];3;25;5;9;30000;0;9;8;1;2;25;-1;4;0;0;0;1;0;1;2;0;0
Intel(R) Data Center GPU Max 1550 [0x0bd5];3;25;5;13;30000;0;8;8;1;17;25;-1;4;1;0;0;1;0;0;0;0;0
Intel(R) Data Center GPU Max 1550 [0x0bd5];3;25;5;25;30000;0;4;8;1;14;25;-1;0;0;0;1;1;0;2;1;1;0
Intel(R) Data Center GPU Max 1550 [0x0bd5];3;25;5;26;30000;0;8;8;1;1;25;0;3;0;0;0;1;0;2;0;0;0
Intel(R) Data Center GPU Max 1550 [0x0bd5];3;25;5;28;30000;0;8;8;1;1;25;-1;3;0;1;0;1;0;2;0;0;0
Intel(R) Data Center GPU Max 1550 [0x0bd5];3;25;5;32;30000;0;9;8;1;2;25;-1;4;0;0;1;1;0;0;1;1;0
Intel(R) Data Center GPU Max 1550 [0x0bd5];3;25;5;45;30000;0;23;8;1;19;25;-1;0;0;0;0;1;1;0;1;1;0
Intel(R) Data Center GPU Max 1550 [0x0bd5];3;25;7;4;30000;0;11;8;1;22;25;-1;1;0;1;0;1;1;1;2;0;0
Intel(R) Data Center GPU Max 1550 [0x0bd5];3;25;7;5;30000;0;11;8;1;2;25;-1;-1;0;0;0;1;0;1;2;0;0
Intel(R) Data Center GPU Max 1550 [0x0bd5];3;25;7;7;30000;0;8;8;1;23;25;1;3;0;0;0;1;0;2;1;0;0
Intel(R) Data Center GPU Max 1550 [0x0bd5];3;25;7;9;30000;0;10;8;1;1;25;-2;6;0;0;0;1;0;2;0;0;0
Intel(R) Data Center GPU Max 1550 [0x0bd5];3;25;7;13;30000;0;8;8;1;12;25;-1;-1;1;0;0;1;1;0;0;0;0
Intel(R) Data Center GPU Max 1550 [0x0bd5];3;25;7;25;30000;0;10;8;1;4;25;-1;1;0;0;1;1;0;2;1;1;0
Intel(R) Data Center GPU Max 1550 [0x0bd5];3;25;7;26;30000;0;8;25;1;2;25;-2;4;0;0;0;1;0;0;0;0;0
Intel(R) Data Center GPU Max 1550 [0x0bd5];3;25;7;28;30000;0;10;8;1;6;25;-2;1;0;1;1;1;0;2;1;1;0
Intel(R) Data Center GPU Max 1550 [0x0bd5];3;25;7;32;30000;0;2;8;1;1;25;0;5;1;0;1;1;1;2;0;0;0
Intel(R) Data Center GPU Max 1550 [0x0bd5];3;25;7;45;30000;0;19;8;1;20;25;1;-1;0;0;0;1;0;0;0;0;0
Intel(R) Data Center GPU Max 1550 [0x0bd5];3;25;9;4;30000;0;15;8;1;18;25;-2;4;0;1;0;1;0;1;2;0;0
Intel(R) Data Center GPU Max 1550 [0x0bd5];3;25;9;5;30000;0;10;8;1;18;25;0;-2;0;0;1;1;0;0;2;0;0
Intel(R) Data Center GPU Max 1550 [0x0bd5];3;25;9;7;30000;0;15;8;1;3;25;0;-1;0;0;1;1;0;1;2;0;0
Intel(R) Data Center GPU Max 1550 [0x0bd5];3;25;9;9;30000;0;15;8;1;19;25;-2;3;0;0;1;1;0;1;2;0;0
Intel(R) Data Center GPU Max 1550 [0x0bd5];3;25;9;13;30000;0;10;8;1;14;25;1;5;1;1;1;1;0;0;2;0;0
Intel(R) Data Center GPU Max 1550 [0x0bd5];3;25;9;25;30000;0;7;8;1;1;25;0;1;0;0;0;1;0;2;0;0;0
Intel(R) Data Center GPU Max 1550 [0x0bd5];3;25;9;26;30000;0;3;8;1;1;25;-1;4;1;0;1;1;0;2;0;0;0
Intel(R) Data Center GPU Max 1550 [0x0bd5];3;25;9;28;30000;0;3;8;1;1;25;-2;0;1;1;1;1;0;2;0;0;0
Intel(R) Data Center GPU Max 1550 [0x0bd5];3;25;9;32;30000;0;4;8;1;1;25;-1;2;0;1;0;1;1;2;0;0;0
Intel(R) Data Center GPU Max 1550 [0x0bd5];3;25;9;45;30000;0;15;8;1;1;25;-1;1;0;0;0;1;0;2;1;0;0
Intel(R) Data Center GPU Max 1550 [0x0bd5];3;25;13;4;30000;0;15;8;1;8;25;-2;5;1;0;0;1;0;1;2;0;0
Intel(R) Data Center GPU Max 1550 [0x0bd5];3;25;13;5;30000;0;15;8;1;6;25;-2;0;0;1;0;1;0;1;2;0;0
Intel(R) Data Center GPU Max 1550 [0x0bd5];3;25;13;7;30000;0;15;8;1;14;25;-1;-1;1;0;1;1;0;1;2;0;0
Intel(R) Data Center GPU Max 1550 [0x0bd5];3;25;13;9;30000;0;15;8;1;4;25;-2;1;0;1;1;1;0;1;2;0;0
Intel(R) Data Center GPU Max 1550 [0x0bd5];3;25;13;13;30000;0;15;8;1;18;25;-2;4;1;1;0;1;1;0;0;0;0
Intel(R) Data Center GPU Max 1550 [0x0bd5];3;25;13;14;30000;0;8;25;1;10;25;1;1;0;0;0;1;0;2;0;0;0
Intel(R) Data Center GPU Max 1550 [0x0bd5];3;25;13;25;30000;0;3;8;1;1;25;-2;3;1;1;0;1;0;0;0;0;0
Intel(R) Data Center GPU Max 1550 [0x0bd5];3;25;13;26;30000;0;16;8;1;1;25;-1;0;1;0;1;1;1;2;1;0;0
Intel(R) Data Center GPU Max 1550 [0x0bd5];3;25;13;28;30000;0;8;8;1;1;25;-2;2;0;0;1;1;0;0;0;0;0
Intel(R) Data Center GPU Max 1550 [0x0bd5];3;25;13;32;30000;0;8;16;1;1;25;-2;3;0;1;0;1;0;2;0;0;0
Intel(R) Data Center GPU Max 1550 [0x0bd5];3;25;13;45;30000;0;15;25;1;1;25;0;-1;0;1;0;1;1;2;0;0;1
Intel(R) Data Center GPU Max 1550 [0x0bd5];3;25;14;13;30000;0;8;25;1;10;25;1;1;0;1;1;1;0;2;2;0;0
Intel(R) Data Center GPU Max 1550 [0x0bd5];3;25;14;14;30000;0;8;25;1;12;25;-2;-1;0;0;0;1;0;2;0;0;0
Intel(R) Data Center GPU Max 1550 [0x0bd5];3;25;14;25;30000;0;15;25;1;1;25;0;-1;0;1;1;1;1;2;0;0;1
Intel(R) Data Center GPU Max 1550 [0x0bd5];3;25;14;26;30000;0;15;25;1;1;25;0;-1;1;0;0;1;1;2;0;0;1
Intel(R) Data Center GPU Max 1550 [0x0bd5];3;25;14;32;30000;0;16;25;1;1;25;1;-1;0;1;0;1;1;2;0;0;1
Intel(R) Data Center GPU Max 1550 [0x0bd5];3;25;25;4;30000;0;30;8;1;17;25;0;3;0;1;0;1;1;1;2;0;0
Intel(R) Data Center GPU Max 1550 [0x0bd5];3;25;25;5;30000;0;24;8;1;23;25;0;4;0;0;0;1;0;2;2;0;0
Intel(R) Data Center GPU Max 1550 [0x0bd5];3;25;25;7;30000;0;30;8;1;15;25;-2;0;0;1;1;1;0;1;2;0;0
Intel(R) Data Center GPU Max 1550 [0x0bd5];3;25;25;9;30000;0;30;8;1;20;25;1;3;0;1;1;1;0;1;2;0;0
Intel(R) Data Center GPU Max 1550 [0x0bd5];3;25;25;13;30000;0;15;25;1;1;25;0;-1;0;0;1;1;0;2;0;0;1
Intel(R) Data Center GPU Max 1550 [0x0bd5];3;25;25;14;30000;0;17;25;1;1;25;-1;-1;1;1;0;1;1;2;0;0;1
Intel(R) Data Center GPU Max 1550 [0x0bd5];3;25;25;25;30000;0;16;25;1;1;1;-2;-1;0;0;0;1;0;0;0;0;1
Intel(R) Data Center GPU Max 1550 [0x0bd5];3;25;25;26;30000;0;17;25;1;1;25;-1;-1;1;1;0;1;1;0;0;0;1
Intel(R) Data Center GPU Max 1550 [0x0bd5];3;25;25;28;30000;0;15;25;1;1;25;0;-1;1;1;1;1;1;2;0;0;1
Intel(R) Data Center GPU Max 1550 [0x0bd5];3;25;25;32;30000;0;15;25;1;1;25;-1;-1;1;0;1;1;0;2;0;0;1
Intel(R) Data Center GPU Max 1550 [0x0bd5];3;25;25;45;30000;0;8;25;1;1;25;-1;1;0;1;0;1;0;0;0;0;0
Intel(R) Data Center GPU Max 1550 [0x0bd5];3;25;26;4;30000;0;30;8;1;20;26;-1;3;0;0;0;1;1;1;2;0;0
Intel(R) Data Center GPU Max 1550 [0x0bd5];3;25;26;5;30000;0;30;8;1;2;26;-2;1;0;0;0;1;0;1;2;0;0
Intel(R) Data Center GPU Max 1550 [0x0bd5];3;25;26;7;30000;0;30;8;1;18;26;-1;3;0;1;1;1;0;1;2;0;0
Intel(R) Data Center GPU Max 1550 [0x0bd5];3;25;26;9;30000;0;30;8;1;10;26;0;4;0;1;0;1;0;1;2;0;0
Intel(R) Data Center GPU Max 1550 [0x0bd5];3;25;26;13;30000;0;16;25;1;1;26;1;-1;1;0;0;1;1;2;0;0;1
Intel(R) Data Center GPU Max 1550 [0x0bd5];3;25;26;14;30000;0;17;25;1;1;26;1;-1;0;1;0;1;1;2;0;0;1
Intel(R) Data Center GPU Max 1550 [0x0bd5];3;25;26;25;30000;0;15;25;1;1;26;0;-1;1;1;0;1;1;0;0;0;1
Intel(R) Data Center GPU Max 1550 [0x0bd5];3;25;26;26;30000;0;15;25;1;1;26;-1;-1;1;1;0;1;1;2;0;0;1
Intel(R) Data Center GPU Max 1550 [0x0bd5];3;25;26;28;30000;0;6;16;1;15;26;-1;4;0;1;1;1;0;0;0;0;1
Intel(R) Data Center GPU Max 1550 [0x0bd5];3;25;26;32;30000;0;16;25;1;1;26;-1;-1;1;0;0;1;0;2;0;0;1
Intel(R) Data Center GPU Max 1550 [0x0bd5];3;25;26;45;30000;0;8;25;1;1;26;-2;1;0;0;1;1;1;1;0;0;0
Intel(R) Data Center GPU Max 1550 [0x0bd5];3;25;28;4;30000;0;30;8;1;17;28;-1;6;0;1;0;1;1;1;2;0;0
Intel(R) Data Center GPU Max 1550 [0x0bd5];3;25;28;5;30000;0;14;8;1;17;28;1;3;0;0;1;1;0;0;2;0;0
Intel(R) Data Center GPU Max 1550 [0x0bd5];3;25;28;7;30000;0;30;8;1;23;28;-2;3;1;1;1;1;0;1;2;0;0
Intel(R) Data Center GPU Max 1550 [0x0bd5];3;25;28;9;30000;0;8;25;1;1;28;-2;1;0;1;0;1;0;1;0;0;0
Intel(R) Data Center GPU Max 1550 [0x0bd5];3;25;28;13;30000;0;15;25;1;1;28;-1;-1;1;0;1;1;1;2;0;0;1
Intel(R) Data Center GPU Max 1550 [0x0bd5];3;25;28;25;30000;0;15;25;1;1;28;-2;-1;0;1;0;1;1;2;0;0;1
Intel(R) Data Center GPU Max 1550 [0x0bd5];3;25;28;26;30000;0;15;25;1;1;28;1;-1;1;0;1;1;1;2;0;0;1
Intel(R) Data Center GPU Max 1550 [0x0bd5];3;25;28;28;30000;0;16;25;1;1;28;-2;-1;0;0;0;1;1;2;0;0;1
Intel(R) Data Center GPU Max 1550 [0x0bd5];3;25;28;32;30000;0;16;25;1;1;28;0;-1;0;1;1;1;1;2;0;0;1
Intel(R) Data Center GPU Max 1550 [0x0bd5];3;25;28;45;30000;0;17;25;1;1;28;-1;-1;1;1;1;1;0;2;0;0;1
Intel(R) Data Center GPU Max 1550 [0x0bd5];3;25;32;25;30000;0;8;25;1;1;32;-1;1;0;1;0;1;0;1;0;0;0
Intel(R) Data Center GPU Max 1550 [0x0bd5];3;25;32;26;30000;0;8;25;1;1;32;-2;1;0;1;0;1;0;1;0;0;0
Intel(R) Data Center GPU Max 1550 [0x0bd5];3;25;32;28;30000;0;8;25;1;1;32;-2;1;0;0;0;1;0;1;0;0;0
Intel(R) Data Center GPU Max 1550 [0x0bd5];3;25;32;32;30000;0;4;25;1;1;32;-1;1;0;0;0;1;0;1;0;0;0
Intel(R) Data Center GPU Max 1550 [0x0bd5];3;25;32;45;30000;0;8;25;1;1;32;-1;1;0;1;0;1;0;1;0;0;0
Intel(R) Data Center GPU Max 1550 [0x0bd5];3;25;45;13;30000;0;31;25;1;1;45;-2;-1;1;0;0;1;0;2;0;0;1
Intel(R) Data Center GPU Max 1550 [0x0bd5];3;25;45;25;30000;0;30;25;1;1;45;-1;-1;0;0;1;1;0;2;0;0;1
Intel(R) Data Center GPU Max 1550 [0x0bd5];3;25;45;26;30000;0;5;8;1;1;45;0;2;0;0;0;1;0;2;0;0;1
Intel(R) Data Center GPU Max 1550 [0x0bd5];3;25;45;28;30000;0;7;8;1;1;45;-2;2;0;0;1;1;0;2;2;0;1
Intel(R) Data Center GPU Max 1550 [0x0bd5];3;25;45;32;30000;0;15;25;1;1;45;1;-1;1;0;0;1;1;2;0;0;1
Intel(R) Data Center GPU Max 1550 [0x0bd5];3;25;45;45;30000;0;10;25;1;1;45;0;1;1;0;0;1;1;2;0;0;1
Intel(R) Data Center GPU Max 1550 [0x0bd5];3;26;4;4;30000;0;16;26;1;6;1;-1;-2;1;0;1;1;0;2;0;0;0
Intel(R) Data Center GPU Max 1550 [0x0bd5];3;26;5;5;30000;0;14;26;1;3;1;-2;-1;0;1;0;1;0;2;1;0;0
Intel(R) Data Center GPU Max 1550 [0x0bd5];3;26;5;13;30000;0;15;26;1;16;0;-1;0;0;0;1;1;0;2;2;0;0
Intel(R) Data Center GPU Max 1550 [0x0bd5];3;26;5;16;30000;0;8;8;1;16;1;0;3;0;1;1;1;1;2;1;1;0
Intel(R) Data Center GPU Max 1550 [0x0bd5];3;26;5;26;30000;0;8;8;1;1;26;0;1;0;0;0;1;0;0;0;0;0
Intel(R) Data Center GPU Max 1550 [0x0bd5];3;26;5;28;30000;0;5;26;1;13;26;-2;4;0;1;0;1;0;0;0;0;0
Intel(R) Data Center GPU Max 1550 [0x0bd5];3;26;5;32;30000;0;3;26;1;11;26;-2;3;1;1;0;1;0;0;1;1;0
Intel(R) Data Center GPU Max 1550 [0x0bd5];3;26;5;45;30000;0;6;8;1;1;26;-2;3;0;0;1;1;1;0;1;0;0
Intel(R) Data Center GPU Max 1550 [0x0bd5];3;26;7;4;30000;0;11;8;1;24;26;-1;3;0;1;0;1;1;1;2;0;0
Intel(R) Data Center GPU Max 1550 [0x0bd5];3;26;7;5;30000;0;8;8;1;19;26;-2;-1;1;0;0;1;1;2;2;0;0
Intel(R) Data Center GPU Max 1550 [0x0bd5];3;26;7;7;30000;0;8;8;1;18;26;-2;1;0;1;0;1;0;2;1;0;0
Intel(R) Data Center GPU Max 1550 [0x0bd5];3;26;7;9;30000;0;8;8;1;22;26;-1;3;1;1;0;1;0;1;2;0;0
Intel(R) Data Center GPU Max 1550 [0x0bd5];3;26;7;13;30000;0;8;8;1;14;26;-1;5;0;0;0;1;0;0;1;0;0
Intel(R) Data Center GPU Max 1550 [0x0bd5];3;26;7;25;30000;0;4;8;1;25;26;1;3;0;1;0;1;0;0;0;0;0
Intel(R) Data Center GPU Max 1550 [0x0bd5];3;26;7;26;30000;0;4;8;1;1;26;0;4;0;0;1;1;0;2;0;0;0
Intel(R) Data Center GPU Max 1550 [0x0bd5];3;26;7;28;30000;0;8;26;1;1;26;0;3;0;1;0;1;0;2;0;0;0
Intel(R) Data Center GPU Max 1550 [0x0bd5];3;26;7;32;30000;0;9;8;1;17;26;-1;4;0;0;0;1;0;0;1;1;0
Intel(R) Data Center GPU Max 1550 [0x0bd5];3;26;7;45;30000;0;8;16;1;1;26;-1;4;0;0;0;1;1;2;0;0;0
Intel(R) Data Center GPU Max 1550 [0x0bd5];3;26;9;4;30000;0;16;8;1;25;26;0;5;0;1;0;1;0;1;2;0;0
Intel(R) Data Center GPU Max 1550 [0x0bd5];3;26;9;5;30000;0;12;8;1;15;26;-2;-1;1;0;1;1;0;0;0;0;0
Intel(R) Data Center GPU Max 1550 [0x0bd5];3;26;9;7;30000;0;15;8;1;10;26;0;3;0;0;1;1;0;1;2;0;0
Intel(R) Data Center GPU Max 1550 [0x0bd5];3;26;9;9;30000;0;17;8;1;17;26;0;-1;1;1;1;1;0;1;2;0;0
Intel(R) Data Center GPU Max 1550 [0x0bd5];3;26;9;13;30000;0;8;26;1;19;26;0;-1;0;1;0;1;0;2;2;0;0
Intel(R) Data Center GPU Max 1550 [0x0bd5];3;26;9;25;30000;0;3;8;1;25;26;1;1;0;1;1;1;1;2;1;1;0
Intel(R) Data Center GPU Max 1550 [0x0bd5];3;26;9;26;30000;0;4;26;1;1;26;1;1;0;0;0;1;0;2;0;0;0
Intel(R) Data Center GPU Max 1550 [0x0bd5];3;26;9;28;30000;0;3;8;1;25;26;-2;4;0;1;0;1;0;2;1;1;0
Intel(R) Data Center GPU Max 1550 [0x0bd5];3;26;9;32;30000;0;8;26;1;1;26;0;1;0;1;0;1;1;2;0;0;0
Intel(R) Data Center GPU Max 1550 [0x0bd5];3;26;9;45;30000;0;15;26;1;1;26;0;-1;1;1;1;1;0;2;0;0;1
Intel(R) Data Center GPU Max 1550 [0x0bd5];3;26;13;4;30000;0;15;8;1;25;26;-1;6;0;0;1;1;0;1;2;0;0
Intel(R) Data Center GPU Max 1550 [0x0bd5];3;26;13;5;30000;0;22;26;1;3;1;-2;-2;1;0;1;1;0;2;0;0;0
Intel(R) Data Center GPU Max 1550 [0x0bd5];3;26;13;7;30000;0;15;8;1;26;26;0;5;1;1;0;1;0;1;2;0;0
Intel(R) Data Center GPU Max 1550 [0x0bd5];3;26;13;9;30000;0;15;8;1;25;26;1;4;0;1;0;1;0;1;2;0;0
Intel(R) Data Center GPU Max 1550 [0x0bd5];3;26;13;13;30000;0;8;26;1;7;26;1;1;0;1;0;1;0;2;2;0;0
Intel(R) Data Center GPU Max 1550 [0x0bd5];3;26;13;14;30000;0;8;26;1;12;26;-2;1;0;0;0;1;0;2;2;0;0
Intel(R) Data Center GPU Max 1550 [0x0bd5];3;26;13;24;30000;0;16;8;1;1;26;0;0;0;1;1;1;0;2;0;0;0
Intel(R) Data Center GPU Max 1550 [0x0bd5];3;26;13;25;30000;0;15;26;1;1;26;-2;-1;1;0;0;1;1;2;0;0;1
Intel(R) Data Center GPU Max 1550 [0x0bd5];3;26;13;26;30000;0;15;8;1;1;26;-2;4;0;0;0;1;0;2;0;0;0
Intel(R) Data Center GPU Max 1550 [0x0bd5];3;26;13;28;30000;0;15;8;1;1;26;0;4;0;0;1;1;0;2;0;0;1
Intel(R) Data Center GPU Max 1550 [0x0bd5];3;26;13;32;30000;0;15;8;1;1;26;-1;3;0;0;0;1;0;2;0;0;0
Intel(R) Data Center GPU Max 1550 [0x0bd5];3;26;13;45;30000;0;5;8;1;1;26;1;0;0;1;0;1;0;2;0;0;0
Intel(R) Data Center GPU Max 1550 [0x0bd5];3;26;14;13;30000;0;15;8;1;20;26;-2;4;1;1;0;1;1;0;0;0;0
Intel(R) Data Center GPU Max 1550 [0x0bd5];3;26;14;14;30000;0;8;26;1;6;26;1;1;0;0;0;1;0;2;2;0;0
Intel(R) Data Center GPU Max 1550 [0x0bd5];3;26;14;25;30000;0;16;26;1;1;26;0;-1;0;1;1;1;1;2;0;0;1
Intel(R) Data Center GPU Max 1550 [0x0bd5];3;26;14;26;30000;0;15;26;1;1;26;1;-1;0;1;0;1;0;2;0;0;1
Intel(R) Data Center GPU Max 1550 [0x0bd5];3;26;14;32;30000;0;8;26;1;1;26;-1;-1;0;0;0;1;1;2;0;0;1
Intel(R) Data Center GPU Max 1550 [0x0bd5];3;26;16;5;30000;0;22;26;1;25;1;-2;0;1;1;0;1;0;0;0;0;0
Intel(R) Data Center GPU Max 1550 [0x0bd5];3;26;24;5;30000;0;31;8;1;23;26;0;3;0;0;0;1;0;1;2;0;0
Intel(R) Data Center GPU Max 1550 [0x0bd5];3;26;24;13;30000;0;17;26;1;1;26;0;-1;1;0;1;1;0;2;0;0;1
Intel(R) Data Center GPU Max 1550 [0x0bd5];3;26;24;24;30000;0;12;8;1;1;1;-2;1;0;1;0;1;0;2;0;0;0
Intel(R) Data Center GPU Max 1550 [0x0bd5];3;26;24;26;30000;0;15;26;1;1;1;1;-1;1;1;1;1;0;2;0;0;1
Intel(R) Data Center GPU Max 1550 [0x0bd5];3;26;24;32;30000;0;12;8;1;1;1;1;1;0;0;0;1;0;2;0;0;0
Intel(R) Data Center GPU Max 1550 [0x0bd5];3;26;25;4;30000;0;28;8;1;10;26;-1;4;0;1;0;1;0;2;0;0;0
Intel(R) Data Center GPU Max 1550 [0x0bd5];3;26;25;5;30000;0;24;8;1;26;26;0;0;1;0;0;1;0;2;2;0;0
Intel(R) Data Center GPU Max 1550 [0x0bd5];3;26;25;7;30000;0;24;8;1;23;26;0;5;0;0;0;1;0;2;2;0;0
Intel(R) Data Center GPU Max 1550 [0x0bd5];3;26;25;9;30000;0;8;26;1;14;26;0;-1;0;1;0;1;0;2;2;0;0
Intel(R) Data Center GPU Max 1550 [0x0bd5];3;26;25;13;30000;0;15;26;1;1;26;0;-1;1;1;0;1;0;2;0;0;1
Intel(R) Data Center GPU Max 1550 [0x0bd5];3;26;25;14;30000;0;32;8;1;5;26;1;1;0;0;1;1;0;1;2;1;0
Intel(R) Data Center GPU Max 1550 [0x0bd5];3;26;25;25;30000;0;15;8;1;1;26;1;2;0;0;1;1;0;2;0;0;0
Intel(R) Data Center GPU Max 1550 [0x0bd5];3;26;25;26;30000;0;5;8;1;1;26;-2;-2;0;0;0;1;0;2;0;0;0
Intel(R) Data Center GPU Max 1550 [0x0bd5];3;26;25;28;30000;0;8;8;1;1;26;-2;6;1;0;1;1;0;2;0;0;1
Intel(R) Data Center GPU Max 1550 [0x0bd5];3;26;25;32;30000;0;3;8;1;1;26;1;2;0;0;0;1;0;2;0;0;0
Intel(R) Data Center GPU Max 1550 [0x0bd5];3;26;25;45;30000;0;10;8;1;1;26;-2;2;0;1;1;1;1;2;0;0;1
Intel(R) Data Center GPU Max 1550 [0x0bd5];3;26;26;4;30000;0;30;8;1;22;26;0;3;0;1;1;1;1;1;2;0;0
Intel(R) Data Center GPU Max 1550 [0x0bd5];3;26;26;5;30000;0;30;8;1;3;26;0;5;0;0;0;1;0;1;2;0;0
Intel(R) Data Center GPU Max 1550 [0x0bd5];3;26;26;7;30000;0;24;8;1;6;26;-1;5;0;0;0;1;0;2;2;0;0
Intel(R) Data Center GPU Max 1550 [0x0bd5];3;26;26;9;30000;0;20;26;1;1;26;-2;1;0;1;1;1;1;0;0;0;0
Intel(R) Data Center GPU Max 1550 [0x0bd5];3;26;26;13;30000;0;30;8;1;26;26;-1;-1;1;1;1;1;1;0;2;0;0
Intel(R) Data Center GPU Max 1550 [0x0bd5];3;26;26;14;30000;0;15;26;1;1;26;1;-1;0;1;0;1;0;2;0;0;1
Intel(R) Data Center GPU Max 1550 [0x0bd5];3;26;26;24;30000;0;15;26;1;1;1;-1;-1;1;0;0;1;1;2;0;0;1
Intel(R) Data Center GPU Max 1550 [0x0bd5];3;26;26;25;30000;0;8;26;1;1;26;-1;-1;1;1;0;1;1;2;0;0;1
Intel(R) Data Center GPU Max 1550 [0x0bd5];3;26;26;26;30000;0;17;26;1;1;1;0;-1;1;0;0;1;1;2;0;0;1
Intel(R) Data Center GPU Max 1550 [0x0bd5];3;26;26;28;30000;0;15;26;1;1;26;-2;-1;1;1;0;1;1;2;0;0;1
Intel(R) Data Center GPU Max 1550 [0x0bd5];3;26;26;32;30000;0;15;26;1;1;1;-2;-1;0;0;0;1;1;2;0;0;1
Intel(R) Data Center GPU Max 1550 [0x0bd5];3;26;26;45;30000;0;8;26;1;1;26;-2;1;0;0;0;1;0;0;0;0;0
Intel(R) Data Center GPU Max 1550 [0x0bd5];3;26;28;4;30000;0;30;8;1;3;28;-2;-1;1;0;0;1;1;1;2;0;0
Intel(R) Data Center GPU Max 1550 [0x0bd5];3;26;28;5;30000;0;30;8;1;14;28;-1;5;1;1;0;1;0;1;2;0;0
Intel(R) Data Center GPU Max 1550 [0x0bd5];3;26;28;7;30000;0;23;26;1;23;28;-2;1;0;0;1;1;1;1;0;0;0
Intel(R) Data Center GPU Max 1550 [0x0bd5];3;26;28;9;30000;0;15;8;1;19;28;1;3;0;1;1;1;0;1;2;0;0
Intel(R) Data Center GPU Max 1550 [0x0bd5];3;26;28;13;30000;0;15;26;1;1;28;0;1;1;0;1;1;1;2;2;0;1
Intel(R) Data Center GPU Max 1550 [0x0bd5];3;26;28;25;30000;0;16;26;1;1;28;-1;-1;1;0;1;1;0;2;0;0;1
Intel(R) Data Center GPU Max 1550 [0x0bd5];3;26;28;26;30000;0;16;26;1;1;28;0;-1;0;0;0;1;0;2;0;0;1
Intel(R) Data Center GPU Max 1550 [0x0bd5];3;26;28;28;30000;0;6;8;1;23;28;1;-1;0;0;1;1;1;0;0;0;1
Intel(R) Data Center GPU Max 1550 [0x0bd5];3;26;28;32;30000;0;15;26;1;1;28;0;-1;1;1;1;1;1;2;0;0;1
Intel(R) Data Center GPU Max 1550 [0x0bd5];3;26;28;45;30000;0;15;26;1;1;28;-1;-1;1;1;0;1;1;0;0;0;1
Intel(R) Data Center GPU Max 1550 [0x0bd5];3;26;32;4;30000;0;37;26;1;12;32;1;6;0;0;0;1;0;1;2;0;0
Intel(R) Data Center GPU Max 1550 [0x0bd5];3;26;32;5;30000;0;30;26;1;6;32;-1;6;0;0;0;1;0;2;0;0;0
Intel(R) Data Center GPU Max 1550 [0x0bd5];3;26;32;7;30000;0;30;26;1;3;32;-1;5;0;0;0;1;0;1;2;0;0
Intel(R) Data Center GPU Max 1550 [0x0bd5];3;26;32;9;30000;0;31;26;1;22;32;1;6;0;1;0;1;0;1;2;0;0
Intel(R) Data Center GPU Max 1550 [0x0bd5];3;26;32;13;30000;0;15;26;1;1;32;1;-1;0;1;0;1;0;2;0;0;1
Intel(R) Data Center GPU Max 1550 [0x0bd5];3;26;32;14;30000;0;21;26;1;25;32;0;-1;0;0;0;1;0;2;0;0;0
Intel(R) Data Center GPU Max 1550 [0x0bd5];3;26;32;24;30000;0;30;8;1;1;1;-1;-1;1;0;0;1;0;1;0;0;0
Intel(R) Data Center GPU Max 1550 [0x0bd5];3;26;32;25;30000;0;8;26;1;1;32;-2;1;0;0;0;1;0;1;0;0;0
Intel(R) Data Center GPU Max 1550 [0x0bd5];3;26;32;26;30000;0;1;26;1;21;32;0;-2;0;0;1;1;0;0;0;0;0
Intel(R) Data Center GPU Max 1550 [0x0bd5];3;26;32;28;30000;0;4;8;1;1;32;-2;-2;0;0;0;1;0;2;0;0;0
Intel(R) Data Center GPU Max 1550 [0x0bd5];3;26;32;32;30000;0;8;26;1;1;0;-2;1;0;0;1;1;1;1;0;0;0
Intel(R) Data Center GPU Max 1550 [0x0bd5];3;26;32;45;30000;0;8;26;1;1;32;-2;1;0;1;0;1;0;1;0;0;0
Intel(R) Data Center GPU Max 1550 [0x0bd5];3;26;45;4;30000;0;22;26;1;15;45;0;5;0;0;0;1;0;0;0;0;0
Intel(R) Data Center GPU Max 1550 [0x0bd5];3;26;45;5;30000;0;23;26;1;11;45;1;4;0;0;0;1;0;2;2;0;0
Intel(R) Data Center GPU Max 1550 [0x0bd5];3;26;45;7;30000;0;15;26;1;7;45;-1;4;0;0;0;1;0;2;2;0;0
Intel(R) Data Center GPU Max 1550 [0x0bd5];3;26;45;9;30000;0;17;26;1;13;45;1;-1;0;0;0;1;0;2;0;0;0
Intel(R) Data Center GPU Max 1550 [0x0bd5];3;26;45;13;30000;0;17;26;1;12;45;0;1;0;0;0;1;0;2;0;0;0
Intel(R) Data Center GPU Max 1550 [0x0bd5];3;26;45;25;30000;0;4;8;1;26;45;-1;4;0;0;0;1;0;0;0;0;0
Intel(R) Data Center GPU Max 1550 [0x0bd5];3;26;45;26;30000;0;5;26;1;1;45;-2;1;0;0;0;1;0;2;0;0;0
Intel(R) Data Center GPU Max 1550 [0x0bd5];3;26;45;28;30000;0;1;26;1;19;45;-2;1;0;0;0;1;0;0;0;0;0
Intel(R) Data Center GPU Max 1550 [0x0bd5];3;26;45;32;30000;0;3;26;1;10;45;1;6;0;0;0;1;0;0;0;0;0
Intel(R) Data Center GPU Max 1550 [0x0bd5];3;26;45;45;30000;0;5;26;1;1;45;1;1;0;1;0;1;0;0;0;0;0
Intel(R) Data Center GPU Max 1550 [0x0bd5];3;28;4;4;30000;0;16;28;1;6;1;-2;-1;1;1;0;1;0;2;0;0;0
Intel(R) Data Center GPU Max 1550 [0x0bd5];3;28;4;5;30000;0;9;8;1;5;28;1;4;0;1;0;1;1;0;0;1;0
Intel(R) Data Center GPU Max 1550 [0x0bd5];3;28;4;7;30000;0;9;8;1;6;28;0;4;0;0;1;1;1;2;2;1;0
Intel(R) Data Center GPU Max 1550 [0x0bd5];3;28;4;9;30000;0;8;8;1;10;28;0;4;0;0;0;1;0;1;2;0;0
Intel(R) Data Center GPU Max 1550 [0x0bd5];3;28;4;13;30000;0;10;8;1;13;28;-1;5;1;1;0;1;1;0;0;0;0
Intel(R) Data Center GPU Max 1550 [0x0bd5];3;28;4;25;30000;0;8;28;1;1;28;0;6;0;0;0;1;0;0;0;0;0
Intel(R) Data Center GPU Max 1550 [0x0bd5];3;28;4;26;30000;0;8;28;1;8;28;-1;4;0;0;0;1;0;0;1;0;0
Intel(R) Data Center GPU Max 1550 [0x0bd5];3;28;4;28;30000;0;8;28;1;1;28;-2;4;0;1;0;1;0;2;0;0;0
Intel(R) Data Center GPU Max 1550 [0x0bd5];3;28;4;32;30000;0;8;28;1;1;28;-1;1;0;0;0;1;0;0;0;0;0
Intel(R) Data Center GPU Max 1550 [0x0bd5];3;28;4;45;30000;0;4;28;1;1;28;1;1;0;0;0;1;0;0;0;0;0
Intel(R) Data Center GPU Max 1550 [0x0bd5];3;28;5;4;30000;0;14;8;1;25;28;0;0;0;1;0;1;0;2;0;0;0
Intel(R) Data Center GPU Max 1550 [0x0bd5];3;28;5;5;30000;0;8;8;1;19;28;0;5;0;0;0;1;0;2;2;0;0
Intel(R) Data Center GPU Max 1550 [0x0bd5];3;28;5;7;30000;0;8;8;1;24;28;-2;0;0;1;0;1;0;1;2;0;0
Intel(R) Data Center GPU Max 1550 [0x0bd5];3;28;5;9;30000;0;8;8;1;9;28;-1;4;0;0;1;1;0;1;2;0;0
Intel(R) Data Center GPU Max 1550 [0x0bd5];3;28;5;13;30000;0;9;8;1;19;28;1;1;1;1;1;1;1;0;2;0;0
Intel(R) Data Center GPU Max 1550 [0x0bd5];3;28;5;25;30000;0;8;28;1;25;28;-1;4;0;0;0;1;0;0;0;0;0
Intel(R) Data Center GPU Max 1550 [0x0bd5];3;28;5;26;30000;0;5;28;1;26;28;-2;4;0;0;0;1;0;0;1;0;0
Intel(R) Data Center GPU Max 1550 [0x0bd5];3;28;13;45;30000;0;2;28;1;1;28;-1;3;0;1;0;1;0;0;2;0;0
Intel(R) Data Center GPU Max 1550 [0x0bd5];3;28;25;25;30000;0;9;28;1;1;28;-1;1;0;0;0;1;0;0;0;0;0
Intel(R) Data Center GPU Max 1550 [0x0bd5];3;28;25;26;30000;0;15;28;1;1;28;-1;6;0;1;0;1;0;1;0;0;0
Intel(R) Data Center GPU Max 1550 [0x0bd5];3;28;25;28;30000;0;8;28;1;1;28;-1;1;0;0;0;1;0;2;0;0;0
Intel(R) Data Center GPU Max 1550 [0x0bd5];3;28;25;32;30000;0;10;8;1;1;28;-2;1;0;1;0;1;0;2;0;0;0
Intel(R) Data Center GPU Max 1550 [0x0bd5];3;28;25;45;30000;0;8;28;1;1;28;-1;1;0;0;0;1;0;0;0;0;0
Intel(R) Data Center GPU Max 1550 [0x0bd5];3;28;26;4;30000;0;28;28;1;4;28;1;4;0;1;0;1;0;2;0;0;0
Intel(R) Data Center GPU Max 1550 [0x0bd5];3;28;26;5;30000;0;28;28;1;13;28;0;6;0;0;0;1;0;2;0;0;0
Intel(R) Data Center GPU Max 1550 [0x0bd5];3;28;26;7;30000;0;30;28;1;18;28;1;4;0;1;0;1;0;1;2;0;0
Intel(R) Data Center GPU Max 1550 [0x0bd5];3;28;26;9;30000;0;32;28;1;23;28;-1;4;0;1;0;1;0;1;2;0;0
Intel(R) Data Center GPU Max 1550 [0x0bd5];3;28;26;13;30000;0;23;28;1;14;28;0;-2;0;0;0;1;0;2;0;0;0
Intel(R) Data Center GPU Max 1550 [0x0bd5];3;28;26;25;30000;0;8;28;1;1;28;-2;1;0;1;0;1;1;0;0;0;0
Intel(R) Data Center GPU Max 1550 [0x0bd5];3;28;26;26;30000;0;15;16;1;1;28;-1;2;0;0;0;1;0;2;0;0;0
Intel(R) Data Center GPU Max 1550 [0x0bd5];3;28;26;28;30000;0;8;28;1;1;28;0;1;0;0;0;1;0;0;0;0;0
Intel(R) Data Center GPU Max 1550 [0x0bd5];3;28;26;32;30000;0;8;28;1;1;28;-2;1;0;1;1;1;1;2;0;0;0
Intel(R) Data Center GPU Max 1550 [0x0bd5];3;28;26;45;30000;0;8;28;1;1;28;0;1;0;0;1;1;1;2;0;0;1
Intel(R) Data Center GPU Max 1550 [0x0bd5];3;28;28;4;30000;0;32;28;1;23;28;-1;4;0;1;0;1;0;1;2;0;0
Intel(R) Data Center GPU Max 1550 [0x0bd5];3;28;28;5;30000;0;41;28;1;12;28;-1;0;0;0;0;1;0;2;0;1;0
Intel(R) Data Center GPU Max 1550 [0x0bd5];3;28;28;7;30000;0;32;28;1;8;28;0;5;0;1;0;1;0;1;2;0;0
Intel(R) Data Center GPU Max 1550 [0x0bd5];3;28;28;9;30000;0;30;28;1;4;28;1;6;0;0;0;1;0;1;2;0;0
Intel(R) Data Center GPU Max 1550 [0x0bd5];3;28;28;13;30000;0;8;28;1;5;28;1;1;0;1;0;1;0;2;2;0;0
Intel(R) Data Center GPU Max 1550 [0x0bd5];3;28;28;14;30000;0;15;28;1;1;28;-2;1;0;0;0;1;0;0;0;0;0
Intel(R) Data Center GPU Max 1550 [0x0bd5];3;28;28;25;30000;0;16;28;1;1;28;-1;1;0;1;1;1;0;0;0;0;1
Intel(R) Data Center GPU Max 1550 [0x0bd5];3;28;28;26;30000;0;16;28;1;1;28;-1;-1;1;1;1;1;0;0;0;0;1
Intel(R) Data Center GPU Max 1550 [0x0bd5];3;28;28;28;30000;0;8;8;1;18;1;-2;4;1;0;1;1;0;0;0;0;1
Intel(R) Data Center GPU Max 1550 [0x0bd5];3;28;28;32;30000;0;9;28;1;1;28;-2;1;0;1;0;1;0;0;0;0;0
Intel(R) Data Center GPU Max 1550 [0x0bd5];3;28;28;45;30000;0;8;28;1;1;28;-1;1;0;1;0;1;0;0;0;0;0
Intel(R) Data Center GPU Max 1550 [0x0bd5];3;28;32;4;30000;0;30;28;1;21;32;1;5;0;0;0;1;0;0;0;0;0
Intel(R) Data Center GPU Max 1550 [0x0bd5];3;28;32;5;30000;0;32;28;1;16;32;-1;6;0;1;0;1;0;1;2;0;0
Intel(R) Data Center GPU Max 1550 [0x0bd5];3;28;32;7;30000;0;30;28;1;22;32;-2;4;0;0;0;1;0;1;2;0;0
Intel(R) Data Center GPU Max 1550 [0x0bd5];3;28;32;9;30000;0;21;28;1;23;32;1;-1;0;1;0;1;0;2;2;0;0
Intel(R) Data Center GPU Max 1550 [0x0bd5];3;28;32;13;30000;0;17;28;1;1;32;0;1;0;0;1;1;0;2;0;0;1
Intel(R) Data Center GPU Max 1550 [0x0bd5];3;28;32;25;30000;0;15;16;1;1;32;0;-2;0;0;0;1;0;2;0;0;0
Intel(R) Data Center GPU Max 1550 [0x0bd5];3;28;32;26;30000;0;8;28;1;1;32;-2;1;0;1;0;1;0;2;0;0;0
Intel(R) Data Center GPU Max 1550 [0x0bd5];3;28;32;28;30000;0;8;28;1;1;32;0;1;0;0;0;1;0;0;0;0;0
Intel(R) Data Center GPU Max 1550 [0x0bd5];3;28;32;32;30000;0;8;28;1;1;32;1;1;0;0;0;1;0;2;0;0;0
Intel(R) Data Center GPU Max 1550 [0x0bd5];3;28;32;45;30000;0;8;28;1;1;32;-1;1;0;1;0;1;0;0;0;0;0
Intel(R) Data Center GPU Max 1550 [0x0bd5];3;28;45;4;30000;0;23;28;1;24;45;1;5;0;0;0;1;0;2;2;0;0
Intel(R) Data Center GPU Max 1550 [0x0bd5];3;28;45;5;30000;0;25;28;1;5;45;1;6;0;0;0;1;0;0;2;0;0
Intel(R) Data Center GPU Max 1550 [0x0bd5];3;28;45;7;30000;0;26;28;1;19;45;-1;6;0;1;0;1;0;2;2;0;0
Intel(R) Data Center GPU Max 1550 [0x0bd5];3;28;45;9;30000;0;18;28;1;4;45;-2;5;0;0;0;1;0;1;2;0;0
Intel(R) Data Center GPU Max 1550 [0x0bd5];3;28;45;13;30000;0;15;28;1;6;45;0;-1;0;0;0;1;0;2;2;0;0
Intel(R) Data Center GPU Max 1550 [0x0bd5];3;28;45;25;30000;0;7;8;1;1;45;1;0;0;1;0;1;0;2;0;0;0
Intel(R) Data Center GPU Max 1550 [0x0bd5];3;28;45;26;30000;0;4;8;1;1;45;1;0;0;1;0;1;0;2;0;0;0
Intel(R) Data Center GPU Max 1550 [0x0bd5];3;28;45;28;30000;0;4;8;1;13;45;-1;-1;0;0;0;1;0;0;0;0;0
Intel(R) Data Center GPU Max 1550 [0x0bd5];3;28;45;32;30000;0;15;28;1;1;45;-1;1;0;0;0;1;0;2;0;0;0
Intel(R) Data Center GPU Max 1550 [0x0bd5];3;28;45;45;30000;0;3;8;1;28;45;-1;5;0;0;0;1;0;0;0;0;0
Intel(R) Data Center GPU Max 1550 [0x0bd5];3;29;14;14;30000;0;8;29;1;15;29;1;-1;0;1;0;1;0;1;0;0;0
Intel(R) Data Center GPU Max 1550 [0x0bd5];3;29;14;16;30000;0;8;29;1;1;29;-1;2;0;0;0;1;0;0;0;0;0
Intel(R) Data Center GPU Max 1550 [0x0bd5];3;29;14;29;30000;0;8;29;1;1;29;0;3;0;1;0;1;0;2;0;0;0
Intel(R) Data Center GPU Max 1550 [0x0bd5];3;29;14;32;30000;0;8;29;1;1;29;1;-2;0;1;0;1;0;1;0;0;0
Intel(R) Data Center GPU Max 1550 [0x0bd5];3;29;16;14;30000;0;8;29;1;22;29;1;5;0;1;0;1;0;0;0;0;0
Intel(R) Data Center GPU Max 1550 [0x0bd5];3;29;16;16;30000;0;15;29;1;1;29;-2;4;0;0;0;1;0;0;0;0;0
Intel(R) Data Center GPU Max 1550 [0x0bd5];3;29;16;29;30000;0;8;29;1;1;29;1;-1;0;0;0;1;0;1;0;0;0
Intel(R) Data Center GPU Max 1550 [0x0bd5];3;29;16;55;30000;0;8;16;1;1;29;0;-2;0;0;0;1;0;2;0;0;0
Intel(R) Data Center GPU Max 1550 [0x0bd5];3;29;29;14;30000;0;6;29;1;22;29;1;-1;0;1;0;1;0;1;2;0;0
Intel(R) Data Center GPU Max 1550 [0x0bd5];3;29;29;16;30000;0;13;29;1;1;29;-2;1;0;0;1;1;1;0;0;0;0
Intel(R) Data Center GPU Max 1550 [0x0bd5];3;29;29;29;30000;0;8;29;1;1;29;-1;1;0;0;0;1;0;0;0;0;0
Intel(R) Data Center GPU Max 1550 [0x0bd5];3;29;29;32;30000;0;10;8;1;1;29;1;4;1;1;1;1;1;2;0;0;0
Intel(R) Data Center GPU Max 1550 [0x0bd5];3;29;29;55;30000;0;8;29;1;1;29;-1;1;0;0;0;1;0;0;0;0;0
Intel(R) Data Center GPU Max 1550 [0x0bd5];3;29;32;14;30000;0;9;29;1;18;32;-1;-1;0;0;0;1;0;1;0;0;0
Intel(R) Data Center GPU Max 1550 [0x0bd5];3;29;32;29;30000;0;15;16;1;1;32;-1;1;0;1;1;1;0;2;0;0;0
Intel(R) Data Center GPU Max 1550 [0x0bd5];3;29;32;32;30000;0;30;29;1;1;32;-2;5;0;1;0;1;0;2;0;0;0
Intel(R) Data Center GPU Max 1550 [0x0bd5];3;29;32;55;30000;0;5;16;1;1;32;1;3;0;0;0;1;0;0;0;0;0
Intel(R) Data Center GPU Max 1550 [0x0bd5];3;29;55;16;30000;0;15;29;1;12;55;0;1;0;0;0;1;0;1;0;0;0
Intel(R) Data Center GPU Max 1550 [0x0bd5];3;29;55;29;30000;0;6;8;1;11;55;-1;6;0;1;0;1;0;0;0;0;0
Intel(R) Data Center GPU Max 1550 [0x0bd5];3;29;55;32;30000;0;6;8;1;1;55;0;6;0;0;0;1;0;1;1;0;0
Intel(R) Data Center GPU Max 1550 [0x0bd5];3;29;55;55;30000;0;3;16;1;1;55;0;2;0;0;0;1;0;2;0;0;0
Intel(R) Data Center GPU Max 1550 [0x0bd5];3;30;30;30;30000;0;8;30;1;1;1;-2;1;0;0;1;1;1;0;0;0;0
Intel(R) Data Center GPU Max 1550 [0x0bd5];3;30;30;76;30000;0;8;30;1;1;30;-1;1;0;0;0;1;0;0;0;0;0
Intel(R) Data Center GPU Max 1550 [0x0bd5];3;30;76;30;30000;0;27;8;1;1;76;-1;4;0;0;0;1;0;2;0;0;0
Intel(R) Data Center GPU Max 1550 [0x0bd5];3;30;76;76;30000;0;4;16;1;1;76;1;2;0;0;1;1;0;2;0;0;0
Intel(R) Data Center GPU Max 1550 [0x0bd5];3;32;4;4;30000;0;19;8;1;25;1;-2;-2;1;0;1;1;1;2;0;1;0
Intel(R) Data Center GPU Max 1550 [0x0bd5];3;32;4;5;30000;0;17;8;1;25;1;-1;-2;1;0;1;1;1;2;0;1;0
Intel(R) Data Center GPU Max 1550 [0x0bd5];3;32;4;7;30000;0;9;8;1;7;32;0;4;1;1;0;1;1;0;0;1;0
Intel(R) Data Center GPU Max 1550 [0x0bd5];3;32;4;9;30000;0;8;32;1;13;32;1;1;0;0;1;1;1;2;2;1;0
Intel(R) Data Center GPU Max 1550 [0x0bd5];3;32;4;13;30000;0;11;8;1;7;1;-2;-1;1;0;0;1;0;2;2;0;0
Intel(R) Data Center GPU Max 1550 [0x0bd5];3;32;4;17;30000;0;8;8;1;12;1;-2;5;1;0;1;1;0;2;2;0;0
Intel(R) Data Center GPU Max 1550 [0x0bd5];3;32;4;25;30000;0;8;8;1;10;32;0;6;0;1;0;1;0;0;1;1;0
Intel(R) Data Center GPU Max 1550 [0x0bd5];3;32;4;26;30000;0;8;8;1;1;32;-1;6;0;1;1;1;1;0;1;1;0
Intel(R) Data Center GPU Max 1550 [0x0bd5];3;32;4;28;30000;0;5;8;1;13;32;0;4;0;1;1;1;1;0;1;1;0
Intel(R) Data Center GPU Max 1550 [0x0bd5];3;32;4;32;30000;0;8;32;1;1;1;-1;-2;0;1;0;1;1;2;0;0;0
Intel(R) Data Center GPU Max 1550 [0x0bd5];3;32;4;45;30000;0;8;8;1;1;32;-1;4;1;0;0;1;1;2;0;0;0
Intel(R) Data Center GPU Max 1550 [0x0bd5];3;32;5;4;30000;0;17;16;1;21;1;-1;0;1;0;1;1;0;2;0;0;0
Intel(R) Data Center GPU Max 1550 [0x0bd5];3;32;5;5;30000;0;17;8;1;5;1;1;0;0;0;0;1;1;2;2;0;0
Intel(R) Data Center GPU Max 1550 [0x0bd5];3;32;5;7;30000;0;9;8;1;6;32;-1;-1;0;0;0;1;0;0;2;1;0
Intel(R) Data Center GPU Max 1550 [0x0bd5];3;32;5;9;30000;0;8;8;1;30;32;1;-1;0;0;0;1;0;0;0;1;0
Intel(R) Data Center GPU Max 1550 [0x0bd5];3;32;5;13;30000;0;8;32;1;26;1;-2;-2;0;1;0;1;0;0;2;1;0
Intel(R) Data Center GPU Max 1550 [0x0bd5];3;32;5;17;30000;0;8;32;1;14;1;-1;-1;0;0;0;1;1;2;2;1;0
Intel(R) Data Center GPU Max 1550 [0x0bd5];3;32;5;24;30000;0;8;8;1;1;32;-2;-1;0;0;0;1;0;2;1;0;0
Intel(R) Data Center GPU Max 1550 [0x0bd5];3;32;5;25;30000;0;2;32;1;1;32;1;2;1;1;0;1;0;0;2;1;0
Intel(R) Data Center GPU Max 1550 [0x0bd5];3;32;5;26;30000;0;9;8;1;1;32;-2;5;1;0;1;1;0;0;0;0;0
Intel(R) Data Center GPU Max 1550 [0x0bd5];3;32;5;28;30000;0;4;32;1;21;32;-1;6;0;0;0;1;0;0;0;0;0
Intel(R) Data Center GPU Max 1550 [0x0bd5];3;32;5;32;30000;0;8;32;1;1;1;-1;-1;0;0;0;1;0;0;0;0;0
Intel(R) Data Center GPU Max 1550 [0x0bd5];3;32;5;45;30000;0;2;8;1;15;32;-2;6;0;0;1;1;0;0;1;1;0
Intel(R) Data Center GPU Max 1550 [0x0bd5];3;32;7;4;30000;0;17;8;1;30;32;-2;5;0;1;0;1;0;0;0;0;0
Intel(R) Data Center GPU Max 1550 [0x0bd5];3;32;7;5;30000;0;14;8;1;18;32;1;1;1;0;1;1;0;2;1;0;0
Intel(R) Data Center GPU Max 1550 [0x0bd5];3;32;7;7;30000;0;14;8;1;26;32;-1;5;0;0;0;1;0;2;2;0;0
Intel(R) Data Center GPU Max 1550 [0x0bd5];3;32;7;9;30000;0;8;8;1;21;32;0;4;0;1;0;1;1;2;0;1;0
Intel(R) Data Center GPU Max 1550 [0x0bd5];3;32;7;13;30000;0;21;8;1;10;32;-1;6;0;0;0;1;0;1;2;0;0
Intel(R) Data Center GPU Max 1550 [0x0bd5];3;32;7;25;30000;0;8;8;1;1;32;1;5;1;1;0;1;1;0;0;1;0
Intel(R) Data Center GPU Max 1550 [0x0bd5];3;32;7;26;30000;0;8;8;1;1;32;0;0;1;0;0;1;0;2;0;0;0
Intel(R) Data Center GPU Max 1550 [0x0bd5];3;32;7;28;30000;0;4;8;1;17;32;0;4;1;0;1;1;0;0;1;1;0
Intel(R) Data Center GPU Max 1550 [0x0bd5];3;32;7;32;30000;0;17;8;1;25;32;-2;4;0;0;0;1;0;0;0;0;0
Intel(R) Data Center GPU Max 1550 [0x0bd5];3;32;7;45;30000;0;8;8;1;1;32;-1;1;0;0;0;1;1;2;0;1;0
Intel(R) Data Center GPU Max 1550 [0x0bd5];3;32;9;4;30000;0;17;8;1;19;32;1;5;0;0;0;1;1;0;0;0;0
Intel(R) Data Center GPU Max 1550 [0x0bd5];3;32;9;5;30000;0;15;8;1;20;32;-1;4;1;1;0;1;0;2;2;0;0
Intel(R) Data Center GPU Max 1550 [0x0bd5];3;32;9;7;30000;0;15;8;1;22;32;0;5;0;0;0;1;0;1;2;0;0
Intel(R) Data Center GPU Max 1550 [0x0bd5];3;32;9;9;30000;0;10;8;1;1;32;1;4;0;1;0;1;0;0;0;0;0
Intel(R) Data Center GPU Max 1550 [0x0bd5];3;32;9;13;30000;0;15;8;1;11;32;0;4;0;1;0;1;0;1;2;0;0
Intel(R) Data Center GPU Max 1550 [0x0bd5];3;32;9;22;30000;0;3;8;1;1;32;-1;4;1;0;0;1;0;0;0;0;0
Intel(R) Data Center GPU Max 1550 [0x0bd5];3;32;9;25;30000;0;6;8;1;1;32;-2;5;0;1;0;1;0;0;0;0;0
Intel(R) Data Center GPU Max 1550 [0x0bd5];3;32;9;26;30000;0;8;16;1;1;32;1;2;0;1;1;1;1;0;0;1;0
Intel(R) Data Center GPU Max 1550 [0x0bd5];3;32;9;28;30000;0;3;8;1;8;32;-1;4;0;0;1;1;0;0;0;0;0
Intel(R) Data Center GPU Max 1550 [0x0bd5];3;32;9;32;30000;0;5;8;1;32;32;0;4;0;1;0;1;0;0;1;0;0
Intel(R) Data Center GPU Max 1550 [0x0bd5];3;32;9;45;30000;0;2;32;1;31;32;1;5;0;1;0;1;0;0;0;0;0
Intel(R) Data Center GPU Max 1550 [0x0bd5];3;32;13;4;30000;0;22;32;1;8;1;-1;1;1;0;1;1;1;0;2;0;0
Intel(R) Data Center GPU Max 1550 [0x0bd5];3;32;13;5;30000;0;20;32;1;8;1;-1;0;1;1;1;1;0;2;1;0;0
Intel(R) Data Center GPU Max 1550 [0x0bd5];3;32;13;7;30000;0;17;8;1;3;32;0;6;0;1;0;1;0;2;2;0;0
Intel(R) Data Center GPU Max 1550 [0x0bd5];3;32;13;9;30000;0;21;32;1;27;32;-1;-1;0;1;1;1;0;0;0;1;0
Intel(R) Data Center GPU Max 1550 [0x0bd5];3;32;13;13;30000;0;9;32;1;21;1;-1;-2;1;0;0;1;1;0;2;0;0
Intel(R) Data Center GPU Max 1550 [0x0bd5];3;32;13;14;30000;0;31;32;1;15;32;1;-1;1;1;0;1;0;0;0;1;0
Intel(R) Data Center GPU Max 1550 [0x0bd5];3;32;13;17;30000;0;8;32;1;17;1;-2;-2;0;0;0;1;1;2;2;0;0
Intel(R) Data Center GPU Max 1550 [0x0bd5];3;32;13;24;30000;0;15;8;1;1;32;-1;0;1;1;1;1;1;2;2;1;1
Intel(R) Data Center GPU Max 1550 [0x0bd5];3;32;13;25;30000;0;8;8;1;1;32;0;4;1;0;0;1;1;0;0;0;0
Intel(R) Data Center GPU Max 1550 [0x0bd5];3;32;13;26;30000;0;16;32;1;1;32;-2;4;0;0;1;1;0;2;2;0;1
Intel(R) Data Center GPU Max 1550 [0x0bd5];3;32;13;28;30000;0;15;8;1;1;32;0;3;1;1;0;1;0;2;0;0;1
Intel(R) Data Center GPU Max 1550 [0x0bd5];3;32;13;32;30000;0;8;32;1;1;1;-2;0;0;0;0;1;1;0;0;0;0
Intel(R) Data Center GPU Max 1550 [0x0bd5];3;32;13;45;30000;0;4;8;1;1;32;-2;1;0;0;1;1;1;0;0;1;0
Intel(R) Data Center GPU Max 1550 [0x0bd5];3;32;14;13;30000;0;15;32;1;28;32;-2;6;0;0;0;1;0;1;2;0;0
Intel(R) Data Center GPU Max 1550 [0x0bd5];3;32;14;29;30000;0;8;8;1;1;32;-1;6;1;1;0;1;0;0;0;0;0
Intel(R) Data Center GPU Max 1550 [0x0bd5];3;32;14;32;30000;0;8;32;1;1;32;-1;2;0;1;0;1;0;2;0;0;0
Intel(R) Data Center GPU Max 1550 [0x0bd5];3;32;17;4;30000;0;32;8;1;8;1;0;1;1;0;1;1;1;2;2;0;0
Intel(R) Data Center GPU Max 1550 [0x0bd5];3;32;17;5;30000;0;32;8;1;27;1;1;1;0;1;0;1;1;2;2;0;0
Intel(R) Data Center GPU Max 1550 [0x0bd5];3;32;17;13;30000;0;12;8;1;19;1;0;6;0;0;0;1;0;1;2;0;0
Intel(R) Data Center GPU Max 1550 [0x0bd5];3;32;17;17;30000;0;15;32;1;1;1;-1;1;1;0;1;1;1;2;0;0;1
Intel(R) Data Center GPU Max 1550 [0x0bd5];3;32;17;32;30000;0;12;8;1;1;1;-2;1;1;0;0;1;0;2;2;0;1
Intel(R) Data Center GPU Max 1550 [0x0bd5];3;32;22;22;30000;0;12;8;1;1;1;1;4;1;0;0;1;0;0;0;0;0
Intel(R) Data Center GPU Max 1550 [0x0bd5];3;32;22;32;30000;0;17;8;1;1;1;-2;0;1;1;0;1;1;2;2;0;1
Intel(R) Data Center GPU Max 1550 [0x0bd5];3;32;24;24;30000;0;12;8;1;1;32;1;-2;0;1;0;1;0;0;0;0;0
Intel(R) Data Center GPU Max 1550 [0x0bd5];3;32;24;26;30000;0;12;8;1;1;32;-1;5;0;0;0;1;0;0;0;0;0
Intel(R) Data Center GPU Max 1550 [0x0bd5];3;32;24;32;30000;0;13;8;1;1;1;-2;1;0;1;0;1;1;2;2;1;1
Intel(R) Data Center GPU Max 1550 [0x0bd5];3;32;25;25;30000;0;15;32;1;1;32;-1;1;0;1;1;1;1;2;0;0;1
Intel(R) Data Center GPU Max 1550 [0x0bd5];3;32;25;26;30000;0;9;32;1;1;32;-1;1;0;1;0;1;0;2;0;0;1
Intel(R) Data Center GPU Max 1550 [0x0bd5];3;32;25;28;30000;0;6;16;1;1;32;-1;4;1;0;1;1;0;0;0;0;0
Intel(R) Data Center GPU Max 1550 [0x0bd5];3;32;25;32;30000;0;6;8;1;1;32;-2;0;1;0;0;1;0;2;2;0;1
Intel(R) Data Center GPU Max 1550 [0x0bd5];3;32;25;45;30000;0;10;8;1;1;32;-2;4;1;1;1;1;1;0;0;0;0
Intel(R) Data Center GPU Max 1550 [0x0bd5];3;32;26;24;30000;0;10;8;1;1;1;0;0;1;1;1;1;1;0;0;0;0
Intel(R) Data Center GPU Max 1550 [0x0bd5];3;32;26;25;30000;0;10;32;1;1;32;-1;4;1;0;0;1;1;0;0;0;0
Intel(R) Data Center GPU Max 1550 [0x0bd5];3;32;26;26;30000;0;30;8;1;15;1;1;2;0;1;0;1;1;0;2;1;1
Intel(R) Data Center GPU Max 1550 [0x0bd5];3;32;26;28;30000;0;12;8;1;13;32;-2;4;0;0;0;1;0;0;2;1;1
Intel(R) Data Center GPU Max 1550 [0x0bd5];3;32;26;32;30000;0;15;8;1;1;1;-1;-2;1;1;1;1;0;1;0;0;1
Intel(R) Data Center GPU Max 1550 [0x0bd5];3;32;26;45;30000;0;20;8;1;1;32;-1;5;0;1;1;1;0;1;0;0;1
Intel(R) Data Center GPU Max 1550 [0x0bd5];3;32;28;25;30000;0;20;8;1;1;32;1;4;0;1;1;1;0;1;0;0;1
Intel(R) Data Center GPU Max 1550 [0x0bd5];3;32;28;26;30000;0;30;8;1;29;32;1;2;0;0;0;1;1;0;2;1;1
Intel(R) Data Center GPU Max 1550 [0x0bd5];3;32;28;28;30000;0;30;16;1;1;32;0;4;1;0;1;1;0;1;0;0;1
Intel(R) Data Center GPU Max 1550 [0x0bd5];3;32;28;32;30000;0;20;8;1;1;32;-2;-2;1;1;1;1;0;1;0;0;1
Intel(R) Data Center GPU Max 1550 [0x0bd5];3;32;28;45;30000;0;12;8;1;1;32;0;1;0;1;1;1;0;1;0;0;1
Intel(R) Data Center GPU Max 1550 [0x0bd5];3;32;29;14;30000;0;31;8;1;32;32;-2;-1;1;0;0;1;1;0;2;0;1
Intel(R) Data Center GPU Max 1550 [0x0bd5];3;32;29;29;30000;0;30;8;1;25;32;0;4;1;1;0;1;0;0;2;1;1
Intel(R) Data Center GPU Max 1550 [0x0bd5];3;32;29;32;30000;0;32;8;1;1;32;0;1;1;1;0;1;0;2;2;0;1
Intel(R) Data Center GPU Max 1550 [0x0bd5];3;32;29;55;30000;0;59;8;1;1;32;0;4;1;0;0;1;0;1;0;0;1
Intel(R) Data Center GPU Max 1550 [0x0bd5];3;32;32;4;30000;0;30;16;1;27;1;-2;4;0;0;0;1;0;2;2;0;0
Intel(R) Data Center GPU Max 1550 [0x0bd5];3;32;32;5;30000;0;30;32;1;10;1;-2;6;0;0;0;1;0;2;0;0;0
Intel(R) Data Center GPU Max 1550 [0x0bd5];3;32;32;7;30000;0;30;32;1;27;32;1;4;0;1;0;1;0;1;2;0;0
Intel(R) Data Center GPU Max 1550 [0x0bd5];3;32;32;9;30000;0;15;32;1;1;1;1;5;0;0;0;1;0;0;0;0;0
Intel(R) Data Center GPU Max 1550 [0x0bd5];3;32;32;13;30000;0;30;32;1;17;1;-1;4;0;1;0;1;0;1;2;0;0
Intel(R) Data Center GPU Max 1550 [0x0bd5];3;32;32;14;30000;0;15;8;1;1;32;1;-2;0;0;0;1;0;2;0;0;0
Intel(R) Data Center GPU Max 1550 [0x0bd5];3;32;32;17;30000;0;11;32;1;1;0;-1;1;0;1;0;1;1;0;0;0;0
Intel(R) Data Center GPU Max 1550 [0x0bd5];3;32;32;22;30000;0;8;32;1;1;1;1;1;0;0;0;1;0;2;0;0;1
Intel(R) Data Center GPU Max 1550 [0x0bd5];3;32;32;24;30000;0;8;32;1;1;1;-2;1;0;0;0;1;0;0;0;0;0
Intel(R) Data Center GPU Max 1550 [0x0bd5];3;32;32;25;30000;0;30;32;1;1;32;1;4;0;0;0;1;0;2;0;0;0
Intel(R) Data Center GPU Max 1550 [0x0bd5];3;32;32;26;30000;0;8;32;1;1;0;-1;1;1;0;1;1;0;0;0;0;0
Intel(R) Data Center GPU Max 1550 [0x0bd5];3;32;32;28;30000;0;10;8;1;1;32;-1;6;0;1;0;1;0;2;1;0;0
Intel(R) Data Center GPU Max 1550 [0x0bd5];3;32;32;29;30000;0;8;32;1;1;32;-2;1;0;1;0;1;0;0;0;0;0
Intel(R) Data Center GPU Max 1550 [0x0bd5];3;32;32;32;30000;0;8;32;1;1;1;-1;1;0;0;0;1;0;0;0;0;0
Intel(R) Data Center GPU Max 1550 [0x0bd5];3;32;32;45;30000;0;10;32;1;1;32;-1;1;0;0;0;1;0;0;0;0;0
Intel(R) Data Center GPU Max 1550 [0x0bd5];3;32;32;55;30000;0;10;32;1;1;32;-1;1;0;0;0;1;0;0;0;0;0
Intel(R) Data Center GPU Max 1550 [0x0bd5];3;32;45;4;30000;0;31;32;1;17;45;-2;5;0;0;0;1;0;0;2;0;0
Intel(R) Data Center GPU Max 1550 [0x0bd5];3;32;45;5;30000;0;27;32;1;26;45;-1;5;0;0;0;1;0;0;2;0;0
Intel(R) Data Center GPU Max 1550 [0x0bd5];3;32;45;7;30000;0;28;32;1;2;45;-1;4;0;0;0;1;0;2;2;0;0
Intel(R) Data Center GPU Max 1550 [0x0bd5];3;32;45;9;30000;0;19;32;1;1;45;1;6;0;0;0;1;0;2;0;0;0
Intel(R) Data Center GPU Max 1550 [0x0bd5];3;32;45;13;30000;0;28;32;1;22;45;0;4;0;0;0;1;0;1;2;0;0
Intel(R) Data Center GPU Max 1550 [0x0bd5];3;32;45;25;30000;0;16;8;1;1;45;-1;5;0;0;1;1;0;1;0;0;1
Intel(R) Data Center GPU Max 1550 [0x0bd5];3;32;45;26;30000;0;19;8;1;21;45;0;-1;0;1;1;1;0;1;2;0;1
Intel(R) Data Center GPU Max 1550 [0x0bd5];3;32;45;28;30000;0;12;8;1;1;45;1;5;1;1;0;1;1;1;0;0;1
Intel(R) Data Center GPU Max 1550 [0x0bd5];3;32;45;32;30000;0;34;8;1;31;45;-1;-2;0;1;0;1;1;1;2;0;1
Intel(R) Data Center GPU Max 1550 [0x0bd5];3;32;45;45;30000;0;12;8;1;1;45;-2;-2;0;0;1;1;1;1;0;0;1
Intel(R) Data Center GPU Max 1550 [0x0bd5];3;32;55;29;30000;0;12;16;1;19;55;-2;2;0;0;0;1;1;0;2;1;1
Intel(R) Data Center GPU Max 1550 [0x0bd5];3;32;55;32;30000;0;18;8;1;6;55;0;-2;0;1;0;1;0;0;0;1;1
Intel(R) Data Center GPU Max 1550 [0x0bd5];3;32;55;55;30000;0;8;8;1;1;55;-2;0;1;0;0;1;1;1;0;0;1
Intel(R) Data Center GPU Max 1550 [0x0bd5];3;35;17;17;30000;0;12;8;1;21;1;-2;4;1;0;1;1;1;0;2;0;0
Intel(R) Data Center GPU Max 1550 [0x0bd5];3;35;17;32;30000;0;10;8;1;3;1;0;0;0;1;0;1;1;0;0;0;1
Intel(R) Data Center GPU Max 1550 [0x0bd5];3;35;32;35;30000;0;11;8;1;33;35;-1;5;1;1;1;1;0;0;0;0;1
Intel(R) Data Center GPU Max 1550 [0x0bd5];3;35;35;32;30000;0;9;8;1;21;35;0;0;0;0;0;1;0;0;2;1;1
Intel(R) Data Center GPU Max 1550 [0x0bd5];3;35;35;35;30000;0;9;8;1;34;1;0;4;0;1;1;1;1;2;0;1;1
Intel(R) Data Center GPU Max 1550 [0x0bd5];3;36;36;36;30000;0;6;8;1;23;36;1;5;1;0;0;1;0;2;2;1;1
Intel(R) Data Center GPU Max 1550 [0x0bd5];3;40;40;40;30000;0;12;8;1;1;1;0;0;1;0;0;1;1;1;0;0;1
Intel(R) Data Center GPU Max 1550 [0x0bd5];3;45;4;4;30000;0;3;45;1;36;45;0;2;0;1;0;1;0;0;0;0;0
Intel(R) Data Center GPU Max 1550 [0x0bd5];3;45;32;28;30000;0;19;16;1;20;45;-1;6;0;0;0;1;0;0;2;0;1
Intel(R) Data Center GPU Max 1550 [0x0bd5];3;45;45;45;30000;0;30;45;1;1;45;-2;1;0;0;0;1;0;2;0;0;1
Intel(R) Data Center GPU Max 1550 [0x0bd5];3;76;30;30;30000;0;12;16;1;50;76;1;10;0;1;1;1;1;0;0;1;1
Intel(R) Data Center GPU Max 1550 [0x0bd5];3;76;30;76;30000;0;8;76;1;4;76;-1;-1;0;0;0;1;0;0;0;0;0
Intel(R) Data Center GPU Max 1550 [0x0bd5];3;76;76;30;30000;0;47;16;1;1;76;0;5;0;1;0;1;0;0;0;0;0
Intel(R) Data Center GPU Max 1550 [0x0bd5];3;76;76;76;30000;0;47;16;1;1;76;-2;6;0;1;0;1;0;2;0;0;0
