src/acc/opencl/smm/params/tune_multiply_GH200.csv
DEVICE;TYPEID;M;N;K;S;GFLOPS;BS;BM;BN;BK;WS;WG;LU;NZ;AL;TB;TC;AP;AA;AB;AC
NVIDIA GH200 480GB [0x3528];3;1;1;1;30000;0;11;1;1;1;1;-2;0;0;1;0;1;0;2;0;0;0
NVIDIA GH200 480GB [0x3528];3;2;2;2;30000;0;11;2;1;2;2;1;-2;0;0;0;1;0;2;0;0;0
NVIDIA GH200 480GB [0x3528];3;3;3;3;30000;0;12;3;1;2;3;1;0;0;0;0;1;0;0;0;0;0
NVIDIA GH200 480GB [0x3528];3;4;4;4;30000;0;14;4;1;2;4;-1;1;0;0;0;1;0;2;0;0;0
NVIDIA GH200 480GB [0x3528];3;4;4;5;30000;0;13;4;1;2;4;1;-2;0;0;0;1;0;2;0;0;0
NVIDIA GH200 480GB [0x3528];3;4;4;7;30000;0;12;4;1;3;4;-2;-2;0;0;0;1;0;1;0;0;0
NVIDIA GH200 480GB [0x3528];3;4;4;9;30000;0;12;4;1;4;4;0;0;0;0;0;1;0;1;0;0;0
NVIDIA GH200 480GB [0x3528];3;4;4;10;30000;0;5;4;1;4;4;0;-1;0;0;0;1;0;1;2;0;0
NVIDIA GH200 480GB [0x3528];3;4;4;13;30000;0;4;4;1;3;4;1;-2;0;0;0;1;0;1;2;0;0
NVIDIA GH200 480GB [0x3528];3;4;4;15;30000;0;4;4;1;3;4;0;-1;0;0;0;1;0;1;0;0;0
NVIDIA GH200 480GB [0x3528];3;4;4;17;30000;0;4;4;1;4;4;0;0;0;0;0;1;0;1;2;0;0
NVIDIA GH200 480GB [0x3528];3;4;4;25;30000;0;19;4;1;3;4;-2;-2;0;0;0;1;0;1;2;0;0
NVIDIA GH200 480GB [0x3528];3;4;4;26;30000;0;3;4;1;2;4;0;0;0;0;0;1;0;1;0;0;0
NVIDIA GH200 480GB [0x3528];3;4;4;28;30000;0;3;4;1;2;4;-1;0;0;0;0;1;0;1;0;0;0
NVIDIA GH200 480GB [0x3528];3;4;4;32;30000;0;3;4;1;2;4;-2;-2;0;0;0;1;0;1;0;0;0
NVIDIA GH200 480GB [0x3528];3;4;5;4;30000;0;15;4;1;2;5;0;0;0;0;0;1;0;0;0;0;0
NVIDIA GH200 480GB [0x3528];3;4;5;5;30000;0;13;4;1;2;5;0;-2;0;0;0;1;0;2;0;0;0
NVIDIA GH200 480GB [0x3528];3;4;5;7;30000;0;13;4;1;4;5;1;-1;0;0;0;1;0;0;2;0;0
NVIDIA GH200 480GB [0x3528];3;4;5;9;30000;0;10;4;1;2;5;-2;-2;0;0;0;1;0;1;0;0;0
NVIDIA GH200 480GB [0x3528];3;4;5;13;30000;0;5;4;1;2;5;1;-2;0;0;0;1;0;1;2;0;0
NVIDIA GH200 480GB [0x3528];3;4;5;17;30000;0;4;4;1;4;5;-1;-1;0;0;0;1;0;1;0;0;0
NVIDIA GH200 480GB [0x3528];3;4;5;25;30000;0;12;4;1;2;5;-1;-1;0;0;0;1;0;1;2;0;0
NVIDIA GH200 480GB [0x3528];3;4;5;32;30000;0;3;4;1;4;5;-1;0;0;0;0;1;0;1;0;0;0
NVIDIA GH200 480GB [0x3528];3;4;7;4;30000;0;15;4;1;3;7;-2;-1;0;0;0;1;0;0;2;0;0
NVIDIA GH200 480GB [0x3528];3;4;7;5;30000;0;12;4;1;2;7;0;-2;0;0;0;1;0;2;2;0;0
NVIDIA GH200 480GB [0x3528];3;4;7;7;30000;0;13;4;1;2;7;0;0;0;0;0;1;0;2;2;0;0
NVIDIA GH200 480GB [0x3528];3;4;7;9;30000;0;5;4;1;4;7;1;-1;0;0;0;1;0;1;2;0;0
NVIDIA GH200 480GB [0x3528];3;4;7;13;30000;0;4;4;1;4;7;-2;-2;0;0;0;1;0;1;2;0;0
NVIDIA GH200 480GB [0x3528];3;4;9;4;30000;0;13;4;1;3;9;1;-2;0;0;0;1;0;0;0;0;0
NVIDIA GH200 480GB [0x3528];3;4;9;5;30000;0;13;4;1;2;9;-2;-2;0;0;0;1;0;2;2;0;0
NVIDIA GH200 480GB [0x3528];3;4;9;7;30000;0;13;4;1;4;9;0;0;0;0;0;1;0;2;2;0;0
NVIDIA GH200 480GB [0x3528];3;4;9;9;30000;0;10;4;1;2;9;-2;-2;0;0;0;1;0;1;0;0;0
NVIDIA GH200 480GB [0x3528];3;4;9;13;30000;0;5;4;1;4;9;-2;-1;0;0;0;1;0;1;0;0;0
NVIDIA GH200 480GB [0x3528];3;4;10;4;30000;0;13;4;1;4;10;1;0;0;0;0;1;0;0;0;0;0
NVIDIA GH200 480GB [0x3528];3;4;10;10;30000;0;10;4;1;4;10;1;-1;0;0;0;1;0;1;2;0;0
NVIDIA GH200 480GB [0x3528];3;4;13;4;30000;0;16;4;1;2;13;0;-1;0;0;0;1;0;0;0;0;0
NVIDIA GH200 480GB [0x3528];3;4;13;5;30000;0;13;4;1;2;13;1;-2;0;0;0;1;0;0;2;0;0
NVIDIA GH200 480GB [0x3528];3;4;13;7;30000;0;15;4;1;1;1;0;0;0;0;0;1;0;0;2;0;0
NVIDIA GH200 480GB [0x3528];3;4;13;9;30000;0;10;4;1;2;1;0;-2;0;0;0;1;0;1;0;0;0
NVIDIA GH200 480GB [0x3528];3;4;13;13;30000;0;12;4;1;4;1;0;0;0;0;0;1;0;1;2;0;0
NVIDIA GH200 480GB [0x3528];3;4;13;17;30000;0;10;4;1;4;1;-2;0;0;0;0;1;0;1;0;0;0
NVIDIA GH200 480GB [0x3528];3;4;13;32;30000;0;12;4;1;2;1;-1;1;0;0;0;1;0;1;2;0;0
NVIDIA GH200 480GB [0x3528];3;4;15;4;30000;0;15;4;1;1;1;1;0;0;0;0;1;0;2;0;0;0
NVIDIA GH200 480GB [0x3528];3;4;17;4;30000;0;16;4;1;3;1;1;-1;0;0;0;1;0;2;2;0;0
NVIDIA GH200 480GB [0x3528];3;4;17;5;30000;0;13;4;1;2;1;0;-1;0;0;0;1;0;0;2;0;0
NVIDIA GH200 480GB [0x3528];3;4;17;13;30000;0;14;4;1;2;1;-1;-2;0;0;0;1;0;2;0;0;0
NVIDIA GH200 480GB [0x3528];3;4;17;17;30000;0;9;4;1;4;1;-1;-1;0;0;0;1;0;1;2;0;0
NVIDIA GH200 480GB [0x3528];3;4;17;32;30000;0;12;4;1;4;1;1;-1;0;0;0;1;0;1;2;0;0
NVIDIA GH200 480GB [0x3528];3;4;25;4;30000;0;14;4;1;3;1;0;-1;0;0;0;1;0;2;2;0;0
NVIDIA GH200 480GB [0x3528];3;4;25;5;30000;0;15;4;1;2;25;1;-2;0;0;0;1;0;0;2;0;0
NVIDIA GH200 480GB [0x3528];3;4;26;4;30000;0;17;4;1;3;1;-1;-1;0;0;0;1;0;0;0;0;0
NVIDIA GH200 480GB [0x3528];3;4;28;4;30000;0;14;4;1;3;1;-1;-2;0;0;0;1;0;2;0;0;0
NVIDIA GH200 480GB [0x3528];3;4;32;4;30000;0;18;4;1;1;1;0;-2;0;0;0;1;0;0;2;0;0
NVIDIA GH200 480GB [0x3528];3;4;32;5;30000;0;14;4;1;2;1;-2;-2;0;0;0;1;0;0;0;0;0
NVIDIA GH200 480GB [0x3528];3;4;32;13;30000;0;11;4;1;2;1;1;1;0;0;0;1;0;1;0;0;0
NVIDIA GH200 480GB [0x3528];3;4;32;17;30000;0;8;4;1;2;1;0;-1;0;0;0;1;0;1;0;0;0
NVIDIA GH200 480GB [0x3528];3;4;32;32;30000;0;13;4;1;4;1;1;-2;0;0;0;1;0;1;2;0;0
NVIDIA GH200 480GB [0x3528];3;5;4;4;30000;0;14;5;1;2;1;-1;-1;0;0;0;1;0;0;0;0;0
NVIDIA GH200 480GB [0x3528];3;5;4;5;30000;0;13;5;1;4;1;-2;-1;0;0;0;1;0;0;2;0;0
NVIDIA GH200 480GB [0x3528];3;5;4;7;30000;0;13;5;1;2;1;0;-2;0;0;0;1;0;0;0;0;0
NVIDIA GH200 480GB [0x3528];3;5;4;9;30000;0;11;5;1;1;1;-2;0;0;0;0;1;0;2;2;0;0
NVIDIA GH200 480GB [0x3528];3;5;4;13;30000;0;12;5;1;4;5;-1;-1;0;0;0;1;0;0;0;0;0
NVIDIA GH200 480GB [0x3528];3;5;4;17;30000;0;12;5;1;2;5;1;0;0;0;0;1;0;0;2;0;0
NVIDIA GH200 480GB [0x3528];3;5;4;25;30000;0;12;5;1;4;5;0;-1;0;0;0;1;0;0;0;0;0
NVIDIA GH200 480GB [0x3528];3;5;4;32;30000;0;12;5;1;2;5;-1;1;0;0;0;1;0;2;0;0;0
NVIDIA GH200 480GB [0x3528];3;5;5;4;30000;0;15;5;1;2;1;-2;-1;0;0;0;1;0;2;0;0;0
NVIDIA GH200 480GB [0x3528];3;5;5;5;30000;0;12;5;1;2;1;1;-2;0;0;0;1;0;1;0;0;0
NVIDIA GH200 480GB [0x3528];3;5;5;7;30000;0;12;5;1;3;1;-1;-2;0;0;0;1;0;1;2;0;0
NVIDIA GH200 480GB [0x3528];3;5;5;9;30000;0;12;5;1;2;1;-2;1;0;0;0;1;0;1;2;0;0
NVIDIA GH200 480GB [0x3528];3;5;5;13;30000;0;5;5;1;4;1;-2;0;0;0;0;1;0;1;2;0;0
NVIDIA GH200 480GB [0x3528];3;5;5;16;30000;0;8;5;1;2;5;1;-2;0;0;0;1;0;2;0;0;0
NVIDIA GH200 480GB [0x3528];3;5;5;17;30000;0;4;5;1;4;1;0;0;0;0;0;1;0;1;0;0;0
NVIDIA GH200 480GB [0x3528];3;5;5;24;30000;0;10;5;1;4;5;-1;0;0;0;0;1;0;0;2;0;0
NVIDIA GH200 480GB [0x3528];3;5;5;26;30000;0;12;5;1;5;5;-1;0;0;0;0;1;0;0;2;0;0
NVIDIA GH200 480GB [0x3528];3;5;5;28;30000;0;19;5;1;3;5;-1;0;0;0;0;1;0;1;0;0;0
NVIDIA GH200 480GB [0x3528];3;5;5;32;30000;0;3;5;1;3;1;1;0;0;0;0;1;0;1;0;0;0
NVIDIA GH200 480GB [0x3528];3;5;7;4;30000;0;15;5;1;2;1;-2;-1;0;0;0;1;0;2;0;0;0
NVIDIA GH200 480GB [0x3528];3;5;7;5;30000;0;13;5;1;4;1;-2;-2;0;0;0;1;0;2;0;0;0
NVIDIA GH200 480GB [0x3528];3;5;7;7;30000;0;10;5;1;2;1;-1;1;0;0;0;1;0;1;0;0;0
NVIDIA GH200 480GB [0x3528];3;5;7;9;30000;0;10;5;1;2;1;0;-1;0;0;0;1;0;1;0;0;0
NVIDIA GH200 480GB [0x3528];3;5;7;13;30000;0;10;5;1;3;1;-1;-1;0;0;0;1;0;1;2;0;0
NVIDIA GH200 480GB [0x3528];3;5;9;4;30000;0;16;5;1;2;1;-1;1;0;0;0;1;0;0;0;0;0
NVIDIA GH200 480GB [0x3528];3;5;9;5;30000;0;13;5;1;2;1;1;0;0;0;0;1;0;0;2;0;0
NVIDIA GH200 480GB [0x3528];3;5;9;7;30000;0;9;5;1;2;1;0;0;0;0;0;1;0;1;0;0;0
NVIDIA GH200 480GB [0x3528];3;5;9;9;30000;0;10;5;1;2;1;0;-1;0;0;0;1;0;1;2;0;0
NVIDIA GH200 480GB [0x3528];3;5;13;4;30000;0;16;5;1;2;1;0;-1;0;0;0;1;0;2;0;0;0
NVIDIA GH200 480GB [0x3528];3;5;13;5;30000;0;15;5;1;2;1;1;-2;0;0;0;1;0;0;0;0;0
NVIDIA GH200 480GB [0x3528];3;5;13;7;30000;0;8;5;1;3;1;1;-2;0;0;0;1;0;1;2;0;0
NVIDIA GH200 480GB [0x3528];3;5;13;13;30000;0;10;5;1;2;1;1;0;0;0;0;1;0;1;2;0;0
NVIDIA GH200 480GB [0x3528];3;5;13;16;30000;0;10;5;1;1;13;-1;-1;0;1;0;1;0;2;2;0;0
NVIDIA GH200 480GB [0x3528];3;5;13;17;30000;0;12;5;1;2;1;0;-1;0;0;0;1;0;1;0;0;0
NVIDIA GH200 480GB [0x3528];3;5;13;24;30000;0;8;5;1;5;13;0;-1;0;0;0;1;0;2;2;0;0
NVIDIA GH200 480GB [0x3528];3;5;13;26;30000;0;14;5;1;3;13;-2;-1;0;0;0;1;0;0;2;0;0
NVIDIA GH200 480GB [0x3528];3;5;13;28;30000;0;5;5;1;2;13;-2;-1;0;1;0;1;0;1;0;0;0
NVIDIA GH200 480GB [0x3528];3;5;13;32;30000;0;4;5;1;5;1;0;-1;0;0;0;1;0;1;2;0;0
NVIDIA GH200 480GB [0x3528];3;5;16;5;30000;0;11;5;1;2;16;-2;1;0;1;0;1;0;0;0;0;0
NVIDIA GH200 480GB [0x3528];3;5;16;13;30000;0;11;5;1;4;16;-2;0;0;0;0;1;0;0;2;0;0
NVIDIA GH200 480GB [0x3528];3;5;16;16;30000;0;11;5;1;2;16;1;0;0;1;0;1;0;2;2;0;0
NVIDIA GH200 480GB [0x3528];3;5;16;24;30000;0;8;5;1;5;16;0;-1;0;0;0;1;0;2;2;0;0
NVIDIA GH200 480GB [0x3528];3;5;16;26;30000;0;8;5;1;2;16;0;1;0;0;0;1;0;0;2;0;0
NVIDIA GH200 480GB [0x3528];3;5;17;4;30000;0;18;5;1;2;1;0;-1;0;0;0;1;0;2;0;0;0
NVIDIA GH200 480GB [0x3528];3;5;17;5;30000;0;13;5;1;5;1;-2;-1;0;0;0;1;0;2;2;0;0
NVIDIA GH200 480GB [0x3528];3;5;17;13;30000;0;10;5;1;2;1;-2;-1;0;0;0;1;0;1;2;0;0
NVIDIA GH200 480GB [0x3528];3;5;17;17;30000;0;16;5;1;2;1;-2;-1;0;0;0;1;0;1;0;0;0
NVIDIA GH200 480GB [0x3528];3;5;17;32;30000;0;10;5;1;2;1;-1;0;0;0;0;1;0;1;0;0;0
NVIDIA GH200 480GB [0x3528];3;5;24;5;30000;0;16;5;1;1;24;-2;-1;0;0;0;1;0;2;0;0;0
NVIDIA GH200 480GB [0x3528];3;5;24;13;30000;0;10;5;1;3;24;-2;-1;0;1;0;1;0;0;0;0;0
NVIDIA GH200 480GB [0x3528];3;5;24;16;30000;0;8;5;1;5;24;1;-1;0;0;0;1;0;2;2;0;0
NVIDIA GH200 480GB [0x3528];3;5;24;24;30000;0;8;5;1;2;24;0;1;0;0;0;1;0;0;0;0;0
NVIDIA GH200 480GB [0x3528];3;5;24;26;30000;0;12;5;1;4;24;-2;1;0;0;0;1;0;0;0;0;0
NVIDIA GH200 480GB [0x3528];3;5;25;4;30000;0;18;5;1;2;1;-2;-1;0;0;0;1;0;2;0;0;0
NVIDIA GH200 480GB [0x3528];3;5;26;5;30000;0;17;5;1;1;26;-2;-1;0;1;0;1;0;2;0;0;0
NVIDIA GH200 480GB [0x3528];3;5;26;13;30000;0;14;5;1;2;26;-2;-1;0;1;0;1;0;2;0;0;0
NVIDIA GH200 480GB [0x3528];3;5;26;16;30000;0;8;5;1;5;26;-2;0;0;0;0;1;0;2;2;0;0
NVIDIA GH200 480GB [0x3528];3;5;26;24;30000;0;8;5;1;5;26;0;0;0;0;0;1;0;2;2;0;0
NVIDIA GH200 480GB [0x3528];3;5;26;26;30000;0;8;5;1;2;26;-2;1;0;0;0;1;0;2;0;0;0
NVIDIA GH200 480GB [0x3528];3;5;32;4;30000;0;18;5;1;2;1;1;0;0;0;0;1;0;2;0;0;0
NVIDIA GH200 480GB [0x3528];3;5;32;5;30000;0;15;5;1;2;1;1;-2;0;0;0;1;0;2;2;0;0
NVIDIA GH200 480GB [0x3528];3;5;32;13;30000;0;11;5;1;4;1;0;-2;0;0;0;1;0;1;2;0;0
NVIDIA GH200 480GB [0x3528];3;5;32;17;30000;0;11;5;1;5;1;0;0;0;0;0;1;0;1;2;0;0
NVIDIA GH200 480GB [0x3528];3;5;32;32;30000;0;12;5;1;4;1;0;-2;0;0;0;1;0;1;2;0;0
NVIDIA GH200 480GB [0x3528];3;6;6;6;30000;0;10;6;1;2;1;1;-2;0;0;0;1;0;1;2;0;0
NVIDIA GH200 480GB [0x3528];3;6;6;7;30000;0;12;6;1;6;1;-1;0;0;0;0;1;0;1;0;0;0
NVIDIA GH200 480GB [0x3528];3;6;6;8;30000;0;12;6;1;3;1;-1;0;0;0;0;1;0;1;2;0;0
NVIDIA GH200 480GB [0x3528];3;6;7;6;30000;0;8;6;1;2;1;-2;1;0;0;0;1;0;1;0;0;0
NVIDIA GH200 480GB [0x3528];3;6;7;7;30000;0;10;6;1;2;1;0;-1;0;0;0;1;0;1;2;0;0
NVIDIA GH200 480GB [0x3528];3;6;7;8;30000;0;10;6;1;3;1;-2;1;0;0;0;1;0;1;0;0;0
NVIDIA GH200 480GB [0x3528];3;6;8;6;30000;0;8;6;1;2;1;-2;-1;0;0;0;1;0;1;0;0;0
NVIDIA GH200 480GB [0x3528];3;6;8;7;30000;0;10;6;1;6;1;1;-1;0;0;0;1;0;1;2;0;0
NVIDIA GH200 480GB [0x3528];3;6;8;8;30000;0;10;6;1;2;1;0;1;0;0;0;1;0;1;2;0;0
NVIDIA GH200 480GB [0x3528];3;7;4;4;30000;0;13;7;1;2;1;1;0;0;0;0;1;0;0;2;0;0
NVIDIA GH200 480GB [0x3528];3;7;4;5;30000;0;11;7;1;2;1;0;-2;0;0;0;1;0;0;0;0;0
NVIDIA GH200 480GB [0x3528];3;7;4;7;30000;0;13;7;1;2;1;-2;-1;0;0;0;1;0;2;0;0;0
NVIDIA GH200 480GB [0x3528];3;7;4;9;30000;0;11;7;1;3;1;-1;2;0;0;0;1;0;0;0;0;0
NVIDIA GH200 480GB [0x3528];3;7;4;13;30000;0;12;7;1;7;7;0;-1;0;0;0;1;0;2;2;0;0
NVIDIA GH200 480GB [0x3528];3;7;5;4;30000;0;12;7;1;1;1;0;-2;0;0;0;1;0;2;0;0;0
NVIDIA GH200 480GB [0x3528];3;7;5;5;30000;0;11;7;1;3;1;0;0;0;0;0;1;0;0;2;0;0
NVIDIA GH200 480GB [0x3528];3;7;5;7;30000;0;12;7;1;4;7;-2;0;0;0;0;1;0;0;0;0;0
NVIDIA GH200 480GB [0x3528];3;7;5;9;30000;0;12;7;1;3;1;-2;-1;0;0;0;1;0;0;0;0;0
NVIDIA GH200 480GB [0x3528];3;7;5;13;30000;0;12;7;1;3;1;-1;-2;0;0;0;1;0;2;0;0;0
NVIDIA GH200 480GB [0x3528];3;7;6;6;30000;0;12;7;1;3;1;0;-2;0;0;0;1;0;2;2;0;0
NVIDIA GH200 480GB [0x3528];3;7;6;7;30000;0;12;7;1;3;1;-1;2;0;0;0;1;0;2;2;0;0
NVIDIA GH200 480GB [0x3528];3;7;6;8;30000;0;12;7;1;2;1;1;-2;0;0;0;1;0;2;2;0;0
NVIDIA GH200 480GB [0x3528];3;7;7;4;30000;0;15;7;1;4;1;-1;-2;0;0;0;1;0;1;2;0;0
NVIDIA GH200 480GB [0x3528];3;7;7;5;30000;0;12;7;1;5;1;-2;0;0;0;0;1;0;1;0;0;0
NVIDIA GH200 480GB [0x3528];3;7;7;6;30000;0;10;7;1;4;1;-2;-2;0;0;0;1;0;1;0;0;0
NVIDIA GH200 480GB [0x3528];3;7;7;7;30000;0;10;7;1;6;1;0;-2;0;0;0;1;0;1;0;0;0
NVIDIA GH200 480GB [0x3528];3;7;7;8;30000;0;12;7;1;5;1;0;0;0;0;0;1;0;1;2;0;0
NVIDIA GH200 480GB [0x3528];3;7;7;9;30000;0;10;7;1;4;1;-1;0;0;0;0;1;0;1;2;0;0
NVIDIA GH200 480GB [0x3528];3;7;7;13;30000;0;12;7;1;7;1;-2;-2;0;0;0;1;0;1;2;0;0
NVIDIA GH200 480GB [0x3528];3;7;8;6;30000;0;10;7;1;2;1;-2;-2;0;0;0;1;0;1;0;0;0
NVIDIA GH200 480GB [0x3528];3;7;8;7;30000;0;12;7;1;3;1;0;4;0;0;0;1;0;1;0;0;0
NVIDIA GH200 480GB [0x3528];3;7;8;8;30000;0;10;7;1;7;1;1;-2;0;0;0;1;0;1;2;0;0
NVIDIA GH200 480GB [0x3528];3;7;9;4;30000;0;14;7;1;1;1;-2;-2;0;0;0;1;0;2;0;0;0
NVIDIA GH200 480GB [0x3528];3;7;9;5;30000;0;10;7;1;4;1;-1;-1;0;0;0;1;0;1;0;0;0
NVIDIA GH200 480GB [0x3528];3;7;9;7;30000;0;12;7;1;5;1;1;-2;0;0;0;1;0;1;0;0;0
NVIDIA GH200 480GB [0x3528];3;7;13;4;30000;0;14;7;1;4;1;1;-1;0;0;0;1;0;0;0;0;0
NVIDIA GH200 480GB [0x3528];3;7;13;5;30000;0;13;7;1;5;1;-1;-2;0;0;0;1;0;1;0;0;0
NVIDIA GH200 480GB [0x3528];3;7;13;7;30000;0;12;7;1;4;1;1;-2;0;0;0;1;0;1;2;0;0
NVIDIA GH200 480GB [0x3528];3;7;13;13;30000;0;10;7;1;6;1;-2;-1;0;0;0;1;0;1;0;0;0
NVIDIA GH200 480GB [0x3528];3;8;6;6;30000;0;11;8;1;7;1;1;0;0;0;0;1;0;2;0;0;0
NVIDIA GH200 480GB [0x3528];3;8;6;7;30000;0;12;8;1;6;1;-1;-2;0;0;0;1;0;1;2;0;0
NVIDIA GH200 480GB [0x3528];3;8;6;8;30000;0;11;8;1;1;1;-1;-2;0;0;0;1;0;2;2;0;0
NVIDIA GH200 480GB [0x3528];3;8;7;6;30000;0;12;8;1;7;1;-1;-1;0;0;0;1;0;2;0;0;0
NVIDIA GH200 480GB [0x3528];3;8;7;7;30000;0;12;8;1;7;1;-1;0;0;0;0;1;0;1;2;0;0
NVIDIA GH200 480GB [0x3528];3;8;7;8;30000;0;11;8;1;1;1;-1;0;0;0;0;1;0;2;2;0;0
NVIDIA GH200 480GB [0x3528];3;8;8;6;30000;0;10;8;1;2;1;0;-2;0;0;0;1;0;1;0;0;0
NVIDIA GH200 480GB [0x3528];3;8;8;7;30000;0;12;8;1;2;1;0;0;0;0;0;1;0;1;0;0;0
NVIDIA GH200 480GB [0x3528];3;8;8;8;30000;0;12;8;1;2;1;-2;1;0;0;0;1;0;1;2;0;0
NVIDIA GH200 480GB [0x3528];3;9;4;4;30000;0;13;9;1;2;1;0;-1;0;0;0;1;0;2;0;0;0
NVIDIA GH200 480GB [0x3528];3;9;4;5;30000;0;13;9;1;7;1;0;0;0;0;0;1;0;2;0;0;0
NVIDIA GH200 480GB [0x3528];3;9;4;7;30000;0;12;9;1;7;1;-2;0;0;0;0;1;0;0;0;0;0
NVIDIA GH200 480GB [0x3528];3;9;4;9;30000;0;10;8;1;7;9;1;-2;0;0;0;1;0;2;0;0;0
NVIDIA GH200 480GB [0x3528];3;9;4;13;30000;0;12;9;1;9;9;-1;-2;0;0;0;1;0;2;0;0;0
NVIDIA GH200 480GB [0x3528];3;9;5;4;30000;0;11;9;1;4;1;-2;-1;0;0;0;1;0;2;0;0;0
NVIDIA GH200 480GB [0x3528];3;9;5;5;30000;0;13;9;1;9;1;0;0;0;0;0;1;0;0;0;0;0
NVIDIA GH200 480GB [0x3528];3;9;5;7;30000;0;10;8;1;2;9;1;1;0;0;0;1;0;1;0;0;0
NVIDIA GH200 480GB [0x3528];3;9;5;9;30000;0;5;9;1;8;1;1;2;0;0;0;1;0;1;2;0;0
NVIDIA GH200 480GB [0x3528];3;9;7;4;30000;0;12;9;1;2;1;-2;-1;0;0;0;1;0;2;0;0;0
NVIDIA GH200 480GB [0x3528];3;9;7;5;30000;0;8;8;1;9;1;1;1;0;0;0;1;0;1;0;0;0
NVIDIA GH200 480GB [0x3528];3;9;7;7;30000;0;10;8;1;3;1;-1;-1;0;0;0;1;0;1;0;0;0
NVIDIA GH200 480GB [0x3528];3;9;9;4;30000;0;17;9;1;7;1;-1;-2;0;0;0;1;0;1;2;0;0
NVIDIA GH200 480GB [0x3528];3;9;9;5;30000;0;17;9;1;4;1;-2;0;0;0;0;1;0;1;2;0;0
NVIDIA GH200 480GB [0x3528];3;9;9;9;30000;0;12;9;1;4;1;-2;0;0;0;0;1;0;1;0;0;0
NVIDIA GH200 480GB [0x3528];3;9;9;16;30000;0;19;9;1;8;1;0;0;0;0;0;1;0;1;2;0;0
NVIDIA GH200 480GB [0x3528];3;9;9;22;30000;0;12;8;1;7;1;0;-1;0;0;0;1;0;1;2;0;0
NVIDIA GH200 480GB [0x3528];3;9;9;32;30000;0;6;9;1;8;1;-2;-1;0;0;0;1;0;1;2;0;0
NVIDIA GH200 480GB [0x3528];3;9;13;4;30000;0;13;9;1;2;1;-2;1;0;0;0;1;0;1;2;0;0
NVIDIA GH200 480GB [0x3528];3;9;16;9;30000;0;16;9;1;7;1;-1;0;0;0;0;1;0;1;2;0;0
NVIDIA GH200 480GB [0x3528];3;9;16;16;30000;0;10;8;1;2;1;0;-2;0;0;0;1;0;1;2;0;0
NVIDIA GH200 480GB [0x3528];3;9;16;22;30000;0;6;8;1;2;1;-2;2;0;0;0;1;0;1;0;0;0
NVIDIA GH200 480GB [0x3528];3;9;22;9;30000;0;16;9;1;7;1;0;-1;0;0;0;1;0;1;0;0;0
NVIDIA GH200 480GB [0x3528];3;9;22;16;30000;0;12;9;1;5;1;-2;-2;0;0;0;1;0;1;2;0;0
NVIDIA GH200 480GB [0x3528];3;9;22;22;30000;0;15;9;1;8;1;1;0;0;0;0;1;0;1;2;0;0
NVIDIA GH200 480GB [0x3528];3;9;22;32;30000;0;15;9;1;7;1;-1;0;0;0;0;1;0;1;2;0;0
NVIDIA GH200 480GB [0x3528];3;9;32;9;30000;0;16;9;1;6;32;1;0;0;0;0;1;0;1;2;0;0
NVIDIA GH200 480GB [0x3528];3;9;32;22;30000;0;10;9;1;6;32;1;-1;0;0;0;1;0;1;2;0;0
NVIDIA GH200 480GB [0x3528];3;9;32;32;30000;0;12;9;1;2;32;0;1;0;0;0;1;0;1;0;0;0
NVIDIA GH200 480GB [0x3528];3;10;4;4;30000;0;8;8;1;5;1;0;1;0;0;0;1;0;0;0;0;0
NVIDIA GH200 480GB [0x3528];3;10;4;10;30000;0;10;8;1;3;10;0;3;0;0;0;1;0;0;2;0;0
NVIDIA GH200 480GB [0x3528];3;10;10;4;30000;0;17;10;1;7;1;0;-1;0;0;0;1;0;1;0;0;0
NVIDIA GH200 480GB [0x3528];3;10;10;10;30000;0;12;10;1;7;1;1;-2;0;0;0;1;0;1;0;0;0
NVIDIA GH200 480GB [0x3528];3;13;4;4;30000;0;8;8;1;7;1;1;-1;0;0;0;1;0;2;2;0;0
NVIDIA GH200 480GB [0x3528];3;13;4;5;30000;0;8;8;1;2;13;-1;2;0;0;0;1;0;0;0;0;0
NVIDIA GH200 480GB [0x3528];3;13;4;7;30000;0;8;8;1;10;1;0;0;0;0;0;1;0;2;2;0;0
NVIDIA GH200 480GB [0x3528];3;13;4;9;30000;0;9;8;1;10;13;0;2;0;0;0;1;0;0;0;0;0
NVIDIA GH200 480GB [0x3528];3;13;4;13;30000;0;6;8;1;9;13;-2;6;0;0;0;1;0;1;2;0;0
NVIDIA GH200 480GB [0x3528];3;13;4;17;30000;0;5;8;1;7;13;0;4;0;0;0;1;0;1;2;0;0
NVIDIA GH200 480GB [0x3528];3;13;4;32;30000;0;12;8;1;13;1;0;2;0;0;0;1;0;1;0;0;0
NVIDIA GH200 480GB [0x3528];3;13;5;4;30000;0;8;8;1;8;1;-2;3;0;0;0;1;0;0;2;0;0
NVIDIA GH200 480GB [0x3528];3;13;5;5;30000;0;8;8;1;3;1;1;2;0;0;0;1;0;0;2;0;0
NVIDIA GH200 480GB [0x3528];3;13;5;7;30000;0;8;8;1;10;1;1;0;0;0;0;1;0;0;2;0;0
NVIDIA GH200 480GB [0x3528];3;13;5;13;30000;0;9;8;1;5;13;1;-2;0;0;0;1;0;2;2;0;0
NVIDIA GH200 480GB [0x3528];3;13;5;16;30000;0;8;13;1;11;13;1;0;0;0;0;1;0;2;2;0;0
NVIDIA GH200 480GB [0x3528];3;13;5;17;30000;0;12;8;1;7;1;-1;-1;0;0;0;1;0;0;2;0;0
NVIDIA GH200 480GB [0x3528];3;13;5;24;30000;0;6;13;1;12;13;-2;2;0;0;0;1;0;0;2;0;0
NVIDIA GH200 480GB [0x3528];3;13;5;26;30000;0;6;13;1;13;13;-2;2;0;1;0;1;0;0;0;0;0
NVIDIA GH200 480GB [0x3528];3;13;5;28;30000;0;3;13;1;3;13;-2;2;0;0;0;1;0;0;2;0;0
NVIDIA GH200 480GB [0x3528];3;13;5;32;30000;0;3;8;1;3;1;0;-2;0;0;0;1;0;1;0;0;0
NVIDIA GH200 480GB [0x3528];3;13;7;4;30000;0;11;8;1;4;1;1;-1;0;0;0;1;0;1;0;0;0
NVIDIA GH200 480GB [0x3528];3;13;7;5;30000;0;9;8;1;4;1;0;0;0;0;0;1;0;1;0;0;0
NVIDIA GH200 480GB [0x3528];3;13;7;7;30000;0;13;8;1;13;1;-2;1;0;0;0;1;0;1;0;0;0
NVIDIA GH200 480GB [0x3528];3;13;7;13;30000;0;12;8;1;4;1;0;1;0;0;0;1;0;1;0;0;0
NVIDIA GH200 480GB [0x3528];3;13;9;4;30000;0;12;8;1;11;1;1;2;0;0;0;1;0;1;0;0;0
NVIDIA GH200 480GB [0x3528];3;13;13;4;30000;0;17;13;1;11;1;-2;-2;0;0;0;1;0;1;2;0;0
NVIDIA GH200 480GB [0x3528];3;13;13;5;30000;0;17;13;1;9;1;-1;-2;0;0;0;1;0;1;2;0;0
NVIDIA GH200 480GB [0x3528];3;13;13;7;30000;0;16;13;1;4;13;-2;-2;0;0;0;1;0;1;0;0;0
NVIDIA GH200 480GB [0x3528];3;13;13;13;30000;0;12;13;1;6;1;-1;0;0;0;0;1;0;1;0;0;0
NVIDIA GH200 480GB [0x3528];3;13;13;16;30000;0;10;13;1;11;13;1;2;0;0;0;1;0;0;2;0;0
NVIDIA GH200 480GB [0x3528];3;13;13;17;30000;0;15;13;1;10;1;1;0;0;0;0;1;0;1;0;0;0
NVIDIA GH200 480GB [0x3528];3;13;13;24;30000;0;13;13;1;9;13;-2;2;0;1;0;1;0;0;2;0;0
NVIDIA GH200 480GB [0x3528];3;13;13;26;30000;0;18;13;1;7;13;-2;2;0;0;0;1;0;0;0;0;0
NVIDIA GH200 480GB [0x3528];3;13;13;28;30000;0;19;13;1;13;13;-1;-2;0;0;0;1;0;1;0;0;0
NVIDIA GH200 480GB [0x3528];3;13;13;32;30000;0;19;13;1;9;1;1;-2;0;0;0;1;0;1;2;0;0
NVIDIA GH200 480GB [0x3528];3;13;16;5;30000;0;13;13;1;12;16;1;0;0;1;0;1;0;2;2;0;0
NVIDIA GH200 480GB [0x3528];3;13;16;13;30000;0;10;13;1;9;16;1;-2;0;1;0;1;0;0;2;0;0
NVIDIA GH200 480GB [0x3528];3;13;16;16;30000;0;8;13;1;13;16;0;-1;0;0;0;1;0;2;2;0;0
NVIDIA GH200 480GB [0x3528];3;13;16;24;30000;0;8;13;1;13;16;0;0;0;0;0;1;0;2;2;0;0
NVIDIA GH200 480GB [0x3528];3;13;16;26;30000;0;8;13;1;7;16;-1;0;0;0;0;1;0;2;0;0;0
NVIDIA GH200 480GB [0x3528];3;13;17;4;30000;0;17;13;1;10;1;1;0;0;0;0;1;0;1;2;0;0
NVIDIA GH200 480GB [0x3528];3;13;17;5;30000;0;17;13;1;6;1;-1;-2;0;0;0;1;0;1;2;0;0
NVIDIA GH200 480GB [0x3528];3;13;17;13;30000;0;16;13;1;6;1;1;1;0;0;0;1;0;1;2;0;0
NVIDIA GH200 480GB [0x3528];3;13;17;17;30000;0;15;13;1;3;1;0;0;0;0;0;1;0;1;2;0;0
NVIDIA GH200 480GB [0x3528];3;13;17;32;30000;0;20;13;1;3;1;1;-1;0;0;0;1;0;1;2;0;0
NVIDIA GH200 480GB [0x3528];3;13;24;5;30000;0;14;13;1;9;24;0;2;0;1;0;1;0;0;2;0;0
NVIDIA GH200 480GB [0x3528];3;13;24;13;30000;0;8;13;1;9;24;-1;-2;0;0;0;1;0;0;0;0;0
NVIDIA GH200 480GB [0x3528];3;13;24;16;30000;0;8;13;1;10;24;0;0;0;1;0;1;0;0;2;0;0
NVIDIA GH200 480GB [0x3528];3;13;24;24;30000;0;8;13;1;11;24;0;0;0;1;0;1;0;0;2;0;0
NVIDIA GH200 480GB [0x3528];3;13;24;26;30000;0;30;13;1;4;24;-2;2;0;0;0;1;0;2;2;0;0
NVIDIA GH200 480GB [0x3528];3;13;26;5;30000;0;16;13;1;12;26;-2;2;0;1;0;1;0;0;2;0;0
NVIDIA GH200 480GB [0x3528];3;13;26;13;30000;0;17;13;1;2;26;0;2;0;1;0;1;0;2;0;0;0
NVIDIA GH200 480GB [0x3528];3;13;26;16;30000;0;8;13;1;13;26;0;-1;0;0;0;1;0;2;2;0;0
NVIDIA GH200 480GB [0x3528];3;13;26;24;30000;0;8;13;1;10;26;0;-2;0;0;0;1;0;2;2;0;0
NVIDIA GH200 480GB [0x3528];3;13;26;26;30000;0;8;13;1;9;26;0;0;0;1;0;1;0;0;2;0;0
NVIDIA GH200 480GB [0x3528];3;13;32;4;30000;0;21;8;1;13;1;1;2;0;0;0;1;0;1;2;0;0
NVIDIA GH200 480GB [0x3528];3;13;32;5;30000;0;17;13;1;5;1;1;-2;0;0;0;1;0;1;2;0;0
NVIDIA GH200 480GB [0x3528];3;13;32;13;30000;0;18;13;1;2;1;-1;-2;0;0;0;1;0;1;0;0;0
NVIDIA GH200 480GB [0x3528];3;13;32;17;30000;0;19;8;1;4;1;0;3;0;0;0;1;0;1;2;0;0
NVIDIA GH200 480GB [0x3528];3;13;32;32;30000;0;15;13;1;11;1;0;-1;0;0;0;1;0;1;2;0;0
NVIDIA GH200 480GB [0x3528];3;14;14;14;30000;0;16;14;1;14;14;1;-2;0;0;0;1;0;1;2;0;0
NVIDIA GH200 480GB [0x3528];3;14;14;16;30000;0;14;14;1;11;14;1;2;0;0;0;1;0;0;2;0;0
NVIDIA GH200 480GB [0x3528];3;14;14;29;30000;0;9;14;1;4;14;0;2;0;1;0;1;0;0;0;0;0
NVIDIA GH200 480GB [0x3528];3;14;14;55;30000;0;20;14;1;7;14;-1;2;0;1;0;1;0;1;1;0;0
NVIDIA GH200 480GB [0x3528];3;14;16;14;30000;0;8;14;1;13;16;0;-2;0;0;0;1;0;0;0;0;0
NVIDIA GH200 480GB [0x3528];3;14;16;16;30000;0;12;14;1;9;16;-1;2;0;1;0;1;0;0;2;0;0
NVIDIA GH200 480GB [0x3528];3;14;16;29;30000;0;9;14;1;11;16;0;2;0;1;0;1;0;2;0;0;0
NVIDIA GH200 480GB [0x3528];3;14;29;14;30000;0;18;14;1;4;29;-2;2;0;1;0;1;0;0;0;0;0
NVIDIA GH200 480GB [0x3528];3;14;55;14;30000;0;26;14;1;7;55;-2;1;0;1;0;1;0;1;0;0;0
NVIDIA GH200 480GB [0x3528];3;14;55;55;30000;0;60;14;1;10;55;0;0;0;0;0;1;0;1;2;0;0
NVIDIA GH200 480GB [0x3528];3;15;4;4;30000;0;8;8;1;3;1;1;2;0;0;0;1;0;2;2;0;0
NVIDIA GH200 480GB [0x3528];3;15;15;15;30000;0;21;15;1;10;1;-1;0;0;0;0;1;0;1;0;0;0
NVIDIA GH200 480GB [0x3528];3;16;9;9;30000;0;12;8;1;16;1;-2;3;0;0;0;1;0;2;2;0;0
NVIDIA GH200 480GB [0x3528];3;16;9;16;30000;0;10;8;1;14;16;1;0;0;0;0;1;0;2;2;0;0
NVIDIA GH200 480GB [0x3528];3;16;9;22;30000;0;12;8;1;14;16;-2;0;0;0;0;1;0;2;0;0;0
NVIDIA GH200 480GB [0x3528];3;16;16;9;30000;0;16;8;1;3;1;0;2;0;0;0;1;0;1;2;0;0
NVIDIA GH200 480GB [0x3528];3;16;16;16;30000;0;12;8;1;13;1;1;0;0;0;0;1;0;1;2;0;0
NVIDIA GH200 480GB [0x3528];3;16;16;22;30000;0;21;16;1;13;1;-2;0;0;0;0;1;0;1;2;0;0
NVIDIA GH200 480GB [0x3528];3;16;16;55;30000;0;30;8;1;2;16;1;2;0;1;0;1;0;1;2;0;0
NVIDIA GH200 480GB [0x3528];3;16;22;9;30000;0;16;16;1;8;1;0;-2;0;0;0;1;0;1;2;0;0
NVIDIA GH200 480GB [0x3528];3;16;22;16;30000;0;12;16;1;15;1;-2;-2;0;0;0;1;0;1;2;0;0
NVIDIA GH200 480GB [0x3528];3;16;22;22;30000;0;22;16;1;14;1;1;0;0;0;0;1;0;1;2;0;0
NVIDIA GH200 480GB [0x3528];3;16;29;55;30000;0;38;8;1;13;29;0;-2;0;1;0;1;0;1;2;0;0
NVIDIA GH200 480GB [0x3528];3;16;55;16;30000;0;23;16;1;6;55;-1;0;0;0;0;1;0;1;2;0;0
NVIDIA GH200 480GB [0x3528];3;16;55;29;30000;0;60;8;1;9;55;0;2;0;1;0;1;0;1;2;0;0
NVIDIA GH200 480GB [0x3528];3;16;55;55;30000;0;5;8;1;5;55;-2;0;0;1;0;1;0;1;2;0;0
NVIDIA GH200 480GB [0x3528];3;17;4;4;30000;0;8;8;1;9;1;-2;0;0;0;0;1;0;2;2;0;0
NVIDIA GH200 480GB [0x3528];3;17;4;5;30000;0;10;8;1;14;1;0;0;0;0;0;1;0;1;0;0;0
NVIDIA GH200 480GB [0x3528];3;17;4;13;30000;0;5;8;1;3;17;0;1;0;0;0;1;0;1;2;0;0
NVIDIA GH200 480GB [0x3528];3;17;4;17;30000;0;12;8;1;14;17;0;-2;0;0;0;1;0;0;2;0;0
NVIDIA GH200 480GB [0x3528];3;17;4;32;30000;0;3;8;1;2;17;-1;-2;0;0;0;1;0;1;0;0;0
NVIDIA GH200 480GB [0x3528];3;17;5;4;30000;0;8;8;1;15;1;1;2;0;0;0;1;0;0;2;0;0
NVIDIA GH200 480GB [0x3528];3;17;5;5;30000;0;8;8;1;15;17;-2;-2;0;0;0;1;0;2;0;0;0
NVIDIA GH200 480GB [0x3528];3;17;5;13;30000;0;10;8;1;7;17;0;-2;0;0;0;1;0;2;0;0;0
NVIDIA GH200 480GB [0x3528];3;17;5;17;30000;0;12;8;1;9;17;-2;-1;0;0;0;1;0;0;2;0;0
NVIDIA GH200 480GB [0x3528];3;17;5;32;30000;0;16;8;1;2;17;-1;0;0;0;0;1;0;2;2;0;0
NVIDIA GH200 480GB [0x3528];3;17;13;4;30000;0;14;17;1;11;1;0;-2;0;0;0;1;0;1;2;0;0
NVIDIA GH200 480GB [0x3528];3;17;13;5;30000;0;13;17;1;5;1;-1;0;0;0;0;1;0;1;2;0;0
NVIDIA GH200 480GB [0x3528];3;17;13;13;30000;0;19;8;1;16;1;-1;2;0;0;0;1;0;1;0;0;0
NVIDIA GH200 480GB [0x3528];3;17;13;17;30000;0;17;17;1;7;1;1;0;0;0;0;1;0;1;0;0;0
NVIDIA GH200 480GB [0x3528];3;17;13;32;30000;0;19;17;1;16;1;-1;0;0;0;0;1;0;1;2;0;0
NVIDIA GH200 480GB [0x3528];3;17;17;4;30000;0;23;17;1;7;1;-2;0;0;0;0;1;0;1;0;0;0
NVIDIA GH200 480GB [0x3528];3;17;17;5;30000;0;23;17;1;15;1;-1;-1;0;0;0;1;0;1;0;0;0
NVIDIA GH200 480GB [0x3528];3;17;17;13;30000;0;21;17;1;8;1;-1;0;0;0;0;1;0;1;2;0;0
NVIDIA GH200 480GB [0x3528];3;17;17;17;30000;0;16;17;1;9;1;0;-2;0;0;0;1;0;1;2;0;0
NVIDIA GH200 480GB [0x3528];3;17;17;32;30000;0;5;17;1;3;1;0;-1;0;0;0;1;0;1;2;0;0
NVIDIA GH200 480GB [0x3528];3;17;32;4;30000;0;23;17;1;11;1;-2;-1;0;0;0;1;0;1;2;0;0
NVIDIA GH200 480GB [0x3528];3;17;32;5;30000;0;22;17;1;6;1;0;-2;0;0;0;1;0;1;2;0;0
NVIDIA GH200 480GB [0x3528];3;17;32;13;30000;0;15;17;1;9;1;-2;-1;0;0;0;1;0;1;0;0;0
NVIDIA GH200 480GB [0x3528];3;17;32;17;30000;0;15;17;1;13;1;0;-1;0;0;0;1;0;1;2;0;0
NVIDIA GH200 480GB [0x3528];3;17;32;32;30000;0;20;17;1;17;1;-2;-2;0;0;0;1;0;1;2;0;0
NVIDIA GH200 480GB [0x3528];3;20;20;20;30000;0;19;20;1;8;1;1;0;0;0;0;1;0;1;2;0;0
NVIDIA GH200 480GB [0x3528];3;22;9;9;30000;0;10;8;1;9;1;0;3;0;0;0;1;0;2;0;0;0
NVIDIA GH200 480GB [0x3528];3;22;9;16;30000;0;10;8;1;21;1;-1;1;0;0;0;1;0;0;2;0;0
NVIDIA GH200 480GB [0x3528];3;22;9;22;30000;0;12;8;1;6;22;1;0;0;0;0;1;0;2;2;0;0
NVIDIA GH200 480GB [0x3528];3;22;9;32;30000;0;20;8;1;20;22;0;1;0;0;0;1;0;2;2;0;0
NVIDIA GH200 480GB [0x3528];3;22;16;9;30000;0;19;8;1;5;1;-2;4;0;0;0;1;0;1;2;0;0
NVIDIA GH200 480GB [0x3528];3;22;16;16;30000;0;19;8;1;15;1;0;-2;0;0;0;1;0;1;2;0;0
NVIDIA GH200 480GB [0x3528];3;22;16;22;30000;0;12;8;1;3;1;0;2;0;0;0;1;0;1;2;0;0
NVIDIA GH200 480GB [0x3528];3;22;22;9;30000;0;23;22;1;17;1;0;0;0;0;0;1;0;1;0;0;0
NVIDIA GH200 480GB [0x3528];3;22;22;16;30000;0;20;22;1;5;1;1;-1;0;0;0;1;0;1;2;0;0
NVIDIA GH200 480GB [0x3528];3;22;22;22;30000;0;23;22;1;14;1;-1;-2;0;0;0;1;0;1;2;0;0
NVIDIA GH200 480GB [0x3528];3;22;22;32;30000;0;30;22;1;7;1;0;-1;0;0;0;1;0;1;2;0;0
NVIDIA GH200 480GB [0x3528];3;22;32;9;30000;0;17;22;1;20;32;-1;0;0;0;0;1;0;1;2;0;0
NVIDIA GH200 480GB [0x3528];3;22;32;22;30000;0;20;22;1;9;32;0;-1;0;0;0;1;0;1;2;0;0
NVIDIA GH200 480GB [0x3528];3;22;32;32;30000;0;40;8;1;3;32;-1;3;0;1;0;1;0;1;2;0;0
NVIDIA GH200 480GB [0x3528];3;23;23;23;30000;0;20;23;1;16;23;1;0;0;0;0;1;0;1;2;0;0
NVIDIA GH200 480GB [0x3528];3;24;24;24;30000;0;20;24;1;16;1;-2;-2;0;0;0;1;0;1;0;0;0
NVIDIA GH200 480GB [0x3528];3;24;24;26;30000;0;30;8;1;18;24;1;2;0;1;0;1;0;1;2;0;0
NVIDIA GH200 480GB [0x3528];3;24;26;24;30000;0;46;8;1;22;26;0;3;0;0;0;1;0;2;2;0;0
NVIDIA GH200 480GB [0x3528];3;24;26;26;30000;0;30;24;1;2;26;-1;1;0;0;0;1;0;1;0;0;0
NVIDIA GH200 480GB [0x3528];3;25;4;4;30000;0;8;8;1;13;25;0;-2;0;0;0;1;0;2;2;0;0
NVIDIA GH200 480GB [0x3528];3;25;4;5;30000;0;8;8;1;18;25;0;5;0;0;0;1;0;0;2;0;0
NVIDIA GH200 480GB [0x3528];3;25;5;4;30000;0;8;8;1;21;1;-2;1;0;0;0;1;0;0;2;0;0
NVIDIA GH200 480GB [0x3528];3;25;25;25;30000;0;24;25;1;21;1;-1;-1;0;0;0;1;0;1;2;0;0
NVIDIA GH200 480GB [0x3528];3;26;4;4;30000;0;10;8;1;6;26;-1;3;0;0;0;1;0;0;2;0;0
NVIDIA GH200 480GB [0x3528];3;26;24;24;30000;0;11;8;1;2;26;-2;-2;0;1;0;1;0;2;2;0;0
NVIDIA GH200 480GB [0x3528];3;26;24;26;30000;0;46;8;1;14;26;-1;0;0;1;0;1;0;0;0;0;0
NVIDIA GH200 480GB [0x3528];3;26;26;24;30000;0;29;26;1;12;26;-1;0;0;1;0;1;0;1;1;0;0
NVIDIA GH200 480GB [0x3528];3;26;26;26;30000;0;32;8;1;22;26;-1;2;0;0;0;1;0;1;0;0;0
NVIDIA GH200 480GB [0x3528];3;28;4;4;30000;0;11;8;1;12;1;-1;5;0;0;0;1;0;0;2;0;0
NVIDIA GH200 480GB [0x3528];3;28;28;28;30000;0;6;16;1;8;1;-2;2;0;0;0;1;0;1;0;0;0
NVIDIA GH200 480GB [0x3528];3;29;16;55;30000;0;21;16;1;15;29;0;2;0;0;0;1;0;1;2;0;0
NVIDIA GH200 480GB [0x3528];3;29;29;29;30000;0;46;8;1;2;29;-2;-2;0;1;0;1;0;1;2;0;0
NVIDIA GH200 480GB [0x3528];3;29;29;55;30000;0;19;16;1;24;29;-2;0;0;0;0;1;0;1;2;0;0
NVIDIA GH200 480GB [0x3528];3;29;55;16;30000;0;58;8;1;26;55;1;-2;0;0;0;1;0;1;2;0;0
NVIDIA GH200 480GB [0x3528];3;29;55;29;30000;0;19;8;1;25;55;-2;4;0;1;0;1;0;1;2;0;0
NVIDIA GH200 480GB [0x3528];3;29;55;55;30000;0;39;29;1;2;55;-1;1;0;1;0;1;0;0;1;0;0
NVIDIA GH200 480GB [0x3528];3;30;30;30;30000;0;30;30;1;11;1;0;-2;0;0;0;1;0;1;0;0;0
NVIDIA GH200 480GB [0x3528];3;32;4;4;30000;0;11;8;1;15;32;-1;-2;0;0;0;1;0;0;0;0;0
NVIDIA GH200 480GB [0x3528];3;32;4;5;30000;0;11;8;1;16;32;1;0;0;0;0;1;0;0;2;0;0
NVIDIA GH200 480GB [0x3528];3;32;4;13;30000;0;10;8;1;1;32;1;0;0;0;0;1;0;0;0;0;0
NVIDIA GH200 480GB [0x3528];3;32;4;17;30000;0;12;8;1;9;32;1;0;0;0;0;1;0;0;2;0;0
NVIDIA GH200 480GB [0x3528];3;32;4;32;30000;0;6;8;1;21;32;1;4;0;0;0;1;0;1;2;0;0
NVIDIA GH200 480GB [0x3528];3;32;5;4;30000;0;14;8;1;14;1;1;-2;0;0;0;1;0;2;0;0;0
NVIDIA GH200 480GB [0x3528];3;32;5;5;30000;0;15;8;1;10;1;-2;-2;0;0;0;1;0;2;2;0;0
NVIDIA GH200 480GB [0x3528];3;32;5;13;30000;0;10;8;1;31;32;1;-2;0;0;0;1;0;0;2;0;0
NVIDIA GH200 480GB [0x3528];3;32;5;17;30000;0;12;8;1;3;32;0;4;0;0;0;1;0;0;2;0;0
NVIDIA GH200 480GB [0x3528];3;32;5;32;30000;0;15;8;1;25;32;0;0;0;0;0;1;0;2;0;0;0
NVIDIA GH200 480GB [0x3528];3;32;13;4;30000;0;23;8;1;4;1;-1;-2;0;0;0;1;0;0;2;0;0
NVIDIA GH200 480GB [0x3528];3;32;13;5;30000;0;23;8;1;4;1;-1;-2;0;0;0;1;0;0;0;0;0
NVIDIA GH200 480GB [0x3528];3;32;13;13;30000;0;20;8;1;18;1;-1;5;0;0;0;1;0;0;0;0;0
NVIDIA GH200 480GB [0x3528];3;32;13;17;30000;0;30;8;1;5;1;-2;-2;0;0;0;1;0;1;2;0;0
NVIDIA GH200 480GB [0x3528];3;32;13;32;30000;0;13;8;1;16;1;-1;0;0;0;0;1;0;1;2;0;0
NVIDIA GH200 480GB [0x3528];3;32;17;4;30000;0;23;32;1;17;1;-1;0;0;0;0;1;0;1;2;0;0
NVIDIA GH200 480GB [0x3528];3;32;17;5;30000;0;18;32;1;14;1;-1;1;0;0;0;1;0;1;2;0;0
NVIDIA GH200 480GB [0x3528];3;32;17;13;30000;0;20;32;1;11;1;0;0;0;0;0;1;0;1;2;0;0
NVIDIA GH200 480GB [0x3528];3;32;17;17;30000;0;20;32;1;4;1;-2;-1;0;0;0;1;0;1;2;0;0
NVIDIA GH200 480GB [0x3528];3;32;17;32;30000;0;10;8;1;23;1;1;4;0;0;0;1;0;1;2;0;0
NVIDIA GH200 480GB [0x3528];3;32;32;4;30000;0;26;32;1;4;1;0;-1;0;0;0;1;0;1;2;0;0
NVIDIA GH200 480GB [0x3528];3;32;32;5;30000;0;29;32;1;11;1;1;0;0;0;0;1;0;1;2;0;0
NVIDIA GH200 480GB [0x3528];3;32;32;9;30000;0;23;32;1;21;32;0;-2;0;0;0;1;0;1;2;0;0
NVIDIA GH200 480GB [0x3528];3;32;32;13;30000;0;30;32;1;6;1;0;-1;0;0;0;1;0;1;2;0;0
NVIDIA GH200 480GB [0x3528];3;32;32;17;30000;0;23;32;1;22;1;0;-1;0;0;0;1;0;1;2;0;0
NVIDIA GH200 480GB [0x3528];3;32;32;22;30000;0;20;32;1;27;32;0;-2;0;0;0;1;0;1;2;0;0
NVIDIA GH200 480GB [0x3528];3;32;32;32;30000;0;19;32;1;29;1;-1;-2;0;0;0;1;0;1;2;0;0
NVIDIA GH200 480GB [0x3528];3;35;35;35;30000;0;57;24;1;17;1;0;2;0;1;0;1;0;1;2;0;0
NVIDIA GH200 480GB [0x3528];3;36;36;36;30000;0;15;16;1;23;1;0;1;0;1;0;1;0;1;2;0;0
NVIDIA GH200 480GB [0x3528];3;40;40;40;30000;0;57;16;1;6;1;-1;1;0;0;0;1;0;1;2;0;0
NVIDIA GH200 480GB [0x3528];3;55;14;14;30000;0;23;55;1;29;55;-1;4;0;0;0;1;0;1;0;0;0
NVIDIA GH200 480GB [0x3528];3;55;14;55;30000;0;8;55;1;2;55;1;7;0;0;0;1;0;1;1;0;0
NVIDIA GH200 480GB [0x3528];3;55;16;16;30000;0;30;16;1;45;55;-2;-2;0;1;0;1;0;1;1;0;0
NVIDIA GH200 480GB [0x3528];3;55;16;29;30000;0;46;16;1;18;55;1;7;0;0;0;1;0;1;2;0;0
NVIDIA GH200 480GB [0x3528];3;55;16;55;30000;0;19;8;1;38;55;0;7;0;0;0;1;0;1;1;0;0
NVIDIA GH200 480GB [0x3528];3;55;29;16;30000;0;29;8;1;35;55;0;-1;0;1;0;1;0;1;1;0;0
NVIDIA GH200 480GB [0x3528];3;55;29;29;30000;0;57;8;1;45;55;-2;-2;0;0;0;1;0;1;2;0;0
NVIDIA GH200 480GB [0x3528];3;55;29;55;30000;0;7;16;1;17;55;-1;1;0;0;0;1;0;1;2;0;0
NVIDIA GH200 480GB [0x3528];3;55;55;14;30000;0;60;55;1;51;55;0;-2;0;1;0;1;0;1;2;0;0
NVIDIA GH200 480GB [0x3528];3;55;55;16;30000;0;38;16;1;16;55;0;3;0;1;0;1;0;1;0;0;0
NVIDIA GH200 480GB [0x3528];3;55;55;29;30000;0;23;55;1;17;55;1;0;0;0;0;1;0;1;2;0;0
NVIDIA GH200 480GB [0x3528];3;55;55;55;30000;0;13;55;1;5;55;0;0;0;0;0;1;0;1;2;0;0
NVIDIA GH200 480GB [0x3528];3;64;64;64;30000;0;5;64;1;18;64;0;6;0;0;0;1;0;1;0;0;0
NVIDIA GH200 480GB [0x3528];3;78;78;78;30000;0;61;78;1;6;78;-2;0;0;1;0;1;0;1;2;0;0
