src/acc/opencl/smm/params/tune_multiply_P100.csv
DEVICE;TYPEID;M;N;K;S;GFLOPS;BS;BM;BN;BK;WS;WG;LU;NZ;AL;TB;TC;AP;AA;AB;AC
Tesla P100-PCIE-16GB [0x2f6c];3;2;2;2;30000;23.4;17;2;1;2;0;-2;0;0;0;0;1;1;1;2;0;0
Tesla P100-PCIE-16GB [0x2f6c];3;3;3;1;30000;33.4;20;3;1;2;0;-2;-2;0;1;0;1;1;2;2;0;0
Tesla P100-PCIE-16GB [0x2f6c];3;3;3;3;30000;61.7;20;3;1;2;0;-2;-2;0;0;1;1;1;1;2;0;0
Tesla P100-PCIE-16GB [0x2f6c];3;4;4;4;30000;144.3;17;4;1;2;0;0;0;0;1;1;1;1;1;2;0;0
Tesla P100-PCIE-16GB [0x2f6c];3;5;5;5;30000;184.7;30;5;1;3;0;0;0;0;0;0;1;1;1;0;0;0
Tesla P100-PCIE-16GB [0x2f6c];3;5;5;7;30000;190.1;31;5;1;3;0;-1;-2;0;1;0;1;1;1;2;0;0
Tesla P100-PCIE-16GB [0x2f6c];3;5;5;13;30000;218.9;60;5;1;4;0;-2;-1;0;1;0;1;1;1;2;0;0
Tesla P100-PCIE-16GB [0x2f6c];3;5;5;16;30000;217.4;60;5;1;4;0;-2;-1;0;0;0;1;1;1;2;0;0
Tesla P100-PCIE-16GB [0x2f6c];3;5;5;24;30000;222.9;30;5;1;5;0;0;-2;1;1;1;1;1;1;2;1;0
Tesla P100-PCIE-16GB [0x2f6c];3;5;5;26;30000;227.5;40;5;1;4;0;-1;-2;0;0;1;1;1;1;2;0;0
Tesla P100-PCIE-16GB [0x2f6c];3;5;7;5;30000;246.9;20;5;1;2;0;0;-2;0;1;1;1;1;1;0;0;0
Tesla P100-PCIE-16GB [0x2f6c];3;5;7;7;30000;270.9;25;5;1;3;0;-2;-2;0;0;0;1;1;1;2;0;0
Tesla P100-PCIE-16GB [0x2f6c];3;5;7;13;30000;294.2;30;5;1;5;0;0;-1;0;1;1;1;1;1;0;1;0
Tesla P100-PCIE-16GB [0x2f6c];3;5;13;5;30000;396.8;20;5;1;4;0;0;-2;1;0;0;1;1;1;0;0;0
Tesla P100-PCIE-16GB [0x2f6c];3;5;13;7;30000;449.7;26;5;1;4;0;1;-2;1;0;1;1;1;1;0;0;0
Tesla P100-PCIE-16GB [0x2f6c];3;5;13;13;30000;498.4;40;5;1;2;0;0;-2;1;0;0;1;1;1;2;0;0
Tesla P100-PCIE-16GB [0x2f6c];3;5;13;16;30000;461.2;20;5;1;3;0;0;-2;1;1;1;1;1;1;2;0;0
Tesla P100-PCIE-16GB [0x2f6c];3;5;13;24;30000;494.4;60;5;1;4;0;-1;-1;1;0;0;1;1;1;2;0;0
Tesla P100-PCIE-16GB [0x2f6c];3;5;13;26;30000;486.0;30;5;1;4;0;-1;-1;1;1;0;1;1;1;2;1;0
Tesla P100-PCIE-16GB [0x2f6c];3;5;16;5;30000;454.9;24;5;1;3;0;-2;0;1;1;1;1;1;1;0;0;0
Tesla P100-PCIE-16GB [0x2f6c];3;5;16;13;30000;578.2;25;5;1;2;0;1;0;1;1;1;1;1;1;2;0;0
Tesla P100-PCIE-16GB [0x2f6c];3;5;16;16;30000;597.7;30;5;1;2;0;-2;-2;0;1;1;1;1;1;2;0;0
Tesla P100-PCIE-16GB [0x2f6c];3;5;16;24;30000;597.0;30;5;1;3;0;-2;-2;1;1;0;1;1;1;0;0;0
Tesla P100-PCIE-16GB [0x2f6c];3;5;16;26;30000;594.9;30;5;1;4;0;-2;-1;1;0;0;1;1;1;0;0;0
Tesla P100-PCIE-16GB [0x2f6c];3;5;24;5;30000;553.6;24;5;1;3;0;0;0;1;0;1;1;1;1;0;0;0
Tesla P100-PCIE-16GB [0x2f6c];3;5;24;13;30000;677.3;40;5;1;4;0;-1;-2;0;0;0;1;1;1;2;1;0
Tesla P100-PCIE-16GB [0x2f6c];3;5;24;16;30000;664.1;50;5;1;3;0;1;-1;0;1;1;1;1;1;0;1;0
Tesla P100-PCIE-16GB [0x2f6c];3;5;24;24;30000;734.9;50;5;1;5;0;-1;-1;0;1;1;1;1;1;0;0;0
Tesla P100-PCIE-16GB [0x2f6c];3;5;24;26;30000;724.8;50;5;1;2;0;-1;0;0;0;0;1;0;1;2;0;0
Tesla P100-PCIE-16GB [0x2f6c];3;5;26;5;30000;556.3;24;5;1;2;0;-2;0;0;0;1;1;1;1;2;0;0
Tesla P100-PCIE-16GB [0x2f6c];3;5;26;13;30000;753.2;60;5;1;2;0;1;1;1;1;0;1;1;1;0;0;0
Tesla P100-PCIE-16GB [0x2f6c];3;5;26;16;30000;744.1;30;5;1;4;0;1;-2;1;1;0;1;1;1;2;0;0
Tesla P100-PCIE-16GB [0x2f6c];3;5;26;24;30000;658.7;60;5;1;4;0;-1;0;0;0;1;1;1;1;2;1;0
Tesla P100-PCIE-16GB [0x2f6c];3;5;26;26;30000;521.7;7;5;1;3;0;-1;-2;1;1;1;1;1;1;1;0;0
Tesla P100-PCIE-16GB [0x2f6c];3;6;6;6;30000;272.0;25;6;1;5;0;1;0;0;1;1;1;1;1;2;0;0
Tesla P100-PCIE-16GB [0x2f6c];3;7;5;5;30000;158.7;30;7;1;5;0;0;-1;0;0;1;1;1;1;0;0;0
Tesla P100-PCIE-16GB [0x2f6c];3;7;5;7;30000;165.6;30;7;1;7;0;-2;-1;0;0;0;1;1;1;0;0;0
Tesla P100-PCIE-16GB [0x2f6c];3;7;5;13;30000;190.0;1;7;1;5;0;-1;-1;1;0;0;1;0;1;2;1;0
Tesla P100-PCIE-16GB [0x2f6c];3;7;7;5;30000;331.1;25;7;1;2;0;-2;0;0;1;1;1;1;1;2;0;0
Tesla P100-PCIE-16GB [0x2f6c];3;7;7;7;30000;354.4;26;7;1;4;0;-1;-2;0;0;1;1;1;1;0;0;0
Tesla P100-PCIE-16GB [0x2f6c];3;7;7;13;30000;394.8;30;7;1;5;0;0;-2;0;0;1;1;1;1;0;1;0
Tesla P100-PCIE-16GB [0x2f6c];3;7;13;5;30000;494.5;25;7;1;6;0;-1;-1;0;0;0;1;1;1;2;0;0
Tesla P100-PCIE-16GB [0x2f6c];3;7;13;7;30000;571.0;26;7;1;3;0;-2;-1;0;0;0;1;1;1;2;0;0
Tesla P100-PCIE-16GB [0x2f6c];3;7;13;13;30000;654.0;30;7;1;2;0;1;0;0;0;0;1;1;1;0;0;0
Tesla P100-PCIE-16GB [0x2f6c];3;8;8;8;30000;471.1;30;8;1;7;0;0;-1;1;0;0;1;1;1;0;0;0
Tesla P100-PCIE-16GB [0x2f6c];3;9;9;9;30000;545.1;30;9;1;6;0;0;-2;0;0;0;1;1;1;0;0;0
Tesla P100-PCIE-16GB [0x2f6c];3;9;9;16;30000;577.2;30;9;1;8;0;0;-1;0;0;1;1;1;1;2;0;0
Tesla P100-PCIE-16GB [0x2f6c];3;9;9;22;30000;566.3;40;9;1;4;0;-1;-1;0;1;1;1;1;1;2;0;0
Tesla P100-PCIE-16GB [0x2f6c];3;9;9;32;30000;546.8;50;9;1;5;0;0;0;0;0;1;1;1;1;2;0;0
Tesla P100-PCIE-16GB [0x2f6c];3;9;16;9;30000;791.8;30;9;1;7;0;0;-2;1;0;0;1;1;1;2;0;0
Tesla P100-PCIE-16GB [0x2f6c];3;9;16;16;30000;856.2;30;9;1;8;0;-1;0;1;1;0;1;1;1;0;0;0
Tesla P100-PCIE-16GB [0x2f6c];3;9;16;22;30000;879.6;50;9;1;4;0;0;0;0;1;0;1;1;1;0;0;0
Tesla P100-PCIE-16GB [0x2f6c];3;9;22;9;30000;945.7;40;9;1;8;0;-2;0;0;0;1;1;1;1;0;0;0
Tesla P100-PCIE-16GB [0x2f6c];3;9;22;16;30000;1062.4;40;9;1;3;0;-2;-1;1;1;1;1;1;1;2;0;0
Tesla P100-PCIE-16GB [0x2f6c];3;9;22;22;30000;1065.8;60;9;1;5;0;0;0;0;1;1;1;1;1;0;0;0
Tesla P100-PCIE-16GB [0x2f6c];3;9;22;32;30000;1072.5;60;9;1;2;0;0;-2;0;1;1;1;1;1;2;0;0
Tesla P100-PCIE-16GB [0x2f6c];3;9;32;9;30000;1113.6;50;9;1;6;0;1;0;1;0;1;1;1;1;0;0;0
Tesla P100-PCIE-16GB [0x2f6c];3;9;32;22;30000;1351.2;60;9;1;3;0;-2;0;1;0;1;1;1;1;0;0;0
Tesla P100-PCIE-16GB [0x2f6c];3;9;32;32;30000;1398.1;60;9;1;8;0;-2;0;1;1;1;1;1;1;2;0;0
Tesla P100-PCIE-16GB [0x2f6c];3;10;10;10;30000;637.6;30;10;1;2;0;-1;-1;0;0;0;1;1;1;2;0;0
Tesla P100-PCIE-16GB [0x2f6c];3;13;5;5;30000;245.9;20;13;1;2;0;1;-1;0;0;0;1;1;1;2;0;0
Tesla P100-PCIE-16GB [0x2f6c];3;13;5;7;30000;262.0;24;13;1;12;0;-1;0;0;0;0;1;1;1;2;0;0
Tesla P100-PCIE-16GB [0x2f6c];3;13;5;8;30000;268.9;25;13;1;11;0;-1;-1;0;1;0;1;1;1;2;0;0
Tesla P100-PCIE-16GB [0x2f6c];3;13;5;13;30000;278.8;30;13;1;4;0;-1;-1;0;0;0;1;1;1;2;0;0
Tesla P100-PCIE-16GB [0x2f6c];3;13;5;16;30000;457.6;30;13;1;9;0;-2;-1;0;1;0;1;1;1;2;1;0
Tesla P100-PCIE-16GB [0x2f6c];3;13;5;24;30000;464.2;40;13;1;13;0;-1;0;0;0;0;1;1;1;2;0;0
Tesla P100-PCIE-16GB [0x2f6c];3;13;5;26;30000;437.1;53;13;1;6;0;1;-2;0;0;1;1;1;1;2;1;0
Tesla P100-PCIE-16GB [0x2f6c];3;13;7;5;30000;347.6;25;13;1;12;0;-1;-2;0;1;0;1;1;1;2;0;0
Tesla P100-PCIE-16GB [0x2f6c];3;13;7;7;30000;364.8;24;13;1;5;0;-2;-2;0;0;0;1;1;1;2;0;0
Tesla P100-PCIE-16GB [0x2f6c];3;13;7;13;30000;433.8;30;13;1;13;0;1;0;0;0;1;1;1;1;0;0;0
Tesla P100-PCIE-16GB [0x2f6c];3;13;8;5;30000;388.2;25;13;1;11;0;-2;-1;0;1;0;1;1;1;2;0;0
Tesla P100-PCIE-16GB [0x2f6c];3;13;13;5;30000;716.0;26;13;1;12;0;-1;-2;0;0;0;1;1;1;0;0;0
Tesla P100-PCIE-16GB [0x2f6c];3;13;13;7;30000;808.8;40;13;1;6;0;0;-2;0;1;0;1;1;1;2;0;0
Tesla P100-PCIE-16GB [0x2f6c];3;13;13;13;30000;838.5;50;13;1;5;0;-2;-2;0;0;0;1;1;1;2;0;0
Tesla P100-PCIE-16GB [0x2f6c];3;13;13;16;30000;875.5;50;13;1;8;0;1;-1;0;0;0;1;1;1;2;0;0
Tesla P100-PCIE-16GB [0x2f6c];3;13;13;24;30000;749.0;17;13;1;10;0;-1;0;0;1;0;1;1;1;2;0;0
Tesla P100-PCIE-16GB [0x2f6c];3;13;13;26;30000;746.5;5;13;1;6;0;-2;-1;1;0;1;1;1;1;0;1;0
Tesla P100-PCIE-16GB [0x2f6c];3;13;16;5;30000;770.1;25;13;1;12;0;1;-2;0;0;0;1;1;1;2;0;0
Tesla P100-PCIE-16GB [0x2f6c];3;13;16;13;30000;982.7;50;13;1;13;0;-1;-1;1;0;0;1;1;1;0;0;0
Tesla P100-PCIE-16GB [0x2f6c];3;13;16;16;30000;973.6;60;13;1;7;0;0;-1;0;1;1;1;1;1;2;0;0
Tesla P100-PCIE-16GB [0x2f6c];3;13;16;24;30000;1050.2;60;13;1;8;0;0;0;0;1;0;1;1;1;2;0;0
Tesla P100-PCIE-16GB [0x2f6c];3;13;16;26;30000;975.0;53;13;1;2;0;-1;0;1;0;0;1;1;1;2;0;0
Tesla P100-PCIE-16GB [0x2f6c];3;13;24;5;30000;825.2;50;13;1;6;0;-1;-1;0;1;0;1;1;1;0;0;0
Tesla P100-PCIE-16GB [0x2f6c];3;13;24;13;30000;1175.7;40;13;1;6;0;-1;-2;1;1;0;1;0;1;2;0;0
Tesla P100-PCIE-16GB [0x2f6c];3;13;24;16;30000;1263.4;40;13;1;4;0;-2;1;1;0;0;1;0;1;2;0;0
Tesla P100-PCIE-16GB [0x2f6c];3;13;24;24;30000;1356.1;60;13;1;7;0;1;-1;1;0;0;1;1;1;2;0;0
Tesla P100-PCIE-16GB [0x2f6c];3;13;24;26;30000;1209.2;53;13;1;6;0;-1;-1;0;1;0;1;0;1;2;0;0
Tesla P100-PCIE-16GB [0x2f6c];3;13;26;5;30000;874.1;30;13;1;11;0;-2;-1;0;0;1;1;1;1;0;0;0
Tesla P100-PCIE-16GB [0x2f6c];3;13;26;13;30000;1295.5;60;13;1;13;0;-2;-2;1;1;1;1;1;1;1;0;0
Tesla P100-PCIE-16GB [0x2f6c];3;13;26;16;30000;1376.1;60;13;1;4;0;1;-2;1;1;0;1;1;1;2;0;0
Tesla P100-PCIE-16GB [0x2f6c];3;13;26;24;30000;1084.3;54;13;1;8;0;-1;-1;0;0;1;1;1;1;2;0;0
Tesla P100-PCIE-16GB [0x2f6c];3;13;26;26;30000;1427.8;60;13;1;11;0;1;0;0;1;0;1;0;1;2;0;0
Tesla P100-PCIE-16GB [0x2f6c];3;14;14;14;30000;908.2;50;14;1;3;0;1;-1;0;0;0;1;1;1;2;0;0
Tesla P100-PCIE-16GB [0x2f6c];3;14;14;16;30000;947.5;30;14;1;14;0;0;0;0;1;1;1;0;1;2;0;0
Tesla P100-PCIE-16GB [0x2f6c];3;14;14;29;30000;834.1;5;14;1;6;0;0;0;0;0;0;1;1;1;1;0;0
Tesla P100-PCIE-16GB [0x2f6c];3;14;16;14;30000;987.5;40;14;1;13;0;-1;-2;1;0;1;1;0;1;2;0;0
Tesla P100-PCIE-16GB [0x2f6c];3;14;16;16;30000;1013.9;60;14;1;7;0;-2;-1;0;0;0;1;1;1;2;0;0
Tesla P100-PCIE-16GB [0x2f6c];3;14;16;29;30000;893.9;4;14;1;4;0;0;0;1;1;1;1;1;1;0;1;0
Tesla P100-PCIE-16GB [0x2f6c];3;14;29;14;30000;1441.8;60;14;1;7;0;-2;-2;1;0;0;1;1;1;2;0;0
Tesla P100-PCIE-16GB [0x2f6c];3;14;29;16;30000;1521.6;60;14;1;13;0;1;-1;0;0;0;1;1;1;2;0;0
Tesla P100-PCIE-16GB [0x2f6c];3;14;29;29;30000;1489.4;50;14;1;9;0;0;-1;1;1;1;1;0;1;2;0;0
Tesla P100-PCIE-16GB [0x2f6c];3;15;15;15;30000;973.0;30;15;1;12;0;-2;-2;0;0;0;1;1;1;0;0;0
Tesla P100-PCIE-16GB [0x2f6c];3;16;5;5;0;194.0;23;16;1;0;0;0;0;0;0;0;1;0;0;0;0;0
Tesla P100-PCIE-16GB [0x2f6c];3;16;5;13;30000;581.2;50;16;1;16;0;-1;1;0;0;0;1;1;1;0;0;0
Tesla P100-PCIE-16GB [0x2f6c];3;16;5;16;30000;592.4;40;16;1;12;0;-1;0;0;1;1;1;1;1;2;0;0
Tesla P100-PCIE-16GB [0x2f6c];3;16;5;24;30000;439.1;6;16;1;14;0;1;1;0;0;1;1;1;1;1;0;0
Tesla P100-PCIE-16GB [0x2f6c];3;16;5;26;30000;581.3;60;16;1;15;0;0;0;0;0;1;1;1;1;2;1;0
Tesla P100-PCIE-16GB [0x2f6c];3;16;8;5;30000;462.6;25;16;1;8;0;-2;-2;0;0;1;1;1;1;0;0;0
Tesla P100-PCIE-16GB [0x2f6c];3;16;8;8;30000;511.4;30;16;1;15;0;0;-2;0;0;1;1;1;1;2;0;0
Tesla P100-PCIE-16GB [0x2f6c];3;16;9;9;30000;562.2;30;16;1;16;0;1;0;0;0;1;1;1;1;2;0;0
Tesla P100-PCIE-16GB [0x2f6c];3;16;9;16;30000;634.9;40;16;1;7;0;0;-1;0;1;0;1;1;1;2;0;0
Tesla P100-PCIE-16GB [0x2f6c];3;16;9;22;30000;632.4;50;16;1;10;0;-2;-2;0;0;1;1;1;1;0;0;0
Tesla P100-PCIE-16GB [0x2f6c];3;16;13;5;30000;786.7;24;16;1;15;0;-2;-1;0;0;0;1;1;1;2;0;0
Tesla P100-PCIE-16GB [0x2f6c];3;16;13;13;30000;1056.9;25;16;1;2;0;1;1;1;1;0;1;1;1;2;0;0
Tesla P100-PCIE-16GB [0x2f6c];3;16;13;16;30000;1147.4;30;16;1;4;0;0;-2;0;0;0;1;1;1;0;0;0
Tesla P100-PCIE-16GB [0x2f6c];3;16;13;24;30000;852.4;5;16;1;10;0;-1;-2;1;0;0;1;1;1;1;0;0
Tesla P100-PCIE-16GB [0x2f6c];3;16;13;26;30000;1097.1;40;16;1;15;0;1;-1;1;0;1;1;0;1;0;0;0
Tesla P100-PCIE-16GB [0x2f6c];3;16;14;14;30000;1136.9;25;16;1;12;0;1;-2;0;1;1;1;1;1;2;0;0
Tesla P100-PCIE-16GB [0x2f6c];3;16;14;16;30000;1169.5;30;16;1;14;0;-1;-1;0;0;0;1;0;1;2;0;0
Tesla P100-PCIE-16GB [0x2f6c];3;16;14;29;30000;901.8;7;16;1;10;0;1;0;0;0;0;1;0;1;1;0;0
Tesla P100-PCIE-16GB [0x2f6c];3;16;16;5;30000;860.6;25;16;1;16;0;-1;-2;0;1;0;1;1;1;2;0;0
Tesla P100-PCIE-16GB [0x2f6c];3;16;16;9;30000;1044.8;50;16;1;7;0;0;0;0;0;1;1;1;1;2;0;0
Tesla P100-PCIE-16GB [0x2f6c];3;16;16;13;30000;1059.9;50;16;1;15;0;-2;0;0;0;0;1;0;1;2;0;0
Tesla P100-PCIE-16GB [0x2f6c];3;16;16;14;30000;1083.5;40;16;1;15;0;0;-1;0;0;0;1;0;1;2;0;0
Tesla P100-PCIE-16GB [0x2f6c];3;16;16;16;30000;1099.0;40;16;1;14;0;-1;0;0;0;1;1;1;1;2;0;0
Tesla P100-PCIE-16GB [0x2f6c];3;16;16;22;30000;1128.1;60;16;1;10;0;1;-2;0;0;0;1;1;1;0;0;0
Tesla P100-PCIE-16GB [0x2f6c];3;16;16;24;30000;1110.8;40;16;1;15;0;0;-2;0;1;1;1;0;1;2;0;0
Tesla P100-PCIE-16GB [0x2f6c];3;16;16;26;30000;1104.1;50;16;1;11;0;0;-2;1;0;0;1;0;1;2;0;0
Tesla P100-PCIE-16GB [0x2f6c];3;16;16;29;30000;977.5;5;16;1;6;0;1;-2;0;1;1;1;1;1;1;0;0
Tesla P100-PCIE-16GB [0x2f6c];3;16;16;55;30000;1030.9;1;16;1;7;0;1;1;0;0;1;1;0;1;0;1;0
Tesla P100-PCIE-16GB [0x2f6c];3;16;22;9;30000;1267.6;30;16;1;2;0;0;-1;0;1;0;1;1;1;2;0;0
Tesla P100-PCIE-16GB [0x2f6c];3;16;22;16;30000;1382.6;50;16;1;8;0;1;1;1;1;0;1;1;1;0;0;0
Tesla P100-PCIE-16GB [0x2f6c];3;16;22;22;30000;1411.9;60;16;1;12;0;1;-2;1;0;1;1;1;1;0;0;0
Tesla P100-PCIE-16GB [0x2f6c];3;16;24;5;30000;877.9;25;16;1;11;0;0;-2;1;0;0;1;0;1;2;0;0
Tesla P100-PCIE-16GB [0x2f6c];3;16;24;13;30000;1361.4;40;16;1;13;0;1;-2;1;0;0;1;1;1;0;0;0
Tesla P100-PCIE-16GB [0x2f6c];3;16;24;16;30000;1463.5;60;16;1;4;0;-2;-2;0;0;0;1;1;1;2;0;0
Tesla P100-PCIE-16GB [0x2f6c];3;16;24;24;30000;1164.1;36;16;1;10;0;-1;0;0;0;1;1;0;1;0;0;0
Tesla P100-PCIE-16GB [0x2f6c];3;16;24;26;30000;1158.0;7;16;1;15;0;1;0;0;0;1;1;1;1;1;0;0
Tesla P100-PCIE-16GB [0x2f6c];3;16;26;5;30000;969.1;30;16;1;10;0;-1;-1;0;0;0;1;1;1;2;0;0
Tesla P100-PCIE-16GB [0x2f6c];3;16;26;13;30000;1469.9;50;16;1;5;0;1;0;1;1;1;1;1;1;2;0;0
Tesla P100-PCIE-16GB [0x2f6c];3;16;26;16;30000;1548.9;60;16;1;6;0;-1;0;1;0;0;1;1;1;2;0;0
Tesla P100-PCIE-16GB [0x2f6c];3;16;26;24;30000;1554.5;60;16;1;11;0;0;-1;0;0;0;1;0;1;2;0;0
Tesla P100-PCIE-16GB [0x2f6c];3;16;26;26;30000;1486.2;50;16;1;11;0;0;-1;0;1;0;1;0;1;2;0;0
Tesla P100-PCIE-16GB [0x2f6c];3;16;29;14;30000;1578.2;50;16;1;4;0;-1;1;1;0;1;1;1;1;2;0;0
Tesla P100-PCIE-16GB [0x2f6c];3;16;29;16;30000;1569.0;50;16;1;9;0;0;0;0;0;0;1;0;1;2;0;0
Tesla P100-PCIE-16GB [0x2f6c];3;16;29;29;30000;1555.2;50;16;1;10;0;-1;-2;0;0;1;1;0;1;2;0;0
Tesla P100-PCIE-16GB [0x2f6c];3;16;29;55;30000;1359.1;17;16;1;15;0;1;0;0;1;1;1;1;1;2;0;0
Tesla P100-PCIE-16GB [0x2f6c];3;16;55;16;30000;1411.0;45;16;1;3;0;-2;1;1;0;1;1;1;1;1;0;0
Tesla P100-PCIE-16GB [0x2f6c];3;16;55;29;30000;1505.1;23;16;1;13;0;0;-1;0;0;0;1;1;1;2;0;0
Tesla P100-PCIE-16GB [0x2f6c];3;16;55;55;30000;1634.4;36;16;1;13;0;-1;0;0;1;0;1;0;1;2;0;0
Tesla P100-PCIE-16GB [0x2f6c];3;20;20;20;30000;1396.9;50;20;1;8;0;-2;-2;0;0;1;1;0;1;2;0;0
Tesla P100-PCIE-16GB [0x2f6c];3;22;9;9;30000;620.0;30;22;1;14;0;1;0;0;0;0;1;1;1;1;0;0
Tesla P100-PCIE-16GB [0x2f6c];3;22;9;16;30000;635.4;40;22;1;21;0;-2;-2;0;0;0;1;1;1;2;0;0
Tesla P100-PCIE-16GB [0x2f6c];3;22;9;22;30000;642.7;60;22;1;18;0;-2;-1;0;0;0;1;1;1;2;0;0
Tesla P100-PCIE-16GB [0x2f6c];3;22;9;32;30000;603.6;27;22;1;17;0;-1;0;0;0;1;1;1;1;0;0;0
Tesla P100-PCIE-16GB [0x2f6c];3;22;16;9;30000;955.7;50;22;1;12;0;-2;-2;1;0;1;1;1;1;0;0;0
Tesla P100-PCIE-16GB [0x2f6c];3;22;16;16;30000;1124.4;50;22;1;11;0;-1;-2;0;0;1;1;1;1;2;0;0
Tesla P100-PCIE-16GB [0x2f6c];3;22;16;22;30000;1161.8;60;22;1;21;0;0;0;0;0;0;1;1;1;2;0;0
Tesla P100-PCIE-16GB [0x2f6c];3;22;22;9;30000;1371.4;60;22;1;8;0;0;-1;0;0;0;1;1;1;2;0;0
Tesla P100-PCIE-16GB [0x2f6c];3;22;22;16;30000;1475.2;50;22;1;8;0;-1;-2;0;1;0;1;1;1;2;0;0
Tesla P100-PCIE-16GB [0x2f6c];3;22;22;22;30000;1550.1;60;22;1;19;0;0;-1;0;0;1;1;1;1;2;0;0
Tesla P100-PCIE-16GB [0x2f6c];3;22;22;32;30000;1421.8;40;22;1;1;0;-2;0;0;0;0;1;1;1;2;0;0
Tesla P100-PCIE-16GB [0x2f6c];3;22;32;9;30000;1594.6;50;22;1;3;0;0;1;0;1;0;1;1;1;2;0;0
Tesla P100-PCIE-16GB [0x2f6c];3;22;32;22;30000;2044.8;60;22;1;10;0;-2;0;0;1;0;1;0;1;2;0;0
Tesla P100-PCIE-16GB [0x2f6c];3;22;32;32;30000;2052.0;60;22;1;15;0;0;0;0;1;0;1;0;1;2;0;0
Tesla P100-PCIE-16GB [0x2f6c];3;23;23;23;30000;1657.8;50;23;1;17;0;0;0;0;0;1;1;0;1;2;0;0
Tesla P100-PCIE-16GB [0x2f6c];3;24;5;5;30000;557.5;24;24;1;1;0;-1;-1;0;1;0;1;1;1;2;0;0
Tesla P100-PCIE-16GB [0x2f6c];3;24;5;13;30000;657.2;40;24;1;22;0;0;0;1;1;0;1;1;1;2;1;0
Tesla P100-PCIE-16GB [0x2f6c];3;24;5;16;30000;652.6;50;24;1;13;0;0;-1;1;0;1;1;1;1;2;0;0
Tesla P100-PCIE-16GB [0x2f6c];3;24;5;24;30000;600.1;53;24;1;1;0;-2;1;0;1;1;1;0;1;2;0;0
Tesla P100-PCIE-16GB [0x2f6c];3;24;5;26;30000;621.4;60;24;1;20;0;0;-2;1;0;0;1;1;1;2;0;0
Tesla P100-PCIE-16GB [0x2f6c];3;24;13;5;30000;857.0;30;24;1;20;0;1;-1;1;0;1;1;1;1;0;0;0
Tesla P100-PCIE-16GB [0x2f6c];3;24;13;13;30000;1145.1;25;24;1;22;0;1;1;1;0;0;1;0;1;2;0;0
Tesla P100-PCIE-16GB [0x2f6c];3;24;13;16;30000;991.2;45;24;1;19;0;-1;0;0;0;0;1;1;1;2;0;0
Tesla P100-PCIE-16GB [0x2f6c];3;24;13;24;30000;1111.6;50;24;1;6;0;-1;-1;0;0;1;1;1;1;2;0;0
Tesla P100-PCIE-16GB [0x2f6c];3;24;13;26;30000;1022.9;25;24;1;22;0;-2;-1;0;1;1;1;1;1;2;0;0
Tesla P100-PCIE-16GB [0x2f6c];3;24;16;5;30000;980.0;40;24;1;10;0;-1;0;0;0;1;1;1;1;0;0;0
Tesla P100-PCIE-16GB [0x2f6c];3;24;16;13;30000;1524.4;50;24;1;21;0;-2;-1;0;0;1;1;1;1;0;0;0
Tesla P100-PCIE-16GB [0x2f6c];3;24;16;16;30000;1541.4;60;24;1;12;0;0;-1;1;0;0;1;1;1;2;0;0
Tesla P100-PCIE-16GB [0x2f6c];3;24;16;24;30000;1506.5;50;24;1;24;0;-1;-1;0;1;1;1;0;1;2;0;0
Tesla P100-PCIE-16GB [0x2f6c];3;24;16;26;30000;1178.7;26;24;1;24;0;0;0;1;0;1;1;1;1;1;0;0
Tesla P100-PCIE-16GB [0x2f6c];3;24;24;5;30000;1051.1;50;24;1;23;0;1;-2;1;0;1;1;1;1;0;0;0
Tesla P100-PCIE-16GB [0x2f6c];3;24;24;13;30000;1584.1;50;24;1;7;0;-1;-1;1;1;1;1;1;1;0;0;0
Tesla P100-PCIE-16GB [0x2f6c];3;24;24;16;30000;1630.0;60;24;1;5;0;0;-2;0;0;0;1;1;1;2;0;0
Tesla P100-PCIE-16GB [0x2f6c];3;24;24;24;30000;1606.4;50;24;1;1;0;1;0;1;0;0;1;1;1;2;0;0
Tesla P100-PCIE-16GB [0x2f6c];3;24;24;26;30000;1483.6;46;24;1;4;0;-1;0;0;1;1;1;0;1;2;0;0
Tesla P100-PCIE-16GB [0x2f6c];3;24;26;5;30000;1069.4;40;24;1;20;0;0;-1;0;1;0;1;1;1;2;0;0
Tesla P100-PCIE-16GB [0x2f6c];3;24;26;13;30000;1516.6;40;24;1;23;0;-1;-1;0;0;0;1;1;1;2;0;0
Tesla P100-PCIE-16GB [0x2f6c];3;24;26;16;30000;1617.3;40;24;1;21;0;1;0;0;0;0;1;1;1;2;0;0
Tesla P100-PCIE-16GB [0x2f6c];3;24;26;24;30000;1806.5;60;24;1;13;0;-2;0;0;0;0;1;0;1;0;0;0
Tesla P100-PCIE-16GB [0x2f6c];3;24;26;26;30000;1777.9;60;24;1;17;0;1;0;1;0;1;1;0;1;2;0;0
Tesla P100-PCIE-16GB [0x2f6c];3;25;25;25;30000;1779.6;60;25;1;12;0;-2;-1;0;0;1;1;0;1;2;0;0
Tesla P100-PCIE-16GB [0x2f6c];3;26;5;5;30000;534.8;20;26;1;1;0;-1;0;1;0;1;1;1;1;2;0;0
Tesla P100-PCIE-16GB [0x2f6c];3;26;5;13;30000;691.2;40;26;1;13;0;-1;-2;1;1;0;1;1;1;2;0;0
Tesla P100-PCIE-16GB [0x2f6c];3;26;5;16;30000;693.3;40;26;1;21;0;0;-1;0;1;0;1;0;1;2;0;0
Tesla P100-PCIE-16GB [0x2f6c];3;26;5;24;30000;520.0;25;26;1;23;0;1;-2;0;0;0;1;0;1;2;0;0
Tesla P100-PCIE-16GB [0x2f6c];3;26;5;26;30000;524.8;3;26;1;25;0;1;1;1;1;0;1;1;1;2;1;0
Tesla P100-PCIE-16GB [0x2f6c];3;26;13;5;30000;939.0;40;26;1;9;0;-1;-1;0;1;0;1;1;1;0;0;0
Tesla P100-PCIE-16GB [0x2f6c];3;26;13;13;30000;1240.9;40;26;1;7;0;-2;0;0;0;0;1;1;1;0;0;0
Tesla P100-PCIE-16GB [0x2f6c];3;26;13;16;30000;1178.2;50;26;1;22;0;0;-2;1;0;0;1;1;1;0;0;0
Tesla P100-PCIE-16GB [0x2f6c];3;26;13;24;30000;1030.6;24;26;1;26;0;1;-1;0;1;0;1;0;1;2;0;0
Tesla P100-PCIE-16GB [0x2f6c];3;26;13;26;30000;1253.7;60;26;1;1;0;1;0;1;0;0;1;1;1;2;0;0
Tesla P100-PCIE-16GB [0x2f6c];3;26;16;5;30000;976.2;40;26;1;11;0;0;-2;1;0;0;1;1;1;0;0;0
Tesla P100-PCIE-16GB [0x2f6c];3;26;16;13;30000;1571.2;50;26;1;26;0;1;1;0;0;0;1;1;1;2;0;0
Tesla P100-PCIE-16GB [0x2f6c];3;26;16;16;30000;1174.4;47;26;1;4;0;-1;-1;1;0;1;1;1;1;2;0;0
Tesla P100-PCIE-16GB [0x2f6c];3;26;16;24;30000;1579.9;60;26;1;23;0;1;-1;0;1;1;1;0;1;2;0;0
Tesla P100-PCIE-16GB [0x2f6c];3;26;16;26;30000;1195.7;25;26;1;18;0;-2;-2;0;1;1;1;0;1;0;0;0
Tesla P100-PCIE-16GB [0x2f6c];3;26;24;5;30000;1085.3;50;26;1;26;0;0;0;0;0;0;1;1;1;2;0;0
Tesla P100-PCIE-16GB [0x2f6c];3;26;24;13;30000;1443.2;50;26;1;1;0;1;-1;1;1;1;1;1;1;0;0;0
Tesla P100-PCIE-16GB [0x2f6c];3;26;24;16;30000;1652.9;60;26;1;9;0;0;0;0;0;1;1;1;1;0;0;0
Tesla P100-PCIE-16GB [0x2f6c];3;26;24;24;30000;1443.9;30;26;1;15;0;0;-1;0;0;0;1;0;1;1;0;0
Tesla P100-PCIE-16GB [0x2f6c];3;26;24;26;30000;1482.0;36;26;1;23;0;1;0;0;1;0;1;1;1;1;0;0
Tesla P100-PCIE-16GB [0x2f6c];3;26;26;5;30000;1076.0;50;26;1;23;0;0;-1;0;0;0;1;0;1;1;0;0
Tesla P100-PCIE-16GB [0x2f6c];3;26;26;13;30000;1654.9;60;26;1;23;0;0;-2;0;0;0;1;0;1;2;0;0
Tesla P100-PCIE-16GB [0x2f6c];3;26;26;16;30000;1613.0;53;26;1;26;0;-1;0;0;1;0;1;1;1;2;0;0
Tesla P100-PCIE-16GB [0x2f6c];3;26;26;24;30000;1521.5;25;26;1;17;0;1;-1;0;0;1;1;0;1;2;0;0
Tesla P100-PCIE-16GB [0x2f6c];3;26;26;26;30000;1825.8;60;26;1;22;0;1;0;0;0;1;1;0;1;2;0;0
Tesla P100-PCIE-16GB [0x2f6c];3;28;28;28;30000;2017.4;60;28;1;25;0;0;0;0;0;1;1;0;1;2;0;0
Tesla P100-PCIE-16GB [0x2f6c];3;29;14;14;30000;1063.5;50;29;1;28;0;0;-1;0;0;0;1;0;1;2;0;0
Tesla P100-PCIE-16GB [0x2f6c];3;29;14;16;30000;1124.0;60;29;1;27;0;0;0;1;1;0;1;0;1;2;0;0
Tesla P100-PCIE-16GB [0x2f6c];3;29;14;29;30000;1086.7;7;29;1;26;0;-2;0;1;0;0;1;1;1;2;0;0
Tesla P100-PCIE-16GB [0x2f6c];3;29;16;14;30000;1190.2;55;29;1;1;0;1;-1;1;1;0;1;1;1;2;0;0
Tesla P100-PCIE-16GB [0x2f6c];3;29;16;16;30000;1402.8;50;29;1;5;0;1;0;0;0;0;1;1;1;2;0;0
Tesla P100-PCIE-16GB [0x2f6c];3;29;16;29;30000;1226.1;30;29;1;14;0;-2;0;1;0;0;1;0;1;2;0;0
Tesla P100-PCIE-16GB [0x2f6c];3;29;16;55;30000;1096.1;9;29;1;22;0;0;0;1;0;0;1;1;1;2;0;0
Tesla P100-PCIE-16GB [0x2f6c];3;29;29;14;30000;1676.4;40;29;1;24;0;-1;0;1;1;1;1;0;1;2;0;0
Tesla P100-PCIE-16GB [0x2f6c];3;29;29;16;30000;1869.9;60;29;1;10;0;1;-1;0;0;0;1;1;1;2;0;0
Tesla P100-PCIE-16GB [0x2f6c];3;29;29;29;30000;1741.8;40;29;1;25;0;-2;0;0;0;0;1;0;1;2;0;0
Tesla P100-PCIE-16GB [0x2f6c];3;29;29;55;30000;1646.8;37;29;1;28;0;1;-2;1;1;1;1;0;1;2;0;0
Tesla P100-PCIE-16GB [0x2f6c];3;29;55;16;30000;1872.0;40;29;1;27;0;0;0;0;0;0;1;0;1;2;0;0
Tesla P100-PCIE-16GB [0x2f6c];3;29;55;29;30000;2156.0;31;29;1;17;0;0;0;1;0;0;1;1;1;2;0;0
Tesla P100-PCIE-16GB [0x2f6c];3;29;55;55;30000;2066.8;5;29;1;25;0;0;0;0;0;0;1;0;1;2;0;0
Tesla P100-PCIE-16GB [0x2f6c];3;30;30;30;30000;1919.2;40;30;1;1;0;-2;0;0;0;0;1;1;1;0;0;0
Tesla P100-PCIE-16GB [0x2f6c];3;32;32;9;30000;1831.3;60;32;1;6;0;-1;1;1;0;0;1;1;1;2;0;0
Tesla P100-PCIE-16GB [0x2f6c];3;32;32;22;30000;2073.6;40;32;1;1;0;-1;-1;0;1;0;1;1;1;2;0;0
Tesla P100-PCIE-16GB [0x2f6c];3;32;32;32;30000;2187.8;50;32;1;1;0;1;0;0;0;0;1;1;1;2;0;0
Tesla P100-PCIE-16GB [0x2f6c];3;35;35;35;30000;1744.5;18;35;1;33;0;2;0;0;0;0;1;1;1;2;0;0
Tesla P100-PCIE-16GB [0x2f6c];3;36;36;36;30000;1823.8;36;36;1;24;0;-1;-2;0;0;0;1;1;1;2;0;0
Tesla P100-PCIE-16GB [0x2f6c];3;40;40;40;0;1912.2;34;40;1;0;0;0;0;0;0;0;1;1;1;2;0;0
Tesla P100-PCIE-16GB [0x2f6c];3;55;16;16;30000;1311.0;25;55;1;32;0;0;0;1;1;0;1;1;1;2;0;0
Tesla P100-PCIE-16GB [0x2f6c];3;55;16;29;30000;1499.1;22;55;1;19;0;-1;0;1;0;0;1;1;1;2;0;0
Tesla P100-PCIE-16GB [0x2f6c];3;55;16;55;30000;1080.8;8;55;1;19;0;-1;0;1;0;1;1;0;1;2;0;0
Tesla P100-PCIE-16GB [0x2f6c];3;55;29;16;30000;1699.5;34;55;1;19;0;-1;-1;0;1;0;1;1;1;2;0;0
Tesla P100-PCIE-16GB [0x2f6c];3;55;29;29;30000;1710.1;9;55;1;52;0;0;0;0;0;0;1;1;1;2;0;0
Tesla P100-PCIE-16GB [0x2f6c];3;55;29;55;30000;1030.0;8;55;1;33;0;0;0;0;0;0;1;0;1;2;0;0
Tesla P100-PCIE-16GB [0x2f6c];3;55;55;16;30000;2125.2;46;55;1;51;0;0;-2;0;0;0;1;0;1;2;0;0
Tesla P100-PCIE-16GB [0x2f6c];3;55;55;29;30000;2243.0;8;55;1;29;0;0;0;0;1;0;1;0;1;2;0;0
Tesla P100-PCIE-16GB [0x2f6c];3;55;55;55;30000;1768.7;8;55;1;42;0;0;0;0;0;0;1;0;1;2;0;0
Tesla P100-PCIE-16GB [0x2f6c];3;64;64;64;30000;1239.7;55;64;1;1;0;0;0;0;0;0;0;0;1;2;0;0
Tesla P100-PCIE-16GB [0x2f6c];3;78;78;78;30000;524.9;1;78;1;43;0;-1;1;0;1;0;1;1;0;2;1;0
