src/acc/opencl/smm/params/tune_multiply_Mi250.csv
DEVICE;TYPEID;M;N;K;S;GFLOPS;BS;BM;BN;BK;WS;WG;LU;NZ;AL;TB;TC;AP;AA;AB;AC
gfx90a [0x989f];3;3;3;3;30000;0;10;3;1;3;1;-1;0;0;1;1;1;0;2;0;0;0
gfx90a [0x989f];3;3;3;4;30000;0;25;3;1;2;1;0;-2;0;0;0;1;0;0;2;0;0
gfx90a [0x989f];3;3;3;5;30000;0;29;3;1;2;1;-1;-2;0;1;0;1;0;2;2;1;0
gfx90a [0x989f];3;3;3;6;30000;0;29;3;1;2;1;-2;-2;0;1;1;1;0;0;0;0;0
gfx90a [0x989f];3;3;3;7;30000;0;29;3;1;2;1;-1;0;0;1;1;1;0;2;2;1;0
gfx90a [0x989f];3;3;3;8;30000;0;9;3;1;2;1;-2;-1;0;0;0;1;0;2;0;0;0
gfx90a [0x989f];3;3;3;9;30000;0;9;3;1;2;1;-2;0;0;0;0;1;0;2;2;0;0
gfx90a [0x989f];3;3;3;10;30000;0;37;3;1;1;1;0;0;0;0;0;1;0;2;2;0;0
gfx90a [0x989f];3;3;3;11;30000;0;8;3;1;3;1;1;-2;0;0;0;1;0;2;2;0;0
gfx90a [0x989f];3;3;3;12;30000;0;6;3;1;3;1;-2;-2;0;0;0;1;0;2;0;0;0
gfx90a [0x989f];3;3;3;16;30000;0;9;3;1;1;1;1;-1;0;0;0;1;0;2;2;0;0
gfx90a [0x989f];3;3;3;23;30000;0;3;3;1;1;1;-1;-2;0;0;0;1;0;2;2;0;0
gfx90a [0x989f];3;3;4;3;30000;0;21;3;1;1;1;0;-1;0;0;0;1;0;2;0;0;0
gfx90a [0x989f];3;3;4;4;30000;0;25;3;1;2;1;0;-2;0;0;0;1;0;0;2;0;0
gfx90a [0x989f];3;3;5;3;30000;0;18;3;1;1;1;1;-2;0;0;0;1;0;0;2;0;0
gfx90a [0x989f];3;3;5;5;30000;0;25;3;1;2;1;-1;-2;0;0;0;1;0;2;2;0;0
gfx90a [0x989f];3;3;6;3;30000;0;15;3;1;1;1;1;0;0;0;0;1;0;0;0;0;0
gfx90a [0x989f];3;3;6;6;30000;0;25;3;1;3;1;-1;-2;0;0;0;1;0;2;0;0;0
gfx90a [0x989f];3;3;7;3;30000;0;15;3;1;2;1;-1;0;0;0;0;1;0;0;0;0;0
gfx90a [0x989f];3;3;7;7;30000;0;29;3;1;1;1;-1;0;0;0;0;1;0;0;0;0;0
gfx90a [0x989f];3;3;8;3;30000;0;15;3;1;2;1;1;-1;0;0;0;1;0;2;2;0;0
gfx90a [0x989f];3;3;8;8;30000;0;29;3;1;1;1;0;0;0;0;0;1;0;2;0;0;0
gfx90a [0x989f];3;3;9;3;30000;0;15;3;1;1;1;-1;-2;0;0;0;1;0;0;0;0;0
gfx90a [0x989f];3;3;9;9;30000;0;25;3;1;3;1;0;-2;0;1;1;1;0;0;2;1;0
gfx90a [0x989f];3;3;10;3;30000;0;15;3;1;1;1;-2;-2;0;0;0;1;0;2;2;0;0
gfx90a [0x989f];3;3;10;10;30000;0;25;3;1;1;1;0;-2;0;0;1;1;0;2;2;0;0
gfx90a [0x989f];3;3;11;3;30000;0;15;3;1;3;1;0;-2;0;0;0;1;0;0;0;0;0
gfx90a [0x989f];3;3;11;11;30000;0;30;3;1;1;1;1;0;0;0;0;1;0;2;2;0;0
gfx90a [0x989f];3;3;12;3;30000;0;15;3;1;1;1;-1;-2;0;0;0;1;0;0;2;0;0
gfx90a [0x989f];3;3;12;12;30000;0;25;3;1;2;1;-2;-1;0;0;0;1;0;2;1;0;0
gfx90a [0x989f];3;3;16;3;30000;0;15;3;1;2;1;0;0;0;0;0;1;0;2;2;0;0
gfx90a [0x989f];3;3;16;16;30000;0;40;3;1;1;1;-2;0;0;0;0;1;0;0;0;0;0
gfx90a [0x989f];3;3;23;3;30000;0;15;3;1;3;1;0;0;0;0;0;1;0;0;2;0;0
gfx90a [0x989f];3;3;23;23;30000;0;50;3;1;3;1;-1;0;0;1;0;1;1;0;0;1;0
gfx90a [0x989f];3;4;3;3;30000;0;18;4;1;3;1;1;-2;0;0;0;1;0;2;2;0;0
gfx90a [0x989f];3;4;3;4;30000;0;25;4;1;2;1;-1;-1;0;0;0;1;0;2;0;0;0
gfx90a [0x989f];3;4;4;3;30000;0;21;4;1;2;1;-2;-2;0;0;0;1;0;2;2;0;0
gfx90a [0x989f];3;4;4;4;30000;0;16;4;1;2;1;1;3;1;1;1;1;0;0;0;0;0
gfx90a [0x989f];3;4;4;5;30000;0;9;4;1;2;1;-1;-2;0;0;0;1;0;0;0;0;0
gfx90a [0x989f];3;4;4;6;30000;0;29;4;1;3;1;0;0;0;0;0;1;0;2;0;0;0
gfx90a [0x989f];3;4;4;7;30000;0;29;4;1;2;1;-1;-2;0;0;0;1;0;0;0;0;0
gfx90a [0x989f];3;4;4;8;30000;0;9;4;1;2;1;-2;0;0;0;0;1;0;2;0;0;0
gfx90a [0x989f];3;4;4;9;30000;0;25;4;1;3;1;1;-1;0;0;0;1;0;2;2;0;0
gfx90a [0x989f];3;4;4;10;30000;0;25;4;1;2;1;0;-1;0;0;0;1;0;2;2;0;0
gfx90a [0x989f];3;4;4;11;30000;0;25;4;1;4;1;0;-1;0;0;0;1;0;0;0;0;0
gfx90a [0x989f];3;4;4;12;30000;0;29;4;1;4;1;1;-2;0;0;0;1;0;0;2;0;0
gfx90a [0x989f];3;4;4;16;30000;0;4;4;1;2;1;-1;-1;0;1;0;1;0;0;0;0;0
gfx90a [0x989f];3;4;4;23;30000;0;30;4;1;3;1;0;0;0;1;0;1;0;0;2;1;0
gfx90a [0x989f];3;4;5;4;30000;0;25;4;1;2;1;0;3;0;0;0;1;0;2;2;0;0
gfx90a [0x989f];3;4;5;5;30000;0;25;4;1;1;1;-1;0;0;0;0;1;0;2;0;0;0
gfx90a [0x989f];3;4;6;4;30000;0;21;4;1;2;1;-1;1;0;1;1;1;0;0;2;0;0
gfx90a [0x989f];3;4;6;6;30000;0;25;4;1;3;1;1;-2;0;0;0;1;0;2;0;0;0
gfx90a [0x989f];3;4;7;4;30000;0;21;4;1;1;1;-2;0;0;1;1;1;0;0;0;0;0
gfx90a [0x989f];3;4;7;7;30000;0;25;4;1;4;1;0;-2;0;1;0;1;0;2;2;1;0
gfx90a [0x989f];3;4;8;4;30000;0;25;4;1;3;1;1;-1;0;0;0;1;0;0;2;0;0
gfx90a [0x989f];3;4;8;8;30000;0;9;4;1;2;1;0;-1;0;0;0;1;0;0;2;0;0
gfx90a [0x989f];3;4;9;4;30000;0;20;4;1;4;1;1;0;0;1;0;1;0;2;0;1;0
gfx90a [0x989f];3;4;9;9;30000;0;26;4;1;3;1;1;-1;0;0;0;1;0;2;0;0;0
gfx90a [0x989f];3;4;10;4;30000;0;20;4;1;4;1;0;-1;0;0;0;1;0;0;0;0;0
gfx90a [0x989f];3;4;10;10;30000;0;25;4;1;2;1;0;0;0;0;0;1;0;0;2;0;0
gfx90a [0x989f];3;4;11;4;30000;0;18;4;1;1;1;0;-1;0;0;0;1;0;2;0;0;0
gfx90a [0x989f];3;4;11;11;30000;0;30;4;1;4;1;0;-2;0;0;0;1;0;0;2;0;0
gfx90a [0x989f];3;4;12;4;30000;0;20;4;1;3;1;-1;-2;0;1;0;1;0;2;2;0;0
gfx90a [0x989f];3;4;12;12;30000;0;40;4;1;4;1;1;-1;0;1;1;1;1;2;0;1;0
gfx90a [0x989f];3;4;16;4;30000;0;20;4;1;1;1;1;-1;0;0;0;1;0;2;2;0;0
gfx90a [0x989f];3;4;16;16;30000;0;30;4;1;1;1;1;-1;0;0;0;1;0;2;2;0;0
gfx90a [0x989f];3;4;23;4;30000;0;24;4;1;2;1;-2;-2;0;0;0;1;0;0;0;0;0
gfx90a [0x989f];3;4;23;23;30000;0;25;4;1;1;1;-2;-1;0;0;0;1;0;0;1;0;0
gfx90a [0x989f];3;5;3;3;30000;0;18;5;1;5;1;0;-2;0;0;0;1;0;2;2;0;0
gfx90a [0x989f];3;5;3;5;30000;0;12;5;1;2;1;1;0;0;0;0;1;0;2;2;0;0
gfx90a [0x989f];3;5;4;4;30000;0;24;5;1;4;1;0;0;0;0;0;1;0;0;2;0;0
gfx90a [0x989f];3;5;4;5;30000;0;9;5;1;5;1;0;-1;0;0;0;1;0;2;0;0;0
gfx90a [0x989f];3;5;5;3;30000;0;20;5;1;2;1;-1;-2;0;0;0;1;0;2;2;0;0
gfx90a [0x989f];3;5;5;4;30000;0;9;5;1;2;1;0;-2;0;0;0;1;0;2;0;0;0
gfx90a [0x989f];3;5;5;5;30000;0;10;5;1;2;1;0;-1;0;1;1;1;1;0;0;0;0
gfx90a [0x989f];3;5;5;6;30000;0;9;5;1;4;1;-2;-1;0;0;0;1;0;2;0;0;0
gfx90a [0x989f];3;5;5;7;30000;0;20;5;1;2;1;0;1;0;0;0;1;0;2;0;0;0
gfx90a [0x989f];3;5;5;8;30000;0;24;5;1;3;1;-1;-1;0;0;0;1;0;2;2;0;0
gfx90a [0x989f];3;5;5;9;30000;0;25;5;1;5;1;0;0;0;0;0;1;0;0;0;0;0
gfx90a [0x989f];3;5;5;10;30000;0;25;5;1;2;1;1;-1;0;0;0;1;0;0;0;0;0
gfx90a [0x989f];3;5;5;11;30000;0;25;5;1;2;1;0;1;0;0;0;1;0;0;0;0;0
gfx90a [0x989f];3;5;5;12;30000;0;12;5;1;3;1;-2;0;0;1;1;1;0;2;0;0;0
gfx90a [0x989f];3;5;5;16;30000;0;25;5;1;5;1;1;-2;0;0;0;1;0;0;2;0;0
gfx90a [0x989f];3;5;5;23;30000;0;30;5;1;3;5;0;-2;0;0;0;1;0;2;0;0;0
gfx90a [0x989f];3;5;6;5;30000;0;20;5;1;4;1;-1;-2;0;0;0;1;0;2;0;0;0
gfx90a [0x989f];3;5;6;6;30000;0;9;5;1;5;1;0;-1;0;0;0;1;0;2;0;0;0
gfx90a [0x989f];3;5;7;5;30000;0;9;5;1;1;1;1;-1;0;0;0;1;0;2;0;0;0
gfx90a [0x989f];3;5;7;7;30000;0;20;5;1;3;1;0;-2;0;0;0;1;0;2;0;0;0
gfx90a [0x989f];3;5;8;5;30000;0;12;5;1;5;1;-1;0;0;0;0;1;0;2;0;0;0
gfx90a [0x989f];3;5;8;8;30000;0;20;5;1;5;1;1;0;0;0;0;1;0;2;0;0;0
gfx90a [0x989f];3;5;9;5;30000;0;20;5;1;2;1;1;-2;0;0;0;1;0;0;0;0;0
gfx90a [0x989f];3;5;9;9;30000;0;25;5;1;2;1;1;-2;0;0;0;1;0;0;2;0;0
gfx90a [0x989f];3;5;10;5;30000;0;20;5;1;4;1;-1;-1;0;0;0;1;0;0;2;0;0
gfx90a [0x989f];3;5;10;10;30000;0;25;5;1;2;1;-1;0;0;0;0;1;0;0;2;0;0
gfx90a [0x989f];3;5;11;5;30000;0;20;5;1;5;1;1;0;0;0;0;1;0;2;2;0;0
gfx90a [0x989f];3;5;11;11;30000;0;25;5;1;3;1;-1;-2;0;0;0;1;0;2;0;0;0
gfx90a [0x989f];3;5;12;5;30000;0;20;5;1;4;1;-1;0;0;0;0;1;0;0;0;0;0
gfx90a [0x989f];3;5;12;12;30000;0;25;5;1;5;1;0;-2;0;0;0;1;0;0;0;0;0
gfx90a [0x989f];3;5;16;5;30000;0;20;5;1;4;1;-1;-2;0;0;0;1;0;2;2;0;0
gfx90a [0x989f];3;5;16;16;30000;0;26;5;1;4;1;0;-2;0;0;0;1;0;2;0;0;0
gfx90a [0x989f];3;5;23;5;30000;0;24;5;1;2;1;-2;-2;0;0;0;1;0;0;2;0;0
gfx90a [0x989f];3;5;23;23;30000;0;24;5;1;1;1;-2;-1;0;0;1;1;1;0;1;0;0
gfx90a [0x989f];3;6;3;3;30000;0;16;6;1;4;1;-2;-2;0;0;0;1;0;2;2;0;0
gfx90a [0x989f];3;6;3;6;30000;0;15;6;1;6;1;-1;0;0;0;0;1;0;2;0;0;0
gfx90a [0x989f];3;6;4;4;30000;0;18;6;1;4;1;-1;-1;0;1;0;1;0;0;0;0;0
gfx90a [0x989f];3;6;4;6;30000;0;15;6;1;3;1;0;0;0;0;0;1;0;2;2;0;0
gfx90a [0x989f];3;6;5;5;30000;0;12;6;1;2;1;1;-2;0;0;0;1;0;2;2;0;0
gfx90a [0x989f];3;6;5;6;30000;0;15;6;1;5;1;-1;0;0;0;0;1;0;2;0;0;0
gfx90a [0x989f];3;6;6;3;30000;0;15;6;1;3;1;-1;-2;0;0;0;1;0;0;2;0;0
gfx90a [0x989f];3;6;6;4;30000;0;15;6;1;2;1;-1;-2;0;0;0;1;0;0;2;0;0
gfx90a [0x989f];3;6;6;5;30000;0;9;6;1;6;1;1;-1;0;0;0;1;0;2;2;0;0
gfx90a [0x989f];3;6;6;6;30000;0;12;6;1;6;1;-2;-1;0;1;1;1;1;2;0;0;0
gfx90a [0x989f];3;6;6;7;30000;0;12;6;1;4;1;-1;-1;0;0;0;1;0;2;0;0;0
gfx90a [0x989f];3;6;6;8;30000;0;20;6;1;4;1;-2;-2;0;1;0;1;0;2;0;0;0
gfx90a [0x989f];3;6;6;9;30000;0;20;6;1;6;1;0;-2;0;0;0;1;0;2;0;0;0
gfx90a [0x989f];3;6;6;10;30000;0;15;6;1;1;1;-2;-2;0;0;0;1;0;2;0;0;0
gfx90a [0x989f];3;6;6;11;30000;0;24;6;1;5;1;-1;0;1;0;1;1;1;2;2;0;0
gfx90a [0x989f];3;6;6;12;30000;0;20;6;1;6;1;-1;-2;0;0;0;1;0;0;0;0;0
gfx90a [0x989f];3;6;6;16;30000;0;25;6;1;4;1;0;-2;0;0;0;1;0;2;2;0;0
gfx90a [0x989f];3;6;6;23;30000;0;15;6;1;1;1;0;-2;0;0;1;1;0;2;2;0;0
gfx90a [0x989f];3;6;7;6;30000;0;15;6;1;3;1;1;0;0;0;0;1;0;2;2;0;0
gfx90a [0x989f];3;6;7;7;30000;0;15;6;1;4;1;1;-2;0;0;0;1;0;2;0;0;0
gfx90a [0x989f];3;6;8;6;30000;0;15;6;1;5;1;-1;-2;0;0;0;1;0;2;0;0;0
gfx90a [0x989f];3;6;8;8;30000;0;20;6;1;5;1;-2;0;0;0;0;1;0;2;0;0;0
gfx90a [0x989f];3;6;9;6;30000;0;15;6;1;4;1;-2;0;0;0;0;1;0;2;2;0;0
gfx90a [0x989f];3;6;9;9;30000;0;9;6;1;1;1;-1;-1;0;0;0;1;0;2;0;0;0
gfx90a [0x989f];3;6;10;6;30000;0;15;6;1;4;1;-2;-2;0;0;0;1;0;2;0;0;0
gfx90a [0x989f];3;6;10;10;30000;0;25;6;1;1;1;0;-1;0;1;1;1;1;0;0;0;0
gfx90a [0x989f];3;6;11;6;30000;0;15;6;1;2;1;-1;0;0;0;0;1;0;2;2;0;0
gfx90a [0x989f];3;6;11;11;30000;0;25;6;1;1;1;-2;-2;0;1;1;1;1;2;0;0;0
gfx90a [0x989f];3;6;12;6;30000;0;15;6;1;6;1;-2;-2;0;0;0;1;0;2;2;0;0
gfx90a [0x989f];3;6;12;12;30000;0;24;6;1;2;1;-2;-1;0;0;0;1;0;2;0;0;0
gfx90a [0x989f];3;6;16;6;30000;0;20;6;1;6;1;1;-1;1;1;0;1;1;0;0;0;0
gfx90a [0x989f];3;6;16;16;30000;0;26;6;1;1;1;0;0;1;1;0;1;1;2;2;1;0
gfx90a [0x989f];3;6;23;6;30000;0;24;6;1;6;1;1;0;1;0;1;1;1;0;0;0;0
gfx90a [0x989f];3;6;23;23;30000;0;24;6;1;5;1;0;-2;0;0;0;1;0;2;1;0;0
gfx90a [0x989f];3;7;3;3;30000;0;15;7;1;2;1;-1;-2;0;0;0;1;0;0;2;0;0
gfx90a [0x989f];3;7;3;7;30000;0;12;7;1;4;1;-2;-2;0;0;0;1;0;2;2;0;0
gfx90a [0x989f];3;7;4;4;30000;0;15;7;1;3;1;0;-2;0;1;1;1;0;0;2;0;0
gfx90a [0x989f];3;7;4;7;30000;0;12;7;1;2;1;0;0;0;0;0;1;0;0;0;0;0
gfx90a [0x989f];3;7;5;5;30000;0;12;7;1;3;1;-1;1;0;0;0;1;0;2;0;0;0
gfx90a [0x989f];3;7;5;7;30000;0;12;7;1;3;1;1;0;0;0;0;1;0;2;0;0;0
gfx90a [0x989f];3;7;6;6;30000;0;12;7;1;3;1;-1;1;0;0;0;1;0;0;0;0;0
gfx90a [0x989f];3;7;6;7;30000;0;12;7;1;2;1;0;-2;0;0;0;1;0;0;0;0;0
gfx90a [0x989f];3;7;7;3;30000;0;15;7;1;4;1;0;-1;0;1;0;1;0;0;2;0;0
gfx90a [0x989f];3;7;7;4;30000;0;18;7;1;3;1;1;1;0;0;0;1;1;2;2;0;0
gfx90a [0x989f];3;7;7;5;30000;0;12;7;1;6;1;1;-2;0;1;1;1;0;2;0;0;0
gfx90a [0x989f];3;7;7;6;30000;0;15;7;1;6;1;-1;0;0;0;0;1;0;0;2;0;0
gfx90a [0x989f];3;7;7;7;30000;0;12;7;1;2;1;1;0;0;1;0;1;1;0;0;0;0
gfx90a [0x989f];3;7;7;8;30000;0;13;7;1;6;1;-1;-2;1;1;1;1;1;0;0;0;0
gfx90a [0x989f];3;7;7;9;30000;0;15;7;1;1;1;-2;-2;0;0;0;1;0;2;2;0;0
gfx90a [0x989f];3;7;7;10;30000;0;15;7;1;7;1;-1;-2;0;0;0;1;0;2;2;0;0
gfx90a [0x989f];3;7;7;11;30000;0;15;7;1;1;1;-1;-2;0;0;1;1;1;2;2;0;0
gfx90a [0x989f];3;7;7;12;30000;0;12;7;1;1;1;1;-2;1;1;1;1;1;2;2;1;0
gfx90a [0x989f];3;7;7;16;30000;0;15;7;1;1;1;-1;-2;1;1;0;1;1;2;1;0;0
gfx90a [0x989f];3;7;7;23;30000;0;12;7;1;1;7;-2;0;0;0;1;1;1;2;1;0;0
gfx90a [0x989f];3;7;8;7;30000;0;15;7;1;3;1;-2;1;0;0;0;1;0;0;2;0;0
gfx90a [0x989f];3;7;8;8;30000;0;20;7;1;7;1;-1;-1;0;1;0;1;1;0;2;1;0
gfx90a [0x989f];3;7;9;7;30000;0;20;7;1;6;1;-2;0;0;1;1;1;1;2;0;1;0
gfx90a [0x989f];3;7;9;9;30000;0;15;7;1;1;1;1;-2;0;0;0;1;0;2;2;0;0
gfx90a [0x989f];3;7;10;7;30000;0;20;7;1;4;1;1;0;0;1;0;1;1;2;0;0;0
gfx90a [0x989f];3;7;10;10;30000;0;15;7;1;1;1;-2;0;1;0;0;1;0;2;2;1;0
gfx90a [0x989f];3;7;11;7;30000;0;20;7;1;6;1;-2;0;0;1;0;1;1;2;2;0;0
gfx90a [0x989f];3;7;11;11;30000;0;15;7;1;1;1;1;-2;0;0;0;1;0;0;0;0;0
gfx90a [0x989f];3;7;12;7;30000;0;24;7;1;2;1;1;-1;1;0;0;1;1;0;0;0;0
gfx90a [0x989f];3;7;12;12;30000;0;13;7;1;7;1;0;-2;0;0;0;1;0;0;0;0;0
gfx90a [0x989f];3;7;16;7;30000;0;24;7;1;7;1;0;-2;1;1;0;1;1;2;2;1;0
gfx90a [0x989f];3;7;16;16;30000;0;24;7;1;7;1;0;-2;0;0;0;1;0;2;2;0;0
gfx90a [0x989f];3;7;23;7;30000;0;25;7;1;3;1;-2;1;1;1;1;1;1;0;0;0;0
gfx90a [0x989f];3;7;23;23;30000;0;24;7;1;1;1;1;-2;1;0;1;1;1;2;0;1;0
gfx90a [0x989f];3;8;3;3;30000;0;15;8;1;4;1;1;-2;0;0;0;1;0;2;0;0;0
gfx90a [0x989f];3;8;3;8;30000;0;15;8;1;1;1;-2;-2;0;0;0;1;0;0;0;0;0
gfx90a [0x989f];3;8;4;4;30000;0;9;8;1;1;1;-2;-1;0;0;0;1;0;2;0;0;0
gfx90a [0x989f];3;8;4;8;30000;0;7;8;1;1;1;1;-2;0;0;0;1;0;0;2;0;0
gfx90a [0x989f];3;8;5;5;30000;0;12;8;1;2;1;-1;4;0;0;0;1;0;2;0;0;0
gfx90a [0x989f];3;8;5;8;30000;0;15;8;1;1;1;1;-2;0;0;0;1;0;0;0;0;0
gfx90a [0x989f];3;8;6;6;30000;0;12;8;1;8;1;-2;-2;0;0;0;1;0;2;0;0;0
gfx90a [0x989f];3;8;6;8;30000;0;15;8;1;1;1;-2;-1;0;0;0;1;0;0;2;0;0
gfx90a [0x989f];3;8;7;7;30000;0;13;8;1;5;1;1;-2;0;0;0;1;0;0;2;0;0
gfx90a [0x989f];3;8;7;8;30000;0;20;8;1;4;1;-2;0;0;0;0;1;1;0;2;1;0
gfx90a [0x989f];3;8;8;3;30000;0;15;8;1;1;1;1;-1;0;0;0;1;0;2;0;0;0
gfx90a [0x989f];3;8;8;4;30000;0;15;8;1;7;1;0;-1;0;0;0;1;0;0;2;0;0
gfx90a [0x989f];3;8;8;5;30000;0;15;8;1;8;1;0;-1;0;0;0;1;0;2;2;0;0
gfx90a [0x989f];3;8;8;6;30000;0;15;8;1;4;1;0;0;0;0;0;1;0;2;0;0;0
gfx90a [0x989f];3;8;8;7;30000;0;15;8;1;4;1;1;-1;1;1;1;1;1;0;0;1;0
gfx90a [0x989f];3;8;8;8;30000;0;10;8;1;3;1;-1;0;0;1;1;1;1;0;2;1;0
gfx90a [0x989f];3;8;8;16;30000;0;12;8;1;1;1;-1;-2;0;0;0;1;0;2;2;0;0
gfx90a [0x989f];3;8;8;23;30000;0;12;8;1;1;1;1;-2;1;1;0;1;1;2;1;0;0
gfx90a [0x989f];3;8;16;8;30000;0;24;8;1;2;1;-1;1;1;1;1;1;1;0;2;1;0
gfx90a [0x989f];3;8;16;16;30000;0;20;8;1;1;1;1;-2;1;1;0;1;1;0;2;1;0
gfx90a [0x989f];3;8;23;8;30000;0;26;8;1;8;1;1;-1;1;1;1;1;1;2;2;1;0
gfx90a [0x989f];3;8;23;23;30000;0;24;8;1;8;1;0;-2;0;0;0;1;0;0;1;0;0
gfx90a [0x989f];3;9;3;3;30000;0;9;9;1;9;1;-1;-2;0;0;0;1;0;0;0;0;0
gfx90a [0x989f];3;9;3;9;30000;0;10;9;1;1;1;-2;0;0;1;1;1;1;2;2;0;0
gfx90a [0x989f];3;9;4;4;30000;0;12;9;1;1;1;1;0;0;0;1;1;0;2;2;0;0
gfx90a [0x989f];3;9;4;9;30000;0;15;9;1;6;1;1;-2;0;0;0;1;0;0;2;0;0
gfx90a [0x989f];3;9;5;5;30000;0;13;9;1;9;1;-2;-2;0;0;0;1;0;2;2;0;0
gfx90a [0x989f];3;9;5;9;30000;0;10;9;1;1;1;-2;0;1;1;0;1;1;2;0;0;0
gfx90a [0x989f];3;9;6;6;30000;0;15;9;1;4;1;-1;1;0;1;1;1;1;0;0;1;0
gfx90a [0x989f];3;9;6;9;30000;0;10;9;1;1;1;0;-2;1;1;1;1;1;0;2;0;0
gfx90a [0x989f];3;9;7;7;30000;0;13;9;1;1;1;1;-2;0;1;0;1;1;2;0;0;0
gfx90a [0x989f];3;9;7;9;30000;0;13;9;1;1;1;-2;0;1;1;1;1;1;2;0;1;0
gfx90a [0x989f];3;9;9;3;30000;0;15;9;1;4;1;1;-1;0;1;0;1;1;0;0;0;0
gfx90a [0x989f];3;9;9;4;30000;0;15;9;1;4;1;-1;-1;0;1;0;1;1;2;2;0;0
gfx90a [0x989f];3;9;9;5;30000;0;15;9;1;2;1;0;1;0;1;0;1;1;2;0;0;0
gfx90a [0x989f];3;9;9;6;30000;0;24;9;1;2;1;1;-2;0;0;1;1;1;0;0;1;0
gfx90a [0x989f];3;9;9;7;30000;0;9;9;1;9;1;-1;0;1;1;1;1;1;0;0;1;0
gfx90a [0x989f];3;9;9;9;30000;0;10;9;1;3;1;0;-1;0;1;1;1;1;0;2;1;0
gfx90a [0x989f];3;9;9;16;30000;0;12;9;1;1;1;1;-2;0;0;1;1;1;2;2;0;0
gfx90a [0x989f];3;9;9;23;30000;0;15;9;1;1;1;-1;-1;0;1;1;1;1;2;2;0;0
gfx90a [0x989f];3;9;16;9;30000;0;24;9;1;8;1;0;-2;0;0;0;1;0;2;2;0;0
gfx90a [0x989f];3;9;16;16;30000;0;12;9;1;1;1;1;-2;0;0;0;1;0;2;2;0;0
gfx90a [0x989f];3;9;23;9;30000;0;26;9;1;8;1;0;-2;0;0;0;1;0;0;2;0;0
gfx90a [0x989f];3;9;23;23;30000;0;3;8;1;8;1;1;3;0;1;0;1;0;1;2;1;0
gfx90a [0x989f];3;10;3;3;30000;0;10;10;1;8;1;0;-2;0;1;0;1;1;2;0;0;0
gfx90a [0x989f];3;10;3;10;30000;0;12;10;1;1;1;-1;-2;0;0;1;1;1;2;0;0;0
gfx90a [0x989f];3;10;4;4;30000;0;13;10;1;3;1;-2;-1;1;1;0;1;1;0;2;0;0
gfx90a [0x989f];3;10;4;10;30000;0;12;10;1;1;1;0;0;0;1;1;1;1;2;2;0;0
gfx90a [0x989f];3;10;5;5;30000;0;15;10;1;3;1;-1;-2;0;1;1;1;1;0;0;1;0
gfx90a [0x989f];3;10;5;10;30000;0;10;10;1;1;1;-2;0;1;0;1;1;1;2;2;0;0
gfx90a [0x989f];3;10;6;6;30000;0;9;10;1;1;1;-1;-1;1;1;1;1;1;2;0;1;0
gfx90a [0x989f];3;10;6;10;30000;0;12;10;1;1;1;0;0;1;1;0;1;1;0;0;0;0
gfx90a [0x989f];3;10;7;7;30000;0;20;10;1;8;1;1;0;0;1;1;1;1;2;2;0;0
gfx90a [0x989f];3;10;7;10;30000;0;9;10;1;1;1;1;-2;0;1;0;1;1;2;0;0;0
gfx90a [0x989f];3;10;10;3;30000;0;15;10;1;10;0;1;-1;1;1;1;1;1;0;0;0;0
gfx90a [0x989f];3;10;10;4;30000;0;20;10;1;5;1;0;1;0;0;0;1;0;2;0;0;0
gfx90a [0x989f];3;10;10;5;30000;0;15;10;1;3;0;0;0;0;0;0;1;1;2;2;1;0
gfx90a [0x989f];3;10;10;6;30000;0;25;10;1;7;1;0;-2;0;0;0;1;0;0;0;0;0
gfx90a [0x989f];3;10;10;7;30000;0;15;10;1;1;1;0;0;0;0;0;1;0;2;2;0;0
gfx90a [0x989f];3;10;10;10;30000;0;10;10;1;9;1;0;-2;0;1;1;1;1;0;1;0;0
gfx90a [0x989f];3;10;10;16;30000;0;12;10;1;1;1;-2;0;0;1;1;1;0;2;0;0;0
gfx90a [0x989f];3;10;10;23;30000;0;15;10;1;1;1;1;0;0;1;1;1;1;2;2;0;0
gfx90a [0x989f];3;10;16;10;30000;0;13;10;1;1;1;-2;0;1;1;0;1;1;2;0;0;0
gfx90a [0x989f];3;10;16;16;30000;0;15;10;1;1;1;-1;0;0;0;1;1;1;2;2;1;0
gfx90a [0x989f];3;10;23;10;30000;0;24;10;1;4;1;-1;-1;0;1;1;1;1;0;0;1;0
gfx90a [0x989f];3;10;23;23;30000;0;3;10;1;4;1;-2;2;0;0;0;1;0;1;0;0;0
gfx90a [0x989f];3;11;3;3;30000;0;9;11;1;6;1;0;-2;0;0;0;1;0;0;0;0;0
gfx90a [0x989f];3;11;3;11;30000;0;10;11;1;1;1;-1;-2;0;1;1;1;1;0;2;1;0
gfx90a [0x989f];3;11;4;4;30000;0;13;11;1;3;1;0;-1;0;1;0;1;1;0;2;0;0
gfx90a [0x989f];3;11;4;11;30000;0;12;11;1;1;1;-2;0;0;1;1;1;1;2;2;0;0
gfx90a [0x989f];3;11;5;5;30000;0;10;11;1;1;1;0;-2;0;1;1;1;1;0;0;0;0
gfx90a [0x989f];3;11;5;11;30000;0;10;11;1;1;1;0;0;0;0;0;1;1;0;2;0;0
gfx90a [0x989f];3;11;6;6;30000;0;12;11;1;6;1;1;0;0;1;1;1;1;2;1;0;0
gfx90a [0x989f];3;11;6;11;30000;0;12;11;1;1;1;-1;0;0;1;1;1;1;2;2;0;0
gfx90a [0x989f];3;11;7;7;30000;0;13;11;1;1;1;-1;0;0;1;1;1;1;2;0;0;0
gfx90a [0x989f];3;11;7;11;30000;0;5;8;1;7;1;-1;2;0;0;0;1;0;1;0;0;0
gfx90a [0x989f];3;11;11;3;30000;0;22;11;1;2;1;-1;1;0;1;0;1;1;2;0;1;0
gfx90a [0x989f];3;11;11;4;30000;0;20;11;1;2;1;-1;-2;0;1;1;1;1;0;0;0;0
gfx90a [0x989f];3;11;11;5;30000;0;20;11;1;5;1;-2;1;0;1;1;1;1;2;0;1;0
gfx90a [0x989f];3;11;11;6;30000;0;24;11;1;1;1;-2;0;0;0;0;1;1;2;2;0;0
gfx90a [0x989f];3;11;11;7;30000;0;9;8;1;7;1;0;1;0;1;0;1;0;1;2;0;0
gfx90a [0x989f];3;11;11;11;30000;0;12;11;1;10;1;-2;-2;0;1;0;1;1;2;0;0;0
gfx90a [0x989f];3;11;11;16;30000;0;3;8;1;11;1;1;-1;1;0;0;1;0;1;2;0;0
gfx90a [0x989f];3;11;11;23;30000;0;15;11;1;1;1;1;-1;0;1;1;1;1;2;2;0;0
gfx90a [0x989f];3;11;16;11;30000;0;15;11;1;1;1;0;-2;0;1;0;1;1;2;2;0;0
gfx90a [0x989f];3;11;16;16;30000;0;3;8;1;1;1;-1;-1;1;1;0;1;0;1;2;0;0
gfx90a [0x989f];3;11;23;11;30000;0;40;11;1;1;1;-1;-2;1;0;0;1;1;2;0;1;0
gfx90a [0x989f];3;11;23;23;30000;0;3;8;1;7;1;-1;2;0;1;0;1;0;1;2;1;0
gfx90a [0x989f];3;12;3;3;30000;0;15;12;1;2;1;-1;-2;0;1;0;1;0;0;0;0;0
gfx90a [0x989f];3;12;3;12;30000;0;10;12;1;1;1;1;-2;0;0;1;1;1;0;2;1;0
gfx90a [0x989f];3;12;4;4;30000;0;11;12;1;12;1;0;0;0;1;0;1;1;0;0;0;0
gfx90a [0x989f];3;12;4;12;30000;0;12;12;1;1;12;1;0;0;0;1;1;1;0;2;1;0
gfx90a [0x989f];3;12;5;5;30000;0;10;12;1;7;1;0;0;0;1;1;1;1;2;0;0;0
gfx90a [0x989f];3;12;5;12;30000;0;12;12;1;1;1;0;-2;0;1;1;1;1;2;0;0;0
gfx90a [0x989f];3;12;6;6;30000;0;13;12;1;1;1;1;-2;0;1;0;1;1;0;0;1;0
gfx90a [0x989f];3;12;6;12;30000;0;12;12;1;1;1;-1;-2;1;1;1;1;1;2;0;1;0
gfx90a [0x989f];3;12;7;7;30000;0;15;12;1;1;1;0;0;1;1;1;1;1;2;0;1;0
gfx90a [0x989f];3;12;7;12;30000;0;12;12;1;1;1;-1;0;0;1;1;1;1;0;2;1;0
gfx90a [0x989f];3;12;12;3;30000;0;20;12;1;12;0;-2;-2;0;1;0;1;0;2;2;0;0
gfx90a [0x989f];3;12;12;4;30000;0;20;12;1;9;0;0;-2;0;0;0;1;0;2;0;0;0
gfx90a [0x989f];3;12;12;5;30000;0;9;12;1;2;1;-1;2;0;0;0;1;0;1;2;0;0
gfx90a [0x989f];3;12;12;6;30000;0;15;12;1;12;1;-2;-2;0;0;0;1;0;0;0;0;0
gfx90a [0x989f];3;12;12;7;30000;0;15;12;1;1;1;-2;-2;0;0;0;1;0;2;0;0;0
gfx90a [0x989f];3;12;12;12;30000;0;12;12;1;8;1;0;0;0;1;0;1;1;0;1;0;0
gfx90a [0x989f];3;12;12;16;30000;0;12;12;1;1;1;-1;-2;0;0;0;1;0;2;1;0;0
gfx90a [0x989f];3;12;12;23;30000;0;4;8;1;2;1;1;2;0;0;0;1;0;1;2;0;0
gfx90a [0x989f];3;12;16;12;30000;0;4;8;1;5;1;0;1;0;0;0;1;0;1;0;0;0
gfx90a [0x989f];3;12;16;16;30000;0;15;12;1;1;1;1;0;0;0;1;1;1;2;2;0;0
gfx90a [0x989f];3;12;23;12;30000;0;20;12;1;1;1;0;-2;0;0;1;1;1;2;2;1;0
gfx90a [0x989f];3;12;23;23;30000;0;3;8;1;8;1;-2;-2;0;0;0;1;0;1;2;0;0
gfx90a [0x989f];3;13;13;13;30000;0;12;13;1;11;1;0;-1;0;1;0;1;1;0;2;1;0
gfx90a [0x989f];3;13;13;23;30000;0;12;13;1;1;1;-2;-2;0;1;0;1;1;2;0;1;0
gfx90a [0x989f];3;13;13;32;30000;0;3;13;1;9;13;0;2;0;0;0;1;0;1;2;0;0
gfx90a [0x989f];3;13;23;13;30000;0;30;8;1;10;1;1;2;0;0;0;1;0;1;0;0;0
gfx90a [0x989f];3;13;23;23;30000;0;3;8;1;6;1;-1;2;0;0;0;1;0;1;2;0;0
gfx90a [0x989f];3;14;14;14;30000;0;10;14;1;10;1;0;0;0;1;1;1;1;0;2;0;0
gfx90a [0x989f];3;14;14;23;30000;0;15;14;1;1;1;-2;0;0;1;1;1;1;2;0;1;0
gfx90a [0x989f];3;14;14;29;30000;0;4;8;1;5;14;0;1;0;0;0;1;0;1;0;0;0
gfx90a [0x989f];3;14;14;32;30000;0;3;8;1;9;1;1;2;0;0;0;1;0;1;2;0;0
gfx90a [0x989f];3;14;23;14;30000;0;26;8;1;2;1;-2;1;0;0;0;1;0;1;0;0;0
gfx90a [0x989f];3;14;23;23;30000;0;40;8;1;3;1;1;2;0;0;0;1;0;1;0;0;0
gfx90a [0x989f];3;14;29;14;30000;0;40;8;1;14;1;-1;1;0;0;0;1;0;1;2;0;0
gfx90a [0x989f];3;14;29;29;30000;0;3;8;1;7;1;1;1;0;0;0;1;0;1;2;0;0
gfx90a [0x989f];3;14;29;32;30000;0;3;8;1;4;1;1;1;0;1;1;1;0;1;2;1;0
gfx90a [0x989f];3;14;32;14;30000;0;50;8;1;14;1;1;3;0;0;0;1;0;1;2;0;0
gfx90a [0x989f];3;14;32;29;30000;0;3;8;1;2;1;1;4;0;0;0;1;0;1;2;0;0
gfx90a [0x989f];3;14;32;32;30000;0;40;8;1;4;1;1;4;0;1;0;1;1;1;0;1;0
gfx90a [0x989f];3;15;15;15;30000;0;5;8;1;3;1;0;0;0;1;1;1;0;1;0;1;0
gfx90a [0x989f];3;15;15;23;30000;0;4;8;1;15;1;0;0;1;1;1;1;0;1;0;1;0
gfx90a [0x989f];3;15;23;15;30000;0;4;8;1;11;1;0;-2;1;1;1;1;0;1;2;1;0
gfx90a [0x989f];3;15;23;23;30000;0;4;8;1;6;1;-1;3;1;1;0;1;0;1;2;1;0
gfx90a [0x989f];3;16;3;3;30000;0;15;16;1;10;0;-1;-2;0;1;0;1;1;0;0;0;0
gfx90a [0x989f];3;16;3;16;30000;0;15;16;1;1;1;-2;0;0;1;0;1;1;2;0;1;0
gfx90a [0x989f];3;16;4;4;30000;0;12;16;1;6;1;0;-1;0;1;0;1;1;0;0;1;0
gfx90a [0x989f];3;16;4;16;30000;0;4;8;1;7;1;0;-1;1;0;0;1;0;1;0;0;0
gfx90a [0x989f];3;16;5;5;30000;0;21;8;1;7;1;-2;-2;0;0;1;1;0;1;2;0;0
gfx90a [0x989f];3;16;5;16;30000;0;8;8;1;6;1;-1;2;0;1;0;1;0;1;0;0;0
gfx90a [0x989f];3;16;6;6;30000;0;9;16;1;1;1;1;-2;1;0;1;1;1;2;0;1;0
gfx90a [0x989f];3;16;6;16;30000;0;12;16;1;1;1;1;0;0;1;1;1;1;2;0;1;0
gfx90a [0x989f];3;16;7;7;30000;0;10;16;1;1;0;-2;0;0;1;1;1;1;2;2;1;0
gfx90a [0x989f];3;16;7;16;30000;0;24;16;1;13;1;0;0;0;1;0;1;1;2;2;0;0
gfx90a [0x989f];3;16;8;8;30000;0;24;16;1;3;0;-2;-1;0;0;0;1;1;2;2;1;0
gfx90a [0x989f];3;16;8;16;30000;0;7;8;1;4;1;0;0;1;0;1;1;0;1;2;0;0
gfx90a [0x989f];3;16;9;9;30000;0;6;8;1;3;1;-2;1;1;1;0;1;1;1;0;0;0
gfx90a [0x989f];3;16;9;16;30000;0;4;8;1;5;1;-2;2;1;1;1;1;0;1;2;0;0
gfx90a [0x989f];3;16;10;10;30000;0;30;16;1;9;0;-1;2;0;1;0;1;0;1;0;0;0
gfx90a [0x989f];3;16;10;16;30000;0;5;8;1;5;1;-2;0;0;0;0;1;0;1;2;0;0
gfx90a [0x989f];3;16;11;11;30000;0;25;8;1;4;1;0;-1;0;0;0;1;0;1;2;0;0
gfx90a [0x989f];3;16;11;16;30000;0;30;8;1;14;1;-1;1;0;0;0;1;0;1;0;0;0
gfx90a [0x989f];3;16;12;12;30000;0;5;8;1;1;1;1;2;0;0;0;1;0;1;2;0;0
gfx90a [0x989f];3;16;12;16;30000;0;5;16;1;14;1;0;2;0;0;0;1;0;1;0;0;0
gfx90a [0x989f];3;16;16;3;30000;0;24;16;1;11;1;-1;-2;0;0;0;1;0;0;2;0;0
gfx90a [0x989f];3;16;16;4;30000;0;24;16;1;1;1;0;2;0;0;0;1;0;1;2;0;0
gfx90a [0x989f];3;16;16;5;30000;0;20;16;1;1;1;0;-2;1;0;0;1;1;2;2;1;0
gfx90a [0x989f];3;16;16;6;30000;0;25;8;1;15;1;-1;2;1;0;0;1;1;1;0;0;0
gfx90a [0x989f];3;16;16;7;30000;0;25;16;1;9;1;-2;2;0;0;0;1;0;1;2;0;0
gfx90a [0x989f];3;16;16;8;30000;0;25;16;1;10;1;0;2;0;0;0;1;0;1;2;0;0
gfx90a [0x989f];3;16;16;9;30000;0;25;8;1;6;1;-2;2;1;1;1;1;0;1;2;0;0
gfx90a [0x989f];3;16;16;10;30000;0;25;8;1;4;1;0;3;1;1;0;1;0;1;2;0;0
gfx90a [0x989f];3;16;16;11;30000;0;25;8;1;8;1;1;2;1;1;0;1;0;1;2;0;0
gfx90a [0x989f];3;16;16;12;30000;0;25;8;1;7;1;-2;-2;1;0;1;1;0;1;2;0;0
gfx90a [0x989f];3;16;16;16;30000;0;12;16;1;2;1;1;-1;0;1;1;1;1;2;0;1;0
gfx90a [0x989f];3;16;16;23;30000;0;4;8;1;4;1;0;-1;0;0;0;1;0;1;2;0;0
gfx90a [0x989f];3;16;23;16;30000;0;40;8;1;4;1;-2;-1;1;1;1;1;0;1;2;0;0
gfx90a [0x989f];3;16;23;23;30000;0;50;8;1;15;1;-1;-1;0;0;0;1;0;1;2;0;0
gfx90a [0x989f];3;17;17;17;30000;0;12;17;1;12;1;-2;-2;0;1;0;1;0;0;2;0;0
gfx90a [0x989f];3;17;17;23;30000;0;3;8;1;11;1;-1;1;0;0;0;1;0;1;2;0;0
gfx90a [0x989f];3;17;17;32;30000;0;3;8;1;17;17;-1;-2;0;0;0;1;0;1;2;0;0
gfx90a [0x989f];3;17;17;35;30000;0;3;8;1;17;17;-1;0;0;0;0;1;0;1;2;0;0
gfx90a [0x989f];3;17;23;17;30000;0;15;17;1;1;1;-2;-2;0;0;0;1;0;2;2;0;0
gfx90a [0x989f];3;17;23;23;30000;0;24;17;1;1;1;-1;0;1;0;0;1;1;2;1;0;0
gfx90a [0x989f];3;17;32;17;30000;0;20;17;1;1;1;0;-2;1;0;0;1;1;2;0;0;0
gfx90a [0x989f];3;17;32;35;30000;0;3;8;1;11;1;1;1;0;1;0;1;0;1;0;1;0
gfx90a [0x989f];3;17;35;17;30000;0;25;17;1;5;1;-2;-1;1;1;0;1;0;1;2;0;0
gfx90a [0x989f];3;17;35;32;30000;0;3;17;1;16;1;0;0;1;1;0;1;0;1;2;0;0
gfx90a [0x989f];3;17;35;35;30000;0;20;17;1;1;1;1;0;1;1;1;1;0;0;0;0;0
gfx90a [0x989f];3;18;18;18;30000;0;4;8;1;6;1;-2;-2;0;0;0;1;0;1;0;0;0
gfx90a [0x989f];3;18;18;23;30000;0;3;8;1;14;1;0;-2;0;0;0;1;0;1;2;0;0
gfx90a [0x989f];3;18;23;18;30000;0;4;18;1;4;1;1;3;0;0;0;1;0;1;0;0;0
gfx90a [0x989f];3;18;23;23;30000;0;4;8;1;16;1;0;3;0;0;0;1;0;1;2;0;0
gfx90a [0x989f];3;19;19;19;30000;0;40;8;1;10;1;1;3;0;0;0;1;0;1;2;0;0
gfx90a [0x989f];3;19;19;23;30000;0;40;8;1;15;1;-1;-2;0;0;0;1;0;1;0;0;0
gfx90a [0x989f];3;23;23;23;30000;0;4;8;1;22;23;-1;3;0;0;0;1;0;1;0;0;0
gfx90a [0x989f];3;28;28;28;30000;0;3;28;1;28;28;-2;2;0;0;0;1;0;1;0;0;0
gfx90a [0x989f];3;32;32;32;30000;0;25;32;1;20;1;-2;0;0;1;0;1;0;2;0;0;0
gfx90a [0x989f];3;35;17;17;30000;0;15;35;1;29;1;1;0;0;1;0;1;0;2;1;0;0
gfx90a [0x989f];3;35;17;32;30000;0;20;35;1;1;1;0;-2;1;1;0;1;1;2;0;0;0
gfx90a [0x989f];3;35;17;35;30000;0;7;35;1;31;1;-2;4;1;0;0;1;1;1;2;1;0
gfx90a [0x989f];3;35;32;17;30000;0;39;35;1;35;1;1;4;0;1;1;1;1;1;0;0;0
gfx90a [0x989f];3;35;32;35;30000;0;3;35;1;31;1;-2;0;1;1;0;1;1;1;2;0;0
gfx90a [0x989f];3;35;35;17;30000;0;33;35;1;20;1;1;4;1;1;1;1;0;1;0;0;0
gfx90a [0x989f];3;35;35;32;30000;0;15;35;1;35;35;-2;0;0;1;0;1;1;2;2;0;0
gfx90a [0x989f];3;35;35;35;30000;0;2;35;1;30;0;1;-1;0;1;0;1;0;1;2;0;0
