src/acc/opencl/smm/params/tune_multiply_V100.csv
DEVICE;TYPEID;M;N;K;S;GFLOPS;BS;BM;BN;BK;WS;WG;LU;NZ;AL;TB;TC;AP;AA;AB;AC
Tesla V100-PCIE-16GB [0xb271];3;2;2;2;30000;35.1;12;1;1;2;0;-1;1;0;0;1;1;0;0;0;0;0
Tesla V100-PCIE-16GB [0xb271];3;3;3;3;30000;93.7;12;3;1;3;0;-2;-1;0;0;0;1;0;0;0;0;0
Tesla V100-PCIE-16GB [0xb271];3;4;4;4;30000;192.8;12;4;1;4;0;-2;0;0;0;0;1;0;1;0;0;0
Tesla V100-PCIE-16GB [0xb271];3;4;4;5;30000;209.3;12;4;1;3;0;-2;0;0;0;1;1;0;1;2;0;0
Tesla V100-PCIE-16GB [0xb271];3;4;4;7;30000;240.6;15;4;1;4;0;-1;-1;0;0;1;1;0;1;2;0;0
Tesla V100-PCIE-16GB [0xb271];3;4;4;9;30000;254.8;8;4;1;2;0;-1;-1;0;0;0;1;0;1;2;0;0
Tesla V100-PCIE-16GB [0xb271];3;4;4;10;30000;264.8;13;4;1;4;0;-2;0;0;0;0;1;0;1;2;0;0
Tesla V100-PCIE-16GB [0xb271];3;4;4;13;30000;282.9;15;4;1;3;0;0;-1;0;0;1;1;0;1;0;0;0
Tesla V100-PCIE-16GB [0xb271];3;4;4;15;30000;283.7;12;4;1;2;0;-2;-1;0;0;1;0;0;1;2;0;0
Tesla V100-PCIE-16GB [0xb271];3;4;4;25;30000;310.8;25;4;1;4;0;0;-1;0;0;0;1;0;1;2;0;0
Tesla V100-PCIE-16GB [0xb271];3;4;4;26;30000;308.3;4;4;1;2;0;-2;1;0;0;0;1;1;1;0;0;0
Tesla V100-PCIE-16GB [0xb271];3;4;4;28;30000;316.8;25;4;1;4;0;0;0;0;0;0;1;0;1;2;0;0
Tesla V100-PCIE-16GB [0xb271];3;4;4;32;30000;318.9;3;4;1;2;0;0;-2;0;0;0;1;1;1;0;0;0
Tesla V100-PCIE-16GB [0xb271];3;4;5;4;30000;216.7;8;4;1;3;0;-1;0;0;0;0;1;0;0;0;0;0
Tesla V100-PCIE-16GB [0xb271];3;4;5;5;30000;226.0;12;4;1;4;0;-1;0;0;0;0;1;1;1;2;0;0
Tesla V100-PCIE-16GB [0xb271];3;4;5;7;30000;274.4;12;4;1;4;0;1;0;0;0;0;1;1;1;2;0;0
Tesla V100-PCIE-16GB [0xb271];3;4;5;9;30000;302.3;12;4;1;4;0;-2;0;1;0;0;1;0;1;2;0;0
Tesla V100-PCIE-16GB [0xb271];3;4;5;13;30000;337.3;15;4;1;2;0;0;0;0;0;0;1;1;1;2;0;0
Tesla V100-PCIE-16GB [0xb271];3;4;5;25;30000;386.3;15;4;1;2;0;1;-1;0;0;0;1;1;1;0;0;0
Tesla V100-PCIE-16GB [0xb271];3;4;7;4;30000;290.9;15;4;1;4;0;-1;-1;1;0;1;1;0;0;2;0;0
Tesla V100-PCIE-16GB [0xb271];3;4;7;5;30000;311.1;12;4;1;3;0;-2;-1;0;0;1;1;1;1;0;0;0
Tesla V100-PCIE-16GB [0xb271];3;4;7;7;30000;381.1;12;4;1;4;0;-2;-1;0;0;0;1;1;1;2;0;0
Tesla V100-PCIE-16GB [0xb271];3;4;7;9;30000;423.7;12;4;1;3;0;-1;-1;0;0;0;1;1;1;2;0;0
Tesla V100-PCIE-16GB [0xb271];3;4;7;13;30000;460.8;15;4;1;2;0;-2;0;0;0;1;1;1;1;0;0;0
Tesla V100-PCIE-16GB [0xb271];3;4;9;4;30000;353.8;15;4;1;1;0;-2;-1;1;0;0;1;0;2;2;0;0
Tesla V100-PCIE-16GB [0xb271];3;4;9;5;30000;387.9;12;4;1;4;0;-1;0;1;0;0;1;1;1;2;0;0
Tesla V100-PCIE-16GB [0xb271];3;4;9;7;30000;481.5;12;4;1;2;0;1;-2;0;0;0;1;1;1;2;0;0
Tesla V100-PCIE-16GB [0xb271];3;4;9;9;30000;531.4;12;4;1;4;0;-1;-1;0;0;0;1;1;1;2;0;0
Tesla V100-PCIE-16GB [0xb271];3;4;9;13;30000;587.2;15;4;1;2;0;0;1;0;0;0;1;1;1;2;0;0
Tesla V100-PCIE-16GB [0xb271];3;4;10;4;30000;394.9;15;4;1;2;0;0;-1;1;0;1;1;0;0;2;0;0
Tesla V100-PCIE-16GB [0xb271];3;4;10;10;30000;593.4;13;4;1;2;0;1;1;0;0;1;1;1;1;0;0;0
Tesla V100-PCIE-16GB [0xb271];3;4;13;4;30000;460.4;20;4;1;2;0;1;1;1;0;1;1;0;0;2;0;0
Tesla V100-PCIE-16GB [0xb271];3;4;13;5;30000;491.0;12;4;1;4;0;-2;-1;0;0;0;1;1;1;2;0;0
Tesla V100-PCIE-16GB [0xb271];3;4;13;7;30000;606.8;13;4;1;2;0;1;-1;0;0;0;1;1;1;2;0;0
Tesla V100-PCIE-16GB [0xb271];3;4;13;9;30000;659.9;15;4;1;2;0;-2;-1;1;0;0;1;1;1;0;0;0
Tesla V100-PCIE-16GB [0xb271];3;4;15;4;30000;484.4;24;4;1;4;0;-2;-1;0;0;1;1;1;0;0;0;0
Tesla V100-PCIE-16GB [0xb271];3;4;25;4;30000;672.2;24;4;1;1;0;-2;0;1;0;1;1;0;2;2;0;0
Tesla V100-PCIE-16GB [0xb271];3;4;25;5;30000;741.7;24;4;1;4;0;-1;-2;1;0;1;1;1;0;2;0;0
Tesla V100-PCIE-16GB [0xb271];3;4;26;4;30000;692.1;20;4;1;2;0;-1;-1;1;0;1;1;0;0;2;0;0
Tesla V100-PCIE-16GB [0xb271];3;4;28;4;30000;720.9;25;4;1;1;0;0;0;1;0;1;1;0;2;2;0;0
Tesla V100-PCIE-16GB [0xb271];3;4;32;4;30000;760.2;24;4;1;4;0;0;-2;1;0;1;1;0;0;2;0;0
Tesla V100-PCIE-16GB [0xb271];3;5;4;4;30000;242.9;12;5;1;2;0;0;0;0;0;0;1;0;0;2;0;0
Tesla V100-PCIE-16GB [0xb271];3;5;4;5;30000;247.6;20;5;1;5;0;1;-1;0;0;0;1;0;2;2;0;0
Tesla V100-PCIE-16GB [0xb271];3;5;4;7;30000;282.4;12;5;1;5;0;0;1;0;0;0;1;1;2;2;0;0
Tesla V100-PCIE-16GB [0xb271];3;5;4;9;30000;303.9;12;5;1;4;0;-2;-1;0;0;1;1;0;0;2;0;0
Tesla V100-PCIE-16GB [0xb271];3;5;4;13;30000;245.5;7;5;1;2;0;-2;1;1;0;0;1;1;1;0;0;0
Tesla V100-PCIE-16GB [0xb271];3;5;4;25;30000;375.3;20;5;1;3;0;1;-1;1;0;0;1;1;1;2;0;0
Tesla V100-PCIE-16GB [0xb271];3;5;5;4;30000;257.8;14;5;1;2;0;-1;0;0;0;0;1;1;1;2;0;0
Tesla V100-PCIE-16GB [0xb271];3;5;5;5;30000;300.3;15;5;1;2;0;-1;-2;0;0;1;1;0;1;2;0;0
Tesla V100-PCIE-16GB [0xb271];3;5;5;7;30000;338.9;20;5;1;3;0;-1;-2;0;0;0;1;0;1;2;0;0
Tesla V100-PCIE-16GB [0xb271];3;5;5;9;30000;364.9;20;5;1;2;0;-1;1;0;0;1;1;0;1;0;0;0
Tesla V100-PCIE-16GB [0xb271];3;5;5;13;30000;393.2;20;5;1;5;0;-1;-1;0;0;0;1;0;1;2;0;0
Tesla V100-PCIE-16GB [0xb271];3;5;7;4;30000;314.7;12;5;1;2;0;-1;0;0;0;0;1;1;1;2;0;0
Tesla V100-PCIE-16GB [0xb271];3;5;7;5;30000;360.8;12;5;1;4;0;1;-2;1;0;1;1;1;1;2;0;0
Tesla V100-PCIE-16GB [0xb271];3;5;7;7;30000;435.2;12;5;1;2;0;-2;0;1;0;1;1;1;1;0;0;0
Tesla V100-PCIE-16GB [0xb271];3;5;7;9;30000;479.6;13;5;1;3;0;1;-2;0;0;0;1;1;1;2;0;0
Tesla V100-PCIE-16GB [0xb271];3;5;7;13;30000;523.5;12;5;1;5;0;-1;0;1;0;0;1;0;1;0;0;0
Tesla V100-PCIE-16GB [0xb271];3;5;9;4;30000;386.9;12;5;1;3;0;-1;-1;1;0;0;1;1;1;2;0;0
Tesla V100-PCIE-16GB [0xb271];3;5;9;5;30000;454.4;12;5;1;4;0;0;-2;1;0;0;1;1;1;2;0;0
Tesla V100-PCIE-16GB [0xb271];3;5;9;7;30000;551.2;12;5;1;5;0;-2;0;0;0;1;1;1;1;2;0;0
Tesla V100-PCIE-16GB [0xb271];3;5;9;9;30000;596.0;13;5;1;3;0;1;-2;0;0;0;1;1;1;2;0;0
Tesla V100-PCIE-16GB [0xb271];3;5;13;4;30000;498.9;13;5;1;3;0;-1;0;1;0;0;1;1;1;2;0;0
Tesla V100-PCIE-16GB [0xb271];3;5;13;5;30000;569.6;12;5;1;5;0;1;0;1;0;0;1;1;1;0;0;0
Tesla V100-PCIE-16GB [0xb271];3;5;13;7;30000;699.9;13;5;1;4;0;-2;-2;1;0;1;1;1;1;2;0;0
Tesla V100-PCIE-16GB [0xb271];3;5;13;13;30000;844.8;20;5;1;4;0;0;0;0;0;0;1;1;1;0;0;0
Tesla V100-PCIE-16GB [0xb271];3;5;25;4;30000;593.2;11;5;1;5;0;0;0;0;0;0;1;1;0;2;0;0
Tesla V100-PCIE-16GB [0xb271];3;7;5;5;30000;399.0;16;2;1;5;0;-1;-2;0;0;0;1;0;0;2;0;0
Tesla V100-PCIE-16GB [0xb271];3;7;5;7;30000;438.8;20;2;1;3;0;0;-1;0;0;1;1;1;0;2;0;0
Tesla V100-PCIE-16GB [0xb271];3;7;7;5;30000;506.3;15;1;2;6;0;-1;-2;1;0;1;1;0;2;0;0;0
Tesla V100-PCIE-16GB [0xb271];3;7;7;7;30000;531.5;20;2;1;4;0;1;-2;1;0;1;1;0;0;2;0;0
Tesla V100-PCIE-16GB [0xb271];3;7;7;13;30000;635.9;24;7;1;5;0;-1;0;0;0;0;1;1;1;2;0;0
Tesla V100-PCIE-16GB [0xb271];3;7;13;13;30000;1037.5;20;7;1;5;0;0;-2;1;0;0;1;1;1;2;0;0
Tesla V100-PCIE-16GB [0xb271];3;9;9;13;30000;905.3;25;9;1;7;0;0;0;0;0;0;1;1;1;2;0;0
Tesla V100-PCIE-16GB [0xb271];3;9;13;9;30000;1027.6;20;9;1;2;0;0;0;0;0;0;1;1;1;0;0;0
Tesla V100-PCIE-16GB [0xb271];3;9;13;13;30000;1136.0;20;9;1;8;0;1;-1;0;0;0;1;1;1;2;0;0
Tesla V100-PCIE-16GB [0xb271];3;9;16;16;30000;1367.4;24;9;1;2;0;1;-1;1;0;0;1;1;1;2;0;0
Tesla V100-PCIE-16GB [0xb271];3;9;22;16;30000;1569.6;24;9;1;6;0;-1;0;0;0;0;1;1;1;2;0;0
Tesla V100-PCIE-16GB [0xb271];3;9;22;22;30000;1665.8;25;9;1;5;0;-2;-2;1;0;0;1;1;1;0;0;0
Tesla V100-PCIE-16GB [0xb271];3;9;32;9;30000;1604.0;30;9;1;2;0;0;-1;1;0;0;1;1;1;2;0;0
Tesla V100-PCIE-16GB [0xb271];3;9;32;22;30000;1944.9;50;9;1;4;0;0;1;1;0;0;1;1;1;2;0;0
Tesla V100-PCIE-16GB [0xb271];3;9;32;32;30000;2154.3;50;9;1;3;0;0;0;0;0;0;1;1;1;2;0;0
Tesla V100-PCIE-16GB [0xb271];3;13;5;5;30000;515.2;25;3;1;7;0;0;1;1;0;0;1;1;2;2;0;0
Tesla V100-PCIE-16GB [0xb271];3;13;5;7;30000;547.3;13;3;1;8;0;0;1;0;0;1;1;1;1;2;0;0
Tesla V100-PCIE-16GB [0xb271];3;13;5;13;30000;596.1;24;2;1;2;0;0;-2;1;0;0;1;1;1;2;0;0
Tesla V100-PCIE-16GB [0xb271];3;13;7;5;30000;636.4;18;2;2;4;0;0;1;1;0;1;1;1;2;2;1;0
Tesla V100-PCIE-16GB [0xb271];3;13;7;13;30000;811.2;12;13;1;12;0;0;0;0;0;0;1;1;1;2;0;0
Tesla V100-PCIE-16GB [0xb271];3;13;9;9;30000;857.9;20;13;1;3;0;0;0;0;0;0;1;0;1;2;0;0
Tesla V100-PCIE-16GB [0xb271];3;13;9;13;30000;885.8;25;13;1;2;0;1;0;0;0;0;1;1;1;0;0;0
Tesla V100-PCIE-16GB [0xb271];3;13;13;5;30000;1009.6;24;13;1;8;0;1;0;1;0;0;1;1;1;2;0;0
Tesla V100-PCIE-16GB [0xb271];3;13;13;7;30000;1189.4;25;13;1;10;0;1;-1;1;0;0;1;1;1;2;0;0
Tesla V100-PCIE-16GB [0xb271];3;13;13;9;30000;1294.8;24;13;1;10;0;-1;-2;1;0;0;1;1;1;0;0;0
Tesla V100-PCIE-16GB [0xb271];3;13;13;13;30000;1351.9;25;13;1;10;0;-1;0;0;0;0;1;1;1;2;0;0
Tesla V100-PCIE-16GB [0xb271];3;16;9;16;30000;1054.4;12;16;1;4;0;-1;-2;1;0;1;1;1;0;0;0;0
Tesla V100-PCIE-16GB [0xb271];3;16;9;22;30000;1094.0;25;16;1;5;0;0;-2;0;0;0;1;1;1;2;0;0
Tesla V100-PCIE-16GB [0xb271];3;16;16;9;30000;1631.8;25;16;1;2;0;-1;-1;1;0;0;1;0;1;2;0;0
Tesla V100-PCIE-16GB [0xb271];3;16;16;16;30000;1809.8;25;16;1;16;0;0;0;0;0;1;1;1;1;2;0;0
Tesla V100-PCIE-16GB [0xb271];3;16;16;22;30000;1847.2;50;16;1;12;0;1;-2;1;0;1;1;1;1;2;0;0
Tesla V100-PCIE-16GB [0xb271];3;16;22;9;30000;1783.9;25;16;1;6;0;-2;-1;1;0;1;1;0;1;0;0;0
Tesla V100-PCIE-16GB [0xb271];3;16;22;16;30000;1999.5;40;16;1;16;0;-1;-2;0;0;1;1;1;1;2;0;0
Tesla V100-PCIE-16GB [0xb271];3;16;22;22;30000;1934.5;25;16;1;14;0;0;0;0;0;0;1;0;1;2;1;0
Tesla V100-PCIE-16GB [0xb271];3;20;20;20;30000;1986.9;40;20;1;13;0;1;-2;1;0;1;1;0;1;2;0;0
Tesla V100-PCIE-16GB [0xb271];3;22;9;9;30000;809.5;20;22;1;17;0;-1;0;0;0;0;1;1;1;2;1;0
Tesla V100-PCIE-16GB [0xb271];3;22;9;16;30000;1256.9;26;22;1;1;0;-2;-1;1;0;0;1;0;1;2;0;0
Tesla V100-PCIE-16GB [0xb271];3;22;9;22;30000;1271.4;30;22;1;1;0;-2;1;0;0;0;1;1;1;2;0;0
Tesla V100-PCIE-16GB [0xb271];3;22;9;32;30000;1371.7;24;22;1;1;0;0;-2;1;0;1;1;0;1;2;0;0
Tesla V100-PCIE-16GB [0xb271];3;22;16;9;30000;1629.0;25;22;1;7;0;1;0;0;0;0;1;1;1;0;1;0
Tesla V100-PCIE-16GB [0xb271];3;22;16;16;30000;2019.3;30;22;1;1;0;-2;0;0;0;0;1;1;1;2;0;0
Tesla V100-PCIE-16GB [0xb271];3;22;16;22;30000;2279.6;50;22;1;9;0;0;0;1;0;1;1;1;1;1;0;0
Tesla V100-PCIE-16GB [0xb271];3;22;22;9;30000;2034.8;50;22;1;6;0;1;1;1;0;0;1;1;1;2;0;0
Tesla V100-PCIE-16GB [0xb271];3;22;22;16;30000;1982.0;40;22;1;15;0;-2;0;1;0;0;1;1;1;0;1;0
Tesla V100-PCIE-16GB [0xb271];3;22;22;22;30000;2292.6;24;22;1;19;0;0;-2;1;0;0;1;1;1;0;0;0
Tesla V100-PCIE-16GB [0xb271];3;22;22;32;30000;1891.9;14;22;1;14;0;-1;-1;0;0;1;1;0;1;2;1;0
Tesla V100-PCIE-16GB [0xb271];3;22;32;9;30000;2402.7;40;22;1;13;0;1;0;1;0;0;1;1;1;0;0;0
Tesla V100-PCIE-16GB [0xb271];3;22;32;22;30000;2739.0;50;22;1;15;0;-1;0;1;0;1;1;1;1;1;0;0
Tesla V100-PCIE-16GB [0xb271];3;22;32;32;30000;3198.7;50;22;1;15;0;1;0;0;0;1;1;1;1;0;0;0
Tesla V100-PCIE-16GB [0xb271];3;23;23;23;30000;2459.7;50;23;1;14;0;0;0;1;0;1;1;1;1;2;0;0
Tesla V100-PCIE-16GB [0xb271];3;24;24;24;30000;2071.2;38;24;1;21;0;0;0;0;0;1;1;1;1;2;0;0
Tesla V100-PCIE-16GB [0xb271];3;24;24;26;30000;2642.7;50;24;1;20;0;-1;0;1;0;0;1;1;1;2;0;0
Tesla V100-PCIE-16GB [0xb271];3;24;24;32;30000;2244.6;50;24;1;17;0;-1;1;0;0;0;1;1;1;0;1;0
Tesla V100-PCIE-16GB [0xb271];3;24;26;24;30000;2711.3;50;24;1;20;0;1;-2;0;0;1;1;1;1;2;0;0
Tesla V100-PCIE-16GB [0xb271];3;24;26;26;30000;2121.7;48;24;1;2;0;1;-1;0;0;0;1;1;1;2;1;0
Tesla V100-PCIE-16GB [0xb271];3;24;26;32;30000;2144.4;4;24;1;19;0;0;0;0;0;1;1;1;1;2;0;0
Tesla V100-PCIE-16GB [0xb271];3;24;32;24;30000;2902.7;50;24;1;11;0;1;-1;1;0;0;1;0;1;2;1;0
Tesla V100-PCIE-16GB [0xb271];3;24;32;26;30000;2408.9;25;24;1;16;0;0;-1;1;0;1;1;1;1;2;1;0
Tesla V100-PCIE-16GB [0xb271];3;24;32;32;30000;3031.2;40;24;1;13;0;-1;-2;1;0;0;1;1;1;0;0;0
Tesla V100-PCIE-16GB [0xb271];3;25;4;4;30000;291.1;24;25;1;3;0;1;0;0;0;1;1;1;1;0;0;0
Tesla V100-PCIE-16GB [0xb271];3;25;4;5;30000;316.7;24;25;1;19;0;0;-2;0;0;0;1;1;1;2;0;0
Tesla V100-PCIE-16GB [0xb271];3;25;5;4;30000;328.2;14;25;1;7;0;0;1;1;0;0;1;0;1;0;1;0
Tesla V100-PCIE-16GB [0xb271];3;25;25;25;30000;2349.7;24;25;1;1;0;-1;-2;1;0;0;1;0;1;2;0;0
Tesla V100-PCIE-16GB [0xb271];3;26;4;4;30000;306.9;1;26;1;26;0;-1;-1;1;0;1;1;1;2;0;0;0
Tesla V100-PCIE-16GB [0xb271];3;26;24;24;30000;1976.0;21;26;1;26;0;-1;-1;0;0;1;1;1;1;2;1;0
Tesla V100-PCIE-16GB [0xb271];3;26;24;26;30000;2405.2;50;26;1;26;0;1;0;0;0;1;1;0;1;2;0;0
Tesla V100-PCIE-16GB [0xb271];3;26;24;32;30000;2449.8;50;26;1;23;0;1;-2;0;0;1;1;1;1;2;0;0
Tesla V100-PCIE-16GB [0xb271];3;26;26;24;30000;2180.2;48;26;1;3;0;-2;0;0;0;0;1;1;1;0;1;0
Tesla V100-PCIE-16GB [0xb271];3;26;26;26;30000;2978.2;50;26;1;19;0;0;-2;1;0;0;1;1;1;0;0;0
Tesla V100-PCIE-16GB [0xb271];3;26;26;32;30000;2410.9;50;26;1;5;0;0;-2;0;0;1;1;0;1;0;1;0
Tesla V100-PCIE-16GB [0xb271];3;26;32;24;30000;3304.4;50;26;1;15;0;1;-2;0;0;0;1;0;1;2;0;0
Tesla V100-PCIE-16GB [0xb271];3;26;32;26;30000;2762.0;60;26;1;18;0;-1;-2;1;0;1;1;0;1;1;0;0
Tesla V100-PCIE-16GB [0xb271];3;26;32;32;30000;2593.6;32;26;1;26;0;-1;0;0;0;1;1;1;1;2;0;0
Tesla V100-PCIE-16GB [0xb271];3;28;4;4;30000;271.5;14;28;1;18;0;-1;-2;0;0;1;1;1;1;2;1;0
Tesla V100-PCIE-16GB [0xb271];3;28;28;28;30000;2548.1;50;28;1;1;0;0;-2;1;0;0;1;1;1;2;0;0
Tesla V100-PCIE-16GB [0xb271];3;30;30;30;30000;2542.6;32;30;1;30;0;-1;0;0;0;0;1;0;1;0;0;0
Tesla V100-PCIE-16GB [0xb271];3;32;24;24;30000;2442.3;40;32;1;24;0;1;0;0;0;1;1;1;1;2;0;0
Tesla V100-PCIE-16GB [0xb271];3;32;24;26;30000;2213.6;16;32;1;17;0;1;-2;0;0;1;1;1;1;2;0;0
Tesla V100-PCIE-16GB [0xb271];3;32;24;32;30000;1755.0;1;32;1;12;0;0;0;0;0;0;1;0;1;1;0;0
Tesla V100-PCIE-16GB [0xb271];3;32;26;24;30000;2360.4;32;32;1;32;0;1;0;0;0;1;1;0;1;2;0;0
Tesla V100-PCIE-16GB [0xb271];3;32;26;26;30000;2579.2;40;32;1;31;0;-1;0;1;0;1;1;1;1;2;0;0
Tesla V100-PCIE-16GB [0xb271];3;32;26;32;30000;2487.2;40;32;1;29;0;0;0;1;0;0;1;0;1;2;0;0
Tesla V100-PCIE-16GB [0xb271];3;32;32;9;30000;2755.0;50;32;1;22;0;1;-2;0;0;0;1;0;1;0;0;0
Tesla V100-PCIE-16GB [0xb271];3;32;32;22;30000;2680.6;32;32;1;31;0;-1;0;1;0;1;1;1;1;0;0;0
Tesla V100-PCIE-16GB [0xb271];3;32;32;24;30000;2742.6;54;32;1;22;0;0;-2;1;0;1;1;1;1;1;0;0
Tesla V100-PCIE-16GB [0xb271];3;32;32;26;30000;3464.2;50;32;1;27;0;-1;0;0;0;1;1;0;1;2;0;0
Tesla V100-PCIE-16GB [0xb271];3;32;32;32;30000;3267.1;50;32;1;31;0;1;-2;1;0;0;1;1;1;2;0;0
Tesla V100-PCIE-16GB [0xb271];3;35;35;35;30000;2236.7;9;35;1;25;0;0;-2;0;0;1;1;1;1;0;0;0
Tesla V100-PCIE-16GB [0xb271];3;36;36;36;30000;2138.9;71;36;1;1;0;1;-2;1;0;0;1;0;1;0;0;0
Tesla V100-PCIE-16GB [0xb271];3;40;40;40;30000;2291.0;9;40;1;1;0;0;0;1;0;0;1;1;1;1;0;0
Tesla V100-PCIE-16GB [0xb271];3;45;45;45;30000;2754.3;50;45;1;29;0;0;0;1;0;0;1;1;1;2;0;0
