src/acc/opencl/smm/params/tune_multiply_H100.csv
DEVICE;TYPEID;M;N;K;S;GFLOPS;BS;BM;BN;BK;WS;WG;LU;NZ;AL;TB;TC;AP;AA;AB;AC
NVIDIA H100 PCIe [0xa32d];3;2;2;2;30000;0;9;2;1;2;0;1;0;0;0;0;1;0;3;3;0
NVIDIA H100 PCIe [0xa32d];3;3;3;3;30000;0;13;3;1;1;0;-1;-1;1;0;0;1;0;0;3;0
NVIDIA H100 PCIe [0xa32d];3;4;4;4;30000;0;5;4;1;4;0;0;0;0;0;0;1;0;1;3;0
NVIDIA H100 PCIe [0xa32d];3;4;4;5;30000;0;11;4;1;3;0;-1;-1;0;0;0;1;0;1;3;0
NVIDIA H100 PCIe [0xa32d];3;4;4;7;30000;0;6;4;1;2;0;-1;-1;0;0;1;1;0;1;3;0
NVIDIA H100 PCIe [0xa32d];3;4;4;9;30000;0;6;4;1;3;0;1;-2;0;0;1;1;1;2;3;0
NVIDIA H100 PCIe [0xa32d];3;4;4;10;30000;0;11;4;1;4;0;1;-2;0;0;0;1;1;3;0;2
NVIDIA H100 PCIe [0xa32d];3;4;4;13;30000;0;6;4;1;4;0;0;0;1;0;0;1;1;1;3;0
NVIDIA H100 PCIe [0xa32d];3;4;4;15;30000;0;11;4;1;4;0;-2;0;0;0;0;0;0;0;0;0
NVIDIA H100 PCIe [0xa32d];3;4;4;17;30000;0;6;4;1;4;0;0;0;1;0;0;1;1;1;3;0
NVIDIA H100 PCIe [0xa32d];3;4;4;25;30000;0;11;4;1;2;0;1;2;0;0;0;1;0;1;3;0
NVIDIA H100 PCIe [0xa32d];3;4;4;26;30000;0;6;4;1;2;0;-1;-1;0;0;0;1;1;2;3;0
NVIDIA H100 PCIe [0xa32d];3;4;4;28;30000;0;22;4;1;4;0;0;0;1;0;0;1;1;1;3;0
NVIDIA H100 PCIe [0xa32d];3;4;4;32;30000;0;3;4;1;4;0;1;-1;0;0;0;1;0;2;3;0
NVIDIA H100 PCIe [0xa32d];3;4;5;4;30000;0;15;4;1;4;0;0;-1;0;0;1;1;0;0;3;0
NVIDIA H100 PCIe [0xa32d];3;4;5;5;30000;0;12;4;1;1;0;0;-1;0;0;0;1;0;0;3;0
NVIDIA H100 PCIe [0xa32d];3;4;5;7;30000;0;11;4;1;1;0;1;-1;0;0;1;1;0;0;3;0
NVIDIA H100 PCIe [0xa32d];3;4;5;9;30000;0;12;4;1;2;0;1;2;1;0;0;1;0;3;3;0
NVIDIA H100 PCIe [0xa32d];3;4;5;13;30000;0;6;4;1;4;0;0;-1;1;0;0;1;0;1;3;0
NVIDIA H100 PCIe [0xa32d];3;4;5;17;30000;0;6;4;1;3;0;1;0;0;0;0;1;1;2;3;0
NVIDIA H100 PCIe [0xa32d];3;4;5;25;30000;0;6;4;1;4;0;-2;-2;0;0;0;0;0;1;3;0
NVIDIA H100 PCIe [0xa32d];3;4;5;32;30000;0;3;4;1;3;0;-1;-1;1;0;0;1;0;2;0;0
NVIDIA H100 PCIe [0xa32d];3;4;7;4;30000;0;10;4;1;2;0;0;-1;1;0;1;1;0;3;3;0
NVIDIA H100 PCIe [0xa32d];3;4;7;5;30000;0;14;4;1;1;0;0;0;1;0;1;1;0;0;0;2
NVIDIA H100 PCIe [0xa32d];3;4;7;7;30000;0;6;4;1;4;0;0;0;0;0;1;1;1;2;3;0
NVIDIA H100 PCIe [0xa32d];3;4;7;9;30000;0;13;4;1;2;0;1;1;0;0;1;1;1;2;3;0
NVIDIA H100 PCIe [0xa32d];3;4;7;13;30000;0;11;4;1;4;0;-1;-1;0;0;0;1;0;3;3;0
NVIDIA H100 PCIe [0xa32d];3;4;9;4;30000;0;12;4;1;1;0;1;-1;0;0;0;1;1;3;3;0
NVIDIA H100 PCIe [0xa32d];3;4;9;5;30000;0;18;4;1;1;0;-2;0;1;0;0;1;1;3;3;0
NVIDIA H100 PCIe [0xa32d];3;4;9;7;30000;0;11;4;1;3;0;1;-1;0;0;0;1;0;1;0;0
NVIDIA H100 PCIe [0xa32d];3;4;9;9;30000;0;12;4;1;3;0;1;-1;0;0;0;1;0;0;3;0
NVIDIA H100 PCIe [0xa32d];3;4;9;13;30000;0;6;4;1;2;0;-2;0;0;0;0;1;1;2;3;0
NVIDIA H100 PCIe [0xa32d];3;4;10;4;30000;0;25;4;1;1;0;0;-2;0;0;0;1;0;0;3;0
NVIDIA H100 PCIe [0xa32d];3;4;10;10;30000;0;10;4;1;3;0;1;-2;1;0;1;1;0;0;0;0
NVIDIA H100 PCIe [0xa32d];3;4;13;4;30000;0;18;4;1;3;0;0;-2;1;0;1;1;0;0;0;0
NVIDIA H100 PCIe [0xa32d];3;4;13;5;30000;0;17;4;1;4;0;1;-2;1;0;0;1;1;0;3;0
NVIDIA H100 PCIe [0xa32d];3;4;13;7;30000;0;14;4;1;1;0;2;-1;1;0;0;1;1;3;0;0
NVIDIA H100 PCIe [0xa32d];3;4;13;9;30000;0;17;4;1;3;0;-2;-1;0;0;0;1;1;1;3;0
NVIDIA H100 PCIe [0xa32d];3;4;13;13;30000;0;5;4;1;4;0;-2;-2;0;0;0;1;1;1;3;0
NVIDIA H100 PCIe [0xa32d];3;4;13;17;30000;0;6;4;1;3;0;1;0;0;0;0;1;0;1;0;0
NVIDIA H100 PCIe [0xa32d];3;4;13;32;30000;0;3;4;1;3;0;0;-2;0;0;0;1;0;2;0;0
NVIDIA H100 PCIe [0xa32d];3;4;15;4;30000;0;16;4;1;4;0;-2;-2;0;0;0;1;0;3;3;0
NVIDIA H100 PCIe [0xa32d];3;4;17;4;30000;0;19;4;1;2;0;0;1;0;0;0;1;0;3;3;0
NVIDIA H100 PCIe [0xa32d];3;4;17;5;30000;0;9;4;1;4;0;-2;-2;0;0;0;1;1;3;3;0
NVIDIA H100 PCIe [0xa32d];3;4;17;13;30000;0;6;4;1;4;0;0;-1;0;0;0;1;0;1;0;0
NVIDIA H100 PCIe [0xa32d];3;4;17;17;30000;0;10;4;1;3;0;0;-1;0;0;1;1;0;0;0;0
NVIDIA H100 PCIe [0xa32d];3;4;17;32;30000;0;15;4;1;3;0;-2;0;0;0;0;1;1;2;3;2
NVIDIA H100 PCIe [0xa32d];3;4;25;4;30000;0;17;4;1;3;0;1;-1;0;0;1;1;1;0;0;0
NVIDIA H100 PCIe [0xa32d];3;4;25;5;30000;0;17;4;1;2;0;1;-2;0;0;0;1;0;3;3;2
NVIDIA H100 PCIe [0xa32d];3;4;26;4;30000;0;20;4;1;1;0;0;-1;1;0;0;1;1;0;3;0
NVIDIA H100 PCIe [0xa32d];3;4;28;4;30000;0;20;4;1;4;0;-1;0;1;0;1;1;1;0;3;0
NVIDIA H100 PCIe [0xa32d];3;4;32;4;30000;0;19;4;1;1;0;0;-2;1;0;1;1;0;3;3;0
NVIDIA H100 PCIe [0xa32d];3;4;32;5;30000;0;15;4;1;1;0;1;-2;0;0;1;1;0;0;3;0
NVIDIA H100 PCIe [0xa32d];3;4;32;13;30000;0;13;4;1;4;0;1;0;1;0;0;1;1;2;3;0
NVIDIA H100 PCIe [0xa32d];3;4;32;17;30000;0;13;4;1;3;0;0;2;0;0;0;1;1;2;3;2
NVIDIA H100 PCIe [0xa32d];3;4;32;32;30000;0;15;4;1;4;0;0;1;0;0;0;1;0;2;3;2
NVIDIA H100 PCIe [0xa32d];3;5;4;4;30000;0;12;5;1;5;0;-2;-1;1;0;0;1;1;3;3;0
NVIDIA H100 PCIe [0xa32d];3;5;4;5;30000;0;11;5;1;3;0;0;0;0;0;0;1;0;0;3;0
NVIDIA H100 PCIe [0xa32d];3;5;4;7;30000;0;12;5;1;1;0;0;-2;0;0;0;1;1;3;3;0
NVIDIA H100 PCIe [0xa32d];3;5;4;9;30000;0;13;5;1;5;0;-2;-2;0;0;0;1;0;0;0;0
NVIDIA H100 PCIe [0xa32d];3;5;4;13;30000;0;1;5;1;3;0;-2;-2;0;0;0;1;1;3;3;0
NVIDIA H100 PCIe [0xa32d];3;5;4;17;30000;0;1;5;1;3;0;-1;1;0;0;0;1;1;3;3;0
NVIDIA H100 PCIe [0xa32d];3;5;4;25;30000;0;1;5;1;5;0;0;-1;0;0;1;1;0;3;3;0
NVIDIA H100 PCIe [0xa32d];3;5;4;32;30000;0;1;5;1;4;0;-2;1;0;0;1;1;1;3;3;0
NVIDIA H100 PCIe [0xa32d];3;5;5;4;30000;0;14;5;1;3;0;1;-1;1;0;0;1;0;0;3;0
NVIDIA H100 PCIe [0xa32d];3;5;5;5;30000;0;14;5;1;2;0;0;-1;0;0;0;1;1;2;0;0
NVIDIA H100 PCIe [0xa32d];3;5;5;7;30000;0;6;5;1;5;0;0;0;1;0;1;1;1;1;0;0
NVIDIA H100 PCIe [0xa32d];3;5;5;9;30000;0;10;5;1;5;0;-2;0;0;0;0;1;1;2;3;1
NVIDIA H100 PCIe [0xa32d];3;5;5;13;30000;0;6;5;1;4;0;1;-2;0;0;0;1;0;1;3;0
NVIDIA H100 PCIe [0xa32d];3;5;5;17;30000;0;6;5;1;3;0;-2;-2;0;0;0;1;1;2;3;0
NVIDIA H100 PCIe [0xa32d];3;5;5;32;30000;0;6;5;1;5;0;-2;-1;0;0;0;1;1;2;3;0
NVIDIA H100 PCIe [0xa32d];3;5;7;4;30000;0;16;5;1;3;0;1;0;1;0;1;1;0;0;3;0
NVIDIA H100 PCIe [0xa32d];3;5;7;5;30000;0;10;5;1;4;0;-2;-2;0;0;0;1;0;0;0;0
NVIDIA H100 PCIe [0xa32d];3;5;7;7;30000;0;13;5;1;4;0;1;-1;1;0;0;1;1;2;3;0
NVIDIA H100 PCIe [0xa32d];3;5;7;9;30000;0;12;5;1;4;0;-2;0;0;0;0;1;0;3;3;2
NVIDIA H100 PCIe [0xa32d];3;5;7;13;30000;0;6;5;1;5;0;-2;0;0;0;0;1;0;1;3;0
NVIDIA H100 PCIe [0xa32d];3;5;9;4;30000;0;15;5;1;4;0;0;0;1;0;0;1;0;3;3;0
NVIDIA H100 PCIe [0xa32d];3;5;9;5;30000;0;11;5;1;5;0;-1;-2;1;0;0;1;0;3;0;0
NVIDIA H100 PCIe [0xa32d];3;5;9;7;30000;0;15;5;1;1;0;1;-1;0;0;1;1;0;0;3;0
NVIDIA H100 PCIe [0xa32d];3;5;9;9;30000;0;10;5;1;2;0;0;0;0;0;1;1;1;2;3;0
NVIDIA H100 PCIe [0xa32d];3;5;13;4;30000;0;14;5;1;2;0;-1;0;0;0;0;1;0;0;0;0
NVIDIA H100 PCIe [0xa32d];3;5;13;5;30000;0;15;5;1;3;0;0;-1;1;0;1;1;0;3;0;0
NVIDIA H100 PCIe [0xa32d];3;5;13;7;30000;0;11;5;1;3;0;1;0;1;0;0;1;1;0;3;0
NVIDIA H100 PCIe [0xa32d];3;5;13;13;30000;0;6;5;1;2;0;-2;0;0;0;0;1;1;2;0;0
NVIDIA H100 PCIe [0xa32d];3;5;13;17;30000;0;6;5;1;5;0;-2;0;0;0;0;1;0;2;0;0
NVIDIA H100 PCIe [0xa32d];3;5;13;32;30000;0;3;5;1;3;0;-2;0;0;0;0;1;0;2;3;0
NVIDIA H100 PCIe [0xa32d];3;5;17;4;30000;0;17;5;1;4;0;0;-2;1;0;0;1;0;3;3;0
NVIDIA H100 PCIe [0xa32d];3;5;17;5;30000;0;16;5;1;4;0;-2;0;0;0;1;1;0;3;0;0
NVIDIA H100 PCIe [0xa32d];3;5;17;13;30000;0;6;5;1;2;0;0;2;1;0;0;1;1;2;3;0
NVIDIA H100 PCIe [0xa32d];3;5;17;17;30000;0;6;5;1;4;0;-1;0;0;0;0;1;1;2;3;0
NVIDIA H100 PCIe [0xa32d];3;5;17;32;30000;0;6;5;1;4;0;1;-2;0;0;0;1;0;2;0;0
NVIDIA H100 PCIe [0xa32d];3;5;25;4;30000;0;15;5;1;3;0;0;-1;1;0;1;1;0;0;0;0
NVIDIA H100 PCIe [0xa32d];3;5;32;4;30000;0;22;5;1;5;0;-2;-1;1;0;1;1;0;0;3;0
NVIDIA H100 PCIe [0xa32d];3;5;32;5;30000;0;16;5;1;4;0;-1;0;1;0;1;1;1;0;3;0
NVIDIA H100 PCIe [0xa32d];3;5;32;13;30000;0;11;5;1;4;0;1;0;0;0;0;1;0;1;3;0
NVIDIA H100 PCIe [0xa32d];3;5;32;17;30000;0;13;5;1;3;0;1;-1;0;0;0;1;1;2;3;0
NVIDIA H100 PCIe [0xa32d];3;5;32;32;30000;0;15;5;1;5;0;1;-1;0;0;0;1;0;2;3;0
NVIDIA H100 PCIe [0xa32d];3;6;6;6;30000;0;7;6;1;6;0;0;-2;0;0;0;1;0;1;3;0
NVIDIA H100 PCIe [0xa32d];3;6;6;7;30000;0;11;6;1;4;0;1;-2;0;0;0;1;0;1;3;0
NVIDIA H100 PCIe [0xa32d];3;6;6;8;30000;0;18;6;1;2;0;-1;1;0;0;0;1;1;2;3;0
NVIDIA H100 PCIe [0xa32d];3;6;7;6;30000;0;14;6;1;6;0;-2;0;0;0;0;1;0;1;0;0
NVIDIA H100 PCIe [0xa32d];3;6;7;7;30000;0;17;6;1;2;0;1;1;1;0;1;1;1;1;0;0
NVIDIA H100 PCIe [0xa32d];3;6;7;8;30000;0;6;6;1;6;0;-1;-1;0;0;0;1;0;2;3;0
NVIDIA H100 PCIe [0xa32d];3;6;8;6;30000;0;14;6;1;2;0;0;0;0;0;0;1;1;1;0;0
NVIDIA H100 PCIe [0xa32d];3;6;8;7;30000;0;14;6;1;3;0;0;-2;0;0;0;1;1;2;3;0
NVIDIA H100 PCIe [0xa32d];3;6;8;8;30000;0;5;6;1;2;0;0;-2;0;0;0;1;1;1;3;0
NVIDIA H100 PCIe [0xa32d];3;7;4;4;30000;0;12;7;1;5;0;0;0;0;0;0;1;0;0;0;0
NVIDIA H100 PCIe [0xa32d];3;7;4;5;30000;0;11;7;1;5;0;-2;-1;0;0;1;1;1;3;0;0
NVIDIA H100 PCIe [0xa32d];3;7;4;7;30000;0;11;7;1;4;0;-2;-2;0;0;0;1;0;0;0;0
NVIDIA H100 PCIe [0xa32d];3;7;4;9;30000;0;14;7;1;1;0;1;0;0;0;1;1;0;0;0;0
NVIDIA H100 PCIe [0xa32d];3;7;4;13;30000;0;1;7;1;4;0;-1;0;1;0;1;0;0;0;3;0
NVIDIA H100 PCIe [0xa32d];3;7;5;4;30000;0;15;7;1;3;0;1;2;1;0;1;1;0;0;0;0
NVIDIA H100 PCIe [0xa32d];3;7;5;5;30000;0;12;7;1;2;0;1;-2;0;0;0;1;0;3;3;0
NVIDIA H100 PCIe [0xa32d];3;7;5;7;30000;0;14;7;1;2;0;-2;-2;0;0;0;1;0;3;0;0
NVIDIA H100 PCIe [0xa32d];3;7;5;9;30000;0;14;7;1;4;0;1;-1;0;0;1;1;0;0;0;0
NVIDIA H100 PCIe [0xa32d];3;7;5;13;30000;0;12;7;1;1;0;1;-2;0;0;1;1;0;3;0;0
NVIDIA H100 PCIe [0xa32d];3;7;6;6;30000;0;11;7;1;6;0;0;2;0;0;1;1;1;0;0;1
NVIDIA H100 PCIe [0xa32d];3;7;6;7;30000;0;11;7;1;2;0;1;-1;1;0;0;1;1;0;3;0
NVIDIA H100 PCIe [0xa32d];3;7;6;8;30000;0;11;7;1;3;0;0;0;0;0;0;1;0;3;0;0
NVIDIA H100 PCIe [0xa32d];3;7;7;4;30000;0;18;7;1;2;0;1;-1;0;0;0;1;1;2;3;0
NVIDIA H100 PCIe [0xa32d];3;7;7;5;30000;0;11;7;1;7;0;1;0;1;0;1;1;0;2;3;0
NVIDIA H100 PCIe [0xa32d];3;7;7;6;30000;0;17;7;1;2;0;-2;1;1;0;0;1;1;1;3;0
NVIDIA H100 PCIe [0xa32d];3;7;7;7;30000;0;14;7;1;4;0;0;0;0;0;1;1;1;1;0;0
NVIDIA H100 PCIe [0xa32d];3;7;7;8;30000;0;24;7;1;2;0;-1;-1;0;0;0;1;0;2;3;0
NVIDIA H100 PCIe [0xa32d];3;7;7;9;30000;0;6;7;1;2;0;-1;-1;0;0;0;1;0;1;3;0
NVIDIA H100 PCIe [0xa32d];3;7;7;13;30000;0;6;7;1;2;0;-1;2;0;0;1;1;1;2;0;0
NVIDIA H100 PCIe [0xa32d];3;7;8;6;30000;0;10;7;1;2;0;-2;1;0;0;1;1;1;1;0;0
NVIDIA H100 PCIe [0xa32d];3;7;8;7;30000;0;6;7;1;3;0;-1;-2;0;0;0;1;0;1;0;0
NVIDIA H100 PCIe [0xa32d];3;7;8;8;30000;0;7;7;1;2;0;1;-1;0;0;0;1;0;2;3;0
NVIDIA H100 PCIe [0xa32d];3;7;9;4;30000;0;16;7;1;2;0;-1;-1;0;0;0;1;0;3;3;0
NVIDIA H100 PCIe [0xa32d];3;7;9;5;30000;0;12;7;1;2;0;0;0;0;0;0;1;0;1;0;0
NVIDIA H100 PCIe [0xa32d];3;7;9;7;30000;0;9;7;1;6;0;-1;-1;1;0;1;1;1;2;0;0
NVIDIA H100 PCIe [0xa32d];3;7;13;4;30000;0;14;7;1;6;0;-2;0;0;0;0;1;1;1;3;0
NVIDIA H100 PCIe [0xa32d];3;7;13;5;30000;0;11;7;1;2;0;1;1;1;0;1;1;1;2;0;0
NVIDIA H100 PCIe [0xa32d];3;7;13;7;30000;0;14;7;1;3;0;-1;-2;1;0;1;1;1;1;0;0
NVIDIA H100 PCIe [0xa32d];3;7;13;13;30000;0;14;7;1;5;0;-2;-1;1;0;1;1;1;2;0;0
NVIDIA H100 PCIe [0xa32d];3;8;6;6;30000;0;14;8;1;6;0;1;-1;0;0;1;1;0;3;3;0
NVIDIA H100 PCIe [0xa32d];3;8;6;7;30000;0;14;8;1;7;0;-1;-2;0;0;0;1;0;3;0;0
NVIDIA H100 PCIe [0xa32d];3;8;6;8;30000;0;11;8;1;4;0;0;-1;0;0;0;1;1;0;0;0
NVIDIA H100 PCIe [0xa32d];3;8;7;6;30000;0;14;8;1;4;0;1;-1;1;0;0;1;1;1;0;0
NVIDIA H100 PCIe [0xa32d];3;8;7;7;30000;0;14;8;1;1;0;-2;0;0;0;0;1;0;0;3;0
NVIDIA H100 PCIe [0xa32d];3;8;7;8;30000;0;16;8;1;4;0;-1;0;0;0;1;1;0;3;3;0
NVIDIA H100 PCIe [0xa32d];3;8;8;6;30000;0;18;8;1;6;0;0;-1;1;0;1;1;1;1;0;0
NVIDIA H100 PCIe [0xa32d];3;8;8;7;30000;0;17;8;1;3;0;-1;1;0;0;0;1;1;2;3;0
NVIDIA H100 PCIe [0xa32d];3;8;8;8;30000;0;14;8;1;3;0;0;-2;0;0;1;1;1;1;3;0
NVIDIA H100 PCIe [0xa32d];3;9;4;4;30000;0;11;9;1;3;0;-1;1;1;0;0;1;0;3;3;0
NVIDIA H100 PCIe [0xa32d];3;9;4;5;30000;0;11;9;1;4;0;1;1;1;0;0;1;1;0;3;0
NVIDIA H100 PCIe [0xa32d];3;9;4;7;30000;0;11;9;1;3;0;1;-2;1;0;0;1;1;3;0;0
NVIDIA H100 PCIe [0xa32d];3;9;4;9;30000;0;1;9;1;9;0;-2;-2;0;0;0;0;1;3;0;1
NVIDIA H100 PCIe [0xa32d];3;9;4;13;30000;0;1;9;1;6;0;-2;0;0;0;0;0;0;3;0;1
NVIDIA H100 PCIe [0xa32d];3;9;5;4;30000;0;13;9;1;2;0;-2;1;0;0;0;1;1;1;0;0
NVIDIA H100 PCIe [0xa32d];3;9;5;5;30000;0;14;9;1;2;0;0;2;1;0;1;1;0;3;0;0
NVIDIA H100 PCIe [0xa32d];3;9;5;7;30000;0;17;9;1;2;0;-1;-2;0;0;1;1;1;0;0;1
NVIDIA H100 PCIe [0xa32d];3;9;5;9;30000;0;15;9;1;2;0;1;-2;0;0;0;1;1;0;3;0
NVIDIA H100 PCIe [0xa32d];3;9;7;4;30000;0;14;9;1;3;0;0;-2;1;0;1;1;0;3;3;0
NVIDIA H100 PCIe [0xa32d];3;9;7;5;30000;0;12;9;1;5;0;0;-2;0;0;0;1;1;3;3;0
NVIDIA H100 PCIe [0xa32d];3;9;7;7;30000;0;10;9;1;3;0;0;0;0;0;0;1;1;1;0;0
NVIDIA H100 PCIe [0xa32d];3;9;9;4;30000;0;18;9;1;9;0;-1;-1;0;0;0;1;1;2;2;0
NVIDIA H100 PCIe [0xa32d];3;9;9;5;30000;0;21;9;1;4;0;-2;-1;0;0;0;1;1;1;3;0
NVIDIA H100 PCIe [0xa32d];3;9;9;9;30000;0;7;9;1;3;0;-2;0;1;0;0;1;0;1;3;0
NVIDIA H100 PCIe [0xa32d];3;9;9;16;30000;0;6;9;1;2;0;-2;0;1;0;1;1;1;2;0;0
NVIDIA H100 PCIe [0xa32d];3;9;9;22;30000;0;11;9;1;8;0;1;-2;1;0;1;1;0;2;0;0
NVIDIA H100 PCIe [0xa32d];3;9;9;32;30000;0;22;9;1;5;0;-2;-2;0;0;0;1;1;2;3;0
NVIDIA H100 PCIe [0xa32d];3;9;13;4;30000;0;14;9;1;3;0;-1;0;1;0;0;1;1;1;3;0
NVIDIA H100 PCIe [0xa32d];3;9;16;9;30000;0;18;9;1;6;0;0;0;0;0;0;1;1;2;0;2
NVIDIA H100 PCIe [0xa32d];3;9;16;16;30000;0;4;9;1;4;0;-1;1;1;0;0;1;1;2;0;0
NVIDIA H100 PCIe [0xa32d];3;9;16;22;30000;0;10;9;1;8;0;1;1;1;0;1;1;1;1;0;1
NVIDIA H100 PCIe [0xa32d];3;9;22;9;30000;0;20;9;1;4;0;1;0;1;0;0;1;1;1;3;0
NVIDIA H100 PCIe [0xa32d];3;9;22;16;30000;0;13;9;1;4;0;1;0;1;0;1;1;1;2;0;0
NVIDIA H100 PCIe [0xa32d];3;9;22;22;30000;0;13;9;1;5;0;-1;0;1;0;0;1;1;2;0;0
NVIDIA H100 PCIe [0xa32d];3;9;22;32;30000;0;24;9;1;8;0;1;-2;1;0;0;1;0;2;3;0
NVIDIA H100 PCIe [0xa32d];3;10;4;4;30000;0;15;10;1;5;0;-1;0;0;0;0;1;0;3;3;0
NVIDIA H100 PCIe [0xa32d];3;10;4;10;30000;0;1;10;1;3;0;-1;-2;0;0;1;0;0;3;3;0
NVIDIA H100 PCIe [0xa32d];3;10;10;4;30000;0;14;10;1;10;0;1;-1;0;0;1;1;1;2;2;0
NVIDIA H100 PCIe [0xa32d];3;10;10;10;30000;0;18;10;1;4;0;-1;-2;1;0;0;1;1;1;3;0
NVIDIA H100 PCIe [0xa32d];3;13;4;4;30000;0;10;13;1;3;0;1;0;0;0;1;1;0;3;1;0
NVIDIA H100 PCIe [0xa32d];3;13;4;5;30000;0;1;13;1;8;0;-1;2;0;0;1;0;1;3;0;0
NVIDIA H100 PCIe [0xa32d];3;13;4;7;30000;0;12;13;1;6;0;-1;-2;0;0;0;1;1;0;0;0
NVIDIA H100 PCIe [0xa32d];3;13;4;9;30000;0;1;13;1;8;0;-2;1;0;0;1;1;1;3;3;2
NVIDIA H100 PCIe [0xa32d];3;13;4;13;30000;0;1;13;1;11;0;0;2;1;0;1;0;1;3;3;0
NVIDIA H100 PCIe [0xa32d];3;13;4;17;30000;0;1;13;1;5;0;0;2;1;0;1;1;1;3;3;2
NVIDIA H100 PCIe [0xa32d];3;13;4;32;30000;0;22;13;1;2;0;0;-1;1;0;0;1;1;1;3;0
NVIDIA H100 PCIe [0xa32d];3;13;5;4;30000;0;11;13;1;13;0;1;0;1;0;1;1;0;2;0;0
NVIDIA H100 PCIe [0xa32d];3;13;5;5;30000;0;14;13;1;7;0;1;0;0;0;0;1;1;2;0;0
NVIDIA H100 PCIe [0xa32d];3;13;5;7;30000;0;6;13;1;12;0;0;0;0;0;0;1;1;1;3;0
NVIDIA H100 PCIe [0xa32d];3;13;5;13;30000;0;1;13;1;8;0;-1;-2;1;0;0;1;1;2;3;0
NVIDIA H100 PCIe [0xa32d];3;13;5;17;30000;0;11;13;1;4;0;-1;0;0;0;0;1;0;2;3;0
NVIDIA H100 PCIe [0xa32d];3;13;5;32;30000;0;17;13;1;4;0;-2;-2;0;0;1;1;1;2;3;0
NVIDIA H100 PCIe [0xa32d];3;13;7;4;30000;0;18;13;1;13;0;-2;-1;0;0;0;1;1;1;3;0
NVIDIA H100 PCIe [0xa32d];3;13;7;5;30000;0;10;13;1;4;0;1;0;1;0;1;1;1;2;3;0
NVIDIA H100 PCIe [0xa32d];3;13;7;7;30000;0;14;13;1;9;0;-2;-2;1;0;1;1;1;2;0;0
NVIDIA H100 PCIe [0xa32d];3;13;7;13;30000;0;14;13;1;4;0;-2;2;0;0;1;1;1;2;0;0
NVIDIA H100 PCIe [0xa32d];3;13;9;4;30000;0;14;13;1;8;0;1;-2;0;0;1;1;1;1;0;0
NVIDIA H100 PCIe [0xa32d];3;13;13;4;30000;0;24;13;1;10;0;-1;-2;0;0;0;1;0;2;3;0
NVIDIA H100 PCIe [0xa32d];3;13;13;5;30000;0;20;13;1;6;0;0;-1;1;0;0;1;0;1;0;0
NVIDIA H100 PCIe [0xa32d];3;13;13;7;30000;0;17;13;1;3;0;1;-2;1;0;0;1;1;1;0;0
NVIDIA H100 PCIe [0xa32d];3;13;13;13;30000;0;11;13;1;5;0;-2;1;1;0;0;1;0;1;3;0
NVIDIA H100 PCIe [0xa32d];3;13;13;17;30000;0;17;13;1;8;0;-2;-2;1;0;0;1;1;1;3;0
NVIDIA H100 PCIe [0xa32d];3;13;13;32;30000;0;6;13;1;5;0;1;-2;1;0;0;1;1;2;3;0
NVIDIA H100 PCIe [0xa32d];3;13;17;4;30000;0;18;13;1;9;0;-2;-1;1;0;0;1;1;2;3;0
NVIDIA H100 PCIe [0xa32d];3;13;17;5;30000;0;17;13;1;5;0;0;2;1;0;0;1;1;1;0;0
NVIDIA H100 PCIe [0xa32d];3;13;17;13;30000;0;11;13;1;10;0;-2;0;0;0;0;1;1;1;3;0
NVIDIA H100 PCIe [0xa32d];3;13;17;17;30000;0;17;13;1;2;0;-2;1;0;0;0;1;1;1;3;0
NVIDIA H100 PCIe [0xa32d];3;13;17;32;30000;0;17;13;1;12;0;1;0;0;0;0;1;1;2;3;0
NVIDIA H100 PCIe [0xa32d];3;13;32;4;30000;0;25;13;1;11;0;-2;-2;1;0;0;1;1;1;3;0
NVIDIA H100 PCIe [0xa32d];3;13;32;5;30000;0;18;13;1;10;0;1;0;1;0;0;1;0;2;3;0
NVIDIA H100 PCIe [0xa32d];3;13;32;13;30000;0;22;13;1;12;0;0;-2;0;0;0;1;1;1;3;0
NVIDIA H100 PCIe [0xa32d];3;13;32;17;30000;0;25;13;1;10;0;-1;-1;0;0;0;1;1;1;3;0
NVIDIA H100 PCIe [0xa32d];3;13;32;32;30000;0;15;13;1;12;0;0;0;1;0;0;1;0;2;3;0
NVIDIA H100 PCIe [0xa32d];3;15;4;4;30000;0;9;15;1;11;0;1;-2;1;0;0;1;0;3;3;0
NVIDIA H100 PCIe [0xa32d];3;15;15;15;30000;0;12;15;1;7;0;-2;-2;0;0;1;1;0;1;3;0
NVIDIA H100 PCIe [0xa32d];3;16;9;9;30000;0;17;16;1;3;0;-2;1;0;0;1;1;1;2;0;0
NVIDIA H100 PCIe [0xa32d];3;16;9;16;30000;0;1;16;1;3;0;-1;1;1;0;1;0;0;3;0;2
NVIDIA H100 PCIe [0xa32d];3;16;9;22;30000;0;17;16;1;6;0;0;-2;1;0;0;1;1;1;3;0
NVIDIA H100 PCIe [0xa32d];3;16;16;9;30000;0;17;16;1;10;0;1;-1;1;0;0;1;1;1;3;0
NVIDIA H100 PCIe [0xa32d];3;16;16;16;30000;0;14;16;1;4;0;-2;0;0;0;0;1;1;2;0;0
NVIDIA H100 PCIe [0xa32d];3;16;16;22;30000;0;25;16;1;5;0;-2;-1;1;0;0;1;1;1;3;0
NVIDIA H100 PCIe [0xa32d];3;16;22;9;30000;0;17;16;1;3;0;1;1;1;0;1;1;1;2;3;0
NVIDIA H100 PCIe [0xa32d];3;16;22;16;30000;0;9;16;1;13;0;1;-2;1;0;1;1;1;2;3;0
NVIDIA H100 PCIe [0xa32d];3;16;22;22;30000;0;15;16;1;16;0;0;-2;0;0;1;1;0;2;3;0
NVIDIA H100 PCIe [0xa32d];3;17;4;4;30000;0;14;17;1;13;0;-2;0;1;0;0;1;0;0;0;2
NVIDIA H100 PCIe [0xa32d];3;17;4;5;30000;0;11;17;1;16;0;1;0;0;0;1;1;1;2;0;0
NVIDIA H100 PCIe [0xa32d];3;17;4;13;30000;0;1;17;1;8;0;-2;1;0;0;0;0;0;3;3;0
NVIDIA H100 PCIe [0xa32d];3;17;4;17;30000;0;1;17;1;9;0;1;0;1;0;0;0;1;0;3;1
NVIDIA H100 PCIe [0xa32d];3;17;4;32;30000;0;1;17;1;3;0;-1;0;1;0;1;1;0;3;3;2
NVIDIA H100 PCIe [0xa32d];3;17;5;4;30000;0;14;17;1;4;0;-2;2;0;0;1;1;1;1;0;0
NVIDIA H100 PCIe [0xa32d];3;17;5;5;30000;0;1;17;1;4;0;-2;1;0;0;1;0;0;3;0;2
NVIDIA H100 PCIe [0xa32d];3;17;5;13;30000;0;1;17;1;7;0;1;-1;0;0;1;1;0;3;3;0
NVIDIA H100 PCIe [0xa32d];3;17;5;17;30000;0;1;17;1;5;0;-1;-2;1;0;0;1;0;1;3;1
NVIDIA H100 PCIe [0xa32d];3;17;5;32;30000;0;1;17;1;2;0;1;1;0;0;0;1;0;2;3;0
NVIDIA H100 PCIe [0xa32d];3;17;13;4;30000;0;19;17;1;5;0;1;1;1;0;1;1;0;0;3;2
NVIDIA H100 PCIe [0xa32d];3;17;13;5;30000;0;18;17;1;17;0;1;-2;0;0;0;1;1;2;3;0
NVIDIA H100 PCIe [0xa32d];3;17;13;13;30000;0;12;17;1;17;0;0;-1;0;0;1;1;0;1;3;0
NVIDIA H100 PCIe [0xa32d];3;17;13;17;30000;0;10;17;1;15;0;-2;-2;1;0;0;1;1;2;3;2
NVIDIA H100 PCIe [0xa32d];3;17;13;32;30000;0;22;17;1;4;0;0;-2;0;0;0;1;1;2;3;0
NVIDIA H100 PCIe [0xa32d];3;17;17;4;30000;0;24;17;1;11;0;-2;-2;0;0;0;1;0;2;3;0
NVIDIA H100 PCIe [0xa32d];3;17;17;5;30000;0;24;17;1;5;0;1;0;0;0;0;1;0;2;3;0
NVIDIA H100 PCIe [0xa32d];3;17;17;13;30000;0;22;17;1;17;0;-1;0;0;0;0;1;0;1;3;0
NVIDIA H100 PCIe [0xa32d];3;17;17;17;30000;0;24;17;1;14;0;0;-1;0;0;0;1;0;1;3;0
NVIDIA H100 PCIe [0xa32d];3;17;17;32;30000;0;11;17;1;9;0;1;-1;0;0;0;1;0;2;3;0
NVIDIA H100 PCIe [0xa32d];3;17;32;4;30000;0;18;17;1;8;0;1;1;1;0;0;1;0;2;0;0
NVIDIA H100 PCIe [0xa32d];3;17;32;5;30000;0;18;17;1;13;0;-1;-2;1;0;0;1;1;1;0;0
NVIDIA H100 PCIe [0xa32d];3;17;32;13;30000;0;15;17;1;4;0;0;0;1;0;1;1;1;1;3;0
NVIDIA H100 PCIe [0xa32d];3;17;32;17;30000;0;15;17;1;16;0;1;0;0;0;0;1;0;1;0;0
NVIDIA H100 PCIe [0xa32d];3;17;32;32;30000;0;22;17;1;11;0;0;-2;0;0;0;1;1;2;3;0
NVIDIA H100 PCIe [0xa32d];3;20;20;20;30000;0;10;20;1;13;0;-1;-1;1;0;0;1;1;2;3;0
NVIDIA H100 PCIe [0xa32d];3;22;9;9;30000;0;17;22;1;9;0;0;1;0;0;0;1;1;1;0;0
NVIDIA H100 PCIe [0xa32d];3;22;9;16;30000;0;10;22;1;17;0;1;0;0;0;0;1;1;2;0;2
NVIDIA H100 PCIe [0xa32d];3;22;9;22;30000;0;14;22;1;21;0;1;0;0;0;1;1;1;2;0;0
NVIDIA H100 PCIe [0xa32d];3;22;9;32;30000;0;1;22;1;3;0;0;-1;0;0;0;1;0;3;3;0
NVIDIA H100 PCIe [0xa32d];3;22;16;9;30000;0;13;22;1;11;0;-1;1;1;0;0;1;0;1;1;0
NVIDIA H100 PCIe [0xa32d];3;22;16;16;30000;0;17;22;1;11;0;-1;0;1;0;1;1;1;2;3;0
NVIDIA H100 PCIe [0xa32d];3;22;16;22;30000;0;22;22;1;3;0;-1;0;0;0;0;1;0;2;3;0
NVIDIA H100 PCIe [0xa32d];3;22;22;9;30000;0;13;22;1;4;0;-2;2;1;0;1;1;0;2;3;0
NVIDIA H100 PCIe [0xa32d];3;22;22;16;30000;0;14;22;1;7;0;-1;-1;1;0;0;1;1;2;0;0
NVIDIA H100 PCIe [0xa32d];3;22;22;22;30000;0;24;22;1;9;0;0;-1;0;0;1;1;1;2;3;0
NVIDIA H100 PCIe [0xa32d];3;22;22;32;30000;0;33;22;1;17;0;1;-2;0;0;0;1;1;2;3;0
NVIDIA H100 PCIe [0xa32d];3;23;23;23;30000;0;22;23;1;23;0;-1;-1;0;0;0;1;1;1;3;0
NVIDIA H100 PCIe [0xa32d];3;24;24;24;30000;0;18;24;1;20;0;-2;-2;0;0;0;1;1;2;0;0
NVIDIA H100 PCIe [0xa32d];3;25;4;4;30000;0;1;25;1;16;0;-1;-2;0;0;0;0;0;3;2;0
NVIDIA H100 PCIe [0xa32d];3;25;4;5;30000;0;1;25;1;3;0;1;-2;1;0;1;1;1;3;3;2
NVIDIA H100 PCIe [0xa32d];3;25;5;4;30000;0;13;25;1;9;0;0;0;0;0;0;1;0;1;0;0
NVIDIA H100 PCIe [0xa32d];3;25;25;25;30000;0;26;25;1;10;0;-1;-1;1;0;0;1;1;1;3;0
NVIDIA H100 PCIe [0xa32d];3;26;4;4;30000;0;12;26;1;4;0;1;-2;0;0;1;1;0;3;0;2
NVIDIA H100 PCIe [0xa32d];3;28;4;4;30000;0;1;28;1;26;0;-2;0;1;0;1;1;1;3;3;2
NVIDIA H100 PCIe [0xa32d];3;28;28;28;30000;0;24;28;1;18;0;1;0;1;0;1;1;1;2;0;2
NVIDIA H100 PCIe [0xa32d];3;30;30;30;30000;0;11;30;1;19;0;0;0;0;0;0;1;0;2;0;2
NVIDIA H100 PCIe [0xa32d];3;32;4;4;30000;0;17;32;1;17;0;1;-2;0;0;1;1;0;1;3;0
NVIDIA H100 PCIe [0xa32d];3;32;4;5;30000;0;1;32;1;13;0;-1;1;0;0;0;0;1;3;1;2
NVIDIA H100 PCIe [0xa32d];3;32;4;13;30000;0;1;32;1;12;0;-1;-1;0;0;0;1;1;3;0;1
NVIDIA H100 PCIe [0xa32d];3;32;4;17;30000;0;1;32;1;25;0;-2;-1;0;0;0;0;0;3;3;2
NVIDIA H100 PCIe [0xa32d];3;32;4;32;30000;0;1;32;1;15;0;0;-2;0;0;0;1;0;2;0;0
NVIDIA H100 PCIe [0xa32d];3;32;5;4;30000;0;17;32;1;6;0;0;1;0;0;0;1;1;1;3;0
NVIDIA H100 PCIe [0xa32d];3;32;5;5;30000;0;18;32;1;24;0;-2;-1;0;0;0;1;1;2;0;0
NVIDIA H100 PCIe [0xa32d];3;32;5;13;30000;0;1;32;1;29;0;0;0;0;0;0;1;0;1;3;0
NVIDIA H100 PCIe [0xa32d];3;32;5;17;30000;0;1;32;1;21;0;-1;1;0;0;0;1;0;3;3;2
NVIDIA H100 PCIe [0xa32d];3;32;5;32;30000;0;24;32;1;32;0;1;-2;1;0;0;1;1;2;0;2
NVIDIA H100 PCIe [0xa32d];3;32;13;4;30000;0;18;32;1;29;0;0;-1;1;0;0;1;1;1;0;0
NVIDIA H100 PCIe [0xa32d];3;32;13;5;30000;0;18;32;1;9;0;1;-2;1;0;0;1;1;1;0;0
NVIDIA H100 PCIe [0xa32d];3;32;13;13;30000;0;22;32;1;26;0;1;-1;0;0;0;1;1;2;3;0
NVIDIA H100 PCIe [0xa32d];3;32;13;17;30000;0;24;32;1;21;0;-2;-1;1;0;0;1;0;1;3;0
NVIDIA H100 PCIe [0xa32d];3;32;13;32;30000;0;5;32;1;19;0;-1;-2;1;0;0;1;0;2;3;2
NVIDIA H100 PCIe [0xa32d];3;32;17;4;30000;0;17;32;1;9;0;1;-1;0;0;0;1;1;2;0;0
NVIDIA H100 PCIe [0xa32d];3;32;17;5;30000;0;18;32;1;9;0;-2;-2;1;0;0;1;1;2;0;0
NVIDIA H100 PCIe [0xa32d];3;32;17;13;30000;0;22;32;1;5;0;-2;-2;1;0;1;1;1;2;3;0
NVIDIA H100 PCIe [0xa32d];3;32;17;17;30000;0;22;32;1;8;0;1;0;1;0;0;1;1;2;3;0
NVIDIA H100 PCIe [0xa32d];3;32;17;32;30000;0;4;32;1;25;0;1;0;0;0;0;1;0;2;3;0
NVIDIA H100 PCIe [0xa32d];3;32;32;4;30000;0;37;32;1;21;0;0;0;0;0;1;1;0;2;3;0
NVIDIA H100 PCIe [0xa32d];3;32;32;5;30000;0;33;32;1;11;0;0;-1;1;0;0;1;1;1;1;0
NVIDIA H100 PCIe [0xa32d];3;32;32;13;30000;0;34;32;1;7;0;0;0;1;0;1;1;0;1;3;0
NVIDIA H100 PCIe [0xa32d];3;32;32;17;30000;0;24;32;1;32;0;-1;0;1;0;1;1;0;1;3;0
NVIDIA H100 PCIe [0xa32d];3;32;32;32;30000;0;22;32;1;18;0;1;-2;1;0;0;1;1;2;3;0
NVIDIA H100 PCIe [0xa32d];3;35;35;35;30000;0;27;35;1;35;0;1;0;0;0;0;1;0;1;3;0
NVIDIA H100 PCIe [0xa32d];3;36;36;36;30000;0;17;36;1;36;0;0;0;0;0;0;1;0;1;3;0
NVIDIA H100 PCIe [0xa32d];3;40;40;40;30000;0;8;40;1;30;0;-1;0;0;0;0;1;0;2;3;0
