src/acc/opencl/smm/params/tune_multiply_PVC.csv
DEVICE;TYPEID;M;N;K;S;GFLOPS;BS;BM;BN;BK;WS;WG;LU;NZ;AL;TB;TC;AP;AA;AB;AC
Intel(R) Data Center GPU Max 1550 [0x0bd5];3;2;2;2;30000;0;4;2;1;1;0;-1;2;0;1;0;1;0;3;3;0
Intel(R) Data Center GPU Max 1550 [0x0bd5];3;3;3;1;30000;0;5;3;1;2;0;-1;-2;0;1;0;1;0;2;3;0
Intel(R) Data Center GPU Max 1550 [0x0bd5];3;3;3;3;30000;0;5;3;1;2;0;-1;-2;1;1;0;1;0;3;0;1
Intel(R) Data Center GPU Max 1550 [0x0bd5];3;4;4;4;30000;0;10;4;1;2;0;-2;1;0;1;1;1;1;0;2;0
Intel(R) Data Center GPU Max 1550 [0x0bd5];3;4;4;5;30000;0;11;4;1;4;0;1;-1;0;1;0;1;0;0;3;0
Intel(R) Data Center GPU Max 1550 [0x0bd5];3;4;4;7;30000;0;9;4;1;2;0;1;0;0;0;1;1;0;0;3;1
Intel(R) Data Center GPU Max 1550 [0x0bd5];3;4;4;9;30000;0;9;4;1;2;0;-2;0;0;0;0;1;0;0;3;0
Intel(R) Data Center GPU Max 1550 [0x0bd5];3;4;4;10;30000;0;9;4;1;2;0;-1;2;0;1;0;1;0;0;1;0
Intel(R) Data Center GPU Max 1550 [0x0bd5];3;4;4;13;30000;0;8;4;1;1;0;0;-1;1;0;0;1;0;0;0;2
Intel(R) Data Center GPU Max 1550 [0x0bd5];3;4;4;15;30000;0;8;4;1;1;0;-2;0;1;1;1;1;0;3;0;0
Intel(R) Data Center GPU Max 1550 [0x0bd5];3;4;4;17;30000;0;8;4;1;1;0;-1;-2;0;1;0;1;0;0;2;0
Intel(R) Data Center GPU Max 1550 [0x0bd5];3;4;4;25;30000;0;8;4;1;2;0;-2;2;0;1;0;1;0;3;3;1
Intel(R) Data Center GPU Max 1550 [0x0bd5];3;4;4;26;30000;0;9;4;1;1;0;-1;0;0;1;1;1;0;3;0;2
Intel(R) Data Center GPU Max 1550 [0x0bd5];3;4;4;28;30000;0;9;4;1;1;0;1;0;0;1;1;1;1;0;0;0
Intel(R) Data Center GPU Max 1550 [0x0bd5];3;4;4;32;30000;0;8;4;1;1;0;0;-1;0;1;1;1;1;0;0;1
Intel(R) Data Center GPU Max 1550 [0x0bd5];3;4;5;4;30000;0;10;4;1;2;0;-1;-2;1;0;0;1;1;3;0;2
Intel(R) Data Center GPU Max 1550 [0x0bd5];3;4;5;5;30000;0;10;4;1;3;0;-2;-2;0;1;0;1;0;3;3;2
Intel(R) Data Center GPU Max 1550 [0x0bd5];3;4;5;7;30000;0;10;4;1;3;0;-2;-1;0;1;0;1;0;3;0;1
Intel(R) Data Center GPU Max 1550 [0x0bd5];3;4;5;9;30000;0;9;4;1;1;0;-2;0;0;0;0;1;0;3;3;0
Intel(R) Data Center GPU Max 1550 [0x0bd5];3;4;5;13;30000;0;8;4;1;1;0;-1;-2;1;1;1;1;0;0;2;0
Intel(R) Data Center GPU Max 1550 [0x0bd5];3;4;5;17;30000;0;8;4;1;1;0;-2;0;1;1;0;1;0;0;0;2
Intel(R) Data Center GPU Max 1550 [0x0bd5];3;4;5;25;30000;0;5;4;1;1;0;-1;0;1;1;0;1;0;0;3;1
Intel(R) Data Center GPU Max 1550 [0x0bd5];3;4;5;32;30000;0;8;4;1;1;0;-2;-1;0;1;1;1;0;3;0;0
Intel(R) Data Center GPU Max 1550 [0x0bd5];3;4;7;4;30000;0;11;4;1;2;0;-1;-2;0;1;0;1;1;3;2;1
Intel(R) Data Center GPU Max 1550 [0x0bd5];3;4;7;5;30000;0;14;4;1;1;0;-2;-2;0;1;1;1;1;0;0;1
Intel(R) Data Center GPU Max 1550 [0x0bd5];3;4;7;7;30000;0;12;4;1;1;0;-1;0;0;0;1;1;0;0;3;0
Intel(R) Data Center GPU Max 1550 [0x0bd5];3;4;7;9;30000;0;9;4;1;2;0;-1;2;1;1;0;1;1;3;3;0
Intel(R) Data Center GPU Max 1550 [0x0bd5];3;4;7;13;30000;0;8;4;1;1;0;-1;-2;1;1;0;1;1;3;3;0
Intel(R) Data Center GPU Max 1550 [0x0bd5];3;4;9;4;30000;0;14;4;1;1;0;-1;-2;0;1;0;1;1;3;3;0
Intel(R) Data Center GPU Max 1550 [0x0bd5];3;4;9;5;30000;0;12;4;1;4;0;-1;-1;0;0;0;1;1;3;0;1
Intel(R) Data Center GPU Max 1550 [0x0bd5];3;4;9;7;30000;0;12;4;1;2;0;-1;1;0;1;0;1;1;3;3;1
Intel(R) Data Center GPU Max 1550 [0x0bd5];3;4;9;9;30000;0;8;4;1;1;0;-1;-2;0;0;0;1;1;0;0;1
Intel(R) Data Center GPU Max 1550 [0x0bd5];3;4;9;13;30000;0;8;4;1;4;0;-1;0;0;1;0;1;0;1;3;0
Intel(R) Data Center GPU Max 1550 [0x0bd5];3;4;10;4;30000;0;16;4;1;4;0;-1;-1;0;1;0;1;1;3;0;2
Intel(R) Data Center GPU Max 1550 [0x0bd5];3;4;10;10;30000;0;9;4;1;3;0;1;0;0;1;0;1;1;3;3;2
Intel(R) Data Center GPU Max 1550 [0x0bd5];3;4;13;4;30000;0;16;4;1;2;0;-1;-2;0;0;1;1;1;0;0;0
Intel(R) Data Center GPU Max 1550 [0x0bd5];3;4;13;5;30000;0;14;4;1;1;0;-2;0;0;0;1;1;0;0;0;0
Intel(R) Data Center GPU Max 1550 [0x0bd5];3;4;13;7;30000;0;12;4;1;1;0;2;0;0;1;1;1;0;3;0;0
Intel(R) Data Center GPU Max 1550 [0x0bd5];3;4;13;9;30000;0;8;4;1;2;0;-2;-2;0;1;0;1;1;0;1;0
Intel(R) Data Center GPU Max 1550 [0x0bd5];3;4;13;13;30000;0;8;4;1;1;0;-2;-2;0;1;0;1;1;0;1;2
Intel(R) Data Center GPU Max 1550 [0x0bd5];3;4;13;17;30000;0;8;4;1;1;0;-1;-1;0;1;1;1;1;0;0;2
Intel(R) Data Center GPU Max 1550 [0x0bd5];3;4;13;32;30000;0;8;4;1;1;0;-1;-1;0;1;1;1;1;0;0;1
Intel(R) Data Center GPU Max 1550 [0x0bd5];3;4;15;4;30000;0;14;4;1;2;0;-2;2;0;1;0;1;1;3;0;1
Intel(R) Data Center GPU Max 1550 [0x0bd5];3;4;17;4;30000;0;12;4;1;3;0;-1;-2;0;1;0;1;1;3;0;0
Intel(R) Data Center GPU Max 1550 [0x0bd5];3;4;17;5;30000;0;14;4;1;2;0;0;1;0;1;0;1;1;3;3;0
Intel(R) Data Center GPU Max 1550 [0x0bd5];3;4;17;13;30000;0;8;4;1;1;0;1;-1;1;1;0;1;1;0;3;0
Intel(R) Data Center GPU Max 1550 [0x0bd5];3;4;17;17;30000;0;8;4;1;1;0;0;-1;0;1;0;1;1;0;0;2
Intel(R) Data Center GPU Max 1550 [0x0bd5];3;4;17;32;30000;0;8;4;1;1;0;-2;0;1;1;0;1;1;3;3;0
Intel(R) Data Center GPU Max 1550 [0x0bd5];3;4;25;4;30000;0;14;4;1;2;0;-2;0;0;1;0;1;1;3;3;0
Intel(R) Data Center GPU Max 1550 [0x0bd5];3;4;25;5;30000;0;12;4;1;2;0;0;0;0;1;0;1;0;3;3;2
Intel(R) Data Center GPU Max 1550 [0x0bd5];3;4;26;4;30000;0;14;4;1;4;0;0;0;1;1;0;1;1;0;3;0
Intel(R) Data Center GPU Max 1550 [0x0bd5];3;4;28;4;30000;0;17;4;1;1;0;-1;0;0;1;0;1;1;0;1;0
Intel(R) Data Center GPU Max 1550 [0x0bd5];3;4;32;4;30000;0;17;4;1;2;0;0;1;1;1;0;1;0;0;0;0
Intel(R) Data Center GPU Max 1550 [0x0bd5];3;4;32;5;30000;0;21;4;1;1;0;-1;-1;0;1;1;1;1;0;0;1
Intel(R) Data Center GPU Max 1550 [0x0bd5];3;4;32;13;30000;0;8;4;1;1;0;-1;-2;0;1;0;1;1;3;0;1
Intel(R) Data Center GPU Max 1550 [0x0bd5];3;4;32;17;30000;0;8;4;1;1;0;1;-1;1;1;1;1;0;3;0;0
Intel(R) Data Center GPU Max 1550 [0x0bd5];3;4;32;32;30000;0;8;4;1;1;0;1;2;1;1;1;1;0;3;0;2
Intel(R) Data Center GPU Max 1550 [0x0bd5];3;5;4;4;30000;0;14;5;1;1;0;-1;-2;0;0;0;1;0;0;1;0
Intel(R) Data Center GPU Max 1550 [0x0bd5];3;5;4;5;30000;0;12;5;1;2;0;0;0;0;0;0;1;0;0;0;2
Intel(R) Data Center GPU Max 1550 [0x0bd5];3;5;4;7;30000;0;12;5;1;1;0;-1;-2;0;1;1;1;0;3;3;0
Intel(R) Data Center GPU Max 1550 [0x0bd5];3;5;4;9;30000;0;12;5;1;1;0;-2;-1;0;1;0;1;0;3;0;0
Intel(R) Data Center GPU Max 1550 [0x0bd5];3;5;4;13;30000;0;8;5;1;1;0;-2;-2;0;0;1;1;0;0;0;0
Intel(R) Data Center GPU Max 1550 [0x0bd5];3;5;4;17;30000;0;12;5;1;1;0;-2;-1;0;1;0;1;0;0;0;0
Intel(R) Data Center GPU Max 1550 [0x0bd5];3;5;4;25;30000;0;8;5;1;1;0;-2;-1;1;1;0;1;0;0;3;0
Intel(R) Data Center GPU Max 1550 [0x0bd5];3;5;4;32;30000;0;8;5;1;3;0;-1;-1;0;0;1;1;1;3;0;0
Intel(R) Data Center GPU Max 1550 [0x0bd5];3;5;5;4;30000;0;12;5;1;1;0;-1;-1;0;0;0;1;0;0;0;0
Intel(R) Data Center GPU Max 1550 [0x0bd5];3;5;5;5;30000;0;8;5;1;2;0;-2;2;0;1;1;1;0;0;2;1
Intel(R) Data Center GPU Max 1550 [0x0bd5];3;5;5;7;30000;0;12;5;1;1;0;-1;-2;0;0;0;1;0;0;2;0
Intel(R) Data Center GPU Max 1550 [0x0bd5];3;5;5;9;30000;0;11;5;1;1;0;-2;-1;0;1;0;1;0;0;2;0
Intel(R) Data Center GPU Max 1550 [0x0bd5];3;5;5;13;30000;0;9;5;1;1;0;-1;0;0;0;1;1;0;0;1;0
Intel(R) Data Center GPU Max 1550 [0x0bd5];3;5;5;16;30000;0;8;5;1;1;0;-2;-1;0;0;0;1;0;0;1;2
Intel(R) Data Center GPU Max 1550 [0x0bd5];3;5;5;17;30000;0;8;5;1;1;0;-1;0;1;1;0;1;0;0;0;0
Intel(R) Data Center GPU Max 1550 [0x0bd5];3;5;5;24;30000;0;8;5;1;1;0;-1;-1;0;0;0;1;0;0;3;0
Intel(R) Data Center GPU Max 1550 [0x0bd5];3;5;5;26;30000;0;8;5;1;1;0;-1;0;1;0;0;1;0;0;3;0
Intel(R) Data Center GPU Max 1550 [0x0bd5];3;5;5;32;30000;0;8;5;1;1;0;-1;-1;0;1;0;1;0;0;0;0
Intel(R) Data Center GPU Max 1550 [0x0bd5];3;5;7;4;30000;0;12;5;1;1;0;0;0;0;0;0;1;0;0;0;1
Intel(R) Data Center GPU Max 1550 [0x0bd5];3;5;7;5;30000;0;13;5;1;1;0;-2;-2;0;1;0;1;0;3;1;1
Intel(R) Data Center GPU Max 1550 [0x0bd5];3;5;7;7;30000;0;12;5;1;1;0;-2;-2;0;1;0;1;0;0;1;0
Intel(R) Data Center GPU Max 1550 [0x0bd5];3;5;7;9;30000;0;8;5;1;1;0;0;-1;1;1;0;1;0;3;0;0
Intel(R) Data Center GPU Max 1550 [0x0bd5];3;5;7;13;30000;0;8;5;1;2;0;1;0;1;1;0;1;1;0;3;2
Intel(R) Data Center GPU Max 1550 [0x0bd5];3;5;9;4;30000;0;16;5;1;1;0;1;0;0;1;0;1;0;0;0;2
Intel(R) Data Center GPU Max 1550 [0x0bd5];3;5;9;5;30000;0;16;5;1;1;0;-1;0;1;1;0;1;0;3;2;0
Intel(R) Data Center GPU Max 1550 [0x0bd5];3;5;9;7;30000;0;12;5;1;1;0;-1;-2;0;1;0;1;0;0;0;1
Intel(R) Data Center GPU Max 1550 [0x0bd5];3;5;9;9;30000;0;12;5;1;1;0;-1;0;1;1;1;1;1;0;0;2
Intel(R) Data Center GPU Max 1550 [0x0bd5];3;5;13;4;30000;0;16;5;1;1;0;-2;-1;0;1;0;1;0;0;0;1
Intel(R) Data Center GPU Max 1550 [0x0bd5];3;5;13;5;30000;0;14;5;1;1;0;-2;-2;0;1;1;1;1;0;0;0
Intel(R) Data Center GPU Max 1550 [0x0bd5];3;5;13;7;30000;0;12;5;1;1;0;-1;-1;1;1;0;1;1;0;3;1
Intel(R) Data Center GPU Max 1550 [0x0bd5];3;5;13;13;30000;0;8;5;1;1;0;-2;-1;1;1;0;1;1;0;3;0
Intel(R) Data Center GPU Max 1550 [0x0bd5];3;5;13;16;30000;0;8;5;1;1;0;-1;0;1;1;0;1;1;3;0;0
Intel(R) Data Center GPU Max 1550 [0x0bd5];3;5;13;17;30000;0;8;5;1;1;0;-2;-1;1;1;0;1;1;0;3;0
Intel(R) Data Center GPU Max 1550 [0x0bd5];3;5;13;24;30000;0;8;5;1;1;0;-2;-1;0;1;1;1;1;0;0;1
Intel(R) Data Center GPU Max 1550 [0x0bd5];3;5;13;26;30000;0;8;5;1;1;0;-1;-2;0;1;0;1;1;0;3;0
Intel(R) Data Center GPU Max 1550 [0x0bd5];3;5;13;32;30000;0;8;5;1;1;0;-2;0;0;1;0;1;0;0;0;0
Intel(R) Data Center GPU Max 1550 [0x0bd5];3;5;16;5;30000;0;16;5;1;1;0;-1;-1;1;1;1;1;1;0;1;0
Intel(R) Data Center GPU Max 1550 [0x0bd5];3;5;16;13;30000;0;8;5;1;1;0;-1;-1;1;1;0;1;1;0;0;0
Intel(R) Data Center GPU Max 1550 [0x0bd5];3;5;16;16;30000;0;8;5;1;1;0;-2;-1;1;1;1;1;0;0;0;0
Intel(R) Data Center GPU Max 1550 [0x0bd5];3;5;16;24;30000;0;8;5;1;1;0;-1;-2;1;1;1;1;0;0;0;0
Intel(R) Data Center GPU Max 1550 [0x0bd5];3;5;16;26;30000;0;8;5;1;1;0;-2;-1;0;1;0;1;1;0;0;2
Intel(R) Data Center GPU Max 1550 [0x0bd5];3;5;17;4;30000;0;14;5;1;5;0;-2;-1;0;1;0;1;0;3;3;2
Intel(R) Data Center GPU Max 1550 [0x0bd5];3;5;17;5;30000;0;17;5;1;1;0;-2;-1;0;1;0;1;1;0;2;0
Intel(R) Data Center GPU Max 1550 [0x0bd5];3;5;17;13;30000;0;8;5;1;1;0;-2;-2;0;1;0;1;0;0;0;0
Intel(R) Data Center GPU Max 1550 [0x0bd5];3;5;17;17;30000;0;8;5;1;1;0;-2;-2;0;1;1;1;1;3;0;0
Intel(R) Data Center GPU Max 1550 [0x0bd5];3;5;17;32;30000;0;8;5;1;1;0;1;0;0;1;0;1;1;3;0;0
Intel(R) Data Center GPU Max 1550 [0x0bd5];3;5;24;5;30000;0;23;5;1;1;0;1;0;0;1;0;1;1;3;0;0
Intel(R) Data Center GPU Max 1550 [0x0bd5];3;5;24;13;30000;0;17;5;1;1;0;1;0;1;1;0;1;1;3;3;0
Intel(R) Data Center GPU Max 1550 [0x0bd5];3;5;24;16;30000;0;8;5;1;1;0;1;0;1;0;1;1;0;3;0;0
Intel(R) Data Center GPU Max 1550 [0x0bd5];3;5;25;4;30000;0;22;5;1;1;0;-2;0;0;1;0;1;1;3;0;1
Intel(R) Data Center GPU Max 1550 [0x0bd5];3;5;26;5;30000;0;17;5;1;1;0;-1;-1;0;1;0;1;1;3;2;0
Intel(R) Data Center GPU Max 1550 [0x0bd5];3;5;26;13;30000;0;8;5;1;1;0;1;0;1;1;1;1;0;0;0;0
Intel(R) Data Center GPU Max 1550 [0x0bd5];3;5;26;16;30000;0;8;5;1;1;0;-1;0;1;1;1;1;0;3;0;0
Intel(R) Data Center GPU Max 1550 [0x0bd5];3;5;32;4;30000;0;22;5;1;1;0;-1;0;0;1;1;1;1;3;1;0
Intel(R) Data Center GPU Max 1550 [0x0bd5];3;5;32;5;30000;0;22;5;1;1;0;-1;-2;1;1;0;1;1;0;2;0
Intel(R) Data Center GPU Max 1550 [0x0bd5];3;5;32;13;30000;0;8;5;1;1;0;0;0;0;1;0;1;1;3;0;0
Intel(R) Data Center GPU Max 1550 [0x0bd5];3;5;32;17;30000;0;8;5;1;1;0;-2;0;0;1;1;1;0;3;0;0
Intel(R) Data Center GPU Max 1550 [0x0bd5];3;5;32;32;30000;0;8;5;1;1;0;1;-2;0;1;0;1;0;0;0;0
Intel(R) Data Center GPU Max 1550 [0x0bd5];3;6;6;6;30000;0;9;6;1;3;0;0;1;0;1;0;1;1;0;3;0
Intel(R) Data Center GPU Max 1550 [0x0bd5];3;6;6;7;30000;0;12;6;1;1;0;-1;0;0;1;0;1;0;0;1;0
Intel(R) Data Center GPU Max 1550 [0x0bd5];3;6;6;8;30000;0;13;6;1;1;0;0;0;0;1;0;1;0;3;3;0
Intel(R) Data Center GPU Max 1550 [0x0bd5];3;6;7;6;30000;0;14;6;1;1;0;-1;-2;0;1;0;1;1;0;0;0
Intel(R) Data Center GPU Max 1550 [0x0bd5];3;6;7;7;30000;0;9;6;1;3;0;0;-1;0;1;1;1;0;0;3;0
Intel(R) Data Center GPU Max 1550 [0x0bd5];3;6;7;8;30000;0;9;6;1;6;0;-1;0;1;1;1;1;0;2;1;1
Intel(R) Data Center GPU Max 1550 [0x0bd5];3;6;8;6;30000;0;14;6;1;2;0;0;0;0;1;1;1;1;0;0;0
Intel(R) Data Center GPU Max 1550 [0x0bd5];3;6;8;7;30000;0;15;6;1;1;0;-2;0;0;1;1;1;1;0;1;2
Intel(R) Data Center GPU Max 1550 [0x0bd5];3;6;8;8;30000;0;16;6;1;5;0;1;-2;0;1;0;1;0;3;3;0
Intel(R) Data Center GPU Max 1550 [0x0bd5];3;7;4;4;30000;0;16;7;1;5;0;-2;-1;0;1;0;1;0;0;1;2
Intel(R) Data Center GPU Max 1550 [0x0bd5];3;7;4;5;30000;0;14;7;1;7;0;-1;0;0;1;0;1;1;0;0;1
Intel(R) Data Center GPU Max 1550 [0x0bd5];3;7;4;7;30000;0;12;7;1;3;0;-2;1;0;1;0;1;1;0;0;2
Intel(R) Data Center GPU Max 1550 [0x0bd5];3;7;4;9;30000;0;9;7;1;2;0;-2;-1;0;1;1;1;0;3;2;0
Intel(R) Data Center GPU Max 1550 [0x0bd5];3;7;4;13;30000;0;9;7;1;3;0;-2;0;0;1;0;1;0;2;0;0
Intel(R) Data Center GPU Max 1550 [0x0bd5];3;7;5;4;30000;0;16;7;1;1;0;1;0;1;1;0;1;0;0;0;0
Intel(R) Data Center GPU Max 1550 [0x0bd5];3;7;5;5;30000;0;16;7;1;1;0;1;-2;0;1;0;1;1;3;3;0
Intel(R) Data Center GPU Max 1550 [0x0bd5];3;7;5;7;30000;0;16;7;1;1;0;-2;-2;0;1;1;1;1;3;0;0
Intel(R) Data Center GPU Max 1550 [0x0bd5];3;7;5;9;30000;0;11;7;1;1;0;-1;-2;0;1;1;1;0;0;1;0
Intel(R) Data Center GPU Max 1550 [0x0bd5];3;7;5;13;30000;0;8;7;1;5;0;-2;-2;0;1;0;1;0;3;0;1
Intel(R) Data Center GPU Max 1550 [0x0bd5];3;7;6;6;30000;0;16;7;1;7;0;-1;-1;0;1;0;1;0;0;0;2
Intel(R) Data Center GPU Max 1550 [0x0bd5];3;7;6;7;30000;0;12;7;1;1;0;-1;-2;1;1;0;1;1;0;3;0
Intel(R) Data Center GPU Max 1550 [0x0bd5];3;7;6;8;30000;0;16;7;1;5;0;-1;-1;0;1;0;1;0;0;1;0
Intel(R) Data Center GPU Max 1550 [0x0bd5];3;7;7;4;30000;0;14;7;1;1;0;-2;-2;1;1;0;1;1;0;0;0
Intel(R) Data Center GPU Max 1550 [0x0bd5];3;7;7;5;30000;0;16;7;1;1;0;-1;-2;0;1;0;1;1;3;1;1
Intel(R) Data Center GPU Max 1550 [0x0bd5];3;7;7;6;30000;0;16;7;1;1;0;-2;-1;0;1;1;1;1;0;3;0
Intel(R) Data Center GPU Max 1550 [0x0bd5];3;7;7;7;30000;0;9;7;1;3;0;0;0;0;1;0;1;1;0;0;0
Intel(R) Data Center GPU Max 1550 [0x0bd5];3;7;7;8;30000;0;13;7;1;1;0;-1;-1;1;1;0;1;1;0;3;0
Intel(R) Data Center GPU Max 1550 [0x0bd5];3;7;7;9;30000;0;13;7;1;2;0;-1;0;0;1;1;1;0;3;3;0
Intel(R) Data Center GPU Max 1550 [0x0bd5];3;7;7;13;30000;0;8;7;1;2;0;0;2;1;1;1;1;0;0;0;0
Intel(R) Data Center GPU Max 1550 [0x0bd5];3;7;8;6;30000;0;16;7;1;1;0;-2;-1;1;1;1;1;0;0;0;1
Intel(R) Data Center GPU Max 1550 [0x0bd5];3;7;8;7;30000;0;16;7;1;4;0;0;0;0;1;0;1;1;0;3;0
Intel(R) Data Center GPU Max 1550 [0x0bd5];3;7;8;8;30000;0;15;7;1;4;0;-1;-1;0;1;1;1;0;0;3;2
Intel(R) Data Center GPU Max 1550 [0x0bd5];3;7;9;4;30000;0;18;7;1;2;0;-1;-1;0;1;1;1;1;3;3;0
Intel(R) Data Center GPU Max 1550 [0x0bd5];3;7;9;5;30000;0;18;7;1;1;0;-1;-2;0;1;0;1;1;3;3;0
Intel(R) Data Center GPU Max 1550 [0x0bd5];3;7;9;7;30000;0;12;7;1;1;0;1;-2;0;1;0;1;1;3;0;0
Intel(R) Data Center GPU Max 1550 [0x0bd5];3;7;13;4;30000;0;21;7;1;1;0;0;-2;0;1;0;1;1;0;0;1
Intel(R) Data Center GPU Max 1550 [0x0bd5];3;7;13;5;30000;0;17;7;1;6;0;-2;-1;1;1;1;1;1;3;1;2
Intel(R) Data Center GPU Max 1550 [0x0bd5];3;7;13;7;30000;0;14;7;1;1;0;1;-1;1;1;1;1;0;0;0;0
Intel(R) Data Center GPU Max 1550 [0x0bd5];3;7;13;13;30000;0;11;7;1;1;0;0;-2;1;1;1;1;1;0;0;0
Intel(R) Data Center GPU Max 1550 [0x0bd5];3;8;6;6;30000;0;16;8;1;4;0;-1;-1;0;1;0;1;0;0;1;0
Intel(R) Data Center GPU Max 1550 [0x0bd5];3;8;6;7;30000;0;10;8;1;4;0;0;2;1;1;0;1;0;3;3;0
Intel(R) Data Center GPU Max 1550 [0x0bd5];3;8;6;8;30000;0;9;8;1;6;0;-1;0;0;1;1;1;0;3;3;2
Intel(R) Data Center GPU Max 1550 [0x0bd5];3;8;7;6;30000;0;15;8;1;4;0;-1;-1;1;1;0;1;0;3;0;2
Intel(R) Data Center GPU Max 1550 [0x0bd5];3;8;7;7;30000;0;13;8;1;2;0;-2;-1;0;1;0;1;0;0;2;0
Intel(R) Data Center GPU Max 1550 [0x0bd5];3;8;7;8;30000;0;16;8;1;1;0;-1;0;0;1;1;1;0;3;0;0
Intel(R) Data Center GPU Max 1550 [0x0bd5];3;8;8;6;30000;0;12;8;1;2;0;1;-2;1;1;0;1;0;3;0;0
Intel(R) Data Center GPU Max 1550 [0x0bd5];3;8;8;7;30000;0;16;8;1;1;0;-2;-2;0;1;0;1;1;0;0;0
Intel(R) Data Center GPU Max 1550 [0x0bd5];3;8;8;8;30000;0;4;8;1;4;0;-1;1;0;1;0;1;1;0;1;0
Intel(R) Data Center GPU Max 1550 [0x0bd5];3;9;4;4;30000;0;18;9;1;2;0;-1;0;0;1;0;1;0;3;0;1
Intel(R) Data Center GPU Max 1550 [0x0bd5];3;9;4;5;30000;0;16;9;1;8;0;-1;-2;1;1;1;1;1;3;2;1
Intel(R) Data Center GPU Max 1550 [0x0bd5];3;9;4;7;30000;0;12;9;1;1;0;-2;-2;0;1;1;1;1;3;3;0
Intel(R) Data Center GPU Max 1550 [0x0bd5];3;9;4;9;30000;0;9;9;1;3;0;-2;1;1;1;1;1;1;3;2;1
Intel(R) Data Center GPU Max 1550 [0x0bd5];3;9;4;13;30000;0;8;9;1;9;0;-1;0;0;1;0;1;1;3;0;1
Intel(R) Data Center GPU Max 1550 [0x0bd5];3;9;5;4;30000;0;21;9;1;4;0;-2;-1;0;1;1;1;1;0;0;0
Intel(R) Data Center GPU Max 1550 [0x0bd5];3;9;5;5;30000;0;16;9;1;1;0;-1;0;1;1;1;1;0;0;3;1
Intel(R) Data Center GPU Max 1550 [0x0bd5];3;9;5;7;30000;0;9;9;1;9;0;-2;-1;1;1;0;1;0;3;0;2
Intel(R) Data Center GPU Max 1550 [0x0bd5];3;9;5;9;30000;0;9;9;1;3;0;-1;-2;1;1;0;1;1;0;3;0
Intel(R) Data Center GPU Max 1550 [0x0bd5];3;9;7;4;30000;0;18;9;1;1;0;-1;-1;0;1;0;1;1;0;3;0
Intel(R) Data Center GPU Max 1550 [0x0bd5];3;9;7;5;30000;0;13;9;1;4;0;1;2;1;1;1;1;1;0;0;2
Intel(R) Data Center GPU Max 1550 [0x0bd5];3;9;7;7;30000;0;11;9;1;1;0;-2;-2;1;1;0;1;0;0;0;2
Intel(R) Data Center GPU Max 1550 [0x0bd5];3;9;9;4;30000;0;16;9;1;8;0;-1;-2;0;1;0;1;0;3;0;0
Intel(R) Data Center GPU Max 1550 [0x0bd5];3;9;9;5;30000;0;16;9;1;5;0;0;-1;1;1;0;1;1;3;0;1
Intel(R) Data Center GPU Max 1550 [0x0bd5];3;9;9;9;30000;0;9;9;1;4;0;-1;-2;0;1;0;1;1;0;2;0
Intel(R) Data Center GPU Max 1550 [0x0bd5];3;9;9;16;30000;0;11;9;1;5;0;-1;-2;1;0;0;1;0;0;0;0
Intel(R) Data Center GPU Max 1550 [0x0bd5];3;9;9;22;30000;0;8;9;1;8;0;-1;-1;0;1;0;1;0;0;0;2
Intel(R) Data Center GPU Max 1550 [0x0bd5];3;9;9;32;30000;0;8;9;1;1;0;-1;-1;1;1;1;1;0;0;0;0
Intel(R) Data Center GPU Max 1550 [0x0bd5];3;9;13;4;30000;0;22;9;1;4;0;-1;0;1;1;0;1;1;0;2;0
Intel(R) Data Center GPU Max 1550 [0x0bd5];3;9;16;9;30000;0;18;9;1;3;0;-1;-2;1;0;1;1;0;0;0;2
Intel(R) Data Center GPU Max 1550 [0x0bd5];3;9;16;16;30000;0;14;9;1;1;0;-1;-1;1;1;0;1;0;0;3;0
Intel(R) Data Center GPU Max 1550 [0x0bd5];3;9;16;22;30000;0;12;9;1;9;0;-1;0;1;1;0;1;0;0;3;2
Intel(R) Data Center GPU Max 1550 [0x0bd5];3;9;22;9;30000;0;21;9;1;1;0;-1;-1;1;0;0;1;1;3;3;0
Intel(R) Data Center GPU Max 1550 [0x0bd5];3;9;22;16;30000;0;9;9;1;1;0;1;-2;1;1;0;1;1;0;2;0
Intel(R) Data Center GPU Max 1550 [0x0bd5];3;9;22;22;30000;0;8;9;1;1;0;-2;2;1;1;0;1;1;0;0;2
Intel(R) Data Center GPU Max 1550 [0x0bd5];3;9;22;32;30000;0;8;9;1;1;0;0;-2;1;1;0;1;1;3;0;2
Intel(R) Data Center GPU Max 1550 [0x0bd5];3;9;32;9;30000;0;23;9;1;2;0;-2;0;1;1;0;1;1;2;3;0
Intel(R) Data Center GPU Max 1550 [0x0bd5];3;9;32;22;30000;0;8;9;1;1;0;-2;2;1;1;1;1;0;0;0;0
Intel(R) Data Center GPU Max 1550 [0x0bd5];3;9;32;32;30000;0;8;9;1;1;0;0;-2;0;1;1;1;1;1;0;0
Intel(R) Data Center GPU Max 1550 [0x0bd5];3;10;4;4;30000;0;14;10;1;5;0;-2;-1;0;1;1;1;1;3;1;0
Intel(R) Data Center GPU Max 1550 [0x0bd5];3;10;4;10;30000;0;10;10;1;5;0;0;-2;0;1;0;1;1;0;0;0
Intel(R) Data Center GPU Max 1550 [0x0bd5];3;10;10;4;30000;0;16;10;1;2;0;-1;-1;1;1;1;1;1;0;2;2
Intel(R) Data Center GPU Max 1550 [0x0bd5];3;10;10;10;30000;0;8;10;1;3;0;-1;1;1;1;0;1;1;0;3;0
Intel(R) Data Center GPU Max 1550 [0x0bd5];3;13;4;4;30000;0;16;13;1;8;0;-1;-1;0;1;1;1;1;0;2;1
Intel(R) Data Center GPU Max 1550 [0x0bd5];3;13;4;5;30000;0;14;13;1;5;0;-1;-1;0;1;0;1;0;0;1;0
Intel(R) Data Center GPU Max 1550 [0x0bd5];3;13;4;7;30000;0;9;13;1;12;0;-1;0;1;1;0;1;1;0;0;1
Intel(R) Data Center GPU Max 1550 [0x0bd5];3;13;4;9;30000;0;10;13;1;5;0;-1;1;0;1;0;1;1;0;0;2
Intel(R) Data Center GPU Max 1550 [0x0bd5];3;13;4;13;30000;0;9;13;1;4;0;-2;0;0;1;1;1;1;3;3;2
Intel(R) Data Center GPU Max 1550 [0x0bd5];3;13;4;17;30000;0;10;13;1;13;0;-1;0;1;1;0;1;0;3;3;1
Intel(R) Data Center GPU Max 1550 [0x0bd5];3;13;4;32;30000;0;9;13;1;13;0;-2;1;0;1;1;1;1;0;3;2
Intel(R) Data Center GPU Max 1550 [0x0bd5];3;13;5;4;30000;0;13;13;1;5;0;-1;1;0;1;0;1;0;0;0;1
Intel(R) Data Center GPU Max 1550 [0x0bd5];3;13;5;5;30000;0;9;13;1;4;0;-1;0;1;1;1;1;1;2;3;0
Intel(R) Data Center GPU Max 1550 [0x0bd5];3;13;5;7;30000;0;9;13;1;9;0;-1;-2;0;1;0;1;1;0;0;0
Intel(R) Data Center GPU Max 1550 [0x0bd5];3;13;5;13;30000;0;9;13;1;6;0;-1;-2;0;1;0;1;1;0;3;2
Intel(R) Data Center GPU Max 1550 [0x0bd5];3;13;5;16;30000;0;9;13;1;3;0;-2;0;0;1;1;1;1;0;3;2
Intel(R) Data Center GPU Max 1550 [0x0bd5];3;13;5;17;30000;0;9;13;1;6;0;-2;0;0;1;0;1;1;0;3;2
Intel(R) Data Center GPU Max 1550 [0x0bd5];3;13;5;24;30000;0;8;13;1;3;0;-1;-1;0;1;0;1;1;0;3;2
Intel(R) Data Center GPU Max 1550 [0x0bd5];3;13;5;26;30000;0;8;13;1;7;0;-1;-2;0;1;0;1;0;3;3;1
Intel(R) Data Center GPU Max 1550 [0x0bd5];3;13;5;32;30000;0;10;13;1;1;0;-2;-1;1;1;1;1;1;3;0;0
Intel(R) Data Center GPU Max 1550 [0x0bd5];3;13;7;4;30000;0;14;13;1;1;0;-2;-2;0;1;0;1;0;3;3;0
Intel(R) Data Center GPU Max 1550 [0x0bd5];3;13;7;5;30000;0;23;13;1;4;0;-1;0;0;1;1;1;0;3;3;0
Intel(R) Data Center GPU Max 1550 [0x0bd5];3;13;7;7;30000;0;16;13;1;2;0;-1;0;1;1;1;1;0;3;0;0
Intel(R) Data Center GPU Max 1550 [0x0bd5];3;13;7;13;30000;0;10;13;1;8;0;-2;-2;1;1;0;1;1;3;3;1
Intel(R) Data Center GPU Max 1550 [0x0bd5];3;13;9;4;30000;0;15;13;1;11;0;-1;0;0;1;0;1;1;0;0;2
Intel(R) Data Center GPU Max 1550 [0x0bd5];3;13;13;4;30000;0;26;13;1;1;0;-1;-2;1;1;0;1;0;0;0;0
Intel(R) Data Center GPU Max 1550 [0x0bd5];3;13;13;5;30000;0;23;13;1;5;0;-1;0;1;1;1;1;1;0;0;0
Intel(R) Data Center GPU Max 1550 [0x0bd5];3;13;13;7;30000;0;18;13;1;1;0;-1;0;1;1;1;1;0;0;0;0
Intel(R) Data Center GPU Max 1550 [0x0bd5];3;13;13;13;30000;0;8;13;1;6;0;-1;2;0;1;0;1;1;3;0;0
Intel(R) Data Center GPU Max 1550 [0x0bd5];3;13;13;17;30000;0;8;13;1;1;0;-1;0;1;1;0;1;1;0;0;0
Intel(R) Data Center GPU Max 1550 [0x0bd5];3;13;13;32;30000;0;8;13;1;1;0;-2;0;1;1;0;1;1;0;3;0
Intel(R) Data Center GPU Max 1550 [0x0bd5];3;13;16;5;30000;0;21;13;1;2;0;-2;0;1;1;0;1;1;0;1;1
Intel(R) Data Center GPU Max 1550 [0x0bd5];3;13;17;4;30000;0;22;13;1;3;0;-1;-2;1;1;0;1;0;0;3;1
Intel(R) Data Center GPU Max 1550 [0x0bd5];3;13;17;5;30000;0;20;13;1;9;0;0;0;1;1;1;1;0;1;0;0
Intel(R) Data Center GPU Max 1550 [0x0bd5];3;13;17;13;30000;0;16;13;1;4;0;0;-1;1;1;0;1;0;3;3;2
Intel(R) Data Center GPU Max 1550 [0x0bd5];3;13;17;17;30000;0;8;13;1;2;0;-1;-1;0;1;0;1;0;3;3;1
Intel(R) Data Center GPU Max 1550 [0x0bd5];3;13;17;32;30000;0;9;13;1;1;0;0;2;1;1;1;1;1;3;0;2
Intel(R) Data Center GPU Max 1550 [0x0bd5];3;13;24;5;30000;0;23;13;1;6;0;1;-1;1;1;1;1;0;1;0;0
Intel(R) Data Center GPU Max 1550 [0x0bd5];3;13;26;5;30000;0;18;13;1;6;0;0;-1;1;1;0;1;0;1;0;0
Intel(R) Data Center GPU Max 1550 [0x0bd5];3;13;32;4;30000;0;25;13;1;11;0;0;0;1;1;0;1;1;2;1;0
Intel(R) Data Center GPU Max 1550 [0x0bd5];3;13;32;5;30000;0;29;13;1;6;0;1;-2;1;1;0;1;0;2;0;0
Intel(R) Data Center GPU Max 1550 [0x0bd5];3;13;32;13;30000;0;9;13;1;1;0;-2;2;0;1;0;1;0;0;0;0
Intel(R) Data Center GPU Max 1550 [0x0bd5];3;13;32;17;30000;0;8;13;1;1;0;-2;1;0;1;0;1;0;0;0;0
Intel(R) Data Center GPU Max 1550 [0x0bd5];3;13;32;32;30000;0;21;13;1;1;0;0;0;1;0;0;1;1;3;0;2
Intel(R) Data Center GPU Max 1550 [0x0bd5];3;15;4;4;30000;0;14;15;1;1;0;-2;2;0;1;1;1;0;3;0;2
Intel(R) Data Center GPU Max 1550 [0x0bd5];3;15;15;15;30000;0;8;15;1;12;0;-1;-1;0;1;0;1;1;0;3;0
Intel(R) Data Center GPU Max 1550 [0x0bd5];3;16;5;5;30000;0;17;16;1;13;0;-2;-2;0;1;0;1;0;0;0;0
Intel(R) Data Center GPU Max 1550 [0x0bd5];3;16;5;13;30000;0;9;16;1;16;0;-2;-2;0;1;0;1;0;3;3;2
Intel(R) Data Center GPU Max 1550 [0x0bd5];3;16;5;16;30000;0;9;16;1;9;0;-2;0;0;1;0;1;0;3;0;1
Intel(R) Data Center GPU Max 1550 [0x0bd5];3;16;5;24;30000;0;8;16;1;14;0;-1;0;1;1;1;1;0;3;1;1
Intel(R) Data Center GPU Max 1550 [0x0bd5];3;16;5;26;30000;0;8;16;1;14;0;-2;0;1;1;0;1;0;0;3;1
Intel(R) Data Center GPU Max 1550 [0x0bd5];3;16;7;3;30000;0;23;16;1;5;0;-1;-2;0;1;1;1;1;0;2;0
Intel(R) Data Center GPU Max 1550 [0x0bd5];3;16;9;9;30000;0;14;16;1;8;0;-1;-1;0;1;0;1;0;2;1;0
Intel(R) Data Center GPU Max 1550 [0x0bd5];3;16;9;16;30000;0;9;16;1;11;0;-1;0;0;1;0;1;1;0;3;2
Intel(R) Data Center GPU Max 1550 [0x0bd5];3;16;9;22;30000;0;6;16;1;10;0;0;0;0;1;0;1;1;3;1;2
Intel(R) Data Center GPU Max 1550 [0x0bd5];3;16;13;5;30000;0;20;16;1;10;0;-1;0;1;1;0;1;1;3;3;0
Intel(R) Data Center GPU Max 1550 [0x0bd5];3;16;16;5;30000;0;32;16;1;1;0;-2;2;1;1;0;1;0;0;0;0
Intel(R) Data Center GPU Max 1550 [0x0bd5];3;16;16;9;30000;0;21;16;1;13;0;-1;-1;0;1;1;1;0;1;3;2
Intel(R) Data Center GPU Max 1550 [0x0bd5];3;16;16;16;30000;0;8;16;1;5;0;-2;2;0;1;0;1;0;0;3;0
Intel(R) Data Center GPU Max 1550 [0x0bd5];3;16;16;22;30000;0;21;16;1;1;0;-1;0;1;1;1;1;0;0;3;0
Intel(R) Data Center GPU Max 1550 [0x0bd5];3;16;22;9;30000;0;9;16;1;5;0;-2;2;0;1;1;1;0;2;3;0
Intel(R) Data Center GPU Max 1550 [0x0bd5];3;16;22;16;30000;0;9;16;1;1;0;1;1;1;1;1;1;0;3;0;0
Intel(R) Data Center GPU Max 1550 [0x0bd5];3;16;22;22;30000;0;11;16;1;15;0;0;-2;0;1;0;1;1;3;1;1
Intel(R) Data Center GPU Max 1550 [0x0bd5];3;16;24;5;30000;0;18;16;1;13;0;-2;-2;1;1;1;1;0;0;3;0
Intel(R) Data Center GPU Max 1550 [0x0bd5];3;16;26;5;30000;0;19;16;1;7;0;1;-2;1;1;0;1;0;3;3;0
Intel(R) Data Center GPU Max 1550 [0x0bd5];3;17;4;4;30000;0;16;17;1;7;0;-1;-1;0;1;0;1;0;0;3;0
Intel(R) Data Center GPU Max 1550 [0x0bd5];3;17;4;5;30000;0;14;17;1;2;0;-1;1;0;1;0;1;1;3;3;0
Intel(R) Data Center GPU Max 1550 [0x0bd5];3;17;4;13;30000;0;9;17;1;6;0;-1;0;1;1;0;1;0;3;2;0
Intel(R) Data Center GPU Max 1550 [0x0bd5];3;17;4;17;30000;0;8;17;1;10;0;-2;0;1;1;0;1;0;0;0;0
Intel(R) Data Center GPU Max 1550 [0x0bd5];3;17;4;32;30000;0;8;17;1;1;0;-2;2;0;1;0;1;1;0;0;1
Intel(R) Data Center GPU Max 1550 [0x0bd5];3;17;5;4;30000;0;17;17;1;10;0;-1;-2;0;1;0;1;0;3;0;0
Intel(R) Data Center GPU Max 1550 [0x0bd5];3;17;5;5;30000;0;16;17;1;15;0;-2;-2;1;1;0;1;0;3;3;0
Intel(R) Data Center GPU Max 1550 [0x0bd5];3;17;5;13;30000;0;15;17;1;10;0;-1;-2;0;1;0;1;0;0;2;0
Intel(R) Data Center GPU Max 1550 [0x0bd5];3;17;5;17;30000;0;8;17;1;10;0;-1;-2;0;1;1;1;0;0;3;1
Intel(R) Data Center GPU Max 1550 [0x0bd5];3;17;5;32;30000;0;8;17;1;1;0;-1;-2;1;1;0;1;0;0;0;0
Intel(R) Data Center GPU Max 1550 [0x0bd5];3;17;13;4;30000;0;15;17;1;16;0;1;-2;1;1;1;1;0;0;3;2
Intel(R) Data Center GPU Max 1550 [0x0bd5];3;17;13;5;30000;0;19;17;1;2;0;-1;0;1;1;0;1;0;3;3;0
Intel(R) Data Center GPU Max 1550 [0x0bd5];3;17;13;13;30000;0;14;17;1;7;0;-1;-2;0;1;0;1;1;0;3;1
Intel(R) Data Center GPU Max 1550 [0x0bd5];3;17;13;17;30000;0;8;17;1;16;0;-1;0;1;1;0;1;1;0;2;0
Intel(R) Data Center GPU Max 1550 [0x0bd5];3;17;13;32;30000;0;8;17;1;1;0;-1;-2;1;1;0;1;1;0;0;0
Intel(R) Data Center GPU Max 1550 [0x0bd5];3;17;17;4;30000;0;21;17;1;11;0;1;-2;0;1;1;1;0;3;0;2
Intel(R) Data Center GPU Max 1550 [0x0bd5];3;17;17;5;30000;0;22;17;1;7;0;-2;2;0;1;0;1;0;2;0;1
Intel(R) Data Center GPU Max 1550 [0x0bd5];3;17;17;13;30000;0;41;17;1;7;0;0;-2;0;1;0;1;0;2;0;1
Intel(R) Data Center GPU Max 1550 [0x0bd5];3;17;17;17;30000;0;4;17;1;6;0;1;-1;0;1;0;1;1;3;3;0
Intel(R) Data Center GPU Max 1550 [0x0bd5];3;17;17;32;30000;0;8;17;1;4;0;-2;2;1;1;0;1;0;3;2;1
Intel(R) Data Center GPU Max 1550 [0x0bd5];3;17;32;4;30000;0;26;17;1;12;0;0;-2;1;1;0;1;1;2;0;0
Intel(R) Data Center GPU Max 1550 [0x0bd5];3;17;32;5;30000;0;21;17;1;11;0;-1;-2;1;1;0;1;1;3;3;0
Intel(R) Data Center GPU Max 1550 [0x0bd5];3;17;32;13;30000;0;22;17;1;5;0;-1;2;0;1;0;1;0;3;3;0
Intel(R) Data Center GPU Max 1550 [0x0bd5];3;17;32;17;30000;0;41;17;1;11;0;-1;1;1;1;0;1;1;1;0;1
Intel(R) Data Center GPU Max 1550 [0x0bd5];3;17;32;32;30000;0;11;17;1;1;0;0;1;1;0;1;1;1;3;0;0
Intel(R) Data Center GPU Max 1550 [0x0bd5];3;20;20;20;30000;0;3;20;1;16;0;-1;0;1;1;1;1;1;3;0;2
Intel(R) Data Center GPU Max 1550 [0x0bd5];3;22;9;9;30000;0;9;22;1;6;0;-1;0;1;1;0;1;0;0;3;1
Intel(R) Data Center GPU Max 1550 [0x0bd5];3;22;9;16;30000;0;23;22;1;11;0;-1;2;0;1;0;1;1;1;3;0
Intel(R) Data Center GPU Max 1550 [0x0bd5];3;22;9;22;30000;0;8;22;1;11;0;-1;2;0;1;0;1;1;3;0;2
Intel(R) Data Center GPU Max 1550 [0x0bd5];3;22;9;32;30000;0;8;22;1;1;0;-1;2;0;1;0;1;1;0;0;2
Intel(R) Data Center GPU Max 1550 [0x0bd5];3;22;16;9;30000;0;19;22;1;4;0;-2;2;1;1;1;1;0;1;3;0
Intel(R) Data Center GPU Max 1550 [0x0bd5];3;22;16;16;30000;0;9;22;1;21;0;-2;0;0;1;1;1;1;0;0;1
Intel(R) Data Center GPU Max 1550 [0x0bd5];3;22;16;22;30000;0;9;22;1;10;0;-2;-1;0;1;0;1;1;0;0;2
Intel(R) Data Center GPU Max 1550 [0x0bd5];3;22;22;9;30000;0;42;22;1;11;0;0;2;0;1;0;1;0;1;3;1
Intel(R) Data Center GPU Max 1550 [0x0bd5];3;22;22;16;30000;0;15;22;1;1;0;-1;1;0;1;0;1;0;0;0;0
Intel(R) Data Center GPU Max 1550 [0x0bd5];3;22;22;22;30000;0;15;22;1;1;0;-2;0;0;0;1;1;0;0;0;1
Intel(R) Data Center GPU Max 1550 [0x0bd5];3;22;22;32;30000;0;16;22;1;1;0;-1;0;1;0;0;1;1;0;0;1
Intel(R) Data Center GPU Max 1550 [0x0bd5];3;22;32;9;30000;0;30;22;1;14;0;-2;0;1;0;1;1;0;0;3;0
Intel(R) Data Center GPU Max 1550 [0x0bd5];3;22;32;22;30000;0;15;22;1;21;0;0;0;1;0;0;1;0;1;3;0
Intel(R) Data Center GPU Max 1550 [0x0bd5];3;22;32;32;30000;0;8;22;1;1;0;-1;1;1;1;0;1;0;1;0;0
Intel(R) Data Center GPU Max 1550 [0x0bd5];3;23;23;23;30000;0;8;23;1;1;0;-1;1;1;0;0;1;0;0;0;0
Intel(R) Data Center GPU Max 1550 [0x0bd5];3;24;5;5;30000;0;16;24;1;11;0;-2;2;1;0;1;1;1;0;0;0
Intel(R) Data Center GPU Max 1550 [0x0bd5];3;24;5;13;30000;0;8;24;1;6;0;-1;0;0;1;1;1;1;3;2;1
Intel(R) Data Center GPU Max 1550 [0x0bd5];3;24;5;16;30000;0;8;24;1;14;0;-1;0;0;1;0;1;1;3;3;2
Intel(R) Data Center GPU Max 1550 [0x0bd5];3;24;13;5;30000;0;19;24;1;13;0;-2;-2;1;1;0;1;0;3;0;0
Intel(R) Data Center GPU Max 1550 [0x0bd5];3;24;16;5;30000;0;27;24;1;1;0;-1;0;0;1;0;1;0;0;0;0
Intel(R) Data Center GPU Max 1550 [0x0bd5];3;24;24;24;30000;0;13;24;1;13;0;0;-2;0;0;0;1;0;2;3;1
Intel(R) Data Center GPU Max 1550 [0x0bd5];3;24;24;26;30000;0;11;24;1;9;0;0;0;0;0;0;1;1;1;3;0
Intel(R) Data Center GPU Max 1550 [0x0bd5];3;24;24;32;30000;0;8;24;1;1;0;-1;1;0;1;1;1;1;0;0;0
Intel(R) Data Center GPU Max 1550 [0x0bd5];3;24;26;24;30000;0;8;24;1;1;0;-2;1;1;0;0;1;1;2;0;0
Intel(R) Data Center GPU Max 1550 [0x0bd5];3;24;26;26;30000;0;11;24;1;24;0;-1;0;0;0;0;1;1;2;3;0
Intel(R) Data Center GPU Max 1550 [0x0bd5];3;24;26;32;30000;0;8;24;1;1;0;-1;1;0;0;1;1;0;1;0;0
Intel(R) Data Center GPU Max 1550 [0x0bd5];3;24;32;24;30000;0;11;24;1;6;0;1;-1;0;0;1;1;0;1;0;0
Intel(R) Data Center GPU Max 1550 [0x0bd5];3;24;32;26;30000;0;9;24;1;15;0;-2;-1;0;0;0;1;1;2;0;2
Intel(R) Data Center GPU Max 1550 [0x0bd5];3;24;32;32;30000;0;17;24;1;21;0;0;0;0;0;0;1;1;1;3;1
Intel(R) Data Center GPU Max 1550 [0x0bd5];3;25;4;4;30000;0;15;25;1;9;0;-1;-2;1;1;0;1;1;0;1;0
Intel(R) Data Center GPU Max 1550 [0x0bd5];3;25;4;5;30000;0;12;25;1;4;0;-1;1;0;1;0;1;0;0;3;2
Intel(R) Data Center GPU Max 1550 [0x0bd5];3;25;5;4;30000;0;16;25;1;18;0;-2;-1;0;1;0;1;0;0;0;0
Intel(R) Data Center GPU Max 1550 [0x0bd5];3;25;25;25;30000;0;8;25;1;1;0;-1;1;1;0;0;1;0;0;0;0
Intel(R) Data Center GPU Max 1550 [0x0bd5];3;26;4;4;30000;0;15;26;1;15;0;-1;0;0;1;1;1;1;0;3;0
Intel(R) Data Center GPU Max 1550 [0x0bd5];3;26;5;5;30000;0;14;26;1;6;0;-1;0;0;0;0;1;0;0;3;0
Intel(R) Data Center GPU Max 1550 [0x0bd5];3;26;5;13;30000;0;15;26;1;16;0;-1;0;0;0;1;1;0;3;3;0
Intel(R) Data Center GPU Max 1550 [0x0bd5];3;26;5;16;30000;0;15;26;1;15;0;-1;-2;0;0;0;1;0;3;3;0
Intel(R) Data Center GPU Max 1550 [0x0bd5];3;26;13;5;30000;0;20;26;1;3;0;-2;2;1;1;1;1;0;0;0;0
Intel(R) Data Center GPU Max 1550 [0x0bd5];3;26;16;5;30000;0;22;26;1;8;0;-2;1;1;1;0;1;1;3;2;0
Intel(R) Data Center GPU Max 1550 [0x0bd5];3;26;24;24;30000;0;11;26;1;23;0;-2;-2;1;0;0;1;0;2;3;0
Intel(R) Data Center GPU Max 1550 [0x0bd5];3;26;24;26;30000;0;8;26;1;1;0;-2;1;0;0;1;1;1;1;0;0
Intel(R) Data Center GPU Max 1550 [0x0bd5];3;26;24;32;30000;0;5;26;1;15;0;-1;0;1;0;0;1;1;1;3;1
Intel(R) Data Center GPU Max 1550 [0x0bd5];3;26;26;24;30000;0;8;26;1;1;0;-1;1;0;1;0;1;0;0;0;0
Intel(R) Data Center GPU Max 1550 [0x0bd5];3;26;26;26;30000;0;14;26;1;1;0;-2;1;1;0;1;1;0;0;0;0
Intel(R) Data Center GPU Max 1550 [0x0bd5];3;26;26;32;30000;0;15;26;1;1;0;1;1;1;0;1;1;1;3;3;0
Intel(R) Data Center GPU Max 1550 [0x0bd5];3;26;32;24;30000;0;8;26;1;14;0;-1;0;1;0;0;1;1;2;3;0
Intel(R) Data Center GPU Max 1550 [0x0bd5];3;26;32;26;30000;0;12;26;1;25;0;0;-2;1;0;0;1;1;1;3;0
Intel(R) Data Center GPU Max 1550 [0x0bd5];3;26;32;32;30000;0;15;26;1;1;0;0;1;1;0;0;1;1;0;3;0
Intel(R) Data Center GPU Max 1550 [0x0bd5];3;28;4;4;30000;0;11;28;1;28;0;-1;-2;1;1;1;1;1;0;2;0
Intel(R) Data Center GPU Max 1550 [0x0bd5];3;28;28;28;30000;0;15;28;1;1;0;0;2;0;0;0;1;1;3;0;0
Intel(R) Data Center GPU Max 1550 [0x0bd5];3;30;30;30;30000;0;9;30;1;1;0;-1;1;1;0;0;1;0;0;0;0
Intel(R) Data Center GPU Max 1550 [0x0bd5];3;32;4;4;30000;0;12;32;1;22;0;-1;0;0;0;0;1;0;0;1;0
Intel(R) Data Center GPU Max 1550 [0x0bd5];3;32;4;5;30000;0;8;32;1;22;0;-1;-1;0;0;0;1;0;3;0;0
Intel(R) Data Center GPU Max 1550 [0x0bd5];3;32;4;13;30000;0;8;32;1;1;0;-1;-1;0;0;0;1;0;3;0;2
Intel(R) Data Center GPU Max 1550 [0x0bd5];3;32;4;17;30000;0;8;32;1;1;0;-2;-1;0;0;0;1;0;3;2;0
Intel(R) Data Center GPU Max 1550 [0x0bd5];3;32;4;32;30000;0;8;32;1;1;0;-1;-2;0;0;0;1;0;0;0;0
Intel(R) Data Center GPU Max 1550 [0x0bd5];3;32;5;4;30000;0;13;32;1;4;0;-1;-1;0;1;0;1;1;0;0;0
Intel(R) Data Center GPU Max 1550 [0x0bd5];3;32;5;5;30000;0;12;32;1;9;0;-1;-1;0;1;0;1;0;0;2;0
Intel(R) Data Center GPU Max 1550 [0x0bd5];3;32;5;13;30000;0;9;32;1;22;0;-2;-2;0;1;0;1;0;3;0;2
Intel(R) Data Center GPU Max 1550 [0x0bd5];3;32;5;17;30000;0;8;32;1;22;0;-1;2;0;1;1;1;1;0;3;1
Intel(R) Data Center GPU Max 1550 [0x0bd5];3;32;5;32;30000;0;8;32;1;20;0;-1;-1;1;1;0;1;1;0;0;2
Intel(R) Data Center GPU Max 1550 [0x0bd5];3;32;13;4;30000;0;22;32;1;3;0;-1;1;0;1;0;1;0;1;3;0
Intel(R) Data Center GPU Max 1550 [0x0bd5];3;32;13;5;30000;0;22;32;1;18;0;-1;-1;0;1;1;1;1;0;1;0
Intel(R) Data Center GPU Max 1550 [0x0bd5];3;32;13;13;30000;0;21;32;1;30;0;-1;0;1;1;0;1;1;0;3;2
Intel(R) Data Center GPU Max 1550 [0x0bd5];3;32;13;17;30000;0;9;32;1;10;0;-2;2;1;1;0;1;1;0;3;2
Intel(R) Data Center GPU Max 1550 [0x0bd5];3;32;13;32;30000;0;9;32;1;19;0;-2;2;0;1;1;1;0;3;3;2
Intel(R) Data Center GPU Max 1550 [0x0bd5];3;32;17;4;30000;0;41;32;1;30;0;0;-1;0;1;1;1;1;0;0;2
Intel(R) Data Center GPU Max 1550 [0x0bd5];3;32;17;5;30000;0;44;32;1;15;0;-2;2;0;1;1;1;0;1;0;2
Intel(R) Data Center GPU Max 1550 [0x0bd5];3;32;17;13;30000;0;12;32;1;14;0;0;1;0;1;0;1;0;1;0;2
Intel(R) Data Center GPU Max 1550 [0x0bd5];3;32;17;17;30000;0;16;32;1;20;0;1;-1;0;1;1;1;1;2;2;2
Intel(R) Data Center GPU Max 1550 [0x0bd5];3;32;17;32;30000;0;2;32;1;1;0;-2;0;0;0;0;1;0;0;0;0
Intel(R) Data Center GPU Max 1550 [0x0bd5];3;32;24;24;30000;0;15;32;1;1;0;0;1;0;0;0;1;1;3;0;0
Intel(R) Data Center GPU Max 1550 [0x0bd5];3;32;24;26;30000;0;16;32;1;1;0;1;1;1;0;0;1;0;3;0;0
Intel(R) Data Center GPU Max 1550 [0x0bd5];3;32;24;32;30000;0;15;32;1;1;0;0;1;1;0;0;1;0;3;0;0
Intel(R) Data Center GPU Max 1550 [0x0bd5];3;32;26;24;30000;0;15;32;1;1;0;1;1;0;0;1;1;1;0;0;0
Intel(R) Data Center GPU Max 1550 [0x0bd5];3;32;26;26;30000;0;15;32;1;1;0;-2;1;0;0;1;1;1;3;0;0
Intel(R) Data Center GPU Max 1550 [0x0bd5];3;32;26;32;30000;0;15;32;1;1;0;-2;1;0;0;1;1;1;3;0;0
Intel(R) Data Center GPU Max 1550 [0x0bd5];3;32;32;4;30000;0;17;32;1;19;0;-1;-2;0;1;1;1;1;2;1;2
Intel(R) Data Center GPU Max 1550 [0x0bd5];3;32;32;5;30000;0;23;32;1;15;0;-2;0;0;1;0;1;1;3;3;0
Intel(R) Data Center GPU Max 1550 [0x0bd5];3;32;32;9;30000;0;26;32;1;2;0;0;-1;1;0;1;1;0;2;0;0
Intel(R) Data Center GPU Max 1550 [0x0bd5];3;32;32;13;30000;0;13;32;1;7;0;-2;2;0;1;1;1;1;2;0;2
Intel(R) Data Center GPU Max 1550 [0x0bd5];3;32;32;17;30000;0;11;32;1;1;0;-1;1;1;1;1;1;0;0;0;0
Intel(R) Data Center GPU Max 1550 [0x0bd5];3;32;32;22;30000;0;11;32;1;1;0;-1;1;0;1;1;1;1;0;0;0
Intel(R) Data Center GPU Max 1550 [0x0bd5];3;32;32;24;30000;0;8;32;1;1;0;-2;1;0;1;0;1;1;0;0;0
Intel(R) Data Center GPU Max 1550 [0x0bd5];3;32;32;26;30000;0;9;32;1;1;0;-2;1;1;0;0;1;1;0;0;0
Intel(R) Data Center GPU Max 1550 [0x0bd5];3;32;32;32;30000;0;8;32;1;1;0;-1;1;0;0;0;1;0;0;0;0
Intel(R) Data Center GPU Max 1550 [0x0bd5];3;35;35;35;30000;0;30;35;1;1;0;0;2;1;0;1;1;1;0;0;0
Intel(R) Data Center GPU Max 1550 [0x0bd5];3;36;36;36;30000;0;9;2;3;1;0;1;1;1;0;0;1;0;0;1;0
Intel(R) Data Center GPU Max 1550 [0x0bd5];3;40;40;40;30000;0;8;5;1;1;0;0;1;1;0;0;1;1;1;0;0
Intel(R) Data Center GPU Max 1550 [0x0bd5];3;45;45;45;30000;0;11;45;1;1;0;0;1;1;0;1;1;0;2;3;0
