src/acc/opencl/smm/params/tune_multiply_A100-80GB.csv
DEVICE;TYPEID;M;N;K;S;GFLOPS;BS;BM;BN;BK;WS;WG;LU;NZ;AL;TB;TC;AP;AA;AB;AC
NVIDIA A100 80GB PCIe [0x1f79];3;2;2;2;30000;0;9;1;2;2;0;1;0;1;0;0;1;0;0;0;0
NVIDIA A100 80GB PCIe [0x1f79];3;3;3;3;30000;0;9;1;1;2;0;0;1;0;0;0;1;1;0;3;0
NVIDIA A100 80GB PCIe [0x1f79];3;4;4;4;30000;0;10;1;1;1;0;-1;-2;1;0;0;1;1;3;3;0
NVIDIA A100 80GB PCIe [0x1f79];3;4;4;5;30000;0;10;1;1;1;0;-1;1;0;0;1;1;0;0;0;2
NVIDIA A100 80GB PCIe [0x1f79];3;4;4;7;30000;0;19;4;1;2;0;-1;0;0;0;1;1;0;1;3;0
NVIDIA A100 80GB PCIe [0x1f79];3;4;4;9;30000;0;6;1;2;3;0;0;-2;1;0;1;1;0;3;2;1
NVIDIA A100 80GB PCIe [0x1f79];3;4;4;10;30000;0;6;1;1;1;0;1;0;1;0;0;1;1;3;3;0
NVIDIA A100 80GB PCIe [0x1f79];3;4;4;13;30000;0;10;1;1;2;0;-1;0;1;0;1;1;0;3;0;2
NVIDIA A100 80GB PCIe [0x1f79];3;4;4;15;30000;0;22;1;1;3;0;-2;1;1;0;0;0;1;0;0;0
NVIDIA A100 80GB PCIe [0x1f79];3;4;4;25;30000;0;14;1;1;2;0;0;1;0;0;0;1;0;0;3;0
NVIDIA A100 80GB PCIe [0x1f79];3;4;4;26;30000;0;4;1;1;2;0;0;-1;1;0;1;1;0;0;2;0
NVIDIA A100 80GB PCIe [0x1f79];3;4;4;28;30000;0;20;1;1;3;0;0;0;0;0;0;1;0;0;3;0
NVIDIA A100 80GB PCIe [0x1f79];3;4;4;32;30000;0;18;1;1;3;0;-1;1;0;0;0;0;1;3;0;0
NVIDIA A100 80GB PCIe [0x1f79];3;4;5;4;30000;0;10;1;1;3;0;-1;-2;0;0;0;1;0;3;0;0
NVIDIA A100 80GB PCIe [0x1f79];3;4;5;5;30000;0;9;1;1;3;0;1;-1;1;0;1;1;0;3;3;0
NVIDIA A100 80GB PCIe [0x1f79];3;4;5;7;30000;0;12;1;1;4;0;1;-1;1;0;1;1;1;3;3;0
NVIDIA A100 80GB PCIe [0x1f79];3;4;5;9;30000;0;6;1;3;4;0;1;1;1;0;1;1;0;3;1;0
NVIDIA A100 80GB PCIe [0x1f79];3;4;5;13;30000;0;21;1;1;3;0;-1;-2;1;0;1;1;0;3;0;0
NVIDIA A100 80GB PCIe [0x1f79];3;4;5;25;30000;0;6;1;1;3;0;0;-1;0;0;0;0;0;0;0;2
NVIDIA A100 80GB PCIe [0x1f79];3;4;7;4;30000;0;10;1;1;3;0;2;0;1;0;1;1;1;3;3;0
NVIDIA A100 80GB PCIe [0x1f79];3;4;7;5;30000;0;9;1;1;1;0;1;-2;1;0;1;1;0;0;3;0
NVIDIA A100 80GB PCIe [0x1f79];3;4;7;7;30000;0;10;1;1;1;0;-1;-1;0;0;1;1;1;3;3;0
NVIDIA A100 80GB PCIe [0x1f79];3;4;7;9;30000;0;17;1;1;2;0;0;1;0;0;1;0;1;3;3;0
NVIDIA A100 80GB PCIe [0x1f79];3;4;7;13;30000;0;16;2;1;4;0;-2;-1;1;0;1;1;0;3;3;0
NVIDIA A100 80GB PCIe [0x1f79];3;4;9;4;30000;0;11;1;2;4;0;1;-2;0;0;0;1;1;3;3;0
NVIDIA A100 80GB PCIe [0x1f79];3;4;9;5;30000;0;19;2;1;1;0;-1;-1;1;0;0;1;1;3;1;0
NVIDIA A100 80GB PCIe [0x1f79];3;4;9;7;30000;0;14;4;1;4;0;0;-1;0;0;0;1;0;1;0;0
NVIDIA A100 80GB PCIe [0x1f79];3;4;9;9;30000;0;13;1;1;4;0;1;-2;0;0;0;1;0;0;3;0
NVIDIA A100 80GB PCIe [0x1f79];3;4;9;13;30000;0;9;3;1;4;0;-1;0;0;0;0;1;1;0;3;0
NVIDIA A100 80GB PCIe [0x1f79];3;4;10;4;30000;0;15;3;1;2;0;1;1;0;0;0;1;0;0;3;0
NVIDIA A100 80GB PCIe [0x1f79];3;4;10;10;30000;0;15;4;1;2;0;1;0;0;0;0;1;1;2;3;0
NVIDIA A100 80GB PCIe [0x1f79];3;4;13;4;30000;0;19;4;1;2;0;1;-2;0;0;1;1;0;0;0;0
NVIDIA A100 80GB PCIe [0x1f79];3;4;13;5;30000;0;17;2;1;1;0;0;-2;0;0;0;1;0;0;3;0
NVIDIA A100 80GB PCIe [0x1f79];3;4;13;7;30000;0;14;2;1;1;0;2;0;0;0;0;1;0;3;0;0
NVIDIA A100 80GB PCIe [0x1f79];3;4;13;9;30000;0;7;2;1;3;0;-2;-2;1;0;1;1;1;0;0;0
NVIDIA A100 80GB PCIe [0x1f79];3;4;15;4;30000;0;20;2;1;1;0;0;-2;0;0;1;1;0;3;0;0
NVIDIA A100 80GB PCIe [0x1f79];3;4;25;4;30000;0;23;4;1;1;0;0;0;0;0;0;1;1;0;3;0
NVIDIA A100 80GB PCIe [0x1f79];3;4;25;5;30000;0;21;4;1;2;0;0;0;0;0;0;1;0;3;3;2
NVIDIA A100 80GB PCIe [0x1f79];3;4;26;4;30000;0;22;4;1;1;0;0;0;1;0;0;1;1;0;3;0
NVIDIA A100 80GB PCIe [0x1f79];3;4;28;4;30000;0;20;4;1;1;0;-1;0;0;0;0;1;1;0;3;0
NVIDIA A100 80GB PCIe [0x1f79];3;4;32;4;30000;0;25;4;1;1;0;1;0;1;0;0;1;0;3;0;0
NVIDIA A100 80GB PCIe [0x1f79];3;5;4;4;30000;0;11;1;1;3;0;0;-2;1;0;0;1;0;0;3;0
NVIDIA A100 80GB PCIe [0x1f79];3;5;4;5;30000;0;9;1;1;2;0;-1;0;0;0;0;1;0;0;0;0
NVIDIA A100 80GB PCIe [0x1f79];3;5;4;7;30000;0;12;1;1;1;0;1;-1;1;0;0;1;1;3;3;0
NVIDIA A100 80GB PCIe [0x1f79];3;5;4;9;30000;0;12;1;1;4;0;-1;-2;0;0;0;1;0;0;0;0
NVIDIA A100 80GB PCIe [0x1f79];3;5;4;13;30000;0;12;1;1;5;0;1;-2;0;0;1;1;0;0;3;0
NVIDIA A100 80GB PCIe [0x1f79];3;5;4;25;30000;0;27;1;1;4;0;1;-2;0;0;0;0;0;3;0;1
NVIDIA A100 80GB PCIe [0x1f79];3;5;5;4;30000;0;11;1;1;5;0;1;-1;0;0;0;1;1;3;3;0
NVIDIA A100 80GB PCIe [0x1f79];3;5;5;5;30000;0;10;1;1;3;0;-2;1;0;0;0;1;0;0;0;2
NVIDIA A100 80GB PCIe [0x1f79];3;5;5;7;30000;0;9;1;1;5;0;1;-1;0;0;0;1;0;0;3;0
NVIDIA A100 80GB PCIe [0x1f79];3;5;5;9;30000;0;25;1;1;4;0;1;-2;0;0;1;1;0;3;3;2
NVIDIA A100 80GB PCIe [0x1f79];3;5;5;13;30000;0;10;2;1;4;0;1;-1;0;0;1;1;1;3;0;0
NVIDIA A100 80GB PCIe [0x1f79];3;5;7;4;30000;0;11;2;1;3;0;1;0;0;0;1;1;0;0;0;0
NVIDIA A100 80GB PCIe [0x1f79];3;5;7;5;30000;0;16;5;1;5;0;-1;0;1;0;1;1;0;1;0;0
NVIDIA A100 80GB PCIe [0x1f79];3;5;7;7;30000;0;19;2;1;4;0;0;-2;1;0;0;1;1;0;3;2
NVIDIA A100 80GB PCIe [0x1f79];3;5;7;9;30000;0;12;1;2;4;0;-2;0;0;0;0;1;1;3;3;1
NVIDIA A100 80GB PCIe [0x1f79];3;5;7;13;30000;0;20;1;2;5;0;1;-1;1;0;1;1;1;3;3;2
NVIDIA A100 80GB PCIe [0x1f79];3;5;9;4;30000;0;15;1;2;4;0;0;-1;0;0;1;1;1;3;0;0
NVIDIA A100 80GB PCIe [0x1f79];3;5;9;5;30000;0;34;2;1;2;0;1;-2;0;0;1;1;0;3;3;0
NVIDIA A100 80GB PCIe [0x1f79];3;5;9;7;30000;0;15;5;1;2;0;1;1;1;0;0;1;1;0;3;0
NVIDIA A100 80GB PCIe [0x1f79];3;5;9;9;30000;0;25;1;2;2;0;0;1;0;0;1;1;1;3;1;1
NVIDIA A100 80GB PCIe [0x1f79];3;5;13;4;30000;0;20;5;1;1;0;0;0;0;0;0;1;1;0;0;0
NVIDIA A100 80GB PCIe [0x1f79];3;5;13;5;30000;0;14;1;3;1;0;1;0;1;0;0;1;1;3;0;0
NVIDIA A100 80GB PCIe [0x1f79];3;5;13;7;30000;0;24;3;1;2;0;1;0;1;0;0;1;1;0;3;0
NVIDIA A100 80GB PCIe [0x1f79];3;5;13;13;30000;0;11;5;1;1;0;0;0;0;0;0;1;0;3;0;0
NVIDIA A100 80GB PCIe [0x1f79];3;5;25;4;30000;0;30;5;1;1;0;1;-2;0;0;0;1;1;0;0;1
NVIDIA A100 80GB PCIe [0x1f79];3;6;6;6;30000;0;18;6;1;3;0;0;1;0;0;0;1;0;1;0;0
NVIDIA A100 80GB PCIe [0x1f79];3;6;6;7;30000;0;19;2;1;6;0;1;-1;0;0;0;1;0;0;3;0
NVIDIA A100 80GB PCIe [0x1f79];3;6;6;8;30000;0;15;6;1;3;0;1;1;0;0;0;1;0;2;3;0
NVIDIA A100 80GB PCIe [0x1f79];3;6;7;6;30000;0;28;2;1;1;0;-2;-2;0;0;0;1;0;3;0;1
NVIDIA A100 80GB PCIe [0x1f79];3;6;7;7;30000;0;12;1;2;1;0;0;1;1;0;0;1;0;1;3;0
NVIDIA A100 80GB PCIe [0x1f79];3;6;7;8;30000;0;15;2;1;6;0;-1;1;0;0;0;1;0;3;3;2
NVIDIA A100 80GB PCIe [0x1f79];3;6;8;6;30000;0;14;3;1;2;0;0;0;0;0;0;1;1;1;0;0
NVIDIA A100 80GB PCIe [0x1f79];3;6;8;7;30000;0;32;1;2;4;0;-1;0;0;0;1;1;1;0;0;0
NVIDIA A100 80GB PCIe [0x1f79];3;6;8;8;30000;0;23;1;2;5;0;-1;0;1;0;1;0;0;0;0;1
NVIDIA A100 80GB PCIe [0x1f79];3;7;4;4;30000;0;9;1;1;6;0;0;0;0;0;0;1;0;0;0;0
NVIDIA A100 80GB PCIe [0x1f79];3;7;4;5;30000;0;15;1;1;7;0;-2;0;0;0;1;1;1;3;0;0
NVIDIA A100 80GB PCIe [0x1f79];3;7;4;7;30000;0;24;1;1;4;0;-1;0;0;0;0;1;0;0;0;0
NVIDIA A100 80GB PCIe [0x1f79];3;7;4;9;30000;0;14;1;1;6;0;1;-1;0;0;0;1;0;0;0;0
NVIDIA A100 80GB PCIe [0x1f79];3;7;4;13;30000;0;15;1;4;2;0;-1;-1;0;0;0;1;1;0;2;0
NVIDIA A100 80GB PCIe [0x1f79];3;7;5;4;30000;0;15;7;1;2;0;0;-1;1;0;0;1;0;0;0;0
NVIDIA A100 80GB PCIe [0x1f79];3;7;5;5;30000;0;6;2;1;2;0;0;-2;0;0;0;1;0;3;3;0
NVIDIA A100 80GB PCIe [0x1f79];3;7;5;7;30000;0;14;3;1;2;0;-2;-2;0;0;1;1;1;3;0;0
NVIDIA A100 80GB PCIe [0x1f79];3;7;5;9;30000;0;10;1;1;4;0;1;0;0;0;1;1;0;0;0;0
NVIDIA A100 80GB PCIe [0x1f79];3;7;5;13;30000;0;5;1;2;1;0;1;-2;1;0;1;1;0;3;0;0
NVIDIA A100 80GB PCIe [0x1f79];3;7;6;6;30000;0;14;1;3;7;0;0;1;0;0;1;1;1;0;0;2
NVIDIA A100 80GB PCIe [0x1f79];3;7;6;7;30000;0;19;2;1;1;0;1;-2;1;0;0;1;1;0;3;0
NVIDIA A100 80GB PCIe [0x1f79];3;7;6;8;30000;0;43;1;2;4;0;1;0;1;0;0;1;1;0;3;0
NVIDIA A100 80GB PCIe [0x1f79];3;7;7;4;30000;0;18;7;1;3;0;-1;-1;1;0;0;1;0;2;3;0
NVIDIA A100 80GB PCIe [0x1f79];3;7;7;5;30000;0;29;1;2;1;0;1;-1;0;0;0;1;1;3;3;0
NVIDIA A100 80GB PCIe [0x1f79];3;7;7;6;30000;0;18;3;1;4;0;-2;0;0;0;1;1;1;0;3;0
NVIDIA A100 80GB PCIe [0x1f79];3;7;7;7;30000;0;18;7;1;2;0;2;0;0;0;0;1;0;1;0;0
NVIDIA A100 80GB PCIe [0x1f79];3;7;7;8;30000;0;11;2;1;1;0;-1;-2;1;0;0;1;1;0;3;0
NVIDIA A100 80GB PCIe [0x1f79];3;7;7;9;30000;0;11;1;2;7;0;1;-2;0;0;0;1;0;3;0;0
NVIDIA A100 80GB PCIe [0x1f79];3;7;7;13;30000;0;9;7;1;1;0;0;2;1;0;1;1;0;0;0;0
NVIDIA A100 80GB PCIe [0x1f79];3;7;8;6;30000;0;10;2;1;2;0;0;1;1;0;0;1;0;0;0;1
NVIDIA A100 80GB PCIe [0x1f79];3;7;8;7;0;0;18;7;1;0;0;1;0;0;0;0;1;1;2;3;0
NVIDIA A100 80GB PCIe [0x1f79];3;7;8;8;30000;0;10;2;1;4;0;1;-1;0;0;0;1;0;2;3;0
NVIDIA A100 80GB PCIe [0x1f79];3;7;9;4;30000;0;16;1;1;2;0;-2;0;0;0;1;1;1;3;3;0
NVIDIA A100 80GB PCIe [0x1f79];3;7;9;5;30000;0;13;3;1;2;0;-1;-2;1;0;0;1;1;0;3;0
NVIDIA A100 80GB PCIe [0x1f79];3;7;9;7;30000;0;9;1;8;1;0;-2;-2;1;0;1;1;1;3;1;0
NVIDIA A100 80GB PCIe [0x1f79];3;7;13;4;30000;0;21;4;1;1;0;1;-2;0;0;0;1;1;0;3;0
NVIDIA A100 80GB PCIe [0x1f79];3;7;13;5;30000;0;9;1;4;3;0;1;1;1;0;1;1;1;3;0;0
NVIDIA A100 80GB PCIe [0x1f79];3;7;13;7;30000;0;16;7;1;1;0;0;0;1;0;1;1;0;0;0;0
NVIDIA A100 80GB PCIe [0x1f79];3;7;13;13;30000;0;9;7;1;1;0;-2;-2;0;0;0;1;0;3;0;0
NVIDIA A100 80GB PCIe [0x1f79];3;8;6;6;30000;0;14;1;2;4;0;-2;-2;0;0;1;1;1;3;3;0
NVIDIA A100 80GB PCIe [0x1f79];3;8;6;7;30000;0;13;2;1;5;0;1;-1;0;0;0;1;0;3;1;0
NVIDIA A100 80GB PCIe [0x1f79];3;8;6;8;30000;0;20;1;2;8;0;1;1;0;0;0;0;0;0;3;2
NVIDIA A100 80GB PCIe [0x1f79];3;8;7;6;30000;0;5;1;7;6;0;-1;-1;0;0;1;1;1;0;1;0
NVIDIA A100 80GB PCIe [0x1f79];3;8;7;7;30000;0;22;2;1;2;0;-2;-1;0;0;0;1;0;0;3;0
NVIDIA A100 80GB PCIe [0x1f79];3;8;7;8;30000;0;16;2;1;3;0;-1;0;1;0;0;1;0;3;3;0
NVIDIA A100 80GB PCIe [0x1f79];3;8;8;6;30000;0;18;8;1;2;0;1;-2;1;0;0;1;0;2;0;0
NVIDIA A100 80GB PCIe [0x1f79];3;8;8;7;30000;0;14;2;1;3;0;-1;-2;0;0;0;1;0;0;3;0
NVIDIA A100 80GB PCIe [0x1f79];3;8;8;8;30000;0;18;8;1;6;0;0;0;0;0;1;1;1;2;3;0
NVIDIA A100 80GB PCIe [0x1f79];3;9;4;4;30000;0;17;1;1;1;0;-2;1;1;0;0;1;1;3;3;0
NVIDIA A100 80GB PCIe [0x1f79];3;9;4;5;30000;0;11;1;3;1;0;-2;1;1;0;0;1;0;3;0;0
NVIDIA A100 80GB PCIe [0x1f79];3;9;4;7;30000;0;10;2;1;3;0;1;1;1;0;0;1;1;3;0;0
NVIDIA A100 80GB PCIe [0x1f79];3;9;4;9;30000;0;10;1;1;7;0;-2;1;1;0;1;1;1;3;0;0
NVIDIA A100 80GB PCIe [0x1f79];3;9;4;13;30000;0;10;1;2;2;0;0;0;0;0;1;0;0;1;0;1
NVIDIA A100 80GB PCIe [0x1f79];3;9;5;4;30000;0;18;1;2;3;0;-2;-1;1;0;1;1;0;0;0;0
NVIDIA A100 80GB PCIe [0x1f79];3;9;5;5;30000;0;19;2;1;1;0;-1;0;1;0;1;1;0;3;3;0
NVIDIA A100 80GB PCIe [0x1f79];3;9;5;7;30000;0;12;1;5;5;0;0;-1;1;0;0;1;0;0;1;1
NVIDIA A100 80GB PCIe [0x1f79];3;9;5;9;30000;0;14;2;1;2;0;1;-2;0;0;0;1;1;0;3;0
NVIDIA A100 80GB PCIe [0x1f79];3;9;7;4;30000;0;16;4;1;1;0;0;1;0;0;0;1;1;0;3;0
NVIDIA A100 80GB PCIe [0x1f79];3;9;7;5;30000;0;18;6;1;3;0;0;-2;0;0;0;1;1;2;3;0
NVIDIA A100 80GB PCIe [0x1f79];3;9;7;7;30000;0;19;1;1;3;0;1;-1;0;0;0;1;0;0;3;1
NVIDIA A100 80GB PCIe [0x1f79];3;9;9;4;30000;0;24;9;1;8;0;-2;0;0;0;1;1;1;2;3;0
NVIDIA A100 80GB PCIe [0x1f79];3;9;9;5;30000;0;17;3;1;7;0;-2;1;0;0;0;1;0;0;3;0
NVIDIA A100 80GB PCIe [0x1f79];3;9;9;9;30000;0;14;9;1;1;0;1;0;0;0;0;1;0;3;3;0
NVIDIA A100 80GB PCIe [0x1f79];3;9;9;16;30000;0;15;3;1;1;0;1;1;0;0;0;1;1;3;0;0
NVIDIA A100 80GB PCIe [0x1f79];3;9;9;22;30000;0;12;1;3;9;0;1;-1;1;0;0;1;0;3;3;0
NVIDIA A100 80GB PCIe [0x1f79];3;9;9;32;0;0;14;1;3;8;0;0;-1;0;0;0;0;1;3;3;1
NVIDIA A100 80GB PCIe [0x1f79];3;9;13;4;30000;0;17;9;1;3;0;-1;0;1;0;0;1;1;1;3;0
NVIDIA A100 80GB PCIe [0x1f79];3;9;16;9;30000;0;11;9;1;1;0;1;-2;1;0;0;1;0;3;3;0
NVIDIA A100 80GB PCIe [0x1f79];3;9;16;16;30000;0;10;9;1;1;0;-1;0;0;0;0;1;0;0;3;0
NVIDIA A100 80GB PCIe [0x1f79];3;9;16;22;30000;0;19;5;1;1;0;1;-2;1;0;0;1;0;2;3;0
NVIDIA A100 80GB PCIe [0x1f79];3;9;22;9;30000;0;10;9;1;1;0;0;-2;1;0;1;1;0;0;0;0
NVIDIA A100 80GB PCIe [0x1f79];3;9;22;16;30000;0;10;9;1;1;0;1;-2;1;0;0;1;1;0;3;0
NVIDIA A100 80GB PCIe [0x1f79];3;9;22;22;30000;0;10;9;1;1;0;-2;0;0;0;0;1;1;3;0;0
NVIDIA A100 80GB PCIe [0x1f79];3;9;22;32;30000;0;15;9;1;1;0;1;0;1;0;1;1;1;0;2;1
NVIDIA A100 80GB PCIe [0x1f79];3;10;4;4;30000;0;14;1;2;5;0;-2;-1;0;0;0;1;0;3;3;0
NVIDIA A100 80GB PCIe [0x1f79];3;10;4;10;30000;0;10;1;2;1;0;0;-2;1;0;0;1;1;0;0;1
NVIDIA A100 80GB PCIe [0x1f79];3;10;10;4;30000;0;24;10;1;5;0;1;1;0;0;0;1;1;2;3;0
NVIDIA A100 80GB PCIe [0x1f79];3;10;10;10;30000;0;9;10;1;1;0;-2;0;0;0;0;1;0;3;3;0
NVIDIA A100 80GB PCIe [0x1f79];3;13;4;4;30000;0;16;1;2;9;0;0;0;0;0;0;1;1;0;3;0
NVIDIA A100 80GB PCIe [0x1f79];3;13;4;5;30000;0;17;2;1;7;0;1;-2;1;0;1;1;1;3;3;0
NVIDIA A100 80GB PCIe [0x1f79];3;13;4;7;30000;0;19;2;1;11;0;1;0;1;0;0;1;1;0;0;1
NVIDIA A100 80GB PCIe [0x1f79];3;13;4;9;30000;0;9;2;1;1;0;1;-1;1;0;1;1;0;0;3;0
NVIDIA A100 80GB PCIe [0x1f79];3;13;5;4;30000;0;14;4;1;2;0;1;-1;0;0;1;1;0;0;1;0
NVIDIA A100 80GB PCIe [0x1f79];3;13;5;5;30000;0;15;13;1;2;0;2;-2;0;0;0;1;1;1;3;0
NVIDIA A100 80GB PCIe [0x1f79];3;13;5;7;30000;0;6;1;1;13;0;-2;-2;0;0;0;1;1;1;1;2
NVIDIA A100 80GB PCIe [0x1f79];3;13;5;13;30000;0;9;1;1;1;0;-2;0;0;0;0;1;0;0;3;0
NVIDIA A100 80GB PCIe [0x1f79];3;13;7;4;30000;0;21;1;1;11;0;1;-2;1;0;1;1;0;0;3;0
NVIDIA A100 80GB PCIe [0x1f79];3;13;7;5;30000;0;18;3;2;5;0;0;1;1;0;1;1;1;3;3;1
NVIDIA A100 80GB PCIe [0x1f79];3;13;7;7;30000;0;16;13;1;1;0;-1;0;1;0;1;1;0;3;0;0
NVIDIA A100 80GB PCIe [0x1f79];3;13;7;13;30000;0;10;1;4;8;0;-2;-2;1;0;1;1;0;3;3;0
NVIDIA A100 80GB PCIe [0x1f79];3;13;9;4;30000;0;18;9;1;1;0;0;0;1;0;0;1;1;2;3;0
NVIDIA A100 80GB PCIe [0x1f79];3;13;13;5;30000;0;19;13;1;1;0;1;-2;1;0;1;1;1;2;0;0
NVIDIA A100 80GB PCIe [0x1f79];3;13;13;7;30000;0;14;13;1;1;0;0;0;1;0;0;1;1;1;0;0
NVIDIA A100 80GB PCIe [0x1f79];3;13;13;13;30000;0;15;13;1;1;0;1;-2;1;0;0;1;0;1;3;0
NVIDIA A100 80GB PCIe [0x1f79];3;15;4;4;30000;0;21;2;1;4;0;1;-2;1;0;0;1;1;3;3;0
NVIDIA A100 80GB PCIe [0x1f79];3;15;15;15;30000;0;15;15;1;1;0;-2;0;1;0;0;1;1;2;3;0
NVIDIA A100 80GB PCIe [0x1f79];3;16;9;9;30000;0;9;16;1;1;0;-2;-2;0;0;0;1;0;3;0;0
NVIDIA A100 80GB PCIe [0x1f79];3;16;9;16;30000;0;14;2;1;1;0;0;-2;1;0;0;1;1;2;0;0
NVIDIA A100 80GB PCIe [0x1f79];3;16;9;22;30000;0;20;6;1;9;0;0;-2;1;0;0;1;1;1;3;0
NVIDIA A100 80GB PCIe [0x1f79];3;16;16;9;30000;0;15;16;1;1;0;1;0;1;0;0;1;0;1;3;0
NVIDIA A100 80GB PCIe [0x1f79];3;16;16;16;30000;0;12;16;1;1;0;-1;2;1;0;0;1;1;1;0;0
NVIDIA A100 80GB PCIe [0x1f79];3;16;16;22;30000;0;14;16;1;1;0;-2;-2;1;0;0;1;1;2;3;0
NVIDIA A100 80GB PCIe [0x1f79];3;16;22;9;30000;0;13;16;1;1;0;1;0;1;0;1;1;1;2;3;0
NVIDIA A100 80GB PCIe [0x1f79];3;16;22;16;30000;0;10;16;1;1;0;-2;-2;1;0;1;1;1;1;0;0
NVIDIA A100 80GB PCIe [0x1f79];3;16;22;22;0;0;24;16;1;0;0;1;-2;1;0;0;1;1;1;3;0
NVIDIA A100 80GB PCIe [0x1f79];3;20;20;20;30000;0;10;20;1;1;0;-1;0;1;0;0;1;1;2;3;0
NVIDIA A100 80GB PCIe [0x1f79];3;22;9;9;30000;0;6;2;5;4;0;-1;1;0;0;0;1;0;3;3;2
NVIDIA A100 80GB PCIe [0x1f79];3;22;9;16;0;0;14;22;1;0;0;1;-2;0;0;0;1;0;2;3;0
NVIDIA A100 80GB PCIe [0x1f79];3;22;9;22;0;0;24;22;1;0;0;0;-2;0;0;0;1;1;1;3;0
NVIDIA A100 80GB PCIe [0x1f79];3;22;9;32;0;0;10;8;1;4;0;0;-1;0;0;0;1;0;2;3;0
NVIDIA A100 80GB PCIe [0x1f79];3;22;16;9;30000;0;10;22;1;1;0;0;1;1;0;0;1;0;1;1;0
NVIDIA A100 80GB PCIe [0x1f79];3;22;16;16;0;0;14;22;1;0;0;1;-2;1;0;0;1;0;2;3;0
NVIDIA A100 80GB PCIe [0x1f79];3;22;16;22;0;0;18;22;1;0;0;1;-2;1;0;0;1;0;1;3;0
NVIDIA A100 80GB PCIe [0x1f79];3;22;22;9;30000;0;18;22;1;1;0;-2;-2;1;0;1;1;0;2;3;0
NVIDIA A100 80GB PCIe [0x1f79];3;22;22;16;30000;0;15;22;1;1;0;-1;0;1;0;0;1;1;2;0;0
NVIDIA A100 80GB PCIe [0x1f79];3;22;22;22;30000;0;24;22;1;1;0;-2;-2;1;0;0;1;0;2;3;0
NVIDIA A100 80GB PCIe [0x1f79];3;22;22;32;0;0;15;22;14;17;0;0;-2;0;0;0;1;0;2;3;0
NVIDIA A100 80GB PCIe [0x1f79];3;23;23;23;30000;0;24;23;1;13;0;-1;-2;1;0;1;1;1;1;0;0
NVIDIA A100 80GB PCIe [0x1f79];3;24;24;24;0;0;18;24;1;0;0;1;-2;1;0;0;1;1;2;0;0
NVIDIA A100 80GB PCIe [0x1f79];3;25;4;4;0;0;15;25;1;0;0;0;0;0;0;0;1;0;2;0;0
NVIDIA A100 80GB PCIe [0x1f79];3;25;4;5;0;0;18;25;1;0;0;2;-2;0;0;0;1;1;2;3;0
NVIDIA A100 80GB PCIe [0x1f79];3;25;5;4;0;0;18;25;1;0;0;2;0;0;0;0;1;1;2;3;0
NVIDIA A100 80GB PCIe [0x1f79];3;25;25;25;0;0;24;25;1;0;0;1;-2;1;0;0;1;0;1;3;0
NVIDIA A100 80GB PCIe [0x1f79];3;26;4;4;0;0;18;26;1;0;0;2;-2;0;0;0;1;1;1;3;0
NVIDIA A100 80GB PCIe [0x1f79];3;28;4;4;0;0;18;28;1;0;0;0;0;0;0;0;1;1;1;3;0
NVIDIA A100 80GB PCIe [0x1f79];3;28;28;28;0;0;18;28;1;0;0;1;-2;1;0;0;1;1;1;3;0
NVIDIA A100 80GB PCIe [0x1f79];3;30;30;30;0;0;18;30;1;0;0;0;0;0;0;0;1;0;1;3;0
NVIDIA A100 80GB PCIe [0x1f79];3;32;32;32;0;0;36;32;4;32;0;0;0;0;0;0;1;0;2;3;0
